Start (HH:MM:SS),End (HH:MM:SS),Segment
0:29:11,0:29:20,"I u tebi se rađa jedna, kako da kažem, želiš ga odbaciti jednostavno ili želiš ga prokleti ili želiš mu zlo."
0:29:22,0:29:29,"Jednostavno u srcu reći, Bože, ja prihvaćam ovaj križ i ja ga posvećujem za uspjeh misija."
0:29:29,0:29:36,"Isus nas nije spasio lijepim riječima, Isus nas je spasio po svome križu, po svojoj patnji i muci."
0:29:37,0:29:49,"On nas nije otkupio time što nas je navijestio, što je navijestio radostnom vijestom spasenja, nego je na križu umro i time nas je otkupio, svojom prolivenom krvlju."
0:29:50,0:30:04,"Zato ja vjerujem da bez križa u konkretnom našem životu, ako ga nosimo s ljubavlju, zbilja, ako ja svoju patnju prikazujem, najradije bih ja svojim križem lupao po glavi osobe koja mi je stvorila taj križ."
0:30:05,0:30:09,"Ali što misli kaže, ljubite jedni druge, ljubite svoje neprijatelje."
0:30:09,0:30:11,Iz ljubavi preuzeti taj križ.
0:30:11,0:30:16,"Možda u obitelji ne možemo promijeniti, to je ono što se stalno susrećemo u ispovjedavnici."
0:30:16,0:30:18,Evo i sinom sam ispovjedao.
0:30:19,0:30:28,"I dođu i kažu: Ja mrzim moga oca zato što je otac pijanac, ima ljubavnicu, zlostavlja mamu, nas maltretira."
0:30:29,0:30:34,"Ja kažem: Dobro, to je ono što ti vidiš, posljedica."
0:30:37,0:30:39,Svaka posljedica ima neki uzrok.
0:30:40,0:30:46,A da li si se ti ikad pitao što je uzrok u tome ocu da se on tako ponaša?
0:30:48,0:30:54,Što je ta rana u srcu tvoga oca da on ima tako ponašanje?
0:30:54,0:30:55,danas.
0:30:56,0:31:07,"I to je, kako da kažem, jedan križ ne osudi drugoga, nego drugoga, probati razumjeti što se dogodilo toj osobi da se on tako ponaša kako se ponaša."
0:31:07,0:31:14,"I onda mi ne molimo da gospodin izliči posljedicu, nego mi molimo da gospodin izliči uzrok takvoga ponašanja."
0:31:14,0:31:27,"Gdje je, što je, kako je, koji puta možemo otkriti, koji puta ne možemo, ali ono što molimo, krvi kristova, na topi one rane duha, duše i tijela koje su uzrok u osobi takvoga ponašanja."
0:31:27,0:31:31,"Evo to je taj., kako da kažem, nositelj križa drugog."
0:31:32,0:31:36,"Lako je osuditi, lako je o drugome govoriti loše, ali hajmo razumjeti jedne druge."
0:31:37,0:31:41,"Ajmo ponijeti taj križ, kako da kažem, za spasenje drugih ljudi."
0:31:41,0:31:51,"Evo, prikazati svoje patnje, za obraćanje supruge, djece, roditelja, prijatelja, poslodavca, susjeda, a onda i za uspjeh misija."
0:31:52,0:32:06,"Taj križ onda da postane sredstvo kojim ćemo mi, ja sam govorio ovdje, dosta sam propovijedao o tome, ja sam rekao naš križ koji ima imamo bit će ključ za otvaranje raja."
0:32:08,0:32:11,"Jer ako ja svoj križ odbacim, čime ću otključati vrata raja?"
0:32:12,0:32:13,Neću moći otključati vrata raja.
0:32:13,0:32:14,Neće imati učitelj.
0:32:16,0:32:19,"Evo, prikazat taj križ za uspjeh misija."
0:32:19,0:32:23,"I treća stvar, završavamo vrijeme korizme."
0:32:24,0:32:38,"Ako ja danas nisam ništa jela jer sam postio, a taj novac sam uštedio pa ću sutra kupiti neku krpicu ili tako nešto, onda šta si postio bez veze?"
0:32:41,0:32:49,"Ako moje odricanje nije druga osoba koja je u potrebi to vidjela, onda moj post nema nikakvoga smisla."
0:32:50,0:32:58,"Kako ima smisla to što si danas bio gladan, čak griza cijeli dan, ako taj plod dvoga postanja neće drugi ugledati?"
0:32:59,0:33:02,"Mnogi su se odrekli pušenja, slatkiša itd."
0:33:03,0:33:13,"Izračunajte koliko bi potrošili u korizmi i napravite paket pomoći, odnesite nekome siromahu kojega imate u svome susjedstvu ili nekome ko ne."
0:33:14,0:33:22,"može riješiti svoje račune, platite im račun od struje, od vode ili od nečega ili pošaljite za misije."
0:33:22,0:33:24,To je taj dar odricanja.
0:33:24,0:33:41,"Zapravo ja se odričem, ja se sjećam, mi smo sjemeni što da smo bili onako dječurlija, pa bi onda, ne znam, mi preko dana ne bi ništa jeli, a ono što smo trebali pojesti pod navodnicima, taj dan čekali smo ponuć da pojedemo."
0:33:42,0:33:48,"To nema nikakvog smisla, to nema nikakvog smisla, jednostavno taj dar koji."
0:33:48,0:33:58,"Dar koji će ti dati drugome, dar tvoga odricanja, dar tvoga korizmenoga posta, drugi mora ugledati na konkretan način."
0:33:59,0:34:04,Tu zapravo potičem sve druge da se znaju odricati u svome životu.
0:34:05,0:34:18,"A čovjek kad se odrekne od onoga što nam je često puta nepotrebno, a mislimo da nam je potrebno, njegovo srce će se ispuniti mirom i jednom srećom, jednim zadovoljstvom."
0:34:18,0:34:22,"Kako da kažem, nadišao sam sam sebe i dao sam drugome."
0:34:23,0:34:24,To je nešto prekrasno.
0:34:25,0:34:35,"Mi misionari, ne znam koliko god možda teško to zamislite, ali ja sam se odreko svoga života u Hrvatskoj, odreko sam se svoga života u Evropi."
0:34:35,0:34:46,"I svi misionari, kako da kažem, mi ne dajemo nešto, nego smo dali sve, dali smo sebe upravo u naviještanje toga kraljestva."
0:34:46,0:34:57,"Božjega, da se meni sviđa ovdje, kako da kažem, čovjek zavoli mjesto gdje djeluje, a da je lako nije lako."
0:34:57,0:34:59,Ja mislim da bi svi naši misionari.
0:34:59,0:35:02,"rekli, bilo bi lijepše da smo u Hrvatskoj."
0:35:03,0:35:13,Ali ovdje vidimo smisao upravo zato što smo svoj život uložili kao jedan dar za izgradnju Božjega kraljevstva.
0:35:14,0:35:14,Čovjek je sretan.
0:35:15,0:35:23,"Makar u onom ljudskom smislu izgubit ću mnoge stvari, ali za Krista ću dobiti mnogo braću i sestre."
0:35:25,0:35:29,"Hvala ti na ovom, dao si i nama, nije tvoj trud."
0:35:29,0:35:33,"Uzaludan dobili smo i mi i svi koji će nas gledati i slušati, mi ćemo ovo."
0:35:34,0:35:38,"emitirati na veliki četvrtak, znači ljudi će se moći duhovno pripremiti za uskrs."
0:35:38,0:36:09,"Evo tebi hvala, srca i na vremenu, znam da si stalno u poslu, stalno si ugužio, da si našao vremena, evo sjesti ovako smo zumom iz daleke Bolivije ili tebi ne iz daleke Hrvatske i htio biti u ime svih nas, evo koji smo te gledali, slušali, čestitati uskrs i evo ja obećajem da ću moliti za misije i misionara, vjerujem da će i mnogi naši gledatelji nakon ovoga što pogledaju Flavice, palati lijepa i evo, sretan uskrs tebi i svim ovim tvojim filialama gdje god dospio i došao do do njih."
0:36:10,0:36:27,"Želim i ja vama svima sretan uskrs, ali ima jedna stvar, to od početka korisme cijelo vrijeme govorim ljudima, da mi slavimo Isusovu uskrsnuće, a da ja nisam uskrsnuće, to nema nikakvog smisla."
0:36:28,0:36:31,Kakvog smisla ima ako ja slavim Isusovu uskrsnuće?
0:36:32,0:36:43,"Ja trebam uskrsnuć s njime, ali ono što kaže Sveti Paolo, su uskrsli smo s njime i zapravo tu se događa da na moj veliki petak."
0:36:44,0:36:48,"Ja umrem starom čovjeku, a da se rodim kao novo biće."
0:36:48,0:36:53,I to je ono što onda sveti Ivan kaže: Mi znamo da smo prešli iz smrti u život jer ljubimo braću.
0:36:54,0:37:02,"Znači, dogodila se jedna smrt staroga čovjeka, starog mene, a s Isusom samo onda uskrsnuo."
0:37:02,0:37:07,"I zapravo onda u uskrsnuću uču Isusovu, ja slavim jednu promjenu moga života."
0:37:08,0:37:09,Evo to ja želim svima.
0:37:09,0:37:17,"Ne samo da slave Isusa uskrsnuće, jer ako ćemo mi slaviti Isusa uskrsnuće, a mi se nećemo mijenjati, neće doći do kraljestva Božjega."
0:37:17,0:37:23,"Ali ako ja, Isus.om umrem i su uskrsnem, e tu će biti prava proslava."
0:37:23,0:37:24,Onda se vidimo u dalji.
0:37:25,0:37:27,"Sjajno, hvala ti, vidimo se, nadam se."
0:37:28,0:37:28,Veliki ti pozdrav.
0:37:29,0:37:29,Hvala ti pozdrav.
