Start (HH:MM:SS),End (HH:MM:SS),Segment
0:00:22,0:00:23,"Prajivice, hvala."
0:00:23,0:00:26,Nisam i Marija dobrodošla u popkast.
0:00:27,0:00:36,"Htio bih te pitati za početak, javljaš se iz Bolivije, kakvo je vrijeme tamo, kakav je dan, kakav je ovaj veliki?"
0:00:36,0:00:42,"Veliki ponedjeljak, evo čujemo se sada na veliki ponedjeljak na početku velikoga tjedna, nakon cvjetnice."
0:00:42,0:00:48,"Baš sam, evo, sretan da si nam gost upravo u velikom tjednu i u oči Uskrsa."
0:00:51,0:00:55,Hvala lijepa na pozivu i na ovoj časti koju ste mi iskazali.
0:00:55,0:01:07,"I što se sjetite Bolivije, makar smo na drugom kontinentu, evo, rado pratim i tvoj rad, Darko, i ovim putem pozdravljam sve koji će gledati ovaj podcast."
0:01:09,0:01:10,Ušli smo u Sveti tjedan.
0:01:10,0:01:24,"I kod nas je vrijeme trenutno, meni super, zato što je nekih otprilike 25 stupnjeva, ali ovdje za ljude je već hladno i mi smo sada u jeseni praktički."
0:01:25,0:01:35,"I kad vidim u crkvi da ljudi obuku jakne zimske, a ja još uvijek se znojim i znojim, to je ta kulturološka i toplinska razlika."
0:01:36,0:01:39,"Ja malo odahne, a oni odmah oblače zimske jakne."
0:01:40,0:01:46,"Ali Bogu hvala, dobro je, imamo jako puno kiše, ali nije bilo poplava."
0:01:46,0:01:48,"kod nas, za sada, dobog hvale, da ure."
0:01:49,0:01:57,"Da, ja tebe zamišljam, uvijek vidio sam neke fotografije na jednoj tvojoj prezentaciji s tim kišama, na onom terenu, kako se probijaš upravo u nemogućim uvjetima."
0:01:57,0:02:00,"To mi je stvarno fascinantno, kamo te sve putovi nose."
0:02:00,0:02:09,"Mislim, kako izgleda taj vaš misionarski rad upravo u takvim jako teškim uvjetima, zapravo cesta nema, ceste nestanu, potope se u blatu kad padne kiša."
0:02:10,0:02:21,"Jasno, evo, baš sam sad poslala auto da ga malo poprave, kako da kažem, jer zbog takvih cesta rasklima se."
0:02:21,0:02:29,sve moguće i isto tako ne funkcioniraju senzori ili vrata se ne mogu otvoriti ili tako.
0:02:29,0:02:36,"A evo, baš sam jučer išao na filiale i u subotu smo bili po filialama."
0:02:39,0:02:48,"Naš najveći zapravo problem je to kad dogovorimo jednu stvar, kako da kažem, dogovorimo sve te mise po filialama i onda dođe kiša."
0:02:49,0:02:56,"I ovdje praktički svi planovi padnu u vodu, doslovno i baš u subotu."
0:02:56,0:02:59,krenuli smo na filijale i prolom oblaka.
0:02:59,0:03:11,"I to je dva sata trajalo prolom oblaka, ali ja sam rekao, bratrema, idemo, idemo da prođemo taj najgori dio koji treba proći još dok nije se rasklasilo sve."
0:03:12,0:03:16,"A onda kad prođeš, onda već kad dođemo do prvih filijala, onda smo već tamo."
0:03:16,0:03:21,"I Bogu hvala, uspjeli smo, Bog nam je pomogao u tom putu."
0:03:22,0:03:30,"I ono što mi je drago doći do svih ljudi, zapravo da shvate tu tajnu Bože ljubavi u taj veliki tjedan, ja to zamišljam."
0:03:30,0:03:39,"Mislim da Bog daje nama ruku, ruku spasa, a mi želimo prihvatiti tu ruku, kako da kažem, želimo se uhvatiti za tu Božju ruku."
0:03:40,0:04:16,"I to mi je najveća želja upravo svim ljudima: evo, Bog ti daje ruku, Bog ti daje ruku i ovim našim slušateljima koji sad slušaju, i to stalno podvlači: Isus nije umro na križu radi dobrih ljudi, Isus je umro na križu radi grešnika, iako ja mislim da moj sam daleko od Boga, evo to je ta jedna javnost kalaža koja nam dolazi uvijek onako: ja sam grešan, Bog me ne voli i onda ja se odmaknem od Boga."
0:04:17,0:04:23,A Bog upravo u velikom tjednu ide i daje ruku svima nama i mi želimo uhvatiti tu Božju ruku i s njim poda.
0:04:23,0:04:37,"Kad govoriš o tim filialama, koje su to udaljenosti, odnosno kako to izgleda kad ti dođeš, odnosno kad vi dođete na tako jednu udaljenu filialu i evo ovo što ti kažete, donesete im Božju ruku, vi ste im zapravo ta Božja ruka koju im donosite u ovom trenutku?"
0:04:39,0:04:39,Jasno.
0:04:40,0:04:43,"Kad idete po filijalama, već znate koje ćete ljude sresti."
0:04:43,0:04:51,Praktički već znamo koje ćemo ljude sresti i uvijek nove ljude upoznamo zato što su ovdje vrlo žive migracije stanovništva.
0:04:51,0:04:58,"Oni se, kako da kažem, skupe, oni svojih par stvarčica što imaju i premeste se iz ovog mjesta u drugo mjesto."
0:04:58,0:05:09,"Ali ono što uvijek, malo onako, kako da kažem, moram to priznati, koji puta me savjest malo pere, ili tako da kažem, uvijek nosimo pomoć."
0:05:10,0:05:23,"Već znaš koji je bolesnik tamo, koje lijekove koristi, ko nema za jesti, tko nema robe, već znamo, ne znam, nije to pakiranje torbe za misionara, hostije, vino i idemo dalje."
0:05:23,0:05:29,"Ne, ti utkrat saž auto, sve ono što je potrebno tim ljudima kojima želiš doći."
0:05:30,0:05:48,"I ono što uvijek kažem, ne možemo naviještati radosnu vijest ljudima koji još uvijek imaju prazan trbuh i nemaju što jesti i nemaju tablete i nemaju ono što im je najosnovnije za život."
0:05:49,0:05:58,Naviještaj riječ je po Bože ide prvo kroz jedno konkretno djelo jer nisu se sva slalo svoje učenike i dalo im je četiri konkretne zadaće.
0:05:58,0:06:10,"Ni u jednom trenutku im nije ono rekao kad ih je prvi puta slalo 72 učenika, nije rekao pričajte nego radite mrtve u skrisu i te bolesne liječite, gubave čistite, zloduhe izgonite."
0:06:10,0:06:12,Četiri zadaće osnovne.
0:06:12,0:06:19,I tu ja mislim da je vrlo živ naš misijski rad upravo zato što radimo na konkretan način.
0:06:19,0:06:37,"Koji puta kažem Bo, a s druge strane možda ćemo zapostaviti taj propovjednički dio, ali opet ja kažem, Bože, evo ja sa svoje strane dajem, a ti nadoknadi ono što ja propustim."
0:06:37,0:06:45,"Jednostavno znamo da ja nikad ne mogu nešto perfekcionirati, ali da Bog može nadodat, to je svakako."
0:06:45,0:06:51,"I ono što uvijek u glavi imam, Isus kaže bez mene ne možete učiniti ništa."
0:06:52,0:06:52,Ništa.
0:06:53,0:06:57,"I onda upravo ja kažem, evo Isus, ja sam sa svoje strane napravio, a sad ti."
0:06:58,0:07:03,"Ja uopće ne mislim da ja mogu sve, nego evo sad tim napravi."
0:07:03,0:07:12,"I ovo je ono što je, mi imamo 23 filiale, najdalja filiala bi bila negdje otprilike 36 ili 38 km."
0:07:13,0:07:13,Zašto?
0:07:13,0:07:15,Zato što se mijenjaju putevi.
0:07:15,0:07:20,"Ne znamo, ovamo se rasklasi i onda idemo tražiti drugi put za bilazne itd."
0:07:21,0:07:25,"Ali ono što je najbitnije, naći put do ljudskog srca."
0:07:26,0:07:34,"Imamo mi ovdje jako puno naših stanovnika i ono što pokušavamo ići, tražiti ljude."
0:07:34,0:07:45,"Evo, to je ono što je, ja mislim mislim najbitnije u tom misijskom poslanju, ja mislim da Crkva u Hrvata još uvijek možda nije došla u tu situaciju da idemo tražiti ljude."
0:07:45,0:07:55,"Kako je rekao papinski propovjednik Raniero Kantalamesa koji je sad već u mirovini, on je rekao dvije su tipične slike u Crkvi, Isus dobri pastir i Isus ribar."
0:07:56,0:08:03,"I on nas želi učiniti ribarima ljudi, onda se zapitamo, a koga mi ribarimo, gdje mi bacamo te mreže?"
0:08:04,0:08:10,"I ono što je rekao jako zgodno taj Raniero Kantalamesa, kaže mi smo pastir koji su ostali čuvati."
0:08:10,0:08:14,"još one ovce koje su s nama, stado koje je s nama."
0:08:15,0:08:16,A tko traži izgubljene?
0:08:16,0:08:17,Jel idemo tražiti izgubljene?
0:08:18,0:08:25,"Evo ja iskreno vam kažem, ja možda ne bih imao ni jednog zapisanog za prvu pričest i za krizmu da ne obilazimo škole."
0:08:26,0:08:42,"Mi smo sve škole obišli ovdje i idemo ih direktno tražiti, koristimo bilo koju mogućnost koja nam se da, otvori, idemo tražiti ljude, pozivati ih na sakramente, pozivati na Euharistiju, pozivati na molitve."
0:08:43,0:09:05,"Koristimo, upravo to je taj misijski., kako to papa Franjo je stalno govorio, crkva u izlasku ili kako se ta fraza kaže u hrvatskom jeziku, moramo biti vani, moramo ići prema drugima, tražiti druge i navještati im radosnu vijest."
0:09:05,0:09:13,"Ako nema toga, ja to dosta govorim i našim lajcima, jer ovdje bez lajka je nemoguće, nemoguće."
0:09:14,0:09:19,"Bez aktivnih lajka koji su svjesni svoga kršćanskoga poslanja, ovdje su lajci."
0:09:21,0:09:25,Tražimo da rastu u vjeri i u smislu da idu navještati.
0:09:25,0:09:32,"Ne samo da ti kažemo, evo ja sam vjernik, idem u crkvu, ispovedam prve petke i molim krunicu svaki dan."
0:09:32,0:09:35,Pa koga ti evangeliziraš?
0:09:35,0:09:37,Koga si ti doveo u Isusu?
0:09:37,0:09:46,"Ako si ti doživi u svome životu jednu promjenu da ti je Bog očitovao svoju ljubav, da li ti ideš drugima govoriti o toj ljubav?"
0:09:46,0:09:50,"Ako nema toga svjedočanstva, onda je sve uzaludan trud sviraći."
0:09:50,0:09:59,"Ja to mislim bar tako, jer što se događalo ljudima koji su doživjeli jedno snažno iskustvo Isusa."
0:09:59,0:10:06,"Isus im je branio da govore o njemu, a oni su slušali i sa ne, išli su o drugima govoriti i gledali što mi je napravio."
0:10:08,0:10:17,"To je, ja mislim, vrlo bitno ta crkva koja će biti svjesna svoga poslanja, traženja drugih, ići drugima u susret i navješta, donositi im nadu."
0:10:18,0:10:28,"Evo, u jubilarnoj smo godini, tema je nada i upravo to donositi ovome svijetu nadu da nije sve izgubljeno, da Bog ipak ima zadnju riječ u svemu."
0:10:28,0:10:30,I to je meni najjača stvar.
0:10:31,0:10:36,"Ja mogu pogriješiti, možemo svi pogriješiti, ali ako se uzdamo u Boga, Bog ima zadnju riječ."
0:10:36,0:10:38,I to je ono što je najbitnije.
0:10:38,0:10:49,"Evo ja koji puta kažem ovako, mi imamo 60 vjeručitelja otprilike, nijedan od vjeručitelja nema za to plaću, nitko od vjeručitelja nema plaću."
0:10:49,0:10:58,"Oni imaju svoj posao koji rade, a svoje svjedočanstvo vjere drugima daju na jedan besplatan način."
0:10:59,0:11:13,"U smislu oni će imati svoj posao, bit će automehaničari, profesori u školi, stačice, radit će na polju šećerne trske."
0:11:13,0:11:22,"Meni je bila fantastična jedna naša vjeručiteljica koja radi kao muško na poljima šećerne trske, jedan jako težak posao."
0:11:23,0:11:31,"A na kraju, što se dogodi, ona dođe za subotu i nedjelju da bude vjeručiteljica i pripremi za mislo slavlje."
0:11:31,0:11:40,"I onda u njezinom selu su je htjeli maknuti, nešto je ovako, nije baš bila po mjeri poglavara, poglavica se."
0:11:41,0:11:43,I onda su je htjeli maknuti.
0:11:43,0:11:53,"Ona, koja možda nema ni završeno osnovnu školu, ona je rekla: Pa vi ćete me maknuti, pa niste me vi postavili na ovo mjesto, Bog me je izabrao."
0:11:53,0:12:01,"I upravo ona je bila svjesna: Pa nima župnik izabrao da ja budem vjeručiteljica, nego me je Bog poslao da ja budem vjeručiteljica u tome mjestu."
0:12:04,0:12:16,"Kad imate konkretne ljude koji su doživjeli jedno konkretno Božje djelovanje u svome životu, to je jedna najveća formula, zapravo evangelizacijska, da on da drugima ide svjedočiti ono što je bolje Bog napravio u njegovom životu."
0:12:16,0:12:33,"Ja mislim da bi mi u crkvi Hrvata trebali pomalo, pomalo već dolazi do toga da imamo vjernike koji će, baš zato što su doživjeli nešto veliko u svome životu, žele drugima svjedočiti."
0:12:33,0:12:41,"Ne samo vidim koliko mogu po medijima pratiti, pa onda i pod navodnicima katolički evangelizatori."
0:12:42,0:12:47,"Ne trebamo imati elitu katoličkih evangelizatora, nego svi katolici trebaju biti evangelizatori."
0:12:48,0:12:51,"Da, jasno bi o čemu govoriš i hvala ti na tome."
0:12:51,0:12:55,"U biti bi trebali možda malo doći na školovanje u Boliviji, da vidimo."
0:12:57,0:13:00,"Recite, ti si sad već pet, šest godina koliko si u Boliviji."
0:13:00,0:13:07,"Vidiš li plodove svoga rada, djelovanja, ne samo svoga, nego općenito situacija kako si zatekao?"
0:13:07,0:13:08,Kakva je sada?
0:13:08,0:13:09,Mjenjaju li se okolnosti?
0:13:09,0:13:10,Mjenjaš li se ti?
0:13:11,0:13:14,"Evo sad ja dok tebe slušam, nekako se i ja mijenjam iznutra."
0:13:14,0:13:19,Evo moram ti priznati da je ovo za mene zapravo jedna mala preduškrsna duhovna obnova.
0:13:19,0:13:20,Hvala ti na ovome.
0:13:20,0:13:21,Kako je s tobom?
0:13:22,0:13:24,Evo ja sam devet godina ovdje u Boliviji.
0:13:24,0:13:25,Devet godina.
0:13:27,0:13:29,Tako da vrijeme ide.
0:13:31,0:13:37,"Ono što govorimo, kad govorimo o plodovima, ja uopće ne mislim o plodovima."
0:13:38,0:13:41,"Jasno, vidi se, vidi se velika promjena."
0:13:42,0:13:50,"Ja se sjećam prvih godina kad sam došao ovdje, na Veliki petak, ovdje dođu, kako da kažem, živo i mrtvo dođe."
0:13:50,0:13:58,"Svi dođu na Veliki petak da budu u procesiji za Božjim grobom, koji se nosi onako kao jedna skrinjica, kutija."
0:14:00,0:14:01,U toj procesi svi sudjeluju.
0:14:02,0:14:12,"To bude otprilike u našem ovdje mjestu, u centru naše emisije, bude sigurno nekih između 5 do 8 tisuća ljudi, zavisi otprilike u toj procesiji."
0:14:13,0:14:20,To je nešto što je najveći moviment gdje se ljudi kreću.
0:14:22,0:14:27,A onda bi došli na Veliku subotu ili na uskrs gdje ne bi imali uopće ljudi u crkvi.
0:14:29,0:14:46,"Jer oni imaju taj kult smrti, kako da kažem, i onda oni su više obilježeni tom patnjom., oni se lakše identificiraju sa Isusom koji je umro, koji je trpio, koji je bio bičevan, zato što i oni u svojoj povijesti i u svome životu prolaze istu patnju kao što je Isus prolazio."
0:14:46,0:14:51,I onda se lakše identificiraju sa Kristom patnikom nego li Kristom uskrsnim.
0:14:51,0:15:03,"A onda upravo opet se vraćamo na tu nadu, ono što mi želimo reći, to da je Isus umro i da je umro i ništa više, to ne bi imalo nikakvoga smisla za našu vjeru, ali Isus je uskrsnuo."
0:15:04,0:15:21,"I tu, tu kad neko živi svoj život, kako da kažemo, onako kako nas Isus poziva, kad netko predaje svoj život i daje svoj život za drugoga iz ljubavi, onda Bog čini velika djela i daje uskrsnuće, daje cijeli smisao našoj patnji."
0:15:22,0:15:25,U smislu možemo patnju živjeti na dva različita načina.
0:15:25,0:15:33,"Prihvatiti križ i reći s ljubavlju ga nosim, a možemo i nositi križ i proklinjati sve koji su nam nanijeli taj križ."
0:15:33,0:15:44,"To su dvije različite, velike razlike između ta dva načina nošenja križa, ali upravo potičemo ih da nose križ s ljubavlju i da vide."
0:15:44,0:15:54,"Video nadu u uskrsnuću koja neće se dogoditi samo na kraju vremena, nego mi u našim uskrsnućima možemo drugima svjedočiti."
0:15:54,0:16:02,"Sve ono što smo prošli kao svoju patnju, svoj križ, svoj veliki petak, možemo govoriti o iskustvu uskrsnoga jutra."
0:16:03,0:16:12,"Evo i tu, kad vidite onda da u crkvi na uskrs dođe jako puno ljudi sada, jer to je, ja mislim, najveća promjena."
0:16:13,0:16:18,"Sad imamo sve te misije, na primjer, na uskrs najjača misija će biti ujutro u 5 sati."
0:16:20,0:16:30,"Ta misa bude puna, puna crkva ispunjena vjernicima u pet sati, zato što oni dočekuju, kako da kažem, tu Isusovu skrsnuće."
0:16:30,0:16:40,"I to će vam oni, oni će one petarde pucati, njihove domaće ovdje petarde."
0:16:40,0:16:49,"Oni plate da dođe orkestar, ona ili imena glazba, da oni sviraju tu iće se u procesiji sa uskrsnim kristom."
0:16:49,0:17:00,"Evo ja mislim da je to najveća možda promjena u onom vjerničkom smislu da počinjemo bazirati našu vjeru na Isusovom uskrsnuću, a ne samo na Isusovoj patnji."
0:17:00,0:17:11,"A ono u ovim konkretnim stvarima što vidimo, čujte, između prvih posjeta filijalama koje sam prije devet godina radio i sada, ja možda žalim za onim prvim vremenima."
0:17:12,0:17:12,Zašto?
0:17:13,0:17:18,"Zato što sam ja imao kao fratar više kontakta sa ljudima, patnicima."
0:17:18,0:17:33,"A sad kako se to sve diglo na jednu i jako veliku razinu, sad mi je teže i sad me više pritišću u uredu i drugim stvarima negoli sa ljudima., konkretni rad i s ljudima."
0:17:34,0:17:41,"Ali evo, u našem tom socijalnom radu imamo nekih 4-5 točaka koje su jako ovako snažne."
0:17:42,0:17:47,Imamo otprilike 250 učenika kojima pomažemo u dodatnoj nastavi.
0:17:47,0:17:56,"To su siromašna djeca o kojima nitko ne vodi brigu i žive u svojim kućama, žive u svojim obiteljima, ali su jednostavno zanemareni, zapušteni."
0:17:57,0:18:04,"To su djeca koje u trećem razredu osnovne škole ne znaju napisati svoje ime i prezime, ne znaju broj dva do znamenitasta broja."
0:18:05,0:18:18,i mi toj djeci dajemo dodatno obrazovanje i jedan tanjur hrane u smislu da im to bude motivacija da dođu i zapravo često puta ta djeca i taj tanjur hrane imaju kao jedini puni obrok koji će doživjeti taj dan.
0:18:21,0:18:27,"Drugi način pomoći je obilazci siromaha, bolesnika gdje nosimo lijekove."
0:18:27,0:18:45,"Jer to je nešto strašno kad vidite da čovjek umire i da on nema novaca da se kupi lijeke, to je nešto što je jako teško i tu Bogu hvala našim dobročiniteljima koji nam omogućuju da mi pomažemo njihovo ime tim ljudima."
0:18:45,0:18:46,To je nešto strašno.
0:18:46,0:18:56,"Kad vidite, umrla je sada prije tjedan dana jedna mlada majka, 26 godina, dvoje djece, karcinom maternice."
0:18:57,0:19:01,I vratili su je iz bolnice da umre kući.
0:19:01,0:19:11,"Jednostavno, ali ona i u tim trenucima strašnih bolova kroz koje je prolazila, niti hrane nije imala, niti lijekova."
0:19:15,0:19:25,"pomažeš tim ljudima i pokušavaš im, kako da kažem, ublažiti taj trenutak patnje."
0:19:25,0:19:31,"I ono što je majka Terezija rekla, bar će ti ljudi umrijeti kao ljudi."
0:19:32,0:19:39,"Bar će ti ljudi, ako i trebaju umrijeti, bar će umrijeti kao ljudi i imat će jedan izraz naše ljudske ljubavi."
0:19:40,0:19:49,"Drugi vidik pomoći je, mi imamo lječnu farmaciju, ljekarnu ovdje kod nas, krenuli smo s kupovanjem lijekova, ovako upišili."
0:19:49,0:20:25,"upisali one uzorke što liječnici dobiju, to smo skupljali da nam daju, ali na kraju krajeva kad smo već zakotarljali taj posao socijalne pomoći ljudima, onda smo vidjeli da moramo imati našu vlastitu ljekarnu gdje kupujemo lijekove od laboratorija i damo ljudima koji zbilja nemaju ni za jesti, te ljudima pomažemo s lijekovima, dalje pomoć u hrani starijima koji su zanemareni, zapušteni ili naprimjer imate bolesnike koji ne mogu raditi, a imaju i sedammero djece."
0:20:26,0:20:30,"I, na primjer, evo tu jednostavno pazimo o svim tim našim siromasima."
0:20:31,0:20:38,"I evo sad jedan veliki projekat na kojem radimo trenutno, to je projekat da napravimo učenički dom."
0:20:38,0:20:46,"To je jedan projekat o kojem sam ja sanjao i dugo sam vremena o tome razmišljao, govorio, promišljao, molio Duha Svetog."
0:20:47,0:20:48,Ja sam govorio o Duhu Svetom.
0:20:49,0:20:54,"Ako to nije tvoja volja, ti zaustavi, stavi sve moguće prepreke na taj projekat."
0:20:54,0:20:56,"Ako je tvoja volja, neka to uspije."
0:20:56,0:20:59,"Evo na kraju, Bog hvala, došli smo praktički do."
0:21:00,0:21:05,kamena temeljača i ovi dana krećemo sa izgradnjom.
0:21:07,0:21:19,"To sam te htio pitati, jer baš oko toga, kako to izgleda, kako ti je pomoglo da se stvari mogu unaprijediti, pogotovo na to da i dalje."
0:21:21,0:21:41,"Ideja je došla odatle da djeca koja u svom selu, svom mjestu nemaju drugi dio osnovne škole, jer ovdje je sustav šest plus šest godina obrazovanja."
0:21:41,0:21:57,"Pa u toj sekundari koji nemaju u svom selu sekundariju, oni moraju pješati četiri, pet, šest km, deset ako imaju motor, ako nemaju motor onda ne mogu ići u školu."
0:21:57,0:22:01,Često puta ti mladi napuste školovanje.
0:22:01,0:22:05,"Jednostavno mi se ne da toliko vremena hodati, nemaju podršku."
0:22:05,0:22:11,"Kako da kažem, neki će ljudi u Hrvatskoj reći pa i ja sam pješac, pa ima si Pa imaš podršku roditelja."
0:22:12,0:22:14,Ovdje na tebe nitko ne misli.
0:22:15,0:22:20,Neće ti reći roditelj ide studira i ide završi neku školu ili zanat itd.
0:22:21,0:22:22,Naša ideja je želja.
0:22:23,0:22:25,Jer ovdje je najranjivija zapravo i obitelj.
0:22:26,0:22:30,Ovdje ne postoji obitelj u pravom smislu riječi zato što nitko ne želi prihvatiti brak.
0:22:31,0:22:37,"Jako malo ljudi se ženi, vjenča je i onda jednostavno žive dok žive i dok krama ide ide."
0:22:37,0:22:39,I kad ne ide onda se rastavimo.
0:22:40,0:22:57,"I tu nije stranu da djeca žive sa očuhom, drugim očuhom itede negdje otprilike 60 do 70 posto djece raste bez prisustva biološkog oca što je za mene strašno katastrofa."
0:22:57,0:23:18,"I upravo želimo kroz taj učenički dom mi želimo te dječake primiti dječake, kasnije ako Bog da napravili bi dom za djevojčice nemoguće ovdje zbog njihove seksualiziranosti da tako kažem nemoguće ih je staviti u isti dom to je strašno."
0:23:20,0:23:25,"Prvo želimo napraviti dom za dječake, a onda za djevojčice ako bude."
0:23:26,0:23:47,"I želimo tu dati kompletno obrazovanje i moralno, i opće ljudsko, i vjerničko, razviti njihove talente, da nauče i engleski jezik, da nauče svirati, da nauče koristiti, kako da kažem, tehniku, sve ono što imamo danas na raspolaganju."
0:23:47,0:24:14,"I ono što ja vjerujem da će prvi oni pravi rezultati doći za nekih 20 godina, zašto to kažem za 20 godina, kad ćemo imati odgovorne mladiće koji neće radi pogreške svojih očeva, djedova, stričeva itd., nego će oni se boriti za obitelj, borit će se da imaju osobu koja je pored njih s kojom će graditi svoju obitelj u crkvenom braku, kako da kažem, i odgajati svoju djecu kako bi trebali."
0:24:14,0:24:17,"Evo, to je moja jedna vizija koju imam."
0:24:18,0:24:22,Jednostavno i želimo ići na taj način mijenjati ovaj svijet.
0:24:23,0:24:29,"Ono što ja kažem, ne bi niko smio prigovarati ako nismo ništa napravili."
0:24:31,0:24:36,"Lako je prigovarati, to svako može, ali ja mislim da nemamo pravo prigovarati."
0:24:36,0:24:45,"Ja kažem, kad vidim ovdje, svako malo se čuje: ukralo mobitel, zaprijetelo pištoljom, napali itd."
0:24:45,0:25:02,"Onda ja se pitam, a što sam ja napravio da ta najranjivija skupina ne postane danas sutra jedan kriminalac, da ne postane lopov, mafijaš, drogeraš, da se ne upusti u trgovinu drogom?"
0:25:03,0:25:23,"Ovdje imate jednu situaciju., evo došla je jedna gospođa, htjela da ju saslušam, za vrijeme COVID-a je izgubila i roditelje i muža, potrošila je i zadužila se za lijekove svojih roditelja i svoga muža, ali nažalost oni su preminuli i ona ima sad ogromne dugove."
0:25:24,0:25:38,"I osoba od koje je ona posudila novce, to su kamatari i jednostavno osoba od koje je posudila novce rekla je, čuj ako ti ne znaš kako ćeš me vratiti novcem, moja sestra proizvodi i drogu."
0:25:39,0:25:50,"Javećeš joj se i ičeš kao, kako da kažem, mula, nosit ćeš drogu u Španjolsku ili u Miami ili negdje drugdje."
0:25:51,0:26:14,"E sad, kad vidite te pod navodnicima ljude koje zovu mula, to su ljudi koji su prošli jedan križ, strašan problem u svojoj obitelji i sad ne znaju kako se izvući iz ruku kamatara i prisiljeni su jednostavno raditi takve stvari i zapravo koga bi ja trebao."
0:26:14,0:26:18,Treba osuditi tu je vlast koja se ne brine o bolesnicima i o potrebitima.
0:26:19,0:26:31,"S druge strane, osudite kamatare koji strašne kamate stavljaju, a onda s druge strane, jednostavno gdje smo mi bili kad je neko trebao pomoći?"
0:26:31,0:26:36,"Gdje smo mi bili, da li smo bili braća i sestra jednim drugima da pomognemo jednim drugima?"
0:26:38,0:26:50,"Kompleksna je situacija, jako je kompleksna, ali ono što je, ja mislim, u cijelom ovom misijskom poslu je ono što je najbitnije, ne izgubiti to sidro koje, kako da kažem, us musidrit naš život na Bogu."
0:26:52,0:27:00,"Kad ti vidiš ovdje svu tu mizeriju, sve što čovjek živi, onda čovjek može reći: Pa, to nema smisla."
0:27:01,0:27:07,"Ali upravo kad moliš i kad ti moliš i Bog ti daje snagu za taj posao, tebi samo se rađaju ideje."
0:27:10,0:27:14,"Pomozi našim gledateljima, molim te da se njima rode ideje, a vjerujem da hoće."
0:27:14,0:27:24,"Evo, meni, kad čovjek čuje ovako nešto, htio bi pomoći, naravno iz ove svoje perspektive, iz Hrvatske, u odnosu na ovo što ti govoriš, i komoditeta i zapravo živimo."
0:27:24,0:27:27,Živimo jako lagodno u odnosu na ove ljude o kojima ti pričamo.
0:27:27,0:27:33,Kako mi možemo pomoći konkretno vama i tim ljudima kojima vi pomažete?
0:27:35,0:27:39,"Ja mislim, prva stvar na koju možete pomoći je molitva."
0:27:41,0:27:50,"Meni je to, zbilja ne kažem to kao jednu floskulu, nego kažem, mi sijemo sjeme riječi Božje u ljude, u srca tih ljudi."
0:27:51,0:27:59,Neko nam treba pomoć da se to sjeme riječi Božje zalije i da može niknut i izrast u jednostavnosti.
0:28:00,0:28:02,I to je ono što je najbitnije.
0:28:03,0:28:05,"Molit za misije, molit za misionare."
0:28:07,0:28:12,Molit da nam Bog da snagu da možemo izvršiti ovo poslanje što radim.
0:28:13,0:28:20,"Ja zbilja kažem, čovjek može imati napasti, može imati problema i biti grešan."
0:28:20,0:28:25,"Kažem ja, pošto kakav bih ja bio da nema hrpu ljudi koji za mene molim?"
0:28:26,0:28:34,"Ako se sada ovako, kako da kažem, koji puta osjećamo ono i potišteno ili nam pomašta, pa kakav bih ja bio da nema ljudi koji za mene."
0:28:35,0:28:37,Bio bi ono ruševina strašna.
0:28:37,0:28:42,"Ali evo, ta molitva, braćo, sa starom nas nosi, jako je bitna."
0:28:43,0:28:50,"S druge strane, ono što možemo je, to uvijek napominjem, prikazati svoje križeve za misije."
0:28:52,0:28:53,Ne možeš podnijeti.
0:28:53,0:28:55,Ne znam kako to učiniti.
0:28:55,0:28:59,"Evo, sad smo baš u ovakvom intenzivnom razdoblju molitvenom, duhovnom."
0:28:59,0:29:05,Kako prikazati svoj križ za misiju u Boliviju i za te ljude koji su tko djeli?
0:29:06,0:29:08,Ako ima šefa kojega ne možeš podnijeti.
