Start (HH:MM:SS),End (HH:MM:SS),Segment
0:49:42,0:49:58,"I evo sad dok to pričam, mi se slušalo i onda sam rekao ustvari da je valjda postoji jedan dan u godini kad ti ljudi moraju biti glavna uloga, valjda postoji jedan dan kad netko od njih može biti na svečanoj tribini, razumiješ?"
0:49:58,0:49:59,I da je zvijezda.
0:50:00,0:50:04,"Da je zvijezda, taj jedan dan, pa u čini ljudima da se osjećaju važniji, zahvaliti to."
0:50:05,0:50:24,"Međutim, sjećam se da mi je Genelo Šundov rekao prije par godina je to bilo, Mirko Šundov, jedan gospodin, gospodin koji je bio ratni zapovjednik četvrte brigade prije mog prijatelja Krstičevića i onda je rekao Andrija nikad nas nitko nije pozvao, nas zapovjednike brigada koji smo oslobađali, deblokirali Dubrovnik 92."
0:50:24,0:50:44,"Bio je Marijan Mareković, bio je zapovjednik Tigrova, on je bio zapovjednik četvrte i bila je druga, mislim da je Matanović bio zapovjednik treće, koji rade, pokojni je bio zapovjednik sedme, njih je bilo živih pet generala i mi tada i gradonačelnik Franković ih je primio, ne znam, u ručevaju, ljudima je to značilo puno."
0:50:45,0:50:59,"Ja sam nedugo prije njegove smrti sreo generala Ivu Jelića, poklonio mi svoju knjigu Čovjek i rat, možda mi je to i najdraži poklon koji se dobio, jedan frajer, jedan časnik."
0:51:00,0:51:18,"Jedan sam ostao takvu tugu tom čovjeku, to je, a to je tuga, ne traže ti ljudi aplauz, ali pokaži malo poštovanja, znaš, pokaži malo i nemoj, ne moj podcjenjivati, malo mi ta posmrtni ti tonovi, malo mi to u tome malo živcira, znaš kao."
0:51:19,0:51:26,Misliš od ovih koji su danas u protokolu tipa protokolaši koji su danas bitni.
0:51:26,0:51:31,"Razumiješ, naš, to je malo, malo, malo, malo respekta naš."
0:51:32,0:51:34,Jer ako su mu vršnjaci onda imao si priliku.
0:51:34,0:51:44,"Ja tu uvijek kažem svim tim velikim domoljubima, imao si priliku urođač, imao si priliku, mogao si se pokazati i dokazati."
0:51:44,0:52:05,"Tako da ne volim ruganje kao takvo inače, ne volim ruganje, ali ovome, ovome baš mi je, baš mi je to nekako počelo smetati, znaš, to je postalo nešto što je realno kompliment ako si bio iz triju bit je poslao kao neka sprdnja naš kao a gdje si bio kao dobro da ih još ne proglašavaju subnorašima."
0:52:05,0:52:07,"Da, doka ćemo, pa imaš."
0:52:08,0:52:09,"Pa mislim, jel ima lažnih branitelja?"
0:52:09,0:52:19,"Pa naravno da ima, jel ima lažnih invalida, naravno da ima, puko, bubnić, nokat ne znam, ne podcjenjujem biti SPI, ali, okej, ne podcjenjujem biti."
0:52:20,0:53:51,"Pa ima lažnih političara, ali ima, znaš, ali nisu baš svi lažni, nije baš tako i to je ono to neko nabacivanje blatom, razumiješ to, naradiš kad te opališ tu, tu neku zalijepiš mu neki pečat, baciš mu i to je to, nemoj podcjenjivati, razumiješ, ima jako puno časnih ljudi koji su se vratili u svom životu, u svojim obavezama, koji su branili ovu zemlju jer su mislili da to treba i da to je ispravno, razumiješ, nemoj podcjenjivati te ljude, nemoj manipulirati s njima, nisu ti ljudi, ni neki od njih, ni većina njih nisu imali prilike ni previše čitati, ni učiti, ali nemoj podcjenjivati, ljudi imaju logiku, imaju zdrav razum i nemoj podcjenjivati, to je najvažnija stvar, to je meni savjet koji govorim mladim kolegama, nemoj nikad podcjenjivati sugovornika, nemoj ga podcjenjivati, zato što ona baka u plašku je možda mudrija od teme, znaš, to što ona ne zna govoriti, ja si otvaram pred nje vam čimbenik i to, nemoj podcjenjivati, komentatora."
0:53:53,0:53:53,Jesu ti nudili?
0:53:54,0:53:54,Pa jesu.
0:53:54,0:53:56,"Pa, veliš, nakon tog mimo hoda više nećemo."
0:53:56,0:54:32,"Pa da, da, da, ne, ne, ne, ne, ne, zato što mislim da je korisno ovo što radim i stvarno želimo napraviti, stvarno želim ovaj, stvarno želim napraviti još dosta tih emisija i baš mi je to nekako omiljeno, jer kako idem polako prema kraju, pedeset šest znači još mogu i na par godina to tako da ja mislim da da siš prema kraju ove karijere da živjet ću valjda još koji god da tako da ajde nemoj da nemoj još valjda na kraju krajeva trebamo još ovakvih dobrih emisija, ali trebamo i još ovakvih dobrih komentatora."
0:54:32,0:54:37,"Molim te, nešto bih voljela s tobom prokomentirati vezano naravno uz lijepu našu."
0:54:37,0:54:45,"Stalno se govori kako znaš ono kad sjedneš s ljudima na kavu, joj nitko neće raditi, nikome se više ništa ne da."
0:54:46,0:54:48,"Plaće su male, posla ima."
0:54:49,0:55:11,"Tu sam nedavno otvorila temu o keramičarima koji ono za tri tisuće eura metar kvadratni pločica ti dođu metar i onda kažu tri tisuće eura ili ne znam neku ti na crno izmijeni cijev znam po prijateljici klinac osamnaest godina cijev dva tri metra, ta majka je završio školu i mazne sedamsto eura."
0:55:11,0:55:20,"Sad, nemam pojma hoće li sad ovo izazvati možda neku, ne daj Bože, poreznu ili nekog kod te žene, ali ja šutim, izvor ne odajem."
0:55:21,0:55:23,Što ti se čini na takve te priče kod nas?
0:55:23,0:55:28,Jesmo li se uljenili ili nismo dovoljno plaćeni ili znate ili znaš kako se kaže?
0:55:29,0:55:33,Radio bih da me dobro plate.
0:55:33,0:55:47,"es druge strane mi kaže nedavno čovjek koji zapošljava jako, jako puno ljudi, ima tu veliku tvornicu, njegova iskustva su koliko god da platiš neradnika, taj nikad neće raditi, a pravi radnik radi uvijek."
0:55:48,0:55:49,Dvije su stvari tu bitne.
0:55:49,0:56:13,"Prvo, ja mislim da je dobro da ne možeš više konova naplatiti petsto eura ako je to bilo prije deset godina i ja mislim da je dobro da kuhar u restoranu u Dvorani koji ima tri tisuće eura plaću i da pritom zna kuhati da se plati to i da ih zaradi da ih zaradi i to je majstorstvo to je zanat to je ne možeš ti baš napraviti poparu od ribe ili ispeći dobru ribu tri kila ako nisi maha, moraš ju mahati to je jedna stvar."
0:56:13,0:56:20,"Druga stvar je ključni problem je što današnje generacije hoće sve i odmah, ponavljam sve i odmah."
0:56:21,0:56:49,"Znači ja sam prvo javljeno živo, to tada nije ni bilo u modi radio nakon četiri godine, nakon stotina priloga, reportaža, anketa, ne znam čega sam radio svoju prvu javljenu živo, kad sam odradio prvu javljenu živo, to je bio požar na Korčuli devedeset i čini mi se osam godine ja sam mislio da sam osvojio svijet, ja sam mislio da sam negdje na marsru."
0:56:49,0:57:03,"Danas dođe kolegica ili kolega nakon tri mjeseca on je na tvojem mjestu ne možeš ti za tri mjeseca naučiti postavljati pitanja ponašati se pred kamerom imam imati znanje to, to je ključni problem."
0:57:03,0:57:10,"Znači hiperinflacija je svega, ali ključni problem je poslodavci bi platili što manje, što je logično s njihove strane."
0:57:12,0:57:17,"Radnici bi htjeli što više, što je opet logično, legitimno, ali ja mislim da kvalitet je kao blaga."
0:57:18,0:57:21,"Znaš kad se pojavi blaga u kuhinji pa ti zakrpiš to, ali evo u dnevnom boravku."
0:57:22,0:57:24,"Ako si ti dobar u poslu, pa me radiš kad kad ćeš proći."
0:57:24,0:57:31,"I nikad nisam priznao, znaš kad kaže nije me urednik volio kao ja bi bio to, ali urednik me nije volio, ma nema stari to sve."
0:57:32,0:57:38,"Ako nisi prošao na radio mrežnici, prošao si na radio to, ako nisi prošao na ovoj televiziji, prošao si na televiziji."
0:57:38,0:57:46,"Ako ti znaš uspiješ kad tad dobar kuhar će, kad tad dođe u restoran gdje će mu se sve posložiti i bit će master šef."
0:57:47,0:57:47,I to je stvar.
0:57:47,0:57:48,Samo treba htjeti.
0:57:48,0:57:49,Samo treba htjeti.
0:57:49,0:57:54,"Ali kažem ti, pitanje je koliko ima naravno ljudi koji."
0:57:56,0:57:57,Pitanje je prioriteta.
0:57:58,0:58:03,"Mi kad smo, ajde, bili djeca, kad vidiš onu učiteljicu na cesti, onom moliš broga te ne vidi, tako?"
0:58:04,0:58:05,"Ako te vidi, kažeš dobar dan."
0:58:06,0:58:06,I to prvi.
0:58:08,0:58:14,"Ja sam baš nekada razgovarala kako su nas učili, driblali, nemoj slučajno ne pozdraviti, nemoj da ti ja čujem ili vidim."
0:58:15,0:58:19,"Sad te gađaju, sad te gađaju, sad i rađaju snijegom ili ne znam šta."
0:58:20,0:58:22,Ili kad prođe dobacivaju to.
0:58:22,0:58:26,"To jednostavno se promijenilo, malo smo se, sve se promijenilo pa i to."
0:58:27,0:58:29,"Ali dobro, ja sam optimist i ja vjerujem da će biti bolje."
0:58:30,0:58:33,Želim uspjehati na ponovno u povratku na teve ekrane.
0:58:34,0:58:36,"Hvala ti lijepo i evo, mislim da da."
0:58:38,0:58:40,Neka erteel dajte ga malo češće uzmite za komentator.
0:58:42,0:58:56,"Mislim da će biti zanimljivo ljudima gledati, ima puno novih zanimljivih stvari koje pripremamo i evo, drago mi je da sam opet u duga recesiji i uvijek moram to ponoviti, ja sam bio, evo gledam tamo na kameri, ja sam bio prvi gost u ovom podkastu."
0:58:56,0:58:56,Tako je.
0:58:57,0:58:58,Prvi se pojavio.
0:58:58,0:59:00,Prije dvije godine i četiri mjeseca.
0:59:00,0:59:02,Otad je puno gosti u proteklih mjeseci.
0:59:02,0:59:02,Ostajalo puno.
0:59:03,0:59:03,Nisi.
0:59:03,0:59:03,"Ne, nisi."
0:59:03,0:59:04,Dapače.
0:59:04,0:59:06,Za tebe je vrijeme stalo.
0:59:06,0:59:07,Pozbiljno.
0:59:07,0:59:08,Pa tako se meni čini.
0:59:08,0:59:10,"E, ali sad će reći, gledajte kako mu se uvaljuju i kako."
0:59:11,0:59:11,Ali to je.
0:59:12,0:59:14,Ja ću reći da si on rođena političarka.
0:59:14,0:59:14,"A, nemoj."
0:59:15,0:59:15,"Ja, on ne moće."
0:59:16,0:59:16,Ne moj.
0:59:18,0:59:19,"Andrija, sretno."
0:59:19,0:59:19,Hvala ti.
0:59:19,0:59:20,Uživam.
0:59:20,0:59:20,Hvala te.
0:59:21,0:59:23,"Andrija Jarek, bio je gost u ovom podkastu Mrežnica."
0:59:23,0:59:24,Hvala vam što nas gledate.
0:59:25,0:59:26,Naravno da se vidimo vrlo brzo.
