Start (HH:MM:SS),End (HH:MM:SS),Segment
0:23:51,0:23:55,"Ako je netko rukuo trideset milijuna, to je prvih deset minuta dnevnika."
0:23:56,0:24:00,Kako se to moglo dogoditi kad si ih sad već spomenuo tih trideset milijuna?
0:24:00,0:24:08,"Naravno je nebitno, potpuno je nebitno jer se zoveš Andrija Alijana, Stevo, Jovo, Vedran ili Hrvoje."
0:24:09,0:24:11,Znači trideset milijuna eura.
0:24:12,0:24:13,"To je ono, teško je izbrojati."
0:24:14,0:24:15,Zumijem.
0:24:15,0:24:16,To je prvih deset minuta.
0:24:17,0:24:19,To mora biti prvih deset minuta.
0:24:19,0:24:20,To mora udarati.
0:24:21,0:24:31,"Znači ne, nemoj, nemoj stavljati na vagu, ako je netko ukrao milijun ili je netko drugi ukrao milijun, mora imati isti tretman."
0:24:31,0:24:32,"Potpuno je nevidljivo kako se on zove, tako?"
0:24:33,0:24:34,Trebalo bi biti.
0:24:34,0:24:36,Znači potpuno je nevidljivo kako se taj čovjek zove.
0:24:36,0:24:45,"Na kraju dana ispovode u Hrvatskoj, ajmo koliko imamo presuda za to, imamo Senadera, imamo Vidoševića, imamo koliko ima, pet presuda ima."
0:24:46,0:24:50,"O krađi nam koliko, sto milijardi, bilijardi nečega, trilijardi."
0:24:51,0:24:56,Razumiješ li kad o tome koliko je tih silnih novaca zapravo splačeno?
0:24:56,0:24:57,Pa naravno da razmišljam.
0:24:58,0:25:01,I onda kažeš bolje da Andrija idem snimati o ubojicama.
0:25:02,0:25:04,"Ali gledaj, to je prošla baba s kolačićem."
0:25:05,0:25:12,"Legalizirali su crne pare, to su danas ugledni poduzetnici i to je, znaš, ja kad čujem kad ne kaže on se snašao, znači ja dobijem infarkt odmah."
0:25:13,0:25:16,"Kad ne kaže on ma dobro, ma se snašao se frać, što znači on se snašao?"
0:25:16,0:25:19,Šta je uzao pet firmi i privatizirao ih je napravio.
0:25:20,0:25:22,"Razumiješ, ali tako malo, znaš koliko nam treba?"
0:25:23,0:25:24,Samo mi se iskačemo s temena.
0:25:26,0:25:34,"Vidite, vidite, tako malo treba, samo mrvica da se napravi jer znate šta ne razumiju ovi bukači s lijeva i s desna?"
0:25:34,0:25:48,"Najdaje Bože, najdaje Bože, jedna jača petak da ne kažem bomba na nekoj plaži u Hrvatskoj da padne promislimo mi smo gladni, sumješ mi šta hoćeš reći, mi uopće nismo svjesni trenutka u kojem mi živimo, u kojem se mi nalazimo."
0:25:49,0:25:54,"Znači mi smo sad na, mi smo ono, molim Boga da prođe ispod kapi, to je to."
0:25:55,0:26:07,"Ja gledam ove analitičare, onda oni komentiraju ne znam rat između Ukrajine i Rusije, pa onda komentiraju raspored trupa, pa način ratovanja, pa sad komentiraju Iran, Amerika i to."
0:26:08,0:26:12,"Stari moji, daj se svi malo, ajmo svi malo se savratovati."
0:26:12,0:26:13,A se to zanima?
0:26:14,0:26:18,"Mislim, mene zanima hoće li ova država, hoće li imati plaću, tome zanima."
0:26:18,0:26:27,Naravno da me zanima da turistička sezona bude rekordna i naravno da navijam da moja zemlja raste i napreduje i da navijam da mi susjed nije gladan.
0:26:28,0:26:33,Ali tko sam ja da komentiram zbog čega ovaj traži zatvaranje tjesnaca ovog ili tjesnaca onog?
0:26:34,0:26:39,"Tko sam ja da komentiram i projiciram hoće li za dva mjeseca nafta barel koštati ovako, razumiješ me?"
0:26:40,0:26:45,"Ne jedan, bilo tko, znači moraš imati znanje, iskustvo da bi mogao to kome."
0:26:45,0:26:46,Kod nas svi sve znaju.
0:26:46,0:26:54,"Znači, pokojnik Ante Rossov general je bio velika faca, priča pet jezika i jako sam ga poštovao kao oca."
0:26:56,0:27:09,"I on meni, sjećam se to scene i on kaže meni si novac o mojim operacijama, raspolja gospođa u Saboru koja se zove tako i tako, zamisli gdje smo mi došli."
0:27:11,0:27:15,"I stvari to je, i stvari kako je pokojnik general bio pametan, razumiješ?"
0:27:15,0:27:16,Da.
0:27:16,0:27:25,"U njegovim operacijama raspravlja gospođa koja je dobila četiri ili dvanaest tisuća glasova ali ona zna da je on pogriješio to i to, razumiješ me?"
0:27:25,0:27:28,E to je naš ključni problem i nitko ne olja.
0:27:29,0:27:33,"Dragi Petrović, Blago Zadro, njih nitko ne pljuje, zna žao što obojica smo zemlju."
0:27:35,0:27:35,Da li živi?
0:27:36,0:27:39,"Eto, znači u Hrvatskoj te ne pljuju jedino ako si mrtav."
0:27:39,0:27:40,Samo tako.
0:27:40,0:27:41,"Ako si živ, ja sam."
0:27:41,0:27:44,"Ako si živ, pa evo, Luka Modić si najbolji primjer."
0:27:45,0:27:46,Čovjek je fenomen.
0:27:47,0:27:48,Čovjek je fenomen.
0:27:48,0:27:57,"Da ti ne kažem Đop, pogrešajte Đokoviću rad, bivšeg Đokovića, ovi ovi pro-režimski mediji u Srbiji zovu propali teniser."
0:27:58,0:28:13,"Zamislite čovjeka koji je najveći teniser svih vremena, koji je po meni top pet uz Michaela Jordana, Muhameda Alija, ne znam, Karla Luisa, Bolka, ajde recimo, top deset najvećih naših u povijesti, po meni."
0:28:15,0:28:20,To znači da nije baš velika razlika između nas i susjeda u omalovažavanju svojih ljudi.
0:28:23,0:28:33,"Svjetski provacij i blizanci, to je, ako treba nekoga ispljuvati, sudarati po glavi, to, pa to nigdje te neće ispunižavati kao što je na Balkanu., nigdje, nigdje te nekoga."
0:28:33,0:28:42,"Evo sad, džeku slave jer je beiha otišao na svjetsko, da nisu otišli na svjetsko, rekli bi Đu Turum, šta će on četrdeset godina, ne može hodati, šta će."
0:28:43,0:28:43,Stara kanta.
0:28:44,0:28:46,"Jedi tamo će vape, stara kanta."
0:28:46,0:28:55,"Sad je Bog alak zato što je Bosna otišla zahvaljujući njemu, naravno, najviše i to je tanka granica između slave i propasti, to je problem."
0:28:55,0:29:14,"Razumiješ, to je, pa rekao sam ti zadnji put kad smo razgovarali kako te napadnu i njihovi najpoznatiji novinari, javne osobe, kako napadnu preko noći i promjene, preko noći i promjene krvnu sliku i ono što je vrijedilo danas, to je jednostavno tako."
0:29:15,0:29:23,Sad kad evo malo spominješ u BiH ove godine odnosno sad si sa dosijevom zašarao i na njihovo držište da tako kažem.
0:29:23,0:29:24,"Jako da, da, da."
0:29:25,0:29:28,Reći će ovi gle po jugosloveniju se.
0:29:28,0:29:43,"A ne, ne, ne, ne, ne radimo, mi radimo, naravno da i u Hrvatskoj nema toliko priča i radimo cijeli Balkan, napravili smo dvije epizode o Zijadu Turkoviću koji su imali jako puno, dvije rečenice za one koji ne znaju tko je Zijad Turković."
0:29:43,0:30:45,"Čovjek iz Sarajeva koji je pravomoćno osuđen na četrdeset godina zatvora pod optužbom da je ubio troje ljudi odnosno naručenih ubojstvo i da je napravio najveću mafijačku organizaciju na Balkanu, a poznati po tome da njegova suđenje, njegovo je postalo reality show koji ima preko trideset pet milijuna pregleda na društvenim mrežama i dijelom i zbog toga smo radili tu emisiju a radili smo i zbog toga što ima jako puno svjedoka i obitelji žrtava i njegove obitelji svi tako da je to jedna emisija dvije epizode smo napravili koje su jako dobre radimo emisiju o jedinom gačiću koji je ubio petero ljudi dvije tisuće devetnaest i radimo emisiju o fikretu hađiću zvano hađija dvije epizode on je ubio troje ljudi, dva brata i rođaka i ostao je poznat po izjavi, on je po njegovoj verziji su njega maltretirali, njihova obitelj tvrdi drugačije, ali uglavnom, hađija je postao poznat po izjavi da je jedan od tih valjda koji je bio ranjen rekao nemoj hađija nećemo više, a onda je rekao pa i nećete i onda ih je ubio."
0:30:45,0:31:03,"On je to izjavio prije par godina, uglavnom sad izlazi za nekoliko dana nakon dvadeset četiri godine zatvora i mislim da će to biti jako zanimljiva priča što se tiče ove sezone to sam ti ostao dužan znači imamo dva mlađana imamo trovače iz plaškova ovdje iz karlovačke župananije."
0:31:04,0:31:13,Iz te županije to je jedna fascinantna priča gdje dvoje ljudi su otrovali neke ljude da im ukradnu sto kuna ili ne znam što.
0:31:13,0:31:15,Imamo priču o slavku stolniku.
0:31:16,0:31:51,"To ćemo oprosti svaki petak će biti ili petak, da, svakog petka od dvadeset jedan pet imamo slavka stolnika tog slikara na isti način da bi bio genijalac i imamo jednu jako potresnu priču a to je martina horvat psi vukovarskog branitelja koja je nestala na laništu dvije tisuće osam godine nikada se nije našla strašna priča užasna priča i zamisli par mjeseci nakon što je to izašlo na platformi Vojo je pronađen njezin otac, Palo Horvat koji je bio vukovarski branitelj."
0:31:51,0:31:54,"Pronašli su se njegove posmrtne ostatke, tako da je to."
0:31:54,0:31:55,Pa čiji još?
0:31:55,0:31:56,Čiji još nitko ne zna.
0:31:56,0:32:01,"Mislim, daj Bože da je Martina živa ali sve upućuje na to da ona ubija."
0:32:02,0:32:06,"Bio si i, odnosno napravio si i priču o Zveri."
0:32:06,0:32:34,"Je, da, napravili smo priču o Srednjo Hrvatskoj Zveri odnosno o Zemljemu svom klanu i posebnost te priče je da je naša kolegica maloprije spomenuta Marijana Čikić uspjela stupiti u kontakt s njime, otišao u Zabelu, Zabela je najčuvaniji zatvor u Srbiji, u Požarevcu i razgovarala s njime face to face i što je bilo nama iznenađenje jer ja i Dario nismo vjerovali da će to uspjeti, uglavnom je razgovarala s njim."
0:32:34,0:32:37,Nismo vjerovali ili niste imali hrabrosti sad malo.
0:32:39,0:32:56,"Ne, ne, imali smo, naravno, hrabrosti, ne, nismo vjerovali zato što u Hrvatskoj je strogo zabranjeno kontaktirati sa zatvorenicima, osuđenicima za oboje zbog reviktimizacije žrtava, zato što u Hrvatskoj zatvorenici ne mogu javno stupati jer njihov nastup može izazvati osjećaj ugroženosti kod obitelji žrtava."
0:32:56,0:33:03,"Međutim, u Srbiji uspjela je Marijana doći do njega, razgovarala je s njim i snimila telefonski razgovor, intervju s njim."
0:33:03,0:33:04,Nevjerojatno kako ste uspjeli zapravo.
0:33:04,0:33:12,"Pa zahvaljujući njeznoj ispravnosti i sistematičnosti i upornosti ona je stvarno bila uporna, zvala, zvala, zvala i na kraju ga je ovaj."
0:33:13,0:33:15,"Ajde da je više riješio, daj ono, daj ono."
0:33:15,0:33:18,"Ajde da je nešto i uspio, uspjeli smo to snimiti."
0:33:18,0:33:31,"Pa mislim, klasični ubojica u jednom klanu koji je bio jako opasan, beskorpulozan i ja mislim da je njemu dokazano da ga sumnjiče za dvadeset ubojstava a da mu je dokazano trinaest."
0:33:32,0:33:39,"Znaš kako meni kažu nekad mi ovako, nekad, često mi pošalju mailove ili poruke i ova pa samo pričate o ratu."
0:33:39,0:33:41,"O, danas ne pričamo o ratu, danas pričamo o ubojstvima."
0:33:42,0:33:43,"Da, malo smo promijenili temu."
0:33:45,0:33:57,"Imaš li ti kad osjećaj da bi trebao ili ti netko kaže dok kradiš dosije, malo ću to pojačati, malo ću nabrijati zbog efekta, važeš li kad to?"
0:33:57,0:34:06,"Važem, ali u pravilu baš ne nabrijavamo zato što ti nabrijavanje ti je kratkoročno i kontraproduktivno."
0:34:08,0:34:36,"Večera se eksplozivno samo naš, sve je to dobro, ali je to nešto što je preplavljeno s time, potopljeno što bi ti rekla i mislim da je previše, manje više, ja mislim da je to, pusti ljudima, pusti ti ljudima nekoni sami, hrvatska publika je odrasla uz televiziju Zagreb i rekla bi da je izuzetno televizijski pismena tako da ne bih ja nikada podsnivao gledatelje."
0:34:37,0:34:48,"Znaš, nije Hrvatska, u Hrvatskoj ne može proći baš tako lako, nije elita ni zadruga, može nekako nekim dijelom, ali hrvatska publika je ipak malo zahtjevnija."
0:34:49,0:34:57,"Sjećate li se ti možda s nostalgijom tih vremena, možda smo imali manje televizijskih programa, ali smo imali više toga za gledanje."
0:34:57,0:35:01,"Ja se sjećam kad sam vidio Ole Vran Mlakara prvi put na Stradunu, ja sam mislio da taj čovjek ne postoji."
0:35:02,0:35:02,Stvarno.
0:35:03,0:35:05,"Da, ja sam mislio da on superheroj koji leti iznad ovoga."
0:35:06,0:35:07,Televizije za angličanstvo.
0:35:08,0:35:11,"Da, da, koji leti iznad ovoga, Milku Babić isto kad sam ga upoznao."
0:35:11,0:35:14,Znači to je jedna fascinantna anegdota.
0:35:14,0:36:15,"Ja sam tada došao raditi u sportski program, na Prisavlju i gospođa Milka je stala do mene, znači je bila ona zelena Unis TBM mašina, ona Unis TBM se zvala, mislim da je iz Bugojna, zelene boje, znaš ona mašina za, ona pisaći Uz popratni zvuk, se rasteže i ona kaže: Pogledaj me, nisam znala da u Dubrovniku rastu orangutani."
0:36:16,0:36:18,"Znači, onako nikome u životu nije."
0:36:18,0:36:19,"Onako posramio, ja."
0:36:19,0:36:22,"Baš se posramio, sad bi bitko sjedio."
0:36:23,0:36:26,"A moja namjera bila ono, našo jutro je kao da se rasteže."
0:36:26,0:36:27,"Ne, da kome vidi."
0:36:27,0:36:29,"Pa ne, nisam se sločio, nisam se svađao."
0:36:31,0:36:33,"Što misliš, koliko ih se danas rasteže na poslu?"
0:36:33,0:36:35,"Mali broj, mali broj."
0:36:35,0:36:36,"Mali broj, misliš?"
0:36:37,0:36:46,"Kad smo spominjali sad tu Bosnu i Hercegovinu i Srbiju, pa kako šaraš sa dosijevom i po njihovim slučajevima, ajmo mi malo, samo mrvicu na politiku."
0:36:46,0:36:56,"U stvari, na moguće sukobe stalno nam nešto govore, prijete, joj, iznašano, bude baruta, joj, mogući su novi sukobi, joj, srbijanske rakete, joj, ovo, joj, ono."
0:36:56,0:36:58,"E sad, baš me zanima što misliš o tome."
0:36:58,0:37:36,"Pa evo, srbijanske rakete, ja volio da neko od ovih analitičara kaže koliko je stara eskadrila MIG-ova dvadeset devet koju je bjelorusija poklonila vučiću pa su u obnovu uložili dvjesto milijuna dolara toliko o tome da su besplatni avioni recimo volio bi da mi neki analitičar objasni koje to rakete može nositi MIG dvadeset devet star četrdeset godina dva puta renovirani tako recimo volio bi analize evo recimo što se tiče potpaljivanja vatre to radi isključivo Vučić jer tako u tom strahu i panici, znači on kao što ljude u Srbiji straše bez mene ćete biti gladni, tako straši ljude u regiji da će biti rat."
0:37:36,0:37:48,"Znači Hrvatska, Albanija, Kosovo su potpisali pismo namjere o vojnoj suradnji, čovjek je mrtav hladan došao na RTS i rekao da je pitanje dana kad će nas napasti, da je Srbija spremna."
0:37:48,0:38:02,"Dakle to je tipično potpirivanje tog vatre, pa imaš notornog šešelja koji svaki dan gostuje na televizijama sa nacionalnom frekvencijom i to komentiraju."
0:38:02,0:38:07,"E, samo me zanima još evo sada je i nakon šesnaest godina Orban otišao s vlasti u Mađarskoj."
0:38:07,0:38:10,Pa ja ne znam tko je.
0:38:10,0:39:16,"Da, Osovina je pukla, ja ne znam tko su fanovi Viktora Orbana u Hrvatskoj i ja tog kako bih ga nazvao moram naći pravi izraz, ja tog onako pozamašnog gospodina vidjeti ne mogu, samo zbog one karte gdje je pola Slavonije pripojio velikoj Mađarskoj i što se mene tiče, jako sam sretan da je podmuhli gospodin Sladenberg sletio s vlasti samo zbog te karte gdje je pola Hrvatske prisvojio Mađarskoj i ne znam tko može navijati za njega i za njegove borbe za čistoću i za ne znam šta i mora li to, dakle to ne zanima me uopće Viktor Orban ni Orbanovci ali s obzirom da je pola trećinu Hrvatske pripovijedio sebi a s obzirom da imam neke informacije kako njegovi ljudi operiraju po Slavoniji, kako torbane po selima, nisam impresioniran sa Viktorom Obrovom, preporučujem mu da hoda i da malo smanjiš licu."
0:39:16,0:39:18,Sad mi to objasni.
0:39:18,0:39:20,"Što torbere, kako torbere po Slavoniji?"
0:39:20,0:39:37,"Pa po Slavoniji ima jako puno ovih imanja koja se prodaju i tako ima jako puno zemlje, pa onda ima jako puno investitora koji kupuju ne pitajući za cijenu, tako da nisam siguran koliko je to ekonomski interes, a koliko je to u stvari želja za ekspanzijom."
0:39:38,0:40:01,"Kao što on Vučić u krajnjoj njegovu već deset godina i pričamo kako su Mađari i Srbi braća i neraskidljivi, je li to najplodnija zemlja u Europi što je Vojvodina, je li to Orban Pikir Vojvodina ili on stvarno toliko voli Srbe, to ne znam, ali ne bih se kladio, prije bih rekao da ima neke teritorijalne pretenzije i prema Vojvodini i prema Hrvatskoj."
0:40:01,0:40:19,"Vojvodina kao takva mene zanima, ali ponavljam ti ono što čujem od ljudi kako kupuju se to po Slavoniji i ono što vidim one karte, opet se vraćam na kartu gdje je dobar dio Hrvatske pripojen velikoj Mađarskoj, znači brat, otperio si i završio si svoje i uopće mene ne zanimaš."
0:40:19,0:40:21,Još manje me zanimaju njegovi fanovi.
0:40:22,0:40:37,"Ovo sada što se događa na Bliskom istoku, samo da te pitam iz svoje perspektive, a pratio si koji je šta, misliš li da bi nekakav novi migrantski val nas tu mogao pogoditi i koliko to ovo zapravo i sigurnosno pitanje za nas?"
0:40:38,0:40:40,Pa ja mislim da je to prvo razno sigurnosno pitanje.
0:40:40,0:41:31,"Iran je zemlja od sto milijuna, devedeset dva milijuna na papiru ali vjerojatno sto milijuna ljudi zemlju od sto milijuna ljudi ne možeš porobiti ili možeš porobiti jako teško kad vidim netanjahua kad vidim trumpa i kad vidim iransku revolucionarnu gardu koja nije iranska vojska za one koji ne znaju to ljudi moraju razlučiti malože da tako je malože i kad čujem homeinija i ajatolaha i nasljednika homeinija ajatolaha ovoga ajatolaha onog i bibi netanjahua i Donald Trump nisam baš optimističan, bojim se da bi to moglo puknuti nešto jako veliko, a mi smo toliko mali i toliko ovisni da kad malo vjetar pukne mi se tresemo tako da ja mislim da smo mi u ne mi nego svi u velikom problemu, a Europa koja je izgubila svaki mogući kriterij, pa ja mislim da Europa nema nikakav obrameni mehanizam."
0:41:31,0:42:27,"Pa sjetite se one migracijske krize dvije tisuće petnaest godine angele mrkle to pa pitajte ljude koji žive po njemačkoj nemojte misliti da su ti ljudi rasisti ili fašisti ili da su oni nešto nacisti ne daj bože pitajte ljude šta misle o tome recite ne pitajte Ne, ne, pitala sam me za migracijski val, pa kakav migracijski val, pa mislimo, mi smo u problemu svakako, kamoli još da dođe deset pet na dvadeset milijuna migranata, to je ali veliko, ja sam tu jako pesimističan i mislim da će to biti ogroman problem, ogroman problem će biti to za cijelu Europu sto posto sto posto mislite da će biti terorističkih akcija da su moguće mislite da mislim da moguće sve ali najviše ono čega se bojim je sukob Rexanti Izrael i Iran Amerika odnosno lideri njihovi ne ulijevaju mi nadu da će to završiti ono pristojno da rukovanje mislim da neće."
0:42:27,0:42:34,"Malo prije si spomenuo, trebamo molit Boga da barem petar da nigdje ne opali pa da ne izgubimo sezonu."
0:42:34,0:42:38,"Ali, sad ću reći možda, lako još možda za sezonu."
0:42:39,0:42:41,Stalno se govori kako nemamo doslovno ničega.
0:42:41,0:42:42,Mi nemamo ničega za jesti.
0:42:42,0:42:47,"Evo nedavno nam je bio Uskrs, idemo u dućan, neću reći koji egipatski krumpir."
0:42:47,0:42:51,"Oka, onda mi kaže jedan poznanik, a idem kupiti mladi luk, odakle mladi luk?"
0:42:52,0:42:52,Iz Srbije.
0:42:52,0:42:58,"Opa, pa kako se svima više isplati ne znam uzgajati krumpir, luk, zelje nego Hrvatima?"
0:42:58,0:43:03,"Pa evo kako, zato što je uvozni lobby je uništio domaću proizvodnju."
0:43:03,0:43:12,"U Hrvatskoj ima jako puno vrijednih ljudi i jako puno, pa krenuo bih od ribara preko Vrgoračkih jaboda, Drnaničkog pršuta do Slavonskog kuna."
0:43:13,0:43:30,"Ima jako puno ljudi koji su vrijedni, koji hoće raditi, koji hoće živjeti od rada svojih ruku, međutim ne može jer su uvozni lobiji toliko jaki da on uveze taj egipatski krumpir ili srbijanski luk i jednostavno ga ne možemo konkurirati cijenu, ne možemo konkurirati s ničim."
0:43:30,0:43:46,"Pa sjetite se onih prosvjeda, ja sam pratio prije petnaest godina prosvjed mljekara pa su mi onda objašnjavali kako ih ove mliječne industrije, reketare, kamatare, kako im obećavaju jednu cijenu, pa kad dođe isplata onda i kaž kaže evo uzmi šećer, uzmi brašno, uzmi kompenzira i to."
0:43:47,0:43:49,Ali zašto je to tako samo kod nas?
0:43:49,0:43:51,"Zašto smo se tako dali, da ne kažem prodali?"
0:43:52,0:43:56,Pa zato što se ne može se čovjek sa sela boriti jer on nije navikao na to.
0:43:57,0:44:00,Ne može se ribar smijeta boriti sa uvoznim lobijima.
0:44:00,0:44:01,Zumiješ kako će se boriti?
0:44:03,0:44:06,Mislim država bi trebala kao znaš šta ću ja onda znati iza njega.
0:44:06,0:44:29,"Država bi trebala zaštititi, ali ja sjećam da je kad je bio taj prosvjed mljekara, jedan gospodin, sad moram, ne mogu sjetiti da li je okolica Slavonskom Brodu, mi je rekao uglavnom oni imaju neku tvornicu, oni partner, oni su prodali tvornicu i dobili su tri milijuna eura po milijun i pol i njegov djed je imao farmu krava i oni žene i djece su razgovarali evo imamo milijun i pol eura što sad?"
0:44:29,0:44:33,"I onda ajde, ajde, ajde otvorit ćemo farmu krava."
0:44:34,0:44:49,"I onda je otišao u Njemačku na najbolju farmu, vidio tamo kako ljudi rade i doslovce prekopirao tu farmu i bilo mu još falo novaca i još je uzimao pedeset tisuća kredita po cijelom, ne znam da napravi to kako treba čovjek je doživio fijasku."
0:44:50,0:45:02,Rekao je ja sam imao milijun i pol eura na računu i onda sam došao u situaciju da ujutro u pet sati muzem krave jer on je automatski jer one automatske muzuljice rade do nula do jedan do dva poslije ne.
0:45:03,0:45:15,"I kaže nije mi bilo teško, ja sam muzao krave zajedno sa svojom suprugom, međutim kad je počelo otkup, ne otkup, čovjeka su uništili, banka mu je uzela farmu i znate šta je uopće takvih tužnih priča?"
0:45:16,0:45:19,"I naravno da bi ih država trebala zaštititi, ali to je jako teško."
0:45:20,0:45:34,"Sad kad si spomenuo koliko je takvih tužnih priča, sad da pustimo ovu crnu kroniku, ima li nekakvih top tri tvojih tužnih priča u novinarskih, a mislim da bi mogao biti i top trideset barem u jednom trenutku."
0:45:36,0:45:45,"trgovački lanac, radila je za njih, rekli su kao mi bi trebali to malo više nego vi, žena je radila sto kilograma kolača, ne, oni su trebali naprimjer tonu."
0:45:46,0:45:48,I onda ona je rekla ja nemam novaca.
0:45:49,0:46:19,"I onda su i oni rekli da će joj oni pomoći, naravno samo neka ona uzme to, ne, oni će joj garantirati otkup, znači neka ona uzme kredit, kupi sad još jednu to liniju nečega proizvodnu i žena je to kupila i sve je bilo super godinu dana, dvije međutim počelo je kaskanje kao ne možemo platiti šezdeset dana, devedeset dana pa evo kompenzacija ulje vraćeno šećer i to i na kraju im su izgubili to sve i njezin otac se, Bože, njezin suprug se ubio, bio je branitelj i ubio se čovjek iz ponosa."
0:46:20,0:46:47,"Ponosan čovjek nije mogao to podnijeti i ona je srela jednu gospođu koja je bila jedna od čelnih ljudi u tom koncernu i ispričala svoju priču i onda je rekla, meni je žao, ona je rekla ne, ne, ne, ne, ne trebam im vaše sažaljenje, samo eto, ako nek se vama dogodi to što se meni dogodilo, mislim, ona je strašna priča, muže je se ubio, znači iz čiste najbolje namjere i takvih priča ima jako, jako puno, gdje su ljudi jednostavno te velike proguta ispili, ne baci i to je to."
0:46:48,0:46:57,"Kad si spomenuo ponos sad tog gospodina, koliko je danas u Oopće kod Hrvata ponos još na cijeni ili je to možda sve nešto onako fake?"
0:46:58,0:46:59,Govorim sad o braniteljima.
0:47:00,0:47:03,"Pa ja sam, mi smo u pravilu ponosan narod."
0:47:03,0:47:08,"Što se branitelja tiče, ja nisam uzao mirovinu, nisam ih htio uzeti, imao sam apsolutno pravo."
0:47:09,0:48:09,Mislim da sam dvadeset šest godina da sam otišao u mirovinu pitanje je bilo danas što bi bilo od tebe da možda bi bio pred kakvim dućanom i pio pivo upravo to i mislim da je užasna stvar to što su što je država cijelu jednu generaciju odnosno to je negdje od šezdeset od šezdeset do sedamdeset g to su ljudi koji su znači devedeset pet imali od dvadeset pet do trideset pet godina znači najbolji i ja mislim da je užasna greška to da ne kažem zločin što su te ljude umirovili i uništili su svaki potencijal koji su tu ljudi imali jer ne prihvaćam to kad mi netko kaže da su branitelji ne znam ovakvi ili onakvi to nije točno puno su bolji nego oni koji su bježali i plovili po dalekim morima ali mislim da su uništena je čitava generacija jedna ljudi koja je mogla još jako puno da to udrže i te su vojne mirovine ustvari napravile veliku štetu jes Jas.
0:48:10,0:48:12,"Znači ljudima koji nemaju ruku, nogu, ekstremiteti."
0:48:12,0:48:14,To je druga priča.
0:48:16,0:48:26,"I to, ali dosta ljudi je propalo jer kad odete sa trideset godina u mirovinu, ne znaš više što bi radio čovjek dokoli čariš."
0:48:27,0:48:29,A iz dokoli se rađa koješ.
0:48:30,0:48:30,Tako je.
0:48:30,0:48:33,Kad imaš puno slobodnog vremena onda ti svašta padne na pamet.
0:48:34,0:48:38,Mi koji nemamo previše slobodnog vremena ne pada nam svašta na pamet.
0:48:39,0:48:40,Nama ne.
0:48:41,0:48:44,Ali ja mislim da i kažem ti opet teško mi je to suditi.
0:48:44,0:48:49,Ja sam osjetljiv sam na branitelje zato što sam vidio?
0:48:49,0:49:42,"Ima jedna odvratna, ima jedna odvratna, ima jedna odvratna fora, kaže gdje si bio devedeset jedan i to ima neki prizvuk kao pospratna pa za razliku od tebe jazavče koji je bio ženin spasuknija ili mami ili koji je pobjegao negdje bio sam tamo gdje ste trebali biti ne ja nego ti ne samo ja nego ti ljudi branitelji to znaš i to sam eksplodirao na ono kada je bio na vojnim mimohođo ejdaj to te se sjećam da je to bilo tlak znači mi smo bili ja kolegica dame i a grego je te bilo i odrađeni prostori sad dječki iz prve garde brigade koji se zna se znamo kao frend da imaš malo vode i sad ne znam da oni tamo procijenjuju vode i oni su izvan tog ograđenog prostora, a u tom ograđenom prostoru gdje mimochod paradi da je jedno trideset žena sa onim fasiklima, znaš ono kako bi rekao, onaj protokol, šta je to protokol da razumijem."
