Start (HH:MM:SS),End (HH:MM:SS),Segment
0:55:24,0:55:28,Kaže samo je stajao tamo ne znajući ništa o Bogu i plakao kao mala beba.
0:55:30,0:55:32,Rekao je da su mu oči bile zatvorene.
0:55:37,0:55:41,"Ne zna tko je molio za njega što se događalo, bio je samo izvan sebe."
0:55:46,0:55:49,Rekao je netko je došao i kratko se pomolio.
0:55:49,0:55:49,za njega.
0:55:55,0:56:00,I rekao je kao da je neka električna struja koja ga je preplavila.
0:56:03,0:56:04,I pao je na podu.
0:56:08,0:56:17,"I dok je ležao na podu, imao je, prisjetio se cijelog svog života."
0:56:17,0:56:19,Cijeli život je moj prošao pred očima.
0:56:21,0:56:23,I ovo je prvo sjećanje.
0:56:26,0:56:29,"Rekao sam, počeo se drogirati sa neki 12 godina."
0:56:31,0:56:34,Imao je rođaka koji je bio dealer.
0:56:37,0:56:39,I dealer je trebao više klijenata.
0:56:45,0:56:52,"I kad je imao 12 godina, njegov rođak ga je držao za glavu na podu i uštrcao mu prvu drogu."
0:57:00,0:57:01,Ovo je.
0:57:01,0:57:09,"Ovaj strašni, užasni ovisnik od droge je u stvari bio žrtva jednog čovjeka sa 12 godina kojeg je navukao."
0:57:12,0:57:27,"I onda svako sjećanje nakon toga, pljačkanje, seksualni odnosi, način na koji se potpuno uništio."
0:57:32,0:57:42,"Ovo mi je rekao, svaki put kada bi došlo iduće sjećanje, Bilo je zastrašujuće da se uopće moram suočiti s time."
0:57:45,0:57:57,"Ali svaki put kad bi taj osjećaj došao, bio bi preplavljen očevom ljubavlju."
0:58:00,0:58:03,"Kaže, uopće ne znam kako bi to objasnio."
0:58:05,0:58:06,Boli je bila stvarna.
0:58:10,0:58:14,Ali Božja ljubav i očeva ljubav je bila još stvarnija.
0:58:17,0:58:20,"Boli me rastvarala, rascijepala."
0:58:23,0:58:26,Očeva ljubav bi me ponovno sastavljala.
0:58:30,0:58:38,"Napokon kad sam izašao iz tog duhovnog iskustva, shvatio sam da sam druga osoba."
0:58:42,0:58:51,"Ono što u tom trenutku nije znao, da je na podu ležao osam sati."
0:58:55,0:59:22,"Kad se probudio, soba je bila prazna, njegova žena je sjedila u stolici do njega plakajući i domaćin je cijelo vrijeme dolazio i govorio moramo zatvoriti grad, pomogla je da se digne i zajedno su otišli kući."
0:59:24,0:59:28,"Poznajem ovog čovjeka, nisam ovo pročitao na internetu."
0:59:34,1:00:00,"Po meni ovaj čovjek nosi svjedočanstvo, on je svjedok i rekao mi je kome god budeš govorio moju priču, molim te reci im da imaju oca, oca koji ih voli."
1:00:03,1:00:25,"Oca koji ih razumije, oca koji ima suosjećanje za njihove slabosti i pogreške, oca koji će dati svakom čovjeku ono što mu je potrebno da bi se promijenio."
1:00:29,1:00:31,I oca koji uživa u njima.
1:00:35,1:00:36,On priča o tvojem ocu.
1:00:45,1:00:55,"Ako Bog može uzeti tu olupinu i pretvoriti ga u modernog svetca, možete učiniti s tobom."
1:00:58,1:01:01,Kažem ovo sa potpunim poštovanjem.
1:01:06,1:01:08,Moje pouzdanje nije u tebi.
1:01:11,1:01:13,Moje pouzdanje je u tvojem ocu.
1:01:18,1:01:19,Znam da te tvoj otac lju voli.
1:01:22,1:01:22,Razumije.
1:01:28,1:01:31,Znaš li da tvoj otac zna stvari o tebi koje čak niti ne znaš?
1:01:33,1:01:48,"Kada si bio mala beba, prvi put kad si se uplašio, prvi put kada je u školi nešto pošlo po krivu, možda ga se toga ni ne sjećaj."
1:01:50,1:01:52,Otac sve to zna.
1:01:57,1:02:00,I on će te sve bliže i bliže približavati sebi.
1:02:05,1:02:08,"Prijatelji, ovo je važno zbog dva razloga."
1:02:11,1:02:17,"Za ovaj trenutak zaboravite cijeli ostali svijet, ovo je bitno za tebe."
1:02:20,1:02:26,"Bog želi da budeš sretan, Bog želi da se osjećaš ispunjen."
1:02:30,1:02:32,Bog ti želi dati ljubav da bi bio potpun.
1:02:35,1:02:41,"Zaboravi ostatak svijeta govorim tebi, ovo je za tebe."
1:02:43,1:02:50,Isus je umro na križu da bi ti mogao upoznati svog Oca.
1:02:57,1:03:01,To je jako velika investicija s Božje strane da bi ga ti mogao upoznati.
1:03:03,1:03:10,Koštala je Isusa njegovog života da bi ti mogao doći k Ocu.
1:03:13,1:03:14,Ali postoji drugi razlog.
1:03:21,1:03:24,Ovdje nas je 630 od 650.
1:03:27,1:03:41,"Ostanite sa mnom jednu minutu, 650 muškaraca koji gore ljubavlju očevom."
1:03:49,1:04:34,"650 muškaraca kojiaca koji sami postaju znak nade ostatku slomljenog svijeta braćo postoje muškarci diljem svijeta koji umiru na zadnjem sjedištu nekoga auta koji su izgubljeni u svojim ovisnostima, o svojim patnjama, o svojim usamljenostima postoje ljudi koji su odustali."
1:04:39,1:04:42,U mojoj zemlji stopa suicida je otišla u nebo.
1:04:47,1:04:59,"Kao da je svijet izgubio sav razum, izgubio je srce jer misle da su izgubili oca."
1:05:04,1:05:46,"Ako u ovoj sobi večeras postoji šesto pedeset muškaraca kojima možemo početi vraćati istinsku poruku koliko drugih bi moglo biti spašeno, koliko drugih mogu pronaći nadu, koliko drugih mogu naći smisao života, vaši suradnici, neki članovi obitelji, neka starica koja živi u blizini, tko ne treba čuti ovu poruku."
1:05:52,1:05:54,"Svi govorimo Bože, pokaži nam svoju ljubav."
1:05:56,1:05:58,Možda ti ljudi govore istu stvar.
1:06:04,1:06:10,"Možda tvoj suradnik ili tvoj susjed u tišini svoga srca traži, čezne za tako nečim."
1:06:12,1:06:17,"A otac kaže, pokazat ću vam svoju ljubav."
1:06:24,1:06:27,"Imam šesto pedeset muškaraca u ovom trenutku, u jednom hotelu u Zagrebu."
1:06:28,1:06:32,Sve što trebam je da kaž kažu da.
1:06:35,1:06:38,Sve što od njih tražim je da otvore svoje srce.
1:06:41,1:06:46,"Jednom kad moja ljuba uđe u to srce, bit će promijenjeni."
1:06:51,1:06:54,Imaću 650 znakova nade.
1:06:58,1:07:00,Imaću još 650 pari ruku.
1:07:06,1:07:10,Imaću još 650 pari uši u koje će slušati va vapaj siromašnih.
1:07:15,1:07:20,Imaće još šesto pedeset srdaca koji će možda donijeti ljubav ranjenom svijetu.
1:07:24,1:07:26,Želite znak moje ljubavi u ovom svijetu?
1:07:27,1:07:28,Daću vam ga.
1:07:34,1:07:36,"Besplatno, radosno vam dajem svoje kraljevstvo."
1:07:41,1:08:00,Jeste li vi spremni prihvat biti starija braća drugima da i oni mogu iskusiti moju ljubav?
1:08:06,1:08:08,"Moram vam priznati, postoji jedna stvar s kojom se jako mučim."
1:08:13,1:08:15,Što je to djelo Božje milosti?
1:08:18,1:08:27,Kao što moj prijatelj koji umire u zadnjem sjedištu auta nije izrekao nikakvu posebnu molitvu.
1:08:29,1:08:30,On nije išao u crkvu.
1:08:32,1:08:33,Sve što je radio bilo je krivo.
1:08:36,1:08:38,Ali Božja milost je došla do njega.
1:08:40,1:08:48,"Na drugu stranu, mi smo sinovi oca."
1:08:52,1:08:54,Svako od nas ovdje je primio neku milost.
1:08:59,1:09:02,Možemo reći super hvala čaća i nastaviti dalje.
1:09:10,1:09:16,Nemamo li mi odgovornost za tu milost i to iskustvo koje smo primili i donesemo i drugima?
1:09:24,1:09:29,"Braća, da jedan od naše braće umre bez nade je tragedija."
1:09:34,1:09:41,Koja je uloga Božje milosti i koja je uloga naše odgovornosti?
1:09:46,1:09:50,Vjerujem da ima i pametnijih ljudi u ovoj dvorani koji bi nam to mogli objasniti.
1:09:52,1:09:54,Ali ovo je jedno od velikih otajstava života.
1:09:57,1:10:04,"Bog ima svoj posao, a i ti brate imaš svoj posao."
1:10:06,1:10:13,"Što to znači, kako to treba izgledati, kako to učiniti, koji je prvi korak?"
1:10:15,1:10:16,Ne znam.
1:10:18,1:10:30,Znam da počinje ovdje tako da svaki muškarac u ovoj sobi otvori svoje srce Bogu.
1:10:33,1:10:34,I otac je naš otac.
1:10:37,1:10:38,Pokazat će nam.
1:10:41,1:10:42,Malo će nas pogurati.
1:10:44,1:10:46,Možda će nas nekad morati ispravljati.
1:10:47,1:10:49,Možda će nas morati iscijeliti.
1:10:51,1:10:52,Osnažiti nas.
1:10:55,1:10:58,Bog želi da se tvoja obitelj spasi puno više nego ti.
1:11:00,1:11:01,I Bog zna kako to učiniti.
1:11:07,1:11:11,"sve od tebe što traži je da kažeš evo me ovdje sam, slobodan sam."
1:11:15,1:11:17,Tome dolazimo večeras.
1:11:23,1:11:36,Najjači aspekt transformiranja i preobrazbe čovjeka je znati i iskusiti da su voljeni.
1:11:38,1:11:39,To je univerzalno.
1:11:41,1:11:52,"Svi to trebamo, svi to želimo, mnogi od nas to ne znaju izraziti, to je u našem DNK."
1:11:57,1:12:06,U meni postoji potreba i želja da budem voljen i postoji želja u ocu da voli tebe.
1:12:11,1:12:38,"I predlažem da u večer se možda i pohrvamo sa samim sobom i postavimo si pitanje da li vjerujem da me otac voli, da li to samo govorim ili zaista to vjerujem u svom srcu."
1:12:46,1:12:48,Možemo pronaći ljude koji su ljuti na Boga.
1:12:50,1:12:51,Zašto si dopustio da se ovo dogodi?
1:12:53,1:12:55,Zašto je ova osoba morala umrijeti?
1:12:56,1:12:58,Kako to da sam izgubio svoj posao?
1:13:01,1:13:03,"Ako si ti moj otac, hajde napravi nešto."
1:13:10,1:13:13,Čak i to je otac spreman čuti i razgovarati o tome.
1:13:16,1:13:21,"Imamo savršenog oca, ali mi nismo savršeni sinovi."
1:13:23,1:13:29,"Što god je u vašim srcima večeras, stvar zaista nije bitno."
1:13:32,1:13:38,"Što god je u tvom srcu večeras, donesi to svom ocu."
