Start (HH:MM:SS),End (HH:MM:SS),Segment
0:00:04,0:00:05,Da li me možete čuti?
0:00:12,0:00:16,Istinski je čast mi biti ovdje s vama večeras.
0:00:26,0:00:31,Mnoge od vas sam mogao upoznati u mojim prijašnjim i našim prijašnjim avanturama.
0:00:32,0:00:35,Evo je kao da se jedna velika obitelj ponovno okupila.
0:00:38,0:00:47,I mislim da ovaj vikend dotičemo jednu jako ozbiljnu temu.
0:00:54,0:00:58,"Mislim da to utječe na sve nas osobno, na naše obitelji, na naše države."
0:01:02,0:01:04,I probat ćemo sad jednu moju šalu.
0:01:13,0:01:16,Isus sjedi na tronu u raju.
0:01:22,0:01:28,I u raju vidi hrpu vjernih njegovih ljudi koji već hodaju po raju.
0:01:33,0:01:38,I osjeti u srcu želju da želi pričati s muškarcima u raju.
0:01:44,0:01:48,Isus ustaje s trona i kaže svi muškarci dođite k meni.
0:01:52,0:02:02,I tisuće njih stoji oko njegovog trona i želi dati riječ o hrabrenju braći.
0:02:05,0:02:12,"Kaže muškarcima, vi ste bili pozvani biti veliki lideri."
0:02:18,0:02:21,Dana vam je hrabrost i snaga da vodite u novom smjeru.
0:02:22,0:02:28,Bili ste pozvani biti vođe i glave svoje obitelji.
0:02:32,0:02:40,"Dali smo vam mogućnost da vodite druge, ali posebno da budete vođa svoje obitelji."
0:02:48,0:02:54,"Svi oni muškarci koji su bili dobri vođe u svojoj obitelji, glava obitelji, neka odu na drugu stranu."
0:02:57,0:02:58,Niko se ne miče.
0:03:02,0:03:04,Isus kaže možda me nisu razumijeli.
0:03:14,0:03:20,"Dragi braćo, ako ste bili dobri voditelji obitelji, glava kuće, molim vas, odite na drugu stranu."
0:03:23,0:03:24,Nitko se ne miče.
0:03:31,0:03:37,"Napokon, jedan onako malo uplašeno odluči otići na tu drugu stranu i stane."
0:03:37,0:03:38,jedini u tu liniju.
0:03:41,0:03:49,"Isus ga želi sad malo ohrabriti, ode do njega i svi mogu čuti što se govori."
0:03:54,0:04:10,"Kažem, gospodo, evo nam voditelja, bio je snažan, bio je mudar, bio je hrabar, bio je glava svoje obitelji."
0:04:52,0:05:24,"razmišljao sam o matinoj temi koju je danas iznio o problemima i o muževnosti, o očinstvu, o situacijama obitelji i mislim da je pokrio mnogo jako važnih točaka i mogu reći da i u mojoj državi prolazimo kroz mnoge iste probleme u našim medijima, na televiziji."
0:05:27,0:05:29,Svi muškarci su idioti.
0:05:36,0:05:47,U svakoj reklami i u svakoj TV seriji muškarac je prikazan kao potpuni idioti i uvijek je žena ta koja spasi stvar.
0:05:51,0:06:01,U ovom trenutku u mojoj zemlji muškarci kao da se srame bilo šta reći i pričati o bilo čemu.
0:06:08,0:06:13,"I sve one točke koje je on izrekao, nažalost moram reći potpuno je u pravu."
0:06:28,0:06:42,"I već je izrečeno da naše razumijevanje muževnosti i biti muškarac je povezano sa razmišljanjem o tome da smo, kako izgleda očinstvo i kako izgleda stvari nebeski otac."
0:06:45,0:06:47,Postoji odnos između te tri stvari.
0:06:53,0:07:04,"Rekao bih da ne postoji samo kriza očinstva, postoji kriza razumijevanja tko smo mi kao muškarci."
0:07:10,0:07:42,Iako možda nekad nismo biološki roditelji uistinu ne razumijem tko smo i mislim da je veliki dio tog problema u našem odnosu sa Ocem nebeskim i vidim mnoge crkvene grupe i zajednice koje pokušavaju pomoći muškarcima da ponovno otkriju svoju muževnost.
0:07:46,0:08:06,"Znam jednu grupu sa jako dobrim namjerama Izađu s muškarcima vani i imaju logorsku vatru, puno popiju i počnu koristiti neprimjeren jezik."
0:08:16,0:08:20,Njihova teorija je da prvo moramo pristupiti muškarcima na takav način da bi ih pridobili možda.
0:08:28,0:08:33,I problem je što mi sami krivo identificiramo tko je muškarac.
0:08:40,0:08:46,Tvoja muževnost se ne očituje time koliko kuna možeš popiti i koliko psovke možeš izreći.
0:08:51,0:08:59,"Tvoja muževnost se očituje u tome da možeš biti Sin Božji i to je, prijatelji, istina."
0:09:06,0:09:10,"Što smo više u odnosu s našim Ocem, to više razumijemo tko smo."
0:09:18,0:09:24,Mislim da možemo imati dvije žalosti kada pričamo o Bogu Ocu.
0:09:35,0:09:43,Dobro smo čuli da kada imamo dobre uzore muške u našim životima da puno lakše možemo otkriti i shvatiti Boga Oca.
0:09:46,0:09:48,"I to je istina, to je točno."
0:09:50,0:09:51,Evo problema.
0:09:56,0:09:58,Nismo svi imali zdravog oca.
0:10:03,0:10:05,Neki uopće ne znaju tko je njihov biološki otac.
0:10:12,0:10:24,"I zato ponekad možemo reći nisam imao dobar odnos sa svojim ocem, zato nikad neću moći upoznat, ispoznat Boga Oca."
0:10:36,0:10:43,I postoji osjećaj izgubljenosti u našim srcima jer smatramo da taj odnos je izgubljen i ne možemo doći do njega.
0:10:48,0:10:50,Imam jako dobru vijest za vas.
0:10:57,0:10:59,Uopće mene zanima tko je vaš biološki otac.
0:11:02,0:11:04,Vaš istinski otac je Bog.
0:11:11,0:11:24,"Bog koristi naše očeve da budu kanali njegove milosti, ali očevi nisu jedini kanal te milosti."
0:11:33,0:11:37,I obećavam vam da Bog želi da vi upoznate njegovu ljubav.
0:11:40,0:11:42,Svi smo imali različita životna iskustva.
0:11:46,0:11:48,Ali Bog je isti i sada i uvijek.
0:11:51,0:11:53,On je tvoj otac.
0:11:58,0:12:02,"Bez obzira da li ti njega znaš ili ne znaš, on tebe poznaje."
0:12:10,0:12:14,"Po svetom pismu, on te poznavao već kada te sad kao u majčinoj jutrobi."
0:12:19,0:12:22,Bilo bi jako lijepo kad bi to spoznali i shvatili.
0:12:26,0:12:29,"Čak i ako se to ne dogodi, ništa se ne mijenja."
0:12:37,0:12:41,Sada ću reći nešto za što sam sto posto siguran da je istina.
0:12:43,0:12:48,"Mogu ovo reći bez ikakve sumnje, bez ikakvog propitivanja."
0:12:54,0:12:57,Bog stvarno je tvoj otac.
0:13:01,0:13:03,"Možda možeš u to vjerovati, možda ne."
0:13:06,0:13:07,Ali to ne mijenja istinu.
0:13:10,0:13:12,Stvarno Bog je tvoj otac.
0:13:13,0:13:22,"On te volite, brine o tebi, razmišlja o tebi."
0:13:27,0:13:32,"I kada dođeš do te spoznaje, sve se mijenja."
0:13:42,0:13:50,"Ali bez obzira bila ta spoznaja prije dvije godine, danas ili tek za pet godina, Bog je i dalje tvoj otac."
0:13:57,0:14:00,Bilo bi prekrasno da su nam stvari u životu išle pravim putem.
0:14:04,0:14:07,Ali stvari često ne idu kako bi trebale.
0:14:09,0:14:11,Ali Bog je tvoj otac.
0:14:20,0:14:25,"I nemoj misliti da zato što tvoj život nije bio savršen, da nemaš pristup od."
0:14:28,0:14:29,Jer Bog je tvoj otac.
0:14:33,0:14:35,Sjećate se priče o razmetnom sinu.
0:14:37,0:14:39,Živi sa svinjama u svincu.
0:14:39,0:14:41,Živi u blatu.
0:14:46,0:14:48,"Kaže, došla mu je u razum."
0:14:54,0:14:57,I okrenuo se i krenuo hodati nazad svome ocu.
0:15:06,0:15:11,"Pismo kaže: Dok je još bio daleko, otac ga je vidio i počeo trčati prema njemu."
0:15:15,0:15:16,Bog je tvoj otac.
0:15:22,0:15:26,I Bog želi napraviti sve da ti razumiješ da si ti njegov sin.
0:15:31,0:15:33,Bog ima neograničene resurse.
0:15:38,0:15:41,na ovaj ili onaj način pomoći će ti da to shvatiš.
0:15:45,0:15:47,Kada to prihvatimo mijenjamo se.
0:15:53,0:16:24,"Prije nekoliko godina bio sam na međunarodnom susretu u Jeruzalemu i bili smo tamo na susretu međunarodne katoličke karizmatske obka obnova je kret, crkveni pokret koji se jako fokusira na kretanje i aktivnost Duha Svetoga."
0:16:28,0:16:59,"Imali smo na tom susretu ljude iz svih dijelova svijeta, otprilike iz 120 različitih zemalja, bila je baš velika grupa, mladi ljudi, stari ljudi, muškarci, žene, svaka rasa, svaki jezik, bogati i siromašni, direktori, poljoprivrednici, svi."
0:17:05,0:17:10,I odlučili smo iskoristiti to vrijeme i dati da ti voditelji ispune jednu anketu.
0:17:14,0:17:16,Jedno od pitanja u toj anketi je bilo ovo.
0:17:21,0:17:29,"Kada iskusiš izljev Duha Svetoga, Što si točno iskusio?"
0:17:34,0:17:38,Bilo je zadivljujuće vidjeti koliko različitih odgovora smo dobili.
0:17:42,0:17:45,Neki su rekli da su osjetili ogromnu toplinu koja je bila nad njima.
0:17:49,0:17:51,Neki su rekli da su se počeli smijati od radosti.
0:17:54,0:17:58,Neki su rekli da su toliko duboko bili dirnuti da su počeli plakati.
0:18:01,0:18:03,ili doživljavati različite duhovne fenomene.
0:18:03,0:18:22,"Počeo sam imati vizije ili imati iskustva različitih od ostalih nadnaravnih fenomena, puno različitih odgovora, ali bila su dva koja su se pronašla gotovo kod svih."
0:18:26,0:18:27,Svi su napisali istu stvar.
0:18:36,0:18:56,"Broj jedan stvar koju su ljudi napisali kada su se otvorili, otvorili svoje živote Duhu Svetom, najviše toga što su napisali je iskusili su ljubav Boga Oca, iskusili su ju, doživjeli su ju."
0:18:59,0:19:06,"Nije bio koncept racionalniji u našem umu, nije bilo teološko razumijevanje."
0:19:09,0:19:11,Ne znam ni kako bih ga opisao.
0:19:18,0:19:22,"Kao da je bila jedna unutarnja spoznaja, unutarnje znanje."
0:19:27,0:19:30,Bog ih stvarno voli i oni su to znali.
0:19:33,0:19:50,"Drugi najčešći odgovor: kada sam otvorio svoje srce Duhu Svetom, iskusio sam Isusovo gospodarstvo nad mojim životom."
0:19:56,0:20:01,Njihovo razumijevanje osobe Isusa Krista je došlo na jednu veću razinu.
0:20:04,0:20:17,"Isus Krist je Gospodin kojeg trebamo slijediti, kojeg trebamo slušati, kojeg trebamo ljubiti i štovati."
0:20:20,0:20:22,Ali ovo sam ja naučio iz tog iskustva.
0:20:24,0:20:30,Možemo pričati i ići na neke nagovore i trebali bi.
0:20:33,0:20:44,"Možemo čitati knjige i trebamo ih čitati, ali sami Bog se želi objaviti tebi."
0:20:47,0:21:00,"Može za to iskoristiti knjigu, može iskoristiti govornika, može iskoristiti i čovjeka koji je tvoj biološki otac."
0:21:03,0:21:05,Ali iza svega toga je sami Bog.
0:21:09,0:21:18,"Ako ti misliš da ti želiš upoznati Boga, Bog to želi puno više nego što ti to želiš."
0:21:21,0:21:33,"Ako misliš da sada voliš Boga, Bog te voli beskonačno više nego što ti njega uopće možeš voljeti."
0:21:37,0:21:48,"govorim ovo zato što želim da imate nadu, čak i ako vaš cijeli život nije bio savršen, otac te traži."
0:21:52,0:22:03,Mislim da druga stvar koja obeshrabruje ljude su naše žalosti i naše stvari zbog kojih žalimo.
0:22:07,0:22:22,"Večeras smo ovdje i pričamo o tome kako je Bog velik, ali negdje u našim srcima mislimo, ali nitko ne zna što sam ja sve činio."
0:22:25,0:22:26,Počinio sam previše grijeha.
0:22:30,0:22:31,Ovo sam učinio krivo.
0:22:34,0:22:36,Toliko godina nisam išao u crkvu.
0:22:40,0:23:09,"Mislim da je Bog dobar, ali mislim da sam ja prije deset godina nešto drugačije učinio, možda bih upoznao oca, ali prije deset godina u mom srcu vrata su bila zatvorena, možda sam propustio svoju priliku."
0:23:12,0:23:14,Imam jednu stvar za reći večeras.
0:23:19,0:23:21,Bog stvarno je tvoj otac.
0:23:25,0:23:31,"Iako su u prošlosti vrata tvojeg srca bila zatvorena, večeras nisu."
0:23:34,0:23:36,Bog ne gleda na svoj sat.
0:23:40,0:23:44,Došao sam ti u milosti prije pet godina i ti nisi bio spreman.
0:23:49,0:23:56,"Ja sam Bog, jako sam zaposlen i ako sad nećeš prihvatiti kod tvoje, to nije vaš otac."
0:23:59,0:24:01,Vaš otac je jako strpljiv.
0:24:05,0:24:08,Tvoj otac je jako strpljiv s tobom.
0:24:12,0:24:15,I on razumije ljudsko srce.
0:24:21,0:24:25,Jer njegov prvorođenac je Bog i čovjek.
0:24:35,0:24:41,Bog je poslao svog sina Isusa k nama da bude jedan od nas kako bi nas vratio kocu.
0:24:45,0:25:15,"Ako si griješnik, ako si u životu učinio glupe stvari i ako si u nekom trenutku si zatvorio vrata svog srca, ti si savršeno dijete za kojim otac trči, ti si savršen kandidat da bi veličao očevo ljubav."
0:25:16,0:25:18,Dakle postoji nada.
0:25:22,0:25:40,"Nema puno nade u ljudima, ali u Ocu imamo mnogo nade, snaga njegove ljubavi, njegov integritet, njegovo milosrđe, njegova velikodušnost."
0:25:44,0:25:53,Ne postoji čovjek u ovoj sobi večeras koji se može diskvalificirati iz Božje ljubavi.
0:25:56,0:25:57,Taj čovjek ne postoji.
0:26:00,0:26:07,"Možete misliti da ste vi taj čovjek, ali mogu vam reći, vi to niste."
0:26:14,0:26:25,I razlog zašto to mogu reći je zato što poznajem tvojeg oca i on te voli i jako je ponosan na tebe.
0:26:31,0:26:36,"I bez obzira na sve tvoje pogreške, na sve glupe stvari, i dalje si njegov sin."
0:26:41,0:26:44,I molim te da večeras doneseš jednu odluku.
0:26:46,0:26:47,Možda samo za ovaj vikend.
0:26:51,0:26:52,Prihvati ovo kao istinu.
0:26:57,0:26:59,Bog u istinu je tvoj otac.
0:27:05,0:27:14,"I po djelovanju Isusa i po djelovanju Duha Svetoga, ovo može postati stvarno u tvojem životu."
0:27:16,0:27:23,"Ne teorija, ne neka filozofska konstrukcija."
0:27:27,0:27:30,Ovo može postati ona prava jezgra tvojeg života.
0:27:34,0:27:48,"Gospodo, želio bih vam predložiti Bez obzira da li svijet to može artikulirati, izreći ili ne, svi traže svoga oca."
0:27:51,0:27:52,Cijeli svijet je u potrazi.
0:27:54,0:27:59,"Mnogi to ne znaju, ali on to zna."
0:28:06,0:28:16,I Bog je pripremio ovaj vikend razmišljajući o tome kako će vas cijelo vrijeme približavati sebi.
0:28:22,0:28:27,"Želim vam postaviti pitanje, nemojte naglas odgovarati, zadržite to za sebe."
0:28:28,0:28:29,Evo pitanje.
0:28:37,0:28:40,Što je po vašem mišljenju glavna poruka Evanđelja?
0:28:49,0:28:57,"Zadržite to za sebe, uzmite si trenutak i u srcu promislite o čemu stvari Evanđelje govori."
0:28:59,0:29:00,Promislimo o tome.
0:29:11,0:29:17,Zanimljivo je da kad postavim to pitanje dobijem jako zanimljive odgovore.
0:29:21,0:29:25,Većina njih kaže Evanđelje je o tome da svi trebamo ljubiti jedne druge.
0:29:30,0:29:34,Drugi kažu glavna poruka Evanđelja je biti dobri prema siromašnima.
0:29:37,0:29:45,"To jesu elementi Evanđelja, ali rekao bih da to nije cijela tema Evanđelja."
0:29:49,0:29:56,Glavna tema Evanđelja je objava Isusa Krista.
0:29:59,0:30:01,Isus je centar evangelija.
0:30:05,0:30:16,"A glavna poruka Isusa nije da hranimo siromašne, budemo dobri jedni prema drugima i uživamo."
0:30:21,0:30:36,Glavna Isusova poruka jest Bog je tvoj otac i vjerujem da postoje jako mudri odgovori ovdje večeras.
0:30:44,0:30:49,Pogledajte sva četiri evanđelja i prebrojte koliko puta Isus govori o Ocu.
0:30:57,0:31:03,"Kada počneš razmišljati o tome i gledati, tek onda shvatiš koliko Isus uistinu govori o Ocu."
0:31:05,0:31:20,"Naprimjer, Svi smo čuli onu parabolu ako te sin zatraži jaje, zar ćeš mu dati kamen?"
0:31:27,0:31:31,"Dijete ti traži ribu, a ti ćemo dati štipavca."
0:31:36,0:31:38,"Možeš učiniti bolje od toga, ti možeš učiniti bolje od toga."
0:31:40,0:31:41,I mi smo grešnici.
0:31:47,0:31:53,"Ako mi želimo biti bolje od toga, koliko tek Bog otac želi biti iznad toga."
0:31:57,0:32:05,"Evo nešto što je rekao u Evanđelju po Luki, jedna rečenica, mijenja život."
0:32:12,0:32:12,Ne bojte se.
0:32:19,0:32:22,Svidjelo se ocu vašemu dati vam kraljevstvo.
0:32:27,0:32:38,"Isus ne kaže moj otac, tvoj otac, tvoj otac, tvoj otac."
0:32:38,0:32:40,Priča tebi o našem ocu.
0:32:47,0:32:50,"Zanimljivo je, svidjelo se ocu vašem."
0:32:54,0:32:57,Nitko ne može prisiliti Boga da bude dobar prema tebi.
0:33:01,0:33:06,"Mislite li da Bog razmišlja, evo opet mog sina, što sad želi?"
0:33:09,0:33:11,Taj uvijek upada u nevolje.
0:33:13,0:33:15,Sad će doći i izreći koju molitvu.
0:33:18,0:33:20,Taj mali me čini ludim.
0:33:26,0:33:29,Mislite li da stvarno otac na taj način razmišlja o vama?
0:33:31,0:33:33,To je jako nepravedno.
0:33:36,0:33:43,Morate se ispričati svom ocu jer to nije ono tko je vaš otac.
0:33:48,0:33:51,"On se nikada, ali nikada ne umara slušati vas."
0:33:54,0:34:12,"I čak i ako pokušavamo biti dobrim ljudima i dalje radimo gluposti i dalje činimo pogreške, i neki od nas čak ponekad počine neki grijeh."
0:34:15,0:34:17,"Mislim da to niste vi, ali par nas."
0:34:21,0:34:23,I opet naš otac nas voli.
0:34:30,0:34:35,Bog nije rekao ako zavrneš očevu ruku da će ti dati kraljevstvo.
0:34:38,0:34:40,Evo ti kraljevstvo samo odlazi odavde.
0:34:44,0:34:47,"Svidjelo se ocu, učinilo ga je sretnim."
0:34:53,0:34:59,I u Starom zavjetu otac će plesati u svijetu svojih sinova.
0:35:03,0:35:04,Otac će zaplesati.
0:35:04,0:35:07,"Evo, evo, evo, evo, dobro je."
0:35:14,0:35:17,Dobro je.
0:35:17,0:35:18,Dobro je.
0:35:19,0:35:21,Imam prijatelje koji znaju plesati.
0:35:31,0:35:34,Otac uživa kad ti dolaziš k njemu.
0:35:34,0:35:35,On uživa u tebi.
0:35:40,0:35:42,Uživa u tome da ti daje.
0:35:42,0:35:42,Što ti daje?
0:35:49,0:35:51,On ti daje puninu Božje kraljevstva.
0:35:55,0:36:01,"Sve što ti je potrebno, on ti daje slobodno."
0:36:01,0:36:05,I mnogo stvari koje želimo daje nam besplatno.
0:36:07,0:36:08,Reći ću vam kratku priču.
0:36:13,0:36:15,Jednom sam posudio svoj očeva auto.
0:36:16,0:36:20,I išao sam na jedan molitveni susret.
0:36:23,0:36:24,"I bilo je jako, jako daleko."
0:36:30,0:36:35,"I kad sam došao tamo, skužio sam da je tank gasa skoro prazan."
0:36:37,0:36:40,"I razmišljao sam, neću stići kući."
0:36:44,0:36:47,Provjerio sam Jacob džepove i shvatio da ima svega para dolara.
0:36:53,0:36:57,Možda je bilo dovoljno za jedan ili dva litre benzina.
0:37:04,0:37:09,"Gledao sam ispod sjedala od auta da li ima nešto novca, našao sam, ali sam bio očaja."
0:37:14,0:37:17,"vozio bi jako, jako sporo da sačuvam nešto benzina."
0:37:22,0:37:26,"Zato što nisam mogao kupiti hranu i benzin, nisam ništa jeo cijeli dan."
0:37:31,0:37:35,"I bilo jako hladno, ali nisam htio uključiti grijanje jer bi trošilo još benzina."
0:37:39,0:37:42,Vozim se kući jako sporo i smrznavam se od hladnoće.
0:37:44,0:37:44,Bilo je užasno.
0:37:49,0:37:52,I onda sam se u jednom trenutku sjetio jedne stvari koju mi je otac rekao.
0:38:00,0:38:06,"Rekao mi, uvijek drži nešto malo dolara sa strane u slučaju da ti gorivo nestane."
0:38:08,0:38:10,Otvorio sam ovu jednu malu ladicu.
0:38:12,0:38:14,Bilo je puno novca u vratima.
0:38:24,0:38:25,Cijeli dan sam se vozio.
0:38:25,0:38:28,"gladan, smrzavao se, a unutra je bila hrpa novca."
0:38:31,0:39:01,"Stavio sam na prvu benzinsku, napunio sam auto do kraja, a onda sam u restoranu pojeo jedan veliki obrok, cijelo vrijeme zahvaljujući ocu što je ostavio novce, ali svi to radimo, svi prolazimo kroz život nadajući se da ćemo nekako izdržati."
0:39:09,0:39:14,A Bog ti želi i uživa u tome da ti da kraljevstvo.
0:39:23,0:39:27,Svaki muškarac ovdje ima isti pristup kraljevstvu.
0:39:33,0:39:40,"U svom pristupu, u svojoj mudrosti Bog svakog od nas tretira zasebno, posebno, individualno."
0:39:49,0:39:54,"Nema veze što je Bog otac, to ne znači da ćeš baš pronaći milijun eura u svom autu večeras."
0:39:57,0:39:59,"Ako nađete, dođite i recite mi."
0:40:00,0:40:02,Možete mi možda počastiti večerom.
0:40:06,0:40:25,"Ali braćo, sve što vam, doslovno sve što vam treba je potrebno da živite sretan i ispunjen život vam je već dano od Oca."
0:40:28,0:40:30,Kako to mogu reći sa toliko sigurnošću?
0:40:33,0:40:39,"Ne znam vaše životne situacije, ali poznajem Oca."
0:40:42,0:41:12,"On je obasjen svjetlošću, on je veličanstva, potpuno briljantan, genijalan i on je jako darežljiv prema svojim dječkima."
0:41:24,0:41:25,Zašto?
0:41:27,0:41:28,Zato što je Bog tvoj otac.
0:41:41,0:41:52,Kroz vrijeme pronalazimo da ono što mijenja čovjekovo život je da ga dodirne Božja ljubav.
0:42:00,0:42:03,Želim vas uvjeriti i nadam se da idete u crkvu.
0:42:05,0:42:19,"Dobro je moliti, trebate se truditi živjeti dobrim životom, ali čak i ako to ne radite, Bog je i dalje tvoj otac."
0:42:24,0:42:27,Želim ispričati jednu priču o čovjeku koji je upoznao svog oca.
0:42:35,0:43:05,"Prije mnogo godina upoznao sam jednog čovjeka koji je bio jako uključen u život svoje katoličke župe, bio je u zboru, bio je skupljao milostinju, čitao je na misama, pričao je sa djecom, ovo je bio crkva u jednom čovjeku, sve radio, jako snažan i predan čovjek."
0:43:11,0:43:57,"Bio sam jako impresioniran, bio je odličan čovjek i rekao mi nisam uvijek bio ovakav i onda je zasukao svoje rukave pokazao sve ožiljke na svojim rukama od injekcija od droge imao je između 11 i 13 godina kada je počeo se drogirati I drogirao bi se i uštrcao drogu u vene dok ona ne bi pukla."
0:44:00,0:44:07,I onda je počeo u vene u prepunama dok ona nisu puknula.
0:44:09,0:44:10,"Onda u noge, u stopala."
0:44:14,0:44:17,I onda je čak uštrcao drogu u oči.
0:44:21,0:44:23,Potpuno izgubio posao.
0:45:03,0:45:08,I ne mogu ti objasniti ni što su drugi učinili meni samo da bi mi dali novce.
0:45:12,0:45:13,U tom trenutku je već umirao.
0:45:20,0:45:23,"Živi u Arizoni, to je sada jedna država koja ima jako toplu klimu."
0:45:28,0:45:32,I u jednom velikom gradu bio je jedan napušteni auto iza jedne zgrade.
0:45:37,0:45:39,I umirao je na zadnjem sjedalu tog auta.
0:45:44,0:45:47,Izgubio je otprilike 60 kg tjelesne mase.
0:45:49,0:45:50,Bio je čisti kostur.
0:45:53,0:45:56,Izgledao je kao beba sklopčana na zadnjem sjedalu.
0:45:58,0:45:59,I umirao je.
0:46:02,0:46:04,Maknut ćemo njega sa strane na minutu.
0:46:07,0:46:08,U drugom dijelu države.
0:46:14,0:46:22,njegova žena je radila posao da bi uzdržavala njihovo troje djece i bila jako ljuta žena.
0:46:25,0:46:26,Mislim da razumijemo zašto.
0:46:35,0:46:41,Njen bijes i ljutnja su se kao otrov širili i na njen posao i u obitelj i u prijateljstvo.
0:46:45,0:46:58,"Jednog dana suradnica joj je rekla na poslu, večeras ću ići na jedan program u crkvu, hoću li ići sa mnom?"
0:47:00,0:47:09,"Pitala ju je što radite na tom programu, pjevamo pjesme, razgovaramo o Bogu."
0:47:11,0:47:20,"Žena se nasmijala i rekla, mislim da Bog ne želi čuti ono što bi mu ja htjela reći."
0:47:21,0:47:25,"Ona je rekla, pa samo dođi."
0:47:27,0:47:34,"Žena su otišla na sastanak, stajala je na kraju crkve jako ljuta."
0:47:39,0:47:51,"Netko je tijekom molitve na glas izrekao Netko je ovdje večeras tko umire od ljutnje, od bijesa."
0:47:55,0:47:59,Žena se okrenula prijateljici i rekla je šta si im rekla da dolazim.
0:48:03,0:48:05,"Ne, ovo se stalno događa, stvarno."
0:48:10,0:48:15,"I rekli su, ako si ovdje večeras, molimo te da se pomolimo za tebe."
0:48:19,0:48:24,I usprko svojim osjećajima izašla je van i dopustila je da se pomolimo za nju.
0:48:27,0:48:30,Tog dana je primila jedan nevjerojatan dar.
0:48:36,0:48:39,Dobila je mogućnost da može oprostiti svome mužu.
0:48:41,0:48:42,To je bio nadnaravan dar.
0:48:45,0:48:47,Ali onda je otišla još jedan korak naprijed.
0:48:50,0:48:52,Ljudi koji su molili za nju su rekli ovo.
0:48:58,0:49:02,Osjećamo da Bog govori i želi da ga nađeš.
0:49:04,0:49:06,Rekla je to neću učiniti.
0:49:09,0:49:12,"Oprostit ću mu, ali me uopće ne zanima hoćemo se više ikad vidjeti."
0:49:14,0:49:25,"I oni su rekli, ovo je ono što otac želi od tebe."
0:49:29,0:49:33,I zbog te jedne rečenice nešto se promijenilo u njenom srcu.
0:49:42,0:49:58,I rekla je da je u tom trenutku osjetila da ju preplavljuje očeva ljubav ne samo za nju nego i za njenog muža i počela je ići okolo i tražiti svog muža.
0:50:01,0:50:21,"Otišla je prvo u mjesta gdje budu droge raši, otišla je u striptiz klubove, pokazivala njegovu sliku i rekla je bilo jako ponižavajuće."
0:50:27,0:50:30,ali toliko ga je volila da ga je odlučila pronaći.
0:50:32,0:50:44,"Nakon tjedana potrage, jedan barmen Šankar je vidio sliku i rekao, a znam tog čovjeka."
0:50:48,0:50:53,"Rekao je živi negdje u središtu grada na zadnjem sjedalu auta, napuštenog."
0:50:59,0:51:02,Naš prijatelj je na zadnjem sjedalu auta umire.
0:51:13,0:51:21,"Na autu nema nikakvih prozora, sva elektronika je počupana, unutra su štakori i on leži na zadnjem sjedalu i umire."
0:51:24,0:51:35,Gubi svijest i vidi kako ruka prolazi kroz zadnji prozor.
0:51:37,0:51:39,i dolazi na njegovu glavu.
0:51:43,0:51:58,"I glas govori, Bog te voli, ja te volim, došao sam ti pomoći, odveš ću te kući."
0:52:01,0:52:05,Bila je to žena i onda je potpuno izgubio svijest.
0:52:08,0:52:13,"Nekoliko dana kasnije se probudio, bio je u bolnici."
0:52:18,0:52:20,I onda su ga doveli nazad kući.
0:52:24,0:52:26,I pomalo se počeo oporavljati.
0:52:32,0:52:33,"Bilo je jako, jako teško."
0:52:36,0:52:37,Žena ima troje male djece.
0:52:42,0:52:46,"I ne kuži gdje mu je točno glava, o čemu točno razmišlja."
0:52:52,0:52:56,"I osjeća Božju ljubav za njega, ali ne želi ponovno ući u odnos muža i žene."
0:52:59,0:53:04,"Dopustila mu je da ostane u kući, odlazila bi na posao."
0:53:12,0:53:17,"I dok je ona bila na poslu, on je krao stvari iz kuće, prodavao ih da bi mogao kupiti drogu."
0:53:20,0:53:24,Jednog dana žena se vratila i rekla mu je.
0:53:29,0:53:33,želim da dođeš na jednu od ovih molitvenih službi sa mnom.
0:53:35,0:53:37,Rekao neću učiniti ništa takvog.
0:53:40,0:53:42,Rekla mu je stvarno mislim da bi trebao.
0:53:48,0:53:53,"I rekao je, tad je shvatio da ako kaže ne želim ići na to, mogla bi me izbaciti iz kuće."
0:53:55,0:53:56,Odlučio je onda otići.
0:54:00,0:54:03,Ona je naprijed jako usudna.
0:54:04,0:54:05,On je od traga.
0:54:07,0:54:09,Vjerojatno je malo pod utjecajem droga.
0:54:12,0:54:13,I smijava se sa svima.
0:54:18,0:54:21,"Gleda, kaže, ovo vidi svi, mašete rukama, baš te ludi."
0:54:27,0:54:29,"Ja imam izgovor, ja sam na drogama."
0:54:29,0:54:30,Koji je vaš izgovor?
0:54:35,0:54:37,Samo ih je smijavao i stvarao probleme.
0:54:40,0:54:41,Večer se bližila kraju.
0:54:44,0:55:05,"Netko je izašao naprijed i rekli su i rekao ako je ovdje večeras, tko me je potrebno da spozna da ga Bog voli, neka izađe naprijed, molit ćemo za njega."
0:55:12,0:55:17,"Kaže usprko svemu što je razmišljao, potrčao je tamo plačući kao beba."
