Start (HH:MM:SS),End (HH:MM:SS),Segment
0:00:01,0:00:04,Hvaljeni su svi Marija i pozdrav svima.
0:00:05,0:00:26,"Drago mi je da bar ovako možemo biti zajedno iako se stvarno radujem kad će ova crkva opet biti puna i kad ćemo zajedno slaviti Gospodina i poslije se družiti, ali evo Bogu hvala i na ovoj tehnici i ovim mogućnostima koje nam je Gospodin providio da i u ovim trenucima budemo zajedno."
0:00:27,0:00:29,Pa evo hvala gospodinu.
0:00:31,0:01:02,"Kao što je Nikola već najavio, večeras ćemo nastaviti sa ciklusom predavanja po knjizi Katolicizam Roberta Barona i ne znam koliko se sjećate, prošlo je već dosta vremena od našeg zadnjeg susreta, Mišao je imao prvo poglavlje, on nam je izlagao prvo poglavlje ove knjige koja je zapravo osmišljena kao jedno putovanje kroz našu vjeru, kao jedno dublje upoznavanje naše vjere, ali na jedan mističan način."
0:01:03,0:01:34,"I ne znam kako ste vi doživjeli to prvo predavanje, ali ja osobno kad sam čula naslov teme i o čemu će se raditi, tema je bila objava Boga koji je postao čovjekom i nekako se svi mislimo pa dobro, to znamo, to je neki temelj i nešto najvažnije u našoj vjeri, a opet nekako sam otišla s tog susreta kao da sam naučila nešto novo i to je ono što je kod naše vjere toliko posebno što je naša vjera doista živa."
0:01:35,0:01:53,"Naše crkve su žive, naša tradicija je živa, liturgija, Isusova riječ je živa i uvijek ima nešto novo, uvijek ima nešto dublje i uvijek nas može iznenaditi i zato nikad ne smijemo prestati upoznavati i saznavati više o našoj vjeri."
0:01:57,0:02:08,"To prvo poglavlje se, kao što sam već rekla, zvalo Objava Boga koji je postao čovjekom, ali je imala i jedan dodatak prije, zapanjeni i prestrašeni."
0:02:09,0:02:16,i to je ono što je Isus donio kad se objavio kao Bog.
0:02:17,0:02:26,I takvim zapanjenim i prestrašenim nama je potreban nauk da bi mogli razumjeti i da bi ga mogli naslijedovati.
0:02:27,0:02:38,"I to je naše današnje poglavlje Isusova učenja, a ima prije dodatak, sretni smo mi i stvarno smo sretni što imamo Isusov nauk."
0:02:40,0:02:53,Isusove riječi i njegovo naučavanje su istodobno bili i jednostavni i bogati sadržajem i bile su fascinirajuće njegove riječi i bile su ponekad izbunjujuće.
0:02:54,0:03:06,"naprimjer na jednom mjestu Isus kaže ljubi bližnjega svoga kao samoga sebe, a na drugom kaže ako ne zamrzite oca i majku niste mene dostojni i zato je potrebno poznavati u potpunosti Isusov nauk."
0:03:07,0:03:20,I njegove riječi ono što je on donio naučavajući je u najdoslovnijem smislu promijenilo svijet tada kada je izrečeno i mijenja ga dan danas i mijenjat će ga uvijek.
0:03:21,0:03:31,I ne znam da li ste ikad razmišljali na taj način koliko je zapravo bilo revolucionarno to što je Isus govorio i koliki je zapravo bio učinak i u povijesti.
0:03:33,0:03:54,"Ne znam jesmo li ikad razmišljali na način da li bi došlo do recimo ukidanja ropstva da nije bilo Isusovog nauka o bezuvjetnoj ljubavi prema bližnjem, koliko je potencijalnih progoniteljaja zaustavljeno sa Isusovom rečenicom tko je bez grijeha nek baci prvi kamen, koliko puta čujemo i neke ateiste da se pozivaju na te riječi."
0:03:55,0:04:25,"Isusov nauk je duboko utisnut i odzvanja u povijesti, koliko je možemo ići i malo užer, koliko je srca utješeno sa Isusovim riječima o liljenima koji niti se muče niti predu, a odjeveni su ljepše nego Salomon u svojoj najvećoj slavi, koliko je velikih svjedočanstva, koliko je oprosta, pomirbi, koliko je ograzlih u grijehu se vratilo Bogu po prispodobi o izgubljenom sinu."
0:04:27,0:04:32,Isusove riječi doslovno donose revoluciju i mijenjaju svijet.
0:04:34,0:04:40,"Gdje god su bile slušene Isusove riječi, one su duboko preobražavale i donosile su istinu."
0:04:41,0:04:55,"I mi svi znamo kad neke stvari su jednostavno svijet nas uči o jednoj drugoj logici, međutim Isusove riječi kao da sjede na naše srce i kao da naša nutrina zna da je to istina."
0:04:57,0:05:04,I Isusovo propovijedanje je bio najviši aspekt njegova djelovanja.
0:05:04,0:05:18,"Narod ga je naravno pratio zbog njegovih djela i zbog njegovih čudesa, ali narod je bilo potrebno naučavati i zato se i vrlo često u Evanđelju ponavlja ta rečenica i Isus je poučavao mnoštvo."
0:05:19,0:05:28,Učenici su u to vrijeme napamet učili njegove riječi i prenosili njegove izreke i zato smo mi danas sretni što imamo njegov nauk.
0:05:29,0:05:54,"I možda najjasnije svjedočanstvo o snazi Isusovih riječi je upravo onaj događaj iz Evanđelja kada je nakon Isusovog takozvani tvrdog govora velik broj odstupio od njega i tada Isus pita svoje najbliže učenike da li će i oni otići od njega, a Petar mu odgovara gospodine kome da idemo, ti imaš riječi života vječnoga."
0:05:56,0:05:59,Oni su znali da su njegove riječi život i da su istina.
0:06:01,0:06:30,"I kad govorimo o Isusovom nauku, možda bi bilo najprekladnije da započnemo sa Isusovim govorom na gori, odnosno Matejevo Evanđelje i ako bi iz govora na gori mogli izdvojiti dio koji bi možda najzornije i najsažetije prikazivao Isusovo Evanđelje,je odnosno Evanđelje u malom, vjerujem da bi se većina teologa složila da su to blaženstva."
0:06:32,0:06:46,"I bilo mi je zanimljivo kad sam slušala ciklus predavanja Don Damira Stojića o blaženstvima, on je u uvodu rekao kako puno radi sa studentima, evo puno je vas i studira i neki od nas su studirali."
0:06:48,0:07:08,"Znamo da kad počinjemo nešto učiti uvijek svaki predmet ima neku veliku skriptu i jednostavno kao da je teško počet od te velike skripte i onda se uvijek nađe neki student koji to skrati, pa onda dođe do drugog studenta koji to još skrati i sve se na kraju svede na nekih par stranica sažetka."
0:07:09,0:07:22,"I naravno da ne smijemo tako promatrati sve to pismo, ali kada bismo odnosno kada bismo trebali sažet bit Isusovog učenja to bi bila svakako blaženstva."
0:07:25,0:07:31,"Kada je Isus izrekao blaženstva, on se popeo na goru, sjedao i stao poučavati."
0:07:32,0:07:46,"I taj njegov način je židove, a i simbolično je i podsjeća na Mojsija koji se također popeo na goru kada je iznio narodu deset Božjih zapovijedi."
0:07:48,0:07:59,"I Isus također donosi zakon, donosi konačni zakon koji je u drugčijem obliku, ali zanimljivo da je puno stroži od ovog Mojsijevo."
0:08:00,0:08:03,Isus je rekao da nije došao dokinuti nego ispuniti zakon.
0:08:04,0:08:22,"Međutim, ono što Isus ovdje donosi, Mojsije je donio jedan niz stvari koje ne smijemo raditi, a Isus donosi, donosi, donosi jedan zapravo niz uputa za sretan i blagoslovljen život."
0:08:23,0:08:28,"I to je ono što je Isus, možemo tako reći, donio novo i otkrio."
0:08:29,0:08:41,"Znači, narod je do tada živio pod zakonom i nisu bili svjesni da živeći taj zakon, da iza toga zapravo stoji sreća i blaženstvo i radost."
0:08:42,0:08:56,"I na drugom mjestu u Evanđelju Isus isto kad se obraća pismoznancima i farizejima kaže ja o vama pismoznanci i farizeji licemjeri, zaključavate kraljevstvo nebesko pred ljudima, sami ne ulazite, a ne date učin i onima koji bi htjeli."
0:08:57,0:09:03,"Jer zakon nije bio prezentiran ljudima kao nešto što donosi sreću, nego kao nešto što sputava."
0:09:04,0:09:18,"A Isus donosi u drukčijoj formulaciji taj konačni zakon, oblikuje ga kao recept za sreću, ali zapravo puno strože od ovih deset Božjih zapovijedi."
0:09:18,0:09:19,Zašto?
0:09:19,0:09:23,"Zato što on govori o srcu, o motivima i nakanama srca."
0:09:25,0:09:38,"I on započinje taj govor sa blaženi, a grčka riječ je makarios što znači sretni odnosno radosni i čak u prevodu je to radost koja se odnosi više na božanstvo."
0:09:38,0:09:46,Znači on započinje taj govor blaženi i zapravo nam daje do znanja da je moguće da budemo potpuno radosni.
0:09:47,0:09:50,I u Ivanovom Evanđelju također to govori.
0:09:50,0:09:55,To sam vam govorio da moja radost bude u vama i da vaša radost bude potpuna.
0:09:56,0:10:09,"I sad kad promatramo tu radost koju on navještava i zakon koji zapravo donosi odnosno on donosi jedan niz zakonitosti, najizgled se isključuju i najizgled su kontradiktorni."
0:10:09,0:10:31,"I ključ toga leži upravo u poimanju slobode koja je kod nas odnosno koja je u svijetu iskrivljena, a Isus donosi nešto novo, donosi revoluciju opet po tom pitanju jer svijet nas uči da je sloboda izbor bez ikakvih ograničenja."
0:10:32,0:10:41,"A biblijski sloboda je oblikovanje naših težnji da dobro, da činiti dobro postane najprije moguće, a zatim i lako."
0:10:43,0:11:04,"Kako bismo to mogli bolje razumjeti, ako promatramo recimo nekog izvrsnog sportaša ili glazbenika u trenutku recimo svog koncerta ili na utakmici, oni su u tome odlični, a čini se da to rade s takvom lakoćom i da su toliko slobodni i da što god da naprave da će uspjeti, da će ispasti dobro."
0:11:06,0:11:11,"Ali iza te slobode stoji mukotrpan rad, stoje velika odricanja i žrtve."
0:11:12,0:11:16,I tako je isto i u ovom moralnom duhovnom svijetu.
0:11:17,0:11:32,"U početku to doista treba biti jedan niz ograničenja, zato je prvo moj svijet donosi deset Božjih zapovijedi i onda kada ustrajemo u tome, kada oblikujemo svoje težnje i čežnje, e onda to postane radost."
0:11:34,0:11:56,"I naravno redost je od blaženstva i način na koji ih je Isus donio je naravno savršen i nije slučajan, ali naš pisac Robert Barom kad razlaže blaženstva on ih je podijelio na ajmo reći pozitivne i negativne formulacije."
0:11:57,0:11:58,Što mislim reći s tim?
0:11:59,0:12:15,"Pozitivne u smislu logično je da je blažen odnosno sretan makarios netko tko je čistog srca i netko tko je milosrdan, ali nije baš logično da je sretan netko tko je ožalošćen, netko tko je gladan i žedan, koji je siromašan."
0:12:16,0:12:27,I prva takva pozitivna formulacija bi bila blago milosrdnima oni će zadobiti milosrđe.
0:12:28,0:12:36,Hebrejski hesed odnosno milosrdan znači oproštenje i vjernost i označava Božju najznačajniju osobinu.
0:12:38,0:12:41,I zato je i ovaj princip možda i najteži.
0:12:42,0:12:54,Zato što da bi bili milosrdni zahtjeva da smo spoznali da smo doista bez Boga nitko i ništa i da je sve što primamo od Boga potpuno nezasluženo.
0:12:54,0:13:02,I kad spoznamo to nekako je prirodno da ćemo biti milosrdni i prema drugima.
0:13:03,0:13:11,Naravno mi ipak težimo tome odnosno pošto smo stvoreni na sliku i priliku Božju mi smo po svojoj naravi usmjereni Bogu.
0:13:11,0:13:17,Sveti Augustin kaže za sebe si nas stvorio Bože i nemirno je srce naše dok se ne smiri u tebi.
0:13:18,0:13:25,Znači da bi naš duhovni rast trebao ići ka toj najznačajnjoj Božjoj osobini da postanemo milosrdni.
0:13:29,0:13:36,"Iduća pozitivna formulacija je blago čistima srcem, oni će Boga gledati."
0:13:37,0:13:46,To znači da ćemo biti doista sretni i blaženi onda kada u našem srcu neće biti nikakve nejasnoće vezane uz to što je najvažnije.
0:13:48,0:13:56,I ovaj princip odnosno ova zakonitost je jako teška jer je puno stroža od dobrih djela.
0:13:57,0:14:05,Tiče se nakane s kojom radimo neka djela i to je ono što će zapravo biti najvažnije jednom kada dođemo pred Boga.
0:14:05,0:14:13,"Niti veličina naših djela, niti kako se to činilo u očima drugih nego ono što je bilo u našem srcu."
0:14:15,0:14:20,Jedina ispravna nakana je ugoditi Bogu i izvršiti volju Božju.
0:14:21,0:14:25,I drugi dio ide oni će Boga gledati i.
0:14:25,0:14:33,"I zapravo samo kad imamo takvu čistu nakanu u srcu, samo tada možemo i vidjeti volju Božju."
0:14:33,0:14:35,Zato kaže oni će Boga gledati.
0:14:37,0:14:43,"Naravno mnogi interesi i čežnje mogu biti okupljeni oko te, ali se nikad ne bi smjele natjecati s njom."
0:14:46,0:14:54,"Dalje imamo blaženstvo pozitivne formulacije, blago gladnima i žednima pravednosti oni će se nasititi."
0:14:56,0:15:10,"Postoje različite glaveadi u našim životima, glad za ostvarenjem, glad za uspjehom, materijalna glad, glad za financijskom sigurnošću, glad za ljubavlju, za moći, za uspjehom."
0:15:11,0:15:37,"Međutim, kod svakoga od nas postoji jedna vrhovna, glavna glad koja zapravo upravlja ovima drugima i ona se može očitovati u našim djelima i zapravo ako promotrimo stvarno svoje očekivanja od života, primjerice Hrvatske prirodno je i normalno i ispravno da imamo čežnje za nekakvim uspjesima i postignućima."
0:15:38,0:15:48,"Međutim, ono što takve gladi donose jest da ako su one glavne gladi u našim srcima, nikad nećemo biti nasičeni."
0:15:49,0:15:59,"I to je možda jedna od najjasnijih dokaza da vječnost postoji, to da doista ništa nas na ovom svijetu ne može ispuniti."
0:16:00,0:16:14,"Recimo krenemo u školu, tu se od nas očekuje neki uspjeh, postignemo neki uspjeh, upišemo nekakav fakultet koji smo htjeli, završimo taj fakultet i nakon svake te stepenice kao da ostane neka praznina."
0:16:15,0:16:19,"A ovo je nešto veliko što sam iščekivao, ali nisam ispunjen."
0:16:20,0:16:23,"I onda ide nekakav idući, idući, idući i nijedan ne donosi ispunjenje."
0:16:24,0:17:01,"Evo ja osobno baš sam na jesen diplomirala i nekako kroz cijeli studij, vjerujem da vi svi studenti ćete se složiti sa mnom, kuda nam se to čini kao nešto veliko, nedostižno i maštamo o tom nekom danu, o tom nekom olakšanju koje će onda doći u uspjehu, možda i nekom statusu u društvu i dođe taj dan i prođe i idući dan već novi izazovi, ne promijeni se ništa previše i samo ti se učvrsti onaj osjećaj da stvarno samo je Bog vrijedan i Bogu hvala ako to shvatimo nakon svakog tog razočaranja."
0:17:01,0:17:03,Promatramo i glad za novcem.
0:17:04,0:17:16,"Obično znamo da većina ljudi kojima je vrhovna glad za novcem, ta krajnja glad, nikad im nije dovoljna, uvijek traže još."
0:17:18,0:17:27,I ovo blaženstvo kaže blagogladnim ženama pravilnosti oni će se nasititi i samo oni će se nasititi.
0:17:28,0:17:33,Jedina glad koja će biti nasičena i koja će nas ispuniti je upravo glad za Božjom voljom.
0:17:34,0:17:35,A što je Božja volja?
0:17:36,0:17:38,"Božja volja je naša pravednost, naša svetost."
0:17:43,0:17:48,"I ako je bilo koja druga glad krajnja, mi ćemo biti nesretni i neispunjeni."
0:17:51,0:17:59,"Četvrto i zadnje blaženstvo pozitivne formulacije je blago mirotvorcima, oni će se sinovima Božjim zvati."
0:18:00,0:18:12,"I zanimljivo da je ovo jedino mjesto u svetom pismu gdje se koristi ta riječ mirotvorac, ali se to ne odnosi na nekakvu ajmo reći političku i društvenu mirovnu misiju."
0:18:13,0:18:19,"I možemo promatrati, zanimljivo je da Isus na drugom mjestu kaže nisam došao donijeti mir nego mač."
0:18:20,0:18:27,"I Isus je došao donijeti istinski mir, ali je došao i ukloniti i lažni mir u koji često upadamo."
0:18:27,0:18:36,"I zapravo mirotvorac, mogli bismo reći da je to onaj koji je spreman žrtvovati svoj mir radi istinskog mira."
0:18:38,0:18:49,"Pravi istinski mirotvorac bio je recimo Blaženje Lloyds oblažen je Lojze Stepinac koji nikako nije imao miran život niti je mirno završio, ali je nosio mir drugima."
0:18:49,0:18:53,Mirotvorac nosi Kristovu istinu pod svaku cijenu.
0:18:53,0:19:00,"To ne znači nužno izbjegavati konflikte, sukobe i biti mirotvorac onako koliko to svijet pojma."
0:19:00,0:19:03,To znači žrtvovati svoj mir radi istine.
0:19:06,0:19:11,To su oni koji se nisu postidjeli i zato se Bog neće njih postidjeti.
0:19:11,0:19:13,Zato će se oni sinovima Božjim zvati.
0:19:16,0:19:25,I imajući na umu ove pozitivne formulacije blaženstva možemo s većim razumijevanjem preći na ove ajmo to reći negativne formulacije.
0:19:26,0:19:56,"I jedan od temeljnih problema u duhovnom redu kod ljudi je taj što mi u sebi imamo upisanu i osjećamo veliku glad za Bogom, ali je pokušavamo zadovoljiti s nekakvim svjetovnim dobrima i svetom akvijom I sveti Toma Akvinski je rekao da postoje četiri tipične zamjene kojima čovjek pokušava otažiti tu glad, a to su bogatstvo, užitak, moć i čast."
0:19:58,0:20:06,I vidjet ćemo ove četiri negativne formulacije blaženstva se upravo odnose na te četiri zamjene.
0:20:07,0:20:11,Prvo je blagosiromasima duhom njihovo je kraljevstvo nebesko.
0:20:13,0:20:24,"Treba naglasiti da ovo nije nekakvo romantično gledanje na ekonomsko siromaštvo, niti je nekakvo demoniziranje bogatstva, nego ovo je jedna formula nenavezanosti."
0:20:26,0:20:31,"I postoje dvije riječi, dvije grčke riječi za siromaha."
0:20:32,0:20:34,"Jedna je pnez, a druga je ptokos."
0:20:35,0:20:41,Ova riječ pnez označava siromaha koji živi od danas do sutra.
0:20:41,0:20:45,"Znači oskudijeva, ali ipak uspjeva preživjeti dan za danom."
0:20:45,0:20:47,Nema nikakvu financijsku sigurnost.
0:20:49,0:20:53,ali ima dostatno ajmo reći za taj dan.
0:20:53,0:20:56,"Nažalost, jako puno ljudi i danas živi oko nas."
0:20:58,0:21:17,"Međutim, postoji druga riječ, to je onaj siromah koji prosi i kojemu je doslovno fizička egzistencija upitna i čiji život ovisi o tome što će taj dan dobiti kao milostinju od prolaznika i to je riječ koja se ovdje koristi."
0:21:19,0:21:30,Znači mi moramo biti potpuno svjesni svoje bijede i toga da smo doista bez Boga nitko i ništa i da ovisimo u potpunosti o njegovoj milosti.
0:21:32,0:21:42,"Problem je što smo mi često pred Bogom kao ovaj pnez, uspjevamo koliko toliko sami i onda kad shvatimo da nam je stvarno teško onda se obraćamo Bogu."
0:21:43,0:21:50,"A ovo je potpuna nenavezanost i potpuno oslanjanje na Gospodina, svjesni da smo bez njega nitko i ništa."
0:21:51,0:21:59,I Kraljevstvo Božje je krajnja briga onog koji je takav kao prosjak pred Bogom i zato će on i zadobiti Kraljevstvo Božje.
0:22:00,0:22:02,Po onom zakonu tražite i naći ćete.
0:22:05,0:22:10,Iduće je blago ožalošćenima oni će se utješiti.
0:22:11,0:23:05,"Ni ovo ne znači da je sreća ako smo stalno žalosni i da trebamo biti stalno žalosni, već ovo isto je jedna vrsta formule nenavezanosti, znači da smo neovisni o dobrim raspoloženjima i onaj koji je neovisan na te osjetilne ugodnosti može bez pridržaja slijediti volju Božju čak i kada ona donosi nekakvu patnju, a uvijek donosi patnju jer mi naslijedujemo Krista raspetog i mi možemo provesti čitav život u nekakvom blagostanju ali nekakvu patnju ćemo nositi, nositi ćemo možda nekakve tuđe težine, patnje, prolaziti različite kušnje i napasti jer Isusova riječ da je uzak i trnovit put je doista istina."
0:23:06,0:23:19,I oni koji su zasićeni svjetovnim mužicima i kojima je sreća ovdje na ovom svijetu ne trebaju Boga i ne trebaju njegovu utjehu.
0:23:20,0:23:25,I opet kao što je bilo i ovdje kod gladnih i žednih pravednosti samo oni će se nasjetiti.
0:23:25,0:23:30,I isto blago žalosjenima oni će se utječiti samo utješiti i samo oni će se utješiti.
0:23:31,0:23:34,Samo Bog je prava utjeha.
0:23:35,0:23:49,"I to žalovanje zapravo je naravno uslijed naše pale naravi, uslijed grešnosti i moglo bi se shvatiti i na način našeg stava prema grijehima našim i tuđim."
0:23:50,0:23:57,"I grčka riječ koja se ovdje koristi je penthontes, to je žalovanje kad ti netko najdraži umre."
0:23:58,0:24:06,"Spominjalo se u Svetom pismu u Starom zavjetu, to je žalost koju je jako osjećao kada je mislio da mu je sin Josip umro."
0:24:08,0:24:14,"Znači, takvo treba biti naše srce, naš stav pokajanja zbog naših grijeha."
0:24:18,0:24:25,I iduće blaženstvo je blagokrotkima oni će baštiniti zemlju.
0:24:27,0:24:32,I to je isto jedna od tih revolucionarnih i kontradiktornih stvari koje Isus donosi.
0:24:33,0:24:35,Kako odnosi kako netko tko je krotak može baštiniti zemlju.
0:24:36,0:24:46,Da li je moguće da to bude nečiji plan za osvajanje nekakve moći i u biti nekakve države da osvaja neku zemlju?
0:24:46,0:24:49,Blago krotkima oni će baštiniti zemlju.
0:24:51,0:25:03,I tu vidimo koliko Isus zapravo u ovakvim stvarima vidimo koliko Isus zapravo našu ljudsku i logiku svijeta pokazuje koliko je zapravo kriva.
0:25:05,0:25:09,To se odnosi na nenavezanost na svjetovnu moć.
0:25:10,0:25:32,"I kako zapravo znamo da je to možda jedna od najjačih napasti, u Matejevom Evanđelju kad Đavao napastuje Isusa, napastuje ga prvo za osjetilni užitak, da stvori kruh, napastuje ga na oholost, da kaže anđelima da ga predrže, da iskuša Boga i na kraju mu pokazuje kraljevstva svijeta i nudi mu ih."
0:25:32,0:25:36,"Znači kad nije uspio na ove dvije napasti, on ga napastuje na moć."
0:25:38,0:25:43,I Mate implicira da je traženje moći zapravo najjače od svih napasti.
0:25:45,0:25:51,Evo di je to isto dosta dobro i slikovito prikazano u gospodaru prstenova.
0:25:51,0:26:04,"Od svih, od svog prstenja najjaču moć je imao taj prsten moći i ako ste gledali film i svi dobri i loši likovi koji bi ga pogledali bi bili na taj trenutak zavedeni."
0:26:05,0:26:17,"I tu je baš dosta zorno prikazano, bolje je uopće se kloniti svake želje za moći i priznanjem jer će nas sigurno zavest."
0:26:22,0:26:29,Iduće blaženstvo i zadnje je blago progonjenima zbog pravednosti njihovo je kraljevstvo nebesko.
0:26:30,0:26:33,To bi bila nenavezanost na čast i na priznanja.
0:26:34,0:26:42,"Spremni, to bi značilo da je sretan i blažen onaj koji je spreman biti pogrđen, ismijan i neprihvaćen od drugih."
0:26:43,0:26:49,"Čast sama po sebi nije loša ako je ona zastava vrline, ali je loša ako je sama sebi svrha."
0:26:51,0:27:06,I Tom Akminski je također rekao da ako želimo vidjeti savršeno ostvarenje blaženstva da trebamo pogledati Krista raspetoga i da trebamo prezreti sve što je on prezreo na križu i ljubiti ono što je on ljubio na križu.
0:27:07,0:27:11,I to je isto jedan veliki naizgled paradoks naše vjere.
0:27:11,0:27:18,"Blažen, istinski radostan i sretan Isus na križu, Isus raspet."
0:27:19,0:27:20,Kakav je bio?
0:27:20,0:27:34,"Bio je čistog srca, imao je čistu nakanu slijediti očevu volju, bio je milosrdan, umro je čak i za one koji neće prihvatiti njegovu žrtvu, umro je dok smo mi još bili u grijehu za nas."
0:27:36,0:27:54,"Bio je krotak, dao se zarobiti, dao se odvesti na križ, raspet i bio je progonjen zbog pravednosti, zbog istine koju je donosio, bio je gladan i žedan pravednosti, naše pravednosti, naše svetosti, našeg posvećenja."
0:27:56,0:27:57,I što je on ljubio?
0:27:59,0:28:08,"Ljubio je očevu volju i samo tako, potpuno nenavezan ju je i mogao izvršiti."
0:28:10,0:28:15,I to je jedna od revolucija isto koju donosi Isusov nauk.
0:28:16,0:28:29,"Ako dalje promatramo ono što je novo i veliko Isus donio, to bi bio taj put nenasilja i to radikalnog nenasilja na koje nas Isus poziva."
0:28:32,0:28:42,"Na jednom mjestu Isus kaže čuli ste da je rečeno ljubi svoga bližnjega, a mrzi neprijatelja, a ja vam kažem, ljubite neprijatelje, molite za one koji vas progone."
0:28:43,0:28:51,"I Isus tu zapravo navješćuje jednu novu, potpuno radikalnu i nesebičnu ljubav prema bližnjemu, ljubav koju se ne može zaslužiti."
0:28:52,0:29:00,"I ta ljubav koju on donosi je zapravo agape, odnosno božanska ljubav."
0:29:00,0:29:04,On nas poziva da možemo i da ljubimo tako kao što je on ljubio.
0:29:05,0:29:15,"On zapravo kasnije kaže da ne ljubimo, da ako ljubimo samo one koji nas ljube, on kaže za to isto ne čine i pogani."
0:29:15,0:29:25,I on zapravo tom rečenicom razotkriva to korisno ljublje i zapravo prikriveni egoizam koji se jako često prikriva i za ljubavi.
0:29:26,0:29:30,"Ljubi i ostani uz nekoga samo kad ti je dobro, to je ono što svijet uči."
0:29:31,0:29:40,"A Isus donosi jednu revoluciju u ljubavi, kaže da to isto ne čine i pogani, a mi smo pozvani biti svjetlost i sol u ovom društvu i u ovom svijetu."
0:29:41,0:29:48,"On nas poziva da ljubimo onako kako i Bog ljubi, a Bog ljubi tako da daje da sunce izlazi i dobrima i zlima."
0:29:50,0:29:53,"Kažem onda dalje, čuli ste da je rečeno oko za oko zub za zub."
0:29:54,0:29:56,"A ja vam kažem, ne opirite se zlomu."
0:29:57,0:30:01,"Naprotiv, pljusnajte tko po desnom obrazu, okrenimo i drugi."
0:30:02,0:30:10,To pravilo oko za oko i zub za zub je postojalo kako bi se na neki način ograničio nagon za odmazdom.
0:30:11,0:30:17,Jer nekako je ljudski i logično da ako nam se nanese nekakvo zlo i nekakva uvreda da vraćamo istom mjerom.
0:30:18,0:30:21,"Pa ide barem da vratimo istom mjerom, a ne više od toga."
0:30:22,0:30:22,To je ljudski.
0:30:23,0:30:24,A Isus donosi.
0:30:24,0:30:30,"A ja vam kažem, ne opirite se zlome, pljusnite li se tko pod desnom obrazom, okrenimo i drugi."
0:30:32,0:30:42,"Nama ljudima odnosno ljudski bi postoje dva načina na kojima mi reagiramo na uvredu, na nasilje i to su borba i bijeg."
0:30:44,0:30:57,"Borba znači ustani za uzmi se za sebe, vrati istom mjerom, ne daj na sebe, ljudska logika da vraćamo zlo za zlo ili drugi način je bijeg."
0:30:58,0:31:10,"Znači spasi sebe, ne izlaži se to ono izbjegavanje konflikata i sukoba i sve je to nekako logično, ali Isus nudi nešto novo, on nudi nešto više."
0:31:11,0:31:14,"On nas uči da se, da ne uzmićemo."
0:31:16,0:31:17,I što je zapravo u srži toga?
0:31:18,0:31:30,On nas uči da mi signaliziramo onome koji nas vrijeđa odnosno napadaču da mi jednostavno ne prihvaćamo taj skup pretpostavki koje su uopće učinile da nasilje bude moguće.
0:31:32,0:31:39,I na taj način za nama je zapravo stalo i do onoga koji nam nanosi zlo.
0:31:40,0:31:49,"Znači cilj tog Isusovog načina nije samo zaustaviti zlo, nasilje i uvredu nego i preobraziti onoga koji nam nanosi zlo i uvredu."
0:31:50,0:31:54,I tu vidimo koliko je Isus zapravo mislio na svaku osobu.
