Start (HH:MM:SS),End (HH:MM:SS),Segment
0:31:55,0:32:15,"Ima jedan primjer iz života Svete Majke Terezije kada je došla sa gladnim djetetom u lokalnu pekaru i tražila je nešto za dijete i taj pekar ju je pljunuo u lice i ona mu je rekla hvala vam na ovom daru za mene, a možete li sad dati nešto za dijete?"
0:32:16,0:32:21,I u toj zgodi vidimo zapravo pravo ostvarenje tog Isusovog nauka.
0:32:22,0:32:27,Njoj je u tom trenutku bilo više stalo i do pekara i do djeteta nego do vlastitog obraza.
0:32:31,0:32:37,Kad govorimo o Isusovom nauku ne možemo a ne dotaći se prispodoba.
0:32:37,0:33:00,"I sad opet naravno svaka, sve što je Isus, svaka riječ koju je Isus rekao je bila jako važna, ali pošto smo ograničeni s vremenom da možemo izdvojiti jednu najvažniju prispodobu, najznačajniju ajmo to tako reći, vjerujem da bi se većina odlučila na ovu prispodobu o izgubljenom sinu odnosno milosrdnom mocu."
0:33:01,0:33:01,Zašto?
0:33:01,0:33:15,"Zato što tu Isus najjasnije donosi izvješće si izveštaj o portretu i naravi Boga Oca, kakav je odnos Boga Oca prema nama, ali i razotkriva naš odnos prema Bogu."
0:33:16,0:33:28,"I puno nas se više puta sigurno našlo u ulogama obojice sinova, a možda premalo u ulozi oca."
0:33:29,0:33:37,"Taj mlađi sin, on predstavlja jedan krivi način postupanja s Bogom, kalkulantski, proračunat i koristoljubiv."
0:33:38,0:33:46,"On, mlađi sin dolazi pred oca sa jednom grubošću i preuzetnošću i kaže oče daj mi dio dobara koji mi pripada."
0:33:47,0:33:52,I svi znamo da se dobra ne nasljeđuju dokle god je otac živ.
0:33:52,0:33:57,Znači on na neki način poručuje svom ocu ne mogu dočekati da umreš.
0:33:59,0:34:04,"Ili manje grubo ne trebaš mi u životu, trebaju mi tvoja dobra, ali ne trebaš mi ti."
0:34:05,0:34:13,I on zapravo vrijeđa velikodušnost svoga oca i tretira nešto što je potpuno nezasluženi dar kao svoju svojinu.
0:34:14,0:34:16,I to i mi često radimo.
0:34:17,0:34:30,"I otac mu daje dio njegovih dobara i on dalje odlazi u daleku zemlju, a grčka riječ za daleku zemlju koja se ovdje koristi je hora makra što znači velika praznina."
0:34:31,0:34:40,I doista svi i koji jesmo pokušali naći sreću bez Boga i koji to pokušavaju uvijek neminovno nailaze na veliku prazninu.
0:34:42,0:34:52,I mlađi sin doživljava svoje dno i Bog to dopušta zato što zna da je to jedini način da mu se vrati.
0:34:52,0:35:04,"I on na svom dnu kada je ostao bez dobara prihvaća posao najamnika koji treba hraniti i brinuti o svinjama što je bilo nepodnošljivo, nedostojno za jednog Židova."
0:35:05,0:35:11,"I tek kada ostaje bez materijalnih dobara on se sjeća oca, tek kada mu je loše."
0:35:11,0:35:14,I dalje on ima u srcu krivi motiv.
0:35:15,0:35:19,"Koliki najamnici oca mojega imaju kruha na pretek, a ja ovdje umirem od gladi."
0:35:20,0:35:38,"I on se odlučuje vratiti kući i dok se približavao svom ocu, otac potpuno odbacuje svaki obzir, svaku konvencionalnost, svaku kalkulaciju, svaku ljudsku pravdu i trči sinu u susret."
0:35:40,0:35:51,"I to što je on trčao je isto jako značajno jer se tad smatralo za jednu za jednog patriarha, za jednog oca, glavu obitelji, da on ne ide nikome ususret nego da njemu dolaze."
0:35:52,0:36:02,"Ali otac trči svom sinu, stavlja mu prste na ruku, što znači da obnavlja zajedništvo s njim, stavlja mu obuću na noge, što znači da mu vraća dostojanstvo."
0:36:03,0:36:14,"I kad sin već započinje svoj, isto, već unaprijed pripremljeni, izvježbani, pogradnički govor, otac ga ne želi niti saslušat, nego pripravlja slavlje."
0:36:16,0:36:27,I tu nam Isus donosi portret Boga Oca i ruši svaku mišljenje da je otac netko strog i netko tko ne mara i za nas je netko tko nam neće oprostiti.
0:36:28,0:36:34,Ne traži ljudsku pravdu i odštetu već ljubi i oprašta svakom i raduje sa svakom svom djetetu.
0:36:36,0:36:49,I s druge strane imamo starijeg brata i često se događa da mi na početku svog puta s gospodinom budemo mlađi sinovi i onda se s vremenom pretvaramo u ovog starijeg.
0:36:50,0:37:04,"On je blizu ocu u fizičkom smislu, znači mogli bi reći na neki način redovito moli, slavi blagdane, tu je ajmo reći smatra se pobožnim, a u srcu i u duhu je daleko od oca."
0:37:05,0:37:10,I nakana i njegovog srca se također očituje iz njegovih riječi.
0:37:10,0:37:14,Toliko ti godina služim i nikada ne prestupih tvoju zapovijed.
0:37:15,0:37:18,Toliko ti godina služim i nikada ne prestupih tvoju zapovijed.
0:37:19,0:37:28,Znači on zapravo vidi se da on radi kao rob i ne djeluje iz ljubavi i zato i ne zna koliko toga mu je besplatno i na raspolaganju.
0:37:29,0:37:31,I tako i mi ponekad živimo.
0:37:32,0:37:34,Gladni pokraj cijelog obilja.
0:37:35,0:37:48,"I zbog te laži o zaslugama on se i ne zna radoma zbog svog brata jer s obzirom da sam vjeruje da prima ljubav i naklonost od oca zbog svojih djela, ne može prihvatiti da bi netko to primio bez djela."
0:37:49,0:37:58,"I zapravo vidimo da kod obojice postoji taj iskrivljena slika ljubavi, a otac ruši tu sliku kod obojice."
0:37:58,0:38:07,"On starijem sinu govori možda jednu od najljepših rečenica u Novom zavjetu, Sinko, ti si uvijek sa mnom i sve moje tvoje je."
0:38:10,0:38:14,"Bog nam se daje cijeli i duhom i tijelom, sve moje tvoje je."
0:38:17,0:38:20,Samo što mi često ne znamo prihvatiti taj dar.
0:38:23,0:38:26,I onda kada ga prihvaćamo onda možemo postati kao otac.
0:38:31,0:38:39,Nadalje ono što je novo i ono što Isus donosi kao jednu revoluciju u svom nauku je i odnos prema bližnjemu.
0:38:41,0:38:58,"U situaciji kada je jedan rabin upitao Isusa koja je najvažnija od svih zapovijedi, a bilo ih je tada u židovskom narodu preko šest stotine, Isus mu tako jednostavno odgovara ljubi Gospodina Boga svoga svim srcem, svom dušom i svim umom svojim."
0:38:59,0:39:01,To je najveća i prva zapovijed.
0:39:02,0:39:06,"Druga je ovo je slična, ljubi svoga bližnjega kao sebe samoga."
0:39:07,0:39:22,"Rabije pitao Isusa koja je najvažnija, ne koje su najvažnije dvije, a Isus svejedno govori, druga je ovo je slična, ljubi svoga bližnjega kao sama sebe, kao da želi nam dati do znanja da jedna bez druge ne idu."
0:39:23,0:39:26,"O te dvije ovisi sav zakon, kaže dalje."
0:39:27,0:39:35,I tu Isus na neki način govori da apsolutna ljubav prema Bogu nije u nadmetanju sa radikalnim davanjem za drugoga.
0:39:36,0:39:50,"I taj problem navozenosti na čovjeka i na ljudsku ljubav je veliki problem, ali ne rješava se tako da se odmičemo od drugih, rješava se tako da se približavamo Bogu i to nam Isus ovdje želi poručiti."
0:39:51,0:40:44,"I gdje zapravo u Evanđelju više nego i gdje možemo vidjeti Isusovo objašnjenje, to je u Matejevom Evanđelju dvadeset pet glava posljednji sud kad će isus razlučiti svoje stado na ovce i jarce tada će reći onima sebi s desna dođite blagoslovljeni oca mojega primite u baštinu kraljevstvo pripremljeno za vas od postanka svijeta jer o gladnijih i dadoste mi jesti oženjih i napojiste me stranac bih i primiste me gol i zaogrnute me obolijeh i pohodiste me u tamnici bih i dođo ste k meni I onda kaže ovima drugima, onda se oni pitaju kad su oni to učinili, a on im odgovara, zaista kažem vam što god učinili ste jednome od ove moje najmanje braće, meni učinili ste."
0:40:46,0:41:04,"I onda ovima s lijeva kaže, odlazite od mene, prokleti u oganj vječni, pripravljen đavlu i anđelima njegovim, jer o gladnijih i ne dadost ste mjest i o ženijih i ne dadost ste mi piti, stranac bijah i ne primiste me, gol i ne zaogrnu ste me, bolestan i u tamnici i ne pohodi ste me."
0:41:04,0:41:08,I oni se pitaju kada to nisu učinili dobro djelo Isusu.
0:41:09,0:41:15,On im kaže zaista kažem vam što god ne učinite jednoj me od ovih mojih najmanjih ni meni ne učinite.
0:41:16,0:41:32,"I vjerujem da se ne može dogoditi da čujemo ovaj tekst a da ne budemo malo uplašeni jel taj dio često šteka, nekako kao da se zatvorimo u ovu svoju osobnu pobožnost i zanemarimo ovo."
0:41:34,0:41:39,"Ali ovdje se radi prije svega o ljubavi prema Bogu, a ne u nekakvim humanitarnim djelima."
0:41:40,0:41:47,"Jer Bog nije jedno među bićima, nego je on temelj i smisao svakog bića."
0:41:48,0:42:06,"I postoji jedan čovjek koji se upravo ovim djelom iz Evanđela, ovom djelu iz Evanđela posvetio svoj život i on je u dosrži ga i razumio i želio ga primijeniti na društvo i na svijet."
0:42:06,0:42:12,"I to je bio Peter Morin, SUD suosnivač katoličkog radničkog pokreta u Americi."
0:42:13,0:42:47,On je rođen u Francuskoj u obitelji s dvadeset tri djece i bio je jako fasciniran i nadahnut sa franjevačkom pobožnošću i kad se franjska vlada okrenula protiv crkve on se ocelio u kanadu i tu je dvadeset godina živio strogo siromaštvo po zahtjevima franjevaca ne znam koliko ste upoznati ali franjo je zagovorovarao takvo siromaštvo da doslovno ništa svoj nisu imali.
0:42:47,0:42:55,Taj dan bi zaradili za hranu i za prenočište i tako bi živjeli iz dana u dan i donosili su Božju riječ i tako je i on živio.
0:42:56,0:43:22,"Uglavnom ono za što se on borio, on je se borio za to da se razvije jedna dosljedna katolička, ekonomska, društvena i politička teorija koja bi bila oblikovana prema ovom dvadeset pet glavi matematičkog evangelija Evanđelja i on je proučavajući socijalni nauk Crkve naišao u enciklici Rerum Novarum Pape Leona trinaest na ovo."
0:43:24,0:43:31,"Kada su jednom potrebe nužnosti i vlasništva zadovoljene, ostatak onoga što netko posjeduje pripada siromašnima."
0:43:33,0:43:43,"Tom Akvinski također ga kaže, iako je vlasništvo nad privatnom svojinom dopušteno upotreba privatne svojine uvijek bi trebala biti usmjerena na opće dobro."
0:43:44,0:44:17,I on je zajedno sa Doroti Dey doista se u to vrijeme borio za takav nauk i oni su osnovali taj katolički radnički pokret i takozvani Kuću gostoprimstva koja se kasnije nazvala Kućom svetog Josipa i proširilo se po cijeloj Americi i po cijelom svijetu i to su bile kuće koje su primale siromahi gdje su oni mogli primiti i materijalna dobra i duhovna dobra.
0:44:18,0:44:39,"I ono za što se on također zalagao, tada je u Americi postojao taj jedan termin go getters, odnosno kao idi i uzmi u smislu ono, uspi, uzbori se za sebe itede i on je razvio u tom svom nauku koji je osmislio pojam go givers, idi i daj."
0:44:41,0:44:55,"I ono što je, što je važno kod ovog je da Peter Morin, a recimo on je Sveta Majka Tereza, oni nisu bili neki najprije humanitarci, oni su prije svega bili pobožni ljudi koji su ljubili Boga."
0:44:57,0:45:06,"I to je ono, na taj način trebamo promatrati odnos prema bližnjemu, ljubiti Boga u bližnjemu."
0:45:06,0:45:11,I to je jedna velika novost koju Isus donosi kada to govori.
0:45:14,0:45:18,"Na što nas sve upućuju ovaj, ovaj Isusov novi nauk?"
0:45:19,0:45:24,"Isus nas poziva na obraćenje, obratite se jer približilo se Kraljevstvo Božje."
0:45:25,0:45:34,"Riječ obratiti se grčki meta iza i nous um, iza uma, odnosno poziva nas da idemo dalje od svoga uma."
0:45:35,0:45:42,"Evo vidjeli smo koliko je sve ono što je nekako nama ljudski logično, Isus nas poziva na nešto drugo, na nešto više."
0:45:43,0:45:56,"I s dolaskom Kraljevstva Božjeg mi moramo promijeniti svoje stavove, moramo promijeniti svoje mišljenje i pogled na svijet i u svijetlu toga promijeniti načine koji postupamo."
0:45:56,0:46:05,I cijelo Isusovo učenje je ovoj novoj viziji i ovoj novom poziva upravo na promjenu.
0:46:06,0:46:10,I sretni i blaženi smo mi jer smo pozvani na to novo.
0:46:12,0:46:14,I to bi bilo sve za večeras.
