Start (HH:MM:SS),End (HH:MM:SS),Segment
0:48:49,0:49:01,"Jer to što si rekla, jako puno je tu nakupljenog, stresa, frustracija, neodgovorenih potreba, koje onda jednostavno moraju u okrilju sigurnosti doma, gdje zapravo dijete se osjeća sigurno, to onda mora izaći van."
0:49:01,0:49:02,To su one situacije.
0:49:03,0:49:05,"Ja ću vode, neću u tu čašu, ovu ću čašu."
0:49:07,0:49:11,"Ja u tim trenucima sam znala reći, pa dobro, evo, jedna, evo ti druga, ajde samo molim tebe."
0:49:11,0:49:18,"Tamo nemamo mi ja vremena, nemamo ni kapaciteta, ja sam cijeli dan radila, ali ne ono ni jedna ne paše dok neki ne znam tantrum ne bude ili ovaj ne."
0:49:18,0:49:26,"Da, tu zapravo je jako važno da mislim na neki način mi to možemo i ne mogu reći spriječiti ali ublažiti, a to je da validiramo."
0:49:26,0:49:56,"Znači uzmi prvo ono, znam da ti je bilo jako teško, jako si mi falio, bilo ti je teško jer mame nije bilo, bilo ti je teško na spavanju jer ti je ovo, možda ti je bilo, znači ono pomoć djetetu, djetet to neće znati izgovoriti, ali ono kad vidi da si ti tu, da si se spustio na njegovu razinu, da si spreman ući u dijalog, mislim neće tu biti dijaloga, ali kad ti vidiš djetet, znači, znači sama doma, koja ti je razlika kad dođeš doma nakon napornog dana i kad ti muž kaže e vidim te ili kad ti kaže dogodilo to drugo."
0:49:56,0:50:01,Evo ako muž sluša onda veliki apel također i mom mužu.
0:50:02,0:50:02,Malo se šalim ja.
0:50:04,0:50:06,Mislim i mi odrasli imamo tu potrebu da nas netko vidi.
0:50:06,0:50:08,A sad zamisli malo dijete.
0:50:08,0:50:09,Naravno da ima potrebu.
0:50:09,0:50:16,"Tako da isto tu možda, evo jedan savjet kad si rekla ovo čaša, čaša, ova čaša, ona tu isto pripaziti koje je ono."
0:50:17,0:50:19,Tu je sad možda tvoja griženja savjesti ili proradila.
0:50:20,0:50:25,I sad imaš ogromnu krivnju i onda ćeš ući u onu totalnu krajnju sačući i pokušati na.
0:50:25,0:50:30,"ću ti pokušat nadoknaditi to sve tako da ja nemam pojma da sam ja tebi roditelj, nek ti meni postižeš."
0:50:30,0:50:35,"Pa evo ova čaša, pa evo znači ono zapravo plešemo na neki način ono po jajima oko djeteta."
0:50:35,0:50:48,"Pa vidi, to je, mogu točno ono detektirat kad je bilo situacije popustljivosti, a kad je bilo samo ono, ok, znam da ti popuštam, ali stvarno mi se ne da to slušati."
0:50:48,0:50:49,"Ako ti mogu godić, godić ću ti."
0:50:51,0:51:01,"Poslije ćemo se baviti granicama i nećeš raditi stalno šta god ti hoćeš, ako su neka pravila, ok, nemam pojma da nema slatkiša prije jela, neću ti tu po popustiti."
0:51:01,0:51:07,"Ali ono od sad gluposti neke čaša vode, evo ti izvoli, biraj, samo ono ne moramo tajma."
0:51:07,0:51:13,"Ne, dobro, to je ok ako dijete odabere, ali ono znači ono kad odabere, pa neću tu, pa hoću ovu, pa neću ovu."
0:51:13,0:51:15,"Kad ne može, zavrti jer zapravo to ne može."
0:51:16,0:51:21,"Da, nije mu to problem, problem je u tom da zagrliš ga ili treba zagrli, ali ne možeš da te mama zagrli."
0:51:22,0:51:27,"Oke, neka djeca će reći ne i to je isto, nećeš ti sad dijete zagrli, ali možeš ti reći da."
0:51:27,0:51:37,"I tu je ono tebi prilika da se povežeš jer i ti si kao majka sva osjećaš loše kad tvoje dijete pati, mislim ti se to zrcalni neuroni ne funkcioniraju na način da mi sad prenosimo."
0:51:37,0:51:41,"samo emocije na našu djecu, nego i naša djeca utječu na neki način na nas također."
0:51:41,0:51:42,I tekako.
0:51:44,0:51:46,Koliko se majčom svemu promijenilo?
0:51:48,0:51:49,Zašto ću ti reći?
0:51:50,0:51:51,Razotkrilo me.
0:51:51,0:51:54,"Mislim da je to ono kao, kada kažem, možda bolja rečenica."
0:51:54,0:52:01,Promijenilo me jako puno i mijenja me i osjetim da me mijenja svakodnevno i vjerujem da će mi mijenjati cijeli život.
0:52:01,0:52:22,"Ali da, jako puno stvari je zapravo razotkrilo o meni za koje sam, pa ne mogu reći da nisam bila svjesna, nego sam mislila da sam ih preradila, znaš, određeni broj godina, godina doživjela razne stvari, radila na terapiji, prolazila svoje ne znam nekakve osobne izlječenja i u vjeri i kroz molitvu."
0:52:23,0:52:28,"I onda dobiješ djete, djete ti se dere ne znam pola noći i ti osjećaš ono bijes u sebi."
0:52:28,0:52:35,"Tako da majčinstvo stvarno i ono najbolje u nama otkriva, ali mislim da i ono najgore."
0:52:35,0:52:48,"I svaki roditelj koji ne vidi to ili ne želi možda to priznati, mislim da živi u zabludi i da si time zapravo šteti i sebi i svom djetetu, jer kad tad dođe to sve na naplatu."
0:52:49,0:52:54,"Te male mamine sveznalice, što oni nama naprave, a mogu i mame biti sveznalice."
0:52:55,0:53:02,"Malo prije sam spomenula to u toj komunikaciji sa da nije nitko savršena, a znamo li mi?"
0:53:02,0:53:03,Svi smo mi savršeni.
0:53:05,0:53:14,"Realno mi smo svi ono predivna, ljubljena djeca Božja koja su nastala na Božju sliku na kraju krajeva, ali evo, odmetnuli smo se kroz život i ne slijedimo njegov plan."
0:53:15,0:53:35,"Ali da, mislim da je savršenstvo, jer taj perfekcionizam to je jedan samo obrambeni mehanizam, jedan obrazac koji vučemo iz onog nekakvih naših unutarnjih glasova koji zapravo uopće nisu naši nego koji su naslijeđeni i pripadaju našim mamama, bakama, prebakama, očevima na kraju krajeva, muškom djelu obitelji."
0:53:36,0:53:40,"I tekako možeš biti savršen, ali pitanje je dokad."
0:53:41,0:53:44,Ali pitanje je i što to savršenstvo znači.
0:53:45,0:53:55,Mislim da je savršenstvo znači stizat i moć sve na uštrb apsolutno svih svojih kapaciteta i onda na kraju krajeva doživjeti burnout.
0:53:55,0:54:03,"Pa mislim između ostaloga profil, znači baš ono se i kad smo se dogovarali za epizode, mislim podijelit ću, u okej, jedan komentar, ne, ne."
0:54:04,0:54:08,"Baš smo i razgovarali kao da sam ti rekla da sam u nekom rebrandingu, tako nešto."
0:54:09,0:54:20,"Ta mamina sveznalica, zapravo, da se razumijemo, mamina sveznalica nisam ja, to je jedno mjesto koje je trebalo poslužiti roditeljima da si uzmu za sebe informacije kako biti što bolji roditelj."
0:54:21,0:54:27,"Ali ono što ja nisam shvaćala u tom trenutku kad sam ja postala majka, koliko zapravo ja želim biti savršena na tom profilu."
0:54:27,0:54:45,"I koliko, ma ne samo na profilu, nego i unutar moja četiri zida, znači ono, kad se sjetim kad sam tek postala majka, pa ja ne znam, evo, hvala mojim bližnjima što su me tolerirali, što su učili od mene, što sam ono doslovce, meni je znalo ono muže i sve reć, ja se nisam preplatio na tvoje savjete."
0:54:46,0:54:56,"I to sam tad, ono znaš, kvači što, kao uvredu, ali danas, koliko je to zapravo, zašto ja to nisam tad mogla razumjeti na način na koji ja danas, ja bi sebi uštedila ono harpu živaca."
0:54:56,0:55:11,"Jer šta se dogodi, postaneš majka, uđeš u to neko majčinstvo sa nekim slikama koje si ti stekla u djetinstvu, gledajući svoje roditelje koji su ti u tom trenutku bili savršeni, jer zbilja djeci su roditelji savršeni."
0:55:11,0:55:18,"Dakle, kakav god, čak i oni roditelji koji udare dijete ili njihova djeca vole njih najviše na svijetu jer ne znaju."
0:55:18,0:55:20,"Ne znaju bolje, ne znaju drugačije."
0:55:20,0:55:22,I za takvu djecu su stvarni roditelji savršeni.
0:55:22,0:55:24,I zašto se to onda događa?
0:55:24,0:55:25,"Znači, djeca tu onda sebe krive."
0:55:26,0:55:30,"Jer kako savršen roditelj koji je u mojim očima savršen, mene može udariti."
0:55:30,0:55:32,"Pa nije problem onda u njemu, problem je u meni."
0:55:32,0:55:34,Tu je zapravo najveći problem u bati nama.
0:55:34,0:55:36,"Ali, da se vratim na temu."
0:55:36,0:55:43,"I onda ti dođeš u to svoje majčinstvo, znači, prenoseći ta nekakva uvjerenja koja su nastajala generacijama."
0:55:44,0:55:48,"I sad si ti došlo u svijet, znači, u okolinu koja je."
0:55:48,0:55:53,je sve samo ne ono što je bila generacijama.
0:55:54,0:55:56,Jer ti sad više nisi samo majka koja je doma.
0:55:58,0:56:15,"Znači, evo recimo konkretno u mojej situaciji moja mama je bila doma s nama jer ne znam, ostavila je svoj posao, tata je dobro zarađivao, od nje se očekivalo da vodi kuću urednom, da to sve bude ono lijepo, da mi hodamo ispeglane, da to sve ono fino, krasno, s akvam pakom."
0:56:15,0:56:24,"I što se meni danas događa, ja dođem u svoje majčinstvo, ja se ubijem od peglanja, od spremanja, jer to je ono obrazac koji ja nosim."
0:56:25,0:56:30,Dobra majka za mene znači biti majka koja brine za svoju obitelj na svim razinama.
0:56:31,0:56:36,"Da je opeglano, da je pospremano, da je skuhano, da je ono četiri slijeda."
0:56:36,0:56:39,"Jer mi smo stvarno, ne znam, naša mama je zbilja bila posvećena majka."
0:56:39,0:56:43,I ja sad pritom ne mislim da majka koja radi nije posvećena majka.
0:56:44,0:56:47,Samo je potrebno onda prilagoditi njenu viziju mačinstva.
0:56:47,0:57:03,"Znači ja kao majka koja radi i koja se želi izgraditi kroz karijeru i kroz taj poziv koji imam, pomoći zapravo drugim roditeljima da i oni odgajaju djecu, znači ja tu moram otpuštati neke stvari, ja ih ne mogu nositi u svoje majkečinstvo, a ja sam napravila upravo to."
0:57:03,0:57:18,"I onda sam došla, mislim, pred burnout, znači, baš smo se dopisivale, objavila sam na Instagramu neki dan, znači naletjela sam na sliku gdje je ono doslovce moj djed drži moje dijete po pravilima baby handlinga."
0:57:18,0:57:21,"I ok, da se sada razumijemo, postoje djeca stvarno koja motorički."
0:57:21,0:57:22,koja se moraju.
0:57:22,0:57:25,"Da, znači, bilo bi lijepo, mislim, bilo bi lijepo."
0:57:25,0:57:37,"I struka kaže da takvi roditelji čija djeca imaju nekakve motoričke, evo nije moja struka pa nekakve motoričke, ne znam, disfunkcije, bi trebale priučiti."
0:57:37,0:57:41,"svoje roditelje, bake, djedove koji ih handle, jer na kraju krajeva s djecom."
0:57:41,0:57:49,"Ali, mi smo dolazili i kod mojih u Slavoniji, jednom, nikad, i ja sam imala ono tečaj baby handlinga za svog djeda."
0:57:50,0:57:54,"Tako da, evo, da, nema televizora ni jedne milisekunde."
0:57:56,0:57:56,"Čekaj, ne znaš."
0:57:56,0:57:57,Sve skuhano?
0:57:57,0:57:58,"Jako, sve skuhano."
0:57:58,0:57:59,"Evo, počuo sam na hipu."
0:58:00,0:58:00,Da.
0:58:01,0:58:04,"I kad smo već kod hipa, znači, ne možeš vjerovati."
0:58:05,0:58:06,"Pokaži tu fleku, ajde."
0:58:08,0:58:10,"Cijelo vrijeme ju gledam, ne, ne, ok, dobro."
0:58:11,0:58:18,"Mislim da, sve skuhano., četiri slijeda, ne znam, domaće kažete, mislim da sam se ja tu preporodila."
0:58:18,0:58:30,"Znači, prva stvar kad sam shvatila da ja to ne mogu sve, kad sam se utopila u svemu, kad sam pukla, znači ono doslovce je preddepresivno sanje, plakanje, ono muže, onda mi muže kaže, ali ti to ne moraš sve."
0:58:30,0:58:33,"Pazite ovo, te bi trebao netko drugi reći, da?"
0:58:33,0:58:40,"Ti to ne tražite sve, da bi ti sebi osvijestio, ti ne vidiš svoj si, mi smo predugo učeni ignorirati naše emocije."
0:58:40,0:58:41,Zašto?
0:58:41,0:58:44,Zato što nam nije bilo dozvoljeno da ih pokažemo kad smo ih trebali pokazati.
0:58:45,0:58:48,"Jednostavno ne možeš ni prepoznati kako se osjeća, ja sam baš u jednom periodu..."
0:58:49,0:59:05,"Moje prvo dijete, ne znam koliko vam je, četiri mjeseca, ja sam doslovce čekala sekundu, znači igra s njim, potica i podražaj, tam i taj, znači nema šta nisam radila, čekaš sekundu u kojoj će on zaspati i onda letiš po stanu."
0:59:06,0:59:11,"Peri ovo pegla jer pazi, ne do Boga, da ja ne opeglam svaku tetricu i ne dezinficiram."
0:59:11,0:59:15,Moje dijete će ono završiti u klajčevoj na intenzivnom odjelu jer će se zaraziti.
0:59:17,0:59:20,Ja vjerujem da će se jako puno roditelja majki pronaći u tom.
0:59:21,0:59:24,"To je jedan veliki problem zapravo, ta kontrola koju."
0:59:25,0:59:35,"koju ti imaš potrebu sad kontrolirati apsolutno sve u svom životu, a to je također obrambeni mehanizam, ono kao ne želim da moje dijete ponovi ono što je meni bilo."
0:59:35,0:59:59,"I sad ću ja svim silama držati sve pod kontrolom, svaku sferu svog života, svaku sferu djetetu ovog života da bih ja bila ta savršena, idealna mama, jer ne želim biti onakva, ne znam, ne želim, ne znam, rani svoje dijete možda kako su mene ranili, pa ću sad napraviti apsolutno sve i utopiti se u svemu tome i tu smo onda reaktivniji, jer ti to ne možeš, ne možeš to, ne možeš taj tempo života živjeti."
1:00:00,1:00:06,"tko može, ja bi voljela da mi se javi, da on meni bude mamina sveznalica pa da mi da ovaj savjet."
1:00:06,1:00:26,"Ali je jako puno i svih tih savjeta i stručnjaka, evo mislim mi pričamo, uvijek nekako nastojim kroz sve te razgovore da doznanja roditeljima da sve o čemu pričamo nije nekakva kao kritika nego zapravo samo osvještavanje toga gdje si i šta si i na kraju krajeva onda šta ti sebi možeš primijeniti i u čemu ćeš ti rasti."
1:00:26,1:00:33,"Nećemo svi rasti u istom, ne znam, ja možda nisam bila opterećena time da me bude čuo, sad mogu reći ono o čemu ti pričaš, boli me briga."
1:00:33,1:00:59,"Ali je jako puno mama time stvarno opterećeno i onda vrijeme koje trebaš provesti, koje je najvažnije da bude kvalitetno, ti kažeš ono stoji ti iznad glave ono šta se trebamo baviti jer jako puno smo dobili, prikupili kroz godine kao što si i sama rekla još dodatnih zadataka koje su vezane za kućanstvo i to je ona neka usporedba i sa tradicionalnim odgojem i sa granicama na kraju krajeva."
1:00:59,1:01:06,"Neki dan sam s mamom komentirala, ja kažem da smo mi u ovom dobu sada, vi bi bili prepopusljivi roditelji."
1:01:06,1:01:36,"Vaša je jedina sreća prema nama bila što vi niste imali toliko slatkiša, toliko ekrana, društvene mreže, ništa od toga nije bilo, mi smo kao djeca išli vanka, igrali se nama, nije radilo i onda u svemu tome u društvenih okolnosti smo se opet oblikovali nekako normalno, ali oni nisu morali disciplinirati na način da paze koliko gledamo teve, da paze koliko unosimo slatkiša jer ih jednostavno nije u toj mjeri bilo."
1:01:36,1:01:41,A mi se puno svojih kapaciteta potrošimo na sve te dodatke koji su u međuvremenu stigli.
1:01:44,1:01:47,Ne znamo se olakšat.
1:01:48,1:02:32,"Mislim, evo pokušavam, trudim se, baš kad si spomenula, meni je nekako ono ti smo tiči, kako da kažem ono, sad nemam vremena, znači ne mogu, ne mogu, ma mislim i dostava je dostava hrane i to mislim, javno priznam, otvoreno priznam, ne kuham svaki dan jer ne mogu, ok, znači druga stvar da sam doma, vjerojatno bi si onda i dan rasporedila drugačije da nemam posao svoj koji radim, koji vodim sama za sebe, drugačije je to, ne znam, evo, ne stignem uvijek i skroz mi je ok posegnuti za nečim onog gotovim, kupljenim, sad smo baš glam ove hipiće, imao se i ljudi ljuti jer flekica je tu, ali evo za sve mame koje imaju nekakve važne snimanja i događaje, nemojte kupovati ove hipiće."
1:02:33,1:02:34,Ljubiča se da.
1:02:34,1:02:35,Ljubiča se da.
1:02:35,1:02:39,"Koji imaju borovnicu, ove od banane su dobri jer evo imam ga baš tu i tu."
1:02:40,1:02:44,"Imaš ti tu svi boja, ništa se ne vrtimo, mogli su svi proći."
1:02:44,1:02:48,"Da, ono kao nemoj kasi ako nije sve svaki dan skuhano."
1:02:48,1:03:00,"Ako baš nigdje ne popuštaš, ako ne popuštaš ni u hrani, ni u ekranima, ni u ne znam komunikaciji, a moraš, jednostavno nekada moraš jer ti imaš sve."
1:03:01,1:03:01,Slažem se.
1:03:01,1:03:09,"Mislim, treba znati onu granicu do koje ti šta ćeš ti odrediti, koja je tvoja zadnja, neću dići ruku na djece, ok."
1:03:10,1:03:22,"Ali sve ovo ostalo između, pa mislim i ti si osoba, nemaš uvijek kapaciteta, ali ovo sam ti još sam prije, vidim da želiš nešto reći, pa zadrži misao, jer ću i ja zaboraviti ovo što si rekla kao nemajka si."
1:03:23,1:03:26,To smo mi žene opet dale drugim ženama tu titulu.
1:03:26,1:03:32,"I to zapravo mi jedne drugima stvaramo pritisak, ono baš ne znamo si biti podrška."
1:03:32,1:04:12,"Mislim, ja imam prekrasnu zajednicu, ono majki unutar programa, moje sigurne i smirene gdje napokon učimo da te druga žena može podržati, da ti druga žena, da ja sam neki dan podijelila ono, ne znam, nakon dvije trudnoće sam omršavila, stvarno sam puno kila natukla jer malo sam pazila na prehranu, vježbala sam, malo sam se zdravije jel hranila, kretala više s klincima i baš sam full omršavila i bila sam prezadovoljna i onda si mislim kad bi to podijelila u nekom okruženju pa mislim reći će ljudi, gledaju, hvale se ovo, ono, ja napišem to ono svojim ženama i napišem, baš sam napisala ako sad imaš ljutnju u sebi radi toga nemaju preusmjeriti u mene, zapitaj se zašto si ljuta."
1:04:12,1:04:21,"Jer najčešće nikad se ti, nikad ti nemas ono projekciju na drugu osobu zbog te osobe, nego zbog nečega što ti u sebi jel nisi."
1:04:21,1:04:31,"Tako da evo te nemajke koje ne kuhaju, ove majke koje kuhaju onda prozivaju nemajkama, ove ne znam, ne stignu jel rade jer se osvajaju kroz karijeru, mislim da je to glavni problem."
1:04:32,1:04:36,Što se nekako ne okrenemo same prema sebi i da gledamo zbilja gdje smo mi to pozvane.
1:04:36,1:04:49,"Znači nemoj si govoriti da si, da si, da trebaš odgajati djecu i biti doma onda biti nesretna i upirati u prstom uspješne žene koje vode posao i govoriti ova žena ne znam je uspješna vodi, a pogledaju djecu u vrtićima i našu."
1:04:50,1:04:59,"da se zapitaš zašto te to smetaš, jer ti možda isto ne živiš nešto što ti neku svoju duboku potrebu koju ni ne znaš iskomunicirati jer eto godinama ju i sama potiskuješ."
1:04:59,1:05:04,"I onda projiciraš tu nekakvu mržnju, ljutnju prema toj osobi koja realno nema nikakve veze s tobom."
1:05:04,1:05:14,"I kontra isto, ja isto sama, znači ono, mene ja osjetim baš da me nekad zna triggerirati kad ja vidim, ne znam na misi, djecu ona posloženu, sve je ispeglano."
1:05:14,1:05:21,"Znaš pa trigerira me neka mi ono, znači prva moja pomisao bude, moja djeca nisu užas, grozna sam kako ova se stine, pa da ona sigurno ne radi."
1:05:21,1:05:24,"Znači to je moja prva reakcija, mislim otvoreno, javno priznam."
1:05:25,1:05:27,"I onda, aha, ok, zašto ja sad to mislim?"
1:05:27,1:05:33,"Možeš konstantno se propitivati jer, mislim, ne možemo živjeti u ljutnji, u mržnji prema drugima."
1:05:33,1:05:40,Sami sebe na kraju pojedemo i ne damo si priliku da poslušamo sami sebe.
1:05:40,1:05:46,"Kad si konstantno usmjeren na nekog drugog, kako ćeš ti fokus prebaciti na sebe, kad ti stalno vidiš šta kod nekog drugog ne valja."
1:05:47,1:05:48,I ono možda i on prema sebi.
1:05:49,1:05:52,"Ta slika savršenstva je, baš se ističe."
1:05:53,1:06:00,"Evo i sad i na društvenim mrežama i sve, i ono paziš, naravno i biznis ti je, i ono paziš kako ćeš objaviti sve to."
1:06:01,1:06:04,Zato mi je drago da se tu pričuju neke realne priče.
1:06:05,1:06:12,"Da pričaš ono šta proživljavaš, da pričaš što misli, ono vidi sad, bez veze mi je osjećaj zato što su ova djeca uredna, moja nisu i tako neke stvari."
1:06:13,1:06:18,"Jer svi to zapravo proživljavamo, ali rijetko komuniciramo."
1:06:18,1:06:23,Radije ćemo uslikati ih kad jesu fini nego kada je neki kaos doma.
1:06:24,1:06:24,Znaš što ti je to?
1:06:24,1:06:28,Ja isto mislim da možda ljudi koji na taj način funkcioniraju nisu ni svjesni.
1:06:29,1:06:29,Znaš?
1:06:29,1:06:34,"Jer to je isto jedan obrambeni mehanizmi koje imamo, to je jako na nesvjesnoj razini."
1:06:34,1:06:40,"Ti sad trebaš stati i zapitati se., e čeka sad malo, stani malo, zašto ja to sad mislim?"
1:06:41,1:06:50,"Ali ovo što kažeš za društvene mreže, mislim, ja isto koja se, evo, mislim, ja jako ne volim kad neko kaže autentičan."
1:06:50,1:06:56,Jer ja mislim da ti jedino s kim ti možeš biti autentičan je u odnosu sa Bogom.
1:06:56,1:07:00,Ti čak ni samom prema sebi ne možeš biti autentičan od tih svih svojih obrabenih mehanizama.
1:07:01,1:07:02,Jer tko si ti zapravo?
1:07:02,1:07:10,"Znači ti cijeli život zapravo bježiš od nekakvih svojih, od svoje autentičnosti zato što nisi mogao u tom ranom djetinstvu biti autentičan."
1:07:11,1:07:14,"Nisi mogo, ne znam, prolit."
1:07:15,1:07:30,"Evo sad, na primjer, tu smo pričale, znači ja sam nosila tu u ovim tvojim stepenicama, ruke su mi se tresle, ne bi slučajno prolila, jer eto kod djete sam dobila etiketu kao smotane šeprlje, jer sam uvijek u kafiću nešto ili u restoranu, ako sam bila s roditeljima, prolila."
1:07:30,1:07:36,"I sad to više nije bilo kao sad ću prolit, nego ja stvarno onda i prolijem, jer to je nešto što me obilježilo."
1:07:36,1:07:55,"Tako da, evo, mislim, to je sad jedan samo mali, banalni primjer, ali evo, mislim da ne možeš biti autentičan i da onaj tko kaže za sebe, možda da je, to je moje stajalište, naravno možete me pobiti, možete napisati da vi jeste, super, meni je drago da vi jeste, ali evo to je moj nekakav stav da ti ja biram šta ću ja objaviti."
1:07:55,1:08:06,Znači ja i u trenutku kad pišem nešto iskreno u smislu da otkrijem neku svoju boljku ili ranu ili ja opet odabirem što je meni ugodno da ja to objavim i što nije.
1:08:06,1:08:11,"Tako da tvrdi da si autentičan na društvenim mrežama, mislim da je to zabluda."
1:08:11,1:08:27,"Ja mogu reći ok, ja sam autentična i zbilja ja pričam iskreno, znači ja ću ti ispričati, ne znam danas sam imala to i to, neću sad zapakirati u celofan, ali koliko stvari ja onda ne kažem, znači mislim autentičan je baš jedna velika riječ i nekako uvijek pokušavamo izbjeći."
1:08:28,1:08:46,"Kažeš, ni prema sebi nismo autentični, nismo onda ni prema partneru pogotovo, nismo na odnosima savršenstva u očekivanjima prema nama samima, imamo očekivanja i prema našim partnerima i kad su djeca najmanja, tu se događaju najveći problemi."
1:08:46,1:09:00,"Da, itekako, itekako ako nema ono otvorene komunikacije, jasnog izražavanja, bez očekivanja ti netko čita misli, mislim da neki sam pročitala da ono prvih par godina zapravo braka da tu najviše rastala bude."
1:09:01,1:09:34,"Dođiš iz jednog predivnog lepršavog okruženja, medeni mjesec, jeste mladenci, sve vam je savršeno, okrenuti ste prema sebi, nema nikakvih, mislim, ima briga, uvijek ima nekakvih briga, ali ipak ima ta doza još uvijek sebičnosti u tebi, pa kao možeš ti sad sebi nešto i priuštiti, sad ovdje ne mislim pod materijalno, jer često nije samo materijalno, mislim, evo recimo ne mogu si priuštiti, baš sam komentirala, znači ja nisam stigla, htjela sam otići na pedikuru, nisam stigla, jučer kasno navečer sam, ne znam, pola sata namakala noge da si oribam pete, jer eto u Svatovima ću imati."
1:09:34,1:09:37,"Znači ono kao, tu si ne mogu priuštiti, ali ne mislim."
1:09:37,1:09:39,Ne mislim samo materijalno nego i vremenski.
1:09:40,1:09:45,"I u toj svojoj istrpljenosti i ne spavaš po noći, znači novi život ti dođe."
1:09:45,1:09:51,Sad više fokus više nije na tebi u smislu i na tvojom partneru da sad vi možete uživati.
1:09:51,1:09:54,Tu sad cijeli fokus spada na tog nekoga tko vas treba.
1:09:54,1:10:00,"Sad treba vas, tu je i sve ide na to maleno dijete i tu jako puno zapravo."
1:10:00,1:10:23,"Još ako uzmem u obzir da je najčešće to tako i biva, da ste u različitim okruženjima odrasli, pa ste onda i različite obrazce iz svojih obitelji ponijeli i različita očekivanja kakav muš treba biti, različita očekivanja kakva treba biti ta žena, različita očekivanja na kraju krajeva kakva treba biti majka, jel moj partner, kakva ja trebam biti majka i ja isto kakav bi on trebao biti otac."
1:10:23,1:10:35,"I tu sad ako nesjednemo i ne dogovorimo i ne razmislimo dobro, tu jako često možemo i pobjeći u to da mi zapravo kroz partnera želimo proživjeti ono što nama nije bilo pruženo."
1:10:35,1:10:47,"I onda znaš tu već kao majka želiš to savršenstvo u svom partneru, zato jer na taj način pokušavaš nadomjestiti sve što ti kao dijete nisi imao, jel u tom odnosu."
1:10:47,1:10:53,"Pa ajde bar da moje dijete ima., ja ću tako isto biti, ja ću tako biti super mama jer sam ja izabrala odličnog partnera."
1:10:53,1:10:59,"Nisam izabrala partnera koji je kao moj otac koji nije pružio ovo, nije bio tu, bio emocionalno distanciran."
1:11:01,1:11:09,"Tako da mislim da treba biti, da treba pristupiti tome ono dosta, da nije dosta samo se zaljubiti i sad kao mi ćemo biti super zaljubljeni smo."
1:11:09,1:11:12,Mislim da je ono tu zapravo i Bog je ono.
1:11:12,1:11:25,"Savršeni nam je dao zapravo model i način na koji bi trebali se upoznavati i na koji način bi trebali živjeti i prije vraka i sve, ali eto mi opet uvijek umješamo svoje prste, živimo."
1:11:25,1:11:35,Živimo na način možda na koji nije to zamišljeno bilo i onda ne uspiješ upoznati svog partnera na način na koji bi ga mogla upoznati kad bi sve one tjelesne stvari mogla odmaknuti.
1:11:35,1:11:37,Da ti vidiš zbilja kakva je to osoba.
1:11:38,1:11:43,"Danas često možemo čut, ne znam, ali meni on nije ovo, on je i bio ovakav kad je ovo."
1:11:44,1:11:46,I to mi se uvijek vrati u sjećanje.
1:11:46,1:11:52,"Znači moja baka često išla na misu, uvijek bi donijela nekakav pirič župni."
1:11:52,1:11:54,I onda sjećam se to ko dan danas kad sam čitala.
1:11:55,1:11:59,"Bila sam, ne znam, možda 8-90 godina, ali baš se sjećam ovoga."
1:12:00,1:12:00,Pisalo je kao.
1:12:01,1:12:08,"žena je došla, uvijek smo imali kao sekciju nekakvog humorističkog nekakvog vica, ne znam da li vi to imate užasno ili ne."
1:12:09,1:12:19,"E, i uglavnom pisalo je nešto kao došla žena na ispojeni i kao žale se na muža, prigovara, prigovara, prigovara i sad nje svećenik kaže kao pa ti si to sve znala i prije braka."
