Start (HH:MM:SS),End (HH:MM:SS),Segment
1:12:20,1:12:27,"Ona kaže pa nisam to mogla vidjeti, nije nigdje pisala, on kaže ja pisala je na čelu sam što ti nisi znala pročitati."
1:12:27,1:12:41,"Tako da mi zapravo ako bolje gledamo i ako bolje upoznajemo naše partnere i prije nego što dođu djeca mi možemo zapravo jako dobro vidjeti na koji način će ti naši partneri biti muževi, na koji način će biti očevi na kraju krajeva."
1:12:41,1:12:42,Mislim dovoljno da pogledam.
1:12:42,1:13:16,"Vidim, ono nisam sigurna jel se slažem, znate što mislim da nas to jako puno promijeni ta uloga majčinska i očinska jer imam osjećaj da sam ja sebe recimo upoznala u nekom drugom svijetu kad sam postala majka, kako je onda moj muž recimo mogao pretpostaviti kakva ću ja biti ili recimo u tom nekom smislu zadržavanja, držanja kontrole u svemu ili perfekcionizma ili s druge strane nekog bijega kojima možda Možda muškarcima bolje ide."
1:13:17,1:13:19,"Ajde, ti to znaš, ti to prepusti."
1:13:19,1:13:30,"Ti nisi bio u situaciji, ok, mi smo se prije braka oko puno toga dogovarali, bili smo ravnopravni, ali sad smo dobili skroz neku novu ulogu, meni ide, tebi ne ide, pa ja ti dam, ne dam."
1:13:30,1:13:32,"Znaš ono, gdje je tu neka ravnoteža?"
1:13:33,1:13:39,"To je skroz nova uloga i upoznajmo sami sebe u toj novoj ulozi i onda moramo i partnera upoznati i on sam sebe, znaš ono?"
1:13:40,1:14:07,"Da, slažem se, ali isto tako, mislim ovo kad kažeš nije moguće znati, neke stvari ne znaš jer to što kažeš promijenite, ali jako puno ono kao nacrt koji mi nosimo i odnos koji mi gradimo sa drugima je jako definiran u smislu da vuče korijenje iz naše primarne obitelji jer mi smo ti koji smo odrasli u tom okruženju gledali na koji način su naši roditelji komunicirali, na koji način su rješavali konflikte, na koji način su ne znam se odnosili prema financijama."
1:14:07,1:14:12,"Dakle mi to sve kao djeca gledamo, upijamo i to mi danas nosimo, znači nesvjesno."
1:14:12,1:14:22,"Znači ja sad tu ne govorim na onoj nesvjesnoj kad ti radiš pa ti sebe upoznaješ, pa primjećuješ neke stvari, ja sad govorim na onoj nesvjesnoj razini, ti to doneseš sve u svoj brak."
1:14:23,1:14:33,"I sad muž sve svoje, isto također, svoja iskustva, pa ne samo odnos između muža i žene, nego odnos i roditelja prema djetetu."
1:14:34,1:14:37,Isto dođeš s nekom idejom kakav bi ti otac trebao ili ne bi trebao biti.
1:14:38,1:14:53,"Jer imamo tu uvijek, znači ili ćeš biti, sviđati se, super ti je, ne primijetiš možda nekakve nedostatke i to je onaj stav ono kao, kako ide ono kako najčešće kažu, man niš mi ne fali, dobro sam ja ispao, to bi recimo bilo ono totalna idealizacija roditelja."
1:14:54,1:15:03,"Da se razumijemo, ne treba sad ni drvjem ni kamenjem po roditeljima, ali treba biti svjestan što od toga nam je koristilo, a što bi recimo možda trebali drugačije."
1:15:03,1:15:11,"Ne sad upirati prstom u roditelje, ne znam, ti si mene oštetio, ne, nego jednostavno izvući nekakvu pouku iz toga što ja mogu drugačije promijeniti."
1:15:11,1:15:13,Ali evo sam i pobjegla misao što sam htjela reći.
1:15:13,1:15:13,"Aha, znam."
1:15:14,1:15:18,"Ono što smo jel nosili, što sam to počela pričati da nosimo i svojih obitelji."
1:15:19,1:15:25,"Sad, jel muž dođe sa određenom idejom u brak s tobom, kakav on želi biti otac, ti dođeš sa određenom idejom."
1:15:26,1:15:28,"E sad ću konkretno reći na onom, na mom primjeru."
1:15:28,1:15:42,"Ja u svom, onom životu, moj otac je bio onako fizički prisutan, ali jako puno radio, bio je uspješan u svom poslu, ali jednostavno nije bilo tu emocionalne prisutnosti i to je meni baš cijeli život dosta falilo."
1:15:42,1:15:56,"Ja to danas mogu, a recimo kod supruga je opet kontrast, ono kontrastrana, moj muže je odrastao u jednoj dosta funkcionalnoj obitelji, roditelji se vole, topao otac, danas predivan ono djed našoj djeci."
1:15:57,1:16:33,"I sad, ja sad da vidim samo njegove kvalitete, ja bi rekla on je predivan otac, ali ja gledam ono znaš kao, moja ideja mog oca nije bila ono što sam ja htjela, ja sad želim nekakvo savršenstvo i sad ja tu iz te svoje potrebe, iz te svoje rane kao šta ja nisam dobila, ne vidim ovo što moj muž već daje nego ja želim još, ja želim da on validira svaku emociju, ja želim da on validira, da vidi dijeta za svaki, znači doslovce želim da on preuzme ulogu, mislim to tako ispada, mi majke najčešće želimo da roditelji odnosno partneri u tom savršenstvu, u toj našoj potrebi za kontrolom budu isti roditelji koji i mi."
1:16:34,1:17:01,"Jer mi radimo ispravno, mi smo ono sveznajuće, sveznalice i sad je tu proces, sad ćemo mi uzeti projektič jedan i ajmo mi sad naše supruge mijenjati i ajmo sad ti ćeš napraviti ovako, ovo treba ovako, Ja sam čitala da je ovo ovako i to još, ako stvarno mi radimo na sebi, ako stalno u smislu, sad ne mislim kao rad na sebi da reflektiraš i sa sobom šta ti trebaš mijenjati, nego kad radiš na sebi, ali tak da mijenjaš druge."
1:17:02,1:17:03,Kužiš da želiš reći.
1:17:03,1:17:05,"Ne, pardon."
1:17:05,1:17:08,"Ali to nije ono što želimo, da i to odmah podvučemo."
1:17:09,1:17:22,"Naravno, ali onda zapravo je tu, ti tražiš od svojeg partnera, svog muža, znači oca svoje djece, da radi isto što i ti, tvoj partner dobiva, ok, ja sam dobeo poruku, ja sam došao sa određenom slikom kakav ja otac trebam biti."
1:17:22,1:17:24,Znači ja mislim da ja radim dobar posao.
1:17:25,1:17:27,Jer to je moja slika i sad ti tu mene prozivaš.
1:17:28,1:17:32,"I to ono doslovce daješ svom mužu, ti to ne radiš dobro, ti ne vrijediš kao otac."
1:17:32,1:17:34,I tu je sad opet na razini identiteta.
1:17:36,1:17:37,Isto je kao sa djecom.
1:17:37,1:17:39,Znaš kad ti odveješ dijete od ponašanja.
1:17:40,1:17:42,I to je nama savršeno jasno s našom djecom.
1:17:42,1:17:48,"Nećemo reći ti si zločest, nego ne znam, evo sad mi ne pada ništa na pamet, ali odvojit ćemo identitet od ponašanja."
1:17:48,1:17:52,Znači nije lijepo to što si napravio ili ne znam ti nisi dobar.
1:17:52,1:17:56,"To su dvije različite stvari, ali to sad recimo našim partnerima ne radimo."
1:17:56,1:17:59,"Jer mi na taj način njima šaljemo poruku, nemaš pojma, failaš kod tata."
1:18:00,1:18:10,"I šta se tu događa?, da ono, mislim u muškarci, ja vjerujem da se muškarci pitaju šta sad ne valjam, pa ću porovati jednom, pa opet ne valjam, pa ću porovati drugi put, pa opet ne valjam, pa ću porovati treći put."
1:18:10,1:18:13,"I onda će više reći pa daj, evo ti radi sama."
1:18:13,1:18:14,I šta onda dobiješ?
1:18:14,1:18:25,"Dobiješ da si u svojoj kontroli, u svom savršenstvu, iscrpljena, nemaš podršku, jer imala si ju, ali ju nisi prihvaćala, htjela si da bude po tvojim kriterijima."
1:18:26,1:18:30,"I onda se zapravo usosiš i tu dolazi isto do burnouta, jer ne možeš."
1:18:30,1:18:39,"Znači mi smo stvoreni, ako kao djecu donosimo kao dvoje na svijet, pa onda za tu djecu je logično da ih dvoje trebaju i od hranit."
1:18:40,1:18:46,"Mislim društvena smo bića na kraju krajeva, nama treba i za opstanak osoba."
1:18:46,1:19:15,Uvijek mi se čini važnim podvući da treba uzeti u obzir tu širu sliku jer ti kad pričaš o odgoju i odnosima nikad ne možeš dati nekakav jednoznačni savjet koji će biti primjenjiv na sve i toliko je nijansi u svemu tome i u tom odnosu jer sad kad to sve pričaš ono pronalazim samim majko da ne pričamo o tome i mislim da žene to mogu i zato što osjećaju prirodno da one razumiju djetetove potrebe bolje i duže su s djetetom i na kraju krajeva možda i jesu.
1:19:15,1:19:17,"Maje im, naravno, ali stvar komunikacije."
1:19:17,1:19:20,Stvar je u tome na koji način mi komuniciramo to.
1:19:20,1:19:25,"Prirodno je da ćeš ti kao majka znat, stvarno znat bolje, intuitivno."
1:19:25,1:19:31,"Znači, ti si majka tom djetetu, ti si ga na kraju krajeva nosila ono, ti već imaš na neki način vezu."
1:19:32,1:19:46,"Sad trebaš pustiti tatu da on izgradi tu vezu pod onim okolnostima pod kojima on zna, ako želiš interferirati, ako želiš možda nešto drugačije, onda treba onako isto dosta biti."
1:19:46,1:19:48,"To je isto kao sa djecom, meni je ono."
1:19:49,1:19:58,"Ali to nekako tako izgleda kao manipulativno, znači ono da biraš način, misliš moraš ga bira, biraš ga na poslu, biraš ga s prijateljima, uvijek biraš dobre riječi, možda najlošije je to biramo sa partnerima."
1:19:59,1:20:00,To ti je ono koji djeca.
1:20:01,1:20:13,"Naš, mi se osjećamo sigurno, s njima se osjećamo sigurno, oni su vjerojatno vidjeli nas u svim izdanjima i u svim svjetlima i onda nekako taj odnos zapravo koji bi najviše trebali njegovati, nekako on uvijek padne."
1:20:13,1:20:21,"Naravno, mislim mi smo sada trenutno u periodu kada nas djeca zbilja trebaju, ali isto moramo biti svjesni da tu i partnerski odnos ne smijemo baš previše po strani."
1:20:21,1:20:50,"Naravno da u nekim, ne znam pogotovo prvih, prvih godinu dana pa onda i mislim, prirodno je da majka i ne znam i nakon poroda i nakon jednostavno ono fiziološki dok se to sve ne jer hormoni dok se ne balanciraju, prirodno je da će možda i više biti fokusirana i na djete, ali onda kad djete lagano odrasta mislim biti svjestan da ti i muž ostaje te djeca odlaze i tu se onda događa zapravo to da toliko budeš fiksiran na svoju djecu da ih kasnije onda ne možeš ni pustiti."
1:20:50,1:21:02,"Znači totalno se saživiš sa tom ulogom majke i totalno onda napraviš svoju djecu ovisnima cijeli život o svojoj brizi, em ti izgubiš tu ulogu kad tvoja dje djeca tebe ne trebaju više?"
1:21:02,1:21:10,"Onda tu isto, svakakav slučaj bude, pa onda bake znaju na svoju unuća da prenosite svoje neispunjene potrebe i tako."
1:21:10,1:21:15,"Ali to su sve ono nezdravi obrasci i nefunkcionalni, nesluže nam."
1:21:16,1:21:22,Možemo na puno zdraviji način to sve iskomunicirati.
1:21:23,1:21:26,"Prvo, krenuliš i od sebe, zašto ja imam potrebu kontrolirati?"
1:21:28,1:21:30,Što ja dobivam s tim da ja?
1:21:30,1:21:36,"Je li stvarno ako ja ne znam, je li stvarno ako ja pustim muža da jednom digne dijete ne znam onak?"
1:21:36,1:21:38,Znači kako su prije dizali ili kada je tako bilo.
1:21:39,1:21:40,"Da, ili ne znam što god."
1:21:40,1:21:42,Sad mi ne pada ništa na pamet.
1:21:42,1:21:48,Evo meni u glavi taj baby handling jer sam ja totalno bila zabrijala s tim baby handlingom kad je moje djete bilo malo.
1:21:51,1:21:52,A je li bila neka poteškoća?
1:21:52,1:21:55,"Pa ne, ne, pa to je jednostavno naš kao imaš nekakve svoje."
1:21:57,1:22:01,"Koliko će to, koliko će ovo, i tu zapravo isto kao roditelj ti projekt radiš."
1:22:02,1:22:08,Projekt radiš od svog djeteta živeći nekakve svoje neispunjene potrebe.
1:22:08,1:22:22,"Želiš ostvariti svoja očekivanja prema sebi, da, očekivanja te savršene mameena mama jer savršena mama je ta koja apsolutno u svim sferama podržava svoje dijete, razvojno, ne znam, kognitivno, emocionalno, na svim sferama naš."
1:22:23,1:22:37,"Sa ovako će krenuti na Helen Doron, sa ovako će, mislim to sad kad se pustiš, znači kad stvarno se saživiš sa tom svojom kontrolom, pa ti ćeš stvarno od svojeg djeteta dobiti projekt, znači ono cjeloživotno obrazovanje, pa i taj i ta mama."
1:22:38,1:23:01,"Sve je to iz dobre namjere, ali na kraju je totalno ono ishod koji ne želiš jer je izprojektirano dijete ono koje u dubini svoje nije sretno jer nije proživljavalo normalan, nekakav slijed, normalno upoznavanje emocija, vidjelo da mama ima težak dan, da mama nešto ne stiže ili da ne znam, da je u redu na kraju krajeva da se mama i tata posvećaju, pa kako oni to rješavaju."
1:23:02,1:23:06,Sve ono nekako ode u neke krajnosti i šta taj projekt na kraju može?
1:23:07,1:23:07,Ništa.
1:23:07,1:23:17,"Slušati, biti ili poslušnik cijeli život ili ona druga krajnost, bunt prema autoritetu."
1:23:17,1:23:23,"I onda što su uvijek dvije različite krajnosti, ali još me ono što si mi spomenula, baš me to asociralo."
1:23:25,1:23:53,"Mislim, sad mi je pobjegla misao, ali nešto u vezi tog kako zapravo mi spriječavamo, e da, rekla si za svađanje, da, treba se znati posvađati pred djecom, to isto nije loše, jer ako se ne svađaš ti, ti, praktički ne mogu reći da dijete držiš pod staklenim zvonom, ali ako si ti model budućih odnosa koje će imati, mislim, to tvoje dijete će u neki drugi partnerski odnos doći sa totalno nerealnom slikom, jer će očekivati da je tvoja obitelj savršena, znači da se tvoji roditelji nikada ne svađaju."
1:23:53,1:24:03,"Treba se tu znati, je li zdravo, to sad kažu moderno raspravljati, mislim, svađa rasprava kao ima neke razlike, ali zdravo se posvađažit ću sad u ovoj situaciji reći."
1:24:03,1:24:12,"I još je jako važno, ok je svađati se, ali nije ok partnera prozivat pred djetetom za neki odgojni postupak."
1:24:12,1:24:17,"Nešto ono kao evo sad mi pada na pamet, ne znam, pao je i sad kaže nije ti ništa."
1:24:18,1:24:19,Alarmi.
1:24:19,1:24:21,"Pa kako mu nije ništa, ne možeš mu reći da mu nije ništa."
1:24:22,1:24:24,"Recimo, saživi se s njegovom emocijom."
1:24:24,1:24:26,"Znači, doslovce ono, imaš potrebu."
1:24:26,1:24:27,A zašto?
1:24:27,1:24:31,Zato jer ti sad očekuješ od svog partnera ono što ti nisi dobila od svog oca.
1:24:32,1:24:35,"I sad ti to želiš jela za svoje dijete, ono što ti nisi imala."
1:24:35,1:24:36,Želiš da mu neko validira emociju.
1:24:37,1:24:47,Evo tako da mislim čisto ako vaši partneri ne potvrđuju emocije vašeg djeteta to ne znači da će vaše djete biti emocionalno znaknuto i da će biti istraumatizirano.
1:24:48,1:24:56,"Tu jako mi često te traume naš, to je naš zapravo glavni trigger nas roditelja, ja bih rekla naša kao milenijali, oni sve prečavamo, sve."
1:24:56,1:24:59,"Ponekad mi prepisujemo, nije sve trauma."
1:24:59,1:25:01,Znači plač djeci nije trauma.
1:25:02,1:25:08,"Dječji plač, ostavi dijete samo, negirat mu emociju, ne znam, odvojit ga od sebe, to je trauma."
1:25:09,1:25:13,"Ali pustiti dijete da plače, reći mu ne, ne znam, to nije trauma."
1:25:14,1:25:17,Takvo stajalište zapravo može samo da su prepopustljivi odgoji.
1:25:18,1:25:26,Ali isto tako u tim situacijama ono što kažeš na mudar način komunicirati i reći ono kad se situacija smirije.
1:25:26,1:25:30,Ajde drugi put možda da mu kažemo ovako ili onako.
1:25:31,1:25:34,Jer vidiš nekad te krive postoje.
1:25:34,1:25:37,Mislim naravno tu treba poduzeti i mi ih radimo na kraju krajeva.
1:25:37,1:25:42,Ja uvijek kažem mužu ono upozorime ili preuzimaj kad vidiš da nisam svoja.
1:25:45,1:25:47,To treba isto znati prepoznati kad više ne možeš naš.
1:26:24,1:26:28,"Da, to je baš jako važno naglasiti kao kad prođe situacija."
1:26:28,1:26:39,"I šta još mi super, jedna moja spoznaja, baš sam radila neki masterclass o zdravim navikama i o suradnji i o poštovanju i tako."
1:26:39,1:26:47,"I sad baš mi je prošlo kroz glavu, mi očekujemo od djece i da nas i poštuju i da surađuju, a mi se ne znamo povezati s njima."
1:26:47,1:26:56,"I ono mi je sinulo, pa čovječe, pa kad sam se ja, znači ja sad kao imam nekakav zahtjev i želim da moj partner nešto napravi, pa sam se ja, ili samo ono sam rekla, ti to moraš napraviti."
1:26:56,1:27:16,"Da, znači ako se povežeš pa nam, znam da ti je bilo teško, vidjela sam da nisi mogao, oprosti, nisam nisam mogla reagirati, ja sam imala nešto, ali ajmo idući put, probat ćemo ovako, ne moraš reći probačeš, probat ćemo, zajedno ćemo probati jer mi smo roditelji zajedno, kako se to kaže, co-parenting, ne znam koja je hrvatska riječ, suroiteljstvo."
1:27:17,1:27:18,"suroiteljstvo, da."
1:27:18,1:27:39,"Zapravo u toj povezanosti, baš sam neki dan o tom razmišljala, o toj povezanosti o kojoj sam počela razmišljati u smislu, ono, iz početka iz onih šturjih savjeta da bilo šta sa djetetom rješavaš kad ste povezani jer inače je uzalud i onda sam skužila koliko zapravo svaki problem u životu možeš rješavati tek iz povezanosti."
1:27:39,1:27:52,Pa na kraju krajeva toliko gledamo u tim filmovima ono od kriv neki istraga i na kraju kad se povežeš sa nekim likom iz njega tek kreneš izvlačiti ono šta tebi treba ili ono krene bolja suradnja.
1:27:53,1:27:57,Tako da apsolutno se može preslikat na sve.
1:27:57,1:28:21,"Da, maloprije si spomenula jednu riječ na koju se želim nadovezati jer mi je važna poštovanje i baš u tom kontekstu partnerskog poštovanja ali i onoga prema djetetu jer jako nam je važno da nas djeca poštuju, mi smo jako poštivali naše autoritete i onda je pitanje tog zarađivanja, evo, poštovanja, kako do njega doći."
1:28:21,1:28:32,I imam dojam da se tu malo razlikujemo u tim muško-ženjskim odnosima i očekivanjima prema djeci na taj način kao kako ćemo zaraditi poštovanje.
1:28:33,1:28:33,Što ti misliš?
1:28:34,1:28:46,"Pa evo, mislim da danas poštovanje zapravo dobiva puno, a ne mogu reći nekakvu negativnu konotaciju i zapravo ga izjednačavamo sa strahom."
1:28:47,1:28:49,Ja ne bih rekla ono poštovanje.
1:28:49,1:28:51,i strah nemaju nikakve veze jedna s drugom.
1:28:51,1:28:53,"Ako ne, pa strah o poštovanju to je ono."
1:28:54,1:28:57,"E, jako poznat pojam, mislim ja sam sad sarkastična."
1:28:57,1:29:02,"Ne, ne, ne, imam i odgovori na to, ali prvo bih se vratila, znači što se događa?"
1:29:02,1:29:07,Ti želiš da te tvoje dijete poštuje i ti dobivaš to poštovanje kroz strah.
1:29:08,1:29:10,"Znači ti ćeš mu prijetiti, nešto ćeš mu oduzeti."
1:29:10,1:29:15,"To je ono, znači doslovce tradicionalni stil odgoja."
1:29:15,1:29:19,"Znači tradicionalno roditeljstvo, tradicionalno odgoj, što je ono napravio?"
1:29:19,1:29:29,"Napravio je to da se mi, naravno ne svi, neću generalizirati, ali određeni postotak jel danas odraslih osoba se i dan danas na neki način boji svojih roditelja."
1:29:29,1:29:30,Zašto?
1:29:30,1:29:32,Jer nikad nismo imali pravo glasa u svojoj kući.
1:29:32,1:29:37,To je onda bilo jednostrano poštovanje i to je ono poštovanje koje ja kažem poštovanje iz straha.
1:29:37,1:29:46,Znači jer ti poštuješ svojeg roditelja ali zar ne bi trebalo poštovanje biti obostrano?
1:29:46,1:29:46,Da.
1:29:46,1:29:47,Jer što ti tražiš?
1:29:47,1:30:21,"Ti tražiš bespokornu poslušnost doma, to su ono baš tri tipične tradicionalne obitelji, bit će ona kak ja kažem, pod mojim si krovom dok ja kažem bit će ovak, mislim to je ono rečenice na kojima smo mi odrasli i to I to, kako da kažem, znači, tradicionalni odgoj ima jako puno dobrih karakteristika, ima i jako puno loših karakteristika i to treba biti svjestan i o tom treba razgovarati bez da se jako je teško znaš šta ti kad nakon nekog određenog doba sad moraš se osvrnuti, reflektirati na svoj život i na svoj odgoj i sad treba priznat svoje greške."
1:30:22,1:30:39,"Tu zapravo ljudi onda zauzimaju čvrste stavove, ne znam, vi moderni roditelji danas nemate pojma jer koliko ti zapravo snagu kao odrasla osoba sad, ne znam, baka i djed koji je tradicionalno odgajao, trebaš imati emocionalnu zrelost koju trebaš imati da bi ti priznalo., aha, ja nisam radio dobro."
1:30:39,1:30:45,"Jer sve ovo što mi danas radimo i zalažemo se, zapravo je više manje kontra od onog kako je nekad bilo."
1:30:45,1:30:53,"Kad je ono bio boom, behavioralnih svih učenja, daj djetetu nagradu, nagradu."
1:30:53,1:30:54,"Da, uvjetovanje."
1:30:54,1:30:55,"Da, da, uvjetovanje."
1:30:56,1:31:00,Daj djetetu nagradu kad napravi nešto dobro i kad neka ga napravi nešto loše.
1:31:01,1:31:03,Danas se ni psi na taj način više ne dresiraju.
1:31:04,1:31:06,Tako da mislim da smo mi više od životinja.
1:31:06,1:31:09,Ali da se vratim jer mi je pobjedila misao na poštovanje.
1:31:10,1:31:11,Što sam tu htjela reći?
1:31:11,1:31:12,Što dobivamo time?
1:31:12,1:31:16,"Dakle, iz straha mi dobivamo poslušno dijete."
1:31:16,1:31:17,Apsolutno.
1:31:17,1:31:20,"Znači naše dijete će nas slušati, to je bespogovorno."
1:31:20,1:31:34,"Ali je stvar u tome da će naše dijete čim mi okrenemo leđa i čim taj autoritet, taj rigidni autoritet i ono beskompromisni, neupitni autoritet, čim se taj autoritet makne, to dijete će raditi to ponašanje."
1:31:34,1:31:41,"A nama je u cilju, barem meni roditelju, a vjerujem da i tebi, da se ja povežem sa svojim djetetom sad dok mogu."
1:31:41,1:31:47,"Jer neminovno je da će se ono kako bude odrastalo, pogotovo u tinejdžerskim godinama, odvojiti od mene."
1:31:47,1:31:49,Znači neminovno je i tu.
1:31:49,1:31:55,"I tu ti kao roditelj trebaš već graditi vezu da tvoje dijete se jednog dana, kad se i odvoji, vrati tebi nazad."
1:31:56,1:32:05,"A ako ćeš ga odgajati u strahu, dobiješ dijete koje će ti lagati, koje će ti skrivati, koje je onda na kraju krajeva, zar je to onda i poštovanje ako ti lažeš svojem roditelju?"
1:32:05,1:32:11,"Ti onda nisi dobio, znači prvotno što si mu htio usaditi, ti mu nisi usadio jer si to išao iz tog strahu poštovanja."
1:32:13,1:32:20,"Evo ne znam, ja bih nekako poticala više roditelje da odgajaju kroz suradnju, a poštovanje da ide kao obostrana ulica."
1:32:20,1:32:25,"I pri tom ne mislim sad da ne bi neko krivo shvatio, znači naravno da djeca."
1:32:25,1:32:36,"ne odlučuju, odlučuju roditelji, ali to ne znači da ti svojem djetetu ne možeš reći znam, znam da ti tako želiš, ali svejedno će bit kako ja kažem jer sam ja roditelj."
1:32:38,1:32:42,Zašto su tolike polemike oko tog tradicionalnog i modernog odgoja?
1:32:43,1:32:46,Zato što mi jako krivo tumačimo taj moderan odgoj.
1:32:46,1:33:01,"Mi pod modernim odgojem smatramo prepopusljivo, to nije moderni odgoj ili ne znam kako bih ga nazvala, svjesni odgoj, to nije prepopusljivost, to je ono čvrste granice, mislim, nije to popusljivo."
1:33:01,1:33:09,"To je jednostavno čvrste granice, ali s poštovanjem djeteta uzimajući u obzir njegove razvojne mogućnosti jer mislim nećeš ti oduzeti."
1:33:09,1:33:14,"Tu je jako puno pojmova i to je taj gentle parenting, nesretni koji mi je i u naslovu."
1:33:15,1:33:30,"Ljudi krivo shvaćaju i ta šiba koja je tolika bura među ljudima jer još nisu ono načisto uopće ni sa spoznajom šta ona radi, izostanak šibe nije gentle parenting."
1:33:30,1:33:31,Ne.
1:33:32,1:33:41,"Nije, ako si odlučio da nećeš tjelesno kažnjavati svoje dijete, ne zna znači da mu nećeš dati granice, da ćeš mu dopustiti da radi šta."
1:33:41,1:33:44,"Znači, samo ćeš to raditi na drugačiji način."
1:33:44,1:33:54,"Ne znam, baš se provuklo se, ali to je zapravo više jer roditelji iz svojih hrana, ovo što smo malo prije pričali iz svojih hrana, jednostavno ne vide, ne vide što rade."
1:33:54,1:34:10,"Pod tom krinkom ja neću nikad više kao moji roditelji, pobjeći ću iz tradicionalnog odgoja, pobjeći ću u gentle parenting, ali ga neću živjeti onakvog sam ja, kako je on zapravo u nekakvoj svojoj srži zamišljen, zato jer ga živim iz opet fokusa na svoje roditelje."
1:34:11,1:34:26,"Znači, ja želim ne biti kao oni, a namaama cilj nije biti ono ne biti kao ona, jer opet je tu onda fokus na njih, na rođaju, a treba biti fokus na nama, na nama što smo mi dobro iz naših obitelji, jer sigurno je hrpa stvari koje smo mi iz naših obitelji predivnih ponijeli."
1:34:26,1:34:37,"Naravno bilo je onih manje loših, ali to nije razlog da onda sad razapinjemo naše roditelje i oni su isto učili ono što su njih učili, pa na kraju krajeva koliko su manje imali na kraju krajeva ovaj problem."
1:34:37,1:34:49,"Apsolutno, ali to što smo i rekli, znači tad je i struka se zalagala za drugačije stvari, tad su i preporuke bile, mislim ja znam često diskutirati s mužem, sad ćeš vitka za 30 godina, ovo je."
1:34:49,1:34:52,Ovo će biti obrati na ovo zato što će otići u krajnost.
1:34:53,1:35:10,"Zato što teško je zapitati se ono što je za mene važno, što je primjenjivo i da stvarno, opet ću spomenuti tu širu sliku, da vidiš širu sliku, da znaš ono otprilike šta očekuješ u budućnosti, šta želiš za svoju djecu, kakav odnos i ostalo."
1:35:10,1:35:19,"Na kraju krajeva, ako bi netko mogao zamjerati roditeljima, mogla bi ti, a čini mi se da nisi."
1:35:20,1:35:24,Moram reći da si jako otvoreno.
1:35:25,1:35:38,"i ranjivo, baš si se ogolila u potkastu Ive Kraljević i mislim ako netko te želi još dublje upoznati, svakako preporučam da to pogleda, imaš šta vidjeti i čuti o tebi."
1:35:39,1:35:50,"Razvedeni roditelji, imaš jako neke zdrave sada stavove, jel'se to sve dogodilo u majčinstvu ili ono, kako si ti se presložila?"
1:35:50,1:36:02,"Da, ne bih rekla baš da je sve u majčinstvu, već je proces istriljenja i nekakvog oprosta krenuo i prije majčinstva, ali da, mislim, što dobivamo od toga da živimo u zamjeranju?"
1:36:03,1:36:06,Je li to nešto što će nas učiniti boljim osobama?
1:36:06,1:36:08,Je li to nešto iz čega ćemo mi izrast?
1:36:09,1:36:14,Iz zamjeranja ne možeš izraz jer je to opet ono što sam već ne znam koji put spomenula.
1:36:15,1:36:17,Opet upireš prst u nekog drugog.
1:36:17,1:36:18,Što tebi čini upiranje prstom?
1:36:19,1:36:19,Ništa.
1:36:19,1:36:22,"Ti stojiš i dalje na istom mjestu, ne krećeš se."
1:36:23,1:36:25,"Evo ne znam, ne zamjeram."
