Start (HH:MM:SS),End (HH:MM:SS),Segment
0:25:03,0:25:08,"Tako da ipak evo, napredujemo i krećemo se, slušamo nekako potrebe djece."
0:25:08,0:25:13,"I još bih se nadovezala, pitala si me, sad mi je to prošlo kroz ono kao loš roditelj, jesi li loš roditelj??"
0:25:13,0:25:14,Burnija prilagodba.
0:25:14,0:25:16,"Da, ako je burnija prilagodba, ne."
0:25:17,0:25:20,"Dakle, prilagodba nema baš, mislim ima."
0:25:21,0:25:25,"Dakle, prilagodba ovisi prva stvar o temperamentu djeteta."
0:25:25,0:25:37,"Dakle, ako je dijete lakšeg temperamenta, ako lakše ulazi u nekakvu interakciju sa nepoznatim, sa novim iskusima, to smanjuje u biti vrijeme prilagodbe."
0:25:37,0:25:50,"Ako je nekog težeg temperamenta, ako se ne znam skriva, ako mu treba dulje vremena uz sigurnost da on krene, tu bi recimo mogla biti malo teža prilagodba, ali također ovisi o stilu privrženosti."
0:25:51,0:26:00,"Dakle, ono sigurno, sigurna znači roditelj koji je sa svojim djetetom razvio sigurnu privrženost, takva djeca će stvarno imati velike otpore."
0:26:00,0:26:02,"To što pitaš ono jesi li loš roditelj, pa zapravo ne."
0:26:03,0:26:20,"Znači ako si ti izgradio sigurnu privrženost sa svojim djetetom, što znači da si mu zadovoljavao njegove potrebe, bio tu kad je dijete plakalo, znači ono prva godina nam u biti i služi za to da mi odgovaramo na svaku potrebu djeteta, a ne da mislimo, ne da ono kažemo ne pusti ga da plače, presta će plakati."
0:26:20,0:26:23,"To je isto ono zanemarivanje, potiskivanje."
0:26:23,0:26:29,"I sad iz sigurne privrženosti, dolazimo u jedno okruženje novo gdje tvoj roditelj odlazi i dijete ostavlja."
0:26:30,0:26:37,"I tu dolazi jako burna reakcija, ponekad znači emocionalna prvenstveno, ali u nekim situacijama i fiziološka."
0:26:37,0:26:51,"Dakle, puno djece, mislim ovo sad govorim čisto da roditelji znaju otprilike što očekivati u manjim slučajevima, ali ima djece recimo koja povraćaju, koja ono od tolikog intenziteta plakanja doslovce ono povraćaju."
0:26:52,0:27:13,"Tako da evo nikako nije naznaka da si lošiji roditelj ako tvoje dijete burno doživljava prilagodbu, ti mu možeš pomoći, jel to što smo rekli, koregulacijom, zrcaljenjem pozitivnog stava, sigurnosti, kad predaješ dijete odgojiteljici, da pokažeš, jel to povjerenje koje daješ."
0:27:14,0:27:31,"Čisto da ono i dijete vidi, ok, moja mama sad, mislim ne moraš ti piti kavu sa odgojiteljicom, ali nekakve svoje osobne stavove ili ne znam, jel ti nekog preferiraš ili ne, to treba ostaviti sa strane, jer to znači djeca, znaš dobro i sama da djeca upijaju više ono što osjećaju nego što im mi kažemo."
0:27:33,0:27:38,"Sad sam rekla ovo za sigurno, još sam se samo htjela nadovezati, znači ove dvije vrste nesigurne prijevrženosti."
0:27:40,0:27:54,"Znači, ignorirajuća bi recimo bila pod navodnicima najlakša prilagodba jer to je dijete kojeg su ignorirali i čije potrebe nisu odgovarale i tako dijete u biti ni ne pokazuje emociju zato jer je naviklo da neće dobiti odgovor na tu emociju."
0:27:54,0:28:12,"To ne znači da to dijete sad ne osjeća nekakvu tugu, to samo znači da je naviklo da to na neki način mora ono u sebi potisnuti, ne obraditi jer nema kapacitete, nego ostati tako zatomljeno i to su najčešće ona djeca koja ulaze u vrtić, čak ne pokazuju ni nikakvu emocionalnu empatiju."
0:28:12,0:28:36,"Da, nikakvu simpatiju nije prema roditelju, nije prema odgojiteljici, a s druge strane rekla bih da je najgora zapravo ta adaptacija jer možda kod djece koja imaju ambivalentnost, znači ono kad je majka ponekad bila prisutna, a nekad nije, ovisno o njenom emocionalnom stanju, znači ako je odgovarala na emocije onda kad je ona imala kapaciteta, tu dijete zapravo dođe."
0:28:36,0:28:40,"Ja sigurno hoću da se to zaista odradi, da će doći mama po njemu."
0:28:40,0:28:41,"Jer nekad je, nekad nije."
0:28:42,0:28:50,"Jer sigurna privrženost u biti nakon nekog vremena dijete nauči, mama dolazi jer će se ti danas pojaviti, sutra će se pojaviti, preksudar će se pojaviti."
0:28:52,0:28:53,"Da, treba vremena."
0:28:53,0:29:07,"Da, mislim, ja ne znam, znači najbrža adaptacija koju sam ja doživjela u programu s majkama s kojima sam radila je bilo dva i pol tjedna, ali to ne znači, mi svi krivo možda povezujemo adaptacije."
0:29:07,0:29:11,Znači adaptacija nije samo kad dijete uže u skupinu bez da se rasplače.
0:29:11,0:29:12,Znači to nije adaptacija.
0:29:12,0:29:17,"Adaptacija, uspješna adaptacija je kad dijete radosno odlazi u taj vrtić."
0:29:17,0:29:20,Znači to znači da smo mi postigli ono što smo mi trebali.
0:29:20,0:29:22,To je jako dugačak proces.
0:29:22,0:29:25,To recimo možda i kod neke djece traje dok ne krenu.
0:29:25,0:29:32,"ona prva prijateljstva i drugačiji način zapravo igranja jer oni imaju sad, igraju se oni skupa, znaš."
0:29:33,0:29:36,Mislim da stvarno nekad imamo prevelika očekivanja od njih da bi nama bilo lakše.
0:29:36,0:29:44,"Pa nama bi bilo super da mi ih odvedemo oni odmah kažu i mi ćemo se igrati i ono ti mama idi, ništa se ne brini, kod mene je sve super."
0:29:44,0:30:05,"Ali realno i mi kad radimo bilo kakve promjene u životu, ideš na novi posao, na kraju krajeva vraćaš se sa godišnjeg, to smo neki dan pričali kako nam je kao roditeljima pogotovo koji imamo već stariju djecu pa cijeli osmi se ne ide u vrtić i onda ti moraš što pokriti godišnjim koji ne može biti toliki i sada je recimoimo ja ove godine imam adaptaciju koja će opet biti dva tjedna i to isto moram pokriti."
0:30:06,0:30:14,"Komentiramo mi ono kao kako to sve stići, koji su to poslodavci toliko razumni da ti možeš uzeti toliko vremena."
0:30:14,0:30:30,Ali s druge strane ako je dijete u fokusu i ako je najvažnije njegovo dobro i ako ga usporedimo sa sobom i kad se vratimo sa godišnjeg pa zar nam ne bi bilo idealno da prvo radimo tjedan dana po dva sata pa tjedan dana četiri da se vrati.
0:30:31,0:30:33,"Da, da, u pravu se slažem."
0:30:33,0:30:46,"Pa i u potpunosti da se vratiš na kolosijek, na svoju tračnicu lagano da se uhodaš, nego ono još pogotovo ako si odlučila evo, ne znam, u nedjelju ćeš doći s mora, onda krcate stvari i u ponedjeljak ideš raj."
0:30:46,0:30:48,Mislim da je to katastrofa.
0:30:48,0:30:51,"Tako da mi sad imamo ono novo pravilo ako idemo na more, vraćamo se dan prije."
0:30:52,0:30:59,"Imaš jedan dan ono čisto malo da vidiš da se šokiraš sa hrpom veša koje si donio doma i okej ajde, dobro, opraće se."
0:31:00,0:31:02,Treba malo vremena tog između da ne bude veliki skok.
0:31:02,0:31:06,Isto tako ne treba da je tu dan prije vrtića reći ono ej sutra ideš u vrtić.
0:31:07,0:31:23,"S obzirom na to da ćemo emitirati koji tjedan prije svih tih polazaka, koji su ovako neki konkretni savjeti koje bi dala i mislim kao odgajateljica si bila u toliko susreta sa roditeljima ono što si primjećivala da se događa da nije dobro, a što bi svakako preporučila."
0:31:24,0:31:26,"Evo, evo, ćemo prvo krenuti od pozitivnog."
0:31:26,0:31:27,Može?
0:31:27,0:31:28,"Može, ajde."
0:31:28,0:31:38,"Znači, evo, odmah da naglasim, dakle, ako sad kreneš sa nekakvim pripremanjem djeteta, ja bih iz mog osobnog stališta rekla da to radiš više radi sebe."
0:31:38,0:31:52,"Ono čisto da samu sebe pripremiš, jer opet ako ti dijete s godinu dana kreće u vrtić, on je odnosno jaslice, jer jaslice su mlađa starija jaslička, a od treće onda mlađa vrtička i starija vrtička, čisto da razlikujemo pojmove."
0:31:53,0:32:03,"Ako ti dijete kreće s godinu dana u jaslice, što god da ti zapravo napravio, možeš pomoći više sebi nego njemu jer opet te čeka to odvajanje."
0:32:04,0:32:14,"Evo što bih rekla, razgovor o vrtiću, pozitivan razgovor o vrtiću, odnosno o jaslicama, možda kupiti nekakve slikovnice na sličnu tematiku."
0:32:16,0:32:41,"Ono što mi je zapravo jako važno, sad mi je prošlo kroz glavu, to bi trebalo trajati duži period, a to je rad recimo jako važno za jaslice jer dijete kad dođe u tu nekakvu novu okolinu očekuje se od njega jer ako odgojiteljica jedna je na ne znam ili sada evo dvije po novom asistenti odgojitelj ipak dijete treba imati neke malo samostalnosti posebice recimo kod hranjenja."
0:32:41,0:33:08,"Znači poticati dijete da samostalno da živi licu žlicu, malo maknuti od sebe ono ta svoja očekivanja da sve mora biti čisto ili ne znam da ćeš ti mislim da se razumijemo, ja isto evo sad smo se baš uselili prije par mjeseci u novi stan, znači ne da mu nisam dala da jede nego sam ga još i ja hranila i sve prisutkala jer ono kao novo je bilo i sad smo se doveli u situaciju da dijete koje je godinu dana jelo, držalo svoju žlicu, sad praktički pred drugom godinom neće jesti samo."
0:33:08,0:33:15,"I sad ja trebam doći s njim u ono kolektiv i ono reći, evo da, ja savjetujem roditelje kako da pripreme, a moje dijete ne zna žlicu."
0:33:16,0:33:21,"Tako da evo, sad intenzivno radimo na tom da barem drži žlicu i da se, mislim nije da ne zna."
0:33:22,0:33:24,"Jednostavno, ja sam ga sad navikla."
0:33:24,0:33:24,Da.
0:33:24,0:33:26,"Sad je to lakše, on će zjevat, a mama."
0:33:27,0:33:28,"A nema veze, već on to za dva dana upozna."
0:33:29,0:33:35,"Na dobro, da nije problem, ali što se zapravo događa što sam htjela reći po te samostalnosti, dakle, djeca su pod prevelikim stresom."
0:33:36,0:33:38,"Dakle, to njima baš, preplavljujuće."
0:33:38,0:33:42,"Preplavljujuće je i nama roditeljima, ali mislim djeci pogotovo."
0:33:43,0:33:45,I sad ti trebaš kao takvo dijete u kolektivu jest.
0:33:46,0:33:47,"Znači, recimo ručak je."
0:33:48,0:33:59,"I sad djeca koja imaju na neki način svoju samostalnost razvijenu, bar da, ne znam, ručicama ako se to radi o djeci od godinu dana, pokušavaju držati licu, na neki način će se i moći sami nahraniti."
0:34:00,0:34:00,Jer što se događa?
0:34:01,0:34:02,Dijete odbija odgojitelja.
0:34:03,0:34:12,"Jer dijete u odgojitelju vidi neprijatelja na početku jer taj odgojitelj je njemu ono fiksacija, figura zbog koje nema njegove mame."
0:34:13,0:34:15,"Znači, mama me je ostavila sa tu samom tetom."
0:34:15,0:34:21,"Tako da tu će si roditelji uvelike olakšati ako potiču samostalno svoju djecu, barem evo što se tiče hranjenja."
0:34:21,0:34:32,"Svakako, evo preporuka je još možda nekakav predmet od doma, ponijeti to kažemo jel tješilica, nekakav prijelazni predmet koji ćete posješati na tu sigurnost doma."
0:34:33,0:34:52,"Ako dijete nema, recimo u mom slučaju mi svom sinu nismo ni nudili jer mislim ti si mu figura prijevrženosti i s tobom je povezan, nije nekako je li tražio ni trebao i sad smo mu počeli malo tuškat, tuškat, tuškat i evo sad smo dobili zapravo to da on spava sa lutkicom, gospom."
0:34:52,0:34:59,"Tako da ona to mi je isto na još jednoj razini lijepo jer čuvaćete gospa, čuvaćete Marija i to mi je onako znači kao majčica."
0:34:59,0:35:02,"Ne možete tvoja majčica, ali možete evo, nebeska majčica."
0:35:03,0:35:07,"Tako da evo, tješilica svakako, što sam još htjela reći?"
0:35:08,0:35:22,"Tješilica, ne bi bilo loše recimo da prošeću roditelji čisto ono da vide djete vizualno, možda da čak ono dva, tri tjedna svaki dan naprave tu rutinicu, jel šetnja i onda već da se povezuju putem."
0:35:22,0:35:24,Jel što se zapravo događa?
0:35:24,0:35:25,Dijete tu će faliti roditelji.
0:35:25,0:35:35,"Jako će mu faliti, onda ga na neki način tu napunimo, damo mu to vrijeme i prije i poslije, da onda na neki način ono čeka, da može čekati što će biti idući dan."
0:35:35,0:35:36,To isto recimo nije loše.
0:35:36,0:35:38,Znači nekakvu igru na putu do vrtića.
0:35:39,0:35:46,Napravi tu nekakvu svoju malu rutinicu jer svaka rutina djetetu u nesigurnoj okolini zapravo na neki način donosi sigurnost.
0:35:46,0:35:50,Zato i je u jaslicama i u vrtiću striktno raspored.
0:35:50,0:35:54,"Sad se ne znam, doručkuje, to zapravo stvara djeci sigurnost rutina."
0:35:54,0:36:03,"Tako da evo isto ne bi kad sam se sjetila sa toga, ne bi bilo loše možda prilagoditi i raspored doma rasporedu u jaslicama odnosno vrtiću."
0:36:03,0:36:05,"Da, pogotovo što se tiče spavanja."
0:36:05,0:36:06,"Spavanja, da."
0:36:06,0:36:11,"Tu je recimo isto, znaju mi ono, majke često mi se jave pa kako one doje, pa kako će one, kako će se dijete uspavati."
0:36:12,0:36:15,"Dakle, dijete u novim okolnostima funkcionira drugačije."
0:36:16,0:36:29,"Inače funkcionira s bakom, drugače funkcionira s djedom, drugačije jednostavno, s majkom najčešće ima najviše povjerenja, pouzdanja, najviše sigurnosti i osjećaja pa onda s majkom ono može ispoliti apsolutno sve emocije, osjeća se sigurno."
0:36:29,0:36:42,"Tako da evo ako netko sada gleda a doji, ja nikada ne savjetujem zapravo da se krene odmah naglim rezom dojenja jer to najčešće recimo dobiju majke savjet kao mama trebate presjeći s dojenjem."
0:36:42,0:37:04,"Mislim ako je to, sad naravno tu ovisi o dobi, nećeš ti do vrti do škole i dojiti svoje, opet kažem, svačije je odabir, želim biti političko korektna jer stvarno smatram da je to osobna odluka dokle god ne utječe na dobrobit djece jer često je to i više potreba majke nego što je to potreba djeteta."
0:37:04,0:37:05,"Kad ovo prijeđe, evo."
0:37:05,0:37:31,"Kad prijeđe, da, ma dobro, ne moramo se sad zadržavati, ali evo čisto ako se dvomite sad da želite naglo presjeći, znači bi bilo kakva sad nagla promjena, možda da pustimo malo proces adaptacije, isto i ako ste krenuli odvikavanje, nemojte sad krenuti od odvikavanja od pelena ako vam dijete sad kreće ne znam za dva tjedna u vrtić, to isto svi nikakvi nagli rezovi, možda bolje da jer previše je nesigurnosti i previše je novina."
0:37:31,0:37:32,Da.
0:37:32,0:37:34,"I onda ne krene malo i ovakav, onak će biti regresije."
0:37:34,0:37:57,"I onda ćete se i visekirati radi te regresije, ne znam, pa ja ste popiški na pot, pa ti tu budeš nervozan, onda možda tu nervozu pokažeš djetetu, tu se isto dijete onda povlači, onda si samo nepotrebno produžavaš i proces adaptacije i proces odvikavanja od pelena, odvikavanja, od dojenja itede Tako da evo nagle promjene možda ne uvodit nego možda malo pričekat taj cijeli period."
0:37:58,0:38:20,"I evo na samom startu ono kad krenu roditelji, kratki pozdravi, znači ovo si me pitala što ne radit, nikako ako vidiš da ti je dijete ušlo u skupinu, sad ono joj, jadano on ušao u skupinu i daj još mami jednu pusicu, nemojte to radit jer znači kad dijete osjeti vašu nesigurnost onda ste gotovi, tu onda zapravo kreće još veći otpori."
0:38:21,0:38:33,"Tako da evo kratki, kratki pozdravi ono, mamate ako voli, ovdje si siguran, dolazim brzo i to je to, to je sasvim dovoljno, pusa što god, kad jednom ga kreneš prodavati, odgojiteljici to je to, koliko god da te ono pucaš u sebi."
0:38:33,0:38:36,I to kad se god isto kao koala pa te pušta.
0:38:37,0:38:44,"Da, to je isti slučaj, ima svakakih slučajeva, ono kad se isto na način znam da ti je jako teško, mamate sada je teti tu si siguran."
0:38:45,0:39:04,"Da, nažalost fizički odvajati dijete, mislim isto je i sa posljednjim granicama, znači ponekad fizički treba dijete tu ono, odvojiti dijete od nečega, jer ti si, mislim ti si vođa svom djetetu, nije on tebi jer u kontra, kad se tu zamjene uloge, mislim tu zapravo dijete najviše pati."
0:39:04,0:39:18,"Ja uvijek kažem ono, znaš, nisu batine te koje će, naravno i batine će oštetiti, ali više će oštetiti dijete po meni pre blagi, prepopusljivi odgoj u kojem je roditelj dijete, a dijete roditelj."
0:39:19,0:39:30,"Jer tu su stvarno ono, barem ono, ako imaš nekakvo kažnjavanje, tu bar dijete ono ima neki smjer kretanja, da, uvlači se u sebe, ali što dobivaš sa ovim prepopusljivim?"
0:39:30,0:39:38,"Znači, dobivaš nekontrolu, znači, sredina, nekakva zlatna sredina je najvažnija i sad ne znam jesam li još nešto htjela reći."
0:39:39,0:39:45,Vrlo mi je na pamet oko tih pozdravljanja da je isto tako opasno ono laganje.
0:39:45,0:39:47,"Da, to sam zaboravila reći."
0:39:47,0:39:52,"Imali smo svakakvih slučajeva, kao igramo se skrivačem, pa se ja sakrijem i mene više nema."
0:39:53,0:39:56,"To je koliko god, hajde ovako ću reći."
0:39:57,0:40:05,"Imala sam slučajeva u kojima su odgojiteljice savjetovale roditeljima da vodu, a imala sam i slučajeve u kojima su roditelji radili."
0:40:06,0:40:08,"Sad prva stvar, naravno da ti je lakše."
0:40:08,0:40:21,"Znači lakše ti je, ako ti se dijete zaigralo, znači kao je sretretno joj, super, i idem ja sad ću mugnuti, lakše će biti toj odgojiteljici jer neće odmah krenuti taj proces, ono, ah, plakanja i od jedanput velikog otpora."
0:40:22,0:40:30,"Ali dugoročno, znači pazi ovo, ti ostavljaš u nepoznatoj okolini, okruženju, novom okruženju svoje dijete i od jedanput te nema."
0:40:31,0:40:36,"Dakle, tu je ono povjerenje trajno naljuljano, poljuljano, narušeno."
0:40:36,0:40:37,"Narušeno, narušeno."
0:40:37,0:40:38,"Da, to je bio moj las."
0:40:38,0:40:42,"Da, da, to sam te dvije riječi sam im bila u glavi, onda je izašla jedna miks, ali dobro."
0:40:43,0:40:50,"Dakle, javit se, znači koliko god da ti bilo teško, koliko god da znaš da će ti dijete plakati, nemoj pobjeći."
0:40:51,0:41:03,"Recimo, Bog, mama te voli i ona se raspadne i ona uzme si pet, deset minuta, dvadeset minuta u autu, plači, isplači ono dušu i srce ako treba, ali da je ono izdrži, izdrži, ti si odrasla osoba."
0:41:03,0:41:11,"Znači, tvoje dijete ne može kontrolirati svoje emocije, a ti kao odrasla osoba bi trebao kontrolirati svoje emocije."
0:41:12,0:41:21,"I samo je tu najteža ta spoznaja da si ti ogledalo, a tako teško ti je i toliko si preplavljen."
0:41:21,0:41:25,"U svakom slučaju, tako sam sretna što sad ne prolazim taj tjedan."
0:41:25,0:41:26,O tome ništa mi ne govori.
0:41:28,0:41:30,"Proći će, znam da će proces u životu proći."
0:41:31,0:41:36,Još bi se nadovezala na ovo što si rekla da smo mi roditelji ogledalo i koliko trebamo biti svjesni.
0:41:37,0:41:49,"Sad pritom ne mislim da ti sad fakeš, znači da ti sad glumate da tu isto onda si ti ugrču jer ti čim negeriš svoju emociju, kad stadi, na bilo koji drugačiji način će ta emocija izaći van."
0:41:49,0:41:55,"Tako da nema ništa loše u tom da ti kažem djetetu, mami je isto jako teško, baš ćeš mi nedostajati."
0:41:55,0:42:00,"Znači nema ništa ili kasnije reflektirati to s djetetom, baš mi je jako bilo teško, jedva sam čekala."
0:42:01,0:42:09,"jer pazi ovo, ti svojim djetetom, jelko regulacijom, pokazuješ, znači ti njemu imenuješ emociju, ti njemu daješ osnove emocionalne pismenosti."
0:42:09,0:42:15,"Dakle, pokazuješ me emociju koju imaš, validiraš ju sama kod sebe, pokazuješ ju kao nešto pozitivno."
0:42:15,0:42:24,"Znači, neki dan sam imala jedan call sa mamama u jednom programu i onda znam, često mi kažu, e oprosti, ja ću sad plakati."
0:42:26,0:42:28,"Mislim, koliko je to zapravo tužno."
0:42:28,0:42:31,"Jer bi rekla ono, oprosti, ja ću se sad smijati."
0:42:31,0:42:36,"Znači, toliko smo otuđeni od svojih emocija, pa evo imamo priliku svojoj djeci pokazati da je ok."
0:42:37,0:42:49,"Možda nama nije bilo dano i možda smo mi jel nekako spriječeni u tome jer se naši roditelji nisu mogli nositi s našim emocijama u nekim svojim drugim problemima, ali evo mi imamo priliku našem djetetu reći mama je tužna."
0:42:51,0:43:06,"Evo ovako izgleda tuga, mislim nećeš reći ovako izgleda tuga jel, ali tvoje dijete će vidjeti po tvojem licu da si ti tužna i već znači prva stvar je imenovati, znati imenovati, znati prepoznati, pardon oprosti, znati to prepoznati emociju i onda ju imenovati."
0:43:06,0:43:23,"Da bi ti uopće mogao šta ćeš šta ti s njom, da bi ti znao gdje ćeš ti s njom, na koji način ćeš ti nju, bilo to i ljutnja, mama je bila ljutnja u nekoj drugoj situaciji, mama je bila jako, čak i ono kad planeš, mama je bila ljuta, oprosti, viknula sam, drugi put ću, ne znam, drugi put kad osjetim da sam ljuta, stisnut ću jako šake."
0:43:23,0:43:31,"To je ono, regulacija na djelu i opismenjuješ svoje dijete i učiš ga ono o prvim osnovama samoregulacije."
0:43:32,0:43:37,"Da, to priznanje stvarno puno znači, meni je uvijek olakšavajuća, za mene osobna rečenica."
0:43:38,0:43:58,"Znam, ljubavni, mami se ne da na posao, jer ono i to je naša stvarna emocija, pa u redu je da ti se ne da, ali šta ćemo popodne, možemo nešto na napraviti, neki plan pa onda da nas to drži, da izdržimo neke i te popratne dijelove dana, koje nam možda i nisu nešto."
0:43:59,0:44:11,"Zato je ovdje važno imati onda kao fokus na pozitivnom dijelu dana, kao mama će doći i tu evo još jedan savjet, možete zajedno isplanirati s čemu će se to djete radovati, ono što će to djete kroz taj dan čekat."
0:44:12,0:44:15,Jer zapravo mi želimo da naša djeca osjete frustraciju.
0:44:16,0:44:21,Znači mi želimo graditi s njima toleranciju na frustraciju.
0:44:22,0:44:27,A kako ćeš ti graditi toleranciju na frustraciju ako ćeš ti apsolutno sve povlađivati svojem djetetu.
0:44:27,0:44:38,"Tako da evo, znači on će osjećati frustraciju i potiskivat će to jer eto da nažalost prva stvar, ta odgojiteljica mu još uvijek nije sigurna figura gdje će moći uopće iskazati svoje emocije."
0:44:38,0:44:49,"A uostalom neće ni svaka odgojiteljica može doć do djeteta, razumijem te vidim, znam da ti je teško doći, sad ću te grliti, zajedno ćemo disati, mislim to je jednostavno nemoguće."
0:44:50,0:44:52,To je nemoguće i to treba biti svjestan i ne očekivati.
0:44:53,0:44:54,To sam isto htjela reći.
0:44:54,0:44:59,"Još jedan dobar savjet, voditi računa u odnosu kakav imaš sa odgojiteljem."
0:44:59,0:45:05,"Dakle, graditi tu poštujući odnos u kojem ti možeš iskomunicirati."
0:45:05,0:45:11,"Meni se najčešće zna desiti ono, dobivam razno razne poruke gdje mi se ono roditelji jave na Instagramu pa mi se žale."
0:45:11,0:45:16,"I onda onda znači, mislim, što da ja radim s tim, da ja zovem tu odgojiteljicu pa da ja kažem što bi ona trebala?"
0:45:17,0:45:34,"Nekako smo ono, baš jako teško komuniciramo vlastite potrebe, lakše nam je ono potisnut u jednu krajnost, jel potisnut u sebe, pa onda pričati za leđa i ono grise ili u drugu stranu ono planuti i reći, mislim to isto nije poanta."
0:45:34,0:45:41,"Poanta je nekako ako vidiš, ako imaš nešto što traži iskomunicirati sa odgojiteljicom, pa možeš to i na poštujući način."
0:45:41,0:45:51,"Na njoj je na koji će, meni često znaju reći, da li ono ne želim to iskomunicirati, možda bude, ne znam, mrzila moje dijete ili možda bude se čak osjetila."
0:45:52,0:45:53,"Mislim, to roditelj isto može vidjeti."
0:45:54,0:45:57,Na kraju krajeva ti možeš se proigravati sa svojim djetetom doma.
0:45:57,0:46:03,"Dakle, djeca, pardon, nemoj pitati svoje dijete kako ti je bilo u vrtiću, neće ti odgovoriti."
0:46:03,0:46:08,"Pogotovo malo dijete, pa čak ni ovo dijete, dvije, tri, četiri godine, igraj se vrtića s njim."
0:46:09,0:46:22,"Ovi tu su tvoji prijatelji, ovi tu lutke su, ne znam, tu odgojitelj.ice, znači djeca kroz igru, zapravo ono, meni je presmiješno, jedna klijentica mi je ispričala na koji način zapravo je ono."
0:46:23,0:46:30,Nek se sad evo nitko ne uvjeri jer svi smo mi ljudi i svi mi viknemo i odgojitelji viču i roditelji viču i svi viču.
0:46:30,0:46:46,"On imitirala je sa svojim, ona lutkice su bile kao, dijele su ručak, a djevojčica je bila odgojiteljica, onda je rekla, ajmo ruke pod stol, mirno sjedi ono, derala se na svoje lutkice."
0:46:46,0:47:05,"Tako da evo ako misliš da se tvoja odgojiteljica osvećuje tvom djetetu, to isto možeš ono vidjeti, onda otići opet, jer razgovarati i reći što te muči, mislim, to su isto ljudi od krvi i mesa i sa svojim manama i sa vrlinama, nitko od nas nije savršen, ali sve se može iskomunicirati."
0:47:05,0:47:11,"Tako da evo moj veliki apel, nemojte pisati u DM, na koji način."
0:47:12,0:47:22,"Da, na koji način se odgojiteljice odnose, nego više to, i to mi je isto, baš mi je to, moram priznati da mi je to jako ružno, očitat ono u mama grupama, na koji način zapravo razgovaraju."
0:47:22,0:47:25,Sad ovo govorim iz perspektive osobe koja je radila s djecom u vrtiću.
0:47:26,0:47:30,"Pa daj ono ako te nešto muči, pa recimo meni, naći ćemo se negdje na sredini."
0:47:30,0:47:34,"Ja sam isto griješila iz svog neznanja, iz neiskustava."
0:47:35,0:47:39,"Učiš dok si živ, isto kako roditelji, tako i struka, mislim."
0:47:40,0:47:55,"Ići ćemo s tim, ali moram i toga, s obzirom na frustraciju koju smo već ranije spomenuli, na kraju krajeva i to su roditeljske frustracije koje ne znamo usmjeriti na pravu osobu, nego na kraju pričaš okolo, a ne osobi i tražiš rješenje."
0:47:55,0:48:03,"A naša djeca koja se uče da budu tolerantni na frustraciju, izloženi su brojnim frustraracijama tijekom svog vrtiškog dana."
0:48:04,0:48:18,"I jedna onako važna stvar za roditelje je znati da će ispucati te frustracije nakupljene odmah tebi u facu, čim izađeš."
0:48:18,0:48:22,Čak u nekim situacijama uopće ne bi rekla čim izađeš nego čim te ugleda na vratima.
0:48:23,0:48:35,"Imala sam ono djecu koja su u prolazu rušila stolice, ono lupala, još ti ono čušku dobacila svom prijatelju i onda taj mali plače ono treba mu mama svaki čas doći pa ti traži objasniti zašto njeno dijete plače."
0:48:36,0:48:48,"Tako da ono čim, naravno kod svakog djeteta je drugačije, ali da, treba očekivati da će prilagodba biti M teška na vratima vrtića i M teška na vratima našeg doma."
