Start (HH:MM:SS),End (HH:MM:SS),Segment
0:00:00,0:00:04,"Ja sam odgovorna za svoje odabire, ja sam odgovorna za svoje odluke."
0:00:04,0:00:07,"Ne mogu ja cijeli život, moj mama i tata su krivi jer su se razveli."
0:00:08,0:00:09,"Nemaš pojma, fejlaš kod tata."
0:00:09,0:00:11,I šta se tu događa?
0:00:11,0:00:20,"Tu se događa da ono, mislim muškarci, ja vjerujem da se muškarci pitaju šta sad ne valjam, pa ću probati jednom, pa opet ne valjam, pa ću probati drugi put, pa opet ne valjam, pa ću probati treći put."
0:00:20,0:00:22,"I onda će više reći pa daj, evo ti radi sama."
0:00:23,0:00:24,I šta onda dobiješ?
0:00:24,0:00:34,"Dobiješ da si u svojoj kontroli, u svom savršenstvu, iscrpljena, nemaš podršku, jer imala si ju, ali ju nisi prihvaćala, htjela si da bude po tvojim kriterijima."
0:00:35,0:00:36,Majčinstvo stvarno...
0:00:37,0:00:50,"I ono najbolje u nama otkriva, ali mislim da je ono najgore i svaki roditelj koji ne vidi to ili ne želi možda to priznati, mislim da živi u zabludi i da si time zapravo šteti i sebi i svom djetetu."
0:00:50,0:00:54,Zakasnili ste ako vaše djete nije prije treće godine došlo u vrtić.
0:00:55,0:00:56,Što ti misliš o tome?
0:00:56,0:01:12,"Tvoje djete je bilo u tvojem okrilju, davala si mu ljubav, pažnju i sad šalješ ga pod navodnicima u nepoznato, u neko novo okruženje, to je zatvaraš jedno poglavlje zapravo svog života i otvaraš poglavlje novog života tebe kao majke koja se vraća na posao."
0:01:12,0:01:16,Adaptacija nije samo kad dijete uđe u skupinu bez da se rasplače.
0:01:16,0:01:17,"Znači, to nije adaptacija."
0:01:17,0:01:22,"Adaptacija, uspješna adaptacija je kad dijete radosno odlazi u taj vrtljeb."
0:01:22,0:01:32,"Ako ti dijete kreće s godinu dana u jaslice, što god da ti zapravo napravio, možeš pomoći više sebi nego njemu jer opet te čeka to odvajanje."
0:01:32,0:01:34,"I opet je, znači, evo što bih rekla."
0:01:38,0:01:41,"Gledate podcast rastoči s djecom, dobar dan i dobrodošli."
0:01:41,0:01:44,"Ja sam Ana Pavlović, voditeljica, domaćica."
0:01:45,0:02:06,"Mogla bih reći, jer ovo je mjesto kao moj drugi dom, a moram se predstaviti za sve one koji su novi na našem novom kanalu iako podcast već neko vrijeme radimo, snimamo, slušamo neke stručne i mudre ljude, to je naša misija da rastemo s djecom i da informiramo i sve vas."
0:02:08,0:02:18,Na početku bih vas odmah zamolila ako se prepoznajete među tom publikom roditeljskom koja je spremna znati više da se pretplatite na naš novi kanal.
0:02:19,0:02:43,"Ima jedno malo zvonce tu u opisu videa, vidjet ćete ga lako, to ne znači nikakvo posebno plaćanje nego jednostavno obavijest YouTube-u da vas ovakav sadržaj zanima i da vam onda to i nudi, a na kraju krajeva i nama je važno zato što te brojke možemo predoći nekim potencijalnim partnerima koji će nas podržati i onda u skladu s time mi možemo kreirati ovaj sadržaj koji je za vas na kraju krajeva besplatan."
0:02:43,0:02:51,"Iznimno mi je čast i zadovoljstvo reći da danas imamo jednog posebnog partnera koji omogućuje ovu epizodu, a riječ je o HIP-u."
0:02:51,0:03:18,"To je brand koji radi preko šezdeset godina i nudi našoj djeci kvalitetan nutritivan obrok, a vjerujem da je svaki roditelj dobro upoznat i sa praktičnim pakiranjem koje imaju i sa raznim okusima 100% voćnog pireja i da je to nešto što se svakodnevno nađe u vašim torbicama i vrlo je zgodno onako zaponijeti i na put i na izlet, šetnju."
0:03:19,0:03:28,"Ono kad se ne stigne nešto posebno pripremiti doma, uvijek dobro dođe nešto što znamo da je kvalitetno, da je organski i da je za dobro našega djeteta."
0:03:28,0:03:40,"O tome što je dobro za djete, što je dobro za nas, kakva su nam uvjerenja, što možemo mijenjati, danas će biti u fokusu ovoga razgovora."
0:03:41,0:03:43,Vrijeme je da vam predstavim svoju gošću.
0:03:44,0:03:45,"Antonija Domović, dobrodošla."
0:03:46,0:03:47,Hvala još bolje te našla.
0:03:48,0:04:00,"Ti si Antonija majka, ujedno si učiteljica, odgajateljica u vjeri i kako si se nazvala savjetnica za svjesno roditeljstvo ili majčinstvo."
0:04:00,0:04:04,Je li Mama sveznalica na Instagramu možda ime koje ću biti najpoznatije?
0:04:05,0:04:06,"Pa da, evo."
0:04:06,0:04:08,Dobro si rekla.
0:04:08,0:04:10,Sad baš ono razmišljam što bih ja tu nadovezala.
0:04:11,0:04:28,"Meni ono kad si mi se javila i kad smo se nešto čuli preko poruka, prva stvar, pratim te već neko vrijeme i jako mi se sviđaju i gošće i evo odmah da pohvalim ovako rad, općenito tvoj i tvoje zalaganje jer mislim da je jako važno zapravo o ovakvim temama jako jasno i glasno govoriti."
0:04:28,0:04:48,"Ali prvo mi je zazvonilo ono rasući s djecom i onda sam si pomislila, ajme pa to je ono moja misija i svrha, to je ono moj opis na mom Instagram profilu, ono kao za majke, za roditelje koje žele rasti zajedno sa svojom djecom i to je nekako ono moja misija i moja svrha mog pojavljivanja online i zapravo ono mog života."
0:04:49,0:05:18,"Možda bih još nadodala evo da sam evo supruga jednom predivnom muškarcu koji je evo trenutno usred strane države jer smo evo došli spojili smo možda malo ono kao poslovno i privatno, čuva dvoje malih klinaca, ono krajičkom nekog uma mi je u glavi, ali sve u redu, ali evo vjerujem njemu i jako se veselim zapravo što ćemo kroz ovu epizodu pričati upravo o takvim temama, o povjerenju i svemu onome što si navela u početku, tako da evo hvala što si me pozvala i jako se veselim."
0:05:18,0:05:27,Hvala tebi što si došla ipak si baš danas prevalila put iz Zagreba do Mostara i jako brzo si stigli i baš svježe izgledaš s obzirom na to da si ustala prije pet?
0:05:27,0:05:39,"Da, da, da, to je ono valjda naša karakteristika majke, ono izgleda najbolje što možeš u danom trenutku da se ne kuže ovi podočnjaci, a vjerujem da ona šminka, šminka zapravo, čini čudno."
0:05:39,0:05:41,"Nema veze, neka nama šminke."
0:05:43,0:05:49,Volimo mi i prekriti nekada naše i pravo stanje i emocije.
0:05:51,0:05:58,Sa stručnjacima sam do sada i komentirala koliko je važno da budemo autentični i da budemo onako svjesni kako se predstavljamo pred djecom.
0:05:59,0:06:49,"To je isto nešto o čemu ćemo danas razgovarati, ali htjelo bih s tobom na početku s obzirom na ovo doba godine, mi smo evo snimamo početkom osam i reći ćemo malo kasnije je kao godišnji su, sad smo mi nešto opušteni, djeca su nam doma, s nama malo više i mogu reći da čak ima ono znaš trideset jedan dvanaest jedanjedan pa i nekakav kraj godine imam osjećaj da je meni ovo jedan ciklus završen valjda mi je ostalo još od obrazovanja ono kad krene nova školska godina, nova vrtička godina da kao da mi je to neki novi početak pa i sad imam dojam jedan je novi početak pred nama u tom devet mjesecu i za brojne roditelje, brojne mame i djecu to će biti prvo odvajanje u smislu polaska u vrtić i znam da je to i kod tebe slučaj."
0:06:49,0:06:52,"Kako se osjećaš, šeseli već uzbuđena zbog toga?"
0:06:52,0:07:48,"Pa je, znači strašno sam uzbuđena, rekla bih čak ono i pozitivno i negativno jer ipak, a mislim kao svaka majka do sad si bila, tvoje dijete je bilo u tvojem okrilju, davala si mu ljubav, pažnju i sad šalješ ga pod navodnicima u ono nepoznato, u neko novo okruženje, to je zatvaraš jedno poglavlje zapravo svog života i otvaraš poglavlje novog života tebe kao majke koja se vraća na posao, nekakvim svojim snovima, ambicijama, željama, jer do sada je realno ono, prvih godinu od dvije, ok, kod nas je situacija bila da moj dječak će, sad u devetom mjesecu su dvije godine, mi smo se nekako hendlali doma jer sam pokušala ono što više zapravo produžiti to zajedničko vrijeme, ali da, evo imam i ja neke svoje ambicije i snove osim, jel majčinstva koje trenutno smatram jednom od najvažnijih uloga mojih zapravo, ali evo veseli me, radujem se, uzbuđena sam, ali isto ima jedna doza ono."
0:07:48,0:07:58,"na ono anksioznosti u meni koju evo sad i ovako javno priznajem, ali da, baš ono što si rekla treba razgovarati i jasno govoriti o onom kako se osjećaš."
0:08:00,0:08:09,"Onako fokus je uvijek na djeci zato što o ridu rade najveću promjenu i uglavnom smo zabrinuti kako će reagirati, kako će teći prilagodba."
0:08:10,0:08:25,"A ono koliko se zapitamo i procijenimo naše emotivno psihičko stanje, kako se ti nosiš time sa svojim emocijama, koliko ih prepoznaješ i ono što uopće prenosiš djetetu."
0:08:25,0:08:26,Dijete tu jesi li svjesna toga?
0:08:26,0:08:26,Da.
0:08:26,0:08:35,Pa mislim da je zapravo kad se kreće tako u jaslici ili u bilo koju novu životnu etapu jako veliki fokus to što si rekla zapravo na djetetu.
0:08:35,0:08:39,Mislim da svi moramo biti svjesni da su to premala djeca.
0:08:39,0:09:01,"Recimo djeca kod nas kreću sa godinu dana u jaslice i to su djeca koja nažalost koliko god da mi njih pripremamo prije nego što oni pođu u jaslice jednostavno ne postoji ni jedna toliko dobra priprema koja će sad njih pripremiti da oni tu adaptaciju odrade savršeno, bez nekakvih emocija, bez otpora, bez plača, bez onog kasnijeg otpora kad se vrate."
0:09:01,0:09:04,"iz jaslica doma, nakon tog nekog provedenog vremena."
0:09:04,0:09:13,"Tako da bih ja rekla, evo, ako se radi o maloj djeci od godinu dana, tu je nekako više, ja bih rekla da je to veći fokus treba biti na roditelja."
0:09:14,0:09:34,"Jer zapravo roditelj je taj ono koji je svom djetetu ta sigurna luka i roditelj je taj koji na kraju krajeva i vodi svoje dijete i onaj dobro poznati koregulacija i ono preko zrcalnih neurona na koji način zapravo djeca upijaju našu emociju i na koji način onda oni idu, s kojom i porukom onda idu u jaslice."
0:09:34,0:09:50,"Tako da bih evo ja rekla da ja jako svjesno osvještavam samu sebe što to točno osjećam, od kud meni to, što se krije iza toga i za te moje krivnje i za straha i za ne znam možda srama jer sam ono željela biti majka koja je doma sa svojim djetetom."
0:09:50,0:10:20,"Tako da evo puno je tu nekakvih emocija, možemo ih ako želiš ono razložiti jednu po jednu jer vjerujem da jako puno zapravo majki prolazi isto, slično i nesvjesne zapravo dolaze ono glavni fokus stavljaš na djete, kako će djete odraditi i onda odjednom kreće ono otpor, plač, objesiti se na vratima, ne želite ući u prostoriju i onda izgubljena u tom svemu, zapravo tu svoju izgubljenost i nesigurnost prenosiš tim zrcalnim neuronima na svoje dijete i tu onda traje adaptacija."
0:10:20,0:10:26,Pa onda nikako zapravo da se dijete odvikne jer zapravo roditelj je taj koji nekako prolongira.
0:10:26,0:10:33,"Znači, svojim stanjem, ako je roditelj siguran, puno brže i puno efikasnije će proći ta cijela adaptacija."
0:10:34,0:10:48,"Ako je nesiguran i ako to pokazuje, ako ne može kontrolirati svoju emociju, a najčešće je to zato jer ju nije ni osvijestio, dakle ne zna što se točno skriva iza tog ne znam, krivnje, što se skriva iza krivnje, ja meni je sad ne znam, osjećam se krivo jer moje dijete ide u jaslice."
0:10:48,0:10:50,Što se skrije iza moje krinje?
0:10:50,0:10:57,"Za moje krinje se skrije to da sam odrasla s majkom koja je veći dio mog djetinstva žrtvovala, pod navodnicima žrtvovala, ostajala doma."
0:10:58,0:11:01,I to je ono jedno moje uvjerenje koje ja nosim.
0:11:02,0:11:08,"Dobra majka je ona majka koja žrtvuje svoje slobodno vrijeme, svoje ambicije, svoje želje kako bi odgojila djecu."
0:11:08,0:11:10,Tako da evo to je krinja recimo kod mene.
0:11:10,0:11:16,"Pa onda ne znam, strah, strah, ono, rekla sam da će moje dijete biti do treće godine doma."
0:11:16,0:11:18,"Je, mislim svašta u životu mi kažemo."
0:11:18,0:11:33,"Ono kad bi sad vratila se unazad još dok sam radila, jel kao učiteljica i kao odgojiteljica, koliko sam stvari i onda u životu rekla neću ovo i neću ono, onda se ti nađeš u tim cipelama majke i misliš ti, ajme ono, više nikad u životu neću reći neću."
0:11:33,0:12:01,"Tako da evo, svega tu, miks svega je i onda kad dođeš pred ta vrata i misliš ti, ajde, sad sam pročitao u nekim prijedručnicima, ono ne znam, zajedno ćemo izabrati bočicu, zajedno ćemo birati papučice, govorit ću kako će biti lijepo u vrtiću, kako će se igrati sa prijateljima, misleći da pripremeš zapravo dijete i onda dođeš i ono sudar, sudar realnosti te ono obuzme i tu onda zapravo ti kao roditelj sebe izgubiš."
0:12:01,0:12:22,"I onda najčešće u takvim slučajevima zapravo vidiš da onda otac preuzme tu funkciju, majka se stvarno ne može nositi, nije se adekvatno pripremila i onda otac je malo kao racionalniji, glava u obitelji, čvrsta ruka, možda malo manje emotivan isto iz nekih svojih starih uvjerenja, muškarac mora biti jak i čvrst."
0:12:23,0:12:30,I onda iz mog iskustva se nekako uvijek događalo zapravo da je tu otac preuzeo nastavak vođenja djeteta.
0:12:30,0:12:37,"Mi smo se, evo suprug, ja smo se dogovorili, on je meni rekao što se mene tiče, ja mogu ići sa sinom."
0:12:37,0:12:42,"Ujutro meni se ne da slušati kao ono znaš, kao šta je bilo, šta mu prenose odgajateljice na vratima."
0:12:43,0:12:44,Ali evo ima još vremena.
0:12:45,0:12:47,"Ne, evo ne znam jesam li ti odgovorila na pitanje."
0:12:47,0:12:48,Ne znam ni šta sam te pitala.
0:12:49,0:12:58,"Sve se to nekako veže na kraju krajeva, nije ni važno, to je nekakav slijed misli i jako puno je toga zapravo u odgoju i u našoj komunikaciji i odnosu sa djecom."
0:12:58,0:13:13,"Dok to pričate, ja onako vrtim našu prvu prilagodbu i sve to što sam osjećala i kako u biti, kao uvjeren si u sebe, u smislu tom da si ti sebi razumno posložio sve to."
0:13:14,0:13:43,"Ja se moram vratiti na posao, na kraju krajeva poslodavac me čeka i ti moraš ići u taj vrtić u jaslice, nebitno kao misliš da si dobar, a onda ide jedan tjedan, drugi tjedan, treći jer sad ovisi o vrtiću kako uopće ide prilagodba i ako to baš krene biti burno ne možeš se ni zapitati jesi li dovoljno dobar roditelj, jesu li loši roditelji oni kod kojih djeca burnije reagiraju ili ako to duže traje?"
0:13:44,0:14:46,"Pozitivno ako ti ne odgovorim, samo bi se radila zapalam jedan dio što si rekla, kao kad se nađeš u toj bujici svega, zapravo je onda poanta da komuniciraš sam sa sobom prije nego što sve krene, kad si ti posložiš ono što ti zapravo osjećaš, što se, kako sam već rekla, što se krije iza toga svega i kad si već donio odluku, znači ti povjeravaš svoje dijete, tvoje dijete ide u nekakav sustav, ipak je zaštićenije u nekakvom sustavu, ne daješ ga ti nekakvom strancu na ulici, to je ono uređeni sustav pod svojim zakonima i svojim pravilima, lakše će sve proći, tako da evo svakako apel roditeljima da budu svjesni da nije lako, mislim ja sad govorim jel iz iskustva ljudi s kojima sam majka, s kojima sam ja radila i kroz svoj program pripreme, ali dok sam ja bila jel radila u vrtiću, sad ćemo vidjeti kako će meni jel biti to kao roditelju, vjerujem da će mi biti teško, evo trudit ću se ne zrcaliti nesigurnost nego ono, ali dobro, mislim to će biti."
0:14:46,0:15:02,"Ali to je najteža nekako stvar, da bez obzira na to što ti razumno znaš da je to dobro rješenje, koliko te svoje osjećaje i ne prepoznaš i ono ne registriraš, ne pozabaviš se njima i onda ih nesvjesno prenosiš."
0:15:02,0:15:14,"Jer sjećam se kad sam sa svojim prvim sinom nakon dva tjedna, ja i prijateljica u istoj situaciji i na kraju krajeva ono skužiš i taj osjećaj krivnje i srama i svega što si navela."
0:15:15,0:15:22,"Ja kažem, ali ja znam da on treba, ali ja to njemu sve ponavljam kao da je to sve tako lijepo isto što si navela."
0:15:22,0:15:26,Ali on kao i dalje odbija i onda nam se dogodila situacija.
0:15:26,0:15:30,Ja sam tada rodila drugoj i zato mi je bilo još posebno izazovno.
0:15:32,0:15:35,Ostao ju je jedan dan doma s nama i to je bilo kaotično.
0:15:36,0:15:48,Ja sam samo tada napokon shvatila da to ne bi moglo tako funkcionirati jedno energično dijete i jedna mala beba i jedna mama koja je jako rastrojena da ne funkcioniraju zajedno i da će to stvarno biti dobro rješenje.
0:15:48,0:15:56,"Tek tada, znači kad sam ja stvarno osjetila mir u sebi je prilagodba krenula u pozitivnom smjeru."
0:15:56,0:16:03,"Ali ono cijelo vrijeme sam kao mislila, ok, i sam ja s njim, ja znam da on mora, ali ono, to što znam nije bilo dovoljno."
0:16:03,0:16:32,"Pa to je zapravo ta ono, nekakva razdjela između tog racionalnog i emocionalnog jer mislim i po goćama koje su ti gostovale i mislim ti si pedagog po struci, vjerojatno, mislim, svjesna si toga da u trenutku kad emocije obuzmu, racio tu ne možemo reći isključi se, ali recimo da emocionalni dio mozga puno jače tu onda funkcionira i onda sve ono i logičko zaključivanje i empatija i nekakva ta kontrola impulsa, nažalost, jer to sve malo dođe u pozadinu."
0:16:32,0:17:30,"Tako da, evo, to baš mi je dobro što si rekla, tek kad si ti ono sama pomirila se s tom činjenicom, iako ako sad ovdje ima netko možda od slušatelja, tko ima možda doma, prinova stiže, to isto je recimo jedan od faktora koji će otežat prilagodbu ako se baš poklopi u isto vrijeme, tako da evo moj savjet je da ipak dijete ostane, barem ne znam, prva stvar zbog bolesti jel koje može starije dijete dovesti bebi doma ali zbog toga ono kao sad mene mama ostavlja, ostaje doma sa tom bebom, emu je to ono, njegov cijeli sistem sigurnosti i povjerenja se tu ruši, došla je neka ono nova osoba mala koja uzima sve to što je nekad bilo samo njegovo, tako da evo, tražit podršku možda od ne znam baka, djedova, čisto da to dijete starije vidi, malo doživi tu malu bebicu i na kraju krajeva na taj način i stvara te prve temelje povezivanja sa tom bebicom da sad ne misli ono šta oni sad rade."
0:17:30,0:17:32,Mislim svašta u tim dječjim malim glavicama.
0:17:33,0:17:37,Ali još sam htjela reći ovo što si rekla kao možeš ti svom djetetu ponavljat koliko god.
0:17:38,0:17:43,"Znači djeca su u toj dobi, znači od godinu do tri kada oni kreću u jaslice."
0:17:43,0:17:51,Znači oni kognitivno nisu sposobni razumjeti da mi njima kažemo ti sad ideš u vrtić i ti ćeš ostati u vrtiću i onda ću ja doći po tebe.
0:17:52,0:17:58,"Oni to ne mogu razumjeti nego oni iskustveno, znači svakim tim pojavljivanjem kad roditelj dođe na vrata, uče."
0:17:58,0:18:01,"Jer prvotna njihova reakcija mene je moja mama, mene je moja moj tata."
0:18:02,0:18:08,"Mislim, evo mene sad ono steže me u prsima kad se sjetim zapravo što nas sve čeka na jesen, ali to je njihovo ono."
0:18:08,0:18:13,"Prva, prva njihova ono poruka koju oni dobiju, mene je moj mama ostavila u nepoznatom."
0:18:13,0:18:14,Jesam li ja siguran ovdje?
0:18:15,0:18:15,Tko je to?
0:18:15,0:18:31,"Znači, kod nas je malo sustav, je li taj odgojni sustav je malo drugačije posložen, jer zapravo mi očekujemo da se dijete adaptira u okolini koju ne poznaje, bez svoje figure privrženosti, bez svoje figure koja je njemu sigurna privrženost."
0:18:32,0:18:40,"Tako da, evo, po meni, ako bi se sustav išta, ako će itko, je li tko donosi odluke i kad čuti i vjerujem da postoji još puno stručnjaka koji se zalaže za to."
0:18:41,0:18:56,"Svakako apel na produljenje procesa adaptacije i boravljenja više, da roditelj može više, dulje dolaziti sa djetetom u tu skupinu jer dijete stječe povjerenje prema nepoznatoj osobi preko svog roditelja."
0:18:56,0:18:57,"Opet ta, jel kod regulacije."
0:18:58,0:18:59,A što se s vrtićima gdje toga uopće nema?
0:19:00,0:19:00,Da.
0:19:00,0:19:05,Kraju krajeva kod mene u vrtiću roditelji ne budu u skupini.
0:19:05,0:19:11,"Ova prilagodba je samo u smislu vremenske, dva sata, četiri sata pa onda ide."
0:19:11,0:19:13,"Znači ni ne uzete ono, ne."
0:19:14,0:19:14,Ništa.
0:19:14,0:19:21,"U to je ono, drugi dan malo slikanje, ovo nešto ispred vrata, na kraju krajeva prvi dan prođe najbolje jer je sve super, wow, novo."
0:19:21,0:19:28,"Drugi dan, treći, ono kad skužiš čeka i oni meni vraćaju, nije mi ok, ali ajde još sam kratko, barem to tako kod nas."
0:19:30,0:19:42,"Iskustvo je pokazalo, što mi je potvrdila i ova mu pedagoginja vrtića, da tek treći tjedan krenu ono pravi problemi kada oni skuže, čekaj malo, ovo je ono, sad pravilo."
0:19:43,0:19:53,"Da, zapravo mislim ovo što sad navodiš meni je to ono kao da, znaš ono kad imaš razne metode uč učenja i sad ne znam, netko baci dijete u vodu kao plivaj."
0:19:54,0:19:56,To bih ja evo poistovjetila.
0:19:56,0:19:57,"Mislim, kod nas je slično."
0:19:57,0:20:02,"Znači, mi ćemo samo prvi dan nešto kratko, drugi dan on ustaje pola sata, sat vremena."
0:20:02,0:20:04,Samo ovisno jelo odgojiteljice tu procjenjuju.
0:20:04,0:20:12,"Znam da sam dobila odgovor, mislim, evo iskreno, ja nisam zadovoljna takvim odgovorom, ali kao da se u koronaju pokazalo da se djeca brže adaptiraju."
0:20:13,0:20:18,"Ok, brže u smislu da, možda i je brže, ali je li sigurnije za dijete?"
0:20:18,0:20:24,"Jer dijete uči potiskivati, znači, baciš dijete negdje."
0:20:24,0:20:58,"Dijete će se adaptirat, dijete je adaptibilno, znači ono, njegov mozak funkcionira, ono, dok uči, dok prolazi nova iskustva, ali sve se onako nekako sigurnije za dijete odvija kad je dijete sigurno, a dijete bez svoje figure privrženosti nažalost ne može biti sigurno, tako da zbog toga su jako veliki otpori, zbog toga su jako velike ono i regresije, ne znam šta sve, ne znam, djeca koja recimo su se odvikla od pelena, moguće da će ponovno mokriti, ugačiti se, djeca koja su se odvikla od ne znam dude, nekakve moguće da će, znači vraćaju se razvojem do nazad."
0:20:59,0:21:05,"Evo ne znam, moj stav je da je vaša i razlika ta je li dijete ide u jaslice ili u vrtić na kraju krajeva."
0:21:06,0:21:26,Neki dan sam baš vidjela jedan video gdje jedna odgajateljica koja se poziva na jedan jako poznat i cijenjen program kao vlasnica tog vrtića s tim programom kaže roditeljima ono baš izravno zakasnili ste ako vaše dijete nije prije treće godine došlo u vrtić.
0:21:26,0:21:27,Što ti misliš o tome?
0:21:28,0:21:46,"Pa evo, ako gledamo razvojno prema nekakvim mogućnostima djeteta da dođe u skupinu, da pokuša to, jel te emocije s na neki način sam regulirati sebi, iako znamo da je to sad tek od četvrte nekakve naznake do sedme, znači to je ono cjeloživotni, samoegulacija je cjeloživotni."
0:21:46,0:21:49,"Sad po nekim novim istraživanjima, bilo je ono do 25."
0:21:49,0:21:50,pa 27.
0:21:50,0:21:52,negdje sam prošla da je čak i do 30.
0:21:52,0:21:52,godine.
0:21:54,0:22:05,"To sam baš htjela reći, budimo realni, prva od sebe mogu krenuti u nekim situacijama kakve ja zapravo imam, samoegulacijske vještine kad ne znam, mogu se izdarati na svoje dijete."
0:22:06,0:22:13,"Tako da evo, idealno, to je u idealnom slučaju da ti dijete bude dozreće doma, ali mi ne živimo u idealnom."
0:22:13,0:22:31,"svijetu i ja uvijek kažem nekako ako mama doma pregorjeva i ako je mjesto vrtić sigurnije u smislu da će mama ga onda dočekati odmorna, ispunjena, ostvarivat će nekakve svoje ambicije kroz posao, čak i da leži doma i da spava, znači nebitno."
0:22:32,0:22:39,"Ako će ta mama biti odmorna, ispunjena da onda posveti vrijeme djetetu, znači uvijek kažem ono kvaliteta prije kvantitete."
0:22:39,0:22:55,"Tako da evo poznajem mnogo, mnogo slučajeva gdje su roditelji odlučili ostaviti svoju djecu doma iz opet raznih uvjerenja koje su podnijeli od svojih baka, djedova itede svojih mama, a zapravo takvoj djeci možda je vrtić sigurnije mjesto."
0:22:55,0:23:02,"Tako da evo meni je to diskutabilno, ja uvijek kažem da svaka majka treba to osjetiti za sebe."
0:23:02,0:23:22,"Oke, stručnjaci se slažu da do treće godine, ali evo ako ti vidiš da ti ne možeš doma, recimo kod nas doma je situacija gdje ja imam malu sedmomjesečnu bebicu, dobro sad već djevojčicu, ali i dječaka koji ima dvije godine, koji je izrazito živo dijete, ono, baš je mali pravi istraživač i muži jako i od doma radimo."
0:23:22,0:23:26,"Tako da evo ja sam ono, Ne mogu više."
0:23:27,0:23:30,"Treba mi, treba mi, treba mi podrška i Bogu hvala da imamo podršku."
0:23:31,0:23:50,"Mislim, sad mi možemo svi upirati, naravno da sustav se treba mijenjati i možda pratiti nekako, jer ono je napredak svijeta, ali mislim, zar je ono, zar sam ja loša mama koja pošaljem svoje dijete u jaslice ili zar si ti dobra mama ako ga ti ostaviš ili zar si ti loša ako ga ostaviš?"
0:23:50,0:24:00,"Tako da evo, mislim da svaki roditelj, svaka majka, roditelj, otac kogod nas sad sluša, treba za sebe pronaći taj odgovor unutar sebe, ono na što sam ja pozvan."
0:24:00,0:24:06,"Jesam li ja pozvan zbilja živjeti svoje majčinstvo, biti majka doma koja odga svoju djecu?"
0:24:06,0:24:14,Jer evo ja vjerujem da Bog za svakog od nas prema svojim talentima i prema nekakvim Božjem naumu što je On namijenio za nas u životu.
0:24:15,0:24:25,"Tako da evo mislim da kad slušaš i osluškuješ samu sebe ali i nečiju tuđu, pod navodnicima, Božu nekakvu volju za tvoj život, nećeš se osjećati krivom."
0:24:26,0:24:31,Ja znam da poziv koji ja živim i koji ja radim da je to zbilja je ono što ja trebam raditi u životu.
0:24:31,0:24:36,"Tako da moj osjećaj krivnje je jako, jako drastično se smanjio."
0:24:37,0:25:02,"Jer znam da će moje dijete biti zbrinuto, znam da će nam biti teško, znam da kad dođe doma da će sve ono što je potisnuo kroz cijeli dan, jer realno dvije odgojiteljice su na, ne znam sada točno koliko će djece biti, odnosno sad po novom sam čak i saznala da imaju čak i asistenticu, znači u biti tri odgojiteljice u određenom periodu, ali dvije jer nikad nije jedna sama kako je bilo, ne znam prije godinu, dvije, tri."
