Start (HH:MM:SS),End (HH:MM:SS),Segment
1:27:56,1:28:17,"smo talitakum i to je zapravo na neki način moj album jedno ohrabrenje ljudima koji su u teškim unutarnjim zatvorima, nekim borbama možda za koje nitko ne zna gdje se osjećaju osamljeni pa možda i žene koje su činile pobačaj i koje to nose kao veliku tajnu i teret."
1:28:18,1:28:23,Evo ja bih rekla da taj album pomaže da ljudi dođu u susret.
1:28:23,1:28:26,"Zanimljivo, zadnja pjesma na tom albumu je hvala ti majko."
1:28:28,1:28:47,"Tako da evo kao što je počelo, kruna tog albuma je upravo i taj moj početak, koje je pjesma posvećena zahvali mojoj mami, tati ali i nebeskom ocu i nebeskoj majci i doktoru kojoj mama odgovorio od pobačaja."
1:28:48,1:29:07,"Nitko ne zna kad ja kažem unutra, stojim na mjestu gdje počiva on, tako važan za život moj, tog anđela kojeg si poslao, ne poznaje miris, dodirni glas, ali duša pamti onaj čas kad rekla je da."
1:29:09,1:29:22,"Tako da je taj trenutak, ja sam duboko onako povezana s tim čovjekom i zanimljivo je da je grob tog doktora jer mama mi je rekla poslije ime je bio udaljen doslovce deset pogrebnih mjesta od moje bake i djeda."
1:29:23,1:29:35,"Tako da ja sad svaki put kad idem bake i djeda na grob njemu stavim bijelu ružu i onda si mislim, kaj si sad ti ljudi misle, jer svaki put dođeš ima neka bijela ruža i neka svijeća, ne?"
1:29:36,1:29:42,"Još će misliti možda netko iz prošlosti ovo, ono, tako da evo to je jedan baš lijepi trenutak."
1:29:42,1:29:47,"Meni svaki put se onda povežem sa tom, tim trenutkom povijesti moga spasenja."
1:29:47,1:29:49,Zašto kažem povijest mog spasenja?
1:29:50,1:30:07,"Jer jedan svećenik mi je rekao Ivona, Bog će te osloboditi i ozdravit onog trena kad prihvatiš svaki trenutak svog života i onog najgoreg i najpogubljeg kao trenutak i povijest svoga spasenja."
1:30:07,1:30:26,"To je priča koju je Bog ispričao sa mnom i sve gdje je zahvatio moj život, gdje sam ja radila grijehe, lomila, uslijed nekakvih rana ili trebala prašiti ljudima koji su mene ranili, to je sve zapravo zahvat Boga u mom životu."
1:30:28,1:30:29,Hvala ti puno Ivona.
1:30:30,1:30:53,"Imaš li neku poruku možda ovako za kraj s obzirom evo da nam se i podcast zove život i s obzirom što si sve prošla i što ti je prijetilo prije nego što si rođena, ali u trenutku kad je tvoj život već započeo do dana današnjega evo što bi poručila što je život i zašto je vrijedan življenja."
1:30:54,1:31:03,"Evo, probat ću vam reći sa svoje strane, a onda ćemo pozvati moju Saru koja je tu, koja će nam reći jednu ključnu poruku života."
1:31:05,1:31:26,"Ne znam, evo prvo hvala jer si me pozvala i sam imala priliku ispričati ove stvari, svaki put se iznova divim i zahvaljujem Božjem zahvatu u mom životu i svakom životu i treba s vremena na vrijeme stati i sagledat što je sve Bog učinio u našem životu."
1:31:28,1:31:34,"Neki put tako trčimo kroz život, toliko je milosti, toliko lijepih trenutaka."
1:31:35,1:32:11,"Rekla bih život je dar, to ne moram vama govoriti iz inicijative, ali ja stvarno imam iskustvo toga i pošto sam dobila nekako posebnim uvjetima taj dar, trudim se tako to živjeti sa jako puno i svojih padova, znači onak, jako me smetaju te neke utopije idealnoga, znači imam puno radosti, ona svi misle da mi je cvijeće uvijek, a zapravo je toliko borbi, stramputisa, padova, dizanja, ne možeš o svemu ni pričat."
1:32:11,1:32:15,"Ja znam ljudima reći, kad bi vam sve rekla o mom životu ne bi gledali ovo."
1:32:16,1:32:16,Zašto?
1:32:16,1:32:25,"Zato jer čovjek ima, jednostavno čovjek je Božje stvorenje, ali je rođeno u grijehu, znači mi smo svašta prošli."
1:32:25,1:32:30,"Hvala Bogu, pa neke stvari nisu vidljive jer nisu sve za oči i uši naše."
1:32:30,1:32:39,"I to je ono što, a Bog zna, znači možemo mi sebe skrivati od svojih problema, ja to ne mogu se od Boga sakriti, mogu od vas se skrivati, ali ne mogu od Boga."
1:32:39,1:32:43,"Tako da rekla bih ovako, život je dar, predragocjen je."
1:32:44,1:33:00,Dobili smo u tom daru hrpu darova koje treba evo kutija s blagom doći i otvoriti i doći u susret sa onim lijepim i ako imate taj strah ono šta je onda ću se umisliti.
1:33:00,1:33:05,"Ja volim ti darovi ne pričaju ništa o vama, oni pričaju o Stvoritelju."
1:33:06,1:33:19,Oni uopće ne govore kako ste vi posebni jer niste vi sebe ni dodali ni oduzeli nego da vas je Bog savršeni otac stvorio u svojoj misli i zna što radi.
1:33:20,1:33:27,Kad sam ja imala osjećaj manje vrijednosti ja sam shvatila da ja dragom Bogu govorim to što si ti učinio ne valja.
1:33:27,1:33:28,Odmah sam se prihvatila.
1:33:29,1:33:49,"Znači prihvatit život kao dar, darove koje si dobio i da punina života dolazi u trenutku kada sebe darujemo drugima u ljubavi na proslavu Božjeg imena."
1:33:50,1:34:07,"Tu je ljubav u nekom savršenom skladu jer postoji zdrava ljubav prema sebi, zdrava ljubav prema drugome koja ne ide bez zdrave ljubavi prema sebi i proslava Božjeg imena i zdrava ljubav prema Bogu."
1:34:08,1:34:25,"I taj život smo dobili da bi ispričali svaki od nas kad gledamo filmove, evo zamislite kao da smo dobili neki scenarij života i mi trebamo odhodat to i u konačnici da se evo nađemo u vječnosti imamo happy end."
1:34:26,1:34:27,Tako neka bude.
1:34:28,1:34:28,Amen.
1:34:29,1:34:38,A sad ćemo pozvati Saru i vidjet ćete koliko mudrosti je meni došlo po mom djetetu kad sam bila u jednoj krizi.
1:34:38,1:34:45,"Evo sad nam se pridružila Ivona, kćer Sara i sad će nam oni ispričati jedan svoj doživljaj."
1:34:47,1:35:01,"Pa evo inače Sara, Lea i Mate su svi bili dio Virtugrada i Lea je započela sa mnom Virtugrad i onda je Mate nastavio i onda kad je Sara došla ona je isto bila dio Virtugrada."
1:35:01,1:35:05,Sad jako puno radimo na Virtugradu isto sa obitelji sv.
1:35:05,1:35:06,Šarbela.
1:35:06,1:35:20,I ona zna vrijednicu posebnicu i zna sve vrtića i dogodio se jedan trenutak gdje su mene zvali na jednu edukaciju za roditelje gdje sam trebala pričati o dječjim talentima.
1:35:21,1:35:37,"Iskreno nisam uopće bila inspirirana, malo sam bila i ljuta, nisam baš bila u svom najboljem kako bi rekla modu i onako rekao, kaj će ja sad doć tamo roditeljima pričat Bože pomozi i legnem i molim se."
1:35:37,1:35:40,A u to vrijeme je Sara spavala pokraj mene.
1:35:42,1:35:53,"I onako ona, ja nju uspavljam, ona jako voli se uspavljivati s mamom, ima i čak novu riječ, a to je da je mama, kako kažuš da sam mažljiva."
1:35:54,1:35:55,Mažljiva i pažljiva.
1:35:55,1:36:13,"Znači mama je mažljiva i onda nas dvije mažljive smo se tako uspavljivale i dođe ovaj, nekako prođe i ona polako već padne u san i onda je počela govoriti nešto što sam ja u tom trenutku duboko osjetila ovo je nešto važno."
1:36:14,1:36:23,"I počela sam, automatski sam opala diktaton, a što je zanimljivo jer sad dijelimo zapravo tu poruku i onda tu koristim na edukacijama."
1:36:23,1:36:37,E sad ću vam Sara reći što je ona u polusnu rekla jer zapravo ona je kao spavala i bila je u nekom svom filmu očito i možda je već bila u polusnu i onda je rekla sljedeću rečenicu.
1:36:37,1:36:37,Šta si rekla?
1:36:39,1:36:40,Ja volim biti ja.
1:36:41,1:36:43,Znači ja volim biti ja.
1:36:44,1:36:48,"I sad ja čujem riječ, rečenicu ja volim biti ja."
1:36:49,1:36:55,"Ja ne mogu opisati, znači dubinu, koliko sam ja osjetila dubinu te spoznaje."
1:36:55,1:37:03,"Zapravo da je ključ da se vratimo u taj stav djeteta kao što je Sara i da možeš reći ja, ja volim biti ja."
1:37:03,1:37:04,Ali to nije sve.
1:37:04,1:37:06,Onda sam ja nju pitala da mi malo elaborira.
1:37:07,1:37:11,"Sara, otkud ti to, kaj ti to znači i šta si ti onda rekla?"
1:37:11,1:37:13,Ja volim sebe i volim svoj život.
1:37:14,1:37:17,Ja volim sebe i volim svoj život.
1:37:18,1:37:30,"I tako bi Sara i ja poručili svima da je tako lijepo da sam ja, ja i da je svako od vas ti i da je živodar i da treba voljeti svoj život."
1:37:31,1:37:32,Je li tak?
1:37:33,1:37:35,Češ pozdraviti ekipu?
1:37:36,1:37:37,Ajmo im mahnati.
1:37:38,1:37:39,"Ajmo ih tamo ti, gledaj."
1:37:39,1:37:39,Bok.
1:37:43,1:37:46,"Hvala puno Ivona, hvala Sari."
1:37:46,1:38:03,"Evo želimo još puno ovako lijepih, svrhovitih, plemenitih i dobrih života i vama dragi pratitelji da nas i dalje gledate u našim novim emisijama, u našim novim podkastima život i da budete uz nas i uz malene nerođene i uz život."
1:38:03,1:38:05,Hvala Nisu si Marija.
