Start (HH:MM:SS),End (HH:MM:SS),Segment
0:59:30,0:59:54,"Kada je najbolje vrijeme za otkrivanje svojih talenata i koliko rano to netko mora odnosno treba, a znamo nešto i o Virtugradu, pa evo baš zato jer sam se ja isto pitala ta pitanja, a počela sam se pitat kad sam rodila djecu i nisam baš bila svjesna koliko je važno sa djecom od malena o tom pričat."
0:59:55,1:00:00,"Nije važno toliko da sad dijete zna, ja imam taj talent ili nemam taj talent i"
1:00:00,1:00:04,"razloga jer oni su u formiranju, to je kasnije važnije."
1:00:04,1:00:17,"Ali je važno zapravo osvještavati te nekakve pojmove da su vrijedni, jedinstveni, da su stvoreni sa svrhom, da su dobili neke talente."
1:00:17,1:00:42,"E onda je tako nastao program Virtugrad i to najčešće, meni kažu obično da bi trebale češće biti trudna jer kad god sam bila trudna je neki novi projekt zapravo se paralelno porodio u toj trudnoći, tako je nastao zapravo Virtugrad i evo, vrtići koji su inače nadahnuti vježbama sv."
1:00:42,1:00:43,Ignacija.
1:00:44,1:00:46,I znate kojim razmatranjem dvije zastave?
1:00:47,1:00:49,Jer imamo vrtiće i maniče.
1:00:50,1:01:12,"Virtugrad je zapravo grad u kojem vrtići žive, vrtići su male vrline koje djeci objašnjavaju na neki način neke zakonitosti života i tako kako biti sretan, kako živjeti svrhovito itede E sad ono što je bitno, nema samo vrtića, imaš i maniča, ne."
1:01:12,1:01:22,"Vrtići osnažuju djecu, ohrabruju, pomažu im da otkriju talente, da razviju vrline i kreposti, a manići rade sve suprotno."
1:01:22,1:01:33,"Znači da djeca povjeruju laži da ne vrijede, da se trebaju uspoređivati drugima na način da ako nisu kao drugi ili bolje od drugih da ne vrijede."
1:01:34,1:01:36,Tako da onda su polako nastajali vrtići.
1:01:36,1:01:42,"Prvi vrtić koji je nastao je zapravo, prvi je bio gospodin Urednić."
1:01:42,1:01:42,Zašto?
1:01:43,1:01:44,Zato što sam ja neuredna.
1:01:45,1:01:53,Znači to mi je jedna slabost i onda sam si smislila gospodina Urednića da odgajam djecu suprotno od toga.
1:01:54,1:01:59,"Još uvijek mi pomaže, zato se neke stvari stvarno u temelju trebaju rješavati."
1:02:00,1:02:10,"Uglavnom i onda pomalo su nizali drugi vrtići, jedna je vrijednica posebnica koja zapravo djecu uči da je svatko vrijedan i jedinstven."
1:02:11,1:02:14,"I zove se i ja sam ja ti si ti, svi smo mi jedinstveni."
1:02:15,1:02:25,"Onda imamo gospodina Talentića koji osvješćava djecu da je svako dijete dobilo kutiju s blagom, to blago su naši talenti ali njih treba otkrivati."
1:02:26,1:02:35,"I onda kad otvorimo kutiju, kad god mi koristimo neki talent onda on zasijaji i onda ti vidiš kakav je to talent i za što služi."
1:02:36,1:02:49,"Tako da mi svi smo dobili kutiju s blagom, mnogi naši talenti su neotkriveni, negdje su zakopani ili zaboravljeni i rekla bih da onda taj sjaj koji ide iz te kutije je manji."
1:02:50,1:02:59,Što mi više otkrivamo tko smo i time služimo u ljubavi za ljubav to je zapravo ta punina radosti i ljubavi veća.
1:02:59,1:03:11,"E sad treba doći Marljivko, na njemu trenutno radim, znači vrijednica posebice kaže vrijedan si, talentić kaže otkri svoje talente, a Marljivko kaže džabeti da ih otkriše ako ih ne razviješ."
1:03:11,1:03:18,"Tako da evo tu malo potičemo djecu na rad, na razvoj, učenje i onda imate zadnjega, to je Dobro Radić."
1:03:18,1:03:24,"Dobro Radić radi, objašnjava djeci zašto su dobili talente, da činimo neko dobro."
1:03:24,1:03:28,"I evo, to vam je objašnjeno sve skupa sa četiri vrtića."
1:03:28,1:04:02,"I još jedna stvar, evo, baš sam sretna zbog ovo, napravili smo igru, zapravo, Vrtograd, poznaje svoje talente i dobro se zabavi, znači gdje imamo sve po Garnerovim inteligencijama, djeca otkrivaju talente, ali onda imate i maniće koje onda kradu talente, pa vas stavljaju u zatvor, pa si je, ne da ti se ništa, a gledaš televiziju cijeli dan, onda te maniće ti ukrade, tamo se ciglice zapravo virtuone, oni ti krade virtuone i još završiš u zatvoru, nezadovoljstvo se zove."
1:04:02,1:04:10,Tako da na neki način kroz ove stvari djeci približavamo pojmove koji će im kasnije služiti za jedno razlučivanje.
1:04:11,1:04:16,"I tako evo, Virtograd je jedan projekt koji je toliko ne mogu objasniti."
1:04:16,1:04:26,"Znači ljudi kad uđu u Virtograd znači i djeca i odrasli, to je to jedno prostor kao da se vraćaš na izvor te čistoće."
1:04:27,1:04:35,"I zanimljivo ova slika, slikovnica, imamo puno lijepih pjesmica na YouTubeu, to možete, to vam je sve besplatno dostupno."
1:04:37,1:04:40,Znači ova slikovnica je nastala u Međugorju.
1:04:41,1:05:02,"Zanimljivo, probudila sam se u četiri sata ako sad ovi kada idu moliti, četiri pet je bilo, rekao pa kaj sam budna, inače volim spavati i rekao stvarno nisam mogla i ona dignem i dođe mi poticaj da pišem slikovnicu, baš sam nekako osobno doživjela jedno unutarnje ozdravljenje svoje djevojčice kroz to."
1:05:04,1:05:08,A tada kad sam bila u Međugorju sam upoznala i sv.
1:05:08,1:05:09,Šarbela.
1:05:10,1:05:15,"Tako da je možda i sveti Šarbel zagovara Virtuginu, ne ne znam, jednog dana kada umremo meni će biti to zanimljivo."
1:05:15,1:05:16,Imam toliko pitanja.
1:05:17,1:05:21,"E, a kakve šarbe li ima veze, kako si ti došao tu?"
1:05:21,1:05:29,"Znači, toliko, kako bi rekla naš put, zanima me ta dinamika, kako bi rekla, zemaljske nebeske crkve."
1:05:30,1:05:40,"Jer stvarno vjerujem da je to jedno, kako bi rekla, da podržavamo, znači ono, zaista osjećam živo zagovor svetaca za određene stvari."
1:05:40,1:05:55,A ja se živo sjećam da si ti pričala o Virtugradu i tada smo bili skupa u Vukovaru i onaj šaren i papirić i sve i ti si tražila tek ilustratora za Vrtograd.
1:05:55,1:05:56,Znači on je samo još bio.
1:05:56,1:05:58,Ilustratorica iz Vukovara.
1:05:58,1:05:59,Zanimljivo.
1:05:59,1:06:51,"Tako da evo i njoj se zahvaljujem, toliko je lijepo Nataša Knežević, toliko je lijepo ušla, ona je zapravo, ja sam njoj rekla što želim, kako to izgleda, ja sam dobila prvu ilustraciju i ono, pitala ju kad si ti tam bila isto, znači ono, to je toliko bilo, jednostavno je prenijela svijet i ono, baš ono pun je boja i toliko jedne, onako kako bi rekla jedne radosti, ne znam, evo ga to, ta vrijednica posebnost, ono jednostavno, evo, tko ne bi bio u Vrtogradu, baš ga volim i mene osobno liječi i puno radim evo tu i sa svojom djecom i tuđom djecom, radimo i neke predstave, radimo i sa školama i sad evo, Sara moja ovaj, prebacila sam je u osnovnu školu Ružišnjak pa vjerujem da ćemo tamo isto puno ovaj donijeti Virtograd, jel iako tamo Virtograd već živi rekla bih."
1:06:52,1:06:54,"Odlično, baš lijepo."
1:06:54,1:07:03,"Recimo, ima ono, hoćeš li malo spomenuti i zajednicu obitelji svjetog Šarbela ili da to prepustimo tvojem suprugu barem?"
1:07:03,1:07:44,"Na šta, ne znam hoće li moći, pa evo da barem nešto kažem, jedno je da zapravo kroz taj neki naš zajednički put suprug je imao posao, ja sam jako bila ovdje angažirana, puno surađivala sa Crkvom, zajednicom, a nekako sam se znala osjećati usamljeno i uvijek sam se pitala Bože, ja ne znam, ja mislim da ti to nisi baš tako zamislio, znači da mu žena u sakramentu su pozvani i zajedno biti u služenju jel zapravo gdje su muža i žena zajedno i Krist je s njima ako ćemo gledati sakramentalno."
1:07:45,1:07:50,I onda sam puno molila za to da bih htjela nekako više molimo da smo zajedno i tako dalje.
1:07:50,1:07:52,I onda je Bog čuo moje molitve.
1:07:53,1:07:55,Ali nisam znala kako će on to izvesti.
1:07:55,1:07:59,"Znači da mi je sad neko rekao kako će to izgledati, rekla bi nema šanse."
1:07:59,1:08:16,"Glavno kad sam ja prolazila jednu veću svoju krizu unutarnju, rješavanje tih problema, nekih hrana, bila sam u Međugorju i dok sam se spuštala sa podbrda dolje, pred dnu, sam vidjela sliku svjetog šarbela."
1:08:16,1:08:16,Ja do tad nisam.
1:08:17,1:08:21,To je bilo 2020.
1:08:22,1:08:24,"negdje, ja mislim, druga."
1:08:29,1:08:33,"Došla sam gore, dolje zapravo i vidim ono nešto me poziva."
1:08:34,1:08:35,"Pitam ženo, oprostite, tko je to svetac?"
1:08:35,1:08:37,"Ono kaže, Sveti Šarblje, tko je on?"
1:08:38,1:08:43,"Pa on nam je libanonski svetac, kakve ima veze, dobro."
1:08:43,1:08:52,"Ode mi je dalje, vidim kućica svetog šarbela i sad je pitam tamo ženo, oprostite, tko je on, po nama je zaštitnik obiteljske molitve."
1:08:53,1:09:01,"Ali zanimljivo je da je tamo i kapelica za nerođene, gdje su relikvije svetog šarbela."
1:09:02,1:09:04,"Tako da, tko zna tko je zamolio da se ja rodim?"
1:09:05,1:09:08,"Znači, to ćemo vidjeti, nadamo se u raju."
1:09:10,1:09:46,"I onda sam ja počela i onda je žena meni rekla slušajte ovakva je, ja osjećam da vi radite nešto važno, evo daću vam i ona je meni dala ulje, tada to nije bilo baš pomodarstvo kao što je danas, malo po meni sad to previše i pitanje sad čije ulje uglavnom, ja sam dobila baš onak bočicu ulja i sad ja dođem suprugu mom koja je poprilično rekla bih jedan oprezan čovjek koji nije da uzima svaku bočicu koju dobije i on kaže, kad si to donijela iz Međugorja, to ti je ezoterija nekako, ja vam ponesam ono ja vrlo ponezanom ženom i dala."
1:09:47,1:09:49,I onda smo mi počeli molit debetnicu sv.
1:09:50,1:09:54,"Šarbelu i to smo nekako opustili, možda nam je dan za obiteljsku molitvu."
1:09:55,1:10:29,"I što se dogodilo, da skratim priču jer bi predugo tralo, znači on je imao jedan veći lom nakon jedno par mjeseci noge gdje se zapravo njemu dogodilo jedno duboko suočavanje sa sobom i njegovim strahovima, kako ja kažem da ga je dragi Bog razmontirao doslovce, fizički, psihički, duhovno, nakon onako kućicu kad razmontiraš pa idemo iz početka i on je tu doživio jedno veliko onako susret sa sobom ali i s Bogom i gdje se nalazi."
1:10:30,1:11:23,"U tom periodu se događa jedna situacija koja je dosta neobična a to je da njega zove kolega, tada je radio u Googleu, kolega iz Amerike koji, oni imaju katoličku grupu tamo dvije tisuće ljudi i on je poslao ja se nalazim na grobu svetog šarbela u libanonu i ako netko od vas želi imat ćemo video poziv pa evo da vidite gdje je on bio i sada kaže on mene kao i ona kako se zove onaj tvoj onaj moj ne pa evo nam sve ti šarve, veli za mislice kaj se dogodilo i mi se javimo na taj poziv i on nas provede sve gdje je on molio, gdje je umro, gdje je sve, znači tko i sad svako malo se izgubi signal jer je to u nekakvim katakombama, ono, ja kažem Igor, kaj je ovo jer šta se dogodilo?"
1:11:23,1:11:36,"On je posao to po cijeloj Americi, Google-u, a na pozivu smo bili Igor i ja i jedan naš prijatelj kojeg smo pozvali da ne budemo sami i nikog više nije bilo."
1:11:36,1:12:18,"I on kaže pa kako od svih ljudi po svijetu vi ste jedini sad došli i to je bilo jako značajno i on kaže, jer vam u redu da vam ja pošaljem par knjigica, slika itede i kaže, pa da, ono može i onda on nama pokazuje i samo mi misli kao knjiga privjesak, odjednom dolazi, što je zanimljivo, dolazi poziv tom prijatelju našem sa carine, aerodroma i zove prijatelj i kaže, dobro, dobio sam, a taj čovjek koji je tamo zna našeg prijatelja i kaže, tu je došlo dvjesto kilo robe na tvoje ime."
1:12:19,1:12:21,Veli kakvi dvjesto kilo robe.
1:12:21,1:12:27,"Veli ja ne znam šta je, tu je neko ulje, ja ću te sad opustiti, ali tko god ti slao, nek ti nemrti, ne može to."
1:12:29,1:12:30,Znači dvjesto kg.
1:12:30,1:12:42,"Mi smo dobili ikonu svetog šarbela, pol dva na dva, ono, maronitske svece, knjige, ulja, tri kutije."
1:12:43,1:12:51,"I sad odjednom, sad evo, ti si u ovom prostoru, dođeš i mi se nađemo u prostoru sa dvjesto kg robe o svetom šarbelu."
1:12:51,1:12:54,"Kaže, evo meni Igor, dobro, kavo, kad smo mi dileri sad bili."
1:12:54,1:12:55,Igor je bio onaj tvoj.
1:12:56,1:13:06,"Znači ono, veli šta je ovo, ja kažem ne znam ljubavi, ja nisam dobila taj poziv, ja sam bila prvi poziv, ali ovo je tvoj poziv, ti si dobio kutije, rješava ih."
1:13:07,1:13:17,"I sad onda smo mi krenuli molit, nismo ništa s tim brzali, a zapravo suludo, ali Igor iako smo vrlo onako učenih ljudi i poduzetni, nije da baš ne znamo kaj ćemo sa životom jel."
1:13:18,1:13:25,"Prvi put smo se našli onako, pred tim kutijama, uljem, ono gledam i onako Bože, kaj ti hoćeš od nas."
1:13:25,1:14:05,"I onda smo molili i tu se zapravo nastavlja priča, nakon jedno par mjeseci, u to vrijeme Igor prolazio te teške priče unutarnjeg i fizičkog ozdravljenja i šarbel mu je bio blizu, što je zanimljivo sa svim tim uljem i zaista doživio jedan duboki zahvat i onda nakon toga on ide opet u Poljsku, u Google i prek puta piše Remo Nader o obitelji Svetog Šarbela i kaže, gle, tu ima neki čovjek, možda on zna nešto o Svetom Šarbelu jer mi ne znamo, znači osim toga nema ništa, imate rijetke stvari, imamo ono ulje od svecca kojeg ne znamo i ne zna pol svijeta tko je on."
1:14:07,1:14:12,"I mi onda se javi njemu i to preklingtina, di je Raymond i ono kao."
1:14:12,1:14:19,"I kaže Remo nama sad da je to prvi poziv koji je on preko LinkedIn-a dobio, nikad u životu nije dobio."
1:14:20,1:14:26,"I on se javio Igoru Igor, njemu kaže kad budete u Poljskoj pa daj dođite vi do nas malo da malo posjedoćete da mi upoznamo sv."
1:14:27,1:14:27,Šarbela.
1:14:28,1:14:37,"I Remont kaže dobro, javit ću vam se, on je bio skroz blokiran, ali njega je, veli, baš se nešto duboko zvalo da treba doći u Hrvatsku."
1:14:38,1:14:44,"I on se sad javio Igoru, nekom Igoru Zgrabljiću iz neke Hrvatske i dolazi u Zagreb."
1:14:45,1:15:03,"I mi organiziramo na Svetom Duhu susret, večer sa Svetim Šarbelom, mi sami dolazimo na susret i ne znamo kada nas čeka, ljudi nas gledaju, a vi šti šarbele, veli, pusti me, nemam pojma,, koniti, sad ću saznati ono i on dolazi gore i to je bilo zanimljivo."
1:15:03,1:15:08,"Evo, i mi smo tad počeli molit Kronicu, devetnicu sv."
1:15:08,1:15:10,Šarbilu preko WhatsApp poziva.
1:15:11,1:15:43,"I u tom trenutku bila je gospa Fatimska taj dan, što je jako zanimljivo i mi dolazimo na aerodrom i Raymond i Fader Antoine, njegov duhovnik koji je od početka s njim već ne znam, godinama, koliko je to već godina, možda više od trideset više ne znam, još uvijek ne znam neke detalje, oni dolaze i dolaze i on zagrli Igora i ja pogledam Fadera Antona i shvatim ovo je moja zajednica."
1:15:43,1:15:47,"Znači to je ono kao kad ljude pitaš koji imaju poziv, kako si saznao."
1:15:47,1:15:59,"Ja sam se uvijek pitala čija sam, koja je moja zajednica, jer ja se sa mnogima poznajem i sa mnogima surađujem, ali nigdje nisam bila ukorijenjena, ne zato jer nisam htjela biti."
1:15:59,1:16:05,"Jesam ja bila aktivna, radila na duhovnosti, fala mi je zajednica, a opet nisam, kao da nije to bilo moje mjesto."
1:16:06,1:16:12,"Kako su oni došli, to je ono, kaže, feels like home, to je to, obitelj svetog Šarabela."
1:16:13,1:16:18,"I taj pojam obitelji, ta taj sam naziv od zajednice molitvena zajednica obitelji sv."
1:16:18,1:16:23,"Šarbela, ona u sebi sve sadrži, mi smo obitelj, ti ja smo obitelj."
1:16:23,1:16:28,"Znači mi kršćani, mi djeca istog Boga Oca, mi smo jedna obitelj."
1:16:29,1:16:33,"Taj jedan osjećaj gdje smo mi povezani na taj način, ja to ne moram objasniti."
1:16:33,1:16:39,"Znači ljudi iz Libanona, mislim ono, pričaju arapski, mislim to oni su, oni su naši, oni pričaju arapski."
1:16:39,1:16:46,"Prekrasno jer Fader Antoine, misu kad je vodio on na arapskom ima pretvorbu."
1:16:46,1:16:51,Tako da smo imali jedan dar da je bila pretvorba na arapskom.
1:16:51,1:16:55,I tu smo se mi s njim povezali kao da se znamo cijeli život.
1:16:56,1:17:04,"To je bilo u duhu pripremano, znači mi smo samo onako uletili u sad jednu, ono, Bog ima svoju prugu i svoje vrijeme."
1:17:05,1:17:09,"Pitanje je samo hoćeš li ti osluhnuti, jel to moja pruga, jel sad to vrijeme?"
1:17:10,1:17:14,"Neki put, jer siluješ vrijeme, zapravo možeš stvari upropastiti."
1:17:15,1:17:20,I onda smo mi krenuli i tako smo mi postali organizacijski odbor obitelji sv.
1:17:20,1:17:21,Šarbela.
1:17:21,1:17:29,"I može, ja smo sad zajedno, evo, ja sam sad kao prava ženica i njemu desna ruka, pa čuj, nismo se javili ovo, ono."
1:17:30,1:17:45,"Ja velim, konačno mogu di sad, sad ti vodiš, a ja pratim baš lijepo, zato jer u svom poslu sam često puta u poziciji gdje trebam poticat promjene sve, sad sam se malo odmorila, baš sam ono ženica, mentoriram s djecom, radim radionice, tako da je to to."
1:17:46,1:18:08,"Najveći plod naše zajednice, što mi od tada, sad preko godinu dana, svakodnevno molimo obiteljski prekovodca Apa Krunicu, imamo grupu od stotinjak ljudi, naravno u skladu sa svetim pismom, dvadesetak nas je na pozivu svaki dan, to djeca mole, djeca se ono trgaju tko će preuzeti devetnicu."
1:18:09,1:18:13,Mi imamo curicu doslovce s djavo majo mi ostipuna.
1:18:14,1:18:18,Znači to da ne zna kakav dan vam je bio kad čujete tu djecu da mole.
1:18:19,1:18:25,Tako da imamo nakon nekog vremena je nastala grupa djece i mlade obitelji sv.
1:18:25,1:18:27,"Šarbela, to su djeca potaknula."
1:18:28,1:18:36,"Imamo jedan pravi primjer ajmo reći možda čak obiteljskog pastorala kako integrira djecu u svakodnevno molitvu, u rastu."
1:18:37,1:18:43,"Bili smo zajedno sad na hodočašću prvom na šezdeset kod padre Pija, sv."
1:18:43,1:18:57,"Franje, u Gargano sveti Mihael, Karlo Akutis, tako da evo baš imamo i to je sve nekako u godinu dana se dogodilo veliki plodovi, još veća odgovornost prema nama."
1:18:57,1:19:06,Inače kako funkcionira zajednica tako da imamo manje grupe od do dvanaest i petnaest ljudi i mi vam baš sutra imamo susret zajednice.
1:19:07,1:19:11,Ideja je zapravo da kroz te manje grupe vi stvarate pravo zajedništvo.
1:19:12,1:19:32,"I vrlo jednostavno, znači tu vam je, kad mene pita ono, a koje je karizma zajednice, naško je da ti kažem prvo kršćanstvo, nađemo se, pitaš kako si dis, imamo susret, pročitaš Sveto pismo, imamo odjek na to, molimo, pomolimo se na kraju na neke nakane i sjednemo za stol."
1:19:34,1:19:48,"Imamo dnevnu krunicu, ujutro imamo časoslovo, Sveto pismo, u podne Fra Vilček zna zvati za anđo gospođi u petnaest sati božansko milosrđe i uvijek netko nosi."
1:19:49,1:19:50,"Nemamo to, to je opcionalno."
1:19:50,1:20:14,"Znači mi imamo grupu i onda ako nekog Bog potakne božansko milosrđe vi vidite voca poziv, taman si može negdje javite se, uvijek ima, na večernjoj krunici nas ima oko dvadeset dvadeset pet kad zbrojite obitelji to je recimo kao da dnevno moli pedeset šezdeset ljudi molimo svaki dan za dušuše u čistilištu, za svećenike, bogoslove svetog Mihajla."
1:20:15,1:20:21,"Evo, sad smo imali posvetu u srcu Isusu, tako da ono pratimo katolički kalendar, pa ubacimo neku devetnicu."
1:20:21,1:20:24,"Jednostavno je, a toliko duboko."
1:20:25,1:20:25,"Tako da, evo."
1:20:26,1:20:26,Ja sam isto.
1:20:27,1:20:31,"Evo, te rupe i čak sam bila zvala za Angelus."
1:20:31,1:20:43,"Ja sam se tada u to vrijeme našla u Barceloni na Monteratu i onda sam bila zvala i onda smo se zbunili kao ono što se ovo događa, zašto se sad zove?"
1:20:44,1:20:44,Sat je bio.
1:20:45,1:20:46,"A, pomaknuo."
1:20:46,1:20:47,"A, prav dobro."
1:20:48,1:20:50,Ako da su taj dan bila dva Angelus.
1:20:50,1:20:54,"Znači, viš kako je dragi Bog postavio Angelus je zapravo 24 sata."
1:20:54,1:20:56,"Znači, kako ideš, uvijek je Angelus, ne?"
1:20:57,1:20:58,"Može se uvijek moli, da."
1:20:59,1:21:09,"I ovo je sve jako lijepo i puno toga ima i stvarno bi mogli imati više ovih razgovora, ali evo htjela bi malo i nešto da nam kažeš o izgubljeno, nađeno."
1:21:10,1:21:26,"Ajmo, meni pa ti si cijelu moju povijest ono, znači, ovo je trilogija, ono, podkaz broj pet naša ono, ovaj, da, pa to je zapravo cijela priča, znači imaš izgubljen identitet koji prvoga nisi imao jer nisi trebao biti rođen."
1:21:26,1:21:36,"obitrođen, onda se pogubiš putem jel nemas pravo, pa se ranjavaš, činiš grijeh, pa se još raniš i zapravo sebe putem izgubiš."
1:21:36,1:21:48,"I mi kad gledamo izgubljenog sina, tamo je zanimljiva situacija kad on u jednom trenutku kad se nađe u onom svincu kaže, ima jedan dio koji kaže i dođe k sebi."
1:21:49,1:21:54,To je taj trenutak kad ti zapravo shvatiš da si izgubio dostojanstvo djeteta Božjeg.
1:21:55,1:22:01,"E sad, vraćam se na dio moje umjetnosti pa ću onda povezati dvije priče."
1:22:01,1:22:11,"Znači, ja sam skroz zakopala umjetnost, imala sam baš velike rane ne baš vezano u području odnosa, bila sam jako povrijeđena, povrijedila sam i druge."
1:22:13,1:22:23,"I tu nekako ono, baš je bila ta rupa uopće, rekla bih i ženskog jednog dostojanstva i toga tko sam kao žena i šta je ljubav i tko smo mi."
1:22:24,1:22:35,Znači to su sve bila nekakva začmrljena pitanja unutar mene i onda sam u jednom trenutku shvatila da meni glazba najviše služi da ja ispričam te priče.
1:22:36,1:22:50,"I onda bi pjevala i kroz tu glazbu i skladanje na neki način dolazim do toga da kažem stvari, da izgovorim stvari toga kaže, kaže, ti si duhovni Đorđe Balašević nekako jer on isto priča priča."
1:22:51,1:23:10,"Ali ono nekako ideja da zapravo ta umjetnost je jako meni intimna, glazba sama po sebi i htjela sam malo i sebično zadržati za sebe jer stvarim time, ali onda sam shvatila da mnogima pomaže u njihovim procesima."
1:23:10,1:23:32,"Tako da evo, odlučila sam u jednom trenutku se boriti za svoj zakopani, izgubljeni, zaboravljeni talent, a to sam zaboravila na tom ledranu i malo po malo sam, to je jedini, ja bih rekla jedino područje, jedini talent gdje sam imala osjećaj da me Bog ne pušta na miru."
1:23:32,1:23:47,"Znači imaš ti razne talente, imaš, budimo realni, nećemo mi sve izvući na površinu jer Bog je obilato nas obdario i nemaš cijeli život i nije dovoljno da ti sve to zahvatiš, ne, jer on daje u obilju."
1:23:47,1:23:51,"Ali taj talent koliko god ga ja zakopavala, sam se vraćala."
1:23:53,1:24:09,"I na toj istoj šutnji gdje si ti bila moja pratiteljica, kad sam ja odustala od glazbe i svega, u jednom razmatranju je, mislim da je bilo bila pustinja, je bila gitara bačena u grm, onako ono, ko šipraže neko ono."
1:24:10,1:24:14,"I ja gledam tu gitaru i hrpa ljutnje spreman toga, i ono to je to hrvanje."
1:24:14,1:24:16,Šta hoćeš više s tom gitarom?
1:24:16,1:24:18,Da je dosta mi više i svega je glazba.
1:24:19,1:24:20,I pustim ja to.
1:24:20,1:24:22,"Pa, da Bog pusti on onda."
1:24:23,1:24:26,"Samo onda ponovo kuca, dođe novo razmatranje."
1:24:26,1:24:30,Milo se ne samarijanac i onda vidim gitaru pokraj ranjenika.
1:24:31,1:24:33,"Opet, ja našao ono kao, kaj sad?"
1:24:35,1:24:40,"I onaj bio glas, ne mogu objasniti koliko duboko jedna spoznaje želim da."
1:24:42,1:24:47,stvaraš glazbu po kojoj ću oslobađat potlačene i ozdravljat bolesne.
1:24:49,1:25:33,"I vrlo brzo nakon te šutnje si imala jedan jako duboki san, sad netko će reći, viška si ona to lijepo zaboravila, može, esam, a može zaista bilo ovaj, vidimo plod, pa vjerujemo da je nešto imao toga, gdje sam se ja našla s nekim ljudima, kao i kažem, da sam bila na sastanku s Bogom i da je rekao da treba raditi glazbu koja će se slušati u zatvorenim sobama, znači da nije to glazba koju ćeš ti doći, sad ćeš slušati na proglašenju proglede srcem jer je jednostavno drugi, drugačiji tip nego to glazba koja traži jedno intimo gdje ti možeš ući u dubinu, malo te ne u polomraku da te nitko ne vidi i da možeš doći u susret sa sobom jer su prebolne teme."
1:25:33,1:25:50,"I da nije naše sad jer ja sam se jako bojala da ću zanemariti obitelj zbog toga itede da nije stvar toga da sad mi okolo idemo, ne znam nastupamo itede nego da taj materijal izađe van, da će po toj glazbi Bog ulaziti u zatvorene sobe."
1:25:53,1:26:04,"I tamo je bila i barica koja je tada bila na šutnji o tome, onda sam njoj rekla sanjala sam to je to ona jako isto puno utjecala evo i na obitelji, puno je pomogla i meni i mojoj obitelji."
1:26:05,1:26:20,"I onda ja gledam ajme mene dobro i sad to pustim ja i dolazimo u jedan shopping centar, nikad neću zaboraviti, vidim majicu i piše Lost and Found, izgubljeno nađeno."
1:26:20,1:26:26,"E da, a tad sam rekla taj kao album će se zvati izgubljeno nađeno."
1:26:26,1:26:32,"I dođem nakon toga, trgožen Lost and Found, ja ovako se zapiljem, želim pitati gospođu jeste dobro velim dajte mi ovu majicu."
1:26:33,1:27:28,"I to je bilo znači prije, znači ja sam album izdala dvije tisuće dvadeset jedan a ovo je bilo dvije tisuće četrnaest koliko je još bilo tu to je isto jedno dugo svjedočanstvo i puno sam se borila puno počinjala puno napuštala glazbu u konačnici sam završila album prijelomni trenutak je bio da ću ono da sam rekla oke bože zatvorit ću tu priču kad sam bila u vašingtonu u muzeju svetog ivana pavla drugog onda me on primio pod svoje tamo su napravili jednu izložbu gdje su pokazali njegov život i ja sam tamo zapravo doslovce plakala od početka do kraja muzeja jer su tamo jako umjetno iskoristili da bi prikazali njegov život, a on je bio umjetnik i on je napisao pismo umjetnicima, tako da na neki način tu kreće povratak Ivone umjetnice."
1:27:28,1:27:38,"I tu sam rekla, ok, da dobro idem do kraja i onda sam završila album i izdan je, Laudat ga je izdao na blagdan sv."
1:27:38,1:27:39,Ivana Paula II.
1:27:40,1:27:56,"Evo imate na YouTubeu su snimke pjesama i kako meni znaju neki ljudi reći, ljudi koji se bore s ovisnostima i u depresiji su, kaže, veliki kad se ne mogu dignuti onda pustim tvoju pjesmu talita kuh."
