Start (HH:MM:SS),End (HH:MM:SS),Segment
0:31:08,0:31:20,"Ta rečenica je meni jako duboko odzvonila, čeka kako mi šest mi šesnaest godina studiramo, da bi ti došao u trenutak da završiš faks i kažeš ne znam tko sam."
0:31:20,0:31:41,"I onda sam osmisla jedan program, zvao se Prospekta, program edukacije i zapošljavanja mladih, gdje sam osmisla model gdje mladi prvo upoznaju sebe, onda naprave viziju i nekakav smjer posle karijere, onda se uče predstavljati poslodavcu."
0:31:42,0:31:48,To sam predstavila jednoj firmi i onda su mi dali priliku da razvijam projekt.
0:31:48,0:32:03,"MUP kod njih i to su prvi ljudi koji su mene prepoznali i evo i ovo je isto jedna prilika da se zahvalim svojim prvim mentorima, to su Roland Sinkopan, Samir Vreto i Željko Zoričić."
0:32:04,0:32:15,"Roland je prepoznao moj talent, vidio u meni potencijal i dao mi izazov, rekao evo izvoliš, nema novaca, mi smo ti podrška, kad krene, ulazimo unutra skupa."
0:32:16,0:32:43,"I vjerovao je u moj potencijal, dobila sam priliku tamo razvijat taj projekt i onda uslijed nekih poslovnih situacija, firma se trebala zatvoriti, dosad se je brzo narasla, ali onda je bilo nekakva tržištu baš ona teška situacija i tamo sam ja zapravo, tamo sam ja zanat počela nekako razvijati, puno sam radila s mladima, prepoznavala talente, ali nije to još bio, to su bile prve konture."
0:32:44,0:33:36,"I onda kako više nisam radila tamo, bila sam na jednoj prekretnici, oka šta sad, znači ja sam našla šta želim raditi, ja to volim raditi, osjećam da je to dio mene, ali diću dalje i tu kreće zapravo moje društveno djelovanje kroz udrugu Putu uspjeha koju je pokrenuo moj suprug ali je stajala sa strane i onda sam zapravo počela raditi iste ove programe sa osobama s invaliditetom, evo to je Svjetlana Marija i udruga Zamisli su to prepoznali i onda je malo po malo krenuo taj društveno odgovorni, odgovorni ajmo reći angažman rada sa mladima, sa osobama s invaliditetom, sa djecom, sa trajno nezaposlenim osobama, ljudi koji su se dugo borili vezano za posao."
0:33:38,0:33:48,"Tako da evo razni projekti, čak smo radili sa djecom iz doma, sa djecom koji imaju poremećaje u ponašanju."
0:33:49,0:33:56,Tako da evo razne skupine kojima je potrebna priča da prepoznaju ljepotu koja je u njima.
0:33:56,0:34:05,"Jedan dečko iz doma, popravnog, on je rekao da edukacija na kojoj je bio su mu dva najljepša dana u životu."
0:34:06,0:34:21,"A to su vam djeca koja ulaze i izlaze van, neki su i pod drogama i sa šta nešto, ali kad čovjek uzrcališ njegovu vrijednost onda ima priliku vratiti se k sebi, a kad se vratiš k sebi onda se vraćaš i Bogu."
0:34:21,0:34:51,"Tako da evo to je dio koji je baš bio važan i onda kreće moj ulazak u posao, pokrenula sam firmu, to je ovo pokretanje, evo poticaj svima za samozapošljavanje, meni je tema bila, ono godinu dana sam bila bez posla pa kao imam priliku za poticaj, evo tak sam poslala poduzetnika, pa dobro, ono mogu otvoriti edukator, kreator, ono obrt, pa vidjet ću i tako sam krenula u poduzetništništvo, ali zapravo cijeli moj život je u poduzetništvu."
0:34:52,0:34:56,"Samo poduzetništvo nije stvar toga da tim, to je stav."
0:34:56,0:35:07,"Ja mislim da smo mi svi pozvani biti poduzetni jer ako postoji neki problem u svijetu, u društvu onda mi trebamo poduzeti nešto, Bog nas poziva na poduzetništvo."
0:35:07,0:35:13,"To nije samo vezano za novac, to je za bilo ovo što inicijativa radi, to je poduzetnost jer postoji neki problem."
0:35:14,0:35:32,"Tako da sam ja tad poduzetna, krenula u poduzetništvo i tu kreće moja suradnja sa kompanijama, organizacijama, rad na raznim vještinama poput komunikacije, rješavanja konflikata, ali ključ kreće sa osnivanjem edukatora ID-a."
0:35:32,0:35:50,"To je zapravo temeljni alat, zato mi kažemo da smo ID grupa gdje on se bavi sa nekako vraćanjem osobu jedan taj temeljni identitet vrijednosti i tko si ti kao osoba, tko sam ja."
0:35:50,0:35:57,"Znači edukator ID odgovara na emocionalnoj i psihološkoj razini tko sam ja, kako sam sazvan."
0:35:58,0:36:04,"E ako vidite, proučavati kako sam saznan, a nekome saznu."
0:36:04,0:36:14,"Znači zanimljivo je ljudi koji u svijetu prolaze taj program, oni možda ne znaju za Boga, ali neki stvoritelj je, netko ih je stvorio."
0:36:15,0:36:23,"I vi sad kad idete gledati konture svog stvaranja, kako ste stvoreni, vi ne morate ne doći u kontakt malo i sa stvoriteljem."
0:36:23,0:36:39,"Jer ona na neki način kroz te osobine, netko je otvoren, netko je poduzetan, netko je pokretač, netko je oprezan, netko voli promišljati o idejama, netko voli graditi odnose, znači duboke odnose."
0:36:39,0:36:46,"Neko voli puno različitih kontakata i sad vi kad vidite sve te različitosti, misli si pa to je stvarno sve puno kreativnosti."
0:36:46,0:36:56,"Tako da imam osjećaj da onako, kad ljudi ulaze u svoj ID, kao da onako Bog stvoritelj, Bog otac stoji pokraj svake osobe, vidiš kak sam ti lijepo stvorio."
0:36:57,0:37:04,"Znate, ono kao autori, znate kada autor sad napravi svoju izložbu i onda ljudi gledaju njegovu sliku, ne?"
0:37:04,0:37:11,I onda zapravo autor na neki način uživa u tom pogledu osobe prema toj slici.
0:37:11,0:37:16,"E sad, ljudi imaju pogled na unutra,ra i tu negdje moraju sresti autori."
0:37:17,0:37:18,"Evo, to mi je prekrasno."
0:37:18,0:37:20,"Vidiš kako sam te lijepo stvorio, a di si se pogubio putem."
0:37:21,0:37:23,"Da, da, evo ti, pa kad ne vidiš da si dobar, vrijedan."
0:37:25,0:37:26,Suprug Igor.
0:37:26,0:37:26,E.
0:37:28,0:37:31,"I onda sam ja tako radila, e šta je zanimljivo?"
0:37:31,0:38:08,"Suprug i ja smo se isto vrijeme obratili i on isto, baš ono u slično vrijeme, isto, zapravo možda mjesec dana nekih razlike s njim o tamo i tu smo krenuli zajedno na put i bilo je zanimljivo, oba dva imamo jako puno svojih rezidua i prošlosti i povijesti i situacija i iskreno nije bilo lako kad smo ušli u brak jer tu je krenulo onda kako bi rekla jedno dubinsko čišćenje ne samo nas i nego svega oko nas i tad si mi ti bila pratiteljica."
0:38:10,0:38:39,"I meni je bilo zapravo zanimljivo da baš na toj šutnji, tu su bile vježbe u šutnji, ja sam nekako dobila naziranje mnogih zahvata koje će Bog nastaviti u životu, a ispričat ću jedan detalj iz razmatranja gdje smo u jednom razmatranju stajali, to je onaj dio kako bi rekla razgovora sa Isusom, kako se zove to trostruko."
0:38:40,0:38:40,Kolokvi.
0:38:40,0:38:41,"Kolokvi, da."
0:38:42,0:39:10,"I onda smo stajali ispred križa i Igor Janaslonjen čelo na čelo, ispred nas su djeca, a bilo je zanimljivo imali smo puno špaga tamo, znači imali smo jako puno tereta koje smo trebali suočiti se, to je bilo sve baš onak jedan veliki darmariju kući vidljiv, ali ono malo po malo Bog je poslagivao i onda je taj scena kada kaže po vama ću izliti blagoslov na buduće naraštaje."
0:39:10,0:39:17,"To je bilo jedan onako jedna duboka jedna izjava, ali ja nisam znala kada je to značilo."
0:39:18,0:39:26,"Nisam ja znala da bi ti ušao u Božji blagoslov i da bi ovaj budući naraštaje ušlo u blagoslov, šta to znači za život."
0:39:27,0:39:51,"Da, ona ajme kako lijepo Bože, a ono, pogledaš iza ono tri reda da ne kažem čega, tako da evo tu kreće borba i bilo je jako puno borbe u sebi, oko nas, među nama s djecom, jako teške situacije u trudnoći, porod, baš evo, baš dosta zahtjevne."
0:39:51,0:40:36,"Čak Lea je imala pet puta pupčano oko vrata pa je i reanimirali su je, tako da onako kreće jedna borba, no ta borba koja je krenula, znači borba za život je nastavila se i kasnije, ali dobro, evo moj muž i ja malo po malo rješavajući svoje unutarnje stvari, ono to je recimo jedna stvar u braku o kojoj znam govoriti, znači prvo, od nas vas se znamo zezati, evo velim, starim mojem mi idemo zajedno, ali ja ti na kraju sama dolazim pred Boga, znači račune dolazim pred njega i zapravo tu je taj neki dio da znamo da ta dinamika između nas i Boga jer ja mogu prema van svašta pokazivati, ali on zna šta je u mom srcu, koje borbe prolaziš."
0:40:37,0:40:49,"Tako da ono rekla bi da u braku svaka osoba ima jednu odgovornost, brinuta o tome da je dobro, da je u dobro, da je u miru sa sobom, sa Bogom i ljudima, to znači suprugi i djeca."
0:40:49,0:41:17,"I tu treba raditi na sebi i mislim da je taj, znači, sistem gdje zapravo mi kroz duhovne vježbe, kroz jedan dublji ulazak u duhovnost, a s druge sakramentalni život i jedan rad na psihoemocijama, a to je rad kroz psihoterapiju, da si išta mogu preporučiti, sad ovim godinama rekla bih ona krene sa dvadeset na psihoterapiju, ne sa četrdeset."
0:41:19,0:41:19,Zašto?
0:41:20,0:41:48,"Jer posebice kad čovjek uđe u duhovnost mi imamo situaciju da jednostavno ono sve nekako to može postati maska gdje ti neradom na ljudskoj dimenziji i svim fokusom na duhovnoj dimenziji zapravo kao da odvajaju šta dva dijela, ja i moja ljudska dimenzija tu, duhovnost i Bog tamo i Bog ne, kako bi rekla, kao da nema prolaza jer je to od mene, od mojeg života, od mojih hrana odvojeno."
0:41:50,0:42:13,"To je jedno osvještavanje što se meni dogodilo u život, taj dio psihoemocija, kako ja znam reći, mala i ona koja nije oprostila, koja je ljuta, koja bi sve poredala redom i reć ovo nije bilo fer, ovo nije bilo fer, zapravo ti mali čuče negdje i onda se događaju situacije nekakvih psihoemocionalnih hajmo reći puknuća i svega."
0:42:13,0:42:13,Zašto?
0:42:14,0:42:16,Zato jer nisi rješavao sve dimenzije.
0:42:16,0:42:22,To je kao da imate problem ne znam sa kilama i onda sjedneš u kauču i moliš kronicu.
0:42:23,0:42:28,Pa naravno odnosa Bogom će meni dati milost da ustanem i da ideš vježbat.
0:42:29,0:42:33,"Ali i dalje trebaš vježbat, i dalje trebaš raditi na prehrani."
0:42:33,0:42:45,I to je nešto što je znači osim ove teme o talentima puno želim pričati o tome da čovjek treba kao ljudsko biće gledati na čovještvo u cjelovitosti.
0:42:46,0:42:56,"Jer Isus je bio Bog i čovjek i kao čovjek je prošao sve emocije, čak je imao i strah, anksioznost, ajmo reći kad glamo gecemani."
0:42:56,0:43:09,"Znači i sad mi smo to, mi imamo ovaj dio nam se sviđa slavljenje, evo ja živim za vječni život, ovaj život stavljam tu, Bog mi je negdje tamo jer nisam i onda je to jedna velika dezintegracija."
0:43:09,0:43:33,"I zato nama nedostaje kao kršćanima punina radosti Božje, da se vide plodovi jer je to kako bi rekla, znači ta milost koja dođe tu je rupa, znači rupa kao da prođe pokraj nas, znači ne može se kroz nas utjeloviti u odnosu nego je tu rupa i onda ta milost padne jer smo puni rana."
0:43:34,0:43:51,"Tako da evo tu bi definitivno rekla posebice, a živjela sam svakakav život, rana kao u priči, problema kao u priči, evo danas i dalje imam, i dalje radim na tome, kako kažem, samo imate vrijeme milosti, znači malo neke odradiš i onda treba i stati."
0:43:51,0:43:55,"Ajme Bože hvala ti, ali to je uspon na goru Karmel, ne."
0:43:55,0:44:09,"Znači ti se stalno uspinješ, ima tu i tam dio brda kad malo možeš stati i onda malo odahneš i Bog da i to vrijeme, ali onda vidiš nastavak, pa ti je zlo i onda opet ti da snagu i tako to ide."
0:44:09,0:44:10,To sam nesretna.
0:44:11,0:44:30,"I ona u edukatora i dio odnosno edukator kreatoru si radila i sa svećenicima jel tako i bilo mi je baš zanimljivo kako si i sama rekla ili je to neki svećenik spomenuo da mu je žao da se ne otkriju talenti njihovi pa ih se onda slavi negdje u službu, nego se često zna e ovo nam fali, daj ti budi tu."
0:44:31,0:44:41,Pa što imaš reći malo o tom dijelu ljudi koji isto na taj način rade na sebi da bi se baš smjestili negdje kao puzle u Božjem ajmo reći slagalici?
0:44:41,0:44:48,"Evo baš sad trenutno imam priliku što je dobro, znači ja sam nekakva diprolazila i sa različitim redovima."
0:44:49,0:45:00,"Znači neki Franjevci su prošli, Salezijanci, sad sam sa Bogoslovima, Dijecezanskim, znači i zanimljivo je kako i Bog voli tu raznolikost u redovima."
0:45:00,0:45:15,"I kad vidite zapravo svaki red, tu vidite isto, oni su svećenici, ali svaki na neki svoj, jer svaki red svjedoči neku, kako bi rekla, kao drugi kut Božje ljepote."
0:45:16,0:45:24,"Znači, s Alezijanci kad dođu, kojima je to stalo neka radost, neka fora, mladi, što ne znači da nema dubine, ali je to njihov izričaj."
0:45:24,0:45:30,"Recimo, kad sam sa djecezenskim bogoslovima, ja toliko uživam u liturgiji, znači ja tamo naučim sav red."
0:45:30,0:45:36,"Moj muž mi je rekao da će me slat na Bogoslovio da se naučim redu, zato jer oni toliko ovaj poslije."
0:45:37,0:45:42,"Ja imam problema s vremenom, a tam je sve na vrijeme, znači tam ne možeš kasnije, uopće nemojte to objasniti."
0:45:42,0:45:49,"Znači, to je toliko, onak jedan nit, zdrava, protokolarna, Bog voli i ceremoniju."
0:45:49,0:45:50,Da li me razumijete?
0:45:51,0:46:11,"Ta ceremonijalnost u ovom pozitivnom smislu, jedne ljepote, znači oni kad se naklanjaju, svaki se to stoji, to je kuda gledate umjetničko djelo, ajme ono, dođe pa to sve lijepo, duboko, pa znači evo ja uživam, to mi je jedno novo otkriće i hoću reći evo oni imaju neki svoj smjer."
0:46:11,0:46:53,"Sad trenutno radim i sa salazijancima u Žepu sa učiteljima srednjih škola, a oni su prošli prije jedno sedam osam godina idi i baš mi je svjedočio jedan salazijanac koliko mu je to značilo i koliko je rekao šezdeset sedamdeset posto više živim sebe u svom pozivu od tog programa da se poče otvara da si je dao dozvolu da bude autentičan svećenik znači boži po svim onim stvarima koje bog od nas traži ali da unese ono osobno jer je ja sam osoba ja onda kad ulazim u svoj poziv, pa ne, ulaskom u brak ne prestaje ona biti ona."
0:46:54,0:47:08,"Ulaskom u brak Don Ivan Širić, Don Mislav, Don Branko, veličasni Domagoj Matošević, svi evo prijatelja imam ko priči svećenika, pa nisu oni izgubili osobu."
0:47:09,0:47:18,Tako da je jako lijepo zapravo vidjeti kad vidite svećenika koji je u punini ljudske dimenzije živi svoj poziv.
0:47:18,0:47:24,Jer tu se događa susret u njegovim talentima s kojima doprinosi u svojoj službi.
0:47:25,0:47:33,I onda recimo ovo što ste spomenula da ih se često stavlja gdje je potrebno i to je isto potrebno.
0:47:34,0:47:45,"Znači biti poslušan, samo ono šta vidim da je nekako izazov, poslušnost kreće onog trenutka kad ja izrazim sebe, naprimjer to sam ja vidjela u braku."
0:47:45,0:47:53,"Znači ja mogu reći suprugu, znaš šta, baš mi nekako sad čežnja da idemo tamo i tamo."
0:47:54,0:48:00,"A onda on kaže, znaš šta i čujem te, uzeti ću to u obzir, samo sad ne možemo zbog toga i toga."
0:48:02,0:48:03,Poslušnost tu kreće.
0:48:04,0:48:07,"I ti onda kažeš aha, tada imaš pravo, razumijem."
0:48:08,0:48:10,A šta mi stavljamo poslušnost?
0:48:11,0:48:15,"Zakopavanje svoje čezni, ja ne znam što je, a ti ćeš mi reći."
0:48:16,0:48:17,To nije to.
0:48:18,0:48:29,"Izraziti sebe znači ja znam tko sam i osjećam neku čežnju, osim toga Bog želi suradnju tu, moj će, Bože će, Bog i ja i poglavari."
0:48:29,0:48:36,"Tu bi trebala recimo malo veća komunikacija, što ne znači da i dalje ćeš trebati ići negdje jer nema nikoga i to je dio kršćanstva."
0:48:37,0:48:43,Ali onog trenutka kad ja znam tko sam ja u slobodi onda ono što jesam stavljam na križ.
0:48:44,0:48:45,Evo Bože predajem ti to.
0:48:46,0:48:52,"Ali dok ja nisam uopće došla u kontakt s tim, prihvatila da to jesam šta ja dajem?"
0:48:53,0:49:01,"Šta prazninu, ideju i zato nemam ono pravo požrtvovnost koja je u ljubavi."
0:49:02,0:49:12,"Jer ja zapravo nisam sebe imala, nisam sebe imala onda nisam sebe ni dala i to je ta jedna praznina kada sjedite ljudi se daju ali zapravo nema ljubavi."
0:49:12,0:49:31,"I vidim tu, evo tu je jedan prostor za rast svih nas, ali za početak ja ako imam priliku, ako ja se ohrabrim sebe izrazit barem se otvara mogućnost i znam mnoge stvarno svećenike koji su napravili taj iskorak i zaista rade predivne stvari."
0:49:31,0:49:36,"I onda me ljude pitaju, da im recimo ove kao da, ali kako je to ono, kako oni to prihvaćaju."
0:49:36,0:49:40,"Ja velim to nije na meni, na meni je da posijem, a Bog daje rasti."
0:49:41,0:49:54,"I vi možda kod deset i petnaest bugoslova, kod njih deset nije palo na plodno tlo ali pet će ono prerastu u takve biljke da je to najvažnija stvar na svijetu."
0:49:54,0:50:15,"Tako da evo ja jako uživam osim u jedinstvenosti, toliko mi se razvila ljubav prema ne znam sad evo ću raditi sa Salezijancima isto u Zagrebu pa sam onda rekla Dombranku da mi da da upoznam malo više kako taj preventivni sustav, kako je Dombrovsko to gledao, ona tolika ljepota, toliko bogatstvo u našoj crkvi."
0:50:15,0:50:24,Znači ja ne mogu to uopće objasniti ono kad čovjek si dopusti otkrivati tu ljepotu stvorenog u svemu.
0:50:25,0:50:33,"Evo, zaljubljena sam, opet sam se zaljubila i to vam je isto u životu, zaljubiš se pa se hrvat s Bogom onda se opet zaljubiš."
0:50:33,0:50:33,Tko ih može?
0:50:34,0:50:35,"Isto, isto, jela?"
0:50:37,0:50:38,Vratit ćemo se na taj dio.
0:50:38,0:50:43,"Samo ti mene ne vraća više, a to ide u skladu s mojim naravi, gore, prošlost, budućnost, vječnost."
0:50:43,0:51:04,"Pa da završim na dio sa mužem, evo, zanima me malo, ovako da konkretno opišem nekome tko nikad nije čuo za edukator, kreator, znači od čega se sastoji, sada ga netko želi u nekoj svojoj maloj grupi provesti, nazove Ivonu, što to sve podrazumijeva, znači kako to teškoče da bismo mi došli do nekog finalnog završnog programa?"
0:51:05,0:51:07,Evo ovo si otkrio da si ti.
0:51:07,0:51:08,Tako je.
0:51:08,0:51:10,Prvo nema finalnog za početak.
0:51:11,0:51:11,Zašto?
0:51:11,0:51:14,Zato jer smo mi cijelo vrijeme projekt u stvaranju.
0:51:15,0:51:19,I ono što ja mislim o sebi to je ona razina svijesti koju imam sad.
0:51:19,0:51:30,Znači ono što edukator i alat radi je da izvuče na površinu ono što je negdje nama prisutno i svjesno i s tim možemo raditi.
0:51:30,0:51:40,"S vremenom mi možemo otkrivati puno drugih stvari i tek u susretu s tim, evo recimo sad podcast pa onako, to je je potpuno jedan novi svijet, nikad nisam vidjela ova svjetla."
0:51:40,0:51:45,"I onda dođeš i kažeš, wow, to je jedan zanimljiv svijet, to je moj, mogla bi malo istražiti."
0:51:45,0:51:58,"Znači taj, dopustit sebi da smo mi jedno, kako bi rekla, imaš ragog Boga, on te ko dobri tata drži za ruku i onda s tobom hoda i otkrivati svijet."
0:51:59,0:52:04,I u tom susretu tebe i života ti sve više otkrivaš kosi.
0:52:04,0:52:11,"I zato ljudi trebaju biti više u kontaktu sa različitim stvarima da bi, da bi duša, češna duša mogla doći u susret."
0:52:12,0:52:13,Znači susret vi u češ.
0:52:14,0:52:20,"E sad, kako to izgleda operativno za one koji vole strukturu i razumijevanje jer ja nisam ta, ali dobro."
0:52:21,0:52:29,"Znači, ID program je program koji traje dva dana i ima nekoliko različitih modula."
0:52:30,0:52:48,"Provodimo ga u suradnji sa crkvom, znači kad radimo sa crkvom i zajednicom, to radimo u Talent for You centru, imamo dvodnevni program u dva dijela i imamo cjelogodišnji program gdje se radi na cjelovitom razvoju ljudske dimenzije."
0:52:48,0:52:51,Znači to su nekakva stvari koje nudimo.
0:52:51,0:52:52,E sad šta je?
0:52:52,0:53:16,"Vi kad dođete na taj program, vi riješite različite upitnike i kroz te upitnike upoznajte svoje talente, svoj temperament, da li ste više ekstrovert, introvert, da li više volite raditi u timu ili volite jedinstveno sami poslagiva stvari, malo ste ono kako bi rekla ne znam, Sveti Augustin pa si u svojim knjigama."
0:53:16,0:53:39,"Znači onda upoznajte svoje područje interesa, koje su omiljene aktivnosti, gdje najviše imate osjećaj doprinosa, sa, koje su vaše vrijednosti, koje su skupine ljudi kojima ste nekako najviše privučeni da služite, to je recimo važno, ovdje su nerođeni, znači vi se trenutno brinete o nerođenima."
0:53:39,0:53:46,"Sad bi rekla pa da oni su nerođeni, pa da brinemo o nerođenima jer zapravo tu je zemaljska i nebeska crkva povezana."
0:53:46,0:53:56,"Brinete o ženama, o majkama koje su odlučili zadržati dijete ali trebaju podršku, brinete o ženama koje su učinile pobačaj, trebaju im psihoemocionalna podrška."
0:53:57,0:54:09,"Evo to su tri skupine ljudi koje netko može osjetiti jedan poziv da želi svoje talente dati za, ajmo reći, određeno poslanje."
0:54:09,0:54:19,"Tako da prepoznavanje bremena oko nekih skupina ljudi vam puno može dati, kako bi rekla odgovorna, taj dio gdje vas Bog zove."
0:54:19,0:54:31,"Jer upravo kad vi osjetite bol, kaže se da svrha nas je onog trenutaka kad se naši talenti povežu sa potrebom i boli svijeta."
0:54:32,0:54:38,Svrha nikada nije prisutna ako se mi bavimo sobom i Vrg i vrtimo oko sebe.
0:54:38,0:54:40,"To je posao, to je karijera."
0:54:41,0:54:45,Svrha i poslanje uvijek imaju veze s drugim i sebi darujem.
0:54:45,0:54:48,Dar sam dobio da bi sebe darivao drugome.
0:54:48,0:54:50,To je Božja logika.
0:54:50,0:54:58,"Ljudska logika, svjetovna logika je dobio se talente da napraviš vrhunsku karijeru, zaradit hrpu para i onda ideš po velnesima."
0:54:58,0:55:01,"Koji nije problem, odeš na velnes, ali ne živiš za velnes."
0:55:02,0:55:04,Mi nismo rođeni da živimo za velnes.
0:55:05,0:55:10,"Ali Bog je dao i velnes, samo je problem da ne može velnes biti svrha."
0:55:10,0:55:12,I tu su se pobrkali lončići.
0:55:12,0:55:31,"Tako da vi dođete na dvodnevni program, prvo se bavite, ovaj prvi dio se bavi, mi to znamo reći hardware, kako si skrojen, koji su ti talenti, pa vidite različitost, ne samo vaše talente nego i druge, pa vidite ono kao da ste došli u vrt pun cvijeća različitog, jel?"
0:55:31,0:55:36,"I onda gledaš, a ovo je ljubičica, ovo je ratinčica, ovo je ruža, ima i trnje, jel?"
0:55:37,0:55:38,"Tako da, to je prvi dio."
0:55:38,0:55:46,"Drugi dio je da kad vi vidite, znači način na koji nas Bog saznao, na neki način daje nama obrise našeg poslanja."
0:55:47,0:56:16,"Znači ako je ja imam prste i miče mi, znači, ha, to je ruka, onaj dio tijela, tako ljudi koji imaju talente, recimo, zove se vezano za, ajmo reći, individualizaciju, to je jedan talent, onda imate talent bliskost, imate talent empatija, to su, znači, talenti koji pomažu, koji vam mogu kazivati da imate neke mentorske tendencije."
0:56:17,0:56:22,"I onda ti ljudi kad god imaju priliku da savjetuju ili mentoriraju, oni su vam puni radosti."
0:56:23,0:56:30,"Ili recimo imate učenje, learner, intellectual, recimo ljudi takvi na edukaciji kad dođu, kažem poslaću vam još ekstra materijale."
0:56:31,0:56:39,"A oni, znači, oni imaju glavom, da zato jer vole izučavati, znači gdje god vi imate korištenje talenata, to je radost."
0:56:40,0:56:52,"I onda na neki način kroz taj prvi dio vidite te stvari, a u drugom dijelu se već pitate, aha, ako sam ja dobio talent, a gdje onda moje mjesto, gdje je moja svrha, Bože gdje me trebaš, gdje me zoveš?"
0:56:53,0:57:28,"E sad, to su vam dva programa, to možete naći na Instagramu, na našim stranicama, načelno se događa svaki mjesec, svaki dva mjeseca, svaki dva mjeseca u ovom prostoru i nakon toga onda imamo uvijek duhovni program najčešće kod Franjevaca naših u Dubravi, tako da evo zahvaljujem i Fra Serđu i svim bogoslovima koji su nam tamo podrška, tako da evo tamo onda odemo na svetu misu, klanjanje, tamo je prilika za ispovijed, tamo imamo priliku i zapjevat i to je to."
0:57:28,0:57:40,"Ono što sam ja primijetila kroz rad da imamo dodatni problem, a to je da ljudi upoznaju svoje talente, znaju što žele i onda imaju blok, ne znaju što dalje."
0:57:41,0:58:05,"I dalje imaju zabranjene djelovanje, zabrana da budu vidljivi, zabrana da učine nešto dobro, tako da sam onda zbog toga napravila taj godišnji program cjelovitog razvoja gdje se isto rade ova dva programa, ali u nastavku se rade i nekakvi ciljevi gdje se prate iskoraci, gdje gledamo šta je to negdje u pozadini, šta nas blokira."
0:58:05,0:58:08,"To je toliko jedna prekrasna, jekovita grupa."
0:58:08,0:58:14,"Sad je tu negdje dvadesettak ljudi, jučer smo imali susret, oni toliko su podržavajući jedni prema drugima."
0:58:14,0:58:24,"Ono kao da ideš zajedno, na brodu smo i trebamo doći, sad netko padne, ovoga drugi digne, ono baš jedna rekla bi čak jedno ozdravljenje zajedništva."
0:58:24,0:58:33,"Tako da se onda veselimo iskoracima i stvarima koje napravimo, za neki su iskoraci da stanu na loptu."
0:58:34,0:58:53,"Imate ljudi koji toliko, to vam se zove driver harry up, ima ga ono, znači ja moram, ja osjećam da iduće godine da ću, sad živim na jedanpetdva znači kao u WhatsAppu, znači ja WhatsApp ne služim nikad na jedan, znači jedanpet neki dva i dva, znači takva mi je naravi i onda zapravo jako puno stvari nakrcam."
0:58:53,0:58:59,A osjećaj nam je Bog zove se da više uđemo u prisutnost svakog tog događaja i sad ću trebati rezati.
0:59:00,0:59:05,"Za mene je iskorak rezati, a ne imati iskorak jer je to moja prirodna stvar."
0:59:05,0:59:13,Tako da jako je važno da se ljudi ne uspoređuju tu i da svakog sa svakim Bog ima svoj proces i svoju dinamiku.
0:59:14,0:59:21,"Za nekog je stajati godinu dana na tim, ja sam ljubljeno dijete Bože, mene Bog voli i dovoljan sam."
0:59:23,0:59:25,Godinu dana samo slušati to.
0:59:25,0:59:29,"Jer ako nemamo taj temelj, sve što nadozideš urušiće se."
