Start (HH:MM:SS),End (HH:MM:SS),Segment
0:00:11,0:00:16,"Hvaljeni su svi Marija, dragi prijatelji YouTube kanala Udruge Hrvatska za život."
0:00:16,0:00:19,Snimamo još jednu emisiju podcast život.
0:00:20,0:00:22,U goste nam je došla Ivona Zgrabnić.
0:00:22,0:00:24,"Ivona, dobro nam došla."
0:00:24,0:00:26,Dobrodošli vi meni.
0:00:26,0:00:27,Tako je.
0:00:27,0:01:21,"Evo mi se ovdje nalazimo u Ivoninom prostoru, u prostoru njezine udruge Talent za tebe i ona je osim toga još i supruga i majka troje djece rođena osamdeset jedan godine reći nam i gdje i još ponešto o sebi i ona izvoli za početak evo ja sam prvo dijete bože kako znam reći bog me htio već od starta evo nastala sam u očevom srcu i kao takva sam došla i dobila dar da sam sad ovdje evo s tobom u svom prostoru i da imam priliku malo progovoriti o svom životu i jednom putu supruga majka troje djece i rekla bi strastvena otkrivateljica talenata i jedinstvenosti u ljudima."
0:01:22,0:01:50,"Evo, to je nešto što me prati već zadnjih dvadeset godina i cijeli neki put ide u smjeru da vidim vrijednost ljudskog života i da vidim ljepotu svakog ljudskog života gdje svaka osoba ima neku jedinstvenost, talente, potencijale, sposobnost da onim što jeste, da proslavi Boga i da čini nešto lijepo u životu."
0:01:50,0:02:19,"I rekla bih, radim to na razne načine, ali evo baš bi rekla da je to jedna poruka i misija evo da što većem broju ljudi prenesem poruku koja je stara od pamti vijeka jel čudesno si stvoren u krilom majčinom jel i ta ljepota života je sve te stvari su nam već rečene u Bibliji i svetom pismu, ali mi smo zaboravili na njih."
0:02:20,0:02:46,"Tako da evo kroz udrugu Talent za tebe radimo razne radionice gdje ljudi prolaze jednostavno razne programe koji im omogućavaju da na neki način kroz razne alate, upitnike da im se zrcali ta slika o njima samima, kako znaju polaznici s nama reći, to sam od uvijek znao ali je to sada dobilo svoje ime."
0:02:46,0:03:02,"Tako da mi na neki način ljudima pomažemo da artikuliraju svoju jedinstvenost, da ju prihvate, a onda kad prihvatiš da onda možeš raditi na tome da te talente razviješ i u konačnici da učiniš nešto dobro."
0:03:04,0:03:04,Jako lijepo.
0:03:05,0:03:29,"I ono mi se znamo stvarno evo dosta dugo, sad već trinaest godina, upoznali smo se prvi puta u jednim duhovnim vježbama i tako i onda poslije kako sam se ja uključila u udrugu Hrvatska za život odnosno prvu inicijativu, onda sve one stvari koje si ti radila zapravo je meni se činilo i ona je čudo tvorka, ona iz ljudi uz pomoć svojih sredstava izvlači ono što je u njima najbolje."
0:03:29,0:03:42,"I ta nevjerojatna svjedočanstva di se netko nečim bavi, otkrije sasvim novi talent koji mu je od uvijek usadjen i tu se osjeća kao riba u vodi su za mene bile zaista čudesne stvari pa i kod mene."
0:03:43,0:03:45,Ali evo da krenemo iz početka.
0:03:45,0:03:53,"Gdje si rođena, u kojoj obitelji, kako je bio tvoj odgoj, doticaj s vjerom da ili ne, evo malo ta pozadina."
0:03:53,0:05:18,"Evo rođena sam osamdeset jedan godine u zagrebu i moj početak nije bio klasičan i zato mi je drago da sam evo u podcastu naime moja mama u trenutku tronoće je bila na fakultetu i to je bila neželjena trudnoća, nisu joj bili planovi, nije bila udana tada itede i to je bio trenutak kad je njezin život bio na jednoj raskrsnici i kada je zapravo bila u promišljanju o tome da krene sama dalje odnosno da napravi pobačaj jer u to vrijeme to nije, mislim i danas isto nažalost, to se gledalo pa dobro eto ne pašati, ne odgovara to sa tvojim planovima, pa imaš vremena i nekako nije baš imala podršku oko toga da krene dalje i da rodi, da me rodi, znači nije imala podršku uže obitelji, no onda se dogodilo jedno čudo, a to je da je ona bila već kod doktora na razgovoru gdje treba ugovoriti, jel, pobačaj."
0:05:19,0:05:35,"I taj čovjek je naravno, on je pa s njom razgovarao o životu i o tome šta, kako živi i na neki način tražio nekakve slamke spasa da možda ipak mama izabere život."
0:05:36,0:06:09,"Ona je bila ta duplašena, mlada, još nezrela i o tome je dosta važno reći da se često puta sude ti ljudi, a zapravo u jednom neznanju, u jednom strahu ljudi donose razne odluke koje eto mogu biti pogubne, opće kad razmišljam, kad ljudi prekinu, znači život i cijela jedna budućnost koja treba biti nečija povijest nestaje, znači nema ureda, nema edukatora i DIA, nema Virtugrada, nema moj troje djece."
0:06:09,0:06:15,To mislim da nisu ljudi do kraja svjesni što to znači za čovječanstvo.
0:06:15,0:06:17,Mislim da ćemo tek jednog dana to vidjeti.
0:06:18,0:06:39,"I onda je ona bila na tom razgovoru, moj tata je bio preko puta te klinike, ne znam, gdje se nalazi i kaže, a divam je dečko, ne, tata je čekao ispred i šetao gore-dolje i on je progledao kroz prozor, veli pa nije vam taj baš tako loš, možda bi i vi mogli to zajedno."
0:06:40,0:07:02,"I bilo je zanimljivo da u tom trenutku je uzeo sliku i pokazao na svoju čerku, ne i rekao, vidite ja sam bio u istoj situaciji kao vi kad sam bio student medicine, a ovo je danas moja čer koja je stomatologinja, a ovo su moji unuci."
0:07:03,0:07:20,"I sad jako je zanimljivo da je on zapravo čak rekao na neki način čim ću se ja baviti jednog dana, a to je da je ta njegova čerka Njegovak čer, gdje je on donio izbor da se zajedno sa suprugom da se rodi, je danas stomatologinja."
0:07:20,0:07:24,"Rodila je, znači ima neki svoj život, ima neko poslanje, ima neko svoje zvanje."
0:07:26,0:07:31,I moja mama je tu počela plakati i donijela odluku ipak da će pokušati.
0:07:31,0:07:40,I ja sam zapravo dobila priliku roditi se i na tom sam neizmjerno zahvalna i mami i tati.
0:07:43,0:07:48,Ružno mi je nekako kad čujem zapravo te neke osude koje se događaju.
0:07:49,0:07:57,onda sprem ljudi koji su bili u toj situaciji jer ja sam zahvalna da su oni ipak rekli da.
0:07:59,0:08:02,"A mislim da je zahvalan i moj muž, ajmo moja djeca."
0:08:03,0:08:09,"A neki ljudi isto tako da, koji imaju sad malo i koristi toga jer su se rodile."
0:08:11,0:08:15,"Ali evo baš sam zahvalna, iskreno zahvalna je možda ovo prilika i da zahvalim."
0:08:16,0:08:20,"Ti si zahvalila i sa pjesmom, jednim glasom, tome doktoru."
0:08:20,0:08:22,Evo zahvaljujem i mami i tati.
0:08:23,0:08:23,Hvala.
0:08:24,0:08:26,Evo i za njih i za njih i za hrabra srca.
0:08:27,0:08:29,To sigurno nije bila laka odluka.
0:08:30,0:08:50,"Mi znamo evo i kroz program oprostom oslobođenja koji provodimo u udruzi da je svaka priča jedinstvena i specifična, nijedna žena takvu odluku sve i da je donese ne donosi na lak način i osim toga kad je i donese ona nije ništa lošija poslije toga ni ništa nego samo hoda dalje slomljenog srca."
0:08:50,0:08:53,"Tako da evo, Bogu hvala, oni su odlučili imati cijela srca."
0:08:54,0:08:59,Evo onda si i ti mene pozvala da pjevam na tim susretima.
0:09:00,0:09:25,"Tako da je to jedna velika proslava jer ja na neki način zaista osjećam duboko razumijevanje za žene koje prolaze tad teror straha, to je i zato je jako važno da se priča o tome da tada ne treba ljudima da se nasjedne na njih nego taj dio da to što oni promišljaju o tome postoji, ima neki korijen."
0:09:25,0:09:41,"Znači ima prvo za početak korijen je taj da mi nemamo do kraja svijest što to znači, a drugo da je to danas toliko normalizirano da ljudi na razini savjesti duboko osjećaju tu nešto ne štima, ali sve u svijetu govori pa dobro."
0:09:42,0:09:58,"Tako da tu mislim zato su važne ove stvari i onako razmišljam si, neko možda može naići na ovaj podcast i čuti ovu priču i da zapravo mu to bude neko ohrabrenje da ipak nastavi dalje."
0:10:01,0:10:16,"U mom iskustvu znam osobe koje su učinile pobačaj i neki su mi bliski ljudi u okolini iz neke ajmo reći ranije povijesti, prošlosti i to je baš jedna velika bol."
0:10:17,0:10:36,"Mislim da je to jedan pa rekla bi nož u majčino srce koje zapravo nekako ostaje, Bog to oprašta i oni mogu nastaviti dalje, ali to je jedna takva duboka duševna patnja da trebaju na neki način dati smisao tome."
0:10:37,0:10:49,"E sad svako nađe neki svoj način i Bogu je sve moguće obnovit, ima jedna lijepa riječ engleska restore, znači baš evo obnoviti, stvoriti na neki način."
0:10:49,0:10:57,"ovo i može Bog stvoriti novo srce, ali tu stvarno treba jedno duboka svijest i pokajanje."
0:10:59,0:11:01,I onda kako je teklo tvoje djetinstvo?
0:11:01,0:11:03,Kakva je ona bila kao djevojčica?
0:11:04,0:11:10,"Da, i onda sam ja dobila svoju priliku za život i tu sam bila, dosta sam provodila."
0:11:10,0:11:18,"Baka mi je dosta važna figura, ona je bila mami velika podrška u tom trenutku kad sam se rodila."
0:11:20,0:11:22,Tako da ovaj baš ima veliku povezanu s bako.
0:11:26,0:11:29,"možda će i baka slušati, još uvijek je živa."
0:11:29,0:11:30,Koliko baka ima godina?
0:11:31,0:12:20,"A ona je sad, sad treba zbrojati u glavi, znači trideset šest godina znači osamdeset devet tako da evo moja bakica baka dik slavonka ona je bila podrška i evo rekla bi jedan isto stup jedne sigurnosti u mom životu i jedne kako bi rekla stamenosti i u tom periodu evo prvo sam bila kod bake i onda smo zajedno se preselili u stubičke toplice i tamo sam živjela sedam godina i sjećam se puno igre s djecom i tako, bilo je tu isto zahtjevnih stvari kroz djetinstvo, ali evo nekako malo po malo rekla bih da čovjek kad ima ovakav start tu je zapravo već jedna borbenost jer je tu već bila prisutna borba."
0:12:20,0:12:52,"Kad bi mogli gledati duhovnim očima ja mislim da uopće ta borba za život osim ove vidljive koje vi u inicijativi radite, ali mislim da se velika nevidljiva borba vodi, tako da ako bi mogla reći život mi je donio razne stvari, mnogo teških trenutaka nakon toga, ali rekla bih da ta jedna borbenost i borba za pravo na život, pa evo čak i sada traje."
0:12:52,0:13:01,"Imam neke zahtjevne trenutke i uvijek se vratim na taj početak, a to je da sam dobila život na dar i da je to najveći dar."
0:13:02,0:13:06,"I onda sve ovo ostalo, malo te neko povrijedi, odbaci, napusti."
0:13:07,0:13:08,"To su, Bog me htio."
0:13:09,0:13:15,"Dakle, kad kažem, kogodo ti je išao, napustio mene, dragi B bog htio i mene dragi bog voli."
0:13:16,0:13:25,"I taj identitet ljubljenog djeteta Božjeg onako od sad nadalje kad god me ono počne bacati desno i lijevo jel rane postoje, to je jako važno."
0:13:26,0:13:34,"Na psihoemocionalnoj razini rane postoje ali evo vraćati se na taj početak, prapočetak mislim da je najvažniji temelj."
0:13:36,0:13:37,"Škola, da."
0:13:39,0:13:57,"Onda sam ovako, onda sam zapravo puno sam mijenjala školu, četiri, pet puta u osnovnoj školi zbog nekih životnih okolnosti, dosta me je to bilo, rekla bi da je čak utjecalo na taj dio povezanosti i povezivanje jednog atačmenta jer zapravo ti čim se povežeš s nekim moraš ići dalje."
0:13:58,0:14:15,"Razvijala je to u meni jednu kompetenciju da se brzo snađem, da me možeš baciti sino i tamo da ja plivam ali zapravo postoji jedna ta možda i zabrana da ideš u dubinu jer nikad ne znaš koga ćeš izgubiti i to je nešto s čim sam se suočila u kasnije vrijeme."
0:14:16,0:14:52,"I onda zapravo spet sam prolazila, dosta sam komala, počela sam vrlo rano skladati i pisati bez muzičke škole i to je bilo već tada jedan moj izričaj kroz kojeg se moja duša izražavala, radila sam neke predstave, tako da ta umjetnička neka nota je kod mene dosta prisutna od malena, kažu roditelji da sam prije počela pjevati nego pričat i to je ja bih rekla jedan onako kako bih rekla jedna sposobnost, alat koji meni kao da mi je Bog dao da ja s njim pričam kroz to."
0:14:52,0:15:07,"Meni znaju reći za moje pjesme da su kopsalmi i moderni jer ja opjevavam neke svoje i boli i molbe i moj odnos s Bogom, ono baš ta jedna dinamika čovjeka i Boga."
0:15:07,0:15:26,"Znači ne sad Bog tamo, pa onda slavljenje Božjeg imena koje je važno, nego je taj dio čovještva i utjelovljenog čovjeka koji živi svoju život, koji nosi svakakve stvari i znati imati odnos s Bogom u tim trenucima."
0:15:26,0:16:23,"Evo to je nešto što je moja rekla bih misija kroz glazbu gdje zaista ulazimo u neke dubine i progovaramo o nekim emocijama i bolima kojima kojim je bilo malo teško jer tu se kako bi rekla ono izlaziš van, svi to vide, sve je to vidljivo ali zapravo ta ranjivost ne mogu vam objasniti kao sad je ovaj intervju, možda osamdeset posto ljudi ne bi podijelilo ove stvari ali ja vam ne mogu opisati koliko miloš čovjek prima kada ti zaista iskreno preneseš u želji podijeliš svoj život jer u tom trenutku kad ti podijeliš svoj život u namjeri da proslaviš Božje ime da pokažeš što je učinio za tebe tada ja ne mogu ono kao da se prelijeva jedna fontana milosti gdje svaka osoba koja gleda taj podcast ja osjećam to u srcu, ja to ne mogu objasniti."
0:16:23,0:16:31,"To je jedno uzajamno davanje i primanje milosti Bože, dva otvorena srca."
0:16:31,0:16:34,"Eto, to je za mene jedna, što za mene znači ranjivost."
0:16:35,0:16:39,"E sad, onda kreće, prolazila sam s pet, bila sam uzorna."
0:16:40,0:16:40,Mioc.
0:16:40,0:16:53,"Da, pa onda sam upisala Mioc, eto ne zato jer sam ovaj, pa ko svi idu u Mioc koji su prošli s petnula."
0:16:54,0:17:00,"Drago mi je da sam išla u tu školu, utoliko sam naučila tamo jako razmišljati i povezivati."
0:17:00,0:17:16,"Znači za mene je Mioc jedno mjesto gdje ti učiš razmišljati, povezivati i to je ono što sam zaista dobila kroz tu školu, kao što sam imala dva i tri iz matematike, jer kad se nađeš u Miocu sa hrpom ljudi koji ono briliraju, a ti si se provukao, ne."
0:17:16,0:17:19,"Ja sam puno vježbala, ali ne ide mi to, nije mi to dar, točka."
0:17:20,0:17:31,"I nažalost, imala sam dar puno, baš u onom dijelu jednom umjetničkom, ali s obzirom da nisam iz tog konteksta onda je to nekako prošlo ispod radara."
0:17:31,0:17:44,"Jer vi da bi razvili određeni dar, vi trebate imati kontekst roditelja i okoline koji će to prepoznati i onda vas staviti na put i dati vam kako to razvijati."
0:17:45,0:17:49,"naprimjer ja sam se sad čudila koliko je tu svjetla, kako izgleda osvjetljenje tu."
0:17:49,0:17:53,"Znači mi često banaliziramo određeni put, a taj put ima neke zakonitosti."
0:17:54,0:18:00,"Ti sad možeš volit snimat ko mali, ali da ti dođeš do toga da snimaš podkaste, trebaš imati neko usmjerenje."
0:18:00,0:18:16,Tako da onda u Miocu tamo dosta me odredilo to jer recimo tamo je bila jedna predstava na Lidranu gdje sam ja na neki način prenijela svoju priču koja je bila do tog trenutka stvarno puno neke boli.
0:18:17,0:18:21,Zapravo uvijek sam bila sprema progovarati o boli na ovaj ili onaj način.
0:18:24,0:18:28,I tamo sam napravila predstavu koja se zvala Sijena bez obrisa.
0:18:30,0:18:32,Znači sam naziv je baš onako dramatičan.
0:18:33,0:18:44,"I rekla bih da mnogi ljudi koji čak imaju priču da su trebali biti upobačeni, neki požive kao sjene bez obrasa."
0:18:45,0:18:46,Jer zašto je to tako?
0:18:46,0:19:25,"Jer na neki način vi niste i to nije, vi ste se rodili, poslije su ti se svi veselili, možda i nisu, ali recimo da jesu, ali ti si temeljno bio neželjen, na psihoemocionalno, ti si bio temeljno neželjen, smetao si, znači imaš osjećaj da smetaš, imaš osjećaj da si ukrao neko, znači svojim postojanjem ti zapravo si nekom ukrao neke želje, ambicije i kao da trebaš se smaknuti i biti nevidljiv jer zapravo budiš sretan jer si uopće rođen, a kamoli da ti sad napraviš."
0:19:25,0:19:35,Druga stvar u toj sjeni bez obrisa taj dio šta god ti napraviš kao da nemaš do kraja pravo na to jer zapravo nisi imao ni pravo na život skoro.
0:19:36,0:19:43,"Onda nemaš pravo ni na uspjeh niti na sreću, na ti nekakav život jer ono budi sretan da si rođen."
0:19:44,0:19:51,I to sam baš sad evo čak prije nego smo krenuli osvijestila koliko taj početak može obilježiti ljude.
0:19:51,0:19:54,I zato prihvaćeni.
0:19:54,0:19:55,Ali Bog može ući u te trenutke.
0:19:55,0:19:56,On je bio tamo.
0:19:57,0:20:03,Samo mi u toj slobodi trebamo zaista Boga zvati u te trenutke slomljenosti.
0:20:04,0:20:07,I onda sve to polako se može složiti.
0:20:07,0:20:13,I onda u srednjoj školi sam doživjela jedno veliko razočaranje baš na Lidranu.
0:20:15,0:20:20,"Jer sam ta predstava Željko Vukmerica, evo, koji je nedavno preminuo."
0:20:25,0:20:47,"I gospodin Raguš, oni su režiseri i glumac je bio, bili su na lideranu i evo oni su nam dali najveći broj bodova, a eto nažalost profesorice koje su bile isto u tom režiriju, da nam nisu dale nijedan bod da nas ruše na ljestvici."
0:20:49,0:21:05,"I sad uopće nije stvar liderana, nije stvar jeste ti sad prošle ne znam državno natjecanje itede znači nebitno, ali ja se sjećam tog trenutka nas je deset sudjelovalo u toj predstavi, to razočararenje kad ti mladom čovjeku uzmeš snove, ideale."
0:21:06,0:21:18,"Znači ja se sjećam trenutka kad sam ja pogledala i na razini nesvjesno emocija ja sam donijela odluku da ubijam umjetnost u sebi, doslovce gotovo je."
0:21:18,0:21:19,Ovo je za mene kraj.
0:21:20,0:21:29,"I tada kao da sam dio sebe odrezala, potpuno jedan vrlo dragocjen i sad što se dogodilo?"
0:21:29,0:21:47,"Zanimljiv jedan toliko duboki trenutak moja, Bog je stvorio jedan kontekst gdje smo se kćer od Žeka Vukmerice, Jelena i ja srele u jednoj suradnji, ona je inače u ovom prostoru sa mnom ovdje i zajedno idemo na jednu edukaciju."
0:21:48,0:21:52,I ja sam na toj edukaciji morala svoj rad prikazati.
0:21:52,0:22:01,"Ispričala sam upravo neke elemente svog života i ona je plačući došla, zagrlila me i rekla je sad znam šta je tata vidio tebi."
0:22:03,0:22:11,"I taj jedan susret, uopće ne mogu objasniti kao da je on bio prisutan tu i da se borio za moju umjetnost."
0:22:12,0:22:16,Tako da evo zahvalna sam i evo Bože molim te da je s tobom sada.
0:22:16,0:22:18,Zahvalna sam na Jeleni.
0:22:18,0:22:32,"I onda na prilici nakon toga, evo srednje škole, tamo sam imala neka isto teška iskustva, tu sam zapravo došla u trenutak gdje sam bila toliko slomljena, mogla bi reći čak i depresivna."
0:22:33,0:23:02,"Današnjoj diagnostici mislim da bi mi dijagnosticirali depresiju, ali nekako prolazila sam kroz to sama, bila sam jako usamljena, izgubila sam sve tadašnje ideale i tu umjetnost i neke jako važne ljude u životu i prijatelje i baš sam ostala sama i sjećam se kako ona idem i taj bol zapravo, taj krik što je zanimljivo, sjećam se tih svojih noći gdje dođem i ona baš plačem u jastuku."
0:23:03,0:23:12,"Ali to nije bio, to je bio krik koji, ja bi rekla kad krećem od onog samog početka, sjećam se da sam šetala šumom i onak."
0:23:13,0:23:19,"Ovo mora imati nekog velikog smisla jer ja nisam imala vjeru tada, to je bitno."
0:23:19,0:23:29,"Znači ja nisam primila vjeru od roditelja, krstila sam se kao inače kao ono postkomunistička djeca, znate kako ide ono s devet godina plus."
0:23:32,0:23:43,"I onda sam išla na vjeronauk, primjela, zanimljivo je, imam dan danas te molitvenik i ja sam u tom molitveniku zapamtila osnovne molitve i kajanje."
0:23:45,0:23:57,"Ja mislim da sam ja svaku večer, tu i tamo bi preskočila, svaku večer bi molila, oče naš zdravo Mario, imala bi, slava ocu, imala bi ispit savjesti i Andžio Čuvaromeli."
0:23:57,0:24:21,"Znači, što se tiče, otišla sam iz crkve itede dogodio se trenutak da sam četajući tom šumom gledala drveće i rekla ovo mora imati smisla."
0:24:21,0:24:23,Jer ako nema smisla onda nema ništa smisla.
0:24:24,0:24:29,"I tu mi se počela otvarati ljubav prema Bogu, Ocu, Stvoritelju."
0:24:29,0:24:34,"Znači, rekla bi da sam prvo imala odnos s Bogom, Stvoriteljem, Bog Otac."
0:24:35,0:24:48,"I taj dio ono, ajde, kao da se počela čuditi, ono slavit Boga kroz ljepotu, prirodu, kako je Bože, Bog sve to stvorio, ono, čudesno."
0:24:50,0:24:58,"I tu kreće taj moj put, onda kreću neka lutanja, naravno jer onda čovjek kad nema taj temelj onda uvijek vas negdje zakačuje ići."
0:24:59,0:26:04,"I sjećam se u tom periodu, hvala Bogu, pa moja narav je takva da nisam u to vrijeme kao nezrela išla duboko u stvari, onda sam poslije zahvaljivala Bogu da sam bila predana i detaljna, možda bi zaglibila negdje dublje, ali u tom periodu zapravo dolazim, prvi put susrećem u Međugorju kršćanstvo kao, wow, kako je to lijepo, pa to je neki taj mir, ali još uvijek nisam znala do kraja i onda počinjemo i put kroz profesora Ivančića kojeg sam počela čitati, dijagnoza duše, to bi kad ste u procesu obraćenja, sve to mora biti malo intelektualno i tako, ono, to je ta jedna intelektualna oholost koja ne mrze si pomoć, vajda te nosi, ali onda Bog i takvima progovara, profesor Ivančić je bio rekla bih kralj za to, znači progovoriti kroz biologiju, kroz ovo, ono onda, onda naravno ti kao obraćenik, da, da, da, on je drukčiji svećenik, da su bar svi takvi i takvi, to su neke te tipične priče."
0:26:04,0:26:14,"Uglavnom otišla sam u to vrijeme, sam imala opet neku krizu i hodam Vodnikovom i vidim Centra za duhovnu pomoć."
0:26:15,0:26:21,"Ovaj me meni, pa to nije ona Ivančić, a ja sam bila tad baš plakala jer sam prolazila neka, baš nešto mi se dogodilo."
0:26:21,0:26:31,"I ja prolazim Vodnikovom, vidim, dođem gore, oprostite, tu profesor Ivančić ovaj čitala s njegovom knjigu pa da da on vam ima danas vjeronauk na zavrtnici."
0:26:31,0:26:39,Ja sam otišla na vjeronauk to je bio dan i sad će biti zanimljivo pada vukovara.
0:26:42,0:27:05,"To je dvadeset i osamnaestjedanaest bravo osamnaestjedanaest i to je trenutak mog obraćenja dvije tisuće četiri godine i šta je zanimljivo ono šta ja ljudima kažem koji traže traže mir pa onda utopiju raja zapravo taj cijeli svijet vam je setiran na način da oni, ti tražiš da ti dođeš u točku da je sve super i onda će biti super."
0:27:07,0:27:08,Pa to nije život.
0:27:09,0:27:21,"I onda se naravno stalno razočaraš, onda ideš jedna praksa pa nije mi sve super i sve, ali zapravo onda shvaćaš da tražiš mir i to je ono što Isus daje, to srce Isusovo daje."
0:27:22,0:27:30,"I to je nešto što kad god dođem s ljudima koji mijenjaju prakse, valjda mi nisi primijetio da to stalno neke probaš pa ide, pa ne ide, pa onda nađeš neke drugo."
0:27:31,0:27:33,I onda počnem pričati o svom svjedočanstvu.
0:27:33,0:27:55,"Znači ja od osamnaestjedanaest nikad više, više nisam posumnjala da li je Isus taj, da li je Isus istina, put i život i da li je Katolička crkva, vjerujem, znači apostolska jedna, da li je prava?"
0:27:57,0:27:57,Znači nikad.
0:27:58,0:28:00,To je to i nema mrdanja.
0:28:00,0:28:03,"I to je ono kad te Bog nađe, našao te."
0:28:03,0:28:07,"E sad, onda kreće, dio kad ti misliš, evo, kreće zaljubljenost."
0:28:08,0:28:17,"Ajme Bože, kako si velik, kako si ti mene našao se i onda ti misliš sve je sada riješeno, ali onda kreće čistilište na zemlji."
0:28:18,0:28:23,"I on kaže super i to, to je ono što ja znam reći, nemojte obraćenicima krastu radost."
0:28:24,0:28:32,"Jer to je bitno, znači zaljubljenost i prije, kako bi rekla braka i početak braka, važno da bi ti mogu iznijeti sve poslije."
0:28:33,0:28:39,Jer ta si ti zapravo u tom jednom zanosu i onda taj zanos ti pomaže kad krene teško.
0:28:39,0:28:55,"Znači taj zanos, ja bi stavila veto za obraćenike prvih pet godina ništa, znači oni sam hodaju i nema nikakvih važnijih slu službi ono to jer zapravo ti si tada ono potpuno afektivan, emotivan i Bog to pušta, to je dio faze."
0:28:55,0:29:03,"I onda ti dođeš kasnije, tamna noža ušao, on kaže, a vidjet ćeš ti kad dođeš, pa da ga pusti, sad treba doći od tamo ono."
0:29:03,0:29:07,Tako da evo to je bila jedna zaljubljena faza i trajala neko vrijeme.
0:29:07,0:29:11,Inače pjesma Moj put je nastala baš na dan obraćenja.
0:29:12,0:29:13,I onda je svašta nešto.
0:29:14,0:29:16,"To evo ga, to je prva dva poglavlja."
0:29:17,0:29:33,"Možda sljedeće poglavlje, odabir studija, ja sam znala da sad ne radiš valjda ništa što se toga tiče, ali i puno ljudi koji su se kroz život ostvarili tražeći Božju volju u nečem posebnom su zapravo napustili svoje ajmo tako reći struke."
0:29:33,0:29:39,Kako je to teklo i kako si se onda upoznala sa svojim suprugom?
0:29:39,0:29:45,"E, moja mama je bila brižna mama koja je brinula u mojoj školi, ali imala je i planove za moj život ovaj."
0:29:46,0:29:52,A plan je bio da odem na ekonomiju i da me zaposle u banci.
0:29:54,0:30:02,"I sad to je onaj dio kad ti zapravo kreneš nekim putem jer nisi dovoljno promišljao tome tko si, koji su ti talenti i šta te zanima."
0:30:03,0:30:16,"Znači cijeli školski sustav zapravo ne osvješćavaju djecu i mlade po toj temi, onda nemaš ti dovoljno čvrstine u tom identitetu da u trenutku kad ti trebaš donijeti izbor da dođeš mami, al ću mama, meni ti to baš ne zanima."
0:30:16,0:30:21,Ako i kažeš nema dovoljno razumijevanja argumentacije da bi se moglo uprijeti tome.
0:30:22,0:30:35,"I onda sam krenula na ekonomiju, teško mi je bilo studirati, ali evo sad mi je malo i drago jer razumijem biznis, a dosta radim sad sa voditeljima, liderima, kompanijama, konzulting i edukacije, pa mi sad taj dio pomaže."
0:30:36,0:30:54,"No nakon fakse zapravo dolazi taj neki moj prvi susret i to u isto ovo paralelno vrijeme kad je profesor Ivančić došao i vjeronauk, moj život i obraćenje, tu nekako se otvaraju i obrisi moje neke buduće misije i djelovanja."
0:30:55,0:31:07,"Jedna kolegica je po završetku fakse ona je postala depresivna i onda sam je upitala pa kako si ona od takve depra, ona kaže pa pusti me, do sad sam bila studenta, sad ne znam tko sam."
