Start (HH:MM:SS),End (HH:MM:SS),Segment
0:00:00,0:00:11,"Hvali nisi Marija, predraga braća, predraga i sestre, evo me sa Vanesom Mioć, predivnom sestrom u Kristu preko koje će Gospodin djelovati na sve vas."
0:00:12,0:00:20,"Ima puno toga lijepoga za reći, ali posebno će vas dirnuti neke njezine misli koje niste mogli ni očekivati da ih ima."
0:00:20,0:00:23,"Vanessa moja, Bog te blagoslovio i tebe isto."
0:00:23,0:00:24,Dobrodošla.
0:00:25,0:00:33,"Baš mi je uvijek kada te vidim veselje jer izbaviš i na moje lice koje se uvijek i smije, poseban osmih."
0:00:34,0:00:36,Hvala vam što to i moj doma isto tako misle.
0:00:36,0:00:39,A sam posebno to sjetio i u susretu sa tvojom mamom predjedom.
0:00:40,0:00:47,Vas dvije ste jako povezane i nekako mi se čini da je upravo ona utjecala u mnogo čemu.
0:00:47,0:01:22,"Pa je, mislim stvarno kako se kaže djeca uvijek prate ono što njihovi roditelji rade i stvarno sam u raznim situacijama i ljepšim i težim mogla baš vidjeti kako ona reagira i gdje ona zapravo od koga ona traži pomoć i to je bilo zapravo kod Boga i to je ono što je meni onda što sam ja naučila da kroz život je to najbolje jedino za mene rješenje jednostavno šta god da se desi uopće ti je najviše pomoć tako da je jako su povezane i mama i Seka i ja Osjećate se zato što mi je ona u razgovoru tako ponosno govorila i o tebi i o obitelji općenito, ali baš je nekako to govorila ne s negativnim ponosom nego baš duboko zahvaljujući gospodinu."
0:01:23,0:01:46,"Je, baš nekako ona često puta ono kaže, ono žele gledati to sve sa strane jer naravno mame su uvijek jako ponosne i sretne i moje dijete, ali baš nekako si to ono kao jer kaže ona i kad nešto nije dobro i to i želim i želim biti okružena ljudima koji će mi stalno tapšati po ramenima nego koji će mi stvarno reći evo ovo je dobro, ovo nije jer ono bez poniznosti ovo sve pada u vodu."
0:01:47,0:01:51,Ona je snažna žena zato što vas je isto i sama podizala?
0:01:51,0:02:22,"Je, stvarno je i moralo u jednom trenutku biti i mama i tata, traždat ljubav, ali traž opet preusmjeriti dijete da se ne pogubi u cijelom svijetu jer u tom trenutku ti imaš dva izbora, možeš ići lakšim putem ili težim, teže je naravno nekad, malo ono kad si poslušan gospodinu i kad zapravo želiš čuti što ti on kaže a ne ono što ti želiš i tvoje ono neke te prolazne želje i u tome nas je baš nekako dobro preusmjerila i sretna sam što je to danas upravo zbog toga što je ona prošla možemo biti tu gdje smo."
0:02:22,0:02:30,"I zato si možda i izraženija kada je u pitanju tema apostolata za život na vani, jel da, takva tema posebno dira?"
0:02:30,0:02:58,"Da, i posebno me dira jer po meni je obitelj nešto najsvetije što postoji i smatram da tko god postigne u tome i zaista ili tko god opstane odnosno tko god je i svećenik ili tko god je u braku ima obitelj zaista je to ono po meni već sveta osoba jer u današnjem vremenu imati obitelj je izazov ali i prekrasno ali općenito taj život meni osobno najveća želja baš u srcu imati svoju obitelj i evo pogotovo za one najmanje to mi jako, jako važno."
0:02:58,0:03:06,"Tako da sjećam se kad smo došli iz Švicarske, jedna od prvih lokacija na kojoj smo bili upravo je Vinogradska ispred koje smo se i umolili krunicu."
0:03:06,0:03:21,Ja sam tada bila ne znam osmi razred i stvarno mi je to baš ostalo na srcu i zato mi je baš evo lijepo što to nije bio samo jedan trenutak nego što je to kroz cijeli period pa evo i sada u Sisku kad će biti koncert nekako da mogu biti dio te priče na svoj neki način.
0:03:22,0:03:51,I taj koncert koji si sad spomenula će baš biti obilježen time što smo uspjeli uz Božju pomoć naravno okupiti glazbenike poput tebe i pjevače i ujedno će biti Marko Perković Thompson jer je on već meni prije nekih pet šest godina kazao koliko mu je ta tema života jako važna i da čeka trenutak kada će on moći o tome otvoreno govoriti.
0:03:52,0:04:04,Kako ti tumačiš sad sve veću prisutnost ove teme za život i brigu za začetnu djecu i brigu za trudnice koje ima naša udruga Hrvatska za život da se ovako uspjelo u četrdeset hrvatskih gradova sve proširiti?
0:04:05,0:04:17,"Ja sam preponosna na vas sve iz udruge Kiper vjerujem da vam nije bilo lako uopće da dođete do toga i neće biti lako organizirati taj koncert vjerojatno će biti na napasti, ali svi znamo da je to dio svega kad činimo nešto veliko za gospodina."
0:04:18,0:04:30,"Preponozna sam na vas jer je stvarno trenutno najpotrebnije o tome razgovarati jer obitelj je najnapadnutija, a život po meni ne postoji ništa veće od toga."
0:04:30,0:04:41,Tako da evo baš sam sretna što branimo svi taj život i što možemo evo pokazati i onima koji još nisu tog mišljenja koliko je to zapravo lijepo i bitno ispunjavajuće.
0:04:42,0:04:43,Svako daje sa svojim talentima doprinos.
0:04:44,0:05:01,"Ti svojim glasom, vi dragi mladi možete dati svojim talentom veliki doprinos ne za našu udrugu, ne za poslove za život zato što to vodimo mi već za dobrobit svakog zaštićenog djeteta i svake trudnice u potrebi i oca djeteta."
0:05:02,0:05:08,"Možete to učiniti svojim pisanjem, naliperom, možete to glasom, možete to plesom."
0:05:08,0:05:16,Imali smo isto tako i dramske pjesme koje su bile upriličene od strane volontera i koje su otvorile upravo tu temu života.
0:05:17,0:05:29,"I ti u svojim pjesmama posebno slaviš Boga Oca, kako je došla ta suradnja konkretno po pitanju te pjesme gdje se posebno slavi Bog otac?"
0:05:29,0:05:31,To mislim da na pjesmu imaš oca.
0:05:32,0:06:05,"Tu pjesmu napisala Romana Bilaver i nekako od samog početka baš rekla bila da je tu pjesmu napisala kako bi ju upravo ja izvodila i na tome sam baš ono zahvalna i sretna jer sam pjevajući tu pjesmu i dan danas bez obzira što je prošlo evo neko vrijeme baš duboko prolazim tu pjesmu i puno ljudi mi je komentiralo da posebno žene su kad se ta pjesma pjevala počele plakati to sve jer važan nam je otac naš, nama je važno da se mi osjećamo zaštićeno kao male princezice, curice koje trebamo i njegovu pažnju i pomoć i zaštitu i ta pjesma mi je posebno draga jer to je stvarno istina."
0:06:05,0:06:22,"Imaš oči na nebesima i on ti dane poznaje i najdraži dio cijele pjesme je taj, neke težište nisu za te stvorene jer stvarno nisu, ja sam sklona ono trpa, trpa, trpa nepotrebno, ajde predaj se njemu i vidjet će onda koliko je život ljepši i lakši, tako da evo baš svaki put se iznova podsjetim."
0:06:23,0:06:27,"Spor je Ivan Crnjak je to snimio, samo je to spor."
0:06:27,0:06:51,"Sorry brate Ivane, uvijek te zovem da si Crnjak, ne, Crnjak, Crnjak, Crnjak, bravo, je on je snimio spot, gotovo skoro sve spotoje, mislim da je većinu je on, da, zapravo jedino jedan nije spot snimio i to nam je baš predor, bilo to smo u Rijeci, bilo u toj kući, prekrasna je bila, ono, prelijepo, prelijepo je, baš ono mi to sve efikasno, brzo i lijepo nam bude."
0:06:52,0:07:16,"Kako je to zanimljivo jer sam ja baš ljubitelj takvih interijera, baš se pokopalo sa samom pjesmom, sve mislim, dobro, nije direktor, ali opet i je, direktor je tamo tradicionalni namještaj što daje neku i tradiciju kad ti gledaš i poklad naše vjere u Hrvatskoj, ali zato sam bio, rekao Matima, Venezuelom moramo snimiti ovdje di je u pozadini vinoteka."
0:07:16,0:07:17,Evo vam se sviđa.
0:07:18,0:07:21,"Je, je, zato što nekako je, malo boje je, pare na taj sport."
0:07:21,0:07:22,"Pa je, je, je, je."
0:07:23,0:07:25,Ispostavilo se da jako voliš vina.
0:07:25,0:07:26,"Volim, da."
0:07:26,0:07:28,Odgovori da ljubavi prema vinu.
0:07:28,0:07:31,"Pa vi što ne znate, pogotovo?"
0:07:31,0:07:33,"Pa je, je, je, je."
0:07:33,0:07:42,"Ne, mi svi baš volimo lijepo onako, ono uz ono gručak ili takvu čašicu vina, mislim da to je ono, baš nešto jako lijepo, volimo živati u tome."
0:07:42,0:07:44,"Kad ste prvi put okusili, koja je to bila vina?"
0:07:44,0:07:45,"U, dobro pitanje."
0:07:46,0:07:49,"Nije bilo vino, bio je onaj dječji pinušac onaj."
0:07:49,0:07:53,"zarađena, ali baš vino, vino ne znam, evo ne mogu se sjetit koje je to."
0:07:53,0:07:54,Jesi li više ljubimica bijelog ili crnog?
0:07:55,0:07:57,"Ljeti bijelo, a zimi crno."
0:07:57,0:07:58,Uz koje jelo?
0:07:59,0:08:09,"Pa uz meso najviše volim naravno to crno, ali baš evo neki dan sam pila neko predobro crno vino i trenutno mi je to evo sad favorit."
0:08:09,0:08:30,"Meni ti je u razmatranju došlo da ipak zavidim na nečemu i ta zavist, pa mogu evo iskreno pred gledateljstvom kazati je vezano uz grijeh zavisti."
0:08:30,0:08:33,"Inače, Bog mi je dao veliku milost da ne zavidim, ja se radujem."
0:08:33,0:08:37,Baš iskreno se radujem i Bogu zahvaljujem na tome.
0:08:38,0:08:39,"Naravno, imam neke ja druge borbe."
0:08:40,0:08:58,"Ali kad sam ono iščitao, čitanje kako je Isus umnožio vino u Kanigaleskoj i kako su ovi likovi pili najbolje moguće vino, pa ja bih rekao u povijesti čovječanstva, rekao sam pa šta nisam ja kušao to vino."
0:08:59,0:09:19,"Nekako mi je došlo, pa Bože moj, dobro je to sve i onda mi je odmah došlo pa čeka malo, pa Kristov se dao u prilikama kruha i vina i zato mi jedemo njegovo tijelo, pijemo njegovu krvi i neusporedivo je s time, ali došlo je do mene ljudski i pa čovjek će volim i ja vino, znači pa da sam ga barem okusio, dakle oni su imali privilegiju."
0:09:20,0:09:22,"Šta ti kažeš, što misliš kakvog je okusa bilo to vino?"
0:09:23,0:09:37,"Ja mislim da je okus sigurno jako intenzivan bio, ono od svega pomalo, bilo to suha, šljive, smokve, ne znam, tada je bilo već čokolade, ono zamišljam se neko tako crno fino vino zasigurno savršeno nešto zamišljamamo?"
0:09:37,0:09:55,"Pa meni je savršeno zato što je to Don Dobro Stojić nama kad je nam govorio o teologiji tijela, spominjao kako je baš na tome Isus započeo javno, dakle na svadbi, na vjenčanju i onda najbolje vino, zamisli to."
0:09:56,0:10:01,I ti si isto osoba koja moli za svoga budućeg muža.
0:10:02,0:10:04,Seti osim će to vjerujem posložiti sve.
0:10:05,0:10:07,Je li bilo ovakvih prilika?
0:10:08,0:10:09,Otvornosti.
0:10:10,0:10:12,Što kažu naši muškarci katolici?
0:10:12,0:10:13,Jesu li boje priče ili ne?
0:10:13,0:10:42,"Pa ja bih rekla da se bojim, mislim ja kad gledam evo u našoj molitvenoj zajednici ili općenito isto, ono tu ima toliko kvalitetnih ljudi, od kvalitetnih muškaraca i žena, oni su stvarno i što je najbolje u životu si posložili te neke stvari i sad treba taj idući korak i čak i tu postoji neko sviđanje i to se sve vidi, ja sam inače taj matchmaker, ja i moja sestra mlađa mi onda volimo to sve, evo, evo je to prezabavno i sretni smo kad se, ono mislim, to je toliko lijepa stvar kad pronađeš svoju osobu s kojom možeš ići zajedno, sve bliže Bogu."
0:10:43,0:10:54,"Ali osjetim i vidim nekako i pogotovo nakon korone i osobno, kao tu je baš se neki strah pojavio i strah od odbijanja, strah od krive odluke pa ne znam što onda i visoka očekivanja."
0:10:55,0:10:57,"Ona mora biti tet, tet, tet, tet, tet, on mora biti tet, tet."
0:10:58,0:11:09,"Znači mi nismo sada već svec, mi možemo raditi na tome, ali možemo zajedno raditi na tome da postanemo svec, a za to moramo biti otvoreni i ne samo pitati se ono što ja želim od nekog nego što i ja mogu pružiti."
0:11:09,0:11:16,"Možda kad promijenimo taj način razmišljanja, možda se i prije neke stvari onda dogode i onda vidiš da ona osoba koja je pred tobom možda čak i nije toliko loša."
0:11:17,0:11:21,"Tako da evo to je nekako puno, treba puno više o tome razgovarati."
0:11:22,0:11:26,"Super mi je ta teologija tijela upravo, baš sam bila na Badi tjedan dana i onda sam isključivo bila."
0:11:26,0:11:42,"Da, bila sam, odlično mi je to bilo, baš ono i otvorenost o tim nekim temama o kojima se uopće ne govori toliko, malo smo zatvoreni previše i onda koliko je tu ta radost, ono jako utječe na sve i koliko je ono bitno, tako da baš mi je drago da se sve više o tome pričam."
0:11:43,0:11:57,"Ekipa, čuli ste, Vanessa je bila na Badi, na Badi svako ljeto Don Damestojić i Selezijanac, prijatelj veliki studentski kapelan, trenutni David vode Ljetnu školu teologije tijela, to može tako nazvati."
0:11:57,0:12:00,"Dvije teologije tijela, imamo modul jedan i modul dva."
0:12:00,0:12:01,"Modul jedan, modul dva."
0:12:02,0:12:03,i prijavite se.
0:12:03,0:12:11,Ti Matija može bez obzira što ovo nije naš događaj slobodno na ekran staviti točno stoljećevu sliku.
0:12:12,0:12:13,A ja sam isto o tome mislio.
0:12:15,0:12:18,"Pa dobro, ali oni govore isto o teologiji i obraćaju čistoću."
0:12:18,0:12:19,"A da, da."
0:12:21,0:12:21,"Pa da, sve."
0:12:22,0:12:28,"Ajde onda stavit to, da ekipa ne bude sad na tražilici, da ne kopa, nekim sve piše."
0:12:28,0:12:32,"Ne, da, da, da."
0:12:33,0:12:38,"Matija, dobro, ajnemo sad bliže jer bit će štenir dan, meni isto gost, bit ćeš gost, evo, ajde."
0:12:39,0:12:41,"Ja sam svjedok, ja sam svjedok."
0:12:41,0:12:45,"Pa tako i kodricovati, evo hoću biti, pa bit ćeš, bit ćeš u pravo vrijeme."
0:12:47,0:12:56,"A vezano za tvoju sestericu, ona je isto ovaj, sada to nisam istražio, vidiš, nije mi to dao moj prijatelj."
0:12:57,0:12:58,"A ima, da, informacije o njoj."
0:12:58,0:12:59,I ona u braku ili nije?
0:13:00,0:13:07,"Nije ona mlađa, ona je od mene šestpet godina mlađa i ona je sad na faksu i baš uživamo, super se slažemo."
0:13:07,0:13:16,"I sad smo, kad sam ja bila u pubertetu, ona nije, pa kad ja nisam, ona je bila u pubertetu i sad smo baš u nekoj fazi gdje možemo se družiti u istom društvu i sve i baš uživamo."
0:13:16,0:13:18,"Tako da ona još se nije udala, al tko zna možda prije mene."
0:13:19,0:13:20,I on ide na toj koncerti i sve.
0:13:21,0:13:21,"E, ide, ide."
0:13:21,0:13:29,"Ne ide sad na sve, sve, sve, ali ide i, ali se naslušala i nagledala i sve već i nasnimala i naslikala, baš je super."
0:13:29,0:13:30,Ono bi jako mi puno pomoglo.
0:13:30,0:13:47,"Ono u tim trenucima je tako važno nekako ja se ono pripremim, ono i duhovno i sve, onda tako u tim trenucima ti neke logističke stvari i tu imam stvarno tih par osoba koji su uvijek tu za mene i za snimanje i sve jer sve zapravo sama radim i onda eto, sam baš jako zahvalan njima, eto, Bog će im platiti."
0:13:48,0:13:50,"Je, hoće li ona doći na ovaj koncert u Sisak?"
0:13:50,0:14:01,"Ona neće zato što ta naš pratić ima krizmu, a ja isto, a pazite i ja sam trebala biti na toj krizmi, ali sam evo došla tako da evo, eto vidite to je žrtva u ljubavi."
0:14:02,0:14:06,Jel barem malo patiš zbog toga ili si na koncertu u Brisarskoj druži će se s cijelom obitelji?
0:14:06,0:14:11,Jer tebi breme lako jedan sladak zbog toga što ćeš biti na koncertu a ne tamo na privatnom druženju.
0:14:11,0:14:13,Ja mislim da će biti upravo takav kak treba biti.
0:14:13,0:14:32,"Lijepo smo se raspodijelili i jedva čekam date evo svoj glas i svojim prisustvom i s molitvom da to ono što i jedva čekam čut tamo i svjedočanstva i vidjeti sve jer bez obzira koliko se mi dajemo i ti evo isto, što sve radiš ono koliko ti se daješ ti kroz ljude isto puno toga dobiješ i tome se baš nekako veselim i tim."
0:14:33,0:14:40,A je li vama ženskim izvođačima malo i skuplje se pripremati za koncert budući da trebate i misliti na frizuru?
0:14:40,0:14:44,Je skuplje je ali ja sam tu dosta snalaživa i ja sve sama radim.
0:14:44,0:14:49,I to čak sama.
0:14:51,0:15:15,"Ja bih odmah ovu emisiju uputio, ovu epizodu emisije uputio nekom konkretnom profesionalnom menadžeru da se zauzme za tebe zato što ekipa nema pojma, ja propušta,, ali evo ja se obvezujem ako ću biti u prilici nadahnuti nekog župnika ili nekog gradonačelnika da tebe odmah ispromoviram pa da imamo neki deal da možda govorimo."
0:15:15,0:15:16,"Dapače, dapače."
0:15:17,0:15:28,Jeste li u duhovnoj glazbi da se ni razvija taj na neki način u pozitivnom smislu riječi menadžment ili još nije na razinu došao kao što je to prisutno vani u sekularnoj glazbi?
0:15:29,0:16:30,"Pa ja bih rekla da se razvija zato što je stvarno po Bogu hvala pa sve više i župnika i gradonačelnika i svi koji su zapravo u mogućnosti da organiziraju nešto tog sadržaja, vide važnost tog istog i to mi je predrago što kad usporedim prije pet godina i sad recimo evo ovu tojest prošlu godinu ja od Uskrsa pa do prvog vikenda, prvom mjesecu ja sam svaki vikend imala nešto dakle to je stvarno ljudi se i Bogu hvala dakle postoji ono svijest o tome koliko je to bitno i kako je to super stvar za privuć ljude a posebno sjećnici će onda svoje evo učiniti sve to ali evo glazbom privuć ljude i tako je tu itekako potrebno sve više evo u tome menadžerskom evo znam recimo konkretno Luka Kotlar koji evo znam radi salonom s kusaricama i to stvarno evo jako se trudi i evo prošle godine, koliko god sam koncert imala, tko je on organizirao, to je stvarno bilo na razini i ja mislim da to duhovna glazba i zaslužuje da to bude na visokoj razini i da ljudi vide da pjesma, ne postoje važnije pjesme od toga kad Bogu pjevaš."
0:16:31,0:16:33,Za Boga treba najbolje.
0:16:34,0:16:40,"I isusa su svakodnevnici poziva na savršenstvo, budite savršeni kao što je ota savršen, ono u wow."
0:16:41,0:16:42,Koji je to poziv?
0:16:42,0:16:48,"Ono veličanstveni da mi imamo tu privilegiju ići prema tome i ne bojati se, čak i uspoređivati sa svecima."
0:16:48,0:16:51,"Jer ekipa često kaže, ja sam daleko od sv."
0:16:52,0:17:04,"Ante, daleko sam od majke Tereze, čekaj malo, čekaj malo ako živimo gospodinovu volju u svom životu, mi možemo se natjecat sa ovim svetcima, natjecat u ljubavi."
0:17:04,0:17:05,"Da, u ljubavi, da."
0:17:05,0:17:09,"A tebe, tko posebno sveti Josip, na neki način zagovara i jesi još kome?"
0:17:09,0:17:52,"Pa nekako se na njega, i na njega se nekako baš navezam jer je on i otac, isto on je zemaljski otac i zato nekako i ta, sviđa mi se to što kod njega baš ono čini mi se kao da je baš ono sjena bilo i o njemu nema puno toga, on nije puno toga govorio, ali sigurno puno toga je učinio i tako da evo baš mislim da može biti pravi uzor, ne nužno da neko ako je ekstrovert mora biti introvert jer po ovom što mi nemamo zapisano njemu se čini kao da je bio takav, ne znamo, ali mislim općenito uzor po tome da bude autentičan i da živi svoj poziv i da vjeruje Bogu, mislim on je mogao odustati čim je saznao da je mogao odustati ali nije i to je to kad netko živi i po tome mislim da muškarci baš ono imaju odličan uzor."
0:17:53,0:18:08,"A sveti osobi Kupertinski, on mi je pomagao u razdoblju dok sam imala ispite, sveta Cecilija naravno i sveti ekspedit mi je isto jako drago, on je za ove hitne slučajeve, njemu sam se jedno vrijeme baš puno i molila, ali stvarno nema to neki favorit."
0:18:08,0:18:13,"Mislim da svi mi on ovisno o životnoj fazi uvijek nađemo nekog svog, ali evo taj sveti osim meni je."
0:18:13,0:18:45,"Hoću kazati vama dragim mladima da je vrlo dobro imati nekog prijatelja za uzora živućeg i da se mi možemo nekome dati kao uzor u određenom segmentu življenja duhovnog, a isto tako dobro imati uzore svece, ne da bi radili idolo poklonstvo i da bi molili njih i dakle mi se zagovaramo njima da se oni zagovaraju kod nas kao kada mi jednim živučima kažemo evo moli za mene, moli za ispit, moli za moj brak i svi molimo jedni za druge."
0:18:45,0:18:50,Tako vjerujemo da i nebeska crkva moli za naše potrebe.
0:18:51,0:19:06,"I ne samo na ovoga svetoga Josipu mogu te reći da je moja Sara isto koja se bavi isto i pjevanjem, tvoja kolegica na neki način sve što je rekla Josipu to se i dogodilo, baš je jak, jak."
0:19:09,0:19:28,"Jako jak, evo baš sad tamo niste molili, to je ono tridesetnicu, ma baš ono osjećam se tako nekako uvijek zaštićen, ali to ne samo, baš to znamo mi kome se mi molimo, ali tako je lijepo imati nekog tko će to povući, pomoći i približiti još bliže Bogu, tako da je to ono baš lijepo što imamo to, baš smo bogati u tom području jako."
0:19:29,0:19:43,Jesi li razmišljao možda da neka pjesma bude isto usmjerena u razgovoru s njim pa onda da ljudi na neki način dožive onu tvoju nutrinu koju možeš podijeliti sa svijetom.
0:19:43,0:19:46,"Naravno, jedan dio nutrine koji ne dijeliš sa svijetom, nego imaš odnos s gospodinom."
0:19:47,0:20:07,"Ja se sad ne mogu sjetiti, to sam neki dan razmišljao o tome kako je meni netko pustio pjesmu, ali ne mogu se sjetiti evo ako je ta osoba ovo video gleda i sve nek se javi da znači znam da mi je netko pustio pjesmu u kojoj se pjeva, radi se o perspektivi kako je Josipu bilo."
0:20:09,0:20:10,Mislim da sam ja htjela zvučati pozitivno.
0:20:11,0:20:22,"Znam di sam sjedila, znam da sam, evo inače šta god se dešava, ja me zove Zajednik, da je ko slon pamtim, ja znam gdje sam sjedila, koja pjesma svijela, koji miris je bio, gdje smo stajali, ali ne znam što se tiče geografije, katastrofa."
0:20:22,0:20:36,"Ali točno znam gdje sam sjedila u autu s desne strane, ali e evo nemam pojma kome to pušta i baš me ta pjesma ganula i ono, raspakala sam se naravno, ali ovoga, baš evo prekrasna pjesma i bilo bi dobro, evo tako jednu pjesmu napisati, evo."
0:20:36,0:20:37,Ili napraviti prepeve.
0:20:38,0:20:38,Ili prepeve za vas.
0:20:39,0:20:41,"Znači, zadnje tri pjesme su ti prepevi, jel da?"
0:20:42,0:21:04,"Da, te tri pjesme zapravo to su, da, ono, jako poznate pjesme kao Marija, Samo Isus može, Golgotha, to su pjesme nekako, baš ono, dok sam bila na Klanju, sam se ono molila i baš mi je nekako na srcu bilo da upravo te tri pjesme snimim, bez obzira što već te pjesme dugo postoje, ali ovoga, baš sam uživala snimajući evo te."
0:21:05,0:21:10,Onda se ti kao vlastna menadžerica obratila Domogu Čondriću da riješi stvari.
0:21:11,0:21:16,"Tako ja sam njemu se javila pa je, ja sam se njemu javila i rekla sam e imam ideju, takve jedne svakako, e šta bi išao?"
0:21:17,0:21:27,"I onda sam se javila, rekla sam, e imam ideju kao šta misliš te tri pjesme da to možda u jednom komadu ovako live snimimo i baš u vrijeme korisno sam se izašla."
0:21:28,0:21:32,"Da, i ja sam to i snimila za vrijeme i baš mi paše nekako to s korisno."
0:21:32,0:21:40,"I on kaže samo malo, javim se dvije minute, ey bend može, možemo tog i tog datuma, od tad i tad možemo tu i tu, onako, Bože hvala."
0:21:40,0:22:01,"Znači pre dobro, oni tako su se odazvali Ivan Crnjak i još ovo i Antonio i znači ekipa cijela koja je ono, može, može, može, može, ono jer inače najteže mislim sam značajno s ljudima i uskladiti sve jer svi imamo svoje planove i to i da su svi mogli tad bez komplikacija, Bogu hvala, evo baš je, evo pre dobro ispalo na kraju, a ja sam se ne čekala hoću li ili neću."
0:22:03,0:23:06,"Nama se doma odmah odazvalo da bude nositelj benda koji će svirati na koncertu i koji će iskoordinirati sve ove izvođače i zanimljivo da su se svi odazvali, isti je Pogreš Markošić i Frama, Karačić i Cestehaoložan i drugi, samo nakon prvog poziva, a tek kasnije smo dobili potvrdu da će biti i Marko Perković Thompson koji je zamolio, zamisli, zamolio da ne odsvjera dvije pjesme, ako je moguće da odsvjera ono devedeset pjesama kazao to će biti ljudi moj koncert iza koncerta i već dok traje ova misija tu je gledateljima jasno di se mogu karte nabaviti, ali ono što želim naglasiti drugo je nešto što je vezano uz tvoju intimnu, ali ne onu intimnu koju nije dobro javnosti dati, ne zato što je nešto škakljivo, već zato što je to odnos s Bogom u pitanju."
0:23:08,0:23:21,"No od ovih pjesama koje si prije izvodila, vjerujem primjerice ili ova pjesma kako si rekla imaš oca, od ovih koje si iznijela, koja ti je nekako najviše srcu prisna i zbog čega?"
0:23:22,0:23:24,Jesi li to povezala možda sa nekom životnom situacijom?
0:23:25,0:23:34,"Pa ja uvijek kažem, to je kao kad pitaš nekoga, neku mamu i tatu, koji ti najdraži dijete."
0:23:34,0:23:36,Aj mi i znao se što to znači.
0:23:36,0:23:39,"Ali je, da počet ću tako, započet ću tako pa ću ja poslije sve."
0:23:40,0:23:46,"Ali stvarno je tako, zato što ja te pjesme nisam snimila unutar godinu dana, ja sam to snimila unutar šest godina."
0:23:46,0:23:51,"Dakle, od prve pjesme koju sam snimila do datuma kad je izašao album, to je prošlo šest godina."
0:23:51,0:23:51,Zašto?
0:23:51,0:24:28,"Jer ja te pjesme nisam, a treba mi pjesma, idem snimiti, trebam skupiti deset pjesama, ne, nego sam ja, svaki put kad mi je netko ili poslao pjesma, ja sam se i pomolila i ja sam sve te pjesme prolazila, dakle i u studiju i svaku tematiku, to je sve toliko različite tematike, ali sve sam to prolazila i to mi je bilo bitno nekako da mogu i sebe dati u tome, ali opet do neke onog razine da ja ne smetam ljudima dok to slušaju, odnosno želim reći da oni sebe mogu staviti u tu situaciju, dakle nije to sada neka ljubavna pjesma ja, ja, ja, moja bol, nego to je dakle odnos s gospodinom i ja želim da se i ti, ti, ti pronađeš u toj pjesmi i možeš sebe staviti u toj situaciji."
0:24:28,0:24:39,"Tako da evo jedna od tih pjesama, naravno to je koliko god ja nju često izvodim i sve to je pjesma vjerujem jer me svaki put podsjeća da vjerujem, pomozim u mojoj nevjeri."
0:24:40,0:25:05,"I ima šoca, to je evo možda upravo zato jer sam ostala rano i bez zemaljskog oca pa me ta pjesma evo posebno nekako tako, ali evo jako volim pjesmu Box i Vjeran s Ramarinom isto ili tišinu s Đurom, ta mi je posebno draga, sad baš evo, baš je teško izdvojiti, ali ajmo reći na tu ima šoca, nju se nekako, nju kad izvodim svaki put ona bude Bože, molim te samo da ne krene plakat."
0:25:08,0:25:09,Koliko godina si imala kad sam otišla?
