Start (HH:MM:SS),End (HH:MM:SS),Segment
0:25:09,0:25:11,Dvanaest godina sam imala tada.
0:25:11,0:25:17,"Koji, koji moment možeš podijeliti sa nama, s ocem koji je bio blizak, lijep, ganutljiv?"
0:25:19,0:25:38,"Pa bilo je tu puno lijepih trenutaka, možda zapravo taj osjećaj koji mi je dao da je ono ponosa na mene i ta neka podrška i cijenim to što je zapravo od kad sam mala bila sam razgovarala već kao da sam velika."
0:25:39,0:26:28,"To je bilo možda, da, to je možda poslije nekad kao bilo možda drugačije jer ono naučila si o puno stvarima razgovarati i detaljan biti sve i sad jednom s vršnjacima kad pričaš kao to je nekako drugačije i onda možda nekad to nije toliko, nije mi to pomoglo ali evo nekako jako volim kod njega on je jako volio i pjevati, oni su imali bend svoj, jako volio pjevati, plesati, sjećate se prije mu je bilo tako neugodno, mi kad smo bili u dućanu negdje, njemu kad se pjesma svidjela on bi samo krenuo pjevati, plesati i sve ono glumiti, imitirati, sve je rojstvo što ja volim, vi vi to isto jako, moja sestra, to smo baš od njega pokupili i to je nešto što je neka neopterećenost i ta želja da se ljudi oko njega osjećaju dobro i u društvu i sve."
0:26:28,0:26:31,Tako da je to baš ono lijepo.
0:26:33,0:26:44,"Lijepo je poznavati takvu osobu i sretna sam što je bio jako kratak period, ali koliko god i kratak bio bio jako intenzivan i na tome sam zahvalna Bogu."
0:26:45,0:26:47,Je to naučio luljat ili voziti bicikl?
0:26:48,0:26:50,"Voziti biciklom je naučio, da."
0:26:50,0:26:52,Mene je naučio i sestro isto rolat.
0:26:53,0:26:57,"Naučio me fuškat, znam jako dobro fuškat sve pjesme."
0:26:58,0:26:59,"Može, aj, slobodno."
0:26:59,0:27:01,Ali ne volim kad se vidi dok to radim.
0:27:01,0:27:03,"Znači, pa koji otkak si je to mogao otvoreno?"
0:27:03,0:27:04,"Da, da, ali ja nisam otkak."
0:27:05,0:27:06,A rekla sam se pokupila od njega.
0:27:06,0:27:08,"Oke, ne ples i imitaciju i glumu."
0:27:08,0:27:09,"Oke, može ovako."
0:27:09,0:27:10,Koje korake naočila?
0:27:11,0:27:16,"Pa čak nije korak, nego čisto onako opušteno, kao da je neka pjesma da nisi ono u što ga."
0:27:16,0:27:19,"Ne, sad tu neki ples, nego to je bilo ono, Michael Jackson svega pomalo."
0:27:19,0:27:22,"Tako da nema, to je jednostavno sve, sve, sve bilo."
0:27:22,0:27:27,"Ali evo može ovako, jer sam malo krenula, jer ne volim svoju facu dok fučkam."
0:27:27,0:27:28,Pa kaže.
0:27:36,0:27:37,I tako dalje.
0:27:38,0:27:39,Proliječe.
0:27:39,0:27:41,"Da, mijem ono najzabavnije."
0:27:42,0:27:45,Tako da to sam naučila od njega i tako.
0:27:46,0:27:48,A lijepo je značak fučkaša.
0:27:48,0:27:49,"Da, to odizapro."
0:27:50,0:27:51,Neće se počeš da odliječe.
0:27:52,0:27:53,"Ja sam ti lovio lice, da."
0:27:53,0:27:55,Pa ovo je šlikov fučkaš.
0:27:55,0:28:03,"Sad me poznato je i na onom filmu Most na Rijeci Kvaj, ona poznata scena gdje."
0:28:03,0:28:05,Zapravo kroz cijeli film oni fučkaju.
0:28:05,0:28:08,A hoćeš li fučkanje ubaciti u neko svojih pjesama?
0:28:09,0:28:10,Nisam razmišljao.
0:28:10,0:28:12,Znaš zašto je šta je zezu tog fučkanja?
0:28:12,0:28:18,"što ja volim sve live izvoditi kao i u studiju, ali ti kad u mikrofonu kad fučka što jako loše zvuči."
0:28:19,0:28:21,"Gledajmo što on spužu, Matija, šta se onda stavi s pužvanjem?"
0:28:21,0:28:25,"Spužvanjem kad, da, pa e ili ću tako, aforam je to, eto to ću."
0:28:26,0:28:35,"Čondroć je se čuo, daj ubaci malo fučkanja i bit će ti to jedina fučkajuća pjesma na duhovnoj sceni, e, bit će ti prvi u Hrvatskoj i prepoznati po tome, da."
0:28:36,0:28:42,A jel te otac uz ove stvari koje si navela isto naučio pit vino ili si tada bila premlada?
0:28:43,0:28:44,A volio je i on vino?
0:28:45,0:28:52,"Volio je vino, volio je općenito uživati sve i dobru hranu, to isto ako volimo, to svi ako volimo."
0:28:52,0:29:07,"Ja sjećam se uvijek kad bi bile neke krizne priče, kad je bio stol za odrasle i stol za djecu, ja nisam htjela sjediti tamo, djedemo nagece i pomfri, nego sam ja volila to neko meso, povrće, ovo ono, to ono od malena, tako da to jesam i od njega isto."
0:29:07,0:29:08,To smo svi nekako malo ovoga.
0:29:09,0:29:11,Jel'jaka zaželješ popiti čašu i nas snimiti?
0:29:11,0:29:12,"Apsolutno, pogotovo sad."
0:29:14,0:29:24,"Evo, imamo ovdje, ne znam, znam da ti voliš, ti si rekao da ti voliš ovaj, ovo nisu reklame sad, nitko nam ne plaća, ovo, Tomaž, Tomaž, Motovon, Teran, Teran kako se kaže."
0:29:26,0:29:26,Ne vidimo.
0:29:26,0:29:27,"Pa teran, da."
0:29:28,0:29:29,"To je crno imamo, znači."
0:29:30,0:29:31,I ovo je preposlije što imamo.
0:29:31,0:29:32,Ovo je pošip bielo.
0:29:32,0:29:33,Kraljevski vinogradi.
0:29:33,0:29:35,Ja volim i pošip i sve.
0:29:35,0:29:36,Koje bi otvorila?
0:29:36,0:29:38,"Oćemo jednu plažu, hoćeš objaviti?"
0:29:38,0:29:39,"Jednu ćemo, ajde koju ćemo."
0:29:39,0:29:41,"Ti biraš, ti si gošče."
0:29:41,0:29:43,"Oka, ajde recimo jedan ili dva."
0:29:44,0:29:44,Dva.
0:29:44,0:29:45,Onda ćemo ovo.
0:29:46,0:29:47,"Aha, za mene je to."
0:29:47,0:29:48,Ja sam šebi u glavi kao.
0:29:48,0:29:50,"Prejedobro si, prejedobro si."
0:29:50,0:29:52,A vidjet ćemo onda kako otvaraš.
0:29:52,0:29:53,Oka.
0:29:54,0:29:56,Zašto se želim da nazovem u njegovo ime?
0:29:57,0:29:58,Gdje su ona čaši?
0:29:58,0:30:00,Sama sekundu ekipa.
0:30:02,0:30:03,Znači ovaj sad totalno.
0:30:06,0:30:08,Hoće se ovo sve isto snimati kako ovo je?
0:30:09,0:30:09,Sve ide.
0:30:10,0:30:24,"Znači molim vas bez osuđivanja znate i sami u životu kad nešto sami radite, a tojest kad nešto radite da vas netko gleda da onda najgore to radite ali ja znam da vi ne osuđujete i da bi volili s nama piti ovu čašu vina."
0:30:26,0:30:27,Ovo je bijelo vino jel da?
0:30:27,0:30:29,Ne ovo je crno vino.
0:30:29,0:30:30,"Čekaj, čekaj."
0:30:31,0:30:31,Još malo.
0:30:32,0:30:33,Neka ti pa gleda.
0:30:34,0:30:36,deset tisuća koraka ja ih moram još skupiti.
0:30:36,0:30:38,"Evo ga, uspjeli smo."
0:30:39,0:30:40,"Evo, propustio si je."
0:30:42,0:30:43,Jako dobro.
0:30:44,0:30:48,"Bila sam u ovoj vinari i prekrasno, prekrasno je, odlično."
0:30:49,0:30:50,"Ne, imamo samo ovu."
0:30:50,0:30:53,"Nema više, slično bijel odci za crno vino."
0:30:54,0:30:55,"Evo, ćeš ti prvo probati malo."
0:30:55,0:30:56,"Da, može."
0:30:56,0:30:58,Onda da vidim kako se to miješa onda.
0:30:58,0:30:59,"Ajde, da vidim."
0:30:59,0:30:59,"Može, ajde."
0:30:59,0:31:01,Ti na tim moratš naučiti sve.
0:31:02,0:31:02,Ja znam samo pic.
0:31:04,0:31:09,"I znam sam je dobro šta nije, ali bi trebalo biti."
0:31:11,0:31:12,Tamo sam snimila i spot.
0:31:12,0:31:16,"Ispod prekrasno je tamo, za pjesmu slavim tebe i na grožnjavanju."
0:31:16,0:31:18,"Naime, super crno, lagano vino."
0:31:18,0:31:19,Možete prevariti.
0:31:20,0:31:21,"Da, i to je najopasnije."
0:31:22,0:31:23,Mislim da mi nije razina kao Dingač.
0:31:24,0:31:25,"Nije, nije, nije Dingač."
0:31:25,0:31:29,"Ali Dingač se jede uz, naravno, s pročosir, naravno, standard."
0:31:30,0:31:30,"Da, pijem."
0:31:30,0:31:40,"Ali ovo bi recimo kada bi se s ekipom našao, sa ekipom naslova glazbenika, ovo vino možemo i pit možda poslije koncerta."
0:31:40,0:31:41,Jer se vrlo lato pije.
0:31:42,0:31:42,Da.
0:31:44,0:31:46,"Znači, morat ćemo prije toga dobro pojesti da ne bi onda."
0:31:46,0:31:48,"Da, još ćemo doći malo."
0:31:49,0:31:51,Evo sad ćemo nazvati.
0:31:52,0:31:53,Baš lijepa ideja.
0:31:56,0:31:57,"Matija, evo može biti taj god."
0:31:57,0:31:58,Ostavi s nama ovdje.
0:31:58,0:32:01,"Evo, gledaj malo."
0:32:04,0:32:06,"Evo, tvoj tata se zove."
0:32:06,0:32:08,"Perica, ali svi su ga zvali Pepo."
0:32:09,0:32:09,Pepo je naš.
0:32:10,0:32:11,Sada je to tata Perica.
0:32:13,0:32:14,Ko je te ovako divno podigao.
0:32:20,0:32:22,"I zatvorit ću Mata, vi ste nazvati."
0:32:23,0:32:23,Da.
0:32:26,0:32:55,"Dragi mladi, posebno vama, ova poruka je da molite gospodina sada dok ste slobodni da vas pripremi da budete sjajni i odgovorni kršćanski očevi i majke i onda nećemo imati brigu o pobačaju i drugim zlima već će to prestati."
0:32:58,0:33:09,"Anesa, evo za kraj, prije nego što ti kažem što ti poklanjamo, što ti još na srcu da preneseš iako gledaju sve generacije, osobito mladima."
0:33:14,0:33:22,"E, ljubavi, Sara snimamo, upravo sam sa ANES-om, završava emisiju, upravo si u eteru."
0:33:24,0:33:26,"Čućemo se, može, ajde nazovem te poslije, može."
0:33:28,0:33:29,"E, kažem."
0:33:30,0:33:54,"Rekla bih nekako, naravno ću naglasiti ono što je meni osobno, naravno bitno, ali to je evo prijatelju evo slobodno nevene uđi, naš prijatelj neven, završavamo misiju, prođi kroz studio, slobodno prođi kroz studio, da da, evo samo tamo uđi, čega, ali ajde samo onda minutu još pričekajte dvije, završavamo, e mislim, može, može."
0:33:57,0:34:00,Pa imamo još jedno snimanje.
0:34:01,0:34:50,"Još možda ta neka glavna, znači rekla bi nešto što je meni bitno i što bi voljela da meni netko tada evo nekako malo češće i govorio, ne samo dok čitaš biblioteke, stvarno tristo šezdeset pet puta kaže neboj se, ali baš da ti netko još dodatno kaže ne boj se, evo stvarno, znači on se brine o tebi i tu mi nekako najviše kad se baš za to želim moliti to je taj psalam sto trideset devet ono on se poznaje poznaje moj misli za koje ponekad mislim da ih ne mogu zaustaviti i vjerujem da vas ima puno isto takvih koje ono ponekad ne znate gdje gdje gdje ćete što ćete je li to dobra odluka jesam li dobro rekao dobro napraviti znači on već se zna on zna on zna šta je bio on je znao što će biti i on zna već vas ali nekako upravo u tim trenucima kad donosite odluku da ne budete u grčkoj strahu nego da njemu to predate i da dopustite njemu da on vas vodi i duh, evo njegovo."
0:34:50,0:35:14,"Tako da evo i je nekako kroz to onda je samo sve nekako puno lakše i ljepše, samo evo na nama je nekako da dopustimo njemu odnosno Bogu da Bog bude Bog u našim životima, a to nekad nije lako jer mislimo da sve možemo i trebamo sami, a stvarno ne moramo jer evo kao što pjesma kaže neke težine nisu za te stvorene, tako da evo leti uživaj i evo slavi jer oni žele da budeš najsretniji i najsretniji."
0:35:15,0:35:34,"Dragi gledatelji, možda ćete nešto zanimljivo naći u ovoj našoj knjizi od deset godina djelovanja Udruge Hrvatska za život ovdje je preko dvjesto volontera opisalo kako im se život promijenio nakon što su ušli u Apostola za život, a na kraju su brojne sličice naše spašene dječice od pobačaja."
0:35:35,0:35:44,"Poklanjam ti ovu knjigu kako bi te mogla u nekim teškim trenucima utješiti, a u nekim radostima još produbiti ti radost."
0:35:44,0:35:56,"Ovdje je i naš već dobro poznati časopis Tromjesečnik za život, Pohod, pohodimo srca ranjena, pohodimo srca u potrebi i donosimo radostnu vijest."
0:35:57,0:36:02,"U ovome zadnjem broju su isto zanimljive informacije, plodovi rada i svjedočanstva."
0:36:02,0:36:07,"A ne, ovo uz jednu pro-life kavu s prijateljicom možeš prokomentirati."
0:36:07,0:36:15,"I ova moja najpoznatija knjiga u Hrvatskoj, prva od tri knjige, to je trilogija Zvrk u Božjim rukama."
0:36:16,0:36:27,"Ovo je treće izdanje, već i biskup Vlado Košić, Don Damir Stojić, Pater, Marko Lugović napisali su Predgor za ovu knjigu i ova knjiga može nekome spasiti život, već i je."
0:36:27,0:36:33,"Ima i drugi dio, sad piše trenutno treći, ali evo za početak pročitatiš prvi dio."
0:36:36,0:36:42,"Recimo, je li mi, jeli muškarci mogu tebe gledati ovako, dugovnici ili su ti ti ti ti muškarci?"
0:36:43,0:36:47,"Pa ne znam jesu li mogu, ne znam jesu li mogu, ali evo nisam neugodna, ne grizem."
0:36:48,0:36:50,"Malo izbjegavaju pogled, jeli da?"
0:36:54,0:36:57,"Možda si presupriorna za njih, pa se muškarci osjećaju inferiorno."
0:36:58,0:37:30,"Ne znam, ja uglavnom jedva čekam biti žena i žensko i ne biti superiorna, nego jednostavno ono, moći biti, odnosno i to želim i vjerujem da jesam nježna iako to možda na prvu se čini kao s obzirom na to čime se bavim i to, onom to malo samo ono i otvorenija i to, ali stvarno evo svakoj ženskoj to želim svakoj osobi da može biti ta nježna, ta princezica koja onako se može osjetiti zaštićeno, ali da evo isto bude autoritet u onim stvarima koje nam žena i treba biti."
0:37:30,0:37:31,Tako da evo ja čekam to.
0:37:32,0:37:36,"Dobro sam govorila, nije loše, rekli ste vi u ime se kajne, ne grize."
0:37:37,0:37:51,"Ja sam uživao sada razgovarajući s tobom jer si iznijela iz dubine duše nešto što je vrijedilo svima nama, a i Bog te obdario vanjskom ljepotom tako da sam na neki način i odmorio svoje oči."
0:37:51,0:37:54,Bog hvala na njegovoj raciji.
0:37:55,0:38:03,"Eto, budi Bog, slavljeno njegovo sveto ime, neka je blagoslovljena njegova i naša majka Marija."
0:38:03,0:38:09,Sve vas radostno pozdravljamo i vidimo se na koncertu 23.5.
0:38:10,0:38:20,"u Sisku sa svim poznatim izvođačima duhovne glazbe u Hrvatskoj i sa našim dragim prijateljem, bratom u Kristu Markom Perkovićem Thompsonom."
0:38:21,0:38:21,Živjeli.
0:38:22,0:38:22,Vidimo se.
0:38:23,0:38:24,Naravno.
0:38:24,0:38:25,"To je to, evo ako će to, mora."
0:38:26,0:38:28,"Eto, muška uvijek ovako zašto."
0:38:30,0:38:31,Mene je to isto ako dođe.
0:38:32,0:38:32,"Je, je, je."
0:38:33,0:38:33,Žijela mi.
0:38:34,0:38:35,Još jedan.
0:38:40,0:38:46,"Vjerujem, pomozimo i ne vjeri."
0:38:49,0:38:52,Tvoja riječ me promijeni.
0:38:54,0:38:58,"Napuni nove, nove."
0:39:00,0:39:00,Napuni nove.
