Start (HH:MM:SS),End (HH:MM:SS),Segment
0:00:14,0:00:16,Pozdravljam vas u 55 minuta.
0:00:17,0:00:18,Hvala da pratite moj podcast.
0:00:19,0:00:34,"Odlučila sam porazgovarati sa čovjekom koji već neko vrijeme paca jedno drugačije svjetlo na ono što se još uvijek u hrvatskoj javnosti prikazuju kao povijesne istine, sa gospodinom Markom Danonom."
0:00:34,0:01:01,"Gospodin Marko Danon je zagrepčanin, poduzetnik, židov koji je kroz iskustvo svoje obitelji stra istražujući činjenicu o svojoj obitelji, u stvari hrvatskoj javnosti ponudio niz novih činjenica koje nisu prije bile dostupne o načinu na koji je kardinal Stepinac, blaženik, uskoro svetac štitio židove spašavajući ih tako da ih se skrivalo u bolnici sestara milosrdnica."
0:01:01,0:01:07,I to je gospodin Danon u stvari istražujući život i slušajući priče svoga oca.
0:01:08,0:01:19,"A onda je gospodin Danon objavio, evo sad nedavno to nam je bio povod, jedan prilog istraživanju propagande protiv Hrvata, protiv Katoličke Crkve."
0:01:20,0:01:29,"i taj je prilog objavljen u Većinjem listu, izuzetno je zanimljiv, preporučam da ga potražite i da ga pročitate iako ćete već puno toga čuti iz našeg razgovora."
0:01:29,0:01:33,"Gospodin Danon, puno hvala da ste se odazvali na mom pozivu da razgovaramo."
0:01:34,0:01:44,"Dakle, vi ste zagrebački židov, vaš je otac preživio holokaust i recite nam o tom njegovom životnom putu."
0:01:44,0:02:10,"On je rođen u Saraju, komali su se preselili u Trst i onda kad je poslije proguselskog rasta nastala Jugoslavija, onda su se dogovorili da se jedan dio obitelji vrati u Jugoslaviju da bi sa ovom obitelji koji su bili u Italiji u Trstu mogli zajedno trgovati."
0:02:12,0:02:40,"I onda se moj tata koji je rođen devetsto trinaest devetsto dvadeset je došao u zagreb i od onda do smrti živi u zagrebu i onda su oni imali gore na dolcu jedan štand gdje su prodavali ove proizvode prvenstveno ove južne limune, naranče i te stvari."
0:02:42,0:03:25,"I to su imali do četrdeset jedan godine inače mi je dida o tate tata je iz sarajeva a baka je iz travnika i baka je jedna od rijetkih židovki u travniku koja je završila onu istosavačku gimnaziju poznatu travničku gimnaziju i još mu je tata uvijek govorio pa zašto su baš nju postali od njih sedmero vraće u gimnaziju, a meni za svoju mamu je ta govorio, a meni se čini da baš nije bila najpametnija."
0:03:27,0:03:37,"Ali meni se kad danas sve vrtim obitelji onda vidim da je u nekim stvarima bila jako, jako pametna."
0:03:38,0:04:26,"I tako su onda tu u Zagrebu, onda su, onda su djeci baka otišli iz Zagreba u Split, hvala neki od bake prijatelji ih je obavijestio da će biti deportacija neka ili nešto da će doći po njih, živjeli su u Palmotićevoj, a tata je cijeli rat proveo kod, to je bio neki dom u Pušćoj za ovu djecu, ovu siroćat, koji su držali neke učiteljice, taj dom, navodno ta zgrada je u lošem stanju danas, nema više tamo ništa i tata je tam cijeli rat proveo u tom domu."
0:04:27,0:04:50,"es time da je u toj u Puši vrlo interesantno bilo kad sam došao da uopće tražim gdje je moj tata bio, onda sam došao u Pušu kod one načelnice općine i onda je, on sam rekao, ali nije moj tata tu bio."
0:04:50,0:05:14,"Zato jer je moj tata uvijek govorio da je negdje bio u nekom mjestu gdje je bio jaki Gestapo i da je gore bila crkvica jedna na brdu i da je zvonar kad je moj tata prolazio, da je zvonar uvijek zvonio da se on sakrije, da ga ovi Gestapovci ne uhvate."
0:05:15,0:05:23,"A meni načelnica općine kaže gospodine tu u ovoj sobi će sad mi sjedimo, tu je sjedio načelnik Gestapo."
0:05:23,0:05:38,"A dole u podrumu je Gestapo imao svoje za saslušavanje gdje ljudi nisu cijele noći mogli spavati, su slušali kako ovi Gestapovci muče ljude."
0:05:38,0:05:56,"I onda mi je bilo jasno da je moj tata bio tu, a ovaj i onda je kaže zvonar zvonio čim je vidio da ovi Gestapovci hodaju po mjestu da se stari negdje, tata negdje sakrije."
0:05:56,0:06:18,"Mislim, ja prvo, prvo mi je bilo to Gestapo, jedno malo mjesto, a unutra Gestapo, jedna cesta koja vodi tamo totalno izvan svih, nema ni ženičke, nema ništa blizu, nešto važno, jaki Gestapo tamo."
0:06:19,0:06:30,"I koje ljude su oni to lovili, hapcili, dole mučili, tukli, šta su poslije radili s njima, gdje su ih, ja to ništa ne znam."
0:06:31,0:06:53,"Ali vi ste istražujući tu povijest svoje obitelji, ste u stvari otkrili da je jedan od načina spašavanja židova u tijeku rata bio da ih se skrivalo u bolnici, u vinogradskoj, danas vinogradska, odnosno danas opet bolnica sestara milosrdnica, ali u komunizmu su joj oteli u sestrama časnima i zvali u vinogradska."
0:06:54,0:06:56,"Dakle, dajte nam o tome nešto, recite."
0:06:56,0:07:05,"Vi ste i sudjelovali u dokumentarnom filmu koji je snimio gospodin Sedlar, gdje ste pojasnili sva ta vaša istraživanja koja ste vi onda napravili vezana za tu temu."
0:07:05,0:07:12,"Da, ta bolnica je jedan fenomen, evropski fenomen II."
0:07:13,0:07:13,svjetskog rata.
0:07:14,0:07:16,Takve bolnice nigdje nije bilo u Europi.
0:07:18,0:07:57,"Nijemci su recimo onaj film Pijanist, na početku tog filma se vidi jedna scena gdje Nijemci jednu bolnicu u kojoj su pronašli nekoliko židova, to je bila živa Istan, to je bila bolnica u centru Varšave gdje su pronašli nekog židova i njemačka divizija Hermann Gering ispričasti mi im je bilo po toj bolnici tražiti židove, donesli su bacače plamena i cijelu bolnicu su zapalili."
0:07:57,0:08:03,I ta scena se u tom filmu pijanist vidi.
0:08:03,0:08:06,"Kad dolaze Nijemci, pale cijelu bolnicu."
0:08:07,0:08:40,"Tu je bila u Vinogradskoj na čelu te bolnice bila časna sestra Bogulju Bajaslu, jedna žena koja je valjda imala onaj koeficijent inteligencije najveći šta može biti, znači bila profesorica matematike, a pomoćnik ravnatelja je bio Kurt Hin, porijeklom Austrijanac koji je bio onda jedan od najboljih optologa u ovom dijelu Europe."
0:08:41,0:08:53,"I sad vjerojatno, to je moja čisto konstrukcija, kad je došla racija, jer su dolazile racije, su dolazile u sve bolnice i u tu bolnicu."
0:08:53,0:09:12,"Kad je došla racija onda je došla časna sestra, a puno tih koji su bili iz policije su bili i dole, možda su se i nju znali neki itede i onda čim su vidjeli čas u cesti nisu počeli puno tražiti ove židove."
0:09:13,0:09:55,"Kad je došla njemačka od Gestapa racija, onda je došao ovaj kurčjanac koji je vjerojatno njih ono na njemačkom pozvao ih je u svoju sobu i onda umjesto da traže židove, ovi valjda iz Gestapa, a svaki se počeo žali da ga boli jedno koljeno, drugo rame, treće je žuludac i valjda je sve te racije u bolnici su na taj način završile da ove kada su trebali tražiti židove su se uvjerili kad su vidjeli tu časnu sestru, tu su vidjeli ovoga austrijanca i nisu dalje tražili."
0:09:55,0:10:05,Ali činjenica je da vi ste izvukli podatke o tome koliko je velik broj židova jako dugo bio skrivan u bolnici.
0:10:05,0:10:08,Sve skupa je bilo u bolnici tristo sedam židova.
0:10:09,0:10:34,od tih tristo sedam ih je bilo jedan impozantni broj koji su bili tri godine u bolnici ako ja dobro pamtim vi ste naveli da je bolnica imala oko jedna tisuća sto kreveta jel tako dakle od jedna tisuća sto kreveta tristo i koliko ste rekli bilo je dana da je došlo u bolnicu po dva ili tri židova.
0:10:34,0:10:50,"Kad je bila recimo kad se počelo po Zagrebu govorit bit će ratije, bit će ovo, bit će ono, deportacije onda su određeni židovi koji su znali da mogu doći u bolnicu, tamo su se sakrit i došli su u bolnicu."
0:10:50,0:10:57,"A taj put njihovog dolaska je išao preko, ustvari i preko nadbiskupa Stepinca."
0:10:58,0:11:00,I oni su se javili njegovom vikom.
0:11:00,0:11:46,"Oni su došli gore kod tajnika, Čalića koji nažalost poslije rata doživio takva mučenja kakva je rijetko tko doživio, hvala za nagradu što je spašavao židove, mislim pod navodnicima, da uzeli su njega da bude svjedok protiv stepinca na suđenju, Čalić, dolazili gore židovi kod nadbiskupski dvor, šta da napravi, gdje da se spase i onda je kardinal zvao časnu sestru, daj dolazitiili dva, ovaj, sakrio ih negdje, spreman ih negdje."
0:11:47,0:12:15,"I ona je to nalazila, spremala ih je i jedan je fenomen, naročito kod nas, da nikad nitko nije prijavio da se gore u bolnici nalaze židovi, niti ovi ljudi koji su tamo radili, niti drugi pacijenti jer je bilo i pacijenata koji su bili i visoki ustaški dužnosnici i njihove familije."
0:12:16,0:12:19,"I ako su tamo bili duže znali su, za neke možda su i poznavali."
0:12:20,0:12:27,"Zagreb bi bio tada mali grad, da tako je, mogli su vidjeti čovjeka za kojeg znaju da je židov u bolnici, a ne bi smio tu biti."
0:12:27,0:12:55,"Slušajte, recimo jedan slučaj ću vam reći Robert Farkaš, poznati odvjetnik, bio je u Jasenovcu i našli su neku vezu kod jednoga ustaše, taj ga je izveo van iz Jasenovca i ova je išao s njim i ova je mislila Robert Farkašu da će ga ovaj ubiti."
0:12:55,0:13:02,"I nakon kilometra rekao je doviđenja, odite vi dalje u dalje, ja se vraćam natrag."
0:13:02,0:13:24,"I ovaj četiri dana hodao od Zagreba i kako je puno ljudi ga poznavalo, stanovao je u Jurišićovoj i na večer se pojavi doma, žena otvori vrata i pita dobrovećeg, jeste vi njega prepoznali ni po glasu ni po fizionomiji."
0:13:25,0:13:42,"I onda on je imao prijatelja profesora Blaškovića koji je bio odličan urolog u bolnici i idu doma kod njega, profesor Blašković negdje naveč večeru u nekom restoranu i donijeti u taj restoran."
0:13:44,0:14:06,On se digne sa večere i odlazi sa ovim doktorom Farkašom u Vinogradsku bolnicu da mu odmah da neku infuziju i sve šta treba da ovaj kako je bio uglavnom slab i četiri dana hodao se bojao da ne umre do bolnice.
0:14:06,0:14:56,"Bio je šest mjeseci ili tu nešto u bolnici, kad se dobro oporavio onda su mu u međuvremenu napravili papire i otišao dole u Primorje, iz Primorja u Italiju, i onda je još iz Italije preko onih gore su bili ti koji su za novce prebacivali u Švicarsku, su znali na dva tisuće metara da nema više ove policijske kontrole švicarske i taj farkaš je cijeli rat proveo u Švicarskoj, ima lijepo zapisano u onom švicarskim prijavio se tamo službeno se prijavio, švicarci nisu dirali tko je došao u Švicarsku, ovaj su ga ostavili u Švicarskoj do kraja rata."
0:14:56,0:15:28,"Dakle, evo, ko zovu gospodina, pokazuju da je u stvari ovdje postao jedan cijeli sustav spašavanja ljudi, pomaganja ljudi i ovo što kažete, da, dakle, prvo u državnim bolnicama nisu mogli židovi u njih ulaziti, ulazili su jedino u ovu bolnicu katoličku, aktivno je sudjelovao u tome u Sestre milosrdnice, to su časne koje u Frankopanskoj, jel, čiji samostani danas su i bio je onda u Frankopanskoj, Sestre milosrdnice su aktivno skrivale te židove."
0:15:29,0:15:44,"I još je nešto da ste mi, da je vaš, da ste kasnije otkrili da je vaš otac, ako sam dobro zapamtila i još neki članovi obitelji da su bili na popisu ubijenih u Jasenovcu."
0:15:44,0:15:54,"Da, da, moji iz familije su bili na popisu i ja sam onda skupio svu dokumentaciju."
0:15:55,0:16:16,"Prvo, mama je umrla sedamdeset dva u zagrebu tata je umro šezdeset devet od tate brat je umro odmah poslije rata itede onda sam ja skupio tu dokumentaciju i poslao sam u jasenovac i u jasenovcu i ih skinuli."
0:16:17,0:16:17,Maknuli su me.
0:16:18,0:16:26,"Ono su me zvali razni novinari, to ste sigurno vi neke imali gadne veze da vas skinu tamo."
0:16:27,0:16:59,"Ja kažem nisam imao veze, ali sam imao sve papire i danas mnogi koji pišu da neki ljudi su tamo u Jasenovcu treba imati sve od, da je nesporno da je taj čovjek bio u Jasenovcu, nesporno da je umro poslije rata i onda su morali su prihvatiti vašu ženu, morali je skinuti."
0:16:59,0:17:06,"Ali vi ste nekako se uključili, dakle istražujući ovu povijest svoje obitelji, iznositi ove istine koje doista nisu bile poznate."
0:17:07,0:17:22,"Bolnica sestara Milosrdnica je, kao što ste rekli na kraju rata, dakle partizani su ju oduzeli časnama, ubili su, dakle nekoliko časnih sestara, bile su izložene mučenjima, dio pacijenata u bolnici je ubijen."
0:17:23,0:17:33,"Dakle, ta bolnica je u stvari od jednog skloništa za židove aktivnog i u stvari tretirana kao najgore mjesto na kojem se može."
0:17:33,0:17:36,"I častne sestre, zašto ja to mogu raditi?"
0:17:37,0:18:16,"Častne sestre, kad je došla UDBA po dokumentaciji, po arhivu bolnice po kojoj je, arhivica ja ovo sve istraživao, koja sad postoji u Hrvatskom ovome, u Arhivu Grada Zagreba, jako lijepo, sve složeno, sve, častne sestre, kad je došla UDBA s kamionom po dokumentaciju, častne sestre su bile toliko inteligentne da su one rekle, pa nemamo više tu dokumentaciju, tu arhivu bolnice, vaši su bili jučer i uzeli su arhivu."
0:18:16,0:18:17,Pa zamislite vi njih?
0:18:18,0:18:18,Da.
0:18:18,0:18:24,"Kao iz moje pjesme, moj snovi, ono kad su onaj auto sjećate se da li su ga osposobili od Nijemaca."
0:18:24,0:18:28,"I ovi su, ovi su, a dobro, valjda bilo više tih kamiona."
0:18:29,0:18:31,"Ovaj su kupili ljudi koji su, da."
0:18:31,0:18:41,"I onda su zvali kardinala Stepinca šta da rade, on je rekao to negdje sakrite i da se uopće za to ne znam."
0:18:42,0:19:04,"I one su to sakrile, UDBA se te dokumentacije nije dokumentirala i nakon kad se situacija smirila onda su oni tu dokumentaciju dali u Hrvatski državni arhiv, ali već u ono vrijeme kad se taj arhiv, kad se ta dokumentacija nije uništavala."
0:19:05,0:19:35,"Jer ja sam baš gledao u zagrebačkim bolničkim arhivima, arhivi su požari osam puta su bili požari su bili u arhivima osam puta i pet puta su arhivi poplavljeni."
0:19:36,0:19:41,"Sad bi možda netko rekao a ne, to je slučajno tako da su gorili ti arhivi."
0:19:41,0:19:54,"Ti arhivi i danas mnoge muče, samo su ti arhivi, najveći dio je u Hrvatskom državnom arhivu ili u arhivu grada Zagreba gdje se jako, gdje se jako pasi."
0:19:54,0:20:01,Vi ste rekli da je neki od židova koji su skrivali su bili jako velik broj dana u bolnici.
0:20:02,0:20:10,"Bili su, evo recimo onaj Stjepan Dojč, onaj tata od ove male glumice, on je bio u bolnici skoro tri godine."
0:20:11,0:20:12,On je bio tri godine skoro u bolnici.
0:20:13,0:20:56,"Za vrijeme u pet mjesecu četrdeset tri njegova obitelj otišla u auschwitz a on je cijelo vrijeme bio u bolnici jer je njegova navodno tako kažu njegova žena je govorila a kaže neće ženu i djecu esesanci kad dođu dirati nego samo muškarce nažalost pokutali su njezinu obitelj a on je ostao živ ali ustvari postao je dogovor ako sam ja dobro to zapamtiotila, između Židovske općine i Nadbiskupa Stepinca i bolnice, da će Židovska općina pokrivati troškove za to."
0:20:56,0:21:02,"Židovska općina je bila takva situacija kod nekih, dosta velikog broja."
0:21:04,0:21:26,"Židovska općina pošalje bolnici, molimo za tok i tok našeg člana, da bi trebao doći u bolnicu liječnice, i taj je drugi dan bio u bolnici,."
0:21:29,0:21:32,"Da, šta je radila časna, šta je radila poglavarica."
0:21:33,0:21:54,"Drugi dan je bio u bolnici i na taj način su neki bili nekoliko mjeseci u bolnici i onda kod mnogih pišu dijagnoze, danas je vrlo teško reći koje su dijagnoze bile prave, a koje su bile."
0:21:55,0:21:56,Tako da bi se spavali.
0:21:57,0:21:58,Ali šta je najbolje bilo?
0:21:59,0:22:02,Često put su išli i muš i žena zajedno u bolnicu.
0:22:03,0:22:13,"I onda muš su dali recimo u neku diagnozu da mu je sa srcem, ženi recimo neku nešto sa urologijom."
0:22:15,0:22:18,Ali najbolje je to da su im dali sobu.
0:22:19,0:22:22,"Zajedno su imali sobu, makar svaki je bio na svom modelu."
0:22:23,0:22:38,"Lepo u sobi su bili šest mjeseci ili godinu dana, zajedno su bili u sobi i onda nikad ih nitko nije ni prijavio."
0:22:39,0:22:42,I još je.
0:22:45,0:23:15,"ona recimo doktorica koja je bila šefica pedijatrije, tamo su kod nje bila isto što je interesantno, ova djeca, puno ove ratne siročadi, ove djece sa kosare, uvijek govorili da su časne sestre, tam i Jastervar su ih učile, tu su djeca bila na njihovoj pedijatriji, tu na pedijatriji je bilo jako puno djece i jako puno djece se liječilo."
0:23:16,0:23:26,"To je prošle godine monsignor Batulja napisao jednu knjigu o skrbnji ovoj djece sa ratne siroćadi, prvenstveno sa Kosar."
0:23:27,0:23:46,"I prvi puta smo tu napisali prošle godine, imena i prezimena sve djece koja su bila u bolnici Stara Milostrdnica i prvi puta poslije osamdeset godina i na Svetom Duhu."
0:23:46,0:23:49,"Bila su djeca u te dvije bolnice, do sad nikad nije."
0:23:49,0:24:07,"raskrinkavajući te laži neprekidno o tome da su ih časne ili katolička crkva toj djeci naudila, bilo je suprotno, da su ih oni spašavali i da im pomognu djeci koja su došla bolesna, iscrpljena, koja su bila u tako lošem stanju nakon tih izbjegova po kozari."
0:24:08,0:25:14,"Ali htjela sam vas pitati isto tako, dakle četrdeset tri godine je dakle do četrdeset tri židovska općina pokrivala trošak i imala taj aranžman sa jednim dijelom da se časnoj jazvu su dakle dovodili židove na taj način onda četrdeset tri došao gestapo jel tako i ustvari pohapsio sve iz te židovske općine i nakon četrdeset tri ustvari nadbiskupija odnosno nadbiskup stepinac je preuzeo taj dio i troška i svega da te ljude skriva u bolnici preuzeo brigu on je imao recimo vjerovatno neke ljude koji su recimo imao je onoga braidera, židova jednoga koji je radio za jednu švicarsku firmu i koji je često putovao van i često puta išao po tim raznim humanitarnim organizacijama i od njih dobivao novac i nosio njemu."
0:25:14,0:25:20,"E sada, taj braider je za nagradu što je to radio."
0:25:20,0:25:40,je četrdeset sedam godine ja mislim došla belgarska policija po njega u zagreb uhitili ga i u beogradu na suđenju navodno su mu našli jedno pismo od karnevala stepinca u džepu i g.
0:25:40,0:25:59,braider je dobio petnaest godina strogu zatvora sa prinudnim radom i da ne umre u zatvoru nakon četrnaest godina su ga pustili dakle oni su ga stavili u zatvor čovjeka koji je spašavao židove u zagrebu da.
0:26:00,0:26:13,"Da, to je ta cijela, cijeli taj i onda su ti ljudi pisali povijest, pisivali nama kako je to izgledalo za vrijeme Drugog svjetskog rata, ti isti koji su nakon rata, evo čovjeka zatvorili u zatvor koji je pomagao."
0:26:14,0:26:32,"Ali na neki način to što ste vi kroz svoju obitelj ustvari vidjeli što je istina, što laž, dakle uz niz drugih stvari koje ste objavljivali aktivno sudjelovali, sad ste evo prije mjesec dana, prije par tjedana ste objavili prilog proučavanju antihrvatske propagande."
0:26:33,0:26:35,I sad to me zanima.
0:26:35,0:26:48,"Vi ste napravili poveznicu ustvari sa tom propagandom., četničkom i velikosrpskom propagandom, koja se i dan danas u demokraciji, u stvari, i tekako može čuti da se ponavlja u javnom prostoru."
0:26:50,0:26:59,"Tu sam unutra citirao četiri knjige, o kojima se govorilo kod nas, ali vrlo malo."
0:27:01,0:28:12,"Prva knjiga, Mučeništvo Srba, koja je izašla u Čikagu, gdje je na trećoj ili četvrtoj strani knjige slika generala Draže Mihajlovića kao ne znam velikog čovjeka i onda je on skupljao te podatke o Srbima ubijenim na teritoriju NDH pa na teritoriju dio koji je Mađarska, okupirala Bugarska itede I onda je to te, međutim te podatke je onda objavljivao još do četrdeset tri i recimo newyork tajme međutim, New York Times, jedan Dinko Tomašić, jedan naš čovjek, profesor u Zagrebu, a našao se Zavemirat u Americi, on je stalno pisao pisma uredništvu."
0:28:13,0:28:16,Dakle činjenice da evo i mi statistički podaci to nisu istine.
0:28:16,0:28:52,"Na temelju obeza stanovništvu je New York Times prestao to, prestao to objavljivati te podatke i New York Times je počeo objavljivati vrlo povoljne članke o kardinalu Stepincu, vrlo povoljne da poslije pape je najpovoljnije šta su Amerikanci pisali o nekom nadbiskupu iz jedne zemlje koja je bila u ratu, NDH je bila u ratu sa Amerikom."
0:28:53,0:29:31,"Znači trebalo je američku cenzuru proći sve, da New York Times može napisati o Stepincu jedan članak kako se on bori protiv one njemačke rastne teorije, da za razliku od one da su Arijevci više viša rasa, a svi drugi da su niža rasa, a on govori da su svi jednaki i još nekoliko, dosta je tih članaka o Stepincu za vrijeme rata i za istinitih dakle koji su točno navodili što je to istiniti."
0:29:34,0:30:28,"Naime, Stepinac kad je bio i u pet mjesecu četrdeset tri je bio kod pape i papa mu je rekao izvoli donesi sve članke sve što si radio za spas židova i srba i stepinac je to donesao papi i papa je poslije sa državnim tajnikom su oni to sve distribuirali i unutra su našli nekoliko stvari i onda je papa dao Radio Vatikanu i Radio Vatikan je onda objavio prvu emisiju koju je bio o toj rasnoj teoriji koju je Stepinac pobijavao u Njemačku jer Radio Vatikan objavio na njemačkom jeziku."
0:30:29,0:30:37,I zapravo Stepinac je onda imao sreću da nisu došli Nijemci da ga ne pošalju u logornik.
0:30:40,0:30:52,"Onda je to radio Vatikan, poslije toga je radio BBC to objavio na engleskom i radio Voice of America na engleskom i New York Times i mnoge druge novine."
0:30:53,0:30:57,Jako puno tih članaka je objavljeno u Švicarskoj.
0:30:57,0:31:10,"To bi isto možda ako ću jedanput imati tak da napišem jednu knjigu, svi članci koji su za vrijeme rata o Stepincu objavljeni."
0:31:10,0:31:38,"U principu to znači da smo mi u stvarnom vremenu u toku rata imali smo državu s kojom je dakle bila dakle Njemačka i NDH u ratu i istovremeno su u toj državi u SAD-u se objavljivali njegove propovijedi, njegovi govori, njegove budnice koje je on u tim ratnim vremenima govorio podučavajući vjernike u Hrvatskoj da je ovo neprihvatljivo."
0:31:38,0:31:46,"I ustvari vi ste s ovim člancima, to je ono isto do čega je došla Ester Gittmann kada je istražujući povijest svoje obitelji, jel tako?"
0:31:46,0:31:50,Ona je došla istraživati i na jedanput je počela u arhivima pronalazazi.
0:31:50,0:31:55,"Dakle, ta propaganda protiv stepinca koju danas slušamo, ona je doista propaganda."
0:31:56,0:31:57,Jel oni ignoriraju sve ove dokazne?
0:31:58,0:32:03,"E sada, ta propaganda je počela odmah poslije rata u Moskvi."
0:32:04,0:32:05,"E, dajte nam recite o tome malo."
0:32:06,0:32:07,"Odmah, 45."
0:32:08,0:32:10,već u šestom mjesecu počela propaganda.
0:32:12,0:32:18,Stalin je smatrao da je najveći neprijatelj na zapadu Vatikan.
0:32:19,0:32:28,"I da Vatikan, i da Vatikan, da sve ove zemlje pojedinačne, da je Vatikan na neki način centrala."
0:32:29,0:32:43,"I kako je puno članaka izlazilo i u Švicarskoj, i u Švedskoj, i u Americi, pa i u Australiji o Stepincu, vjerojatno to je moje mišljenje."
0:32:45,0:33:08,"Staljeni je zapravo dobro mislio, nije nažalost postao papa Stepinac nego dvadeset godina kasnije i vam pavao drugi vrsta."
0:33:08,0:33:18,"Vojtila jel da, Poljak isto koji je bilo, koji je na neki način srušio taj komunistički taktički sustav."
0:33:19,0:33:38,I onda je ovaj Staljin formirao jednu cijelu službu koja je imala zadatak da širi dezinformacije o određenim ljudima koje je on i valjda ovaj politbirot dade.
0:33:39,0:34:37,"Dakle u principu oni bi izmišljali o njima najgore laži, to je bila ta smiješna smirš, a zapravo to postoji danas da se o određenim ljudima izmišljaju najgore laži plaćenih tih svojih novinara, medija koji su držali itede da se te laži i onda je pedeset jedan godine izašla u moskvu jedna knjiga vatikan u dvjesto dvadeset jedan godine koja je napisala neki šajman koji radi u povijesnom institutu akademije nauka i unutra je napisao da je stepinac i nad I nabrek u Šarijelu, u Bližnjoj Križni, u Sloveniji, u Sloveniji, preko 800.000 srba."
0:34:38,0:34:40,"Odbora je da, da, tako je ležite."
0:34:41,0:34:53,"Ali ta knjiga je prevedena na sve istočne, evropske, odnosno slovenke, ta knjiga je prevedena na španjolski, ta knjiga je prevedena na kineski."
0:34:54,0:35:04,"I sad vi, da recimo, jedan razgovarate sa nekim južnoameričkim ili kineskim."
0:35:05,0:35:15,nadpisku po starijem čovjeku i da ga pitate recimo nekim kardinalom i da ga pitate koju prvu knjigu o II.
0:35:15,0:35:22,"svjetskom ratu odnosno Vatikanom je pročitao, onda bi rekao da je pročitao tu rusku knjigu."
0:35:22,0:35:38,"I vi u principu u ovim svojim prilozima pokazujete da je ta sovjetska propaganda, dakle te čiste laži koje su izmišljale od Katoličke crkve u Hrvatskoj, ustvari da su se onda prenosile kroz Jugoslaviju i do dana današnjeg u Hrvatsku."
0:35:39,0:35:51,"Slušajte ako vi pročitate knjigu, druge knjige u istočnim zemljama, u ovim socijalističkim zemljama nije bilo ni u Jugoslaviji."
0:35:52,0:36:12,Ako ste vi pročitali u knjizi da je Stepinac i na čelu inkvizicije tko u onom petnaest stoljeću ubio osamsto tisuća srba onda a drugu knjigu vi u životu niste pročitali onda ste vi te podatke vjerovali.
0:36:12,0:36:25,"E sada, koliko vi morate u životu pročitati knjiga da vi dođete do zaključka da to šta piše u toj ruskoj knjizi da je to čista laž i te dezinformacije, čiste dezinformacije."
0:36:26,0:36:33,Vi ste onda pokazali u ovim prilogima isto tako da je u Jugoslaviji postojala antihrvatska propaganda.
0:36:34,0:37:13,"I onda su u Srbiji dediere i ovi koji su pisali, oni su vjerojatno imali ovu rusku knjigu, ali kad je već bio onda informiro i posle, nisu smjeli u svojoj knjizi napisati da su oni čitali tu rusku knjigu i da su oni puno toga šta u toj ruskoj knjizi piše da su oni prenosili to činjenicu u svoje knjige, jer DDR isto piše o inkviziciji, da je bila inkvizicija u Hrvatskoj."
