Start (HH:MM:SS),End (HH:MM:SS),Segment
0:37:13,0:38:11,"DDR isto piše, ovi drugi isto pišu, ovi na zapadu, neki poslije se ispostavilo da im je jugoslavenska obavještajna služba davala informacije i podatke, Rivelija recimo, to je Monsignor Batelja napisao jednu odličnu knjigu Laž Rivelija, a mnogi su dobili zadatak kada je otprilike bilo da bi eventualno Stepinac mogao postati blažen ili svet još ono vrijeme, onda je bilo da ti sad napiši brzo evo ti od jugoslavenske ove ovištajnih službi dokumentacija, samo to, pa to metni pol toga stavi u knjigu i napiši knjigu."
0:38:12,0:38:23,"Neki su pisali vrlo korektno, neki ovi."
0:38:24,0:38:58,"Dakle vi ste u principu pokazali da su ovdje kroz tu sovjetsku propagandu, onda kroz propagandu Jugoslavije, komunista koji su stalno napadali Katoličku crkvu i Hrvate okrivljavali za genocid iznoseći proizvoljne brojke o broju ubijenih Srba u vrijeme NDH, a to je, neki su u jednom dijelu govore milijun Srba, u drugom milijun četiristo dakle to su brojke koje se uopće nisu poklapale sa popisom stanovništva prije rata i popisom stanovništva nakon rata."
0:38:58,0:39:01,"Pokazuje se da se smanjio broj Hrvata, a ne broj Srba."
0:39:02,0:39:05,"Brojke su to pokazale, tko je bio više ubijen."
0:39:05,0:39:13,"Ali mene zanima sada vaša slika o tome, zar nije paradoks da vi sada, 2024."
0:39:13,0:39:28,"godine, evo prošle godine, mislim ste predstavili, ste sudjelovali u snimanju tog filma o bolnici sa stara milosrdnica, da mi u stvari danas još uvijek moramo dokazivati da su to čiste laži, izmišljotine."
0:39:29,0:39:37,"Evo moram reći, ja se sjećam, ja sam bila u osnovnoj školi, dakle, ja mislim da smo bili treći razred, su nas vodili."
0:39:38,0:39:39,na izlet na kozaru.
0:39:39,0:40:04,"I ja se dan danas sjećam da smo tamo, su nam pokazali neki strašni film gdje je sve bilo puno djece, gladne, umorne ovakve, onakve i da je nama tamo ta žena koja je pričala o tome ispričala kako su ta gladna djeca ušla u samo u voćnjak časnih sestara i da je časna sestra motikom ubila dijete koje je htjelo ubrat jabuku."
0:40:04,0:40:21,"Evo ja dan danas, to su oni nama u trećem razredu osnovne škole na izletu, takve bolesne, prvo laži, ali čak da je to istina, kako možeš djeci takve strahote pokazivati i pričati, ali to je bila čista laž."
0:40:22,0:40:31,Ali to vam muče u životu i treba vam u životu možda deset i petnaest godina da shvatiš da te netko manipulira.
0:40:32,0:41:10,"Da vidite da to što ste tam govorili da je sto posto laž ili se uvijek čovjek misli ma možda nisu to dete ubili ali ali ali da su ga potjerali ili da ali to vam je ta te dezinformacija tako ja sam došla doma ja sam strašno me to pogodila jer sam ja poznavala časne sestre, uvijek su mi bila uličenje dobra i dobrote prema meni i ja sam to ispričao mocu jer se sjećam da je moj tata tada otišao u školu i rekao mi u mojoj razrednici da u smislu da se takve stvari ne mogu djeci govoriti uopće."
0:41:11,0:41:14,Ali i on je meni objasnio doma naravno da je to laž.
0:41:14,0:41:27,"Ali upravo ovo što ste rekli, koliko danas ima ljudi moje dobi koji ustvari svoju sliku o Katoličkoj Crkvi temelji na toj indoktrinaciji kojoj smo mi bili izloženi kao djeca cijeli život."
0:41:28,0:41:32,Evo recimo još jednu stvar možda zanimljivu.
0:41:32,0:41:40,U Americi je tu knjigu o bolnici Stara Milosrnica objavio Rabin Jack Bemporat.
0:41:42,0:41:53,Rabin Jack Bemporat je jedna vrlo interesantna osoba jer je on bio prijatelj od Ivana Pavla II.
0:41:54,0:41:57,Oni dva su 85.
0:41:57,0:41:58,ili 86.
0:42:00,0:42:13,"prvi papa, njih dva lepo pješice iz Vatikana, u ono vrijeme idu u Velikorincu sinagogu, najavili su se ovom rabinu i dolazim papa i Jack Bemporat."
0:42:13,0:42:54,"je Jack Bembora dolazio u sinagogu, prvi puta da je jedan papa poslije dvije tisuće godina došao u sinagogu i iza njih je bila ova televizija vatikanska koja je to snimala ovaj jadni rabin koji je bio u sinagogi kad je vidio da je papa ušao unutra je toliko bio uzbuđen da nije mogao ni pozdraviti da to je Jack Bembora napravio drugu stvar Jack Bembora koju je napravio kad je Ivan Pavao II to ćete nažalost u malo knjiga pročitati ali to je istina papa Papa Ivan Pavo II."
0:42:54,0:43:01,je tražio tri židovska rabina da ga blagoslove.
0:43:02,0:43:07,"Dva rabina suždana živa, ovo je Bemborat i jedan drugi, treći je umro."
0:43:08,0:43:09,Dva rabina suživa.
0:43:10,0:43:14,"I treća stvar, kad je otvorena Ovčara, 97."
0:43:15,0:43:29,"godine, onda je rabin Jack Bemborat bio prvi rabin koji je došao na Ovčaru i rekao da je to genocid, da je to nešto užasno, da se to može mjeriti sa onim što se radilo u Drugom svjetskom ratu."
0:43:30,0:43:31,I rabin.
0:43:31,0:43:52,"Rabin Jack Bemborat koji je inače donedavno bio profesor na onom sveučilištu Vatikanskom u Vatikanu je došao sa knjigom ovom koju je u Americi izdao o bolnici Stara milosrdnica, došao je papi."
0:43:54,0:44:11,"Njega on je kao rabin i profesor i tako reći legendarna ličnost, došao papi i papa uzme knjigu, a na prvoj strani knjige je časa sestra, bogoljuba Jad jasu."
0:44:12,0:44:22,"Kaže, i on govori, kaže, papa, pa kaže, pa nije ova, šta vi meni govorite, pa ova žena je iz Buenos Aires, pa nije ona iz Zagreba."
0:44:24,0:44:24,Jer ona je.
0:44:25,0:44:28,"I on je bio kod papi Franje, papi Franje je odnio ovu knjigu."
0:44:28,0:44:34,"I papi Franje je odnio knjigu, i papa Franju kaže, pa nije ona."
0:44:34,0:44:36,Pa to je čast na koju ja znam iz Buenos Aires.
0:44:36,0:44:41,"Pa ja ja znam dobro iz Buenos Aires, kad vi meni govorite da je ona iz Zagreba."
0:44:42,0:44:49,"I on kaže je, ona je, došla je udba na."
0:44:50,0:45:12,"na, u Frankopansku, međutim, imaju nekoliko vrata da mogu otići van, oni su došli, UDBA je došla po nju da ju streljaju, ona je pobjegla na druga vrata i nekako je uspjela doći do Trsta i u Samostan u Rimu."
0:45:13,0:45:32,"Međutim, ona je bila na spisku UDBA smrtna kazna, streljanje, ubijanje, oni su počeli po Rimu tražiti i onda kad je već vidjela da je situacija u Rimu, da je vrlo ovaj opasna, onda je otišla u Buenos Aires."
0:45:33,0:45:50,I nedavno mi je rekla jedna časna sestra da ona kad je i po Buenos Airesu vrlo oprezno ništa nije išla jer se bojala da je UDBA ne ubije.
0:45:51,0:46:11,"I ona je te častne sestre, taj dok sud gdje oni tamo u Buenos Airesu imaju svoj samostan, one tamo su dolazile dok je papa Franjo bio pomoćni biskup Buenos Airesa, one su dolazile svaki nedjelju kod njega na misu."
0:46:12,0:46:22,"I Papa Franjo kaže da je on dolazio kod nje gdje je ona bila profesorica u školi, da je on dolazio kod nje jedanput godišnje u školu."
0:46:24,0:46:38,"I Papa Franjo zove državnog tajnika svete stolice Parolina, kardinala Parolina, daj dođe vidjeti, pogledaj evo sad tu knjiga o ovim častnim sestrama."
0:46:38,0:46:42,"A tu je moja častna dama, ja nju dobro znam iz Buenos Airesa."
0:46:42,0:46:53,"Da, nevjerojatan je taj u stvari put i nevjerojatno je koliko kako ipak istina se probija, ali kako se te laži dugo zadržavaju."
0:46:53,0:47:33,"Vi ste u uvodu u ovaj svoj prilog u stvari upravo to navodite, kako te laži koje se ponavljaju, koje su se ponavljale četrdeset pet godina kako su one i danas prisutne u demokraciji kada imamo internet možemo sve provjeriti i danas su prisutne i trebate jako jako jako puno energije da vi recimo gledajte za tristo sedam ljudi ja sam se koji put osjećao kao da sam majao rudbe kad tim židovima koji su bili u bolnici i piše na onim bolničkim kartonima dok kad su bili, šta je bilo s njima posle."
0:47:35,0:47:41,"Da li su posle recimo, ne da sad krivim židove."
0:47:41,0:47:55,Neki židovi su bili u bolnici i onda su smatrali da jedino četnici su oni da dođu kod četnika da su tam sigurni.
0:47:55,0:48:00,"A čim su došli kod četnika, četnici su ih isti dan zaključili."
0:48:01,0:48:06,Kao što je Neidić riješio židovsko pitanje i hvalio se na početku rata da ih je sve pobjegao.
0:48:06,0:48:15,"I recimo neki su tako došli u istočnu Bosnu, onda tu je recimo isto bio ovaj dr."
0:48:15,0:48:32,"Lev, on je bio ovaj upravnik partizanske bolnice u istočnoj Bosni, neko vrijeme se skrivao u bolnici, onda je poslije bio tamo, došli su četnici, cijelu crvenu jedinicu bolnice su zaklali i doktore su zaklali."
0:48:33,0:48:47,"Da su bili pametni te doktore su mogli uzeti, a ništa drugo da četnike liječe jer je bilo puno tih zaraznih bolesti, tih doktore jako malo ovaj malo bilo, puno ih je falulo, ali su bili tako i taj dr."
0:48:48,0:49:18,"Lev donedavno je na VMA u Beogradu bila jedna spomen-ploča koji su ubijeni od četnika, židovi, židovski, pa i drugi doktori, međutim ta ploča kako su sada četnici postali opet tam jako in ili popularni, ta ploča je mahnula, ne piše više da su ubijeni."
0:49:19,0:49:27,Dobro i mislim da uopće Za nekoga u II.
0:49:28,0:50:08,"ratu malo je pisano o tome kako su četnici, pa i tu u Srednjoj Bosni i na drugim mjestima, tamo dole oko Sarajeva najviše je bilo puno velikih ovih izbjegličkih logora gdje su ljudi ti koji su bježali pred četnicima gdje su boravili."
0:50:09,0:50:51,"Znači kada uzmete drugi svjetski rat o čemu je malo pisano i kada uzmete domovinski rat gdje je jako puno ovih muslimana bošnjaka bilo u Hrvatskoj isto bježeći pred ovim četnicima onda ćete vidjeti da je to jako, jako slična stvar, da se ponaša nažalost o tim izbjegličkim logorima u Bosni gdje je bilo puno tih muslimana i Hrvata u tim logorima, nažalost se malo, malo, još to nije, još to nije istina."
0:50:51,0:50:59,"Netko da si to uzme i da traži arhive, pitanje je da li ima negdje arhiva o tim izbjegličkim logorima."
0:50:59,0:51:55,"Ja znam slučaj taj jer je onaj poznati bosanski književnik Isaac Samokovlje, koji je zapravo imao rješenje da liječi one Sipili u Bosni, on je bio glavni liječnik u tom jednom izbjegličkom logoru kod Alipačenog mosta u Sarajevu i ne znam koliko tisuća tih izbjeglica je bilo, a njegov brat Samoklovija je bio ne znam kako dugo u bolnici sestara Milosevica, a ovaj je bio dole otišao u Bosnu i onda posle je iz Bosne otišao u, premjestili su ga u Hrvatsku vojsku."
0:51:56,0:52:04,"Dakle, ustvari, prije Preporučamo dakle da ljudi pročitaju ovaj vaš prilog, da vide oni svi koji ih zanima povijest i što se događalo."
0:52:04,0:52:15,"Jer ovaj vaš nekako pregled koji ste dali jako logičan i jasan, te sovjetske propagande, pa onda jugoslavenske propagande, ustvari nam pomaže da razumijemo i ono što se događa danas."
0:52:15,0:52:32,"Jer ustvari ta propaganda koju smo mogli čuti, danas možemo čuti od nekih povjesničara ili nekih koji se prave da su povjesničari, a ustvari isto tako propagandno djeluju, da možemo na neki način razumjeti bolje što se stvarno događalo."
0:52:33,0:52:42,"Evo, dobro, puno vam hvala i na vašem na vremenskom Na vremenu koje ste vi odvajali za ova istraživanja i vi ste se proučavali arhive."
0:52:43,0:52:49,"Ako sam dobro shvatila i u Beogradu, proučavali i Židovski, ovaj, Historijski muzej."
0:52:50,0:52:56,Tamo sam isto dobio od njih puno te dokumentacije.
0:52:57,0:53:05,I oni imaju jako puno dokumentaciju i koju oni vrlo korektno čuvaju.
0:53:05,0:53:22,"Tako i to i na taj način proučavajući ustvari arhive i dokumentaciju da nam svima pomažete da razumijemo to razdoblje, da ga bolje razumijemo i da umjesto nas nekako raskrinkate te laži kojima smo i danas kao društvo izloženi."
0:53:23,0:53:55,"Da, ja mislim da sada ako ste pratili ovo što je došao onaj Gallagher da bi za kardinala Kuharića itede ja mislim da sad papu na neki način kad nije dao da postane stepinac proglašen svetim, da nije proglašen svetim, da stepinca papu to malo nemre to više svoje pa toga malo muče, ja mislim."
0:53:55,0:53:57,Pa to je dobro da ga muči i mi se nadamo da će ga to malo muči.
0:53:57,0:54:13,"Ja mislim da ga to malo muči i da bi, da bi ovaj, da vidi radi čega su ovi baš na Stepinca tako svi na vama."
0:54:14,0:54:22,"Da, zašto je ta velikosrpska propaganda, u stvari gdje se zloupotrebljava pravoslavlje je tako aktivna upravo oko kardinala Stepinca, da."
0:54:23,0:54:24,Upravo oko njega.
0:54:24,0:54:36,"Ili on, recimo, Rusi uopće ne pišu, recimo, ni na jednom mjestu, ni Rusi, ni neki ne spominju Pavelića, ime Pavelić, nema ga."
0:54:37,0:54:41,"Mnogi ne spominju Jasenovac, ne postoji, ne postoji."
0:54:41,0:54:45,"Da, fokus je cijeli, samo fokus na stepinci."
0:54:46,0:55:02,"Pa dobro, to je često sudbina najboljih među nama, da se na njih baš usmjeri i da oni mogu iznijeti taj teret, evo mogu ga je na zemlji nositi, sigurno ga sad na nebu, sigurno je da on to sada u konačnici sve preokreće svojim zagovorom za sve nas."
0:55:02,0:55:17,"Evo, puno vam hvala na ovom razgovoru i hvala vam da ste tako studiozno pristupili svemu tome i da niste ove sve stvari zadržali samo za sebe i za svoju obitelj, već za sve nasilje, to je dobro cijelog našeg naroda, ovo je sve."
0:55:18,0:55:19,Hvala vam lijepo kada ste me pozvali.
0:55:19,0:55:24,"Hvala vam, vas pozdravljam dragi gledatelj i nadam se da vam je ovaj razgovor bio zanimljiv kao i meni."
0:55:24,0:55:37,"Ako želite više doznati, možete pogledati film gospodina Jakova Sedlara o bolnici sestara milosrnica i ulozi koju je imala u spašavanju Židova u kojem također gospodin Marko Danon je dao svoj prilog."
0:55:37,0:55:54,"Možete pogledati, potražiti na večernjaku ovaj prilog propagandi anti-Hrvatskoj od četrdeset dva godine i evo želim vam da ustrajete u istraživanju istine i da ne podlijećemo nikakvoj propagandi danas kad imamo svoju državu i kad smo slobodni."
0:55:54,0:55:56,Pozdravljam vas do sljedeće prilike.
