Start (HH:MM:SS),End (HH:MM:SS),Segment
0:00:05,0:00:08,S vama je danas moj dragi prijatelj Tomislav Bagarić.
0:00:08,0:00:15,"Tomislav je student zagrebačke ekonomije, fotograf i mladi vlasnik firme za fotomontažu i video produkciju naziva Studio Regnare."
0:00:15,0:00:17,Tomo prijatelju dobrodošao.
0:00:17,0:00:21,Evo prije svega lijep pozdrav tebi i svim slušateljima i gledateljima.
0:00:21,0:00:25,Drago mi je evo da sam dobio priliku i čast biti ovdje s vama.
0:00:26,0:00:45,"Prije svega bi volio ako mi daš prilike da pohvalimo u biti i tebe i cijelu ovu produkciju, ove dečke iza kamere koji se toliko trude u biti da djeluju da dadnu svojoj domovini nešto drukčije, nešto što u biti je danas najpotrebnije."
0:00:45,0:00:50,Tako da evo želim odmah reći na početku svaka čast i evo drago mi je da mogu biti dio ove priče.
0:00:50,0:01:04,"Hvala ti što si to rekao javno i na kameri, inače oni koji ne znaju ovaj cijeli setup kako je to napravljeno to je također djeluje i naša gospođa Zagarić, tako da evo razlog više da te ugostimo, ali nije to, imamo jedini razlog zašto si došao u emisiju osim ovog prekrasnog uvoda koji smo dogovorili."
0:01:05,0:01:15,"sa dvadeset dva godine je mlada si osoba i proaktivna koja je kroz svoje djelovanje kroz svoj talent u fotografiranje, odlučio sve to staviti u službu Bogu."
0:01:15,0:01:30,"I to radiš kroz duhovno-duhovite večeri kod Frostjepa na Brčine svaki četvrtak, fotografiraš na hodu za život, mnoge studentske udruge i udruge mladih angažiraju te kroz njihove, da zapravo popratiš njihove konferencije, da popratiš njihove projekte i slične stvari."
0:01:31,0:01:37,"Uz to vlasnik si i obrta, tako da vjerujem da ćemo imati jedan širok i ugodan razgovor kojem se jako veselim."
0:01:37,0:01:49,"Pa također, evo, da, veselim se i bit će sigurno zanimljivih tema i nadam se nekome možda na poticaj, evo i pokrene nešto svoje i da na kraju krajeva bude promjena u ovom svijetu i da se tome pomogne, moram reći."
0:01:49,0:01:51,Kako si za početak imao šta zanimljivog?
0:01:52,0:02:07,"Pa ima zapravo puno toga, puno toga, dosta, dosta posla, dosta, ajmo reći, stresa oko, evo, oko samih fakulteta, sad su ti ispitni rokovi, evo, Bogu hvala, u srijedu sam pisao sa zadnjim ispitom, sam isto, Bogu hvala, položio, tako da sam taj dio i riješio."
0:02:08,0:02:30,"Osim toga, imamo dosta projekata, dosta, dosta filmova snimamo, dosta vječanja su se otkrenula, puno, puno toga, što, ajmo reći, neke moje zamisli u glavi, neke moje ideje koje bih ja volio, ajmo reći, proizvesti, ali uz, ajmo reći, malo vremena treba to sve neko regulirati da bude onako točno jel tako da."
0:02:33,0:02:43,"Pa zna šta, sad će te biti iskreno, prije nego sam krenuo uopće cijelu firmu i sve skupa bio sam po naravi tako neko ajmo reći nestrpljiva osoba."
0:02:44,0:02:56,"To mi je dosta, dosta mi je to ajmo reći donijelo poteškoća jer hoću sve ono instantno, a ajmo reći da većina mladih tako neko u današnje vrijeme želi sve instantno, želi sve što prije, sve preko noći."
0:02:57,0:03:07,"Međutim, kroz ovu firmu i kroz služenje na svetom duhu sam sam shvatio u biti da je ta strpljivost u biti poanta svega jel, da je to neka bit."
0:03:07,0:03:18,I Bog me zaista naučio kroz evo i ovih godina i pol gotovo i firme i rada i nekog služenja da budem strpljiv i da će on u pravi trenutak napraviti pravu stvar jel.
0:03:18,0:03:20,Kako je uopće počela tvoja priča sa fotografijom?
0:03:20,0:03:22,Kad si otkrio da imaš talent i ljubav za.
0:03:22,0:04:27,"Zapravo je zanimljivo, to nisam pričao nikome još, kao mali još, bio sam možda, imao sam možda šest sedam godina, imao sam tu nekakvu ideju uvijek u glavi, za nekim filmovima nekakvim, ja sam sebi sam stvarao nekakve ideje u glavi nešto i onda bih ja ako to je bilo od dvije tisuće šesnaest godine još sam bio i mobitel i oni mali onaj okia tripet da onaj kockice da i ovaj i u biti što je bilo zanimljivo ja sam smišljao nekakve nekakve ajmo reći scenarije filmova onda bi okupio neku ekipu to je uopće bila moja obitelj ne znam brat sestra brat i četverica nas je dosta puno i onda bih ja njima podijelio uloge i išao bi kao to snimati radit ajmo reći i u biti sam već tu ajmo reći krenuo razvijati tu neku svoju ideju i o filmu i o fotografiji itede a onda kasnije nekako, kako smo mi inače rodani iz Hercegovine, mi dosta putujemo dole i kupujemo se tamo za grad i nekako tijekom putovanja kada vidiš jednostavno to polje, taj prizor, tu prirodu, ne možeš nekako ostati ravnoteža."
0:04:28,0:04:32,"I meni je to uvijek me privlačila ta slika, ta fotografija, moramo reći."
0:04:32,0:04:37,"Uvijek bih ja uzimao mobitel i kad ne bi imao svoj, jer nisam imao svoj mobitel, to ne znam, prvo sve, moramo reći."
0:04:38,0:04:48,"I onda bi uzimali od brata ili sestre, nekoga i onda bi u biti ono fotkao, snimao, da ostane nekako to u nekoj uspomen, moramo reći."
0:04:49,0:05:11,"I to je u biti se odrazilo kasnije na, ajmo reći dubak korone kada sam ja dobio nekakav poticaj da kupim svoj prvi fotoparat i da u biti krenem u malo dublje u to jel i tu sam u biti onda krenuo i u fotografiju i u snimanje i otvorio svoju firmu itede ali o tome možemo malo govoriti."
0:05:11,0:05:12,"Možemo, možemo govoriti danas."
0:05:12,0:05:19,"Definitivno jako zanimljiva tema i pričatiš mi sve, većinu toga znam ali želim dobiti ono što ne znamo od tebe baš upravo u ovom razgovoru."
0:05:19,0:05:29,"Ali dobro, šta ćemo s onima koji nisu rođeni u Hercegovini, koji nemaju takav pogled na taj pejzaž, kako oni mogu možda i što je preporučio onoj mladoj osobi koja još ne zna kako otkriti taj svoj talent?"
0:05:30,0:06:12,"Pa rekao bi možda da je najbitnije kada govorimo o talentima, evo da je najbitnije tu bi se recimo spomenuo onaj priča o talentima u Bibliji kada je u biti došao gospodar i dao talente svojim tri sluga i rekao im evo idite sa tim talentima nešto radite i to je bio prvi sluga koji je dobio pet talenata pa je otišao, stvorio je još njih prije, bio je drugi sluga koji je imao dva talenata pa je stvorio još dva i bio je i onaj treći sluga koji je zakupio svoje talente i u biti kada je došlo vrijeme da oni predaju te svoje talente, ovaj prvi sluga je dao svoje, deset talenata, drugi sluga svoje, četiri talenta, došao je treći sluga i dao, rekao gospodaru znam da si ti opak da, evo, tebi dajem ono što je tvoje, jel."
0:06:13,0:06:27,"I u biti tu možemo iz te priče, možemo biti zaključiti da Bog nama daje beskrajno, da nam daje talente koje onda mi moramo dalje širiti, da moramo to koristiti na razno razne načine, jel."
0:06:27,0:06:39,"I onda kaže, baš sam si tu priču ovdje izapisao, kaže, samo malo, ovako, kaže ovako, gospodaru dva sam ja talenta predao, evo druga sam dva talenta stekao."
0:06:40,0:06:45,"Recimo gospodar valjarslugo dobri i vjerni, u malome si bio vjeran, nad mnogima će te postaviti."
0:06:46,0:07:01,"A kaže kada je ovaj koji je zakopao svoje talente kaže gospodaru zna dok te čovjek si strog, žanješ gdje nisi sjeo i kupiš ih gdje nisi vijao, pobavlja se s toga odoh i sakriti talente, svoje, sakriti talente tvoju zemlju, evo ti tvoje."
0:07:01,0:07:08,"A gospodar mu reče, kaže zlugo, zli i lijeni, znao si da žanješ gdje nisi sjeo i kupim gdje nisam vijao."
0:07:09,0:07:13,"Trebalo je dakle da uložiš novac kod novčara, ja bih ga u porovnati uzmio sa dobitkom."
0:07:14,0:07:25,"I u biti onda on kaže, ovoga koji nije, koji nije, dakle koji zakopa svoje talente, da će ga se baciti tamo gdje je plaća išla kroz zube jel, a onoga koji ima, da ćemo se dati u izobilju."
0:07:26,0:07:30,"Znači će se njemu dati i svi ovi drugi talenti i njemu će se dati u izobilju, a onaj koji nema njemu će se uzeti sve."
0:07:31,0:07:46,"I u biti se na to netko povezao s tim da Bog nama daje te talente da mi ih koristimo, da mi ih koristimo na njegovu veću slavu, da nekome možda pomognemo, da u svakodnevnom životu da te talente koristimo da napravimo ajmo reći bolji svijet."
0:07:46,0:07:57,"Pa evo i sam projekt tvoj, odnosno i cijeli ovaj tim mladih za ovu domovinu da s tim talentima pokušamo promijeniti našu Hrvatsku koju toliko svi volimo do koje nam je stalo."
0:07:58,0:08:14,"I upravo je to ajmo reći neka poanta tih talenta i da se sad nadovežem na vaše pitanje, mladi čovjek koji ima talente, koji je shvatio da, ajmo reći spoznaje tu neku svoju ljubav prema nečemu, a neka mu je možda strah to pokrenuti."
0:08:16,0:08:29,"Ono što meni je recimo zanimljivo ovo tu, kaže, za, kad sam slušao jednom, to je bilo još prije par godina, bilo je, ne znam, Urb je Turb, ja mislim, Papa je govorio i imao je neku svoju poruku mladima."
0:08:30,0:08:36,"I to mi je još tada ostavilo jako, jako neko u pamćenju, baš sam više malo istraživati da nađem taj njegov govor."
0:08:37,0:08:45,"I što je meni posebno ostavilo neko u pamćenju, kaže, dragi mladi, ne zakapajte svoje talente, darove koje vam je Bog darovao, nemojte se sanjati o velikim stvarima."
0:08:46,0:08:53,"I onda on nastavlja, kaže, mi članovi crkve ne bismo trebali biti čudanci, svi bi nas trebali smatrati braćom i bližnjom, a poput tablastova."
0:08:53,0:09:00,"No, istodobno moramo imati hrabrosti biti drugačiji, pokazati druge snove koje ovaj svijet ne nudi."
0:09:00,0:09:15,"Svjedočite ljepotipotu, velikodušnost, služenje, čistoću, jakost, praštanje itede I mislim da je to u biti, da je papa to pogodio u onom srcu, da ne smijemo nikada se bojat sanja o velikim stvarima."
0:09:15,0:09:25,"Jer sada, meni je fenomenalno kada malo to stavimo u neku perspektivu, ajmo reći, kada pogledam, evo taj recimo citat koji je rekao, to je stvar koju je rekao papa, nemojte se sanja o velikim stvarima."
0:09:26,0:09:38,"Kada se sjetimo, ne znam primjerice kada kaže u Bibliji da su nam sve vlasi na glavi izbrane, kada kaže da se vraćajući, a kako nećemo mi, koju znači o mi koji značimo puno, puno više."
0:09:39,0:09:46,I kada stavimo to sve u nekakvu tu perspektivu tko sam ja da onda ne iskoristim te svoje talente na Bože već slavu.
0:09:46,0:09:55,Znači ako je mene Bog ovaj svijet je već milijunima i godina i milijardama godina već postoji i ja sam samo jedna mala mrvica u tom cijelom svijetu.
0:09:56,0:10:03,"I zašto ja ne bi pokušao onda napraviti nešto od tih svojih talenata, neku promjenu, nešto da neka bude tako da kažem."
0:10:05,0:10:10,Hvala ti puno što si to izvukao jako lijepe citate i mislim da je jako moćna poruka.
0:10:10,0:10:30,"Ono što sam vidio recimo, ne znam jesam li se uopće pratio, mislim da je baš Jordan Peterson rekao te stvari, ono kada misliš da se bojiš sa time koji su tvoji talenti i kako ih spoznati ili nešto, samo se baci negdje, samo radi nešto, uključi se u nešto i vjerujem da si možda ti tako uvijek bio proaktivan, idem raditi nešto, samo ajde, probaj ću ovo, pa ne ide, probaj ovo."
0:10:30,0:10:41,"I zapravo kaže da probaj nešto i ako ti se svidi, super, možda si talentiran za to, probaj to razvijati dodatno, ako ti se ne sviđa ili ako nisi za to bar ćeš shvatiti što ti se ne sviđa i šta bi ti se potencijalno moglo sviđati."
0:10:42,0:11:05,"Upravo to, pa mi mladi, evo mi imamo to svi u cijeloj ekipi, dvadeset nešto godina, mislim to je zbilja mlad i kada razmišljamo o tim nekoj, ja moram reći pokušajima, nekoj pokušajima stvaranja, zaista kad si tako mlad, nije bitno i da propadne jedanput, drugi put, treći put, četvrti put, peti put ćeš uspjeti, bez obzira šta je to."
0:11:06,0:12:02,"Ali rijetka je to stvar, imaš dvadeset dva godine već radiš te velike stvari i to razumiješ tako da evo da, ali mislim da je poanta ovo što sam maloprije rekao da kada stavimo u perspektivu to što sam rekao sve te izjave koje nam i kaže i sam Bog u Bibliji ne boj se ja sam s tobom zašto se onda ja imam bojati bilo čega u svom životu ako je Bog sa mnom, ako je meni običajno tristo šezdeset pet puta u bibliji kaže ne boj se kaže za svaki dan je jedanput ne boj se i tko samo da ja da proturječim tomu i da kažem pa može šta ako sad bude ovako pa šta ako bude onako pa šta ako ta filmova ne uspije pa ovako pa onako šuti ne boj se ako je Bog rekao ne boj se onda se ne boj i to je u biti i to je u biti ta poanta koju mladi moraju shvatiti znači nije bitno hoćeš uspjeti ili nećeš ti iz svega toga zvuči neku poantu naučiti nešto i to je na kraju krajeva za tvoj blagdan, za tvoje bolje sutra."
0:12:02,0:12:05,"A kako tebe, tako i tvoje domovine i tvoje obitelji itede Evo."
0:12:06,0:12:14,"Kako ti, pričamo o tome često izvan kamere, ali mislim da je jako vrijedno da spomenemo ovu temu i uživo, kako ti dok fotografiraš si svjestan da služiš Bogu?"
0:12:15,0:12:25,"Znam da je to česti problem ljudi koji isto služe, koji su u nekoj funkciji na altaru ili oko altara, ono ja sad moram fotografirati, moram biti to, moram uhvatiti to, pa kad ću se ja pomoliti Bogu, kako ti glašim tu situaciju?"
0:12:25,0:12:34,"Pa znaš šta, to je u biti i ta priča o talentima što su sami mogli rekli, meni je Bog dao taj talent da ja njega koristim."
0:12:35,0:13:32,"I u biti ja kada eto ne znam fotografiram i snimam bilo koji projekt koji radim ja zbilja uživam u tome, zbilja to radim iz srca, a kada nešto radiš iz srca onda radiš to ono sto posto a onda i sam Bog bi rekao kaže što više što više dobijete više ćete primiti nazad i u biti ja kroz sada taj svoj rad primam nazad sto posto zbilja i na duhovno duhovitim večerima i bilo tako neki projekt koji ja moram reći više duhovne razine nego u biti se pitanje na to referirajom ja tim svojim služenjem dobivam nazad puno pun, puno, puno, znači zbilja i tijekom tih, znači duhovno-duhovitih večeri često me pitate ljudi kako ono, samo moraš hodati, okolo trčati, fotka snimati, ali u biti ja kroz to svoje služenje dobiva nazad i onda u biti to neka, neka, neka plantatilna, evo."
0:13:32,0:13:38,"Ali sami to je cilj Tomislav je to što ljudi tebe pitaju, kako ti je ovo, kako ti je ono, kao da ljudi možda nisu upoznati s konceptom služenja."
0:13:39,0:13:46,"Misliš da postoji ta neka kriza služenja u našoj zemlji, od politike, crkve na kraju krajeva, prijateljstava, školama ili slično?"
0:13:47,0:13:50,"Pa ajmo reći, aha ovako gledaj."
0:13:51,0:14:17,"Mislim da mladi ljudi, općenito mladi ljudi imaju puno toga za dat, ali da nemaju toliko hrabrosti i da nemaju, okej ajmo reći da se sad do poslije jedan zbilja, evo vidimo i sami žarišta po raznim župama gdje se mladima nudi i da služe, ali i da dobiju nešto nazad, djelo?"
0:14:18,0:14:25,"Mladima treba biti podrška, treba im reći, prijatelju u redu je, znači ti kroz svoje služenje dajš drugome nešto."
0:14:25,0:14:35,"Kada mladi shvate da je puno ljepše i puno bolje služiti nego da budeš služen, onda će shvatiti tu bit, tu poanta služenja."
0:14:36,0:14:48,"Jer nas, evo primjerice na Svetom Duhu u zajednici ima tridesetak i mi držimo cijeli taj koncept i antonosnih od mladih i duhovnih odhodite večeri i sve to skupa."
0:14:48,0:14:57,Kad je Bolaš na nas svijesti mladih svaki tjedan dođe preko tisuću mladih ljudi i to sve ja moram reći treba netko držati i duhovno i fizički držati to sve.
0:14:58,0:15:09,"Međutim, ono što govori i sam Stjepan, evo, da njega spomenemo, ti tim služenjem dobiješ nazad puno, puno više i onda u biti ti ništa ne služite."
0:15:09,0:15:13,"Dapače ti si onda ispunjen, a si ispunjen na neki poseban način."
0:15:14,0:15:47,"I to je ono što potičem sve ove mlade koji gledaju uključite se u neku županedeljku, ima toliko prilika i evo kod nas sve je duh i ne znam na novorođenju u Botnicu ima i Jarun Bože pobjeda, ima toliko, tako je s kadsiste palma, toliko prilika, toliko se nudi, a mi smo toliko u nekom strahu da šta ako ja sad dam dio sebe pa ako ne dobijem natrag nešto, ne treba to gledati s te strane, nego treba gledati da daš u potpunosti cijeloga sebe."
0:15:47,0:16:05,Meni je recimo zanimljivo jedan dobar prijatelj Bogostol na Svetom Duhu mi je rekao jednom prilikom kada je meni tada bilo već stvarno previše svega i baš sam ono razmišljao kako će tada otići ljudi odustati od duha služenja i sve i kaže prijatelju moraš naučiti davati bezuvjetno.
0:16:07,0:16:08,Naučiti davati bezuvjetno.
0:16:10,0:16:46,"Jer to je, jer mi često, često puta ono krenemo govoriti pa je ovo je pa umoran sam, pa imam fakultet, pa imam 1500 stvari za obaviti, obaveza, pa ne znam, evo, djevojka i ovako i onako, obitelj, problemi, ali poanta je u tome, znači da ti kad radiš bezuvjetno, ti u biti onda daješ apsolutno sve i ne pitaš, odnosno ne govoriš je ovo je umoran sam, ovakav sam, onakav sam, nego daješ bezuvjetno sve, a onda ćeš primiti stostruko više."
0:16:46,0:16:56,"I to je, moram reći, neka poanta služenja, neka poanta da i mladima pokušamo evo i kroz ovaj podcast ih potaknuti da se priključe negdje jer zbilja ima toliko mogućnosti i toliko prilika."
0:16:57,0:17:03,"Evo i sad si spomenuo tih nekoliko žarišta koje imamo diljem Grada Zagreba, vjerujem da je tako i diljem cijele Hrvatske od Splita do Osijeka."
0:17:04,0:17:09,"Evo služiš na tom, služiš na duhovno-duhovitim večerima kod Frastljepa na Brčane, tim četvrtkom."
0:17:09,0:17:10,Što vidiš ti u tim četvrtima?
0:17:11,0:17:11,Što vidiš?
0:17:11,0:17:21,"Misliš da se događa ta neka duhovna obnova iznad naše zemlje baš po tim žarištima mladih ljudi koje organiziraju Franjevci, Salezijanci, Dominikanci ili slični redovi?"
0:17:21,0:17:22,Na kraju krajeva samo lajci.
0:17:23,0:17:26,"Pa netko tko smatra da smo mi, ajmo reći, izabran narod."
0:17:27,0:18:03,"Smatram da smo tu, evo možemo vidjeti razno razno svetišta i po Hrvatskoj i Međugorje, da nas je gospa izabrala sa nekim razlogom, da smo tu, pa evo i to što ti kažeš, žarišta sa svih strana, ali to nije samo u Zagrebu, imamo i Osijek, imamo i Split, imamo sad čak i rijeku, evo Blažen i Burušić koji djeluju u rijeci mladi, ne znam, rijeka milosti, proglašavaju srcem, toliko toga, jednostavno smatram da smo mi izabran narod i da je na nama da to iskoristimo i da širimo dalje."
0:18:04,0:18:09,"Jer pogledaj samo, evo primjer je, pogledaj srcem prošle godine na Maksimiru."
0:18:10,0:18:37,"Neki kažu da je bilo pedeset tisuća ljudi, neki pedeset pet i neki četrdeset pet ne bitno skupila se zbilja ogroman broj ljudi znači napravljen je cijeli maksimir i kad ti pogledaš nekakav takav koncert u ovom dijelu Europe pa čak i šire se nije nikada održao meni je drago da sam ja tamo pristupila da sam ja tamo bio jer to je za mene ispisana povijest ne samo crkve nego općenito i cijeloga svijeta."
0:18:38,0:18:46,"Kada mi šaljemo svijetu poruku da pedeset tisuća ljudi slavi Boga, pa nije li to predano?"
0:18:46,0:18:56,"I naročito ja bi tu izdvojio možda i mladih ljudi, znači često je neka teško, teško je stariju osobu reći evo ovo što si sad imao cijeli život što si radio to ti baš sada nije dobro aj sad ipak probaj ovako."
0:18:56,0:19:00,Ipak su mladi ljudi koji se tek formiraju da su formirani sa tim nekim pravim vrijednostima.
0:19:00,0:19:01,"Uprotno, uprotno."
0:19:02,0:19:53,"Mlade ljude zbilja traže, zbilja su gladi, gladi su, gladi su nečega a ne znaju ni samo šta jer današnji svijet im nudi toliko toga i devedeset posto toga je pesimizam negativnost mladim ljudima treba ponuditi ono suprotno mladi ljudi imaju toliko toga za dat samo treba to iz njih izvući znači toliko toliko imaju talenata toliko toliko imaju želje ja vidim u svakom mladom čovjeku koji dođe i na sveti duh i ne znam idem i postavim i postavim znači i jaruni i botine itede mladi ljudi su toliko željni davati samo ih treba potaknuti treba im reći pa dobro u redu je ajde, ajde, proba nešto napraviti svoje, proba djelovati pa nebitno je li to sad u toj župi ili negdje na kraju krajeva sam, sam Bog rekao spasiti jednu dušu i spasiti sebe, znači, zadobit ćeš rad."
0:19:54,0:19:56,"Ajmo se zadržati, ajmo otići odmah takvim korak dalje."
0:19:56,0:20:10,"Ne samo da je bitno služiti, dati se već u neku postojeću zajednicu, ali šta je sa onim mladima, zašto bi recimo netko iz jednog dijela grada išao na drugi dio grada, ako u svojoj župi recimo ne djeluje kako bi trebao djelovati odnosno da učinite od te župe da funkcionira kao što funkcionira ona na drugom dijelu grada."
0:20:11,0:20:19,"Imaš li kakav savjet onim mladima koji će pogledati ovaj video, željeli bi napraviti nešto slično kao što rade ova žarišta, kako to napraviti u svojim župama?"
0:20:19,0:20:40,"Pa znaš šta, evo, i neki dan smo pričali ti, ja kako ste vi u biti pokrećete nešto tu u Sesvetama u Župi svojoj, ali kako u biti ima tu puno tih stvari koje treba posložiti pa ovako, pa onako i tu bi se opet vratio netko i referirao na to što je mene rekao taj Bogoslav da si dajemo bezuvjetno."
0:20:43,0:21:01,"Mladima treba pokazati svojim djelom, znači treba biti tu netko koji će pokazati svojim djelom, to smo mi, mi koji smo već upoznati ovoga Boga, koji već djelujemo, koji želimo služiti i onda će oni vidjeti u nas i reći pa dobro vidjeti kako lijepo, kako ovaj služi, kako pokušava napraviti nešto, jel?"
0:21:02,0:21:03,I onda će oni sami naučiti.
0:21:04,0:21:25,"A nekom mladom čovjeku koji možda želi pokrenuti ili u svojoj župi ili negdje, negdje, negdje nešto, savjetovao bi mu samo da bude strpljiv, to je ono što sam rekao na početku, da strpljivost je neka bit, da ima vjeru, da se uzda u Boga i da pokuša okupiti neku ekipu istomišljenika."
0:21:26,0:21:32,"Mislim da je to jako bitno, to je ono što kaže da kakvi su to i prijatelji, takav će biti i ti, jel?"
0:21:34,0:21:40,"U biti je to nekako bit toga, da mi okupimo prijatelje oko sebe koji razmišljaju ista kao i mi."
0:21:40,0:21:44,"Jer onda ćemo biti, onda će oni biti isti kao i mi i mi ćemo biti isti kao oni."
0:21:44,0:21:44,Ja tako.
0:21:44,0:21:47,Poslovno razmišljaju sa ciljem da je to služenje ključ.
0:21:47,0:21:51,Ja mislim da to mora biti poruka ovog cijelog razgovora i drago mi je da je za sada.
0:21:51,0:21:58,"I tu sam izdvojio samo jednu rečenicu koju je rekao Sveti Augustin, kaže težiš velikim stvarima, počneš s malim."
0:22:00,0:22:15,"Mislim da je to bit i neka zaključak cijelog ovog pitanja u biti što se njima postavlja da kroz male stvari, kroz male ciljeve mi ćemo postići one velike ciljeve."
0:22:16,0:22:21,"Upravo zato ne trebamo mi mlade ljude, svi postavljamo ogromne ciljeve."
0:22:22,0:22:27,"Standardi su postavljeni jako visoko, traže se od nas jako, jako puno."
0:22:28,0:22:33,"Međutim, trebaš težiti tome da ideš svaki dan korak po korak, rješavaš ciljeve."
0:22:34,0:22:37,"Kaže ona priča jedna, ujutro kad se probudiš, napravi svoj krevet."
0:22:38,0:22:54,"Jer ako ti, ako ti, ako i kroz dan ti krene loše, pa ovo prođe loše, pa ovo padneš, pa ne znam, ovako, onako, ti ćeš opet doći na kraju dana, imat ćeš svoj složen kredit jer ti će doći, dići će naći na uspjeh jer si započeo danas sa uspjehom."
0:22:54,0:23:03,I mislim da je to bitno da Vladama kažemo uzmite si male ciljeve i ti mali ciljevi će nagrađivati jedan veliki cilj na koji ti će na kraju doći.
0:23:03,0:23:08,"Pretpostavljam da si tako isto radio sa svojom firmom, ali evo sad ćemo to saznati kad ti postavim pitanje."
0:23:08,0:23:13,"Nisu baš biznis priče, ali sigurno bi se volio dotaknuti i poslovnog dijela ovog što radiš."
0:23:13,0:23:14,Mislim da je vrijedno da to ljudi čuju.
0:23:16,0:23:27,"Kako je tekla priča otvaranja obrta od početka do kraja, odnosno do danas, nećemo spominjati kraj, ali od početka do danas kako je nastalo ime Studio Regna, predstavi da čujem."
0:23:27,0:23:31,"Da, jedna jako zanimljiva priča, jako dugačka u biti."
0:23:32,0:24:05,"Ja bi tu možda izdvojio, recimo naziv, naziv samoga studija, mi je recimo zanimljivo, ja sam još tada kad sam bio možda sedam i osam razred čitao sam put i brazdu od, odnosno svjetoga Žuze Marije Escrive i on je tu u biti u tim svojim spisima gdje on u biti govori, ajmo reći neke poticajne misli, on je tu napisao jedan citat koji je meni jako ostao u je neko ostavio onako baš jako opečatljiv."
0:24:05,0:24:12,"Pisalo je Regnare Kristum Volumus i u prijevodu, to je u onom prijevodu preveo, Bog je uz odvažne."
0:24:13,0:24:21,"I meni je ta rečenica, tako mi se neko u srce onako uvukla, da."
0:24:22,0:24:32,"I ja sam tada imao jedan, pa onako dosta neka star laptop, nešto onako čisto da mogu pisati u Wordu nekakve radove, znaš onako, za školu i tako."
0:24:33,0:24:50,"I ja sam si napravio pozadinu, to sam sam sam tada, ako, uzela sam neku sliku planina i napisao sam taj citat i stavio sam to kao pozadinu da im bude uvijek podsjetnik da je Bog uz mene, da šta god radim da se borim, da se trudim jer Bog je uz mene."
0:24:51,0:24:52,Ako sam ja odvažan onda je Bog uz mene.
0:24:54,0:25:25,"I u biti par godina kasnije kada sam ja otvorio svoju firmu, kada sam, kada je došao trenutak da ja izaberem naziv firme, ja sam bio onako dobro pa kako će se firma zvati, sada je ne znam, ono znači baviš se sa fotografiranjem, snimanjem, pa kako, ne znam, oko sokola, tako neka neka, neka nekakva, nekakva, ajmo reći smiješnim nazivom i razmišljam i u svojoj toj svojoj muci, ona legnem u krevet i pomolim se i sve te muke zaspijem."
0:25:25,0:25:34,"I nekako, kod da vam je onako, bio sam vaš u polusnu, u polumolitvi mi dođe slika toga, tog laptopa i te pozadine."
0:25:35,0:25:40,"Regnare Kristom Volomus i kažem to je to, studio se mora zvati Studio Regnare."
