Start (HH:MM:SS),End (HH:MM:SS),Segment
0:52:33,0:53:06,"Pa znaš šta, mladi su, mladi su, ne bih u biti govorio neke kritike, ne bih govorio neke kritike, rekao bih samo da su mladi veliki potencijal i da mladima treba pružiti priliku bez obzira gdje su, šta su, kako rade, šta rade, treba im pružiti priliku, treba im pružiti nekakvo utočište, nekakvu sigurnost da vide u nama nekakvu snagu, da se u biti ohrabre, da u biti uzmu svoj život i da onda njega naprave neko rano djelo."
0:53:07,0:53:15,Treba mladima biti veliki poticaj i onda će mladi u biti dobiti kriva i onda će onda kriva tražiti nešto pozitivno.
0:53:16,0:54:03,"I tu sam izdvojio, možete i ovaj, nešto reći samo dok ja to nađem iz Biblije, evo, evo, znači kaže ovako, to je Izaija četrdeset trideset jedan kaže ali onima što se jahu uzdaju snaga se obnavlja krila im rastu kao orlovima trče i ne sustaju hode i ne more se i upravo u toj rečenici u bibliji vidim mlade vidim mlade i kao kaže pjesma ona to je moja pjesma za mene je nadar za pjesma kao orao ja s tobom letit ću visoko samo ti vodi me kako on dalje ide već i to je bitno jel znači kao orao ja ću s tobom poletjeti znači ti kaže svakim danom mijenjam je snagom ljubavi svoje je, to je to, to je poanta."
0:54:03,0:54:09,"Ja mislim da je to Tomislav Pernar, da svi mi Hrvati koji živimo ovdje, čak i oni u iseljeništvu da su toga svjesni."
0:54:09,0:54:12,"Voliš svoju zemlju i znam da ju osjećaš, pričamo puno o tome."
0:54:13,0:54:23,"Koje su neke stvari, kada misliš zapravo, kako se mi katolici moramo postaviti prema ovom vremenu u kojem trenutno živimo i ekonomskoj, političkoj, socijalnoj, društvenoj stvarnosti?"
0:54:23,0:54:34,"Pa znate šta, ja mislim da moramo biti hrabri, da moramo biti razboriti, da moramo nekako se društiti biti ta promjena."
0:54:36,0:54:44,"Jer mladima svjetijeta ostaje, mi mladi smo ti koji jesmo i nema druge budućnosti u Hrvatskoj nego nas mladih."
0:54:45,0:54:50,Puno mi ljudi ovdje dolazi i kaže katolici moraju biti izvrsni jer je to temelj za evangelizaciju.
0:54:50,0:54:51,Koliko se slaže s time?
0:54:51,0:54:52,Pa znate šta?
0:54:52,0:55:16,"Od nas katolika svi očekuju mnoštvo i svi govore da moramo biti savršeni, ali sad bih tu rekao jednu stvar koja je bitna za mlade, a to je da se mladima kaže da je u redu da nisi dobro, da je u redu nekada i da si pao i da si posustao, da je u redu i da više nemaš snage i da više ne znaš kojim putem krenuti."
0:55:18,0:55:36,"Previše se očekuje savršenstvo, previše se stavlja nekakva savršenost, nekakva ozbiljnost, ne znam, previše stavlja tu nekakvu, nekakva, kao da je nekakva, ta linija otišla u nebo i ne vidimo je kraja onako."
0:55:36,0:55:39,Znači mora biti sve savršeno ili je potpuno krivo.
0:55:39,0:55:50,"I onda u svemu tome mladi nemaju prilike reći pa nisam dobro, pa danas nisam dobro, danas se ne osjećam dobro, strah me, ne znam, ne znam kako dalje, šta da radim."
0:55:51,0:55:52,Složio bi se to zovem.
0:55:52,0:56:05,"Ali u redu je reći to, u redu je reći to, ali je bit u tome da čak i tada kada nam je loše i kada ne znamo šta i kako, Bog je rekao ja sam uz tebe, ne boj se, ja ću te nositi."
0:56:06,0:56:16,"I to je nekako bitno da si uvijek u glavi posvjesnim, imamo tu nekakvom misao što je Bog rekao da se ne boj, znači kaže ne boj se ja sam s tobom."
0:56:17,0:56:18,Pa nije li to predijeljeno.
0:56:18,0:56:22,I zato mladima treba pružiti podršku i reći im u redu je nekad i da se loše osjećajš.
0:56:23,0:56:24,"Nije to ništa strašno, to je u redu."
0:56:25,0:56:36,"Prije koji tjedan ovdje mi je sjedio Andrej Grubić, ekonomski analitičar i poduzetnik i rekao je da jedan od najboljih nenamjernih ili namjernih načina kako možete pomoći zemlji je biti poduzetnik."
0:56:37,0:56:44,"Evo ti već polako ideš i gaziš od te vode, ali što misliš da tebi nedostaje u tome da još više služiš za ovu zemlju?"
0:56:46,0:56:47,"Pa, ovako gledaj."
0:56:48,0:57:39,"Ja mislim da ja osobno svakoga dana sve što radim radim maksimum, da ja zbilja sve od sebe i mislim da je bit i poanta da dajemo sve od sebe svakoga dana, da dajemo sto posto od sebe i to je ono bezuvjetno bez obzira bez obzira jel to znači ja bi volio da i ovaj podcast bude potpora mladima neovisno tome jesu li oni uvjerili ili nisu jel je to ne znam možda upis nekog fakulteta jel to možda da pitaš sur van onako možete strah možda je to evo da se prijaviš ne znam na potjeru recimo ne znam nešto nešto nešto nešto nešto nešto što onako te možda strah da će ti izići iz svoje komfort zone ali opet će biti na tvojoj rasti poticaj."
0:57:39,0:57:42,I ja se trudim onda svakoga dana izaći iz svoje komfortzone.
0:57:42,0:57:52,"Pa recimo prije tri godine kad sam tek ušao u zajednicu, osoba tada ne bi mogla sjediti ovdje i pričati na ovakav način."
0:57:54,0:58:10,"Ja bi zamotkivao, ja bi stajao, ja bi si sad priznajavao, ja bi gledao kamere onako šta se događa, znaš, ti bi mi bio kao najgori neprijatelj, ajmo reći, znaš ono, bio sam toliko nekom, ajmo reći, bio sam, baš sam bio introvert, bio sam povučen, bio mi je strah."
0:58:11,0:58:22,"I kroz to služenje i sve skupa, Bog me je potpuno okrenuo, potpuno dao mi je tu snagu da evangelizira, da pričam, da djelujem, znaš."
0:58:23,0:58:34,"I to je jednostavno nešto što onda u biti pokušavam se svakoga dana prisjetiti i da onda to iskoristim u svemu što radim jel, što je jednostavno bit i poanta svega."
0:58:35,0:58:43,"Mislio sam te pitao za poruku, ali mislim da je cijeli razgovor sam po sebi bio i više nego jedna kvalitetna poruka za svakoga koji je ostao ovdje do kraja."
0:58:43,0:58:47,Tako da prijatelju stvarno uživao sam i hvala ti što si došao ovdje.
0:58:48,0:59:09,"Hvala tebi, hvala evo cijeloj ekipi ovdje, cijeloj ekipi ovdje i nekako možda bih završio sa jednim citatom, kaže ovako, evo ako kaže, znači od majke Terezije, kaže daj svijetu nabljež, ti imaš, vjerojatno neće nikada biti dovoljno ipak, daj svijetu nabljež, ti imaš."
0:59:10,0:59:37,"I mislim da je to nekako, nekako poanta i bit svega ovoga da sve što imamo od sebe damo i onda ćemo biti, biti ta promjena i evo nisam toliko spomenuo našu Hrvatsku, našu prekrasnu zemlju koja je najljepša zemlja na svijetu, koja ima toliko jezera, planina, brda, ona predljepa je u svakom pogledu."
0:59:38,0:59:43,"I poruka mladima, ostanite u svojoj domovini, borite se za svoju domovinu."
0:59:44,0:59:48,"Naši roditelji su se nekada borili na jedan način, mi se sada borimo na drugi način."
0:59:49,0:59:52,Moramo ostati ovdje i moramo živjeti za svoju domovinu.
0:59:53,0:59:57,"Tu smo, tu nas je Bog stavio s razlogom, tu smo s razlogom i moramo to iskoristiti."
0:59:58,1:00:00,Moramo se boriti do kraja i
1:00:00,1:00:01,onda će na kraju biti sve dobro.
1:00:02,1:00:05,"Ništa brate neće akvariti ovu špicu, hvala ti puno za kraj ove sjednice."
1:00:05,1:00:06,Hvala ti.
1:00:06,1:00:07,Sretno u daljnjim projektima.
1:00:07,1:00:08,"Hvala i vidimo se, sad i pozdrav."
