Start (HH:MM:SS),End (HH:MM:SS),Segment
0:25:41,0:25:58,"I u biti je to priča tog naziva i onda kasnije i sam logo koji je specifičan što nam svi govore da je lijep jer tvori neku krunu jer u biti sama riječ regnare znači kraljevstvo, kraljevati vladati."
0:25:59,0:26:07,"I u biti ta kruna u kojoj u samom središtu se nalazi križ da nas podsjeti da je naš Bog, naš vladar, naša, sve je naš kralj."
0:26:08,0:26:28,"I u biti ja i na taj način nekako evangeliziram i mladence i raznorazne spotove koje snimamo i sve skupa jer se i na kraju svakog spota ili ne znam neke snimke nađe naš blog i ljudi će sigurno primijetiti taj križ i reći je dobro što se taj križ radi usred nečega što je u biti ja moram reći svjetovno jel, ono nebitno jel."
0:26:29,0:26:32,Tako da je to isto neka bila moja poanta i biti jel.
0:26:35,0:26:42,"Dobro, jako je lijepo da se vratiš na početak da vidiš gdje je to počelo i odlučio si staviti taj križ, odlučio si staviti tako ime što je prekrasna priča."
0:26:42,0:26:44,"Kako je sada, kako to dalje ide?"
0:26:45,0:27:10,"Da, pa u biti ja sam, to je bilo još za vrijeme korone, nekako kako sam se odvažio da otvori nešto svoje, da pokrene nešto svoje, tu sam počeo puno istraživati gdje bi ja mogao uzeti, moram reći, neka poticaj gdje bih ja mogao pokrenuti nešto, znači krenuti s nečim, neka početni kapital, nešto da ja mogu, da ja neko zalađe, da ja uopće mogu razmišljati o nečemu onako ozbiljnijem."
0:27:12,0:27:59,"I kroz razne razne prikupljive sa prijateljima, istraživanjima, sam naišao na taj poticaj za mlade od ove EU i u biti sam tu krenuo u tu nekakvu ideju i pisanja i plana i troškovnika i svašta to na što je bilo i to je bilo jedno razdoblje zaista teško gdje sam ja više od pola godine u biti pisao sve te planove, troškovnike, skupljao sam volonterske sate da mogu i to priložiti, puno toga, puno toga, znači morao sam proći puno i ministarstava i raznih udruga i dosta, dosta stresno, ali opet kada pogledam sada, evo recimo sada kada pričamo, malo o tom razmislim, zbilja se isplatilo i drago mi je zbog toga."
0:28:02,0:28:34,"Nekako osim toga, kad sam to sve pokrenuo, do današnjeg dana, ne znam sad možda da evo ispričam priču, kako sam u biti upoznao ekipu ovog drugog Tomislav, to je bilo još prije tri godine kada je bio Antonovski hod mladih, evo ja sam se javio Frastjepanu Brčani, ako mu treba pomoć na neki način služiti u zajednici jer evo ja se bavim sa fotografiranjem i snimanjem, ali ako mogu bilo šta služiti, sad evo znači dolazi Antonovski hod, ako mogu bilo šta pomoći."
0:28:35,0:28:41,"I Stepan je meni napisao poruku, dođi poslije susreta, mi se javi pa ćemo vidjeti evo nešto ćemo dogovoriti."
0:28:42,0:28:49,"I ja u biti dolazim poslije susreta, bilo je već malo kasno i upoznajem se sa Stepanom i nismo mu si ni pružili ruku, dolazi drugi dečko."
0:28:51,0:29:03,"Dolaze drugi dečko i govori, koji si Marijafar Stjepan, ja sam Tomislav i Stjepan, ovaj Stjepan, sa strane kaže Tomislav Tomislav kao isto Vučić Tomislav i kao pa da se vi kao prvo malo poznajete pa ćemo onda mi kasnije malo pričati."
0:29:03,0:29:12,"Jer u biti u čemu je stvar Tomislav se javio za istu stvar kao i ja, on se isto bavio sa fotografiranje snimanja itede netko je opasno molio."
0:29:13,0:29:23,"I u biti šta je bilo na kraju, da je Stjepanu taj tjedan, to je bilo prethod sam, dečko koji je trebao snimati i fotkati mu je otkazao, nije mogao zbog nečega."
0:29:24,0:29:27,"Stjepan je ostao sam, bez ikoga da mu to snima i fotka."
0:29:28,0:29:43,"I kako mu je bitno bilo provedivo i evo sad da ne duljim, dan danas evo taj Tomislav, ja skupa radim u biti i sve ovo što sam sad dosad stekao, on je bio velika podrška u tome i tako da evo veliki pozdrav i za njega."
0:29:44,0:29:51,"Pozdrav za Tomu, naravno možda bi on mogao doći isto ovdje u potkas pričati o nekim stvarima, ako bude bio dobar, popričat ćemo o tome."
0:29:51,0:29:55,Što bi izdvojio kao jedan od nekih najvećih projekata kroz cijeli tvoj poslovni vijek?
0:29:56,0:30:06,"Uf, to je, to je, oprosti Tomislav, fascinantno mi je da je taj vijek nije toliko velik, a imaš zaista već toliko uspjeha i vjerujem da će to biti jedna uspješna firma."
0:30:06,0:30:07,U čemu je tajna?
0:30:07,0:30:08,Znaš šta?
0:30:10,0:30:15,Rekao bi netko da kada dopustiš Bogu da djeluje onda nema granice.
0:30:16,0:30:28,"Zaista ja sam se u potpunosti prepustio Božjem milosrđu, dao sam svoje talente u služenje Bogu i Bogu me zaista nagradio stostruko, a stostruko zbilja."
0:30:29,0:30:48,"I sad ti evo pitaš za te neke projekte, za mene osobno svaki moj projekt koji radim je moj vrhunac jer Jer ne znam, netko ujutro, ujutro, ujutro kad se probudiš, kada u biti prvo otvoriš oči i shvatiš da si probudio, da si dobio priliku da još jedan dan živiš, to je neka blagoslov."
0:30:48,0:30:58,"Jer evo, samo danas, evo, toliko ljudi se uopće nije, nije dobila priliku živjeti današnji dan i treba Bogu zahvaliti na tome, ali prije svega."
0:30:58,0:31:03,I onda u biti svaki projekt za mene je poseban i znači jako puno.
0:31:05,0:31:11,"Recimo, jedan projekt koji sam rekao da je netko ušao u povijest je Proglas srca na Maksimiru."
0:31:12,0:31:14,"Za mene je to bilo zaista, zaista milosno."
0:31:14,0:31:20,"Evo ja se sjećam, nas je bilo deset fotografa, ja mislim, a Maksimir je zaista ogroman."
0:31:20,0:31:29,"Maksimir je ogroman ima, tada su bile tri tribine i ja sam u biti fotografirao na Donjem zapadu i jug."
0:31:30,0:31:41,"Sad kad ti povlaš jug i zapad, to je onako, treba to preći, znaš, treba to preći s obzirom da još ima ne znam stoje nešto redova stepenica, onako dosta zahtjevno."
0:31:42,0:31:47,"Međutim, sjećam se, sam program je počeo negdje oko tri, mi smo morali doći oko pet sati."
0:31:48,0:32:01,"I ja se sjećam od pet sati kada sam ja došao do ponoći, mislim da je trebao koncert, ja nisam stao ni jednu sekundu, trčao sam gore, dolje, lijevo, desno da uhvatim apsolutno sve moguće."
0:32:02,0:32:10,I ono što je neko meni ostalo u pamćenju da u niti jednom trenutku nisam stao i rekao Bože umoranca ne mogu više.
0:32:11,0:32:44,"Ja koda da sam letio, imao sam, imao sam znači u biti sam bio na krilima Duha Svetoga, bio sam toliko pomazan, znači imao sam snage poslije, znači kada je koncert završio ja sam mogao još jedan koncert napraviti, toliko sam imao snage da ono, jer u biti kad ti vidiš tu radost u ljudima, tu sreću, tu ispunjenost, kad ti vidiš jednu obitelj koja dođe sa petero djece, koja je došla ne znam možda iz Švicarske, iz Austrije, koja su putovali deset sati da bi bili tu na koncertu, da bi slavili Boga, smijem li se ja onda žaliti i reći Bože umoran sam?"
0:32:45,0:32:52,"Znači, nešto toliko lijepo i toliko nešto što je mene na kraju dana onda ispunilo jednostavno predljeposjećaj."
0:32:53,0:33:06,"I osim toga, ne znam, evo, to što ti kaže, zbilja smo imali puno projekata, nekako mi je bitno neko se vodi rečenicom u Bibliji besplatno primite, besplatno dajte."
0:33:07,0:33:20,"I nekako mi je bitno onda, evo moram tu spomenut humanitarni mjesec koji radimo svake godine, a to je u biti dvanaest mjeseci gdje svi prihodi koji dođu u firmu u biti idu za humanitarne svrhe."
0:33:21,0:33:25,"I prošle godine smo to dali u Dječjem domu za Zagreb, to neki znaju kao Nazorova."
0:33:26,0:33:38,"I recimo vam sad jedna priča, zanimljiva, kada sam došao tamo, to je bilo početkom jedandvanaest i došao sam da popišemo ono papir, da ja njima dajem tu svota određenu koja je koja je, bla bla."
0:33:39,0:34:00,"I uglavnom ja dođem tamo parkiram i kako je to, to je velika zgrada, ima ona baš puno katova i parkiram i izađem iz auta i čujem onako dječje glasove i pogledam onako gore i vidim možda ne znam, bilo četiri pet kat, djeca, njima ih ne znam desetak, imaju možda četiri pet godina."
0:34:02,0:34:15,"Toliko radosti o njima, toliko sreća, njih je čuvala jedna teta gospođa, jedna, međutim oni su imali, oni su imali neke male loptice, nekakve autiće, ništa specijalalno, oni su bili toliko sretni."
0:34:15,0:34:18,"Oni nemaju ništa, imali su sve tada u tom trenutku."
0:34:19,0:34:34,"To je trenutak koji ću sigurno pamtiti do kraja života, trenutak koji je mene potaknuo da razmišljam o biti, o svojoj nezahvalnosti i koliko biti ja imam i koliko trebam Bogu biti zahvalan svaki dan za sve to što imam ja."
0:34:34,0:34:54,"I kada te vidiš malo dijete od četiri pet godine koje uopće nema roditelja, znači nema onu neku prvu nit, vodilju koja će mu u životu pružiti tu prvu stvar, to je neka prva podrška, a oni opet se ponašaju kao da imaju sve, toliko su sretni, toliko su radosni, toliko su ispunjeni, skaču, plešu."
0:34:55,0:35:01,"Pa evo sad kad to kažem ono što je rekao sveti Bosko, skačite, plešite, samo nemojte griješiti."
0:35:03,0:35:12,"To je u biti to, toliko su bili ispunjeni i meni je to dalo toliko snage za sve dalje u životu što ću raditi i zbilja sam zbog toga jednostavno presretan."
0:35:12,0:35:33,"I zbog toga nekako i cijeli taj humorni mjesec mi je u biti nekako dalje u daljem radu cilj da ga dovedemo na neku zbilja posebnu razinu, da to bude baš onako nešto što će ljudima zapasti u oči i reći pa čovjek će vidjeti ovo, idemo mi onda djelovati, idemo mi nešto od sebe dati."
0:35:34,0:35:34,E to je poanta.
0:35:35,0:35:37,Poanta je da mi od sebe damo ljudima.
0:35:38,0:35:40,"To je u biti, to je taj humanitarni rad."
0:35:41,0:35:54,"Evo, rekao si mi nekoliko tih predivnih priča koje vjerujem da će imati svoj nastavak, ali moram te pitati, znam da ne možeš znati sve, ali daj mi barem neku viziju, daj mi taj dašak neke vizije da tu pred kamerama kažemo da te za dvije godine držimo za riječ."
0:35:54,0:35:55,Znaš šta hoćeš reći?
0:35:57,0:36:04,"Nam je da dajem sve od sebe svakoga dana, a on a onda je na Bogu da on to iskoristi."
0:36:06,0:36:28,"Ja imam u glavi tisuću ideja, tisuću planova, tisuću projekata, nekako želim, baš sam onako gladan, gladan sam da djelujem, da radim, da stvaram nešto novo, nekakav poticaj mladim ljudima i tu sam prepustio Bogu apsolutno sve cijeli svoj život i neka onda on upravlja na tome, pa evo vidjet ćemo."
0:36:28,0:36:30,Vidjet ćete se u dokumentarizmu možda.
0:36:31,0:36:51,"Dapače, dapače, nekako mi je fotografija, ja moram reći, moja prva ljubav, ali u posljednje vrijeme me zbilja produciranje, snimanje, taj dio me baš tako jako privlači i baš bi volio u budućnosti neko krenuti i u tom smjeru."
0:36:51,0:37:21,"Pa evo sad to što pitaš i u biti smo sad u nekom projektu snimamo jedan dokumentarac, jedan je već u pripremi, još, tako da, da, da, da, tako da u biti sam već krenuo, krenuo sam u tom smjeru, samo što tu je dosta onako ima i procedure i stvari koje moraš riješiti, pogotovo ako se misliš ozbiljjnije baviti s tim, to je sada već nešto onako malo, malo zeznato, ali opet ako ja vam bog ne imam sve pa ćemo uspjeti to."
0:37:21,0:37:34,"Dobro, dobro, ostavit ćemo se za drugi potpis, možda i neke ostale priče, ali dajde ono pitanje koje mi se sad nameće, pa kako stižeš to svećevljeće, imaš faks, imaš evangelizacijsku zajednicu, imaš svoj obrt, hrpetinu drugih ideja pretpostavljam, kako to stižeš?"
0:37:34,0:37:54,"Pa znaš šta, nekako od jutra kad se probudim pun sam, pun sam elana, pun sam neko onako, adrenalin me odmah puna na tisuću, odmah onako skočim s kreveta i želim ići u svijet raditi nešto naš."
0:37:56,0:38:07,"Vjerujem da je to nešto što svi mladi tragaju za tako nečim, da kad se probudim da im nije onako, evo sad fakultet pa moram ići ne znam ovako ovo ono."
0:38:09,0:38:25,"Međutim, ja sam evo Bogu hvala dobio tu milost da ujutro kad se probudim da sam zbilja onako radostan, da sam sretan što živim ovaj život, što imam priliku i ove talente koje mi je Bog dao da ih ja dam u svijet, da ih iskoristim."
0:38:26,0:38:46,"I u biti što mi je neko zanimljivo, svaki put kada imam tisuće stvari za napraviti u danu i kada mislim da neću se tići da jednostavno baš previše toga se zadam, jednostavno sam takva osoba, onako mislim a mogu, mogu znaš, a može i ovo i ovo i ovo, a može, može."
0:38:46,0:38:55,"Na kraju dana opet se to neko posloži savršeno u sekundu ono, u sekundu se sve posloži da čovjek stane i kaže dobro, pa je li ovo moguće ono?"
0:38:57,0:39:04,I tu opet vidim neko Božje djelovanje i samoga Boga i samo kao Bog u tome svemu i da on neko to sve uvodio.
0:39:05,0:39:05,Bogu hvala za to.
0:39:06,0:39:14,"Ali evo, spomenuo si tu radost, svjestan si sam koliko mladih danas svoje, nemaju taj elan koji imaš ti kada se probudiš."
0:39:14,0:39:27,"Šta ti misliš koja je bila neka poruka tim mladima koji možda trenutno prolaze kroz neka teška razdoblja, koji možda imaju neke naznake depresije, anksioznosti zbog kojih ne mogu spavati kako spada i onda sve ostale i talente i sve što imaju kasnije ne mogu ispoljavati na pravi način?"
0:39:29,0:39:32,"Pa neka moja poruka, evo, njima."
0:39:33,0:39:45,Pa u biti ono što smo rekli na početku da se ne boje i da ono što kaže svjedac uzme svoj život u svoje ruke i napravi od njega rijemak djela.
0:39:45,0:39:59,"U biti da pokušaju napraviti od ničega nešto, a to je ono što sam rekao nisam došao radi svetih nego radi grešnika, da u biti od ničega napravi nešto."
0:40:00,0:40:11,"I mladi isto tako imaju tu snagu u sebi, imaju snagu za promjenu, imaju snagu da naprave nekakve posebne stvari."
0:40:12,0:40:12,Ja to zbilja vjerujem.
0:40:12,0:40:28,"Znači, mladi su toliko talentirani, mladi imaju toliko snage sebi, samo ja sam treba taj poticaj mali reći im pa prijatelju dobro to radiš, naš, malo ih potaknuti po ramenu i reći pa zaista si dobar, zaista si učinio ovo jako dobro, naš."
0:40:30,0:40:42,"Dovodi se previše, pa evo ja sam znam često puta reći dobro pa mladi su jako tromi, pesimistični, ne treba, ne treba to gledati, treba gledati to s pozitivne strane."
0:40:44,0:40:56,"Mladi su zbilja posebni i imaju posebne ideje, ono što smo rekli na početku kada sam bio dijete, kada sam imao onako neku viziju, maštu koju nije imala granica, to su mladi, to su mladi."
0:40:56,0:41:03,"Znači trebamo biti kao djeca i to su mladi i njima samo treba pružiti podršku i reći evo izvoli, svijet je pred tobom, iskoristi to."
0:41:03,0:41:04,"Ako nećeš sad, kada ćeš?"
0:41:05,0:41:06,Ako nećeš ti tko će?
0:41:06,0:41:15,"Spomenuo si tih nekoliko poticaja koje bi mladi trebali imati samo po sebi, ali jesu li, znam da puno čitaš, pa me zanima koliko su te bi knjige možda bile poticaj u tome svemu."
0:41:16,0:41:25,"Evo samo bi se nadovezao, sam je pao na pamet film jedan Hexo Ridge, ako si možda gledao, Greben spašenih."
0:41:26,0:41:26,Greben spašenih da.
0:41:27,0:41:47,"I u biti, neki dan sam se to isto sjetio, u biti kako u filmu se radi o malom morniku koji u biti nije htio uzimati oružje u ruke nego je on htio spašavati ljude u to vrijeme rata sa svojim djelovanjem, znači medicinski, ali bit će tu pomoć da on spašava ljude."
0:41:47,0:42:12,"I što mi je kad sam gledao taj film, neko je ostalo posebno u pamćenju, u glavi, zašto se taj film zove Greben spašenih, to se radilo u jednom velikom laku grebenu gdje su se ti marinci penjali i onda bi išli u rat i u biti po noći bi bila mu reč, zatišite, bilo bi vrijeme da se u biti ljudi malo odmore itede Taj mladi čovjek koji nije htio uzeti oružje i ruke, on je po noći spašavao ljude."
0:42:13,0:42:31,"On bi išao od čovjeka do čovjeka, fino bi ga ono ne znam što treba, zavezao da mu je morfi, da mu smanjim tu bol, spustio bi čovjeka dole, vojska bi to preuzela itede Znači on je bio jedini na tom grebenu koji je ostao i koji je spašavao svoje prijatelje."
0:42:32,0:42:38,I ona rečenica koja mi je nekako posebno ostala pamćenje je Bože pomozite mi da spim samo još jednoga.
0:42:39,0:42:47,"Kada bi spasio jednoga svog prijatelja, svog suborca, on bi rekao Bože molim te, pomozim i da spasim samo još jednu osobu, samo još jednoga."
0:42:48,0:42:49,Sajna poruka.
0:42:49,0:43:05,"Sajna poruka i kad ti pogledaj, znači čovjek koji je bio u ratu, koji je bio izmučen, koji je imao krvave ruke, koji je sam bio pogođen, jer je taj film je stvaran po istinitom događaju, koji je u biti nije više mogao, nije imao niti jedan atlas snage, on je rekao Bože molim te da spasim još jednoga."
0:43:06,0:43:11,I to bi poistovjetio s mladima današnjice koji moraju reći Bože pomozim i da spasim samo još jednoga.
0:43:12,0:43:16,"Ne bitno, ne bi Nebitno je to u kojem ti polju djeluješ i kako djeluješ."
0:43:16,0:43:20,"Ti si tu da napraviš neku promjenu, ti si tu da spasiš još jednu osobu."
0:43:20,0:43:30,"Pa evo mi koji djelujemo u zajednici kao evangelizatori, naša je bit da mi spašavamo osobe jednu po jednu, da kažemo Bože pomozimo im da spasimo šina ga."
0:43:31,0:43:38,"I to je neka ljepota i u tom služanju i što si ti se mene pitao, to je nekako, to je nekako, to je neko ono, to."
0:43:38,0:45:11,"A što se tiče knjiga, knjiga su meni u biti dosta pomogle, knjige su te koje su mi pomogle da neko razvijem i svoju umi, svoje maštu kada evo sad razmišljam i o filmovima i o produkciji itede knjige su bile te koje mi daju tu nekakvu potporu, ali se ne bi, ne bi stao samo na knjigama nego bi stao, nego bi i rekao za mlade ljude posebno podcasti, podcasti i to posebno bi, ako mogu, ako mogu reći evo ovo je recimo podcast, ovo je podcast, ali ono što je meni pomoglo jako, a još od malena kad sam bio mali moram spomenuti profesora Tomislava Ivančića, njegove radove možete naći apsolutno svugdje i na YouTubeu, on je tijekom svog života napisao sedamdeset osam knjiga mnoge te knjige su male knjižnice koje brzo pročitaš ali imaju neku poruku neku pantu koja će ti biti za svakodnevni život nekakva neka potpora njega bi netko istaknuo istaknuo bi Damir Stojića teologija tijela izuzetno važna stvar i za mlade ljude i za na kraju krajeva mlade bračne parove jer čistoća ne prestaje samo kada ljudi uđu u brakk, postoji i bračni čistoća i takve neke stvari koje su jako bitne kroz koje ti možeš naučiti i sebe pripremiti za svoje živo tijelo."
0:45:11,0:45:37,"Tako da svakako bi te poručio, mislim sad ćemo i neke knjige koje sam možda već rekao i koje ćemo reći, ćemo staviti, pa evo ovaj podcast se može staviti ispod dolje u linku, tako da mladi ljudi vide, ali svakako profesor Ivančić, teologija tijela od Damena Stovića, to je puno utjecalo na tebe, pretpostavljam, po čemu biraš naslove danas, što čitaš danas?"
0:45:38,0:45:38,Pa znaš šta?
0:45:42,0:46:01,"Nekako gledam nešto što, kako sam, zbilja sam pročitao dosta knjiga i nekako se držim za duhovno štivo, za duhovno štivo, ali u današnje vrijeme pokušavam malo biti onako raznolik da gledam malo i neke druge stvari."
0:46:03,0:46:07,"Ne znam, posljednji knjiga koju sam počeo čitati su bijesovi od Dostojevskoga."
0:46:08,0:46:14,"Dostojevski kao takav nije bio baš neki vjernik, ali je izvlačio nekakve velike plamente u svojim djelima."
0:46:15,0:46:22,"Tako da to isto onako preporučam mladima, ali knjige biram nekako po sebi, što meni odgovara."
0:46:22,0:46:32,"Primjerice odem u verbom i ne znam, uzem neku knjigu, pročitam iza nekakav kratki sadržaj, malo otvorenu knjigu, pročitam, vidim, moglo bi to mene zanimati ili ne."
0:46:32,0:46:41,"U posljednje vrijeme se uglavnom nekako fokusiram na knjige, ajmo reći, koje baš izgrađuju mene kao osobu."
0:46:41,0:46:45,"Ne znam, knjiga od temperamenta do karaktera, recimo knjiga, fenomenalna knjiga."
0:46:46,0:46:48,Knjiga glava obitelji.
0:46:50,0:47:01,"To je recimo neka knjiga koja, ok, ja sam, nisam otac i nisam u ono još u tom dijelu, ali pokušavam već sada gledati kako da sebi izgradim za taj život koji meni dolazi ubrzo, ajmo reći, relativno brzo."
0:47:02,0:47:19,"Kako da ja budem pravi otac, kako da ja budem uzor svojoj djeci, kako da ja budem pravi muž, da budem podrška svojoj ženi i tako neke stvari koje u biti grade mene, moju osobnost, moj karakter i koje mi u biti daju nekakav vjetar u leđa da ja znam da se mogu boriti sa današnjim svijetom, ajmo reći."
0:47:19,0:47:26,"Hvala svima na ovim prijedlozima, vjerujem da ću ja imati koristi od toga i gledatelja ako ih primimo u ruke."
0:47:26,0:47:33,Ali evo pričali smo puno o tim mladima i na kraju krajeva mi smo mladi i radimo ovako neke stvari da animiramo odnosno da pružimo taj neki sadržaj medijski.
0:47:34,0:47:52,"Ja se nadam da će ti dati sebe tu da dokumentaristički barem sadržaj pružiš mladima kako bi mladi stvarno nakon jednog dugog, dugog, dugog vremena shvaćali da je taj kvalitetan medijski sadržaj izrazito potreban i da može utjecat na njihovo mijenjanje u ovom svemu žutilu, pesimizmu, negativnosti, sve što si zapravo već rekao."
0:47:53,0:48:01,"Ali ono što mene zanima je, bi li rekao da ti odrastaš u društvu koje od tebe čini čovjeka koji može činiti dodanu vrijednost."
0:48:02,0:48:23,"Misliš li da danas mladi iskorištavaju maksimum SOA-e koje imamo i da to društvo u kojem se nalazi što od srednje škole, što od fakulteta, ajde izuzet ćemo tu evangelizacijsku zajednicu i te krugove u kojima jesi, bi li rekao za sebe da, da, da, bi li rekao za mlade da danas nedostaje optimizma i da to nije ono što treba biti?"
0:48:24,0:48:30,"Pa znam šta, rekao bi netko da mi u biti moramo sami, sami zavrati."
0:48:31,0:48:43,"To što ste i sam rekao puno je negativne, puno je pesimizma, mediocriteta, onako do kriterija, dosta je stavljen naglasak na upravo tome, na toj nekoj negativi."
0:48:44,0:48:54,"Jer u današnjim medijima, kada pogledaš, otvoriš vijesti, pogledaš dnevnik ili nešto, sve vijesti su samo uglavnom negativne."
0:48:55,0:49:03,I teško je pogotovo mladom čovjeku u današnje vrijeme u svojoj toj negativnosti ostati nekako pozitivan.
0:49:05,0:49:26,"I kad to gledamo sa te strane, mislim da je jako bitno, a to sam rekao i malo prije da zaboravimo da izaberemo okruženje ljudi koji će nas mijenjati, koji će nas poticati da budemo bolji ljudi, da nađemo nekakav krug istomišljenika koji će onda od nas činiti prave ljude jel."
0:49:27,0:49:38,"I u biti je to nekako po meni najbitnije da se okružimo sa prijateljima, pravim prijateljima koji će nas podsjetiti na dobro, na dobro, koji će imati pozitivne misli."
0:49:39,0:49:44,"Sam profesor Ivanović je rekao ako mislite pozitivno pa bit će vam pozitivno, ako mislite negativno pa bit će vam negativno."
0:49:45,0:49:46,A to vidimo i u današnjem svijetu.
0:49:47,0:50:08,"Svi samo vrte tu neku negativu, pa i događa se negativna, ti ne možeš recimo ne znam ako ti je loše recimo, ti možeš, znači imaš dva puta da govoriš loše mi je, loše mi je, loše mi je, loše mi je pa tebe će biti još lošije, aj da okrenem to, recimo pa dobro mi je, bit će bolje, bit će dobro i stvarno će biti dobro."
0:50:09,0:50:26,"I to me sad, evo kad pričamo o tome se sjećam, to sam sjetio od Viktora Franklina, nekako, on je govorio upravo o tome kako je bitno nekako okrenuti priču na suprotnu stranu."
0:50:27,0:50:30,Znači da radiš upravo suprotno od onoga što se događa.
0:50:30,0:50:34,"Znači ako ti je loše to da kažeš pa dobro je, bit će dobro."
0:50:35,0:50:40,"I to je nekako bitno da imamo pozitivan stav, pozitivne misli."
0:50:41,0:51:05,"I onda će biti i sama djela koja radimo i sve što proizlazi iz toga će biti nekako pozitivno, bit će sveto, bit će lijepo, bit će dobro i na kraju krajeva ćemo onda i primijeniti i našu Hrvatsku itede A isto je bitno reći o medijima nitko biti kada govore i o mladima i o političarima itede uvijek nađu neku negativnu stranu."
0:51:06,0:51:09,"Ja bih napravio isto to suprotno, ja bih tražio pozitivne strane."
0:51:10,0:51:38,"Profesor Ivanović je znao reći idemo blagoslivljati, idemo reći, idemo reći Bože hvala ti za naše političare, pa dobri su, pa rade, daju sve od sebe, Bože hvala ti za naše profesore, pa trude se, pa uče našu djecu, Bože hvala ti za naše mlade, jesu kakvi jesu, ali se trude, ali se bore, hoće napraviti nešto od svog života, Bože hvala ti evo za sve i za svakoga jer to je od Boga."
0:51:38,0:51:41,Bog je nas stvorio na svoju sliku i krvlju pa to smo mi.
0:51:42,0:51:46,"I u cijeloj toj priči, što je najbitnije, da ne smijemo zaboravit Bogu zahvaljivati."
0:51:47,0:51:49,Na svemu što imamo i na svemu što jesmo.
0:51:49,0:52:10,"Ujutro, od kad se probudiš, prvo kad se probudiš, kad otvoriš oči, kažeš, Bože hvala ti što sam živ, Bože hvala ti evo na ovom krovu, što sam ja večeras mogao spavati u ovom krevetu, Bože hvala ti na ovom čovjeku, Bože hvala ti na ovoj travi, na ovom avotu, sve je to Bog stvorio, sve je to Bog stvorio, Bože hvala ti na svemu u životu što imam, što ću imati."
0:52:11,0:52:13,Znači bitno je zahvaljivati i.
0:52:13,0:52:18,I onda će u biti sve što radimo će biti sveto i sve što radimo će nam biti na neku veću slavo Bože.
0:52:18,0:52:22,Jako lijepo si rekao da je nekad možda lakše naći tu kritiku u svemu tome.
0:52:22,0:52:32,Još kad nam se to dodatno plasira znači ono nije toliko teško pronaći nešto negativno oko sebe pa samim time mi tako razmišljamo ali daj mi jednu pozitivnu i negativnu kritiku današnjih mladih.
