Start (HH:MM:SS),End (HH:MM:SS),Segment
0:00:21,0:00:24,Dobrodošli u još jedan podcast mrežnica.
0:00:24,0:00:28,Naš današnji gost je profesor Josip Jurčević iz Domovinskog pokreta.
0:00:28,0:00:30,"Profesore, dobrodošli."
0:00:30,0:00:33,"Dobro vas našli, a i posebno pozdrav vašeg gledatelja."
0:00:33,0:00:34,Hvala vam najljepša.
0:00:36,0:00:39,"Svi čekaju, svi nešto čekaju, svi nešto čekaju, čekaju dogovore, pregovore."
0:00:40,0:00:43,Ono što znamo što je najnovije jest da se ništa ne zna.
0:00:44,0:00:50,U kojoj su trenutno fazi pregovori odnosno razgovori vašeg Domovinskog pokreta i Hrvatske demokratske zajednice?
0:00:51,0:00:59,"Pa evo što se nas tiče stvari su potpuno jednostavne i nisu se nimalo promijenile, ovo što god mediji plasiraju to je nekakav veliki spin."
0:00:59,0:01:21,"Sinad smo imali sjednicu i predsjedništva koje broji preko dvadeset ljudi, Domovinskog pokreta koje broji četrdesetak ljudi i stvar je bila jednostavna, potvrdili smo ono što komuniciramo javno već par godina, uključujući kampanju, uključujući čak i prije tjedan dana smo se očitovali, ali to se utopilo na neki način u ovoj halobuci koja se diže."
0:01:22,0:01:32,"Dakle, stvar je jednostavna, naš preduvjet, dakle ne uvjet, nego preduvjet za bilo kakve pregovore jest, dakle ne može sa esdeesesom i može."
0:01:33,0:01:36,"I od toga se ne odustaje, izglasovali smo to jednom."
0:01:37,0:01:50,"Dakle, to je preduvjet da uopće sjednete za stol, u pregovarački stol, dakle ne može se pregovarati ako se to nije dogovorilo, dakle to je neka vrsta preduvjeta i to je vrlo jasno rekao, evo gospodin Radić je čak otišao pred medije i to je rekao."
0:01:50,0:01:51,Evo to je najjednostavnije.
0:01:51,0:02:02,"Ono što se moglo čuti jučer čini mi se jest i da SDSS i možemo nisu konstituirani na ustavni način, na ustavan način."
0:02:03,0:02:06,Malo mi je to prošlo onako ispod radara pa bih voljela da objasnite.
0:02:07,0:02:27,Pa evo poznato je i nekoliko puta je u medijima to opet ostalo na margini jer ne odgovara o strukturi moći a to je Venecijanska komisija koja je otprilike rekla da zapravo manjine su već na toj razini u članicama EU-a da nema potrebe da oni budu opće parlamentarno zastupljeni.
0:02:27,0:02:30,To se može vidjeti statistički tek nekoliko zemalja.
0:02:30,0:02:41,"Pored nas čini mi se dvije tri zemlje imaju manjinske predstavnike u parlamentu, ali imaju jednoga dva i mi smo duplo svih njih dakle na tome standardu."
0:02:41,0:03:07,"Ali je zanimljivo da je Venecijanska komisija zapravo komisija Vijeća Europe, to je glavna rekao bih integrativna institucija Europe, ona je osnovana četrdeset devet godine gotovo dvadeset godina prije europske zajednice odnosno eu i ona je vrijednostni kriterij i ona pod sobom ima i Međunarodni sud za ljudska prava i ona određuje vrijednosne standarde kako bismo rekli."
0:03:07,0:03:17,"To znači, venecijanska je skraćeni naziv jer se ona sastaje u Veneciji, ali zapravo tajništvo je u Štrasburu i ona određuje što je demokracija, što je pravo."
0:03:17,0:03:28,"Ona se prvenstveno bavi dakle demokracijom kroz pravo i dakle to njezino mišljenje na neki način je standard i mi smo daleko, daleko ispod standarda kad se radi o manjinama."
0:03:28,0:03:41,"Prema tome, ulazak u EU znači prihvaćanje određenih standarda, međutim ne samo kad se radi o ovome pitanju manjinskome, ja to volim često javno ponavljati i potrebno je ponavljati jer se to rijetko čuje."
0:03:41,0:03:57,"Dakle, mi smo u pregovaračkom procesu prihvatili cjelokupnu europsku vrijednostnu i pravnu stečevinu, velikim dijelom je formalno-pravno implementirali u naš pravni sustav, međutim praksa je potpuno, potpuno suprotna pogotovo kad dodamo na područje kulture, obrazovanja i sl."
0:03:57,0:03:59,"Dakle, tu je potpuna, potpuna perverzija."
0:04:00,0:04:07,"Ja sam o tome i pisao neke znanstvene članke sa recenzijom u časopisima, a jedan ali nažalost kod nas znanje teško prolazi."
0:04:08,0:04:15,"Možemo li konkretno zbog čega smeta SDSS, smeta li SDSS i Pupovac ili samo Pupovac i zbog čega smeta možemo?"
0:04:15,0:04:16,Ukratko.
0:04:16,0:04:30,"Ukratko rečeno, kada se radi o Pupovcu, dakle to nije neko ekskluzivno mišljenje mene osobno ili DP-a, sjetimo se da je predsjednik kada je bio i Vojvodin Sipović da se on vrlo jasno očitovao da se radi o etno biznismenima."
0:04:31,0:04:34,To je jedino ostalo dobro zapamćeno ovako baš iz te njegove.
0:04:35,0:05:08,"Jasno i sa te razine kada je rečeno, međutim vrlo brzo je to otišlo opet ovaj negdje u podzemlje i to se ne čuje, ali recimo postoji stranka, Srpska pravedna stranka koju vodi moj prijatelj Nenad Vlahović kojeg se isto tako prigušio i on je podnio cijeli niz kaznenih prijava protiv ove Pupovčeve strukture, ajmo to tako nazvati, koja po njegovim tužbama zapravo uzima novac i ne dijeli ga manjinskoj etničkoj zajednici Srpskoj koju Hrvatska država odvoji, nego završava u tim njihovim čudnim kanalima."
0:05:09,0:05:11,"Koji su to kanali, mislim da je nedvojbeno."
0:05:11,0:05:12,Gdje završava novac?
0:05:12,0:05:18,"Završava u toj strukturi koja je etno biznis, da budemo najblaže rečeni, ali koja je to struktura?"
0:05:18,0:05:27,Dovoljno je reći da je tu stranku osnovao ratni zločinac Goran Hadžić i osnovao na sumnjivi za ratni zločin Vojislav Stanimirovic.
0:05:27,0:05:39,"Prema tome, oni nisu promijenili svoju strategiju i oni su jedan od instrumenata oprostite srpskog sveta, jer to sam ja više puta elaborirao, pisao u nekim medijima, ali to je sve ostalo na nekome rubu."
0:05:39,0:05:51,"I oni dalje od toga nisu otišli, što možemo vidjeti u njihovim očitovanjima kada se radi o hrvatskom Domovinskom ratu, kada se radi o svim vrijednostima na kojima zapravo počiva hrvatsko društvo."
0:05:51,0:06:23,"Dakle, teme Hrvatske je nedvojbeno Domovinski rat u događajnom i vrijednosnom smislu, oni ga nikako ne mogu prihvaćati, vidimo njihov odnos prema Oluji, vidimo što pišu novosti, dakle to je otvorena protuhrvatska propaganda sa nizom čak rekao bih nastranog naslađivanja, kad su bili požari u Hrvatskoj, pa lepa Hrvatska ne znam, lepo glori itede Dakle nikad pa ni tad DP i esdeeses da, to je naše osnovno stajalište."
0:06:25,0:06:43,"A možemo, dakle zastupa jednu globalističku radikalnu agendu i opet da ne bi rekli evo to je sada stajalište samo Domovinskog pokreta, tu smo poštujemo dvije rekao bih najvažnije vrijednosne institucije koje to razumiju i znanstveno i na ovaj svjetonazorski način."
0:06:44,0:07:20,"One su se dvije tisuće osamnaest vrlo jasno kada je bilo prihvaćanje ili proces hoćemo ili nećemo prihvatiti istapsku konvenciju dakle hrvatska akademija znanosti i umjetnosti vrlo je jasno rekla da je to apsolutno protivno ne samo hrvatskoj budućnosti nego cijeloj tradicijskoj baštini erha I isto tako govoreći od antropološke do ove svjetonazorsko vrijednosne razine isto se osnovno očitovala i hrvatska biskupska konferencija tako da to nije nekakva posebna mudrost, dakle i to su dvije institucije koje se inače veoma rijetko javno počinju, ali svatko to može otići u medije iz toga doba pa vidjeti."
0:07:21,0:07:33,"Dakle svi oni koji su se nadali na neki način i onoj antikorupcijskoj, odnosno antihadezeovskoj većini u Saboru za sad te nade mogu staviti malo u zapečak ako sam ja dobro shvatila."
0:07:34,0:07:52,"Što se tiče hadezea mislim da ne, ne, dakle evo stajalište je vrlo jasno i to naše povjerenstvo u koje imamo puno povjerenja, dakle čine ga čelni ljudi naše stranke, predsjednik gospodin Penava, zamjenik gospodin Mario Radić, glavni tajnik Josip Dabro, politički tajnik gospodin Barna."
0:07:53,0:07:56,"Preduvjeti su da ponovimo, esdeeses ne i ne možemo."
0:07:57,0:07:59,A koji je onda uvjet prvi?
0:07:59,0:08:04,"I onda se razgovara na klasični način o programima, znači najprije se razgovara o programima."
0:08:04,0:08:05,O foteljama?
0:08:05,0:08:19,"Ne, fotelje su zadnje jer ako kvalitetno dogovorite ovaj program, zajednička politika, bez obzira na podjelu na fotelje i jedna i druga strana ili koliko ih bude, imat će kontrolne mehanizme na ovom drugom da li se to provodi ili ne provodi."
0:08:19,0:08:22,"Prema tome, ne mogu postojati dvije politike."
0:08:22,0:08:25,Uvijek se ide od onog općeg prema pojedinačno.
0:08:27,0:08:30,Je li po vama hadeze globalistička stranka?
0:08:32,0:08:38,"Po ovome što provodi proteklih osam godina, pa možemo reći i u Sanadrevo vrijeme, apsolutno taj vrh je."
0:08:39,0:09:05,"Međutim, evo opet da se vratimo na primjer Istanbulske, to je bila jedna od većih drama, sjetimo se da je četrnaest zastupnika hadezea bilo suzdržano, u medijima smo mogli čitati očitovanja cijelog niza stranačkih organizacija od Zadra, Imotskog itede koje su bile izrazito i glasovale protiv toga, ali one su bile neutralizirane raspuštanjem ili na druge represivne načine."
0:09:06,0:09:12,"Ako je hadeze dakle globalistička stranka, što onda uopće depes s takvom strankom radi?"
0:09:12,0:09:37,"Rekli smo dakle da je to vrh stranke, poštujemo demokracija, dakle podrazumijeva procedure, prema tome sadašnje stanje imamo, ako opet gledamo, zapravo imamo sto pedeset jedan zastupnika svaki od njih to je pravno regulirano dakle to je njegov rekli bismo osobni mandat prema tome naravno da su stranke zauzele stajališta mi smo očito jedina stranka koja je potpuno jedinstvena, čvrsta."
0:09:38,0:09:42,"Znači ovo kad kažu DP će se raspasti, DP će se raskoliti, hoće li?"
0:09:43,0:10:14,"To su spinovi, to se može vidjeti po jedinstvu rukovodstva i pregovaračkog tima od četiri čelna čovjeka, ključna institucija je predsjedništvo, a iznad njega još je i Domovinski pokret, dakle potpuno smo jedinstveni i to ne sada iz nekih pragmatičnih razloga nego evo to je i gospodin Mario Radic sinoć rekao odmah jer je bila gužva, došlo je puno novinara pa čim smo donijeli tu odluku da se ljudi ne bi pržili i mučili na sunce, smo počeli rano pa je otišao rano i obavijesti o tome, o toj osnovnoj odnosi koja ih je zanimala."
0:10:14,0:10:19,Onda ne postoji ta struja Penava odnosno te dvije struje Penava Radić ili je i to spin?
0:10:20,0:10:20,"Ne, sve je spin."
0:10:21,0:10:32,"Nama raste broj članova potpore, zatrpani su nam mailovi da ne odustanemo itede itede i priključuje se mnogi koji su nezadovoljni sa aktualnim politikama u Hrvatskoj."
0:10:33,0:11:18,"Hrvatska je tradicijska zemlja, poznate su naše tradicionalne vrijednosti, protiv njih se ratuje, to je moć globalističkog sustava, nemamo samo mi probleme s time, dakle cijela EU i cijeli svijet ima probleme s time jer globalizam je po mišljenju mnogih autora, ja inače predajem već četvrt stoljeća najnoviju svjetsku povijest upravo proces globalizacije, europskih integracija i slično, o tome najotvorenije piše američka literatura u kojoj u znanstvenoj literaturi već prije dvadesettak godina je bila notorna činjenica da američke institucije, dakle institucije SAD-a najmoćnije države na svijetu ne zastupaju interese američkih građana nego interese multinacionalnih kompanija i njihovih interesa koje imaju sjedište u SAD-u."
0:11:18,0:11:32,"I to je išlo do razrede čak do toga da se pokazuje određena eksteritorijalnost određenih multinacionalnih kompanija gdje je onda čak na svom teritoriju, policija ne može ući unutra, pravosuđe ne može nego su oni već tada imali."
0:11:32,0:11:33,Dakle oni su država u državi.
0:11:33,0:12:02,"A država u državi na toj mikro razini, a pogotovo financijska i druga moć, tako da danas nije nikakva tajna kad gledate prošlu pandemiju koja je bila i ovo što se sada događa, dakle to je rekli bi prva runda, oni su pripremili cijeli niz zakona, dakle da stručnjaci Ministarstva zdravstva Hrvatske, Njemačke, cijele EU neće ništa odlučivati, nego oni će reći sad je pandemija, jel svi to moraju poštivati u tom jednom nažalost novom globalizmu."
0:12:03,0:12:19,"Ja često volim reći da ovi mrtvi globalisti, ovi mrtvi totalitarci poput Hitlera, Staljina vjerojatno se vrte u grob od žalosti jer nemaju ovakve tehničke i tehnološke mogućnosti da mogu ostvariti ono što se zove total kontrola."
0:12:19,0:12:21,"Da što bi tek sad radili, ne da je u bogu."
0:12:26,0:12:29,I to je transhumanizam ali to zaslužuje postojanje.
0:12:29,0:12:31,"I o tome ćemo, pričamo mi o tome u podcastu."
0:12:31,0:12:51,"Postoji, dakle, postoji, ta ideologija je tako daleko dogurala u ideološkome smislu, temelji se na ovoj malto svojoj teoriji od prije dvjesto godina da zapravo da pučanstvo raste geometrijskom progresijom jel i da neće biti dovoljno hrane i sve ovo drugo klimatske promjene."
0:12:51,0:13:01,Dakle cijeli narod koji vlada svijetom zapravo je u funkciji razbijanja nekih punktova otpora od nacionalnih država do nekakvih ne znam udruga i slično.
0:13:01,0:13:04,Od onog što bi kao svakome trebalo biti normalno da?
0:13:04,0:13:41,"MMF itede cijeli niz institucija globalističkih od financija zdravstva, čak i civilnoga društva jer tu su ušli i kontroliraju, financiraju, tako da je poznato od prije dvadeset i trideset godina da su Greenpeace financirali upravo krupni kapital, antitikotinske kampanje da bi kontrolirali, financirali su upotrebu upravo tvornice duhana itede Vratimo se malo u lijepu našu, rekli ste na početku da je vrh hadezea globalistički što znači da idete sa tezom da obično članstvo nije."
0:13:42,0:13:54,"Bili onda depe popravljao taj vrh odnosno mijenjao ga ili naprimjer bili hadezeov vrh bio manje globalistički kada bi bio na čelu, ne znam gospodin Anošić, gospodin Butković."
0:13:55,0:14:06,"Pa znajući njihove životopise, nedvojbeno, međutim na koji način je njih paralizirao, neutralizirao Plenković, to bi sad mogli razlagati."
0:14:06,0:14:09,"Pa što vi mislite kako kratko, kako su neutralizirani?"
0:14:10,0:14:14,"To zvuči onako pomalo ratnički, neutralizirati neprijatelja."
0:14:14,0:14:31,"Značajno je sve riješeno rekao bih, ja sam dvadeset godina radio u institutu koji je multidisciplinarni, silno su zanimljivi eksperimenti koji se događaju na razini socijalne psihologije budući u Americi postoji velika količina novaca do te razine da je moć psihologa i psihijatra nevjerojatna."
0:14:32,0:15:12,"Kod nas kad bih ja sada rekao da ima svoga psihologa jer svi bi mislili da nešto nije u redu, sad kad pokažete da nemate psihologa smatra se da niste normalni, ajmo to tako reći, parade, dakle eksperimente gdje se vidi da se uspješno može bombardiranjem po stručnom znanstvenom kriteriju ljudskih mozgova sa određenim informacijama u određenom ritmu možete izazvati pravu dramu u čovjeku tako da on protivno svojim vrijednostnim načelima, jel protivno svojim stavovima zapravo postupa i ponaša se potpuno drugačije, kako u ovome gospodarskom marketingu, znači trgovini roba, ali isto tako u političkom postupanju."
0:15:13,0:15:19,Što to znači da gospodin Plenković onda na taj način se ponaša prema svojim suradnicima?
0:15:20,0:15:21,"Apsolutno, dakle koristi se."
0:15:21,0:15:22,Čime i bombardira?
0:15:24,0:15:24,Dakle tu je cijeli.
0:15:26,0:15:42,"Dakle tu su i mediji kao što vidite i svi ovi spinovi koji se događaju, ne znam pogotovo vezano za esdepe za depe jel evo mi se raspadamo, mi smo ovakvi, mi smo onakvi iako se, dakle prije dva godine i čitavo vrijeme konsistentno očitujemo uključujući ovih par tjedana dva puta je bila sjednica predsjedništva."
0:15:42,0:15:47,Pa baš to pravi gospodin Kolakušić je odmah istu večer otišao ako ja to tako smijem.
0:15:48,0:15:48,Otišao je.
0:15:48,0:15:58,"To je specifično, sjećamo se da je ušao u politiku s time da je rekao da će pola Vlade preuzeti od toga da će biti predsjednik Vlade, da će biti ministar pravosuđa, policije i čini mi se još nešto."
0:15:59,0:16:36,"Tako kako je on na neki način budući u EU vrlo dobro komunicirao antiglobalističku, dakle suvereničkičku agendu i narativ, to smo svi mogli pratiti ali to je on nije postojao u našim medijima, ali je bio dostupan preko interneta i za ovu kandidaturu njemu za EU, a mislim da je on tamo ušao u određeni krug koji pruža otpor globalizmu, njemu je bila na neki način rekao bih zagrijavanje i priprema za ovu kampanju koja će sada ići ili koja je već počela zapravo jer kad smo predali liste praktično započela je kampanja za izbore za Europski parlament."
0:16:36,0:16:59,Tako da je njegova blisko s nama jest u tome što smo mi naglašeno suverenistička stranka pa onda po toj osnovi je on i sudjelovao tako da nije neočekivan njegov odlazak u tu rekao bih čak radikalno stajalište da on zagovara tu teoriju zapravo za i taj narativ širi da bi postigao uspjeh na skorim izborima devet lipnja.
0:16:59,0:17:07,"Samo ću podsjetiti, bili hadeze bio manje globalistički kada bi bili na vrhu ili Janušić ili Butković, to mi je odgovorio."
0:17:08,0:17:23,"Hrvatska je autoritarno društvo, mi nikada nismo živjeli demokraciju što se opet vidi po jednostavnoj činjenici da na svim izborima za parlament, za sabor, nikada se nitko u javnim očitovanjima nije tu, ajmo tako reći, rekao ja ću biti predsjednik Sabora."
0:17:23,0:17:50,"Prema tome, nikada mi još nismo živjeli demokraciju nažalost i u tom smislu čelni čovjek je iznimno bitan i kad bi bio neki drugi čovjek sigurno bi bilo drugačije obzirom na životopise evo i gospodina Anušića koji je bio jedan od heroja hrvatske obrane, brat mu je poginuo i ne vidim da je on do sada učinio nekakav ovakav grijeh prema hrvatskom suverenizmu."
0:17:51,0:17:58,"Koliko su, počele su priče naravno o mogućim novim izborima pa se nešto spominje rujan, koliko je to moguće?"
0:17:59,0:18:03,"Ne znam, dakle evo naše stajalište je da zastupamo naša načela."
0:18:05,0:18:07,Kako vam se čine hadezeovci u tim pregovorima?
0:18:07,0:18:08,Jesu li blagonakloni?
0:18:09,0:18:10,Jesu li simpatični?
0:18:10,0:18:11,Što govor tijela govori?
0:18:12,0:18:18,"Pa ne znam, to treba pitati naše pregovarače, ali to nas nije zanimalo na našim sjednicama, mi smo se bavili ključnim pitanjima."
0:18:18,0:18:28,"Imate li vi osjećaj, a to se stalno nešto onako govori i proteže da zapravo gospodin Plenković baš ne može smisliti Domovinski pokret?"
0:18:29,0:18:56,"Pa koliko je to osobno, koliko je to uvjetovano njegovom karijerom, ako se prati njegova karijera, zna se njegov životopis, zna se komu je otac, njegov, njegov naturalni rad, sve je to na neki način rekao bih logično i zna se za njegovu čarobnu rečenicu kojom je očito u dobro pripremljenoj hibridnom ratu hajmo to tako reći dovede na čelo hadezea stranci s kojom se on po cijelom narativu hadezea teško može poistovjetiti."
0:18:56,0:19:53,"Dosta puta je u medijima puno prava bilo rečeno od raznih nazovimo lijevo-desnih strana da bi bilo primjerenije kad bi Plenković bio na čelu esdepea jel Milanović na čelu hadezea dokle je otišla ta devijacija koju je učinio jel Plenković osim toga u osam godina on je deset i petnaest tisuća novih ljudi na sjednicama vlade raznim tijelima hadezea dakle infiltrirao ajmo tako reći u cjelokupni institucijski sustav i s time će im vjerojatno buduće vlasti ja nadam se da će to biti i depe imati problema da stvari vrate u nekakvu rekao bih hrvatsku ili kolotečinu koja je u interesu hrvatskih građana i hrvatske države profesore kad čovjeka netko ne voli, kad netko ne voli ili kad se netko omalovažava ili nešto što je to zašto bi onda se s tim čovjekom družio drugim, dakle onim tko te ne voli?"
0:19:54,0:20:02,"Onda ja opet postavljam pitanje, zašto DP bi htio ići ili mogao ići sa hadezeom ako znamo taj stav?"
0:20:03,0:20:06,"Ne, mi nismo repli, ićemo ili nećemo."
0:20:07,0:20:12,"Ja mislim zašto uopće pregovarate na taj negativistički način, postavljam se na programski način."
0:20:12,0:20:14,"Dobro, ja sam malo radikaliziran."
0:20:14,0:20:40,"Razumijem da, da, razumijem što je društveni ugovor, razumijemo različitost, teško je naći dva ista čovjeka na svijetu, rođene mobilizance itede Prema tome, društveni ugovor, da se vratimo na početak je temelj društvenosti, suživota, inače bi se vratili ono kako je Hobbes davno govorio, filozof, prirodno stanje u kojem je čovjek čovjek u vuk i u kojem belumonijom kontra ovom je srad svih i uproti svih."
0:20:40,0:21:03,"I on smatra da su ljudi društveno biće i da onda postižu taj društveni ugovor uključujući dakle, evo sad imate u saboru sto pedeset jedan zastupnika imate pet šest stranaka koje imaju određene programske ciljeve i ako se u nekim temeljnim stvarima složimo onda se u pregovaračkom procesu nastoji naći modus jel da se popravi stanje u Hrvatskoj ajmo to tako reći."
0:21:04,0:21:15,"Tako da se mi postavljamo na taj način, to znači DP i dalje pregovara i sa esdepeom i sa MOST-om i sa hadezeom i ostalom, jučer su pregovori."
0:21:16,0:21:28,"Razgovori su bili, evo, razgovori, ali kažem preduvjet je vrlo jasno komuniciran, evo i na neki način imam potrebu ga ponavljati više puta, određeno na sve ove šumove ili spinove koji su."
0:21:28,0:21:30,To je ono s čime smo počeli.
0:21:31,0:21:38,MOST-ov Nikola Grmoja iznio je ideju o gospodinu Penavi kao šefu Sabora i tada je vidio iskru u penavinim očima.
0:21:39,0:21:42,Je li ta iskra se vidjela i u očima ostalih DP-ovaca?
0:21:43,0:21:47,"Ne znam šta to je ovaj fjesnički, romantično da je vidio iskru."
0:21:47,0:21:50,"Da, pa dobro, simpatično gledam."
0:21:51,0:22:32,"Gospodina Penova on uvijek ima iskru u očima, ako ćemo tako reći, jel'l ovaj i dosta ovaj branitelja, jel'l imamo tu neku isku tako, šteta što to ovaj gospodin Grmoja nije vidio u vrijednosti, puno veću isku rekao bih, kad su čak neki čak prijatelji Penavi prigovarali, kad je on dao zadnju ponudu se previše ponižava, ali budući smo dorasla odgovorna stranka, zanemarili smo sve što smo čuli i od gospodina Grmoja naročito, jel te njegove spinove nevjerojatne, jel a prostor mu se bio javno otvorio i tada je gospodin Pernar MOST-u, pa znači i gospodinu Grmoju ponudio tu koaliciju i jasno je da bi danas možda i dvostruko više zastupnika imali i MOST i mi, ali eto to se nije dogodilo."
0:22:32,0:22:34,"No, sami ste si krivi, reklo bi se jel."
0:22:34,0:22:39,"Eto da, to bi bilo zgodno da se ja bio i visit, pa bi bilo zgodno da se to pitamo gospodina."
0:22:40,0:22:53,"Da, dobro, sad da se još malo vratimo na gospodina Grmoju, rekao je da ukoliko bi se DP odmaknuo od nekih mutnih interesa, da je onda tu moguće i ujedinjenje, da DP zauzme čvrst stav."
0:22:54,0:22:56,Kako ste vi shvatili tu izjavu?
0:22:56,0:23:26,"Evo ja sam shvatio zapravo da gospodin Grmoja još uvijek ima tu neku, ovaj, mračnu iskru u očima, dakle nisam je vidio vizualno, nego zaključujem logički, je li on rekao bih, kondicioniran, kao što se kaže, izmanipuliran ili je to njegovo stajalište, ja to ne znam, ali u svakom slučaju kriv, prema tome, opet možda od opće stvari da ne idemo sad u elaboraciju, DP je nova stranka, on nikada nije bio u državnoj vlasti."
0:23:26,0:23:39,"Prema tome nitko od nas, evo ni u predsjedništvu, ni u Domovinskom odboru nije mogao sudjelovati u ovoj pljačkaškoj igri koja se događa na državnoj razini."
0:23:40,0:23:50,Dok je MOST imao prigodu u vrijeme kada je imao ministra pravosuđa i ministra policije to je bila idealna prigoda da se počne obračunavati sa korupcijom.
0:23:50,0:23:57,"Nažalost, evo to je ključno zapravo, a sad to treba pitati gospodina Grmoju da ne bi sada mogućnosti obrazlagao."
0:23:57,0:24:19,"Dakle, kad se radi o tome da li je netko nešto mogao, da li je netko uvučen u nešto, onaj tko je imao prigodu, pa bi bilo zanimljivo analizirati razlog zašto tada MOST nije ništa napravio, a imati u rukama policiju i pravosuđe, moglo je se ako ne obračunati, a barem sigurno dramatično početi sa obračunom sa korupcijom koja je inače instrument svih ovih loših stvari u Hrvatskoj."
0:24:19,0:24:22,"Da, korupcija je instrument da bi se to događalo."
0:24:22,0:24:24,Jedna tajnica je tad bila puno moćnija.
0:24:25,0:24:29,"Da, koliko su te i drugi bili moćniji ako je tajnica bila toliko."
0:24:30,0:24:35,"Mi nikoga nećemo ucjenjivati niti ćemo dati da se nas ucjenjuje, rekao je gospodin Radić."
0:24:36,0:24:38,Ucjenjuje li se onda domovinski pokret?
0:24:39,0:25:25,"Pa na neki način da, s tim pritiskom, eto da smo mi sada odgovorni hoće li biti novi izbori jer Hrvatska je u drami krizi, međutim jasno je da je DP ponudio vrlo jasan program na temelju kojega je postigao nevjerojatno veliki iako rekao bih manje od mog očekivanja uspjeh, dakle stranka koja praktično prije par godina nije postojala, sada je treća po svojoj snazi i cijelo vrijeme smo programski vrlo jasno komunicirali i sad ovaj cijeli pritisak medijski koji se događa jel da se raskolio DPI itede onda možemo vidjeti da se svi drugi raskoljavaju uključujući i MOST, a mi smo čvršći nego ikada rekao bih, pogotovo ovaj presid nas je još više uvjerio i osvijestio jel da naša."
0:25:26,0:25:27,Hoće li se hadeze raskoliti?
0:25:28,0:25:30,Pa to je jedna od mogućnosti rekao bih.
0:25:31,0:25:32,Što je preduvjet za nju?
0:25:33,0:25:56,"Pa preduvjet za nju će evo sada, dakle lopta ili stvar je kod hadezea mi smo vrlo jasno očitovali dakle naš preduvjet i sad svatko se može pitati što to sprečava hadeze kao stranku ili hoće li ona ostati kompaktna na tome tragu, da idemo u nove izbore što je šteta da gubimo vrijeme i slično."
0:25:57,0:26:05,"Drugo, sigurno je njima velika drama ako izgube izbore obzirom na korupciju i sve ono što je i europska tužiteljica pokrenula."
