Start (HH:MM:SS),End (HH:MM:SS),Segment
1:16:30,1:16:54,"Isto tako vrijednosno identitetski Istanbulska konvencija, o kojoj se očitovala naglašavam HAZU, dakle najpametnija organizacija barem formalno u Hrvatskoj koja počiva na znanosti i isto tako Katolička crkva odnosno HBK, BISO konferencija koja je u svjetonazorskom i identitetskom smislu tijekom cijele povijesti vrijednosno bila ključna na hrvatskom prostoru."
1:16:54,1:17:33,"nikako nije moguće da depe ode na ovu drugu stranu zajedno ne znam sa mostom esdepeom ne, ne, to je otvorena mogućnost sve je još uvijek otvoreno ali sada kako smo rekli evo najrealnija je ova mogućnost na neki način prema barem temeljnim odrednicama jer se hadeze još uvijek voli predstavljati kao demokršćanska i slično ova stranka koja radi u korist hrvatskih interesa drugo barem formalno iako je devedeset osam tisuća članova skh prešlo u nju ali barem formalno jer to je nekakva nova stranka ovaj od devedeset jedan onda bi to bilo šezdeset jedan trinaest jedan nađete recimo gospođa vuče milović gospodin Zurovec."
1:17:34,1:17:46,"Ona se vrlo dobro očitovala, očito ona je znanstvenica, prepoznaje situaciju, rekla je neće nitko pregovarati u moje ime jer u toj jednoj sumnjivoj koaliciji je ona rekla da su oni sklopili prekoalicijski sporazum."
1:17:47,1:18:16,"Drugo već je i ta stranka kao što vidimo pukla, ovo što je komunicirano vrlo dobro je iskomunicirano ali to je mogli bismo reći pojednostavljeno blef da ne bi sada elaborirao sve i prije ili kasnije izaći će dakle koja je pozadina toga, toga loma, od svjetonazorske do možda nekih upravljačkih neanizama ali govorite o Most, dakle to je bio za neke neočekivan i lom, za mene evo recimo nije, ali duga priča."
1:18:17,1:18:20,"Dobro, vidjet ćemo što će se događati, jel, profesore."
1:18:20,1:18:24,"Dakle, vrlo je izgledno hadeze, depe i još netko."
1:18:24,1:18:26,"Ne, to ćemo vidjeti."
1:18:26,1:18:38,"Dakle, upravo zbog toga smo se kratko očitovali i dogovorili smo da nećemo ulaziti u nikakve elaboracije jer ionako je dovoljno ovih dimnih bombi koje drugi bacaju."
1:18:38,1:18:53,"I sad, ako bismo ušli u neke stvari na nižu pregovaračku razinu, tko, kako, što itede onda bi samo još više zbunjivali i to je usmjereno naravno, evo nas nisu poljudali nego ojačali i isto tako puno ljudi pristupa DP-u."
1:18:53,1:18:55,Prema tome držat ćemo taj ritam.
1:18:57,1:18:58,"Taj ritam, hvala vama."
1:18:59,1:19:01,U ovom ritmu smo lijepo završili ovaj podcast.
1:19:01,1:19:03,"Profesore Jurčeviću, hvala vam najljepša."
1:19:03,1:19:09,Hvala vam što ste pružili mogućnost da se ipak u ovoj divnoj zavijesi malo temeljitije progovori.
1:19:09,1:19:12,"Malo je zapuha labura, je li tako, i raščistilo se."
1:19:12,1:19:13,Hvala vam još jedan put.
1:19:14,1:19:15,Bio je ovo još jedan podcast.
1:19:15,1:19:18,"Mrežnica, naravno da se vidimo vrlo brzo."
