Start (HH:MM:SS),End (HH:MM:SS),Segment
0:26:06,0:26:09,"E sad, je li njima, tko je gospodar tu postavlja se pitanje."
0:26:10,0:26:30,"E sad da ne idemo ovo što smo rekli za Venecijansku komisiju, ali je puno zanimljivije otvoriti pitanje, prije ili kasnije će ga sigurno netko otvoriti, što je sa ovih pet drugih manjina, zastupaju li oni, zapravo, jesu li oni predstavnici svojih etničkih manjinskih zajednica ili zapravo rade za nekoga drugoga."
0:26:30,0:26:43,"I sigurno bi oni trebali početi razmišljati, a već su se udomačili kako bismo rekli na tim svojim pozicijama, a pogotovo jedan od njih jel koji je najdugovječniji za dvanaest glasova je, mislimo na Furia Radina."
0:26:43,0:26:48,"Možda i malo više gospodine Radina, da, to je bila tjesna borba."
0:26:49,0:27:24,"devetsto ne znam dvadeset i nešto i devet dakle ali onda je iskustvo gospodina radina pobjedilo ne, ne, e sad koga zastupaju ako se toliko čvrsto vežu uz ovu etno biznis stranku jel koja se ja to slobodno mogu reći lažno predstavlja, evo navodim opet podsjećam na moj prijatelja Neda Vlahoviča, Srpsku pravednu stranku i sjedili smo i prijatelje etničkih Srba jel koji smatraju da ih zapravo ta ekipa ili ta struktura esdeesesa zapravo ne predstavlja nego da se bavi kao što je rekao predsjednik Josipović etno biznisom u najmanju ruku."
0:27:24,0:27:41,"Sad još malo o esdeesesu, razgovarala sam s jednim članom te stranke, rekao mi je ti ne razumiješ, u Hrvatskoj ne vole Pupovca ali ne vole ga ni u Srbiji kao ovdje je jasno da ga se ne voli, a u Srbiji misle da je premekan., da bi trebao biti barem retorički puno oštriji."
0:27:42,0:28:37,"Ma ne radi se tu o emociji, radi se o interesima kao što vidimo te silne količine imovine koje se izručuju toj strukturi u kojoj pripada nedvojbeno i Srpska pravoslavna crkva o kojoj vrlo dobro u Saboru komunicira gospodin Prkačin, dakle radi se o vjerskoj organizaciji koja nije registrirana u Hrvatskoj, koja je jedna od glavnih izravnih aktera političkih i vojnih tijekom srbijanske oružane agresije na Hrvatsku, ugovor koji je potpisan zapravo sa nepostojećom njihovim nekim savjetom koji uopće ne postoji u njihovom statutu i protivno je standardima i pravoslavlja, a i cijelog isustava koji postoji u Europi jel da u jednoj državi ne postoji Hrvat, odnosno da mi smo jedna država u kojoj ne postoji pravoslavna crkva jer to država, jel institucije ne dopuštaju da se registrira što je temeljno ljudsko pravo."
0:28:38,0:28:39,Tako duga je priča o tome.
0:28:39,0:28:42,Duga je priča da samo malo da se još vratimo.
0:28:42,0:28:49,Ukoliko hadeze i DP krenu odnosno ostvare koaliciju ili neku suradnju to se voli reći programska suradnja.
0:28:50,0:28:53,Prijeti li onda DPU nestanak?
0:28:54,0:29:04,"Znamo da hadeze s kim krene u igru odnosno tko krene u igru s hadezeom taj vrlo brzo nestane, ono postane u tragovima kao ono, a to mi čestice nekakve ih se mogu naći."
0:29:06,0:30:11,"Uvijek su otvorene sve mogućnosti, međutim u DPU se radi o iskusnim, pogotovo evo cijelo čelništvo, ovo najšire predsjedništvo, ali i Domovinski pokret gdje opet većina drvogolja sa branitelja, nakon rata smo svi otišli u svojim strukama od znanosti, biznisa, to su sve iskusni ljudi koji su karakterno rekao bih provjereni u najtežim uvjetima, znači devedeset jedna tisuća devetsto devedeset tijekom rata uvijek postoji mogućnost kako se kaže da netko ovaj putne ili nešto ali ne mislim da smo imalo ugroženi samo svjesni smo znamo što hoćemo pa to je hadeze naravno pokazala se praksa da je sve što je išlo s njime bilo je usisano ali ne bih rekao da je to problem da je to problem hadezea nego to je problem tih stranaka tako da i to je nekakva priroda sukoba političkog u demokratičnim zemljama, ali nastoji neka veća stranka kad je manja pojesti veću jer ponovo veća riba jede manje, ali nekad i manje ribe znaju pojesti veće ribe."
0:30:11,0:30:12,Nagristi onu veću.
0:30:13,0:30:33,"I sad kad bi ta manja riba tipa Domovinski pokret nagrizao ovu veću, znači možda bi se moglo dogoditi da vi zapravo preobratite hadeze da ih vratite na isti put, odnosno na put na kojeg mnogi očekuju da bude, a to je antiglobalistički nacionalni suvereni bla bla."
0:30:34,0:31:39,"Po mojem mišljenju da tu čak nije, došli smo do te razine kao što je bilo devedeset devedeset jedan sjetimo se tada tada su pucale te razlike političke ili tradicionalne i prema onoj staroj grčkoj da je rat otac svih ustvari ovo je neka vrsta jel hibridnog rata koji je došao do vrhunca da naš naraštaj koji je stvorio državu zapravo da je izgubio u cijeloj ovoj globalističkoj igri gdje srpski svet opet ovaj nama najdublje ovaj ušao u našu strukturu tako da mislim da će tu mnogi saborski zastupnici koji su čestiti ljudi zanemariti ono što je manje važno jer stranke su instrument da biste ostvarili neku dobrobit ili opće dobro u svojoj zajednici, to znači u hrvatskoj državi i vjerujem da će neki pojedinci razumjeti ovo što mi programski nudimo i da će prekršiti to što neke stranke zapravo na prvo mjesto stavljaju svoj osobni interes, onda svoju stranku, onda tek na kraju stavljaju onaj opći interes, to znači hrvatska država, hrvatsko društvo."
0:31:39,0:31:39,DPN.
0:31:40,0:31:44,Evo tu smo jedini koji smo se očitovali i jedini koji rastemo sada.
0:31:45,0:31:47,U tom smislu i u svakom drugom.
0:31:47,0:32:25,"Što vi mislite, koliko je moguće evo sad će početi i nabrajanja, ono kad je bilo prvi dan rata u Ukrajini, pedeset osam dan rata u ukrajini sad bi tako moglo biti dvanaest dan već nemamo vladu odnosno nemamo dogovore dvadeset osam i onda krenu znate kako to obično bude naslovnice nekih ne znam portala s upitnikom obično prijeti li hrvatskoj nestabilnost hoće li se urušiti onda tu i tamo nekakav analitičar koji zna sve od rata u ukrajini pa do prije toga korone ili ne znam oni dežurni analitičari po medijima kažu ako ne dobijemo uskoro vladu prijeti nam ne znam što."
0:32:26,0:32:32,"I sad se onda tu nađu nekakvi hop žetončići pa kažu, wow, mi ćemo biti spasitelji."
0:32:33,0:32:34,Koliko je to moguće?
0:32:35,0:32:45,Zapravo puno toga što se događa u Hrvatskoj je manipulacija i onda koristi se opet taj ono što su sionolozi političari zvali promjena fokusa ili preusmjeravanje pozornosti.
0:32:45,0:33:42,"Znači kad imate jedan stvarno ozbiljan problem kao što je u Hrvatskoj demografski problem i na prvom mjestu nama je demografski slom i on se ne može rješavati parcijalno, znači osnujete samo nekakvo ministarstvo pa onda imate te nekakve parcijalne, dakle djelomične, djelomične mjere, svi vidovi djelatnosti od gospodarstva pa nadalje do identitetskoga moraju biti podržani upravo tom jer to su razlozi bijega iz Hrvatske, a Hrvatska je prema svim makroekonomskim analizama zadnjih desetljeća jedna od po prirodnim bogatstvima, geopolitičkom položaju, komparativnim prednostima, pozemnim zalihama pitke vode što je strateški proizvod dvadeset jedan stoljeća mi bi trebali biti gospodarski jako bogata zemlja socijalno izbrinuta i u sigurnosnom smislu sigurna zemlja mi to sve nismo zbog ovog pogrešnog, recimo blago, ja to često kažem veleizdajničkog načina upravljanja Hrvatskom."
0:33:43,0:33:45,"Kako Hrvatsku možemo promijeniti upravo, kratko rečeno."
0:33:45,0:33:55,"Ta vaša izjava o veleizdajničkom upravljanju Hrvatskom, pa onda kad gledamo hadezeovce koji to slušaju onda onako progutaju lagano knedlo, a vi dalje vozite po svoje."
0:33:56,0:33:56,Zašto?
0:33:57,0:33:59,Ne zašto vozite po svoje nego zašto je veleizdajnička.
0:34:00,0:34:03,Zato što je to potpuno jasno i to se tako zove i formalno pravno.
0:34:03,0:34:26,"Drugo da opet ne bih se pozivao na sebe, prije desettak godina postojalo Hrvatsko nacionalno etičko sudište u kojem su bili najistaknuti hrvatski intelektualci, sveučilišnih profesora, akademika, bivših političara, ministara, odvjetnika i slično i donosili smo da bismo zainteresirali etičke presude za veleizaju."
0:34:26,0:34:40,"Tako da smo i u vrijeme kad su na najmoćnijim položajima bili i predsjednici država, predsjednici Vlada, ministri, dakle mi smo uključujući gospodina Pupovca, dakle donošen su te etičke presude da bi se zainteresiralo javnost."
0:34:40,0:35:28,"Nažalost, duga priča koliko je otpora bilo, čak je jedan plaćen oglas odustalo se od njega, dakle novine su jutarnji list, možemo i to reći kad je vlasnik bio Hanžeković, a dogovoreno je s njime da će ići taj oglas, međutim cijela redakcija je prestala štrajkom, znači u propaštavanju lista ako se objavi ono što smo mi zaključili na jednoj sjednici, a bilo je dvapet tisuće ljudi u Lisinskome na tom našem zasjedanju tako dakle da su otpori, ovo presmjeravanje pažnje glavni mehanizam širenje beznadža malodušja nevjere gdje se psihološki nastoji svakog čovjeka uvjeriti da je sam na svijetu da je jadan, nemoćan da ne može ništa i tu dolazi čak do psihološke autodestrukcije a kamoli socijalnog raslojavanja na onom principu podijeli po Vlada."
0:35:28,0:35:33,"Dakle, Hrvatska je u tom smislu ugrožena zbog dakle veleizdajničkog postupanja."
0:35:34,0:35:41,"Dobro, vi ste rekli konkretno da je Plenković doveden za predsjednika hadezea od strane izvan hrvatskih neprijateljskih i globalističkih interesa."
0:35:41,0:35:44,"Dakle, to je rekao bih."
0:35:44,0:35:46,Tko ga je doveo?
0:35:47,0:35:49,"Globalistička struktura, koju mi."
0:35:54,0:35:56,"Da pacificira Hrvatsku, da nas kolonizira."
0:35:56,0:36:31,"Najjednostavnije je dakle kolonizacija Hrvatske, kažem, ali nije to samo naš problem, to je globalistička agenda gdje se razaraju sve tradicionalne vrijednosti uključujući da su već Ujedinjene nacije kojima sam naziv govori pa čak i povelja UN-a tvrdi da je nacija nacionalna država, da je ona temelj međunarodnog prava, da je ona subjekt i puno toga je prekršeno od strane raznih tijela UN-a, dakle ono u povelji što piše da se nitko ne smije miješati u suverena pitanja itede a sjetimo se samo Haškog suda što je radio po Hrvatskoj."
0:36:31,0:36:36,"Dobro, što je po vama najveći grijeh Andreja Plenkovića kao premijera, hrvatskog premijera?"
0:36:36,0:36:44,"Dakle, jedan slučaj Dakle da ne služi državnim i društvenim interesima naroda ili građana koji su ga izabrali i koji ga plaćaju da bude na vlasti."
0:36:47,0:37:00,"Da, to je zanimljivo u jednoj presudi hrvatskog pravosuđa protiv Tomislav Merčepa gdje nije bilo jednog svjedoka i ja sam svjedok svega toga jer sam i pratio proces i dobro poznajem pokojnog Merčepa."
0:37:01,0:37:11,"Zastrašujuće je izdušilo kada je sudac, neću mu reći ime, ali svatko može provjeriti, rekao tu zastrašujuću rečenicu da je Merčep bio na pogrešnoj strani povijesti."
0:37:12,0:37:22,"Što znači vi ste povjesničar, što znači molim vas lijepo, dajte mi to objasnite, biti na pravoj strani povijesti, što to znači općenito, što to znači kad to kaže gospodin Plenković?"
0:37:22,0:37:34,"Pa prema tradicionalnim vrijednostnim kriterijima koje Hrvatska zastupa, znači tu su nekakva humanistička ili kršćanska načela koja su gotovo izjednačena jer onda se to spušta na nižu razinu."
0:37:34,0:37:49,"Prema tome, po nama ili barem po meni, jer evo tu ću govoriti u osobno ime, da sad, jer o tome nismo uopće raspravljali, se podrazumijeva po obrazovanom nekakvom standardu, znači na prvom mjestu su humanistička ili kršćanska načela."
0:37:49,0:38:05,"i onda Hrvatstvo se može mjeriti prema tome jer sad isto padem naprijed, zgodno ste rekli, a možda ćemo, ne znam koliko je ostalo od emisije, isto je bilo dosta medijskih manipulacija sa ovom što mi hoćemo u kulturi i obrazovanju."
0:38:05,0:38:10,"Ja sam to nekoliko puta rekao, ali to nitko ne želi ponoviti odnosno ni to izražuje, pa onda."
0:38:11,0:38:14,"Ja neću, pričat ćemo dan o tome odnosno razgovarat ćemo."
0:38:14,0:38:27,"Mi kada govorimo o tome, dakle o kulturi i obrazovanju želimo europske vrijednosti koje smo formalno pravno prihvatili da one zažive u Hrvatskoj i da se kultura i obrazovanje postupa upravo prema tim kriterijima."
0:38:27,0:38:51,"Kažem ja sam nedavno u časopisu A1 objavljen je analiza udžbenika o kojem se puno pričalo, ali svi su udžbenici gotovo svi takvi, gdje sam dokazao analizom zakona, a vrlo su razrađeni zakoni i pravilnici o udžbenicima, dakle jedno govori zakon i u vrijednostnom i svakom drugom smislu, a sasvim obrnuto je u udžbeniku."
0:38:51,0:39:11,"Samo da se to treba vratiti, dakle ono ne kroatizirati nego europeizirati rekao bih, jer unutar EU vrijednosti postoji vrlo jasnona hijerarhija ili ljestvica vrijednosti koju određuje upravo Vijeće Europe i hrvatske institucije treba standardizirati prema tome i o tome je riječ."
0:39:12,0:39:15,"Dobro, sad ćemo malo o tome, samo molim vas, dajte da završimo."
0:39:15,0:39:28,"Dakle, rekli ste što znači biti na pravoj strani povijesti, ali niste odgovorili što po vama, dakle što je biti na pravoj strani povijesti iz smjera odnosno iz pogleda Andreja Plenkovića po vama?"
0:39:29,0:39:49,"Iz globalističke, a to znači i Plenkovićeve agende, to znači razoriti sve tradicionalno, kolonizirati Hrvatsku u ovome slučaju i zato je ta čarobna rečenica s kojom je on doveđen, a to je bila debela priprema, sjetimo se tko je tada bio Andrej Plenković, dakle kad je ušao u hadeze Svjetska stranka nije tauc, odnosno ne smije biti tauc jednog čovjeka."
0:39:49,0:40:06,"Dakle sada je to puno, puno aktualnije nego kada je on govorio i ja sam već prije nekoliko godina napisao nekoliko članaka i predlažući nekim mlađim ljudima uključujući gospodina Resslera da kaže tu čarobnu, dakle da se pojavi netko na nekom skupu hadezea zna se na kojem to treba biti i da izgovori tu rečenicu."
0:40:07,0:40:19,"Međutim, dotle je išla neutralizacija mnogih čestitih ljudi u hadezeu, kažem, a tu su vrhunske znanstvene metode manipulacije da se nitko ne usudi reći tu rečenicu iako mnogi to u privatnim razgovorima očituju."
0:40:19,0:40:22,"Da, znači da nemaju baš hrabrosti previše."
0:40:22,0:40:32,"Pa kažem nekadašnji, imam primjere heroja u ratu koji su išli doslovno govoriti na tenkove, a danas se boje nekog imaginarija nevidljivoga."
0:40:33,0:40:37,"Dakle to je psihologija, moć psihologije i manipulacije je nevjerojatna."
0:40:38,0:40:41,"Da, spomenuli ste imaginarij."
0:40:41,0:40:57,"Hrvatski imaginarij je ono što je jedan dio programa Domovinskog pokreta, pa vas tu ne neki, rekla bih na neki način malo su vam se rugali pa kažu što oni hoće, vraćaju nas unazad."
0:40:59,0:41:04,Što znači zapravo novi hrvatski kulturni imaginarij u jednoj rečenici?
0:41:05,0:41:14,"Ja sam pročitala sam vaš program samo da znate, znači vidjela sam snaženje svijesti o hrvatskom nacionalnom interesu."
0:41:20,0:41:39,"Dakle, seže tamo barem u stoljeće sedam ili šesto kako volimo reći i taj identitet je toliko čvrst i neupitan da je zahvaljujući upravo tom identitetu mi smo opstajali devet stoljeća kada nismo imali državnu vlast i naš identitet je bio toliko jak i izgrađen da smo ipak opstali."
0:41:39,0:41:50,"Inače u Europi koje god pleme ili narod tamo u ranom srednjem vijeku dvjesto godina ili sto godina nije imalo svoju državu ono se istopilo, asimiliralo, pretvorilo u nešto drugo."
0:41:50,0:42:04,"Nama se to nije dogodilo i zapravo na tim vrijednostima je zapravo uspio naš otpor herojskog doba devedeset jedan da smo se u nemogućim uvjetima obranili dakle, kad smo bili razoružani, kad smo bili na procesu ustrojavanja."
0:42:04,0:42:05,"Dakle, evo i ovaj narašta je to dokazao."
0:42:06,0:42:23,"Na kraju referendum, sjetimo se devetnaest svibnja, eto to će isto uskoro biti, obljetnica devetnaest svibnja kada je u onim teškim vremenima kada je da je završilo drugačije zna se kakva bi represija bila i onih bakica šta su na trgu bana jelčića plele čarape za hrvatske branitelje."
0:42:24,0:42:37,"Međutim, tada je osamdeset pet posto građana sa pravom glasa izašlo na referendumu devedeset četiri posto je glasovalo za samostalnu hrvatsku dakle to su te vrijednosti koje smo tada iskazali."
0:42:37,0:43:28,"Sad će netko reći povjesničar Jurčević, opet ide u prošlost, u povijest, ljude to možda ne zanima, sad smo dvadeset jedan stoljeće dvije tisuće dvadeset četiri godine što danas znači nacionalni hrvatski identitet kad od tog identiteta nemamo više nekune imamo još što himnu zastavu da evo opet ću se vratiti na vijeće europe i venecijansku povijest evo što bi onda tu domovinski pokret napravio to mi objasnite kako biste vratili hrvatski nacionalni identitet evo možda najjasnije reći da Hrvatska ponovno bude ili da bude subjekt međunarodnih odnosa kao što su sve druge članice EU, barem toliko ili čak da ne idemo na sve zemlje ove koje su starije, koje stoljećima postoje, da budemo barem na razini Slovenije."
0:43:29,0:43:55,"Dakle Slovenija je višestruko suverenija država i zajednica društvena nego što je Hrvatska, razlozi su, ne možemo ih ovdje elaborirati jako ih je puno, s time da je duplo manja po teritoriju, dvostruko manja po broju stanovnika i po povijesnom identitetu ili političkom itede dalje ili po geostrateškom položaju puno manje važna nego što je to Hrvatska."
0:43:55,0:43:57,"Prema tome, što treba napraviti konkretno?"
0:43:59,0:44:03,"Zastupati interese hrvatskih građana, to znači od gospodarstva, razvoja i sl."
0:44:03,0:44:08,"i zaustaviti ovaj bijeg iz Hrvatske, iz jedne zemlje u kojoj nema nikakvog razloga da se bježi iz nje."
0:44:08,0:44:31,"Dakle, nikada takav danak u krvi nismo plaćali kao u ovih proteklih deset godina, sjetimo se onih istina i legendi o onom islamskom dobu, jer kada je taj danak u krvi plaćen upravo na fizički način, nikada nije bio tako okrutan brojčano niti strukturom, to znači toliko obrazovanih mladih, potentnih ljudi u svakom pogledu."
0:44:32,0:44:33,Kako biste ih vi vratili?
0:44:34,0:45:17,"Domovinski put je to isto u programu, to znači prve mjere su zaustaviti taj odlazak, a zatim naravno vraćati i ovih pola milijuna, stvoriti uvjete u Hrvatskoj koji su objektivni na temelju tih datosti koje imamo, razvojnih i svih drugih, a to ovisi o upravi koja će raditi za hrvatske interese, stvoriti takve uvjete da se oni vrate u svoju domovinu Hrvatsku, a isto tako potomci hrvatskih iseljenika iskazuju veliki interes pogotovo iz ugroženih dijelova svijeta, to znači od Južne Amerike, danas i Australije nakon ovih teških covid iskustava gdje je bilo premlačivanja, kršenja ljudskih prava prema ženama, staricama itede mnogi koji se nisu mislili vratiti a imaju tamo unuke sada prodaju sve u Australiji i vraćaju se."
0:45:17,0:45:43,"Međutim, postoje te barijere koje su bile jednake kao i one prije devedesette godine jer ova struktura koja vlada ona je naslijeđena iz jednog totalitarnog netržišnog doba, nerazvojnog doba, a hrvatski iseljenici uglavnom žive u zapadno razvijenom svijetu, oni bi Hrvatskoj donijeli i gospodarska iskustva, kapital, investicije itede ali bi donijeli ova demokratska iskustva vrijednosna u praksi što je demokracija."
0:45:43,0:46:04,"Kako to da onda ova vlast ili ove strukture vlasti ako sprječavaju na taj način povratak naših ljudi, kako onda ne sprječavaju dolazak nekih drugih ljudi, dakle uz nekih puno drugačijih civilizacijskih okvira, kulturoloških, to im ne smeta?"
0:46:05,0:46:53,"Radi se o klasičnoj zamjeni stanovništva i ti standardi su opće poznati, to su migracijske znanosti davno utvrdile da se iz politički nestabilnih, gospodarski razvijenih dijelova svijeta, tako je cijele povijesti, seli u gospodarski razvijene i politički stabilna društva, prostor itede Tako da Hrvatska je ne zbog svoje objektivne datosti iseljenička zemlja i to možemo preko sto pedeset godina se vrlo detaljno prati ali tako je bilo i ranije i to se događa na isti način i danas dakle hrvatska je danas članica eu nato a i samo treba primijeniti kažem te praktične standarde puno toga smo zakonsko usvojili, međutim nažalost ovaj praksa je potpuno, potpuno obrnuta."
0:46:53,0:47:05,"I uopće ako se promijeni upravo u Hrvatskoj, ako se stvoriti uvjeti u Hrvatskoj neće biti nikakav problem vratiti i ovih pola milijuna mladih koji su ogorčeni i otišli i rekli da se više nikad neće vratiti u Hrvatsku."
0:47:05,0:47:32,"Sjetimo se starijih iseljenika, o tome postoje brojni dokumenti i svjedočanstva, oni su nepretjedno govorili da će se vratiti, odlazili su vani, ne znam da bi nešto zaradili, da bi preživjeli, ostavili su ovdje dio obitelji, još uvijek postoje u vlasništva osoba, njihovih potomaka koji su preko sto godina ili tamo od kraja devetnaest stoljeća iseljavale, još uvijek ne žele prodati nekakvo imanje, ne znam, na Braču, Hvaru ili negdje drugdje u Hrvatskoj."
0:47:32,0:47:52,"Prema tome, to je jedno složeno za ovakvu emisiju pitanje, ali postavljam i pitanje je li složeno onda pitanje kako to da je Domovinski pokret podnio kaznenu prijavu protiv Andreja Plenkovića, upravo zbog, sad ću ja reći, probijanja granica, ilegalnog probijanja granica migranata."
0:47:53,0:47:54,A sad?
0:47:55,0:48:00,"Ne, dakle radi se o klasičnoj, ja uvijek volim otići u širinu."
0:48:01,0:48:04,"Dob Dakle, radi se o klasičnoj zanemarivosti stanovništva jer je opće poznato da."
0:48:04,0:48:07,Mislim podnijeli ste kao stranka kaznenu prijavu protiv njega.
0:48:08,0:48:09,Ja više ništa ne čujem.
0:48:09,0:48:18,"Mislim, evo recimo kad govorimo primjerice Karlovačka županija je jedna od županija koja je najviše na udaru migranskog vala ilegalnih migranata, a sada i švercera migranata."
0:48:18,0:48:25,Ja to stalno pričam osim što smo najtajniji i mislim da Sisačko-moslovačka još ima tu pod navodnicima čast.
0:48:26,0:48:28,"Dakle, ljude zanima to."
0:48:29,0:48:35,"Možda nekoga recimo u Puli ili ne znam ili u Buzetu to previše ne zanima, ali."
0:48:35,0:49:17,"Pa evo ovih pet županija koja čine sedmu izbornu jedinicu u kojoj sam bio ja, a to su ratne županije koje su dijelom bile okupirane i ona je danas tim stampedom ilegalnih migranata ugrožena, DP je nekoliko puta svao dopise pa javno pozivao da se ne krše hrvatski zakoni što je najvažnije to se događa masovno i krše se cijeli niz hrvatskih zakona od Zakona o granicama državnim službenicima, čak su odvjetnici kada smo radili tu kaznenu prijavu izbrali dvadeset devet odredbi EU koje se također krše."
0:49:17,0:49:38,"Ali radi se o klasičnoj zamjeni stanovništva jer je poznato, to je zapravo bit, poznata je činjenica opet iz imigracijskih znanosti da doseljenici kada dođu na neki prostor oni se ne bune i ne ostvaruju svoja, rekli bismo politička, ljudska itede prava nego tek treći ili četvrti naraštaj se ohrabruje ili socijalizira na taj način da se počinje buniti."
0:49:38,0:50:06,"Prema tome, ova zamjena stanovništva je planirana da mladi kvalitetni ljudi koji bi sigurno tražili svoje mjesto u svom prostoru, životnom prostoru ako tako možemo reći u svojoj domovini, udaljavaju se, raspršuju diljem svijeta, tu se dovode ljudi koji su kulturološki sasvim različiti iz udaljenih dijelova svijeta i oni će tri četiri dana šta ja sigurno neće praviti probleme ovoj, evo kako bih ja rekao o velikoj islamskoj strukturi koja vlada Hrvatskoj."
0:50:06,0:50:15,"Što to znači da onda nekakav budući saziv Sabora i ona kvota nacionalnih manjina imat ćemo Nepalce, Filipince, možda i Hrvate?"
0:50:16,0:50:28,"Prema procjenama za deset godina ne Hrvati nego građani Hrvatske, ovi starosjedioci ajmo to tako reći, biti će u će biti umanjeni, a već su i rekli ste za desetak godina."
0:50:28,0:50:29,Za desetak godina koji je tempo?
0:50:30,0:50:50,"Postoje procjene demografa, tamo od prije dvadesetak godina, ja sam to baš u jednom članku naveo, koji su čak pesimistički predviđali ritam koji će se događati ovaj demografski slom Hrvatske, oni su toliko zakazali odnosno bili su premalo, bili su previše optimistični, a u trenutku kada su to donosili to je izgledalo da je to previše pesimizma."
0:50:51,0:50:59,"Međutim, pokazatelji dvadeset godina kasnije pokazuju da su oni zapravo dramatično podcijenili situaciju zamjene stanovništva u Hrvatskoj."
0:51:00,0:51:02,Koliko je to opasno za nacionalnu sigurnost?
