Start (HH:MM:SS),End (HH:MM:SS),Segment
0:51:03,0:52:44,"To je, dakle možete zamisliti kada, kako je, jel stanovnicima pogotovo ovog prostora, pa čak to već ima problema, Istra počinje imati problema jer to je prostor preko kojeg se također tutni nekontrolirano, dakle time se ruši nacionalno, dakle granica, granica je osnovno ili teritorij je osnovno obilježje jedne države i ponovo ću jer više puta sam to ponavljao pa moram i kod vas, bilo tko hrvatski državljanin ako samo metar izvan graničnog prijelaza pokušava prijeći granicu i pokaže dokument, on će svejedno biti prekršajno ili drugačije kažnjeno jer je pokušao to napraviti, a ovdje desetci tisuća u stampu preko takozvani zelene granice ilegalno prelaze granicu, sigurnosno ugrožavaju apsolutno Hrvatsku, poništavaju uopće smisao teritorija države, granice itede do toga da krše cijeli niz zakona i događa se cijeli niz paradoksa koji su i kod vas u emisiji, a i vaš suprug, ja sam s njim to dosta komunicirao, na kraju gospodin Ribić je također bio analisti u sedamoj izbornoj jedinici, ključni čovjek koji apsolutno sve zna, dakle događa se takva drama jer sigurnosna i drugo protupravnosti da se vrlo blago krijumčari kažnjavaju, a ovi koji su zapravo sudionici toga i na neki način organizatori i poticatelji, to znači migranti, dobivaju još sedam dana nekakav privremeni azil i ako ih neka država uhvati, a najčešće bježe prema zapadu i već se vraćaju u tisućama, mi smo dužni prihvatiti ih ili praćati po glavi dvadeset tisuća, dvadeset tisuća je u biti da i postati mogući, neki govore da bismo mogli postati oprostite i hotspot u budućnosti vrlo lako."
0:52:45,0:52:53,"U principu već na neki način jesmo, samo smo sada tekući hotspot međutim doći će trenutak kada će ti ljudi ostajati ovdje."
0:52:54,0:53:02,"Malo u tom odnosu prema ilegalnim migrantima, čini li se vama da hadeze i možemo imaju slične stavove?"
0:53:03,0:53:27,"Ne samo o tome nego na neki način ako gledamo stranke koje su ušle u Sabor po cijelom nizu stvari pogotovo ovih ključnih, to znači u odnosu prema esdeesesu, prema Istanbulskoj konvenciji, prema ovim ilegalnim migracijama, gotovo da nikakve razlike nema između Plenkovića i njegove strukture i možemo."
0:53:27,0:54:04,"Tako da ne treba isključiti ni tu najslabiju, apsurdnu mogućnost, samo je pitanje koliko je to moguće da li, hoće li njihovi strani gospodariti jer se radi o istim interesima i globalnim, hoće li im to dopustiti jer zapravo možemo je zapravo ovdje da bi zamijenio esdepe tako da proces destrukcije esdepea se također događao planski i zbog toga se ne događa koalicija između možemo esdepea koja bi donijela puno više glasova jednima i drugima jer možemo je tu da bi u ime ove globalističke agende zapravo preuzeo mjesto esdepea mi ćemo kao plakati za esdepeom sad će reći neki."
0:54:04,0:54:54,"Ja bih sad zanimao da u nizu analiza tko bi mogao s kime, imate deset i petnaest varijanti u medijima i zbrajaju, oduzimaju, tko čini sedamdeset šest nijedno se ne analizira ova rekao bih programski vrlo kompatibilna da kompatibilna dakle ova između možemo esdeesesa i hadezea koliko je to moguće po vama pa programski je to rekao bih realno ali zbog ove duže perspektive i uloge možemo jer taj model možemo ne postoji samo u hrvatskoj on je pratili smo i u srbiji bitku za Beograd, dakle to je jedan model koji se po metodologiji prepoznaje, dakle oni se ne tuku za prijevaru u Srbiji na izborima nego za prijevaru u Beograd jer bitno je preuzeti metropolu u glavni grad i onda po starom kolonijalnom modelu iz jednog punkta se onda u jednom dužnosti kapilarno širi, dakle ništa to nije novo."
0:54:55,0:54:59,Dakle zgodna mogućnost hadezea možemo i SDSS.
0:54:59,0:55:08,"Da, tada padaju maske jel na idućim izborima bi bilo potpuno obrnuto i ti ovi isto strani kolonizatori vrlo dobro znaju jer to je nešto što je u znanosti."
0:55:09,0:55:24,"Jesu li ti strani kolonizatori odnosno isti onda oni koji up upravljaju i jednom i drugom opcijom, evo naprimjer hadezeom mi možemo ili to mi sad samo ulazimo u nekakve teorije da ne kažemo urodno."
0:55:24,0:55:26,"Dakle, teorija interesa, ništa drugo."
0:55:27,0:55:30,"Rekli smo negdje na početku emisije, ali smo puno toga prošli."
0:55:30,0:55:50,"Dakle, ono što sam rekao o Sjedinjenim američkim državama, dakle prije dvadesetak godina u američkoj znanstvenoj literaturi, dakle činjenica da američka država, dakle njihove institucije ne služe građanima Sjedinjenih američkih država nego prvenstveno multinacionalnim kompanijama i iza kojih stoji koncentracija moći kapitala i svega ostalog."
0:55:50,0:56:17,"Prema tome, mijenjaju se ti identitet, dakle, mijenja se američki identitet na taj način, a onda možete misliti što se radi, radi se o interesima, iza toga stoji ta ideologija transhumanizma, iza koju omogućuje robotizacija, ne treba više toliko ljudi, radne snage, dakle to je toliko razrađeno teoretski, već robotizacija, to znači da se kaže da ne znam, da ja imam lošu ruku, samo će mi staviti drugu ruku, a vjerojatno u nekom trenutku i mozak."
0:56:17,0:56:25,"Dakle, toliko je daleko otišla prirodne znanosti ove biološke, medicinske, koje su u funkciji toga."
0:56:25,0:56:36,"Ali kažem to opično izgleda kao teorija zavjere, međutim to je teorija interesa i teorija jednog procesa globalističkoga kao novog totalitarizma koji se događa, koji ima institucije moći."
0:56:36,0:56:55,"Rekao sam i tu rečenicu da već mnoge institucije UN-a koja je najmoćnija svjetska organizacija koja je ustrojena upravo na načelu nacionalnih država, međutim pragmatično već služi ovoj novoj nekakvoj klasi recimo jel dosta neobrazovanih ali i moćnih ljudi koji zapravo urušavaju cijeli svijet."
0:56:56,0:56:59,Vratimo se malo na depe i onaj vaš program.
0:57:00,0:57:10,"Osim osim što želite osnažiti nacionalni identitet, prstom ste uprli i u medije, ne u sve, ali pa u dobar dio."
0:57:11,0:57:20,"E sad, trebaju li se mediji bojati mogućeg dolaska domovinskog pokreta na vlast ili u vlast ili ne znam, možda biste vi bili evo ministar kulture."
0:57:20,0:57:36,"Ne, ne o tome nema riječi, to je isto bilo zlorabljeno da se ovaj pokuša baciti jedna bombi sa jednom dužim razgovorom za erteo naravno gdje je rečeno da će to biti u emisiji gdje sam dosta toga kraće nego ovdje elaborirao pa onda u ustvu se pojavilo to neko pitanje."
0:57:37,0:57:39,"Ali da se ne bavimo drugima, mediji."
0:57:39,0:57:39,Mediji.
0:57:40,0:57:42,Hoće li biti mediji na udaru domovinskog pokreta?
0:57:42,0:58:25,"Mislim da ne bi bilo prvi puta ovaj, sjećate se dvije tisuće godine nije bilo domovinskog pokreta ali je bilo prije toga hadezea došao esdepe na vlast pa su se izvukli sto dvadeset i nešto novinarskih dosijeva dakle novinar uvijek smeta onome protiv koga piše a obično piše protiv vlasti pa mediji su vrlo važan instrument u suvremenom svijetu to znači cijelom dvadeset stoljeću i kad se radi o onome što zovemo hibridni rat oni su glavno sredstvo a to na jedan usporeniji način utemeljuju onda znanost kultura i sve ostalo i mediji su potpuno ne samo u Hrvatskoj, ali u Hrvatskoj najdramatičnije promijenili onu svoju temeljnu ulogu da budu nekakvi posrednici u razmjeni informacija, stabilizaciji društva i svega."
0:58:25,0:58:28,Oni uglavnom sada zastupaju ove protuhrvatske interese.
0:58:28,0:58:36,"Kada pogledam strukturu vlasništva u medijima u Hrvatskoj, dakle vrlo malo ćete naći i to rubno hrvatskih medija."
0:58:36,0:58:44,Dakle postoje mediji u Hrvatskoj koji dominiraju i koji zastupaju ovu globalističku ili velikosrbijatsku agendu.
0:58:45,0:58:58,"Tu i tamo se već u hrvatskim medijima pojavila ova struktura, tko kupuje elektroničke medije, tko je vlasnik portala itede tko je vlasnik određenih prava ovih za kabelske televizije itede To je dakle šokantno što se to događa u Hrvatskoj."
0:58:58,0:59:05,"To znači ne postoje hrvatski mediji u Hrvatskoj, a bez hrvatskih medija u Hrvatskoj nemoguće je zamisliti stabilnost."
0:59:06,0:59:14,Ali profesor ako su mediji na tržištu onda je to sasvim logično da onaj tko više da za nešto postane vlasnik.
0:59:15,0:59:35,"Tržište je potpuno u redu, međutim gledamo medije koje plaća Hrvatska država od haertea i to je isto tako u funkciji te agendije, ja imam puno prijatelja na haerteu dobar dio njih je sudjelovao u hrvatskom Domovinskom ratu, ja sam tim dijelom jedno vrijeme zapovijedao tako da znam te ljude i vrlo dobro znam što se događa."
0:59:35,0:59:47,"Nevjerojatan je strah na haerteu danas jer ima puno čestitih ljudi, ali slično kao što se događa u hadezeu određen egzistencijalni i drugačiji rekao psihološki i parapsihološki pritisak neutralizira te ljude."
0:59:48,0:59:57,"Radili smo jedan film, neću reći koji da se ne identificira, režiser sa haertea je pristao to režirati, ali se potpisao pod potpunim pseudonimom."
0:59:58,0:59:59,Čega se boje?
1:00:00,1:00:05,To je ovaj socijalno-psihološki mehanizam koji je jednim dijelom utemeljen na egzistencijalnom strahu.
1:00:06,1:00:09,"Dakle, ljudi žive u Zagrebu, nemaju krava, nemaju vrt, nemaju ništa."
1:00:09,1:00:18,"Ukoliko dobiju otkaz, naći će se na cesti, dakle, umirat će od vladi itede jer će morati ići pljačkati nekakva posluživanja i slično."
1:00:18,1:00:50,"Dakle, taj golemi pritisak je u povijesti našoj najbolje koristio komunizam kada je osamdeset posto stanovnika je bilo živilo na selu na prostoru jugoslavije pa tako i hrvatske ali su oni užurbano urbanizirali provodili lažnu neutemeljenu industrijalizaciju dovedu vas u grad pretvore u radničku klasu daju vam nekakvu gajbu najbolje reći u kojoj ćete živjeti ali ako nećete služiti i slušati, dakle razvijate te mehanizme autocenzure u strahu, dakle egzistencijalni strah je najstrašniji strah."
1:00:51,1:01:00,Hoćete li reći da zbog tog egzistencijalnog straha zapravo Hrvatsku koči napredak odnosno?
1:01:00,1:01:02,"Ne, to je jedan od elemenata."
1:01:04,1:01:16,"Znači taj egzistencijalni strah je kod po vama novinara, kod većine javnih službenika, s time da je isto tako mi još uvijek nismo prešli na tržišno gospodarstvo."
1:01:16,1:01:21,"To je ono možda najbolje što smo vidjeli u koroni, ti, ti, ti, ti, da."
1:01:21,1:01:22,"Tako ćete, tako ćete pisati."
1:01:23,1:01:51,"Možda je druga činjenica ova gospodarska, to znači još uvijek država je glavni gospodarstvenik, to znači puno privatnih tvrtki je vezano za poslove sa državom, dakle država je još uvijek vlasnik koji može upropastiti najuspješniju tvrtku, slopite ugovor, taj privatnik ne znam za neki infrastrukturni objekt, pa angažira još sto nekakvih drugih struka itede rovo kopača ne znam, do elektronike i svega ostaloga i svi to daju na kredit i onda vam država ne plaća."
1:01:51,1:02:01,"Ja znam cijeli niz slučajeva u proteklih nekoliko desetljeća ljudi koji su na taj način upropašteni, jedan država ne plaća, vi tužite državu, ali njezino je pravosuđe, ono vas zanemaruje i vi propadnete."
1:02:01,1:02:03,"Evo još malo mrvicu u medijima, molim vas."
1:02:04,1:02:08,"Ima li onda hrvatskih uopće medija, odnosno medija koji dišu hrvatski?"
1:02:08,1:02:21,"Pa evo ima, evo ovaj vaš podcast je ovaj kao i niz drugih podcasta ili ovih rubnih elektroničkih medija sa tim slovima je teže, uostalom one ionako više nisu bitne i sve su manje bitne."
1:02:23,1:02:28,Kako bi trebao medij koji diše hrvatski funkcionirati?
1:02:28,1:02:33,"Mislim, nema ljepšeg nego kad si sam svoj, jer obično onaj tko te plaća, on ti je gazda."
1:02:33,1:03:17,"Dobro, to je od haertea da se plaćalo, potpuno neutraliziran jel tu i tamo pred izbore puste neku tomsonomu pjesmu ili puste nekakav dokumentarni stari film, ako pogledate sve što se vrti, dakle ili se vrti iz razdoblja bivše Jugoslavije ili sa paradigmom da je drug Tito divan, krasan jel iako znanstvenici u Americi i Njemačkoj su dokazali da pripada među deset mega ubojica u cijeloj svjetskoj povijesti, dakle toliko toga se preveznog događa da je to teško napraviti, ali to je javni medij kojeg mi plaćamo, pretplatu plaćamo, to znači da financiramo nešto i onda ljudi gube živce i kažu nemojte gledati taj medij, ali ta ovisnost što vas više tuku, vi više trčite prema tome."
1:03:17,1:03:21,Hoćete li reći da su onda u jednom dijelu hrvatski mediji toksični?
1:03:22,1:03:52,"Apsolutno, dakle mediji nisu u funkciji stabilnosti, stabilnosti društva ne obavljaju svoju temeljnu medijsku, dakle posredničku ulogu, dakle da preko njih društvo ostvaruje koheziju, dakle putem informacija, dakle oni nisu objektivni i sve ono što piše u zakonima ili što je u standardima uopće medija, jer oni imaju potpuno obrnutu funkciju, oni su u funkciji određenih globalističkih najčešće interesa ili čak privatnih interesa koji su protivnim matičnim, u ovom slučaju protivnim su društvenim interesima."
1:03:54,1:04:26,"U tom tržištu, dakle poanta je u tome, dakle ako netko želi na taj način djelovati razorno na hrvatsko društvo, on to može obzirom na ljudska prava i sve ostalo, dakle u to se ne miješamo, ali sigurno je da javni mediji koji su onda opet povezani sa sustavom obrazovanja, znanosti i kulture, to je sve sinkronizirano i katedrala duha je li ovaj što smo pokušali je li ovaj tamo devedesettih iako je to bilo pogrešno zvati haerte dakle, najjači medijski servis kojeg mi plaćamo, ona se zapravo pretvorila u zloduha."
1:04:27,1:04:37,"Rekli ste da je Hrvatska odnosno u programu Domovinskog pokreta piše da je Hrvatska i danas predmet razno raznih tajnih akcija, pa onda u tom istom programu piše podsjećate i na akcije Labrador i opera."
1:04:38,1:04:45,"Iako sam ja to dobro iščitala i shvatila, zapravo naglašavate da je tako nešto danas moguće."
1:04:46,1:04:47,I da to ima svoju genetsku.
1:04:47,1:05:21,"Ja sam objavio knjige i sa dokumentima, to znači infiltracija Hrvatske od strane Velike Srbije počela je, da ne idem u daljnju prošlost, ali vrlo intenzivno od osamdeset sedam godine kada je na čelo srbije dovezen slobodan milošević da obavio ono što je obavio tada je za ministra uprave i pravosuđa u hrvatskoj a to znači cjelokupno kadriranje u hrvatskoj dovezen zloglasni vojni sudac koji je to obavio tako da danas pravosuđe je prema svim procjenama stručnjaka u Hrvatskoj i EU, dakle rak, rana hrvatske korupcijske hobotnice."
1:05:22,1:05:40,"Duga priča, ali to su procesi, pa onda druga činjenica koju sam isto javno govorio i dokumentirao, naravno da su tri najmoćnija čovjeka u SRH bila redom Špiljak, Stojičević, Račan, a svojoj trojci je bio šef kabineta Slavko Malobabić koji je razmjenio labradore."
1:05:41,1:06:08,"Ta skupina je brzo razmijenjena da se ne bi otkrila ostala cijela hobotnica o kojoj je vrlo uvjerljivo u Hagu svjedočio i Mustafa Čandić i general Zarević gdje za gdje zastrašujuće do kojih razmjera smo mi bili prije devedesette infiltrirani od takozvani kontraobavještajnih grupa, vrlo uvježbanih ljudi koji su tada raspoređivani u cijeli državni, društveni, medijski, obrazovni itede A tko kaže da nisu danas?"
1:06:09,1:06:10,"Pa ne, to vam hoću reći."
1:06:10,1:06:21,"Dakle oni su od tada pa do danas, dakle oni rade sinkronizirano, imaju svoj cilj i inače u strategiji ratovanja, dakle poznato da je najvažnije prije nego uđete u sukob, infiltrirati svoje ljude."
1:06:21,1:06:22,"Da, sve je jasno."
1:06:23,1:06:26,"A tada su imali dovoljno uvjeta, mogućnosti."
1:06:26,1:06:31,"Gdje su danas takvi po vašim informacijama najviše ušli, gdje su najviše infililtrirani?"
1:06:32,1:06:34,"U vlast, gospodarstvo, mediji."
1:06:35,1:06:36,Znači to su tri poluge.
1:06:36,1:06:39,"Da, to su tri poluge, ali isto tako kultura i znanost."
1:06:40,1:06:46,"U njoj, ja često to znam reći, nije ni vjetrić demokracije i hrvatstva zapuhao u odnosu na prethodnu paradigmu."
1:06:46,1:06:57,"Tako da je na jednoj osobi to se može najlakše prepoznati, a o njoj je čak teško kompromisantno govorio i predsjednik države Milanović, međutim on je i dalje moralna vertikala."
1:06:58,1:07:08,"To znači u vrijeme hrvatskog proljeća u kojem sam ja sudjelovao sa lijeve strane su bili mnogi moji kolege, časni, pošteni ljudi nisu htjeli svjedočiti protiv svojih kolega studenata."
1:07:08,1:07:17,Jedan jedini je ključni svjedok Žarko Puhovski i on je već tada postao moralni autoritet vrijednosti u Hrvatskoj i to je do današnjega dana.
1:07:17,1:07:34,"Usprkos tome što je i predsjednik države Milanović žestoko opravdan, dakle označio drukerom jel, a znamo što to znači jel, međutim on i dalje možete oporiti bilo koji medij tiskani ili slični, on i dalje arbitrira što bi trebalo, što je dobro za Hrvatsku i on je vrijednostni kriterij."
1:07:35,1:07:48,"Nije iznimka, dakle on je samo jedan karakterističan primjer koji svatko može prepoznati, a s druge strane kad vidimo da se taj status njegov ne može promijeniti čak ni nakon što jedna od najmoćnijih institucija, tojest predsjednik države javno kaže o tome, svi to ignoriraju."
1:07:49,1:07:52,Tu vidite koliko je razvrnata ta okupiranost Hrvatske u institucijskom smislu.
1:07:52,1:08:08,"Kad ste spomenuli predsjednika države, je li on, aha, predsjednik, kolega Andrzej Komljadović, iskusni, dakle negdje moja generacija, znamo se pedeset godina, on priprema knjigu, dakle zarobljena država, u tom smislu dakle bit će politologija."
1:08:08,1:08:09,"Dakle, zarobljeni smo."
1:08:09,1:08:21,"Što se dakle, iza svega dakle ovog što ja govorim stoje znanstvena znanja, ne moja nego dakle cijele znanstvene zajednice u Hrvatskoj, znanstvene zajednice ona koja se, dakle, koja se ne vidi."
1:08:21,1:08:23,Što je onda ostalo nezarobljeno?
1:08:24,1:08:25,Imali nešto što nije?
1:08:25,1:08:43,"Vrlo malo, evo Domovinski pokreti, rekao bih i to sam ja javno govorio i govorim i o stranci jer da sam u tu stranku prvi put u životu ušao, aktivan sam od hrvatskog proljeća, ali nikad nisam ušao, nisam bio u partiji ni u stranci što ne mora ništa značiti, ali sam silno društveno aktivan i vidjevši ovo sve što se događa odlučio sam da negdje moram ući."
1:08:43,1:08:48,Ušao sam zaista u jedinu stranku koja nije okupirana u ovom smislu.
1:08:48,1:08:51,Ako postane okupirana gdje je onda tu vaša budućnost?
1:08:52,1:08:55,"Pa to je sad, ja sam svoju dionicu odradio."
1:08:55,1:08:57,"Da, ne, ne, odradio."
1:08:57,1:09:30,"Pa to je čista savjest, mina savjesti ovaj i odakle ta jednoglasnost, jednoglasnost kad se radi o temeljnim pitanjima u depeu to znači ljudi su različiti, životi su različiti, raznih dobi itede ali kad se radi o ovakvoj ugrozi slično kao devedeset jedan dakle isključivo zajedništvo glave skupa znači hrvatska je sada ugrožena apsolutno ugroženije rekao bih nego devedeset jedan jer tada ste vidjeli tko puca na vas međutim sada se događa da na vas pucaju oni koji vam se čine kao vaši jer tu je zabluda sa biračima manipulacija i sl."
1:09:33,1:09:46,profesore spomenuli ste predsjednika države je li njegovo prekomjerno verbalno granatiranje ukralo esdepeu glasove je li ga bilo malo previše je li malo?
1:09:47,1:10:25,"Ne, evo po mom mišljenju, ovom stručnom kako se dakle hibridnog ratovanja, pa to sam i vodio u ratu i poslije dvadeset godina vodio centar u našem najjačem institutu, glede toga, pa to čak je, mislim u jednoj misiji gospodin Bauk naglasio pa kaže gledajte pa mi smo uoči izbora i prije nego se javio Mirandić imali četrnaest posto sada smo dobili četrdeset dva prema tome to je vrlo dobro odrađen posao za esdepe dobro pričali smo o svemu malo o hrvatskoj pa ste se malo dotakli globalizma povjesničar ste predajete zapravo noviju povijest."
1:10:25,1:11:09,"Sad kada bi vas netko pitao gdje je danas Hrvatska, gdje je danas Europa dvije tisuće dvadeset četiri godine i da najbolje opišete to kroz neku godinu iz naše bliske povijesti gdje bismo bili stalno nam prijete sa nekakvim ratovima sa širenjem sukoba ovim onim gdje bismo bili a da nismo na pravoj strani povijesti pa evo koja je godina ovako po vama dakle ne moje mišljenje nego znanstveni rado je o tome brojni postoje to znači europa je u dvadeset stoljeću potpuno kapitulirala do tada je ona bila središte svijeta to znači najmoćnije u političkom smislu u vojnom smislu u gospodarskom, kolonijalni gospodar cijelog ostaloga svijeta itede ona je danas rubni dio svijeta."
1:11:09,1:11:24,"Glavni slom se počeo događati nakon Prvog svjetskog rata kada su ratne pobjednice, to znači Europa, postale dužnik SAD-a i taj dug se danas sve više povećao i to se pretočilo ove globalističke multinacionalne kompanije."
1:11:24,1:11:34,"Nakon Drugog svjetskog rata Europa je zapadna, demokratska, sigurnosno ovisila o NATO-u koji je instrument SAD-a."
1:11:34,1:11:45,"Europa je danas kontinent koji u cijelosti izumire slično kao i Hrvatska, nema energetske i prirodne resurse koji bi mogli jamčiti neku samodrživost."
1:11:46,1:12:35,"Prema tome, to je ugrožen kontinent i gledajući u svjetskim razmjerima, rubni dio svijeta u bilo kojem političkom, vojnom, gospodarskom pa i razvojnom smislu, najzagađeniji dio svijeta itede Dakle, cijeli niz vrlo teških situacija koje zahtijevaju da Europa se ujedinje, međutim nažalost ovaj proces takozvani europske integracije se krajnje diskriminacijski odnosi nakon devedeset prema zemljama bivšeg komunističkoga svijeta i događa se ta destabilizacija da oni dakle da Dakle, ovaj dan ako krvi je organiziran na način jel da se iz tog prostora dakle, prave takve razvojne i drugačije sigurnosne razlike, da jednostavno ljudi sele i produžuju život u zapadnim državama."
1:12:35,1:12:55,"To znači još uvijek EU nije projekt koji gradi zajedničku Europu, da se to izbalansira, da budu slične plaće, da budu slični uvjeti nego se ta dramatičnost od devedesette godine na ovamo događa jel i s time da opet kažem iza toga stoje globalistički mehanizmi kojima središte nije u Europi."
1:12:55,1:13:21,"Ali da bi spasili Europu, da bi spasili Hrvatsku, puno toga se mora promijeniti, a ono što je dubinski najvažnije, znači taj sindrom kolonijalne metropole što je Europa bila barem petsto godina nakon Kolumba, da ne govorimo ranije, dakle i ta socijalnost i sve devijacije druge nažalost one danas dominiraju u Europi i ne događa se ta integracija u ovom pozitivnom smislu nego poče koga, dakle u onom socijalnom darvinizmu."
1:13:22,1:13:42,"Svi vidu da stvar ide u lošem smjeru i upravo štavaju svoje najbliže susjede da bi produžili svoj život, ali zapravo to je vrlo, vrlo jadno i ne može se suprotstaviti ovim na taj način ovim globalističkim, kad gledamo širu perspektivu, dakle ovim globalističkim vrlo stručno organiziranim i sintetiziranim interesima."
1:13:42,1:15:08,"Dvije tisuće dvadeset četiri je najsličnija kojoj godini iz dvadeset stoljeća pa možda bi evo prva asocijacija iako to možda neće biti ovaj teško je odabrati ali prvo što mi je palo na pamet to je prvi svjetski rat gdje dvadeset po nekim procjenama ima to se razlikuje to ovisi jel četrnaest ili osamnaest dakle kada ajmo gledati ljudske žrtve evo to mi se uvijek od nekako padne prvo na pamet dakle rat je završio sa dvadesetak milijuna mrtvih ali puno više mrtvih je umrlo od takozvani španjolske groznice koja se dogodila nakon toga pa nas ni to nije opametilo jer sad čujete, nakon Pa izvor nas je išao i drugi svjetski rat i svjetski ratovi su dakle ponikli u toj duhovnoj krizi koja se dogodila u Europi, najžešće su oštetili Europu i oni su glavni dakle čimbenik koji je tu višestoljetnu moć ove Europe kao uzora i svega ostaloga i moći dakle sasjekao do ovoga da smo danas dogurali da izumiremo i da u jednoj Švedskoj ljudi nemaju gdje su prije deset i petnaest godina još mogli četati po ulicama danas vojska kontrolira što se događa u Švedskoj i taj proces se slijeva prema jugu, prema nama i već na pola Njemačke imate slične probleme kao u Švedskoj, nas to čeka sigurno u ovih otprilike desetak godina ako se ne osvijestimo jer ne stavimo glave zajedno i ne dovedemo u upravu koja će nas moći štititi što je više moguće."
1:15:09,1:15:10,Dakle crno nam se piše.
1:15:11,1:15:14,Ne piše nam se crno odnosno crno nam se piše ako mi to odaberemo.
1:15:16,1:15:23,"Da zaključimo, DP je jedinstven, Hrvatska je zarubljena, treba je."
1:15:24,1:15:24,Točno.
1:15:26,1:15:26,Ok.
1:15:26,1:15:33,SDSS možemo i hadeze su vrlo kompatibilni zapravo po razmišljanjima odnosno u programskom smislu.
1:15:33,1:15:41,"Apsolutno se može iz svih medija iščitati javnog govora, dakle, čelnih osoba u tim strukturama, ajmo to tako reći, u tim strankama."
1:15:42,1:15:54,"I kad bismo mogli onda dobiti novu Vladu, odnosno kad bi smo mogli dobiti mogućeg mandatara, pa evo u ovom trenutku kad bi moglo biti sve dogovoreno."
1:15:54,1:16:29,"U ovom trenutku to je odgovornost na hadezeu dakle, DP kao čimbenik, svjesna je mogućnosti itede tako se potlopilo da naših trinaest zastupnika zapravo su ključni, mi se tu nismo postavili osobno, stranački, foteljaški itede nego isključivo programski ono što smo komunicirali od početka, nudimo i sada, sve je to spasno odnosno za Hrvatsku, dakle demografski slom je na prvom mjestu, ova je stampedo, evo mislim da vama ne moram ovdje objašnjavati što to znači, ali i za cijelu Hrvatsku što to znači."
