Start (HH:MM:SS),End (HH:MM:SS),Segment
0:31:30,0:31:49,"Dopunila ju je nakon, kad smo došli do svjedočenja Johna Đordana, dopunila ju je sa još nekim detaljima, tako da tužiteljica u Sarajevu ima nekakav polazni materijal i trebalo bi dakle."
0:31:49,0:31:53,početi raditi bar predistražne radnje pa da vidimo do čega možemo doći.
0:31:54,0:32:10,"Ja iz svog iskustva, budući da sam u službi dok sam radio, asistirao institucijama za provođenje zakona na nekoliko slučajeva ratnih zločina, znam da recimo mnogo dokaza postoji u ratnim arhivama."
0:32:12,0:32:23,"Svjedočenje moje može biti osporeno ili ti se dobro ne sećaš, prošlo je puno vremena ili ti možda i ti politiziraš nešto, hoćeš da optužiš neku stranu."
0:32:23,0:32:24,"Možda za nekog gradite, da."
0:32:26,0:32:30,To je jedan od vrlo interesantnih komentara.
0:32:31,0:32:42,"Kad sam objavio nekoliko kolumni u zadnje vrijeme i govorio za medije, onda oni komentari koji slijede iza toga su vrlo maštoviti."
0:32:42,0:32:44,Ja sam već sad agent.
0:32:45,0:32:48,"Ema i Siksa, Cije i Sismija."
0:32:48,0:32:53,I to su još tri dobre plate koje ja primam od njih da bih ovo sve radio.
0:32:55,0:32:58,"To mi je poznato, samo ću reći, to mi je poznato."
0:32:58,0:32:59,Za koga vi radite inače?
0:33:00,0:33:01,A za koga ne?
0:33:01,0:33:03,"Dobro, za koga ne?"
0:33:05,0:33:21,"Tako da taj nekakav javni aspekt je dosta, kako bih rekao, neozbiljan i ne bi trebao da ometa pravilno zaključivanje tužbaštva ni u Italiji, ni kod nas."
0:33:21,0:33:34,"A zašto, gospodine Subašiću, nije BIH tužiteljstvu zapravo prije bilo stalo do toga da unatoč kaznenoj prijavi koju je podnijela gradonačelnica otvori slučaj?"
0:33:36,0:33:37,"Pa vidite, to."
0:33:39,0:33:55,"Ne samo taj slučaj, postoje stotine slučajeva ratnih zločina koji se ne procesuiraju bez obzira na dokaze koji postoje u svakom tom predmetu, a istovremeno se procesuiraju onaj ovako vrlo minorni incidenti."
0:33:56,0:34:14,"I diže se pompa oko njih, znate ako je negdje nekom zarobljeniku palio šamar, tu ide suđenje pa se to razlači, a predmeti gdje je čitavo selo nestalo pa nemaš od koga DNK da uzmeš da identificiraš ljude, to stoji još u ladicama i to se ne procesuira."
0:34:14,0:34:23,"Ako to je jedna činjenica koja je uzrok ogorčenosti bosanske javnosti na rad pravosuđa, više na tužilaštvo nego na sud."
0:34:23,0:34:34,"To kada dođe do suda onda se uglavnom primjeni zakon, imate svjedoke, imate dokaze, ako je van razumne sumnje dobije se presuda, ako nema dovoljno dokaza to propadne."
0:34:35,0:34:39,Međutim tužilaštvo je to na kojem po mom mišljenju zapinje.
0:34:40,0:34:48,"Da vas pitam, koliko je po vama, po nekakvim vašim procjenama talijana okrvavilo ruke u Sarajevu?"
0:34:48,0:34:54,Koliko Oko kojeg brojca tih sunista bi se moglo raditi?
0:35:16,0:35:27,"Mislim da do tog egzaktnog podatka o tome nikad nećemo doći, najviše Italijana, jer je njima bilo najzgodnije takav jedan aranžman., uzeti i iskoristiti."
0:35:27,0:35:51,"Međutim, očigledno se radi o nekakvim krugovima, recimo, sotonističkim na taj način, koji su uključivali i državljane drugih zemalja, koji su bili o tome obavješteni, i nije im bilo možno doći iz Kanade, iz Amerike, iz Francuske, iz Velike Britanije u Italiju i krenuti na takav jedan safari."
0:35:54,0:35:57,Ecuador tvrdi da je to išlo svakog vikenda.
0:35:58,0:36:00,Ja mislim da je to trajalo najmanje dvije godine.
0:36:01,0:36:09,"Ali koliko vidim, on je u Milanskom tužilaštvu u prijavi naveo da je to tralo od 92."
0:36:09,0:36:10,do 96.
0:36:12,0:36:20,"Taj maksimalni period, meni malo izgleda možda nerealan, a ovaj period od dvije godine, o kojem ja govorim, je u nešto u čemu sam siguran."
0:36:21,0:36:26,"Dakle, dvije godine je sto vikenda po pet ljudi i sad vi možete reći."
0:36:27,0:36:35,"Međutim, ovo o čemu sad ja govorim je zaista kalkulacija, jer mi ne možemo znati je li baš svaki vikend dolazila grupa, je li ih baš bilo pet ili više."
0:36:36,0:36:42,"Tako da je taj broj, nećemo doći do njega, ali on je jedan morbidno velik."
0:36:44,0:36:50,Gdje onda dolazimo do zaključka koliko to ljudi sa takvim poreznim i motivima živi oko nas?
0:36:51,0:36:58,"I redovno su to bogati, utjecajni, obrazovani ljudi koji imaju svoje poruke, svoju djecu."
0:36:58,0:36:59,Elita.
0:36:59,0:37:00,"Elita, da."
0:37:00,0:37:01,Društvena elita.
0:37:02,0:37:05,"Spomenuli ste neke druge zemlje, Britaniju, Kanadu, SAD."
0:37:06,0:37:08,Podsjetite me koga ste još spomenuli?
0:37:11,0:37:12,Odakle su još dolazili?
0:37:13,0:37:21,"Je li njihov, da tako kažem, njihov građanski iđić gotovo istovjetan ovim talijanskim?"
0:37:25,0:37:28,"Ovako, sad ovo što govorim je iz druge ruke."
0:37:28,0:37:53,"Dakle, ja u svom poslu nisam došao do tih podataka, ali ovaj slovenački svjedok koji je imao priliku da ih vidi, on ih identificirao njihovo porijeklo, evo ovako sad kako smo rekli, bilo je Amerikanaca, Kanadčana, Britanija.aca, Francuza, najviše Italijana."
0:37:54,0:37:57,"Nije siguran za Nijemce, ali misli da je bilo i Nijemaca."
0:37:59,0:38:00,Je li bilo Rusa ili nekog drugog?
0:38:01,0:38:01,"Rusa, tako je."
0:38:03,0:38:03,Rusa.
0:38:06,0:38:09,Za njih mi nije jasno da li su morali ići preko Italije.
0:38:09,0:38:12,Oni su mogli direktno u Beograd stići.
0:38:13,0:38:20,Tako da ja ostajem pri tome da je u organizaciji morala učestovati srbijanska služba.
0:38:22,0:38:31,"Je li Sarajevo safari, odnosno je li se ovaj safari po vašemim informacijama odvijao samo u Sarajevu ili u još nekim gradovima Bosne i Hercegovine?"
0:38:32,0:38:40,"Prvo, gledajući istorijske ovaj fenomen, to se nije desilo prvi put u Sarajev."
0:38:40,0:38:52,"Jer istražujući ga, ja sam našao da se to dešavalo za vrijeme građanskog rata u Libanonu, zatim za vrijeme neokolonijalnih konflikta u Africi."
0:38:53,0:39:00,Danas možemo pretpostaviti da je Gaza idealno područje za ovako nešto.
0:39:01,0:39:05,Čak ima i nekih informacija da je safari u Gazi malo drugačije izgledao.
0:39:06,0:39:06,Ukrajina također.
0:39:07,0:39:15,"Dakle, svako ratno područje je idealno tlo za pse rata i za ovakve likove."
0:39:16,0:39:16,Bolesnike.
0:39:17,0:39:25,Pitala sam vas to iz jednostavnog razloga jer postoje neke informacije ili priče da je slično se odvijalo i na području Mostara.
0:39:28,0:39:38,"Da, na području Mostara se nešto slično odvijalo i to znam isključivo iz talijanske š štampe, koja je 95."
0:39:39,0:39:47,"pisala o safariju koji je išao preko Ankone, Splita i do Mostara."
0:39:47,0:39:51,"S te strane, prometno, najlogičnije i najlakše."
0:39:52,0:39:53,I najkraće.
0:39:53,0:39:54,Tako je priča.
0:39:54,0:39:58,Tako da ja vjerujem da je to vrlo moguće.
0:39:58,0:40:03,"Ako Italijani sami o sebi to pišu, nema razloga da mi osporavamo."
0:40:03,0:40:20,"Međutim, u Mostaru se ta tema također nije tratirala niti u medijima, niti pravosudno jer sad ovo o čemu mi govorimo, da se dešava u Milanu i Sarajevu, tiče se samo Sarajevo Safari."
0:40:20,0:40:29,"Ali koliko sam vidjela, postoje interesi iz drugih zemalja također da se priča o Sarajevo Safariu rasvijetli."
0:40:30,0:40:38,"Pa čak i u Sjedinjenim američkim državama, rekli ste mi da ovih dana kontaktirate i s mnogim drugima da nisu iz Italije."
0:40:39,0:40:43,"Smijemo li to znati, možete li to podijeliti, odnosno koliko možete podijeliti s nama?"
0:40:43,0:40:48,"Evo, mogu podijeliti, obzirom da sam već podijelio sa kolegama novinarima."
0:40:50,0:40:55,"Dakle, ako je nešto već snimljeno i otišlo u eter, nema razloga da sad ne govorimo o tome."
0:40:56,0:40:59,S tim što ću vam još nešto dodatno reći.
0:40:59,0:41:16,"Dakle, ja sam u cijeloj ovoj nesreći sretan što je ta jedna medijska euforija, eto da ne kažem kampanja, ovo nije organizirano, ali je zaista jedan novinarski nerv proradio da aktuelnu temu temeljito obradi."
0:41:18,0:41:46,"I kontakti sa većim brojem svjetskih agencija, vrlo utjecajnih, rezultirao je time da je u Americi jedna od kongresmenki Republikanske stranke tražila podatke o safariju sa pitanjem tko su američki državljani koji su sudjelovali u tome i zahtjevali da se to istraži i procesuira."
0:41:46,0:41:47,To je to.
0:41:49,0:41:56,"Osim Amerikanaca, sličan kontakt, vrlo ozbiljne institucije, sam imao iz Kanade."
0:41:56,0:42:01,"Dakle, jedna institucija iz Kanade koja je vrlo bliska premijeru i."
0:42:01,0:42:10,i ministru pravosuđa se interesirala za kanađane koji su sudjelovali u tome i traže elemente da i oni otvore istragu.
0:42:11,0:42:19,Kontaktirala me jedna advokatska učiteljica iz Francuske na informaciju o tome da je bilo i Francuza.
0:42:19,0:42:25,"Dakle, dajte nam podatke, neke početne, koji će biti dovoljni za otvaranje istrage u Francuskoj."
0:42:25,0:42:28,Imamo za to sve tri bitne zemlje.
0:42:29,0:42:30,Italija je četvrta.
0:42:33,0:42:37,Mislim da sam sinoć pročitao negdje da je Britanska.
0:42:37,0:42:40,je britansko pravosuđe primijetilo da se to ponaša.
0:42:40,0:42:44,"Znači, sada su samo primijetili da se to dešava u medijima."
0:42:44,0:42:53,"Ja sam imao prije tri, četiri dana intervju sa novinarom Daily Maila koji bi možda mogao nešto tamo pokrenuti."
0:42:53,0:43:07,I to bi bila već peta vrlo bitna zemlja koja želi raštiti i riješiti pitanje vlastnog smeća u aferi Sarajevo-safari.
0:43:08,0:43:14,"Tako da da nije bilo medija i da nije bilo ove kampanje, mislim da bi ta priča pala u zaborav."
0:43:17,0:43:38,"Sada u ovoj fazi ja sam bio malo i rezigniran ponašanjem bosanskog pravosuđa i nisam možda bio ni optimističan da će se išta desiti, da će se ikad išta više desiti, ali zasluge za ovu sad lavinu koja se dešava zaista pripadaju Veciglavaciji Nio Mila."
0:43:40,0:44:00,"Što bismo mogli, ako će sve biti slobodno za otkrivanje, što bismo još mogli otkriti ne samo oko talijanskih sudionika u U ovoj priči, nego i sudionika iz tih velikih zapadnih zemalja, u koje onako često gledamo kao prosvjetljeni zapad, fini zapad kojem tako jako stremimo."
0:44:01,0:44:05,Što bi nas možda moglo najviše sve skupa iznenaditi?
0:44:07,0:44:21,"Pa gledajte, reći ću vam jedan podatak o filmu Sarajevo-safari, koji je snimljen u Sarajevu, emitiran vrlo često u medijima u Sloveniji."
0:44:22,0:44:36,"I ja kad sam išao na festival u Portuto Rožu i u Ljubljani gdje je taj film također prikazan, vidio sam da tamo, da u Sloveniji postoji za Bosnu je to neobična kultura gledanja dokumentarnog filma u kinima."
0:44:36,0:44:57,"Dakle, taj film se vrtio jako dugo po slovenskim kinima, mediji koji su preuzeli i platili arsmedi da ga emitiraju, nekoliko ih je bilo u Sloveniji, međutim, ja ne vidim da je onda, ako je samo u Sloveniji da je ta gledanost nešto masivna."
0:44:57,0:45:01,"Mislim, njima hvala, zaista su mnogo uradili da se ovaj fenomen razotkrije."
0:45:01,0:45:08,i onda se desilo da taj film zapravo nakon toga nije prikazan negdje zapadnije u Sloveniji.
0:45:11,0:45:11,Zašto?
0:45:12,0:45:43,"Zato što otkriva jedno morbidno bolesno lice Zapada, a otkriva i dvostruki moral tih društava koje propagiraju demokraciju, propagiraju ljudske slobode i ljudska prava, a zatim guraju pod tepih takvu jednu stvar, dakle ne žele ni prikazati film koji kaže da došao je iz Francuske manijak da puca za pare po Bosare."
0:45:43,0:45:56,"Ni to ne želi prikazati jer bi se onda možda obavezali da to procesuiraju i što bi naravno narušilo njihovu vlastitu našminkanu sliku idealnih demokracija, idealnih modela života."
0:45:58,0:46:00,To je vrlo neobično i vidite nešto.
0:46:00,0:46:12,"Gledajući iz perspektive Bosne i Hercegovine koja je doživjela različite izdaje Zapada koje su nas koštale vrlo mnogo, to nas ne iznenađuje."
0:46:13,0:46:18,To je samo još jedan slučaj koji pokazuje odnos Zapada prema Bosni.
0:46:20,0:46:31,"Tako da bi ova afera, bude li opstala u medijima dovoljno dugo, mogla zapravo da razotkrije taj dvostruki moral Zapada."
0:46:32,0:46:43,"Jednu etiku koja važi samo za njih između sebe, ali ne važi za neke druge, za balkanske narode, za neke divljake, za obojene itd."
0:46:44,0:46:48,Ali vole oni docirati nama kako bismo se trebali ponašati.
0:46:48,0:46:59,"Pa, puni su lekcija, ali kad trebaju demonstrirati nešto onda to ne rade s nama nego nekako."
0:46:59,0:47:03,"To je rezervirano, ta demokracija i taj liberalizam samo za njih."
0:47:04,0:47:08,Recite mi gospodine Subašiću što kažu Sarajelije sad na sve to?
0:47:08,0:47:18,"Jesu li već da tako kažem zaboravili iako je te stvari, ratne stvari teško zaboraviti i to nema šanse da čovjek zaboravi, to jednostavno ti ostane."
0:47:20,0:47:26,Zanima li ih to ili su okupirani možda nekim drugim problemima danas dv 2025.
0:47:26,0:47:28,godine egzistencijalnim?
0:47:29,0:47:31,"Da, egzistencijalnim svakako."
0:47:32,0:47:41,"To je jedna stvar, a druga je da mi zapravo živimo jedan zamrznuti sukob, jedan rat koji nije završen ishodom, bilo kakvim."
0:47:42,0:47:53,I živimo u jednoj situaciji gdje je povremeno napetost tolika da se pitamo hoćemo li taj sukob sad otvoriti pa da ga dovrši.
0:47:54,0:48:05,"I onda dođe informacija o Sarajevu safariju, gdje vi kad sa sarajljanima pričate, jako ćete teško naći nekog da nije bio nabrnut snajperskom vatrom."
0:48:06,0:48:13,"Međutim, meni je bilo jako, a možda i iznenađujuće, kako su budno reagirali na film."
0:48:15,0:48:25,"I šta je suština bijesa, ljutnje nakon saznanja da su na njih pucali i lovci, ti safari?"
0:48:25,0:48:26,"Dakle, ovako kažu Sarajeli."
0:48:27,0:48:37,"Kaže, znamo mi od početka rata, od prvog dana rata, mi trpimo snajperiste i mi znamo šta žele."
0:48:37,0:48:51,"Dakle, imate taj projekat Velike Srbije, ovo je Bosna, oni neće da to bude Bosna, nek da bude Velika Srbija, mi to ne damo, onda oni zato nas hoće da nas pobiju pa da to riješe i mi znamo da su to oni sa tim ciljem."
0:48:51,0:49:01,"I to je jedan cilj koji koliko god da je ekstreman i moderan, razumijemo mi zašto se desio rat i zašto pucaju svi ti silni snajperisti na nas."
0:49:01,0:49:05,I onda dođu ljudi koji nas uopće ne mrze.
0:49:06,0:49:19,"Oni nisu ni na čijoj strani, osim što su na strani koja će ih dovesti na položaj da pucaju."
0:49:19,0:49:25,"Tu imam čak osjećaj da im je neko rekao, hajde vi sad u ovaj dio Sarajeva pa pucajte tamo, da bi on to platili pa da bi došli."
0:49:25,0:49:29,Njih uopće ne zanima zašto mi ratujemo.
0:49:30,0:49:48,"I onda kažu Sarelije, pa ako sam ja nekom politički neprijatelj, zar postoje ti nekakvi zapadnjaci koji me svode na nivo divljači, na nivo jelena, ne znam divlje svinje ili antilope koja je lovački profil?"
0:49:49,0:49:49,Da.
0:49:49,0:50:00,"Dakle, to jedno poniženje, jedna totalna dehumanizacija nas je zapravo bila uvredljiva i razlog vrlo budnih reakcija."
0:50:00,0:50:09,"Znate, kad se 30 godina nakon rata netko nervira i ljudi što je pucao snajper na njega, to zvuči pa mislim za ne sviše zaboravim."
0:50:10,0:50:23,"Ali sad kad mi kažeš da si me gađao snajperom jer će ti faliti taj trofej na zidu u lovačkoj tvojoj vikendici, onda je to zaista ako je nešto vam pameti."
0:50:24,0:50:33,"Kad govori Kad govorimo o tome, što je u njihovim glavama?"
0:50:33,0:50:44,"Znači, kožim kolokvijalno karik se pokušava opisati kao manijaci, luđaci, poremećene ličnosti."
0:50:46,0:50:49,"Mislim, ta su objašnjenja nedovoljna."
0:50:51,0:51:01,"Pišem o tome, ja sam nekoliko puta tražio pomoć neuropsihijatra, ali čak i kad smo snimali film, imali smo asistenciju jedne neuropsihijatre iz Afrike."
0:51:01,0:51:12,"Iz Sarajeva, koja nam, kao i svaki ljekar bez konkretnog pacijenta koji je pred njom, ne može da dokuči otprilike o čemu se zaista radi."
0:51:12,0:51:16,"U konačnici, puno je njih bilo."
0:51:17,0:51:28,Tako da jedno objašnjenje stručno jeste da se tu radilo o poremećaju ličnosti sa elementima sadizma kod svih.
0:51:28,0:51:33,To je najopćenitiji opis mentalnog poremećaja u kojem se radi.
0:51:34,0:51:37,A sad individualno iz kakvih su sredina oni došli.
0:51:37,0:51:37,iz.
0:51:39,0:51:44,Znate ona pitanja kod takvog tretmana?
0:51:45,0:51:54,"Kakvo je bilo djetinstvo, da li je bilo nasilja, da li si bio žrtva ili si bio svjedok nasilja, pa si odrasloj dobi to počeo ispoljavati?"
0:51:55,0:51:59,To je jako teško govoriti dok nemate nekog konkretnog.
0:51:59,0:52:07,"Kad budu imali nekog konkretnog, onda će vjerojatno njegov vještak da ga brani neuračunjivošću i ne znam jab li o čime tako."
0:52:08,0:52:28,"Mada kad čovjek zapravo razmišlja, danas kad ti gledaš kroz nišan na prsa djeteta i mrtav hladan, povučeš obarač jer eto te to na neki način ispunjava, niti jedno zlostavljanje u djetinstvu te tu bilo kakve vrste ne opravdava."
0:52:29,0:52:31,"Ali dobro, to je nekako moje razmišljanje."
0:52:31,0:52:36,"Zapravo, ono što sam vas htjela možda samo za kraj pitati."
0:52:36,0:52:44,"Objasnili ste sad kako se raj ili je dišu, objasnili ste kako vaša, kako mi to kažemo, pravna država isto funkcionira."
0:52:44,0:53:19,"Je li možda tragično to da će te situacije, te sarajevske žrtve, a sad najprije tu mislim i na te žrtve, te djece na koju smo svi osjetljivi, dobiti pravdu opet nekim zaobilaznim putem, znači eto, zahvaljujući talijanskom kolegi novinaru, njegovoj upornosti da se bavi tamo nekim, sad ću reći, sarajlijama, bosancima, balkancima, a da nikad nismo, a da nikad se te žrtve neće tu naplatiti upravo od onih koji bi trebali."
0:53:19,0:53:23,"Dakle, to je tužilaštvo, odnosno, pravna država Bosne i Hercegovine."
0:53:23,0:53:24,Je li to zastrašujuće?
0:53:27,0:53:32,"Pa vidite, mi smo već navikli na to da ne dobijamo pravnu satisfakciju domaćeg pravosuđa."
0:53:34,0:53:58,"I onda kad su izricane presude u Haagu ili presude protiv zločinaca iz Bosne u pravosuđima evropskih zemalja, recimo mislim da je Njemačka prvu presudu za genocid donijela i za ratne zločine, bilo ih je i drugdje, mi smo bili zahvalni što se ipak pravda negdje gdje je pojavila."
0:53:59,0:54:19,"Sad je slična reakcija i Etijog Vacinije je neko vrijeme bio heroj dana u Sarajevu, ja nisam, jer ja nisam natjerao bosansko pravosuđe ni na šta, niti gradonačelnica, ali kad se pojavilo to u Italiji, onda je reakcija bila hajde makar negdje."
0:54:20,0:54:28,"Sad kad se malo zakotrljalo i kod nas, onda se pojavila neka nada da će biti neke pravne satisfakcije, da će biti kažnjeni."
0:54:30,0:54:39,"Svi sigurno ne, većina sigurno ne, ali presuda bilo kome za tu vrstu zločina bila bi satisfakcija u smislu priznanja."
0:54:40,0:54:46,Jer mi imamo i 30 godina poslije rata negiranje da su se desili neki zločini.
0:54:46,0:54:55,"Kad sam ja pokušao istražiti na toj strani, koji je bio vodič po grbavici ljudima, to je zid šutnje."
0:54:56,0:55:06,"I sad, mislim, jednostavno, ako imate stranu koja negira genocid, kako ćete od njih očekivati da priznaju tako neke te pojedinačne zločine?"
0:55:07,0:55:15,To je možda najteži dio puta do pravde koji mi možemo ovdje očekivati.
0:55:16,0:55:18,"Međutim, ovo nešto se dešava."
0:55:19,0:55:34,Poziv republikanske kongresmenke da se istraže učesće Amerikanaca rezultiraju nakon dva dana sudskim pozivom mene da dođem svjedočiti o tužbaštu Bosne i Hercegovine.
0:55:34,0:55:42,"Tako da sve što se dešava u Bosni, nažalost skoro sve, mora da se desi na poticaj izvana."
0:55:44,0:55:46,Nije se dogodilo ako izvana netko nije.
0:55:47,0:55:47,"Jas, tako je."
0:55:48,0:55:52,"Nije se dogodilo dobro, a Bog meni zlo, ako nije bilo poticaja izvana, da tako."
0:55:53,0:55:54,Možemo to tako reći?
0:55:54,0:55:55,Mogli kratko.
0:55:55,0:55:58,Bosanska povijest je puna svega toga.
0:55:59,0:56:03,"Zadnje pitanje, bojite li se zbog svega što govorite?"
0:56:04,0:56:14,"Neki svjedoci tih zločina vjerojatno su dobrim dijelom još živi, neki počinitelji tih mogućih, ti mogući počinitelji su vjerojatno još uvijek živi."
0:56:14,0:56:18,Rekli ste sami mi na početku da se radi o moćnim ljudima.
0:56:20,0:56:37,"Pa vidite, što se tiče nekog straha uopće bavljenjem ovom temom i eventualne reakcije na moj rad sa druge strane, ja mislim da sam ja svoj strah potrošio za one četiri ratne godine."
0:56:38,0:56:56,"Nakon toga svi smo mi bili u poziciji da odlučimo hoćemo li se okrenuti i početi se baviti nekim drugim stvarima, pokušati sve zaboraviti i živjeti neki normalan život ili ćemo se nastaviti boriti sa stvarima koji su ostale neriješene."
0:56:56,0:57:09,"Dakle, ja moram reći da sam nakon te četiri ratne godine u vojnoj obaveštajnoj službi, ostao još 20 godina u toj službi, u oružanim snagama Bosne i Hercegovine i otprilike od 16."
0:57:09,0:57:11,sam ja u mirovini.
0:57:12,0:57:17,Čak i tih 20 godina bavio sam se nekim slučajima ratnih zločina.
0:57:17,0:57:26,"Kad sam otišao u mirovinu, onda kažu kao obaveštajac i sigurnjak nikad ne idu u penziju, jednom u službi, uvijek u službi."
0:57:26,0:57:31,"E sad, to su doskočice iz te branše."
0:57:31,0:57:35,"Međutim, deslo se zapravo da ja kroz pisanje."
0:57:37,0:57:50,"kojem sam se vratio nakon umirovljenja, sam se počeo jednako baviti analizom, analitikom i onda su me iz redakcija nekakvi zvali, hajde nam napiše analizu o ovome, o onome."
0:57:50,0:57:57,"Kao prije se radio analize samo u dva, tri primjerka šefu iz arhiva, kaže sad ću imati veliki tiraž, radi opet."
0:57:58,0:58:05,Tako da su otprilike vojno-političke analize i analize sigurnosnih nekih kriznih područja moja specijalnost.
0:58:06,0:58:07,"Čitam, vidjela sam."
0:58:08,0:58:11,"Imam reakcija nekih, onako."
0:58:12,0:58:12,Koje su?
0:58:13,0:58:23,"Zvuče agresivno, međutim, sve su to oni ratnici sa ta statura i nikakvih ja ozbiljnijih prijetnji nisam imao."
0:58:23,0:58:26,Čak i ja mislim da je gledat sceni u većem riziku.
0:58:27,0:58:27,Je li da?
0:58:28,0:58:28,Da.
0:58:30,0:58:32,To bih nekako rekla čak možda i ja.
0:58:33,0:58:38,"Gledala sam jedan njegov nedavni isto tako istup, nešto je bilo, no dobro."
0:58:39,0:58:46,"Što reći na kraju, gospodine Subašiću, hvala vam što ste odvojili vrijeme i podijelili ovo sve s nama."
0:58:47,0:58:48,Ja ću vama reći hvala vama.
0:58:49,0:59:12,"što ste mi dali prostor da govorim o tome i da svim kolegama novinarima i svim medijima, sugeriram da pokušaju ovu temu držati negdje ako ne baš svaki dan u vrhu, da je održe živom jer je očigledno da javni pritisak vrlo često bude ključan da se uradi nešto u institucijama."
0:59:13,0:59:38,"Dakle ako zaista želimo pravdu dobiti kroz neku efikasnu istragu i na kraju presudu, moramo joj pomoći, moramo joj dati krila i i dati joj podršku da sa nekim onim posljednjim pečatom na pravosnažnu presudu stavi tačku na slučaj i time da satisfakciju žrtvama."
0:59:38,0:59:40,Prilike moj motiv je to.
0:59:41,0:59:53,"E sad, naravno, ne može nitko sam, ali sad već vidim da u ovom slučaju, ni ga ma cijeni, ni ja, ni bilo tko se bavi, nismo sami, već je ovo euforija globalna."
0:59:54,1:00:00,"Ne znam zašto, palo mi je sad na pamet, eto, naš blaženik Stepinac je rekao kako Bog ne trpi one koji."
1:00:00,1:00:02,"i miruju, a rođeni su da se bore."
1:00:03,1:00:15,"Pa eto onda u tom kontekstu, bez obzira na vjeru, naciju, ona jedna ideja čovjeka i čovjekoljublja bi trebala u svima zapravo prevladati."
1:00:15,1:00:16,Bar se nadam da hoće.
1:00:17,1:00:22,"Ja se također nadam i čini se da se uklapamo tu, Maksimo."
1:00:23,1:00:27,"Da, rekoh, bez obzira na vjeru, naciju ili ne znam što."
1:00:28,1:00:28,Hvala vam najljepša.
1:00:29,1:00:32,Hvala vam.
