Start (HH:MM:SS),End (HH:MM:SS),Segment
0:00:21,0:00:37,"U podkastu Mrežnica danas pozdravljam umirovljenog obavještajca armije Bosne i Hercegovine, gospodina Edina Subašića, s kojim ćemo razgovarati o jednoj iznimno mučnoj temi vezanoj za rat u Bosni i Hercegovini, točnije za rat i opsadu Sararajeva."
0:00:38,0:00:49,To je Sarajevo Safari odnosno organizirani dolazci i pucanja na ljude u Sarajevu tijekom opsade tog grada.
0:00:50,0:00:56,"Prije svega gospodine Subašiću, lijepo vam pozdrav i hvala vam što ste se odazvali na moj poziv."
0:00:58,0:01:02,"Hvala vam na pozivu, lijep pozdrav vama i vašim pratiteljima."
0:01:04,0:01:19,"Prije tri godine snimljen je dokumentarac Sarajevo Safari, autor je Slovenac Miran Zupanić i to je bio zapravo jedan početak da tako kažemo možda za nas koji smo manje znali početak priče o svemu što se u Sarajevu događalo."
0:01:19,0:01:46,"No s obzirom na vaš posao obavještajca, dakle analitičara u vojsci, u armiji Bosne, odnosno u armiji Bosne i Hercegovine, kada ste se vi prvi put susreli s informacijom da postoje takvi ljudi koji bi dolazili u Sarajevu preko vikenda i pucali zapravo na Sarajlje iz objesti hobija za novce?"
0:01:48,0:02:00,"Da, dobro ste rekli, Sarajevo Safari prije tri godine, koji je imao svoju premijeru i to baš u Sarajevu, je ovaj fenomen razotkrio malo šire javnosti."
0:02:01,0:02:04,Prvi pokušaj razotkrivanja fenomena desio se 1995.
0:02:04,0:02:14,"kad je talijanska štampa objavila nešto o safari lovcima u Sarajevu, a ja sam prvi puta čuo za to u 1993."
0:02:14,0:02:24,"godine, radeći redovan posao u analitici vojne obavještajne službe, gdje je meni na stolu došao jedan izvještaj o saslušanju."
0:02:25,0:02:35,"Zarobljenog pripadnika Srpske radikalne stranke, jednog dobrovoljnika iz Srbije, koji je također bio vikendulovac u Sarajevu."
0:02:35,0:02:52,"To je bila vrlo česta pojava i vikendi su za nas u Sarajevu bili najteži dani jer su tada dolazili i dobrovoljci i plaćenici, a evo sada znamo i safari lovci na rub odbrane Sarajeva i pucali na grad."
0:02:52,0:03:02,"Vikendi su bili dani najintenzivnije snajperske vatre i poslije nekog vremena, evo sada nam je već i jasno zašto je to tako bilo."
0:03:03,0:03:18,"Dakle, taj izvještaj u saslušanju sadržavao je jedan detalj koji je privukao pažnju, zato što se radilo o jednoj sasvim novoj vrsti snajperista koju mi evidentiramo i prepoznajemo na ratištu."
0:03:19,0:03:23,"Dakle, dotad je snajperska vatra bila poznata, gotovo svakodnevna."
0:03:24,0:03:46,"Mi smo znali da na građane pucaju redovne vojnici Vojske Republike Srpske, zatim plaćenici, vrlo često stranci iz Rusije, Rumunije, Grčke, Ukrajine, a zatim i dobrovoljci koje su okupljale radikalne stranke po Srbiji i dovodile ih vikendom da ovdje ratoju za neku dnevnicu i za ratni prije."
0:03:48,0:04:05,U informaciji o kojoj govorim stajala je jedan opis snajperista koji je dao taj zarobljenik i koji je zapravo tri puta pomenuo da se radi o državljanima Italije koje dotad nismo vidjeli ovdje.
0:04:06,0:04:12,I jedan najmračniji detalj za koji nismo odmah mogli da povjerimo da je točan.
0:04:12,0:04:34,"Naime, na pitanje tog dobrovoljca iz Srbije koliko će Talijani dobiti dnevnice i naknadne za vikend ratovanje, oni su odgovorili da ne, neće oni dobiti, nego su oni već platili da dođu u Sarajevo i da pucaju na civile, na ljude, kao da su u lovu na safari."
0:04:35,0:04:44,"Dakle, to je bila jedna šokantna informacija koju ne možeš odmah da poveruješ i kao i svaka sumnjiva informacija podleže provjeri."
0:04:45,0:04:48,Od dodatnog ispitivanja njega nije bilo nikakve koristi jer je on.
0:04:48,0:05:03,"on zapravo dan ranije došao iz Srbije u Sarajevo za Luta, tako je i zarobljen i ništa on u stvari nije mogao više reći, ali smo mi mogli uspostaviti vezu sa obavještajcima u sastavu Umprofora."
0:05:04,0:05:28,"Obzirom da je on pominjao Talijane, da je njih pet bilo, upisao ih je kao ljude u srednjim godinama, u nekim četrdesetim godinama, dobro obučene, dobro opremljene sa netipičnim oružjem, dakle ne vojničkim nego lovačkim, sve su to bili elementi za provjeru kod italijanskih obavištajaca u Umprofor."
0:05:29,0:05:36,Njima smo prezentirali podatke i tražili od njih da provjere da li je to točno obzirom da imamo informaciju da dolaze iz Milana.
0:05:37,0:05:40,Neka to provjere oni jer problem očito počinje tamo.
0:05:42,0:05:44,To je bio kraj 1993.
0:05:45,0:05:47,"godine, dosta teška ratna godina."
0:05:47,0:05:52,Čekali smo 4-5 mjeseci na taj odgovor i dobili ga negdje u proljeće 1994.
0:05:52,0:06:16,"Mislim, sad je jako teško se sjetiti datuma, ali bio je to prijelaz marta, april, sjećam se tog perioda po nekim drugim dat događajima, to je bio otprilike onaj period kad je Washingtonski sporazum potpisan, kad je taj bošnjačko-hrvatski sukob završen, poklopilo se sa informacijom koju smo dobili iz Italije, koja je vrlo bila kratka."
0:06:17,0:06:24,"Inače su informacije u obavištajnoj razmjeri kratke i jasne, svedene na neophodne detalje."
0:06:24,0:06:29,"Dakle, da, pronašli smo mjesto gdje se to organizira u Italiji."
0:06:30,0:06:35,Italijanske službe domaće su neutralizirale to mjesto i to se više neće događati.
0:06:36,0:06:47,"Dakle, ako sam do tada isumljao u iskaz zarobljenika, tad više nisam imao razloga da sumnjam jer je jednostavno odgovor Sismija da je to tamo postojelo i da je riješeno."
0:06:48,0:07:07,"Potvrdio je njegov iskaz koliko god on bio kratak, bez puno detalja, potvrđeno je da je taj fenomen postojao i na temelju njihovog odgovora, kao trebalo bi to značiti da se to do kraja rata neće dešavati."
0:07:07,0:07:19,"Mi zaista nismo dobili informaciju da se to ponavljalo, nikakvu indiciju da dolaze i dalje lovci da na taj način i s tim motivom pucaju po građanima."
0:07:20,0:07:25,Što naravno ne mora značiti da se to nije dešavalo negdje drugdje i možda bolje i prikriveno.
0:07:27,0:07:33,"Kad kažete, znači Talijani su to po dobivanju informacije zapravo prerezali, je li tako?"
0:07:33,0:07:34,Tako je.
0:07:35,0:07:39,Koliko je Talijana bilo prema onome što vi znate u igri?
0:07:39,0:07:40,Tko su ti ljudi?
0:07:40,0:07:44,"Rekli ste ljudi u srednjim godinama, pretpostavljam i mučniji."
0:07:45,0:07:48,Danas vjerojatno imaju 70-80 godina.
0:07:52,0:07:57,"I možda je još bolje pitanje, zašto je to samo stavljeno pod tepih?"
0:07:57,0:08:07,"Znam da je posao obavještajnih službi da to drže pod tepihom, ali ipak je riječ o nečem stravičnom."
0:08:08,0:08:14,"Nečem stravičnom, morbidnom i što ne ide uz taktike i motive i oblike rata."
0:08:14,0:08:15,Točno.
0:08:17,0:08:24,"Vidite, nakon filma se zapravo počelo ponešto odnotavati, to je puno godina nakon tih događaja."
0:08:24,0:08:33,"Međutim, tad već na osnovu te šture informacije u analitici se razrađuju različiti scenariji tko bi to mogao biti."
0:08:34,0:08:40,"Dakle, doći iz, evo recimo iz Milana, pa smo onda saznali da je to i preko Trsta."
0:08:41,0:09:01,"U to vrijeme letovi su bili, legalni letovi preko Srbije su bili zabranjeni, pa se vjerojatno išlo preko Mađarske, a zatim kopnenim putem preko Srbije, prijeći granicu sa Bosnom, pa onda proći kroz ratnu zonu i doći u Sarajevo koje je bilo svakodnevno izloženo."
0:09:02,0:09:02,vatri.
0:09:02,0:09:13,"Dakle, to je jedna vrlo komplicirana operacija i zahtjevna i traži dobru organizaciju grupe koja ima autoritet u svim fazama."
0:09:13,0:09:30,"Dakle, i prihvatiti njih iz Italije, prihvatiti ih negdje na mađarsko-srbijanskoj granici, okupiti ih u Beogradu i dovesti ih u Sarajevo kroz sve checkpointe koji postoje u sputi, kroz linije fronta koje su krivudave, koje su se mijenjale svaki dan."
0:09:31,0:09:36,"Dakle, slijedi zaključak da je u tome, u organizaciji, morala učestovati."
0:09:38,0:09:41,Vrlo autoritativna služba iz Srbije.
0:09:42,0:09:52,"Po našoj pretpostavci, takav kapacitet za takav poduhvat imala je jedino služba državne nezbijednosti Srbije, a na području Bosne i Hercegovine vojne snage Ratka Mladić."
0:09:52,0:10:01,Oni su jedini imali autoritet da strance provedu i da ih neumjetno uvedu na linije na Grbavici.
0:10:02,0:10:19,Grbavica je okupirani dio Sarajeva oko stadiona željezničara koji je bio uklinjen u slobodni dio grada i tu su linije razgraničenja između agresorskih i obrambenih snaga se nekad svodile na manje od 50 metara.
0:10:21,0:10:45,"Dakle, zaključak je bio, tko je u organizaciji, tko je u Italiji njih okupio, organizirao, to ćemo sad prepustiti tužitelju iz Milana, Alessandru Bubisu i Eciju Gavaceniju, talijanskom publicisti, novinaru i književniku koji je zapravo sad pokrenuo taj slučaj i postigao da se on otvori zvanično u italijanskom pravosuđu."
0:10:46,0:10:51,Drugi zaključak koji ističe iz čitavog Turisti će iz činjenice da su oni plaćali da dođu.
0:10:52,0:11:00,"Dakle, to je bio jedan, teško je reći turistički aranžman, ali oni su ga očigledno tako shvatili."
0:11:01,0:11:11,"Da su oni plaćali velike sume novca, zaključak je da su to ljudi iz društvene elite Italije i to ne samo Italije nego iz drugih zemalja koji su dolazili."
0:11:11,0:11:25,"Sad kad se pomenju cifre u kojoj ja nisam siguran, zaista nemam ni jednu potvrdu koliko je poplatio, možda je to bilo i različito, od 90.000 dolara do 100.000."
0:11:25,0:11:27,sto tisuća eura u tadašnjim valutama.
0:11:27,0:11:48,"Dakle, platiti toliko za dva dana vikenda safarije u Sarajevu sa pravom da se ubije neko u Sarajevu, mogli su samo vrlo imučni ljudi koji su već ostvareni, koji su već samim tim i utjecajni u svojim sredinama i onda dolazimo do odgovora na pitanje zašto to dosad nije procesuirano."
0:11:48,0:12:01,"Dakle, oni su u to doba bili vrlo bogati, moćni na neki od njih i na pozicijama u svojim zemljama gdje su mogli zataškati bilo kakvu istragu i staviti to pod tek, kako bi vi kažete."
0:12:02,0:12:04,To su neki zaključci o tome o kome se radi.
0:12:05,0:12:08,"E sad, film je izašao 22."
0:12:10,0:12:15,gdje su se meni nakon toga javili nekoliko kolega sa detaljima koji su oni znali.
0:12:16,0:12:17,"Vidite, dok sam radio 93."
0:12:17,0:12:18,i 94.
0:12:18,0:12:27,"na tom slučaju, po principu nituno zna ko treba da zna i zna koliko mu je potrebno za posao."
0:12:28,0:12:37,"Dakle, nekoliko mojih kolega koji su sa mnom svakodnevno bili, pojma nisu imali o tome jer mi je bila obaveza da čuvam detalje, ali su se javili."
0:12:37,0:12:37,sada.
0:12:38,0:13:09,"Javio se kolega koji zna za zarobljavanje, javio se jedan drugi koji zna nekoliko detalja o tome tko su ti ljudi profesionalno, koji je to društveni tip ljudi na kojim su pozicijama u svojim zemljama i uvijek je to bio top nivo koji je omogućavao i ekonomski, a i utjecajem da tako nešto sebi priuštite."
0:13:10,0:13:13,Što su vam rekli ti vaši kolege koji su se sad počeli javljati.
0:13:14,0:13:17,"Znači, sad se nekakva slagalica slaže, nadopunjuje."
0:13:19,0:13:32,"E sad, ja bih rado govorio o tome, međutim, ja se od prije dva, tri dana nalazim u jednoj specifičnoj situaciji gdje ću morati puno detalja koji bi zanimali ljude, morati zadržati sad za sebe."
0:13:34,0:13:54,"Naime, ono što se meni svidjelo u cijeloj ovoj kampanji, što je pozitivno i što opravdava epitet medija kao sedme sile, desilo se da osim što je u Italiji otvorena istraga da se nešto pomaklo i u pravosuđu Bosne i Hercegovine."
0:13:54,0:14:13,"Ja sam kontaktiran iz pravosuđa Bosne i Hercegovine, mislim da ću narednih dana se morati u potpunosti staviti njima na raspolaganje, što ja zapravo tražim već tri godine, ali je bio potreban globalni medijski pritisak da se to desi i da neko iz fioke neke izvuče taj predmet."
0:14:14,0:14:33,"Gospodine Subašiću, da se malo vratimo na ovu, dakle, meni jednu definitivno najodvratnijih tema o kojima razgovaram, dakle, to su ta ubojstva i cjenici, rekli ste do sto tisuća današnjih eura, je li tako se penjala cijena za vikend safari za ubijanje po Sarajevu."
0:14:34,0:14:42,"Mnogi ljudi danas smatraju majot pa tko bi to radio, ali vidimo da se očito prema nekim informacijama radilo."
0:14:42,0:14:43,Kako je to izgledalo?
0:14:44,0:14:44,Kako je izgledao put?
0:14:45,0:15:00,"Znači ovo što ste malo rekli iz Italije preko Trsta, pa vjerojatno Mađarska, pa Beograd, pa Sarajevo, rekli ste o profilu ljudi, što onda bi oni dolazili u Sarajevo, smijete li to zapravo malo podijeliti s nama?"
0:15:00,0:15:07,"Kako su ti njihovi zločinački dani, ti zločinački sotonski vikendi zapravo izgledali?"
0:15:09,0:15:17,"Vidite, sad je otprilike izgrađen, odnosno rekonstruiran taj model aranžmana."
0:15:18,0:15:33,"Radilo se o tome da su oni živjeli svoj normalni život do petka, do kraja radnog vremena i da je već prijehodno bila dogovorena organizacija putovanja gdje su oni kretali u petak popodne na večer na put iz Italije."
0:15:33,0:15:43,"Sad ste već pomenuli rutu preko Mađarskearske do Beograda i recimo da se put završavao u petak navečer u Beograd, okupljanjem."
0:15:44,0:16:08,"Išao je transfer u toku noći kroz Srbiju do granice Bosne i Hercegovine, tu se prelazilo, znamo da je istočna Bosna u to vrijeme bila pod okupacijom i da je bilo njima vrlo lako prijeći granicu gdje bi ih prihvatale mladečive snage bosanskih Srba i vozile do Sarajeve."
0:16:09,0:16:13,"U Sarajevu su oni, prva stanica je bila na palama."
0:16:14,0:16:31,"Pale su, bila je ratna predsjednica agresora gdje su oni izlazili i tad su lokalnim prijevozom dolazili do Sarajeva, to je nekih 15 km, i ulazili najčešće u solitere na Grbavici."
0:16:33,0:16:44,"I to u nekoliko solitera koji imaju po 18-20 pratova gdje je sa vrha, sa stanova iz najviših etaža, Sarajevo bilo kao na vlaku."
0:16:44,0:16:47,"Dakle, oni su subotu provodili tu i."
0:16:49,0:17:04,"To je bio vrhunac i cilj njihovog putovanja, njihovog safarija, gdje su ih na položaj uvodili lokalni vojnici koji su tu svakako službom ali bili na položaju."
0:17:05,0:17:14,"Nakon što bi pogodili koga su htjeli i šta su platili, vraćali su se u toku nedelje nazad i u ponedjeljak su bili na svom redu."
0:17:17,0:18:02,"Kad kažete pogodili bi kog su htjeli, našla sam podatak zapravo da je od devedeset dva do devedeset pet ubijeno tijekom opsade više od jedanaest tisuća ljudi od toga jedna tisuća šesto djece posebno su djeca odnosno životi malih bili na cijeni dakle ako kažemo da su civili u svakom ratu nepotrebne žrtve a djeca i žene posebno onda dobijamo dimenziju monstruoznosti tog zločina koji su oni činili mislim malo je teško govoriti o tome da je postojao cijenovnik."
0:18:03,0:18:09,"Znamo da u legalnom, normalnom sportskom lovu postoji cijenovnik kad se ide u lov."
0:18:11,0:18:16,"Ima cijena za medvjeda, za slona, za tigra, za jelena, jel tako."
0:18:16,0:18:29,Oni su na sličan način spostavili cijenovnik ako želi lovac da ubije civila ili vojnika ili ženu ili dijete.
0:18:29,0:18:37,"Dakle, neko je postavio taj cijenovnik koji možda sad, da govorimo o ciframa, nije ni toliko."
0:18:37,0:18:50,"bitno, već to postojanje crnonika i takvog nekog gradkovanja je dovoljno bitno da vidimo tu psihološku, nemoralnu dimenziju čitave te afere."
0:18:50,0:18:57,"Da, postojao je crnonik, svi su oni htjeli da imaju trofej prema svom afinitetu."
0:18:58,0:19:11,"Mislim, ja se i ružno osjećam da tako govorim o tome, međutim, toliko mi je ružnih činjenica za sve ove godine prošlo kroz luke da jednostavno se njima moramo baviti ako hoćemo imati neki pravni epilog."
0:19:12,0:19:12,Jeste li.
0:19:13,0:19:20,Razgovarali s nekim od obitelji žrtava tih safari zločinaca?
0:19:22,0:19:29,Ja sam imao priliku razgovarati sa bračnim parom koji je izgubio dijete i koji se pojavljuju u filmu.
0:19:30,0:19:46,"Dakle, to je jedna sudbina, čudna, da je majka tog djeteta zapravo početkom rata otišla iz Sarajeva, a zatim se vratila u Sarajevo u sred rata sa djetetom od godinu dana."
0:19:47,0:19:48,Gdje su oni nakon prošlovanog?
0:19:48,0:19:54,"Ošladjenog prvog rođendana, te djevojčice izašle da prošetaju jer je bio miran dan, kako se kaže."
0:19:56,0:19:59,"I snajperista je pogodio djevojčicu, a nije maj."
0:20:03,0:20:07,Ne možemo tvrditi koja od žrtava snajpera je žrtva safari lovca.
0:20:07,0:20:16,"To je jako teško ustanoviti jer je na Sarajelu pucala su četiri tipa lovca, od četiri tipa snajperista koje sam malo prije pomenuo."
0:20:16,0:20:20,"I da vam pravu kažem, s Sarajelima je svejedno ko od njih puca."
0:20:20,0:20:35,"Znači, oni su morali trčati, biti brži i na neki način natjerati, privijeti ili se sklanjati, ili neki su čak se prepuštali sudbini, pa ako me pogodi, pogodi, ako ne ništa prođu."
0:20:35,0:20:47,"Tako da, eto, u tim danima mi smo željeli i voljeli onu sarajsku bust u Marlu da bude loša vidljivost, pa da možemo slobodno proći s jednog kraja grada na drugi."
0:20:49,0:20:59,Ja sam upoznao njih i upoznao sam još nekoliko preživjeli žrtava snajperskog pucnja koji su bili ranjeni.
0:21:00,0:21:14,"Mislim, i sam sam bio izložen najmanje tri puta snajperskom napadu, dva puta sam dobio metak u automobil kojim sam se kretao, jednom metak metar ispred mene, znači nije dobro izračunano, snajperista."
0:21:15,0:21:22,"Tako da u Sarajevu svi smo mi bili gađani, a mnogo njih je nažalost bilo i povučeni."
0:21:23,0:21:38,"Dakle, kad ste spomenuli taj bračni par s tom djevojčicom o kojem i govori, oni se ispominju u ovom filmu Sarajevo Safari, pozvat ćemo ljude da pogledaju film koji ne može nikoga ostaviti ravnodušnim, nikog normalnog."
0:21:39,0:21:40,Tragična sudbina.
0:21:42,0:21:55,"No u svemu ovome postoji i informacija o jednom slovenskom državljaninu koji zapravo zna puno više o cijeloj ovoj priči, a čiji je identitet za sad skriven koliko sam shvatila."
0:21:56,0:22:02,"Možete li vi malo više objasniti, ne morate odavati identitet, nego o čemu je riječ?"
0:22:04,0:22:13,"Evo kažem, ja ni danas ne znam stvarni identitet, iako sam ga sreo, iako sam ga poslije premijere filma sam ga sreo.."
0:22:15,0:22:40,"Radi se o čovjeku koji je u to doba bio vezan za, kao što sam kaže, jednu od američkih obaveštajnih službi i koji se sticajem okolnosti, baveći se obaveštajnim poslom na području Bosne i Hercegovine, bio svjedok tih safari, seansi na Grbavici i to više puta."
0:22:41,0:22:48,"U jednom razgovoru s njim on je meni rekao da se malo čudi da je kao svjedok svega toga da je preživio, da su ga ostavili na životu."
0:22:49,0:22:56,I on je nakon puno godina odlučio da progovori u filmu Sarajevo.
0:22:57,0:23:12,"Njega je zapravo pronašao producent filma Franciz Izajac, čuo od njega tu nevjerojatnu priču koju režiser Miren Ceponić u prvom momentu nije htio povjerovati kao neku moguću."
0:23:13,0:23:16,Sravim razumom je teško prihvatiti da se tako nešto deša.
0:23:17,0:23:25,"Međutim, Franciz je bio uporan, došao je u Sarajevo, tražio je nekoga još koji je o tome, naravno sa one strane počinilaca."
0:23:25,0:23:30,"i savčasnika je jako teško naći, nikad nije uspio naći nikoga, odnosno jeste, otkrit ću vam jedan detalj."
0:23:32,0:23:41,"U Sarajevu je našao mene, pa s ticajem okolnosti dugo je u novinarskim krugovima tražio tko bi nešto o tome znao i tako je došao do mene."
0:23:41,0:24:01,"Ja sam se naime i prije rata bavio novinarstvom i nakon umirovljenja, oponoo sam, imam svoju kolumnu na portalu Radio Sarajevo, došao je do mene i onda se sklopila priča moja, ovu koju sam vam ispričao iz službe i priča tog Slovenca koji je sve to vidio s druge strane."
0:24:01,0:24:09,"Dakle, obzirom da se mi nismo poznavali, da mi nismo mogli uskladiti priče, to je dalo jednu vjerodostojnost svemu tome."
0:24:09,0:24:14,"Pa, je Mirror Zupanic odlučio da snimi taj film koji je 1922."
0:24:16,0:24:17,sve to razotkriva.
0:24:18,0:24:27,"Sada, šta će se dešavati u ovom pravnom dijelu tretmana ovog fenomena?"
0:24:28,0:24:33,"Jaz to ne znam, međutim, mislim da će taj Slovenac biti jedan od pitnih svjedoka."
0:24:36,0:24:37,Ali o Sarajevu.
0:24:37,0:24:43,"safariju se govorilo i u Haškoj sudnici, od strane jednog američkog državljanina, je li tako?"
0:24:45,0:25:04,"U Haškoj sudnici na suđenju dvojici generala, Dragomiru Miloševiću i generalu Galiću, oni su za te četiri godine obsade smjenjivali su jedan drugog, bili su komandanti snaga koje su držale Sarajev u opsadi."
0:25:04,0:25:30,"Na suđenju njima pojavio se američki vatrogasac John Jordan koji je služio u to vrijeme u Sarajevuevu, u UMPROFOR-ovoj jedinici, u vatrogasnoj njihovi jedinici, koja je pomagala, to je bila jedna, nazovimo, humanitarna misija UMPROFOR-a gdje su gasili požar gdje god borbe izazovu požar, i one su imali pristup na obje strane."
0:25:31,0:25:36,"Njegovo svjedočenje, za koje također nisam znao ni za njega do 2007."
0:25:37,0:25:57,"Do se nije pojavilo u Haškoj sunici, pokloprilo se sa pričom mojom i sa pričom slovenca jer je on, boravajući na Grbavici, vidio te ljude u uniformama koje nisu vojničke, ali su kamuflažne, pa ih je identificirao kao lovačke i sa oružjem koje nije klasično vojničko."
0:25:58,0:26:10,"Mislim, kao i u Domovinskom ratu u Hrvatskoj, tipično vojno oružje bili su kalašnikovi i poneki snajper također srbijanske domaće ili slovenske proizvodnje."
0:26:11,0:26:14,I vrlo je bilo prepoznatljivo ako netko nosi nešto drugo.
0:26:15,0:26:24,Ovo su bili ljudi koji su očigledno i iz perspektive Amerikanca bili neki stranci u Nagrbavici.
0:26:27,0:26:34,Odskakali su od domaćih vojnika i on je njih viđao da dolaze i odlaze.
0:26:34,0:26:37,"Dakle, nije on vidio pucanje, malo je tko vidio."
0:26:37,0:26:38,Tko je vidio pucanje?
0:26:40,0:26:46,Njihovo pucanje mogao je da vidi samo taj srpski vojnik koji ih je doveo na taj položaj.
0:26:47,0:27:02,"Međutim, John Jordan je, kad malo razmislimo i vidimo šta je sve vidio i kako to opisuje, bazirajući se na karakterističnim bitnim detaljima."
0:27:03,0:27:24,"Možemo zaključiti da je zapravo vatrogasna služba bila, bio jedan legendirani obavještajni rad za koga je Jordan radio, pa i to možemo vrlo lako pretpostaviti i vrlo je indikativno da se u Haškoj sudnici pojavljuje samo on, bez obzira što je ta vatrogasna jedinica imala sto ljudi, naprimjer."
0:27:24,0:27:36,"Samo se John Jordan pokazuje da poziva i objašnjava kako su ljudi izgledali, kako su se ponašali, kakvo su oružje imali, čak mislim da je i pomenuo neki model oružja koji je on prepoznao."
0:27:37,0:27:39,Ne bi trebala biti specijalnost vatrogasca.
0:27:40,0:27:43,"Da, oni kao gase požare, no dobro, znamo kako to ide."
0:27:44,0:27:45,Prvo ih pale.
0:27:45,0:27:47,"Da, točno."
0:27:47,0:27:48,I to ste dobro rekli.
0:27:50,0:28:03,"Dakle, taj Amerikanac, zatim Slovenac za kojeg još točno ne znate, znači njegov identitet, ali i vi biste trebali biti glavni, pretpostavljam, svjedoci u ovoj cijeloj priči."
0:28:06,0:28:09,Koliko je moguće da sve to padne u vodu?
0:28:10,0:28:14,"Znači, znate kako će ono reći, može li od svegaega na kraju biti ništa?"
0:28:16,0:28:18,To je sad pitanje koje mi se postavlja.
0:28:19,0:28:34,"Ljudi su mrtvi, ovo što ste rekli nitko te nije vidio da pucaš osim nekakvog tamo nažalost srpskog vojnika, žrtve su pokopane, oružje, strahujete li od toga?"
0:28:34,0:28:48,"Strahujete li da bi ovo, znači ovo što, a nadam se da ćemo još neke stvari samo dotaknuti, da bi sve moglo proći kako mi kažemo lišo, znači zaboravljeno, nekažnjeno, osim kod onog gore?"
0:28:50,0:29:08,"Budući da već imamo iskustvo da je mnogo predmeta u kojima je čak bilo možda i više dokaza i više svjedoka jasnih počinilaca da su propali, mislim uvijek postoji bojazan da će se to tako desiti."
0:29:09,0:29:18,"Posebno u bosarskom pravosuđu koji je prilično ispolitizirano i koji je prilično ne samostalno, postoji taj rizik."
0:29:18,0:29:24,U italijanskom pravosuđu možda možemo govoriti da je taj rizik manji.
0:29:24,0:29:41,"I ja se uznam u italijansko pravosuđe da će rasvijetliti bar tu fazu safarija, dakle okupljanja u Italiji, pronalazak tih ljudi i bar rasvjetljavanje njihovih motiva i organizacije koja ih je dovela u Sare."
0:29:43,0:30:01,"Ja sam više od godinu dana u kontaktu sa Ecijom Gavacenijem koji je dobio od mene sve što ja imam i koji je proveo vlastito istraživanje, došao do relevantnih dokaza koje."
0:30:01,0:30:12,koje je prezentirao u prvom neformalnom razgovoru sa tužiteljem kada on želi da vidi šta uopće ima da prezentira.
0:30:13,0:30:23,"Zatim je Gavacini napravio čini se jednu kvalitetnu krivičnu prijavu protiv NN izvršilaca, to je tako kažem, oni više nisu NN, bar nekoliko njih."
0:30:25,0:30:33,I tako da je talijanski tužitelj na temelju njegovih dokaza odlučio da otvori istragu.
0:30:34,0:30:50,"Moj zaključak je da su to toliko kvalitetni dokazi i da ima materijala za dalju istragu, da talijanski tužlas koji je istovremeno zamjenik državnog tužitelja Italije, taj u Milanu, ne bi se upustio u predmet koji je neperspektiva."
0:30:50,0:30:52,To je jedan moj zaključak.
0:30:52,0:31:05,"Korak koji je on napravio jeste tužlas, da je on zadužio specijalnu jedinicu karabinjera koja se bavi organiziranim kriminalom i terorizmu, koja će raditi istražne radnje."
0:31:05,0:31:11,I to mi je pokazatelj da tamo postoji ozbiljan materijal u tom predmetu da se tu nešto uradi.
0:31:12,0:31:18,"Što se tiče bosanskog pravosuđa, one su nekoliko koraka i 30 godina iza svega toga."
0:31:20,0:31:30,"Međutim, u žlaštu Bosne i Hercegovine već tri godine postoji krivična prijava koju je podnijela tadašnja gradonačelnica Benjamina Karić."
