Start (HH:MM:SS),End (HH:MM:SS),Segment
0:00:11,0:00:12,Dobro večer svima.
0:00:12,0:00:18,Evo nalazimo se u velikom tjednu i danas na veliki četvrtak pozdravljamo vas u još jednom podkastu.
0:00:19,0:00:24,Danas ćete imati priliku ugledati naših dvoje novih gostiju u novoj temi.
0:00:25,0:00:33,Večeras smo odlučili ugostiti samu nogometnim žargonom špicu napada Katoličke crkve.
0:00:34,0:00:40,"Ugostili smo dva svećenika, dva mlada svećenika, nema na čemu Stjepane."
0:00:40,0:00:41,"Hvala, hvala."
0:00:42,0:00:47,S nama je Pater Stjepan Ivan Horvat i s nama je Don Mirko Šakić.
0:00:47,0:00:50,"Dečki, dobrodošli u naš podcast i hvala što ste se odazvali."
0:00:51,0:00:52,Hvala tebi na pozivu.
0:00:52,0:00:56,Da ih odmah pohvalim i zahvalim im se još jednom.
0:00:56,0:00:59,Došli su unatoč svom naguravnom rasporedu.
0:01:01,0:01:08,"Don Mirko je došao iz Splita samo za ovu priliku, a Pater Stjepan je došao iz Vinkovaca danas."
0:01:08,0:01:08,"Prije par sati, da."
0:01:09,0:01:10,"Prije par sati, malo prije."
0:01:11,0:01:17,"Evo, odlučili su se odazvat na podcast i podijeliti s nama ovih par sati simbolično nešto."
0:01:19,0:01:26,"Za početak, dečki, jeste gledali do sad naše podcaste ili koliko vam je to bio razlog da se odazovete u podcast?"
0:01:27,0:01:33,"Ja sam vidio da snimate, da idu, ono malo sam preletio, mislim prvi, ali nisam pogledao onako iskreno."
0:01:34,0:01:41,"Drago mi je kad sam vidio digotna, evo vidim ono poznate face, lica, uvijek kažem pogledat ću, ali kad vidim da traje dva sata, drugi puta, da kažem."
0:01:42,0:01:43,"Vidjet ćemo, hoćemo li biti kraći."
0:01:44,0:01:49,Iskreno mislim da sam najveći ambasador BP podcasta doli u Splitu i okolici..
0:01:51,0:01:53,Kaj radi ambasador BP podcasta?
0:01:53,0:01:56,"šalje samo linkove, kad pogleda, samo prosljeđuje."
0:01:57,0:02:01,"Očekaj, ako budemo prirodni, a ne ono da odgovaraš ono što hoće da čuješ."
0:02:04,0:02:09,"Oba dvoja ste svećenici, oboje ste svećenici, to smo upozorili."
0:02:09,0:02:09,Obojica.
0:02:10,0:02:10,Obojica.
0:02:12,0:02:14,Uglavnom svećenici ste.
0:02:14,0:02:30,"Svećenici ste, jedan je redovnik, jedan je samo svećenik, o, od kud nam dolaziš i kako to da si postao svećenik, kak je izgledalo tvoj život prije."
0:02:31,0:02:32,Je li to nešto što se moglo očekivati od tebe?
0:02:32,0:02:37,"Jesu li ljudi oko tebe uvijek govorili, ma taj mali će biti svećenik ili je to ipak bio nekakav klik?"
0:02:38,0:02:40,"Tu je već koliko pitanja, ne znam od kojeg da krenem."
0:02:41,0:02:43,Svećenik sam od 2015.
0:02:44,0:02:48,"Sada će biti osam godina, sad će se prebaciti na ono zadnje."
0:02:49,0:02:51,"Znači, je li se to moglo očekivati od mene?"
0:02:51,0:03:15,"Pa to je onako uvijek meni, ja sam odgoditelj bogoslova i ono, svaki svećenik put je totalno različit i ono to pitanje, ljudi misle ne znam da svaki ministar će postati svećenik, na primjer, ali to nema veze, ali ja ću reći da moj život nije išao tim putem, nisam ministrirao, ne znam, moja dva brata su ministrirala, oni su u nekom periodu života govorili da ću biti svećenici, ja nisam i nisam stvarno nikad pomislio o tome do 23."
0:03:15,0:03:21,"godine, ali ajmo to tako nazvati, kad sam osjetio poziv, bio sam sto posto siguran da je to to."
0:03:21,0:03:37,"I ono sve ono ustvari što sam prije živio se uklopilo, iskušao sam pa da čovječe, to je život koji ono kad sam vidio kako žive u samostanu, misionari krvi Kristove, ono to je moj život, znači to je postalo tako jasno, samo što eto, postao sam tog svjesan sa 23, a ne ono sa četiri."
0:03:38,0:03:40,Sad ne znam što si još pitao.
0:03:40,0:03:46,"Pa dobro, to u stvari život ko mladi si imao neku fazu obraćenja, nismo fazu obraćenja."
0:03:46,0:03:51,"Ne, mislim ja sam onaj reći tipični mladenački život nakon krizne."
0:03:53,0:03:54,Šta će raditi sad u crkvi?
0:03:54,0:03:56,"Rano je da se ženiš, ne znam i to."
0:03:56,0:03:58,Oni vole sve što vole mladi ljudi.
0:03:58,0:04:04,"Da, izađeš u subotu na večer u grad, šta bi ja sad trebao buditi se onog nedjelju, ne znam u sedam da idem na misiju i to i sve."
0:04:05,0:04:11,"A opet na večer smo uvijek ili gledali utakmicu ili cibalja igrala, nije bilo mjesta za sve tu misiju naš."
0:04:12,0:04:18,"Nije nego ono i mislio sam, moja baka je bila uvijek u crkvi, mama isto, ali baka je bila svaki dan, što je nešto za bake."
0:04:19,0:04:22,"Kad ja postanem baka, ja ću ići u crkvu, jer to je bilo tako ono našu."
0:04:23,0:04:27,"Ali nisam ono u smislu, nije bilo one neke od bojnosti prema crkvi."
0:04:28,0:04:37,"U smislu sada to je nešto loše, jednostavno je to nešto što nekad će biti vremena za to i sve, ali nisam osjećao potrebu."
0:04:38,0:04:45,"Nekada bi me netko pitao, mama, nedjelja, da će ti ići u crkvu, ne znam ja i braća, onda bi znao reći meni je tamo dosadno."
0:04:46,0:04:56,"Stvarno mi je bilo dosadno, ali onda dođeš u crkvu, stojiš tamo, zagu zagušljivo je, leđa te boli, sve će neko ono radi nešto tamo na altaru, ne znam ja šta on radi."
0:04:56,0:04:57,Znaš što?
0:04:57,0:04:59,Ali gledaš ono kad će proći.
0:04:59,0:05:02,Jedno me je uvijek toživciralo ti župni oglasi.
0:05:02,0:05:02,Znaš ono?
0:05:02,0:05:05,"Taman čekaš da kažu, vidite, umiruju i onda ih sejde još malo."
0:05:05,0:05:08,"Znaš ono, to obično bude ono 12 minuta minimum."
0:05:08,0:05:08,Znaš što?
0:05:08,0:05:10,"Onda opet kaže, ne znam zašto."
0:05:10,0:05:11,Znaš što je ovo i za ono.
0:05:12,0:05:13,Tako da bilo mi je dosadno.
0:05:13,0:05:17,Ja mislim da je to razlog zašto sam ja prestojiću crkvu.
0:05:17,0:05:26,"Možda je, da je neko meni objasnio o čem se radi ili šta je to, ali nisam siguran da sam dobio pravu informacijuciju."
0:05:26,0:05:27,A kaj te je pokrenulo opet?
0:05:29,0:05:42,"E, pokrenulo me to što sam, ajmo reći, onaj način života koji sam ja živio, u jednom trenutku mi je bilo ono, kad je dosta katastrofa i ono i to neko sazrijevanje, ako se to može tak nazvati, gdje si počeo razmišljati o životu."
0:05:43,0:05:48,"Ja sam sebi doslovno rekao, laka je to život, sve što sam dosad živio, meni je dosta."
0:05:48,0:05:53,"Znaš, nemam više ja šta, sve sam probao, sve sam vidio, što je to?"
0:05:54,0:06:06,"Dosadilo me je, dosadio mi je takav neki ispravan život i tu sam, ja nisam tad vapio Bogu, ali si tražio nešto više od toga., ili će završiti, ili je to to, ili moramo otkriti nešto više."
0:06:07,0:06:08,To je sad ukratku ono.
0:06:09,0:06:09,Ok.
0:06:10,0:06:12,"Spomenuo si Cibaliju, rodom si točno iz?"
0:06:12,0:06:14,Vinkovac.
0:06:16,0:06:20,"Mirko, sada imaš koliko godina?"
0:06:21,0:06:22,27.
0:06:23,0:06:24,Svećenik si već?
0:06:25,0:06:26,Pa brzo će tri godine.
0:06:27,0:06:28,Bogoslovia traje?
0:06:29,0:06:30,Bogoslovia šest godina.
0:06:31,0:06:34,"To je devet, znači sa osamnestih otišao u Bogoslovlju."
0:06:34,0:06:36,"Tako je, malo neobično."
0:06:37,0:06:39,"Rano ili kasno, neobično?"
0:06:39,0:06:40,"Pa rano, danas."
0:06:41,0:06:50,"Baš sam ti pitala, kaj bude u glavi mladog dečka iz Splita da sa 18 godina kaže, evo ja mislim da bih ja htio posvetiti svoj život Bogu do kraja?"
0:06:52,0:07:02,"Pa ne zna, u ovoj glavi je nekako u tim godinama bilo svašta i sve osim toga, osim neke želje za svećeništvom."
0:07:04,0:07:13,"Ja nekako kažem da je pod meni možda malo neobična situacija koja je prije bila uobičajena, da neko nakon srednje škole, sereći."
0:07:13,0:07:17,"Sljedeći korak je da se odluči ako želi biti svećenik, da ide na arheologiju, u Bogoslovu."
0:07:19,0:07:24,"Međutim, danas sve češće se događa da su ti kasni pozivi, niste i pa kasni pozivi."
0:07:25,0:07:26,20.000 ljudi.
0:07:26,0:07:27,"Ne, to je OK, onalo opet."
0:07:28,0:07:34,"Ali meni se u 17 godina, ja nekakav smiješan 17 godina su se događale tako neke stvari."
0:07:35,0:07:36,Koji je hajdeo bio te godine?
0:07:37,0:07:41,"I događale neke stvari, šumim i ovdje ne znam."
0:07:46,0:07:49,Dim je Bog dao znanje u stvari u kojem smjeru i kako da je moj život ide..
0:07:52,0:08:08,"Međutim, nekako bi jedno pola godine prije toga nego se meni dogodila ta jedna situacija u kojoj mi je Bog stvarno jasno da doznanja i šta želi od mene i di ću ja biti najsretniji, di ću ja kao takav, kad jesam, druge činiti sretnijima."
0:08:10,0:08:24,"Ali jedno pola godine prije toga nekako su se i događale neke stvari, bila je krizma, nama je krizma u drugom srednjem, znam da je ovdje puno biskupija u osmom razredu, nama je u drugom srednjem, 16 godina, to su već ozbiljne godine."
0:08:24,0:09:06,"I evo jedno par mjeseci prije toga sam imao jednu, dvije situacije u kojima sam otkrio nešto jako važno za moj život, a to je da nisam bio ja sretan, nisam do kraja imao u sebi tu radost i zadovoljstvo sa samim sobom i tada sam ja pokre sebe učio moju stariju sestru, tada njenog zaručnika koji su uvijek, ako su bili jedno dva godine u vezi i provociralo me to kako oni to su srce ono mirni su, sretni su, zadovoljni su, jedno i drugo su normalni su čovječan, lijepi, zgodni, uspješni, ozbiljno završio maturi, diplomira, programe, jer tako ona studira."
0:09:08,0:09:11,"Što je to, što oni imaju, što ja ne imam, što ne ima nikod u mojej ekipi."
0:09:12,0:09:20,"Ja sam tako njih malo, pomalo promatrao, i muškarije koji mi nije dopuštao, da ja dođem u svoje sessi i rečem teško mi je, pomozim mi, nisi sretan, ni tako."
0:09:21,0:09:30,"Ovaj da se tako uočio, da u stvari oni žive kršćanstvo, da žive tu svoju vezu, malo drugačije nego cijela ta moja tu ekipa."
0:09:31,0:09:38,"Naravno i predbračna čistoća, zajednička molitva, subota večer, če ne idu u pol ure na flanjanje., i poslije prošetajete."
0:09:38,0:09:39,Što je to?
0:09:40,0:09:41,Ali me je to provociralo.
0:09:41,0:09:48,"Istina je da meni je to bio poticaj da samo počneš iskreno ispovijedati, da počneš iskreno ići na misiju."
0:09:49,0:09:58,"Da je drugačiji pogled na sve, na odnose u obitelji, na sve poredu, opcije u školi, cure, spolnost, evo, taj nogomet se onda još trenira."
0:09:59,0:10:01,Isto je bilo i cubali.
0:10:01,0:10:03,Igraj smo prije svibali.
0:10:03,0:10:07,"Igraj smo prije svibali, i bio je dobar rezultat, da sam bio splita."
0:10:08,0:10:33,"Tako da je, češem se Stepana, si pitao je li bilo za očekivati itede Meni je bilo malo smiješno kao su poslije jer ljudi neki govorili, ah mi smo znali, jer sada bio ministranta od trećeg osnovne do osmog razreda i imao sam predivno župnika, evo moj donante i stalno super svećenik ali mene nije nikada privlačio njegov način života."
0:10:33,0:10:37,"Znači, hoću uspjeti u balonu, hoću, ima ženu i puno djece, znači, čega nisam zahtjevao."
0:10:37,0:10:41,"Znači, ono to svećenstvo, nisam uopće razmišljao o tome."
0:10:42,0:10:56,"I onda u stvari, nekako, tko je najobjektivniji za reći je li to bilo za očekivati od mene, mi mislim ipak to obitelj, moji su bili izvan sebe kad sam njima rekao da želim biti svećenik, da ću biti svećenik."
0:10:56,0:10:57,Izvan sebe od sreće ili?
0:10:58,0:11:02,"E, je od sreće, ali nisu od mene očekivali, nije bilo od mene za očekivati."
0:11:04,0:11:04,"Dobro, hvala."
0:11:05,0:11:25,"A daj sad kad ste oba dvojica spomenuli pojam poziva, Stjepan je ti da si osjetio poziv, ti da, evo znao si da te Bog zove, daj nam malo demistificirate taj pojam poziva, kaj sad to znači, je li to nešto što ti sigurno znaš, kako se to očituje, je li to ima neki radnaravni znak, kakav je tu moment oko toga."
0:11:25,0:11:38,"Ja bih ovo što si prije pričao sa Mirkom, spomenuo je stvar sretan, znači ovo što si meni bio pitao je li to bilo nešto normalno, redovno i to."
0:11:39,0:11:42,Ja sam sa 23 godine došao u samostan i vidio kako oni žive.
0:11:42,0:11:55,"Ja nekad razmišljam da sam došao ono u prvom srednje, da sam vidio kako ti ljudi žive, možda bi tad ja otkrio, gledaj to je, kad sam vidio šta oni rade, kad sam vidio načina kako žive, kad sam vidio kako, možda bi mene u tom trenutku to privelo."
0:11:55,0:12:18,"Sada zašto to nije bilo u prvom srednje, nego sa 23 godine, ja ću reći to je Božje, znaš, Bog je vjerojatno ono tako ja to vjerujem, znao kad je najbolji trenutak da mi posvijesti to, a ovo mi je genijalno bilo, to pitanje sreće, evo ja kad razgovaram s ljudima, kad ispovijedam, ono nekako osjećaš poticaj često da pitaš ljude jesi li sretan."
0:12:19,0:12:25,"Koliko ljudi je danas nesretno, a često ustvari mogu riješiti taj, znači sretan nisam, zašto?"
0:12:26,0:12:28,"Zbog toga i tog, ok, zašto ne rješavaš to?"
0:12:28,0:12:39,"Znaš ono, to je ono nevjerojatno, mene to nekad iznenadi, znaš, ne znam, sretan, ne poštaraj, studiraš, šta pravo, koja godina, treća, ali ja to sigurno neću nikada raditi u životu."
0:12:39,0:12:40,Zašto nas tu držiš prag?
0:12:41,0:12:43,"Gledaj, već sam završio tri godine, šta da sad radim?"
0:12:43,0:12:48,"Znači, sad si spreman biti nesretan cijeli život, jel ti je žao, ne znam, dvije godine koje si naiš kožišona."
0:12:49,0:12:53,"To je, da, ali ovo, evo sad što si pitao, hoćeš malo ti pričati, jel da."
0:12:54,0:12:55,"Nadalje, samo ovo, da."
0:12:57,0:13:10,"Znači, ja ne volim svjedočiti, zato što imam osjećaj da neke stvari, evo što ti kažeš, ja sam znao da je mene Bog pozveo, da ti ljudi gledaju ovako, znaš ono šta, ali ja sam u tom trenutku stvarno znao da je to on."
0:13:11,0:13:18,"Znači, ne možeš nešto staviti u riječi, ali znaš da je to nešto što je ta jedna sigurnost 100%."
0:13:19,0:13:34,"Znači ja se sjećam kad me tata pratio, nakon tri mjeseca sam bio samostan, vratio se kući, rekao svojim, gledaj idem probat, svećenik, on nas sviđa mi to i sad mene tata onako ispraćuje na vlaku i kaže, a da ja tebi sad nađem posao u Vinkovcu da imaš 10.000 kuna plaće ili bi ti htio ostati tu."
0:13:34,0:13:58,"Ja kažem ne bi zašto, zašto ono, osjećam da je to onaj Bog pozvao, ali znaš što ne, sad ti ne možeš to staviti u riječi, znači ja znam da je to bio onaj, pusti 10.000 kuna, mislim mi je to mal novac naš, ali ono, postoji nešto, ima Bog ti da tu nutarnu sigurnost., ja sam to tako doživio, kad kažem ja vjerujem da sam susreo živog Boga, ali sad opet će netko reći, ali ne mogu ti ja staviti to, ja ne znam, nisam ga vidio, nisam ga, ajde."
0:13:59,0:14:19,"Pa da, se rekao je meni bilo možda kod mene malo neobično što su tako rano se dogodile te stvari oko poziva, ali ono što je isto vi danas ono neobično, a to je što je meni isto Bog dava jasnoću, evo, meni je trebalo nešto snažno da me Bog ono strese."
0:14:21,0:14:32,"Sjećam se kako je pokojni frazijedan Linić jedanput rekao mojoj mami, uglavnom svaki put kad bi ona otišla na neko duhovno obnovo, na neko duhovne vježbe i tako, meni bi se nešto dogodilo."
0:14:32,0:15:00,"Znači, sad se i ne vide na meni svi ovi ožilci i tako, imam jedan na čelu i tako, ali baš ovaj koji je bio na čelu, znači čudo sam da to ostaje živ, znači to je jedan skok u more, stvarno kad sam došao u bolnicu, doktor je zvili izvan sebe i tako i sad mama je tada bila baš na duhovnom obnovi kod frazijezdana, u Samoboru i ona cila u strahu i gori, frazijezdana je svaki put kad ja dođem, njemu se nešto dogodilo."
0:15:00,0:15:03,"I onda mu pokazuje sliku mene, znači ne prepoznatljivo."
0:15:04,0:15:11,"I onda je tada po kojoj frazi je jedan rekao, pa očito s našim Mirkom nisu smora malo žešće, malo agresivnije."
0:15:12,0:15:23,"I meni je, ja sam imao jednu stvarno jednu, ne možemo reći na naravnu, izvanrednu i tako, jedan nekako događaj i susret u kojem mi je Bog jasno dao do znanja šta želi od mene."
0:15:24,0:15:25,Mogu li to kratko ispričati?
0:15:25,0:15:40,"Ja mislim da je to jedna od stvari, ali prije nego to kažem, svi ćemo se mi složiti da svatko od nas, pa tako i svaki od nas svećenika ima ono jedinstven i originalan put i svoj poziv i način na koji mu Bog to očituje."
0:15:41,0:15:49,"Evo, netko od malena, nekako je to u njemu i to raste, raste, netko tog trideset osamnaest godina a netko on osamdeset i tako."
0:15:51,0:16:21,"Ja sam evo već tada nakon te moje krizne se stvarno iskreno nekako dolazio Bogu u svetoj ispovijedi i u svetoj misiji i tako i molio se i tada se se redovito ispovijeda, evo to za jednog srednjoškolca je bilo otprilike jedanput mjesečno, još tada se on naravno bajas taj nogometon i točno se sjećam te nedjelje, već mi je bilo jedno mjesec dana prošlo i osjećam da popušta i tako."
0:16:23,0:16:32,"Iskreno nisam se volio ispovijedati kod svog župnika jer mislio sam naime meni šta je on mislio o meni, mojih srednjoškolskih grijeha, znači sada vlazniče se a misli da sam super i dobar i tako."
0:16:33,0:16:43,"I onda tu nedjelju smo imali utakmicu, ja sam odlučio da ću otići u drugu župu, naravno, mislio sam sedam ispovjedice, poslije sam slobodan i tako."
0:16:44,0:16:57,"I tako, bila je to jedna običajna ispovijed, nije se ništa spektakularno dogodilo osim što je Isus Kristus za grijeh oprostio i tako, ali u toj ispovijedi nije mi ništa sad taj, sve će im kreka nešto i tako da je mene rasvijetljilo."
0:16:58,0:17:29,"Važan moment je bio nakon, evo nakon što sam se izmolio pokoru i nekako kad moliš pokoru, klekneš u klupu, refleksno pobožno spustiš glavu i tako, i nakon što sam se izmolio pokoru, sjajan sam još jedno desetak minuti do mise i poglednu i padne na oltar i tamo, tamo, taj jedan Franjevac, fratar je pripremao oko oltara voda i vino za misu i sad to moje dizanje po glave, padanje pogleda doli, taj oltar, taj franjevac."
0:17:30,0:17:36,Ja samo tako jasno čujem jedan predivan glas i tebe želim tamo.
0:17:39,0:17:43,"I jasno ono, znači što je ovo?"
0:17:44,0:17:52,"Nikad, ja uvijek kažem da nikada u životu tolika doza straha, a s druge strane nikada tolika doza radosti."
0:17:53,0:18:00,"I jasno, ja tu sve tu nisam, ja ne znam li sabijana, ne bunja zemlja, ne onam."
0:18:00,0:18:12,"Sjećam se tu takmiću sam ja, ja sam onaj letio po terenu i ja sam imao problem sa, ja nisam, mi si volim nogomet, ali to nije bila ljubav prema nogometu nego je to bila moja navezanost na uspjeh u tom sportu."
0:18:12,0:18:15,"Ja sjećam se da sam tada bio onaj spreman, ovo je moja zadnja."
0:18:16,0:18:39,"Međutim, odlučio sam ovaj da, to je bio dvadeset jedan deset znači od dva mjeseca do božića ja sam odlučio ovako znači bože znači do božića nikome ništa znači ono da sveti petar sad dođe da ne znam tko dođe nikome ništa znači i davide sapuka i ti stvarno mene želiš na takav način usmjeriti."
0:18:40,0:18:52,"Ja naprimjer evo prije toga, samo nisam imao želju za svećeništvo, kažem, samo sam volio i volio svog župnika, sve sve svećenike, toliko predivnih svećenika i kroz moje odrastanje, ali evo i nisam imao neki moment da sam razmišljao o svećeništvu."
0:18:52,0:19:00,"Tako i onda kad se meni dogodilo tako nešto, izvanredno, taj jedan trenutak, sekunda, nemam pojma koliko je to tralo, to je nešto što je u meni sve promijenilo."
0:19:00,0:19:06,"Jedna sakrsta, sad, meni je to bilo dva mjeseca, uf, to je jedna sakrpa, poglaštaj, ništa, to je ovako."
0:19:07,0:19:36,"I sad kad vidim da puno momaka koji ne znam, imaju trideset godina i lome se ono godinama oko poziva itede ja stvarno zahvalan Bogu da mi je dao jednu jasnoću, ali čini mi se to važno da kroz ta dva mjeseca mog razmišljanja, promišljanja, nekako sam provjerio cijeli svoj život, svih svojih sedamnaest godina, toliko situacija u kojima me Bog pokušava do toga dovesti, pokazati, ali ja sam samo ono ne, ne, znači imam svoje, gazi sve oko sebe, ni čut, pusti me na miru i tako."
0:19:37,0:19:47,"Evo, ja vidim, poznajem sebe donekle i zna da nam je trebalo nešto tako da mi Bog da do znanja, ali opet je Bog taj koji te ostavlja u slobodi."
0:19:48,0:19:50,Kako se to uklopi kasnijenije u priču.
0:19:50,0:19:57,"Ja sam se puno puta pitao, navijač koji je sad išao u vojsci, pa bez veze šta sam to, pa ne znam studirao."
0:19:57,0:20:03,"Ali kasnije ti si shvatio da je sve to, kuda se moralo dogoditi, sve je to ono ugrađeno u priču poziva."
0:20:03,0:20:11,"Ovo što si pričao u crkvi, ja sam se sjetio jedne situacije, kad sam ja prvi put došao u samostan, nisam ni znao zašto dolazim uopće na tri dana i sve."
0:20:13,0:20:19,"I sad ja sam trebao ići kući za Vinkovci, a bio je vlak iz Zagreba svaka tri sata, devet u dvanaest u tri."
0:20:20,0:20:39,"Ja ono iću u devet, pa ne, a ja ostat ću još tri sata u dvanaest, pa iću u tri pa i ono, na kraju sam ušao u ponoć, ali i kad sam odlazio samostanar rekao idem, ja sam ono tu noć proplakao u kapelici, napravio životnu ispovijed, ono osjećam se da treba biti tamo, ne znam ni ja zašto."
0:20:39,0:20:49,"I sad ono kao, ok, prije nego što odem, idem još pet minuta u kapelicu, ono javit se i nekako ono pozdrav ovo, ono ajde, ja krenem i ne napravim to."
0:20:50,0:20:57,"Ja ono u autu već mislim, ono pa ću reći, nisam ušao u kapelicu, ono koji glupo osjeća i sve nešto sam zaboravio, je li to dobro ili je..."
0:20:58,0:21:00,I meni u tom trenutku zvoni mobitel.
0:21:01,0:21:06,"I sad neko zove kao, e, pa kako si ti otišao, niste ni javio i sve i to."
0:21:07,0:21:11,U toj trenuta kad ja razmišljam da se nisam javio u kapelici.
0:21:11,0:21:16,"I kao, još sada ono, ko je to šta, je li ono neko i samostana ili šta."
0:21:18,0:21:23,"I onda kaže neko neko ime, ne znam, Marko i Stija, nisam, kao ne, Ivan je Ivan."
0:21:23,0:21:24,"A, stori krivi broj."
0:21:26,0:21:32,"Ja zbog toga ne volim vidjeti onaj natpis u crkvi, Bog će vam se javljati na svakakakve načine, ali sigurno vas neće zvati na mobitel."
0:21:33,0:21:36,"Ja kažem, mene zvana mobitel, pa stvarno vjerujem da je to bio on."
0:21:37,0:21:48,"E to je taj trenutak, ti vidiš da se događaju stvari i sad kad ti to pokušaš nekom pričati, ljudi te gledaju ovako, ti čuo kakav glas, jel znaš što su te stvari?"
0:21:49,0:21:51,"Tebi je to dosta, tebi je to puno."
0:21:51,0:21:59,"Ali bilo bi super da me svaki dan zove i re kaže, da malo, pazi na to."
0:22:02,0:22:08,"Ali ja mislim da se mi bojimo, ja bih se vratio na početak, podsjetio sam se jedne stvari koju sam htio reći, klanjanje."
0:22:09,0:22:17,"Znači ja dolazim u samostan sa dvadeset tri godine znači ja sam ono sakramenti, pričest, krizma, ja nisam u životu vidio presvetu, ja nisam znao šta je to."
0:22:17,0:22:22,"Ulazim u kapelu, ljudi kleče ispred nečijeg na altaru, ono majkomila, di sam došao."
0:22:22,0:22:49,"Znači, ja do dvadeset tri godine nisam znao šta je presvetu što je meni bilo onako nešto ja sam mislio uletio sam u neku sekturinu ono bježio odavde znači sunce neko tamo da nešto oni stebi stavili neko zlatno čudo tamo i kleče pretirano ali nisam gdje sam ja to imao priliku vidjeti znači kod nas je to vjerojatno bilo ne znam klečanje godišnje utorak ono liga prvaka obično bila utorkom ili nešto naš ne bi otišao na to ali ja nisam znao šta je presvetu Što je prestižeto."
0:22:49,0:22:54,"Nije tad bilo, ne znam, internet, ovo ono, da, stariji se ne imamo od tebe, znaš, pa onda ono."
0:22:55,0:22:56,"Ali, ovaj, da."
0:22:57,0:22:58,Što će ti doći 27 godina?
0:22:59,0:23:00,Skoro 27 godina.
0:23:00,0:23:01,40 godina.
0:23:02,0:23:03,"Ne bi ti se reklo, evo."
0:23:03,0:23:06,"Čitam dosta, ne, 39, 39, 39, 30."
0:23:08,0:23:11,"Vas dvoje, s tobom dvoje svećenici, ali postoji razlika."
0:23:11,0:23:15,"Stepan je, ti si redovnik, misionar krvi Kristove."
0:23:15,0:23:17,Ispravit ćeš me ako sam u krivu.
0:23:19,0:23:20,Što sam ja?
0:23:20,0:23:21,Ti si svećenik.
0:23:21,0:23:24,Ja sam djecezanski svećenik s Plitsko-Makarska na Bisku.
0:23:24,0:23:24,Ti si pater?
0:23:24,0:23:24,Pater.
0:23:25,0:23:26,Tisi don.
0:23:26,0:23:26,Da.
0:23:28,0:23:28,Don.
0:23:28,0:23:30,Da nam to malo rastumačite.
0:23:31,0:23:33,"I okej, još jedno pitanje."
0:23:33,0:23:38,"Koja je razlika generalno nekakva i konkretno koja je razlika, kako izgleda vaš dan?"
0:23:38,0:23:42,"Jesu li oni slični, nisu slični, ti živiš u zajednici?"
0:23:43,0:23:44,On se mora dižavljati.
0:23:45,0:23:48,"Dok se nije snimalo, pitao sam ga kad se probudio, rekao u 11.30."
0:23:48,0:23:51,Tijekom redomincija se probudio u pola šest.
0:23:52,0:23:54,Mislim da ne mora uopće dalje ni pričati o tome.
0:23:54,0:23:55,Sve je u 11.30.
0:23:55,0:23:56,Mislim da su ono usnuo.
0:23:57,0:23:58,"Okej, misli čarijas."
0:23:59,0:24:01,"Pa ja sam, znači, ja sam."
0:24:01,0:24:08,"Ja sam nekako obični svećenik, podnaovnik svjetovni svećenik, svećenik koji pripada jednoj biskupi."
0:24:09,0:24:21,"I nekako temeljna razlika je ta, evo, djecezanskog svećenika i svih drugih redovnika je taj život koji je u zajednici prisutan u redovništvu."
0:24:21,0:24:29,"I ta zajednica živi kao jedna obitelj, bilo da su tu dvojica, trojica ili ih je četrdeset i imaju svoj dnevni red i tako."
0:24:29,0:24:37,"I mi smo, nekako sam ja jedan dio toga i podnaovnike redovništva, takvog načina života i prošao kroz Bogosloviju."
0:24:37,0:24:43,"bogu slaviju, zajedno moliš, tamo se studira i tako družiš, se jedeš, sve to skupa."
