Start (HH:MM:SS),End (HH:MM:SS),Segment
1:35:14,1:35:20,"Kod nas se plaća, mislim, minimalac, nešto da društva, evo sad možeš tu nešto krivo reći."
1:35:20,1:35:24,"Ne, čeka, imam posljednje pitanje, to su ljudi postavili."
1:35:25,1:35:29,"da li se može prestati biti svećenik, ali znam da se može pod nekakvim uvjetima."
1:35:30,1:35:32,Deset godina si svećenik i zađeš van.
1:35:32,1:35:35,Da li imaš deset godina staža nakon toga ili ne možeš deset godina staža?
1:35:36,1:35:53,"Sve ovisi o zajednici, ali kažem u pravilu ne, ali ja mislim, evo sad kažem, evo to ću pitati poglavara, mislim čak da se nama plaća, baš zbog ovih situacija, da se nama plaća neki minimalac, onda ne znam tako da imaš, jer dle, onda budeš dvadeset godina svećenik, napustiš ti, nemaš ništa, ako ti to nije naš plać."
1:35:53,1:35:59,"Ali kažem, to sad ovisi o, znam da se prije nije, mislim, kod nas plaćalo, ali baš vjerojatno zbog tih situacija."
1:35:59,1:36:01,"Mi se ovdje imamo kao, evo."
1:36:01,1:36:09,"naprimjer ja ne mogu doći sad u banku neko i digni kredit jer ja nemam kao primanja unosa, od čega dobivam tu mjesečnu nagradu?"
1:36:09,1:36:40,"Sve ono šta župani daju to ide na župni račun koji je kao jedna zajednica i tu smo sad nas vojnici na župi i točno se zna s tog računa župnog sve što se milostinja daje šta dođe netko da za župu sve to ide na jedan to je kao jedna obitelj to je naše znači, ali točno se zna da meni s toga bilo da je na računu ne znam deset tisuća kuna ili milijun kuna koliko god meni mjesečno pripada toliko i toliko sedamsto šezdeset župniku toliko i toliko evo i ono, znači to se točno zna."
1:36:40,1:36:46,"Znači ustvari meni moji župljani mi daju tu mjesečnu nagradu da mogu sebi ili gorivo, da mogu se otići kupiti."
1:36:47,1:36:48,I to je milostinja realno.
1:36:48,1:36:48,Tako je.
1:36:50,1:36:56,"Imam još jedno pitanje, jes se to sjetilo za oba dvoje u koroni kad nisu bile javne misije?"
1:36:56,1:37:14,"Ja sam tada bio Đakovin u koroni, tako da ja nisam ekonom u smislu, ali znam da naprimjer naš samostalni prozor gdje mi živimo od grupa koje dolaze, znači koje ostavljaju svoj prijedlog, koje log u kojem jesmo osjetili to dobro."
1:37:15,1:37:18,"Naš, ono i stvarno te neke ono, na nekom trenutku smo se pitali ono kako dalje."
1:37:19,1:37:30,"Naš, nema štica tu, neki, ne znam, dorumisa da smo se našli u situaciji ono da smo stvarno trebali pomoć, ono tražili bi, rekli bi ljudima u zajednici s kojima surađujemo, gledaj, nemamo ono za."
1:37:31,1:37:33,Ali nije bila jednostavna situacija.
1:37:33,1:37:49,"Evo, na primjer, znam jedne časne u Zagrebu koji imaju pučku kuhinju, koji su, njima sad opet da ne kažem nešto krivo, mjesečno ili svaka dva mjeseca iz inozemstva dolazi kamion donacija hrana, testerina, ovo, ono su u jednom trenutku ostale bez."
1:37:49,1:37:49,toga.
1:37:49,1:37:54,"Znači puška kuhinja je radila, beskućnici su dolazili po hranu, oni su ostali bez zaliha."
1:37:54,1:38:05,"I onda su onako tim nekim unutarnjim krugovima mi koji imamo veze s njima, su rekli, ljudi mi nemamo više što dati ljudima, deorganizirajte nešto, kupite nam brašno, riže, tjestenine, ulja."
1:38:06,1:38:08,To su bile situacije koje nisu izašle van.
1:38:08,1:38:13,"Znači, meni je genijalno bilo kako se ljudi organizirali."
1:38:14,1:38:17,"Stvarno i to je, svako je donio nešto svoje i na brzinu se napunilo."
1:38:17,1:38:18,I opet je bilo.
1:38:18,1:38:23,"A to je ta stvar, diti možeš uvijek zavapit svojim vjernicima, gledi mi nemamo."
1:38:26,1:38:31,"Meni je to super u Župiću učer gdje sam bio gdje župnik često govorio ljudima, ljudi župa je vaša."
1:38:32,1:38:40,"Znači župa je vaša, mi ćemo otići, nas dvojica ćemo otići sa župe, ne znam, krov curi, grijanje ne radi, to je vaše."
1:38:40,1:38:42,"Ako vi u to uložite nešto, vi ćete imati."
1:38:43,1:38:46,"Znate šta, nije to, ja neću odnijeti župu sa sobom."
1:38:46,1:38:57,"Ta svijest da ti ne daješ, što on kaže, svećenik ima jednako, dolaze li ljudi, ne dolaze li, bila milostina toliko ili toliko, propisana je njegova nagrada, toliko i toliko, moja nagrada to."
1:38:58,1:39:08,"Ali ono, to je vaše, ako ćete vi i ono Tu ljudi često, ili sad ja sjećam tamo, župnik je držao uvijek na 14 ili 12 stupnjeva u crkvi."
1:39:08,1:39:20,"I onda su neki rekli, ok, naš račun za grijanje, ne sjećam se, ali 15 tisuća kuna, ja ću krenuti na 20, ali bit će 30."
1:39:20,1:39:21,Jesmo mi to spremni skupiti?
1:39:22,1:39:27,"Ljudi misle da je to samo naš, ali treba komunicirati s njima."
1:39:27,1:39:36,"Znači treba reći ljudima te stvari, najskuplje je bio u Dubrovniku, znači on je financije, bio je skuplje, šitao javno."
1:39:38,1:39:45,"Znaš ono, zašto ja to ne bih vama pokazao, na što bi skupija trošila, od čega bi skupija zarađivala, kako je stanje."
1:39:46,1:39:47,Meni je to genijalna stvar.
1:39:47,1:39:51,"Opet ne moram ja svu intimnost, svoju otkrivati svakome."
1:39:51,1:39:54,Ali takve neke stvari ja ne vidim u tome problem.
1:39:55,1:40:02,"I to isto na jednoj župi, ne zna kad se onaj se na staru godinu ili kad se govori, prihodi, rashodi, ne znam, nija statistika."
1:40:02,1:40:04,"Da, da, da, da."
1:40:04,1:40:06,Pa ljudi imaju pravo to reći.
1:40:06,1:40:08,"Imaš ekonomsko vijeće, gdje su te stvari."
1:40:10,1:40:10,Da.
1:40:10,1:40:14,Ali najvažnije je da samo posjećiva ljudima to nešto da to nešto njihovo je.
1:40:14,1:40:18,"Da, naravno, isto ta da mi to ne zloupotrebljavamo."
1:40:19,1:40:23,"Ajde, to je ono ili pak župnik s tim upravlja, svećenik s tim upravlja."
1:40:23,1:40:24,Što je.
1:40:25,1:40:28,"Idemo još jedno pitanje, pa idemo na QA ne od naših gostiju."
1:40:28,1:40:36,"Dajak, imate iz rukava svaki po jednu neobičajnu epizodu iz vašeg svećeničkog života?"
1:40:38,1:40:41,"Neobičajnu, ludu, smiješnu, ne svaki dašnju."
1:40:41,1:41:19,"Pa evo, da, meni je sve smiješno, stavim vas ovdje, ja sam u Splitu i na ovom momentu, ali nešto sam posebno dotaklo, ima puno takvih sličnih situacija ove godine u blagostanju obitelji i tako između ovih zgrada tamo ima jedan mali trg i tu se okuplja jedna ekipa, muška ekipa njih desetak, onako, momci četrdeset do pedeset godina tako i malo, znači lagano pivica, druženje i tako."
1:41:21,1:41:25,"I sad sam onda se vratio jedno pola godine prije toga, tamo na Lito, Tamo nalito."
1:41:26,1:41:29,Ja sam imao jednu situaciju u kojoj.
1:41:30,1:41:32,Bilo je malo neizgodno.
1:41:32,1:41:42,"Jer jedan lik iz kvarta s Kurčićem, o kojem neću govoriti, on i ne zna za ovu situaciju, a zna za ovo poslije."
1:41:43,1:41:48,"Ja sam prolazio sa svojim motorom i imam kad sigurno crni vizir, jer ne vidi se koji je."
1:41:48,1:41:55,"I evo, jedan, taj jedan čovjek, ono baš je bio ljuta."
1:41:56,1:41:58,"Neka žena se okrčala sa autobusom, pa nikako se okrenit."
1:41:59,1:42:01,I onda on ono.
1:42:01,1:42:03,"Peštima, bogu psu."
1:42:05,1:42:07,"Ja nisam imao mira, tako da prolazim."
1:42:08,1:42:12,"On je bio u autu, on mu je rekao: Pa šta ti je on kriv?"
1:42:14,1:42:15,On je pogledao u rešetiću.
1:42:16,1:42:18,Ja sam rekao: Ne kao prema bogu.
1:42:18,1:42:22,"Ej, kao što ti je on kriv, ako vrijeđa Isusa i tako."
1:42:24,1:42:26,Ja govorim: Pa nije ti on ništa kriv.
1:42:27,1:42:28,On diga ručnu.
1:42:30,1:42:32,"Ništa, ja ovdje nisam skužio ako sam ja i tako."
1:42:33,1:42:35,Ali nije mi bilo u tom momentu svejedno.
1:42:36,1:42:38,I vidio sam da možda stvarno nije to način.
1:42:39,1:42:41,I dođe sad taj blagoslov obitelji.
1:42:42,1:42:46,"Ja šetam, već je tako, pada je mrak, lagano, kišica."
1:42:47,1:42:52,"Ja sa kapuljača, kolar, stola, kišobran, nisam imao kišobran."
1:42:53,1:43:01,"I ja tu prolazim blizu tog trga, ja čujem tamo kaos, znači verbalno, ajme, ono na rubu fizičkog incidenta."
1:43:01,1:43:07,"Ja tako povjerim, ja vidim taj lik s nekim, već je od njega zaglavo, ali poišče ga."
1:43:08,1:43:13,"Ja oču neću, oču neću, ja govorim, ostaću vas sad tamo na našem, ostaću vas."
1:43:13,1:43:14,Sad će se čata osmijriti.
1:43:15,1:43:27,"Evo ma idemo šim maso još dvije tri obitelji, ja tako su radnici u dvije tri obitelji i ja se spuštam, izlazim iz te tu zgrade i komotam, naravno namjerno ću pročano tu, čujem da se smiruje, idem iz situacije."
1:43:27,1:43:48,"I lagano, već lagano pada mrak, oni tu su raštrkani, njih je desetak, smirila se ta svađa, svaku u svom nekom filmu i ja prolazim i uočim me neko od njih i derese, rečasni, pa di ste bili prije 20 minuti da ste bar bili tu da nas blagoslovite."
1:43:49,1:43:55,"Znači, ja staja, ja govorim, pa nije nikakav kasno."
1:43:56,1:43:59,"Govorim, Bog nas uvijek naš čeka, ako raširimo ruku."
1:43:59,1:44:04,"I taj lik, po naonike, najžešći, taj moj, on se puče."
1:44:05,1:44:09,"Znači, Bogu ono, znači."
1:44:09,1:44:15,"I ovaj, ja još naš, da dodam malo, naš Bog nas ljubi na to svemu, ovako onako, onako još češće, znači."
1:44:16,1:44:24,"I dolazi treći, kaže, a mogli smo se sklano sapo, molit, ja spusti kapu, oni spuštaju boce."
"-1 day, 23:59:59",1:45:01,"Znači, ej da je bar to neko s tim ja strane, znači ništa ja sam napravila, zna križa, oni su svi se, znači zna križa, ja onako zagurna molitva, onako iz srca šibaj, inak i blagoslovi i tako, i oni oni oni oni oni oni oni oni oni oni oni oni oni oni oni oni oni oni oni oni oni oni oni oni oni oni oni oni oni oni oni oni oni oni oni oni oni oni oni oni oni oni oni oni oni oni oni oni oni oni oni oni oni oni oni oni oni oni oni oni oni oni oni oni oni oni oni oni oni oni oni oni oni oni oni oni oni oni oni oni oni oni oni oni oni oni oni oni oni oni oni oni oni oni oni oni oni oni oni oni oni oni oni oni oni oni oni oni oni oni oni oni oni oni oni oni oni oni oni oni oni oni oni oni oni oni oni oni oni oni oni oni oni oni oni oni oni oni oni oni oni oni oni oni oni oni oni oni oni oni oni oni oni oni oni oni oni oni oni oni oni oni oni oni oni oni oni oni oni oni oni oni oni oni oni oni oni oni oni oni oni oni oni oni oni oni oni oni oni oni oni oni oni oni oni oni oni oni oni oni oni oni oni oni oni oni oni oni oni oni oni oni oni oni oni oni oni oni oni oni oni oni oni oni oni oni oni oni oni oni oni oni oni oni oni oni oni oni oni oni oni oni oni oni oni oni oni oni oni oni oni oni oni oni oni oni oni oni oni oni oni oni oni oni oni oni oni oni oni oni oni oni oni oni oni oni oni oni oni oni oni oni oni oni oni oni oni oni oni oni oni oni oni oni oni oni oni oni oni oni oni oni oni oni oni oni oni oni oni oni oni oni oni oni oni oni oni oni oni oni oni oni oni oni oni oni oni oni oni oni oni oni oni oni oni oni oni oni oni oni oni oni oni Pozdravljam ga."
1:45:02,1:45:03,Ako će gledati podcast.
1:45:03,1:45:05,"O, hoće poslati mu link."
1:45:06,1:45:06,Ja sam pa kad.
1:45:07,1:45:08,"Znači, ostavili ste u kontaktu."
1:45:09,1:45:12,"Ja ću jednu splitsku, ovako iz Splita."
1:45:12,1:45:14,"Poljud, nije tekma."
1:45:17,1:45:19,E sad da skratim.
1:45:20,1:45:26,"Kad smo došli prve godine na ultru, imali smo kao dvije smjene, dnevna i noćna sezvala."
1:45:26,1:45:31,"Prva je bila, onajmo reći od ne znam kad smo izložili, od šest sedam pa do ponoći."
1:45:31,1:45:40,"Znači, to je ono kad radimo s ljudima, a u ponoći već bude previše ljudi, preglosna glazba, a druga je ujutro od pet kad se ugasi glazba, kad svi ljudi odu."
1:45:41,1:45:54,"Znači, cilj ove prve je bilo evangelizacija, razgovor s ljudima, a cilj druge službe je bio, ugasi glazba, ode 40-50 tisuća ljudi, sigurno će ostati neko pijan, drogiran, ležati, izgubljen, najmo mu pomoć."
1:45:55,1:46:04,"I kako mi, ono ljudi koji su vidjeli, ja imam, moja uniforma je crvena, crna reverenda, bit će crvena, ovo je Božji znak, neki sigurno."
1:46:05,1:46:13,"Imaš ovaj veliki križ ovakav tu i sad ovaj prvi dio sam uvijek bio s križem, jer taj križ, ono, privlači, zvoni mi mobitel, ne znam, smijem javiti."
1:46:13,1:46:16,"Oko glava, pita gdje si?"
1:46:16,1:46:18,Nije pogledavao.
1:46:20,1:46:26,"Prvi sam dio išao s križe, jer je taj križ veliki znak koji privlači sve poglede, a drugi dio sam išao bez križa."
1:46:28,1:46:33,"Ne mogu ga sad tu pokazati, ali je velik križ i ako nekog traž podići ili nešto, mogu ga samo probosti."
1:46:35,1:46:42,"I sad prvo jutro, kurkuti ja šetam oko polju da idu dva policajca, naglašavam Split."
1:46:44,1:46:48,"I sad taj policajac kuže mene u toj haljeni, kurkuti je bio, on ima neki svoj princip."
1:46:48,1:46:51,I koji je u principu i nosi ovako ležajno.
1:46:52,1:46:56,"I sad policajci, ono što je u pitanju, što hodate, šta kao po gradu."
1:46:58,1:47:13,"I sad policajci, ali nam je to uvijek bio hin za priču, razgovarati sve, i sad možemo, ali približavamo se oproti svemu, pa tu smo, u čemu je problem, i sve ono što su tu ukradili."
1:47:17,1:47:20,"Ne znam zašto je ovo puno, ali ti pravi pop."
1:47:22,1:47:24,"Ja kažem, ti pravi policajci."
1:47:24,1:47:27,"Kaže, možda ima uniformu ovako, imam i ono."
1:47:28,1:47:34,"A kažemo, nije to nego jučer naveč, kažem, po polju je tu neka budaletina s ovakvim križem velikim hoda okolo."
1:47:34,1:47:37,"Kaže, znači, i ta sam bio ja."
1:47:39,1:47:39,To je ta stvar.
1:47:40,1:47:41,"Ima, ima takvih, ima scena."
1:47:42,1:47:45,Blagoslov obitelji je stvarno nešto gdje ti imaš ono.
1:47:45,1:47:46,To treba snimati.
1:47:46,1:47:47,"Znači, ono ono što je film."
1:47:47,1:48:00,"Scenaka ti, mislim, ja poštujem stvarno svakog čovjeka koji nas primi u kuću, ali imaš ljudi koji stvarno, ono ja sam doživio u župi, jedno i tu neću reći, koji da ja sa stolom pozvonim."
1:48:00,1:48:04,"Oni im otvori gospođa vrata, ali nisi Marija, dobar dan."
1:48:04,1:48:05,Izvolite.
1:48:05,1:48:09,A mi smo ono kao imamo na popisu u Zagrebu se često mijenjaju podstanari.
1:48:09,1:48:12,Onda ti ono stvarno ljudi otvori i oni se otvori unutra.
1:48:12,1:48:15,"Da, ono, a vi ste našo ono za blagoslovo."
1:48:16,1:48:16,A što je to?
1:48:18,1:48:26,"Pa blagoslovo obitelji, ono skropilo, da, ono, znači ljudi pustite unutra, poštuje, ali što ćete vi sad raditi?"
1:48:27,1:48:28,Zašto ste vi sad došli?
1:48:29,1:48:35,"I tu bude ono, ministranice obično počnu smijati, ovo i to nekad ja, ali ono ima takvih nekih scena da ono stvaraju."
1:48:35,1:48:42,"Prvog je blagoslova sad bilo super ove godine smo išli cijelu župu, prošle godine nismo, samo jedan dio."
1:48:43,1:48:52,"I sad ima puno ljudi koji ne znaju da sad, to ja sam na toj župi godinu i pol dana i ljudi koji možda i ne idu redovito tu i tako ne znaju me."
1:48:52,1:49:10,"I pogotovo ti stari ljudi koji ne mogu, znači sad dođe i na ono, znači neko, znači zbrijana glava s bradom i onaj ja svećenik, znači onda su tako neki ljudi, ja sam onaj kao, ma ti si jehovi, svjedok, onaj ja nisam, pa oni ovako izgledaju na stola, pa nećeš ti meni ukući ono."
1:49:10,1:49:15,Ja sam tada trebao razmišljati kako ću ono naš neku šemu da ljude skuže.
1:49:15,1:49:21,"Jednom ljude pozvoni, naravno, misli im o popisu, to su zgrade, ljudi i tako dalje, obitelji koje se blagoslivljaju."
1:49:22,1:49:31,"I kad bi ga to neko od otvori, ako je ono zbunja šta on vidi, ja bi onda samo opuštao i rekao, šta je Haniš Marija, hoćemo blagosloviti ili nećemo naš?"
1:49:31,1:49:32,I svi puštamo.
1:49:32,1:49:34,"Samo daj, samo daj, taj naš."
1:49:36,1:49:37,"Dobro, idemo na."
1:49:38,1:49:42,Smijemo pobjeći kratko iz podkasta?
1:49:42,1:49:43,"Ne, dobro."
1:49:43,1:49:46,"Kaže Matija da ne, kam je pobjegao."
1:49:46,1:49:47,Ne smije reći.
1:49:47,1:49:48,Dobro.
1:49:48,1:49:50,A bolje povičeno nego tipka povičeno.
1:49:51,1:49:51,Ali.
1:49:52,1:49:55,"Bogoslavlje me pitaju kad je mi sad ujutro, evo, i sad to moram odgovoriti."
1:49:56,1:49:58,Sad stavimo u 11.
1:49:58,1:49:59,Pa da mi ovdje u djece zance da.
1:50:01,1:50:08,"Dobro, s obzirom da neki neka moraju ići, ovo će biti dobar argument za to da na ova pitanja imamo kraće odgovore."
1:50:09,1:50:13,Hvala svima koji ste slali svoja pitanja na najavljenu temu u naš inbox.
1:50:13,1:50:22,"Probrali smo neka od njih, neka od njih smo koji do sad uvijek već ubacili gore u ova prva pitanja, pa idemo redom."
1:50:22,1:50:25,Prvo pitanje smo već imali.
1:50:25,1:50:30,kako ste zadovoljni sa svećeničkom formacijom i gdje vidite prostora za poboljšanje iste.
1:50:30,1:50:31,To jesmo.
1:50:31,1:50:34,"Kad osjetite poziv, kako znate u koji ćete redući?"
1:50:34,1:50:36,"Franjevci, Talijanci, Dijaceza."
1:50:37,1:50:41,Ti si priča za Patera Limića koji je to na jedno dosta naravno razinu spustio.
1:50:42,1:50:42,Pa da.
1:50:43,1:50:43,Hvala.
1:50:44,1:50:53,"Ja sam, dok nisam uopće pojma imao što su redovi, što je Dijaceza, što je susreo web stranicu i kasnije mi se nare krvi Kristove."
1:50:53,1:51:01,"Znači tako da ja ću reći opet, prije nego što sam ja odlučivao, Bog mi je pokazao o kom se radi i danas kad znam sve, ja vjerujem da bi."
1:51:01,1:51:03,opet izabrao misionare krvi Kristove.
1:51:03,1:51:16,"Ali sad kad neko mene dođe i kaže, evo ja bih htio biti svećenik, razmišljam o tome i sve, tu isto važno je ono upoznati čovjeka, vidjeti što ga zanima, kakav je, što bih htio."
1:51:16,1:51:26,"Je li voli raditi s ljudima, je li ga zanima, ne znam, ono bih htio biti djecezanski župnik, biti na župi, je li bih htio posvetiti ono svoj život tišini, moliti u razmatranju."
1:51:26,1:51:37,"I sad to su ono, ajmo reći, imaš kontemplativne redove, ne znam, benediktince, kartuzijance koji posvećuju se molitvi i šutnji, nemoj komunicirati s publikom."
1:51:39,1:51:40,Imaš aktivne znači.
1:51:41,1:51:41,To je ono važno.
1:51:43,1:51:48,"Ako želiš biti liječnik, izabrat ćeš poslije možda neku specializaciju što te više zanima."
1:51:50,1:51:51,Tako da je ovo važan taj dio.
1:51:51,1:51:55,"Svoje bogo slova kažeš da samo misionari krvi Kristove, nema druge."
1:51:56,1:51:56,Ali sada ne.
1:51:57,1:51:59,"Ne, oni kažu samo ono gdje je Ceza."
1:52:00,1:52:05,"Ja njima samo pokažem Mirka i kažem, evo, vidite, ako ne budete bili dobri misionari, evo što vas čeka."
1:52:05,1:52:18,"Ne, imao sam situaciju konkretnu, ne bih htio sad to neću u intimnu dijeliti, ali dečko koji je došao k nama rekao je da bi htio biti časni brat, ali bi volio služiti bolnicima u bolnici."
1:52:18,1:52:30,"Sagleda, realno mi to u Hrvatskoj nećemo raditi još dugo godina, a postoji bolnički brat u strancu i ne bi bilo fair da ja sad njega pokušavam zadržati kod nas ako želi raditi nešto što neki red u Hrvatskoj već radi."
1:52:31,1:52:35,"Znači, rad s bolnicima, rekao sam mu da se javi njima, jel im se javio, ne znamo."
1:52:35,1:52:40,"Ali to je sada ta stvar gdje ako mi neko dođe i kaže ja bih htio provesti vrijeme u šutnji, nečko je djece zancima poslao."
1:52:42,1:52:43,"Kartuzija, naša ona, to je."
1:52:44,1:52:44,Da.
1:52:45,1:52:48,"Dalje, kako vidite olog laika?"
1:52:48,1:52:51,Katologa lajka u pastoralu?
1:52:53,1:52:54,"Ajde, reci."
1:52:56,1:52:56,Prevaži.
1:52:56,1:52:57,Prevaži se.
1:52:57,1:53:00,"Lajci, prevaži se stvarno mi svećenici."
1:53:02,1:53:09,"Ako ćemo sve sami to na župi u pastoralu, onda se u stvari dogodi ono što smo malo prije spomenuli, izgubiš sebe u stvari."
1:53:09,1:53:10,Sad ćeš ti pogoditi.
1:53:10,1:53:12,Zašto bi imao sve jeronauke na župi?
1:53:13,1:53:24,"Ako imaš tu stvarno toliko kvalitetnih ljudi i mladih i srednje dobi, koji se tu i žele da, koji stvarno žele služiti svojoj župi, svojoj zajednici."
1:53:25,1:53:33,"Tako da ne bih sad neko pustio dalje, ali definitivno prevažni su laici, ono prevo šta vi radite, vi ste laici čovječe."
1:53:34,1:53:49,"Ovo je stvarno velika evangelizacija, navještaj, tolika srca dira, toliki se životi mijenjaju, ne znam, zbog jednog podnosnika običnog podcast, ja se ne bih ka tome posvetio ni Stjepanji, ni Don Damir."
1:53:49,1:53:54,"Drugi Vatikanski kožiš, otvoriti se i onda surađivati više s narodom Božjim."
1:53:55,1:54:01,"I stvarno je, nama se, mi imamo laičku zajednicu krvi Kristove, kožiš koji nam isto."
1:54:02,1:54:02,To nismo.
1:54:02,1:54:03,Previše.
1:54:03,1:54:07,"Da, lajička zajednica krvi kristove, koji isto pomažu nam u hrpu tehničkih stvari."
1:54:08,1:54:09,Od održavanja kuća.
1:54:09,1:54:15,"Znači, našu kuću u prozoru, u Pe, majstore, bro."
1:54:15,1:54:19,"Da, što sam htio reći, da ćemo ti nakon ovoga, ali možeš i sam uzeti."
1:54:20,1:54:21,"Da, malo."
1:54:21,1:54:23,"Poslušajmo, vidjet ćemo ovo rezati ili ne."
1:54:23,1:54:27,"Dobro, pa ja ne bi, nek svi vide, od djece za nju."
1:54:29,1:55:27,"Ta suradnja sa lajcima, koji je konkretno naš duhovni centar, diti bude preko vikenda grupa od pedeset pet ljudi oni kad dođu u traku će očistiti znači oni nam pomognu tu ako neće oni mi ćemo znači nema tamo još uvijek uvjeta da se zaposle ljudi da nego ono u tim nekim stvarima tehničkim stvarno su ogromna pomoć jer ne može zamijeniti ali i ovo njihova svjedočanstva znači evo sad konkretna situacija bili smo zajedno na ultri meni su uvijek kad sad nakon su prošli ultra tebe zove neko idej ma nemoj mene ja ako svećenik ono meni su čuli već tisuću puta te tamo ono ne znam mariju petru josip da nek ti oni kažu svoje iskustvo jel to je ono što ja mislim da će više ljudima znači, gledaj, jedan student koji je mogao, meni je to posao na neki način služba, ali netko tko je izdvojio svoje vrijeme, novac i sve i došao tamo na ultru, mene osobno zanima njegovo svjedočanstvo, gledaj, od mene se to očekuje."
1:55:28,1:55:49,"Zato mislim da stvarno laici su veliko bogatstvo, ali naravno opet mora se znati ono, nekad si laici uzmu previše, to je dio koji mi opet moramo ih i poučiti, moraju znati i imati dobru tu suradnju, kontakt, ali opet kako da."
1:55:49,1:55:50,Kako da to sad kažem?
1:55:51,1:55:56,"Uvijek se vraćamo na to, jako puno problema iz crkve dolazi zbog neznanja, zbog neupućenosti."
1:55:57,1:56:03,"Znači, ljudi izbacuju neke, pa evo u vremenu korone, stvarno gdje smo se podijelili, izbacuju neke ono flosku leito i sve."
1:56:03,1:56:06,"Kad malo s njima kreneš, pričaš, oni uopće ne znaju o čemu se radi."
1:56:08,1:56:14,"Veliki je problem neupućenost, ali mislim na lajci stvarno je veliko bogatstvo crkve."
1:56:14,1:56:16,Crkva i oni su crkva kao i mi.
1:56:18,1:56:20,"Mirko, ti kad si spreman, možeš se slobodno vratiti?"
1:56:20,1:56:21,"Nije, nije otišao dalje."
1:56:22,1:56:23,Pređe preko cijelog kadra.
1:56:24,1:56:26,Mejna je pojam na zum.
1:56:26,1:56:28,"Znači, mlijetovanje."
1:56:35,1:56:38,"Znači, što ste bitno vremenske zone na vaš putovanje kroz vrijeme?"
1:56:40,1:56:43,"Ok, evo još par kratkih pitanja."
1:56:47,1:56:48,"Da, nešto u novom."
1:56:48,1:56:50,Nisi se složio sigurno sa Stepanom za ulogu lajka.
1:56:51,1:56:57,"Što se tiče idućeg pitanja, treba li sve će nekim imati mogućnost žene?"
1:56:58,1:56:58,Ma kako će.
1:57:00,1:57:00,Hvala.
1:57:01,1:57:23,"To je onako jedno pitanje koje je, evo ja naprimjer dosta putujem po Hrvatskoj, obilazim župe i to pitanje celibata općenito najveći argument za ukidanje celibata je kad ti dođeš na jednu župu, na neki otok, ne znam koji je ono ili u neko selo koje je zabačeno negdje i sve i župnik je tamo sam i on ima realno dva sata posla dnevno."
1:57:23,1:57:37,"Znači njega ta samoća košta, to je sad jedna krajnost i u takvoj situaciji kada vidim takvog svećenika, meni to razmišljanje o ukidanju celibata je ono ozbiljna stvar, to je čovjek je sam."
1:57:38,1:57:40,"Njega ta sama oča, baš ga može ubiti."
1:57:41,1:57:47,"A druga stvar, onda dođeš u jedan Zagreb, dio ono svećenike, ne stigneš ono ništa."
1:57:47,1:57:56,"I sad tu je po meni nemoguće da čovjek ovdje još u službu na župi, ne znam nija i sve, to još se brine za svoju obitelj."
1:57:56,1:57:56,Ne znam nija i sve.
1:57:57,1:58:01,"E sad to je stvar o kojoj crkva uvijek promišlja, uvijek razmišlja."
1:58:01,1:58:09,"Bilo je vremena u povijesti, ima i danas, grko-katolici, gdje je crkva redi oženjene muškarce."
1:58:09,1:58:13,"Svećenici se nikad neće moći ženiti, nego će moći biti zaređeni u određenoj."
1:58:14,1:58:16,Jesu oni jednaki onda?
1:58:17,1:58:41,"Da li oženjeni muškarac koji bi bili da, da, da, da, drukčije, malo, ali evo ja sam u Poljskoj, u Poljskoj sam živio godinu dana i tamo sam zajedno u ovoj školi odgojitelja u Krakovu su bili s nama grko-katolici, znači ono uz dužno poštovanje, ali ti oženjeni, mi imamo problem sa duhovnošću, znači sa duhovnim životom, ja mislim da je kod njih to opet iz mog deset puta gore."
1:58:42,1:58:50,Znači njima svećeništvo postaje ono doslovno posao sa radnim vremenom nakon kojeg oni odlaze u svoju obitelj i ono ne zanima me više ono.
1:58:50,1:58:52,Znači ono neka to stvarno tako izgleda.
1:58:52,1:58:59,"Mi smo imali duhovne vježbe od tjedan dana u šutnji, bilo je tamo par tih grko katolika koji oni više da oni ne znaju što bi s tim uopće."
1:59:00,1:59:06,"Znači oni, ono više mi smo u šutnji, sad i to sjedimo u parku, ono vidim, ekipa odlazi van negdje i sve."
1:59:06,1:59:11,"Znači mislim da je teško da u današnjem svijetu, na neki način si podijeljen."
1:59:13,1:59:33,"Mi smo možda spomenuli na prije, ne znam, krize neke u Bogoslovi, u toj formaciji, meni kako se, ono bilo je, vjerujem da i tebi bilo i tako, ali meni je nekako se približavalo ređenje, ja sam sve više uviđala i fotu braka, koliko je brak predivan, prevelik zbog svih stvari i težak, ali predivan."
