Start (HH:MM:SS),End (HH:MM:SS),Segment
0:24:44,0:25:13,"Za nas, djece izanske svećenike, je nekako uobičajnije da smo, ajmo reći, solo i gracijom, da smo, ne znam, češće smo, sami smo na župama, evo, taj jedan način života samotnjački, evo, ja sad na mojoj župi, ja sam pomoćnik jednom svećeniku, nas smo dvojica, evo, na takvim malo većim župama, eventualno su dva svećenika, evo, doli mi imamo, čini mi se, tri, dvije župe samo u cijeloj biskupi gdje su tri svećenika, djeca izanske."
0:25:13,0:25:14,"Kad je Cezanska, to je sad neobično malo."
0:25:15,0:25:29,"Tako da evo, ja, na primjer, kao djeca, Cezanski svećenik, ja sam sebi sve kreira po onome šta ima nekakve obveze u dogovoru sa svojim župnikom, ovo sve ostalo."
0:25:30,0:25:38,"Na primjer, ja sam molim, časosloveno, ja sam molim, to je nešto što je koji nije prisutno u zajednici, onda zajedno mole i tako."
0:25:40,0:25:46,"To recimo na prvo bi rekao, ako su perovci samo može određivati, ali to teže možda određivati."
0:25:47,0:25:49,Ja bih rekao ako meni.
0:25:49,0:26:03,"Meni nije, kad se dogodilo toliko poziva, prvi svećenik s kojim sam pričao, opet ga spominjem, to je frazvjezdan, jer tada nakon Božića, ne znam s kim sam išao, ali išao sam duhovno u jednu vašu tamu, u Samobor."
0:26:04,0:26:06,I on je bio prvi svećenik s kojim sam pričao.
0:26:06,0:26:16,"Ja sam mu rekao šta mi se dogodilo, govorim frazvjezdan, znači to i to se dogodilo, znači sam puka, mislim da nisam i tako, i onda mi je on tako potvrdio da nisam puka u tom smislu."
0:26:18,0:26:22,"A ja sam s njim rekao, ništa me ne zanima, samo mi reci ti."
0:26:23,0:26:28,"Znači ja sam spreman di god., ostao u Splitu, otići u Zanzibar, nemam pojma, di god."
0:26:30,0:26:46,"Jednog dana on meni rekao nešto što me tada razočarala, sve je da je stvarno Božji način, Božja pedagogija, rekao Miro, ti ćeš sad molit, ti ćeš razmišljat, ti ćeš, tebi poznajš sebe, pričaj s Bogom, vidi tebe takova kakav jesi, on može najviše iskoristiti."
0:26:47,0:26:54,"I ono u tom prvom trenutku se pomisli, a krade si, pa onda ti besa, ona je stasim."
0:26:54,0:27:06,"A onda kad se vrati kući, kad se stvarno samo ide se toga držat, ja sam baš sjedio i tada svećenik on nakon toga priča, da recimo, ono redovništvo, frater, ovaj onaj lovi desni, djecezanski svećenik, koja je razlika?"
0:27:07,0:27:16,"I meni iskreno, čin mi je ovaj objasnio da ti kao djecezanski svećenik da si pod navodnike solo igrač, mene je to, ja sam tu sebe vidio."
0:27:17,0:27:22,"Znači, takav sam, volio i tu sam oču i sam sebi sve to kreirati itd."
0:27:23,0:27:30,"Međutim, evo, svaka sam postao svećenik, kroz bogoslove nama su govorili jako puno važno je, zajedništvo važno itd."
0:27:30,0:27:34,"Međutim, šta pričaš o zajedništvu, idem sam na župu, šalješ me samog na župu."
0:27:34,0:27:37,Ali ja stvarno evo sad vidim kroz ove moje dvije.
0:27:37,0:27:41,u dvapet godine svećenstva da bez toga doviđenja.
0:27:41,0:27:47,"Znači, da ja nemam kao djeceizantski svećenik zajedništvo s ovom drugom braćom svećenicima doviđenja."
0:27:47,0:27:50,"Evo da vidim da mi najvažnija nama je odnos s Bogom, ali da nije dovoljna."
0:27:51,0:28:07,"Bez ovoga odnosa s drugim, s drugom braćom svećenicima ono jednostavno se pogubiš jer tolike su neke nepredvidive situacije pogotovo za nas mlade svećenike, ono koje nisi očekivao, koje da si zna da će biti pobigavi, ono ne bi se zaredio isto kao u braku, no da si zna neke stvari koje će doći na pobigavi."
0:28:07,0:28:13,"Evo, nitko sretniji od mene, od tebe šta ipak nismo pobjegli, sad smo tu u tome, ali ne možete nitko vam to pripremiti.."
0:28:13,0:28:34,"I onda evo meni to zlata vrijedi, evo moja mama, ta braća svećenici s kojima sam tu i stalno smo skupa i zajedno im molimo i zajedno ćemo ono ne znam i podružiti i zezati se i ozbiljno i jer ono jedino me drugi svećenik može do kraja razumjeti u mojim nekim mukama, ali i u mojim nekim radostima kad se kasnije i tako i dobre stvari događaju."
0:28:34,0:28:43,"Tako da evo to bi rekao ono da je to nešto što je za nas, za te sezonske svećenike prevažno, to zajedništvo s drugim svećenicima na malo drugačiji način."
0:28:44,0:28:50,"Da, ono mi kod redovnika je naglašen baš taj zajednički život, gdje smo mi od nas trenutno živi osam samostalno."
0:28:50,0:28:55,"Znači sad nema ono i taj dnevni red, on se može probuditi u jedanaest kožeš."
0:28:55,0:29:14,"Ja imam molitvu ili misu ujutro u šest u pola sedam i nema to sad ja ću, može se dogoditi ako sedam do peto ne znam koji danas budemo snimali do jedan ujutro ne moram se ja ustati ujutro, ako ima misu moram, ako ima molitvu ostaću spavati, ali ono mi smo zajedno, nas osam, to su ljudi koji ja sebi nisam izabrao."
0:29:14,0:29:21,"To je kao da sad ono iše šira ljudi s kojima ne znam, ti radiš u firmi, netko izabere vas osam, a Bog je tako izabrao ljude i stavio ih pod isti krov."
0:29:21,0:29:36,"Znači to nisu ljudi s kojima ti super prijatelji, sa onim se neće drugo društvo, ovo mi ne paše, nego nekad je ono netko, evo mi kad smo gledali svjetsko prvenstvo, znači ono od nas osam dvojicu to ne zanima."
0:29:37,0:29:47,"Malo, ja idem ne znam šetat ono, idem čitati knjigu, ono što znači kad ideš, nošeno debi, evo, traje nam još četiri ruke, znaš za navijanje, ono, nema nega to ne zanima."
0:29:48,0:30:05,"Ali to je sad jedna stvar, imaš milijun takvih stvari, gdje smo mi totalno različiti, a moramo živjeti zajedno i to je, teško je to, znači to je zahtjevno i tu, ja kažem bez poziva na redovništvo, ali opet vraćam se na pitanje poziva, ako mene Bog pozove u redovnike u zajednicu onda je to mjesto za mene."
0:30:05,0:30:15,"Ja sam bio, postuđe najmo reći bi skupi, bio sam, bio sam godinu u Čučerju ali sam živio samostalno, putovao, ali tri godine sam živio na Župi, djecezanskoj i dugom selu kao kapelan."
0:30:15,0:30:22,"Ovo kada on kaže pomoćnik to je kapelan, ljudi će krivo shvatiti pomoćnik, ono našlo više da ne znam neko ugalj tovar ili nešto, kapelan."
0:30:24,0:31:03,"I sad, bili smo nas dvojica i mi bi se našli na doručku, ne znam ni ja to, ali gledati ono nedjelja navečer, imaš, mislim, devet navečer, dođeš i sam si, ne znam, župnik je ošao negdje ili ne znam, gledao u svoju sobi film, ti bi onda s nekim bi nešto, ja osjećam u sebi tu i sad super, iz početka meni je bilo super, gledaj ne vidiš ono braću koja te žuciraju, ali u nekom trenutku, gledaj, ja bi onda probudio se ujutro, ja bi s nekim sjeo, popio kavu i onda ja sam osjetio kod sebe, ja sam počeo tražiti masu izvana toga našu, osjećaj da je ono, ja sad ne znam, evo danas ako ne dođem prekasno kući, doći ću tamo, WhatsApp grupa je braću o čko popit nešto, ne znam, ajmo sjesti."
0:31:03,0:31:13,"I od njih osam doće jedan dvojica ili svi, znači imaš taj neki ili ono ujutro sa doručkom, u Dadorućkom smo uglavnom svi, ali naručka, znači netko će doći, imaš potrebu s ne nekim."
0:31:13,0:31:14,Eto je ta stvar koja je.
0:31:15,0:31:18,"Taj zajednički život, koliko je lijep, toliko je zahtjevan naš."
0:31:18,0:31:21,Ja se ne mogu dopustiti da sad s nekim tamo.
0:31:21,0:31:25,"Moj oe mi ne paši, on ne gleda nogomet, neću s njim pričati našo."
0:31:26,0:31:27,Je li navijao za Hajduk?
0:31:27,0:31:28,"Da, je li navijao za Hajduk?"
0:31:28,0:31:31,"Dobro, ja volim isto Hajduk naš, ali volio sam kad bih si bavio."
0:31:33,0:31:39,Kako ti se onda trebalo sada tražiti svoju vrstu dozvolu da dođeš na podcast i da ti to uzme dio večeri?
0:31:40,0:31:43,"Pa da, mislim imaš neke stvari koje su."
0:31:44,0:31:47,"Nije to ona vojnička poslušnost, da ja sad za svaku sitnicu moram."
0:31:48,0:31:55,"nama kako je naš Gašpardel Buffalo utemelio misionare Krvi i Kristove, znači apostolat je nekako najvažniji."
0:31:55,0:32:42,"Druga stvar da sam ja sad rekao idem ja sad po dana ne znam na sljeve ono, ja bih rekao taj jedan, mi smo se dogovorili naprimjer ako mene nema u kući ono, tko preuzima moj dio i sve, ali ovaj, nije sada ja za svaku sitnicu moram zvati po glavara i pitat tko u vojsci ono na zapovjed, nego neke stvari se podrazumijevaju, mi se dogovaramo između sebe, gledano sutra ujutro je misa, tko će imati, tko će ovo, tko će i sada ako je jedan svećenik u kući, drugi može otići negdje, ono, dogovaramo se, sve ono konkretno danas je rijetko kad smo mi svi u kući, ali stvarno, jedan je ne znam, negdje na duhovnim vježbama, jedan vodi rodnevnicu, jedan je ne znam na snimanju podcasta, jedan je ono naš različito, netko je zaspao, dogodi se i to naš, ja mijenjam Mirka, ali je Mirko sad došao na podcast, netko u Splitu mora mijenjati."
0:32:44,0:32:53,"Čekaj, daj mi samo još reći unutar zajednice, koje trenuci su vam u pravilu zajednički, znači postoje iznimke, ja kažem u jedan dan, ujutro, današnje."
0:32:53,0:33:01,"Na šta je meni sad, mi snimamo u ponedjeljak, u četvrtak užiš, onda se mijenja, da pričamo o ponedjeljku, u četvrtak užiš, onda se mijenja, da pričamo o ponedjeljku, u četvrtak užiš, može ponedjeljak."
0:33:02,0:33:08,"Ono kad si rekao da su došli iz Vinkovaca, ono viče mama na TV da sam bio u Vinkovcima da se nisam javio."
0:33:09,0:33:26,"Pa da, ponedjeljak ujutro, evo danas, mislim da su u pola sedam, ja sam putovao iz Vinkovaca ponedjeljak, u pola sedam su Bogoslovi imali jutarnji časoslov, znači časoslov, nešto što molimo mi svećenici i pola sata zajedničko razmatranje."
0:33:26,0:33:28,Znači razmatramo sve to pismo u grupi.
0:33:28,0:33:37,Znači ajmo reći časoslovi za razmatranje traju neki trideset pet četrdeset minuta na prazno ako je netko usta se ranije pojavio nešto to je na njegovu slobodu naš.
0:33:37,0:33:41,"Nije to zabranjeno, ali u pravilu se ustaju pet minuta, deset prije."
0:33:42,0:33:49,"I nakon toga je doručak, znači doručak je sedam i petnaest, petnaest i dvadeset minuta, pola sata i onda idu na fakultet."
0:33:50,0:34:17,"E sad, jedan je na prvoj godini, jedan je na drugoj, jedan je na petoj, ono krene i sljedeća točka zajednička, znači u tom vremenu dok su oni na fakultetu ili nekad netko ostane kod kuće, mi, nas dvojica svećenika, ono imaš svoje dužnosti, pripremaš nešto, trebaš otići u nabavku, doći neko na ispovjedni razgovor, to je dopodne, u dvanaest i petnaest imamo srednji čas, opet dio časoslova i molimo nek neke molitve Krvi Kristovo, Janđo Gospodnji, nakon toga je ručak."
0:34:17,0:34:25,"E sad opet nakon ručka, ja obično petnaest i dvadeset minuta odspao nakon ručka, to mi je ono, ali stvarno volim to i ono, sve to vrijeme isto meni."
0:34:25,0:34:35,"Ovaj, nakon toga opet Janče učiti, jedan će, ne znam, evo danas kad sam ja odlazio ponedjeljak, dječki su ne znam kosili travu, sređivali su vrt."
0:34:36,0:34:49,"Ovaj, sljedeća točka, ponedjeljak je u pola šest i krunica, zajednička, sveta misa, večera i mi imamo navečer formacijski susret, znači s Bogoslovima.ima."
0:34:49,0:34:52,"E to ti je sad neki kostur, ali se to mijenja."
0:34:53,0:34:57,"Znači, ali to je sad puno, svaki dan je drukčiji, svaki od sedam dana je drukčiji."
0:34:58,0:35:03,Ti imaš konkretno puno molitvenih trenutaka koji su zadani kao zajednički.
0:35:03,0:35:04,"Da, zadani kao zajednički."
0:35:05,0:35:10,Kaj od toga imaš ili imaš još nekakve svoje osobne trenutke za molitvu?
0:35:11,0:35:11,Imaš?
0:35:11,0:35:12,I kaj tad moliš?
0:35:12,0:35:17,"Ili imaš nekakvu omiljeni način molitve po Božjosti, otoklanjanje ili nešto slično?"
0:35:18,0:35:32,"Jedan je od mojih običaja, imamo zajedničko klanjanje recimo četvrtkom kad svako ima sat vremena, imaš pred presvetim, dogovorimo se na ručku koče u jedan, dva, tri, četiri, ali neko pravilo da imaš sat vremena."
0:35:33,0:36:01,"Ja imam neki običaj gotovo svaki dan, osim ako ne dođem kasno kući, pola sata ujutro ili dvadeset minuta, to neko razmatranje u tišini i najčešće kad se probudim u svojoj sobi poslušam komentare ima jedan poljski svećenik, Vegžinek, ako budeš poslušam, znači ima komentar prvog čitanja psalma i evanđelja, to traje nekih pet šest minuta, to poslušam u svojoj sobi i onda se spustimo u kapelicu dvadeset minuta pola sata."
0:36:01,0:36:03,Volim početi sa razmatranjem dnevničkog.
0:36:03,0:36:15,"E sad, hoću ja tamo nastaviti razmatranje pa pogledati još koji komentar ili ću ono razmišljati o tome ili ću naći, ali volim taj prije tog zajedničkog, ima taj jedan svoj trenutak."
0:36:15,0:36:40,"A dalje u danu, gledajte, danas sam putovao i kad sam došao u Zagreb, sjeo sam, nisam otišao kući direktno, ali sam znao kad odem kući da je gotovo, nego sam sjeo u auto i odgovarao na poruke i onda sam se ono zamislio, sutra imam Sveti Ante, imam utorak, dobro to je sad bilo prekjučer, znači, ja I onda sam razmišljao što ja znam uopće o svemu tom antiku."
0:36:40,0:36:48,"O tome sam ono odveo me to u, ajmo reći, molio sam, razmatrao sam, ali nije to bio taj trenutak koji sam ja isplanirao, nego je došao spontano."
0:36:48,0:36:55,"Znaš, tako da ono, nemaš tih nekih, da li taj jutarni diop, više sam jutarni tip nego večernji."
0:36:55,0:36:56,Što se kod mene promijenilo?
0:36:56,0:37:09,"Prije ono, nekad kad je mama, dok nisam radio, bio sam nezaposleno jedno vrijeme, mama je znala doći u tri popodne s posla i budit nas, braću, da idemo na ručak ujutro."
0:37:12,0:37:16,Ti nemáš zajednički.ke trenutke ili imaš sad kad si sjedim s svećenikom?
0:37:17,0:37:18,Moli te ili nešto?
0:37:18,0:37:18,Nemaš.
0:37:18,0:37:21,Kako izgleda tvoj molitveni dan?
0:37:21,0:37:25,I kaj preferiraš od molitve po Božjoj?
0:37:25,0:37:31,Otvoriti se rupa u rasporedu od 3 sata na večer ako bacuješ molit u kajeto?
0:37:32,0:37:34,"Da, uglavnom se ne otvori rupa u 3 sata."
0:37:36,0:37:43,"Uz ono što je nama svećenicima u središtu, ta molitva častova, psalmi koji nisu smolija."
0:37:46,0:37:53,"Mene je najveće otkriće u Bogoslovi, bilo je puno otkrića, ali najveće mi je bilo."
0:37:55,0:38:04,"Mislim, baš kad je moja generacija došla u Bogosloviju, da je tada duhovnik uveo pod obavezno, čak da je pod grijeh, ako se ne držimo jedne stvari."
0:38:04,0:38:09,"A to je 15 minuta u Sisusu, predpresveti, svaki dan."
0:38:09,0:38:23,"Znači, kad god želiš, kad god želiš, ujutro, neki je ujutari, neki je večerni tip, tokom dana, u pauzi od fakse i tako dalje, ali biti 15 minuta pred Sisusom, te molitve srca, pa baš stvarati intimnost s njim."
0:38:23,0:38:24,Ja mislim da je u stvari.
0:38:24,0:38:41,ustvari da kroz to mi je najviše još Bog ono otkriva ono posljednje lipotu ono i kršćanstva i svećeništva itede Tako da to ono nešto šta ono želim ljubomorno čuvati tu intimnost Isusom pred presvetim.
0:38:41,0:38:49,"Sjećam se ono tamo sedmi i osmi razrede, u mom mama je već u tom periodu voljela odlična klanjanja, u no i tako spomenula sam u sestri."
0:38:50,0:38:53,"To onda bi ono, mene bi nekad, ajde, ide na klanjanje."
0:38:53,0:39:01,"Onda bi ja išao samo zato jer je ovaj, mojak je svi ja gitaru, ja sam volio gitaru, naša, ali bi mi to bilo toliko naporno i tako."
0:39:02,0:39:14,"Ali poslije ono kad znaš, kad ovo što si ti malo preka, nisam znao šta je to tamo, ja sam znao, ja sam znao da je tamo Isus, ovo ono, ali sad ti to nekako abstraktno, ne razmišljaš o tom utjelovljenju itd."
0:39:16,0:39:24,"Ali kad si ono malo počneš ulaziti u smisao, ljepotu toga, čekaš zašto to presveto, šta je to, šta se tu događa."
0:39:24,0:39:28,I onda meni je to postalo stvarno nešto što najviše čuvan.
0:39:32,0:40:11,"U Bogoslovi, evo iskreno u Bogoslovi mi je bilo puno, puno lakše i što se tiče osobne molitve, baš ovo što sam vam rekao, dnevni red, evo kad je sad priča, ne znam, jedan njihov ponedjeljak kao da je priča, to što smo mi imali u Bogoslovi, to je malo nama nezgodno na Župišta, čini mi se da većina od nas, pogotovo mladih svećenika kad dođemo tamo malo se pogubiš u početku, znači jer ono, tamo te je sve bilo izorganizirano i meni je taj dnevni red mi je ono me spasio u Bogoslovi, ja se sjećam, na dobu dana došao prvi dan predavanja i tako ja poslije ručka, sad ću a to malo ponoviti šta je bila predavanje."
0:40:11,0:40:16,"Tada meni moj Cimer koji poslije sam otkrio da se uopće toga ne drži, šta je meni rekao."
0:40:18,0:40:18,Dobro savjet.
0:40:21,0:40:24,"Slušajte što vam govore, ali ne ravnajte sa svojim dijakom."
0:40:24,0:40:25,Sve to pismo čovječe ono.
0:40:26,0:40:30,"Kažu meni, ma pusti sad to, Gari, sad je vrijeme odmora."
0:40:31,0:40:32,Drži se dnevnog reda.
0:40:32,0:40:33,Šta on ostane?
0:40:34,0:40:34,Šta on ostane?
0:40:34,0:40:35,Šta on bi još bio u sjemeni?
0:40:35,0:40:38,Šta on ima iskustva.
0:40:39,0:40:43,"I čuo ću ja to odlučiti tada, prvi par dana Bog uslovio, ako mi je to rekao."
0:40:44,0:40:48,"Čuo ću ono koje je zajedničko, molitva je, kad je družen, družen, predajanja itd."
0:40:49,0:40:50,"Kada odmor, odmaran."
0:40:52,0:40:54,I onda nekako naravno ide i učenje.
0:40:54,0:41:00,"I onda imaš te rupe u kojima to je vrijeme za osobnu molitvu, za biti s Bogom."
0:41:01,0:41:10,"Znači, meni se zna dogoditi da sam toliko izgažen da se srame to reći, ali da ne odem pred Isusa."
0:41:10,0:41:18,"Da me taj cijeli dan i onda ne znam, i budem i umoran, i možda možda i tužan zbog nekih situacija s ljudima, i ljut itd."
0:41:19,0:41:24,"Ali vidim da kad sam u najgorem stanju, fizičkom, psihičkom, duhom itd."
0:41:24,0:41:36,"Da ono što uvijek mogu, što je ono stvarno najveće, ono nekako blago i ono oružje, a to je krunica, to je marina blizina."
0:41:38,0:41:44,"Mene je uvijek bilo čudno, u mojoj obitelji se počela moliti krunica, tamo nekad sa krene osnovnu školu."
0:41:45,0:41:53,"I naravno isto ako ono, krunica će reći ono, utorak, liga, ako imate, gasi televiziju, znači u meni, a ne smiješ ništa."
0:41:54,0:41:56,"A ne smiješ ništa, kao što ti volite tu krunicu."
0:41:57,0:42:01,"Ali ja sam tada u tom periodu neka čuo da imam, pa o, drugi reka ili ne."
0:42:01,0:42:02,rekao ili negdje to sam protivnika.
0:42:02,0:42:04,Nemojte moliti krunicu ili ga provokati.
0:42:04,0:42:06,Kad igra Hajduke ime.
0:42:07,0:42:10,Da je on rekao da mu je najdraža molitva i najljepša molitva krunice.
0:42:11,0:42:12,"Pa čeka, stani Ivane."
0:42:12,0:42:14,"Ivane, Pavle, legendo."
0:42:14,0:42:16,"Znači, meni je stvarno njega volio."
0:42:16,0:42:19,"Mislim, ja sam imao deset godina kao on umra, 2005."
0:42:20,0:42:28,"Ali, ali me je baš nekako ostao u sjećanju, u srcu i ono imalo mi je težinu što god bi tako čuo nešto što je on rekao i mene je to i prouciralo."
0:42:28,0:42:31,"Pa kako ono čeka, je li se on zezao, je li ozbiljno?"
0:42:32,0:42:36,"Pa di ćemo to bi najdraže kradlo moj zdrav, Marija i tako dalje, vrti ponavljaj."
0:42:37,0:42:46,"I onda kroz srednju školu, evo spomenuo sam taj nekakav period kad se u meni se okrene stvari, išao sam na silu ono, ma ide na silu čovječe, to mora biti dobro, ta molitva."
0:42:46,0:42:49,"I onda to ono počneš moliti, počneš razmišljati pa zašto ta krunica?"
0:42:50,0:43:02,"Pa onda skužiš da na početku svakog od ta istva se kaže ono, razmišljat ćemo o tome, tome da ti u stvari ulaziš u ta odnos sa onoj Isusom, u taj njegov život, u tu njegovu ljudskost, u sve ono da ulaziš kroz tu krunicu."
0:43:03,0:43:13,"Tako da evo, i ono šta, još jedno, kroz Bogoslovio sam stvari otkriva snagu i važnost molitve, sve ti je to razumski jasno, ali to ono u."
0:43:13,0:43:28,"Ali kroz tu formaciju nekako baš opipaš i kušaš sve to skupa i meni je puno, puno ono, to prije nisam čuo, ja zato nisam išao u Bogoslovje, a to je ono lekcija od divina, da smatram Bože riječi, da ta riječ Božja meni stvarno progovara."
0:43:29,0:43:48,"Tako da, volio bih vratiti nešto što sam imao u Bogoslovi, a to je da se svaki dan bi, isto sam onaj jutarni tip i napreg ta tih 15 minuta s Isusom koji su nam bili obvezni, nas par bi napadalo ujutro, prva točka je u 6:30, mi smo u 5:28, smo mi dolje, imamo svojih sat vremena."
0:43:49,0:43:53,"i ono petnaest minuta toga pa razmatra Božju riječ, to je bilo tako ono dobro."
0:43:56,0:44:06,"I sad se evo trudi nekako stvarno to opet opet imati jer vidim da bez toga stvarno ne znaš ništa, ne znaš tada tu stvari, pogotovo bez klanjanja."
0:44:06,0:44:18,"Evo mene toliko mi je drago koliko mladi ljudi, mladi tvoji godina i mojih godina i tako ali više mojih godina, moj nažupi koliko zavole klanjanje."
0:44:19,0:44:33,"Kada ono stvarno i kroz taj evo i kad mi vodimo klanjanje da im pomogneš da uđu u to, ne da tamo nešto čitaš, da vrtiš svoje nešto, ovo, ono, nego da pomogneš tim mladima da se dovodi susret i koliko je to zavoljeno."
0:44:33,0:44:41,"A mi sve činimo ono šta imamo dati ljudima, ako konstantno ne primamo od Boga moliti, ništa sebe, a to je ono, to je ajmo."
0:44:43,0:44:49,"Kod nas je, neću sad sad to onako neboješ skivati, koliko li vajaka da gola, znači nitko ne očekuje ono paliti."
0:44:49,0:44:50,To se stalno će.
0:44:52,0:45:08,"Kod nas je ono, vraćam se sada na taj zajednički život naš, gdje je ono stalno to prilagođavanje drugo, pa ono čak i nekad molitveni život naš, imaš svoj neki plan, sad bi ja ne znam nešto molio i sve, ali onda ti dođe neki brat i kaže ajde idemo napraviti to ili treba otići ne na što umiranje sebi."
0:45:09,0:45:19,"Znači ja sad kažem ne znam, evo ja bi sad otišao u sobu ne znam izmoli deseticu krunice ili napravio si razmatraju neku pokušaj kaže kao nemamo ne znam jogurt ali možeš otići kupiti jogurt ono ili nešto."
0:45:20,0:45:36,I sad to je trenutak gdje meni ono neću reći da je važniji jogurt od molitve ali potreba tog brata i kod nas je puno tih situacija u danu kad se ne samo crno-bijele dobro i loše nego u stvari između dva dobra biraš.
0:45:36,0:45:36,Kužim.
0:45:39,0:45:58,"A ovo mi je jedna stvar koju ja sam tek otkrio, ajmo reći u praktičnom životu, na jednom predavanju, naš psiholog, svećenik predavao nam je psihologiju, nam je rekao da svećenik treba u danu imati dva sata zaraditi nešto što voli, što ga opušta."
0:45:59,0:46:11,"Nama je to bilo naš ideal, prva godina, svećenik Ante nije spavao, nije jeo, on je samo molio, imaš te neke svetačke ideale koji su izmišljeni, da tako kažem."
0:46:11,0:46:13,"I onda misliš, pa gdje ću ja sad raditi nešto, ja."
0:46:13,0:46:25,"će ja sad raditi nešto što ja volim, a ti skužiš ono, ne znam, ispovijedaš, pripremaš, tebi to treba, tebi treba jedno vrijeme di će se ti odmoriti, di će se upustiti, jer čovjek ne može funkcionirati drugčije."
0:46:25,0:46:43,"Znači, sad, to je isto važna stvar koju ti moraš naći, ono i, meni je znao nekad moj ili duhovnik ili ispovjednik reći ono je odmori se, za pokoru se odmori, ono što ti se ti glaša ono šta, satijante se nije odmarao, znači ono imaš te neke ideale koji su iskrivljeni, ali ti moraš funkcionirati kao normalan čovjek."
0:46:44,0:46:53,"Zašto je recimo sestrama, pustit ću vratiti, sestrama karmeličanka, zašto nije ima obavezna rekreacija, obavezno druženje ili obavezno spavanje?"
0:46:54,0:47:00,"Znači imaš ne znam, mislim osam sati spavanja, ono što i sad neka sestra kaže neće osam sati spavati, ja ću molit po noći."
0:47:00,0:47:05,"Možeš čak ti dopusti poglavarica ili duhovnik, jer tu naš džavao najbolje slomi naš."
0:47:06,0:47:16,"Ja sad neću gledati s braćom ne znam utakmicu ili nešto, jer sad oni, e ja ću sad molit da, ja sam sad bolje od njih, znaš, začaste, ali koliko je to i zajedništvo i umiranje sebi, koliko je važno."
0:47:18,0:47:44,"E to su te stvari i ono, ti moraš, a ono poticaje u svakom trenutku vagati naš, Bože, evo šta sad želiš od mene, još imam svoj neki plan, imam svoje neke želje, ali ono da je to taj jedan, zajednica je živa, našo ono prilagođavanje, umiranje, ne znam, neki svećenik ili ja ili neki subrat kaže, gledaj, ja ne mogu, možeš uleti tu umjesto mene, možeš zamijeniti, ili sad ja legnem nakon ručka i neko pozovani i kaže, ja bi se ispovijedao našo, pa evo, vi ćete sad."
0:47:44,0:47:48,"Vi ćete sad, ja id pozvoni opet za pol sata pa ono da ti otvorim."
0:47:49,0:47:56,"Ali to su te one konkretne situacije, di se ti milijun puta ono to sve promijeni."
0:47:56,0:48:03,"Ovo baš, samo da se kratko nadovežem što ste rekli, ono treba imati tu neko vrijeme, ono u kojem će se odmoriti, dekracija itd."
0:48:04,0:48:17,"Mene nekako stalno je tu, kad sam zaređen, sveti papa Grgur Velik, čini mi se da je rekao, mislim da je baš svećenicima se obraća da je rekao pazi da dajući sebe ne izgubiš sebe."
0:48:18,0:48:28,"Ja mislim da je po tome i mladi svećenici, mi svećeni imamo, imaš šta ćeš, čovječe, stani, trebati vrijeme u kojem će se opustiti, u kojem će se odmoriti, u kojem će se malo makniti."
0:48:28,0:48:36,"Ne znam kako je to kod vas, a kod nas, djece izvan svećenika, najčešće da znaju da imamo jedan dan slobodan u tjednu."
0:49:13,0:49:17,"Ako ne padne naš nešto da baš mora, ono u pravilu se ne radi."
0:49:18,0:49:21,"Odmori se, odi posjetiti nekog, odi u prirodu, uprovozaj se biciklom."
0:49:22,0:49:24,Da imaš taj jedan dio odići se.
0:49:24,0:49:32,Ja rijetko kad da se s nekim nešto dogovorim popodne navečer ili sad nekog zamijeniš ili to.
0:49:32,0:49:33,"Ako baš ono ne gori, ne moram."
0:49:34,0:49:36,Srijeda popodne je ono naš jedno slobodno vrijeme.
0:49:37,0:49:38,"Ok, a kaj radite u tim trenucima?"
