Start (HH:MM:SS),End (HH:MM:SS),Segment
0:49:38,0:49:49,"Znači, zanima me ta nekakva aktivnost ili događaj ili nekakvo mjesto na koje idete u svijetu, a da nije vezano za pastoral."
0:49:49,0:49:54,"Znači, OK, vi možete neko dotići zato što vam pastoralne dužnosti to nalažu."
0:49:55,0:49:57,"Imate srijedu popodne, ti imaš svoje ne znam."
0:49:58,0:49:59,Na cijelu sredinu.
0:49:59,0:50:00,"Ne, samo popodne."
0:50:00,0:50:07,"Koje su to mjesta u svijetu u kojima volite biti, kao Stjepan i kao Mirko, a da niste u službi nužno?"
0:50:08,0:50:13,"Znači, ono baš mjesto na koje volite dotići, situacija u kojima volite biti s ljudima, koje su to aktivnosti?"
0:50:14,0:50:19,"Pa ja nisam, ne znam, neki sad planinari itd., ali ja volim prirodu, maknice."
0:50:20,0:50:26,"Znači, ja se, evo, vi sa sjećjevera i tako."
0:50:27,0:50:32,"Volite lito more, kupanje, zna se koliko ste je pamali, kupanje i tako dalje."
0:50:32,0:50:33,Plaža.
0:50:33,0:50:35,"Ja, evo meni sljedeće sa ovito."
0:50:35,0:50:37,Znači ja se ne moram kupa ni jedan pu moru.
0:50:37,0:50:38,Znači zašto?
0:50:38,0:50:40,Zato jer sam odrastao deset metara doslovno od mora.
0:50:43,0:50:48,"Ko djeca smo bili stalno na plaži, ja sam imao dužu malo kosicu, plavu."
0:50:49,0:50:51,"Znači, ali od sunca."
0:50:51,0:50:51,Četvrti osnovni.
0:50:52,0:50:53,"Plavo, ko dinamo ili plavu?"
0:50:54,0:50:56,"Žutu, kao slama."
0:50:56,0:50:57,Kao slama.
0:50:57,0:51:00,"Četvrti osnovni, prvog tjedna škole učiteljica zovemo u školi."
0:51:00,0:51:04,"govor, dođite molim vas na razgovor zbog Mirka, deset godina."
0:51:05,0:51:29,"Ne znate šta si napravio, govorim, znači nisam ništa čuo, nisam stigao, ono prvi tjajanje, jesi, znate, jesi itede i ako on stvarno nisa ne zna šta hoće i zove na nju nastaviti, na razgovor je učiteljica, tako uvod, uvod neki, kaže pa gospođo, znate si ljudi, dajte deset godina, pa je rano da mu dajete pramenove itede hoće li govoriti, mi smo toliko bili tu na tom moru, na suncu da plava kosa čovjek."
0:51:30,0:52:08,"I evo naprijed meni sad u ovom liti, meni bude odmor, otići, volim, meni je najljepše misto na svijetu su mi jedan u Hercegovini, blidinje planina, znači maknimo od mora, ajmo u planine liti, kad svi doli na more, ne oni guž, oni se maknu, tako da evo meni ta priroda, s biciklom otići, provozat se, smo to, ono i tako ne smije sad svašta govoriti, to je naprezito meni, nekako baš, baš ta, samo makni se u prirodu, to me najviše, da odmori baš."
0:52:09,0:52:13,"Jer otići na kavu u slobodno vrijeme, mene to iscrpime.."
0:52:14,0:52:16,Različito sve od situacije.
0:52:17,0:52:21,"Često se tu srijedu ostavim na cestu s nekim ljudima koje volim, koji su mi dragi."
0:52:22,0:52:29,"Posjetiti neku obitelj koju nisam dugo vidio, ali gotovo uvijek je to vezano uz nešto ili napravi krug."
0:52:29,0:52:32,"Kurkud, kad su ga premjestili u rijeku, to mi fali."
0:52:32,0:52:34,Ja sam s njim znao napraviti krug oko runa.
0:52:34,0:52:42,"Nađemo se, napravimo krug oko runa, sat i po dva, izjedamo se jedan drugom, sjednemo, popijemo nešto, tako nešto."
0:52:42,0:52:47,Ili kod nas gore ima kraljični zdenac ili gore župa na sljemenu.
0:52:48,0:52:48,Nisam sad to dugo bio.
0:52:49,0:52:50,i zvuči onako malo sad kao da.
0:52:51,0:52:53,"Ali ono nešto, ali uglavnom da je drugačije."
0:52:55,0:52:58,U 99% situacija ne ustajem kod kuće.
0:52:59,0:53:09,"Taj dan hoću i ako imam, jer ako ostanem kod kuće upalim laptop, stoje mi stvari koje moram pripremiti na stolu, vidiš da ti tamo ne znam oni mačori prašina."
0:53:10,0:53:17,"Ono, pritisnuti je taj način, ne želim biti, makni se oni, ne želim isto gledati da nisam sa svojom braćom zbog oslovima."
0:53:17,0:53:25,"Znaš ono, taj dan, ja sam i magistar, oni mene podsjećaju na probleme na kojima treba raditi, i idem."
0:53:25,0:53:27,"Idemo se maknuti taj dan, odmoriti se jedni od drugih."
0:53:28,0:53:30,Isto je važno.
0:53:30,0:53:34,"Ne kažem, nema sad nešto ono da, ali odmor je svakako ono."
0:53:37,0:53:42,"Pitanje je, kako ljudi reagiraju na vas kada vas svi vide u svijetu van službe?"
0:53:43,0:53:45,I pitanje je vezano odmah za to.
0:53:47,0:53:53,"Teza koja kaže svećenik bi uvijek morao biti u uniformi, kolar, reverendu imaš samo ti, Stjepanel?"
0:53:54,0:53:55,"Trebao bi on imati, ali samo ja."
0:53:55,0:54:00,"Ovaj, je li uopće slažete s tom tezom i kakva su vam iskustva po tome?"
0:54:00,0:54:05,"tome i druga stvar kada vas ljudi prepoznaju ako ste u uniformi, kako ljudi reagiraju?"
0:54:05,0:54:07,To normalno ili danas ono?
0:54:07,0:54:08,K.U.
0:54:08,0:54:08,svećenik?
0:54:10,0:54:11,Kako su vam iskustva?
0:54:13,0:54:20,"Ja recimo iz početka sam bio jako opterećen školarom, školar, komadna, sad ću ja imati ili neću, pa li ga ja trebam ili ne."
0:54:20,0:54:27,"A sad je to neka trenutak da ono izađeš van, obučeš ga ili ne, ono različito je."
0:54:28,0:54:30,Samo što je danas svijet takav da sad ne znam.
0:54:31,0:54:39,"Tičeš mene, evo sad prije nego što smo došli na snimanje, sam bio s jednom osobom koja me zamolila na razgovor, rekao sam kod zubara sam gledaj kad izađem naći smo tu na kavi."
0:54:40,0:54:43,"Znači pričali smo o ozbiljnim stvarima, znači nisam bio u kolaru."
0:54:43,0:54:46,Ja da sam tamo bio u kolaru ne bi pitao slobodu.
0:54:47,0:54:48,Znači ja nemam s tim problem.
0:54:48,0:54:51,"A gledaj ljudi bi slušali šta ona priča, šta."
0:54:51,0:54:54,Znači u tom trenutku ja mislim da je bolje bilo da sam bez kolara.
0:54:54,0:54:55,Netko će reći svećenik treba.
0:54:56,0:54:58,Ja ne smatram da svećenik treba biti uvijek u kolaru.
0:54:59,0:55:06,"To su situacije genijalno jedno iskustvo, ajaj to će sad otići predaleko."
0:55:07,0:55:08,Znači ja vozim Blablakar.
0:55:09,0:55:40,"Evo danas sam vozio isto iz Vinkovaca, vjerujem da ljudi znaju šta je bla bla car i pokupio sam ono ljude, ja gledam kad vozim bla bla car da dođem po tebe pred kuću, dovezem te na kraju i vozili smo se neki sat i pol vremena, bila je jedna osoba koja ajmo reći neugodno se izražavala, možda će gledati podcast pa ono, sad je u trenutku kada me jedan dečko pita čim si ti baviš, ja kažem svećenik si ono, ona je na suvozaču umjesto onako u mene, evo oprosti što sam onako ono govorila i to je sve naše."
0:55:40,0:55:54,"Sad, ja nisam bio u kolaru, da sam ja bio u kolaru, ta osoba bi ono čim uđe u auto, maska, svećenik, nemoj psovat, znaš ono, bude Budi dobar i papa je super, Božanić je super, sve je super naše, ali sjedim sa svećenikom."
0:55:55,0:56:08,"Ali kasnije, znači, te neke teme koje su pokrenute i sve, ne samo u ovoj današnjoj situaciji, nego puno, gledimo s tim ljudima pričat ko svećenik, jer su oni otvorili, razotkrili."
0:56:08,0:56:10,"Da smo kolar, možda ne bi."
0:56:10,0:56:22,"E to su te situacije, ali ovo što mi je prvo palo na pamet, to ću ispričati, meni je ono najjača situacija bez kolara i s kolarom, kako sam ja ono avanturisti i svašta volim."
0:56:23,0:56:36,"I sad ja puno puta vozim bicikl često po Zagrebu i sobni bicikl imam, baš volim pedaliti, to je jedna od stvari gdje ja izbacim iz sebe kad me Bogoslovi naljute ili netko drugi, djece zanci ili tako."
0:56:36,0:56:43,"I čuo ja ide na more biciklom, ide ovaj, ide onaj, prvo ja odem na Krk dva dana."
0:56:44,0:56:46,"Sad super, ali gledaj, mogao bih ja otići više dana."
0:56:46,0:57:06,"Jedno ljeto ja sebi kažem idem ja, mislim da je bilo sedam dana, znači diću šta ću, mene zove jedan svećenik iz Poljske, on bi išao na more, rekao ajmo ovako, štidi oš automaću, di bi išao negdje, da nije predaleko ni preblizu, ja nađem smještaj u Rogoznici, već bio deveti mjesec, rekao našta, mi ćemo biti tu par dana, on se vraća za Poljsku, ja idem dalje biciklom."
0:57:07,0:57:15,"Ja se binog rogoznica, dopuzena dolje pa Međugorje pa Brač, neki tjedan dana je bilo i svuda sam imao spavanje, osim u Makarskoj."
0:57:15,0:57:45,"Onaj li taj dio, ne znam, rogoznica, opuzen, ne znam, mogu pogledati na mobitelu, ali ono, obično se računa stotinjak km u danu, znači da možeš već tempo izdržati sve i bilo je puno više i rekao moram naći u Makarskoj ono spavanje i sad ja vozim bicikl, ulazim u Makarsku, vidim iznajmljene neke sobe, pozvonim prvo i rekao ono, ne znam, 50 eura apartma, rekao mi je treba ono dva kvadrata, puno mi je to, radio ću na plju i on kaže ono, 100 kuna naš može, super."
0:57:46,0:57:50,"I sami sieli pričati, ja sam normalno u šorcu majci, uznajno ono i sve."
0:57:51,0:58:01,"I sad onaj sti bio kad u Makarskoj, pa je samo par puta prošao, ali ne znam ono tu, Makarska kao za vas mlade, tu je super, imaš dolje klubovi, ima cura i sve i to, ti."
0:58:02,0:58:04,"I super, i meni ono, krene priča normalno dalje."
0:58:05,0:58:16,"Ja sam Đakon bio tad, nisam još bio svećenik i ono mi se napričali svašta i on meni kaže u jednom trenutku, ok, moram te prijaviti., onda mu dam osobno, jedan osobno u Kolaru."
0:58:17,0:58:26,"I koji odlazi, vraća se, ja već uvidim promjenu i on dođe do mene i kaže, tu dolje ti, fratri, imaju muzej jedan dobar."
0:58:28,0:58:33,"Ali kasnije mi smo sjedili, još nisam ja ušao ni u taj muzej, ni u te klubove, nego smo mi sjedili, još i pričali."
0:58:33,0:58:37,"Naravno, čovjek ide nedjelju na ministar, ministrira, vjernik je, sve super."
0:58:37,0:58:41,"A gledaj, on se tebi razotkrio, nema više glumena."
0:58:42,0:58:47,"On znam da si svećenik i sad ti znaš kakav sam ja vjernik, hajmo pričati."
0:58:47,0:58:51,"E sad to je da sam se ja pojavio njemjemu na vratima u kolaru, bilo bi dobro, vjerojatno ne bi ušlo u kolaru."
0:58:51,0:58:57,"Vjerojatno bi ne bi naplatio, možda bi narezao ono pršuta i sira naš, ali ne bi došlo do te priče."
0:58:58,0:58:59,E to je ta stvar danas gdje.
0:59:00,0:59:03,"Sad kad neki neko kaže ti trebaš uvijek nositi kolaru, ja se ne slažem s tim."
0:59:03,0:59:08,"Ali nije mi bio problem nositi, samo kažem ja mislim da u nekim situacijama više izgubiš kada ga nosiš."
0:59:09,0:59:13,"To su te one, evo mi na ultri, ja ću ga na ultri uvijek obući."
0:59:13,0:59:15,Je li to važan tamo i taj znak?
0:59:15,0:59:19,"Ako ja budem hodna u majici od Božje pobjede, neće nitko skužiti o čemu se radi."
0:59:19,0:59:20,"Imali su majice, Bože."
0:59:21,0:59:22,"Imali majice, imali."
0:59:22,0:59:25,"Znamo, ali nekad na ono neće skužiti sa trećim vjerskom."
0:59:26,0:59:27,Ne ističe se ništa uopće.
0:59:27,0:59:28,"Da, to je."
0:59:28,0:59:30,"Maro, jedino kad nosiš samo na njemu, da to je jedna."
0:59:31,0:59:31,Dobro.
0:59:32,0:59:32,Ovaj iskustvo sa.
0:59:33,0:59:33,Pa slični smo.
0:59:34,0:59:34,Svarno slični.
0:59:35,0:59:37,"Iskreno, sam bio možda s tim stvarno opterećen."
0:59:42,0:59:46,Ali puno ista ovakvih situacija u kojima vidiš da.
0:59:46,0:59:47,To možda nije to.
0:59:49,0:59:51,"Zamijenjali za mjesta, naš isti je obitelj televizora."
0:59:54,0:59:56,"Uglavnom, slažem sa Stjepanom."
0:59:56,0:59:57,Znači nije slično.
0:59:57,1:00:00,Ne držiš tezu da podobavezno.
1:00:00,1:00:20,"Pa ne mislim bilo bi puno ovakvih situacija kada jednostavno s osobama jedan duhovni razgovor i prisiljen si isto u neki kafić, ne stigne ta osoba doći od tebe ili si ti ovako negdje vani itede To je jednostavno i radi te osobe i radi slobode jer ljudima odmah to ono."
1:00:21,1:00:22,Da li ljudima znači?
1:00:23,1:00:34,"Ja naprimjer sad kad dolazim na župu ja se ovako osjećam ugodno, znači ja ovako ću doći, ne znam, to mi je dnevni luk ajmo to tako reći, ali kad ti dođeš na neku župu ja bi volio ovako voditi duhovnu obnovu."
1:00:34,1:00:35,A ljudima znači kad dubučeš reverendaj.
1:00:35,1:00:38,Sad na tom mjestu ja ću obući reverendu i staviti ovo.
1:00:38,1:00:40,Pitanje je je li mudro u tom trenutku?
1:00:40,1:00:40,"Da, da."
1:00:40,1:00:41,"Šta kažeš, nisam."
1:00:41,1:00:42,Pitanje je je li mudro u tom trenutku?
1:00:43,1:00:49,"Da, ono, baš to, na tu crno vjeru, isto kao što si rekao, ova je situacija, odlučim samo molim, dođe jedan brat, trebamo otići po jogurt."
1:00:51,1:00:55,"To, toliko tih situacija u kojima ti i Duh Sveti trebate vidjeti šta."
1:00:55,1:01:13,"Pa nema šta, evo ja iskreno, otkad nosim reverendu i sve, ja sam izgubio osjećaj za odjeću koja, ono, meni kad treba svećano, znači ja ležem u krevetu, u šorcu i majici, netko pozvan, ja obućem reverendu, ti si ono, u sekundi si najsvećaniji, ali ja imam problem kad trebam doći negdje, a ne nosim reverendu,."
1:01:14,1:01:21,"Znači, bila je situacija, sad za sve to blaža, bili smo dolje u Dubrovniku i sad bila je najveća večera s biskupima, ja sam došao ovako obučen."
1:01:22,1:01:30,"Sad meni jedan svećenik dođe i kaže ono, pa gledaj, trebao sam se obući, vjerojatno ispoštovanja, kolar, košulju i hlače i sve, ali ono, izgubiš osjećaj za to."
1:01:30,1:01:34,Ša glam onu odijelu i sve i to ja u majici koja košta 80 kuna našu.
1:01:34,1:01:40,"Sad se to i s njima, nije to najvažnija stvar na svijetu, ali postoje neki ono, kako se kaže to, dress code."
1:01:41,1:01:51,"Da, nešto ono ispoštovanja, gledaj, ne možeš baš doći ono u trenerci u kojoj si malo prije, ne znam, ležao negdje na plaži ili to i sad si ti došao na nek neko svečani susret našao."
1:01:51,1:01:54,"To je opet, ne vjerujem da me je to neko zamjerio."
1:01:55,1:01:58,Ali baš ta mudrost u nekom trenutku.
1:01:58,1:02:06,"Ja sam imao situacije u kojima je u svijetu, pod naulnike, taj kolar nekoga privuče, nekoga odbije."
1:02:07,1:02:08,Nekoga baš privuče.
1:02:11,1:02:12,To je dio našeg identiteta.
1:02:13,1:02:15,Tu treba biti baš mudar.
1:02:16,1:02:18,"Sad idem u shopping center, trebam si kupiti to dobro."
1:02:19,1:02:24,"Da, ubijam, normalno da ću se otkočati i tamo ću gledati."
1:02:24,1:02:26,gledat ono meni ono nažalost.
1:02:26,1:02:28,"Došao sam, obišao sam čovjeka u miru to riječ."
1:02:29,1:02:32,"Da, ali nemaš problema u otići u jednu situaciju."
1:02:32,1:02:38,"Ja sam išao s mladima nešto u Varaždinu i sad sjedimo u pizzeriju, a ja volim ljutost sve ono ono ono."
1:02:38,1:02:42,"Ja sad u Kolaru sam bio, sjeo sam s njima i sad bilo mi je pred njima glupo maknuti Kolar."
1:02:43,1:02:49,"Jel' ono to su srednjoškolci i sve ono što nemam potrebu, već sam došao s njima i sve."
1:02:50,1:02:55,"Ja gledam onaj popis pica, iskužim pica, ona će reći ljuta, zove se Đavolska."
1:02:56,1:03:05,"I sad odmah ona neka dolazi i dolazi konobar, ono ja sad šta da radim., i pitome na ono kao naručujete, i sve što ćete, onda je to nekakav."
1:03:05,1:03:07,"Možemo je đavolska, ajastro, ovako."
1:03:09,1:03:10,"Ispadle, ali sporno ono."
1:03:11,1:03:11,Dobra pisa.
1:03:12,1:03:12,Dobra pisa.
1:03:12,1:03:13,"On je naš ljutoj, i sve."
1:03:14,1:03:16,"To je sada ta, di bih ja najradije njemu rekao je đavolska."
1:03:18,1:03:18,"Da, dobro."
1:03:18,1:03:25,"Užeš, što su te one situacije, di ti se nađeš, ili ovo, ja isto, ja sam kod nas u kući zadužen za kupnju."
1:03:25,1:03:36,"Nabavku, gled, ono neću nikada otići u kolaru kupovati, nemam ja problem, sad ne znam, ali gled, ja ću ono, ja kupujem za nas osam, kupujem jedno mjesečno, kupujem još puno kutija."
1:03:36,1:03:41,"punu kuću, netko će vidjeti, da ćeš ljudima priliku da se pogube u tome, nema potrebe."
1:03:42,1:03:43,"Znači, ja bi rekao to."
1:03:44,1:03:50,"Iako da sad idem i u kolaru, ja nemam s tim problem, ali može problem imati onaj drugi."
1:03:50,1:03:51,"Znači, to je ta stvar."
1:03:52,1:04:05,"Ja sam imao jednu smiješnu situaciju, imao sam naš župan, jedan prostor koji smo mi nazvali utočište i tako da li se i družimo i tako i sad treba tu, znaš, grickalica, treba čipsa i onda, ti ćeš, sad ne smije ovdje govoriti, reklamirati učanja."
1:04:06,1:04:06,"Da, ne idemo."
1:04:07,1:04:08,"Sumnjam da ih imao u Zagrebu, a, pardon."
1:04:10,1:04:15,"Uglavnom, ali nije to ni važno i sad išli smo išle su tri cure iz župe i ja idemo."
1:04:15,1:04:22,"Znači ja sam najčešće u ovim dukama, sad sam išao s filmom, ali imam super ove dukse koje se mogu zakopčati naš."
1:04:23,1:04:51,"Od kopča zakopčati i ja sam bio zakopčan takvu u tom dućanu i tada su bila velika ona kolica, ali samo grickalica i ono sokova, jedno ne znam ko je bilo ko sto eura znači, ali grickalica, čipsa to je puno i sad kad smo to stavili na onaj, na onu traku, puna ona, cila traka i gledam mladim, ovakvim vjerojatno studenti onaj blagajni i sad to dolazim uz sve i onda diže ako gleda, gleda mene i gleda njih, gleda to kažeže on, a dičete vi s ovim."
1:04:53,1:04:56,"Ja govorim njemu, znaš ti po njemu, kakve radice ima."
1:04:56,1:04:58,Ovako stah gleda njih tri kade.
1:04:58,1:04:59,"A ovo si žene, ali."
1:05:01,1:05:01,Što?
1:05:02,1:05:03,I on već izgubio.
1:05:03,1:05:07,"Da, moj nije prijatelj, ali u sjećanju sam tu sam župio, ali to mi je."
1:05:07,1:05:08,O ima puno radice na župi.
1:05:09,1:05:12,"Onda si ovo od dican iz žene, ali kako je."
1:05:12,1:05:13,Smišno.
1:05:14,1:05:21,"A da mi recite, rekli ste, ok, znate sjesti na cugu, na kaos sa nekim ko vas traži za razgovor ili nešto."
1:05:23,1:05:29,"Jer nekad, barem vi volite sj sjediti na kavu, popit piće sa nekim svojim?"
1:05:29,1:05:31,Je li vam to neka vrsta razvrnode?
1:05:33,1:05:40,"Pa ja sam malo prije spomenuo u slobodno vrijeme, slobodan dan da neću otići opit u taj ambijent, ali nešto štam je ono običajno."
1:05:40,1:05:53,"Na putu to s mladima na župi, kome god se javila za razgovor, znači u četiri sam završio sa zubarom, u šest imam s vama dogovor."
1:05:54,1:06:01,"Znači ja sad nemam vremena sjediti u auto ili otići gore kući i reći ajako je bilo idealno stvarno, takav smo sve."
1:06:01,1:06:03,"Takva atmosfera i sve smo mi sjedili u ispovjedalnici, razgovarali."
1:06:04,1:06:06,"Ono nego ne, idemo, hajmo sjesti na kavu."
1:06:06,1:06:10,"Sjedili smo u gradu, jedan kafić, pričali neki sat vremena."
1:06:10,1:06:13,"Na što, ili da mi je bio auto blizu, ja bih sjedio u auto."
1:06:14,1:06:18,"Imamo auto štolu, ispovjedalnica nije idealna, ali nekad ne možeš."
1:06:19,1:06:26,"Nekad si u situaciji da u Zagrebu je to, neko te zove, ne znam, Saijaruna i kaže ono, ja bih se htio porazgovarati s tobom i sve."
1:06:26,1:06:29,"Mislim, ako neko ne vozili, trebalo mu sat vremena do mene."
1:06:29,1:06:33,"Ja kažem, ne znam, sutra dolazim dolje, ajde ciješćemo negdje pa ćemo popričat."
1:06:34,1:06:35,Po meni to nije ništa loše.
1:06:38,1:06:43,"Ja ne volim mjesta gdje su stolovi preblizu, gdje je bučno."
1:06:43,1:06:44,Ja sad ne mogu naći.
1:06:44,1:06:47,"Paziš uvijek naš osoba, ti iznosi nešto, priča o nečem."
1:06:48,1:06:49,Ne volim da sluša to neko drugi.
1:06:50,1:06:53,"Znaš, nije mjesto na vrijeme, ali ima."
1:06:53,1:07:00,"Ja u Zagrebu, pošto sam često automobilom, već znam ono mjesto gdje mogu parkirati, da se ne plaća parking."
1:07:02,1:07:10,"I ono gdje su take neke terase, mjesta gdje možeš ono popričat diskretno, a opet si na javnom mjestu."
1:07:10,1:07:13,"Oke, dolazite na dogovor u jednom zračnom."
1:07:13,1:07:17,"Dogovor jedan s drugim, ti dolaziš u Zagreb, nalazite se na kavi."
1:07:19,1:07:20,Je li naručite kavu uopće?
1:07:21,1:07:22,Koliko je sati nisi rekao?
1:07:23,1:07:23,Sad je li inače?
1:07:24,1:07:24,Kada?
1:07:24,1:07:25,"Pa evo, ta situacija."
1:07:26,1:07:29,"Evo ga, ponedeljak u 20:09."
1:07:29,1:07:31,Pa mislim da nije pametno pit kavu ako kažeš.
1:07:31,1:07:32,"Dobro, kaj naručuješ?"
1:07:32,1:07:33,Jel se smije naručiti piva?
1:07:34,1:07:34,Smije.
1:07:35,1:07:35,Morate prijaviti.
1:07:36,1:07:37,A voziš poslije prije?
1:07:37,1:07:37,Kome?
1:07:40,1:07:44,"Pa preporučuje se, evo, da mi smo normalni ljudi, gužiš."
1:07:44,1:07:50,"Evo ja sad reći ću, naprimjer, ja do nekih četiri naručujem kavu."
1:07:51,1:07:51,Poslije?
1:07:52,1:07:53,Poslije ovisi ako imam nešto.
1:07:55,1:08:04,"naprimjer ako je srijeda nemam problem popiti pivo, ne da pijem pivo samo u slobodno vrijeme nego nemam nešto poslije, nemam misu, nemam dogovor, nemam snimanje."
1:08:04,1:08:11,"Ali sad naprimjer ja danas da sam u pet sjeo ne znam s njim, ajmo popiti pivo, ajmo moj bi tu spavalo, ja bi tu ono naš ne volim pivati."
1:08:11,1:08:25,"Ali par puta u tjednu kad smo mi kod kuće navečer ne znam jel liga prvaka jel nedjelja jel ono, ajmo ili imamo taj ponedjeljkom susret, to je gotovo uvijek, ono ponedjeljak završimo službeni susret u devet šta ćemo, ajmo popiti pivo."
1:08:26,1:08:31,Ja kad popijem alkohol ili ću nastaviti pit ili ću otići spavati.
1:08:32,1:08:33,Mene jedno pivo uspava.
1:08:33,1:08:34,Znači ono nema ono...
1:08:35,1:08:37,Baš ovisi o tome što imaš puno toga.
1:08:37,1:08:38,"Da, ovisi o tome što imaš puno toga."
1:08:38,1:08:39,Dobro je kaj imate poslije.
1:08:40,1:08:43,"Pa evo ja nisam došao sam iz Splita, ja sam vozio iz Splita."
1:08:44,1:08:46,Prijatelj ovaj nije vozio odmoran i tako da ne znam.
1:08:47,1:08:52,Jer Stepan je nešto što mi je baš jako indikativno i meni se grlo saslušalo ovo moja čaša ili nešto.
1:08:53,1:08:54,Nije mi zbilja šale.
1:08:54,1:08:57,"Morat ćeš dobro pojesti prije piva, ne mogu na praznim čašama."
1:08:57,1:08:59,"Ima tu kiflice, ne znam jelova."
1:08:59,1:09:00,"Kiflice, ali sad je na kraju prilika."
1:09:00,1:09:07,"Kiflice stvarno sad su se već ohladile, bile su tople, ali ja gledam kad Slavonka napravi kiflice i nestavi u njih."
1:09:09,1:09:10,To je ono šokac teški.
1:09:12,1:09:12,Meni je to neobično.
1:09:13,1:09:14,Jeste li za pivu?
1:09:15,1:09:15,Možeš.
1:09:16,1:09:16,Ja mogu.
1:09:17,1:09:18,Ovdje ćemo pričati o tome.
1:09:18,1:09:20,Ovisi je li topla ili plava?
1:09:21,1:09:21,To je moja briga.
1:09:23,1:09:26,Ja ću zamoliti Mateu da nam nešto da pive.
1:09:27,1:09:29,"Ne moj po pola teena, janica su cijele, cijelu popini."
1:09:30,1:09:31,Ona je trudna bila.
1:09:31,1:09:32,"Još uvijek je trudna, bohuhala."
1:09:32,1:09:36,"Neće što reći na TV oči, kadar to mora se animirati da ti Maroji čuje."
1:09:37,1:09:38,"Mari, gleda po Tena."
1:09:38,1:09:39,"Aha, tela."
1:09:40,1:09:40,Hvala ti.
1:09:40,1:09:42,Mi tu imamo od piva.
1:09:45,1:09:45,Jedan brand.
1:09:47,1:09:48,Da ne reklamiramo.
1:09:48,1:09:49,"Aha, skidate ti kefe."
1:09:50,1:09:51,"Dobri smo, dobri smo."
1:09:51,1:09:52,Moramo ići.
1:09:52,1:09:53,Giflice.
1:09:53,1:09:54,"Uspiju, ujdemo."
1:09:54,1:09:54,Moramo ići.
1:09:55,1:09:55,"Ti, je li ti?"
1:09:56,1:09:58,"Kad uzmete kiflicu, ona ide, vidiš čim si, ona čekaš."
1:10:00,1:10:01,Naš koja ne voli?
1:10:01,1:10:04,"Najgore mi je kad trogam kiflicu, ona je spek meza."
1:10:04,1:10:05,Spek meza.
1:10:05,1:10:06,Znaš koja ne voli?
1:10:06,1:10:08,"Nisi pek meza, ona si peča."
1:10:08,1:10:08,Neće.
1:10:09,1:10:10,"Ona je ovo bila oveš u top, ono toplo je."
1:10:11,1:10:11,Kad on ovo.
1:10:11,1:10:13,"U isto, ali oni se smiju s druge."
1:10:13,1:10:20,"Ja sam ja od sada da se ne poljam deforal, ali kad sam došao rekao sam kononaš kad je prazna kriflica, ko da otvoriš Kinder, ja i nema igračka."
1:10:20,1:10:24,"Naš neko je zaboravio, ona je tamo teta što radi na čovaciji, zaboravila u bacu."
1:10:25,1:10:26,Imala je neko otvarač.
1:10:29,1:10:30,A je to tisto?
1:10:31,1:10:36,"Da se vratim na razliku, djece zanci, on ima 16 ključeva."
1:10:37,1:10:38,Što je to ti ključevi čovjek?
1:10:39,1:10:39,Dom Mirko.
1:10:39,1:10:40,Sveti Petarov ono.
1:10:41,1:10:42,Je li to baš otvarač ili je to nešto.
1:10:43,1:10:44,Pa ja to s noktom.
1:10:46,1:10:48,Je li to uvijek imaš u sebe ili.
1:10:49,1:10:51,Evo još jedno pitanje nakon ovog.
1:10:51,1:10:52,"Krzalica, sagite."
1:10:53,1:10:54,Isto dobio na poklon.
1:10:56,1:10:57,Koja je naš sljedeća pitanja?
1:10:57,1:10:57,Barač.
1:10:59,1:11:00,Sad nas je ovo baciti u...
1:11:02,1:11:03,Ja smijem izbotiti.
1:11:03,1:11:04,Ali ima ono nekle za tri.
1:11:05,1:11:07,"Čekaj, moram ono brenca krivati našu."
1:11:08,1:11:08,A naopako.
1:11:09,1:11:10,A ovo je liga prva.
1:11:11,1:11:11,Hvala.
1:11:12,1:11:13,Našemateju koja je naša.
1:11:13,1:11:14,Sad razmišljao će izbotiti ili iz čaše.
1:11:14,1:11:16,Više kako to što sam ga ono....
1:11:16,1:11:16,Naniši.
1:11:18,1:11:19,Evo izbotiti.
1:11:19,1:11:20,Šta će ljudi reći?
1:11:20,1:11:20,Ja volim.
1:11:20,1:11:21,Znaš kako je?
1:11:21,1:11:22,Htio sam već par puta prekiniti.
1:11:23,1:11:25,Znaš kako izgleda moj dolazak u Split preko ljeta.
1:11:25,1:11:31,"Ja odem na Žnjan, parkiram, okupam se, no onda se obično javljam ulicu Terze u njemu."
1:11:31,1:11:33,Glam koji je slobodan da se nađe.
1:11:33,1:11:37,"Ali prvo je kupanje na Žnjanu, ili da dolazim s druge strane, na četvrti."
1:11:37,1:11:38,Na Marijanu.
1:11:38,1:11:39,Ja sam na četvrti.
1:11:39,1:11:41,"A kupanje ulice Terze, pa onda ja."
1:11:42,1:11:44,Mladi čovjek će ono naš.
1:11:45,1:11:47,"Ono obično dođem s nekim ozbiljnim razgovorom, Pavlo."
1:11:50,1:11:50,Što te?
1:11:53,1:11:58,"Otvaram set pitanja koje je krenut malo više prema vama kao svećenicima, prema osobi svećenika."
1:11:58,1:11:58,Da mi je dao pivo.
1:11:59,1:11:59,Jesam.
1:11:59,1:12:04,Jesam da se rasteretite i razvežite malo.
1:12:05,1:12:05,Mislim malo.
1:12:06,1:12:07,Da se tečnik.
1:12:10,1:12:14,Kaj je najteže svećenik u njegovom staližu?
1:12:14,1:12:15,Kaj mu najteže pada?
1:12:16,1:12:18,Meni pamet pada samoća.
1:12:19,1:12:21,Kaj vam najteže pada?
