Start (HH:MM:SS),End (HH:MM:SS),Segment
0:51:25,0:51:35,"Kako ćeš ti dijete koje svojim lošim ponašanjem pokazuje nam nešto, tako što ga povrijediš i spustiš prema dolje, pomoći mu da, i onda tražiš da ono raste dalje."
0:51:36,0:51:39,"Ne, ono će samo još gore., će biti još gore, još gore, još gore."
0:51:39,0:51:44,I na kraju to izraste u nekakvu vrlo lošu priču koju mi onda samo osuđujemo.
0:51:44,0:51:46,Opet se vraćamo na ono osuđivanje.
0:51:47,0:51:49,"Tu smo ono kao šta, uvijek osuđujemo."
0:51:49,0:51:50,Što je to u te kategorije?
0:51:50,0:51:52,"5, 4, 3, 2, 1."
0:51:52,0:51:52,Dobro.
0:51:52,0:51:53,"Da, loše."
0:51:53,0:52:00,"Da, to je strašno koliko se kroz te kategorije mi gledamo i počnemo vjerovati da smo mi ta ocjena."
0:52:01,0:52:02,I djeca počnu vjerovati.
0:52:02,0:52:06,I to se uvjerenje stvori u tom periodu i onda te pati cijeli život.
0:52:07,0:52:11,Cijeli život imaš sram jer si dobio jedan u srednjoj školi iz matematike.
0:52:11,0:52:13,A jel te osuđuje okolina jer si donijela.
0:52:13,0:52:16,"tako nešto neobično, nepoznato u dobro poznato vrijeme."
0:52:16,0:52:18,"Pa znaš šta, ja sam neki luđak."
0:52:20,0:52:21,"Generalno, jer ja nisam normalna."
0:52:23,0:52:28,"Jer ja nikako kad bi mogla gledati okolinu, ne bi mogla biti tu gdje jesam."
0:52:29,0:52:36,"Ja sam imala neki mentalni, nemam pojma šta, ne mogu to racionalno verbalizirati, koji je isključio okolinu."
0:52:37,0:52:39,Apsolutno isključio okolinu.
0:52:39,0:52:46,"I uopće samo relevantno mi je bilo šta mi kažu ljudi koji su meni važni, koji su bili moji uzori u nečemu."
0:52:46,0:52:49,"I ako sam tražila i prije, uvijek sam znašla."
0:52:49,0:53:05,Slikajila sam u svoj život samo da dajem prostora ljudima koji su iz nekog razloga meni važni ili mogu ih na neki način modelirati neke svoje što mi se sviđa pa ću to i ja primijeniti u svoj život.
0:53:06,0:53:11,Ili su jednostavno tu jer mi se čini dobar mi je život kad popijem kavu s nekim takvim.
0:53:11,0:53:12,I to je to.
0:53:12,0:53:19,"Nemam ni širok krug društva, želim neki svoj život koji je isključeno to sve skupa."
0:53:20,0:53:25,"Znači, ne može uopće mi to spuštanje, to prilagođavanje, sve te stvari."
0:53:25,0:53:26,zapravo ja.
0:53:26,0:53:27,Pitao sam te to.
0:53:27,0:53:37,"Naravno da je osuđivanje bilo, mislim, ono sad ti, sad šta će ona sad, gdje je majka s djetetom, šta ona pravi, ko je ona, šta je ona, ono ponižavanje, svašta, svašta je tu."
0:53:37,0:53:40,"I kad sam školu otvarala, tu sam tek doživjela ono."
0:53:41,0:53:51,"Čak i od struke gdje sam se totalno diviš ti da ono, ti vidiš ljude koji su godinama u obrazovanju, koji ti ono totalno bi, baš vidiš, ne vidiš podršku, nemaš nikakvu podršku."
0:53:52,0:53:53,Ali nema ih što ključiš.
0:53:53,0:53:54,Ne razumiješ.
0:53:54,0:53:55,"Ne, žao mi je ga."
0:53:55,0:54:01,"Znaš, žao mi je sve te ljude koji tako osuđuju površno, imaju neku priču, to je ono, harfaj, tamo negdje."
0:54:01,0:54:04,"djeca ništa ne rade, niko ništa ne želi, ne znam te vjera."
0:54:05,0:54:07,Samo radi ono u što vjeruješ.
0:54:07,0:54:10,"Kreirano što ve znaš, vrijeme će pokazati."
0:54:11,0:54:24,"Vrijeme će pokazati strpljivost, radi dobro za svoje vrijednosti, za ono što ti vjeruješ, što ti stvarno vjeruješ, ono kako treba život dati."
0:54:24,0:54:27,"Ali ono što me zanima, to je osnovna škola, da tako."
0:54:27,0:54:28,"Da, sad je koliko četiri, pet godina."
0:54:29,0:54:33,"Ne, ne, sad smo mi pet godina, ali od prvog do osmog, iduće godine ćemo ići u srednju školu."
0:54:33,0:54:37,I kako onda se ta djeca traže?
0:54:38,0:54:51,"to mislim je bio jesi li ti imala neke osude jer donosiš tako neki sustav skroz nepoznat, ali onda ta djeca, učenici imaju li oni osude sa strane i kako će se oni snaći na prijelazu iz."
0:54:52,0:54:55,Pa ja se čestitam svakom svom roditelju koji je došao u Hrvatsku.
0:54:55,0:54:57,Kako je došao na fakultet ipak su ocjene dva mjerila?
0:54:58,0:54:58,Nikakvo.
0:54:59,0:55:00,Mjerilo za fakultetni su ocjene.
0:55:01,0:55:04,"Ne, neće vam ozorni, a onda da moraš imati neki prosjek nešto."
0:55:05,0:55:12,"Da, generalno da upišeš, ali kako ćeš ti taj fakultet i kad ga upišeš završiti, koliko ljudi i kako završiš fakultet, te ti ne."
0:55:12,0:55:14,"Ne, ne,, to razumijem i slažem se."
0:55:15,0:55:17,Mi ocjene imamo od sedmog razreda.
0:55:17,0:55:37,"Kad ulazimo u ovaj MUIP program, Mirlears program, tad idemo od, IB ima te ocjene od jedan do sedam, tu ipak, ali svejedno te ocjene se donose na isti način, konceptualno, na isti način kako se donosi, znači gledaju se konceptualno, ne gledaju se površno, kao i već se gleda jedna dubina te ocjene."
0:55:37,0:55:39,Uvijek tu je već temelj od šest godina gdje su djeca.
0:55:39,0:55:49,"Cijelo vrijeme djecu učiš da oni uče, naša djeca uče, ali iz svojih osobnih interesa, iz svih motivacija iznutra, tako da naša djeca uče, obladavaju."
0:55:49,0:55:59,"tim gradivom i rade ga u svakom slučaju, garantiram kad dijete tako učiš da uči bolje, već to bi učilo kad uči samo za ocjenu i na pamet."
0:56:00,0:56:08,"Kad njega istraživački uče gdje ono uzme tu knjigu pa uzme još pet ovakvih knjiga, što će mi samo jedna knjiga?"
0:56:08,0:56:11,"Znači mi jedan udžbenik, da, dovedi to u Zagreb."
0:56:12,0:56:12,Šta ću sada?
0:56:13,0:56:15,I kaže ima udžbenik jednu lekciju naučiti.
0:56:16,0:56:20,"Da, pa onda kampanja pet sati uči lekciju na pamet."
0:56:21,0:56:22,Ono moram to ovako shvatiti.
0:56:23,0:56:32,"I mi ga ocijenimo sa ocjenom i kažemo iz tih četiri pet lekcija koje je učilo na pamet, to je tvoje znanje, trenutačno ne bude test, evo ti ispit i evo ti je tvoja ocjena iz toga."
0:56:33,0:56:36,Pa znaš li ti koliko je to područje duboko što oni uče?
0:56:37,0:56:48,"I koliko tu možda ako mu dopustiš različite resurse da istraži tu temu, da napravi svoju knjigu, da napravi svoj film na tu temu."
0:56:48,0:57:02,"Mi smo imali Hrvatske kraljeve, video u kojem djeca cijelu hrvatsku povijest rade i stranci naši koji glume kako su se žene tad ponašale?"
0:57:02,0:57:18,"Kako su one cijelu tu, cijeli taj njihov život žive, oni su se uživali u to cijelu priču, oni su se ponašali, snimao se film, oni su se ponašali kao te žene, kako su, kad su djecu imale, kad su, to su bila djeca trećeg, četvrtog razreda."
0:57:19,0:57:24,"To je učenje, oni su čitali šta su oni živjeli, kako su radili, kako su se ponašali."
0:57:24,0:57:42,"A ne, bitka se dogodila te i te godine, ma ko se sjede, ajmo se sad mi odrasli, ajde ti se sad sjeti, mama koja svoje dijete tjeraš i ti učitelju, ok učitelj povij informatike nek se sjeti povijesti kad je bila borba ovoga i onoga."
0:57:42,0:57:43,Ajmo se nemoj lagati.
0:57:43,0:57:58,"To je informacija koja, ali ako si ti to živi, ako si ti to odglumio, ako si to imao film, ti točno znaš, osjećaš te kraljeve kako su oni tu živjeli, kako su oni, kako se to razvijalo, kako je ta bila, pa hrvatska pobjeda, kako je to sve išlo, ti si to odglumio."
0:57:58,0:58:07,"Gotovo trenutno s ovim svim umjetnim inteligencijama, gore, gore, dolje ti je to izgublat u sekundi, ono najosamotnije što izgublat na životu."
0:58:07,0:58:13,"Ali ti je važno to znati, nego ko će se baviti kvizovima i hoćeš da ti budeš u potjeri."
0:58:13,0:58:15,Stvarno trebaš to znati.
0:58:15,0:58:24,"Ako je to tvoj predmet i strast, da ti znaš puno informacija u jednom trenutku, da si ti ono, živi će GPT kad ti neko upuca, ti odmah imaš, jer to je tvoja strast."
0:58:24,0:58:26,"Super, učito radi razvijer."
0:58:26,0:58:35,"Ali nisu svi ljudi, ne, ali htjela sam reći, bitan je taj kontekst, ta priča, da doživljaj, da doživiš te ljude koji su živjeli."
0:58:35,0:58:40,"Jedna gore dolje, sad ću to na brzinu, ali ti generalno možeš zaštiti godinu ako si ti to odglumio u toj godini."
0:58:41,0:58:47,"A to je godina, godinama, ali ne možeš, ne znamo, nismo doživjeli uopće tu lekciju."
0:58:47,0:58:53,"Ali na što znam da je boljka našeg obrazovnog sustava, količina materijala."
0:58:53,0:58:57,Ima i toliko predivnih nastavnika koji su žrtve tog kurikuluma.
0:58:58,0:59:00,Do tih predivnih nastavnika i obstaje obrazovanje.
0:59:00,0:59:01,Oni ga i nose na leđima.
0:59:01,0:59:07,"Zato je moje pitanje tebi, imate li vi neki totalno drugačiji kurikulum kad vi stignete imati film na temu jedne lekcije koja vjerojatno."
0:59:08,0:59:10,Niti profesori moraju raditi 45 minuta.
0:59:10,0:59:18,"Pa postoje ipak, postoje organizacije koje su puno, koje su stvarno duboko osještene."
0:59:18,0:59:20,Zosještene i koje idu u obrazovanje potpuno drugačije.
0:59:20,0:59:24,"Recimo, zato sam se i priključila International Baccalaureate."
0:59:24,0:59:26,Oni su toliku širinu imaju.
0:59:26,0:59:33,"I po tome su posebni što svakoj školi traže da budeš autentičan, ne daju ti kako ćeš."
0:59:34,0:59:34,To je najteže.
0:59:35,0:59:38,Moraš sam smisliti kako ćeš pa te evaluiraju je li to dobro ili nije.
0:59:38,0:59:40,Znači kroz autorizaciju.
0:59:40,0:59:49,"Stalno su u procesu autorizacije, oni ti kažu napravit će to, napravit će tako, napravit će taj kurikulum, a onda mi svi idemo od njih konzultacije kako."
0:59:50,0:59:53,"A onda oni samo pogledaju, pa kako vi mislite da je najbolje?"
0:59:53,0:59:54,E to je teško.
0:59:54,0:59:57,"E to što mi želimo da naši učenici, najlakše bi bilo da."
0:59:58,1:00:00,Oni uče učitelje da
1:00:01,1:00:05,"Nema onoga, ja sam ti rekao napravi kako ćeš i to je ispravno."
1:00:05,1:00:09,Ispravni su puno puteva ima do kojih dođ do znanja na ispravan način.
1:00:10,1:00:11,Kako ti to radiš?
1:00:11,1:00:13,"Netko će napraviti ovako, netko će onako."
1:00:13,1:00:19,"I na tim njihovim edukacijama, kad ti to onda često zna se dogoditi, jer su naporni, ono ništa ti neće reći."
1:00:20,1:00:24,"Jer mi smo navikli da nam netko kaže nauči to, tako je, tako je."
1:00:24,1:00:56,"Ali nije kod njih kažu, ok, ajde, evo, tema je ta i ta, oni nešto ispredaju i kažu, evo sad imate projekt, napravite, ne znam, vi neki svoj video na tu temu kako biste u tom problemu kojeg ima, ima problem, evo sad nemam prva kata, Mara, ajmo malo u hrvatskom, imaju problem to i to, e kako će one to riješiti, ajd nam ti sad recite kako biste vi njih savjetovali, vi ste se njihov savjetnik, vi nađete ono što je ono teško, užasno kako ćeš ti sad, lakše bi mi bilo da mi kažete, odgovori na ovo pitanje pa ću ja ti pronaći odgovor, ali odgovora je jako puno."
1:00:57,1:01:14,"I kad mi to u svojoj glavi shvatimo da nije obrazovanje, uzmi komad sadržaja, nauči ga na pamet, izrecitiraj ga i da je to za znanje, mora biti integrirano, ono mora biti iskustveno, ono mora biti tvoj osjećaj, ono mora biti povezano sa svim centrima u mozgu."
1:01:14,1:01:17,Ne može biti samo ovaj kognitivni jedan plus jedan i dva.
1:01:18,1:01:26,"Ali mislim da će upravo sada, evo, ova umjetna inteligencija kad sam i sve već otaknula, možda potaknuti to da shvatimo da te neke šture informacije su lako dostupne."
1:01:26,1:01:27,Nije poanta samo naučiti na pamet.
1:01:27,1:02:10,"Ono što mi dobivamo nove generacije djece koji žive u digitalnom svijetu, što je s jedne strane, užasno loše što vodi u ovisno što, s druge strane, taj digitalni svijet, ako i ja vjerujem da će puno ljudi ga znati koristiti, puno djece da će pronaći kroz svoj neki osjećaj, pronaći da ga koriste na pravi način i već vidim mlade koji ga koriste na pravi način, nisu svi ovi sad, Gen Z, nisu svi koji su sad propali zato što su stalno bili na društvenim mrežama, ima djece koja su otišla u ozbiljne ovisnosti, sad su ovisni o nekakvom tom svijetu, kao što su nekada bili ovisni o nekakvim drugim, o alkoholu."
1:02:11,1:02:12,Oni sad to i to je loše.
1:02:12,1:02:14,"Imaju loše primjere, ali i dobri primjeri."
1:02:15,1:02:23,"Gdje su se razvijali, učili kroz sve te silne platforme obrazovanja koje postoje, kroz to silno znanje u digitalnom svijetu koje postoji."
1:02:24,1:02:58,"Gdje su kroz to, ja imam, sad neke mlade ljude javljaju se za neke projekte, rad ne znam, nešto vezano za marketing., zato su tako mladi ljudi totalno ono, educirani, dana nisu išli u to što rade u školu, pa čak nemaju ni fakultet, već rade i sebi poprilično, zarađuju poprilično novac u tom ne znam, evo, digitalnom svijetu, u video editing ili nekakve takve gdje oni sami nađu neku svoju svrhu i interes i to super."
1:02:58,1:03:12,"Vidiš da im to super ide, imaju veliko znanje i svaki dan uče i rade jer su otkrili svijet znanja koji je ogroman od udžbenika, znači puno veći i dublji živ."
1:03:13,1:03:18,"U vremenu kad smo mi bili djeca, ja kad sam bila dijete, nije bilo tog svijeta."
1:03:18,1:03:28,"Bio je udžbenik, knjige, samo knjige će uvijek ostati, uvijek će biti, nikad neće izčeznuto, neće definitivno pisanje i čitanje."
1:03:29,1:03:32,"Ako nestane pisanje i čitanje, nestat će čovječanstva."
1:03:32,1:03:33,"Znači, to nikad neće nestati."
1:03:33,1:03:39,"Mi ćemo uvijek imati potrebu pisati, uvijek jer to je ta nekakva naša ljudska potreba i čitati."
1:03:39,1:03:43,"I to čitati čak i knjigu jer to smo mi ljudi, nikad neće."
1:03:43,1:04:01,"I ja garantiram da će Gen Z isto kad dolazi, da će kada doći i možda biti im to, evo tako ih vidim da će oni doći osnivati nekakve bug klubove gdje će se oni družiti, čitati knjige kao što su nekad ti stari ljudi radili, da će se vratiti nekim dijelom, ali taj digitalni svijet koriste u svoj nekakav."
1:04:02,1:04:03,Sad mi s tim ljudima imamo posla.
1:04:04,1:04:18,"Znamo, mi sad moramo znati nove generacije koje nam dolaze i kako njih obrazovati, a ti njih ne možeš kao jedan autoritarni nastavnik kako je sedamdesetih ili osamdesetih godina obrazovao djecu."
1:04:19,1:04:35,"Ne možeš ove generacije, oni su otišli u jedan drugi svijet, oni su ono prešli igricu, oni su drugi svijet i tebi oni mogu biti drski, bezobrazni, nekulturni zato što oni te ne, nisi im, nisi im, ne možeš im biti samo zato što ti da, Bog i Batina."
1:04:35,1:04:38,Ne možeš više samo zbog i Batina biti uzor djeci.
1:04:38,1:04:40,"Ti moraš imati puno većiće, više vrijednosti."
1:04:41,1:04:44,"I kao roditelj, i kao učitelj, moraš raditi na sebi."
1:04:45,1:04:59,"Moraš imati ovaj dio empatije, da se vratimo na početak, i duhovnosti, i empatije, i životnosti, i ljubavi, i svega prema životu, da bi ih inspirao, da bi oni prišli, da bi oni htjeli uopće da budeš dio njihovog svijeta."
1:05:00,1:05:10,"Jer ne možeš kažnjavati njih koji su sad gledano, glašete nove generacije, stvarno, mislim, vidiš da su te prešli."
1:05:10,1:05:11,Težak zadatak za nas.
1:05:11,1:05:13,"Da, i sad još ne dolazi."
1:05:14,1:05:21,"Sad mi možemo, kao stari, ja mogu sad reći, e, prije su bili bolji, mi nismo bili bolji kak smo mi bili."
1:05:21,1:05:22,Ništa nije istina.
1:05:23,1:05:26,"Niti smo bili bolji kao tinejdžeri, niti smo bili bolji kao djeca, niti smo bili."
1:05:26,1:05:34,"Sve smo radili, samo smo radili izaleđa roditeljima da nas ne znaju i ne vide skrivečki sve što rade i što oni danas rade."
1:05:35,1:05:39,"Pa onako i vidiš da nekakav, ja bih rekla, puno su bolje generacije od nas."
1:05:41,1:05:42,"To je obećavajuće, oni da."
1:05:43,1:05:44,"Ja ne znam, takav je moj otječaj."
1:05:45,1:05:45,Kako se to čuva?
1:05:45,1:05:52,"Onda je konkretno u školi, taj baš problem kad si spomenula i drski su, ovakvi su, onakvi su, imaju taj neki otpor."
1:05:53,1:05:56,Koji su onda alati za dovođenje reda?
1:05:57,1:05:58,"Tu su veliki, veliki."
1:05:58,1:06:03,"Znači, tu ti je najvažnija stvar zapravo dovesti u učionicu jedno dobro stanje."
1:06:05,1:06:12,"Prva stvar je da imaju osjećaj pripadnosti u toj učionici, da ne rade ništa jedni protiv drugih i da sve rade za sebe i za svoju zajednicu."
1:06:12,1:06:15,"za jedan viši cilj, za svoju školu, za svoju zajednicu."
1:06:16,1:06:32,"Druga stvar je rješavanje sukoba koje je jako važno jer ti kad rješavaš sukobe kad mi smo evo ovaj Bog i Batine je odlučio i rekao ti si kriv, kazni čute, evo ti jedan sjedi."
1:06:33,1:06:36,"I on je taj koji preuzima odgovornost, on je taj koji kažnjava i koji tu vode."
1:06:37,1:06:47,"Znači ako djeca imaju sukob, mi ih učimo da međusobno riješe sukob jer nema učitelja koji može riješiti sukob između djece, oni moraju imati sami preuzeti odgovornost i sami riješiti sukob."
1:06:48,1:06:59,"Znači, to su sve metode koje postoje u psihoterapiji, u edukacijskoj psihologiji, koje su tu, nikad ih Irena nije izmislila, već samo ih je pročitala, naučila i vidjela."
1:07:00,1:07:09,"Zahvaljujući isto tome digitalnom svijetu, da ga sad ne glorificiram, meni je pomogao, a jako sam isto protiv njega u smislu da roditelj daje osjećaj djetetu."
1:07:09,1:07:15,"Recimo, problem nam je veliki kad vidimo da je dijete vezano da se samo regulira na digitalnom svijetu."
1:07:15,1:07:18,"Ako ti nemaš, dobro, zašto radimo jako u harfi na odnosu?"
1:07:19,1:07:43,"Zato što dijete treba biti, može biti u digitalnom svijetu, ali ne treba, kažem da treba biti, može biti i bit će, nećemo spriječiti dijete da bude u digitalnom svijetu, ali moramo im dati osjećaj roditeljstva, sigurnosti, ljubavi, pripadnosti u obitelji i u školi i svugdje, jer onda ono ide igrati igrice, moramo mu dati osjećaj etike, morala, jer ono nekako, to sve mora u obitelji naučiti."
1:07:43,1:07:45,To su vrijednosti koje neće naučiti na digitalnom svijetu.
1:07:46,1:08:41,"To su visoke vrijednosti koje kreiraš zajednicu sa visokim vrijednostima gdje on neće se ići samo regulirati kroz neku igrecu nasilnu gdje jedni ubijaju druge jer kad tu dođe dijete, da tu vidi sebe, da tu pronalazi svoju stvar onda dobiva iskrivljenu vrijednost svijeta, onda dobiva onda ono što si ti rekla treba biti nasilan, treba biti kako je rekla si, treba biti sebičan, treba biti, znači tu nema nigdje nekakve, kako bi te ti rekla, gdje je dobio taj osjećaj nekakvog duha koji je, kako bi ti rekla, ispravan, koji je ljekovit za čovjeka, koji je važan za ljudsko postojanje, koji je stvarno važan gdje god u bilo, koji se njeguje u obiteljskim zajednicama."
1:08:41,1:08:47,Školska zajednica treba biti taj duh vrijednosti koji se njeguje gdje je.
1:08:48,1:08:56,"dobrota, ljubav, empatija, poštivanje sebe, drugoga, odgovornost."
1:08:57,1:09:05,"To su sve vrijednosti koje se trebaju razvijati, koje trebaju ne biti pisane, one trebaju biti u cijelom prostoru."
1:09:07,1:09:15,"To možeš dobiti tako što ti to radiš kao mama, kao učitelj na sebi i ostavljaš tu jednu zajednicu, u svojoj zajednici to širiš dalje."
1:09:17,1:09:18,"Da, na koji način ti želiš?"
1:09:18,1:09:19,širiti dalje?
1:09:19,1:09:27,"Misliš li da je, imaš li nade u naš obrazovni sustav da će se promijeniti ili je, ja vjerujem da će se promijeniti?"
1:09:28,1:09:30,Ja vidim da se on već mijenja i već vjerujem da ga neki ljudi mijenjaju.
1:09:30,1:09:32,Jer ne bi postojalo da se iznutra mijenja.
1:09:33,1:09:49,"Meni je dijete dolazi sad iz srednjoškolskog sustava kojega završava, koje po njemu vidim da je pronašao tamo nastavnike koji je volio, koji su, znaš, kad nisi sad pitaš maturante šta im je bilo najljepše, onda oni uvijek kažu kave, ke su išli."
1:09:50,1:10:22,"naša druženja, moji prijatelji, poneki kažu nastavnici, znači nisu, trebali bi biti na prvom mjestu nastavnici koji su me inspirirali, znanje koje sam dobio tamo, vještine koje sam tamo dobio, ali gledaju, oni gledaju uvijek taj topli duh, ali ti vidiš i po njima da dosta oni, ja recimo ja kroz svoje dijete vidim da obrazovanje će opstati i da će ga zapravo ti ljudi koji rade promjene, koji su isto u obrazovanju, koji isto vjeruju u ovo što mi pričamo i koji vide, znači samo jednostavno možda trebaju podršku od neke više, ali vjerujem da će se to sve promijeniti."
1:10:24,1:10:24,Jer mora.
1:10:24,1:10:38,"Je li ti bilo nekad izvor frustracije to što, ok, ti na jednu stranu uvodiš neke promjene na bolje, a onda ti dođe dijete iz škole i proživljava, sigurno je nekad su bili ti stresovi radi ocjena i svega toga što ti želiš promijeniti da to ne bude tako?"
1:10:38,1:10:51,"Pa recimo, kad sam se ja sa prvim djetetom, sam se nervirala i tražila nekakvu pravdu, znači, gdje sam znala ono kako ne vidite, kako je to moguće, ne znam kako bi ti rekli, bila sam ono u i rekla."
1:10:51,1:10:52,Bila sam ona u tom nekom duhu koji nije bio.
1:10:54,1:10:59,"Da, borba je za vama kao da nekome sa ti nešto i u tom malo je bilo tog osuđivačkog duha."
1:11:00,1:11:31,"Kad sam otvorila školu i kad sam shvatila šta je važno da dam svome djetetu, da me uopće ne zanima kakve će biti ocjene, da želim da moje djete ima baš sve ove nekakav dobar osjećaj i da tu školu prođe sa jednom i da prođe sa tim svojim prijateljima, da ima tu ljubav i nekakvu, da imam te prijateljske odnose, zdrave, da i da nekako ne budemo to ako je, nije zapravo mi to nikako da mora biti učenje na prvom mjestu."
1:11:32,1:11:36,"Da, nažalost, mora samo učiti, učiti, učiti, učiti, učiti, učiti, dobiti dobre ocjene."
1:11:36,1:11:47,"Znači, on je htio upisati u gimnaziju, imaju u sedmom razredu da će tu gimnaziju upisati i samo je išao, znači, tad je bio sedmi, osmi razred, naprosto ja tad pričam o tim svim 5-0, moje dijete 5-0."
1:11:47,1:11:55,"Sedmi razred 5-0, 8-5-0, ja sad pričam kako ono, nemojte mi to činiti, a moje dijete ono, bilo mi je nekom trenutku trudlu, pa ja govorim, ali dobro, ne moraš biti."
1:11:55,1:11:58,"On kaže, moramo pisati oču, upisati Marulićevu gimnaziju."
1:11:59,1:12:00,"Da bi pisala, mora biti 5-0."
1:12:01,1:12:01,Hoću to da upišem.
1:12:02,1:12:05,"Nešto drugo, ne, ne, niti bolje, niti gore, samo Marulićeva."
1:12:05,1:12:08,"Jer neki njegov prijatelj je išao, neko je imao svoj, on je stvarno to radio."
1:12:08,1:12:13,"Posle kad došao u gimnaziju, uopće nije bio 5-0, svašta je nekako to prolazilo."
1:12:14,1:12:23,"Što ja nikad nisam, meni je bilo stvarno važno, htjela sam da bude dobar čovjek, da poštuje, da nisam davala nekakvu važnost, ne dajem važnost, tome ne želim davati važnost."
1:12:24,1:12:24,tome.
1:12:24,1:12:26,Ne želim ga forcira da mora sada.
1:12:26,1:12:30,"Pa da sve upiše i ne upiše fakultet i koji će, ništa me uopće ne zanima."
1:12:31,1:12:54,"Jako mi je bitno da bude čovjek koji je odgovoran, koji će raditi, koji pridonosi i koji u zajednici našoj obiteljskoj radi i koji pomaže i koji ne znam, zna napraviti sebi svoj ručak, zna ispedla svoju robu i kojem ja nemam nikakvoga, već u prvom srednjem može samostalno i može samostalno živjeti."
1:12:54,1:12:56,"Pa znači, da, pisat će."
1:12:57,1:13:00,"Nešto što god, kako god da bude, uopće mi nije to bio prioritet."
1:13:01,1:13:02,Uopće mi nije bio to prioritet.
1:13:03,1:13:12,"Znači, premda on sada želi informatiku, želi se razvijati u nekom tom svom smjeru, to je nešto kad, to je stvarno bi voljela da svaki roditelj doživi taj level."
1:13:13,1:13:32,"Ali, ako bi slučajno bio nepristojan u školi, vrijeđao druge prijatelje, nastavnicima, to bi, recimo, to bi sigurno reagiralo da nije poštivtivao nekoga, da nije išao tamo, da je bahat, da je nekakav, to su sjednosti koje ne ima šansu."
1:13:32,1:13:34,"Tu bi, recimo, reagirala puno prijevečno na jedinicu."
1:13:35,1:13:39,"Tu bi sigurno rekla, stop, stani, to ne dopuštamo našoj obitelji."
1:13:39,1:13:43,"Takve stvari jednostavno ne idu, to bi uvijek na to."
1:13:43,1:13:51,"Znači, da ta jedan, ono ne znam, evo, kažem, toliko smo ne, ne znamo."
1:13:51,1:13:56,"Dijete koje strastveno se bori, oni sami isto nađu svoju neku strast."
1:13:56,1:13:57,"Znači, oni se bori."
1:13:57,1:14:05,On se borio da te potice da nađe u čemu se pronalazi i da ga u tome vidiš i da ga u tome guraš.
1:14:06,1:14:18,"On je sad radio neki video, vidjela sam da se dok je htio napraviti video za kraj, stalno je bio, istraživao je sve kako se radi, kako šta, kako napraviti zvuk, kako ovo, kako ono."
1:14:18,1:14:27,"Mislim, to su stvari koje kad te zanima, viš kako brzo, on je već ono, kako je brzo naučio i kako se ta kamera, ta kamera je kod nas bila ima pet godina, nikad nitko nije uzeo."
1:14:28,1:14:36,"On je to sve sastavi, uzeo, napravio jer mu je to bilo super važno jer je htio da napravi taj video, htio je da sa tim svojim prijateljima."
1:14:36,1:14:38,"I ti gledaš, eto, to je to."
1:14:38,1:14:48,"Zapravo, kad nađe neku svrhu, on može i da mu pomogne, da ga podržiš u toj nekoj svrhi jer pritisak po zakonu fizike, pritisak stvara otpor."
1:14:49,1:14:50,Kad tad će biti otpor?
1:14:51,1:14:53,Pa kad ništa kasnije neće biti otpor prema životu.
1:14:54,1:14:56,"Strah, pritisak stvara otpor."
1:14:58,1:14:59,Ali definitivno.
1:15:00,1:15:02,"nisam ni za ono opustiti se, šta me briga."
1:15:03,1:15:09,"Nikakve uključenosti nemam kao majka, baš ne kradi šta hoće, baš me briga to isto ne uključuje."
1:15:09,1:15:11,"Naravno, sa zrnom stoli sve."
1:15:12,1:15:24,"Tu moraš biti tu, on mora znati pravila nekakva života kakva stoje, on treba znati šta su njegove dužnosti, odgovornosti, šta je važno u životu."
1:15:24,1:15:26,To je ono što mislim da trebamo naučiti djecu.
1:15:26,1:15:29,"A i gledati djete, vjerojatno da."
1:15:29,1:15:32,"Da, gledat ga u tome kako je pronašao neku ispunjenje."
1:15:32,1:15:33,Ja vjerujem da je to tako predivno.
