Start (HH:MM:SS),End (HH:MM:SS),Segment
0:26:11,0:26:16,Nego je to možda taj strah i osjećaj život sa djetetom.
0:26:17,0:26:20,Jer to zaista nije lagan život i možda bi stvarno mi je sretniji da.
0:26:21,0:26:22,"Znači, nekad mi se čini da."
0:26:26,0:26:27,Ne volim uspoređivati.
0:26:27,0:26:33,Jedino je pojam da ove nove generacije ipak malo imaju tendenciju bježati od odgovornosti.
0:26:33,0:26:34,Pa onda u tom kontekstu.
0:26:35,0:26:49,"Pa ja bih rekla da nove generacije imaju tendenciju bježati od odgovornosti, da su da nekako ne servira se neki lagodan život i sve skupa, ali nikad ne bih rekla šta je bolje i šta je gore, jer nemam pojma."
0:26:50,0:27:01,"Znači, vi imate svoju priču, imate ljude, ja znam one ljude koji isto nemaju djecu i koji ne žele djecu, a koji žive nekako ne znam cijeli svoj život."
0:27:01,0:27:06,spašavaju životinje i imaju takve ljude u svom životu.
0:27:06,0:27:11,"Meni je Bog dao takav život, da imam toliko ljudi u svom životu."
0:27:12,0:27:17,"Svi imaju, kako bi rekla, neku sliku."
0:27:17,0:27:19,"Slažu neku sliku, da naze ispunjenost i svrhu."
0:27:20,0:27:37,"Isto kao što znam ljude koji idu u crkvu svake nedjelje i mole se Bogu i imaju djecu, ali generalno nisu na toj razini empatičnosti, borbe za druge, ne valim to riječ, nekakvog svrhovito."
0:27:38,0:27:43,"Nisu mi uzori, nisu mi uzori, razumiješ me?"
0:27:43,0:28:08,"Ne možeš mi biti tu, nije mi to što ti ispunjavaš nekakve kriterije koje smo mi sebi zadali, koje su načelno, ja sam odrasla u katoličkoj obitelji gdje su mi roditelji tako, gdje ste svake nedjelje morali ići u crkvu, gdje imali su se ta nekakva pravila koja i za, znači, isto tako gledam neku drugu priču, ne, nije mi to."
0:28:09,0:28:18,"Svrhovit život, poštivanje prema svemu, odnosno, stvarno prema životu nije mi to, ne znam, kako bi rekla, puno, nije mi to kriterij."
0:28:20,0:28:30,"Možeš imati djecu i više djece i sve to, s druge strane možeš uopće ne živjeti život koji je primjer kako zaista čovjek treba živjeti."
0:28:31,0:28:33,Što zaista znači biti duhovan.
0:28:34,0:28:37,Što zaista znači kad mi kažemo on je vjernik ili nije vjernik.
0:28:37,0:28:46,"Jer zaista vjernik onaj koji svake nedjelje ide u crkvu, ispunjava sve ono kako smo naučeni, ali u svom životu nema tu duhovnost."
0:28:47,0:29:31,"Da sad ne dajem ono, znači tako da ne Mi nismo mi kako ćeš ti, ti tražiš biti primjer nekom čovjeku ako želiš sad živjeti, zaista ne znam sada je otišao do skroz neko, ali ne veze."
0:29:31,0:29:32,Već postaviš sa strane ili što.
0:29:33,0:29:34,Ne sviđa mi se ovaj smijeh.
0:29:34,0:29:59,"Ali gleda, ako ti hoćeš živjeti život ispunjen, znači ako želiš biti primjer u životu kao, evo, katolik vjernik, budi taj čovjek kojega će neko, koji nije nikad došao u susret sa ničim sličnim, koji će reći, ej, ali želim pripadati, želim učiti od ove žene, želim vidjeti tuže, želim biti ovo što je ona."
0:30:00,0:30:07,"ili muškarca, a da sad govorimo o nama ženama, želim biti to što ti radiš u svom životu da si tako dobra."
0:30:07,0:30:09,Ja želim to isto raditi jer vidim da je to.
0:30:10,0:30:19,"Ja vjerujem, ja molim, ja stvarno vjerujem, ja sam jako duhovna osoba koja vjeruje više u Boga, već to vjerujem da ja sjedim sad s tobom ovdje."
0:30:19,0:30:36,"Znači duboko vjerujem da, ali ne mogu trunku reći, nemam taj osjećaj u sebi, e onaj vidiš, e on, zašto on nema djecu, e vidi ovaj, ovaj je gej, on sigurno ne valja, ovaj ne pripada nama, ovaj nam nije u redu, ovaj."
0:30:37,0:30:38,Gdje idemo s tim?
0:30:38,0:30:41,Ja želim svim ljudima biti tu.
0:30:42,0:30:47,Da kroz tu moju vjeru se sa mnom u kontaktu uz kavu dožive nešto lijepo.
0:30:47,0:30:49,"Pa pet minuta, pet minuta."
0:30:50,0:30:50,Mislim da je to.
0:30:51,0:30:54,"Moram još, Tina, reći da si to uspjela."
0:30:55,0:31:12,"Jer meni je moj neki cilj koji ja tek trebam doseći, nisam ja ni blizu, ali uvijek razmišljam, želim biti onaj tip vjernice koja je onako kao suptilna u smislu da ljudi se zapitaju odakle njoj ta radost."
0:31:14,0:31:15,Odakle njoj ta snaga?
0:31:16,0:31:18,"Kažem, još je put pred mnom, ali..."
0:31:20,0:31:20,Što će ti sad reći?
0:31:21,0:31:21,Ako bi skrovala...
0:31:22,0:31:22,A što će ti sad reći?
0:31:23,0:31:27,"Budući da ti stvarno ne govoriš često o svojoj vjeri, ja pojma nisam imala za tu tvoju stranu."
0:31:28,0:31:31,"Ne znam sad zašto je to, jer ja volim neke ove podcaste."
0:31:31,0:31:34,"E, sad što izađe iz mene, evo sad bi on trebao doći."
0:31:34,0:31:34,Došao je ovaj dio.
0:31:35,0:31:40,"Ja sam se pripremala malo, gledala o tebi, znam već tu cijelu tvoju priču i pratim."
0:31:40,0:31:45,"Ja sam se baš pitala, pa nemaš šansa da ova žena nije vjernica, pa odakle njoj snaga?"
0:31:46,0:31:47,Evo.
0:31:47,0:31:48,A to je moja snaga.
0:31:48,0:32:13,"Mislim, ja strašno, mislim, stvarno, da nije bilo vjere, ja ne bih mogao to proći sa Mateom, pa da naravno, mislim, ne bi ni muži, ja mi ne bi, ja toj svojoj djeci kažem bez tog duhovnog života, pazi, duhovnog, ne ono ispunjavanje očekivanja drugih, meni to čak ide i na živce, ne želim se prikazivati svake nedjelje u crkvi da bi se pokazala kako sam ja vjernik."
0:32:13,0:32:24,"Nemojte me pogrešno zvati, meni za to to su, mada i od moje bake koja je bila dosta konzervativna i dosta tih nekakvih stvari u kojima sam i mame i tih nekakvih pravila u kojima ti time pokazuješ što ti nešto znaš."
0:32:24,0:32:25,"Znaš, što znaš?"
0:32:26,0:32:43,"Ja želim kad ti dođeš sa mnom u kontakt, da to osjetiš da postoji taj jedan dio mene koji je duhovan i koji će ti nešto, ne znam, koji će ti nešto, ne imam pojmaš, želim živjeti vjeru."
0:32:43,0:32:45,Želim to stvarno živjeti.
0:32:45,0:32:48,"Ne želim nikada, od mene nikad nećeš čut."
0:32:48,0:32:51,Jer nikad neću nešto što je drugo i drugačije osuditi.
0:32:51,0:32:52,I reći da je to vjeru.
0:32:53,0:33:00,"U mom svijetu to nije što god, možda od mene, možeš me staviti u koju god održiš kategoriju, ali ja neću osuditi druge."
0:33:00,0:33:06,"Ja imam ljude koji volim, koji su ono, toliko, meni je to Bog dao."
0:33:06,0:33:09,Da dođemo u kontakt sa toliko različitih ljudi.
0:33:11,0:33:14,Možeš li odvojiti tipa grijeh od osobe?
0:33:14,0:33:17,Jer ja razumijem i slažem ja da odvajam grijeh od osobe.
0:33:17,0:33:18,Da ja uopće pričam o grijehima drugih.
0:33:19,0:33:24,"Ipak, vjerojatno imaš nekakav kompas kad je nešto u redu i nije u redu, to želiš reći, ali ne osuđuješ."
0:33:25,0:33:26,"Ali gdje ti je, Bog je stvorio čovjeka."
0:33:29,0:33:31,Što je bilo prvo kad je Bog stvorio čovjeka?
0:33:31,0:33:32,Što je rekao Bog?
0:33:32,0:33:34,"Bog stvori čovjek, što je bilo?"
0:33:34,0:33:36,Bog stvori čovjeka i dademo slobodu.
0:33:36,0:33:37,Je li tako?
0:33:38,0:33:42,"Znači, njegova ideja je bila da mi ovdje imamo slobodu i da biramo."
0:33:42,0:33:47,"Poslije toga dolazi deset Božjih zapovijedi, koji su vrlo jasni kriteriji."
0:33:47,0:33:56,"Koliko god su oni dosta sključani, vrlo je jasno nekako šta, kroz to si mogao nekako ne ubij, ne ukradi, ne reci lažna svjedočanstva."
0:33:57,0:34:02,"Svašta to nešto ima što ti onako, prilično ti može biti neki taj koncept jasan šta ćeš raditi."
0:34:03,0:34:12,"Tko sam ja da ja kažem, ja sam Irena Orlović, katolik, vjernik, bolja od tebe koji nisi, koji si ateista."
0:34:12,0:34:13,"Atheista, naprimjer."
0:34:14,0:34:23,"I sad ti imaš tog ateistu koji je odrastao u nekoj svojoj priči, možda on taj put skroz radi kroz neku ekološku osviještenost, kroz neku."
0:34:23,0:34:33,"Gledajući, ja ljude oko sebe vidim da ljudi, majkajte, žive skroz neki život koji je skroz etičan, pravedan, pošten, kroz neki svoj put."
0:34:33,0:34:36,"Ko sam ja da tebi kažem, kako te od tebi da puštim?"
0:34:37,0:34:49,"I otpisujem da ne kažemo ono, pa ne znam, možemo se uvijek naći bilo kako, možemo se, ne bitno je da svi pređemo tu i to je onda taj dio empatičnost, svrha."
0:34:49,0:34:57,"Svrha, postojanje, osjećaj da, da, osjećaj nekakav, taj osjećaj tog nekog duha koji te vodi."
0:34:57,0:35:03,"Evo, ne znam, to je neki level koji ja vjerujem da ljudi doživljavaju na različite načine."
0:35:04,0:35:08,"Naš je put takav, ja ga volim i ne bih nikada odustala od njega."
0:35:08,0:35:18,"Znači, to je nešto što sam ja ipak taj, kroz svoju nekakvu obitelj, imam neki svoj put, tako pokušavam biti primjer svojoj djeci."
0:35:18,0:35:23,"Ja neću svojoj djeci reći nikada moraš ići negdje u crkvu, moraš ovo napraviti, moraš ovo napraviti."
0:35:23,0:35:25,To moja djeca nije.
0:35:25,0:35:29,"Nikad neće čuti od mene, ali generalno oni sami odaberu otići."
0:35:32,0:35:42,"Da, u tome nečemu do ovoga moraš biti ti to što želiš da ti dijete bude i to negdje."
0:35:42,0:35:44,I opet ja sad da ne odem da sam ja sada nešto savršena.
0:35:44,0:35:54,"Nisam niti savršena majka, niti savršena ni u ničemu, ali evo generalno ne volim taj dio onog kad mi počnemo od, kažemo mi, Bog nas je kaznio zbog ovoga, Bog nikad ne kažnjava."
0:35:54,0:36:00,"Po mom, ovo kažem sad moje, sad ću ja biti nekakva, krstiva i svoje neko, da ću imati ono disclaimer."
0:36:01,0:36:03,"Ni gošćani, bajteljica nisu teolozi."
0:36:03,0:36:07,"Psiholozi, ali gledaj kako ja, samo pričamo o svom malom životu, ništa, samo o svom svijetu."
0:36:07,0:36:23,"Znači, ti možeš živjeti taj život koji ti je, zna se šta ide prema Bogu, kakav je put, etičnost, empatija, ljubav prema čovjeku, ljubav prema životu."
0:36:23,0:36:25,"Sve su to putevi koji, sve su to stvari."
0:36:25,0:36:36,Kako pomiriš tu te dvije strane da ti osjećaš ono potpuno ispunjenje u duhovnosti i vjeruješ?
0:36:37,0:36:40,I to da opet to držiš za sebe na neki način.
0:36:42,0:37:00,"Pa ja gledam da ja svojim životom utječem, a ne svojim propovijedanjem i nekom mjerom, a na svojim životom utječem na svakog čovjeka da kroz posao koji radim da on bude etičan, da on bude nešto što je dobro za društvo i zajednicu."
0:37:01,0:37:05,Da nešto što radim da je to korisno društvu i zajednici.
0:37:06,0:37:08,I to je za mene moja vjera.
0:37:09,0:37:13,"Ne moram ja ako govorite i slušaj, Iva, ja sam ti vjernik, znaš, ja sam sad."
0:37:13,0:37:14,nešto posebno.
0:37:15,0:37:24,"Jer i nisam posebna, samo gledam svaki dan kroz svoj život kako naravno da sam užasno puno griješi."
0:37:25,0:37:28,"Naravno da i ja, da sam generalno nisam Bog."
0:37:29,0:37:37,"Mogu biti dio Božje zajednice na svijetu, glat negdje neknu mrvicu nekada, ali naravno da sam iso čovjek i da svaki dan napravim neke pogreške."
0:37:37,0:37:40,I da sigurno nekoga sa nekim svojim ponašanjem i povrijedim.
0:37:40,0:37:49,"I da sigurno jednostavno sam ono, ali stalno imaš oči, znaš ako vidiš, oi, nije to."
0:37:50,0:37:51,Da stalno imaš tu neku.
0:37:51,0:37:54,Zato mi kroz školu radimo to samo refleksiju.
0:37:54,0:37:55,To se zove samo refleksija.
0:37:55,0:37:59,"Da provjeriš sebe gdje sam bio dobar, gdje nisam bio dobar, gdje mogu biti bolji."
0:38:00,0:38:02,Kako ću bolje to napraviti u svom životu.
0:38:02,0:38:08,"I da isto tu grešku koju si napravio, ne stavljaš kao ono kako mi je to greh."
0:38:09,0:38:09,Izgon.
0:38:10,0:38:10,Greh.
0:38:11,0:38:13,"Jedan, greh je sve to."
0:38:14,0:38:16,"Znaš, tu greh je da taj."
0:38:17,0:38:20,te si čovjek i grešan si i sve je to tako ok.
0:38:21,0:38:32,"Dok to vidiš, dok vidiš da griješiš., da radiš pogreške, da nije dobro, da može bolje, jer ja isto mislim."
0:38:33,0:38:36,"I ne samo da mislim, to je isto površno."
0:38:36,0:38:42,"Ja vjerujem da mi ljudi u ovom svijetu sve što naučimo, naučimo kroz te greške."
0:38:44,0:38:49,"Od hodanja, kad smo padali, do tih nekih ponašanja koje smo imali."
0:38:49,0:39:00,"Pa onda ako me netko i kao dijete, kad ja pogriješim na pravilan način, pomogne da vidim svoju grešku i da rastem bolje iz nje."
0:39:01,0:39:11,"I to je zadatak nas roditelja, ne da kaznimo ga, da ga omalovažimo zato što griješi, jer mi smo generalno ljudi, mi stalno griješimo, mi stalno radimo greške."
0:39:13,0:39:16,I kroz njih učimo i kroz njih se razvijamo.
0:39:17,0:39:21,Ja ne znam šta sam u životu svome naučila da nisam naučila kroz neku grešku.
0:39:22,0:39:26,I u odnosu s ljudima i u odnosu da vidim da stalno nešto griješim.
0:39:27,0:39:42,"Ali onda stanem i kažem, ok Irena, prvo je bio jako jedan period života u kojem sam te greške sebe krivila, užasno krivila, užasno, to je taj naš odgoj koji nas je ono, moraš biti savršen, ne smiješ griješiti."
0:39:42,0:39:47,"I taj osjećaj krivnje je jako težak, jako, jako težak."
0:39:47,0:39:56,"I sad ti to toliko kriviš se, kriviš se, kriviš se i ti sebe i psihički i fizički, ne fizički, ali zlostavljaš tom krivnjom."
0:39:57,0:40:04,"A to nema ve to tež, jednostavno reći, ok, pogriješio sam, ali idem bolje, idem drugi put napraviti bolje."
0:40:04,0:40:07,"Sad znam kako ne valja, kako nije dobro, sad ću napraviti bolje."
0:40:08,0:40:13,Može mi drago da si spomenula tu auto-sama refleksiju.
0:40:14,0:40:26,"i da malo iz ove dubine se probamo vratiti na nešto malo neću reći površnije, ali jednu svakodnevicu, evo konkretno u tvojoj školi koju si osnovala."
0:40:26,0:40:27,Pa kako to onda?
0:40:27,0:40:31,"Evo, mi sad vidimo s kakvim sve borbama se čovjek bori kasnije u životu."
0:40:31,0:40:39,"Možda je dosta toga ukorijenjeno u tom nekom, baš što sam spomenula, ako pogriješiš, jedinica, ako pogriješiš, nisi dovoljno dobar."
0:40:39,0:40:43,"Ono samo se kao neka vrijednost je pet, pet nula."
0:40:44,0:40:47,To ti onda obećava nekakvu svjetlu budućnost.
0:40:48,0:40:52,Ti si napravio jednu veliku promjenu u svojoj školi da nema ocjena.
0:40:52,0:40:53,"Pa, znaš što ja sam."
0:40:54,0:40:57,"Kako to funkcionira, gdje djeca sama sebe evoluiraju?"
0:40:58,0:41:04,"Funkcionira je to tako, to je isto jedna, koliko god djelovalo to kao vraćamo se negdje, ali to je ta velika dubina."
0:41:04,0:41:06,Toliko promišljanje o svojim.
0:41:06,0:41:07,Što sam htjela reći?
0:41:08,0:41:08,Praksa.
0:41:08,0:41:10,Ne zato što si ti promišljala o svojim.
0:41:10,0:41:15,"Definitivno, to je jedini način na koji, pazi, ja čak ne bih rekla ja."
0:41:16,0:41:17,Ja to nisam izmislila.
0:41:17,0:41:19,Ja to nisam stvorila.
0:41:19,0:41:31,"Ja sam tu samo netko ko je istraživao, čitao i vidio šta je prije sto godina edukacijska psihologija istraživanja koja je pratila neke prakse koje su u svijetu."
0:41:32,0:41:34,Znači to nije nešto što je Irena izmislila.
0:41:35,0:41:37,Da odmah razumijemo da ne bi ispalo da sam ja sad neki tu.
0:41:40,0:41:53,"Ja sam to pratila, vidjela moj način na koji moje ne znam od obrazovanja do predmeta interesa do svega toga, vidjela u biti kako ljudski um funkcionira, kako mi učimo."
0:41:53,0:42:02,I kako mi najbolje učimo tako što se mi susrećemo sa našim pogreškama i što ih reflektiramomo.
0:42:03,0:42:05,I sa uspjesima i sa pogreškama.
0:42:06,0:42:09,"Da vidimo ono gdje smo uspješni, to je isto tema."
0:42:09,0:42:13,Mi teško sebi dajemo da vidimo gdje smo uspješni i dobri.
0:42:13,0:42:15,Šta sam ja dobro napravila?
0:42:15,0:42:16,Šta sam ja dobro?
0:42:17,0:42:18,E pa to je bilo dobro.
0:42:18,0:42:22,"I kad ti reflektiraš što si dobro napravila, kako sam to napravila?"
0:42:22,0:42:23,Kako je to išlo?
0:42:23,0:42:25,Šta je moja jača strana?
0:42:25,0:42:26,Šta mi ide dobro?
0:42:26,0:42:27,Ja otkrivam sebe.
0:42:28,0:42:28,Gdje sam pogriješila?
0:42:29,0:42:31,"Ne ono kada uviješ četiri, pa je pitanje, a šta nisi znala?"
0:42:32,0:42:34,"Da, već kako sam došla do četiri?"
0:42:35,0:42:35,Šta sam znala?
0:42:36,0:42:38,Kako sam uspjela doći do te ocjene?
0:42:40,0:42:41,Šta je moja strategija?
0:42:42,0:42:44,"Svi smo mi u nečemu, u bolju nečemu, malo gori."
0:42:45,0:42:46,Šta je moja dobra strategija?
0:42:47,0:42:48,Znači i to je bitno.
0:42:48,0:42:50,I koji su pogreške?
0:42:50,0:42:51,Kakve su one?
0:42:52,0:42:53,Gdje sam pogriješio?
0:42:54,0:42:57,I znam da je to pogreška.
0:42:58,0:42:59,Znači ne sramim se zbog toga.
0:43:00,0:43:01,"To je bitno, jako bitno."
0:43:01,0:43:05,"Jer kad se sramim zbog pogreške, to je strašno kad se djeca srame pogriješiti."
0:43:06,0:43:09,Kad se stvara jedna slika da su savršene.
0:43:09,0:43:12,"Šta sam pogriješio, gdje sam pogriješio i kako tu mogu biti bolje?"
0:43:13,0:43:16,"Možda će se nekomu činiti kao škola bez ocjena, pa tu nema nikakve strukture."
0:43:17,0:43:19,Pa tu su određene i ogromna struktura.
0:43:20,0:43:27,"Tu su oni i oni te bliže, te učitelji i oni to evaluiraju, samo je to puno dublja evaluacija od jednog broja."
0:43:28,0:43:31,Taj jedan broj je cijeli jedan proces.
0:43:31,0:43:34,"Ne može biti samo jedan broj, evo tebi pet."
0:43:34,0:43:35,Šta to znači?
0:43:36,0:43:43,"Šta si ti dobio s tom peticom, osim nekakve povratne informacije, ti si najbolji od ovih drugih."
0:43:44,0:43:46,To nije ono što želimo u svom životu.
0:43:47,0:43:49,"To nije naš put, ali ako ti ne kažemo."
0:43:49,0:44:05,"Ako ti neko tu peticu evaluira na način gdje si dobar, šta si dobro napravio, ako ti u pitanjima osvijesti nastavnik, kako je ta petica, znači nastavnici opisno ocjenjuju i oni opisno ocjenjuju zajedno s učenicima, zajedno, zašto zajedno?"
0:44:05,0:44:15,"Zato što učenik osvijesti šta si radio ovaj tjedan, šta je bilo dobro, kako si došao do toga da to budeš, koje si vještine koristio da to napraviš."
0:44:16,0:44:38,"Znači kad ti pričaš o tome, ti to uzmete, kad ti to verbaliziraš, kad ti to napišeš, jer pisanje je jako važno, kad ti pišeš., zamisli si pišeš tekst u kojem pišeš o sebi neku refleksiju, pa ti vježbaš i pišeš i sve skupa, učiš i učiš sve procese učenja svoga, ideš neke druge, neke druge levele u našem postojanju."
0:44:38,0:44:51,"I ti jednostavno integriraš i taj osjećaj i vještine i to ćeš sutra opet idući tjedan, idući mjesec koristiti jer ti si sad svjesan svoje snaga, ali i slabosti."
0:44:51,0:44:52,Šta je moglo biti bolje?
0:44:53,0:44:54,Kako si to mogao bolje?
0:44:55,0:44:56,Šta nije bilo dobro?
0:44:56,0:44:57,Šta je sasvim u redu?
0:44:57,0:45:01,Kako se onda djeca nose s tim slabostima.
0:45:01,0:45:09,"Jer na trenutak mi se činilo kao da je to onda samo bustanje, super sijome, nema veze što, ali super sijome, ovo ti je super, ovo ti više kao bustanje."
0:45:09,0:45:12,"Ne, to je jedno i drugo, ali samo za ove slabosti."
0:45:12,0:45:23,"Odličnost, no zato što djeca nema tu, slabosti se nadograđuju, ako sam nečemu, nikad neću biti, ne znam, super umjetnik jer nemam tu, nemam sada, ne znam baš što je bolje crtati."
0:45:24,0:45:28,Ali sam dobar u tome ono koliko mogu biti dobar najviše potencijal kojeg imam.
0:45:29,0:45:45,"To je nastavnik se zato educira, znači nastavnici se stalno educiraju o tom području gdje on uči, kako on evaluirati to tog učenika, da on primijeti njegove potencijale i da on na neki način njemu da povratnu informaciju u čemu je dobar, u čemu je bolji."
0:45:45,0:45:46,"Slabosti su, snaga isto."
0:45:47,0:45:53,"Te ti vidiš, sada što bi ja sada trebala od sebe forsibilizirati, ne ide mi matematika dobro, tema svih tema."
0:45:53,0:45:54,"Ajmo, repeticije."
0:45:55,0:46:00,"Znači, tko kaže da si ti loš ako tebi ne ide dobra matematika?"
0:46:01,0:46:07,"Ako jednostavno ne znam, nešto se dogodilo u tim procesima, možda stvarno ide nekakvim diskalibriranim."
0:46:07,0:46:09,"Ne znam, imaš stvarno to?"
0:46:09,0:46:12,"E sad, nažalost, sramota, grozno, ne ide."
0:46:12,0:46:15,"Ajmo, repeticije.icije, ajmo popravljati."
0:46:16,0:46:18,Pa do neke točke ide i matematika.
0:46:18,0:46:22,"Ajmo vidjeti gdje tome djetetu matematika ide, do koje je on točke."
0:46:22,0:46:31,Možda je ne znam u petom razredu ali još uvijek između trećeg i četvrtog što je neurobiološki i neuroznanstveno sasvim ok i u redu.
0:46:32,0:46:40,"Jer to nema nigdje, nigdje, nijednog istraživanja koje potvrđuje da bi reklo da je to dijete ne znam manje vrijedno."
0:46:41,0:46:49,"Zato što nije, svi sad i matematici i stručnjaci u matematici i u psihologiji svi govore o tome da vrati dijete gdje je."
0:46:50,0:46:52,Vrati ga ako treba sa sadržajem u treći razred.
0:46:52,0:46:56,"Da, ne samo rupe neke, ali i ovdje ima rupe, on ne zna, on ne predima."
0:46:56,0:46:58,"Vrati ga u treći razred, molim te."
0:46:59,0:47:01,I daj mu osjećaj uspjeha.
0:47:02,0:47:06,Vrati ga ako treba ono na množenje iz šestog razreda.
0:47:06,0:47:08,Vrati ga još uvijek ako nije množenje usvojilo.
0:47:08,0:47:09,Ajmo opet množit.
0:47:09,0:47:11,Ajmo samo da imaš osjećaj da ti to možeš.
0:47:12,0:47:22,"Pa ćemo to množenje raditi duže vremena, ali bitno je djetetu zadržati osjećaj da nije krivo, loše, glupo, bilo šta zato što to nije usvojilo."
0:47:23,0:47:26,I taj sram nas roditelja ako to dijete nije usvojilo.
0:47:27,0:47:29,Pa to ono idi radi kako mu.
0:47:30,0:47:30,Lijenije.
0:47:31,0:47:32,To je najčešće.
0:47:32,0:47:33,On je samo lijen.
0:47:34,0:47:37,To je najčešća rečenica koju ćemo čuti od roditelja.
0:47:38,0:47:39,Ne postoji ljeno dijete.
0:47:41,0:47:42,Ne postoji ljeni čovjek.
0:47:42,0:47:43,Postoji samo otpor.
0:47:45,0:47:46,Otpor prema tome.
0:47:46,0:47:51,Ti imaš ljude koji su zauvijek odlučili biti u otporu prema životu.
0:47:52,0:47:57,"Jer su povrijeđivani, jer su omalovažavani i onda su shvatili bolje da ne pokušavam."
0:47:58,0:48:01,"Jer kad sam pokušavao, spuštalo me se nazad.."
0:48:02,0:48:04,"Jer sam išao na repeticije, nije išlo."
0:48:05,0:48:11,"I onda, zamisli taj osjećaj, vježbaš matematiku, ne znam, par sati, napraviš sve, odeš na kontrol, ljepede da bi išlo što."
0:48:11,0:48:13,"Pa ne moram zamišljati taj osjećaj, zamišljati."
0:48:13,0:48:14,I znaš što ću ti reći?
0:48:14,0:48:18,"Baš to, čak ne bih rekla možda prvo otpor, ali onda ono odustajem."
0:48:18,0:48:20,"Ja nisam za matematiku, točno."
0:48:20,0:48:21,Svaki čovjek je za matematiku.
0:48:23,0:48:29,"Znate, padne na pamet, pa sjećam se trenutaka kada bi ja ono to pohvatalo, pa to je zapravo dosta logično."
0:48:30,0:48:41,"Ali onda opet odvučem ova neka kreativna strana u kojoj više uživa matematiku, su te učili da moraš ti u petom razredu?"
0:48:41,0:48:53,"Mislim, vjerojatno mi je samo tempo bio možda za matematiku sporiji od moje generacije, ali se nekad čak i zapitam, evo s nekim odmakom kad je bila ta osnovna i srednja, zapitam se, pa možda bi meni i matematika bilo ok."
0:48:53,0:48:55,"Da, i onda kad bi bilo što bi bilo."
0:48:56,0:48:58,Matematika je važan predmet.
0:48:58,0:49:03,"Užasno, za naš kognitivni razvoj je užasno važno raditi matematiku za djecu."
0:49:04,0:49:06,I konceptualnu matematiku.
0:49:06,0:49:07,Da oni shvate što je to.
0:49:07,0:49:09,"Ja ne znam matematiku, ja znam častno."
0:49:10,0:49:12,Ali generalno da ti shvati što je to tebi to treba.
0:49:13,0:49:18,"A šta meni treba onaj korijen iz onog nečega kad sam, a to nije istina, trebati danas."
0:49:18,0:49:21,Profesore ne znaju dati odgovor na to šta će mi to jednog dana.
0:49:23,0:49:31,"Da su nama profesori samo objasnili da to možda i nema nužno veze s tim da će te teta na blagajni prevariti taj korijen iz nešto, nego da to samo da ti."
0:49:32,0:49:34,"Razvijati, promijeniti razmišljanja i nešto."
0:49:34,0:49:42,"Vi sutra radiš nešto u životu, te i traži, imate neke neurološke procese unutra koji su matematički koncepti."
0:49:42,0:49:44,Ti pomažete svugdje.
0:49:44,0:49:48,Ali zapravo i za svaki predmet imam osjećaj da je najveći problem to što.
0:49:49,0:49:51,što učenici ne znaju šta će im to.
0:49:51,0:49:52,Oni ulaze u gradnju.
0:49:52,0:49:55,Pa upravo mi u školi u Harenu imamo koncept.
0:49:55,0:49:59,"Znači svaki učitelj prolazi why, prvo."
0:50:00,0:50:06,Prvi dio osvještavanja djeci kad počinje lekcija je zašto je to važno.
0:50:06,0:50:07,Sad si rekla odličnu stvar.
0:50:08,0:50:10,Jer zašto bi ja učio?
0:50:11,0:50:19,"Nije, ok, učiš za pet, dobiješ pet, ispunio si svrhu i sve znanje koje si imao zaboraviš."
0:50:19,0:50:22,"Svjesno da to nema smisla, učim samo za peticu, petinu gradimo."
0:50:23,0:50:23,Znači nema smisla.
0:50:25,0:50:38,"Ljudima koji uče za pet, djeci koja uče za pet ima smisao zato što kad su pet mama će me vidjeti, tata će me vidjeti, učitelji će me, svi će govoriti da sam ja pet i napokon sam ja u dobrom osjećaju."
0:50:38,0:50:45,"To je prividan osjećaj dobar jer kad tad toliko živjet za druge, ispunjavati očekivanja drugih te vodi u neku anksioznost."
0:50:46,0:50:48,Doći će dan kad to nećeš više moći.
0:50:49,0:50:55,"Izgoriš, izgoriš kad tad, početiš priznavati se u snu, budit se sa paničnim napadom, ne možeš to ispuniti."
0:50:55,0:51:01,Toliko očekivanja od društva da te postavke koje je društvo postavilo su potpuno krive.
0:51:01,0:51:03,Tako da to je svrha.
0:51:03,0:51:08,"Drugi ne vide svrhu u tome, onda djeca ulaze u neka loša ponašanja."
0:51:08,0:51:11,Loša ponašanja nam uvijek govore da dijete traži pomoć.
0:51:12,0:51:15,"Nikad ništa drugo, već samo da dijete treba traži pomoć."
0:51:16,0:51:24,"I naš je zadatak da mi tome djetetu pomognemo, a ne da ga spustimo, da ga povrijedimo jer se ovo loše ponaša."
