Start (HH:MM:SS),End (HH:MM:SS),Segment
0:00:00,0:00:22,"Bok, ja sam Iva Kraljević, a sa mnom je danas Irena Orlović, magistrica znanosti psihosocialnog savjetovanja, neurolingvistička psihoterapeutkinja, osnivačica privatne osnovne škole Harfa, vlasnica i urednica izdavačke kuće Harfa, ali prije svega jedna jako snažna, hrabra i cool žena."
0:00:23,0:00:46,"U današnjoj epizodi ćete sigurno biti osnaženi, motivirani, dirnuti, slobodno pripremite i maramice, ali ćete se i nasmijati i zamisliti više puta i evo, od srca vam se savjetujem da se lijepo smjestite, onako zamislite da ste primaknuli neku stolicu ovdje s nama i budite s nama u ovom razgovoru."
0:00:56,0:00:59,"Evo, draga Irena, hvala ti na dolazku iz Splita."
0:01:00,0:01:00,Kako si?
0:01:00,0:01:01,Kako je prošao put?
0:01:02,0:01:02,Super.
0:01:03,0:01:03,Dobro.
0:01:04,0:01:07,Sve je baš poznato pričalo i slušala sam neku knjigu i tako da.
0:01:08,0:01:10,"Volim ja putovati sa autom, tako da meni nije to teško."
0:01:12,0:01:16,"Recimo, evo krenut ćemo zapravo odmah, bez nekog small toka."
0:01:16,0:01:22,"Znam da ljudi zapravo žele čuti ono o tebe najbolje, a ne kako je prošao put u što si doručkovala."
0:01:23,0:01:24,Krenimo prvo s tobom.
0:01:26,0:01:31,Tvoj život zapravo se jako nadovezuje na ono čime se ti baviš.
0:01:32,0:01:40,"Kao što sam rekla u uvodu, osnivačica si i harfe škole i nakladničke kuće, izdavačke kuće."
0:01:41,0:01:42,Kako je sve krenulo?
0:01:45,0:01:48,Pa sve je krenulo tako što.
0:01:49,0:01:55,iz nekog mog osobnog pokušaja da pomognem sama sebi.
0:01:56,0:02:01,Znači iz nekog osjećaja da nešto napravimo od svog života bez obzira kakav on bio.
0:02:03,0:02:10,"Da nešto, da ono nekog prkosa, sad mi u zadnje vrijeme cijelo vrijeme kao nekakav prkos prema životu."
0:02:11,0:02:16,Život ti stvarno servira jako puno teških stvari i ti mu moraš prkositi.
0:02:16,0:02:29,"Znači ne možeš reći ono evo sad je meni život dao teško djetinstvo i ja sam gotovo u životu, ja ne mogu ništa protiv toga, već ja ne mogu tu ništa, bespomoćan sam."
0:02:29,0:02:36,"Meni je život sad dao neku tešku situaciju, ja sam bespomoćan, ne mogu si sad ništa tu napraviti jer je meni to život dao."
0:02:36,0:02:49,"Mislim, život nam generalno stalno dolaze takve neke stvari koje su teške, a mi trebamo preko sit u smislu da prihvaćamo to što nam dolazi i od njega radimo ono što najbolje je moguće."
0:02:49,0:03:29,"Mislim, ja sam kao nekakva mama u tim nekim vrlo mladim godinama, pa da mi riječ na pamet, pogubljena u vremenu i prostoru, pokušala naći nekakav svoj put i kao žena, i kao majka, i kao ne znam, nešto za sebe, nešto za svoj život, nešto što u tim nekim trenucima baš teškim u životu, kao mama, ne znam, djeteta sa teškoćama, pa svim tim nekim problemima od financijskih do svakakvih nekakvih, sam nekako iz nekog razloga u mom životu je se pojavio taj osjećaj, ok, to je sad to, ali to me neće ubiti."
0:03:30,0:03:33,Ne dam tome sad nečemu da ja postanem žrtva toga nečega.
0:03:34,0:03:40,"Što je bilo ono prvo to za neke koji možda gledaju slu i slušaju, a nisu još upoznati s tvojom životnom pričom."
0:03:41,0:03:49,"Prvi neki okidač ili prvo to što ti je život servirao nešto što ti moraš isprku si ti je bilo, pretpostavljam, rođenje djeteta sa vrlo teškom."
0:03:49,0:03:50,Alad generalno i nije.
0:03:51,0:03:55,"Generalno ima toga jako puno, ali možda sad da ne ulazimo u ono u cijelu dubinu."
0:03:55,0:04:12,"Ali ima jako puno stvari u mom životu koje su specifične, drugačije, od nekakvih onih ratnih situacija gdje sam samo stalno išla kao nekakva izbjeglica živjeti u Njemačkoj, pa sam onda tamo bila, snalazila se, naučila sam se nekako, da se ne vraćam sad u djetinstvo."
0:04:13,0:04:33,"Ali u trenutku života, kad sam zapravo nekako krenula, našla nekog čovjeka s kojim ću nastaviti svoj život dalje, da je to nekakav spas, našla sam nekoga s kojim ću sad živjeti dalje, dobili smo djetet s oškoćama u razvoju i ogroman problem."
0:04:33,0:04:52,"Kad sam mislila, pa sad ću se skraćiti, sad će sve biti dobro, sad je to vrijeme kad je ono super, dogodilo se djetet s oškoćama u razvoju, ti je onda ono, propadneš u rupu od nekog osjećaja super je, propadneš što talno, kako sad, šta dalje."
0:04:52,0:05:05,"Ali evo tako nekako, ne znam, možda i kroz djetinstvo i možda negdje se rodio taj neki osjećaj da u meni je to sada tako, ali ajmo sad dignuti glavu i idemo naprijed."
0:05:06,0:05:25,"Neću dopustiti da mi to sad, još sam tu, još sam živa, idem dalje i tako da bude to teško, ali nekom trenutku je onda dobio šta je osjećaj, tako da sam ja to krenula, idem sad dalje kreirati neki sadržaj, knjige prevodi, evo vidiš nemate literature, ajmo to prevodi, ajmo se baviti nečim, ajmo nešto raditi, ajmo nešto."
0:05:25,0:05:27,napraviti od ovog života dok smo tu.
0:05:28,0:05:37,"Tražiš uvijek neku svrhu, neku svrhu postojanja, neki viši cilj koji te onda vuče."
0:05:38,0:05:48,"Uvijek ideš nešto iznad ovog površnog života, nešto što te vuče, šta možeš napraviti da bude bolje u ovom društvu, zajednici u kojem živiš, šta će biti dobro i tebi."
0:05:48,0:05:54,"To je neka teorija koja je meni uvijek nekako, kad radiš nešto što je dobro za zajednicu, za društvo, bit će dobro i tebi."
0:05:55,0:06:03,"Ne samo ono da bude dobro meni, nek nekako cijeli svijet, nek stane samo neki meni dobro i mome djetetu, to nije dobro."
0:06:03,0:06:06,To je ono neki borbeni život u kojem se samo boriš.
0:06:07,0:06:16,"To je nekako isto površno i nije duboko, nije ni duhovno, nije ni na kojoj razini ok."
0:06:16,0:06:27,"Ali ako radiš nešto što je viši cilj, nešto dobro, nešto, onda te to vuče, ta svrha te uvijek vuče da ti nekako nešto napraviš od svog života i tako sam ja i to tako o tome, uvijek nekako."
0:06:28,0:06:32,"Mislim, ako imaš to u sebi, a ne odazoveš se tome, imamo sve ono propadaš."
0:06:33,0:06:38,"Da, pa da, a propadaš generalno ako Ako ne pronalaziš svrhu."
0:06:40,0:06:50,"Znači, moraš imati u svom životu, da bi živio sretan i ispunjen život, moraš imati nekakav osjećaj neke svrhe života."
0:06:50,0:06:51,Zašto si tu?
0:06:52,0:06:57,"Šta sad tvoj život, ovo ne možeš gladno površinom, meni nije dobro, nek cijeli svijet propadne."
0:06:58,0:07:03,"Ne mora više nikome biti dobro, vidi kako je ovo, vidi kako ovo, meni vidiš, meni je život dao, tako."
0:07:03,0:07:05,"Mislim, svakom čovjeku je život dao nešto."
0:07:06,0:07:11,Svaki čovjek ima neke svoje životne borbe i za svakog od nas to je neke priče.
0:07:11,0:07:12,Niko nema težu.
0:07:12,0:07:15,I svako doživljava tu svoju priču na neki svoj način.
0:07:15,0:07:26,"Ne možemo reći, ajmo, moja priča je takva, ja imam sad pravo da, ne znam, dam sebi opravdanje u životu, da ja imam pravo raditi nešto ili ovako jer ja sam imao težak život jer svi imamo neku priču."
0:07:26,0:07:29,"Bitno je zaista da stanemo i kažemo, ok, to je stvarno život."
0:07:30,0:07:32,On je takav.
0:07:34,0:07:41,"Ja nisam niti onda za te neke pozitivu, tešku, nešto, nešto, sve mora biti super jer ne svije se dogoditi nešto loše."
0:07:42,0:07:44,"Mislim, generalno se strah uvijek događaju neke loše stvari."
0:07:45,0:07:46,Tijeli mi njih vidjeti ili ne?
0:07:47,0:07:47,Tijeli?
0:07:47,0:07:49,Mislim da kako je super.
0:07:49,0:08:14,"Jalom rekao, bol je uvijek tu i šta god da mi napravimo u našem životu, ona će doći u naš život, mi je možemo potiskivati, mi je možemo ignorirati, mi se možemo pravi da se ne događa, ona će pokucati, ako ništa izaće kroz naše tijelo, kroz naše emocije, kroz naš unutarnji, ako ništa ona će uvijek izaći zapravo kroz neki naš unutarnji svijet i uvijek će nas još više, će biti glasnija što je mi manje čujemo."
0:08:14,0:08:44,"Što je prije čujemo, što prije dođemo u kontakt s njom, što prije prihvatimo taj bolni proces nekakvog života, onda će ona biti prihvaćena u našemem životu i neće imati potrebu vrištati iznutra i izlaziti kroz nekakav psihosomatski put, ili kroz neke emocije, ili kroz neki psihološki život, ili kroz zaista zdravlje naše, kroz nekakvu bolest, ili kroz nešto ono što neće tražiti da je se čuje i vidi."
0:08:45,0:08:46,Jer ona je sastavni dio života.
0:08:47,0:08:47,Da.
0:08:47,0:08:53,"A sigurno se drugačije nosiš sa boli sad, nakon ipak jedne životne škole."
0:08:53,0:08:58,"I kako ti je bilo u tim danima, da se vratimo, to je neki ipak veliki zaokret."
0:08:59,0:09:03,"Sigurno je ona Irena prije nego što se je rodilo dijete sa poteškoćama, imali neke planove, neke ideje."
0:09:03,0:09:13,"Baš smo danas na kavi prije snimanja prirodka pričali o tome kako mi uvijek imamo neke planove i onda te život to po mene kao da ti Bog dragi želi reći ono, ok, samo ti planiraj, ali svejedno."
0:09:13,0:09:17,"Svejedno život ide tako, budi svjestan, pa se uvijek nešto može pokrenuti."
0:09:17,0:09:20,"Da su stvari neke pod tvojom kontrolom, neke jednostavno nisu."
0:09:21,0:09:28,"Kako si hedlala tu voliti taj zaokret, tada ipak malo nezrelija u tim godinama kad je."
0:09:28,0:09:37,"Znaš što je sad kad si spomenula Bog, ja mislim da meni u mom životu definitivno, to predlažem, sad ne želim ja reći ono, ja sam sad nešto bolja ili svi smo mi."
0:09:37,0:09:48,"jednako vrijedni, bez obzira na sve, ali meni je pomogao taj dio nekog duhovnog života koji mi je onako dao nekako vjera."
0:09:48,0:09:55,"Znaš, kad vjeruješ u dobro, to je za mene vjera u Boga, kad vjeruješ da će biti sve dobro, kad vjeruješ da."
0:09:57,0:10:00,"Znaš, ta je neka viša svrha."
0:10:00,0:10:04,"Znači, ne možeš biti samo površan, nekako i živjeti, nešto dobre stvari."
0:10:05,0:10:12,"Premda ja sad neću reći onaj ko vjeruje, on je bolji ili onaj ko ne vjeruje, on je gori, to nikad neću reći."
0:10:12,0:10:18,"Svi imamo, ja poznajem jako puno ljudi koji uopće nisu vjernici, koji rade isto tako za višu svrhu jako dobre stvari."
0:10:19,0:10:21,I isto su u istoj kategoriji u mom svijetu.
0:10:22,0:10:38,"Znači, negdje ono kad radiš nešto dobro, meni osobno je pomoglo jako puno vjera u to da, ono vjera u Boga, vjera da nešto više postoji, da postoji neka viša svrha postojanja našeg ovdje, da nešto što i to meni puno pomaže."
0:10:39,0:10:41,I ja se divim ljudima koji nemaju taj dio sebe.
0:10:41,0:10:42,Što ste htjeli reći?
0:10:42,0:10:44,Ja to gledam kao na dar vjere.
0:10:44,0:10:59,"Da, vjera je vel kad se događaju loše stvari u životu, kad imaš taj input u sebi, ne možeš ti jednostavno, ti vjeruješ da će opet sve biti dobro."
0:11:00,0:11:06,"I imaš taj duh tog nečega što vjeruješ da je dobro, to je sad tako, ali bit će sve dobro."
0:11:07,0:11:24,"I vjeruješ da ko si ti zapravo, da ti ne bude, da ti moraš živjeti neki super život koji je iz filma ili romana ili iz Hollywooda, iako to nije da si ljut na ne znam, Boga, na ne znam šta, zato što to je to, ja mislim, ok, živiš život."
0:11:25,0:11:35,"Život kakav je, ono što dobivaš iz nekog razloga je tu u tvojom životu, a ti trebaš s tim što imaš napraviti najbolje."
0:11:36,0:11:39,I nekako prepustiti da je život takav.
0:11:39,0:11:46,"Da on je jednostavno takav, da dolaze u njega i dobre i loše stvari, da sve ima neki svoj razlog, ne možemo ga razumjeti."
0:11:47,0:11:55,"Nekad ga razumijemo, nekad kažemo, evo, meni je to s Mateom, pa evo, to se meni valjda trebalo dogoditi zbog ovoga i zbog onoga."
0:11:55,0:11:59,"I valjda je to meni trebalo u životu, iz nekog razloga mi je trebalo."
0:11:59,0:12:10,"Možda evo, ja to sebi tako objašnjavjavam, meni je to tako zato što je to ta, nekako pokušavamo opet naći neku, opet smisao i svrhu, zašto je meni nekakav problem došao u životu."
0:12:11,0:12:35,"I generalno, gledaj, ja u ovom trenutku sad kad to pričam, mislim, ja prolazim kroz tu situaciju da sam izgubila muža i u kojem sam, kad sam razmišljala, evo sad je sve super, sve odlično i već smo imali te razgovore prije njegove smrti, kako je to sad sve super, kako je sve došlo na svoje, kako je nekako smo se ono izgradili neku priču u životu, sve dogodilo se, to što se dogodilo."
0:12:36,0:12:37,I to je ogromno.
0:12:38,0:12:40,pad i na svim razinama.
0:12:40,0:12:43,Ne može niko reći u tom trenutku da to prihvatiš.
0:12:43,0:12:45,"Evo, hajla, ono sve mi je super."
0:12:46,0:12:48,Nije ono padneš i duhovno i.
0:12:51,0:12:51,To je bilo nedavno.
0:12:52,0:12:54,To je bilo nedavno prije ovo sedam mjeseci.
0:12:55,0:13:04,"A, samo bih htjela, kažem opet možda za nekoga koji nije upoznat s ovom pričom, precizirati Matejinu dijagnozu."
0:13:04,0:13:09,"Znači, ona sedam ima koliko 25 godina, ne čuje, ne govori."
0:13:09,0:13:11,"Ona je gluho njema, ima, znači."
0:13:13,0:13:38,"Težu srčanu grešku, nakon koje je ona imala operaciju gdje je rođena kao zdravo dijete sa teškom srčanom greškom, gdje je morala biti operirana u prvih nekoliko dana života, što je generalno uspjelo, ali je posljedica te operacije bila možda ni udar koji je znači koma, što je ostavilo znatne posljedice na njezin neurološki razvoj."
0:13:38,0:13:48,"Gdje ona, sad ima njezini nekakvi snimci mozga, pokazuju da je tu više cerebralna paraliza, već što."
0:13:49,0:13:59,"da bi to mogla biti nekakva primarna dijagnoza već to je sad to srce koje funkcionira tako kako funkcionira na nekom, kako se kaže za te greške da djeca žive sa pola srca."
0:14:00,0:14:05,"I generalno kažem to u početcima bilo strašno, niko to ne želi, ne želiš to, ne može niko reći da."
0:14:05,0:14:15,"Mi smo u nekim periodima rekli neće to živjeti 7, 8, 9 godina, pa onda jedna operacija ipak produži, pa iduća operacija kažu evo sad ne znam opet dokle živjeti sa."
0:14:16,0:14:19,Pa to te nauči nekakvom živjeti sa neizvjesnošću.
0:14:20,0:14:25,Svako spavanje navečer ti ne znaš što će se sutra tvoje dijete probuditi.
0:14:25,0:14:29,"I naučiš se živjeti s tim, ono jednostavno moraš živjeti."
0:14:29,0:14:36,"Međutim, mi smo tu da živimo i mi smo tu da nekako što god da je, tu smo da živimo ovaj život."
0:14:37,0:14:46,I naučiš tezam iz nekog razloga to ti se dogodi u životu i jednostavno naučiš da živiš da nije pod tvojom kontrolom.
0:14:47,0:14:51,Ali opet mi uvijek imamo neki plan i neku preduođbu kako će to izgledati.
0:14:51,0:15:06,"Znači, mi uvijek imamo neku preduođbu jer ono kao očekujemo, dijete je bolesno, nikomu ne daje dan života, a sada je već dvadeset pet godina i kad god odemo doktoru bilo šta, najmanja upala bilo čega, koju već vide svi da je gotovo."
0:15:07,0:15:09,Već nam daju nekakva saučeša.
0:15:11,0:15:19,"Žele su neke tu, ljudi su puni, neke su čuti prema nama čim vide da je ona tu gdje je."
0:15:20,0:15:26,"Kroz najmanjih upala nečega, da ne kažem preživljavanje velikih upala pluća, što ja znam."
0:15:26,0:15:31,Tako da živimo s tim da je to nekakav oboje.
0:15:31,0:15:36,"Živimo dosta dugo godina s tim, nitko ne očekuje, recimo ja sam više osoba koja."
0:15:36,0:15:39,"koja daje im sebi puno više zadataka, puno nekakvih."
0:15:40,0:16:01,"Ja sam ta koja kreira neke priče, škole, supruge, on je podrška, ali on ima jedan svoj posao koji radi i on nije za te neke velike, jel da izlaže se nekom velikom stresu, jer negdje sam ta ja koja živi jedan veliki stres i on je uvijek bilo ona kao strah njegova da se nešto ne dogodi materiji i meni."
0:16:02,0:16:05,"Uvijek je ona kao, nemoj sebi to raditi, ma šta će ti?"
0:16:05,0:16:07,"Evo više dan, nemoj to sebi raditi."
0:16:07,0:16:07,Ubičete stres.
0:16:08,0:16:12,"Ubičete stres koji živi, što će ti taj stres, što ti to treba u životu?"
0:16:12,0:16:28,"I tako nekako da nikad nije bila opcija da bi se njemu, čovjeku koji ne pije, ne puši, živi zdravo, koji je super samoreguliran, koji je najkul čovjek kojeg ikad poznajem, koji od svega zna napraviti kumor šalu, sezanciju, da bi se njemu nešto moglo dogoditi."
0:16:28,0:16:30,Ali evo ipak se njemu dogodilo na kraju.
0:16:31,0:16:32,Nešto strašno.
0:16:32,0:16:36,"I onda to sad svačaš, zapravo sad prelazi život iz jednog."
0:16:37,0:16:39,Moja djeca imaju običaj reći prešli smo igricu.
0:16:41,0:16:42,To mi se super sviđa.
0:16:42,0:16:43,Sad prešli smo neku drugu igricu.
0:16:44,0:16:44,Prešli smo igricu.
0:16:45,0:16:45,Sad više mi uopće.
0:16:46,0:16:46,Čega se uopće bojati?
0:16:47,0:16:48,Više se ne bojim ničega.
0:16:49,0:16:52,"Nije mi sve jedno, ne mogu reći osim sebe je sve jedno."
0:16:53,0:16:58,"Idemo dalje, ali se ne bojim ničega jer nemam pojma šta će se sutra dogoditi."
0:16:59,0:17:02,"I ne smijem, znači ono strah neće biti moj voditelj."
0:17:03,0:17:05,Jednostavno ne želim da.
0:17:05,0:17:09,"Mislim, ima situacija koja taj strah ispliva iz mene, ne mogu ja reći."
0:17:09,0:17:18,"Bilo je situacija sa svojom djecom, sa sinovima i da ne javim i se na telefon, to ja prije nikad nisam radila, ja sam već."
0:17:19,0:17:24,"Gdje se javim, molim te, ono već počinjem razmišljati jer sad znam, sad znam."
0:17:24,0:17:37,"Znam koliko je život nesiguran, koliko je tanak i koliko smo mi tu zapravo sa nekim borbama, s nekim ljutnjama, pravdama, nečim."
0:17:38,0:17:39,Toliko smo tu prolazni.
0:17:40,0:17:44,"I ja bih rekla i ono, ne znam zašto mi pada riječ nebitni."
0:17:46,0:17:47,Ne možemo biti nekad prebitni.
0:17:48,0:17:50,"Ili prebitni, ali dajmo sebi da smo prebitni."
0:17:50,0:17:52,Da moram ja nešto napraviti.
0:17:52,0:17:55,"Jer sad ću ja tebi reći kako ćeš, šta ćeš, tko se i šta."
0:17:56,0:18:01,"Ali mislim da, generalno putujemo svi prema tome."
0:18:01,0:18:01,Svi prema tom nekom putu.
0:18:02,0:18:19,"Evo nedavno kad je u Zagrebu bilo ovo nasilje u Prečkom, u osnovnoj školi, ja doslovno sam samo nazvala prijatelja koji je psiholog u vrtiću, isto u Prečkom, isto je bio u podkastu, ja sam onom, Matej, daj recimo, utješime, utješime doslovno."
0:18:19,0:18:20,Šta da ja sad razmišljam?
0:18:20,0:18:25,"Ja bi najradije otišla po djecu u vrtiću, zaključala nas u stan i šta da radim?"
0:18:26,0:18:33,"On je samo rekao, ovo je samo opomena koliko je život prolazan i da ne vrijedi s nekim ni dana biti u nekoj svađi."
0:18:33,0:18:34,"Da, evo zašto."
0:18:35,0:18:35,Bašto.
0:18:36,0:18:40,Da ne vrijedi pozdraviti se ujutro s djecom na neki loš ton.
0:18:41,0:18:41,Da.
0:18:42,0:19:01,"I ne vrijedi očekivati od te svoje djece neke priče da ih ono forsiraš u životu, da im ono neki prostor da se osjećaju sigurno, da im neki prostor da se osjećaju voljeno, da im neki, da im taj cijeli nekakav pritisak život je tako prolazan."
0:19:01,0:19:05,I nemaš pojma šta se sutra događa i stvarno moraš živjeti s tim.
0:19:07,0:19:10,"Mi nismo inače, nas je promjena i kontrola."
0:19:11,0:19:22,"Mi želimo kontrolirati svoj život., kontrolirati život svoje djece, imati osjećaj da smo mi tu nekakav važan faktor."
0:19:24,0:19:38,"Ali, generalno, ti jesi važan faktor i ti možeš neke stvari kontrolirati, ali, ne želiš li sebi dajati neke važnosti božje uloge, kako bi rekla?"
0:19:38,0:19:47,"Da si sad tu nekakav, živiš što tvoje jesi, dosta je važno da imaš nekakav taj osjećaj i moći."
0:19:48,0:19:53,Balans između moći i poniznosti je velika srna.
0:19:53,0:19:58,"Znači, to je jedna poniznost, ali ne ona poniznost u smislu kako su nas učili."
0:19:58,0:20:10,"Ona poniznost kad se ti pokoravaš, jedna dostojanstvena poniznost života, gdje vidiš i cijeniš život svakog čovjeka, svake biljke, svake život."
0:20:11,0:20:20,"Ovdje nismo samo mi, ovdje je jedan cijeli ciklus kojega mi zanemarujemo, gdje mi toliko grabimo sebi, daj da meni bude dobro."
0:20:20,0:20:22,"I sve da je savršeno, pa pjesmo."
0:20:22,0:20:25,"Da, i sve ima nešto što je kako."
0:20:25,0:20:29,"to društvo očekuje, stvorili smo vrijednosti tu u sebi."
0:20:29,0:20:33,"Ja bih rekla nikad nismo živjeli u boljem vremenu, to barem ja u 74."
0:20:33,0:20:55,"godište gledajući koliko je to sad dobro, ali nikad u tužnijem, nikada toliko se otužno svi nekako žive da se samo nešto prigrabe od nekakvoga, ne znam, nekako nema tog, empatija nije uopće tema više, izgubilo se zašto bi bio uopće empatičan, kome to vrijedi danas?"
0:20:56,0:21:01,"Mislim, vrijedi, užasno vrijedi, užasno puno vrijedi zato što vrijedi tebi u tvojem osjećaju života."
0:21:02,0:21:07,"Jer više ćeš razumjeti život ako si prema ovoj biljci ovdje empatičan, a da ne kažem prema ljudima."
0:21:07,0:21:08,Namjerno govorim.
0:21:09,0:21:22,"Znači ako ti razumiješ da ona isto treba, razumiješ njezin proces rasta i iako je zaljevaš, iako se brineš, ti sebi, ti si u ovom svijetu imaš svrhu."
0:21:22,0:21:27,"Empatija je sve, osjećaš ljude oko sebe, doživljavaš, no mi smo svi skloni nekako tom."
0:21:27,0:21:36,"Evo neki dan su bili neki Oskari ili Gremis ili nešto, jedna glumica je uzela tu nagradu i nisam slušala, ali sam kasnije vidjela neke naslove da je rekla."
0:21:38,0:21:42,sebičnost znak samostvarenja.
0:21:43,0:21:44,Meni je to tako tužno bilo.
0:21:45,0:21:49,I danas kao da je najveći strah da će ti netko oduzet malo komfora.
0:21:50,0:22:13,"I tako mi je ono i lijepo i mislim, sada bi bilo krivo reći da razumijem, ne razumijem te, ali kad vidim da ti na svoju kćer koja zaista društvo bi ju okarakteriziralo kao smetnju, da je ona tebi oplemenila život, zapravo odredila pravac u kojem ćeš se kasnije ti razvijati."
0:22:13,0:22:15,"Da, niko nije smetnja."
0:22:15,0:22:18,Smetnja smo samo mi koji imamo osjećaj da smo nešto važniji od drugih.
0:22:19,0:22:21,Nisam to gledala jer ne pratim ja to previše.
0:22:22,0:22:29,"Ja imam neke stvari, ne pratim uopće taj neki svijet kako bih rekla."
0:22:30,0:22:49,"I nemam pojma koja je šta rekao, ali generavno gledano, taj osjećaj koji nosimo svi, opet sam rekla, svi imamo neku svoju priču, taj osjećaj koji nosimo neviđenosti unutar nas tijekom našeg djetinstva gdje nismo imali taj."
0:22:49,0:22:57,"nekakav prostor gdje bismo se niti emocionalno, niti duhovno, ispravno nekako razvijali."
0:22:58,0:23:02,Gdje je tu bilo baš tako nekako disfunkcionalni odnose.
0:23:02,0:23:04,Sve to skupa nas je stvorilo u borbenost.
0:23:04,0:23:11,"Zato ti se čini da ti je sebičnost važna i da nešto gazi preko svih, posebno taj američki svijet."
0:23:12,0:23:14,"Znači, ja ne bih voljela da taj svijet dođe kod nas."
0:23:15,0:23:23,"Ja bih voljela da se mi vratimo, više bih voljela da se vratimo u onaj ex-juga svijet, već u američki."
0:23:23,0:23:25,"Pa kažem, ako je ono kao hvala Bogu."
0:23:25,0:23:26,da kaskamo za Amerikom.
0:23:26,0:23:27,Pa bar vidimo što nas čeka.
0:23:27,0:23:29,Pa možda nekad možemo malo poduzeti neke korake.
0:23:30,0:23:34,"Jer u svom svijetu smo bili ono, susjedi su sa susjedima pričali, kuhali kave."
0:23:34,0:23:41,"Moja mama je metlom zvala gore susjedu na kavu, pa su se zajedno družile, pa smo svi bili nekako tu bitni."
0:23:42,0:23:49,"Nekako mi se to više sviđa što smo imali naše tri hajne u robnoj kući koje smo mi, curice, mogli odabrati koje ćemo nositi."
0:23:49,0:23:50,Svi smo bili u nekim tim.
0:23:52,0:23:56,Vjerujem mi da mi to u nekom trenutku djeluje od ovoga gazi sve.
0:23:57,0:24:00,Samo da dođeš do svoje nekakve.
0:24:00,0:24:02,Ali takvu poruku šalju mladima.
0:24:02,0:24:02,Da.
0:24:02,0:24:06,Nisu oni jadni nekad krivi što misle da je to nabrijavanje gazita.
0:24:06,0:24:07,"Da, gazita."
0:24:07,0:24:10,"Nema nikakvih, ono ja gledam u tom biznis svijetu."
0:24:11,0:24:15,"Kad imaš posla s amerikancima, znaš koja je to razlika?"
0:24:16,0:24:21,"Kako tu ono, ono, znaš što sad ne zavode, ako me budu slušali?"
0:24:22,0:24:24,Neće trebamo titlove bez brige.
0:24:25,0:24:27,Ali stvarno je taj jedan svijet okrutan.
0:24:27,0:24:32,"Vrlo da oni da bi uspjeli su morali pregaziti puno toga, držo nekakvog."
0:24:32,0:24:33,I to nije put.
0:24:33,0:24:36,"Ja ne mogu, ne znam, ne, nemam u svojoj."
0:24:36,0:24:39,"Ja opet u mom malom svijetu, tko sam ja, nebitna."
0:24:39,0:24:45,A nemam osjećaj da netko ko dođe tim putem da može biti ispunjen.
0:24:46,0:24:48,Znači čak i sretan mi je površno.
0:24:49,0:25:03,"Znači sretan mi je nekakav kategorija trenutka, ispunjen, svrhovit, život, empatičan, nekakav viši nivo življenja i postojanja."
0:25:03,0:25:06,Da prodavaju one isto naslove za klikanje.
0:25:07,0:25:15,"Istraživanja pokazuju da su ljudi bez djece sretniji,iji, sretniji, sretniji."
0:25:15,0:25:19,"Ja se mislim, pa možda i jesu, ali jesu li ispunjeni?"
0:25:19,0:25:22,Je li njihov život ima više smisla ili manje?
0:25:23,0:25:24,Gdje je tu svrha?
0:25:24,0:25:25,"Oke, su sretniji."
0:25:25,0:25:31,"Oke, pa ja vjerujem da je netko sretniji od mene ujutro jer se naspavao, a mene djeca bude po cijelu noć."
0:25:31,0:25:34,"Ja vjerujem da je sretniji, ali ja ne idem za tom srećom."
0:25:34,0:25:48,"Ali danas je to sve prodaje kao sretni će biti ako i onda ljudi umanjuju ovo nešto drugo što nosi sa sobom i žrtvu i nekad i bol, ali ima više smisla, više svrhe na kraju."
0:25:48,0:25:55,"Pa znaš šta, ja bi ti bi ti tu rekla da generalno je to sve isto nekakvo individualno pitanje."
0:25:55,0:26:02,"Ne treba meni niko ništa, ja znam svoj put, moj put je bio takav, ja sam htjela imati djecu."
0:26:02,0:26:06,Nego stvarno je možda sretniji i nema taj uopće.
0:26:06,0:26:11,"Znači, ne možemo opoređivati nekakve živote jer nemamo pojma."
