Start (HH:MM:SS),End (HH:MM:SS),Segment
1:15:33,1:15:39,"Moja osobna priča, zapravo sjetila sam se jedne od svojih sestara, neću se sad baviti menjima."
1:15:40,1:15:43,"Odlična učenica, sve, sve, sve, sve, sve."
1:15:43,1:15:44,Ali voli i glazbu.
1:15:45,1:15:47,"Završila je i ona, i glazbenu i srednju glazbenu i sve."
1:15:47,1:15:55,"Ali, ma dobro, pa ne živi se od glazbe, upiše nešto, znaš, upiše neki konkretan fakultet i ona upiše najkonkretniji fakultet od svih."
1:15:57,1:16:02,"Težak, super, sve je mama i tata ponosni, dobro i nju crveno je kopka, et ta glazba, glazba."
1:16:03,1:16:09,"I ono krene tonuti malo na toj prvoj godini, kao dobro nije to, to odrekla se ipak malo te glazbe."
1:16:10,1:16:17,"I onda je u jednom trenutku saznala za tu jednu akademiju, nešto, neki malo kraći program i upiše ona to."
1:16:18,1:16:25,"I taj procvat, taj procvat te osobe, mi smo svi to danima komentirali."
1:16:25,1:16:26,Svi nju vidjeli?
1:16:26,1:16:31,Svi nju vidjeli koliko je ona procvala samo zato što par puta tjedno ili ne znam koliko.
1:16:32,1:16:35,ide na to nešto što njoj daje to neko ispunjenje.
1:16:36,1:16:38,To je toliko predivno za osvjedočiti bio.
1:16:38,1:16:39,"Da, da."
1:16:39,1:16:54,"Tako da, a mi često, to sam vidjela, neko je napisao na Instagramu što mi radimo kad nam dijete ima pet iz ne znam engleskog, a dva iz matematike."
1:16:54,1:16:57,"Engleski zanemarimo, ide na instrukcije za ovo što ima."
1:16:57,1:16:59,"Evo, to je cijela poanta prioriteta."
1:16:59,1:17:02,"Da nećuš forcamo, ali da potičemo to što ima."
1:17:02,1:17:03,tražiti.
1:17:03,1:17:04,"Ne, ne, očito ne."
1:17:04,1:17:05,"Znači, idemo to."
1:17:06,1:17:09,"Zato što Rini je ti pitaj, kako ti to dobro ide?"
1:17:09,1:17:11,Zato nekad i ova darovita djeca pate.
1:17:11,1:17:12,Kako ne?
1:17:12,1:17:17,Jer se usredotočujemo na ove slabije i onda njih vuče.
1:17:17,1:17:19,"Oni su već došli, oni ne mogu sami sebe držati."
1:17:19,1:17:20,"Da, da."
1:17:20,1:17:21,Njima treba ista sadržaja.
1:17:22,1:17:33,"Uvijek u školi imamo program na tri stupnja, gdje onda dajemo uvijek svakom razredu, čak i iduće godine razmišljamo po IB-u."
1:17:33,1:17:46,"Like bio je to da bismo trebali kombinirati, znači da djeca bez obzira na razrede, to je negdje idemo prema tome, da djeca idu na matematiku razvojno gdje jesu."
1:17:46,1:17:50,"Znači da svaki učitelj ima svoju grupu razvojno, ne po razredu."
1:17:51,1:18:01,"Ovi su tu na stupnju, ovi su tu, a ovi koji su i to ćemo vjerojatno implementirati, gdje ćemo ih onda samo iz razreda prebacivati kod nastavnika gdje on može raditi ono gdje on je."
1:18:01,1:18:05,"I da se osjeća dobro u matematici, da je grupa s djecom koja su tu gdje on je."
1:18:07,1:18:12,"Jer generalno skupi darovito dijete, dijetu koji na matematici u istu grupu ne pripadaju."
1:18:12,1:18:16,"Kad je u pitanju matematika, kad je u pitanju nešto drugo, pripadaju, jel tako?"
1:18:17,1:18:22,"To nekako, je li to tako logično zapravo, ali da, to je jedino logično."
1:18:24,1:18:36,"To je jedino logično kad je u pitanju učenje i kad je u pitanju učenje u biti sa nekakvog emocionalnog, iz nekakvog aspekta dubljeg gdje ti osjećaj pripadnosti je važan za razvoj.."
1:18:37,1:18:43,"Da bi mogao rasti, moraš imati ljude koji su s tobom u tvom svijetu."
1:18:44,1:18:54,"Čak neću reći ni na tvojoj razini, ali da, moraš imati ljude svoje razine da koji tebe razumiju, koje ti razumiješ da bi sve što se događa u svijetu uvijek."
1:18:55,1:19:10,"Imaš istraživanje o psihoterapiji kod ljudi koji su, mislim, teško je pobijediti alkoholizam, to svi znamo, ali imaš ljude koji su se nekako iščupali iz toga i onda je bilo pitanje njima u engleskoj jedno istraživanje kao šta vam je najviše pomoglo."
1:19:11,1:19:24,"Da, i onda su to, sad bi trebalo biti psihoterapeuti, psihoterapija, svi su rekli pomogli su mi ljudi koji su isto tako, grupo ljudi je rekli, ali velika većina, znači njih je rekla pomogli su mi ljudi koji su isto proživjeli kao i ja."
1:19:24,1:19:35,"Znači našli su svoju neku zajednicu, neke ljude koji isto su proživjeli, koji ih osjećaju i doživljavaju, zajedno smo se iscijelili."
1:19:35,1:19:37,"To je taj osjećaj zajednice, pripadnosti."
1:19:38,1:19:40,koji ti je potreban da bi išao dalje.
1:19:41,1:19:46,"Kad ti si u zajednici u kojoj se ne osjećaš da pripadaš, ne možeš ići dalje."
1:19:46,1:19:49,"Ne, ti tu stagniraš, ti se tu osjećaš loše."
1:19:49,1:19:54,"Kad ti nađeš, evo ide na glazbu, nađeš svoje ljude gdje radimo zajedno ono što volimo."
1:19:56,1:19:58,"I to, tu cvateš, tu rasteš."
1:20:00,1:20:01,"Da, evo, primit ćemo se kraju."
1:20:03,1:20:07,"Htjel bih te pitati sad za tvoje, uopće ne želim reći, planove."
1:20:08,1:20:11,"Tvoja, tvoja, tvoj neki pogled, i sad na."
1:20:12,1:20:16,"Ja moram reći, o meni baš me jako potreslo kad je suprug preminuo."
1:20:16,1:20:22,"Jer kao što si ti meni prije rekla, da te podsjećam na sebe u nekim početcima s tim borbama."
1:20:22,1:20:25,"I to tako sam jana vazljala, znači, tako ćemo mi."
1:20:25,1:20:28,"To je taj power couple i ono isto, sve skupa, sve, sve."
1:20:29,1:20:39,"I onda, isto kad to ne ide u tom smjeru kako ti misliš da će ići, baš me to jako potreslo i vjerojatno do nedavno su te predstavljali."
1:20:40,1:20:46,"supruga, majka, to je bila jedna tvoja uloga u kojoj jesi i sad se nedavno to promijenilo."
1:20:48,1:20:50,Kako se ti sad nalaziš u toj novoj ulozi?
1:20:50,1:20:52,Pa možeš ti to moći reći za pet godina.
1:20:54,1:20:56,Ja sam još uvijek u procesu.
1:20:57,1:21:00,Za pet godina ću ti možda znati reći ako budem živa.
1:21:01,1:21:03,Ako ne odem i ja sa ovog svijeta.
1:21:04,1:21:08,"Što generalno je sve, nema pojma kako šta funkcionira."
1:21:08,1:21:10,Jer još je to uvijek jedan proces.
1:21:13,1:21:17,"Da je sve postalo drugačije, moj pogled na svijet apsolutno je."
1:21:18,1:21:22,"Je li on negativan ili pozitivan, to ti da ne mogu reći jer nije ni jedno ni drugo."
1:21:23,1:21:40,"A da prelazi moja uopće pojivanja, prelazi i da ne znam, kažem sad u ovom trenutku živim, tu sam iz dana, svakog dana u dan."
1:21:42,1:21:49,"Planiram, ali imam planove, ali nemam nikakva previše sad očekivanja."
1:21:49,1:21:58,"Spremna sam i svjesna sam da možda nešto uopće više nemam, ne znam ono, uopće ne znam objasniti kako je to sad."
1:21:59,1:22:01,Sad u ovom trenutku sam ja još uvijek u tom procesu.
1:22:02,1:22:12,"Znači, još uvijek je to nekakva, ne znam, negdje ono živiš, ne razmišljaš, pa se onda sjetiš, pa onda."
1:22:12,1:22:18,"Pa onda ti treba dah, pa onda se sjetiš ono i taj spoznaja šta je život i kakav je."
1:22:19,1:22:21,Razmišljaš jako o smrti.
1:22:22,1:22:26,"Počinje, nikad prije nisam razmišljala, recimo, kao smrt, kao pojam nije postojala."
1:22:27,1:22:31,"Uopće nisam taj, sad počinjem, evo, valjda su to te 50."
1:22:31,1:22:34,razmišljati o tome je li 50 nije godina.
1:22:35,1:22:43,"Ono, ovo je sad nije, prošle godine, samo mjesec van, nakon toga sam napunila 50 i tu sam imala planove kakav će ti biti rođen dan 50 i pa smo se zajedno."
1:22:44,1:22:48,"planirali kako će to izgledati, pa na kraju bilo je tako kako je."
1:22:49,1:23:07,"Tako da puno razmišljam o tom dijelu nas na ovom planetu, toj smrti koja nas sve čeka, i nekako isto razmišljam da ovo ne može biti sve."
1:23:08,1:23:14,"Da sigurno ovaj naš put kroz ovo tijelo, da ne može biti sve."
1:23:15,1:23:16,Bilo bi preabsurdno da je sve.
1:23:17,1:23:42,"Znači, tako sam to nekako još više i dublje razine doživjela da, evo, ne može biti to sve, to je nekakav, jer tu smo, gdje smo, ne znamo, nikad nećemo dobiti odgovore na ova pitanja, neka i ono trebamo na neki način živjeti s tim i, evo, kažem, pronaći svrhovitost u najvećim bolima."
1:23:43,1:23:45,I to je dobar osjećaj.
1:23:45,1:23:51,"Bez obzira kako bi ti rekla, kad ti pronađeš neki, taj duhovni život je opet ti dan neki."
1:23:52,1:24:04,"Imaš dane u kojima si jako tužan i u kojima sebi dopustiš tužan i dopustiš sebi da se isplačeš i to moraš i preživjeti tu bol, doći u kontakt s njom i biti slab i plakat."
1:24:04,1:24:16,"Imaš isto dane kada ono, ne znam, upalim neku glazbu, vozim auto i kažem ono, hvala ti bože, tu sam, evo, dok sam tu, tu sam, šta mogu napraviti sad da to bude, ne znam."
1:24:16,1:24:37,"Ne znam, još više gledam tu svoju obitelj, još više gledam nekako, još dublje gledam na ljude, još više gledam kao ljude kad vidim neke ljude koji ne znamo, tako žao mi je da ljudi nekako pate u smislu zbog nečega zbog čega ne bismo stvarno trebali patiti."
1:24:38,1:24:41,"On trebamo sebi nekako dopustiti da dok smo tu, taj put je stvarno."
1:24:42,1:24:47,"Moja mama bi rekla, ono zapravo moja baka, pa poslije moj mama dok je bila starija, kao je moj život."
1:24:47,1:24:49,je kao da jedna vrata uđeš na druga izađeš.
1:24:49,1:24:53,"Sve što više godina idu, ti stvarno to vidiš da je to tako brzo prošlo sve."
1:24:53,1:24:57,"Svi ti 50 godina svega toga je prošlo, nemam pojma koliko me još čeka."
1:24:58,1:25:09,"I u nekom tom trenutku, ajde ono diši tu danas, ispunio ovaj dan, ispunio ovaj dan da budeš dobro, da bude dobro tebi i da bude ljudima oko tebe dobro."
1:25:09,1:25:16,"Nemaš ništa od toga, od nekih kukljavina, upadanja u neke loše stvari, kritiziranja."
1:25:18,1:25:25,"ponižavanja drugih ili nešto, bilo čega, tako bez veze gubiš život."
1:25:26,1:25:43,"Ajde, napravi nešto, objavi neku novu knjigu, napravi nešto šta je dobro i bit će ti dobro i tebi i drugima oko tebe, i tako stalno taj lanac nek bude dobro i drugima i meni, bit će dobro i ovom svijetu, i tako na neki način tu je dobar osjećaj."
1:25:43,1:25:46,"Da, bitno je kreirati dobre osjećaje svaki dan."
1:25:46,1:25:49,Mislim da je to zapravo u ime možda.
1:25:49,1:25:53,"Možda neko kako nas sluša i trenutno, možda može se poistovjetiti s tobom."
1:25:53,1:25:58,"Ja vjerujem da će puno značiti, baš biti dobra riječ podrška."
1:25:58,1:26:04,"Ja neću nikad zaboraviti tvoj story nakon te vijesti koja je bilo nijedkud, pa i onda googlam."
1:26:04,1:26:05,Je li čovjek bio bolestan?
1:26:06,1:26:06,Što je bilo?
1:26:07,1:26:08,Ja se mislim onako.
1:26:09,1:26:13,"Ne, ma sad će Irena vjerojatno gasiti Instagram i gotovo."
1:26:14,1:26:15,Što mi nikad nije palo na pamet?
1:26:15,1:26:20,"I za dva dana, tri, ne znam sad, Buba, želim krivo reći, ti se javljaš na story."
1:26:20,1:26:24,"Na storiji, ona ko vidi se u boli, potresena i govoriš: ljudi, bit ću ja dobro."
1:26:24,1:26:26,Ja to ne mogu zaboraviti.
1:26:26,1:26:27,Sad će se i ja rasplakati.
1:26:27,1:26:28,Zašto je meni to čudno?
1:26:29,1:26:30,"Nemam pojma, sad se ne mogu uopće sjetiti."
1:26:30,1:26:32,To je bilo toliko intenzivno razdoblje.
1:26:33,1:26:34,Zašto sam se ja tad uopće javila?
1:26:35,1:26:36,Ali puno ljudi mi je pisalo.
1:26:37,1:26:43,"I puno ljudi je upravo ta imalo, kako bi ti rekla ono, Irena, ne možeš te uvjeriti, da tu smo uz tebe."
1:26:44,1:26:51,"Než, u tom trenutku, u tom trenutku, ja sam shvatila da koliko smo."
1:26:51,1:26:55,"Koliko se muti, tek tad, rezervom je mužu umrli da ja shvatim da sam ja utjecala na ljude."
1:26:56,1:26:56,Pozitivno.
1:26:57,1:27:05,"I onda pisma ljudi u tom periodu su bila, više ove ja i sad isto imam suze, ali to su nekakav osjećaj koji je tako dobar."
1:27:06,1:27:14,"Ovo su suze nisu iz boli, već jako dobrog osjećaja gdje meni ljudi pišu pisma šta sam ja njima učinila u njihovom životu."
1:27:15,1:27:22,"Mame djece s teškoćama u razvoju koje su pokrenule neke biznise, žene koje su zlostavljane."
1:27:22,1:27:26,"Znači, ja sad dobivam masu vaših odgovora."
1:27:27,1:27:33,"Nemoj prestat, ti si nama promijenila život, ti si, ono, mislim se, je ovo moguće?"
1:27:33,1:27:40,"Je li ovo moguće da je samo jedna osoba, ali to je masa ljudi koji meni sad piše preko Instagrama, pa i na Facebooku."
1:27:41,1:27:46,"Kako ti još rekla, treba će mi zbog alergije, ja mislim da ovako neće mi trebati zbog maramice."
1:27:47,1:27:49,"I ja u tom trenutku, ono, razmišljam se, baš šta je ovo?"
1:27:50,1:27:53,"Ono, sad meni je ta moja zajednica koja je ljudi."
1:27:53,1:27:56,"Koja su ljudi gdje ja pišem, govorim nešto, ali ja nemam sad dojam da sam nikoga nešto."
1:27:57,1:28:02,"Ja samo imam potrebu da to pišem, kažem, da se te knjige dođu do više ljudi."
1:28:02,1:28:06,"Sada, meni je ta povratna informacija iz tog osjećaja."
1:28:06,1:28:09,"Ja sam uzela opalila video i rekla: Ljudi, bit ću dobro, bit će sve dobro."
1:28:10,1:28:12,Dobro sam i sve će biti dobro.
1:28:12,1:28:35,"Jer stvarno sam, bez obzira što tad ti poto ne cijeli život, cijeli svijet, on kreneš oko sebe i vidiš da imaš djecu, imaš ljude još i baš svoje obitelji, imaš, ti moraš živjeti sada dalje, ti imaš samo dva izbora, živjeti ili umrijeti u tim danima, u takvim trenucima."
1:28:35,1:28:50,"A pri tome umrijeti znači i ugasiti Instagram i povući se, oka ne mora biti, netko će ugasiti, netko će tugovati, moraš proći tu tugu, ali umrijeti, biti tu i biti mrtav duhom, to isto znači umrijeti."
1:28:51,1:28:55,"Znači, ti imaš ljude koji danas žive, a umiru."
1:28:56,1:29:08,"Odavanje alkoholizmu, odavanje da štetiš svome emocionalnom, duhovnom i fizičkom zdravlju, isto znači umirati, samo na rate."
1:29:09,1:29:10,Ti isto ne živiš.
1:29:10,1:29:18,"Ako si ti ovisnik od bilo čega, kockice, alkohola, bilo kojih nekakvih stvari koje štete tebi i tvojoj obitelji, ti umireš."
1:29:18,1:29:20,"Ti ne živiš iz zabloda da živiš, to nije život."
1:29:20,1:29:26,"Znači, samo imaš izbor ili ćeš živjeti ili ćeš umrijeti."
1:29:26,1:29:28,I odluči se šta ćeš.
1:29:29,1:29:32,"I definitivno, kadaš."
1:29:33,1:29:46,"Ja imam djecu koja u tom trenutku gube oca koji je bio vrhunski otac, koji je bio čovjek koji stvarno je bila njihova velika snaga."
1:29:47,1:30:00,"Ja ne mogu sad u ovom trenutku biti toliko sebična i ubit samu sebe i ostaviti ih tako, bez obzira što su mi svi veliki, ali svejedno mi svi trebamo nekoga drugoga."
1:30:00,1:30:04,"U tom trenutku samo razmišljaš ono, ne mogu umirati, neću umirati."
1:30:06,1:30:06,Još više.
1:30:07,1:30:35,"Sad totalno imam još jedan drugi level, još više gledam da moj život bude zdrav, da spavam redovitije, da posao drugačije gledam, da više sad toliko ono da baš gledam na svoje zdravlje kako bi mogla i najveća stvar u ovome možda, možda kad je moj stariji, ti više navrata mi je rekao, pa i mlađi, ali ovaj stariji je onako nekako ni puno ili još veći, izreliji i sve."
1:30:35,1:30:40,"Govorim mama, ti nemas pojma koliko ti me inspiriraš."
1:30:40,1:30:42,Mislim da je to najveći level koji čovjek može.
1:30:42,1:30:58,"Još veći je ovo kad te ljudi, kad ti tvoji rijete kaže, jedan toliko, njima je toliko teško u tom svemu, oni tako osjećaju, momak i to je stvarno odjedanput je samo izgubio je ono, otac je bio stvarno njihovo ono i onda je to drugo ti kao toliko kad vidim tebe."
1:30:59,1:31:00,Kako se ti boriš?
1:31:00,1:31:01,"Tižeš, sidiše na trening."
1:31:02,1:31:03,Ja ne mogu na trening.
1:31:04,1:31:05,Treba mi sad vremena da.
1:31:06,1:31:12,"Ali, mlađi sin, oni se već, oni se isto vrže, nekako isčupani, isto krenuo i vježba izra, i ovo sve nešto."
1:31:15,1:31:19,Ja sam stao i zato što je stariji osjetio to da je on taj muškarac.
1:31:20,1:31:24,"Ja sam rekao, ne moraš ti biti i nemoj slučajno pokušavati zamijeniti."
1:31:27,1:31:31,"Ti ne trebaš spasiti mene, ja ću spasiti sebe., ti gledaš sebe."
1:31:31,1:31:33,On počeo mama kako da on meni pomogne.
1:31:34,1:31:37,"To je velika zabluda nas, majke, koji upadnemo da nam djeca spašavaju."
1:31:38,1:31:40,"Jer smo mi, ne ja ću sebe sama spasiti iz ovoga."
1:31:41,1:31:47,"On govori kako taj tvoj osjećaj to koliko me inspirira, koliko mi to daje čovječe jesi ono."
1:31:47,1:31:52,"Ta borba odjedanput, ono bilo je pa onda odjedanput, idemo živjeti."
1:31:52,1:31:58,"Jer samo tako, i kaže, možemo odabrati da umremo, ali možemo odabrati da živimo."
1:31:58,1:32:07,"Ali kad god smo u tom lošem stanju, odajemo se kocki, odajemo se nekom lošem životu koji nema nekog duha, mi umiremo."
1:32:08,1:32:12,Mi samo živimo u tom dobrom duhu.
1:32:13,1:32:22,To je život ovdje dok smo povezani u našem svijetu sa Bogom.
1:32:23,1:32:27,"Ljudi koji ne vjeruju u Boga, povezani sa moralnim vrijednostima, isto je to Bog."
1:32:28,1:32:30,"Ljubav, etika."
1:32:32,1:32:34,"dostojanstvo, sve je to isto Bog."
1:32:35,1:32:39,"Ne moraš reći da možeš reći ne vjerujem, ali ako to živiš, istoj si energiji."
1:32:40,1:32:45,"Možeš reći ne postoji Bog, ali ti ako to živiš te vrijednosti, to je to."
1:32:45,1:32:46,To je zapravo Bog.
1:32:47,1:32:54,"U tom nekakvom nastojanju, opet da ne budemo sada, da ne pretjerujem, da ne savijam sebe o nastojanju da živiš takav život, je život."
1:32:56,1:33:01,Ovo sve drugo je za u mom svijetu put ka umiranju.
1:33:03,1:33:05,"Ili ostavljaš neki, zašto si?"
1:33:05,1:33:08,"Znaš, ako ti ješ nekim putem, zašto smo bili tu?"
1:33:09,1:33:19,"Ako nećemo ostaviti neki trag, iskoristi priliku da ostaviš neki trag, da ostane neki dio tebe na ovom planetu, da nešto napraviš."
1:33:20,1:33:22,"Šta sam sad, ako sam samo tu bio i ne znam?"
1:33:23,1:33:24,U okruženju koje možeš.
1:33:24,1:33:26,"Da, mora to biti sad."
1:33:26,1:33:35,"U tvojoj obitelji, u svojoj zajednici, u bilo čemu, nećemo, ne mora to biti sad trag, naravnoavno, da trebaš ostati sada."
1:33:35,1:33:37,"Ako nisam otvorila školu, ništa ne bi bilo."
1:33:37,1:33:39,"Ne, naravno, da je to istina."
1:33:39,1:33:40,"Da, ne mora biti tako."
1:33:40,1:33:41,"Da, naravno, ne mora biti tako."
1:33:42,1:33:46,"To je sve, ko zna i moj putevi, zašto su bili takvi kakvi jesu."
1:33:46,1:33:52,"Ali, definitivno, ostavljate, pazi, mi ostavljamo trag, mi koji smo odlučili da imamo djecu."
1:33:53,1:33:57,To je velika odgovornost i ti ostavljaš trag i postojiš cijeli život kroz njih.
1:33:58,1:34:02,"Moj muž je umro svojim tijelom, ali on nikad nije umro."
1:34:02,1:34:04,"On je još uvijek tu, ja još uvijek."
1:34:04,1:34:07,se pitam šta bi on to rekao na ovo.
1:34:07,1:34:09,I to je nešto što sam prvo rekla svojoj djeci.
1:34:10,1:34:11,Tata je uvijek tu.
1:34:12,1:34:17,"Ako želite mu živjeti njegove vrijednosti koje je on živio, pitajte se šta bi sa tata rekao."
1:34:17,1:34:19,"I ništa više ne trebaš, on je tu."
1:34:20,1:34:21,Šta bi tata rekao na ovo?
1:34:21,1:34:21,Idemo dalje.
1:34:23,1:34:35,"Jer kad vrijednosti i taj duh ostaje koji je bio ovdje, ne moraš otvarati šta si ti rekla, ni škole, biti poznati umjetnik, pjevač, glumac da bi."
1:34:35,1:34:42,"Da bi, ali ako ti u svojoj kroz ljude s kojima si bio u kontaktu ostavljaš, oni nastavljaju živjeti."
1:34:42,1:34:49,"Te mlađe dženzi, hajmo njima ostaviti duh neki koji će ih inspirirati gdje će oni nastavljaju živjeti."
1:34:52,1:34:58,"Ojoj, pokušavam progutati knelupada mogu ići prema zaključku."
1:34:58,1:35:02,"Hvala ti, evo stvarno ti hvala."
1:35:02,1:35:06,Ja vjerujem da Bog daje križ onakav kakav procjeni da čovjek može nositi itd.
1:35:06,1:35:17,"Tako da tebe stvarno, a ja bih rekla, dao ti je veliku odgovornost jer inspiriraš druge i širi krug ljudi i mijenjaš živote."
1:35:18,1:35:22,"Sad mi je malo i jasnije nakon ovog razgovora odakle ti ta snaga, odakle to sve crpiš."
1:35:23,1:35:36,"Što je zapravo predivno kad to ne piše na čelu, nego zaista čovjek se zapita od kud joj snaga, pa to mora da je božja neka božji prst u svemu tome kako ta žena ide kroz sve te stvari i opet toliko snage da i dalje."
1:35:37,1:35:42,"Češ nam u Zagreb, nadam se, jednom dovesti tu školu, odnosno otvoriti."
1:35:42,1:35:43,Stvarno se tome nadam.
1:35:44,1:35:48,I znam da se nadaju svi zagrebčani koji su poslušali ovu epizodu.
1:35:50,1:35:53,Malo jesmo išli mimo nekih tu vidljivih pravila.
1:35:53,1:35:56,"Ne znam tko je ono što im se dogodilo, ali tako bi trebalo biti."
1:35:56,1:35:58,Zato je taj podcast kao i onaj.
1:35:58,1:36:12,"Tako da svi koji zapravo su se zainteresirali, zaintrigiralo ih je kakva je to škola, o čemu se radi, masa je materijala i bilo se i u raznoraznim podcastima i emisijama i nadam se da će se ljudi informirati o tome jer ja mislim da je to stvarno budućnost."
1:36:14,1:36:16,I nadam se da će ići u tom smjeru.
1:36:16,1:36:19,"Ako ništa, možda ćeš postati neka ministrica obrazovanja."
1:36:19,1:36:20,Ne znam na kojem nivou.
1:36:20,1:36:22,Možeš reći nešto što je sigurno.
1:36:22,1:36:24,Da to neću postati.
1:36:24,1:36:26,Ništa ne znam što je sigurno u životu.
1:36:27,1:36:27,Ali ne znam.
1:36:28,1:36:31,"Jedino, sad možda da baš poludim pa da odemo u neke političke vode."
1:36:32,1:36:33,"Mislim, ja."
1:36:33,1:36:36,"Možda ćeš onda biti teže dostupna za razgovor, pa nemoj."
1:36:36,1:36:47,"Ne, ne to, ne, zato što znaš ono javno Znaš, ja volim svijet koji je, da bi radio neke ovakve stvari, moraš imati svoj svijet i kreirati svoj svijet ljude oko sebe."
1:36:47,1:36:55,"A taj put neki, ja nisam taj, mislim da promjenu radiš definitivno u nekom svom okruženju."
1:36:56,1:37:03,"I da, pa, znaš, nama se čini ministar obrazovanja ili ministrice, nekada su to ljudi koji imaju puno veliku moć."
1:37:04,1:37:10,"Ali generalno, ministar obrazovanja ne može ništa promijeniti ako u školi ima učiteljicu koja to ne želi promijeniti."
1:37:10,1:37:11,Ako me razumiješ.
1:37:12,1:37:13,Tako da ti imaš baš.
1:37:13,1:37:15,"Ja te ne vidim, te nijedno u toj ulozi."
1:37:15,1:37:31,"Da, tako da ti moraš biti ono, ja bi radije bila učiteljica koja mijenja svoj razred na terenu, zato što je to jako izcrpljujući posao i nemučan je što god ti pokušaš bilo u kojoj si, a uopće, njime bi je uopće, ne znam za kakve stranke, ni za šta je to uopće, ne zanima me."
1:37:31,1:37:40,"Ali bilo da gdje je, teško je biti u toj ulozi da ti nešto ti moraš, ali naravno da je važno da je netko na poziciji ko kuži."
1:37:43,1:37:46,Tako da ja ću biti uvijek ona učiteljica tamo na projekti.
1:37:47,1:37:48,Hvala ti.
1:37:48,1:37:57,Nadam se da će ljudi drugi pratiti tvoj primjer i da će biti još više takvih primjera i škola i programa i da ćeš nam ti još knjiga omogućiti.
1:37:57,1:37:58,Ja isto nadam.
1:37:58,1:38:01,"Ono negdje, kako bi rekli, sad se stvarno dosta promijenila."
1:38:01,1:38:10,"Nikad nisam ni govorila ni o tom svom putu, ali nekako nakon ovog cijelog iskustava i to je dosta i ljudi pitalo i šta i kako i gdje, šta dalje i kako si ti uspjela i ovo."
1:38:10,1:38:21,"Mislim da je ok da kažem neke svoje ili dublje stvari u životu i hoću, sigurno ću objavljivati još literaturu u tom smjeru i možda i nešto dublje i nešto više i nešto ne znam."
1:38:21,1:38:27,"Šta mi sad bude svu literaturu koju ja objavljam, to je nešto što je u biti nešto što je bio predmet mog interesa u tom trenutku."
1:38:28,1:38:31,"Pa onda to objavim jer znam da sigurno ima još ljudi koji to prolaze, taj problem."
1:38:32,1:38:38,A to je nekako i najautentičnije kad ti svoje životne okolnosti pretačeš onda u posao.
1:38:39,1:38:40,"Da, da, da."
1:38:42,1:38:47,"Oke, imaš li O, evo, imali smo li nešto zaboravili spomenuti, imali neku poruku za kraj?"
1:38:47,1:38:51,"Da, smo imali neku drugu ideju kako će to ići, ali šapan, nemam neku poruku."
1:38:51,1:38:56,"Mislim da je evo, generalno, ono što sam ja ovdje shvatio, primio par poruka, gasi."
1:38:57,1:39:01,"Generalno bi poruka bila ono, živi, živi, nemoj umirati."
1:39:01,1:39:15,"To bi bilo, nemoj umirati, nemoj se predavat, pokušava, nemoj imati ni velika očekivanja od sebe, ni kao roditelj, ni kao majka, ni niko, nemoj imati velika očekivanja, poštuju svaku svoju mali napredak."
1:39:16,1:39:34,"Pa i kad si skuhao ručak i kad si napravio nešto sebi da je ono dobro sam napravio, traži taj dobar osjećaj u svemu i nekako on se uvijek preljeva na djecu, na društvo, uvijek je ta tvoja unutarnja emocija se preljeva i na druge, njeguje da bi nešto mijenjao i da bi živio."
1:39:34,1:39:45,"To je promjena takvog tipa je život zapravo stalno, da bi taj tvoj život evo od sutra bio prisutan i u drugim ljudima, u tvojoj obitelji, jer nikad kažem da mi nikad ne umiremo.."
1:39:46,1:39:46,Mi uvijek ostajemo.
1:39:47,1:39:48,Taj naš duh ostaje.
1:39:48,1:39:51,"A gledano, i sad bi to bila tema za novi podcast."
1:39:52,1:40:02,"I drugi put, da, da, gledano, čak sam ja bila krenula nešto i pisati o tome, a jednog dana možda i napišem knjigu kako to je znanstveno gledano."
1:40:02,1:40:08,Mi smo svi od tih nekakvih elatoma sastavljeni u ovom svijetu i ne može sve umrijeti.
1:40:09,1:40:16,Znači ono ima veliki smisao da postoji i znanstveno gledano da postoji naša duša koja.
1:40:16,1:40:18,je opet je tu.
1:40:19,1:40:22,"Ne može biti sve ovo, samo jedno tijelo koje je tu."
1:40:23,1:40:27,"Nismo mi, ne valjamo se uopće, mi smo o dušu ovdje u takvoj jer ne može biti sad ovo."
1:40:28,1:40:29,Tako da je to sad sve.
1:40:30,1:40:34,"Toliko važnost dajemo, ali ne može biti nikako mi sad nemam i nikakvu logiku."
1:40:35,1:40:37,"Boli mi aj logično razmišljati, ali nemam i logiku."
1:40:37,1:40:43,Sigurno mi postojimo i ostajemo uvijek ako ništa kroz ljude s kojima smo bili u kontaktu i dalje živimo.
1:40:44,1:40:47,I kroz nas žive naši ne.
