Start (HH:MM:SS),End (HH:MM:SS),Segment
0:48:42,0:48:52,"I govorio sam ljudima o toj rodnoj ideologiji, kako će doći vrijeme, ako već nije došlo, gdje će se promicati ideju da muško može reći da je žensko."
0:48:53,0:49:12,"Nakon toga, jedan lječnik mi je došao, dobro, nam je rekao časti, da ja vas pratim, ja podržavam, ali ne morate zastrašivati ljude da bi vi promovirali svoje, ne morate lagati, jer je rekao doktore, to se događa i on se nasmijao, kao to je nemoguće."
0:49:13,0:49:14,Ne moguće da ne može vjerovati.
0:49:15,0:49:16,"I vidite, u deset sekundi."
0:49:16,0:49:22,"Ja sam to govorio zato što dolazim iz Kanade, pa vidim u što se pretvorila moja domovina, gdje sam rođen."
0:49:23,0:49:24,Ja više je ne prepoznajem.
0:49:25,0:49:29,"Kad kažeš da ne prepoznajem, što ne prepoznajem?"
0:49:32,0:49:49,"Slobodno mogu reći u jednu vrstu totalitarizma na ovom području.<|notimestamp|><|nodiarize|><|notimestamp|><|nodiarize|><|notimestamp|><|nodiarize|><|notimestamp|><|nodiarize|><|notimestamp|><|nodiarize|><|notimestamp|><|nodiarize|><|notimestamp|><|nodiarize|> Prijatelj iz mature se uvijek nađemo i da se razumijemo, ne idu u crkvi, nisu neki vjernici, ni jedan od mojih."
0:49:49,0:49:51,"prijatelja od srednje škole, a smo prijatelji."
0:49:51,0:49:53,"Naravno, da, oni mene vole, ja ih volim."
0:49:54,0:49:55,Tu se jedni za druge.
0:49:55,0:50:04,"Rade za firme, IBM, za ovo, za ono, za banke CIBC i tako."
0:50:04,0:50:08,"I kad oni meni pričaju, na što su oni prisiljeni?"
0:50:09,0:50:10,Prisiljeni.
0:50:11,0:50:12,"Dakle, prisiljen govor."
0:50:14,0:50:25,"Što je Jordan Peterson sa običnim mobitelom i mogu se pohvaliti da je počeo sam ga pratiti kad nije imao tisuću pratitelja, jer on je sa običnim mobitelom na sveučilištu Toronto."
0:50:25,0:50:30,"Učinuo je u Torontu, govorio je neke stvari o nekom zakonu u Kanadi, ljudi su se njemu smijali, dakle to se događa."
0:50:30,0:50:36,"Mislim, Jordan Peterson i sve ovo što mi sada imamo u njegovoj posljedica toga da su njega htjeli natjerati."
0:50:36,0:50:36,Tako je.
0:50:37,0:50:40,"Dakle, radi se, dakle, jedna faza je cenzura."
0:50:40,0:50:42,Kad se govori šta ne smiješ reći.
0:50:42,0:50:48,"E sad, Kanada i ta naša ljevica ide lagano u jednu drugu fazu, a to je šta moraš reći."
0:50:49,0:50:49,"Moramo reći, da."
0:50:49,0:50:50,"Dakle, šta moraš."
0:50:50,0:50:54,"Prvo ne smiješ, nije politički korektno da ovo reče, a onda da, ovo moraš reći."
0:50:54,0:51:01,"I to je ta faza i sad svi moraju u svojim službenim mailom staviti svoje pridjeve, Hemši, Hr."
0:51:01,0:51:03,"Hemši, her, ziši, ne znam što nije ja."
0:51:05,0:51:09,I moraš biti upućen sa svojim sugovornikom koji je pridjev.
0:51:11,0:51:11,I to je realno.
0:51:12,0:51:18,Stvarni problem je u tome što imaš mail u kompaniji koji moraš znati napisati.
0:51:18,0:51:26,"I ona svako malo moraju ići na sustavnu reedukaciju, senzibilizaciju i moraš sjediti tamo."
0:51:27,0:51:32,"To smo imali u srednjoj školi, se to zvalo teorija i praksa samoupravnog socijalizma."
0:51:33,0:51:37,Imali smo predmet gdje su nama ispočetno objašnjavali.
0:51:37,0:51:39,"I na fakultetu smo to imali, što god da smo studirali."
0:51:39,0:51:43,"To je u komunizmu bio isto ta, tako se zove senzibilizacija."
0:51:43,0:51:59,"Ovo dolazi na velika vrata ako već nije, jer se iz nekim pričaju već u nekim dokumentima o hrvatskim da je više žena, majka nego osoba koja rađa ili osoba koja menstruira itede I to je ono na što je Plenković pristao ratifikacijom Istanbulske konvencije."
0:51:59,0:52:10,I to je opasno i to je zaista totalitarizam gdje prisiljavaš nekoga da govori na jedan način i da misli na neki način.
0:52:10,0:52:11,A zašto moraš?
0:52:11,0:52:12,Moraš ga prisiljavati.
0:52:12,0:52:15,"Zato je tebi ovaj liječnik koji tebi rekao, ne može."
0:52:16,0:52:28,"Pa on je rekao istinu, on je tebi rekao, pa ne može u normalnim okolnostima itko pristati na laž da ti sa svojim stanicama i genetskim kodom možeš reći da si ti ja."
0:52:28,0:52:29,Pa apsolutno.
0:52:29,0:52:30,I to je istina.
0:52:30,0:52:39,"Ja kažem za dvjesto tristo godina ako prekopavaju neke grobove, nađu i kost i DNA, onaj test koji će oni izvršiti tada neće znati za tvoje osjećaje."
0:52:40,0:52:40,Tako je.
0:52:40,0:52:42,Netko će znati za tvoje DNA.
0:52:42,0:52:44,"Dakle, tko će koristiti mušku ili žensku."
0:52:45,0:52:49,"Ali za prisila je nužan ovo što si rekao, super."
0:52:49,0:52:53,"Ja sam rekao super da je prvo da ti govori što ne smiješ govoriti, a onda te tjeraju što ti ide."
0:52:53,0:52:57,Prisila je nužna jer ti po logici stvari ne možeš što govoriti.
0:52:57,0:52:59,Dakle oni te moraju tjerati govoriti nešto.
0:53:00,0:53:03,"I to je, evo moramo se tome suočiti."
0:53:04,0:53:06,I ovo je došlo na našim vratima.
0:53:07,0:53:08,Ja sam tada 2012.
0:53:08,0:53:12,koristio sliku kako se žaba kuva.
0:53:12,0:53:15,Stavlja se u hladnoj vodi i podgrijavaš malo.
0:53:16,0:53:16,Žaba je ugodno.
0:53:17,0:53:21,"Na jedan put je vrilo i dok ona skuži da je vrilo, ona je već kuvana."
0:53:22,0:53:25,Pa sam koristio tu sliku za nas i to je se tako.
0:53:25,0:53:26,naglo promijenilo.
0:53:26,0:53:27,"Znači, 2012."
0:53:28,0:53:46,"u 11 godina do čega je do kakvog došli smo do toga da tebi danas netko tvrdi, dakle da ti tvrdi stvari koje biološki nisu moguće i da ti postavlja kriterije i da te tjera da ti moraš o tome ili šutjeti ili govoriti isto što želi naša žena."
0:53:46,0:53:51,"I naravno onda samo ti prijede, oni uvijek imaju etikete transfobija, sad je transfobija ta."
0:53:53,0:54:00,I zanimljivo je vidjeti kako feministički pokret se tu ne snalazi jer imamo absurd.
0:54:01,0:54:14,"Da jedan muž koji će staviti suknju, staviti puno šminke, utvrđujući sve ženske stereotipe, utvrđujući da je on žena."
0:54:15,0:54:24,"Dakle, dok je feministički pokrov govorio, nemojte staviti slike sa suknje jer mi smo više od suknje, mi smo više od šminke, mi smo okej."
0:54:24,0:54:31,"Sada jedan biološki muž koji stavi tange, otkrije palebice, ne bi da baš vidio."
0:54:32,0:54:37,"I sve one stereotipične slike protiv koje je feministički pokrov se borio, ovaj sad prerušuje."
0:54:37,0:54:45,"Ovaj sad preuzima na sebe jedna aproporacija tvrdeći da je žena, pa Matt Walsh postavlja dobar pitaj što je žena."
0:54:46,0:54:46,Što je žena?
0:54:47,0:54:50,"Čeka, je li žena ova suknja i šminka?"
0:54:50,0:54:51,"Da, je."
0:54:52,0:54:56,"Ili je dovoljno staviti, da to je takvo poniženje ženstvenosti."
0:54:56,0:54:57,"I sve što žena jest, je li."
0:55:00,0:55:00,I čudim se.
0:55:01,0:55:03,što feminički pokret šuti.
0:55:03,0:55:06,"Dobro, ima nekih ideja unutar feminističke ideje."
0:55:06,0:55:08,"Evo, ne podržavam ništa što je napisao J.K."
0:55:09,0:55:10,"Rowling, svaka je čast."
0:55:11,0:55:21,"Ja ne propću nikome da čitaita Harry Potter i zbog toga se zročio u novinama, ali svaka nju čast, ona je se digla i suprotstavila toj rulji."
0:55:21,0:55:27,"I ne samo to, škakve ona, batine, neprekidno dobiva zbog toga."
0:55:27,0:55:42,"Kao osoba koja je bila nagrađivana od LGBTQ zajednice, ka osoba koja je i ona, ja sam neke videe gledala gdje je nju, kad je objavila neku video igricu ili nešto objavila, koliko mržnje nju napada, čemu je ona izložila."
0:55:43,0:55:49,"To će biti vrlo zanimljiv jedan savjes kad se dogodi ismeću, onaj pošteni, iskreni feminički pokret."
0:55:50,0:55:51,Gdje ti štitiš prava žena?
0:55:51,0:55:52,"Štitiš prava žena, mislim."
0:55:54,0:56:05,"Ženski sport, gledamo područje ženskog sporta, ženski vceji, sve one zakone koji su negdje utvrđivali žene u nekim područjima, što su hvalo vrijedne."
0:56:06,0:56:11,Sada na jedan put imamo muškarac koji pobjeđuje mis.
0:56:12,0:56:13,Mis postane.
0:56:13,0:56:14,Ne znam gdje je u UN-u.
0:56:14,0:56:16,"U Nizozemskoj ili negdje je postao, da."
0:56:17,0:56:22,I zato što on promiče jednu stereotipičnu sliku žene.
0:56:23,0:56:24,Razumijem što želiš reći.
0:56:24,0:56:30,"to u stvari iskrivljavanje onoga što je žena, a onda njega tretiraju kao žene."
0:56:30,0:56:36,Dakle on promiče ovu žensku apoliju s nekim stereotipnim slikama preko kojih feministički pokret se bori.
0:56:36,0:56:57,"Ali druga tema je tu vezana doista za to da se sve niže djeci stvara sumnja oko njihovog identiteta tko su oni i da u stvari ono što se je pokazao je veliki skandal u klinici za, najvećoj klinici za, dakle transrodnost u Tevistoku."
0:56:57,0:57:19,"On je pokazao da je udio djece i mladih koje su oni počeli im davati hormone ili kojima su postavljali dijagnoze da su drugog spola, da je u toj skupini bio puno veći udio djece i mladih koji pripadaju nekom spektru autizma i koji su ranjivi u drugim pogledima psihološkim."
0:57:20,0:57:35,"I to je ono prestrašno da ti one koji su osjetljiviji, koji su krhki, koji su ranjivi kako god da gledaš i onda oni se ponadaju da je u stvari rješenje tih njihovih drugih problema u tome da promijene spol."
0:57:35,0:57:39,Sad ima ogroman pokret onih takozvani detransitionalisti koji.
0:57:39,0:57:41,Kako se njih cenzurira?
0:57:41,0:57:47,Meni su rekli da sad u Kanadi da je bio prijedlog zakona ili su ga prihvatili da se ne može izvršiti detransicija.
0:57:48,0:57:53,"Moram baš to, to mi je neko neki dan rekao, nisam verificirala, ali moram to pogledati."
0:57:53,0:57:54,Ali ne bi me čudilo.
0:57:54,0:57:58,"Dakle, da oni kažu, ok, promijenio si spol, ali ne možeš više natrag."
0:57:59,0:58:20,"Sada, evo, kanadsko društvo je došlo, sad kad sam ja bio doma, najaktualnije su bili, mi kažemo, Queens Park, Queens Park je taj trg gdje je gradsko viječe, da su roditelji se digli, maho muslimani, jako puno muslimana u Torontu, da se okane svoje djece u školama."
0:58:21,0:58:26,Da se okane njihove djece u smislu što guraju sve te ideologije.
0:58:26,0:58:33,"Dakle, dajte nam djecu matematiku, fiziku, kemiju, zemljopis, tristeno ponašanje, tamo je to dječjega tamo."
0:58:33,0:58:52,"I naravno kolumnisti, posebno Toronto Star, koji je nažalost, ja sam bio paperboy, ja sam kao 12 godina razosvijete, da za Boga da nisam to radio, ali sam kao 12-godišnjak to radio, razosvijete Toronske novine, a oni su veliki promotori i oni govore o teroru koji roditelji vrše na svojim djecom što ne utvrđuju."
0:58:52,0:59:03,I sad zakon se radi o tome jesu li učitelji dužni reći mami i tati djeteta ako dijete traži pridjeve koji se ne uklapaju sa svojim biološkim spolnošću.
0:59:04,0:59:06,"Dakle, država može bolje procijeniti."
0:59:08,0:59:10,Kanadsko društvo je došlo do te točke.
0:59:11,0:59:18,Roditelji se bore za pravo da učitelj ako dijete slučajno dođe u pet i šest i sedam razred kaže ja sam muško ili žensko.
0:59:19,0:59:26,Zakon sad i protesti su bili o tome moraju li učitelji to reći mamita.
0:59:26,0:59:27,Dokle smo došli?
0:59:28,0:59:36,"A s druge strane, ako on napravi štetu nekakvu u školi, ako mu trebaju dati aspirin ili ga boliti glava, morat će zvati roditelj."
0:59:37,0:59:38,Dokle je došlo ka nas.
0:59:38,0:59:40,"Dakle, to je točka koju se oni raspravljaju."
0:59:40,0:59:47,"Kao što je, ne podržavam sve što govori, ali ovaj Joe Rogan i ovaj poznati podcaster."
0:59:48,0:59:51,"Ljevica, prije je to bilo ovdje, nekako."
0:59:51,0:59:52,Sad je Ljevica ošla ovdje.
0:59:55,1:00:00,"Čovjek bi pomislio, čeka je li to tako radikalno od roditelja da traže da učitelju samo obavijeste."
1:00:00,1:00:05,"Naravno, u problemu koji ima njihovo dijete, to je došlo kanadsko društvo."
1:00:07,1:00:12,"I zato, drago mi je to vidjeti, ogroman je pokret sad homeschooling u Kanadi, a školovanje djece doma."
1:00:14,1:00:35,"U SAD-u je to moj brat to čini, moj brat ne šalje svoju djecu u školu više, nego od početka ima jedan sustav, homeschooling je jedan sustav što moraju naučiti u SAD-u da sačuvaju vrijeme, petero djece idu na homeschooling, fantastično nešto, nadam se da to dođe u Hrvatskoj, jedna super alternativa."
1:00:36,1:00:39,"Tako da evo idemo dalje, radosno."
1:00:41,1:00:55,"Zanimljivo mi je ta na kraju do čega je došlo kanadsko društvo, onda istovremeno se otkrije da je premijer lagao, glumio da je u braku, a ustvari je živio odvojeno od svoje žene godinama radi javne slike."
1:00:55,1:01:01,"Kako je to, koliko je to sve licemjerno u konačnici?"
1:01:02,1:01:24,"Ali kako ti s jedne strane bi davao normu ljudima kako da se ponašaju, postavljao se iznad roditelja u odnosu na djecu, iznad svih vrijednosti, a s druge strane, ti glumiš, lažeš da si u braku, odvojio si se od svoje žene, sad istražuju da li je u stvari on joj alimentaciju plaćao kroz nekakve davanja."
1:01:25,1:01:26,Kako nalažeš?
1:01:27,1:01:34,"Ono što je strašnije je uloga medija, ja to mogu reći za Hrvatsku, prije je medij bio jedan korektiv."
1:01:34,1:01:35,"Korektiv, slažem se."
1:01:35,1:01:41,"Novinari su uvijek bili malo bezobrazni, u pozitivnom smislu, što su istraživali, što su kopali, što su tražili."
1:01:41,1:01:43,"Toga više nema, toga više nema za neke."
1:01:44,1:01:47,"Dakle, mi to vidimo u Kanadi, taj medij."
1:01:47,1:01:48,"Odlaziš, uputu i država."
1:01:48,1:01:49,Gotovo.
1:01:49,1:01:58,"I gotovo, nema više onog medija gdje je ono oslobođen nekih svjetonazorskih nego on kopa, on traži, on ispituje."
1:01:59,1:02:05,"I Bogu hvala za ulogu novinara u prošlosti što su to radili, što su otkrivali skandale i ono, toga više nema."
1:02:05,1:02:10,Što su ljude poticali na promišljanje i kritičko razmišljanje o onome što se događa.
1:02:10,1:02:12,"Ima za neke, a ne za sve."
1:02:13,1:02:15,I to možemo slobodno vidjeti u Hrvatskoj.
1:02:15,1:02:17,"To možemo, a to je i u grad Zagreb."
1:02:19,1:02:20,"Neću sad ući u to, ali to je očito."
1:02:21,1:02:27,I to je zapravo najopasnije što vidim kad mediji i vlast su u spremi.
1:02:27,1:02:28,Tako je.
1:02:28,1:02:30,"Evo, to je istina."
1:02:30,1:02:33,I jel u principu mediji onda počinje biti propaganda?
1:02:33,1:02:37,"Jer ja ne vidim neovisan medij, mainstream, ne vidim ga u Hrvatskoj."
1:02:37,1:02:40,"Nažalost, evo vidim samo tu spregu."
1:02:41,1:02:42,Pa da i tu je.
1:02:42,1:02:55,"I ja sam imao razgovor s jednim novinarom i on se uvrijedio kad sam ja njemu rekla, ali ti si dio većine koja, ti si dio ne većine već dio mainstreama koji nameće drugima."
1:02:56,1:03:00,"Ti uopće ne preispituješ politiku, ti moć ne preispituješ."
1:03:00,1:03:01,Koga ti preispituješitivati.
1:03:02,1:03:07,Tvoja uloga bi bila preispitivati one koji su moćni i kako bi ih držao pod kontrolom.
1:03:08,1:03:11,A ti ustvari zajedno s njima napadaš sve koji im se suprastave.
1:03:13,1:03:16,I to je najproblematičnije u današnjem društvu.
1:03:17,1:03:19,Imali smo uvijek svakakvih političara.
1:03:20,1:03:21,Nema se tome čuditi.
1:03:21,1:03:22,Naravno.
1:03:22,1:03:26,Ali uvijek negdje je medij taj bio koji je kopo tražio.
1:03:27,1:03:31,Kroz medije su ljudi mogli doći i izraziti svoje mišljenje.
1:03:32,1:03:32,Da.
1:03:32,1:03:32,Jel tako?
1:03:33,1:03:35,"Ali, Bogu hvala za mreže."
1:03:36,1:03:38,"Sad imamo potpuno jedno drugogo područje, podcasti."
1:03:39,1:03:40,Društvene mreže.
1:03:40,1:03:42,Društvene mreže gdje imamo jednu.
1:03:42,1:03:47,I onda vidimo kako žele i to skratiti.
1:03:48,1:03:52,"Kao fake news u ime fake news-a, da cenzuriraju neke novine."
1:03:53,1:03:53,"Da, tako."
1:03:54,1:04:03,"Ali, rekla bih da je krajnja točka ovog što si ti nazvao povezivanjem medija i politike, to je ono što smo vidjeli u totalitarnim režimima."
1:04:04,1:04:12,"To je krajnja točka i to je ono da tebi komunistička partija javi šta se smije objavljivati u novinama, što se ne smije."
1:04:12,1:04:12,To je tako doista.
1:04:12,1:04:18,"Doista izgledalo da ti nisi mogao objavljivati, ti si o događajima imao službenu istinu."
1:04:18,1:04:21,"I u fašizmu, i u komunizmu."
1:04:21,1:04:22,I to je ono prema kuda se ide.
1:04:22,1:04:24,Nadamo se da nećemo do tamo doći.
1:04:26,1:04:32,Puno ti hvala na razgovoru i puno smo toga pokrili.
1:04:33,1:04:34,Radujem se tvojim iskustvima.
1:04:35,1:04:38,Razgovarat ćemo opet kad malo stekneš iskustva.
1:04:39,1:04:47,"Ne, ne, ne, nisam to htio reći, već kad još više stekneš iskustva s našim kadetima, bit će mi drago da ćeš biti zajedno sa njima."
1:04:47,1:04:48,Hvala ti.
1:04:48,1:04:52,Hvala vama dragi gledatelji i ja vas pozdravljam do sljedeće prilike.
