Start (HH:MM:SS),End (HH:MM:SS),Segment
0:00:00,0:00:12,"Crkva smatra da je spolnost tako sveta da bi ona trebala biti samo između muža i žene i samo u službi ljubavi, dakle izraz ljubavi i otvornost prema životu."
0:00:13,0:00:18,I zato imamo situacije starije osobe koje ne mogu imati djecu više ili sterilne osobe iz nekog fiziološkog razloga.
0:00:19,0:00:26,"I naravno oni su u sebi po sebi, su otvorni prema životu, njihova fiziologija to ne dopušta i vole se."
0:00:26,0:00:31,I naravno da taj bračni spolni činjenje je svet i dobar i koristan i tako dalje za njih.
0:00:32,0:00:38,"Crkva smatra i vjeruje da kad se mi potpuno predajemo,, mi imamo dušu."
0:00:38,0:00:47,"I kad se mi potpuno predajemo, onda nam tijelesno darivanje mora biti slika ono što smo duševno dali, a to je da se potpuno tijelesno dajemo."
0:01:01,0:01:06,"Pozdravljam vas u 55 minuta, hvala da vratite moj podcast, hvala na komentarima koje stavljate."
0:01:07,0:01:13,"Moj današnji gost je svećenik kojeg malo kome treba predstavljati, Don Damir Stojić."
0:01:13,0:01:18,"Dona Mire, hvala ti da si našao vremena u svojoj novoj službi za ovaj razgovor."
0:01:18,0:01:20,Hvala lijepo i hvala na pozivu.
0:01:20,0:01:25,"Dakle, ti si u puno navrata od kad si došao u Hrvatsku, a to je bilo daleke 1993."
0:01:25,0:01:27,"godine, ako dobro pamtimo."
0:01:28,0:01:35,"Dakle, ti si puno puta u medijima su se bavili tobom, onim što si govorio, onim što si radio."
0:01:36,0:01:45,"Ali ovo da mi imamo medijske objave, puda, jedan župnik na koju novu službu prelazi, to još nismo vidjeli."
0:01:46,0:01:49,"Mi smo tokovi da mi sjedimo na kavu i mi svećenici, samo čujemo."
0:01:49,0:01:58,"Samo čekamo onaj dan kad je Zagraška biskupa objavila razmještaj, razrješenja, i baš smo bili na kaviji par svećenika i samo čekamo naslov."
0:01:59,0:02:00,I krenulo je.
0:02:01,0:02:05,"Meni je najbolje bilo, Foreš, da si ti na pitanje novinara rekao istinu, jel tako?"
0:02:06,0:02:09,Te bi su nazvali i pitali kako je to bilo.
0:02:10,0:02:17,"Pa ovako, da netko preuzme službu, on mora biti razriješen prijašnje službe."
0:02:18,0:02:18,To je normalna stvar.
0:02:19,0:02:25,"I to je jedan pravni akt, to je pismo, dekret gdje dotični poglavar nadbiskup."
0:02:25,0:02:28,te razrješuje kako bi bio slobodan da se imenuješ i tako.
0:02:29,0:02:37,"Kao što se u firmi, kada se nekog miče na drugu poziciju, isto tako, prvo ga se makne sa jedne, kaže se dokada je na njoj i onda od kada je na idućoj poziciji."
0:02:38,0:02:40,Idemo nekoliko koraka naprijed.
0:02:41,0:02:42,Ja sam bio župnik tri godine.
0:02:43,0:02:51,"I nakon što sam 13 godina bio studijski kapelan, što mi je stvarno bio posao koji sam stvarno volio, bacio sam se 100% u to."
0:02:52,0:03:03,"Ali ja sam također nakon 13 godina tražio, mislim, ispucao sam se, dao sam sve što ima i tražio sam ja već dvije godine prethodno tome da me nešto novo i tako nisam očekivao župništvo."
0:03:05,0:03:10,"No, provincijal, moj poglavar me je imenovao župnikom, mi imamo zavjet poslušnosti."
0:03:10,0:03:13,"Dakle, mi redovnici, svećenici smo poslušni."
0:03:13,0:03:20,"Na dan mog ređenja, odnosno zavjetovanja, ja dajem zavjet da ću ja biti poslušan mom poglavaru."
0:03:21,0:03:23,"Nekad je to teže, nekad lakše."
0:03:24,0:03:25,Kao i svim drugim ljudima.
0:03:25,0:03:26,Normalno je.
0:03:27,0:03:35,"Ja sam čak molio mog poglavara godinu dana ranije da me razriješi župništvo jer ja volim evangelizirati, ja volim..."
0:04:14,0:04:23,"I u tom trenutku moj poglavar mene nazove i došao mi na kavu i pitao Damire, jesi li ti za to, bili li ti to prihvatili?"
0:04:26,0:04:27,"Naravno, ja sam to prihvatio."
0:04:29,0:04:33,Svijet medija ima dojam da mi smo kao neka politička stranka.
0:04:33,0:04:34,"Crkva, da, da."
0:04:34,0:04:36,Ne razumijemo je li to.
0:04:37,0:04:40,"Jedni drugima žele zlo, napadaju, sad tebe neka..."
0:04:40,0:04:42,"Dere se na tebe moraš ići tamo, da."
0:04:42,0:04:47,Sjetimo se koliko političkih stranka kad se političari odvoje odmah optužbe.
0:04:48,0:04:48,"Bratski, moj..."
0:04:48,0:04:50,Moj suprug.
0:04:50,0:04:54,Moj suprug je poklikavu je me pitao.
0:04:55,0:04:57,"Damire, kako se osjećaš?"
0:04:57,0:04:58,Bili ti to prihvatio?
0:04:59,0:05:02,Naravno da bi prihvatio i nije mi to uopće palo na pamet.
0:05:02,0:05:03,Pa kako bi ti palo na pamet?
0:05:05,0:05:08,I rado sam prihvatio i tako je to došlo.
0:05:08,0:05:09,"I naravno, kako da procedura ide."
0:05:10,0:05:16,Onda moj provincijal obavijesti zagrebačkog nadbiskupa da me razriješi službe župnika.
0:05:16,0:05:19,On u stvari tebe treba službe župnika razriješiti nadbiskupa.
0:05:19,0:05:19,Tako je.
0:05:20,0:05:23,"Jer sam ja župnički, ali tako to funkcionira kod nas."
0:05:23,0:05:28,"Dakle, ima dvije pravne osobe imamo Zagrebačku nabiskupiju i Hrvatsku salzijansku provinciju."
0:05:28,0:05:30,Ja sam član Hrvatske salzijanske provincije.
0:05:30,0:05:34,"Drugim riječima, zagrebački nabiskup ne može sa mnom raspolagat."
0:05:34,0:05:44,"Kao sa svojim svećenicima koji su svećenici nadbiskupijski, on ih raspoređuje i on više nikog za to ne treba pitat, a za tebe treba razgovarati sa svojim provincijalom."
0:05:44,0:05:52,"Nadbiskup može sugerirati, pitat i budući da ja sam djelovao na području Zagrebačke nabiskupe, naravno to je dogovor."
0:05:52,0:05:53,I kako to funkcionira?
0:05:54,0:06:02,Moj provincijal predlaže mene ili nekog drugog i dotični nadbiskup u ovom slučaju zagravački nadbiskup imenuje.
0:06:04,0:06:08,Ali ne može se dogoditi da nadbiskup mene imenuje bez prethodno znanja mog provincijala.
0:06:08,0:06:16,A tvoj provincijal neće pristat na imenovanje bez da prethodno razgovara sa subratom za kojeg je odgovoran ovo razdoblje dok je provincijal.
0:06:17,0:06:19,"Mislim, to nije kao političke funkcije."
0:06:20,0:06:23,"Dakle, odabiru se provincijali unutar kruga jednoga."
0:06:24,0:06:27,"Prema tome, danas je on tebi provincijal, sutra ti njemu možeš biti."
0:06:27,0:06:28,"Prema tome, to su stvari koje."
0:06:29,0:06:30,Jako si dobro ovo rekao.
0:06:30,0:06:34,Kao da je crkva i redovi u crkvi kao da su političke stranke.
0:06:35,0:06:36,A to se uopće ne može predstavljati.
0:06:37,0:06:41,"Mi smo braća, mi razgovaramo, imamo poslušnost u konačni."
0:06:43,0:06:55,"Iskreno, ja još nisam doživio, u mojih 30 godina, u našoj Hrvatskoj, Slovenskoj provinciji, možda je bilo da ja nisam znal, ali još nisam doživio da jedan subrati izričito odbijo."
0:06:57,0:07:03,"Može biti nagodovanje i uvijek provincijalna spita, kako se osjećaš, mi te tu vidimo."
0:07:04,0:07:05,Kako ti sebe vidiš?
0:07:05,0:07:06,Da ti sebe tu vidiš.
0:07:07,0:07:14,"Naravno, da neki poglavar nećete nametnuti negdje, jer znad da češkodite.iti tebi i drugima."
0:07:14,0:07:16,Jer ti cilj je da sve učinite dobro da radi svoj život.
0:07:17,0:07:23,"Odlično, to bude puno mjeseci prije, da malo razmisliš o tome, da malo razmišljljaš o tome."
0:07:24,0:07:26,To se zove bratski odnosi.
0:07:27,0:07:28,"Ali opet, neko mora biti."
0:07:28,0:07:30,"Naravno, mora se znati tko odlučuje."
0:07:31,0:07:35,"Kad bi oni znali, mislim, mi i naši provincijali smo subrača."
0:07:35,0:07:39,"Jer, e, by the way, mi smo prošli mjesec, prije dva tjedna glasali za novog provincijala."
0:07:40,0:07:42,"Dakle, može se dogoditi kod nas situacija."
0:07:42,0:07:43,"Neke vi glasate, ne?"
0:07:44,0:07:46,"Savjetodano, savjetodano, da."
0:07:46,0:07:49,I može se dogoditi da sadašnji provincijal.
0:07:50,0:07:51,bude nekome kapelan.
0:07:51,0:07:51,Da.
0:07:51,0:07:52,U zimama.
0:07:52,0:08:06,"Tako je da osoba koja je odlučivala o tome tko će kuda ići na ovaj način, sad kao tebe, tko će ići na novu službu, bude u stvari pom ruka desna, odnosno pomoćnik nekome o kome je odlučio da bude žup."
0:08:06,0:08:11,"Evo recimo, ja sam, kao što bratari imaju guardijane, mi Salazijanci imamo ravnatelja."
0:08:11,0:08:15,"Mi smo poglavari, ravnatelj je poglavar Salazijanske redovničke zajednice."
0:08:15,0:08:16,Ja sam bio ravnatelj šest godina.
0:08:17,0:08:20,Po našim konstitucijama moja služba je prestala.
0:08:20,0:08:24,"I ja sam sad subrat u zajednici, imam drugog ravnatelja i."
0:08:24,0:08:30,"I onaj koji je sad vikar u zajednici, ja sam njemu bio poglavar prije dva mjeseca, sad je on vikar."
0:08:32,0:08:34,"Sad je on iznad tebe, pa tako je."
0:08:34,0:08:35,Ali šta je?
0:08:35,0:08:37,Ali kako je to zdravo?
0:08:38,0:08:39,"Mi smo braća, upravo to."
0:08:40,0:08:40,Kako je to zdravo?
0:08:40,0:08:50,"Zato što, ja sam rekao, svaki subrat osim ako ima neki veliki problem, bi trebao biti poglavar, će se da osjeti i brzo će shvatiti da u našim krugovima biti poglavar, vladav znači služiti."
0:08:51,0:08:52,I više trpi to od ostalih.
0:08:53,0:08:57,"Ja sam rekao njemu, daj, sad mi odreši ove ravnateljske službe, gdje stvarno si."
0:08:58,0:09:00,"To je kao gardijante, gdje si ti glavni, ti si glava."
0:09:01,0:09:05,"Međutim, to je puno više žrtvovanje, puno više služenje."
0:09:05,0:09:06,Odgovora.
0:09:06,0:09:14,"Pa da, ovo iz medija što dolazi, to je taj mentalitet, ono šefovanje, neko lupti šakom ostalo."
0:09:15,0:09:31,"Da se vratim natrag na ovo, kad sam ja razriješen studentskog kaplana, u istom paragrafu piše da sam imenovan župnikom, tad su brojili da je Bozenic mene smijenio, u istoj rečenici me imao, ako ćemo hierarhijski gledati, za jednu službu više."
0:09:31,0:09:31,"Više, da."
0:09:32,0:09:34,"Ali šta, medij je samo vidio riječ razrješenje."
0:09:35,0:09:36,Naravno da me mora razriješiti.
0:09:37,0:09:44,"Prije nego što me imenuje i ponavljam, ako ćemo gledati hijerarhijski, služba župnika je malo više od studentskog kapelana."
0:09:45,0:09:47,"I u istoj rečenici, on me razrješuje."
0:09:47,0:09:48,I promovira recimo.
0:09:50,0:09:58,"Ali, ali, ali doista je prisutna, ima jedan dio novinara i urednika koji su zlonamjerni."
0:09:59,0:10:06,"To je činjenica i to vidimo nažalost u brojnim napadima, potpuno neutemeljenim na crkvu i na svećenike i redovnike i na katolike."
0:10:06,0:10:10,"Ali, doista ima jedan dio koji ne zna, koji ovo ne razumije."
0:10:10,0:10:16,"Znači ne razumije, ali ja ono što ja ne razumijem, ali zašto onda ne nazove i ne pitate da ti objasniš proces."
0:10:17,0:10:21,"Jer proces je otvoren, poznat je, svima onima unutra je poznat, ja sam je."
0:10:21,0:10:24,A šta bi tek bilo u mediji da sam ja dobio ono što sam tražio?
0:10:25,0:10:27,Ja sam tražio da budem bez službe.
0:10:29,0:10:29,Iskreno.
0:10:30,0:10:35,Ja sam tražio da ja budem bez službe subratu zajednici da mogu biti slobodan za njihovu radionalizaciju.
0:10:36,0:10:37,Evo sinoć sam bio župi Vidovec.
0:10:38,0:10:40,"Večeras idem, sutra idem u Lovreć."
0:10:40,0:10:43,To su večernji sat pa mogu ja to žonglirati s ovim poslom.
0:10:43,0:10:45,Ali ja sam htio biti potpuno slobodan.
0:10:45,0:10:46,Šta bi tek rekao?
0:10:46,0:10:46,Da.
0:10:46,0:10:48,A to je ono što sam tražio.
0:10:48,0:10:48,Da sam dobio otkaz.
0:10:48,0:10:58,"Od kada sam tražio da budem freelancer, kako bi rekao, slobodan da mogu putovati kad me zovu seminare, voditi tako."
0:10:58,0:11:01,Jer ja stvarno osjećam taj poziv da budem evangelizator.
0:11:01,0:11:02,Još da me zdravije služi.
0:11:02,0:11:08,Možda jednog dana ću čeznicu za župničkom ili ne znam kojom pozicijom nešto stabilnije.
0:11:08,0:11:15,"Ali ja još uvijek osjećam da mogu putovati, voditi seminare, voditi evangelizacijske susrete."
0:11:15,0:11:18,"I velim, da sam ja dobio ono što sam tražio, ajme, meni šta bi od mene bilo."
0:11:19,0:11:38,"Ali meni je bilo zanimljivo kad si ti postavljen, samo za župnika, toga što si ti, u stvari, negdje sam te slušala, s toliko ljubavi i poštovanja si govorio dok si bio studentski kapelan upravo o župničkoj službi."
0:11:39,0:11:46,"Rekao si ono, nekako mi je drago bilo čut tu jasnu kako ti to vidiš."
0:11:46,0:11:56,"Jer ja to isto tako vidim da su to svećenici koji rade od jutra do navečer, koji rade od krštenja do pogreba, koji imaju užasno puno poslova unutar od jutra."
0:11:56,0:12:04,"Baš si rekao da oni rade od jutra do sutra, neprekidno na raspolaganju, uglavnom često i poslove koje nitko ne vidi, koje svi podrazumijevaju."
0:12:05,0:12:06,I onda si ti posao živ.
0:12:06,0:12:07,Znači što ću reći?
0:12:09,0:12:13,"Ako ću gledati liječnički svijet, vi ste liječnica, pa znate, postoji doktor opće prakse."
0:12:14,0:12:21,Doktor opće prakse skuži da ajme meni karcinom ili šaljete kod onkologa ili ne znam kod nekog drugog specijalista.
0:12:21,0:12:22,Neurologa.
0:12:22,0:12:26,"E, tako u crkvi imamo svećenike opće prakse, to su župnici."
0:12:27,0:12:29,Mi ne bi mogli funkcionirati bez njih.
0:12:29,0:12:34,"Oni rade one poslove ajme meni, svakodnevne poslove koje crkva ne bi mogla funkcionirati."
0:12:34,0:12:36,Onda imamo specijaliste.
0:12:37,0:12:42,"studentske kapelane, bolničke kapelane, vojne kapelane."
0:12:43,0:12:47,To je usko područje gdje neko se nečim bavi i crkva treba i to.
0:12:47,0:12:47,Naravno.
0:12:47,0:12:51,"Samo šta je u medijima i u svijetu, ovo je možda vidljivije."
0:12:51,0:12:51,Zašto?
0:12:51,0:12:55,U Zagrebu imate 150 župnika i jedan ili dva studentska kapelana.
0:12:56,0:12:57,I tako oni iskaču malo.
0:12:58,0:13:02,"Ali a propos župništva, ja sam sad tri godine bio župnik, prvi puta."
0:13:03,0:13:07,"I stvarno, tako mi je drago što sam imao to iskustvo."
0:13:07,0:13:10,"Naime, ja sam stalno bio s mladima, dakle, samo mladi."
0:13:10,0:13:13,"Najviše 26-27 godina, mislim."
0:13:14,0:13:16,"Imao sam jednu sliku crkve, ono samo mladi."
0:13:16,0:13:24,"Sad na jedan put, imam starce koji su nepokretni, pa moram ih obići prvi petak."
0:13:24,0:13:27,"Pa imam ljudi koji umiru u bolnici, pa doma."
0:13:29,0:13:32,Pa imam parove koji traže crkveno razrešenje braka.
0:13:33,0:13:37,"Ja osobno pokrenuo 5-6 takvih slučajeva, pa pričaš s tim ljudima, pa vidiš njihovu patnju."
0:13:38,0:13:47,"S jedne strane ljubav se neka druga dogodila, s druge strane čezu za sakramentima i žele sanirati to, pa vodiš takve ljude."
0:13:48,0:13:57,"Pa vidiš sirotinju, ljudi koji kucaju na vrata za hranu, pa vidiš ljudi koji su bolesni, rak, ne znam što već."
0:13:58,0:14:07,"Pa onda mlade obitelji koji se pripremaju za brak, jedna velika radost, pa dobiju dijete, pa onda ljudi koji ne mogu djecu dobiti, pa tu muku i patiju se."
0:14:08,0:14:09,"Mislim, stvarno..."
0:14:10,0:14:11,"Hle, dakle cijeli presiv."
0:14:12,0:14:17,"Ja kao sunska pela sam samo vidio onaj elan njihov pripremu za život, nešto nerealno."
0:14:18,0:14:20,Nešto što traje 4-5 godina.
0:14:21,0:14:23,"I oni su zamijenjali, a Don Damir je ostao."
0:14:23,0:14:25,"Ja sam otpratio tri generacije studenata, četiri."
0:14:26,0:14:30,Tako da ovo mi je bilo dva iskustva.
0:14:30,0:14:37,"Evo, naišao sam na jedan par koji su izbjeglice iz Subotice, tamo iz kraja Subotice, kad je bio rat."
0:14:38,0:14:41,"I nekako u tome svemu nisu nešto bili u vjeri, nisu bili u braku."
0:14:42,0:14:45,Oni su 55 godina u građanskom braku.
0:14:46,0:14:52,"Kad sam ja malo s njima pričao, oni su jadni se, ne znaju pravila, oni su mislili da je to nemoguće."
0:14:52,0:14:53,Ja sam im rekao pa moguće.
0:14:53,0:14:55,Ja sam kod njih došao doma vjenčati ih.
0:14:56,0:14:57,Pa sam vodio neke mlade.
0:14:58,0:14:59,"Svirali smo tortu, donijeli."
0:15:01,0:15:03,"To je fešta bila u kući, u stanu."
0:15:03,0:15:04,To je jedno iskustvo.
0:15:04,0:15:06,Drugo iskustvo je jedan hrvatski brat u Tigrovima.
0:15:06,0:15:08,"Oprosti samo da ti kažem, ali višto ne znanje."
0:15:09,0:15:11,"Koliko tu ima neznanja, nepoznavanja."
0:15:12,0:15:17,"Oni su možda prije 15 godina se mogli vjenčati, početi živjeti sakramentalno."
0:15:17,0:15:18,Ja sam imantu rekao.
0:15:19,0:15:19,Oni su moj.
0:15:21,0:15:23,"Časti, Tom Davir, mi se možemo vjenčati."
0:15:23,0:15:23,Pa kako ne?
0:15:24,0:15:25,Ja ću vas vjenčati.
0:15:25,0:15:26,"To je bilo, ajme meni."
0:15:27,0:15:29,"Dakle, dvoje ljudi koji žive cijeli život bez."
0:15:29,0:15:32,I on je umro godno i pol dana kasnije.
0:15:32,0:15:34,"To je zaredivno, evo da si imao priliku."
0:15:35,0:15:44,"I još jedan koji je bio u Tigrovima, koji je dobio karcinom i ja sam došao do njega."
0:15:44,0:15:47,"On je na području teritorijalnom svoje županije, županije živi."
0:15:48,0:15:50,"Na ispred nije bio, ajme meni, od rata možda."
0:15:51,0:15:53,Ja sam s njim proveo jedno sat vremena.
0:15:54,0:15:58,Ja ne znam jesam li ja ikad doživio jedno ljepše iskustvo sutra danju umro.
0:15:58,0:15:59,Sutra danju umro.
0:16:00,0:16:05,"Dakle, ja imam osjećaj kad je taj čovjek se pomirio s Bogom, da jednostavno..."
0:16:06,0:16:09,"kao da je dobio jednu slobodu, kao da je rekao, ok, spreman sam."
0:16:09,0:16:10,I on je sutra dan umro.
0:16:11,0:16:14,"On ima dvoje djece, oni su već odrasli., ti mušim studenti."
0:16:15,0:16:19,"Dakle, to su stvari za koje ja kao studentska kapelan nisam znao."
0:16:19,0:16:21,"Znao sam da postoji, ali nisam imao iskustva."
0:16:22,0:16:26,"Dakle, ja sam stvarno sretan što sam to mogao raditi."
0:16:27,0:16:28,"Ali evo, idemo dalje."
0:16:28,0:16:29,Idemo dalje.
0:16:30,0:16:40,"Daj mi reći sada, dakle, u stvari, na neki način je ova tvoja nova služba, dakle, vojnog kapelana slična sa studentskim kapelanom."
0:16:40,0:16:41,"Jel to su isto, na neki način, studenti?"
0:16:42,0:16:44,"Svoj na svome, dakle, donekle bi se vratili svoje."
0:16:46,0:16:49,"Da sam ja planirao ovo, ne bi se dogodilo."
0:16:49,0:16:50,"Dakle, je."
0:16:51,0:16:53,Ja sam vojnik kapelan za Hrvatsko vojno učilište.
0:16:54,0:16:55,To je na Črnomercu.
0:16:55,0:16:57,Franjo Tuđman je na Črnomercu.
0:16:57,0:16:58,Tamo ima nekoliko institucija.
0:16:59,0:17:01,"Moram prizati, još nisam pohvatio sve činove."
0:17:02,0:17:04,Na mojim vratima sam zalijepio sve činove.
0:17:05,0:17:06,Morate znati te stvari.
0:17:08,0:17:12,I tamo ima nekoliko institucija i među ostalim tamo su kadeti.
0:17:12,0:17:20,"To znači, nakon mature, mladić ili djevojka može se prijaviti da bude profesor hrvatski vojnik i oni idu kadetsku školu koja traje pet godina."
0:17:21,0:17:24,"Otprilike ima njih oko 300, 320, 300."
0:17:24,0:17:30,"Evo, ne znam točno brojku, u pet godina, onam tamo je sučasničke škole, ono više granga."
0:17:30,0:17:38,"Kad bi paralelno to gledao sa sveučilištem, sveučilište ima fakultete, poslijeplomski studij, tako i ovo."
0:17:39,0:17:44,"I tamo imaš visoku zapovjednu školu, ljudi dolaze iz cijele Hrvatske i borave jednu akademsku godinu."
0:17:44,0:17:49,"Uglavnom, u svakom trenutku tamo spava, živi oko 500 do 600 ljudi."
0:17:50,0:18:01,"Da ne kažem, djelatnike, od žene koji rade u večeraju u kuhinji do portira, do djelatnika predavači, oko 1200, 300 ljudi svaki dan."
0:18:02,0:18:05,"I Bogu hvala, tamo je jedna fina kapelanija sv."
0:18:05,0:18:09,"Mihajla, ima crkvica, mala kapelica, svaki dan služi mi su tamo."
0:18:10,0:18:16,"Započeo sam vjeronauk za djelatnike, jučer sam imao prvi sat, sad ću započeti sa kadetima u utorkom."
0:18:18,0:18:20,"Dobro, da se malo mi o tome opišite."
0:18:21,0:18:22,Ti kadeti žive u tom domu.
0:18:22,0:18:22,Oni žive.
0:18:22,0:18:24,Oni žive u paviljonima.
0:18:24,0:18:25,Studentski dom.
0:18:25,0:18:26,Studentski dom.
0:18:26,0:18:31,"I sada ti tamo, kad ti kažete da si počeo držati vjeronauk, što to znači?"
0:18:31,0:18:31,Kako to izgleda?
0:18:32,0:18:37,"Oni, dakle jučer sam imao prvi sat za djelatnike, za kadete ću tek krenuti za svi sveti."
0:18:38,0:18:42,"To je slobodno vrijeme, oni su slobodni i za 17 sati."
0:18:43,0:18:46,Tako da ja u večernjim satima ponudim ko želi ko hoće.
0:18:46,0:18:50,"A za djelatnike tako isto, a na kraju radnog vremena ko želi ko hoće."
0:18:51,0:18:53,"Nema naravno tu nikakvog, niti mogu prisiliti koga."
0:18:54,0:18:55,"Mi ti želimo, pa ne."
0:18:56,0:18:56,Nudiš teme.
0:18:57,0:18:59,"Znači, šta si na primjer sa djelatnicima radio?"
0:19:00,0:19:00,O Bogu.
0:19:02,0:19:03,Glavna nagrada.
0:19:03,0:19:04,"Ogromna slova, Bog."
0:19:05,0:19:07,7 plus 1 dokaza da Bog postoji.
0:19:07,0:19:10,"Moraš malo, na vrhu sam stavio breaking news."
0:19:11,0:19:12,Bog.
0:19:12,0:19:15,7 plus 1 dokaza da Bog postoji.
0:19:16,0:19:18,"Dobro, koji si ti dokaze podijelio?"
0:19:19,0:19:24,"To me nedokazane, oni putovi, argumenti iz čežnje, argumenti stvorene stvarnosti."
0:19:24,0:19:25,Zadnji dokaz sam ja.
0:19:26,0:19:29,"Neko slučaj, ako ja postoji ili mora Bog biti, znaš što?"
0:19:30,0:19:32,"Ja sam zadnji dokaz, u biti moje svjedočanstvo."
0:19:32,0:19:38,"Ja sam sedam ovih, ima tu i ti puteva, to maklinsko, to možete stvarno naći, na internetu vidite, to je prekrasno nešto."
0:19:40,0:19:44,"I onda sam na kraju svjedočio, rekao, zadnji dokaz je tvoje svjedočanstvo."
0:19:45,0:19:47,Moje osobno iskustvo Boga.
0:19:47,0:19:49,"Moje iskustvo Boga, ja sam ga."
0:19:49,0:19:52,"Ja ga znam, ja sam ga susreo, moja je."
0:19:52,0:19:53,Ja sam mu život posvetio.
0:19:54,0:19:56,"Ja ga želim podijeliti s drugima, ali drugi su ga i ostavili."
0:19:57,0:20:00,Tamo je bilo od čistačica do zapovjednika.
0:20:00,0:20:04,"Ja sam vidio, bilo je dosta puna dvorana, oko 60-70 ljudi."
0:20:05,0:20:06,I tako idemo dalje.
0:20:07,0:20:25,"Zašto je sada, kad radiš, sada kad ćeš raditi s kadetima, kada ćeš ustvari ljudima dati priliku da koji žive na takav način imaju i prodube svoju vjeru, zašto je to interes, zašto uopće postoje vojni kapelani, zašto je interes vojske?."
0:20:25,0:20:26,Da ima.
0:20:26,0:20:26,Ovako.
0:20:27,0:20:29,"Postoji interes crkve, interes vojske."
0:20:29,0:20:32,"Interes crkve je, da nas crkva želi biti gdje god je narod."
0:20:33,0:20:36,"Neka zlobno može reći, a crkva podržava rat."
0:20:36,0:20:37,To nije istina.
0:20:37,0:20:39,Mi se nalazimo u bolnicima.
0:20:39,0:20:40,To ne znači da mi podržavamo bolest.
0:20:41,0:20:42,Mi se nalazimo u zatvorima.
0:20:42,0:20:44,To ne znači da mi podržavamo kriminal.
0:20:44,0:20:46,Mi se nalazimo tamo gdje su duše.
0:20:46,0:20:49,"U hrvatskoj vojsi, u svakoj vojsi su duše."
0:20:49,0:20:51,Crkva želi biti tamo gdje su duše.
0:20:51,0:20:51,Evo ga.
0:20:52,0:20:55,Od vrtića do palijativne skrbe.
0:20:55,0:20:58,"Evo, gdje god je duša, majka želi tamo biti."
0:20:59,0:21:00,A mi smo majka crkve.
0:21:00,0:21:01,"Nemam ja šta, mislim."
0:21:01,0:21:02,E sada.
0:21:03,0:21:04,Koji interes vojske?
0:21:04,0:21:04,Vojske je...
0:21:05,0:21:12,"To isto postoji, čitao sam, tu ima jako puno iskustava koristiti prisutnosti vojnih kapelana za vojsku."
0:21:12,0:21:26,"Kad uđeš u HVU, to je jedno selo, govorim sada Črnomejerz, tamo imate restoran, tamo imate kafiće, dva, tri kafića, tamo imate čak frizerski salon, tamo imate dom zdravlja i tamo ima crkva."
0:21:26,0:21:30,"Čovjek je kao i jedno malo mjesto, malo da je sjelo, da."
0:21:30,0:21:36,"Čovjek ima potrebu da ispuni sve svoje potrebe, mora ispuniti svoje potrebe."
0:21:37,0:21:43,I svaka normalna država i civilno društvo će shvatiti da jedan od tih dijelova je duhovni život.
0:21:43,0:21:48,"Dakle, mora biti menza, moramo jesti, mora biti neka rekreacija, mora biti tjelovježba."
0:21:50,0:21:51,Ali čovjek ima i dušu.
0:21:51,0:21:58,"Sada, možda će neko reći ja neću vježbati svoju dušu, neko će reći ja neću ići na tjelovježbu, recimo ja bi trebao ići na tjelovježbu."
0:21:58,0:22:00,"Ne idem tako često, ali bi trebao."
0:22:01,0:22:14,Vojska vidi kao i druge institucije u erha da postoji duhovni komponent i njima je u interesu da vjernici zadovoljavajujniji.
0:22:15,0:22:17,I to je najnormalnija stvar.
0:22:18,0:22:20,Kao što vojska će opremiti fitness centar.
0:22:21,0:22:24,Jer vojsci je u interes da ljudi su zdravi.
0:22:25,0:22:26,U svakom pogledu.
0:22:28,0:22:29,I tako za duševne stvari.
0:22:30,0:22:31,Tako da to je taj interes.
0:22:31,0:22:32,Ja sam tamo na raspolaganje.
0:22:33,0:22:34,Svi imaju moj kontakt.
0:22:34,0:22:36,Sad ja sam dijelio malu brošuru.
0:22:36,0:22:37,"Razgovor, ispovjed."
0:22:40,0:22:40,Individualni razgovor.
0:22:41,0:22:41,Ispovjed.
0:22:43,0:22:44,"Bilo što, bilo što."
0:22:44,0:22:46,I tek sam krenuo dva tjedna.
0:22:46,0:22:49,"Još moram vidjeti, hodati se kako to sve izgleda.?"
0:22:50,0:22:58,"Kao da u studentskom centru, u studentskom centru, postoji radio kao što je ne samo neki, tam je bila imenzija, tam je bila ponuda kulture, opatom, kakva je bila, ali bila je."
0:22:59,0:23:11,"Tam je bila ponuda za šport, za razne sekcije, gdje je Sovoljčki centrum to organizirao, i među ostalim, tam je bio Sovoljčki, u odnosu na to, da sam ja, zadnji je drugi, Sovoljčki kapelan."
0:23:12,0:23:14,"I ko želi, neki zvoli."
0:23:15,0:23:16,Meni je to najnormalnije življenje.
0:23:16,0:23:25,"Ani ne, a pogotovo s obzirom na to, da sam čitala neke studije kako u stvari pomažu."
0:23:25,0:23:45,"U stvari pomaganje svim ljudima naravno, ali i vojnicima, iskustva u Sjedinjenim američkim državama i drugim državama, da u stvari kada ti pomažeš čovjeku da bude autentičan u onome što on jest, da ako on sebe smatra katolikom, ako on je katolik, kaže da je katolik, da on bude što autentičniji, da što bolje poznaje svoju vjeru, da živi u skladu sa svom vjerom."
0:23:47,0:23:47,Biće sretnije.
