Start (HH:MM:SS),End (HH:MM:SS),Segment
0:23:47,0:23:57,A naše iskustvo iz rata je u principu da je normu postupanja sustavno u onom cijelom kao su rata crkva neprekidno davala.
0:23:57,0:24:00,Poznata je propovijed kardinala Kuharića.
0:24:02,0:24:13,"gdje si ti u tako teškim okolnostima gdje te ubijaju, muče, siluju, pale, ti imaš nekoga tko ti u tim okolnostima govori, ali ti to nećeš raditi, ti to ne smiješ raditi."
0:24:14,0:24:16,"I to je, mislim, to se ne može dovoljno."
0:24:17,0:24:27,"I koliko je značilo prisutnost studentskog kapelana po tim postrojbama koji su bili negdje iza crte, koji su bili s tim ljudima, moralna podrška, duhovna podrška."
0:24:28,0:24:38,"I taj da ti u svim okolnostima, a najviše onim kad si pod najvećim stresom, najvećim pritiskom, imaš nekoga tko ti govori ovo je granica, ovo je norma., to je samo pomoć."
0:24:39,0:24:46,I vidimo razliku u konačnici u postupanjima jedne vojske i u postupanjima druge vojske i u odnosu crkve prema tome.
0:24:49,0:25:09,"Nedavno sam imala nekakav susret sa nekim studentima pa su mi rekli, u stvari nekoliko njih mi je reklo, to sam i prije čula, kako su im tvoje predavanja o teologiji tijela i način na koji si ti o spolnosti govori, kako si to povezivao sa podukama o vjeri, o svemu."
0:25:09,0:25:13,Jednom si ti bio rekao kako su im potpuno promijenili želje.
0:25:13,0:25:26,"život u smislu da su prestali to doživljavati kao teret, kao zapovjed, kao pritisak, već kako su doživjeli da je nauk crkve u stvari vezan za spolnost i oslobađanje."
0:25:28,0:25:37,"A ti si tam bio rekao da ti možeš održati ne znam koliko predavanja studentima na sve moguće teološke teme, da to nikog ne mediji neće o tome ništa govoriti."
0:25:37,0:25:43,"A kad imaš jedno predavanje o pornografiji, ako se dobro zje, odmah tema, mislim."
0:25:45,0:25:49,"Ja sam, kad gledaš na kraju moga mandata, Mandata u 13."
0:25:49,0:25:55,"godini, ja sam napravio jedno ogromno izvješće i doslovno sam teme iznio od 2007."
0:25:55,0:25:56,koje sam imao do 2020.
0:25:57,0:26:03,"I spolnost, pitanje o spolnosti je možda 10%?"
0:26:04,0:26:05,10%.
0:26:05,0:26:12,"Dakle, govorio sam o blaženstvima, o deset Božjih zapovijedi, o sakramentima, o svjetsima, o svijestima."
0:26:13,0:26:18,"Naravno, kad govoriš o spolnosti, 10 do 15% svih mojih tema su bili spolnosna."
0:26:18,0:26:20,Pa zašto je on tako opterećen?
0:26:21,0:26:31,"Ne, ja sam govorio o relikvvijama, o svecima, o molitvi, ja sam tumačio o čenaš, ogromni ciklusi, no ovo zanima svijet."
0:26:32,0:26:33,"Ovo svijet, tako je."
0:26:33,0:26:34,"Oni skoče na to, jel."
0:26:35,0:26:37,"I naravno, osluškujem ljude."
0:26:37,0:26:43,"I ja da sam možda više slušao studente, ja sam uvijek ankete, oni su uvijek tražili temu spolnosti."
0:26:43,0:26:44,Uvijek.
0:26:44,0:26:49,"Ali ja sam znao da moram im dati ne toliko što žele, nego ono što moraju čuti."
0:26:50,0:26:54,"Pa sam dao ispolnost, ali sam dao tako, ja sam smatrao u jednom trenutku oni moraju znati šta je ehoistija."
0:26:54,0:26:59,Pa smo imali ogroman jedan ciklus od 12 predavanja o sakramentima ehoistije.
0:26:59,0:27:00,I je možda...
0:27:00,0:27:14,"možda malo manje brojka padne, ali su brojke bile ogromne, ali jest, ovo su bombastične teme koje svakoga, jer to je tako intimno, to tako pogađa svakog čovjeka, ali treba integralno o svemu pričati."
0:27:14,0:27:25,"Ali u konačnici ovo što si rekao, ako čovjek ne razumije, a onda i ne osjeća euharistiju, onda u stvari provedba svega onoga druga o čemu razgovaramo teško može ići."
0:27:25,0:27:27,A nas ponos je samo jedan posutak toga svega.
0:27:28,0:27:37,Ali jedna tema koja je i danas često aktualna među mladima je taj zajednički život prije braka.
0:27:37,0:27:39,Kohabitacija.
0:27:39,0:27:56,"I to je jedna, imam dojam da u stvari tu sad postoji da je došlo do jednog ulaza različitih pogrešnih tumačenja važnosti toga da mladi ljudi kroz ženitbeni sakrament, oni koji su vjernici kroz ženitbeni sakrament počnemo zajedno živjeti, a ne prije."
0:27:57,0:28:00,"A nekako kao da je to bez veze, pa to je samo forma."
0:28:01,0:28:04,"Je, ovako, ja sam isto tu doživio jednu evoluciju."
0:28:05,0:28:09,"Kad sam postao svećenik, ja apsolutno nisam tu temu dirao."
0:28:10,0:28:13,"Dakle, ja nisam kao mladi svećenik imao argument."
0:28:14,0:28:24,"Ako dvoje mladi se vole, žene se za šest mjeseci, bolje sad saznati i bolje se upoznati nego kasnije, pa ajmo živjeti zajedno, jer to je ta logika."
0:28:25,0:28:26,"Što je dobro namjerno, zapravo."
0:28:27,0:28:28,"Da, pa naravno da."
0:28:28,0:28:32,Daleko od toga da ja uperem prst u nekoga.
0:28:32,0:28:37,"Stvarno ti mladi imaju dobru namjeru, kao ejdemo sad živjeti zajedno šest sedam mjeseci, godinu dana."
0:28:37,0:28:49,I idemo vidjeti jesmo li mi zato jer ne želimo kasnije doći do razvoda i to je stvarno dobro namjerno i ja sam to pre prošlutio.
0:28:50,0:28:51,Ja sam to vidio kao mladi kapelan.
0:28:52,0:28:53,No šta sam onda primijetio?
0:28:54,0:29:01,"Jedan nakon par godina svećenstva dolaze ljudi, nakon 2, 3, 4, 5, 6, 7, 10 godina braka i razvod."
0:29:02,0:29:15,"A najproblematičnije mi je bilo kad neko dođe nakon godinu dana i malo i kreneš proces s njima, pričaš i s njom i s njim, pokušavaš sanirati, ne ide pa traže crkveno poništenje, pa dođe do ti nužni pitanja kako su živjeli."
0:29:16,0:29:22,Ja sam primijetio nešto da baš oni koji su živjeli zajedno prije braka završavaju razvod.
0:29:22,0:29:25,To je meni bilo kako se kaže na engleskom wake up call.
0:29:26,0:29:27,Poziv na budženje.
0:29:27,0:29:27,"Što je ovo, čujte?"
0:29:28,0:29:29,Kako je ovo sad moguće?
0:29:30,0:29:34,A suprotno tome sam vidio parove koji tak nisu živjeli.
0:29:34,0:29:37,"Koji su živjeli ono što crkva govori, u čistoći odvojeno."
0:29:38,0:29:39,I oni ostaju u braku.
0:29:39,0:29:40,"Sada, jedan disclaimer."
0:29:41,0:29:46,Ja ne govorim niti tvrdim da svatko koji živi zajedno prije braka će završiti u razvoju.
0:29:46,0:29:47,Niti svatko koji živi u čistoći.
0:29:48,0:29:52,"Da će ostati u lijepom i sretnom braku do kraja života, naravno."
0:29:52,0:29:55,"Ali govoriš o svom iskustvu, o svom ograničenom iskustvu."
0:29:56,0:30:01,Ja govorim o mom iskustvu 21 godina svjećanja koje mene ne može tu nitko pobijati zato što sam to doživio.
0:30:01,0:30:05,I koja je u konačnici te potaknula da prejestiš svoje srce.
0:30:05,0:30:06,Na što treba stavljati naglasak?
0:30:07,0:30:09,"Onda sam ja u srčnom krugu, i tečajki, ste vi ovo primijetili?"
0:30:10,0:30:11,Zašto mi šutimo o ovome?
0:30:12,0:30:12,"E, ali."
0:30:14,0:30:14,"Oprostite, ne pregrijem."
0:30:15,0:30:15,Je li u stvari samo da.
0:30:16,0:30:22,"Dakle, poanta za jedan dobar dio ljudi koji je ovo što si rekao, mladih koji idu živjeti zajedno prije nego svi."
0:30:23,0:30:24,Poanta je u probi.
0:30:24,0:30:25,To je kao brak na probu.
0:30:26,0:30:27,Da mi vidimo da li svi mi pašemo.
0:30:28,0:30:32,"I onda oni kao obave probu, a onda se pokaže da ta proba nije došla do toga."
0:30:32,0:30:34,Nego što je se dogodilo?
0:30:35,0:30:40,"Ja sam vidio da nakon Nakon sedam mjeseci, godinu dana braka, razvod."
0:30:41,0:30:49,"Čak sam primijetio korelaciju što su više živjeli zajedno, četiri, pet, šest, sedam godina, nakon pet, šest, sedam mjeseci braka, razvod."
0:30:50,0:30:51,Šta je ovo?
0:30:51,0:30:59,"Mislim, upravo se događa ono što su htjeli spriječiti s ovim i jedan par, pa drugi par, pa treći par, pa četvrti par."
0:30:59,0:31:06,"I onda sam dobio hladan tuš kad sam bio prije Washington, naime, ja sam poslasoćen 2002."
0:31:06,0:31:08,išao sam na studiju 2007.
0:31:08,0:31:09,I šta je se dogodilo?
0:31:10,0:31:11,Ovo je bilo provjedonosno.
0:31:12,0:31:15,"Ako se sjećate Luke Rađe, koji je nastradao, nažalost."
0:31:16,0:31:20,Tad je on bio glavna faca svećenika u Zagrebu.
0:31:20,0:31:22,"Je, je u samom osjećaju."
0:31:24,0:31:26,Luka je bio svima nama mladim svećenicima neki ideal.
0:31:27,0:31:29,Ja sam znao kao mladi svećenik ići njemu slušati.
0:31:30,0:31:32,I on je nastradao.
0:31:33,0:31:34,Završio je u koliciji.
0:31:34,0:31:34,Tako je.
0:31:34,0:31:42,"I onda, ajde, kako su došli do mene, ja sam tek bio mladi kapelan da ja dođem i malo o tome pričam."
0:31:42,0:31:46,"Sad ja sam već znao za teologiju tijela, ali nisam znao detalje sve."
0:31:47,0:31:49,Bio sam na jednom susretu u Skatsu.
0:31:49,0:31:52,"Sutra tu s kad su, kao Luka, ne, Luka je ne."
0:31:53,0:31:56,"Jednom su mene zvali, ja se sjećam, Pater volenik me zvao."
0:31:58,0:32:01,I tada sam ja sa rukavicama o tome pričao.
0:32:01,0:32:03,Nekom je otvoreno pitao o tome.
0:32:04,0:32:07,"Jedna studentica, pazi, ovo je bilo dvije treće."
0:32:08,0:32:09,"Ona mene pita otvoreno, javno."
0:32:11,0:32:18,"Šta vi mislite, donda mi je rekla: kad jedan par želi živjeti zajedno, ja sam bio tako nejasan."
0:32:19,0:32:25,"Ja nisam htio s jedne strane ići protiv crkve, ali nisam imao snage."
0:32:25,0:32:26,to obraniti javno.
0:32:27,0:32:27,Jer nisi sam.
0:32:29,0:32:31,"To nisam razumio, nisam to prožvakovao dovoljno."
0:32:31,0:32:35,"Ja nisam imao hrabrost nekome reći: ne smijete živjeti zajedno, nemojte to raditi."
0:32:35,0:32:39,"A on je rekao: dobro, namjerno mi želimo, zar nije bolje prije nego prije?"
0:32:39,0:32:41,Odkrij da si ne pašemo prije nego putem.
0:32:41,0:32:45,"Ja sam prešutio na aukcije, nisam govorio protiv crkve, ali sam prešuti."
0:32:48,0:32:54,"I tada jedna druga cura se digla i rekla: srama zbilo, pred svima, meni."
0:32:59,0:33:01,To nisam nikad spasio od njih.
0:33:01,0:33:04,Ovo je ekskluziva.
0:33:05,0:33:15,"Ona je rekla kako vi kao svećenika, katolički svećenik, ovdje pred svim mladima ste prešutili nešto tako važno, ona vajdaj, ja ne znam tko je to bio."
0:33:15,0:33:18,Ja bih volio sad njoj se zahvaliti što me prozvala.
0:33:20,0:33:21,"Dakle, prozvala me."
0:33:22,0:33:23,Nešto sam govorio protiv sebe.
0:33:23,0:33:25,Ja sam prešutio samo.
0:33:26,0:33:30,Ti si to dao neki neutralni odgovor bez bez obzira na to.
0:33:31,0:33:32,Da se ljudima sviđim.
0:33:32,0:33:33,Samo da se sviđim ljudima.
0:33:34,0:33:36,Mene hladan znoj oblio.
0:33:37,0:33:41,Ona ti je rekla da kako možeš ti prešutiti katoličku crkvu?
0:33:41,0:33:42,"Znači, ne govorite jasno?"
0:33:44,0:33:45,Ja sam i to jedna studentica.
0:33:46,0:33:48,"Ja sam išao doma, ja sam pao u takvoj krizi."
0:33:51,0:33:58,"Ja sam nakon toga išao na studiju i to je brudilo u mene, ja sam se bacio u to."
0:33:59,0:34:01,Kad je Donald Dummers vratio u 2007.
0:34:01,0:34:02,Ne možeš više.
0:34:04,0:34:05,"Ajmo sad do te teme, zašto?"
0:34:07,0:34:08,Ovo je moje iskustvo.
0:34:10,0:34:16,"Nitko ne ide iz neke zle volje to čini, dapače namjerna jako dobra."
0:34:17,0:34:24,"I da se razumijem, ja to imam u mojoj rodbini, ja to vidim, mislim svi to rade, mnošto to čini dobro namjerno."
0:34:25,0:34:27,"Uzmimo da je dobro namjerno, gdje je problem?"
0:34:30,0:34:33,Problem je što djevojke ne razumiju kako mozak muški funkcionira.
0:34:34,0:34:42,"Mi muškarci, mi smo kavijeri, mi smo lovci, svaki muškarac voli se udvara djevojci itd."
0:34:42,0:34:43,i on lovi.
0:34:44,0:34:48,"I ako on, na posljednjoj razini, ja sam dugo o ovome razmišljao, ako on..."
0:34:48,0:34:56,"Ako on ulazi u neki brak i on pet šest mjeseci prije ide s njom živiti, i on je lovac, kakav će on biti u tih pet mjeseci?"
0:34:56,0:34:58,"Naj, naj, naj, sve suprelative."
0:34:59,0:34:59,Zašto?
0:35:00,0:35:01,Jer zna da je na probi.
0:35:02,0:35:03,I ova se oduševi.
0:35:04,0:35:06,"Ovaj me meni, on meni donosi doručak u krevet."
0:35:07,0:35:08,Pa on je tako uredan.
0:35:09,0:35:09,On je.
0:35:12,0:35:12,Zašto?
0:35:12,0:35:14,Jer on ju lovi i on zna da ona to očekuje.
0:35:15,0:35:19,"I onda nakon šest mjeseci oni ulaze u brak i on je ulovio, oženio se i šta se dogodi?"
0:35:22,0:35:22,Stvarnost.
0:35:22,0:35:25,"E sada, u čemu je problem?"
0:35:26,0:35:38,"Ona je stvarala jednu sliku koja nije bila najrealnija, i gradila sve na tome, ušla u brak i vidjela da to baš nije tako, on se tamo samo tako predstavi."
0:35:38,0:35:42,"On čak nije lagonamjerno, nego je muškarac bio, tipičan muškarac, lovio je."
0:35:42,0:35:44,"E sada, koji razlika ako nisu živjeli?"
0:35:49,0:35:56,"Ona bi ušla bez ikakve slike, takve slike bar, i ona bi ga prihvatila u zdravlju i bolesti, u dobru i u zlu."
0:35:57,0:36:00,Prije braka on se predstavljao samo u dobru.
0:36:00,0:36:06,"Samo u dobro, u najboljem i onda ona opravdano pita pa dobro šta je sad ovo."
0:36:07,0:36:14,"OK, ja se ugrađujem oko ove teorije, ja sam dugo o tome razmišljao i to je zaključak koji sam ja došao."
0:36:14,0:36:18,"Ja razumijem, pojednostavio si, ali si nam sad rekao kako ti to ide."
0:36:19,0:36:32,Jer kako objasniti da nakon kohapitacije par godina da baš ti parovi završe nakon nekoliko mjeseci što sam ja imao u moje pastoralne iskustvo i kao župnik i kao studentski par da sam to vidio u mojim očima?
0:36:33,0:36:33,Da.
0:36:34,0:36:34,I zato.
0:36:35,0:36:36,"Dakle, to je jedna razina."
0:36:36,0:36:36,razine.
0:36:37,0:36:48,"Dakle, razina toga da ustvari onima koji žele da im to pomogne, da bolje, da se pripreme ustvari za jedan dugi zajednički lijepi život, ok."
0:36:49,0:36:50,A druga stvar je nauk crkve.
0:36:50,0:36:54,"Dakle, ovo je iskustvo zašto to plodova?"
0:36:54,0:36:56,"A kako je, zašto crkva toliko?"
0:36:56,0:37:04,"Zašto u nauku crkve stoji da ljudi ne žive zajedno već da se trebaju, da je ono što se kaže u medijima seks samo u braku?"
0:37:05,0:37:14,"Ja bih ovdje jednu razliku radio, jer stvarno postoji jedna razina gdje ako su neke situacije gdje netko živi ispod istog krova, a žive kao brati sestra."
0:37:16,0:37:28,"Ja to nikome ne preporučujem, ali ako ćemo gledati usko, to nije grijeh, da su odvojeni zbog nekih financijskih, ekonomskih razloga itd."
0:37:30,0:37:37,"Tako da jako je važno gledateljima to znati, da oni mogu se pričestiti, jako na jednoj razini čak možda rade javni sablas."
0:37:37,0:37:49,"Ali nisam razumio, dakle naprimjer imaš, aha, imaš dečke i curu koji žive u istom stanu, ne žive zajedno, nemaju seksualna odnosa, žive zajedno kao brati sestra, ali žive zajedno zato jer im je to praktičnije ili iz nekog drugog razlogaoga."
0:37:49,0:37:51,Iz nekog nužnog razloga.
0:37:52,0:37:53,Stanarina bi bila skupa.
0:37:54,0:37:55,Moramo razumjeti ljude.
0:37:56,0:38:05,"Ja sam pratio takve ljude, ljudi me upozoru kad dođu nekada na ispite na razgovore, od časa samo da znate, živim ja svojim momkom, ali mi živimo sa čvrstom odlukom da ćemo živiti u čistoći."
0:38:06,0:38:06,Takva je situacija.
0:38:07,0:38:18,"Naravno da nije to idealno, ja to nikome ne preporučujem, ali postoje neke situacije gdje se to dogodi i ok, ajde, idemo i kapa dolje, svakati čas što tako proročuješ živiš."
0:38:19,0:38:19,Svakati čas.
0:38:20,0:38:21,"Ok, vratimo se na ukup crkve."
0:38:22,0:38:23,Crkva.
0:38:25,0:38:30,"Znate, kad je nešto vrijedno, mi želimo to čuvati."
0:38:30,0:38:35,I mnogi ljudi smatraju da crkva zabranjuje uvijek nešto na području spolnosti.
0:38:35,0:38:36,I je to istina.
0:38:36,0:38:39,"Mi imamo puno, puno zabrana na području spolnosti."
0:38:39,0:38:43,Ali iza svake zabrane i za svake ne postoji jedan veliki da.
0:38:44,0:38:47,I to je veliki da je taj odnos između muža i žene.
0:38:47,0:39:00,"Crkva smatra da je spolnost tako sveta da bi ona trebala biti samo između muža i žene i samo u službi ljubavi, dakle izraz ljubavi i otvornost prema životu."
0:39:00,0:39:06,I zato imamo situacije starije osobe koje ne mogu imati djecu više ili sterilne osobe iz nekog fiziološkog razloga.
0:39:06,0:39:13,"I naravno, oni su u sebi posebi, su otvoreni prema životu, njihova fiziologija to ne dopušta i vole se."
0:39:13,0:39:18,I naravno da taj bračni spolni činjenje je svet i dobar i koristan itd.
0:39:20,0:39:34,"crkva smatra i vjeruje da kad se mi potpuno predajemo, mi imamo dušu i kad se mi potpuno predajemo, onda nam tjelesno darivanje mora biti slika ono što smo duševno dali, a to je da se potpuno tjelesno dajemo."
0:39:35,0:39:52,"Dobra je slika kad pozoveš nekog građovinara i šta bi bilo kad bi neko rekao, e, ne znam koliko će ovo košati, ali ajde, daj potpis na ček, to se zove blank check, ja ću ispuniti tvoje očekivanja, ja ću ispuniti svoje, ja ću to niko napraviti."
0:39:52,0:39:57,"Ja kažem djevojkama, nemojte dati momku blank check, ne mojte mu sve dati."
0:39:57,0:39:58,"Bijanko ček, da."
0:40:01,0:40:20,"Dakle, to predanje i tijelo i to dio spolnosti ćeš predati kad možete jednim drugima reći volim te potpuno, trajno i evo javno to obznanjujem, jedan pravni akt, evo sada potpuno se predajem."
0:40:20,0:40:35,"I zato u crkvi kad kod altara se predaju i oni postru muži žena, tek onda oni daju jedan tjelesni pečat tom duhovnom dokumentu koji su sastavili pred Bogom, pred altarom."
0:40:35,0:40:36,"Evo ja, to je slika druga."
0:40:37,0:40:40,"Dakle, nećeš nikad potpis staviti ili žig na prazan dokument."
0:40:41,0:40:48,"Dokument se ispunjava riječima pred altarom i onda ajmo sad staviti tjelesni pečat na to, konzumacija."
0:40:49,0:41:05,"I iz tog razloga, evo, jer brak, odnosno spolus je tako svetak koji prenosi život, da to pripada osobama koji su se potpuno predali i koji su dali to obećanje da će trajno živjeti i tek onda mogu svoje tijela predati jednim drugima."
0:41:05,0:41:19,"I u principu, psihološki gledano, odnos, ako je cilj izgraditi dubok odnos, trajni odnos, nepovršan odnos sa nekim, ima toliko tih koraka koje se treba napraviti."
0:41:20,0:41:23,"Ja volim bejsball, mislim, volim bejsball, prije sam gledao bejsball."
0:41:24,0:41:25,Kad gledaš bejsball.
0:41:25,0:41:27,"Kad ležeš baseball, ima puno pravila."
0:41:28,0:41:43,"I kad ja, Hrvata, u Torontu, tu mi stric došao, uvijek je atrakcija ići u toronski, taj skaj dom, takozvan, prvi stadion gdje krov se miče, otvara, zatvara 60-70 tisuća ljudi i prvi pol sata je zanimljiv."
0:41:43,0:41:45,"Onaj tipičan Hrvat, pita koliko će ovo trajati."
0:41:46,0:41:47,"Da kaže oko 3,5 sata."
0:41:48,0:41:53,"Ima pravila i ko ne zna pravila baseball, ne zna što se događa."
0:41:53,0:41:58,"Međutim, kad ti shvatiš pravila baseball, on postaje zanimljiv zbog pravila."
0:41:59,0:42:01,"I tako, kad neko vidi na uč crkve, oko spolnosti."
0:42:02,0:42:04,"Toliko pravila, no ajmo meni."
0:42:04,0:42:12,"Međutim, ako vidiš samu vrijednost toga, vidjet ćeš šta ti pravili, ti okviri su tu upravo zato što je to tako vrijedno."
0:42:12,0:42:14,"Šta ukvirujemo inače, vrijedne slike?"
0:42:15,0:42:19,"Ako vidiš u Luvru, ne samo da je."
0:42:19,0:42:21,"Okvir oko Mona Lisa, ne može biti blizu Mona Lisa."
0:42:22,0:42:23,Zašto je to tako?
0:42:23,0:42:26,Zato što to umjetničko djelo Mona Lisa je vrijedna.
0:42:27,0:42:31,"Pa smo stavili zašto kod nje, pa smo stavili neki okvir, pa smo stavili čak zaštitari koji to čuvaju."
0:42:32,0:42:33,Šta je najvrjednije?
0:42:34,0:42:35,Pa ljudska osoba.
0:42:35,0:42:36,"Ljudsko biće, tako."
0:42:36,0:42:37,I šta?
0:42:37,0:42:38,I idemo dalje.
0:42:39,0:42:42,"Ako je ljudsko biće vrijedno, način kako se prenosi ljudsko biće..."
0:42:43,0:42:44,Od kud dolazi ili svijet?
0:42:44,0:42:49,"Zato crkva, majka crkva, ponavljam, ima potrebu staviti jedan debeli okvir oko toga."
0:42:49,0:42:50,Jer je tako vrijedno.
0:42:51,0:42:57,"Nasuprot tome, pornografska kultura, šta pornografska kultura govori?"
0:42:57,0:42:59,"Evo, radite što hoćete."
0:42:59,0:43:04,"Sad, ja se pitam, tko više vrijednije tijelo i spolnost?"
0:43:04,0:43:06,Pornografska kultura ili ovo?
0:43:07,0:43:12,"Hugh Hefner, koji je bio osnivač suvremene pornografske industrije 50-ih godina, on je..."
0:43:13,0:43:24,"Otac mu je bio pentekostalac, evangelik, pastor, koji je jednom, kad je imao 11-12 godina, vidio plakte su, ono, dječak, proljave."
0:43:24,0:43:33,On ga je zavezao za stolicom i nemilosrdno ga matio tuko sa Reme da istjera džavla iz njega.
0:43:34,0:43:42,"Mali Hugh Hefner je pobjegao doma, ušao u američku vojsku i onda u svom rokovniku, znaš šta je napisao?"
0:43:43,0:43:48,"Ja ću svijetu dokazati da je spolnost i tijelo, da su oni dobro."
0:43:49,0:43:53,"E sada, gdje je problem nastao?"
0:43:54,0:44:00,"Gdje on spolnost i tijelo nije samo dobro, nije samo vrlo dobro, nego je sveto."
0:44:00,0:44:02,I on je izostavio sveto.
0:44:04,0:44:07,Zbog iskrivljene slike svete i svete.
0:44:07,0:44:12,"Ja čak mislim da on je dubinski negdje imao možda dobru namjeru, ali je totalno išlo krivo."
0:44:13,0:44:34,"Na drugom kontinentu u isto vrijeme, i to nije slučajno, još jedan mladić je doživljavao sve horore, a on se zove Karovoj Tiva, koji je izgubio i mamu, i tatu, i brata, i svakako ga je vidio kako ubijaju profesore njegove i studente, kolege, pa je bio nacizam, pa je komunizam, pa je iz jednog zatvora njegova zemlja završila u drugom zatvoru sovjetskog, komunističkog."
0:44:35,0:44:42,On je isto u jednom trenutku kao mladi filozof rekao ja ću svijetu dokazati da je ljudski život svet.
0:44:43,0:44:46,Meni je zanimljivo da oni su suvremenici u isto vrijeme.
0:44:47,0:44:53,"I ovaj govori da je tijelo i spolnost dobar, samo dobro, a ovaj govori da je sveto."
0:44:55,0:44:56,I vidimo koji su plodovi.
0:44:57,0:45:00,"Ako samo gledamo, ja sam to analizirao, žrtve pornografske kulture."
0:45:01,0:45:04,"U prosječnu dob kad umiru, predoziranje, samoubojstvo, nasilje."
0:45:04,0:45:05,To je strah.
0:45:05,0:45:05,A oni.
0:45:06,0:45:09,Kromiče cijela industrija koja zarađuje na tim ljudima.
0:45:10,0:45:12,Kromiče da je to dobro.
0:45:13,0:45:14,"E, samo gleda plodove."
0:45:14,0:45:15,I svi šute o tome.
0:45:15,0:45:20,"U Kanadi su, svim se prošle godine, tri, četiri porno zvijese okrutno ubijene."
0:45:20,0:45:22,Nitko o tome ne priča.
0:45:22,0:45:24,Gdje su tu feminističke udruge?
0:45:24,0:45:27,Gdje su tu ove NGO-e koji bi trebali stati?
0:45:28,0:45:28,Ne.
0:45:29,0:45:29,Što je?
0:45:29,0:45:36,"Jer ako priznaju da je temelj te industrije eksploatacija, iskorištavanje žena."
0:45:36,0:45:40,"Žena, prvenstveno, a onda i muž, a onda sve pada u vodenu."
0:45:40,0:45:42,"Usput rečeno, oni to prikazuju kao oslobođenje."
0:45:42,0:45:45,Od svih mojih tema koje sam ja imao od 2007.
0:45:45,0:45:46,do 2020.
0:45:46,0:45:59,"i od svemu što sam pričao, neke teme stvarno izaziva svijet i mediji, ali nikada, nikada nisam dobivao tako strašne, mračne poruke i prijetnje kao za pornografiju."
0:45:59,0:46:05,"Čak više nego kad sam govorio o Bortusu, je ono je bilo jezivo vidjeti."
0:46:05,0:46:09,"Dakle, neke obskurne, anonimne Facebook stranice, poruke."
0:46:12,0:46:15,"Ja sam tad shvatio šta je taj svijet, koliko je mračan."
0:46:16,0:46:17,Kakve sam ja poruke dobivao?
0:46:18,0:46:20,Povezan sa trgovinom djecom i to prijetnjom.
0:46:20,0:46:21,"Trgovinom ženama, drogom."
0:46:22,0:46:24,To je podzemlje.
0:46:25,0:46:30,"Podzemlje koje ti netko pokušava isfurat kao kul, kao da je to za nekoga dobro."
0:46:31,0:46:33,"Užas, užas, užas."
0:46:35,0:46:37,Ja sam samo to uzela kao jedan od mojih tema.
0:46:38,0:46:49,"Idemo dalje, ja sam te godine govorio o Fatimi, o Gospi i među ostalom i to zbog silnih poruka koje sam dobivao i želje za radom od momaka i problema djevojke."
0:46:49,0:46:53,"koji imaju momke pa sam vidio ovo je gorući problem, ajmo vidjeti šta možemo napraviti."
0:46:53,0:46:58,"I dvije teme, ajme meni, koji su to bili pred i da ne kažem tjedan dana u medij što smo vukli."
0:47:00,0:47:04,"Željeli su da prestanemo o tome govoriti, da, strašno nešto, strašno."
0:47:05,0:47:13,"Dakle onda o tome treba govoriti, treba o tom zlu govoriti i treba, mi želimo da ljudi budu slobodni, a ne da budu zarobljeni."
0:47:14,0:47:25,"Osim ovih stvari koje radi, koje smo pričali malo organizaciji sa Lezijanaca, kako to funkcionira sa novim službama, vi imate izdavačku kućuću."
0:47:25,0:47:26,Salezijanu.
0:47:26,0:47:29,I ovo je knjiga koja je objavljena neki dan.
0:47:29,0:47:30,"Nedavno, je."
0:47:30,0:47:31,"Da, neki dan."
0:47:31,0:47:34,"U gradu su čak stavljeni, dakle, Matt Walsh, što je žena?"
0:47:35,0:47:41,"On je napravio nepoznati dokumentarac, kroz koji postavlja pitanje što je žena."
0:47:42,0:47:43,Najobičnije pitanje.
0:47:44,0:47:47,Je čovjek otvorio Pandorinu kuhinju.
0:47:48,0:47:51,"Kutiju, pardon, ne kuhinju, ali i kuhinja bi dobio dobar izraz."
0:47:52,0:48:01,"I ustvario je razotkrio da ti imaš tonu ljudi koja neće reći, ne zna reći, ne želi reći što je žena, tko je to, tko je ž to?"
0:48:01,0:48:01,Tko je žena?
0:48:01,0:48:02,Što je žena?
0:48:03,0:48:18,"I ova knjiga, u stvari njegova, već na samom početku je doživjela zanimljiv prijem jer su veliki jumbo plakati koji su u Zagrebu postavljeni, neki od njih su prešarani."
0:48:19,0:48:21,"Da, čuo sam, vidio sam."
0:48:21,0:48:23,"Zašto, u čemu je reakcija?"
0:48:23,0:48:31,"Pa, podsjeća me na, ako se sjećate kad je bilo raspravo o spolnom odgoju u Hrvatskoj?"
0:48:31,0:48:33,"Da, kako je, 2012."
0:48:34,0:48:35,"godine, godinu dana prije referenduma."
0:48:35,0:48:41,"Da, ja sam dosta obilazio u Hrvatskojsku tada i sjećam se kad sam bio u Koprivnici ili Virovici, ne znam točno gdje je, negdje na sjeveru."
