Start (HH:MM:SS),End (HH:MM:SS),Segment
0:38:35,0:39:02,"Ima, na primjer, jedna od tako zanimljivih stvari, mi imamo za neke gene, geni su oni, možemo reći, dijelovi naše genoma koji kodiraju proteine, mi od nekih gena imamo više kopija koje su korisne i imamo nekoliko, recimo to tako, loših kopija."
0:39:05,0:39:10,"Koliko ja znam i koliko sam pročitao, ljudi koji se time bave, ničemu ne služe."
0:39:11,0:39:15,"Ok, sve je ok, da ćemo imati nekoliko funkcionirajućih kopija."
0:39:16,0:39:23,"Sada, naravno, te loše kopije se prenose našem djeci."
0:39:25,0:39:33,"Dakle, u određenom trenutku u stvaranju te kopije ili se nešto pokvarilo i to je ostalo."
0:39:33,0:39:37,"Sada je zanimljivo da mi sa, naprimjer, nekim drugim."
0:39:37,0:39:48,"drugim živim bićima nemamo samo iste gene na istom mjestu, nego imamo i te loše kopije na istom mjestu."
0:39:50,0:40:03,"To je jedna od brojnih stvari koje govorite da je teško osporiti, mislim danas da smo mi nekako u rodu, što se tiče naše biologije, što mislim da crkva prihvaća."
0:40:03,0:40:23,"Uz put, jako je zanimljivo, mislim spomenuto, možda brojni ne znaju, da crkva nije nikad rekla da je teorija evolucije se suprostavlja katoličkoj vjeri."
0:40:27,0:41:17,"I što se tiče čovjeka također, ne samo to, nego to je bio dvanaest i u ociklici humani generi, ako se dobro osjećam, negdje jedna tisuća devetsto pedeset ili tamo tamo negdje piše da čovjek je prihvatljivo za katolika prihvatiti da u svojoj biologiji čovjek, nemam sad više točan citat u glavi, je povezan ili također sa drugim živim bićima ili proizlazi iz evolucije, sad ne sjećam se točno izraza, ali u svakom slučaju to je, da smo tu, s jednim nikakvim problemom."
0:41:17,0:41:17,O.
0:41:18,0:41:18,K.
0:41:18,0:41:20,Sada po biologiji je vrlo jasno.
0:41:20,0:41:28,"Međutim, u povijesti se sad, jel sve što jesmo objašnimo biologijom?"
0:41:30,0:41:48,"Meni se čini vrlo jasno, eto, više od toga da nismo baš, ne možemo baš mehanistički objasniti što je svijest, da postoji jedan korak koji nije samo kvantitativan nego je stvarno kvalitetan između čovjeka i pogotovo naše svijesti i razuma i svih ostalih bića."
0:41:48,0:41:57,"I da tu vjerojatno, ne mislim da je tu negdje jedan input iz vana."
0:41:57,0:42:12,"I u toj enciklici koju sam citirao, piju od 12, kaže s druge strane: Jasno je za katolike da je Bog direktno stvarao dušu, duhovnu stvarnost u čovjeku."
0:42:13,0:42:22,"Kad se duša pojavljuje, točno mi za ne znamo, ne znamo hoćemo ikad znati prije sudnog dana."
0:42:32,0:42:54,"cijeli rasponu tih raznih ranijih oblika čovjeka, jesu ovi stvarno bili ljudi, koji je, koji nije, mislim da nije jasno, barem ja ne bi mogo reći, ali u određenom trenutku postaje čovjek."
0:42:56,0:43:04,"Sad, što si pitao, jeli su svi ljudi danas proizlaze iz istog para?"
0:43:06,0:43:26,"Po tim genetskim studijama koje su se radile, čini mi se je zaključak da je vjerojatno jako mala grupa, ali da izgleda jako malo vjerojatno da se sada je samo jedan par."
0:43:27,0:43:30,Je li to za vjernike protivno vjerovanje?
0:43:33,0:43:35,Rekao bi da ne nužno.
0:43:35,0:44:00,"Mislim ono što je za nas, to što ne znamo u kojem trenutku bi se označilo među ostalim među svojim Recimo, mi imamo vjerojatno, ako je sve to točno, da u određenom trenutku ljudi koji nisu bili ljudi, u određenom trenutku toj genealogiji ulazi duša, da li duša ulazi samo jednom paru, da li ulazi maloj grupi, ne znam."
0:44:03,0:44:22,"Mislim da je to otvoreno pitanje, pitanje je naravno prenosa istočnog grijeha, je za nas bitno, da je to tu i to je vjerska istina koju ne osporavam, to na koji način, mislim, pošteno odgovore da ne znam."
0:44:23,0:44:45,"Dobro, evo, sad kao znanstveni gledajući uopće i ovaj područje kojim se ti baviš i cijelokupni svijet, da li možemo iz sve te kompleksnosti i savršenosti zaključivati na postanje Boga ili ipak nije dovoljno, ili ipak sama materija, sama ta savršenost nije dovoljna da bismo zaključili na Božje postanje."
0:44:45,0:44:46,Što bi ti rekao?
0:44:48,0:44:55,Mislim da treba jedno razmišljanje koje sad izlazi iz tog pristupa prirodnih znanosti.
0:44:56,0:45:20,"I sad, kad gledamo koji je pogled na svijet koji ja kao znanstvenik razvijam, jedan pogled na svijet koji je duboko razuman, što nije nužno bilo očito svima u svakom doba."
0:45:21,0:45:33,"Ono, jedna povijesna činjenica da, koji je do toga, koji je zapravo došao s poverenjem da u svijetu mora vladati razum kao što je upravo bila kršćanska kultura."
0:45:35,0:45:45,I što je apsolutno u skladu sa činjenicom da mislim da se u kršćanskoj kulturi mi prihvaćamo da je svijet tu kao plod Božjeg uma.
0:45:46,0:46:03,"Ja vidim da je svijet razuman, onda također mislim da moramo uzeti čovjeka kao takvog i naše težnja dobrim, naša potreba."
0:46:03,0:46:05,"za smislom, koja je činjenica."
0:46:06,0:46:16,"Tako da, kao znanstvenik, imam riječ iz matematičkih jednadžba: nikad neću moći dokazati Boga."
0:46:16,0:46:23,"Niti ga dokazati, niti dokazati da ga nema."
0:46:24,0:46:38,"Ali slika svijeta koju mi daje znanost, je apsolutno u skladu s tim povjerenjem da je tu duboki razum i za sve."
0:46:38,0:46:58,"Tako da ne na razini matematičkog dokaza, ali rekao bih na onoj možda većoj razini već razmišljanja o svijetu koja je ono više može svojstveno filozofiji plus samo čovjekovo iskustvo."
0:46:59,0:47:14,I mislim isto da je Bog htio da budemo stvarno slobodni u tome i da mora postojati za vjeru taj korak slobode i povjerenja.
0:47:17,0:47:27,Ali ne na način da dao sam ti dovoljno da napraviš taj skok povjerenja.
0:47:27,0:47:30,Evo s tom pozitivnom mišljenjem ćemo i završiti ovu emisiju.
0:47:31,0:47:34,Hvala ti puno na gostovanju u našem podcastu.
0:47:34,0:47:35,Hvala na pozivu.
0:47:36,0:47:43,"Hvala i vama poštovani gledatelji, ovo je bio još jedan podcast Bitno Neta, ostanite uz program Laudator televizije i pratite nas ponovno za dva tjedna."
0:47:43,0:47:53,"Također, evo pozivam vas na našem YouTube kanalu Bitno Neta, kliknite on uu ikonicu pretplati se i tako ćete dobivati svaka dva tjedna nove informacije kada iziđe naša emisija."
0:47:54,0:47:56,Hvala vam još jednom i srdačan pozdrav.
