Start (HH:MM:SS),End (HH:MM:SS),Segment
0:00:28,0:00:32,"Dobro večer, poštovani gledatelji, dobrodošli u još jedan podcast Bitno neta."
0:00:32,0:00:36,"S nama je večeras, znanstveni savjetnik u trajnom zvanju sa Instituta Ručka."
0:00:36,0:00:38,"sa instituta Ruđer Bošković, Vuko Brigljević."
0:00:38,0:00:39,"Vuko, dobro večer."
0:00:39,0:00:40,Dobro večer.
0:00:41,0:01:04,"Evo obično započinjemo tako s nekim malo osobnim pitanjima pa te bih za početak pitao odrastao si u Švicarskoj i sad mi Hrvati kad sebi te pa mu obično kažemo Hrvatska će jednog dana postati kao Švicarska ili mogla bi postati kao Švicarska ali evo iz svog iskustva života i u Švicarskoj i u Hrvatskoj što misliš, zašto još uvijek nismo Švicarska?"
0:01:05,0:01:06,A dobro.
0:01:09,0:01:12,Imamo dosta različitu povijest.
0:01:13,0:01:35,"Dobro, kao prvo mislim da ljudi smo isti sa istim talentima, mislim da je bilo koja priča da je netko genetski pametniji ili gluplji je glupost i što se i pokazuje time da mislim naši ljudi kad odu van se jako dobro snaču."
0:01:36,0:01:56,"Također mislim jedna zajednička stvar između Hrvatske i Švicarske je globalno koliko mi bili kritični prema samim sobom i sigurno djelomično s pravom, imamo dosta dobru razinu obrazovanja."
0:01:58,0:02:04,"Malo drugčija, mislim da negdje smo mi malo jači, na drugim točkama su švicarci jači."
0:02:04,0:02:12,"Reko bih, primjerice, umjetničko obrazovanje je kod nas dosta bolje, dosta jače, dosta razvijenije."
0:02:13,0:02:20,"Stručno obrazovanje je ne ono sveučilišni, nego stručno jer je, rekao bih, u Švicarskoj dosta razvijeno."
0:02:21,0:02:24,I više nego u većini zemalja.
0:02:25,0:02:31,Ali ima par specifičnosti švicarske koje čine dosta posebnim sustavom.
0:02:31,0:02:55,"Sigurno je pomoglo da preko pet stoljeća mira, jako ne postoji ona famozna rečenica u filmu Teći čovjek od Orsana Welcha, njih kaže: vidi, gleda Italiju, Borž i tako dalje, je 30 godina ubojstva, krvoproliće, ratovi, ne znam što, je došao Michelangelo."
0:02:57,0:03:04,"Leonardo da Vinci, Renesansa itede Švicarska pet stoljeća mira i šta su razvili kukukzat."
0:03:06,0:03:29,"Tako možda kad kad fali malo kreativnosti u Švicarskoj, ali sigurno jedan sustav koji je jako profitirao od pet stoljeća mira, jedne kulture kompromisa koja čini jednu od jačina švicarske ne u odnosu na Hrvatsku nego u odnosu na gotovo sve ostale zemlje."
0:03:32,0:03:58,"Što je povijesno motivirano i objašnjivo, mislim, Švicarska je preživjela samo zato što su Katolici nakon reformacije i protestanti uspjeli stvoriti neki miren suživot, zato što su različite jezične zajednice također stvorile suživot koji su htjele."
0:03:58,0:04:06,I to naprimjer vodi do tog političkog sustava gotovo institucionalnog.
0:04:06,0:04:20,"Institucionalizirane koalicije, dakle u Švicarskoj na vladi je uvijek jedna koalicija raznih stranaka, više ljevih, više desnih, više za poduzetništvo, više socijalnih."
0:04:23,0:04:40,"I toliko je to izraženo da kada recimo socijalist napušta vladu, nitko ne stavlja pod upitnik ili gotovo nitko da njega zamjenjuje neko iz te stranke, ni one stranke s desne strane spektra, ni opračno."
0:04:43,0:04:59,"Jedna druga stvar koja čini Švicarsku jako karakterističnom da je na njemački postoji taj izraz vilenstation, dakle jedna nacija koja je izrasla ne iz osvajanja odozgo nego od želje da se živi zajedno."
0:05:00,0:05:10,I jedna posljedica toga je jedan poseban odnos prema državi gdje ljudi stvarno osjećaju da je država nešto jako njihovo.
0:05:11,0:05:21,"Iako ti kradeš porez, ti ne kradeš nekom tamo, ti meni kradeš."
0:05:22,0:05:41,"Zato što je, mislim, jedna od možda rijetkih država gdje na kad kad, na glasanjima koje su tamo jako česta, ljudi biraju protiv ukidanja poreza, što je, evo, u pitanju, dosta jedinstveno."
0:05:42,0:05:47,es druge strane se mora naglasiti da je porez jako nizak u odnosu na većinu.
0:05:47,0:06:14,"Ali, taj smisao odgovornosti mislim, okej, velika pragmatičnost isto, ono koje isto proizlazi iz naravi, recimo Švicarska je u biti povijesno jako ruralna sredina i koja je do relativno nedavno u povijesti bila relativno siromašna."
0:06:14,0:06:18,U devetnaest stoljeću jako puno Švicaraca emigriralo u Ameriku zbog potrebe.
0:06:20,0:06:27,Ali rekao bi to su onih par ključnih elemenata kojim bi rekao na kojoj bismo mi mogli raditi.
0:06:27,0:07:01,Znači još nekih četiristo sedamdeset pet godina mira kod nas i vjerojatno ćemo ovaj to ćemo imati mislim nije pitanje ono razviti više društvene odgovornosti možda isto više sposobnost za dijalog sa drugim ljudima koji drugačije misle politički ekonomski svjetonazorski kako sam se onda odlučio doći jel iz te uređene i lijepe švicarske u kojoj sam na kraju krajeva odrastao u Hrvatsku.
0:07:02,0:07:07,"Da, dobro, to je jedna osobna priča."
0:07:07,0:07:30,"Mislim, dobro, sam rođen u Hrvatskoj, u Dubrovniku, roditelj se preselio iz bivše Jugoslavije u Švicarsku za kruhom, za tražiti posao, oboje liječnici, valjda onda u neko vrijeme."
0:07:30,0:07:35,"Pa idemo vidjeti, možda jedna, dvije, tri godine, pa dvije godine postaju u pet, pa pet postaju u deset."
0:08:09,0:08:12,"U redu, i sad Bog ima svoje putove."
0:08:13,0:08:48,"Ono što me konačno potaklo na povratak je početak rada u Posadei, dakle osnovna pretura Katoličke crkve čiji sam član već godinama i dosta godina prije dolaske u Hrvatsku i ja sam imao želju već puno godina, već pet puno godina da ako eto ikad djelovanje u Posadei počne u Hrvatskoj, da bi mi bilo jako drago u tome sudjelovati, to je bilo moguće i to pa mogu hvaliti tu smo."
0:08:48,0:09:00,"Da, ti si kao član opusa i kao numerari, živiš na jedan specifičan poziv o kojem se toliko možda ne zna u Hrvatskoj, a to je aposlovski celibat kao lajk."
0:09:00,0:09:17,"Evo, možda nam malo progovorite o tom pozivu unutar crkve jer kod nas se čini mi se, kažem malo o tome govori čak onda nekad kad imaju molitve tijekom mise, kažem molimo te Bože da što više svećenikih zvanja, a oni koji se ne ožene da, koji se ne zareze za svećenike da budu ne znam, da se ožene i da osnuju obitelj."
0:09:17,0:09:23,Ali evo taj aposlovski celibat kao da nekad nam izmakne kao uopće mogućnost poziva?
0:09:23,0:09:23,OK.
0:09:24,0:09:24,Dobro.
0:09:25,0:09:52,"Mislim kao prvo ima jedno zajedničko u pozivu za uspust, kao ono specifična stvar te duhovnosti je posvećivati svakodnevnicu, posvećivati svakodnevnicu, tražiti susret s Bogom unutar svakodnevnice, pogotovo kroz posvećivanje dvije velike stvarnosti koje čine svakodnevnicu već u nas i to su rad i obitelj."
0:09:53,0:11:01,"Možda sa tim posebnim naglaskom posvećivanje rada i tu se ja kao i svi ostali članovi OPCD-a smo pozvani tražiti svetost u svom radu, vidjeti svoj rad kao sredstvo i služenja Bogu i drugih što vodi na specifičan način tog rada i tražiti odnos, intiman odnos s Bogom unutar te svakodnevnice i za to mislim ja kao i svi ostali trebamo pomoć i ono što na jedan način opušta i kao institucija radi je davati pomoć kroz razna sredstva, tečajeve, osobno, osobni savjet, organizacija vjeronauka raznoraznih duhovnih obnova, možemo gledati na jedan način kao stavljanje na raspolaganju jednu mrežu benzinkih crkva."
0:11:02,0:11:11,"I svi mi kad trebamo malo energije, malo goriva, malo potica, malo servise i tome se neko mora posvetiti."
0:11:12,0:11:37,"I unutar oposede je to, recimo, upravo da budu više na raspolaganju drugima, neki, živimo u taj poziv aposlovskog celibata, da budemo više na raspolaganju upravo za te ul odgovornosti, obrazovanja i pomoć drugima."
0:11:38,0:11:52,"Naravno je to kao svaki poziv nešto što sama osoba mora vidjeti u molitvi, da ga pozove tim putem na jedan način bude još više na raspolaganju drugima."
0:11:53,0:12:25,"I u OPUSED-u ima i svećenika i vrši jednu bitnu funkciju, ali također lajci su bitni, specifična misija OPUSED-a se ne bi mogla ostvariti bez svećenika, ali ne bi se mogla ostvariti bez lajka koji također vrši jednu funkciju koju svećenici ne mogu, nisu pozvani, dok je vrlo je vrlo jasno da dijeljenje sakramenata i specifično duhovonodvorstvo je jedna odgovornost koja specifično pripada svećenicima."
0:12:26,0:12:31,Evo krenimo onda sad na ovaj znanstveni dio o kojem ćemo provesti većinu naše emisije.
0:12:31,0:12:45,"Evo iako si došao u Hrvatsku povremeno, ipak ideš nazad u Švicarsku, u Ženevu, jer tamo sudjeluješ u CERN-u na jednom najvećem, mislim da je to najveći svjetski laboratorij i susrećeš se sa različitim vrhovskim znanstvenicima praktički iz cijeloga svijeta."
0:12:45,0:12:53,I sad postoji ta jedna ideja ili ideja koja se želi progura da MUP ureda među znanstvenicima nema toliko puno vjernika.
0:12:53,0:13:05,"Sad, kako je tvoje iskustvo susreta sa tim znanstvenicima u CERN-u i na drugim mjestima, da li je među njima manje vjernika ili kako se odnose prema vjeri, kakav je to tvoj odnos s njima u tom smislu?"
0:13:06,0:13:25,"Sad, točnu statistiku nemam niti sam je ikad pokušao raditi ili potražiti, ali rekao bih da možda nismo predaleko raspodijele za opće stanovništvo."
0:13:26,0:14:01,"Dakle, imam kolege vjernike, više njih, katolike, neke drugih kršćanskih vjeroispovesti, druge vjernike drugih vjera, imam kolege agnostike, gdje su najdaž određeni, imam kolege ateiste, neke od njih uvjerene i borbene, kao što ima ateisti ima te iste sa drugih strana."
0:14:06,0:14:24,"Rekao bi da u većini slučajeva, sada govoreći o onima koji ne dijele vjeru, kad saznaju da ste vjernik, to susreću sa puno poštovanja."
0:14:24,0:15:10,"I većina njih ne misli da je tu bilo kakav problem ili bilo kontradikcija i sad se počne me se sjeća naprimjer na Petra Hicksa, dakle koji je nagrađen Nobelovom nagradom dvije tisuće trinaest nakon što smo otkrili i potvrdili postojanje čestice koja i nosi njegovo ime koji osvrnući se na upravo neke od tih borbenih ateista jer sam iza to nema mjesta za to da svakako ti ljudi ne govore u ime znanosti."
0:15:11,0:15:16,"Da, ali evo, kažem, ovi koji se pojavljuju možda u svjetskim medijima itd."
0:15:17,0:15:20,često govore upravo tu tezu kao znanstvenik.
0:15:20,0:15:23,Šta drugo možeš biti nego ili agnostik ili ateist?
0:15:23,0:15:36,"Budući da za vjeru ne postoje znanstveni dokazi, onda svaki autentični znanstvenik jednostavno možda bi bilo najpoštenije da kaže da je agnostik jer se o Bogu ne može sa sigurnošću ništa tvrditi."
0:15:39,0:15:44,"Mislim, ljudi koji tako tvrde se ne ponašaju tako u vlastitom osobnom životu."
0:15:46,0:16:56,"Dakle, pitanje je jednostavno prihvaćanja da je stvarnost u kojoj živimo jako šarolika, jako obostrana, da postoji puno načina da ju pristupimo, da ju spoznamo i da pristup prirodnih znanosti, koji su legitiman i dobar, mislim inače se ne bi time bavio i fascinantan i otvara jako puno mogućnosti, nije jedini pristup i da pogotovo on zapravo u trenutku kad ja počinjem se baš baviti egzaktnim znanostima, ja jedan dio stvarnosti ne da našem stavljam sa strane ili jedan dio prihvaćam i na kraju prihvaćam također razumnost."
0:16:58,0:17:13,"I postoje puno stvari u životu svih nas i u životu najiminentnijih znanstvenika koje su apsolutno dio života, međutim, koje nikome ne pada na pamet da to napišu u znanstvenom članku."
0:17:14,0:17:47,"Mislim, je li ikad, eko nakon nekom mjerenja o eto virologiji u ovo vrijeme, puno govorimo o virusima, ne, ili o proučavanju nekakve nuklearne reakcije, ne neko govori o tome da je mora spomenuti da je taj dan znanstvenik bio jako žalostan zato što mu je neko jako blizak u obitelji umro ili jako sretan zato što je njegova novovjetna ekipa dobila prvenstvo nacionalno-europsko koje god."
0:17:49,0:17:54,"Naravno da ne, znači smatram da je to apsolutno irrelevantna informacija za taj rezultat."
0:17:55,0:18:01,Je li to nebitna informacija u životu te osobe?
0:18:02,0:18:04,Možda za onu nogometnu je.
0:18:05,0:18:07,"ne, jer ona prva naravno da nije nebitna informacija."
0:18:08,0:18:19,"I sami znanstvenici jako često, sami koriste povjerenje za prihvatiti stvarnost."
0:18:20,0:18:29,"Dakle, možemo isto spoznati stvari putem povjerenja u autoritet koji je egzistencijalno pokazao da mu se može vjerovati."
0:18:32,0:18:48,"Druga stvar, da li bilo tko u izboru muža ili žene može biti apsolutno 100% siguran da će ta veza biti dobra dok je život, realno ne."
0:18:51,0:18:55,Po toj logici se ni jedan znanstvenik ne bi trebao žene ili udavati.
0:18:56,0:18:58,To naravno nije slučaj.
0:18:58,0:19:14,"Dakle, ti sami koji to tvrde misli u popuno tome, u vlastitom životu, prihvaćaju da postoje drugi načini za spoznati stvarnost."
0:19:15,0:19:23,i jedan važan od njih je povjerenje tamo gdje postoji egzistencijalna podloga za povjerenje.
0:19:24,0:19:41,"Većina njih prihvaća iako to ne može dokazati matematičkim načinima, zato što to egzistencijalno zna da ih naprimjer roditelji vole, ali ne mogu to dokazati matematikom, fizikom i kemijom i biologijom."
0:19:41,0:19:49,Evo druga stvar onda koju obično spočitavaju kako bismo rekli znanstvenicima koji su vjeri je to pitanje dogme.
0:19:49,0:20:05,"Kako netko kao znanstvenik čiji je posao stalno propitkivat, stalno biti sumnjičav, stalno gledat šta ne valja s nekim pristupom da u području vjere prihvaća dogme kao neke istine koje su utvrđene i koje se moraju uzeti kao zadane."
0:20:06,0:20:31,"Pa mislim da je to pitanje povjerenja upravo, mislim sami znanstvenici po puno tome, mislim ja sam kao fizičar da sam ja stvarno išao osobno provjeriti sve rezultate koje ja sam predajem, naravno da nisam, nitko nije."
0:20:33,0:20:43,"Međutim, imam dovoljno razloga za povjerenje onima koji to jesu napravili."
0:20:46,0:21:27,"I u životu, mislim, neke stvari, mislim da spoznajemo, rekao bih, životno, egzistencijalno i jako vjernik prihvaćam da eto imam dovoljno životnih razloga povjerenja u Boga i onih koji ga predstavljaju da mogu prihvatiti to iako nadilazim razum u nekim slučajevima iako ili nikad neću znam mojim razumom moći dokućit to što čujem preko vjere."
0:21:28,0:21:48,"Evo sad kad govoriš o stvarima koje možda razumom nećemo nikad dokućit, smatraš li da i u znanosti pogotovo u nekim pitanjimaima koja su baš na nekakvom doticaju znanosti i vjere, poput kako to da nešto uopće postoji, odakle je uopće ta prva materija ili kako to da je čovjek samo svjestan da je na neki način materija postala svjesna same sebe."
0:21:49,0:21:56,Misliš li da će znanost doći do odgovora na takva pitanja ili kakvi bi uopće odgovori mogli biti?
0:21:56,0:22:03,"Oke, spomenuli ste dvije jako različite teme pa ću možda krenuti od one jednostavnije."
0:22:07,0:22:36,"Zašto uopće nešto postoji, mislim ja kao fizičar, krećem od toga da je stvarnost tu, da pokušavamo otkriti pravila po kojima on funkcionira u tom materijalnom aspektu, pravila koje bi mogle biti drugčija, dakle ne postoji temeljnog razloga zašto fizikalni zakoni ne bi mogli biti drugčiji."
0:22:37,0:22:40,Ali krećemo od toga da je stvarnost tu.
0:22:41,0:23:27,"Ima i jedan Jedna izraz rečenice od Stevena Hawkinga u njegovoj knjizi Kratka povijest vremena, koju mislim da ima već 40 godina, u kojem na kraju knjige, sam govori jako štete da je zaboravio te mudre riječi koje je u to vrijeme napisao, govorići o potrazi za konačnom teorijom, takozvanom teorijom svega, eto, jednadžba iližbi koje bi opisale najosnovnije fizikalne zakone koje još nemamo."
0:23:28,0:23:31,"Ne znamo hoće li ikad doći do njih, ali trenutno ih ne imamo."
0:23:34,0:23:46,"Ali i da dođemo do tih jednadžbi, još uvijek ostaje pitanje zašto uopće postoji svijet koji te jednadžbe opisuju?"
0:23:47,0:23:55,"Pisujete to jako poetički, što je to što udiše vatru u jednadžbu da čine da postoji svijet koji bi te jed nečega opisali?"
0:23:56,0:23:59,I to je pitanje koje apsolutno nadilazi fiziku.
0:23:59,0:24:21,"Mislim, mi krećemo od toga da je svijet tu, razvija se, mijenja se, pokušavamo shvatiti da smo dosta daleko došli, koje su sve, koje su sve oblici promjene, razvoje moguće, dopušteni, ali svijet je tu i to je na način zadano, od toga krećemo."
0:24:24,0:24:41,"Jako i važno je, naravno, proučavajući područje kozmologije u ovom dijelu Gdje govorimo o razvoju svemira, velikom prasku i tako dalje, fizika neće nikad moći izići iz nje same."
0:24:41,0:24:45,"Dakle, možemo li to objasniti?"
0:24:46,0:24:46,Fizika je tu.
0:24:48,0:25:08,"O dugo pitanje svijesti, tu sam puno manje na svom području, samo mi je zanimljivo, jer je činjenica da u tim brojnim istraživanjima koja su ono jako zanimljiva, jako vrijedna."
0:25:09,0:25:29,"Sad se sjećam jednog predavanja od profesorice Susan Greenfield, čini se svoje vremeno imala, nisam sigurna je bila predsjednica ili ima važnu poziciju Kraljevskoj akademiji za znanost u Engleskoj."
0:25:33,0:26:25,"Govori neurološka baza svijesti, jako zanimljivom predavanju i vrlo jasno su poveznice tu, a na početku počinje s tim ako očekujete da čujem reći što je svijest onda možete odmah izaći, zato što kroz redove nemam pojma ili ne znamo ali to je nešto je jako zanimljivo pitanje i mislim naravno kad se bavimo manifestacijama i to ako vidimo evo sad ovdje u mozgu napravimo ovo, nekome se pojavio ova slika ali sam, sama činjenica svijesti mislim da ostaje malo o misteriji, ali definitivno sam tu manje na svom području."
0:26:25,0:26:41,Spomenuo si bio Stevena Hopkinga i on je na neki način u kasnim godinama postao poznat po toj misli koju je zabilježio da zato što imamo neke zakone poput gravitacije itede možemo zamisliti da je svemir nastao niz čega.
0:26:41,0:26:45,"I onda je to bio dokaz, Bog nam više ajmo reći kao pretpostavka ne treba."
0:26:46,0:26:51,"Postao je suvišan, sve možemo apsolutno opisati bez bez njega, kako bi ti to komentirao?"
0:26:53,0:27:10,"Oj, moram reći, jedno jako, jako loše i površno obrazovanje u najosnovnijoj logici."
0:27:12,0:27:26,I na više mjesta Stephen Hawking poslije pokazuje dosta veliki prezir prema društvenim zajednostima prema filozofiji.
0:27:27,0:27:57,"Mislim djelomično sama filozofija je za to odgovorna, to je zanimljivo pitanje za sebe i takozvani teore dekonstrukcionizma itede gdje se stvarno ono, mislim kad neka od tih ideja dođu nas prirodoslovca je jasno da ne možemo s takvim ljudima razgovarati, jako teško što nekako nema veze s razumom."
0:27:59,0:28:14,"I možda zbog toga, Stephen Hogan ima stvarno, tu ste veliki prezir, no filozof, da ga nema, možda bi shvatio da u jednoj rečenici napravi više grešaka."
0:28:17,0:28:40,"Gledajući njegova tvrdnja da iz takozvanog stanja vakuma, fizikalnog vakuma, dakle, stanju u kojem nema ni jedne čestice, može putem fizikalnih zakona nastati svemir koristeći zakone fizike."
0:28:41,0:28:42,"Dakle, što nam je rekao?"
0:28:42,0:28:53,"Da iz fizikalnog stanja A, ali koji je tu, koji postoji, se može razviti u fizikalno stanje B."
0:28:59,0:29:23,"Konceptualno, slično konceptualno, nema velike razlike između ovo je dopušteno, ovaj prelaz od vanjske od vakuma u svemir je dopušten fizikalnim zakonima ili onog problema kojim davimo srednjoškolce bacim loptu sa brzinom od deset metara u sekundi na kojoj visini će stati."
0:29:24,0:29:33,Imamo fizikalno stanje gdje se lopta kreće sa nekom brzinom prema gore i drugo fizikalno stanje u kojem lopta stala.
0:29:35,0:29:41,"Dakle, imamo razvoj jednog fizikalnog sustava u drugi, ali to nema veze sa stvaranjem."
0:29:42,0:30:03,"Dakle, i to je ono, gotovo nije jasno kako jedan tako veliki um kao Hokinga stvarno je, mislim da je bio pametan, mislim da tu nema dvojbe, može ne vidjeti takvu grešku u vlastitom razmišljanju."
0:30:03,0:30:13,"I mislim da je na kraju života, pogotovo u zadnjim godinama, to stvarno postalo nešto kao strast kod njega."
0:30:13,0:30:30,"Mislim da je bilo jako zanimljivo na jednom seminaru na CERN-u gdje ga nitko ne pitao ni o Bogu, ni o ničem drugom, završava seminar o kozmologiji sa rečenicom koja je gotovo bila nepovezana s ciljem ostatkom predavanja."
0:30:32,0:30:34,Iz toga ne trebamo stvaratelja.
0:30:35,0:30:53,"Ne znam što mu je trebalo i koje je jedno nerazumijevanje zapravo samog pojma stvaranja koje je stvaranje od ničega, ali od ničega egzistencija, ne ono što bismo rekli u filozofiji ontološki."
0:30:54,0:31:08,"Evo sad kad već imamo nešto što je stvoreno, iduće pitanje ili iduća pitanja su analogično vezana uz onaj pojam koji se često možda kod nekih vjernika spominje sa određenim skepsom, a to je evolucija."
0:31:09,0:31:14,I sad ono što se meni barem čini da mnogi ljudi ne razumiju sam proces evolucije.
0:31:15,0:31:23,Tumače evo riba je silno htjela hodati i trudila se i izrasle su i noge i evo tko bi normalan u to vjerovao.
0:31:23,0:31:28,Ali ipak da li evolucija tako funkcionira i kako zapravo evo možda da nam ti objasniš kako zapravo funkcionira.
0:31:29,0:31:44,"Oke, tu pošteno također moram reći da možeš naći puno bolji sugovornike, naprimjer mog kolegu iz instituta Tomislav Domazeta Loša koji je tu stvarno na svom terenu."
0:31:46,0:32:01,"Ja sam fizičar, rekao bi bi biologa jer se bavi jako kompleksnim sustavima, ja pogotovo još kao fizičar elementarnih čestica se bavim baš sa najosnovnijim ono možemo reći redukcionizam do krajnje granice."
0:32:03,0:32:12,Tako da me ovdje donekle i mislim moram poštivati struku dok nemam dokaza da je njih zaslužila to poštovanje.
0:32:13,0:33:29,"Tema me zanima, čitao sam o tome nešto, rekao bih iz hobija, ne toliko koliko bih još htio, ima još puno neotvorenih knjiga i čekaju na mojoj polici, ali tako iz tog pogleda apsolutno vanjskog amatera, mislim moramo razliku razlikovati, dakle šta govorimo o evoluciji biološki, dakle da se jedan oblik života može mijenjati putem određenih mehanizma, ok, postoji ona, postoji igra prirodna selekcija, mislim da je to u prirodnoj selekciji nema ništa pametno, možemo reći to je zdravi razum, mislim da koji ima da imamo više oblika života koji se možda i bore za resurse, da onaj koji je bolje prilagođen konkretnim okolnostima pa će preživjeti lakše i bolje, mislim da je to zdravi razum."
0:33:31,0:33:46,"I je onda povezano za to, činjenica da se evolucija stvarno dogodila na Zemlji, dakle da su sva živa bića na Zemlji trenutno povezana kao jedan razvoj."
0:33:49,0:34:14,"Za mene osobno, na temelju svega što sam pročitao, ne postoji puno dvojbe da se evolucija dogodila i da je način života tu, jer sad je od samo jednog mjesta krenulo, ili više mjesta, ne bi znao, mislim samo pitanje izvora života, je li to čisto po priježijelim zakonima moguće."
0:34:15,0:34:20,"Je, rekao bih, nerešeno pitanje."
0:34:20,0:34:30,"Mislim, postoji jako zanimljivih rezultata, jel točno znamo kako je nastao život, tako je nastao prirodnim putem, mislim da ne."
0:34:34,0:34:39,"Ali sad, da li razumijemo sve mehanizme?"
0:34:39,0:34:58,"Mi znamo da su moguće genetske mutacije, vidimo ih, trenutno smo upravo u razvoju novih sojeva virusa, pa možemo reći da vidimo evoluciju na dijelu i naravno da onih koje se brže šire, njih ima više."
0:34:58,0:35:01,"Više, mislim, nema ništa čudno u tome."
0:35:04,0:35:12,"Da li razumijemo sve mehanizme, nisam siguran, ali to bi moje kolege biolozi sigurno trebali reći više nego ja."
0:35:15,0:35:32,"Ovo je si opisao da su ribe silno htjele hodati, ne, mislim, postoji, možda su došlo do promjene koje su nekim ribama dopustile hodanje ili disanje van vode."
0:35:34,0:35:44,"ide krenula dalje, ali mislim nema u samom biološkom procesu, mislim nema cilja ni namjere."
0:35:44,0:35:52,"Nema ono što filozofija nazove, jer to će ti znati bolje od mene, teleologije."
0:35:55,0:36:05,"Dakle, u tom smislu, prirodni zakoni mogu objasniti kako može doći do razvoja, ne sa cilje."
0:36:06,0:36:21,"Dakle, cilj može doći izvana, možemo vidjeti čisto teološki, da Bog može dopustiti i upravljati tim razvojem da dođe do onoga što on želi."
0:36:24,0:36:53,"Ali za mene, mislim da njemu srcu nema puno dvojbi, pogotovo danas kad vidimo cijelu genetsku bazu i sličnost u genomima i mislim stvari koje se koriste u kriminologiji, dakle mi danas po toj varijaciji genoma mislim da možemo više-manje saznat koliko je vremena prošlo, koliko je generacija prošlo."
0:36:53,0:37:06,Mislim tako je i radimo naprimjer to povezivanje kad su se Hrvati odcijepili od nekog izvornog naroda i koliko smo daleko od Poljaka ili od Čeha ili ne znam koga.
0:37:06,0:37:09,Dakle te se metode koriste danas.
0:37:11,0:37:15,To mi se čini ne previše sporno.
0:37:17,0:37:23,Evo iz vjerskog aspekta kad se govori o evoluciji uvijek se napominje taj problem možemo reći prvog para.
0:37:25,0:37:41,"Postavlja se pitanje ako je teorija evolucije točna, onda bi se na neki način lako pretpostavio da su ti neki prvi parovi ljudi se pojavili na više različitih mjesta, dok kad čitamo Sveto pismo, čitamo Adama i Eva i onda se iz njih razvio cijeli ljudski rod."
0:37:41,0:37:50,Pa sad evo gledajući znanstveno koliko je možemo reći izgledno da su se svi ljudi razvili iz jednog ljudskog para.
0:37:52,0:37:56,Da li je to nešto što znanost danas tvrdi ili osporava?
0:37:58,0:38:13,"Oke, ponovit ću da nisam na svom terenu i nisam siguran da razumijem svoje istraživanja do kraja, sigurno ih ne razumijem, nisam proveo dovoljno vremena proučavati to pitanje."
0:38:14,0:38:17,"Mislim, prvo, evolucija, što s čovjekom?"
0:38:19,0:38:33,"Dakle, sudeći po biologiji, sudeći po našem genomu, mi definitivno jesmo u rodu sa ostatkom živog svijeta."
