Start (HH:MM:SS),End (HH:MM:SS),Segment
0:23:53,0:23:54,A mi se svi bojimo smrti.
0:23:55,0:23:56,"Joji, umro je, kažu."
0:23:56,0:23:59,"Mislim da kažemo, joji, ja sam morostat još."
0:24:01,0:24:04,"On je izašao iz ovog zatvora, pa ti si još tu."
0:24:05,0:24:34,"Dakle, htio sam vam samo donekle malo ilustrativno ovako pokazati koliko je zapravo čovjek zahirio što je razvijao samo materijalnu fizikalnu znanost, što je zanemario duhovnu znanost, humanističku znanost koju je razvijala filozofija već tada Sokrata, Aristotela, Platona itede i drugih, zaprnjavjekovnih i drugih filozofa."
0:24:36,0:24:40,Koliko smo zapravo zahirili što uopće nismo bitno označili.
0:24:41,0:24:47,I možda još za danas samo ovo što je to zapravo taj duh odnosno duhovna duša.
0:24:49,0:24:53,Čovjek nije čisti duh nego je duhovna duša kažu i filozofi i teolozi.
0:24:54,0:25:01,"To znači da njegov duh, njegova osobnost prožima i psihu i tijelo i stvara zapravo čovjeka."
0:25:02,0:25:04,Tvoja psiha nije životinska a ne.
0:25:05,0:25:23,"I koliko god proučavaš svinsku psihu koja je jaka ili majmunjsku ti nikad nećeš znati tko si ti kao čovjek, tvoja p psiha nešto sasvim drugo jer nju prožima tvoja osobnost, tvoj karakter, tvoja savjest, tvoja sloboda, tvoja kreativnost, sve moć, to je nešto sasvim drugo."
0:25:24,0:25:34,"Također ti nemaš tijelo kao što imaju ne znam ja zamorci itede i štakori na kojima proučavamo čovjeka kao tijelo, ne, jer tvoje tijelo prožima duh."
0:25:36,0:25:50,"I zato dok možemo tjelesne bolesti i sve funkcije čovjeka donekle na životinjama isto ocijeniti kao slično, dok možemo također biološki svijet tako ocijeniti i fizikalni i psihički proučavati na životinjama."
0:25:51,0:25:55,Konrad Lorenz je to osobito proučavao u Austriji.
0:25:55,0:25:57,"Dakle, čovjeka nema nigdje."
0:25:58,0:26:01,"Ne možeš na orangutanu proučiti šta je čovjek, ne."
0:26:05,0:26:11,"Ne možeš na pametnom konju proučiti šta je čovjek, iako mi kažemo konju jedan, kravo jedna."
0:26:12,0:26:13,"Dzabri, krava ništa ne zna."
0:26:14,0:26:18,"Pitaš ju tko sam ja, ona kaže mu, mu, mu, barak."
0:26:20,0:26:22,"Kažu, u anegdote."
0:26:24,0:26:26,Šta je dakle duhovna duša?
0:26:27,0:26:34,"Čovjek je dakle zato duhovna duša, to je duh koji ujedno drži čitavu čovjeku konstituciju i zato je on duhovna duša."
0:26:35,0:26:39,Ne postoji čovjek bez tijela i ne postoji tijelo bez duše.
0:26:42,0:26:45,Čovjek je uvijek tijelo i duša i zato je on duhovna duša.
0:26:46,0:26:57,"I ako me pitate a gdje je to onda računajte na ovo, znate šta je to fizičko tijelo čovjekovo, somatsko kaže medicina, dakle znate šta je taj biološki život čovjeka."
0:26:58,0:27:03,"Drugo, znate šta je psihički život čovjeka, psihički život čovjeka, psihologija nam je savršeno proučila psihu."
0:27:04,0:27:08,Psihijatrija do kraja je došla u proučavanju kako liječiti tu psihu.
0:27:08,0:27:21,"Psihoterapija da, imate ih, neki kažu šesto sedamdeset raze psihoterapijskih metoda, drugi kažu dvjesto sedamdeset a rastu svaki dan zašto jer nijedna ne liječi jedino pomaže psihoterapija ne može."
0:27:22,0:27:39,"Donekle psihijatrija i to osobito medicamentoza može puno pomoći ali sve se više vidi kraj svega toga jer čovjek je nešto sasvim drugo onda ako s druge strane promatrate isto vjerski život teologiju, ni tamo nema čovjeka."
0:27:41,0:27:48,"Ja sam teolog, doktor teologija, ja sam trideset osam godina predavao teologiju, ja ne znam tko je čovjek."
0:27:50,0:27:55,"Nigdje se u teologiji ne preučava tko je to čovjek, pa ni u filozofiji."
0:27:56,0:28:19,"Ono što mi zovemo antropologija ili nauka o čovjeku to je fizika, to je tijelo čovjekovo to je njegov biološki život, to je njegovo psihičko, to nisam ja dakle mi imamo jedan crkveni život, religiozni život dakle i religijski ako hoćete i filozofiju, ali nitko ne zna tko je čovjek i što je to njegova patnja."
0:28:19,0:28:21,Imamo psihologiju i sve to nije čovjek.
0:28:22,0:28:39,"I ako hoćete dobro razumjeti duhovnu dušu morate smjestiti dakle između psihologije kao takve ili između psihije kao takve i između religijskog čovjekova, čovjekovog moći jer čovjek traži vezu ponovno s Bogom."
0:28:41,0:28:42,Što je to autonomno?
0:28:42,0:28:44,Ona ima cijeli svoj organizam.
0:28:44,0:28:45,Što je to duhovna duša?
0:28:46,0:28:47,To si najprije ti kao čovjek.
0:28:48,0:28:51,Zanimljivo je da psiholozi uopće ne znaju tko je to osoba.
0:28:51,0:29:01,"To me razočaralo, najbolji moji prijatelji psiholozi pa govore sad da je to psihosocijalno, ne znam je što, neka se koncentrira ili što, osoba to sam ja, to je moja egzistencija."
0:29:02,0:29:03,Ja nemam osobu nego to jesam ja.
0:29:04,0:29:12,"Druga duhovna duša, drugi organ to je život i to vječni život koji ne prestaje jer duhovni život se ne može razdijeliti, prema tome uništiti."
0:29:12,0:29:17,On prelazi s posuda i on se nikad više ne može skratiti.
0:29:18,0:29:22,Treće to je savjest koja kaže čini dobro ako hoće živjeti sretno.
0:29:24,0:29:27,Četvrto to je intelekt koji ga morate usporediti sa razumom.
0:29:28,0:29:30,"Intelekt spoznaje cjelinu, razum spoznaje dijelove."
0:29:32,0:29:36,Dosta je onaj jedan pristup koji je obično sa oceanom usporediti.
0:29:36,0:29:38,"Gledajte, svatko od vas zna što je ocean."
0:29:39,0:29:40,Nema od vas nitko tko ne zna što je ocean.
0:29:41,0:29:42,Kad čujete za ocean?
0:29:42,0:29:43,Niste.
0:29:46,0:29:48,Svatko zna što je ocean.
0:29:48,0:29:50,"A to je intelektualno, to je um."
0:29:51,0:29:54,Um vidi cjelinu oceana i zna što je ocean.
0:29:54,0:30:01,"A kada pitam a što je ocean i valovi i voda, je li to i dno mora isto oc ocean?"
0:30:02,0:30:03,Je li obala ocean?
0:30:04,0:30:05,Jesu li ribe ocean?
0:30:06,0:30:08,"I kad bacim, ne znam ja, kamenčić, je li to ocean?"
0:30:10,0:30:14,"Kad uzem ja u čašu oceanske vode, je li to ocean?"
0:30:15,0:30:16,Meni je to problem.
0:30:18,0:30:27,"Isto kad kažem čovjek, svi znate tko je čovjek, a kad pitam je li gineš čovjek, je li crnaš čovjek?"
0:30:29,0:30:30,Je li čovjek u Europi čovjek?
0:30:30,0:30:31,Jako malo.
0:30:33,0:30:34,Odrekao se sebe.
0:30:34,0:30:35,Tko je to čovjek?
0:30:36,0:30:37,"Žena čovjek, pa nije valjda."
0:30:38,0:30:43,"Muškarac nije poštovan, nego žena i muškarac su čovjek, kaže Biblija."
0:30:45,0:30:51,"Je li dijete čovjek, je li hendikepiran čovjek čovjek, je li stara u staračkom domu čovjek?"
0:30:53,0:31:20,"Razlikujte zato u duhovnoj dimenziji, dakle um to je intelekt, potom postanite intelektualci, jer vidite cjelinu i postanite mudri, a drugo je razum, time postanete znanstvenici, postanete fah idioti kažu stručnjaci, a to znači toliko se zadovoljite onom jednom, nešto u G, jedan mali dio ili jednu kost, pa ju proučavaš cijeli život i kaže to poznajš čovjeka, a šta ti ne znaš šta je kostar kamoli čovjek?"
0:31:24,0:31:26,"I onda se kaže ti si znanstvenik, znaš?"
0:31:27,0:31:31,"Jedan mali atom proučavaš cijeli život, kaže ja sam znanstvenik, a znaš šta je materija?"
0:31:31,0:31:32,"Ne znam, pa onda."
0:31:34,0:31:47,"To su dvije različite spoznaje, jedna intelektualna i po njima filozofija proučava sve i stvara teorije zapravo na temelju raznih otkrića u prirodnim znanostima."
0:31:48,0:31:56,"A druga A drugo je razum koji sve važe, računa matematički, pa onda ovo, pa ono, on mora dijelove, razum vidi dijelove."
0:31:56,0:31:59,Zato razumom nikad ne možete znati jer postoji Bog.
0:32:00,0:32:04,"I razumom ne možete nikada, nikada dokazati da je potrebno biti pravedan."
0:32:04,0:32:06,"Ne, razum kaže pa nisam lud."
0:32:07,0:32:13,"A gledaj kakav je onaj, a onaj, a gledaj šta mi ukradeš, a gledaj šta mi ne daju, a vidi gdje ja stanujem, a oni."
0:32:15,0:32:17,Razum ne zna šta je pravda.
0:32:17,0:32:20,"A umom itekako onda znam, pravda, ovo, to je to."
0:32:21,0:32:22,To je nešto prema čemu ja idem.
0:32:23,0:32:25,"Pa da ste svi protiv te pravde,."
0:32:25,0:32:26,Ja znam da ću ja dokučiti.
0:32:28,0:32:28,Um i razum.
0:32:29,0:32:34,"A onda je to karakter, a onda je to svijest, sloboda, cjelovitost, onda je to transcendencija."
0:32:34,0:32:36,Što znači transcendencija?
0:32:36,0:32:40,"Zamislite čovjeka, to je recimo ova takozvana aksijološka ili morala transcendencija."
0:32:41,0:32:43,Da je čovjek spreman za slobodu umrijeti.
0:32:45,0:32:47,Razumski je to nepodnošljivo.
0:32:47,0:32:59,Pa se tako lud da će za slobodu domovine izgubiti ženu i djecu i auto i radno mjesto i kuću i stan i prijatelje i gostionicu i frizera i hlače i sve.
0:33:00,0:33:00,Prije se lud.
0:33:01,0:33:05,"On kaže da isplati se, sloboda je važnija od svega."
0:33:05,0:33:06,To je takozvani transcendencija.
0:33:07,0:33:12,"Postoji nešto, moralna vrijednota je iznad svega, čovjek mi je iznad svega važan."
0:33:15,0:33:25,"A onda postoji takozvani kognitivna transcendencija, ne spoznajem to što bi rekao ocean gledano razumski, ocean kad kažem svi umom znamo, to je cjelina."
0:33:26,0:33:27,"To je ta transcendencija, transcendentno."
0:33:28,0:33:43,"Jer kako se kažem ja na neki način to gledam po općenito, zapravo to nije po općenito nego baš to je sposobnost da odbaciš sve one pojedinosti i vidiš cijelinu u onom svom duhovnom dijelu, u svemu zapravo pa u svom duhu."
0:33:43,0:34:14,"Evo ja sam vama svega napričao, a vi sad malo odspavajte, pokušajte ovo shvatiti, dakle ovo ćemo reći, Hagliotherapija je nova vrsta, rekao bih medicinske znanosti, jer Hagliotherapija istražuje čovjekovu duhovnu dušu, njezine ranjenosti, patnje čovjeka i sve i traži lijek za te njegove bitne duhove, gledajte."
0:34:14,0:34:20,"Ona liječi čovjeka kao čovjeka, ukoliko je čovjek, to su najteže bolesti."
0:34:22,0:34:25,"I ona zato ima sva četiri dijela, četiri godine studija."
0:34:26,0:34:35,"Prva je takozvani antropologija, proučavanje, a tko je to čovjek, što je to čovjekov duhovni organizam, što je duhovna duša, što je to duh?"
0:34:36,0:34:39,"Reci mi šta je duh, od čega se duh sastoji?"
0:34:39,0:34:41,Možeš li ga negdje ovako uzeti?
0:34:41,0:34:43,Možeš li duh otpuhati?
0:34:44,0:34:44,Tko je duh?
0:34:45,0:34:49,Jesu li to vještice koje će sada sve svete pojuriti na metlama u Hrvatskoj.
0:34:52,0:34:52,Što je to duh?
0:34:55,0:34:56,Je li to puhanje vjetra?
0:34:57,0:34:59,A ipak svi znamo duh.
0:35:02,0:35:04,"Zapravo bit svega, ono u temelju svega."
0:35:04,0:35:05,Gdje stoji svemir?
0:35:06,0:35:06,U duhu.
0:35:08,0:35:09,Gdje stoji sve što je stvoreno?
0:35:09,0:35:09,U duhu.
0:35:10,0:35:11,"Dobro, gdje stoji duh?"
0:35:12,0:35:13,U duhu.
0:35:15,0:35:17,"Jer duh je, da kažemo, transparentan."
0:35:18,0:35:22,"Ti možeš duhom, dakle, imati svijest, ali i samo se."
0:35:22,0:35:24,"Ti možeš sebe promatrati, ali to nije."
0:35:25,0:35:28,kao neka koja ne znam ja izlazak iz samoga sebe.
0:35:32,0:35:32,Nego je to naprotiv.
0:35:33,0:35:36,"Ja, jer duh je moj i u meni i iza mene."
0:35:36,0:35:39,Ja mogu sve promatrati izvana i iznutra sa svih strana.
0:35:40,0:35:41,Duha ne može odgraničiti.
0:35:42,0:35:45,I na taj način spoznajem sebe i svoj duh.
0:35:46,0:35:48,Tako da mogu ja proučavati.
0:35:48,0:35:49,Duhom proučavam duha.
0:35:50,0:35:51,Duh je čudo jezben stvar.
0:35:52,0:35:55,"Tako da kažem, taj Jesus kaže, Bog je duh."
0:35:56,0:35:59,"Svačitate, dakle, da je to zapravo temelj svega."
0:36:01,0:36:12,"Dakle, četiri su ta predmeta, prvo je antropologija, drugo je onda proučavanje patologije te duhovne duše, gdje je ona ranjena, kako ona može oboljeti."
0:36:12,0:36:14,"Vidite, to su teške bolesti."
0:36:14,0:36:18,"Kad i počeš liječiti postaješ vrhunski čovjek, ti se mijenjaš."
0:36:19,0:36:26,"Treća je onda dijagnoza, kako diagnosticirati te duhovne bolesti, a četvrto, a kako se mogu liječiti?"
0:36:26,0:36:31,Prekrasno se mogu liječiti na stotine načina.
0:36:32,0:37:51,"Hagijoterapija je zapravo prva u svijetu započela takvo istraživanje, filozofija je već dvije tisuće tristo godina još tamo od aristotela proučavala donekle antropologiju filozofska antropologija se zove znači proučavanje čovjeka donekle kao duh nego duša ali proučavanje čovjeka u kontekstu njegove patologije i terapije to nije nitko do sada ni u crkvi ni u svijetu nigdje i to je novost u svijetu i zato je ta terapija već poznata u čitavom svijetu osim u hrvatskoj kako sam rekao na početku su imali već tri studija gdje je preko dvadeset tri iz dvadeset tri nacije su ljudi dolazili iz južnoafričke unije iz koreje iz rusije iz ukrajine iz američke sjeverne i južne iz cijele europe dolazilo je preko pet stotina ljudi svaki puta budu prisutni na tom studiju cijeli tjedan dana traje studij profesor ivančić obično govori ali sjedeći ne mora ovako stajati kao sad pa mu je lakše cijeli tjedan to je nešto prekrasno zapravo proučavati čovjeka i gledati kako mu pomoći to zaključujem ta četiri antropologija hg terapijska antropologija nazovimo zatim drugo h, hagioterapijska patologija."
0:37:51,0:37:53,"Treće, hagioterapijska dijagnoza."
0:37:54,0:37:56,"I četvrto, hagioterapijska terapija."
0:37:59,0:38:03,Razlikujemo ujedno hagioterapiju kao terapijski postupak.
0:38:04,0:38:18,"Razlikujemo onda hagioterapiju koju zovemo drugim imenom, a to je antropološka medicina ukoliko proučavamo tu antropologiju i baš medicinu ukoliko je ona na duhovnoj razini i duh čovjek obliječi."
0:38:19,0:38:31,"Znanstveni dakle dio te hagioterapije se nazove antropološka medicina ili drugačije medicina duha itede itede Za danas dosta, ali mislim da je, ste zapisali sve."
0:38:31,0:38:57,"Dobro, za domaću zadaću ćete imati obraditi što je to hagioterapija, što znači ta riječ, koji su četiri dijela hagioterapije, što je to duh, a što je to duhovna duša, po čemu se čovjek razlikuje od životinja i biljaka, zašto je čovjek vrhunsko biće u svemiru i na Zemlji, zašto je čovjek gospodar Zemlje, a zašto je čovjek zločest, a zašto je čovjek nečovjek, a kad se to događa da čovjek postane životinja?"
0:39:00,0:39:14,"Kad kažemo čovjeku mati si divan, došao sam iz Slovenije sad prošli nedjelju, bio sam tri dane prosvjetnim djelatnicima govorio pa su mi toliki oni prosvjednici dođu pa te hoćete poljubiti, ja ne dam."
0:39:16,0:39:37,"Kad do sada me Hrvati ljube, a šalim se naravno, dragi su bili, uvate za ruku, kaže veliki čovjek, šumnjoj, ja sam samo 174, 175, toliko ih je to fasciniralo naime, konačno prepoznajemo dakle nešto što nikad se nije proučavalo ni poznavalo, sad ovdje na putu."
0:39:38,0:39:40,Što je to duhovna dimenzija?
0:39:40,0:39:41,Tko je to čovjek?
0:39:42,0:39:43,Zašto je čovjek dragocjen?
0:39:44,0:39:46,Zašto se isplati za čovjeka i životati?
0:39:48,0:39:50,I zašto si sretan kad čovjeku pomogneš?
0:39:51,0:39:52,Kad mu obrišeš suze?
0:39:53,0:39:53,Svateš.
0:39:54,0:39:57,A zašto si nesretan kad nekome nisi dao molio te?
0:39:58,0:39:59,Neko te plačući tražio?
0:40:00,0:40:02,"Neko te je molio nemoj ga, ti si ga udarao i tukao?"
0:40:03,0:40:05,Zašto si onda nesretan?
0:40:06,0:40:09,Sve ćeš shvatiti kad proučiš duhovnu dušu.
0:40:10,0:40:10,Sve tu.
0:40:14,0:40:20,Živiš samo kad si dobar i kad tražiš istinu i kad ljubiš.
0:40:20,0:40:22,Ne kad voliš nego kad ljubiš.
0:40:22,0:40:24,Nemojte voljeti čovjeka.
0:40:24,0:40:25,To je ružno.
0:40:26,0:40:28,Jer će onda i prestati voljeti.
0:40:28,0:40:29,Ljubite čovjeka.
0:40:30,0:40:33,Jer voli se nešto samo što ti se sviđa.
0:40:36,0:40:42,"Volju dobro meso, dobru janjetinu, dobar sladoled, dobre cipele, fino ti štimaju čizmice sad."
0:40:43,0:40:46,"Kad dođe kiša i hladnoća, voliš dobar auto."
0:40:47,0:40:48,"Znači se pokvari, ne voliš."
0:40:50,0:40:54,"Čim se otroješ sladoledom ne voliš, čime nešto drugačije ne sviđati se."
0:40:55,0:40:56,Zato voljeti je opasno.
0:40:57,0:40:59,"I ako te netko voli, bježi od njega."
0:41:01,0:41:03,Znači uskoro će otočiti potiš od tebe.
0:41:04,0:41:07,"Ako imaš dečka koji te voli, nemojte se vjenčati."
0:41:10,0:41:13,Pretvorite volenje u ljubav.
0:41:13,0:41:14,Šta je ljubav?
0:41:14,0:41:17,Ljubav je doživljaj sučuti.
0:41:17,0:41:19,Osjećaj da onaj drugi pati.
0:41:20,0:41:23,Ja mogu ljubiti svoga najgoreg neprijatelja.
0:41:23,0:41:24,Zločinca.
0:41:24,0:41:24,Zašto?
0:41:25,0:41:40,"Jer ja znam na toj duhovnoj razini, pa on pati zato što je pogazio svoj savjest, svoje dostojanstvo, on nema kamo siroče, pa on je mrtav, on je nesretan, on bježi od sebe i od svoje savjesti i od Boga i od policije i od ljudi, on nema ništa siroče."
0:41:41,0:41:48,"Ja osjećam suđenje, ja bih mu htio pomoći, ja bih ga htio zagrebiti, rekao bi brat moj, ajmo krenuti drugačije, više se mijenja."
0:41:52,0:42:01,Jeste slušali prošli utorak od dvadeset i trideset do dvadeset dva sata volim slušati profesora ivanšića on je imao jednu emisiju.
0:42:02,0:42:04,"Gospodine, naučite nas vjerovat."
0:42:04,0:42:11,U toj emisiji je pročitao dva pisma od dvojice najtežih zločinaca zatvorenih u Lepoglavu.
0:42:12,0:42:14,"Jedan je Srđan, drugi je Slavko."
0:42:15,0:42:26,"A ovaj gospodin Mato Rašić i njegova žena koja je tamo pobjegla, oni su prije tri godine krenuli kad su slušali profesora Ebarića gdje je govorio pomoći drugima, to daje najveću sreću."
0:42:26,0:42:38,"Oni su odlučili otići u Lepoglavu, morali su Ministarstvo uprave da im dopusti da dođu do tih ljudi i rekli su, željeli bismo razgovarati sa najtežim zločincima i najgorim zatvorenicimaik među vama."
0:42:38,0:42:42,"Oni su rekli čovjeku to je opasno, ni policajac ne smije k njemu unutra, on je agresivan."
0:42:42,0:42:43,"Kako će se završiti, šta dogodi?"
0:42:44,0:42:44,Ne bojte se.
0:42:45,0:42:49,"I oni su uspjeli, zamislite da ste čovjek skroz promijenili, da ste napisali prekrasno pismo."
0:42:50,0:43:00,Kako nema teško djetinstvo i kako nikad nije znao da on nešto vrijedi i kako je doživio samo zlo u ljudima i samo to da su ga obezređivali i da on vidio u ljudima samo svoje najprijatelje.
0:43:00,0:43:04,"I da je samo jednog htio, on je ubio nekoliko ljudi i policajaca i smatrao da je to pravedno."
0:43:05,0:43:09,"On ima uopće razliku između dobra i za, njega sve kaže, ono što mu se sviđa to radi."
0:43:10,0:43:21,"I onda kad je došao, kaže ti dvoje ljudi su došli k meni, možeš Meni, muži i žena, Mato i Pavica, oni su po prvi puta meni rekli, pa ti si tako dobar, pa ti si čovjek."
0:43:21,0:43:24,"Pa evo mi smo došli iz Zagreba da te potražimo, da budemo s tobom."
0:43:24,0:43:25,"Kaže, mene frapiralo."
0:43:26,0:43:27,Što vi imate sa mnom?
0:43:27,0:43:28,Zašto vi mene tražite?
0:43:28,0:43:29,Zašto se vama vrijedi?
0:43:30,0:43:34,"Ma ti si čovjek, ma ti si naš prijatelj, ma ti patiš užasno, pa patim da."
0:43:34,0:43:35,Pa mi smo željeli da budem sretan.
0:43:36,0:43:37,On se skroz promijenio.
0:43:38,0:43:45,"I kaže, profesore, želim još ostati u izolaciji, ne želim izići van sa drugima, da se učvrsti kažu u ovome što sam dobio."
0:43:46,0:43:47,"Da sam sretan, kaže."
0:43:47,0:43:57,"Jer sam pisao ljudima kojima sam napravio zlo i kojima sam ubio njihove najdraže, neka mi oprosti da sam spreman kad izađem napraviti sve najbolje za njih da im nadoknadim zlo što sam načinio."
0:43:58,0:44:05,"Ja te sad vidim, kažu, pa zaista postoji apsolutno dobro, postoji samo sloboda, postoji samo dobrota i ljubav."
0:44:05,0:44:06,Ja to nisam nikad znao.
0:44:07,0:44:12,"Kada su mi otvorili oči, kada sam bio slijep, kada su mi dali sunce u kojem vidim sve, ja sam već tako sretan."
0:44:13,0:44:23,"A onda kad je to vidio drugi Slavko koji je sličan, ne tako teško kao on, ali isto tako pobijavao ljude, kad je vidio kako svoj je promijenio postao ljubomoran, pa je molio da bi on smio s njima razgovarati."
0:44:24,0:44:42,"I nakon nekoliko mjeseci on se promijenio, još prvi napisao već tri četiri pisma, onda su ga sad pustili da smije izići iz izoliranosti, dakle iz te svoje čelije, smije raditi tamo u radionici, razbariti, mene je razbario prekrasan lih Gospev ako kao da gleda kroz prozore i poslao mi, nevjerojatno."
0:44:43,0:44:50,"I vidite iz toga ćete shvatiti šta je radioterapija, ona pretvara naše logore i zatvore u klinike."
0:44:50,0:44:52,Zašto liječimo fizičke bolesti?
0:44:53,0:44:54,Zašto liječimo psihičke bolesti?
0:44:55,0:44:57,A zašto ne liječimo duhovne bolesti?
0:44:58,0:45:02,"Pa za mene vidite da je ovaj jadan zločinac bolestan, teško bolestan."
0:45:02,0:45:04,Njemu su oči bile zatvorene.
0:45:04,0:45:05,Zašto bi bio kriv?
0:45:05,0:45:06,Zašto ga treba kažnjavati?
0:45:06,0:45:07,On je mogao drugačije.
0:45:07,0:45:09,On je osjetio majčinske ljubavi.
0:45:09,0:45:12,"Njemu nikakav otac i brat, imat znaju reći ti si vrijedan, ti si tako dobar."
0:45:12,0:45:14,"Ne, svi su govorili ne voljaš, ne voljaš, ne voljaš."
0:45:15,0:45:16,"I odbijali ga, on se morao braniti."
0:45:16,0:45:20,"On je teško ranjen čovjek, izranjen i sad ga baciš još u čelo."
0:45:20,0:45:23,Pa naravno da mora biti agresivan i sve bi po ubijal.
0:45:24,0:45:26,"I upravo to pišem, to sam i pisao jučer sam ga pročitao."
0:45:26,0:45:33,"Kaže, svi su sudovi svih država, kada je strašno hladno osvetljive, punih hladne osvete."
0:45:33,0:45:39,"Jedino Bog i duhovna dimenzija kaže ono što je ljubav, što je ljubav, što je toplina, gdje se možeš vratiti."
0:45:39,0:45:42,"A tek sad vidim, pa kako sam mogao raditi takve stvari?"
0:45:43,0:45:44,Nikad to više ne bi napravio.
0:45:45,0:45:46,I to je bojica tako.
0:45:47,0:45:56,"Idemo dalje, sad su mi u Rijeci otišli isto, idu u Pulu, u zatvor i sad bi tamo jedna doktorica upravo i danas kaže, profesore genijalne stvari doživljava, nemoguće."
0:45:57,0:46:00,"Najprije pokušali razgovarati sa pojedincima, onda vidjeli da ne ide."
0:46:01,0:46:01,Zašto?
0:46:01,0:46:05,Jer oni mogu doći njoj na razgovor samo kad je pauza njihova.
0:46:05,0:46:10,"A ta pauza to je jedino vrijeme kad se oni mogu malo odmoriti na zraku, biti malo na zraku, jel?"
0:46:10,0:47:06,"I onda teško je im doći i razgovarati s njom, da napravila drugačije, da napravila jedan seminar od jednog dana, jedan poslijepodne sa grupom od njih od dvadeset i trideset jer onda s njima radila i sada oni dolaze jedan po jedan još da te me ipak razgovaraju kaže ona pa to je nevjerojatno najljepše sa takvim ljudima raditi i promijeniti najteže je sa dobrim ljudima a svi misle da dobri ljudi žive u svijetu, a lopovi u zatvoru ja mislim da je obratno zašto pa zato što mi ne vidimo koliko smo mi zapravo zločesti koliko mi negativnih riječi izgovorimo koliko mi negativnih misli imamo koliko mi negativnih osjećaja, koliko mi toliki negativnih želja imamo za drugima, koliko toga ružno mislimo, ružno gledamo u medijima, samo ružne stvari slušamo, onda ih prebacujemo na druge, okrivljamo druge, svađamo se, svi su krivi."
0:47:07,0:47:10,"Mediji kažu svi su siromašni, svi kažu da, svi smo siromašni."
0:47:10,0:47:14,"Mediji kažu mi smo svi bogati, da, mi smo svi bogati."
0:47:15,0:47:23,"Mediji kažu mi ćemo svi za tu stranku samo glasati, da, svi ćemo za tu stranku, to je recimo o ose bez pastira."
0:47:25,0:47:26,Kada niko ne misli svojim ravom.
0:47:30,0:47:33,I pitam se zašto ne bismo mijenjali društvo.
0:47:34,0:47:36,A to može samo duhovna dimenzija.
0:47:37,0:47:38,Znate gdje je rješenje?
0:47:38,0:47:41,"Kad se ti promijeniš, sve se promijeni."
0:47:42,0:47:45,"Kad se ti promijeniš, svi se mijenjaju."
0:47:46,0:47:49,Jer ti si svjetlo koje se upalilo i u tom svjetlu svi vide.
0:47:52,0:47:54,Ajmo sada ustati malo da se odmorimo.
0:48:07,0:48:11,"Posjetimo se, je li to ono zašto smo došli večeras ili još nešto drugo trebamo?"
0:48:17,0:48:22,"Kao što ono sveti Ivan Krsitelj poslao, kaže, jesi li ti onaj koji ima doći ili da drugoga čekamo?"
0:48:24,0:48:26,Je li to ono što zapravo trebamo ili?
0:48:30,0:48:31,Što bi ti još trebao?
0:48:31,0:48:32,Što bi ti još htio?
0:48:43,0:48:54,onda pogledaj možda lijevo ili desno koji kraj tebe da ne budemo stranci a tako smo blizu navijesite samima sebi to pa baš je lijevo da ja postajem pa da.
0:48:59,0:49:28,"Možda pogledajte svoje prste i ovo ima lijepe ruke i ruke moje gledam mogu ih podići i spustiti koliko sam sloboda, nogama mogu mahnuti lijevo, desno pa koliko slobode, koliko se žele da zbrine za mene, a koliko pluća ne prestanu udišu i izdišu, koliko srce radi, Bože koliko se tih aparata i živih bića u meni, koliko ti patuljaka u meni se trude da meni dadnu život, u što je meni lijepo, što sam ja važan."
0:49:28,0:49:30,Sad gledajte samo to što sam ja važan.
0:49:33,0:49:40,"A onda se sjetite, pa da, stvoritelj svijeta je mene htio, pa ja sam prevažan."
0:49:40,0:49:47,"Ako je Bog sve mogući, mene zamisli da je dobro da ja postojem, ma čovječe, nitko više neće biti u Zagrebu veći od mene."
0:49:48,0:49:50,Što sam ja dragocijen?
0:49:52,0:49:55,"Upite to u sebe, to je strašno ljekovito."
0:49:56,0:49:57,Što sam ja dragocijen?
0:50:00,0:50:02,"To nije više sviđanje, to je ljubav."
0:50:03,0:50:04,Kako sam ja dragocijen?
0:50:06,0:50:11,"A onda samo reci svojoj duši ono što je rekao Tinujević, za led si duša stvorena."
0:50:12,0:50:13,"Čovječe, ti si za razvoj."
0:50:14,0:50:18,"Bit duha je da se razvija, napreduje idu uvijek dalje i dalje."
0:50:18,0:50:21,"Nema granica, nema penzije, nema odmora."
