Start (HH:MM:SS),End (HH:MM:SS),Segment
1:15:58,1:16:13,"Ja samo znam dakle koliko sam se mučio u početku dok to nisam znao, prvih pet godina mučio sam se, nikog nisam promijenio, ja sam trudio se da pametno govorim, ja sam trudio da pametno propovijedam, ja sam trudio da se ima na izlete, mi smo zajedno igrali nogomet, sve je sve moguće, nitko se promijenio nije."
1:16:14,1:16:18,Kad sam ja na ovu stranu došao i osjećao kako to mene promijenilo.
1:16:18,1:16:22,"Sada sam ja samo njima praštao i slično, su počeli mijenjati strašno."
1:16:23,1:16:24,A sada nam je Bog bio bliz.
1:16:26,1:16:32,"Bog bliz, dakle ta vertikalna linija funkcionirala i horizontalno među ljudima, prekrasno."
1:16:33,1:16:36,Iz toga je započelo ovo što vi sada čujete od mene.
1:16:37,1:16:44,"Dakle, cijelom svijetu je drago da viknu ti ljudi, čovjek je najteže ranjen u duhu, a to se može jako dobro liječiti na duhovnoj razini."
1:16:44,1:16:53,"Svijet može biti drugačiji, društvo može biti drugačije, možemo uništiti oružje, možemo uništiti sve što zagađuje prirodu, možemo prehraniti još toliko ljudi, opće ni problem."
1:16:57,1:16:58,Šta biti dobri?
1:16:59,1:17:00,Vjerujete u dobro?
1:17:05,1:17:05,Dobro.
1:17:07,1:17:09,"Da ne kažem nešto drugo, bit će dobro."
1:17:10,1:17:21,"Ja vjerujem u vas, a vi hvala vam srca pa ćemo sad završiti a slijedeći četvrtak ćemo onda temeljito krenuti još jače naprijed da vidite kako je to dobro."
1:17:22,1:17:40,Ali vas molim utorak slušajte emisiju utorak slušajte emisiju od dvadeset i trideset do dvadeset dva jer govori prekrasno baš ove mehanizme zakonitosti kako da postanete vrhunski genijalci.
1:17:45,1:17:46,Već imam program za taj dan.
1:17:48,1:17:55,"Hvala vam, još jednom vidite da li smo li pokraj vas postali malo optimistički ili još uvijek depresija."
1:17:57,1:18:05,"Pogledajte je li gospodin s vama, ima li Boga u vama, jesmo li s njime u kontaktu, onda smo sigurni da će biti dobro."
1:18:05,1:18:13,"Isto se zna za renta, on je povijesna osoba, znate, on je moj veliki prijatelj, ne zovemo se, razgovaramo i on je Bog i čovjek."
1:18:14,1:18:15,I on nas sve ljubi ludo.
1:18:15,1:18:16,Rekao da vas pozdravim.
1:18:17,1:18:19,I rekao je da treba ovako moliti.
1:18:19,1:18:21,Ajmo tako kako je rekao.
1:18:21,1:18:22,Oče naš.
1:18:52,1:19:00,"Gospodin s vama, neka vas vodi i blagoslivlja ovaj tjedan sve mogući stvoritelj koji vas ljubi."
1:19:00,1:19:02,Otac i sin i Duh Sveti.
1:19:04,1:19:08,"Idite i budite hrabri, rasite lako noć, idite u miru."
