Start (HH:MM:SS),End (HH:MM:SS),Segment
0:50:22,0:50:25,"Nema noći i dana i duh uvijek radi, uvijek, uvijek."
0:50:25,0:50:28,"uvijek uvijek uvijek, to je prekrasna sposobnost tebe čovječe."
0:50:29,0:50:33,"I reci lijepo, za lec si duša stvorena, idemo naprijed ovakav sat."
0:50:34,0:50:50,"Za lec to znači izići ću iz bolesti, izići ću, izići ću iz ovih negativnih misli koje stalno mislim, iz ove depresije, izići ću, izići ću iz ovog straha koji me sad svapnja, ja ću izići, za lec si duša stvorena, poleti."
0:50:53,0:50:57,"Samo se reci, izići ću ja iz ove tjeskobe, hoću."
0:50:58,0:51:10,"Nema straha koji me može držati više, ne, izići ću, odvezat ću sebe kao pticu koja je bila vezana i pored."
0:51:11,0:51:28,"Pa onda se samo sjeti čovjeka ti neizmjerno nadilaziš sebe, ti neizmjerno nadilaziš samog sebe, ti si vezan tijelom i psihom za ovdje, za ovu dvoranu, ali svojim duhom si posvuda, ti si naprijed i samo gledaj što možeš postati."
0:51:29,0:51:33,"Gledaj svoga duha kako te zove, dođi za mnom kaže, gleda šta možeš postati."
0:51:34,0:52:06,"Zdrav možeš biti večeras, sposoban, vrijedan, inteligentan, možeš postati moralan, sad, svijet, kreativan, nema granice, samo gledaj kako je duh ispred tebe, kako prekrasan neko tko te zove, dođe za mnom, tijelo je obećano promo, on kaže, ja bih sad spavao, ja bih sad popio, ja bih sad išao na kišu, ne, duh kaže, idite za mnom, gledajte, ti možeš biti velik, ti možeš biti zdrav, ti možeš biti vrhunski čovjek, pazi, ne daj se."
0:52:08,0:52:25,"A na čovjek kako Abe Šimić kaže, čovjek će ne idi malen ispod zvijezda, čovjek će ne idi malen ispod zvijezda, nemoj biti tako malen, nemoj više tako mislite o sebi da si mali i nikakav, ne, ti si vrhunski."
0:52:28,0:52:39,"Pazi ako je stvorite ili družite s tvorima, u tebi ima neizmjerno, ti si kao Bog velik, ne apsolutan ali besgraničan dan, imaš granice razvoja."
0:52:41,0:52:57,"Večeras zapamti, ne ide više malen, kreni, iziđe iz svih tih svojih zakočenosti vezano vezanosti, robstava, ne, dosta je, neću više biti bolestan, neću više biti autist, neću više gledati negativno, ne, ne i ne, točka, si čuo?"
0:52:58,0:53:00,Da vidim da se sad to smije.
0:53:04,0:53:12,"Vidjet ćete kako se može smijati, prekociti kaže Franklin u logoterapiji, prekociti zlo, ne, pa šta onda?"
0:53:14,0:53:19,"Lako tebi Ivančić govoriti da sad kad dođem kući nemam šta jesti, pa šta onda, recite pa šta onda?"
0:53:21,0:53:24,"Lako tebi Ivančić ti si mlada, mi ovdje možda ćemo umrijeti za koju godinu."
0:53:26,0:53:27,reci pa šta onda?
0:53:28,0:53:36,"Taj prkos trots zove se njemački, to je kod Franklova bilo u logoterapiji jedna od bitnih terapija, pa šta onda?"
0:53:37,0:53:38,Pa šta onda?
0:53:39,0:53:42,"I to je ono što tjera od tebe negativne misli, negativne riječi i sve."
0:53:44,0:53:45,Riječi su važne.
0:53:45,0:53:48,"Od sada do sljedećeg utorka, do sljedećeg četvrtka samo pozitivne riječi."
0:53:49,0:53:53,Da li sad čujem jednu negativnu jer riječi te osuđuju i riječi te spašavaju.
0:53:54,0:54:01,"Samo govorim ja mogu, bit će dobro, ja vjerujem da će biti dobro, ja vjerujem sutra sam drugačiji, ja vjerujem da ću sutra promra promijeniti."
0:54:01,0:54:03,Ja vjerujem da ću izići svoj negativni misao.
0:54:04,0:54:05,Skiniću ove crne naočale.
0:54:05,0:54:06,"Ne, neću ih više nositi."
0:54:07,0:54:12,Neću više gledati onu negativnu dolju u prljavštinu i kloaku.
0:54:12,0:54:12,Ne.
0:54:13,0:54:17,"Ja gledam u cijetu, ružu, u lastavicu kako se vinula."
0:54:17,0:54:18,Ne bi pod oblake.
0:54:18,0:54:19,Gledam i letim.
0:54:20,0:54:20,To sam ja.
0:54:21,0:54:23,Za leci duša stvorena.
0:54:24,0:54:25,Ne ide maleni spacijesta.
0:54:25,0:54:29,"Prijatelji, nemojte dolaziti četvrtkom, a ići opet, ali maleni."
0:54:29,0:54:33,"Ne dam, ne dopuštam da ikog govori i misli negativno."
0:54:34,0:54:35,Samo pozitivno.
0:54:36,0:54:36,Ja mogu.
0:54:36,0:54:39,Ja vjerujem da ću biti zdrav.
0:54:39,0:54:40,Ja vjerujem.
0:54:41,0:54:41,Recite to večeras.
0:54:42,0:54:43,Sve dok se ne nasmiješ.
0:54:44,0:54:45,"Govori, govori, govori."
0:54:46,0:54:48,"Naređujem ti, pazi."
0:54:49,0:54:51,"Ja ću ja u policiju, pa se onda svi me ređujem."
0:54:54,0:54:56,"Liječeni kme su, ja li policajac uvijek."
0:54:58,0:55:00,"Budite odlučni, znate, protiv zla."
0:55:00,0:55:00,Ne dam se.
0:55:01,0:55:02,Baš hoću biti zdrav.
0:55:15,0:55:19,"Recite samo sebi tiho tri puta, bar tri puta, bit će dobro."
0:55:20,0:55:21,Ja vjerujem da će sve biti dobro samo.
0:55:22,0:55:22,Sve će ovo biti dobro.
0:55:23,0:55:24,Tri puta si to rekao.
0:55:30,0:55:32,"Smiješ i više puta, manje ne."
0:55:35,0:55:38,I sad gleda kako se osjećaš poslije toga kad tako govoriš.
0:55:39,0:55:40,Kada si uplivao čistu vodu.
0:55:41,0:55:44,"Kada je sunce granulo, došlo jutro."
0:55:44,0:55:47,Kada si otplovio na pućinu i sad se ne bojiš.
0:55:48,0:55:49,Novi život počinje.
0:55:50,0:55:53,"Proba još jednom, ja vjerujem, bit će dobro, ja vjerujem."
0:55:54,0:55:58,"Jer samo je dobrota apsolutna, bezgranična, neuništiva."
0:55:58,0:56:04,"Zdravlje, mir, uspjeh u dobroti, ja vjerujem, bit će dobro."
0:56:06,0:56:10,"Pomoć dati da vas svaki tjedan mijenja, mijenja, mijenja."
0:56:10,0:56:15,"Nakon ovog teorijskog i ovog praktičnog dijela, sad jedan još zanimljiviji dio."
0:56:16,0:56:20,Puno puta smo učili da postoji način da promijeniš druge ljude oko sebe.
0:56:22,0:56:26,Pravilo je obično promijeni sebe i druge će se mijenenjati već automatski.
0:56:27,0:56:33,"Ali imamo pokraj toga temeljnog pravila još jedno drugo pravilo, a to je one četiri točke."
0:56:34,0:56:46,"Gledaj čovjeka koji te je povrijedio recimo ili čovjeka koga hoćeš promijeniti, gledaj ga u duhu u oči, dakle ne idi k njemu, u duhu ga gledaj u oči i govorim mu opraštaj ti."
0:56:47,0:56:53,Drugo smo rekli govori oprostiti meni što te nisam razumio i ljubio.
0:56:53,0:56:58,"Treće, želim te ljubit kao što te voli tvoja majka."
0:57:00,0:57:03,"Četvrto, zahvaljujem Bogu za tebe."
0:57:04,0:57:04,Četiri.
0:57:05,0:57:13,"Nekad sam znao govoriti i peto još, a to je odričam se, to je za one koji su me povrijedili, odričam se zla koje si ubacio u mene."
0:57:14,0:57:26,"Dakle, prvo, opraštam ti, drugo, oprostiti meni, drugo, želite ljubit kao majka, četvrto, zahvaljujem stvoritelju što postojiš, četiri točke."
0:57:27,0:57:35,"I kad to činite tjedan, dva dana i to često preko dana tako da osjećate to mijenja, tada ćeš vidjeti kako se drugi ljudi promijene."
0:57:36,0:57:44,"Imamo iskustva već Tijelo iskustava već previše i zaista djeluje gotovo mehanički, totalno sigurno."
0:57:44,0:57:46,Samo važno da li je to potrebno.
0:57:47,0:57:50,Rijetki su koji to točno tako čine kako ja kažem.
0:57:52,0:57:55,"Nego svi čuju i kažu još što smo dobro čuli, se hvale kako su dobro čuli."
0:57:56,0:57:58,"Kad kaže si primijenio, pa čuo sam."
0:58:01,0:58:05,"Pa dobro je što to promijenilo, pa meni nije, eto ja sam čuo pa meni nije promijenilo kaže."
0:58:08,0:58:17,"Ne vrijedi, brat moji, ići liječniku pa onda platiti, pa doći u apoteku, uzeti lijekove koji je on propisao pa platiti, pa doći kući i baciti lijek u koš."
0:58:19,0:58:20,Da li bi ga trebao uzeti?
0:58:23,0:58:24,Ajmo za to.
0:58:24,0:58:27,"I rekli su da se time drugi mijenjaju i to je sigurno, garantirano."
0:58:28,0:58:31,Svako tko to napravi dobro sigurno će promijeniti ljude po kretanju.
0:58:31,0:58:40,"To je nevjerojatno koliko je duh transparentan, koliko je duh silovita snaga u čovjeku, koliko je snaga duha, dakle osobito vjere nešto čudesno."
0:58:41,0:58:56,"Ja sam sto puta to doživljava, pričao sam, čini mi se i vama prošli puta ili kada, meni se to stalno događa, da bilo kada recimo nekome se dogodi da nekada održim neko predavanje pa se čini pa što, to ne, ja ne bih prihvatio, nisam baš Ivan Šu, ne znam kako govorio."
0:58:57,0:59:11,"Sad mi se čini da su ljudi razumjeli, uglavnom su prespavali, sad mi nešto govori, znate, lupa po meni, pa šta si išao govoriti, pa to od toga ništa, pa to i nije ništa si govorio, pa vidite, među vama ima neko zlo koje hoće da razvoji ono dobro što sam učinio."
0:59:13,0:59:23,"I zanimljivo je, od tada sam samo počeo govoriti, ja vjerujem da je ovo bilo odlično, ja vjerujem da su ljudi čuli, ja vjerujem da će oni reći da je to izvrsno, ja vjerujem, ja to deset puta se vi kažem."
0:59:23,0:59:33,"I onda u meni ostaje ta kao jedna unutarnja snaga, kao nešto što se u mene uviježilo, jedan temelj koji stalno govori da, to je odlično i to će biti dobro."
0:59:33,0:59:34,Ja to vjerujem.
0:59:35,0:59:42,"Ja sam uvijek doživio da ljudi dolaze u pauzi, profesor je odakle vam to, profesor je što vi opremljate, profesor je kako sam vas spoznao."
0:59:44,0:59:48,I tad sam shvatio zašto Isus kaže onome koji vjeruje sve moguće.
0:59:50,0:59:53,"I zašto kaže vjerate to je spasilo, dajte teže bolest se brzo zdraviti."
0:59:55,1:00:00,"Kako mu ga žena koja je kada je oprostila te meso, to je vjerovala u to, ovo stvarno ne treba"
1:00:00,1:00:02,operaciju raka na prsima.
1:00:04,1:00:12,"Bezbroj, dakle, tih situacija gdje im je tako jasno, kad hoćeš vjerovati, kad nešto povučeš cijeli semir za svakom, sve se mijenja."
1:00:14,1:00:16,"Dobro, to je vjera i kad tako govoriš."
1:00:16,1:00:23,"Ali ove četiri točke o kojima sam govorio, one ne samo da mijenjaju druge, jer mi smo uglavnom to analizirali."
1:00:23,1:00:29,"Ono što je bitno kod tih četiri točke, one tebe mijenjaju, one tebe čine sretnim, one tebe ozdravljuju."
1:00:30,1:00:33,"Prva točka je kad kažeš, ja ti opraštam."
1:00:36,1:00:41,"I druga točka kad kažeš, oprostite meni, bez te dvije točke, sto puta sam osjetio."
1:00:41,1:00:47,"Nekome uvrijedio, s nekim ne mogu, onaj tamo je bezobrazan, onaj tamo ovakav, ovdje ne mogu, umoran sam."
1:00:47,1:00:51,"Kad već te dvije točke napravim, ja oživim."
1:00:54,1:00:57,"Ja sam zdrav, ja sam uspješan, nevjerojatno."
1:00:59,1:01:02,"A još ako nastavi sa one druge dvije, nema granice."
1:01:03,1:01:06,"Dakle, šta se događa kad ja kažem opraštam ti?"
1:01:07,1:01:18,"Tada ja zapravo, rekao sam vam to sto puta, da kad mene netko uvrijedi, kad te netko uvrijedi, onda kao da ubaci u tebe neku bombu koja je aktivirana."
1:01:19,1:01:35,"I ako ti to čuvaš u sebi, ako ti o tome razmišljaš, pa zašto bi to, pa kako je moglo to reći, pa ovo, pa ono, ti u sebi samo čuvaš tu bombu koja će svakoga dana eksplodirati i razorit će i tvoje misli, tvoji intelekti, tvoji morali, to je sve ono što je u tebi vrijedno i dragocjeno, to razara."
1:01:36,1:01:40,"Ništa gore nego razmišljati onome tko te uvrijedio, zašto."
1:01:40,1:01:53,"I onda još nešto te boli, pa osim što ne možeš ni misliti, emocije su ranjene, umiranje, razum ranjen, osim što ne možeš ni raditi, ne možeš ni jesti, ne da se ni spava, to kreće se stopu, to ubija, braćo moja."
1:01:54,1:01:59,"Svaka uvreda, jedna negativna riječ kad ti kažu kako ti to stoji sam samo tvoja kosa."
1:02:00,1:02:01,Kako to izgledaš?
1:02:01,1:02:03,Pa ćeš takav ići.
1:02:03,1:02:06,"Bože, u sranu da bilo, pa ta boja kravate ne ide."
1:02:06,1:02:07,Pusti ga čovjek će.
1:02:12,1:02:16,"I tako dalje, itede Čim nekome rekneš nešto negativno, ti si ga ranio teško."
1:02:17,1:02:21,"I ta rana boli, ti si ubacio u njega bombu i on se muči."
1:02:21,1:02:23,"To boli duboko, prijatelji."
1:02:24,1:02:27,Vlastiti grijeh nikad toliko ne boli koliko boli.
1:02:27,1:02:31,"Tuđi grijeh koji te je povrijedio, koji ti je nešto negativno rekao."
1:02:31,1:02:36,"Osobno to kad povrijedi, to je dostojanstvo, to je osobnost, to boli užasno."
1:02:37,1:02:47,"Onda kad još počne predvacivati, pa ti si kriva, tko drugi, pa ja pa ništa ne radiš, sran te bilo, ti si komali pakao, ti će on kazati dobro idem se uopće daću."
1:02:49,1:02:51,Vi ne znate koliko riječi ubijaju.
1:02:53,1:03:03,"Ja bih rekao nije toliko opasno kad te mu žudari fizički, ali kad njega žena jezikom lupi, neizlječivo."
1:03:08,1:03:11,"I nitko ne govori o tom nasilju, prijatelji dragi."
1:03:14,1:03:20,"A žene imaju tako oštar jezik da je milina, a dječki oštru ruku."
1:03:23,1:03:29,"I kako izići dakle iz tog pakla nasilja, istog zapravo zarobljeništva, a to boli užasno."
1:03:32,1:03:45,"Još predbacivanje, pa nikad neće to da popraviš, pa šta radiš mužu, a šta ono šta ti radiš, gledaj, kako si to ispekla, pa zar ti ovo, ne baš pametnije kruha kuhati, kako ti stoji ta haljina, ajde molim, koljena ti se vide, sram te bilo."
1:03:46,1:03:46,I tako dalje.
1:03:47,1:03:52,"Kad počnu tako predbacivati, koliko ovaj prijatelj, do kada ubacuješ u njega bombe?"
1:03:53,1:03:56,"I ako se hoćeš osloboditi, nema druge nego bombu izbaciti van."
1:03:59,1:04:18,"I tako dalje, a mi stariji znamo to, rat naš Domovinski, od bombe se može sakriti, ali to da su me mrzili, to da su me progonili, to da su me psovali, to da su mi ružili, to da su mi htjeli uzeti moj domov ili moju slobodu, moju majku, moga oca, to je užas i to muči."
1:04:18,1:04:25,"I naši branitelji se zato ubijaju, to je posttraumatski stresni sindrom."
1:04:26,1:04:29,"I mi svi smo zapravo mrtvi, mrzimo, mrzimo."
1:04:30,1:04:35,"I onda smo još mudri pa kažemo dobro, zašto se možemo oprostiti, pa vi šta su napravili?, rekli daj šta sad?"
1:04:36,1:04:41,"Čuvaj tu bombu u sebi da tebe razori, time ćeš to sveti neprijatelju, gluposti."
1:04:43,1:04:52,"Pa ako si u nekoj kući uvijek taj primjer uzima, u ratu sam to vidio, pa neprijatelj dođe do Vučesca pa ubaci aktiviranu bombu tebe u kuću, šuzeti pa gledaj, joj je dobra bombica."
1:04:54,1:04:57,"I on ju razmišlja, ili ćeš brže van, pa njemu."
1:04:58,1:05:07,"To je ono, oprostiti prijatelju znači ubiti neprijatelja, ubiti neprijatelja, a izliječiti vlastitu opasnost i ranu i strah."
1:05:09,1:05:12,"Kad prašš, ti ne pomažeš ništa neprijatelju."
1:05:12,1:05:14,"Kad mu oprosiš neću onda doći u nebo, a ne boj se."
1:05:16,1:05:18,Nemam prava na ništa kad ti mu oprosiš.
1:05:18,1:05:23,"Jedino što u tom oprosljenju to je, ti si Slavonija od njegova zla i on ti ne može ništa, on se smiješio."
1:05:27,1:05:35,"Kod nas u Slavoniji to znaju ljudi reći kad se, kad neka povrijedi ovako jedna djevojka, druga, ona ili žena druga, onda znaju reći, a pijuni mi pod prozor."
1:05:37,1:05:41,"To znači to ne ulazi u mene, to je izvan mene i prema tome ne možeš mu vrijediti."
1:05:42,1:05:45,"I to je mudra rečenica zapravo, poslije kad sam o tome razmišljao."
1:05:48,1:05:54,"Ništa u pasi nego ne prestanu se mučiti sa onim što ti nek je netko ubacio, to je gore od svih bombi."
1:05:56,1:06:00,"I prašnjavanje nije ništa drugo nego oslobođenje, nećeš ti mene."
1:06:01,1:06:06,"I to kako ćeš to osloboditi, tako da misliš, a jadanori, kako možeš tako negativno govoriti?"
1:06:07,1:06:15,"Jel to muž, jel to tvoja majka, jel to tvoja žena, jel to tvoj dijete, jel to tvoj otac, jel to tvoj susjed, jel to tvoj prijatelj, jel to kolegica na pozornici?"
1:06:16,1:06:20,"Ne bi, kako možeš, samo razmisli, ja pa kako možeš tako negativno reći?"
1:06:20,1:06:21,Pa kako može tu laž izraziti?
1:06:22,1:06:24,Ja sam najbolja žena na svijetu.
1:06:25,1:06:27,"A ja, pa nema tako muškarca kao ja."
1:06:29,1:06:34,"Uvijek moraš pozitivno o sebi govoriti i požaliti onoga, pa kako može biti takav zakon?"
1:06:35,1:06:36,Tada ćeš se uspjeti osloboditi.
1:06:38,1:06:40,"Dokle, eko, dosadeš onom drugom, kako je to mogao?"
1:06:41,1:06:42,"Sram me bilo, on je još gori od mene."
1:06:42,1:06:51,"Ti samo vidiš kako umnažeš zlo, mržnju, osvetu, negativne riječi, negativne misli i ti sebe, sebe truješ, uništavaš i gaziš."
1:06:53,1:06:54,I to je ta mudrost.
1:06:54,1:06:59,"I sad kad ti oprosiš, samo da vidiš, oj Bože moj, smiješ se ovako kao ja stalno."
1:07:02,1:07:11,"Smiješ se mogu tek kad ja dođem ovdje na mikrofon, onda gledam se vas i kažem u sebi, ja vam ocaca praštam ljudi, ja vam praštam., ja vas razumijem."
1:07:12,1:07:15,"Možda biti kako hoćete, ali ja vas neću suditi."
1:07:16,1:07:21,"Oprostite i meni što nisam još bolji, ali htio bih biti, vjerujte mi."
1:07:22,1:07:27,"A da kažem, hoću vas voljeti, htio bih vas roditi kao dobar rotac svoju djecu."
1:07:28,1:07:32,"I na kraju, Bože, ja ti zahvaljujem što sam darovao ove ljude."
1:07:32,1:07:38,"Šta bi bilo da njih nema, badava sve moje znanje i moj život, ovako gledam koliko je rađeno."
1:07:39,1:07:45,"Jer kad utišem u vas ono dobro, vi ste novi ljudi, nova je domovina, novi sin."
1:07:47,1:07:50,"I zato oprostite, zato oproštenje zapravo mijenja mene."
1:07:51,1:08:01,"I sto puta sam vidio prijatelje dragi, kada ono idem iz kuće ili u kuću, idem na neki posao i susretnem se s nekim ljudima za koje znam povrijedili su me i oni ne mogu ni misliti na njega."
1:08:02,1:08:09,"Onda samo znam jedno dok idem ili već prije toga, samo gledam u duhu, ja ti opraštam, potpuno ti opraštam, može biti kako hoćeš."
1:08:09,1:08:17,"Ja sam osobno kao da nešto od mene silazi i ja idem usred tom čovjeku, mogu se smijati mirno, sve najbolje govoriti."
1:08:17,1:08:24,"Jer kad ja kažem oprašati znači ja neću ni jednu riječ spomenuti negativno, ja te neću suditi, ja te neću nikada suditi, ne ja ne."
1:08:24,1:08:26,Jer Isus kaže ne sudite i ne osuđujte.
1:08:26,1:08:29,"Jer ako te bude osuđiv, ja sam osuđđen, ja sam osuđen, pa nisam lud."
1:08:29,1:08:31,I to je ta mudrost koju treba znati.
1:08:32,1:08:35,I to su te rane duhovne koje su sasvim drugačije od fizičkih rana.
1:08:36,1:08:43,I ako njih ne shvatiš u tom paradoksalnom zapravo s onim jednom porođaju u tebi nećeš se za to osloboditi.
1:08:44,1:08:47,Ali tako napraviti ti poseban sposoban susreti svakog čovjeka.
1:08:48,1:08:54,"Da ne znaš kako si imao protiv njega, govorio si protiv njega, možda si ugovarao, ulagao protiv njega i sad te stid možda pričekao."
1:08:55,1:08:57,A čovjek kaže samo to se opraštam ti.
1:08:58,1:09:03,"Onda polako dodaš oprosti ti meni, da oprosti negativno sam mislio protiv tebe."
1:09:03,1:09:08,"Ruža sam te zapravo u sebi osjećao, žao mi je, oprosti mi."
1:09:08,1:09:10,To je čudo kako postaješ slobodan.
1:09:10,1:09:16,Točno osjećam kako mi proradi i želju da si pluća i srce i glava i mozak sve zdravo.
1:09:17,1:09:20,Ako to ostane u tebi sve onda ne možeš spavati.
1:09:21,1:09:24,Krvotok se stisne i krv ne teče kako treba.
1:09:25,1:09:28,"Pluća su stisnuta i ne mogu primati zrak, ne možeš duboko udariti."
1:09:29,1:09:30,Ti si gotova.
1:09:30,1:09:34,"Želo u nogama se stišću, vene su gotove i ti ne možeš hodati."
1:09:34,1:09:39,"Želju da stisne pravi rak, ne mora rok, ali dobro, čir, a crijeva opet hemoroida i tako."
1:09:40,1:09:46,Svatimo dakle da jedna takva ureda napravi jedna tisuća bolesti i mislim da i mi se onda pitamo kako to.
1:09:46,1:09:54,"I liječnici mi kažu profesor dajte mi protumačite, osobito onog kardiologa Zamiz Splita, ali znam isto liječnike Serebra i druge kolege, prijatelje."
1:09:55,1:10:04,"Kažu Tomislav Zamiz dođe mi kaže ima te i te probleme sa želudcem, sa srcem osobito, sa glavom itede I tražim nema ništa, ništa, ništa."
1:10:04,1:10:05,Ja kažem ne za šta.
1:10:06,1:10:15,"I onda znam da smo učili, kaže psihofizički treba, jel, promatrati, psihosomatski, onda pokušavam, kaže psihijat, psihički to nema, ne znam što."
1:10:16,1:10:16,Zašto?
1:10:16,1:10:24,"Na psihičkoj razini nikad nećeš za toga, jesi li neko povrijedio, jesi li učinio zlo protiv njega, je li on tebe povrijedio, jesi li oprostio, to nema."
1:10:25,1:10:26,I kažem šta ću?
1:10:26,1:10:31,"Dam nekoliko lijekova samo da simptomatski se malo pomogne, ali to ne riječi."
1:10:31,1:10:36,"Otkloni simptome da te ne boli, on je glava zadnjih dva tri sata, a iza toga još gore."
1:10:36,1:10:37,"Kako izliječiti, pitaju."
1:10:38,1:10:42,Ma vi ne znate koliko sam i Hrvati sretni da nam Bog dao to otkriće duhovne dimenzije.
1:10:44,1:10:44,Sve je u tome.
1:10:45,1:10:50,"Čitavo društvo ćemo promijeniti, sve bolesti moći liječiti, prijatelji i dragi."
1:10:50,1:10:52,Svi ćete ljudi moći biti prijatelji.
1:10:52,1:11:08,"Ti znaš put kako da riješiš, kako da si olakšaš, kako da u tebi funkcionira svaki organ, kako da duša se veseli, kako da budeš kreativan, kako da stvaraš, pišeš, kako da se ne baviš nijednom negativnom mišljenju, nijednom bolešću, ničim, ne, nikakvim strahom, s tim ti ne baš ništa."
1:11:08,1:11:22,"I kad ne vjeruješ u strah, kad ne vjeruješ u bolest, ne vjeruješ u prijetnje, tada sigurno, sigurno uspijevaš jer to dobro u koje ti vjeruješ tjera izle ljude, izlo iz njih i mijenja njih, a osobito mijenja i slobađa te ljude."
1:11:25,1:11:34,"Ovaj tjedan ove dvije stvari za sad napravite da naučite svakako čim ustaješ, ona se sjeti koga će sve danas sresti."
1:11:35,1:11:44,"I odmah, odmah gledaš ga u oči, u duhu iz toga, opraštati, neću te suditi, određati se toga da išta negativno te govorim."
1:11:44,1:11:48,"Možeš biti kakva hoćeš, ja te neću suditi."
1:11:48,1:11:49,Šta je vidjeti to čudo?
1:11:50,1:12:00,"Pa to je nevjerojatno kolika snaga odjedan puta poteče, kolika inteligencija, koliki mir, koliko zdrav je, s kakvom pravom bi gimnastikom sve do podne."
1:12:03,1:12:24,"A onda kad još kažem drugu, oprosti ti meni, nisam znao do sada biti mudar, čist prema tebi, nisam znao zapravo oprostiti, nisam znao razumjeti, ogovarao sam te, mislio protiv tebe, sve sam išao kako ću te napasti, kako ti ne radiš dobro, šta to radiš ovo i ono, sad je žao, oprosti."
1:12:25,1:12:32,"Kad to dvoje napravite, vi ćete drugi puta doći tako da ćete reći profesor, ne moramo više imati kinotehiku, mi smo novi ljudi."
1:12:33,1:12:38,"Vjerujte mi, tako snažno, onda ću vam sljedeći puta zadati druge dvije stvari."
1:12:39,1:12:49,"Jer kad vi kažete oprostite, onda zapravo kažete smiješ k meni doći i to osjete ljudi, smiješ k meni doći, ja te neću suditi."
1:12:50,1:12:56,"I to tako osjetite jer pazite, duh nema granica, duh neposredno djeluje, duh neposredno se komunicira."
1:12:56,1:13:01,"Ono što ti misliš što se komunicira, da mi sudimo, vi ste čuli šta ja ja želim vama reći."
1:13:02,1:13:09,"A onda kad kažete oprostite meni, zapravo kažete dopustite da ja smijem doći k tebi, da smijemo biti zajedno."
1:13:09,1:13:13,I upravo to zajedništvo stvara da se taj čovjek počne mijenjati.
1:13:14,1:13:18,Ono što da ti više ne mrzite njega smije k tebi i on je slobodan.
1:13:18,1:13:23,"I da on više ne treba mrziti tebe jer ga moliš da ti oprosti, slobodan ti."
1:13:24,1:13:26,I na taj način nastaje zdravlje.
1:13:26,1:13:36,"Vidjet ćete najteže bolesti, schizofrenija, sve moguće maligne fizičke bolesti, somatske, izliječit ćete ako to napravite ovaj tjedan."
1:13:37,1:13:37,Čudo.
1:13:38,1:13:40,Jer one su i nastale na temelju toga.
1:13:41,1:13:41,Sjetite se što dr.
1:13:42,1:13:52,"Jovanas kaže, od sto bolesti sedamdeset ih je nastalo, od konflikta u savjesti, od te unutarnje povrijeđenosti tebe itede ili dr."
1:13:52,1:14:04,"Lipton čitajte njegovu knjigu biologija duša, biologija vjerovanja kad kaže ljudi zapravo ubacuju u naše gene negativne sadržaje i onda to djeluje negativno i stvara bolesti."
1:14:05,1:14:20,"Iako ljudi oko tebe govore tebi pozitivno i dobro i ako ti onda izutra sebi govoriš da ja vjerujem bit će dobro i ja vjerujem da sam zdrav i bit ću zdrav, ti ubacuješ, upisuješ u gene ono što tvoje stanice, sve milijarde stanica surađuju na tome da ti posao ostaneš zdrav."
1:14:20,1:14:22,"A to je najnormalnija logika, prijatelji."
1:14:23,1:14:24,To je najnormalnija funkcionalnost.
1:14:24,1:14:25,Dugo ne duša.
1:14:26,1:14:27,To je zašto nigdje nije učila.
1:14:28,1:14:30,"A ne može kad tijelo drugačije funkcionira, psija drugačije."
1:14:31,1:14:32,Morate naučiti ovdje.
1:14:32,1:14:33,Šta ću ja?
1:14:35,1:14:42,"Poslije kao da imali sveučilište i tako dalje, pa onda ovo bude poseban predmet na sveučilištu ili posebnu kliniku da imamo, onda ćemo drugačije."
1:14:42,1:14:44,Ali za sada ovdje naučite odmah.
1:14:44,1:14:47,Tako da vas možemo potrebiti za znanstveni dokaz.
1:14:49,1:14:49,Odmah.
1:14:52,1:14:57,"Dakle, zapamtite, morate proučiti kod kuće što je to hagioterapija."
1:14:58,1:14:59,Što to ona proučava?
1:15:00,1:15:02,Što to ona poručuje svijetu?
1:15:03,1:15:24,"Kako ona kaže društvu i političarima i prosvjetnim djelatnicima i svima, ljudi možete biti zdravi, ljudi društvo može biti bolje, ljudi ne svađa nego pomirenje, ljudi ne zlo gledati nego dobro gledati jedni u druge, promijenit ćemo Hrvatsku, vidjet ćete, to uopće nije teško."
1:15:25,1:15:36,"Kad ja gledam kad sam kao mladi svećenik djelovao u Frankopanskoj, studenti su mi dolazili, tisuća studenata je prošlo kroz tih trinaest godina što sam tamo predavao vjeronauke, sigurno su svi promijenili."
1:15:36,1:15:45,"Sad kad ih sretan, to su dečki koji su u politici angažirani, imaju svoje firme, puno djece, radosti, kažu pa se vi sjećate, ja sam dolazio k vama u Franko Pavlinsku na Vrnavu."
1:15:45,1:15:48,"Franko nemoj pun, tko bi sve zapamtio?"
1:15:50,1:15:55,"I kad mi pričao onda koliko sam sretan da to više nikad ne mogu zaboraviti, koliko ih je to mijenjalo onda."
