Start (HH:MM:SS),End (HH:MM:SS),Segment
0:00:01,0:00:22,"Dobro večer onima koji su dobri ljudi, hvaljeni su se Marija koji su katolici, nadam se da ste dobro, idemo polako, korak po korak u ono zašto smo ovdje večeras, nadam se da ste svi svjesni zašto ste došli i da svi kao i ja tražite ono što je bitno."
0:00:22,0:00:33,"HGO terapija kao riječ najprije, HGOs grčki znači sve, terapija znači liječenje, postupak, dakle posredovanje, terapije, odnosno liječenje nekom bolesniku."
0:00:35,0:00:51,"HGOs naziva Nazvali smo dakle haglotherapiju zbog toga što je čovjekova duhovna dimenzija sveta, jer je po katehizmu Katoličke crkve, a i po najnovijim istraživanjima neuroznanosti, zapravo to sveto područje čovjeka."
0:00:52,0:00:55,"Životinju smiješ jesti, peći i tako dalje."
0:00:56,0:00:58,"Meso jedete, jel?"
0:01:00,0:01:01,Srama zbilo.
0:01:01,0:01:02,Jadna životinja.
0:01:03,0:01:04,"Također i biljke, zar ne?"
0:01:04,0:01:05,I njih jedevo.
0:01:05,0:01:08,To su isto živa biljčanja i nitko na njih ne misli.
0:01:08,0:01:10,Ali čovjeka ne možeš ispeći.
0:01:11,0:01:12,To je bio užas.
0:01:13,0:01:23,"I pitamo se po čemu se to čovjek onda razlikuje od životinja koje smiješ ispeći, uživati u njima, napraviti sve moguće najbolje, najbiranija jela."
0:01:24,0:01:35,"Od čovjeka ne možeš baš ništa osim očekivati rat, koju ružno riječ ili pak ljubav poput majčinske, sestrinske, prijateljske i tome slično."
0:01:36,0:01:36,To je čovjek.
0:01:37,0:01:47,"Dakle, budući da je čovjekova duh ona duša od Stvoritelja, a Stvoritelj je jedino svijet, to je jedno apsolutno biće, on je bitak, onda zbog toga je čovjek svijet jer od njega."
0:01:48,0:01:54,Čovjek je biće stvoreno od Stvoritelja i čovjek je zapravo jedini partner Stvoritelja.
0:01:55,0:02:02,"On u sebi ima samo ljude da s njima razgovara, donekle anđele, a nisu mu tako važni kao ljudi."
0:02:03,0:02:08,Jer biti čovjek znači sadržavati u sebi sve što je stvoreno.
0:02:10,0:02:15,"Čovjek dakle u sebi sadržaje najprije materiju, mrtvu materiju."
0:02:17,0:02:24,"Zatim ima on biološki život, dakle živu stvarnost, biologiju, vegetativnu dušu."
0:02:25,0:02:33,"ima i psihičku stvarnost, koji ima i životinje i biljke, a ovdje mrtva materija, ali on je iznad svega toga još čovjek."
0:02:34,0:02:35,Po čemu?
0:02:37,0:02:48,"Svi koji su studirali medicinu, nauka o čovjeku, razne antropologije, svi koji su studirali psihologiju misle da znaju tko je čovjek."
0:02:49,0:03:01,"Psihologije znaš samo tko je životinja i što je životinjsko u čovjeku, ali čovjeka preko psihologije nećeš nikada dohvatiti jer on nije psiha, on je iznad psihe."
0:03:03,0:03:17,"Upravo to što je iznad psihe to upravo proučava hagioterapija koja s jedne strane dakle ima terapijski dio, terapijsko djelovanje, zato se zove terapija, hagioterapija."
0:03:18,0:03:31,Hagioterapija ne toliko kao da je to liječenje svetin kako neki hoće reći onda preneštaju znanstveni dio na religiozni dio što nije ispravno nego je to hagioterapija zato što se radi o svetom području čovjeka.
0:03:32,0:03:41,"Čovjek je i njegova duhovna duša svetinja, svet, njega ne smiješ dirnuti, njega ne smiješ upotrebljavati kao nekakav predmet, on je svetinja."
0:03:41,0:03:48,"Zbog toga što je svetinja, zato kažemo da je to hagioterapija, dakle liječenje svetinje svetoga u čovjeku."
0:03:49,0:04:10,"Ako se pitamo što to hagioterapija čini, prvo upozorava čitav svijet da smo u najvećoj zabludi čovječanstva i da znanost tek sada počinje polako dodirivati tu zabludu i otkrivati da čovjek dakle nije psihosomatsko biće nego da je on prvenstveno neumatsko biće, duhovno biće."
0:04:11,0:04:39,"Neuroznanosti, biološke znanosti, ali i filozofija, ali osobito fizika, sve dakle suvremene znanosti se dali na istraživanje duha u čovjeku i kažu da sve to predstavlja jednu revoluciju koja valjda nije tristotinjak godina najmanje ili četiristotinjak godina uopće postojala, da je to najveća revolucija, najdublja spoznaja sad pred kojom mi danas stojimo, da je čovjek zapravo duhovna duša, da je on duhovno biće i da je duh bit čovjek."
0:04:41,0:04:42,Ali mi nažalost ne znamo što je duh.
0:04:43,0:04:53,"Doktor Erik Kandr koji je dobio Nobelovu nagradu za istraživanje mozga sam je dakle rekao tu rečenicu, idem stvarati znanost o duhu."
0:04:54,0:04:59,"Do sada sam gaže cijeli život istraživao mozak i ja ne znam ni što je mozak, niti tko je čovjek."
0:05:00,0:05:02,Jer mozak nije fizika ni kemija.
0:05:02,0:05:05,"Jer kad nema života u mozgu, nemate imati ni mozak."
0:05:05,0:05:06,Mozak nije mrtva tvar.
0:05:07,0:05:09,A recite mi što to oživljava mozak?
0:05:09,0:05:15,"Kemijski elementi, fizikalni elementi, oni su samo mrtva tvar, materija, a mozak je živ."
0:05:16,0:05:18,"Ja se još pitam, što je to čovjekov mozak?"
0:05:18,0:05:23,"Jer kod životinja isto, vegetativna duša oživljava mozak."
0:05:23,0:05:26,"Psihička duša, kod životinja je itekako živimo onda."
0:05:27,0:05:29,Čovjek je drugačiji od životinja i bilja.
0:05:29,0:05:47,"Životinje ne misle, životinje ne govore, životinje ne stvaraju, životinje ne planiraju, životinje nisu slobodne, životinje nisu sebe svjesne, životinje ne traže smisao svoj, životinje ne znaju odakle su i zašto su, životinja nikad ništa nije načinila, priroda je ostala kakva je."
0:05:48,0:05:49,Tko je onda čovjek?
0:05:49,0:06:02,"Čovjek međutim misli, on razmišlja, čovjek razgovara, pokušava shvatiti, on traži smisao, čovjek radi, djeluje, neprestano hoće da mijenja ovaj svijet, da stvara svoj svijet."
0:06:03,0:06:07,"Čovjek boluje, plače i smije se, još se ne da životnja njenja smijala."
0:06:07,0:06:09,Zašto je čovjek toliko čovječan?
0:06:10,0:06:16,I zašto je čovjek spreman za slobodu domovine umrijeti i ljubav prema vlastitom djetetu život dati?
0:06:17,0:06:19,Sad će čovjek sposoban za pravdu umrijeti?
0:06:20,0:06:21,Životinja ne.
0:06:21,0:06:22,Tko je čovjek?
0:06:23,0:06:27,"I zašto čovjek ne zna odakle je došao na svijet, a on se to ne može prestati pitati?"
0:06:27,0:06:30,"I zašto čovjek ne zna što je smrt, kamo se sa smrću odlazi?"
0:06:31,0:06:47,"I zašto čovjek ne zna šta radi ta jedna okrugla zemlja, dakle, koja je jedina nastanjana i tražimo svemiru bar komadić vode, ako ičega, dok se čovjek da nestane na svijetu vode da bar tamo odemo, na njihove bunare, u svemir, kažu tako znanstvenici."
0:06:47,0:06:51,"Tražimo negdje voda, da li ga ima, ništa mi ne znamo."
0:06:51,0:07:11,"Gdje smo mi ovdje na Zemlji, kao na nekakvoj barci, kao na nekakvoj kugli u kojoj se vrti sedam milijardi ljudi, a da ne znamo odakle si došao, a kamo ti ideš, a zašto si došao na svijet, a zašto si rođen baš u Hrvatskoj, a što radiš ovdje sad večeras u kino teci, šta će biti sutra s tobom, a Breksutra, jesi li ti sretan?"
0:07:12,0:07:15,"Mučno je biti čovjek prijatelj, nemaš sudbinu u svojim rukama."
0:07:16,0:07:17,Tko te je poslao u svijet?
0:07:18,0:07:21,Majka i otac smiješno pita i pa će reći nemoj gluposti pričati.
0:07:22,0:07:24,A gdje si bio prije sto godina?
0:07:24,0:07:25,Pa kamo ćeš poslije sto godina?
0:07:26,0:07:26,Gdje ćeš tada biti?
0:07:27,0:07:28,Kamo ćeš otići poslije sto godina?
0:07:28,0:07:31,"Recite mi, poslije sto godina tebe nema."
0:07:31,0:07:34,"I recite mi, pa što si radio sve svoje godine ovdje na zemlji?"
0:07:35,0:07:40,"Ušao si sa plaćem iz majčine utrobe, izaći ćeš sa plaćem ljudi oko tebe što si umro."
0:07:41,0:07:41,Što si radio ovdje?
0:07:42,0:07:42,Ništa.
0:07:42,0:07:43,Gdje si bio?
0:07:43,0:07:43,Nigdje.
0:07:44,0:07:45,Kamo odlaziš?
0:07:45,0:07:46,Nikamo.
0:07:47,0:07:48,Tko si ti čovjek?
0:07:49,0:07:51,A ti znaš da imaš samo sebe i ti si svjestan toga.
0:07:52,0:07:54,Samo sebe i samo jedno čovjek želi spasiti život.
0:07:54,0:07:59,I hajde šulicom pa ti samo neki auto se mora približiti pa da će te udati u kakav se trzneš.
0:07:59,0:08:01,"I paziš, uj, jedino život spasiti."
0:08:02,0:08:09,"Čovjek ne misli mozgom nego amigdalom tako brzo prolaze kao flešu, upravo kao svjetlo prolaze te misli brže da se spasiš."
0:08:09,0:08:10,"Samo jedno želiš spasiti, život."
0:08:11,0:08:12,Jer život to si ti.
0:08:13,0:08:14,"Ako nemaš života, nemaš sebe."
0:08:15,0:08:16,Ali tko ti je dao život?
0:08:16,0:08:18,Jesam ti deinkarnirao?
0:08:18,0:08:20,"Moj, bio si tibetski car, jel?"
0:08:22,0:08:23,Kenetska carica.
0:08:23,0:08:24,I sjećate se čak toga.
0:08:25,0:08:25,Smiješ.
0:08:26,0:08:38,Sreća pa se i reinkarnacija riješila jer su prošle godine upravo znanstvenici na Frankovom institutu u Berlinu otkrili da zapravo svaki čovjek nosi sve informacije ljudske povijesti u sebi.
0:08:38,0:08:48,"Prema tome kada neki kažu deja vu, znači dogodi se neka nesreća pa imaš tako reći da sve u tebi nestane da onda rekuta čini se kao da si nekad negdje već bio."
0:08:48,0:09:01,"Tako ljudi kažu deja vu i iz toga onda pravi da postoji reinkarnacija, da su čovjeki u proglasu smrti, rađeni najprije u kravi, pa u svinji, pa ne znam u muhi, pa onda u nekom čovjeku koji je dobar, pa sve bolji i bolji i bolji, onda mora biti u nekoj godini."
0:09:01,0:09:07,"milijune godina, tako zvan Samstar, u neprestanoj prestanoj, prestano se ponovno rađa da dođe konačno u nekakva nebesa."
0:09:07,0:09:08,Tko si ti zapravo?
0:09:09,0:09:10,I čija je zemlja?
0:09:10,0:09:16,"Ti si našao sve bilje i živote, ti si našao u kišu i ti ništa ne možeš napraviti protiv nje."
0:09:17,0:09:22,"Ni Rusi koji su htjeli praviti oblake, ne mogu ni rastirati, tako ajmo i praviti."
0:09:22,0:09:24,"Ni Amerikanci, čija je ova zemlja?"
0:09:25,0:09:26,Čije su zvijezde?
0:09:26,0:09:29,"A recimo, a čije je tvoje srce i tvoja glava?"
0:09:30,0:09:31,Jes li ti negdje kupio svoju glavu?
0:09:32,0:09:33,Jes li kupio negdje svoje ruke?
0:09:33,0:09:35,Jes li negdje kupio svoje srce?
0:09:35,0:09:36,Tko je tebe načinio?
0:09:37,0:09:47,"Znam Znanstvenici se trude da prouče, da istražuju izdana uda noć za noć, godinu za godinu i nikako, nikako ne mogu, kaže naš dr."
0:09:47,0:09:50,"Vladimir Par, došli smo do zida i da više dalje ne znamo."
0:09:51,0:09:52,"I nikad nećemo znati, kažu."
0:09:53,0:09:53,Zašto?
0:09:54,0:10:01,"Zato što nemamo mogućnosti, nemamo sredstava, ne novčanih, nego nemamo uopće znanstvenih sredstava da bismo mogli dalje proučavati."
0:10:01,0:10:04,"Mi smo proučavali samo materiju, a mozak nije materija nego duh."
0:10:05,0:10:09,"Duša je duh, misao je duh, sloboda je duh, svijest je duh."
0:10:10,0:10:15,"Dakle, radioterapija s jedne strane će viknuti cijelom svijijetu, pazite ljudi, krenimo na pravi put."
0:10:16,0:10:27,"Zašto nam se događaju ovakve stvari i ratovi i bolesti i smrti i rak i nesreće itede i mržnja i da moraš ići u EU ne znaš zašto, zašto nam se sve to događa?"
0:10:28,0:10:35,"Ja želim reći samo ovo, zlo u svijetu dolazi samo od toga što ne poznamo da je čovjek duh."
0:10:36,0:10:37,Što je to duh?
0:10:39,0:10:42,"Znanstvenici o tome da je duh sloboda, što to znači?"
0:10:43,0:10:50,"Tjelesno dakle i psihički ti možeš biti sad samo tu i sada, sad i tu dakle to je prostorno i vremenski si ograničen."
0:10:51,0:10:52,Ti ne možeš sada biti u sutrašnji dan.
0:10:52,0:10:56,"Ja bih rekao, ja bih rekao, od vas hoću sutrašnji dan, ja bih rekao, profesor, evo mene u sutra."
0:10:56,0:10:56,Možeš li?
0:10:57,0:11:00,"Ja mogu, ali ne psihofizički nego duhom."
0:11:02,0:11:05,"I to nema aštom, pazi, jedno ima ašta, ne, duhom."
0:11:06,0:11:10,"Ja sam sada u sutrašnji dan, a ja sam već u nebu, ne znam gdje ste vi."
0:11:11,0:11:15,"Već sam u Južnoj Americi, već sam sada u Australiji, nema, vrijeme nema."
0:11:15,0:11:16,Zašto?
0:11:16,0:11:20,"Jer duh je sloboda prostora i vremena, to je bit duha kažu znanstvenici."
0:11:21,0:11:22,Zato ja sam svugdje.
0:11:23,0:11:25,Istovremeno uvijek ne mogu negdje ne biti.
0:11:25,0:11:31,"Drugo, duh je cjelina, cjelovitost, duh ne možeš dijeliti, sad će biti to osobno, ne, ti si stalno sve."
0:11:31,0:11:42,"Ja sam sada u trenutku moga začleća, sad sam u trenutku moga rođenja, sad sam u trenutku moje pučke škole, sve ja to obustim, sve ja to u sebi nosim, to sam ja."
0:11:42,0:11:46,"Ja sam već ono što će sutra biti i prekosutra biti, to je duh."
0:11:47,0:11:52,Duh je sveobuhvatan kao stvoritelj svijeta.
0:11:52,0:11:56,I to je jedna nova revolucija zapravo i to što hagloterapija mora vikrati svima.
0:11:57,0:12:10,"Ljudi ako ne otkrijemo duha upropatit ćemo se, pogotovo sada kada nam je zagađena čitava zemlja i kada nam prijete da bi trebalo smanjiti čovječanstvo na petsto milijuna ljudi, da je sedam milijardi previše, onda izmišljaju kako će nas skratiti."
0:12:11,0:12:15,"Svi smo mi osuđeni na smrt, ne samo po prirodi nego i po političarima."
0:12:16,0:12:18,"Oni misle da će oni ostati, a mi otići."
0:12:19,0:12:28,"Dakle, i ne snutimo zapravo koliki su to problemi veliki jer ako se mi sve više umračamo na zemlji onda ne možemo imati dovoljno hrane kažu stručnjaci."
0:12:28,0:12:29,Mi moramo onda kemiju upotrebljavati.
0:12:30,0:12:32,"Ako upotrebljavamo kemiju, mi smo zatrovali zemlju."
0:12:32,0:12:34,Da zatvorimo zemlju da više ne možemo narasti.
0:12:34,0:12:36,"Da smo zatrovali sebe, više nas nema."
0:12:36,0:12:37,I kažu šta je pametnije?
0:12:38,0:12:44,Što prije smanjiti čovječanstvo na petsto milijuna tako da se zemlja odmori ili pustiti da ovako sami sebe ubiju?
0:12:44,0:12:59,"Vidite, to su zapravo kriminalne misli, ali to već piše, imate knjižurne o tome napisanih i zna se da je među njima bio i Gorbačević, svi veliki tobože umovi čovječanstva odnosno bogataši velike kad su to odlučivali da treba nešto u tom smislu napraviti."
0:12:59,0:13:06,"I ne slušajte koliko je zapravo i gripa, ovaj ptičja i kralja ludilo i sve drugo, koliko je to zapravo ono što nam već prijeti."
0:13:07,0:13:10,Ptičja i svinska o ljudskoj više i ne govore.
0:13:12,0:13:21,"Drugim riječima, bez duha i poznavanja duha mi ćemo zaista sebe uništiti i to razumno uništiti, znate, logički uništiti jer nemamo drugog rješenja, nije istina."
0:13:22,0:13:38,"I upravo to agioterapija očevikanja, ono sad to ima rješenje jer duh nema granica i kada počnemo duhovno razmišljati, kada počnemo dakle na stranicama duha i uma i intelekta zapravo promatrati svijet i proučavati, onda ćemo odlučiti da su rješenja tu bez krajnja."
0:13:39,0:13:40,Jer materija je ograničena.
0:13:40,0:13:49,"Ja ako mislim da je materija rješenje za čovjeka, ja ako mislim da samo čovjek mora jesti, biti, obući se i gdje će stanovati onda imamo i to već dovoljno, ali to nije čovjek."
0:13:50,0:13:59,Kad mi kažu stručnjaci naši u Zagrebu recimo fizici proučavaju i na matematičkom PMF-u proučavaju baš pitanje determinističkog kaosa.
0:13:59,0:14:01,Što je to deterministički kaos?
0:14:01,0:14:06,Uvijek su bili sigurni da je zapravo svaki prirodni zakon željezni da se on ne može mijenjati.
0:14:07,0:14:20,"I nama su onda fizičari uvijek pregovarali da mi to ovo se pravimo glupo, fizičari s njim mogu praviti čudesna, ne možemo mijenjati prirodne zakone, odnosno čvrste itede Sada jedanput ta fizičari su pokrikli, oni sami su otkrili deterministički kaos."
0:14:20,0:14:26,"A kao znači, dok će nema čvrstog zakona, kao svaki časopis da nešto sasvim drugogo kaže izgleda."
0:14:26,0:14:31,"I zbog tog kaosa ne možeš više definirati šta je prirodni zakon, šta je silateža, šta je ovo, šta je ono."
0:14:31,0:14:31,Ne.
0:14:32,0:14:37,"Više nema fizičke sigurnosti, postoji samo jedna sigurnost duha, slobode."
0:14:38,0:14:47,"Dakle, to je ono prvo što Hagijoterapija svijetu mora cijelom viknuti da je znanost vrhunski postala sposobna da konačno otkrije čovjeka."
0:14:48,0:14:51,I ako me pitate a gdje je taj duh u čovjeku onda pitajte a gdje nije.
0:14:52,0:14:56,"Vrh tvoje noge je čovjek, jel da je to tvoja, tvoja noga je."
0:14:56,0:14:58,I vrh tvoje kose je isto i to si ti.
0:14:59,0:14:59,Kako?
0:15:00,0:15:00,Kaže dr.
0:15:01,0:15:10,"Beck, bečke jedan stručnjak, svaka stanica našeg tijela ima u sebi duhovnu dimenziju i svaka spoznaje i odlučuje tu strašnost."
0:15:10,0:15:13,"A ima milijun, milijardi stanica u čovjeku."
0:15:14,0:15:24,"I svaka stanica spoznaje vanjskim okrugom ima kao antenu koja prima sve moguće informacije u sebe i ona odlučuje, stanica odlučuje."
0:15:24,0:15:34,"I kaže ako ti razbijaš stanice, ako ubijaš sebe, ako si nemoralan, ako negativno misliš, govoriš itede točno se ovdje kao se stanice razbijaju i uništavaju."
0:15:34,0:15:44,"Može se mjeriti, to je ono, zato je ova pitanja, naime, duhovne dimenzije danas totalno znanstveno, znanstvenije od fizike i kemije svega drugog, jer se sve može mjeriti."
0:15:45,0:15:48,"Mjere se rezultati, mjere se zapravo plodovi onoga što zapravo duh radi."
0:15:49,0:15:52,I potom vidimo šta je zapravo duhovna dimenzija.
0:15:52,0:15:56,"Kad i počeš vjerovati da će biti dobro, probajte samo, ali to morate probati."
0:15:57,0:15:58,To nije vjerovati pa staviš ad akta.
0:15:59,0:15:59,Ne.
0:16:00,0:16:12,"Ono gdje smo mi zapravo zakržali, gdje smo se stvorili u životinja, tamo gdje smo pali duboko, to je upravo to što mi uopće ne znamo šta je duh i što ne znamo se koristiti, neizbjeno koristi zapravo sposobnostima duha."
0:16:13,0:17:01,"Zamislite ako duhu zavisi u tebi sedamdeset posto bolesti znači sedamdeset posto fizičke bolesti možeš izliječiti od sto sedamdeset izliječiš samo što liječiš duhovnu dimenziju što živiš po duhu što vjeruješ u dobro što tražiš istinu što si čovjekov ljubiv sedamdeset posto bolesti a da ne kažem da toliko ima bolesti a to je drugo što mora agioterapija viknuti najteže bolesti to su duhovne bolesti kada čovjek dobije rak kada je od nekog nesreće onda se neće ubiti toga ne tjera na ubos nego traži da se izliječi ali kad čovjek nema smisla, kada osjeti da on nije za ništa vrijedan na zemlji, da on ne zna zašto bi živio, se ubija, on uzima sebi život, on se želi uništiti do kraja, to je najteža bolest."
0:17:02,0:17:18,"A iza toga dolaze depresije, a onda teške krivnje, osjećaj krivnje, a onda da ne kažemo razne teške agresivnosti i niz tih bolesti, onda osobito različite takozvani egzistencijalne bolesti."
0:17:18,0:17:25,"Tko sam, odakle, tko upravlja sa mnom, zašto ja moram živjeti, tko mi je dao moju glavu, zašto moram biti muško, tako lijepo bi žensko?"
0:17:26,0:18:01,Zašto je moram imati sada trideset sedam godina ako se okrenu a vi lijepo sedamdeset tri jel kad se okrenu zašto je moram biti hrvat a zašto vi ste kinec pa hvala bogu što nisam lijepo je biti hrvat i to je najljepše na svijetu dakle bezbrojna pitanja koja su egzistencijalna a onda što će od mene biti zašto je moram trpjeti a zašto je moram umrijeti ja nisam nikad želio doći na svijet tko je mene bacio u ovaj život mene je to uvijek mučilo od djetinjstva to pitanje tko ima pravo mene ubaciti u život uživat.
0:18:01,0:18:02,Ja nikad nisam želio živjeti.
0:18:03,0:18:05,Ja sam uživao dok me nije bilo na zemlji.
0:18:05,0:18:06,"Ojoj, prije sto godina."
0:18:08,0:18:10,Nikad mi ništa nije falilo.
0:18:10,0:18:15,"Nisam bio ne bolestan, niti ne znam kakav, utrujen kako kažem Dalmatinci."
0:18:15,0:18:16,"Dakle, ništa uživao."
0:18:16,0:18:18,Znači da mi to moram patiti.
0:18:18,0:18:18,Zašto?
0:18:19,0:18:21,Onda sam napadao svoju majku.
0:18:21,0:18:22,Zašto si mene rodila?
0:18:22,0:18:25,"Pa malo to misle šta ti, nisam to i ja hila."
0:18:27,0:18:28,Znači to je još bolje.
0:18:28,0:18:30,"Nisam ni htjela, zar te ni sramam?"
0:18:31,0:18:33,"Pa kako ću to htjeti, kaže."
0:18:33,0:18:38,"Ja sam, ja sam samo neko dijete će se roditi, ja sam htjela dijete, kaže, došla si ti, šta ću ja sad?"
0:18:38,0:18:40,Niti ona zna zašto sam došla na svijet.
0:18:40,0:18:44,"Pitam tata, a ti tata, a kako ću ja ako mama ne zna?"
0:18:45,0:18:49,"Pitam stručnjake, učitelje, svećenike, nitko ništa ne zna."
0:18:49,0:18:50,Ja sam rekao svi ste neznalice.
0:18:51,0:18:54,"Pitam sedam milijardi ljudi, zna li iko odakle smo mi stigli na ovu zemlju?"
0:18:54,0:18:56,Zašto sam se ja morao roditi na zemlji?
0:18:56,0:18:57,Ma nitko me nije pitao.
0:18:58,0:19:01,Pa tko ima pravo bez moga pitanja mene ubasti u bol i patnju?
0:19:02,0:19:03,Odakle nekome pravo?
0:19:06,0:19:08,"Vidite, to su takozvani egzistencijalna pitanja."
0:19:09,0:19:33,"Na njima su se jako mučili, Heidegger, njemački jedan veliki filozof egzistencijalist, ali osobito francuski, Sartre, Kamill, te beskrajna užasna njihova djela i Sartre i Kamill, te Sartre je Kamill znao reći, kaže ubiti čovjeka to je najveće dobročinstvo, kaže jer čovjek ima velike čežnje da ih ostvari, a život je kratak i ne može ništa ostvariti."
0:19:34,0:19:36,"Čovjekovo život je besmisao, kaže Sartre."
0:19:40,0:19:46,"Kamill u svome djelu, la muš, muha jer kažu, pritisni i ubiti čovjeka kad ćeš napraviti dobro."
0:19:46,0:19:47,Čovjek nema smisla.
0:19:48,0:19:56,"Čovjek kaže kao muha u boci, ne može van, unutra nema smisla, lupa na sjenke, ne vidi kuda, šta, kako."
0:19:58,0:19:59,A zaista smo tako.
0:19:59,0:20:01,Recite mi što je to svemir?
0:20:03,0:20:04,Što je to nas okružuje?
0:20:06,0:20:19,"Kaže astronomi, malo je potrebno pa da samo nešto pokvari i da tresnu svi ti naši, sve naše, dakle, i mali i velike ljudska tijela i da razore u zemlju."
0:20:19,0:20:20,Malo je potrebno.
0:20:21,0:20:29,Tko je to imao potrebu da mene sadka utrobi moje majke?
0:20:30,0:20:32,Znate kako sam ja kompliciran?
0:20:32,0:20:32,Otekvi.
0:20:34,0:20:43,"Kako je naše tijelo komplicirano, al kako je naša misa komplicirana, kako je duša, kako je, tko je to imao volju stvarati moj mozak?"
0:20:45,0:20:52,"Kad mi ljudi kažu priroda, ja onda tražim, dajte mi tu prirodu da je upitan za zdravlje."
0:20:52,0:20:53,Kako me smjela stvarati?
0:20:53,0:20:54,Kakva priroda?
0:20:54,0:20:56,"Čovjek će Bože, glupost."
0:20:56,0:20:56,Gdje je?
0:20:57,0:20:57,Šta je?
0:20:58,0:20:59,Priroda stvara.
0:21:00,0:21:03,Jer na Jer najgore kad kažu pa to zakoni stvaraju.
0:21:03,0:21:04,"Dobro, a koji zakon je stvorio?"
0:21:06,0:21:07,Smiješno.
0:21:07,0:21:10,"Znači zakon prije nego je bio, oni sebi će stvoriti."
0:21:11,0:21:14,"To kao kad ja kažem Bože, a šta ti mene nisi pitao, hoću li ja živjeti?"
0:21:14,0:21:16,"On mi kaže pa niti bilo, kako će te pitati?"
0:21:17,0:21:19,Kako će se zakon stvarati sa sebe?
0:21:20,0:21:21,Zakon kad ga prije nema.
0:21:23,0:21:30,"Ali ljudi idu do besmisla, znate, osobito materialisti, samo da opravdaju to, da ne žele reći da postoji Bog."
0:21:30,0:21:30,Zašto?
0:21:30,0:21:33,"Jer onda oni pomožni ljudi kažu aha i vi vjerujete, jel?"
0:21:34,0:21:36,Da se prave pomožni ljudi važni.
0:21:36,0:21:38,"A pomožni Pa Bože, ljudi su obično najdalji od Boga."
0:21:40,0:21:43,"Pa to je isti koji misle o njemu, traže ga i pišu, oni su još najbliže."
0:21:44,0:21:50,"Vjernici ne trebaju Boga, oni bi ga to Bože imaju, pa Boga se ne može imati, samo tražiti."
0:21:51,0:21:55,"Neka se može samo s leđa vidjeti, on je uvijek ispred tebe, uvijek te vodi naprijed."
0:21:56,0:21:59,"Onaj koji kaže da zna za Boga da ga vidi, taj nije vjernik."
0:22:01,0:22:08,"Nažalost, to su dva, dva zapravo, dva ekstrema koji nijedan ne rješava te probleme."
0:22:09,0:22:12,"Ni materialisti koji kažu nema Boga, ni vjernici koji kažu ima ga."
0:22:12,0:22:14,Pa kako znaš da ga ima?
0:22:14,0:22:17,"Ja se cijeli život moći da ga pronađem, nigdje ga."
0:22:18,0:22:21,"A opet je stalno tu, nazovica se zagrlimo pa plačemo."
0:22:21,0:22:29,"Obojica, on plače što ja plačem, ja plačem što ne mogu ovako na ljudski odnosno što ga mogu na materijalni način uhvatiti."
0:22:29,0:22:34,"Ali kad idete u ljubavi u duha i duhovnu dimenziju, onda to vidite, evo tu je."
0:22:36,0:22:43,"Pogotovo Isus iz Nazareta koji je postao čovjekom pa uskrsnuo, on je tako bliz, tako neposredan, on milina je biti."
0:22:44,0:22:50,I to mi jedino daje smisao i samo zbog toga ovdje imam još snage govoriti vam jer postoji Bog.
0:22:50,0:22:58,"Samo zato se isplati biti čovjek, kaže Dietrich Bonhefer koji je poginuo u koncentracijskom logoru u Flossenburg u Njemačkoj."
0:22:58,0:23:03,Samo se zato isplati biti čovjek jer na ovoj zemlji živio Isus iz Nazareta.
0:23:04,0:23:11,"Da on nije živio, sve što ljudi misle, rade, govore, sve što pišu i stvaraju ne bi imalo smisla."
0:23:13,0:23:17,Samo zato što je on tu živio ja znam da ću ja preživjeti sve smrti.
0:23:17,0:23:19,Ja znam da smrt nije kraj nego prolaz.
0:23:20,0:23:20,Uf što mi je to lijepo.
0:23:21,0:23:23,Zadnji put sam pričao kako je to moj tata doživljavao.
0:23:23,0:23:26,"Ali svi ti ljudi klinički umorni, smrtne boli, prijatelji."
0:23:26,0:23:27,Svi se vi bojite smrti.
0:23:28,0:23:29,Smrt je nešto najljepše.
0:23:29,0:23:31,"Bojite se života, a to je najgore."
0:23:31,0:23:32,Treba izdržati život.
0:23:33,0:23:34,A smrt je preras dalje.
0:23:35,0:23:37,Kao što si prešao iz majčine utrbe finom.
0:23:38,0:23:38,Je li te boljelo?
0:23:39,0:23:40,Je li se ne sjećam?
0:23:41,0:23:43,Lijepo si prešao ovaj život i tu se razvijaš.
0:23:43,0:23:45,Ali da ga pređeš u naj.
0:23:48,0:23:51,Rečeš kako su ovi ljudi na zemlji jadni kad ne znaju.
0:23:51,0:23:53,Treba ovamo pređe da ovdje najljepša.
