Start (HH:MM:SS),End (HH:MM:SS),Segment
0:31:10,0:31:13,"Da, u Njemačkoj postoje ankete koje to dokazuju."
0:31:14,0:31:16,"Mislim da šezdeset posto Nijemaca kaže, ili je još više?"
0:31:17,0:31:17,Ne znam.
0:31:18,0:31:24,Ali mislim da je oko šezdeset posto Nijemaca kaže da neke teme ne govore.
0:31:25,0:31:25,Na primjer.
0:31:26,0:31:52,"Da, migracija, naravno, i sve ovo lijevo, kao što je to, ako kažete da je sve ovo queer stvar nešto što može biti problematično, pogotovo ako se protivite tome ili ako to nametnete malim djeci, onda će vas nazvati mrziteljem homoseksualaca, što je očito pogrešno."
0:31:53,0:31:54,"Mislim, ali."
0:31:54,0:31:58,Posebno za DAFD jer znamo za vaše.
0:31:58,0:32:00,"Da, to je dobar primjer."
0:32:00,0:32:00,Da.
0:32:01,0:32:10,"Mislim, to je pogrešno, ali znate, to ako to dovoljno često ponovite, nešto će vam se zalijepiti i vašoj reputaciji i imate problem."
0:32:11,0:32:12,I to je strategija.
0:32:13,0:32:19,"Kada je gospođa Merkel rekla da ćemo to uspjeti, bila je to najveća pogreška?"
0:32:19,0:32:26,Najveća je pogreška bila da je zapravo otvorila naše granice i onda se pretvarala da možemo to učiniti.
0:32:27,0:32:28,"Da, definitivno."
0:32:28,0:32:38,"Mislim, napravila je i druge pogreške, na primjer, odlučila je zatvoriti nuklearne elektrane nakon Fukushime."
0:32:39,0:32:46,"Ili otvaranje naših granica definitivno je bio najveći greška, dobro, za Njemačku i zapravo za cijelu Europu."
0:32:47,0:32:52,"Rekli ste visoke poreze, visoke poreze, da."
0:32:52,0:32:56,Kako funkcionira državna uprava u Njemačkoj?
0:32:56,0:32:57,Je li skupa?
0:32:58,0:33:03,To je vrlo skupo jer imamo veliki javni sektor koji treba financirati.
0:33:03,0:33:06,"Ponoviti ću, zvuči mi tako poznato."
0:33:07,0:33:10,"Dobivaju velike mirovine, zar ne?"
0:33:11,0:33:16,"A javni sektor, baš kao i u SAD-u, zaista treba smanjiti i mora."
0:33:53,0:33:55,A u Njemačkoj ih kritiziraju.
0:33:55,0:33:57,I to je jedna stvar koju moramo učiniti.
0:33:58,0:34:07,Ali u Njemačkoj imamo i puno birokracije jer uvijek želimo da stvari budu na isti način i precizne i slično.
0:34:07,0:34:10,I očito smo to potpuno pretjerali.
0:34:11,0:34:14,Ali imate sreće što ne živite u Hrvatskoj.
0:34:14,0:34:16,Ne znate što je zapravo birokracija.
0:34:17,0:34:17,Možda.
0:34:18,0:34:22,Ali u Njemačkoj je to ogroman problem i zbog toga gubimo mnogo novca.
0:34:23,0:34:31,I ovo je jedno od tema koje se sada puno pojavljuje u Hrvatskoj.
0:34:31,0:34:36,"Da, kad pitate političara što je sada važno."
0:34:37,0:34:48,"A naš ministar koji nas je isključio iz putovanja nije samo za europske poslove, već i za uklanjanje birokracije."
0:34:48,0:34:55,I do sada nije donio nikakav prijedlog ili utjecaj u parlamentu.
0:34:56,0:35:06,"I kritizirao ga je ne samo nas, već i sve druge oporbene stranke zbog toga što u tom području ne radi mnogo."
0:35:07,0:35:10,Što očekujete od nove vlade gospodina Mercesa?
0:35:11,0:35:11,Vrlo malo.
0:35:12,0:35:24,"Dakle, mislim da će nova vlada Mercesa biti još gora od koalicije za semafor koji su formirali socijaldemokrati, liberali i zelena stranka."
0:35:25,0:35:36,"Dakle, zapravo mislim da će biti gora jer će nastaviti s politikama koalicije za semafor bez prekida duga."
0:35:37,0:35:42,"Dakle, koalicija za semafor i dalje je imala prekid duga, a ZDS se riješio toga."
0:35:44,0:36:00,"Ako pogledate sporazume o koaliciji, vidjet ćete da je CDU SPD-u učinio mnogo ustupaka kako bi Friedricha Merza učinio kancelarom."
0:36:03,0:36:15,"Dakle, recimo, platforma je, recimo, osamdeset posto SPD-a i neće biti promjena jer je Merz obećao političku promjenu, zar ne?"
0:36:16,0:36:22,"Prije izbora, a nekoliko sati nakon izbora prekršio je sve svoje obećanja.."
0:36:22,0:36:30,"Dakle, mislim da će pad Njemačke nastaviti s Friedrichom Merksom."
0:36:30,0:36:31,Da.
0:36:31,0:36:53,"I najveći problem CDU-a i nove vlade jest da nemaju pregovaračku moć, po mom mišljenju, jer ne mogu ugroziti ljevičare, znate, mogli bismo to učiniti s AfD-om ako želimo, jer imaju ovaj Brandt Mauer, kao da je to požarni zid."
0:36:54,0:36:58,A požarni zid i oni imaju požarni zid za Linkę.
0:37:35,0:37:38,U SPD-u na posljednjim izborima.
0:37:38,0:37:49,"Ali ako se dobro pogledate, mislim da je to ispravno reći da je osamdeset posto više na lijevoj strani kad je u pitanju ishod onoga što su planirali."
0:37:49,0:37:54,"Dakle, u kojem smjeru se Njemačka sada kreće s novim kancelarom?"
0:37:54,0:37:58,"Da, mislim da je to pad."
0:37:59,0:38:05,"Dakle, nisam baš optimističan u vezi s bliskom budućnošću Njemačke."
0:38:06,0:38:12,Ima toliko problema i ne mislim da ih mogu riješiti ovim lijevim programom ili ovim lijevim stavom.
0:38:12,0:38:15,"Znate, postoji li stav prema SPD-u?"
0:38:15,0:38:18,"Dakle, veći gospodarski pad i veća migracija."
0:38:20,0:38:22,Bez ruskog plina?
0:38:22,0:38:27,"Da, bez ruskog plina, bez nuklearnih elektrana prije izbora."
0:38:28,0:38:30,Kako je to moguće?
0:38:30,0:38:42,"Dakle, prije izbora, CDU je rekao da će provjeriti mogu li se određene nuklearne elektrane ponovno aktivirati, a nakon izbora se riješili te ideje, zar ne?"
0:38:42,0:38:42,Kako je to moguće?
0:38:43,0:38:48,"Pa, kao što sam ranije rekao, 2011."
0:38:48,0:38:49,godine dogodila se Fukushima.
0:38:49,0:38:58,"I onda je Merkel odlučila zatvoriti nuklearne elektrane, iako u Njemačkoj nema potresa."
0:38:58,0:39:04,"Dakle, to je bilo osim političkih potresa, zar ne?"
0:39:04,0:39:07,"Dakle, da, ona je samo vrlo oportunistička."
0:39:08,0:39:22,"Samo je mislila, dobro, ljudi, Nijemci bi sada mogli biti uplašeni nuklearnim elektranama zbog nesreće koja se dogodila u Fukušimi zbog potresa, koji opet nemamo u Njemačkoj, zar ne?"
0:39:22,0:39:26,I zato je odlučila zatvoriti našu.
0:39:26,0:39:35,Zatvorili smo čiste i učinkovite nuklearne elektrane koje proizvode jeftinu energiju bez CO2-a.
0:39:36,0:39:39,"A onda je započeo rat u Ukrajini, a ostatak je povijest."
0:39:40,0:39:40,"Da, da."
0:39:40,0:39:41,"Ostatak je povijest, da."
0:39:42,0:39:53,"Dakle, imamo problem da smo u opasnosti da imamo možda blackout ili brown out koji je doživjela Španjolska i Portugal prije nekoliko tjedana."
0:39:53,0:39:54,"Da, prije nekoliko tjedana."
0:39:55,0:40:03,"I to je ono što vam treba, pogotovo u industrijaliziranoj zemlji, potreban su elektrane koje su osnovne."
0:40:03,0:40:17,"To znači da moraju raditi cijelo vrijeme, znate, jer vam je potrebna struja ujutro kad se svi probude, a trebate je imati i navečer kad se svi vrate kući, nešto skuhaju i slično."
0:40:18,0:40:27,"I ne možete to planirati s vjetrenom i solarnom energijom jer sunce sja kad sja, a noću ne sja."
0:40:27,0:40:33,"I ako vjetar nije i zimi je magla, nemate dovoljno energije."
0:40:34,0:40:40,A ljeti imate previše energije i moramo prodati energiju drugim zemljama.
0:41:16,0:41:23,Nije bilo nikakve pravilne istrage i mi smo jedina strana koja to zaista želi istražiti.
0:41:24,0:41:31,I očito ih želimo popraviti i ponovno uvoziti ruski plin kroz te naftovode.
0:41:32,0:41:38,"Mislim, postoji jedna niz koja još uvijek radi, ali još uvijek je ne koristimo, što je apsolutna ludost."
0:41:38,0:41:44,"I dalje primamo ruski plin, ali ne kroz naše naftovode, već kroz druge zemlje po mnogo, mnogo višoj cijeni."
0:41:44,0:42:06,"Da, naša industrija treba ruski plin, posebno, na primjer, kemijska industrija i BSF, na primjer., Njemačka napušta Njemačku po malo i ulaže deset milijardi dolara u Kinu jer su cijene energije tamo mnogo, mnogo niže nego u Njemačkoj."
0:42:09,0:42:12,Mnogi vjeruju da snažna Njemačka znači i snažnu Europu.
0:42:14,0:42:16,Je li Njemačka sposobna za to?
0:42:18,0:42:31,"Mislim, naš je stav u tome da želimo snažnu Europu i da želimo imati dobru prijateljsku vezu sa svim našim susjedima i da imamo dobre odnose i da želimo imati pragmatične odnose."
0:42:31,0:42:34,"Znate, kao što je gospodarska razmjena i slično."
0:42:34,0:42:42,"Dakle, mislim da snažna Njemačka čini i snažnu Europu, ali to morate odvojiti od EU-a."
0:42:42,0:42:52,"Dakle, jer je EU, po našem mišljenju, mislim, počela je kao dobra ideja, ali sada se razvila u nešto stvarno, stvarno problematično."
0:42:52,0:43:07,A euro birokracija i eurokrati u Bruxellesu nešto je što prijeti našoj suverenosti i suverenosti svih država koje su unutar EU-a.
0:43:07,0:43:11,To se može reći i za Hrvatsku.
0:43:11,0:43:23,"I da, to je nešto što kritiziramo u vezi s EU-om i na neki način želimo napraviti, znate, povući se korak unatrag jer ne želimo ovu političku uniju."
0:43:24,0:43:28,Želimo imati sindikat jer mislim da je to priča o uspjehu.
0:43:29,0:43:31,Želimo imati unutarnji tržište.
0:43:31,0:43:31,Što je to?
0:43:33,0:43:34,Zajednički tržište.
0:43:34,0:43:35,To je ono što želimo.
0:43:36,0:43:40,I mislim da je to pragmatičan pristup cijeloj ovoj temi.
0:43:41,0:43:44,I mislim da je to u biti.
0:43:44,0:43:56,"Dakle, ova suradnja, ova gospodarska suradnja, na to se moramo usredotočiti i to je naš opći cilj za Europu kao stranku."
0:43:56,0:44:05,"A kad je u pitanju vaš pitanje može li Njemačka zapravo voditi Europu, mislim da je Njemačka još uvijek relativno jaka."
0:44:06,0:44:10,"Kao što smo rekli, ona je na strmom padu, ali je i dalje relativno jaka."
0:44:10,0:44:20,"Dakle, ekonomski je u redu, ali politički imam dojam da njemački političari ne žele preuzeti vodstvo."
0:44:20,0:44:22,"To je više Francuska, zar ne?"
0:44:58,0:44:59,Mislim da svi to radimo.
0:45:01,0:45:07,"U redu, spomenuli ste Europsku uniju, ali htjela bih vas pitati o Ursulini von der Leyen."
0:45:08,0:45:09,Njemačka je.
0:45:09,0:45:12,Bila je njemačka ministarica obrane.
0:45:12,0:45:15,Što mislite o njezinom političkom radu?
0:45:16,0:45:23,"Mislim, ako pogledate njezin politički rad u Njemačkoj kao ministaricu, bila je potpuna katastrofa."
0:45:27,0:45:30,Bila je odgovorna za našu vojsku.
0:45:32,0:45:42,"I da, mislim da nisam pretjeralaujem kad vam kažem da naša vojska više nije sposobna braniti našu naciju."
0:45:43,0:45:45,Nedostaje nam puno stvari.
0:45:45,0:45:46,Nemamo ljude.
0:45:47,0:45:49,Nemamo tenkove.
0:45:49,0:45:52,"Imamo neke tenkove, ali ne funkcioniraju."
0:45:53,0:45:57,"Od deset tenkova jedan radi, a ostatak stoji u hodnicima."
0:45:58,0:46:02,"I isto je s našim zrakoplovima, helikopterima i slično."
0:46:03,0:46:05,"Dakle, donijela je strašne odluke."
0:46:06,0:46:13,I mislim da je jedna od najzabavnijih stvari bila da su naši tenkovi morali biti sposobni biti.
0:46:13,0:46:17,Moguće je da ih upravljaju trudnice.
0:46:17,0:46:18,Nisam čula tu priču.
0:46:19,0:46:19,Reci mi.
0:46:21,0:46:35,Moralo je biti kao da su pronašli pravu tvrtku za koju su je htjeli kupiti.
0:46:35,0:46:42,To je bilo jedno od toga što su spremnike morali upravljati trudnice.
0:46:42,0:46:45,"Mislim, bilo je ludilo, znaš."
0:46:46,0:46:50,I rekla je da su u prostorijama.
0:46:50,0:46:57,"U sobama vojnika moraju biti ravne zaslone, znate, tako da je Bundeswehr privlačniji za mlađe ljude."
0:46:57,0:46:59,Jača.
0:46:59,0:47:01,"Da, i jača, naravno."
0:47:02,0:47:05,"Dakle, potpuno pogrešno donošenje odluka u tom trenutku."
0:47:06,0:47:17,"A onda je, da, poslana u Europu jer je blizu Angele Merkel."
0:47:18,0:47:27,"I mislim da su obje na isti način, stil donošenja politike, kao što je iza zatvorenih vrata."
0:47:28,0:47:31,"I mislim da je stručnjakinja u tome, kao i Angela Merkel."
0:47:32,0:47:44,I mislim da je to razlog zbog kojeg je poslana u Bruxelles jer je više nisu trebali u Njemačkoj jer je njezina reputacija bila toliko oštećena.
0:47:44,0:47:45,A sada vodi EU.
0:47:46,0:47:50,"Sada vodi EU kao jedna od najvažnijih osoba, političkih osoba na svijetu."
0:47:50,0:47:53,"I da, to se nastavlja."
0:47:55,0:47:57,"Da, i smijem li dodati da je i korumpirana."
0:47:57,0:48:04,"Dakle, čak i u svojoj ulozi ministra obrane, potrošila je mnogo novca na korupciju."
0:48:40,0:48:47,"Draga gospođo Nguyen, nešto samo za vas."
0:48:48,0:48:52,Kakvo je to biti žena u politici u Njemačkoj danas?
0:48:53,0:48:58,Migrantka s vjetnamskim korijenjem i još uvijek u AFD-u.
0:48:58,0:49:00,Osjećate li mržnju i predrasude?
0:49:02,0:49:05,"Pa, naravno, ne od strane moje stranke, nego od lijevaca."
0:49:05,0:49:09,"Dakle, dobivam puno mržnja od lijevaca na društvenim mrežama."
0:49:10,0:49:13,"Ja sam vrlo aktivna na društvenim mrežama i da, vidjela sam to."
0:49:13,0:49:15,"Da, vrijeđaju me."
0:49:15,0:49:17,Vrijeđaju me puno.
0:49:17,0:49:18,Što rade?
0:49:18,0:49:18,Što pišu?
0:49:18,0:49:27,"Da, na primjer, da sam dječak i da čekam da me Rusi siluju, a onda me pucaju."
0:49:28,0:49:46,"Da, samo rasističke i vrlo seksističke stvari, da sam nacistička prostitutka i slično, da ću biti deportirana kad bude na vlasti AFD, a onda ću se vratiti u Vijetnam i prostitutirati se i slično."
0:49:47,0:49:47,Da.
0:49:48,0:49:48,Strašno.
0:49:48,0:49:52,Ali vaši su roditelji došli iz Vijetnama.
0:49:52,0:49:53,"Da, točno."
0:49:53,0:49:54,"Dakle, pobjegli su početkom 19."
0:49:54,0:49:55,stoljeća.
0:49:55,0:50:06,"Rano osamdesete, pobjegli su od komunizma kad su komunisti preuzeli Zajgon iz vjerskih razloga jer pripadaju kršćanskoj manjini."
0:50:08,0:50:09,A vi ste rođeni u Njemačkoj?
0:50:09,0:50:11,"Ja sam rođen i odrastao u Njemačkoj, da."
0:50:11,0:50:16,"Kao i vaša sestra, a Njemačka je vaša domovina."
0:50:16,0:50:17,"Definitivno, da, definitivno."
0:50:19,0:50:21,"Moje posljednje pitanje, u redu."
0:50:22,0:50:23,Što mislite da dolazi?
0:50:23,0:50:25,Kakva je budućnost Njemačke?
0:50:28,0:50:31,Mislim da bliska budućnost Njemačke nije baš sjajna.
0:50:32,0:50:36,Imamo toliko problema koje moramo riješiti.
0:50:37,0:51:03,"Ali mislim da novonabrani Mertzov vladar ne može riješiti te probleme jer, kao što smo rekli, ne govore o stvarnim razlozima za probleme i samo ulažu novac u neke teme i misle da će taj novac riješiti sve probleme."
0:51:03,0:51:12,Ali morate don napraviti dobre programe kako biste se borili protiv problema.
0:51:13,0:51:16,"A ako samo uložite novac u nešto, to neće riješiti probleme."
0:51:18,0:51:27,I mislim da će čak i brže pasti naš pad zbog toga.
0:51:29,0:51:32,I zbog toga AFD raste.
0:51:33,0:51:36,Mogli bismo ući u vladu na sljedećim izborima.
0:51:36,0:51:37,Vidjet ćemo.
0:51:37,0:51:46,Nadam se da ćemo uskoro ući u vladu na istoku jer će sljedeće godine biti nekih saveznih izbora koji su zaista važni.
0:51:47,0:51:56,"I onda se nadam da ćemo moći početi spasiti zemlju, ali to će potrajati desetljećima, a ne samo četiri ili pet godina."
0:51:57,0:52:03,"Dakle, niste optimistični u pogledu budućnosti Njemačke, u pogledu budućnosti Njemačke."
0:52:03,0:52:14,"Ne, nisam optimističan, ali mislim da ćemo, ako dođemo na vlast u roku od nekoliko godina, pokušati spasiti mnoge dobre stvari Njemačke."
0:52:14,0:52:18,I to će biti teško i teško će se boriti za to.
0:52:19,0:52:21,"Dakle, definitivno postoji srebrna strana."
0:52:21,0:52:23,I u politici mislim da se morate.
0:52:23,0:52:29,Hvala vam što ste se priključili.
0:52:30,0:52:33,Hvala vam što ste se priključili.
0:52:33,0:52:42,Hvala vam što ste se priključili.
0:52:42,0:52:51,Hvala vam što ste se priključili.
