Start (HH:MM:SS),End (HH:MM:SS),Segment
0:00:21,0:00:23,Dobrodošli u podcast Mrežnica.
0:00:23,0:00:27,Naši današnji gosti su gospođa Ana Nuen i gospodin Kristijan Rode.
0:00:27,0:00:31,Oboje su zastupnici AFD-a u Hessenskom parlamentu.
0:00:31,0:00:36,Ono što je zanimljivo je da je upravo gospođa Nuen migranskih korijena.
0:00:36,0:00:38,Njeni roditelji tijekom 80.
0:00:38,0:00:44,godina godina prošlog stoljeća došli su u Njemačku gdje su pobjegli zapravo pred komunistima iz Vjetnama.
0:00:44,0:00:49,Ona i sestra rođene su u Njemačkoj i ponosne su na svoje kršćanske korijene.
0:00:49,0:00:56,"No ono što je još bitnije, je da je njena priča priča o uspješnoj integraciji u Njemačkoj."
0:00:56,0:01:06,"Gospodža Nuenu za sve to i zamjenica je glasnogovornika za evropske politike u parlamentu, a opisuju je kao ženu od koje strahuje njemačka vodeća stranka."
0:01:07,0:01:10,Uz to predsjednica je odbora za evropska pitanja.
0:01:10,0:01:14,Njen kolega Kristijan Rode glasnogovornik je za evropske politike.
0:01:15,0:01:25,"Oboje su mladi ljudi kojima predviđaju sjajnu političku budućnost u stranci koja je trenutno, kako to neki bi htjeli, a neki možda i ne, najpopularnija u Njemačkoj."
0:01:25,0:01:26,I još detalj.
0:01:26,0:01:41,"I gospođa Nue i gospodin Rode trebali su biti dio službene njemačke delegacije u posjeti Hrvatskoj, no onda su u zadnji čas skinuti s tog popisa jer je njemačka služba AFD, odnosno njihovu stranku, okarakterizirala kao radikalno desnu."
0:01:41,0:01:51,"Danas su naši gosti pa ćemo iz prve ruke čuti sve ono što se događa zapravo u Njemačkoj, odnosno situaciju u ovoj moćnoj evropskoj zemlji."
0:02:28,0:02:46,SPD socijalnih demokrata proglasila nas je ekstremističkom desnicom zapravo nekoliko dana prije nego što je trebala predati Ministarstvo unutarnjih poslova svom nasljedniku iz kršćanske socijalne unije.
0:02:47,0:02:57,To je samo pokazalo da želi nanijeti što više štete prije nego što napusti službu.
0:02:57,0:03:03,"I trebate znati da domaća obavještajna služba nije nepristrana, zar ne?"
0:03:03,0:03:17,"Dakle, podređena je Ministarstvo unutarnjih poslova i nije bilo pravnog presuda, već političkog presuda koji nam je naškodio jer imamo vrlo visoke rezultate."
0:03:18,0:03:26,"Dakle, trenutačno imamo rezultate na 26 posto, ovisno o agenciji za anketiranje koju gledate."
0:03:26,0:03:34,Ali trenutačno smo najpopularnija stranka i zato mislim da je Nancy Faye trebala napraviti mjerenja.
0:03:34,0:03:35,U redu.
0:03:36,0:03:42,"Trebali ste biti dio službene njemačke delegacije regije Hessen u Hrvatskoj, a također i u Srbiji."
0:03:42,0:03:46,"Nisu vam dopustili, ali došli ste u Hrvatsku sami."
0:03:46,0:03:47,Je li to bilo vrijedno toga?
0:03:47,0:03:49,"Da, mislim da je bilo potpuno vrijedno toga."
0:03:49,0:03:53,Susreli smo se s puno zaista zanimljivih ljudi i imali smo puno sastanaka.
0:03:53,0:03:54,Susreli smo se s političarima.
0:03:55,0:03:57,Susreli smo se s ljudima iz medija.
0:03:58,0:04:17,"I mislim da smo pokazali njemačkom i srpskom javnosti, a također i hrvatskoj javnosti, da je naš ministar napravio veliku pogrešku u tome što nam je vjerovao ili nam je dopustio da ne putujemo s njim u te zemlje."
0:04:19,0:04:26,"Mislim da sada svi shvaćaju da je želio napraviti ime iz sebe i na naš trošak, znate."
0:04:28,0:04:31,Tako funkcionira CDU stranka u Njemačkoj.
0:04:32,0:04:43,"Žele naštetiti našem imenu, našoj reputaciji, a kad nismo bili tako veliki, rekli su da žele suočiti nas u parlamentu."
0:04:44,0:04:51,Željeli su se s nama u parlamentu svađati i pokazati ljudima da naši argumenti nisu dobri.
0:04:52,0:04:56,I očito to uopće ne funkcionira ako pogledate ankete.
0:04:56,0:05:04,"Pokušavaju uništi naš ugled ovim, a ovo je također jedan od ovih poteza u tom smislu."
0:05:05,0:05:11,I to je zaista propadalo jer je to bila prava PR katastrofa za ministra Pena.
0:05:12,0:05:21,"Dakle, bilo je puno pokrivenosti u tisku o toj temi, u Njemačkoj i Srbiji, mislim i u Hrvatskoj i Makedoniji."
0:05:21,0:05:34,"Definitivno smo pobijedili u tisku i trebate znati da ljudi u Njemačkoj s srpskim i hrvatskim korijenjem glasaju za nas, pa smo vrlo popularni među njima."
0:05:34,0:05:37,Razgovarajmo o AfD-u.
0:05:37,0:05:38,"U redu, sada."
0:05:38,0:05:45,"Ovdje u Hrvatskoj, baš kao i u zapadnim zemljama, vi ste prikazani kao opasna, radikalna stranka."
0:05:45,0:05:47,Možete mi to objasniti?
0:05:47,0:05:47,Da.
0:05:48,0:06:04,"Kao što sam već rekao, to je poput strategije da se nosimo s drugima, znate, jer ne mogu, predvidjeli smo toliko problema u Njemačkoj i rekli smo im da će to biti problematično ako dopustite tolikoj brojci ljudi da ilegalno uđu u zemlju."
0:06:04,0:06:09,"Morate ih integrirati, morate ih nahraniti, morate organizirati sve to."
0:06:10,0:06:21,"Vaše nuklearne i ugljenokopne elektrane, a mislite da je nedostatak sunca i vjetra dovoljno za industrijaliziranu zemlju poput Njemačke, suočit ćete se s mnogo problema."
0:06:22,0:06:24,I to se događa upravo sada.
0:06:24,0:06:31,"Ljudi u Njemačkoj to vide i vide da smo to napravili, da smo predvidjeli te probleme."
0:06:31,0:06:36,A sada shvaćaju da možda nisu ti zli momci.
0:06:36,0:06:38,Možda imaju pravo.
0:06:38,0:06:43,I tako strategija uništavanja našeg ugleda raspada.
0:06:43,0:06:47,"I da, mislim da smo sada na pobjedničkoj stazi."
0:06:49,0:06:56,"Da, i očito smo velika opasnost za uspostavljene stranke i zato se bore protiv nas na način na koji to rade."
0:06:56,0:07:02,Mi smo opasnost za njihove položaje i za njihove poslove i za nevladine organizacije.
0:07:04,0:07:13,"Da, često možemo čuti: O, AfD, oni su tako strašni, protiv stranaca."
0:07:13,0:07:24,"Pa, mi smo protiv nezakonitih stranaca, pa moramo stvarno razlikovati jer nas često optužuju da smo protiv svih ljudi."
0:07:24,0:07:28,"Ljudi s migracijskim podrijetlom, ali to definitivno nije slučaj."
0:07:29,0:07:32,"Dakle, očito želimo zatvoriti granice."
0:07:32,0:07:37,"Želimo deportirati nezakonite i kriminalce, što je apsolutno razumno, zar ne?"
0:07:38,0:07:41,"Pa, to je razumno u inozemstvu, ali ne i u Njemačkoj."
0:07:41,0:07:46,Rekao je da je to u Njemačkoj kao da je to tako zlo.
0:07:47,0:07:55,"Da, ali, kako je rekao moj kolega, sve više ljudi shvaća da je naša platforma apsolutno razumna."
0:07:56,0:08:01,"Da, i da to bude potpuno jasno, nemamo ništa protiv stranaca."
0:08:01,0:08:06,"Znate, u našoj stranci imamo puno ljudi s migracijskim podrijetlom."
0:08:06,0:08:06,I mi smo alkoholici.
0:08:07,0:08:09,"Da, pa je to puno ljudi, stvarno."
0:08:11,0:08:23,"I ako se ljudi dobro integriraju u našu zemlju, u našu društvo, ako govore jezik i ako se dobro ponašaju i ako rade za svoje obitelji, to je potpuno u redu za nas."
0:08:23,0:08:31,"Ali ova ilegalna imigracija u Njemačku i život iz socijalnih sustava, to je ogroman problem."
0:08:32,0:08:51,"I nećemo prestati govoriti o ovoj temi jer je možda, mislim, to je najveća tema naća tema u njemačkoj politici i nećemo je zaustaviti jer je to problem i o njemu se mora govoriti jer je to naša, znate, kao da smo ovdje da o tome pričamo."
0:08:52,0:08:57,Mi smo u političkoj sferi u Njemačkoj da o tome pričamo i zbog toga smo izabrani.
0:08:58,0:09:01,"Dakle, to je razlog zašto je AFD tako popularan."
0:09:02,0:09:05,"Postoji nekoliko razloga, ali to je jedan od razloga, da."
0:09:05,0:09:09,"Dakle, rješavamo mnoge probleme koje su uzrokovale uspostavljene stranke."
0:09:09,0:09:10,U redu.
0:09:10,0:09:12,Što radite da biste bili tako popularni?
0:09:13,0:09:15,Koje su druge probleme?
0:09:15,0:09:17,Koji su problemi u Njemačkoj?
0:09:18,0:09:26,"Mislim da je opći problem poput problema s budnošću, poput svih tih budnih stvari."
0:09:26,0:09:40,"Mislim da su lijeva i radikalna lijeva previše djelovala, previše su išli s restrukturiranjem društva."
0:09:40,0:09:51,"I mislim da su Nijemci obično konzervativni, srednji desni konzervativci, jer je zato imali toliko kancelara iz CDU-a."
0:09:52,0:09:57,Zbog toga što su uvijek dobri u tome da se pretvaraju da su konzervativci.
0:09:58,0:10:00,To je u redu.
0:10:02,0:10:07,I tako se većina u Njemačkoj osjeća i misli.
0:10:08,0:10:28,"I gledaju na to i, na primjer, ako imate sedamdeset šest spolova i morate promijeniti jezik i graditi različite toalete, a to su stvari koje većina ljudi u Njemačkoj uopće ne cijeni."
0:10:28,0:10:36,"I to je također jedan od aspekataata, rast cijena zbog zelenih politika, posebno zelenih politika."
0:10:38,0:10:52,"Gubimo mnogo radnih mjesta jer naša industrija odlazi u inozemstvo, ulaganja odlaze u inozemstvo i to su odluke koje utječu možda na deset, petnaest, dvadeset godina u budućnosti."
0:10:52,0:10:54,"Dakle, imamo puno problema."
0:10:55,0:10:58,Energetska sigurnost također je ogroman problem.
0:11:00,0:11:04,"Migracija, unutarnja sigurnost na našim ulicama."
0:11:05,0:11:10,"Osjećaj nesigurnosti.nosti, pogotovo u velikim gradovima, je ogroman problem."
0:11:11,0:11:19,"A vlada uvijek govori ljudima da se sve svake godine sve poboljšava, ali osjećaj je da je to pogrešno."
0:11:19,0:11:25,A onda imamo terorističke napade islamskih ili islamističkih ljudi.
0:11:25,0:11:39,"Dakle, to je poput ogromnog paketa koji je problematičan i zbog kojeg se suočavamo s tim problemima i o kojima pričamo na način na koji nitko drugi to ne čini."
0:11:40,0:11:43,"Dakle, mislim da je to razlog zbog kojeg smo tako popularni."
0:11:43,0:11:45,Razgovarajmo o Njemačkoj danas.
0:11:45,0:11:48,Kakvo je stanje života u vašoj zemlji danas?
0:11:48,0:11:50,Njemačka je nekoć bila obećana zemlja.
0:11:51,0:11:51,"Da, točno."
0:11:51,0:11:55,"Kao što je rekao moj kolega, imamo puno problema, zar ne?"
0:11:56,0:12:00,I govorio je i o padu naše ekonomije.
0:12:00,0:12:04,"Dakle, u trećoj godini recesije u Njemačkoj."
0:12:04,0:12:06,I to je stvarno loše za nas.
0:12:06,0:12:12,Mislim da smo jedina zemlja OECD-a u trećoj godini recesije.
0:12:12,0:12:15,Sve druge ekonomije rastu.
0:12:15,0:12:21,"I kao što je rekao moj kolega, dobro plaćena radna mjesta u odlaze u inozemstvo."
0:12:22,0:12:24,Ljudi gube posao.
0:12:25,0:12:31,"I to je, da, to je također jedan od razloga zašto smo ponovno toliko popularni."
0:12:31,0:12:36,Imamo rješenja za probleme koje su uspostavile stranke.
0:12:37,0:12:44,"Imamo rastuće cijene i zbog, dobro, samopovijesne energetske krize."
0:12:44,0:12:54,"A kad je u pitanju sigurnost, ne možete izaći noću kao žena bez uznemiravanja."
0:12:55,0:13:07,"Uznemiravate se u U javnim bazenima imamo dva stupnja silovanja dnevno u Njemačkoj, što prije 2015."
0:13:07,0:13:10,"godine nije bilo moguće, ali nažalost to je nova norma."
0:13:10,0:13:13,Općenito imamo mnogo silovanja.
0:13:14,0:13:16,Imamo mnogo zločina s nožem.
0:13:18,0:13:25,"I ako pogledate statistike, vidjet ćete tko je previše zastupljen u tim statistikama zločina."
0:13:26,0:13:33,I mi smo jedina strana koja govori o temeljnom uzroku porasta zločina.
0:13:34,0:13:45,"A druge strane kažu da je to zbog, ne znam, društvenih razloga zbog kojih ti momci siluju žene ili zbog društvenih razloga."
0:13:46,0:14:01,"Da, jer su traumatizirani jer su pobjegli iz svoje zemlje i nisu integrirani i ne mogu pronaći posao, i zato počinju zločine nožem i zato siluju žene."
0:14:02,0:14:06,"Ali ne, to definitivno nije istina."
0:14:07,0:14:11,"To je zbog kulturnih razlika, vjerujemo."
0:14:11,0:14:23,"I opet, mislimo da smo jedina strana koja zaista govori o temeljnim uzrocima problema u našoj zemlji."
0:14:23,0:14:24,Osjećate li se sigurnije?
0:14:25,0:14:28,"Pa, ne bih išao van noću sam."
0:14:28,0:14:29,Ne bih.
0:14:29,0:14:29,Ne bih.
0:14:30,0:14:32,"Pa, ovisi o tome."
0:14:32,0:14:33,Živite u Frankfurtu?
0:14:33,0:14:34,Živim u Frankfurtu.
0:14:35,0:14:40,"Srećom, živim u dobrom području, pa ovisi o području u Frankfurtu."
0:14:40,0:14:48,"Ali, na primjer, područje oko glavne željezničke stanice je vrlo."
0:14:48,0:14:55,Vrlo je popularan među trgovcima drogom i drugim zločinima.
0:14:55,0:14:58,"I, na primjer, ne bih tamo išao noću."
0:14:59,0:15:03,Ili ne bih išao na naš glavni trgovački centar.
0:15:03,0:15:04,"Ne, ne bih to učinio."
0:15:05,0:15:07,I ne bih išao ni u javne bazene.
0:15:09,0:15:09,Bože moj.
0:15:12,0:15:16,I mislim da je to i razlog zbog kojeg smo tako popularni među mladim biračima.
0:15:16,0:15:25,"Imali smo povećanje, ogroman porast, jer kad pričam s tim mlađim momcima, to nije sve."
0:15:25,0:15:27,Svi su se žene uplašile.
0:15:27,0:15:32,Također su se uplašili i dječaci kad izlaze u veće gradove.
0:15:35,0:15:42,I uvijek čujem da je sigurnosna situacija tamo zaista problematična za njih.
0:15:43,0:15:48,"Dakle, pokušavaju, znate, ne idu u te stvarno problematične lokacije."
0:15:48,0:16:02,"I možda ne idu u Frankfurt, nego u manji grad u Frankfurtu jer problemi nisu tako veliki i veliki kao u središtu ili u nekim mjestima u Francuskoj."
0:16:03,0:16:07,"Dakle, to je nešto što mlade sve više prepoznaju."
0:16:10,0:16:16,I stvarno sam sretan što više ne izlazim toliko jer imam obitelj i djecu.
0:16:17,0:16:20,I tako ne izlazim toliko kao kad sam bio mlađi.
0:16:22,0:16:27,Ali to je ogroman problem i nitko o tome ne govori osim nas.
0:16:27,0:16:31,"Dakle, to je i razlog zbog kojeg smo toliko popularni."
0:16:32,0:16:38,"Dakle, možemo reći da Njemačka nije zemlja kakva je nekad bila, nije zemlja kakva je nekad bila."
0:16:38,0:16:38,Da.
0:16:38,0:16:38,To je istina.
0:16:40,0:16:50,"Mislim da je Alexander Gauland jednom rekao da ne želimo još jednu zemlju, već da želimo zadržati našu dobru staru Njemačku kao što smo to nekad radili."
0:16:50,0:16:51,Dobru staru Njemačku.
0:16:52,0:16:53,Želimo je očuvati.
0:16:53,0:16:54,To je naš cilj.
0:16:54,0:17:02,"I ne želimo ići, znate, ne želimo promijeniti zemlju u nešto stvarno problematično i nedemokratsko."
0:17:02,0:17:08,I mi smo demokrati i želimo očuvati demokraciju i želimo očuvati našu Ustavu.
0:17:09,0:17:12,To je naš opći cilj i to je razlog zbog kojeg smo osnovani.
0:17:13,0:17:16,A naši politički protivnici uvijek to kažu.
0:17:16,0:17:21,"Republikanci uvijek okrenuli su to naopako i rekli da je suprotno, ali nije."
0:17:22,0:17:24,Pa zapravo želimo još više demokracije.
0:17:24,0:17:29,"Dakle, na primjer, želimo izravnu demokraciju, baš kao i u Švicarskoj."
0:17:29,0:17:30,U redu.
0:17:30,0:17:32,Možete mi to objasniti?
0:17:32,0:17:40,"Da, želimo da ljudi imaju pravo na referendume o važnim temama, baš kao i u Švicarskoj."
0:17:41,0:17:53,"Dakle, ne samo glasanje svakih nekoliko godina, svakih četiri ili svakih pet godina, već i redovite referendume."
0:17:53,0:17:55,Referendumi o važnim temama.
0:17:55,0:17:56,U redu.
0:17:56,0:18:04,"Vratimo se svakodnevnom životu u Njemačkoj, posebno u smislu gospodarskih i društvenih uvjeta."
0:18:05,0:18:09,Kakav je svakodnevni život u Njemačkoj?
0:18:10,0:18:12,Mislim da ste siromašni?
0:18:12,0:18:14,Jeste li bogati?
0:18:14,0:18:20,Svi drugi su se stranke uvijek bavile da smo bogata zemlja.
0:18:20,0:18:24,I to je djelomično istina.
0:18:24,0:18:27,"Djelomično je istina, ali djelomično je i pogrešno."
0:18:32,0:18:58,"Znate, Njemačka kao zemlja nije bogata, ali i dalje smo vrlo učinkoviti u stvaranju bogatstva, ali ta sposobnost opada i to je, mislim, ogroman problem i suočavamo se s ogromnim problemima s našom demografijom jer će se tzv."
0:18:59,0:19:09,baby boomeri u narednim godinama prestati baviti radom i onda ćemo imati ogromne probleme s u našim društvenim sustavima.
0:19:10,0:19:17,"Dakle, ovo će biti jedna od stvari koje se moraju riješiti, ali na neki način je neriješiva."
0:19:18,0:19:26,I ovo je istina koju nitko ne govori ljudima u Njemačkoj osim nas.
0:19:26,0:19:39,I to će smanjiti našu razinu bogatstva i način na koji možemo živjeti u Njemačkoj.
0:19:40,0:19:49,I uvijek volim reći da je sama država bogata prima toliko poreza od građana i od.
0:19:50,0:19:52,To mi zvuči tako poznato.
0:19:52,0:19:52,"Da, da."
0:19:54,0:20:11,"Ali ljudi nisu tako, vrlo malo ljudi, recimo, mislim da je manje od 50 posto ili možda oko 50 posto, samo oko 50 posto Nijemaca imaju nekretnine, a svi ostali iznajmljuju svoje stanove ili kuće."
0:20:11,0:20:20,"I znate, nekretnine su vrlo, vrlo važne za izgradnju bogatstva za starost."
0:20:21,0:20:31,"I zbog toga što ljudi dobivaju tako visoke poreze, ljudi u Njemačkoj ne mogu kupiti nekretnine."
0:20:31,0:20:36,Jesu li zadovoljni time ili je to nešto ili je to.
0:20:37,0:20:40,"Naravno, Nijemci žele kupiti nekretnine, ali ne mogu."
0:20:40,0:20:41,Nemaju novca.
0:20:43,0:20:44,I zato ih iznajmljuju.
0:20:44,0:20:45,"Molim vas, učinite to."
0:20:45,0:20:47,"Da, zato ih iznajmljuju."
0:20:47,0:20:48,Žao mi je.
0:20:48,0:20:50,"Molim vas, nastavite."
0:20:50,0:20:50,U redu.
0:20:50,0:20:51,U redu.
0:20:51,0:20:55,Ali razgovarajmo malo o integraciji migranata.
0:20:56,0:20:57,Kako je integracija migranata?
0:20:57,0:20:59,Kako se trenutno percipira integracija migranata u Njemačkoj?
0:21:00,0:21:03,Koju ulogu ima AfD u tome?
0:21:05,0:21:09,Mislim da se integracija migranata percipira vrlo loše.
0:21:11,0:21:21,"I mislim da neki od naših migranata stvarno pate zbog toga jer se i oni izražavaju i kažu: U redu, integrirali smo se ovdje tijekom godina."
0:21:22,0:21:23,Zaradili smo se.
0:21:24,0:21:25,Naučili smo jezik.
0:21:25,0:21:34,Ali ti novi uništavaju naš ugled jer nitko ne može nas odvojiti od njih.
0:21:35,0:21:36,negativne reakcije.
0:21:37,0:21:41,"I to je, po mom mišljenju, tužna istina."
0:21:42,0:21:53,"I da, integracija se u javnosti doživljava vrlo loše, a sve druge strane uvijek kažu da moramo raditi na integraciji."
0:21:54,0:22:02,A onda izrađuju programe i ulažu mnogo novca u to kako bi sve bolje integrirali migrante.
0:22:05,0:22:10,Ali rezultat je da to očito ne funkcionira.
0:22:11,0:22:31,"I budući da je Anna već rekla, postoje kulturne razlike i ako ne govorite o tim kulturnim razlikama i ako ih ne uključite u svoje strategije za integraciju, nećete uspjeti i nema druge opcije, a oni ne žele o tome govoriti."
0:22:33,0:22:35,"Dakle, sve je to kao da propada."
0:22:35,0:22:48,"Da, a u Njemačkoj imamo velike paralelne društva gdje druge društva ne stupaju u kontakt s njemačkim društvom."
0:22:50,0:22:52,"Želim čuti više o tome, molim."
0:22:52,0:23:13,"Da, mislim da postoje područja u Njemačkoj gdje više ne čujete njemački, gdje imate samo stranih trgovina, baš kao i, dobro, paralelno društvo koje više ne izgleda ili zvuči kao Njemačka, a određeni migranti također preziru Njemačku, zar ne?"
0:23:14,0:23:17,"Ne vole Njemačku, vole samo njemački novac."
0:23:20,0:23:22,Ali mnogi Hrvati žive u Njemačkoj.
0:23:22,0:23:25,Jesu li vaši birači?
0:23:26,0:23:38,"Na primjer, bivši hrvatski ministar vanjskih poslova rekao mi je da su i Turci koji su godinama živjeli u Njemačkoj glasali za AfD."
0:23:39,0:23:40,Mislim da je to istina.
0:23:41,0:23:52,"Mislim da je to samo osjećaj, ali ono što smo doživjeli jest da su posebno Hrvati zaista, zaista za AfD u Njemačkoj."
0:23:52,0:23:56,Ne bih htio reći da svaki Hrvat u Njemačkoj glasuje za AfD.
0:23:56,0:23:57,"Ne, naravno da ne."
0:23:57,0:23:58,Da je većina njih.
0:23:59,0:24:02,"I znate, smiješno je da ako želimo."
0:24:03,0:24:39,"imati sastanke na lokalnoj razini, kao što su sastanci za razgovor, svađu i sastanak s našim kolegama iz stranke, a u restoranima tražimo stol i pozivamo, a obično kad pozovemo njemačku restoran, vlasnik, ne uvijek, ali često, ne znam, možda nije najbolja ideja da dođete k nama, a ako pozovemo hrvatsku ili tursku restoran, talijansku restoran, reći će: Da, dođite k nama."
0:24:41,0:24:43,"Svejedno, želimo vas ovdje."
0:24:43,0:24:52,"I ovo je prilično smiješna situacija, na neki način prilično smiješna situacija, ali na drugi način i prilično tužna."
0:24:52,0:24:57,Imate li članova koji pozivaju na svrgavanje Demokratskog koridora?
0:24:58,0:24:59,Koliko vam štete?
0:24:59,0:24:59,Ne.
0:24:59,0:24:59,Ne.
0:25:00,0:25:00,"O, dobro."
0:25:00,0:25:10,"Ako netko poziva na to unutar naše stranke, odmah ćemo ga izbaciti jer to nije nešto što toleriramo i prihvaćamo u našoj stranci, uopće ne."
0:25:10,0:25:13,"Dakle, je li to moguće za vašu zemlju, za AfD?"
0:25:14,0:25:15,Što mislite?
0:25:15,0:25:29,"Hoćete li biti zabranjeni?iti jer je to kao da pogledate Bundesverfassungsgericht, najviši sud."
0:25:30,0:25:32,"Da, znam, Vrhovni sud."
0:25:32,0:25:45,"I ako pogledate što su rekli za druge stranke, ova tema je, znate, došla na vrh."
0:25:46,0:25:51,"Na temelju onoga što imamo sada, po mom mišljenju, ne možemo biti zabranjeni."
0:25:55,0:26:01,"Ako gledate na to kao na odvjetnika, s pravnog stajališta, ne možemo biti zabranjeni."
0:26:01,0:26:02,Ali nikad ne znate.
0:26:03,0:26:07,"Ako ste pred sudom, sve se može dogoditi."
0:26:08,0:26:32,"I mislim da je najvažnije u vezi s tim i zabranom ili prijetnjom zabrane i kategorizacijom od strane domaće obavještajne službe, sve je u tome da naštetimo našoj reputaciji, tako da kad imamo izbore, ljudi misle: O, sviđa mi se ono što gov govore, ali možda su previše radikali."
0:26:32,0:26:35,"Možda su previše, znate, možda su oni zli momci."
0:26:36,0:26:36,Nikad ne znate.
0:26:37,0:26:38,Zli momci i zle djevojke.
0:26:38,0:26:39,"Da, zli momci."
0:26:39,0:26:40,Očito.
0:26:41,0:26:50,"A onda možda ne glasaju ili ne glasaju ponovno za CDU, možda zato što se pretvaraju da su konzervativci i da su glavni struj."
0:26:50,0:26:51,Da.
0:26:51,0:26:56,"Na neki način, po mom mišljenju, oni su središnja lijeva stranka."
0:26:56,0:26:57,"Dakle, da."
0:26:58,0:27:00,"Dakle, to je strategija, znate?"
0:27:01,0:27:04,"I ne mislim da ćemo biti zabranjeni, ali će to pokušati."
0:27:05,0:27:16,"Morate dokazati Vrhovnom sud da želite ukinuti parlamentarnu demokraciju na borbeni način, što definitivno ne činimo, zar ne?"
0:27:16,0:27:20,Zato se slažem sa svojim kolegom.
0:27:21,0:27:26,Trenutačno je gotovo nemoguće da nas zabrani.
0:27:27,0:27:35,Jesu li demokracija i sloboda govora na rubu propasti na Zapadu?
0:27:35,0:27:35,Definitivno.
0:27:36,0:27:44,"Dakle, JD Vance je također kritizirao demokraciju u Europi i, naravno, i u Njemačkoj."
0:27:44,0:27:48,"Zaista sam sretna što dobivamo toliko potpore od EAS-a, ali definitivno imate pravo."
0:27:48,0:27:52,"Imamo formalnu slobodu govora, ali ako se izjasnite."
0:27:52,0:27:59,"Dakle, imamo, recimo, slobodu govora za ljevičare, ali ne i za konzervativce."
0:28:00,0:28:11,"A ako se izjasnite protiv glavnog toka, možda ćete izgubiti posao, možda ćete izgubiti prijatelje, možda ćete izgubiti reputaciju, zar ne?"
0:28:11,0:28:20,"A ako, recimo, objavite meme o političaru iz etablirane stranke, možda ćete biti kažnjeni, zar ne?"
0:28:20,0:28:21,Stvarno teško.
0:28:23,0:28:24,kažnjavanje.
0:28:24,0:28:25,"Da, točno."
0:28:25,0:28:31,"Dakle, nemamo pravu slobodu govora, samo formalnu slobodu govora."
0:28:32,0:28:34,A kada je to počelo?
0:28:36,0:28:42,Najprije ću se vratiti na govor JD-a Wanda jer mislim da je to bio zaista izvanredan govor.
0:28:42,0:28:43,U Münchenu.
0:28:43,0:28:47,"Da, u Münchenu na sigurnosnoj konferenciji u Münchenu."
0:28:48,0:28:51,"I mislim da je on tamo iznio zaista, zaista dobru točku."
0:28:52,0:28:55,I rekao je da je sloboda govora u središtu naših demokracija.
0:28:56,0:29:06,"A ako nemate slobodu govora, ne biste trebali., ovo je nešto što morate učiniti ispravno u svojoj zemlji i ne biste trebali poučavati nikoga drugog na svijetu."
0:29:06,0:29:09,Morate to učiniti ispravno u svojoj zemlji.
0:29:09,0:29:21,"Dakle, ovo je, a kad ste pogledali lica naših vođa koji su sjedili u ovoj prostoriji, bilo je kao da smo se dobro nasmijali."
0:29:21,0:29:24,"Dakle, da, a vaša je pitanja bila, zaboravio sam."
0:29:25,0:29:26,Zaboravio sam.
0:29:27,0:29:28,Kada je to počelo?
0:29:28,0:29:35,Kada je tako zvana sloboda govora na drugi način počela?
0:29:35,0:29:41,"Mislim da je to bilo s osnivanjem naše stranke, jer smo bili neprijatelji."
0:29:42,0:29:45,"Da, da, bili smo neprijatelji od samog početka."
0:29:45,0:29:49,"Naša stranka je vrlo mlada, osnovana je 2013."
0:29:49,0:29:53,"godine i mislim da je to počelo tamo, ali moje mišljenje može biti pogrešno."
0:29:53,0:29:56,Mislim da je to bio postupan proces.
0:29:58,0:30:06,Već sam to shvatio nakon terorističkih napada 911.
0:30:06,0:30:11,"godine, kada ste htjeli govoriti o problematičnim dijelovima islama i kada ste bili povezani."
0:30:11,0:30:22,"Kada ste to povezivali s migracijom u Njemačku, a imali smo poznati autor, Tilo Zaratzin, koji je napisao vrlo poznatu knjigu."
0:30:22,0:30:23,Kako se zvao?
0:30:23,0:30:26,Nazvala se Deutschland Schafft sich up.
0:30:26,0:30:28,"Dakle, Njemačka se ukida."
0:30:28,0:30:37,I imali smo veliku raspravu tijekom mjeseca u Njemačkoj o migraciji i islamu.
0:30:38,0:30:48,I mislim da je to bilo kao da ste već mogli osjetiti da nešto u vezi s slobodom govora nije u redu u Njemačkoj.
0:30:49,0:30:58,"I to zapravo nije bila iskrena rasprava i zapravo je bilo samo, znate, ad hominem, samo o njegovoj reputaciji."
0:30:59,0:31:09,I u tom trenutku mislim da većina Nijemaca shvaća da nešto nije u redu i da ne bi trebali govoriti o posebnim temama.
0:31:09,0:31:10,"Dakle, šuti i."
