Start (HH:MM:SS),End (HH:MM:SS),Segment
0:48:48,0:49:13,Nose po četrdeset šest četrdeset sedam četrdeset osam brojni tenisice jer dnevno ne stane slušavaju odjedan po tih četrdeset dva tri ono što si rekao na početku da je važna podrška i vjerojatno zašto je veći uspjeh ljudi koji se prijave na taj show pa tamo postignu neke rezultate a ne bi to nikad vani zanima me što kad se vrate van u svoj stvarni život kako onda dalje pa kako nastavi život?
0:49:14,0:49:14,To je ključna.
0:49:14,0:49:22,"Znaš da ovisnici, ključ izlječenja bilo kojeg ovisnika je da ga preseliš u komunu, da ga izoliraš od njegovog svakodnevnog života."
0:49:23,0:49:24,To je ključ uspjeha.
0:49:24,0:49:26,I što onda kad ga vratiš u taj život?
0:49:27,0:49:30,Koliko su oni spremni nastaviti živjeti?
0:49:30,0:49:30,Većinom nisu.
0:49:31,0:49:34,Većinom nisu zato što je to druga borba koja tek počinje.
0:49:34,0:49:36,Naš prva borba je unutra.
0:49:37,0:49:57,"Netko tko izdrži tripet mjeseca psihički stvarno teško, naporno snimanja, ja govorim to su kao dva paralelna procesa koja se događaju cijelo vrijeme, zaista je zahtjevno, ali ispunjavajući jednu ruku i oni, znaš koliko puta sam čuo od njih, kako bi se vratila ili vratio ponovno proživjeti to sve."
0:49:57,0:50:05,"Jer to je naravno iskustvo, vjerujem mi, to je spektakl i onima koji to rade, nama koji to radimo i oni koji to proživljavaju."
0:50:05,0:50:07,To je jedna borba i ta borba je teška i strpljuća.
0:50:09,0:50:18,"Od prvog dana, evo danas, kad se vratim na set, čujemo im reći ovo je tek početak, ovo je tek početak."
0:50:19,0:50:24,"Prava borba počinje onog trenutka kad vi izađete odavde van, tad počinje vaš pravi život."
0:50:25,0:50:32,"Jer ovo sve je, kako bih rekao, ovo sve je jedna platforma koja vam može biti jedan dobar zamašnjak, ali vi morate se pripremiti."
0:50:33,0:50:39,"Dakle, ti od prvog dana moraš stvarati strategiju kako živjeti jednog trenutka kad izađeš van."
0:50:39,0:50:53,"I oni koji su uspjeli, koji su uspjeli u projektu, nije kad kažem uspjeli, mislim novih ljudi par koji dođe do finala, kao da je finalista, jer mi uvijek imamo kao ne finaliste i finaliste."
0:50:53,0:50:58,"Kod nas uvijek svi se bore za nešto, ali imamo one koji su ispali i oni koji su došli do samog kraja."
0:50:59,0:51:03,"Ni garancija uspjeha, da ćeš, ako dođeš do finala da ćeš ti da si ti uspio."
0:51:03,0:51:04,"Ne, ne, ne, ne."
0:51:04,0:51:21,"Jedina, ako ćemo je nazvati garancija uspjeha je ako si ti stvorio sve preduvjete da tvoj život od onog trenutka kad napustiš projekt ide u skladu s tim kako si ga ti zamislio dok si bio u projektu."
0:51:22,0:51:30,Da ispunjavaš sve standarde i sve kriterije koje si si postavio dok si bio unutra.
0:51:30,0:51:31,Jer pazi šta je tu bitno.
0:51:32,0:51:44,"Ne govorim samo organizacijski, šta je bitno za njih, međutim, ona je organizacija, bitna je organizacija je vremenska, kad jedem, što jedem, kad treniram, kad se krećem, koliko se krećem, to je jako važno."
0:51:45,0:51:48,A još je bitna životna organizacija.
0:51:49,0:51:51,Kakav sam u odnosima kad izađemo dalje?
0:51:53,0:52:02,"Prema roditeljima, prema supružnici, supruzi i suprugu, prema djeci, prema zajednici u kojoj živim, na poslu."
0:52:03,0:52:04,Što je to točno sve?
0:52:04,0:52:06,To sve mi njih ispitujemo unutra.
0:52:06,0:52:16,"To su bitne stvari o kojima nećete stigneš vani razmišljati, a sad si u odmaku, sad si u otklonu jednoj i sad ti gledaš svoj život iz druge perspektive."
0:52:17,0:52:18,Aha i sad to tako funkcionira.
0:52:18,0:52:28,"Znaš, prošle sezone smo imali Davorku koja je jako veliku borbu vodila sa zdravljem svoje djece."
0:52:28,0:52:29,To je jako teško.
0:52:30,0:52:37,"Pazite, imaš ženu koja kao majka jednostavno nema šanse da će pretpostaviti nešto ispred djece, jel tako?"
0:52:37,0:52:40,"Ne, nema šanse, pogotovo kad je ti zdravlje tvoje djece u pitanju."
0:52:42,0:52:52,"A moraš, ako želiš ne vratiti se na stare postavke, nego želiš zadržati ovo što si sad stvorila, ti moraš naći način kako."
0:52:52,0:52:55,A što to znači mora naći vrijeme?
0:52:55,0:53:03,"Mora se organizirati i mora naći novu energiju koja je potrebna da može jer ona će uvijek biti majka, znači uvijek brinuti za svoju djecu."
0:53:03,0:53:12,Ali sad uz to mora naći i druge izvore energije i vremena koji će joj poslužiti da nastavi životni stil kako ga je započela u školu.
0:53:12,0:53:18,"Ili imate neki postotak koliko ljudi se vrati na staru kilažu ili koliko ih, ti koji su uspjeli?"
0:53:18,0:53:20,Pa ja imam subjektivnu procjenu.
0:53:20,0:54:01,"Mogli bi raditi i možda bi trebali sad na kraju devette sezone napraviti nekakvo objektivnoni osvrt, proći sa svim kandidatima i reći im zapravo što i kako, ali ja imam, moja neka subjektivna procjena, to ti govorim samo za ove koji su bili kod nas u mojim sezonama, znači ovih prethodnih pet plus sada ovo će biti šesta, ja bi rekao da je negdje oko dvadeset dvadeset pet posto uspješnost dakle to znači da su ti ljudi zaista promijenili svoj život i sad ti tu mogu nabrojati par ljudi za koje znam da su sto posto promijenili svoj život iz temelja da se više nisu vratili na stare postavke i da su to ljudi kojima je zaista show pomogao i da su oni ajmo ih nazvati pobjednici pravi stvarni pobjednici jer ja sam govorio uvijek nije pobjednik onaj koji ide na glavnu nagradu."
0:54:01,0:54:06,Pobjednik je onaj koji se meni za dvije godine pojavi ili tri godine pojavi u istom izdanju kakvog sam ga vidio na finalu.
0:54:06,0:55:12,"E ti si majstor pobjednik i takvih ima ja bih rekao negdje dvadeset pet možda trideset posto ajmo biti jako optimistični jel još dvadeset posto je onih koji su na tragu pozitivne promjene to znači da se nisu vratili na stare postavke nego su tu negdje između jel cirkuliraju malo gore malo dolje ali i dalje je to pozitivno puno bolje nego što je bilo onog trenutka kad su ušli u projekt i vjerojatno negdje između četrdeset i pedeset posto onih koji su se vratili na one postavke na kojima su bili jel to dobar postotak ovih dvadeset posto meni je to fantastično, meni je to fantastično ja ne znam da netko vani evo ja bi volio da me razuvjere da mi kažu tko vani radi i u kojem postupku sa pretilim osobama i da imaju takav postupak da od deset ljudi dvoje ljudi zaista dovedu do reda jel postoji evo uopće na razini države bilo gdje ali postoji neki program za pretile jer znam da sam čitala komentare ljudi kažu a zašto ne a zašto ne pokažete koje vježbe radite iz jednog u jedan zašto ne prikažete to sve pa da ljudi pretili uz vas vježbaju također sami doma da pratite taj program."
0:55:13,0:55:19,"Znači ljudi uglavnom jedu kriskalice, evo, a što ti kažem, zato smo tu gdje jesmo po statistici."
0:55:19,0:55:31,"Ovako, znam da postoji nekoliko klinika, postoje klinike koje se bave i emocionalnim prejedanjem, evo dakle, mislim to je ta kategorija ljudi najčešće, evo ovakve."
0:55:32,0:55:54,"Tako da ima, ima institucija koje to rade u Hrvatskoj, da, da, da, da, i u institucija koje to rade u Hrvatskoj, neke od njih ne vole život na vagi, da, ima, ima institucija koje to rade, koje se bave s tim time, ja ne znam kakav je njihov postotak uspješnosti, ali znam da postoji na nacionalnoj razini nekoliko koji to rade."
0:55:54,0:56:01,"Ali volio bi da postoji naš jedan nacionalni program, da se zna da zaista se bavi neko s time strateški."
0:56:02,0:56:11,A ima nekoliko tih ja bi rekao kao zajednica i pokreta koji su između ostalog u kojima sudjeluje i kao što sam rekao prva dama.
0:56:14,0:56:19,Je li svako debljanje znak da nešto ne valja na nekoj emotivnoj razini?
0:56:22,0:56:23,Ispričat ću ti svoj primjer.
0:56:24,0:56:32,"Došla sam u teretanu u svoju u teretanu tvoju prije nedavno, prije dva mjeseca i u nikad sam boljoj formi života."
0:56:32,0:56:42,"Ja sam četrdeset godina se nisam bavila ničim i sad sve i trči i teretana i sad se pa znači ja sam prvi put došla tebi u teretanu kao ja sam prvi put u životu ovdje, šta se ovdje radi."
0:56:43,0:56:44,I dobro ti je išlo čovjek tamo?
0:56:45,0:57:05,Da i slušaj i zdebljala sam se ti pa stala sam na vagu i vidjela da imam šezdeset osam kg imala sam ja stanem dvadeset godina u isti traper kombinezon koji sam nosila prije trudnoće i nije mi jasno šta se događa nije mi jasno šta je pošlo po zlu i dođem u teretanu i prič pričam s Rudijem i kažem da sam stvarno loša od kad mi nema tileta.
0:57:08,0:57:20,"I on meni kaže, pa Ivana, ja sam se zdebljio deset kila od kad sam izgubio svoju kujicu, ležao je doma i ja sam isto tako potpuno nesjesna, e do ležala doma i jela linoladu."
0:57:20,0:57:22,A umjesto da si šetala vani s njim ti si s njim?
0:57:22,0:57:31,"Jela sam linoladu umjesto da sam s tiletom jer tile mi je bio svaki dan, da svaki dan sam ja imala neke obveze, ono dvije, tri šetnje dnevno i stalna neka akcija."
0:57:31,0:57:40,"Ja sam sad ostala doma i jela slatko, zato što sam imala, to je baš to emocionalno preživljavanje."
0:57:41,0:57:43,Imala sam tugu koju je trebalo nekako za riješiti.
0:57:43,0:57:44,Zavječiti da.
0:57:44,0:57:54,"I ja, teško mi je dati tu konkretan odgovor zato što smatram da u jednoj većoj mjeri stvarno je jedan disbalans u tijelu, tojest emocionalni disbalans koji se događa."
0:57:55,0:57:57,"Da, to može biti pozitivno."
0:57:58,0:58:07,"Primjer, roditi se dijete, dići ćeš pozitivnijeg osjećaja u tvojem tijelu, u tvojoj glavi od toga da ti se rodilo dijete, jel tako?"
0:58:07,0:58:16,"Pazite, znači ti govorim iz muške perspektive, ne govorim o ženskoj trudnoći koja, koju svi znamo da je normalno da žena dobije na masi."
0:58:16,0:58:25,"Muškarac, dijete mu se rodi i u jednom trenutku velika većina njih dođe i meni kaže, pa vjerojatno se i meni to dogodilo, glupo, evo čuo ću ja sam se zdebio par kilo."
0:58:26,0:58:32,"A pazi, sve dižno, sve krasno, ti si dobio novi mali život, ali to je stres, to je isto emocionalni disbalans."
0:58:33,0:58:37,Kužiš i ta prekomjena sreća i veselje opet nije neka ravnoteža.
0:58:37,0:58:41,I tu se isto može dogoditi to da zapravo ti dobiješ na tjelesnoj masi.
0:58:41,0:58:51,"Ne mora biti samo nužno uvijek traumatično iskustvo, to ti hoću reći, jel nekakva tuga, da je nešto teško, nego evo diče slijepše od toga, dijete se rodilo, svi vidim veseli, opa, evo pet kila gore."
0:58:51,0:58:56,"Tako da, pretpostavljam da uvijek to je nekako povezano, uvijek nekako je povezano."
0:58:56,0:59:03,"Ali s druge strane, opet, mislim, pa ne može život bez emocija, bez nekakvih emotivnih doživljaja."
0:59:04,0:59:08,"Nekad su one pozitivne, nekad su negativne, to je loša ili kako god hoć, traumatična."
0:59:09,0:59:18,Ja bih to sasvim normalno i mi nalazimo načina kako da se borimo sa tim stresovima koji nam se događaju.
0:59:18,0:59:24,"Jedan od tih svakako je comfort food, jedan od najlakših rekao bih."
0:59:24,0:59:28,I isti taj efekt može učiniti i tjelesna aktivnost.
0:59:28,0:59:30,Evo ti si najbolji primjer toga.
0:59:30,0:59:38,"Dakle, da i tu možda možeš na neki način zaliječiti odlaskom na sjeeme ili odlaskom u planine i da se osjećaš onako nekako malo bolje."
0:59:38,0:59:39,Samo zašto je ključno?
0:59:40,0:59:45,"Baš mi je neki dan to prijateljica rekla svakati čas kako ti to radiš, a još uvijek mrzim trčanje."
0:59:45,0:59:54,"Dakle, pet puta u životu sad trčala i dalje ga, a dobro, ne mrzim, ali nije mi više tako drago dok trčim, kad prestanemo onda sam sretna."
0:59:55,1:00:00,"Da i ovaj, kaže prijateljica kao svaki ti čas, evo nije baš svaki čas, ono puls mi"
1:00:00,1:00:06,"nenormalno visok, uopće ne ide to meni, kaže ona, ali ideš."
1:00:06,1:00:12,"Znaš, to je odraz discipline kad ti se ne da i kad ne voliš to, a ti to svejedno radiš."
1:00:12,1:00:14,To je odraz karaktera i discipline.
1:00:15,1:00:45,"Imam dosta prijatelja koji imaju problem sa težinom i prošle godine sam za rođendan rekla da ne želim nikakve poklone, nego da mi za rođendan se popnu gore na slijeme i gore smo kao imali tulum, mrzili su me, mrzili su me i psovali su me cijelim putem, puhali su me i psovali su me, govorili da to prijateljstvo više nema smisla, da mi ponavljamo u drugačijim smjerovima, grozno su se osjećali samo zbog tog malo napora koji smo morali poduzeti."
1:00:46,1:00:49,Ljudi ne žele da im bude neugodno.
1:00:50,1:01:03,"Kako motivirati ljude da nema, ne postoji to, ne postoji to, to je, ja ne znam, evo, ja bi to radim 25 godina."
1:01:04,1:01:07,Motiviram ljude i vrlo sam neuspješan u tome.
1:01:07,1:01:11,"Koliko god da to nekom čudno zvuči, ali smatram da sam izuzetno neuspješan u tome."
1:01:12,1:01:24,"Zato što nisu, nije u promilima bi mogao reći ljudi koji su zaista to kao nešto napravili, nekakve ne znam velike pomake i promjene u periodu kad su radili sa mnom."
1:01:24,1:01:28,Najčešće je to bilo nekako održavanje i očuvanje zdravlja u toj kategoriji.
1:01:28,1:01:31,Ja nisam nikad radio u nekakvom velikom unaprijeđenju zato što je jednostavno.
1:01:31,1:01:34,ljudi s kojima sam ja najčešće radio nisu imali potrebe za to.
1:01:35,1:01:42,"Ali činjenica je da takva vrsta motivacije koja dolazi od strane nekoga, vanjskog izvora, nije meni to besmisleno."
1:01:43,1:01:45,To može biti trenutačna inspiracija.
1:01:46,1:01:48,Ja to više mogu tako nekako doživjeti.
1:01:48,1:01:58,"Da te neko u nekom datom trenutku može inspirira da ti napraviš nešto, da probaš, da se iskušaš u nečem novom, da te stvori neko znatiželju."
1:01:59,1:02:00,Tu taj dio mogu razumjeti.
1:02:00,1:02:24,"Ali ako nema tog unutarnjeg driva, tog unutarnjeg zašto, kojeg je Đković nedavno nekoliko puta spomenuo, to mi se tako jako sviđa, on je čudo, čudo jednako, taj čovjek je toliki izvor, evo meni inspiracije, da ja onda razmišljam u tom kontekstu, on je na najviše mogućoj razini, sa najvećim mogućim resursima i sa najboljim mogućim resursima."
1:02:25,1:02:31,"I on opet kaže, evo je pitanje koje si moraš postaviti, moraš si postaviti pitanje zašto, zašto ja ovo radim."
1:02:31,1:03:19,"sa trideset pet trideset sedam tristo osamdeset devet četrdeset dvadeset jedan devetnaest to je pitanje koje si moraš postaviti i ako znaš odgovor na to pitanje onda će onda se dogodi ta inercija prema naprijed tako da meni je to se pokazalo kao jedina prava istina ovo da ja sa tebi govorim ivana možeš ti to ja vjerujem u tebe a to je trenutačno ja sam to doživio ja sam to doživio i ja sam to doživio nekoliko puta u životu na vagi i to je fantastično osjećaj da nahrani svoj vlastiti ego kad ti nekoga motiviraraš, kak je to super, ja sad tebi govorim, ti to možeš, ja vjerujem u tebe, ajmo izdrži još malo naš, ali realno je da ti samo u svom tijelu, u svojoj glavi, u nekom trenutku sve što ti ja govorim možeš prihvatiti kao istinu ili možeš prihvatiti kao laž, tojest nepovjerenje imaš prema tome."
1:03:19,1:03:21,Ali na kraju je to tvoja odluka.
1:03:22,1:03:33,"Kužiš, ja šta god da tebi govorim na kraju je to tvoja odluka, mogu ti govoriti loše stvari, ti si grozna, užasna si, katastrofa radiš, ovo tvoje trčanje nema smis smisla, sjedite na našem telefonskom razgovoru."
1:03:33,1:03:43,"Ali ti si u svojoj glavi donijela odluku i sad kako će ovo utjecati na tebe, može te pokolebati ili ne, ali u svakom slučaju je to tvoja odluka na kraju dana."
1:03:44,1:03:55,"Ali u svakom slučaju mislim da ljudi koji su u sportu od malena, koji su nekako navikli na tu disciplinu da im lakše to ide i kasnije kroz život, pa zar ne?"
1:03:55,1:04:36,"Da, zato što su jednostavno naučili su to, prihvaćaju te okolnosti, mislim kada kad te neko, kad ti sustavno prihvaćaš da te netko gazi nad pripremama iz godine u godinu, iz godine u godinu, te bi se to pretočilo u tojest tvoj stvarni život kao nekakva normalna stvar, te bi ta patnja, ako ćemo je tako nazvat kao što je bio odlazak na sjeme tvojih dragih prijatelja, nekome je to normalna stvar, znaš, netko u tom pronalazi užitak, ja recimo upravo u tome pronalazim užitak, meni je bitan element igre, jako bitan element igre, to mi nedostaje sad u četrdesetima zato što sam puno tih igara prestao igrati rukomet, nogomet, košarku jer su izuzetno dinamične, se puno promjena u glasa kretanja i shvaćam da moje tijelo više ne reagira isto."
1:04:37,1:04:46,"Dok ja jadem tenis koliko toliko još ostao prisutan i to je jedna igra koja mi je potrebna, a onda povrh toga ima taj biciklizam, trčanje, planinarenje, tretana."
1:04:46,1:04:53,"Jer ta su neka još ta četiri, ovaj četiri tipa aktivnosti koje ja nekako najčešće provodim."
1:04:53,1:04:54,To su sve patnje.
1:04:54,1:04:59,"Znači u tome nema igre, nema igre u tome da se apenjam na ono sve, nekakva igra u tome, to je borba teška."
1:05:00,1:05:02,"Jer se još pazi, budalo."
1:05:02,1:05:07,"Znači, ja si na ritual jer, kako ja funkcioniram, ja idem gore, peške i onda na bus, dolje."
1:05:07,1:05:11,"Taj menadžment, ništa drugo, da ne trošim previše vremena, nego bita mi nije trening gore."
1:05:11,1:05:16,"I onda s busom se brzo vratim dolje u auto i paljada doma po djetetu, kuha je ovo ono što već trebam raditi."
1:05:17,1:05:18,Ja na ritual da kasnim na busu.
1:05:20,1:05:24,"Znači, da buš će mi za pet minuta otići ako neko ne dođem."
1:05:25,1:05:26,Kužiš i onda umiranje.
1:05:27,1:05:30,"I onda samom sebi, pa i si ti normalan, pozornost što to radiš."
1:05:30,1:05:31,"Ali, u tome ima."
1:05:31,1:06:03,"nešto, imate neki element opet natjecanja koji je meni valjda važan na neki način i onda ja se na taj način natječem jer kad više nema jednog protivnika tu ima uvijek onaj koji nikada neće otići, a to si sam ti, taj protivnik, taj ti je i to je naš i to su većinom porazi, to su većinom porazi, ti uglavnom gubiš protiv nekog svog komforta jer lakše je biti doma, lakše je upaliti telku, lakše je ne odraditi taj trening, a onda kad ga povremeno pobijediš onda je ta pobjeda onda baš slatka."
1:06:04,1:06:33,"Penjemo se mi gore na tupkal i kaže meni moj partner pa kao on je zapeo na tri i dvjesto i sramotio me užasno tamo grčeve u nogama neki Portugalci ga masiraju u prepune, on mu mučkao sol sa vodom, na tri i dvjesto smo tek došli, onda nismo vopili ne za Himalaju i on mi govori cijelo vrijeme, ali zašto se ti sad još penjaš na četiri i dvjesto samo gore je malo viši vrh i malo više snijega kao ono kao onoga kojeg ne vidi smisao, zašto da se on pati."
1:06:36,1:06:37,Pitanje je zašto.
1:06:38,1:06:40,Kako objasniti ljudima koji to ne znaju?
1:06:40,1:06:41,Koji je moj odgovor?
1:06:43,1:07:01,"Zato što kad se spustimo do zole, ja nisam više isti čovjek, zato što to, koliko mene to promijeni kao osobu, da ja to nosim kasnije u životu, da ja kasnije u životu kad ću se naći u nekoj situaciji, poslovnoj, prometnoj, bilo kakvoj, ja sam postala druga neka osoba, ja drugačije gledam na to sve."
1:07:02,1:07:06,Ja onda stisnem zube i nastavim dalje jer ti to nekako jačati karakter.
1:07:07,1:07:07,Što ne?
1:07:08,1:07:14,"To je kao igra karaktera, ako ćeš svaki put popustiti sebi onda ćeš biti slabo osjetljiv."
1:07:14,1:07:23,"U kanalu si, u kanalu si, nisi ispunio svoj potencijal na neki način i to je šteta ako imaš tu priliku da je ne iskoristiš."
1:07:24,1:07:25,To je ono što ja najčešće znam reći.
1:07:25,1:07:27,To je ono što ja najčešće znam reći u showu.
1:07:28,1:07:30,"Sa kamerom, mimo kamere, nebitno ono."
1:07:31,1:07:33,"Znaš, imaš te potencijal u sebi."
1:07:34,1:07:35,"Misliš, je li to motivacija?"
1:07:35,1:07:36,"Ari, ne imam pojma."
1:07:36,1:07:38,"Znaš, imaš te potencijal u sebi."
1:07:39,1:07:40,Negdje ćeš doći.
1:07:41,1:07:42,A samo ne vrti granice.
1:07:42,1:07:46,"Zamisli, sad možeš sve, samo."
1:07:48,1:07:51,I to je ono gdje zapravo često je nalazila se.
1:07:52,1:07:53,Smo nailazili na kritiku.
1:07:53,1:08:24,"Čak možda i ja, kada sam kritički razmišljao o tom projektu, sam to smatrao da je to ona kao, pa čeka, oni se pel penju uz nekakav, mi to zovemo sand hill kao pješćano brdo, pate se ljudi, grabe kroz pijesak, pogotovo netko ima šezdeset sedamdeset osamdeset kg viška znaš ti šta je to koliko to njima naporno ili razno razne te izazove kroz koje oni prolaze kao stavljamo ih u neke vrlo nelagodne situacije neugodne za njih i kao zašto se to radi?"
1:08:25,1:09:03,"Pa upravo zato, upravo zato zato što to iskustvo kao i planina to je ono što te gradi to je ono što ti stvar stvara preduvjete da kasnije kad dođeš u život, pa koja prepreka više postoji za tebe ako si savladala planinu od četiripet tisuće metara koja je to prepreka koja je nesavladiva tako i njima isto jako je važno zašto zato što oni u svojim glavama sa iskustvima koje imaju zadnjih deset i petnaest dvadeset godina ovisno o njihovoj dobi oni su uglavnom izbjegavali takve vrste izazova i došli su ti gdje jesu kužiš znači i matematika je naša bila uvijek vrlo jednostavna."
1:09:04,1:09:23,Ako si izbjegavao izazove i kao posljedica si sedamdeset osamdeset kg teži nego što bi trebao biti pa šta misliš onda da prestaniš izbjegavati izazove jer ti nisi sretan ovdje a to je evidentno prema onome što mi ti govoriš.
1:09:23,1:09:33,"Znači govoriš mi da nisi sretan u ovom tijelu i u ovom stanju u kojem jesi ajmo onda u te izazove i oni to mrze i to je njima grozno, kao i penje njih na sljeve, to je grozno."
1:09:34,1:09:41,"Ali kad prođu kroz to, ti samo u jednom trenutku vidiš kako se nekakav sjaj počinje pojavljivati u očima."
1:09:41,1:09:49,"Znaš, to je neko zrnce vjere u to da zaista stvarno život može biti lakši i jednostavniji i da ne trebaju nositi toliki seno teret."
1:09:50,1:09:53,I onda osjetit ću i ja ogromnu zahvalnost jer sam dio toga.
1:09:54,1:09:55,To je čarobno.
1:09:56,1:09:57,Kako ne čovječe?
1:09:58,1:10:05,"Reko si da su neki ljudi drastično promijenili život živote u smislu da su zatrudnjeli nakon šova, a prije nisu mogli."
1:10:06,1:10:06,Ozbiljno.
1:10:07,1:10:09,"Mi imamo bebica, imamo brakova, imamo."
1:10:10,1:10:14,"Znate, kad se ja znam, šalite, često onda me ovi sprde iz produkcije."
1:10:15,1:10:29,"Ja dođem na set ili neko neko vrijeme da kažem, dobro, ljudi smo mi došli snimati ljubav na selu, brak na prvu, ne za sve ove projekte koje rade ovi naši, ili smo došli žagiti, gubiti tjelesnu težinu i raditi na skidanju kilograma."
1:10:29,1:10:36,"Hožeš, kao posljednjeica se često zna pojaviti upravo i to da ljudi nađu partnera, zaljube se."
1:10:38,1:10:39,"Mislim, prekrasno, stvarno divno."
1:10:39,1:10:48,"Divno, evo imamo iz prethodne sezone cure, dečko koji su došli u životno vaginu, zaljubili se, sad se trebaju ženiti."
1:10:50,1:10:55,"Nina nam je rodila, prije par mjeseci isto, nije mogla ostati trudna."
1:10:55,1:10:59,Sjećam se iz onih sezona prije mene isto također da je bilo par cura koje nisu mogle ostati trudne.
1:10:59,1:11:01,Jer kako ćeš?
1:11:01,1:11:05,"tjeluti, sustav ti je pod takvim preopterećenjem, nema šanse, bolje si zagoli život."
1:11:05,1:11:07,Nemoguće ostati trudan.
1:11:07,1:11:16,"Mislim to je prvo pravilo, svaki ginekolog, svaki na svijetu će ti reći gospođo, reducirajte tjelesnu masu, onda ćemo razgovarati o trudnoći, jer to je prvi preduvjet."
1:11:17,1:11:20,I to im je sudjelovanje u tom projektu omogućilo.
1:11:21,1:11:22,Pa za to nije prekrasno.
1:11:22,1:11:26,"Znaš, pa to je takva nagrada za sve koji su sudjelovali u tome."
1:11:26,1:11:32,Znači ne može doći promjena na van ako nije prije toga prethodila promjena potpuno iznutra.
1:11:32,1:11:36,"I to je najvažniji element, to je najvažniji element koji se događa."
1:11:36,1:11:38,I on se događa kroz različita iskustva.
1:11:38,1:11:45,"Jedno od iskustava recimo o kojima, a rijetko možda i pričamo su psihološka podrška koju imaju naši natjecatelji."
1:11:46,1:11:52,"Dakle oni od ulaska u projekt do izlaska iz projekta, čak i nakon su konstantno pod psihološkom podrškom."
1:11:53,1:11:59,"I ljudi koji razgovaraju sa psiholozima, psihoterapeutima, oni prolaze jednu katarzu, prolaze kroz svoje traumatične iskustva."
1:11:59,1:12:04,"Da, često se govori o njima i pred televizijom zato što je to takav format."
1:12:05,1:12:09,Bitno je adresirati onaj prastvarni problem koji je doveo do toga.
1:12:09,1:12:11,Šta ćemo svi govoriti svi su ljeni.
1:12:11,1:12:15,Nisam imao vremena jer ne znam koja je naš koja je ona glupa i razlozi sve postoje.
1:12:15,1:12:25,"Ne onako, ja sam zanemarivao sebe zato jer sam brinuo za bolesnu mamu i tatu koji su mi umrli na rukama ili grozne druge priče kroz koje ljudi prolaze."
1:12:26,1:12:29,"Nažalost to su okidači, to su triggeri koji dovode do toga."
1:12:29,1:12:38,"Žena priča, gubila sam bebu u trudnoći, kaj sad ćemo okretati glavu od toga i praviti se da to nije razlog zbog čega je ona došla u to stanje koje je."
1:12:38,1:12:40,Jer je to dovelo do emocionalnog izbalansa.
1:12:40,1:12:44,"Ta trauma je nažalost posljedica, ta trauma je zapravo uzrok njenog problema."
1:12:45,1:12:52,"I sad će netko govoriti ono ovako, ono što oni ljudi koji su u publici, u gledalištu, sebi uzimaju za pravo."
1:12:54,1:13:01,"Znači prvi korak, što si mi rekao, jesi li mi dao odgovor na pitanje što reći ljudima koji imaju dvadeset ili više kilograma kako krenuti?"
1:13:01,1:13:03,"Nisam ti dao odgovor, ne, ne."
1:13:04,1:13:16,"Ja sam sve nekako sve više uvjeren da zapravo bi ljudi trebali prvo početi brinuti o svom emotivnom zdravlju, to je veliki utjecaj moje supruge evidentno na mene."
