Start (HH:MM:SS),End (HH:MM:SS),Segment
0:23:44,0:24:10,"Ali, opet s druge strane, kao da nam fali te nekakve temeljne kulture tijela, kulture zdravlja, da razumijemo da zapravo što ta hrana nama čini, zašto je ona nama potrebna, na koji način se trebamo odnositi prema njoj, na koji način se ostaje tjelesno aktivan, zašto nam je to bitno, gdje možemo pronaći element igre u tjelesnoj aktivnosti jer je važno da ona bude povezana jedno s drugim pogotovo u nekoj određenoj dobi."
0:24:11,0:24:16,Ne možemo mi isto na jednaki način pristupati djetetu od koje predškolske dobi ili školskog uzrasta pa ili odrasle osobe.
0:24:16,0:24:34,"I ti sad znači sama prolaziš jedno, ja te pratim, prolaziš jedno iskustvo, jednu agoniju, ali pazi, prolaziš jednu agoniju koja je sad, znači ja bi rekao se nastavlja na ovo što si započela i kroz planinarenje gdje si otkrila neke nove, nove spoznaje o sebi, poznaješ opet sebe kroz neku drugu prizmu."
0:24:34,0:24:51,"Dakle mi moramo, moramo, teška riječ, ali bi trebali, trebali bi biti tu, ja bi rekao, znatiželjni, da istražujemo, znači da, da, da želimo upoznati svoje tijelo, vidjeti koje su naše mogućnosti, pronaći nešto što nas ispunjava."
0:24:53,0:25:05,"Kao roditelj funkcioniram na način da ja mogu samo iz te prizme promatrati svijet, teško mi je iznad toga se izdići i mogu s kineziološke strane ili s trenerske strane iskustveno pričati jednako kao roditeljski."
0:25:05,0:25:11,"Svojim djeci želim da isprobaju sportove, znači ne da treniraju sportove nego da ih isprobaju."
0:25:11,0:25:18,"Probaj sad ovo, probaj sad kako se čini, vodim ih na različite aktivnosti da uživaju u tome da pronađu nekakvo zadovoljstvo."
0:25:18,0:25:21,"Ako se šta pri tome uhvati, sjajno, super."
0:25:21,0:25:23,"To će ti donijeti puno dobroga, barem meni je."
0:25:25,0:25:44,"Žao mi je da nemamo kod nas, ali to je ono gdje vidim zapravo kroz život na vagi, vidim da tu roditelji koji pogotovo sad koji dolaze kroz ovu emisiju, da ih to jako brine i da jednostavno kad vide, kad postanu roditelji, kad djeca krenu njihovim smjerom, da onda stvarno nešto moraju mijenjati."
0:25:44,0:25:53,"I to je jako dobra motivacija, to je jako dobra motivacija kad i vidiš svoje dijete kako se uništava već jer nasljeđuje tvoje obrasce ponašanja."
0:25:53,0:25:56,A to tako zorno se vidi.
0:25:56,0:26:01,"Evo njega, debač već malo više nego što bi trebao imati kilograma."
0:26:01,0:26:07,I sad je prilika zapravo da ti na svom primjeru pokažeš djetetu koje je nekakav pravi putokas.
0:26:07,0:26:12,A kako ti na svom primjeru djeci pokazuješ odnosno kakav je to odnos prema nezdravoj hrani?
0:26:14,0:26:17,Da li braniš li djeci?
0:26:17,0:26:17,Ne.
0:26:18,0:26:19,Ozbiljno ne?
0:26:19,0:26:23,"Ne, ne branim djeci, ali reći ću ti ovako."
0:26:24,0:26:27,"Jedina stvar gdje sam, ako smijem, jesam li smijem reći Hitler?"
0:26:28,0:26:29,"Smiješ se, samo tko ti je?"
0:26:30,0:26:48,"Jedino da doživljavam kao Hitler, kao neki, to bi bio nekakav diktator i kad su društvene mreže i mobiteli i ekrani u pitanju, tu sam grozan, tu ti baš on jašem po glavi i ono koliko si minuta bila više nego što je bilo, ajmo sad idemo oko ovog jezera, tu sam Hitler, tu sam grozan."
0:26:48,0:26:54,Čak mislim da moram naći neki balans jer je toga me jako strah.
0:26:54,0:27:08,"E sad, što se tiče nezdrave hrane, to si me pitala, ja sam jednostavno u nekom trenutku svog života procijenio da meni fast food ne stvara nekako veliko zadovoljstvo."
0:27:08,0:27:14,"Ovi fast food restorani, dakle nije mi potrebno, to mi je rekao moj suprug, nije mi potrebno."
0:27:14,0:27:23,I kad sam skočio da mi to nije potrebno onda sam jednostavno prestao konzumirati tu hranu i nekako postično došlo do toga da onda mi na obiteljskoj razini to ne konzumiramo.
0:27:23,0:27:24,Da li jedemo burgeri?
0:27:25,0:27:29,"Da, apsolutno, ali koje najbolje?"
0:27:29,0:27:32,"Znaš, gledamo da to bude pravi burger."
0:27:33,0:27:48,"Ja ću ga pripremiti doma ili ću otići u restoran za koji znam da nije fast food, da ga samo konačno bacam nego da mi slože ljudi pravi komad junečeg mesa, junečeg faširanca i da to pecivo bude našlo kako treba, da bude unutar svježa salata i onda nemam nikakav problem s tim, nikakav problem."
0:27:49,0:27:54,Da li moja djeca nekad mene mole da idemo negdje ili da naručimo nekad neku fast food hranu?
0:27:54,0:27:54,Da.
0:27:54,0:27:56,I da li im ja to dozvolim?
0:27:56,0:27:56,Da.
0:27:57,0:28:00,A da li bi ja to dozvolio jedanput ili dvaput mjesečno?
0:28:00,0:28:00,Ne.
0:28:02,0:28:02,Ne.
0:28:03,0:28:06,"Imamo doma, spremit ćemo doma što želiš jesti, za što si danas raspoložena?"
0:28:07,0:28:07,"Oka, ajde da vidimo."
0:28:08,0:28:14,Ne mislim da je to najbolji mogući put i niti postoje neki najbolji mogući put i postoji samo pravac i put koji funkcionira.
0:28:15,0:28:15,Kužiš me?
0:28:15,0:28:18,"Ne kužiš me, ne znam koji je pristup."
0:28:18,0:28:55,Ja imam četrdeset četiri godine neki dan mi je prvi put u životu prijateljica objašnjavala ugljikohidrate proteine mene to nitko nikad nije naučio u životu i ja tek sad pokušavam razumjeti hranu razumjeti jel to učiš svoje djecu to da i to ti radim na način da imao sam ti evo ajde opet moram biti iskren reći kako je razrednica mojeg najstarijeg kćeri je došla na ideju da ako bih ja htio doći jedan dan kod njih u razred pa da malo pričamo o tome i ja sam to vidio kao savršen način da ja zapravo opet to nekako uvalim i svoje kćeri da malo pričamo o makronutrijentima.
0:28:55,0:29:08,"Ja nisam nutricionista, znači ja sam kineziolog, imam neko bazično znanje iz prehrane, ali sam htio na jedan kreativan način pokušati djeci dočarati zapravo što to točno znači."
0:29:09,0:29:28,"Šta je za mišiće važno, šta je važno za naše, za pohranu energije, na koji način možemo puno trčati ili puno skakati ili kad imamo nekakav recimo težak ispit, što nam je potrebno ili onda pitaš njih ono kako se vi ponosite recimo kad učite i kada ondašnjaka onda naši kažu jako smo gladni kad učimo, a zašto ste jako gladni kad učite?"
0:29:28,0:30:04,"Pa zato što trošimo jako puno energije, dakle vidite vi trošite energiju kad učite a sjedite i nikud se ne krećete, zato što mozak radi, mozak sagorijeva veliku količinu energije i to vam je jako bitno, ali kakvu energiju unosite u svoje tijelo, je li to energija koja dolazi samo iz nekakvih ajmo reći fast food ili ajmo reći nekakvih namirnica koje su procesuirane ili su to nekakve ajmo reći u kategoriji zdravih namirnica, voće, povrće koje nam daju dužu energiju koja se bolje deponira u naše tkivo itede itede Tako da ja tu mogu na jednoj elementarnoj razini njima približiti hranu, a onda na njima je dalje da razvijaju to."
0:30:05,0:30:06,I sad šta se desi?
0:30:06,0:30:13,"Prođe neko vrijeme, ja dođem na informacije i ja pitam rasku kao kako je to prošlo kod njih, je li im to bilo ono što kažem?"
0:30:14,0:30:23,"Ludilo, totalno su reagirali pozitivno, super, hiper pozitivno, oduševljeni su, počeli su pričati međusobno o tome."
0:30:24,0:30:32,"Kaže mi jedan tata, jesti nećeš vjerovati, čuješ li nakon tog predavanja, ovaj moj dođe doma i kaže, gleda jogurt, šta tu ima, uprotine ili masti ili kukuruznog hidrata."
0:30:33,0:30:35,Ja sam ostao šokiran koliko je to na neki način na njih utjecalo.
0:30:35,0:30:40,"Ja sam mislio da će to biti njima ono kao B boring, ali nije na kraju ispalo jako pozitivno."
0:30:40,0:30:44,"Pa da prvo meni sad to objasnite, ako i ja bi voljela to čuti da ja shvatim."
0:30:45,0:30:45,Koji dio?
0:30:47,0:30:50,Evo to osnove koje si objasnio to klincima u školi.
0:30:51,0:31:06,"Pa ja sam se bazirao samo na makronutrijentima, dakle na proteinima, ugljikohidratima i mastima jer jednostavno ići dalje u filozofiju nemam da se razumijem nemam dovoljno niti znanja, niti stručnosti, tako da se tu moramo graditi odmah, ali sam opet išao iz prizme nekako naše obitelji."
0:31:07,0:31:11,"Ja sam bio izraziti meso, jeste, izraziti meso je kuklinac."
0:31:12,0:31:23,"Meni je meso moralo biti na svakom obroku, tako i vjerojatno sam nekako i energijski tako mi je bilo važno pogotovo u nekakvoj adolescenskoj dobi kad sam se razvijao, a i tradicijski."
0:31:24,0:31:28,"Znate, nama je doma tako jednostavno, nama je kuhala i to je bilo pod normalno."
0:31:28,0:31:45,"I onda u nekoj fazi života kad bi rekao negdje tamo na faksu, malo možda poslije faksu počinje zapravo isto malo ozbiljnije shvaćati tu prehranu i vidiš kad mi je prvi put u životu bilo nešto palo teško na želucu onda sam se postavio pitanje što se gore događa, glava mi se raspada, kogobac."
0:31:45,0:31:52,"Dakle, tada sam se počeo postavljati pitanje i onda sam i ja počeo malo istraživati i vidjeti zapravo na koji način stvari funkcioniraju i što meni treba u odnosu na moje aktivnosti koje imam."
0:31:53,0:31:55,"E sad, što se tiče makronutrijenata, to si me pitao."
0:31:55,0:32:01,"Dakle, rekli smo imamo tri osnovne vrste namirnica, tojest makronutrijenata, to su ugljikohidrati, masti i proteini."
0:32:02,0:32:31,"Kad kažem proteini, pretpostavljam da znaš iz koje vrste namirnica dobivamo proteine, jel, dakle meso, riba, jaja, neki mliječni proizvodi, grahorice recimo ako pričamo o nekakvim vegetarijanskim namirnicama, onda imamo ugljikohidrati, to su više voće, povrće, dakle nekakvo najčešće što nam dolazi iz ugljikohidrata i to su nam ti šećeri koji su nam važni i onda imamo te masti koje su nam bitne, koje su nam jako važne, a godinama su bile diskreditirane."
0:32:31,0:33:00,"I onda imamo neke zdrave masti koje su recimo maslinovo ulje, naprimjer avokado ima puno zdravih zasićenih masnih kiselina, neka riba itede itede Tako da su to recimo nekakve osnovne namirnice i sad ja djeci dajem priliku, ne da im ja serviram točno i kažem gledajte morate pojesti toliko ribe, toliko riže i toliko salate ili ne znam toliko neke maslinovog ulja staviti nego kako bi vi složili jedan sebi balansirani obrok."
0:33:00,0:33:08,"I onda oni govore kako njihov obrok izgleda, na koji način njihov obrok izgleda i onda govorimo, aha dobro, a čega tu imaš više, čega tu imaš manje."
0:33:08,0:33:20,"Jer poanta nije da ti ja selviram, da ti dam sve, nego da ti svojim istraživanjem dođeš do nekakvih spoznaja i da onda malo to uključiš ajmo reći da nekakav kognitivni razvoj djece kroz prizmu igre opet."
0:33:20,0:33:22,"Užasni, to mi je bilo zabavno, s njima pogotovo."
0:33:23,0:33:28,"Zapravo si eto postao kroz godine i kroz životne vage si postao stručnjak za mršavljenje, jel tako?"
0:33:32,0:33:33,Pa zar ne?
0:33:34,0:33:36,"Jel ti se ljudi obraćaju danas više, obraćaju više?"
0:33:37,0:33:40,"Da, kao doktor za debljinu."
0:33:40,0:33:41,"To da, to da, to da."
0:33:42,0:33:56,"Jednostavno to je grunulo nakon druge sezone, grunulo, grunulo je društvene mreže, ja se nisam istinito tome znao snaći, evo najiskrenije."
0:33:57,0:34:04,"Jer kako bi te rekao, meni je život na Vagi došao kao kruna karijere na neki način, dosadašnje karijere."
0:34:05,0:34:14,"Ja sam dvadeset godina bio radio kao fitness trener, imao sam tu sreću i privilegiju da sam radio sa takvim facama u svom poslu da je to čudo jedno."
0:34:14,0:34:23,"Ja nisam radio sa sportašima, ali sam zato radio sa najvećim estardnim zvijezdama u Hrvatskoj, glumačkim zvijezdama, političarima."
0:34:24,0:34:43,"Ja sam se našao u takvim životnim situacijama, odvjetnicima, biznismenima, čudo, znači od jednog dečka koji iz dugova niš previše pametan, normalan neki klinac, došao da sam stvarno se našao u takvim životnim situacijama."
0:34:43,0:34:48,"Ja ne, ne, znači čudo, čudo, meni je to bilo nevjerojatno i im."
0:34:50,0:35:30,"Dođe život na vagi, prilika za život na vagi i mene ta ideja da završim na televiziji, da radim kao trener na televiziji, mene je doslovce ostavila bez teksta, šokirala me onako kako je to moguće jer u tom trenutku znaš ja sam etabliran, ja sam napravio sve što sam mogao napraviti, ja imam neke druge snove u poslovnom smislu koje bih htio realizirati, koje me na neki način možda čak i pritišu, tlaču me, imam toliko i toliko godina, trebao bi možda imati svoj centar, pa ovo, pa ono, pa onda imam u nekom trenutku, imam centar, pa nemam centar, pa imam partnere, pa nemam partnere, pa imam krive partnere, pa svakakakva nekakva svoja životna iskustva prolazi neka traumatična, neka više ne će, više, neka manje i osjetim da dolazim do nekog zasićenja ajmo to tako reći."
0:35:30,0:36:02,"Dakle, mogu ovaj posao sada ovako radit dok ne umrem realno i imam klijente s kojima radim deset i petnaest i dvadeset godina i onda dođe ta životna vagi i u jednom trenutku upravo to, sad si ti guru za mršavljenje a nisam, mislim, fakat nisam, znaš, ono, ja sam netko tko je samo svoj posao radio pred televizijskom kamerom pa sad ispada da to sve znam, ja znam hrpu trenera, ljudi koji rade taj posao, ja bi rekao ono, super kvalitetno, sa toliko entuzijazma, želje, volje i možda su u konceptu veitlo, Vejtlo sa puno više nego ja."
0:36:03,0:36:13,"Jer ja sam kao fitness strana radio sa rekreacijom, rekao sam ti nisam nikad radio sa pretilim ljudima prije života na vagi, ali sam naučio na faksu otprilike nekakve osnovne principe struke."
0:36:13,0:36:33,"I kada sam došao u projekt na finalnom razgovoru na potpisivanju ugovora ja sam rekao gledajte ja se neću odreći niti u jednom trenutku svoje struke, šta god da vi tražite od mene, ja ću sve raditi onako kako su me naučili na faksu i u što ja vjerujem, duboko vjerujem da je ispravno."
0:36:34,0:36:38,"I tada je producent rekao naravno, ništa drugo, ništa manje od tebe ne očekujemo."
0:36:39,0:36:42,"I to se držim do danas, šest sezona."
0:36:42,0:36:45,Koliko je prošlo ljudi kroz te šest sezona?
0:36:47,0:36:53,"16 otprilike po sezoni, neko 20, možda 100, 100-100-100-100-100-100-100 ljudi."
0:36:53,0:36:56,Imate li problem sa prijavama ili ih ima?
0:36:57,0:36:58,Pa ima ih.
0:36:59,0:37:00,"Nažalost, nema ih."
0:37:01,0:37:02,Nije problem izabrati kandidate.
0:37:03,0:37:22,"Ne, mislim, produkcija ima neke svoje zahtjeve, naravno, kad se radi o televizijskoj emisijiija bude zanimljiva, ali mislim da prijava nikad ne nedostaje iz jednostavnog razloga što i sama si rekla smo u takvoj situaciji kakvu jesmo."
0:37:24,0:37:35,"Na temelju svog tog iskustva koje si prošao, koje si proživio, okej tebi se javljaju ljudi koji žele smršavati, ali jel misliš da debela osoba, jel to politički nekorektno reći da je netko debeli?"
0:37:36,0:37:49,"Ja sam čak u jednom trenutku ljude od milja zvala debeli i ozbiljno su se uvrijedili neki, prestala sam to govoriti zato što mi je pas moj, pokojni Tile, od milja zvali debeli."
0:37:49,0:37:58,I onda tu i tamo kad bi nekom svojim prijateljicama rekla debela shvatila sam da to nije simpatično i zapravo da je moj pristup tome kriv.
0:37:59,0:38:04,"Jer misliš da pretila osoba, debela osoba može biti sretna?"
0:38:04,0:38:05,Može biti debel i sretan?
0:38:07,0:38:13,"Pa u jednoj mjeri sigurno možeš, ali mislim, može i mršava osoba biti sretna."
0:38:16,0:38:18,"Kuš, to je fakako filozofsko pitanje."
0:38:18,0:38:23,"Mislim da sreća generalno nije uvjetovana s time da li smo preteli ili ne, ali znam što je sigurno."
0:38:24,0:38:27,Siguran sam da su ponekad jako nesretni zato što su debeli.
0:38:28,0:38:30,To sam sto posto siguran.
0:38:30,0:38:33,Niko ne može biti sretan u svom vlastitom tijelu ako ima 50 kg više.
0:38:34,0:38:40,"Znaš, većinu vremena čovjek ne stigne zbog života takvog kakav je, zbog rituala života ne stigne razmišljati o tome."
0:38:40,0:38:44,"Ali svi mi kad, znaš, to ti kao i kako bi ti rekla?"
0:38:46,0:38:50,"Evo, glup primjer, ali ne zna, možda će ljudima biti jasan."
0:38:50,0:38:52,"Naprimjer, ja jako volim igrati tenis."
0:38:52,0:38:52,Jako.
0:38:53,0:38:54,I muči me lakat.
0:38:56,0:38:57,Tensky lakat je vjerojatno naš.
0:38:57,0:38:59,I sad ja igram usprko toj boli.
0:39:02,0:39:03,"Kužić, što ćeš reći?"
0:39:04,0:39:09,"Ja ga igram, živim život, igram ga, ali me taj lakat boli, tu je prisutan i cijelo vrijeme, zeza me."
0:39:09,0:39:11,I ako ga ne tretiran postaće sve gore i gore.
0:39:11,0:39:13,Znači moram nešto učiniti po tom pitanju.
0:39:13,0:39:22,"Sad ja mogu utrgati glavu u drugu stranu i praviti se kao da me ništa ne boli i lupa tu lopticu i onda nakon tog tenisa svaki put, a i meni ne mogu ruku ispružiti."
0:39:22,0:39:30,"Mogu ili mogu nešto napraviti po tom pitanju, otići kod matke ili kod moje jojki i dajte riješite ovo majki ti boli me čovjek."
0:39:30,0:39:34,Pitam te to zato što u zadnje vrijeme vidimo plus size modele i nisam sigurna što o tome mislim.
0:39:35,0:39:40,Da li je to dobro i da li je to ok ili je to samo komercijalna zamka s druge strane?
0:39:40,0:40:06,"Da li je to način da se ipak prodaju ti proizvodi i tim ljudima koji su pretilja koji to drže kao nekakav izgovor da ne bi morali mijenjati ništa pa ono i to je ok jer ja vidim djecu u ulici koji hodaju u kroptopovima i u tajcama ogromni i bez ikakvog srama i bez ikakvog kompleksa i nisam sigurna jel to dobro, jel to loše."
0:40:06,0:40:14,"Pa ovako, ja mislim da prosramljivanje bilo koga zbog njihovog fizičkog izgleda nema smisla, meni to nema smisla."
0:40:15,0:40:37,"Ali ajmo ne mazati oči i reći kako ne znam industrija, beauty industrija nije osmislila, jel tko god da je došla sa tim, kako si rekla, plus size modelima, da nije došla iz perspektive prodaje, to ne može biti istina, to ne može biti dalje od istine."
0:40:37,0:40:43,"Dakle, oni su to napravili samo u svrhu komercijalizacije, ništa drugo, nema smisla."
0:40:44,0:40:55,"Dakle, ja smatram da, rekao sam u uvodu za sebe da sam zaista netko tko je izuzetno empatičan, koji može se osjećat, koji je prošao iskustvo rada sa stotinama ljudi koji imaju problema sa tjelesnom masom."
0:40:55,0:41:08,"Ja imam potpuno razumijevanje da je to bolest i da ti ljudi trebaju pomoć, ali ne mogu okretat glavu u drugu stranu i reći da to nije problem, to je problem."
0:41:09,0:41:16,"Dakle, ako netko ima BMI preko trideset to je problem, ta osoba ugrožava svoje zdravlje vrlo jednostavno."
0:41:16,0:41:35,"Dakle, sad da li on s tim može živjeti, to mu je sasvim sve jedno, to je druga stvar, fajn, u redu, ok i zašto bih ja sa tebe tu na bilo koji način diskreditirao ili opasramljivao zato jer se ti osjećaš dobro, a ja smatram da to što ti sebi radiš, ono kao nije dobro za tvoje zdravlje."
0:41:35,0:41:43,"To je tvoja stvar, to je život i fajn živi svoj život kako ti misliš da je najbolje, ali nećemo okretati glavu u drugu stranu i reći, ma je i je to sasvim u redu."
0:41:44,0:41:51,"Nije, ako je netko u kategoriji pretile osobe i imaš pretila s jedan dva i tri stupnja i ako dođe taj tri stupanj."
0:41:52,0:41:54,Sad si rekao BIM-aj kako se to određuje?
0:41:55,0:41:56,Kako znamo da je ne?
0:41:57,0:42:15,"Tjelesna težina i tjelesna visina su glavni parametri, sad si me uzela na pretkog interneta samo pišeš bodima indeks i u principu on ti daje nekakvo skaliranje tvoje tjelesne mase u odnosu na tvoju tjelesnu visinu kako bi otprilike konstitucijski osoba trebala u kojim parametrima trebala biti."
0:42:15,0:44:10,"Sad time taj bodimas indeks proteže normalne recimo kod žena je do dvadeset pet ja sad ću ovo izlaganje govorim moguće da griješim tako da treba provjeriti na internetu za svaki slučaj kod muškaraca ja mislim do dvadeset kod žena je do dvadeset pet onda preko toga je prvi stupanj debljine pa drugi pa treći mislim da ti je taj treći ti kad je bodimas indeks preko trideset pet ja mislim jel onda govorimo to bi trebao provjeriti sada da budem sto posto siguran ali u svakom slučaju on nije nekakav indikator konstitucije tijela jesu li to kandidati tvoji iz života na vagi preko trideset pet moji kandidati su preko pedeset preko pedeset da mi imamo kandidata ove godine koji ima sedamdeset tri bodima što to znači koliko ima kilograma dvjesto i trideset četrdeset pedeset ne znam sad ste ih najskreniji ne znam moram pogledati ali svakako preko dvjesto kg na m osamdeset tričetiri pet ne znam tako nešto kako se to dogodi ja razumijem kad imaš par kg viška pa pa ono nije lako za početak dijetu ali kako kad imaš dvadeset ili pedeset ili sto kg ili sto pedeset dvjesto koliko koliko više to je nevjerojatno kako uopće krenuti to je jako dobro pitanje to je jako dobro pitanje kako krenuti od kud krenuti što napraviti kad se dovedeš u tu situaciju sad naš Naš, znaš šta je najzanimljivije od svega, šta sam ja čuo i to mi je ostalo zapečaćeno, to ti još samo više produbiti, to je jednom kako bi rekao ne poštovanje, a poštovanje, a poštovanje i suosjećanje prema ljudima koji prolaze kroz takvu borbu."
0:44:12,0:44:23,"Nitko na svijetu, to je rekao jedan naš kandidat, nije toliko razmišljao o hrani i o prehrani i o promjeni životnih navika kao pratitelji ljudi."
0:44:24,0:44:26,Kužišak je to začarani koruk?
0:44:26,0:44:35,"Znači oni svaki dan razmišljaju o tome kako trebaju promijeniti svoj životni stil, tebi dođe tri tjedna prije ljeta, evo ajde da mi ove tri kile skinuti i počeo sam razmišljati o tome."
0:44:35,0:44:43,"On svaki dan ih u svojoj glavi o tome, svaki dan razmišlja o tome kako bi trebao promijeniti svoje životne navike, a stoji u mjestu."
0:44:44,0:44:56,"I šta je sad to, to ja, par puta sam dao predavanje po nekoliko firmi o tome i to mi, to je, rekao sam da znam odgovor na to pitanje, ja mislim da bi bio ono multimilijunaš."
0:44:57,0:45:08,Što je to točno u nama koje u tom trenutku i s tog momenta stajanja napravi korak prema naprijed.
0:45:09,0:45:12,"Što je to, koja je to nevidljiva sila koja te gurne prema naprijed?"
0:45:13,0:45:13,Šta je to?
0:45:15,0:45:26,"Ne znam, evo ne znam, najiskrenije nakon svih silnih sezona rada i dalje ne mogu reći, znaš, ići će reći educiraj se, pronađi pravu podršku, savjetuj se sa nutricionistom."
0:45:26,0:45:36,"Svi oni to naprave, oni su milijardu puta, odu na klinička pretrage, odu u bolnice, kod nutricionista, kod trenera, kod svih ovoga i opet je to tapkanje u mjestu."
0:45:36,0:45:47,I onda dođe ta neka nevidljiva sila koja te kao da te pogura prema naprijed i kreneš tim putem promjene i zaista se nešto dogodi i to je onda stvarno čudo.
0:45:47,0:45:48,Čudo neviđeno.
0:45:48,0:45:49,Kako to izgleda?
0:45:49,0:45:58,"To je onda kao ona, kako se kaže, ona snježna kugla koja se zarola i onda samo do one grude male nastane cijeli snijegović."
0:45:58,0:46:17,"Tako da, tome sam ja svjedočio nebrojno puta u životu na vagi i zato sam ja vječni fan tog, ja možda sutra više nikad neću raditi tu emisiju i može dogoditi čudo stvari, ali ja ću vječno, vječno biti zagovorovaratelji i vječni fan te emisije jer mislim da je nekim ljudima ipak pomogla."
0:46:17,0:46:22,"Koliko je to promijenilo njihova života, kako se ti osjećaš sa tom spoznajem da si tako utjecao na."
0:46:22,0:46:24,"Pa ponosan, baš ponosan."
0:46:24,0:46:33,"Zato mi teško nekad padne kad čujem kritike na račun toga svega, ali znači ja sam se nekoliko puta našao u situaciji da ti netko kaže hvala ti što si mi spasio život."
0:46:34,0:47:06,"Znači ja hvala Bogu imam sad dovoljno, ja da se meni to dogodilo sad dvadeset sedam pa i ja bi letio znači preko s lijevena bi letio hladno bez problema ali znaš ego se utiša s vremenom neke stvari i druge zamjene ovaj HGK-a taj ego tri postaneš roditelj, postaneš nekako možda malo skromniji i onda shvatiš da si ti jedan mali kotačić u tom mehanizmu, a zapravo da je većinu posla ili sav posao su ipak ti ljudi napravili i da je njima svaka čast jer je nadljudska snaga trebala da se zaista promijeni to."
0:47:07,0:47:13,Nadljudska snaga kad netko tko ima dvjesto kg dođe i izgubi sto kg svoje tjelesne mase.
0:47:14,0:47:20,"Znaš koliko to su nestvarne transformacije ako možemo, to je teška riječ, ali preobražaj."
0:47:21,0:47:25,Ja sam prije dva dana vidjela prijatelja koji je izgubio u šest mjeseci trideset kg.
0:47:26,0:47:32,"Sjedila sam prekič u Dubrovniku i nekome potapšio poluciju, ja nisam prepoznala tog čovjeka od nekog starog čovjeka."
0:47:34,0:47:35,On izgleda mladić.
0:47:36,0:47:37,On je ono zgodni mladić.
0:47:38,0:47:48,"Znaš koliko se meni puta dogodilo da ja cure koje dođu kod nas, majke mi, cure koje dođu kod nas u emisiju, ja im sad vi govorim, cure mlađe od mene."
0:47:51,0:47:57,"Ja ne znam procijeniti sad u tom trenutku, jer više nemaš puno ih je i sad da onda zaboravim godine, ono ja, vi, vi, ono me zove Vigodž."
0:47:58,0:48:00,"Pa ti stariji od mene, pa nisam."
0:48:00,0:48:13,"sam, kad si našao onda si sjetio, a da pa kad imam i ja godina, skupilo se ponešto, nisam više mladić, ali da ono, to je nevjerojatno koliko to preobliči čovjeka ta debljina."
0:48:14,0:48:26,"Fun fact, jedan do dva broja veličina stopala im se smanji, jedan do dva broja."
0:48:26,0:48:36,"Drugi fun fact koji mi je prijatelj upravo rekao, glava mu se smanjila, velika mu je kaciga za motor, glava mu se smanjila za jedan broj, a ovakvi će lakoti, glava mu se smanjila."
0:48:36,0:48:43,Znači zamislite tko je to opterećenje na naš sustav i onda koliko je ta promjena velika.
0:48:43,0:48:47,"Znači njegovom se glava smanji, ljudima se stopalo smanji dva broja, tri broja čovjeka."
