Start (HH:MM:SS),End (HH:MM:SS),Segment
0:00:00,0:00:09,Niko na svijetu nije toliko razmišljao o hrani i o prehrani i o promjeni životnih navika kao pratili ljudi.
0:00:09,0:00:14,Tebi dođe tri tjedna prije ljeta i ovoj da mi ove tri kile skinu i počeo sam razmišljati o tome.
0:00:14,0:00:16,On svaki dan je u svojoj glavi o tome.
0:00:17,0:00:22,"Svaki dan razmišlja o tome kako bi trebao promijeniti svoje životne navike, a stoji u mjestu."
0:00:22,0:00:31,Što je to točno u nama koje u tom trenutku iz tog momenta stajanja napravi korak prema naprijed?
0:00:31,0:00:35,"Educira se, pronaći pravu podršku, savjetuje se sa nutricionistom."
0:00:35,0:00:36,Svi oni to naprave.
0:00:36,0:00:38,I opet je tu tapkanje u mjestu.
0:00:38,0:00:44,I onda dođe ta neka nevidljiva sila koja te kao da te pogura prema naprijed i to je onda stvarno čudo.
0:00:44,0:00:45,"Čudo, neviđeno."
0:00:45,0:00:57,"To mi sam ja se dođe nebrojeno puta u životu na vagi i može to biti čudo stvari, ali ja ću vječno biti zagovaratelj i vječni fan te emisije jer mislim da je nekim ljudima ipak pomogla."
0:01:01,0:01:02,Koja je tvoja igra?
0:01:03,0:01:05,Tvoja igra te čini posebnim.
0:01:06,0:01:08,Ona te pokreće i inspirira druge.
0:01:09,0:01:11,Kako god se krečeš.
0:01:11,0:01:14,"To je tvoja igra., Intersport."
0:01:15,0:01:16,Recime kako je izgledao današnji dan?
0:01:16,0:01:20,Kao prvo hvala ti što si došao usred Kikofa.
0:01:21,0:01:25,"Gledaj, kada te zove Jone Paradžiković da ima tu sad da moći neće, moraš ići."
0:01:26,0:01:29,"Hvala tebi na pozivu, stvarno mi je izuzetna čast, stvarno je."
0:01:29,0:01:33,Jer sam tvoj dugogodišnji fan kako se ona kaže.
0:01:33,0:01:43,"I da, usred smo Kikofa počeli smo snimati novu sezonu, pa smo nekako našli prostora u danu da malo pobihnem, da malo ti i ja popričamo i onda se vraćam natrag."
0:01:44,0:01:44,Kako je izgledao dan?
0:01:44,0:01:48,Ujutro smo krenuli od oko devet sati i trebali već biti na setu.
0:01:49,0:02:15,"Međutim, kiša nas je malo oprala pa smo odgodili početak snimanja, zato sam, ispričavam se malo kasnio, ali mislim da smo još uvijek u dobrom timeline tako da ćemo snimati danas sigurno dugo noć jer današnji dan je zapravo nekako najvažniji i krećemo sa nekakvim velikim izazovom gdje upoznajemo kandidate, dajmo im odmah nekakav prvi zate da vidimo kakva je motivacija, kako funkcionira, kakve su njihove motoričke sposobnosti."
0:02:15,0:02:18,Najčešće su to nekakve jednostavne skretne strukture.
0:02:19,0:02:25,"Danas je samo bilo lagano planinarenje, sedamsto metara je staza dugačka, nije to ništa, ali je malo strmi i teren."
0:02:26,0:02:29,"I oni su to odvalili sjajno, čak bolje nego što smo očekivali, rekao bih."
0:02:30,0:02:40,"I nakon toga ide vaganje, prvo inicijalno vaganje da se vide zapravo s kakvim težinom dolaze u show, da na neki način ih upoznamo malo bolje i tako izvršavamo taj prvi dan."
0:02:41,0:02:46,"I onda na sljedećih tri i pol mjeseca, tojest sto dana borbe."
0:02:46,0:02:47,Teške borbe.
0:02:48,0:02:59,"A recimo, negdje sam čula da si rekao da već kad ih prvi tjedan upoznaš ili možda ne prvi put, nego prvi tjedan da već znaš tko će biti pobjednik, tko će biti finalist, na temelju čega?"
0:02:59,0:03:07,"Pa da sad ispadam, možda stradavamo sada, ali možda bi bilo sada nezahvalno reći šta mislim ove godine, tko će biti prvi, pa da vidimo u čemu smo u pravu."
0:03:07,0:03:08,"Da, to bi bilo super."
0:03:08,0:03:15,"Ali obzirom da ne smijemo skrivati imena kandidata, mogu napisati na neki papir i ćemo izdavati potpis ili nešto, pa vidite onda jesam bio."
0:03:15,0:03:38,"Ali da, mislim, gledajte, nije to nikakva sada velika filozofija gdje sam ja nešto posebno pametan ili talentiran, pa na osnovu toga mogu procijeniti, to je jednostavno kada već radiš s ljudima toliko dugi niz godina i kada imaš priliku s nekim živjeti dvadeset četiri sata na dan ti vidiš vrlo brzo zapravo kakav je taj sistem kakav je sustav unutar tog čovjeka i šta je on zapravo pošto je ta osoba došla u ovu."
0:03:38,0:03:39,Misliš kako je ovo?
0:03:39,0:03:40,"Da, kakve su poslah."
0:03:42,0:03:43,Stvarno to se odmah vidi.
0:03:43,0:03:44,"Da, barem je bilo do sada."
0:03:44,0:03:47,"Zapravo, znaš kako sam ja u ovu sezonu ušao?"
0:03:47,0:03:54,"Ja sam u ovu sezonu ušao s nekakvom predumišljenjem da vrijeme je za underdoga, vrijeme je za nekoga ko nije izraziti favorit."
0:03:54,0:03:56,Ja sam uvijek volio one koji su kao.
0:03:56,0:03:57,obožavam underdoga.
0:03:57,0:03:58,Znaš to kao i to.
0:03:58,0:04:00,Nemoj mi navijat za ove kao ono Real Madrid.
0:04:00,0:04:05,"Daj mi ove te ispod dolje, daj mi bajku, ispričaj, da vidimo kako je život čudesan."
0:04:06,0:04:12,"I u principu, pravilu, pa kao i u svakom drugom natjecanju, ipak oni koji su favoriti, oni najčešće pobjeđuju."
0:04:12,0:04:18,"U prethodnoj sezoni se znalo da je to Alina, cura koja je došla, znači već u prvom tjednu je radila dvostruko više od svih drugih."
0:04:18,0:04:47,"Sezonu prije toga je bila mrtva trka, bilo ih je par koji su se onako isticali, ali čak mogu reći u toj sezoni možda da je jedan underdog pobjedio, to je bio naš Mislav koji možda u prvih nekoliko tjedana nije se isticao po tome da bi mogao doći samo kraju, da bi mogao biti pobjednik, ali već nakon nekog vremena se vidilo da ima taj zamašnjak i da se to nekako u njemu sve više i više razvija, ali gledajući i u sve ostale sezone jednostavno vidiš u prvih par dana zapravo kako je tko posložen i kako funkcionira."
0:04:48,0:05:03,"Jer u načelu to je zapravo jedno natjecanje jel iako se oni zapravo dođu tamo boriti za svoj vlastiti život i natječu se sami sa sobom, s druge strane opet je natjecanje međusobno jel tko ipak izgubi na kraju najveći posao tijeliste mase, taj je pobjednik."
0:05:04,0:05:08,"Ali možeš nekako pokušati objasniti što je to, šta su to postavke?"
0:05:09,0:05:11,"Disciplina, volja, motivacija."
0:05:12,0:05:13,Što je ključno?
0:05:14,0:05:16,Motivacija svakako nije.
0:05:17,0:05:29,"Spremnost na rad, disciplina apsolutno, uz mogućnost usvajanja, kad dobiješ nekakav input, kad ti ne Kada ti netko da izvana neka stručna osoba, kada ti kaže ne znam, nutricionist, to je to."
0:05:30,0:05:42,"Tvoja je neka znatiželja da šta je 1200-1500-1800 kalorija od čega su one satkane, kako ih disperziram kroz dan, što znači dovoljno hidracije, nema muljenja."
0:05:42,0:05:46,"Tu je sve vrlo egzaktno, vrlo, vrlo egzaktno."
0:05:46,0:05:52,"Tako se meni barem pokazalo moje ovo svjedočanstvo u ovih prethodnih pet i u ovoj šestoj sezoni, vjerujem da će biti vrlo slično."
0:05:52,0:06:01,"Dakle, ta tvoja mogućnost da usvojiš te navike, da primijeniš ono što ti netko kaže, da ne bi rekao postupno."
0:06:01,0:06:08,ne bih rekao poslušan ali discipliniran i da se pridržavaš toga od prvog do posljednjeg dana jednako.
0:06:09,0:06:13,"Dakle nije to motivacija, motivacija dođe i ovdje kod svih nas, tako i kod njih."
0:06:13,0:06:23,"Ali ta disciplina, najbolji, ono zornji primjer je ta Lina koju spominjem, djevojka koja je prošle godine pobjedila i ona je rekorder po postotku ukupnom koliko je skinula."
0:06:24,0:06:27,Znači ta cura je hodala bez prestanka jer šta je?
0:06:29,0:06:43,"Mi svi imamo šovu, šov je tu da zabavi gledatelje, kao posljedicu ima naravno nekakve promjene životnih navika koje ti ljudi mogu usvojiti i kojima je to jako dobra otkočna daska za život koji ih čeka nakon toga svega."
0:06:44,0:06:55,"Međutim, mi smo tu u jednom procesu koji je rigidan i koji je vrlo krut, koji je zahtijevao od tebe potpunu posvećenost ako zaista želiš doći do tog konačnog cilja."
0:06:56,0:07:05,"Ako si se spreman upoznati, zaista se upoznati i vidjeti se u jednoj drugoj perspektivi, onda to sve ima smisla."
0:07:06,0:07:12,"Ako nisi, ako je to sve samo jedna kao, gledaš kao nekakvu avanturu, bojim se da to onda nije nešto što je dugoročno održivo."
0:07:13,0:07:25,I zato je postotak i uspješnost takva kakva je jel jer nisu uvijek svi spremni i ako i dođu pazi njima je mi možemo gledati život ovakvih kao nekakvu konačnu instancu ljudi koji su zaista došli pred zid.
0:07:25,0:07:43,"Znači kad ti sad sagledate nekakva iz neke prizme prosječnog čovjeka kao da zaista misli neko ide tamo na televiziju, ogoliti svoju dušu pred cijelom nacijom, skinuti se pred cijelom nacijom i sto dana boraviti u nekakvoj vrlo zatvorenoj strukturi koja je ono vrlo dinamična, teška, naporna, psihički izazovna."
0:07:44,0:07:52,"Znači to mora netko vidjeti kao zaista ono posljednja prilika, posljednja šansa da se se posvetim sebi i da napravim tu nekakav zaokret u životu."
0:07:52,0:08:00,I onda kad takvu priliku ti tako olako shvatiš onda shvatiš da zapravo nije to za svakoga i da ne može svatko proći kroz tu katarzu.
0:08:00,0:08:20,"I zato kad me pitaš ovo šta je to onda ti po nekim, ja bi rekao čak ponekad i neopisivim parametrima po osjećaju koje kad gledaš osobu shvatiš ti si taj, kužiš, a onda onda dograđuje to sa prilikom i voljom da uči, da usvaja i da radi, da ima konsistenciju."
0:08:20,0:08:27,Recimo kad kažem da neki koji nisu spremni u tim uvjetima gdje im zapravo sve im je omogućeno.
0:08:27,0:08:31,Ono što je ključno koliko sam shvatila kroz svoje razgovore uvijek je to je podrška.
0:08:32,0:08:35,"To je ono što je, to je riječ koja je zapravo."
0:08:35,0:08:42,"Prvo, da, da, i najvažnije što oni dobiju tamo u tom šovu je podrška i psihologa i nutricionista i vas, trenera."
0:08:43,0:08:46,"Oni koji tamo ne uspiju, jel'imaju šanse uspjeti van?"
0:08:47,0:08:58,"Pa imaju, imaju šanse kad im se ono što se kaže poslože kockice, kad dođe taj moment da zdravlje zaista postane prioritet."
0:08:58,0:09:00,"Aha, evo, okidači, to je razlog."
0:09:00,0:09:23,"Jer pa najčešće, znaš, samo nekad je to već onda sada kad smo prešli rub, kad nema povratka, znaš, nažalost, kad jednostavno stvari krenu toliko, život krene toliko nizbrdo da nema vraćanja sad na staro, ne možeš ti sad, mislim ja sam po prirodi optimist, ali znaš i sama kad se čovjek može naći nekad u nekim životnim situacijama koje nažalost su bezizlazne na neki način."
0:09:24,0:09:37,"Da se vratim na tvoje pitanje, ima šanse, ali ja bi rekao kad gledam samo iskustveno, ja sad tu mogu teoretizirati do sutra, ali iskustveno gledajući da su one puno manje moguće je."
0:09:38,0:09:49,"Imamo par primjera djevojaka koje su bile kod nas u projektu, prošle su život na vagi, vratile kilograme, prošlo neko vrijeme i onda se dogodila o kidač, dogodila se promjena."
0:09:49,0:09:56,Ali zanimljivo i one kažu da im je život na vagi donio jako puno pozitivnoga i da je to opet bio nekakav kotačić.
0:09:57,0:09:59,"To je bio ono, korak naprijed, dva nazad."
0:09:59,0:10:08,Jel nešto pozitivno se dogodilo i to iskustvo su one sigurno u nekom trenutku svog života kasnije koristile da naprave tu promjenu.
0:10:08,0:10:21,"Ja iskreno moram priznati prvih par sezona nisam gledala, zvučalo mi je to i djelovalo mi me jako, imala sam neku predrasudu, izgledalo mi je jako ponižavajuće za te ljude što ih se skida tako gola do gola."
0:10:21,0:10:38,"Međutim, onda sam ubrala neku sezonu koju si ti radio i kad sam shvatila na koji način, s kakvim poštovanjem i s kakvom empatijom pristupate tim ljudima, mislim da je to užasno važno, sam se ja potpuno promijenila mišljenje svoje."
0:10:39,0:10:46,"Prije sam mislila da su pretjerani ljudi slabi, da je to zapravo debljina, da je odraz slabog karaktera."
0:10:46,0:10:50,"Pa mislim ako ne možeš, ako imaš problem s debljinom prestani jest."
0:10:51,0:10:57,"Meni to zvuči jednostavno u glavi, znaš, meni su takve postavke ono prestani to raditi ako skužiš da ti to ne valja."
0:10:58,0:11:03,I onda sam zapravo shvatila da je pozadina negdje puno dublje.
0:11:04,0:11:12,"Koliko je tebe taj šok promijenio i šta, kako si ti imao prije mišljenje o ljudima sa prekomjernom tjelesnom težinom, a kako je možda danas?"
0:11:13,0:11:15,"Slično kao i ti, gotovo slično."
0:11:15,0:11:29,"Ja, Mlinka koji je radio projekt prije mene, mi se znamo svak sa, dobili smo kolege, stalno se dugo godina poznajemo i ja iskreno nisam ni sanjao da bi mogao doći u takvu situaciju, da ja budem u toj poziciji, zaista ne."
0:11:31,0:11:34,I u vrijeme kad smo mi počeli snimati ja sam imao dvoje male djece.
0:11:35,0:11:42,"Svako tko ima dvoje male djece zna da zapravo nemamo vremena puno za promatranje, gledanje televizije, jednostavno živite takve temelje i ne stigneš."
0:11:43,0:11:46,I nisam ni ja uspjevao to pogledati nego bi sporadično nekad bacio oko.
0:11:47,0:12:00,"Ono što je mene zapravo najviše zainteresiralo jest ja ti funkcionirajem po principu kad čujem nekakvu kritiku za nešto kao i sa Andar Dogom, onda me zanima zašto to ljudi, zašto, zbog čega kritika, čemu?"
0:12:00,0:12:04,"Kao što si ti rekla u samomom početku, podcjenjivanje ljudi, sramoćenje."
0:12:05,0:12:26,"I to je takav isti stav je bio nekako ja bi rekao u široj zajednici kineziologa, kolega sa mog fakulteta, da kao šta oni to rade to nije profesionalno da ovo da ono, a ja to ne volim, ja to jako ne volim, ja ne volim to kad netko sudi ljude a nije u njihovim cipelama hodao, to me baš smeta."
0:12:26,0:12:48,"Imao sam taj problem kad sam počeo raditi taj projekt, da su ljudi se dozvoljavali komentirati što je naravno normalno, ljudi imaju pravo izraziti svoje mišljenje, ja to apsolutno poštujem, ali ja se s tim ne slažem i onda me to mučilo, ali nekako s godinama ti ćeš to znati, radić na televiziji, to godinu se nauči nositi s tim, nauči se to prihvatiti, da su ljudi različiti i jednostavno danas gledam na to sasvim drugačije."
0:12:48,0:13:06,"Iz tog razloga sam ja odlučio par puta pogledati tu emisiju da vidim i ja nisam vidio ništa sporno, ništa sporno, ali isto tako mi nije bilo jasno kao stvarno zašto ljudi se dovedu u tu situaciju, ja nisam nikada prije života na vagi radio s osobom koja ima toliko puno kilograma i takvu masu, nikada."
0:13:07,0:13:32,"Znači, ja nisam bio neki ekspert za skidanje sala i sad su mene pozvali, dođi ti si ekspert, ti ćeš znat kako, znači pojma nemam, znači ja znam što sam naučio na fakultetu i kroz neko svoje dodatno usavršavanje, na otprilike kako se radi redukcija potkošnog masnog tkiva, ali nisam stručna osoba za to, ne mogu se ja nazvati guru za salo, znači ne naš, nisam u toj kategoriji."
0:13:32,0:13:49,"I onda me zanimalo zapravo kakav je njihov pristup i vidio sam zapravo neke elemente koji su mi se učinili, aha, ok, sa ovim stvarima funkcioniram, rezoniram, mogu i ja razmišljati na isti način, neke stvari jednostavno dozvoljavam da svaki trener ima neki svoj nastup, pristup, način kako nešto radi."
0:13:49,0:13:56,"Možda bi ja to na neki drugačiji način radio, ali nisam o tome tada u tom trenutku ni razmišljao dok nisam ja došao u priliku da to radim."
0:13:56,0:14:00,"Kao sve u životu, sve se događa sa razlogom."
0:14:01,0:14:05,"Neposredno prije života na vagi, moja supruga opisuje gestalt."
0:14:07,0:14:16,Ne bi ja nikad u životu bio to što jesam u životu na vagi da nije ona utjecala na neki način na to da ja jesam po prirodi empatičan.
0:14:16,0:14:48,"Dakle, smatram se da sam empatična osoba, ali ne bi ni ja imao razumijevanje za debele i pretile osobe toliko da nisam u razgovorima s njom shvatio, pa nije debljina fizička bolest, nije pretilost, ona je posljedica nečeg što je puno dublje u nama, a to je da svatko od nas traumu, neko loše životno iskustvo, stres prihvaća i bori se s njom na neki određeni način."
0:14:48,0:14:54,I zato je posljedica debljina kao takva jednostavno odraz onoga što prolaze ljudi kroz svoj život.
0:14:54,0:15:00,"Netko će otići u neku drugu sferu, alkoholizam, netko će otići u pretreniranost."
0:15:00,0:15:04,Imam ja prijatelja koji je konstantno u treningu i konstantno povrijeđen.
0:15:05,0:15:06,Ali to nije normalno.
0:15:06,0:15:09,"Kužiš i tako i sa debljinom, isto."
0:15:09,0:15:10,I onda tek počneš.
0:15:15,0:15:23,"I onda kad počneš raditi s tim ljudima, kad čuješ priče koje stoje iza te debljine, onda ne možeš ne biti čovjek, kužiš."
0:15:24,0:15:28,I danas kad oni meni dođu i kad kažu a evo znaš on je lijen.
0:15:29,0:15:50,"Ja znam tako jako ljene ljude koji imaju dvjesto kilograma, koji rade tri posla, uzdržavaju dvoje djece od kojih je jedna bolesno, koji iza sebe imaju traumatično djetinstvo, koji su se uzdržavali svoje roditelje do smrti itede itede itede I sad, kako da ja sad nemam razumijevanje za te ljude?"
0:15:51,0:15:53,"To mi dođe normalno, prirodno."
0:15:54,0:16:13,"Pa ja sam prošao kroz svoje odrastanje, svoje djetinstvo i kroz svoje traume i kroz svoje djete rata, devedeset jedan g do devedesette godine nitko nije spominjao što znači biti bosanac što znači biti hercegovina što znači biti hrvat ili srbina odjedanput on je bosanac ja rođen u zagrebu petrove bolnici kako sam ja bosanac."
0:16:14,0:16:14,Na što ono?
0:16:15,0:16:16,Kaj to znači uopće?
0:16:17,0:16:28,"Nije da se ja ne identificiram sa time, identificiram se, meni je to normalno, moj tata je iz Bosne, ali da me sad ti prozivaš na taj način, otkud sam to, zašto sam to odjedan puta?"
0:16:28,0:16:44,"I tako dalje, i tako dalje, sada da ne unosim svoj nekakav osobni dio u cijelu priču, hoću reći da svi smo mi prošli kroz nekakva traumatična iskustva kroz život, jer oni nas oblikuju, oni su nam i na neki način potrebna, jer stvaraju nas kao čovjeka da budemo ono što jesmo i sa dobrim i sa lošim stranama."
0:16:44,0:16:50,"I zato razumijevanje i podrška koju si spomenula u početku od mene je uvijek, ali apsolutno."
0:16:51,0:17:25,"Pripremajući se za ovaj razgovor sam malo istraživala pa sam vidjela, ne znam da li je to najrecentnije istraživanje, ali iz dvije tisuće dvadeset tri podaci eurostata kažu da smo mi najdeblja nacija u europi i da su nam djeca najdeblja u europi i da će do dvije tisuće trideset biti milijun pretili hrvata pa ček sam malo onda to više sad ne govorimo o osobnoj nekoj razini da onda nismo svi ljeni onda je zapravo problem negdje dalje."
0:17:26,0:17:26,Što ti misliš o tome?
0:17:28,0:17:40,"Mislim da si dobro pročitala taj podatak i iskreno, to me u jednu ruku plaši jer se bojim gdje civilizacijski idemo."
0:17:41,0:17:45,"Ja sam naš, ja sam dijete ulice koje je bilo u pokretu cijeli život."
0:17:46,0:18:03,"Moj sustav, moj sustav vjerovanja je drugačiji i sad moram prihvatiti činjenicu da živim u svijetu u kojem su brojke takve kakve jesu i onda normalno da to uvlači jednu dozu straha u mene jer ono, ne znam kako ćemo, mi imamo onaj super crtić voli i ne znam da si ga gledala."
0:18:03,0:18:03,Kako ne?
0:18:04,0:18:06,"Jel dakle, naš, je li to naša budućnost?"
0:18:06,0:18:07,"Kuš, je li to naša budućnost?"
0:18:08,0:18:30,"Onda ćemo mi stvarno tako funkcionirati, ono biti na autopilotu praktički, jel, ja se nekako nadam i vjerujem da nije, ali nažalost podaci su takvi kakvi jesu, statistika ne laže u tom kontekstu i nekakva predviđanja su takva da ako se ne napravi nekakav veliki zaokret, a bojim se da ga ja na globalnoj razini ili barem na nacionalnoj razini ne vidim."
0:18:31,0:18:37,"Ja bi volio da sam u krivu, ali ne vidim ga da postoji jasna strategija naše države koja govori o tome, međutim ovo je veliki problem."
0:18:38,0:18:39,Nemojmo u ovom bit prvi.
0:18:40,0:18:43,"Aj, bilo koju tablicu uzmite, ali nemojte da smo u ovoj broj jedan."
0:18:43,0:18:46,"Znaš, ili ako već jesmo, šta možemo učiniti da to promijenimo?"
0:18:46,0:18:51,"Znaš, da je to ono neki alarm koji se pali od našeg, našeg dragog premijera pa na nižeg od svih."
0:18:52,0:19:01,"Ja znam da je od našeg predsjednika žena supruga i dosta je ona aktivna po pitanju toga i to mi je drago za vidjeti, ali nekako mi se čini da je još uvijek taj utjecaj premali."
0:19:01,0:19:07,"Znaš, da se ne, u kurikulumu se ne mijenja ništa, u visokom školu se ne mijenja ništa."
0:19:07,0:19:18,"Sad znam da su govorili o tih jedna tisuća petsto kineziologa koji će navodno dobiti priliku raditi već u, kako se zove, od prvog do četvrtog razreda."
0:19:18,0:19:30,"Da će već odmah u startu tjelesna zdravstvena kultura biti pod, kako bi rekao, da ju prate kineziolozi, dakle, da su pod njihovom ingerencijom, ajmo se tako izraziti."
0:19:30,0:19:32,"Ne znam gdje je to, što se s tim događa."
0:19:32,0:19:35,"Ono što bi sušpalili, nisu kineziolozi onako od profesori tjelesnog."
0:19:35,0:19:37,"Da, ali to ti je od petog do osmog."
0:19:37,0:19:39,"Aha, ti učiteljica?"
0:19:39,0:19:40,"Razredna nastavna, da."
0:19:41,0:19:43,"Čovjek ti što ni ne zna, zaboravio sam, davno je bilo to vrijeme."
0:19:43,0:19:48,"Da, učiteljica i učitelj ti vodi brigu o tjelesnoj zdravstvenoj kulturi."
0:19:49,0:20:13,"djece od prvo da će to raditi, da i u vrtiću je, sad tu sad, ne, nema, nema, nema kineziologa, nema, mi imamo sportsku grupu u našem vrtiću, moja jedina su klinke u sportskoj grupi pa moj dragi prijatelj i kolega Vidra vodi moje curke i isto jedan od onih ljudi koji strastveno radi svoj posao i uživa u tome i to je tako lijepo za vidjeti."
0:20:14,0:20:21,"Ali nema to u svakom vrtiću, nema svaka grupa da ima kineziologa koji brine o nekakvom zdravstvenom statusu te djece."
0:20:21,0:20:22,A koliko je to potrebno?
0:20:23,0:20:36,"Koliko je potrebna svijest da ne znam, da dijete ne smije kupiti kutiju cigareta ili ne znam alkohol, a smije kupiti junk hranu."
0:20:37,0:20:38,"Nije usporedba, zar ne?"
0:20:38,0:21:16,"Da, da, pazi, mislim, jer gledajte, ako danas netko u dvije tisuće dvadeset pet godini jel danas i datum smatra da šećerna ovisnost nije tojest ne postoji šećerna ovisnost ili ovisnost o slatkom ili o slanome jednako i da je jednako opasna kao i ovisnost o cigaretama o drogi o alkoholu ili neka treća ovisnost to moram To, bojim se da smo ono mašli lice u futbol, dakle, znači ono, to je, što je najbolji dokaz tome ili akatantan primjer, činjenica da smo prvi u Europi po pretilosti, dakle mi smo ovisni o nečemu, ajmo vidjeti kako riješiti taj problem."
0:21:16,0:21:25,"Znači da smo imali, ja se sjećam kao klinac da je bila ono jako velika kampanja kad je droga bila ono sveprisutna i kad se spominjalo da droge ima na svakom koraku."
0:21:25,0:21:41,"Ja ne znam koliko je danas ima ili nema, ali hoćete reći kako u nekom trenutku se osvijestilo se to da je to izuzetno opasno i da trebamo na neki način educirati i ljude i da treba biti dovoljno stručnog kadra koji će brinuti o tome da se na neki način na globalnoj razini nekako suzbije ta pandemija ako ćemo je tako nazvati."
0:21:41,0:21:41,To nije normalno.
0:21:41,0:22:19,"Nije normalno da smo, da smo, da smo, da smo, da smo, da smo, da smo, da smo, da smo, da smo, da smo, da smo, da smo, da smo, da smo, da smo, da smo, da smo, da smo, da smo, da smo, da smo, da smo, da smo, da smo, da smo, da smo, da smo, da smo, da smo, da smo, da smo, da smo, da smo, da smo, da smo, da smo, da smo, da smo, da smo, da smo, da smo, da smo, da smo, da smo, da smo, da smo, da smo, da smo, da smo, da smo, da smo, da smo, da smo, da smo, da smo, da smo, da smo, da smo, da smo, da smo, da smo, da smo, da smo, da smo, da smo, da smo, da smo, da smo, da smo, da smo, da smo, da smo, da smo, da smo, da smo, da smo, da smo, da smo, da smo, da smo, da smo, da smo, da smo, da smo, da smo, da smo, da smo, da smo, da smo, da smo, da smo, da smo, da smo, da smo, da smo, da smo, da smo, da smo, da smo, da smo, da smo, da smo, da smo, da smo, da smo, da smo, da smo, da smo, da smo, da smo, da smo, da smo, da, da, da, da smo, da smo, da smo, da smo, da smo, da smo, da, da, da, da, da, da, da smo, da, da, da smo, da smo, da, postoje neki objektivni parametri i razlozi zašto to nije tako, ali mene plaši ta činjenica da smo u takvom stanju kakvom jesmo."
0:22:19,0:22:27,"Oka jasno i slažemo se da je to društveni neuspjeh, a ne toliko osobni, ali što osobno možemo napraviti?"
0:22:27,0:22:39,"Koliko je teško promijeniti neke obrasce i mentalitet, ti si sigurno kao i ja iz, mi smo generacija, ja ne znam da li su tebe tjerali da pojedeš sve sa tanjura."
0:22:40,0:22:43,"I dalje, znači ja bacat hranu, da li je to gladno u Africi?"
0:22:43,0:22:54,"U Africi su gladni, ti moraš pojesti sve sa tanjura i hrana je bila nekako kod moj baka kako kod moje bake i dida koji nisu imali hranu, koji su preživjeli rat i to je bio odraz ljubavi."
0:22:54,0:23:02,"Znaš, oni su ti spremali hranu i nutkali su te hranom kad da ti kažu da te vole, nisu ti rekli da te vole nego bi te otpali hranom."
0:23:02,0:23:05,Koliko je to teško na toj razini promijeniti?
0:23:05,0:23:39,"Pa znam, ali nismo se odnio osamdeset petšestsedamdvije tisuće dvadeset sedam ali nosimo te obrasce a i vi evidentno da nosimo ali ja sam roditelj ti si roditelj naš i imaš neka svoja životna iskustva koja si prošla kao pubertetlja, kao odrasla osoba, jel dakle sve što ti nosiš kao transgeneracijski, jel dakle, jednosimo nekakve tradicijske vrijednosti, neka uvjerenja, jel dakle, to upravo to, nemoj da ti hrana ostaje na tanjuru, nemoj bacati hranu."
0:23:39,0:23:44,"I smatram da je to u redu, treba biti bazičan prema hrani, jel dakle, poštovati hranu."
