Start (HH:MM:SS),End (HH:MM:SS),Segment
1:13:17,1:13:20,"Ali je, mislim svi su."
1:13:20,1:13:34,"Ugovor mi je bila mala digresija kad sam te upoznala, upoznala sam i tvoju Petru i ja sam ti rekla kako si super prema ljudima u showu, kako si simpatičan i ti si meni rekao sve to što vidiš na ekranu, sve to sam ja zahvaljujući njoj."
1:13:35,1:13:36,To je jako lijepo.
1:13:36,1:13:37,"Naš, to je baš."
1:13:37,1:13:42,"Pa je, ja osjećam stvarno jednu odgovornost i zahvalnost zbog toga što smatram da je stvarno."
1:13:42,1:13:50,"Ja sam donio nešto i ona uvijek naravno to vrlo skromno prihvaća, ali čin se je da sam ja nebrojne razgovore s njom vodio oko kandidata."
1:13:51,1:13:57,"Ja mislim da se sad sada lažem, da kažem da nisam, ja sam pametan jako, ja sam pronicljiv, nisam, fakat nisam."
1:13:57,1:14:16,"Puno puta sam se našao da sam pred zidom, da ne znam kako nekog kandidata otvoriti ga, kako da počne promišljati o nekim stvarima, kako mu pristupiti, koji je pristup pravi, jednostavno sam tražio pomoć od osobe koja se bavi time, a to je razgovorom i jednom emocionalnom podrškom."
1:14:16,1:14:21,"I smatram da zaista stvarno jedan jako, jako važan segment, ako ne bih rekao možda čak i prestaje upravo to."
1:14:21,1:14:25,"Jer mi uvijek govorimo o tome kako je glava ta koja određuje sve, jel tako?"
1:14:26,1:14:27,Glava je ta koja sve određuje.
1:14:27,1:14:27,"Dobro, super."
1:14:28,1:14:29,Ja nisam doktor za glavu.
1:14:29,1:14:34,"Ja ću ti reći kako radiš čučanj,anj, kad radiš iskora, kad radiš potisak, kad radiš povlačenje."
1:14:34,1:14:37,"Ja sam za to doktor, ova ekologin, nisam doktor magistar."
1:14:38,1:14:46,"Ali, doktori sa glavom, ako ćemo ih tako zvati, mislim kolokvijalno, dakle, ljudi koji se bave emocionalnom podrškom, su oni koji su onda važni u tom procesu."
1:14:46,1:14:50,"Dakle, ako netko zaista ima taj problem, onda bih rekao, može stvarno krenuti od tu da."
1:14:50,1:15:06,"Mislim, ga je svi putuju u vodu u Rim, nutricionist, fizioterapeut, kineziolog, psihoterapeut, svi će na jednom trenutku dovesti do te osobe i ta osoba će iz onih svojih unutarnjih podržaja i iz unutarnjih osjećaja krenuti u nekakav proces."
1:15:06,1:15:08,Ali stvar je opet na kraju odnosa.
1:15:09,1:15:16,"Neka će sa trenerom, neka će sa nutricionistom ili sa nekom trećom osobom ustvari taj odnos koji će joj pomoći da izađe iz svog limba van."
1:15:17,1:15:24,"I zato je to, mi smo socijalna bića, nama je odnos jako važan za postojanje, za identitet, za svrhovitost."
1:15:25,1:15:32,I vrlo često danas evo čujemo jako često ljudi zapravo su sve manje u nekakvom emocionalnom odnosu.
1:15:33,1:15:35,"U distrakciji smo, konstantno smo, diskonektirani."
1:15:36,1:15:39,"Nikad više nismo konektirani međusobno, nikad manje u odnosu."
1:15:40,1:15:43,"Ja se pričam o odnosu koliko ja nešto puno znam o tome, ali tako mi se čini."
1:15:44,1:15:56,"Ono što čujem i od stručnih osoba, ajmo to tako reći, i ono što vidim je da se taj socijalni kontakt izgubio dosta, a potreban nam je za nekakvu svrhovitost."
1:15:56,1:16:18,"I iz tog razloga bih rekao da ljudi koji jesu u problemu, da osjećaju taj problem, da on ne mora biti samo izražen kroz tjelesnu masu, može biti na razno razne načine, da ga osjećaju da je jako važno promisliti zapravo što im je važno, što im je potrebno, što im nedostaje i da onda nekako pokušaju naći tu podršku na koju se uvijek vratimo."
1:16:20,1:16:24,"Znači emocionalna stabilnost, hrana i disciplina."
1:16:25,1:16:27,"Zapravo tri neka stupa, zar ne?"
1:16:28,1:16:33,"Pa vjerujem da da, vjerujem da da., a onda opet sve eto."
1:16:35,1:16:38,"Nekako sam filozofski nastrojen danas, oprosti ako."
1:16:38,1:16:55,"Dapače, super je, ali mi je naš, razmišljamo o tome i živimo svoje živote i onda vidiš u par tisuća km dalje, ljudi žive u ratu, znaš, onda zaboravi emocionalnu stabilnost, prehranu, aktivnost, zaboravi to sve."
1:16:55,1:17:05,"Mi smo to prošli prije trideset godina, netko to sad zna, ja sam mislio, to sam razgovarao sa svojim svojim prijateljem koji je ratno dijete on iz Slavonskog Broda i baš u ratnim godinama bio tamo."
1:17:05,1:17:09,Ja sam čak i se borio koliko je Slavonski Brod kazneno stradao u ratu.
1:17:10,1:17:15,Mi smo svi mislili da više nikad rata biti neće nakon ovog našeg.
1:17:16,1:17:21,"Kao to, znači sad smo završili i onorak, skužiš, pa kako non-stop neko ratuje?"
1:17:22,1:17:24,Pa dokad više majka mora stara?
1:17:24,1:17:25,Zar nismo ništa naučili?
1:17:25,1:17:37,"Znači, onorak, pa čeka moguće da smo prošli kroz dva svjetska rata, da se još uvijek ljudi živi koji su kroz to prošli i da tih njih stavljaš ponovno u taj problem."
1:17:38,1:17:38,Pa kako?
1:17:40,1:17:41,"Znaš što, kako je to moguće?"
1:17:41,1:17:42,Za čije interese?
1:17:44,1:17:44,Zbog čega?
1:17:45,1:17:46,"Za industriju, vjerojatno."
1:17:47,1:17:48,"Za pare, da."
1:17:49,1:18:12,"Ja sam prenajevan u tome i mislim, kažem, možda nije ni trenutak za takvu vrstu razgovora, ali sve više sam u onom nekakvom stanju da ono zagrli svoju djecu, poljubi ih, drži ih blizu sebe, bude blizu ljudi koje voliš, osjeća neki mir jer sreća je bojim se sveti gral."
1:18:12,1:18:22,"To više nitko se ne pokušava naći nekakvu sreću kao takvu, kao nekakav ultimativni cilj nego samo nađe neki mir koliko je to moguće."
1:18:22,1:18:26,"Možda smo čak malo i izbombardirani srećom, zar ne?"
1:18:26,1:18:34,"Zar ne misliš da smo i terorizirani srećom, da moraš biti stalno sretan i da je uvijek sreća i onda ako nisi tamo sretan osjećaj što se nesretno osjeća."
1:18:34,1:18:38,"Da kao da su to dvije jedine emocije koje imamo, naš, ono što je da sam sretan ili sam nesretan."
1:18:38,1:18:53,"Ali znaš što bih te htjela pitati, što mislim da je, sad smo absolvirali ovaj dio tebe kao jedina kao doktora za fitness trainer, ali ti si fitness trener, dakle teretana je tvoje igralište."
1:18:54,1:19:02,Ja sam prvi put kročila u teretanu sa četrdeset četiri a moj sin sa devetnaest i njegova ekipa idu svakiakodnevno u teretanu.
1:19:03,1:19:22,"I vidim da kod te generacije djece, ne znam koja su to Z generacija ili koja već, da njima teretana postala onako središte života, njima je to i društveni izlazak, oni se tamo i gledaju ženske, oni se tamo i druže, ali nekako se gaji taj kult tijela."
1:19:22,1:19:30,"Ne idu u teretanu iz istih razloga kao što sam ja krenula u teretanu, da bi mi noge bile stabilnije, da mi se ne bi ukljaštio mišić kad se spuštam sa planine."
1:19:30,1:19:41,Ja sam krenula zbog zdravlja da se da budu fizički spremnija da mogu nekakve napore podnijeti a oni idu isključivo zbog kulta tijela.
1:19:42,1:20:06,To ti je isto kao i prije deset petnaest dvadeset trideset godina četrdeset godina ne misliš da je više danas nego prije ne bih rekao mislim da ne mislim da nam i brojke govore zapravo ne govore u tom kontekstu jel da je tu nekakav napredak ja bi trebao potražiti statistiku koliko često ljudi koji postotak ljudi u Hrvatskoj se bave redovito tjelesnom aktivnosti.
1:20:07,1:20:46,"Ali bit ću hrabar pa ću ti reći otprilike manje od petnaest posto manje od petnaest posto ljudi u hrvatskoj siguran sam se bavi redovitom tjelesnom aktivnošću po tim smatram nekakvu vrstu rekreacije što to znači redovita tjelesna aktivnost jel to svaki dan da se baviš nečim ili pa ne fajn to staviti u nekakav kontekst tri puta tjedno da si nekako fizički aktivan mislim danas je dosta o tome priča, postoji nekakvo tjelesno kretanje, odlazak na posao, šetnja, nošenje stvari, nekakva aktivnost koja nam je potrebna da bi mogli obavljati svakodnevne dužnosti i obaveze."
1:20:46,1:21:02,"A onda postoji nekakva vrsta tjelesne aktivnosti koja nam je ciljana tjelesna aktivnost, koja nas usmjerava u nečemu, koja ima za nekakvu svrhu, ti si rekla koja je tvoja, da bi mogla savladat lakše planinu, da bi se bolje osjećala, da bi preventivnoirala možda neku povredu."
1:21:02,1:21:05,Kod tog sina je neka druga svrhovitost u tome.
1:21:06,1:21:06,On želi dobro izgledati.
1:21:07,1:21:08,On želi izgledati kao neko kovežba.
1:21:08,1:21:09,On ne želi biti zdrav.
1:21:09,1:21:10,On nema motivaciju biti zdrav.
1:21:11,1:21:13,Ja sam 19 godina razmišljao o tome da želim biti zdrav.
1:21:13,1:21:14,Ma taj je on.
1:21:14,1:21:16,I meni je to savršeno jasno.
1:21:16,1:21:19,"Jasno mi je da ja danas se ne obraćam istoj populaciji kao prije 10, 15, 20 godina."
1:21:20,1:21:21,Ne obraćam se jednostavno.
1:21:21,1:21:22,Jer sam ja drugačiji.
1:21:22,1:21:27,"I danas fitness trener koji bi imao 22, 23, 24 godine, on sigurno ne bi razgovarao o tome o dugovječnosti."
1:21:28,1:21:30,"Znate, morate razmišljati o tome kako ćete vi sa svojim unucima."
1:21:30,1:21:31,Ko bombi?
1:21:31,1:21:44,"ko gore i briga za unuke, daj sad odmah, di sam čovječe, daj mi da vidim kako ću moći imati dupe ko Kim Kardashian, kako ću imati leđa ko ne znam Silvestr Stallone i kako ću imati biceps ko moj prijatelj Viktorio."
1:21:45,1:21:57,"Dakle, znaš, to je ono, to je smisao postojanja, mislim, to je normalno, to je logično, jasno mi je to, kod njih je kultura, kod nas je nešto drugo, to dolazi generacijski i apsolutno, potpuno razumljivo."
1:21:58,1:22:12,"A kako onda zaključuješ, dak dakle podaci su da je sve više mladih nesigurniji u sebe, sve više poremećaja u prehrani, sve više psihičkih poremećaja, a mladi pohode teretane i toliko ulažu u izgled."
1:22:13,1:22:25,"Pa no šta, ja smatram da su ta istraživanja bila tako aktualna kad smo mi bili krivci da bi također bili frapantni podaci jer ne znam o tom nekakvom da li ima taj nekakav trend razvoja tih poremećaja sve više i više."
1:22:25,1:22:41,"Činjenica je da su, zato sam ti rekao u onom dijelu kad sam te pitao da li smijem reći Hitler, da su Da je digitalizacija donijela svoje neke probleme, donijela je puno lijepih stvari, puno prednosti, puno noviteta, ali isto također jako puno izazova."
1:22:41,1:22:44,Jako puno izazova i zato sam ja tu staromodan.
1:22:45,1:22:47,Evo jedna riječ koju nisam za sebe koristio.
1:22:48,1:23:00,"Ja sam tu staromodan, tu sam jako staromodan i ja želim da moja djeca budu vani, da se kreću što je moguće više, da su u društvu, to je jako bitno, da se socijaliziraju."
1:23:01,1:23:18,"Da nekad dobe ponosu, ne fizički, ne bi volio da mi vaše dijete dobi ponosu fizički, ali da dobi ponosu nekakvom iskustvom, da ga neko nidi po špota, da nešto nešto krivo napravi, da nauči na svojoj koži da se opeče, ali nadam se da baš jako boli."
1:23:19,1:23:24,"Ako ne mora, ne bih htio, naravno, zaštitnički sam nastrojen po tom pitanju, ali da prođe kroz ta iskustva."
1:23:25,1:23:31,Ali da ne doživljavam bullying preko ekrana i da ne smatram da je.
1:23:31,1:23:32,I da ne smatram da je to nešto jako važno.
1:23:33,1:23:34,To je izazovno.
1:23:34,1:23:39,"Imam šesti razred, sad će ići u sedmi iduće godine i to je sada jako izazovno."
1:23:39,1:23:58,"Ja ne bih iznosio neke sad detalje, ali stvari koje mi čujemo, koje se događaju u osnovnoj školi, to je ona serija Adolescence, šta je bila aktualna jedno vrijeme, bojim se da je mačji kašalj za ono što se događa zapravo trenutno."
1:23:58,1:24:34,"OK, ajde, tamo je bilo nekako ubojstvo, pa u tom kontekstutekstu kod nas se ne događaju toliko često i ne želimo da se događaju takve stvari iako smo u Prečku nedavno imali sličnu situaciju pa sada evo u Gracu, pa ono prije dva godine u Beogradu i to je ono od čega se roditelji najviše plaše i što je jer to je nam trenutno najveća nepoznanica i neprijatelj kojeg jednostavno ne znamo, di se skriva na koji način adresirati, kako jer naš ti si dao u ruke djetetu mobitel, prozor u cijeli svijet, ti pojma nemaš kako ga zaštititi od svih problema na koje može naletiti."
1:24:34,1:24:36,I zato sam ja tu groza.
1:24:37,1:24:38,Pogotovo curice.
1:24:39,1:24:48,"Ja mislim da su curice, ja vjerujem da su to ljudi, ali ja imam žensku djecu pa s te strane to sigurno meni još dodatno opterećenje."
1:24:49,1:24:57,"Tako da, velim, to je nešto čega se jako plašim i nešto što bi pokušao ako ikako moguće nekako zaštititi ih što je moguće više."
1:24:57,1:25:08,Manje se bojim toga kažem ti da će stradati vani koliko god nekakvi izazovi bili nego od ovih stvari koje se može dogoditi u tom virtualnom svijetu.
1:25:09,1:25:19,Ali misliš da je taj virtualni svijet i ti trendovi sa Instagrama da su promoviraju zdrav način života koji zapravo može postati potpuno nezdrava obsesija?
1:25:20,1:25:34,"Pa dobro da to je isto nešto što može otići u jednu drugu vrstu krajnosti koja isto također nije zdrava, to da si sad preopterećen svojim izgledom tijela, bilo da je ono narušenog izgleda ili da je gotovo savršeno."
1:25:35,1:25:38,"Ali znaš, sad još nije točno to i onda si ti opet s time opterećen."
1:25:39,1:25:40,Nijedna krajnost nije dobra.
1:25:40,1:25:50,"Znaš kako je kao sola krivulja, jedna lijeva i desna strana, to su nekakvi ekstremi koje bi trebala izbjegavati, negdje ta zlatna sredina koliko je to moguće, nekakav normalan balans u životu."
1:25:51,1:26:00,"Kažem, ja sam prvi kao netko tko je sportaš cijede život i tko je u tjelesnoj aktivnosti i koji, nadam se, imao relativno zdrav pristup sportu."
1:26:00,1:26:07,"Bogu hvala za obišle su me neke teže povrede, cijeli život sam u pokretu i to je dio mog identiteta."
1:26:07,1:26:12,Svejedno ne smatram da moja djeca trebaju imati takvu vrstu odgoja dječjeg.
1:26:13,1:26:19,"Znači opet bih htio naći tu nekakvu ravnotežu da su aktivne, ali opet u onoj mjeri koja njima odgovara."
1:26:19,1:26:24,"Ako to bude u smjeru sporta, naravno podržat ću ih, ali nisu moja očekivanja takva."
1:26:26,1:26:27,Ne guraš ih u tom smjeru.
1:26:28,1:26:33,Jel misliš da mi kao roditelji trebamo gurati ili samo usmjeravati?
1:26:36,1:26:41,"Smatram da se trebamo izuzet što je moguće više, što je moguće više."
1:26:41,1:27:17,"Mislim da neke smjernice i primjerom, živjeti primjerom, da je to najbolji način odgoja, a onda dati podršku u onoj mjeri koliko je to potrebno, pod tim podrazumijeva ona naša logistička podrška, vozim na trening, vozim na natjecanje, pričekamo, to su sve sastavni dio odrastanja i u nekom trenutku života je i moj tata znao nekad doći po mene na trening kad je on bio jako kasno u laganjinu i kad bi išli pa se nas troje naguramo u peglicu i moj stariji nas vozi na večer ili sutra ujutro je škola."
1:27:18,1:27:24,"O, takvu vrstu podrške naravno je potpuno razumljiva, ali onda se na neki način izuzeti."
1:27:24,1:27:43,"Ovo gdje, opet nisam u toj koži, pa naš, teško mi je pričat, ali činjenica je da danas roditelji pohode tribine, i natjecanja, hodočastne na natjecanja svoje djece i u prvim su redovima jako su glasni i navijaju, može biti dvosjeklimač, evo samo to."
1:27:43,1:27:55,"Znači da povremeno mislim da je to zdravo i da dijete osjeti podršku, ali opet ako si na svakoj tekmi, svakoj hodočasti, da to možda stvara ne može stvoriti nekakav dodatan pritisak kod djece."
1:27:55,1:27:58,"Mislim da to nije zdravo za nekakvo odrastanje, samo to, ništa drugo."
1:27:58,1:28:13,"Jer ja prije svega gledam da dijete treba i dijete treba se igrati,, a da o sportu, nekakvom selektivnom sportu trebamo pričati, ono ne, nekakvoj juniorskoj dobi, kada zaista vidi se u kojem smjeru ide ta njegova, ako ćemo je nazvati karijera."
1:28:13,1:28:25,"Ključ svega zapravo i kad pričamo o roditeljstvu i kad pričamo o hrani, o sportu je umjerenost i normalno, a nekako mi se čini da je danas nikad teže biti umjeren i normalan jer su sve neke krajnosti, sve su krajnosti ekstremne."
1:28:25,1:28:27,"Težimo, pa da, težimo, težimo."
1:28:28,1:28:39,"To je opisano dobro pitanje za nekoga tko se bavi proučavanjem ljudskog mozga i zašto, zašto toliko stremimo kad tim krajnostima i zašto su nam one toliko važne da nam je teško ostati u balansu."
1:28:39,1:28:52,"A s druge strane, jako smo veliki konformisti, jako volimo da nam je toplo, ugodno, nekano, da nam je sve lijepo, njoj i njoj, a opet volimo te, volimo te krajnosti."
1:28:53,1:29:24,"Tako da, zanimljiva smo mi bića za promatrati u svakom slučaju, falim mi još puno znanja kojeg se nadam da ću u godinama koje slijede steći i iskustva da me još malo bolje upoznam ljudski način i koncept razmišljanja jer sad trenutno smatram da još uvijek nisam ni zagrebao površinu a toliko sam različitih ljudi trenirao u životu i različitih karaktera da je to za jednu dobru knjigu napisati."
1:29:24,1:29:29,Recimo i za kraj molim te koja je najveća glupost hit mršavljenja koju si čuo?
1:29:30,1:29:47,"Ja sam za Ja se u zadnje vrijeme suočavaš sa OZNP-om, budući da ne volimo izlaziti iz zone ugode i ne volimo poduzimati napore, pa sad više pribjegavamo tim nekim čarobnim tabletama i injekcijama."
1:29:47,1:29:53,"Ja ti to nekako cijeli život gledam ovako sa strane i samo se jako smijem svemu tome, to mi je baš onako histerično smiješno."
1:29:53,1:30:00,"Mislim, naravno ironičan sam dok to govorim jer nije uopće smiješno, ali onako jednostavno ne mogu se prestati čuditi."
1:30:00,1:30:09,"Tragamo i Draga moja Ivana, šta ti misliš, koliko puta sam do sada u ovih dvadeset i kustur godina pričao o novogodišnjim rezolucijama?"
1:30:10,1:30:11,Šta misliš?
1:30:12,1:30:13,dvadeset i nešto toga.
1:30:14,1:30:20,"Znači svake godine isto pitanje, dođe neki novinar koji je postavio e znaš mi bi napravili prilogu o novogodišnjoj rezoluciji."
1:30:22,1:30:26,Ja bi volio naći one prve snimke da vidim kako sam bio entuzijastičan oko toga.
1:30:26,1:30:33,"Znate vi sad kad krene nova godina, najbolje bi bilo da vi sad odmah krenete pa onda u početku, vjerojatno naglo, treba jako krenuti."
1:30:33,1:30:35,Tako sam govorio kad sam bio mladi trener.
1:30:35,1:30:38,"Pet puta tjedno u teretanu, onda sam malo stariji."
1:30:38,1:30:40,"Pa znate, trebalo bi umjereno krenuti."
1:30:40,1:30:45,"Možda najbolje da prvo malo reducirate telesnu masu, da prvo pazite na prehranu."
1:30:45,1:30:48,"Onda sam pod kraj kao, slušajte, nemojte vi nikog skretati."
1:30:48,1:30:52,"Nemojte vi nikog skretati dobro, vam je tu gdje jeste, ostanite vi tu."
1:30:53,1:30:54,"Znači, i takve slične."
1:30:55,1:30:59,"Evo kad me pitate što je najveće gluposti, ja bih rekao, ne ovo je više gluposti."
1:30:59,1:31:18,"A sve ovo što se tiče ovih hit i trendi, metoda mršavljenja, tu su neko vrijeme, dođu vodu, puno ljudi to isprobava, cijela fitness industrija bih rekao ili beauty industrija počiva na tome, netko je to jako dobro unovčio i ruga se svima ostalima koji se time bave."
1:31:18,1:31:21,"Pa eto, nekad sam ja predmet ruganja, nekad je netko drugi."
1:31:22,1:31:24,Jeste li ikad u životu bili na dijeti?
1:31:24,1:31:38,"Ne, nekad u životu nisam bio na nikakvoj dijeti, možda na nekoj bolnici, pa sam bio u bolnici, sjećam se jednoga da sam se otrovao, to je jedna možda dobra predavačka priča za kraj, dosta opisuje mene i moj koncept."
1:31:39,1:32:02,Mislim da je bila Olimpijada u Londonu dvije tisuće dvanaest mislim bio sam kod prijatelja gledali smo nešto ne nekakvo natjecanje i on je bio dan prije na svadbi i donio je janjetinu sa svadbe i ja rekao donesi tu janjetinu mamo da jedemo janjetinu da gledamo olimpijadu i nije bilo kruha šta sad da je kruha janjetina daj šta imaš ima čipi čipsa ja daj čipi čips janjet janjetin.
1:32:02,1:32:04,"Pojevo, ja tu čip i čips stajem i janjetin i meni poznalo."
1:32:05,1:32:07,"Opasno, truvanje."
1:32:07,1:32:09,"Znači, ja sam osam kila izgubio jednu noć."
1:32:10,1:32:16,"Znači, ja sam završio na gore na ovoj, kako se zove, zaraze."
1:32:16,1:32:17,"Mihaljević, Frod Mihaljević."
1:32:18,1:32:21,Sam završio na infuziji i ja sam se jedva dovukao do doma.
1:32:21,1:32:23,"Stari, kad me je vidio na vratima, nije me prepoznao."
1:32:24,1:32:25,"Znači, ozbiljno truvanje."
1:32:25,1:32:30,"Od tog dana, od tog dana, ja više nikada u životu nisam čip sielao."
1:32:30,1:32:34,Eto super dijeta umjesto Ozempika janjetinu i chipi chips.
1:32:35,1:32:37,"Da, i da vidiš kako si u osam kilova jedna noć."
1:32:37,1:32:44,"A znaš, ljudi uvijek očekuju da ću reći da nisam jeo janjetinu, ali od janjetine ne možeš pobjediti, tako da prestan sam chipi chips jesti."
1:32:45,1:33:24,"Ne vjerujem u taj koncept mršavljenja na taj način, vjerujem u promjenu životnog stila, vjerujem u to da čovjek svjesno razmišlja o tome šta su mu prioriteti, kako želi da mu život izgleda i kada je spreman na tu promjenu onda on i zakorači i onda se dogodi ta jedna mala magija koja meni predmet mog razmišljanja i proučavanja već dugi niz godina i kroz emisiju koju radim i mimo emisije i evo jednog dana kad saznam što je to točno onda ću možda i knjigu napisati ili doći još jedan podcast da ti kažem što je to točno, što je to što pokreće ljude ali u svakom slučaju to će biti predmet proučavanja, izučavanja i promišljanja ljudi sigurno još dugi niz godina."
1:33:25,1:33:26,Samo još jednu stvar da podijelim.
1:33:27,1:33:34,"Neki dan kad sam, kako sam krenula trčati, pratim i objavljam to na Instagramu pa patnje Ivane Paražiković kako se muči na to."
1:33:34,1:33:35,Na pogodbeni način.
1:33:35,1:33:37,"Stotinu ljudi, sto različitih savjeta."
1:33:37,1:33:39,"Da, milijardu savjeta, ali ti si mi rekao: manjisi toga."
1:33:42,1:33:43,To je isto kao i mnogogodišnja rezolucija.
1:33:44,1:33:46,Rekao sam ti to ono što točno kako ja razmišljam.
1:33:48,1:33:49,"Trčanje nije dobro za tijelo, zar ne?"
1:33:50,1:33:51,Ništa nije dobro za tijelo.
1:33:51,1:33:56,"Najbolje je ležati u krevetu, to je najbolje za tijelo, ali nije dobro za glavu."
1:33:56,1:33:57,Pa vidi ovako.
1:33:58,1:34:01,"Trčanje je jedna jako, jako zezutaktivna."
1:34:01,1:34:09,jako je zazvonta tjelesna aktivnost zato jer nije zatvoreni kinetički lanac što znači u principu da mi u trčanju imamo jednu fazu leta kada naše tijelo nije u kontaktu sa podlogom.
1:34:10,1:34:11,Tako bi trebalo biti.
1:34:12,1:34:20,I sama ta činjenica da mi udaramo sa svojim stopalom tojest sa svojim tijelom o podlogu stvara jednu određenu dozu stresa u našim globovima.
1:34:21,1:34:33,I sad je pitanje da li na biomehaničkoj razini mi to izvodimo relativno pravilno pa amortiziramo taj udarac i na neki način smanjujemo rizik od nastanka povrede ili ne radimo to.
1:34:33,1:34:45,Zato je jako važno naći nekoga tko se može takve stvari razumjeti i tko se tim stvarima bavi da nam ukaže na to na kakav način bi trebali pravilno trčati kako bi naše tijelo ne bi bilo pod određenim rizikom od ozljede.
1:34:46,1:34:47,To je jedan parametar.
1:34:47,1:34:50,Drugi parametar je onaj energetsko-psihološki.
1:34:51,1:35:09,"Trčanje je prekrasno, trčanje je predivno za naše tijelo zato što toliko biokemijskih procesa dogodi se u našem tijelu, toliko koliko nuspojava ima u kontekstu zadovoljstva, sreće i jednog ispunjavanja, ispunjavajućeg osjećaja nakon završetka te aktivnosti da je zaista posebno."
1:35:10,1:35:12,A najviše posebno tome zato što je zapravo vrlo jednostavno.
1:35:13,1:35:18,"Sve što trebaš je samo trčati, a opet tako je teško i komplicirano."
1:35:18,1:35:31,"Tako da savjetujem svakako da ti nastaviš dalje trčati u svom ritmu kako tebi najbolje paše, ali ću ti reći da opet ubiti će me žena."
1:35:32,1:35:38,"Ona je počela, mislim ona trči godinama i rekreativni trkač, ali odlučila ove godine trčati polu maraton."
1:35:38,1:35:38,Opa.
1:35:39,1:35:39,Da.
1:35:39,1:35:48,"I ona je to planirala na proljeće i krenula je ona onako ambiciozno, ona meni kaže, vidi našao sam plan na internetu, ja ću trčat ovako."
1:35:48,1:35:52,"Znači da ima podlogu u trčanju, znači trči pet, šest km, to je normalno."
1:35:53,1:36:03,"Ja pogledam, ovo je malo ozbiljan plan i sigurno da ćemo, da da, može, krene, trči, trči nakon nekog vremena."
1:36:03,1:36:10,"Pozdravljam, nisam ništa htio govoriti, ali već na prvu kad sam pogledao, činilo mi se da je malo preintenzivan problem za nju."
1:36:10,1:36:17,"Naravno, kakav bih ja suprug bio da sam se petljao u to i da sam joj rekao da je to preintenzivan, nego sam pustio da ona to sama ispusi na svojoj koži."
1:36:17,1:36:23,"Ne zato što sam smatrao da sam nostradam, nego jednostavno zato što me ne bi poslušala da sam joj rekao da drugačije."
1:36:24,1:36:30,"I sad je ona to malo kroz iskustvo jedno prošlo, malo više sad sluša, malo više sluša."
1:36:30,1:36:37,"I ide malo sporijim tempom, ali vjerujem da će ovo jeseni ona to napraviti, da će to iscrčati i da ćemo mi ostali svi biti podrška."
1:36:37,1:36:45,"Bilo je sjajno video, ja sam vidio na Instagramu kada žena završava maraton, ulazi u cilj, a ispred ciljne ravnine, znači ne iza nego ispred to je muž i djeca."
1:36:45,1:36:53,"I djeca ju trče u zagrlje, a ona ih samo za opasnost koju je to pakle ide ona do kraja, da ona mora prvo kroz cilj proći."
1:36:53,1:36:57,"Ja to pokažem ženji i rekao ovako ćemo ti i dočekati, kaže ona, evo, evo, to ti je obitelj."
1:36:58,1:37:01,"Znači, kod doma do cilja oni ti sve za seru."
1:37:02,1:37:02,Da sabotiraju.
1:37:03,1:37:06,"Tako da, ovaj sad neko ne, ok, mi ćemo te čekati onda iza cijene ravnine."
1:37:06,1:37:11,"Želim i tebi da prožiš kroz svoju cijenu ravninu što prije, što bolje, ali najviše od svega da budeš sretna i zadovoljna."
1:37:12,1:37:12,Jesam.
1:37:12,1:37:13,"Hvala ti, jedo."
1:37:13,1:37:14,Baš je bilo zadovoljstvo.
1:37:14,1:37:15,Hvala tebi još tampod na pozivu.
