Start (HH:MM:SS),End (HH:MM:SS),Segment
0:29:14,0:30:28,"M mt jedanjedandvašest kad to izmisliš tako je odmah Biblije, bravo mt jedanjedandvašest nemojte zaboraviti zarez između, ako zaboravite zarez ništa od toga i unutar toga dvije riječi ima cijeli jedan redak i redak je isto super ali dvije riječi su dovoljne, bravo evo sad ću vam reći to glasnije., reci svima da oče, to vam je formula za svetost, da oče, sad se neki misle ono, sad kad ja to popijem, sad šta da napravim s tim, živi, živi svaki trenutak svoga života sa da oče, i dalje ta formula kaže jer tako se tebi svidjelo."
0:30:32,0:30:52,"Imamo najljepši uzor, one koja je od početka, od začeća već imala tu formulu u sebi, ona je već toga bila ispunjena, popila toga puno, od početka, a to je, evo službenice gospođe neka mi bude po tvojoj riječi, skraćeno da hoće."
0:30:56,0:31:04,"Osjećaj u svome srcu da te Bog poziva da budeš svećenik, da budeš redovnica, nešto te vuče ka tome, da hoće."
0:31:06,0:31:25,"I probaj, probaj, nemoj se bojat, probaj, ne možeš ništa izgubiti ako kao djevojka koja osjeća poziv u svome srcu da bude redovnica, odeš nekom redu, proučiš, vidiš malo koje su te njihove karizme, odeš malo do njih, porazgovaraš s njima, odeš par dana, živiš s njima, vidiš."
0:31:26,0:31:32,"I to je onda konkretnije, konkretiziralo se, živiš da oče, živiš to što te potiče u srcu."
0:31:33,0:31:46,"Ima neki dečko sviđati se i osjećaj da bi on mogao biti taj ili ima neka cura sviđati se, osjećaj da bi ona mogla biti ta, da oče, nešto te vuče iznutra, priđi, idi."
0:31:49,0:31:53,"Ne, ne, ali on mora biti muško, on mora mene pozvati."
0:31:53,0:31:57,"E, šta da hoće, šutiti hoće?"
0:31:59,0:32:03,"Ne, da hoće, oslobodi se."
0:32:07,0:32:12,Ja bi volio najviše kad bi svi muškarci večeras ovdje rekli da hoće i krenuli.
0:32:13,0:32:20,"E, ali je problem taj što ima malo i straha u njima, ne ide to baš tako uvijek jel tako, malo stisne nekad."
0:32:23,0:32:28,"Ali ako tebe nije stisnulo, a ti reci da hoće, javi se."
0:32:32,0:32:47,"Osjećate u svome srcu da treba živjeti svoj život kakav jeste, raditi gdje jeste, dati se do kraja i želite se tako posvetiti Bogu, želite dati do kraja na taj način Bogu u svakodnevnom životu radeći ono na što te on poziva, da oče i kreni."
0:32:51,0:32:53,"I ne možeš ugoditi, to je formula za svetost."
0:32:54,0:33:06,"Ako ćeš u svemu samo govoriti da oče, gdje te on poziva iznutra, ako je to njegovo jer te bi se tako svidjelo, ako je to njegovo onda ne možeš pronaći, onda ideš u nebo."
0:33:09,0:33:24,"Što nam pomaže da to prepoznajemo, tu se vraćamo opet na prvi korak i onda to ide u krug, a to je razočivanje je li od Boga ili od nekog drugog, a to polako, sad bi bilo previše da idemo u to, ali može se, može se."
0:33:25,0:33:36,"I moja zadnja misao je ne boj se, ne boj se, ne boj se popiti tu formu večeras, čarobnu formu, da hoće."
0:33:38,0:33:56,"Imate jedanjedan dva šest sa zarezom, ne boj se jer kad Jer svaki put kada kažem da hoću, događaju se, čude se stvari, čude se stvari od kojih živite."
0:33:57,0:34:00,"E zato samo hrabrost, samo hrabrost."
