Start (HH:MM:SS),End (HH:MM:SS),Segment
0:00:07,0:00:22,"Hvala vam lijepa na vašoj molitvi, hvala što, hvala Stjepanu koji me ne znam gdje je sad, izgubio sam ga, hvala vam što me pozvao večeras da mogu biti ovdje s vama i hvala vama što ste došli u tolikom broju."
0:00:23,0:00:25,"A znao sam da će to biti tako, zašto?"
0:00:25,0:00:51,"Zato što se govori o ljubavi, kad god je o ljubavi odmah svi navale, još posebno danas vam je ta tema nekako našla ono šta je s nama koji još nismo našli ljubav koju tražimo, a onda takvih ima onako često samo se oni skrivaju, onako ne žele se pokazati jer sve jer sramota, stara cura, stari momak, e, još nisi nikoga našao, kaže se ženi, koliko ste puta čuli to pitanje, kaže se više ženi, e."
0:00:54,0:01:05,"I mi ćemo večeras pokušati malo o tome razmišljati, idemo vidjeti zajedno što je to što se događa, gdje je taj ljubav tu prisutna i što možemo učiniti po tom pitanju."
0:01:05,0:01:12,"Znači meni je večeras želja, zaista jedina želja mog srca, vas je ohrabriti, ohrabriti."
0:01:12,0:01:14,Idemo pokušati zajedno vidjeti što se tu može.
0:01:15,0:01:27,"Evo, preporučio bih vam tri koraka, tri koraka večeras, nekako ćemo ih provoditi zajedno, vidjet ćemo možda pokušati još nešto između, jedno iznenađenje, vidjet ćemo kako će to ići, kako će dug sveti voditi, moramo njemu pustiti ovo sve."
0:01:29,0:01:59,"Kada sam danas ujutro bio u Skacu, daleko kod nas u Palmotićevoj, malo sam razgovarao s onima koji su tamo, znači imamo u uredu koji rade i tako koji su bili tamo, čak i Ike, danas se pojavio Ike, on je ono, njega dug sveti stvarno vodi svugdje, on se samo pojavi jedanput i tako se danas ujutro pojavio iz Osijeka, evo ga u Skacu u Zagrebu i tako smo malo mi pričali, svi smo bili tamo zajedno i onda sam i spomenuo da ću večeras ovdje biti s vama i da evo otprilike koja je tema o kojoj bi volio govoriti."
0:01:59,0:02:04,Ono što mi je bilo prekrasno je da sam dobio od njih toliko poticaja što bi trebao reći.
0:02:04,0:02:11,"Bilo je toga jako puno, pa neću moći sve iskoristiti, ali pokušat ću vam neke stvari reći, zato što su to ljudi koji su kao vi."
0:02:12,0:02:32,"Jer može se dogoditi nekada da vam ja govorim iz tog nekakvog svog iskustva, nečega što ja jesam, a to nije dovoljno, to nije dovoljno, zato što ja jesam svećenik Isusovac i govorim uvijek iz te perspektive, to je moj život, iz toga najviše znam jer to živim, to je moje iskustvo."
0:02:33,0:02:47,"Ali tvoje iskustvo je drugačije, što ne znači da ja nisam imao takvo iskustvo,vima jesam, nisam se rodio kao svećenik i suvremenik, imao sam jedan svoj put životni i prošao sam i zaljubljivanja i veze i sve to da bi došao do ovoga što danas jesam."
0:02:50,0:03:01,"Tako da volio bih vam danas donijeti ono što sam čuo od njih, ono što je i mene dotaklo u tome što su mi oni govorili, tako da evo vidjet ćemo koliko vam to može koristiti."
0:03:02,0:03:21,"Za početak, znači kao jedan prvi trenutak o kojem ćemo razmišljati jest nešto što je potrebno svima nama ali posebno je potrebno tim nekim osobama, evo možemo reći kao što je Stjepan rekao na početku, onima koji još nisu na neki način sebe pronašli."
0:03:24,0:03:38,"Jer ako ja imam, ajmo reći trideset i kusor godina i više i četrdeset već ušao ili tako i nisam pronašao sebe gdje me Bog zove, gdje jesam onda mi nešto fali."
0:03:40,0:03:47,"Što ne znači da je to loše, nije loše nego samo jednostavno tebi sebi trebam priznati nešto mi fali posebno ako se u tome krije jedna neodlučnost."
0:03:49,0:03:56,"Možda među vama postoje zaista ljudi koji su pronašli svoj poziv, recimo poziv na brak ali još nije naišla ta osoba koja treba naći."
0:03:56,0:04:06,"Bogu hvala, to je jako dobar korak, to je već si nešto učinio, već si napravio nešto što zovemo razlučivanje, razlučivanje poziva."
0:04:08,0:04:22,"Znači ja sam već razlučio s Bogom u razgovoru, u razmatranju, u razgovoru s njim, razlučio sam da me on poziva u brak ili da me on poziva u redovništvo, svećeništvo, posvećeni život."
0:04:23,0:04:26,"Razlučio sam to već zbog Boga i to je već dobro, to je već prvi korak."
0:04:27,0:04:32,"Ali ako to nisam napravio onda mi nešto fali, znači nešto mi fali."
0:04:32,0:04:37,"E sada, da bi nekao mogao razlučiti dobro, potrebni su neki preduvjeti."
0:04:38,0:04:39,Puno je sad tu toga.
0:04:40,0:04:42,Ja večeras s vama neću govoriti o svemu.
0:04:43,0:04:48,"Izvoći ću jednu stvar koju mislim da je bitna, za temeljna, za početak razlučivanja."
0:04:51,0:05:01,"Večeras vas neću toliko voditi u samo razlučivanje jer zato je potrebno, potrebno je na vrijeme i potrebno je da pronađete nekoga koji će vas pratiti u tome."
0:05:01,0:05:27,"I poprilično je dobro da nađete nekoga za sebe, da to bude osobno, da hodate s tom osobom, s tim duhovnikom, bilo svećenikom, bilo časnom sestrom, bilo možda čak i nekim lajkom koji ima iskustva u tome, jednoj duhovnoj osobi koja zaista živi s gospodinom, koji to prepoznajete kada mu se približite vi to osjetite da je to ono izvanđeo što smo čuli, on je blizak s Bogom, on je blizak s Bogom, blizak je socijalno i on ti može pomoći isto tako."
0:05:28,0:05:30,Ali zato je potreban jedan osobni put.
0:05:30,0:05:39,"Za početak večeras ja bi ti samo donio jednu stvar koja je sigurno temeljna, bez koje ne ide, bez koje sigurno nećeš moći uopće ući u razočaranje."
0:05:40,0:05:46,"A to sveti Ignacije zove neopredjeljenost, neopredjeljenost ili idiferentnost."
0:05:47,0:06:02,"Znači kad čujete tu riječ neopredjeljenost ili idiferentnost nekako gledajući samo s ove neke ljudske strane to su prilično riječi koje su negativne, možemo reći, ti si indiferentan, kad nekome kaže da je indiferentan to znači da ono, boli ga briga."
0:06:03,0:06:10,"Ali kod svetog Ignacija je to nešto drugačije, ta neopredjeljenost ili indiferentnost vodi k nečem puno većem."
0:06:11,0:06:15,Pa ću vam pročitati sada jedan citat koji je za Ignacija bio važan.
0:06:16,0:06:32,"Kaže da Ignacija je Nikada, on je uvijek imao nekakvu možemo nazvati elastičnu duhovnost, znači uvijek je tražio Boga u svemu, nije nikada zatvarao vrata u tom smislu, uvijek je dopuštao Bogu da uđe na sva vrata njegovog života."
0:06:33,0:06:37,"Ali ima ta jedna stvar, kaže, da je barem jednom izričito rekao nikad."
0:06:38,0:07:01,"Naime, u jednoj od svojih važnih rečenica kaže ovako, čuvaj u svim stvarima slobodu duha, ne gledaj ni u čemu na ljudski obzir, nego nekati duh iznutra bude slobodan da bi u svako vrijeme mogao raditi i suprotno, neka te ni jedna prepreka ne zadrži od čuvanja ove duhovne slobode, nikada ne odustani."
0:07:02,0:07:05,Tako je Ignac napisao u jednom svom pismu.
0:07:06,0:07:14,"Znači Ignac je govorio o slobodi duha, HZMO govori o tome kao tom preduvjetu te neopredjeljenosti."
0:07:15,0:07:16,Zašto je ona bitna za tebe?
0:07:19,0:07:23,Da bi mogao uopće krenuti razočarati potrebno je da budeš neopredjeljen.
0:07:24,0:07:33,U jednom od svih najpoznatijih djela Ignacija u duhovnim vježbama naziva nešto načelo i temelj i onda u tom načelu i temelju govori baš o toj neopredjeljenosti.
0:07:34,0:07:36,Da sam slobodan od svega.
0:07:39,0:07:43,"Bilo bogatstvo, bilo siromaštvo, bilo zdravlje, bilo bolest."
0:07:44,0:07:50,"Što god mi Bog da, ja sam slobodan, primamo od njega, od njegove ruke."
0:07:51,0:07:54,"To je ta sveta neopredjeljenost, ta sloboda."
0:07:55,0:07:58,es tom slobodom duha ja mogu ući u razočaranje.
0:07:58,0:07:59,Zašto?
0:07:59,0:08:02,Jer samo s njom mogu primiti ono što mi Bog daje.
0:08:03,0:08:10,Jer inače ako bez toga uđemo u razočaranje svoga poziva onda ćeš izabrati nešto što je tvoje.
0:08:11,0:08:16,"I najčešće uopće ni nećeš čuti Boga nego ići ćeš samo svojim silama, udarati ćeš samo svoje."
0:08:19,0:08:28,To razočaranje nije samo večeras za one osobe koje još uvijek nisu našle nikoga pa razočaraju svoj poziv nego to se može koristiti i u vezi.
0:08:30,0:08:38,"Ako ste već u vezama, opet moraš imati tu slobodu duha i u toj vezi jer inače ta druga osoba ti postaje idol."
0:08:39,0:08:47,"Ako nisi slobodan od nje, što ne znači da je ne ljubiš, nego samo znači da je možeš dati Bogu."
0:08:48,0:08:49,Što znači biti slobodan od drugoga?
0:08:50,0:08:54,"Znači da ga mogu dati Bogu jer je on njegovo dijete, ona je njegovo dijete."
0:08:55,0:08:57,Potrebno je da je dam njemu.
0:08:58,0:09:02,"Ako to mogu učiniti, ako je mogu pustiti Bogu, onda sam slobodan."
0:09:04,0:09:12,"A tek tada zaista ljubim tu Bogu osobu, ako je dopustim da bude Božja do kraja, onda je ljubim svim svojim bićem."
0:09:14,0:09:22,"Zato ova sloboda duha je bitna za svakoga od nas ovdje večeras, bitna je i za mene kao svećenika, kao redovnika."
0:09:23,0:09:32,"Jer ako ja nemam te slobode onda vam ne mogu donijeti Boga, onda ću vam najčešće donositi samo sebe, a to vam neće dugo trajati."
0:09:32,0:09:37,"Možda će vas oduševiti malo na početku, ali na dulje staze ništa od toga."
0:09:38,0:09:40,Zato je puno važnije da vam donesem Boga.
0:09:44,0:09:52,"Znači sloboda duha, to je temeljno da bi započeo razočivanje, da bi započeo tražiti gospodina."
0:09:54,0:09:56,Kako pronaći tu slobodu duha?
0:09:56,0:09:58,Kako biti neopredjeljen?
0:10:00,0:10:01,Strpljivo s molitvom.
0:10:03,0:10:39,"Kada sam ulazio u velike duhovne vježbe još kada sam bio Bogoslov u Rimu i tada sam ulazio u te velike duhovne vježbe svetog Ignacija, o trideset dana u šutnji, samo jednu stvar nam je rekao znači naš voditelj tih duhovnih vježbi prije toga, rekao je dečki prije samih duhovnih vježbi, rekao je molite za svetu neopredjedinost, molite za svetu ravnodušnost, za svetu indiferentnost, kako god hoćete nazvati, molite za to, to je jako bitno, bez toga ne možete ući u duhovne vježbe i molite da budete velikodušni, uđete velikodušno u to."
0:10:42,0:10:56,"I trudio sam se zaista, to je bila jedina moja molitva, nekoliko mjeseci, možda i pola godine prije samih tih duhovnih vježbi jer svaki mjesec bi on dolazio polako nas pripremati za to i onda na ljeto u osam mjesecu cijeli mjesec smo to imali."
0:10:57,0:11:02,"Nekoliko mjeseci je on dolazio, ja sam zaista se trudio moliti za to, redovito, redovito, svaki dan sam molio za to."
0:11:03,0:11:18,"I gospodin mi je toliko toga dao, toliko je milosti sam primio, koju ničim nisam zaslužio, ničim, ali došao sam otvorena srca, došao sam slobodna duha i toliko sam toga primio."
0:11:19,0:11:36,"Zato je to početak svega, to je prva minus, evo neka prva stvar koju večeras bi mogao ako tebi služi uzmi to, iskoristi to da možeš od danas početi molit gospodina za tu slobodu duha, a druga je da budeš velikodušan onda u tom odgovoru."
0:11:37,0:11:48,"es tim dvjema stvarima, s tom svetom ravnodušnjom ili slobodom duha i velikodušnošću ulazim u onda to razlučivanje, ulazim u to traženje Boga, to jest traženje njegove volje za moj život."
0:11:50,0:11:53,"To je prva stvar, prva stvar, prvi korak."
0:11:55,0:12:16,"Drugi korak, do njega ćemo doći ako vam opet malo spomenem svetog Ignacija, on nam je isto, mislim evo mogli ste primijetiti da je on dosta bitan jer zbog njega sam i kao svećenik onda dijecedenski otišao u društvo Isusa, on je zaista toliko toga donio u mom životu."
0:12:16,0:12:31,I zato bih sada kao drugi korak vam volio pričati malo o nečemu što te zna priječiti onda ako i kreneš uopće u to razočaranje onda se dogodi nešto što te zaustaviti.
0:12:32,0:12:42,"Ali to se može dogoditi čak i prije, prije nego uopće kreneš, možda se sad događa u vašem životu, možda baš sada, a to je strah, strah."
0:12:43,0:12:50,"E sad taj strah ima više vrsta, zaista puno i opet kažem ne mogu ih ući, večeras su sve."
0:12:50,0:12:57,"Zato ovo opet preporučam, otiđi nekome osobno, s njim razgovaraj, onda ćeš moći polako sve te strahove imenovati."
0:12:58,0:13:19,"To je početak borbe sa strahom, imenovati taj strah, imenovati ga, dati mu ime, tko je, gdje si ti, odakle ti dolaziš, koga dolaziš, zašto si u mom životu, tko te je poslao, imenovati ga, što želiš učiniti u mom životu, gdje me vodiš, to su pitanja koja moram postaviti i dati si odgovor."
0:13:21,0:13:24,"Ja ću već danas spomenuti dva, dva straha."
0:13:25,0:13:32,"Prvi je strah od odgovornosti, a drugi je strah od toga što će drugi reći."
0:13:33,0:13:46,"To su jedni ovako od češćih strahova možemo ih nazvati posebno među mladim ljudima, posebno među onim mladima koji nisu još uvijek pronašli recimo svoj poziv koji nisu krenuli."
0:13:47,0:13:48,Strah od odgovornosti.
0:13:49,0:13:49,Zašto?
0:13:50,0:13:58,"Zato što svaka odluka koju ti doneseš u životu nosi posljedice, nosi uvijek posljedice, svaka odluka."
0:13:58,0:14:05,"Znači ako doneseš jednu odluku nešto moraš maknuti sa strane jer u svemu što biramo uvijek su najmanje dvije mogućnosti, najmanje uvijek dvije."
0:14:06,0:14:09,"Uvijek možeš reći da i ne, uvijek."
0:14:10,0:14:11,Uvijek imaš tu slobodu.
0:14:11,0:14:17,"Nekada postoji više mogućnosti u nečemu što biramo, onda razočivanje postane i malo teže, ali može se i u tome."
0:14:17,0:14:26,tome jer se smanjuje polako i opet se dođe na kraju do dvije ali svaka odluka nosi sa sobom posljedice.
0:14:28,0:14:32,A samo onaj koji je odgovoran može preuzeti te posljedice.
0:14:34,0:14:38,Zašto se događa da mi u našem životu ne donosimo odluke da bježimo od njih?
0:14:38,0:14:39,Zašto se javlja taj strah?
0:14:39,0:14:41,Zato što nemamo odgovornosti.
0:14:43,0:14:44,Nemamo odgovornosti.
0:14:46,0:14:50,Bojimo se tih posljedica koje se mogu dogoditi i zato mi je lakše se sakriti.
0:14:52,0:14:57,"Lakše mi se praviti gluh, ne čujem, pričaju, boli me briga."
0:15:04,0:15:05,Što napraviti s tim?
0:15:09,0:15:22,"Sveti Ignacije u jednom trenutku svoga života kad je krenuo na taj duhovni put došao je u jedno mjesto koje se zove Madreza i u toj Madrezi je ustvari počeo dobivati velike, velike spoznaje od gospodina."
0:15:23,0:15:30,"Ali još uvijek tada u tom trenutku on je bio jako, jako, jako se borio sa skrupuloznost."
0:15:37,0:15:43,"ga je dovela u jednom trenutku, on to sam govori, dovela ga je u jednom trenutku do skorog samoubojstva."
0:15:45,0:15:56,"Došao je doslovno pred jednu liticu na rub i htio se baci dole, nešto je njemu cijelo vrijeme govorilo baci se, baci se, nema smisla."
0:15:57,0:16:01,"I skoro je učinio samoubojstvo, svetac, jedan svetac, evo."
0:16:02,0:16:06,I taj svetac u tom trenutku je bio izgubljen slučaj.
0:16:07,0:16:12,"Taj svetac u tom trenutku imao više od trideset godina, a govorimo o šesnaest stoljeću."
0:16:14,0:16:18,Zamislite kakav je tek tada bio problem nekog tko sa trideset godina još nikakve odluke u životu nije donio.
0:16:19,0:16:46,"Mi danas imamo problem evo trideset godina još niste ništa odlučili, već i danas prigovaramo, a kamoli tada, tada sve ženili s četrnaest i petnaest već je tada bilo sve riješeno on je već tada u tim svojim godinama nikakve odluke nije donio ne samo da nije donio odluke nego je došao do trenutka da počinje samoubojstvo, toliko ga je to ubijalo što se dogodilo?"
0:16:50,0:16:54,Odlučio je opet i u tome tražiti gospodina.
0:16:58,0:17:02,I u tom trenutku je odlučio isto osočivati njega.
0:17:03,0:17:05,Počeo je u sebi razlikovati duhove.
0:17:06,0:17:15,"Već prije je to učio u trenutku svog obraćenja, možemo reći mi ove godine Isusovci slavimo petsto godina od trenutka tog Ignacijevog obraćenja."
0:17:19,0:17:27,Već je tada polako dok je u bolničkoj sobi bio sa slomljenom nogom operiranom i lomljenom više puta naživo i tako nije tada bilo anestezije.
0:17:28,0:17:36,"I tada dok se oporavljao čekao je i razlučivao je duhove, čitao je malo jedne stvari, Viteškaane, malo život Isusa i onda je gledao što se u njegovom životu događa."
0:17:36,0:17:47,"Tako i u ovim skrupuloznostima, gledao je, pitao je odakle dolazite, što ne meni rađaju, kako se ja osjećam kada se to meni događa."
0:17:47,0:18:10,"I onda je te stvari odmicao sa strane, sve ono što nije bilo od gospodina, sve ono što nije u njemu rađalo jedan istinski mir, jednu radost, ono unutarnju radost, unutarnje predanje, sve što u njemu nije rađalo više ljubavi, više nade, pouzdanja, više vjere, sve je to odmicao, odmicao osobe jer je to mu prepoznao da to nije od gospodina."
0:18:13,0:18:15,I onda je u tom trenutku preuzeo odgovornost.
0:18:17,0:18:21,"Preuzeo je odgovornost i odlučio je, ja idem u Svetu zemlju."
0:18:23,0:18:27,"To je moj put, idem tamo i tamo ću služiti, tamo ću se dati do kraja."
0:18:28,0:18:31,Ali tu isto sada dolazi do nečega jako zanimljivog.
0:18:32,0:18:32,Zašto?
0:18:32,0:18:39,"Zato što čak i tu je Ignacije slobodan, tog slobodnog duha ima u sebi, da kada dođe u Svetu zemlju služi da to nije za njega."
0:18:39,0:18:40,Zašto?
0:18:40,0:18:41,Zato što ga izbacuju.
0:18:42,0:18:53,"I to ne bilo tko, izbacili ga fratri, fratri ga izbacili, fratri rekli ne može Ignacije nogom nazad za Barcelonu."
0:18:56,0:19:04,"Naravno, pokušao Ignacije, daj, ostavite me pa nemojte me baš tako i tako, ali kad su oni rekli, nema, onda je rekao dobro, nije od gospodina, idem nazad."
0:19:07,0:19:18,"Imao je, imao je razočaranje, da, oni su imali razočaranje, a razočaranje njihovo je bilo, stisnuo se od Turaka, znaš, ako ovaj luđak ovdje ostane, Turci će i njega i nas."
0:19:19,0:19:22,"I to je brzinsko razočaranje bilo, Ignacije ti nazad u Barcelonu."
0:19:26,0:19:30,"Znači, imao je slobodu duha, vratio se nazad i tražio je i dalje samo Boga."
0:19:32,0:19:37,"I tu sada dolazimo do tog drugog straha koji se događa u našem životu, a to je strah od što će drugi reći."
0:19:39,0:20:04,"Govorio sam na početku ono, kaže se više udati i takve te stvari i onda kaže više puti, nikad više stalno nemate isto pitanje, stalno se vrti oko toga itede To su te stvari kada nas drugi pritišu, kada počinju ti glasovi drugih, kada majka stisne, ajde više, ajde više, pa vidi je kakva se, pa tako fina, pa dit je momak."
0:20:11,0:20:12,Što će drugi reći?
0:20:14,0:20:36,"Sada bih želio s vama podijeliti jedno evanđelje koje vam može pomoći u takvim trenucima, a to je jedno evanđelje koje ste sigurno isto već čuli, a govori o jednom zanimljivom liku, a zove se Petar i još jednom drugom zanimljivom liku, a zove se Ivan."
0:20:37,0:20:40,"Petar i Ivan, oni su vam bili s Isusom."
0:20:41,0:21:05,"I taman Petar odradio onaj ljubiš li me, ljubiš li me, ljubiš li me, pa ljubite, pa ljubite i krenuli njih dvojica, kažemo mi, ajmo malo prošetati, aj Petre, kaže ovako, a to mu reče nagovješćujući kakvom će smrću posloviti Boga, rekavši to doda, idi za mnom."
0:21:06,0:21:19,"Petar se okrene i opazi da ga slijedi onaj učenik kojeg je Isus ljubio i koji se za večer rebijaše privio Isusu na prsa i pitao ga gospodine tko ćete izdati, vidjevši ga Petar kaže Isusu gospodine, a što s ovim?"
0:21:20,0:21:25,"Odgovorimo Isusu, ako hoću da ono ostane dok ne dođe, što je tebi do toga?"
0:21:26,0:21:26,Ti idi za mnom.
0:21:33,0:21:44,"Sljedeći put kada vam netko bude kvoco, stani i samo ga onako pogledaj i prepozna i Petra u njemu."
0:21:47,0:21:51,Zašto drugi imaju potrebu stalno nama govoriti što trebamo mi raditi?
0:21:53,0:22:02,"Zato što su oni u nečemu ranjeni, zato što ne mogu sebi do kraja reći što bi trebali, pa je lakše reći drugome."
0:22:04,0:22:07,Petar još nije bio spreman do kraja.
0:22:08,0:22:19,"I znamo, trebalo je skroz do Rima i kvo vadit iz domina, idemo opet da me razabnemo Petra, e tek tada je Petar došao u glavu, tek tada."
0:22:23,0:22:33,"Osobe koje nam to govore imaju isto tako svoje borbe i kad ih tako počnem gledati onda mi je puno lakše, onda ih mogu ljubiti, a onda to stvari mijenja, uvijek ljubav mijenja stvari."
0:22:36,0:22:48,"Ali nemojmo zaboraviti što je Isus rekao prije toga, ti idi za mnom, E tu sada dolazimo do jedne važne stvari."
0:22:50,0:22:57,"Svako od nas ovdje je već danas pozvano na jednu stvar, to sigurno, to je isto kod svih, a to je svetost."
0:22:58,0:23:00,"Tu se poziv ne mijenja, tu je isti kod svakog od nas."
0:23:03,0:23:03,Što se mijenja?
0:23:03,0:23:06,Mijenja se način na koji ćemo doći do svetosti.
0:23:07,0:23:12,"Mijenja se način na koji ćemo doći do svetosti, a to su ti pozivi koji postoje u crkvi."
0:23:13,0:23:19,"Poziv na brak, poziv na posvećeni život svećeništvu, redovništvu i poziv na posvećeni laikati."
0:23:20,0:23:22,Ali poziv na svetost je svima jednak.
0:23:24,0:23:40,"a to je ovaj id za mnom, id za mnom, budi meni blizak ja, sjetite se iz Evanđelja koji sam blizak Ocu, Sin Božji, blizak Ocu, budi ti blizu meni, id za mnom."
0:23:44,0:24:02,"U ovom trenutku sada jedini način da pronađeš mir u svom životu je da ideš za Isusom, prvo to da ideš za Isusom, to je tvoj poziv sada u ovom trenutku i taj poziv je ustvari poziv u svakodnevnici."
0:24:03,0:24:14,"U onome najmanjem što činiš svaki dan, ono na što si pozvan svaki dan, tamo gdje si na fakultetu, to je prva stvar ako ste studenti, prva stvar je fakultet."
0:24:15,0:24:27,"Ako ne polažeš ispite, ako ne učiš, pa možeš onda razmišljati o evangelizaciji ne znam čega, ali ništa od toga, nemati svetosti jer će to biti kratkotrajno, izgubit ćeš svoju dušu."
0:24:28,0:24:35,"Ako ne kreneš od onoga što je prvotno tvoje, temeljno, svakodnevno, onda će se izgubiti u raznim evangelizacijama."
0:24:37,0:24:44,Trebaš prvo izvršiti ono što se od tebe traži da bi onda mogao sebe dati do kraja u onom drugom.
0:24:45,0:24:49,"Jer inače tvoje srce će biti razdvojeno, a srce kada je razdvojeno nikad nije dobro."
0:24:50,0:24:53,"Nikad nije dobro kada je srce razdvojeno, nikada."
0:24:56,0:25:00,Srce mora biti cijelo i mora se u punini dati tamo gdje se daje.
0:25:02,0:25:04,"Zato idite polako, korak po korak."
0:25:04,0:25:10,"Neka drugi pričaju, samo neka čuje ona Isusa, što to tebe briga, ti ide za mnom."
0:25:14,0:25:18,"Ali živi svoju svakodnevicu, živi taj svaki trenutak."
0:25:19,0:25:27,"Jer ako Mater kaže e, pospremi krevet onda to ne znači da ti možeš nju pogledati i reći, hvala neka ona svoje priča, idem ja za Isusom."
0:25:29,0:25:30,Krevet pospremi.
0:25:31,0:25:45,"Ako nećeš prvu stvar učiniti ujutro kad dođeš jel tako, kad ti mama dođe i kaže kako se zoveš, Martina je se pospremila krevet, ti ulaš u nekakav, onda se vratiš, što mi pospremiš ga i to je to."
0:25:48,0:26:00,"Ako ne krenemo od toga, od prve stvari ujutro s tim, počinjemo od početka, time slijediediš najbolji Isus."
0:26:01,0:26:07,"E sada bih volio da napravimo jednu stvar, to je to malo iznenađenje, to sam naučio od jednog svog subrata i mislim da je to jako bitno."
0:26:08,0:26:11,"Sad ću vam objasniti svrhu toga, a onda ću vam reći što ćete napraviti."
0:26:11,0:26:30,"Svrha je da ja sada vama pričam puno toga, puno toga sam vam već sad ispričao, ali to će ostati često samo ovdje u glavi, možda, nekima ako su neki čuli, ako nekome je išta to koristilo, ne znam sigurno nije baš puno, ali eto barem nešto valjda."
0:26:30,0:26:39,"Ali da bi se to spustilo u srce, da bi se to utemeljilo u tebi, potrebno je da to podijelimo, moramo to podijeliti, mora biti živo, ne može se samo vrtiti tu u zraku negdje."
0:26:40,0:26:40,Što ćemo sad učiniti?
0:26:41,0:27:18,"Okrenut će se osobi do sebe, pronađite si para, nađite si para i podijelite kratko, minutu, dvije, tri, tri minute, ne vidjet ćemo koliko bude ja ću otprilike odlučiti, podijelite međusobno dvije stvari, dvije stvari koje su vas dotakle iz ovoga što sam do sada rekao, dvije stvari, ok, samo dvije stvari, ali konkretne stvari, ne govorite, ne govorite reći i ovo je dotaklo me kako je on tu pričao o ljubavi, ne, nego gdje je priča o ljubavi, što je rekao o ljubavi, to podijelite, dvije konkretne stvari, ajmo."
0:27:18,0:27:21,"Nađite si para, jednog para i samo podijelite to s njim."
0:27:35,0:27:42,"Vidim ja da bi vi to sad dijelili do sutra, vidite kako se rodi nešto živo odmah, to je bitno, to je bitno, jako bitno."
0:27:43,0:27:46,"Jednu stvar ću vam reći, jednu tajnu, smijem vam reći jednu tajnu."
0:27:49,0:27:53,"Ono što ste podijelili, tu je nešto važno za tebe."
0:27:55,0:28:03,"Kad ćeš se večeras vratit kući malo ostani s tim, malo porazgovori s Bogom baš o te dvije stvari koje ste dotakli."
0:28:04,0:28:05,Zašto baš to gospodine?
0:28:06,0:28:07,To je nešto bitno za tebe.
0:28:10,0:28:17,"Privodimo kraju, znači zadnja točka, dvije smo prošli, sada je treća točka."
0:28:18,0:28:37,"Zadnje dvije godine mog života tražio sam formulu za svetost, Stjepane tražio sam formulu za svetost, išao sam oko, svugdje, u Slavoniji sam bio zatvoren novicijat od dvije godine u Splitu, ali sam bio s gospodinom i tražio sam formulu za svetost za svetost?"
0:28:37,0:28:38,Ja imam formulu.
0:28:39,0:28:42,"Znači da ću vam formulu, to napravite i sveti ćete biti."
0:28:42,0:28:43,Je li može?
0:28:44,0:28:45,To izbriši?
0:28:45,0:28:45,Ne.
0:28:46,0:28:47,"Aha, da, ok."
0:28:47,0:28:50,"Ja mislim da netko neće, dobro, netko neće, ok."
0:28:51,0:28:52,"Formula za svetost, jeste spremni?"
0:28:54,0:28:57,"Bilo bi dobro da zapišete, ako imate šta za zapisati, zapišite, ok."
0:28:58,0:29:08,"Snimam se, a i to se snima, ali ti ćeš možda zapat prije dok ovaj video izađe, a prije onoga koji će to gledati odmah to popiješ i riješeno za tebe, sveti."
0:29:10,0:29:11,Jeste spremni?
