Start (HH:MM:SS),End (HH:MM:SS),Segment
0:00:01,0:00:14,"Evo dragi mladi, vjerujem da u životu ne možemo nekad razumjeti trpljenje, ne možemo nekad razumjeti progon, ne možemo nekad razumjeti zašto nam se nešto događa."
0:00:15,0:00:25,"Međutim, riječ Božja je ona koja nam uvijek pomogne, koja nas ohrabruje jer riječ Božja nije moja tvoja riječ."
0:00:26,0:00:28,"Ono što Bog kaže, to stoji."
0:00:29,0:00:31,Mi ljudi smo prevrtljivi u svojim obećanjima.
0:00:31,0:00:33,"o njima, Bog ne."
0:00:34,0:00:48,I dok danas razmišljam kako pronaći onu Božju riječ koja će mene i tebe ohrabriti u našim životnim situacijama pronašao sam je i u knjizi Postanka.
0:00:49,0:00:52,Vi samo razmislite malo povijest spasenja.
0:00:53,0:01:17,"I kad gledate sve ona pisma, sve onu povijest spasenja kako nas je Isus spašavao, onda ćete vidjeti da je Izrael izabrani Božji narod, taj mali narod je Bog izabrao za sebe i Bog uzima između njih Abrahama koji će ih voditi."
0:01:18,0:01:19,I što se događa?
0:01:22,0:01:48,"Izrael je mali narod, oko sebe je imao narode, nacije, puno moćnije, puno jače, puno uglednije i drugim riječima možemo reći imao je pored sebe tako jake neprijatelje da je u očima ljudskim bilo neizvjesno da oni mogu pobjediti i da mogu opstati."
0:01:49,0:02:09,"Koliko nama se u životu dogodi da nekada evo okruženi smo situacijama, ljudima, nadređenima, osobama kojima se čini u životu svi su jači od nas., svi nas mogu nagaziti, svi nas mogu uništiti."
0:02:11,0:02:21,"Ali kad pogledaš ako je čovjek nevjernik, ako čovjek nema pouzdanja u Boga može odmah potonuti, možeš se odmah predati u životu."
0:02:22,0:02:27,"Međutim, ne zaboravimo da naša snaga ne dolazi od nas."
0:02:28,0:02:34,Ima u psalmu kad molimo kaže da je jadan onaj čovjek koji se pouzdaje u čovjeka.
0:02:36,0:02:46,"Jer Božja snaga može izvesti ono što ne može niti jedan čovjek, niti jedna vojska, niti jedna organizacija."
0:02:47,0:03:00,"I sada kada pogledate izraelski narod okružen svim neprijateljima i Abraham normalno da je u strahu, što je meni tebi najveća prijetnja kad vidimo naše neprijatelje?"
0:03:01,0:03:12,"Tu smo onda na testu ili nam se manifestira vjera ili ne ili nevjera koja se manifestira kroz oblik osobnog straha, paranoje."
0:03:13,0:03:24,"Koliko puta sami čujemo u našim rječnicima neće ovo izići na dobro, nećemo ovo pobjediti, neću uspjeti jer onda nastupa zapravo naša nevjera."
0:03:25,0:03:30,"Nastupa u nama strah, a to nije od Boga jer Bog ohrabruje."
0:03:31,0:03:55,"Ako Bog mene ili tebe stavi u neku situaciju neprijateljsku, stavi nas u okruženje, zamisli samo tvoje radno mjesto, stavi to u okruženje neprijateljsko, stavite tamo gdje nije raspoloženje neko dobro, gdje ti stave stalno neke, kako se kaže ono nogu na put ili nešto protiv tebe, onda normalno ti nije ugodno."
0:03:56,0:04:10,"Međutim, nije li Bog s razlogom stavio Abrahama izraelski narod među silne te neprijatelje i puno veće vojske i sve oko njih, ali ga nije poslao da ga nije ohrabrio."
0:04:10,0:04:15,Nije ga stavio Abraham tamo da vodi taj narod a da ga nije ohrabrio.
0:04:16,0:04:17,Znate što im je rekao?
0:04:17,0:04:25,Evo idem potražiti ovdje u ponovljenom zakonu sedam poglavlje osamnaest redak.
0:04:26,0:04:29,Zapamtite tu u sebi rečenicu kad nađete u krizu.
0:04:30,0:04:33,Ponovljeni zakon sedam poglavlje osamnaest redak.
0:04:36,0:04:44,"Kad je Abraham vidio u kojoj sredini, oko koga je okružen, komu radi o glavi, da svakog trena mogu biti uništeni."
0:04:46,0:04:47,Što im je Bog rekao?
0:04:48,0:05:09,"Ne, ne, ti idi tamo i onda im kaže u toj rečenici ponovljenog zakona sedam poglavlje osamnaest redak, ne boji ih se, ne boji ih se, ne boji ih se, govori u množini, ne boji ih se svi njih, ne boj se jer ja sam s tobom."
0:05:11,0:05:16,"I vidite, Abraham se nije bojao, zato je postao pravotac vjere."
0:05:17,0:05:24,"Vjerovao je Bogu njegovo obećanje, ne boji se, ja ću djelovati kad treba, ja ću biti uz tebe."
0:05:25,0:05:30,"Na drugom mjestu isto Bog daje Abrahamu i kaže, ali ja ću biti uz tebe, ne boj se."
0:05:31,0:05:36,"A još mi je jačala rečenica u punom ovako množini, ne boji se."
0:05:37,0:05:40,Šta je ovo ih u mom i tvom životu?
0:05:41,0:06:11,"Množina ova, to su današnji naši strahovi, današnje naše paranoje, ljudi, situacije, svega onoga što mi u životu vidimo, nabrajamo svakodnevno od jutra do navečer šta sve vidimo, doživimo, ali sjetimo se koliko god da ih je i u množini, pa da se uroti cijeli svijet, sjeti se Božje riječi, ne boj ih se, ponovljeni zakon sedam poglavlje osamnaest redak."
0:06:12,0:06:15,Velika je to stvar kad ti Bog nešto jamči.
0:06:15,0:06:30,"Ne boji se, ne boji se svojih strahova, ne boji se za svoju budućnost, ne boji se hoćeš li se udati nećeš, ne boji se hoćeš li uspjeti ili nećeš, ne boji se svoje slabosti, ne boji se."
0:06:31,0:06:41,"Kad izbrojimo sve te naše strahove, situacije, e onda se to pretvara u množinu, onda nastaje strah i paranoja."
0:06:41,0:06:56,"Međutim, ako čovjek nije usidren u Božju riječ i ne sjetiš se svakodnevno tih Božjih obećanja, lako čovjek može zaista upasti u krizu."
0:06:57,0:07:04,"Šta mislite, možda ćete reći pa dobro, to je samo dogodilo Abraham."
0:07:06,0:07:11,"Međutim, zlo je uvijek tu, ona je aktivno uvijek."
0:07:12,0:07:36,"Pogledajte poslanici F je fežanima, danas prvo čitanje slušali smo, odnijeli su knjige da pročitam, kaže nije nam se boriti protiv krvi i mesa, protiv vrhovništva vlasti, borimo se protiv zlih duhova, borimo se protiv tame, koliko toga zla, koliko toga zla koji se bori protiv dobra."
0:07:37,0:08:01,"I zato nekada ne borimo se samo protiv onog vidljivog ljudi koji su okruženi nego u pozadini su uvijek zli duhovi, tama koja potiče i traži suradnike, traži suradnike, a ti suradnici se zovu ljudi koji onda se stave u službu džavlu, a ne Bogu da bi činio džavo svoje."
0:08:02,0:08:04,"I zato, zašto to govorim?"
0:08:05,0:08:15,"Poslanci Fežanima to upozorava, postoji duhovni svijet, evo mnogi se večeras spremaju i sladit će noć vještica, mnogi će reći da je to samo igra."
0:08:16,0:08:32,"Onaj koji je duhovan on će osjetiti i zna dobro da i sami vještice su proglasile da je ovo najjača tamna noć u kojoj oni imaju i svi zapravo koji se bave magijom, zlo i bilo čime najjače je dejstvo."
0:08:32,0:08:36,Ali ja ovdje pričam o Bogu koji je to sve pobjedio.
0:08:37,0:08:40,Ali samo hoću reći da zlo ne prestaje raditi.
0:08:41,0:08:50,"Oke, Abraham ide sa scene, dolazi njegov sin koji treba naslijediti i voditi dalje narod, mislite da je Izaku bilo puno lakše."
0:08:51,0:08:59,"Izaku su radili ti okruženi neprijatelji njegovi, još veće, još veće zlo."
0:08:59,0:09:00,Šta su mu radili?
0:09:00,0:09:06,Radili su čak do te mjere da su išli zatrpanovati bunareve koji su bili iskopani za pitku vodu.
0:09:07,0:09:11,"Svakodnevno su mu činili zlo, svakodnevno su podkapali."
0:09:12,0:09:16,"To se svima nama u životu može dogoditi, rekao bih zlo ne miruje."
0:09:16,0:09:23,Uvijek će naći način daći način da nešto posije negativno.
0:09:23,0:09:40,"Međutim, jako je dobro Bog rekao u postanku u petnaest poglavlju Abrahamu, suočit ćeš se s poteškoćama, ali ja ću te zaštititi u svim njima."
0:09:41,0:09:53,Ponovo u postanku u dvadeset šest poglavlju kaže ne boj se ja sam s tobom blagoslovit ću te i to je ono lijepo što Bog je u svim tim situacijama uz nas.
0:09:54,0:10:08,"Mi trebamo biti poput Abrahama, poput Izaka, poput svih svetaca, u tim situacijama kad smo okruženi neprijateljima, kad udaraju sile tame na nas, ostati postojani i vjerni Bogu."
0:10:09,0:10:18,"Koliko god se čini neizdrživo, koliko god se čini puno jače od dobra, to je prividno, Bog će pobjediti uvijek."
0:10:19,0:10:22,Jer Bog kaže ne boji ih se.
0:10:23,0:10:32,"Na drugom mjestu, kako je Bog, možemo vidjeti suosjećajan s onima koji trpe."
0:10:32,0:10:43,"Bog nas ne šalje, ne stavlja u okolinu, u sredina, u mjesta gdje ćemo samo trpiti, biti okruženi neprijateljima, a da je za nas zaboravio."
0:10:43,0:10:43,Ne.
0:10:46,0:10:52,"Gledajte, vi znate svi onu priču Abrahama i Sare, da nisu mogli dobiti dijete."
0:10:54,0:11:20,"I naravno u njihovo vrijeme u židovskoj kulturi kad netko ne bi imao s obzirom da su da su da je Abraham kroz nekoliko godina postigao veliko bogatstvo i u tom bogatstvu naravno imali su i sluškinje i naravno da je imao sluškinju koja se zvala Hagara, to je sluškinja njegove žene Sare."
0:11:21,0:11:26,"Međutim, Sara nije mogla dobiti potomstvo, nije mogla dobiti dijete."
0:11:28,0:11:33,es druge strane imamo obećanje Božje Abrahamu da će dobiti sina.
0:11:35,0:11:37,I što Sara nije vjerovala?
0:11:37,0:11:39,Nije vjerovala tom obećanju.
0:11:39,0:11:47,"es obzirom da je Abraham star, ona već stara gleda svoje tijelo okopnulo, počela je smatrati to nemogućim."
0:11:49,0:11:51,Vidite sad jednu pouku iz ovoga.
0:11:52,0:11:59,"Koliko se nama u životu neke naše molitvene nakane, molimo za njih, a ne vjerujemo da će se dogoditi."
0:12:00,0:12:11,"Molimo za njih, a u startu sumnjamo da će se ostvariti, pogotovo ako traju malo duže, jesmo mi kratkog strpljenja."
0:12:12,0:12:19,"Tako je i Sara izgubila strpljenje i obećanje, prestala je vjerovati u obećanje da će Bog poslati im dijete."
0:12:20,0:12:20,I što radi?
0:12:21,0:12:25,"Tipičnu onu grešku koju svi mi radimo, preuzima stvar u svoje ruke."
0:12:26,0:12:31,"Ja to volim mladima reći požurimo volju Božju, guramo volju Božju na svoj način."
0:12:32,0:12:34,Dakle šta je ona napravila?
0:12:34,0:12:39,Uzela je svoju sluškinju Hagaru i dala je svome mužu da rodi dijete.
0:12:40,0:12:43,U židovskoj kulturi u tom vremenu to je bilo normalno.
0:12:43,0:12:47,Ako neka žena nije mogla roditi dijete onda sluškinja bi rodila dijete.
0:12:48,0:12:50,Ali ovo vam govorim kod Božje volje.
0:12:50,0:12:54,Vidite da nije dobro u životu gurati stvari.
0:12:54,0:13:02,"stvari jer ih mi radimo na svoj način, a Bog bi možda tu istu stvar, isti cilj napravio na svoj način."
0:13:02,0:13:10,Ovdje vidimo tipičnu ljudsku nestrpljivost i preuzimanje stvari u svoje ruke.
0:13:10,0:13:17,"Ne radite to, makar čekali godinama nešto, budite strpljivi Božjoj riječi, Božjoj obećanju."
0:13:17,0:13:33,"Ako se nađeš u situaciji neizglednoj, okružene neprijateljima, iščekuješ nešto, samo se sjetite ovih svih riječi Božjih koje nam govore.ori, ne boj se, ne boj se, s tobom sam, vjeruj mi, to je najbitnije, najbitnije."
0:13:34,0:13:35,I što se događa?
0:13:36,0:13:52,"Sara preuzima inicijativu, Hagara ostaje trudna, međutim počinje neprijateljstvo između njih dvije, počinje netrpeljivost između njih dvije do te mjere da je Hagara morala pobjeći u pustinju."
0:13:54,0:13:58,"E sad uzmite malo osjećaje, situaciju, je situacije te žene."
0:14:00,0:14:18,"Sluškinja nema nikakvu vrijednost, nema nikakvo dostojanstvo, nosi dijete kojemu ne može biti kako treba majka, ne može nije njezino, mislim njezino je, ali kao sluškinji nema pravo na nju, na to dijete."
0:14:19,0:14:29,"Trpi progonstvo, strankinja je i može još niz stvari nabroj zbog čega trpi i kako se osjeća."
0:14:29,0:14:32,Probajte ući malo u njezino stanje.
0:14:34,0:14:37,"Međutim, još se nalazi u pustinji sama."
0:14:41,0:14:44,Koliko i mi doživimo takve slične situacije?
0:14:46,0:14:46,Pustinje.
0:14:47,0:14:55,"Međutim, tu ovo što naglašavam tu osjećajnost Božju, Bog je nije ostavio."
0:14:57,0:15:13,"Baš tamo je izrekla nešto što je zapamćena, inače nitko ne bi zapamtio u Bibliji ime Hagara i jednu sluškinju, nego je ona u toj situaciji gdje se našla susrela se s Bogom."
0:15:15,0:15:19,Bog je čuo njezine suze i pronašao je u pustinji.
0:15:20,0:15:23,I Bog joj se preko anđela obraća da se mora vratiti.
0:15:25,0:15:27,I vidite kakav je naš Bog.
0:15:28,0:15:43,"Ovdje se iskazuje i vidi da je Bog naš pun suosjećanja, empatije i da nije gluh na nepravdu, nije gluh na naše neprijatelje, nikoga ne ostavlja samoga koji je pravedan."
0:15:44,0:15:47,Naša briga je samo da se borimo da budemo pravedni.
0:15:49,0:15:52,Bog se uvijek pobrine na svoj način kad će nas pronaći.
0:15:53,0:15:56,Hagaru je pronašao u najtežoj situaciji u pustinji samu.
0:15:58,0:16:05,"Možda smo i ti toliko zaokupljeni situacijom da nemamo vremena za pustinju, da bi nas Bog pronašao."
0:16:05,0:16:10,"Možda nas Bog traži, ali naći ćete sigurno, utješit ćete."
0:16:11,0:16:23,Ali što je to toliko Hagaru dirnulo da je ona izrekla nešto zbog čega su je evo zapamtili i zbog čega je uništila u Sveto pismo.
0:16:24,0:16:49,"Kad je se Bog obratio, Boga je imenovala ovako el roi, roji, el roji, a to vam znači Bog koji vidi, evo ja mogu pročitati i u Svetom pismu kako kaže, ali jako je lijepo znati, ona je izrekla nešto što je bitno i važno svakome od nas."
0:16:50,0:17:19,"U takvim situacijama, ona nije Bogu objašnjavala, protjerali su me, pa napravili su mi ovo, znaš da nisam kriva za to, nije se ništa Bogu morala objašnjavati, Bog je pronalazi, a ona začuđeno dirnuta Božjom blizinom, Božjom intervencijom, Božjom snagom i ljubavlju izrekla je ovo, el roji tojest Bog koji me vidi, Bog koji me vidi."
0:17:21,0:17:28,"Sjeti se i mene i tebe, Bog vidi, Bog vidi svakoga od nas, svaku našu situaciju."
0:17:29,0:17:33,"Zato sam ga rekao, ona nije objašnjavala Bogu što joj se dogodilo."
0:17:34,0:17:44,"Zato je i izrekla to El Roy, Bog sve vidi, vidio je nepravdu koja je učinjena prema njoj i kako se osjeća i zato je Bog intervenirao."
0:17:45,0:17:59,"Bog vidi i moj i tvoj život, Bog vidi sve naše situacije i to je jedna onako nadajuća rečenica i jedan lijep Božji postupak prema svima nama."
0:18:00,0:18:23,"Možda nekad ne možemo sve izreći, ne možemo podijeliti s drugima, ne možemo dočarati drugima možda koliko patimo, trpimo i koliko nam je teško ili s kakvim neprijateljima smo okruženi, ali sjetimo se Hagare i samo reci LROI, Bog sve vidi, Bog će intervenirati kad bude trebalo, kad mi više ne budemo mogli braću i sestre."
0:18:25,0:18:43,"Evo u poslanici Efežanima potiče nas uz ovo što upozorava na taj duhovni svijet i borbu, prvo da se mi molimo Bogu, da se mi ojačamo u njegovoj snazi."
0:18:44,0:18:57,"Zato vam kažem u životu na razini duhovnih borbi ostaje nam, mi se možemo samo boriti s ovim svijetom ako želimo živjeti u duhovnosti, samo nam ostaje božja snaga."
0:18:58,0:19:00,Bog će nam dati jer on sve vidi.
0:19:00,0:19:08,"I zato kažu poslanice fežanima danas u prvom čitanju, jačajte se u Bogu, naša je snaga Bog, s tim sam i počeo."
0:19:09,0:19:15,"Ako nema u nama Boga i Božje snage, mi ćemo uništiti sami sebe."
0:19:16,0:19:30,"Kaže jedna priča da je postojao neki dvorac koji je imao jako puno ogledala, sve je bilo obloženo ogledalima, ogledalima, ogledalima i u jednoj od tih soba obloženih ogledalima unišao je pas."
0:19:33,0:19:34,Nikoga nije bilo u dvorcu.
0:19:35,0:19:42,"Pas kada je unišao, ugledao je odraze u ogledalima sebe i vidio je tisuće pasa."
0:19:44,0:19:48,"Od straha počeo je lajati, svi su počeli lajati."
0:19:49,0:19:55,"Od straha je lajao sve više, ali nikoga nije bilo, svi su mu ti psi uzvraćali."
0:19:57,0:20:00,I cijelu noć se borio do jutra dok ga netko nije našao uginute.
0:20:02,0:20:17,"Dakle, pas se cijelu noć borio sa svojim osobnim tisućama odraza, odraza govorim, uginuo je što se borio sa svojim osobnim odrazom."
0:20:19,0:20:22,Što je onda svijet za mene i za tebe?
0:20:23,0:20:25,Jedno veliko ogledalo.
0:20:27,0:20:39,"I ono s čime se mi borimo, zapravo svijet, percepcija svijeta jesu naše tisuće i tisuće projekcija koje mi stvaramo."
0:20:41,0:20:44,Svijet je ono što mi projeciramo.
0:20:46,0:20:46,I to je svijet.
0:20:47,0:20:48,Jedno veliko gledalo.
0:20:48,0:21:00,"Ako ti projiciraš strah, ako ti se boriš sam, ako se braniš kao i ovaj pas, onda ćeš teško izdržati svaki pritisak i neprijatelja."
0:21:01,0:21:05,"Zato, kako kaže El Roy, Bog sve vidi."
0:21:06,0:21:06,Amen.
