Start (HH:MM:SS),End (HH:MM:SS),Segment
0:28:33,0:28:39,"Idemo trčat, ali ono priprema za trčanje nije trening nego upucati ću se u koljeno, neću uopće koristit Evangelij da bi evangelizirao."
0:28:41,0:28:45,Jer Evangelij će ti možda reći pa nemoj nići sin jer nisi ti zato nego netko drugi.
0:28:46,0:28:51,"Evangeliziraš kad poslušaš Božji riječ,, najbolja stvar evangelizacije je poslušat."
0:28:52,0:28:58,"I ako on tebi kaže, glej sine, ti molim te, super si, ali daj ti se samo skloni tamo iza, to je to."
0:28:59,0:29:05,"Kad sam ja bio u srednjoj školi i sad pojavila se profesorica, nova glazbenog i kao, formirat će se zbor."
0:29:06,0:29:09,"I ja i još dva, tri prijatelja uključili su se mi odmah u taj zbor."
0:29:09,0:29:13,"Dobro, mi smo htjeli i pjevati, ali tko je na zboru nije baš na predavanju."
0:29:13,0:29:16,I sve je to bilo super i sad je došao božićni koncert.
0:29:17,0:29:27,"I mi stvarno nama je to se sviđalo lijepo tamo i mi tamo pjevamo, pjevamo i sad su došle ove neke teže pjesme, a profesorica pogleda nas u reci i kaže, gleda na sveci i kažem, e da, da, da, sveci vi samo malo tiše kad."
0:29:28,0:29:48,"Ono, da bi to bolje zvučalo, bolje će zvučati ako vi budete tiši, vi budite tu, nemojte otići, nemojte ne doć, ne, ne vi dođite, ali tvoj zadatak je bit malo tiše i koncept će super zvučati, netko treba povisit to onda bi dobro zvučalo, netko treba smanjit, netko treba zašutiti, a netko treba govorit."
0:29:50,0:29:53,"Nema tu, aha, ja moram samo pričat, pričat, pričat, pa ne."
0:29:53,0:30:31,"Jedna prijateljica kada je predavala Bogoslovima Sveto pismo u Rijeci, onda su je kao ona objašnjava, ne možeš sad to doslovno sve gledati pa treba malo razmislit ovo, ono, kao treba, znate dragi bogoslovi, nije stvar da sad ti pročitaš i naučiš to na pamet nego ono razumiješ, razlučiš, doživiš, nekako percepiraš, u sam uđeš u to i to uđe u tebe, onako dođe do jednog spajanja, našo, jednog isjedinjenja na neki način, na jednoj emotivnoj razini i duhovnoj i tjelesnom svemu, jel, ja znam da ima to Bogus, samo moram, evo, sad ja moram, daj da nabobam na pamet i gotovo."
0:30:31,0:30:38,"I sad oni ajde skužili su dobro Bibliju, ne možemo čitati doslovno i kaže jedan, a dobro profesorice, a ima li neka druga knjigaiga koju možemo čitati doslovno?"
0:30:39,0:30:45,"Nema sine, moraš glavu koristiti za svaku knjigu, pogotovo za knjigu tvoje života."
0:30:47,0:30:53,I nemoj ni tražiti od Boga da on tebi napravi nešto bez da ti to moraš razumjeti i shvatiti i malo se potruditi.
0:30:53,0:30:55,Jer to je njima pljuješ mu u lice.
0:30:56,0:30:58,"Jer Bože, ne, neće, ja to ti to meni sreću."
0:30:59,0:31:00,"Super, ja da ti sređujem."
0:31:01,0:31:02,Pa zato tebe imam.
0:31:02,0:31:04,Tko tu koma ima biti sluga?
0:31:05,0:31:07,I to je dobro meni i tebi da smo sluga.
0:31:07,0:31:09,"Pa shvati gdje si, shvati što si."
0:31:10,0:31:13,"I to će ti dati blagoslov, to će ti donijeti plodove."
0:31:14,0:31:30,"A druga stvar, draga braćo i sestre, ima toliko fenomenalnih stvari koje mi zapravo volimo, ali mi smo doslovno sebe uvjerili da je nama to grozno, da mi to ne volimo i da se mi toga trebamo riješiti, da se mi toga trebamo riješiti."
0:31:31,0:31:33,"A zapravo ne, zapravo nije istinito."
0:31:34,0:31:36,"Evo primjera, daj da ću dva primjera."
0:31:36,0:31:57,"Jedan prijatelj sina ima tinejdžera, znate kako je to, jedva čekaš da ti sin dođe u te godine, da ti nakon petnaest godina što si ga prao, preslačio, odhranio, kaže tata ti mene ne voliš, ti uopće ne znaš, kako se voli, ti ne kužiš ništa, ti si najgori otac na svijetu i tako, to je evo, svi jedva čekamo imati jednog tineđera od petnaest godina, tako."
0:31:57,0:32:09,"I sad kaže taj prijatelj, on nešto je molio sa ženama da ključe božanskog milosrđa, Sin je kasno došao i kao nije zakaznu, ali morao je oprati suđe kojega je čekalo jer je htio izmigoliti."
0:32:09,0:32:51,"I sad on i žena mole za stolom, a tu je od nas spojena i kuhinja i sad taj Sin jel pere to suđe i onako on u vilicama i sada njemu sine molimo daj malo tiš, a da da oprostite, oprostite, dobro, sad oni naravno Bob, njegov je pregled, pa ću ti reći, pa sine sam zamolio, da, da, da, oprosti, da, da, da, da, opomoli, po njegovoj pregledu, e, e, kaže ja ga gledam, ono, gledam na onak i kaže i sad ovaj govori meni, pa ne bi čovjek poludio, imaš tih pet minuta, jedva nekako, evo da izmolim tu krunicu, jedva nešto, a ovaj te živcira, šta da radim?"
0:32:51,0:32:54,"Evo ja slušam i kažem prijatelju, ali ti u tome uživaš."
0:32:56,0:32:58,Pa pogledaj kako si vesel kad mi o tom pričaš.
0:32:59,0:33:09,"To je tvoj sin, ja znam da komunicira te ljude, komunicirati ljubav na malo čudan način, a valjda i ti njemu isto tako, ali to je način na koji on želi biti prisutan i ti zapravo si ponosan na njega."
0:33:09,0:33:22,"Istina da ti je to bolno u tvojim ustima, istina da bih htio da to napravi na neki drugi način, ali taj događaj je nešto fenomenalno, nešto predobro, prešto, pre lijepo čega se nećeš riješiti."
0:33:23,0:33:25,Ili evo drugi jedan primjer.
0:33:25,0:33:33,"Evo postoji, znači znate li što znači riječ organ, jedna strašna grčka riječ."
0:33:34,0:33:53,"Organ je ono što dovodi do dijela, znači oruđe, imam organe, imaš tjelesne organe, organe, organe državne organe, znači riječ organ znači nešto što dovodi do dijela, dijelo je na grčkom ergon, a energija je ono što dovodi do dijela, ergon, al dobro, to je malo grčko, čisto da znate."
0:33:54,0:34:00,"Sad imaš organ i poanta svakog organa je da organ tebi koristi, barem što se tiče ljudskih organa."
0:34:00,0:34:24,"Znači imaš oči, smatra se na normalan organ, jel ne sad neki koji ne felsha, znači ako imaš oči, oči tebi koriste da gledaš, imaš ruku, da s njome nešto valjda napišeš, da nešto kažeš, imaš usta, da s njima pričaš, imaš želuda da sme probaviš itede Postoji jedan jedini ljudski organ koji ne koristi onome koji ga ima."
0:34:26,0:34:27,"To je biologija, ovo nije teologija, sigurno da znate."
0:34:28,0:34:32,"Nije sad ovo, sad sam dobio spoznaje, ne, ne, ovo je čista medicina i biologija."
0:34:32,0:34:39,"Znači postoji jedan jedini fizički ljudski organ koji ne koristi onome koji ga ima, a nemaju ga svi."
0:34:40,0:34:41,A nemaju ga svi.
0:34:41,0:34:42,Znate li o kojem se organu radi?
0:34:46,0:34:48,Koji organ ne koristi onome koji ga ima?
0:34:48,0:34:51,"Znači, imaš ruku koristiti tebi, imaš oči koristiti."
0:34:52,0:34:59,"Imaš jedan organ, postoji jedan ljudski organ, jedan dobar broj ljudi ga ima, koji ne koristi onome koji ga ima."
0:35:03,0:35:04,"Moj mozak koristi, što?"
0:35:05,0:35:07,Mozak načelno koristi.
0:35:09,0:35:18,"Imate li ideju koji to ljudski organ čovjeka ima u svome tijelu, dio ti je tijela, a ne koristi onome koji ga ima, a mislim da normalno funkcionira."
0:35:19,0:35:25,"Ne sad imam ruku koja je slomljena pa mi ne koristi, nego imam organ, a nemaju ga svi, ponavavljam."
0:35:26,0:35:30,Imam organ koji meni koji ga imam ne koristi.
0:35:31,0:35:33,Prvo slovo je u.
0:35:34,0:35:35,Nije umljak.
0:35:39,0:35:40,Nije umljak.
0:35:42,0:35:43,Nije umljak.
0:35:47,0:35:48,"Uvo, nije uvo, nije."
0:35:49,0:35:50,"Ručimo biologiju, dobro, ajde."
0:35:51,0:35:52,Evo nešto ćemo naučiti.
0:35:52,0:35:55,"Znanstveno veće, znanstveno veće, pa učimo."
0:35:58,0:35:59,U?
0:36:00,0:36:00,Kako?
0:36:10,0:36:15,"Točan odgovor je utroba, utroba, majčina utroba."
0:36:17,0:36:24,"Znači, drage sestre vi koji imate utrobu, Bogu hvala, tebi osobno može živjeti bez nje, tebi ona ne koristi."
0:36:25,0:36:33,"Ali ta utroba tvome djetetu je svijet, svijet, cijeli svijet, sve."
0:36:35,0:36:43,"Izvor identiteta onoga što će se dogoditi u toj utrobi, doći će do novog života, doći će do začeća, utroba."
0:36:43,0:37:03,"E sad ja pretpostavljam, evo sam nisam žensko, evo, ali se divim onima koji jesu, koliko sam ja uspio ovako razgovarati sa braćom, sestrama u vjeri Kristu i tako shvaćam, znam da je to jedan vrlo zahtjevan organ koji često može razno razne probleme, bolovi proizvoditi i to baš gadne bolove."
0:37:04,0:37:10,"Ja vjerujem da ja da imam takav organ koji mi ne koristi, a donosi bolove, prva stvar kako da ga se riješim?"
0:37:11,0:37:30,"Ja da se riješim toga, šta će mi to, mislim šta će mi pravo, šta, ništa me ne koristi, šta će mi, živim bez toga, ja isto nemam utrobu, gleda, dobar sam, jel, ono, jel, ali nekome za nešto će trebat, e, ali to trebaš imati riječ, trebaš imati svjetlost."
0:37:31,0:37:45,"I sad zamislite da dolazi neka djevojka i kaže, ma dragi, znaš šta, ja želim me u brak, ali znaš šta, imala sam jedan organ koji me nije trebao, to je bila moja utra, ja sam s toga riješila, pa pa, pa zašto draga, najljepši je tvoj organ i ti ga se riješiš, zašto bi ga se riješila?"
0:37:46,0:37:54,"To je organ koji zapravo na hebrejskom se zove milosrđe, isti korijen riječi je kao i milosrđe, raham odakle dolazi."
0:37:54,0:38:14,"E onda sveti Ivan Zlatovski to jako lijepo opisuje, kaže kada jedna žena ne želi svoje dijete i kada je zapravo njoj to dijete i opasno za život i kada bi bilo, kada njezina logika, kada njezin mozak, glava te žene u biti ispravno pokazuje da je dobro se riješiti toga djeteta, pazi, ta utroba te iste žene nju ne sluša."
0:38:15,0:38:17,Utroba ju ne sluša i ona hrani to dijete.
0:38:18,0:38:31,"Ona hrani to dijete iako logika i mozak naređuju ne, nije to dobro, šteti mi, boli mi, smeta mi, opasno mi je, utroba ne sluša, utroba ga hrani i daje da raste."
0:38:31,0:38:43,"I onda raste da svijet ima zlatost i kaže tako i kad Božja pravda kaže pravedno je da tebe se ubije, pravedno je da tebe nemir griješio se, agle, pravedno je da što s ti napravimo da se toga riješimo."
0:38:44,0:38:47,A Božje milosrđe ne sluša Božju pravdu.
0:38:48,0:38:53,"Najveća nepravda na ovome svijetu je Božje milosrđe, najveća nepravda."
0:38:54,0:38:59,"To je jedan od hintova iz Biblije, čisto ovako za one koji čitaju, evo to se u Bibliji nalazi."
0:38:59,0:39:13,"Znači, najveća nepravda na ovome svijetu je s Božje milosrđe, a to je opet riječ, da on kaže, ljubim te, opraštam ti, volim te, daj dođi k sebi, daj popričaj sa mnom."
0:39:14,0:39:17,"Ali gledajte, nemojte sad tu na mene gledati sad tko da to nešto bolje znam."
0:39:18,0:39:23,"Pa pazite, ja čitam Bibliju, trudim se sve, opet svaki put kad moram razmatrat, meni je to dosadno."
0:39:24,0:39:27,"Svaki put tražim sto izgovora, samo da ne moram razmatrat."
0:39:27,0:39:37,"Samo da, da, budem, budem, budem, a svaki put mi bude lijepo, ali opet svaki put tražim kako da izbjegnem, kako da se sakrijem, kako da ovo."
0:39:37,0:39:46,"Ali opet kao što smo slično pjevali u ovoj pjesmi, Božja milosrđa je takvo da će oni iskoristiti onu minutu da ti kaže ono što ti treba reći da živiš."
0:39:47,0:39:50,Bez te riječi nema života.
0:39:52,0:39:59,"Na kraju krajeva, evo vjerujem da ćemo i moliti danas i prije ste molili pa onda molimo evo za dar spozna je pa bude neka proročka riječ."
0:40:00,0:40:08,"Evo znaš kako se recimo neka dogodi da te baš ta proročka riječ po nekoj spoznaji nekog brata koji to uopće ne poznaje pogodi, promijeniti život, super."
0:40:08,0:40:12,"Ali to je opet jedan običan brat kao ti, ja, svi mi isti."
0:40:12,0:40:21,"Zamislite kolika je sn snaga Božje riječi koja po kojoj službeno znamo treba provjeravati sva duhovna iskustva, sva duhovna iskustva."
0:40:22,0:40:32,"Ja sad mogu reći, a ovo, ono, a onda će doći neka čeka čovjeka Biblija, a nauk Crkve, a pričaj ti šta god dočeš, ali ovo, ovo je temelj."
0:40:33,0:41:00,"Zato kaže jedan poluvic, mislim, to je vic jer židovski je pa nije smiješan, ja ga i dalje zovem vicem, kaže da je neki rabin tražio, pitao svoju ženu dozvolu da ode kao posvetiti se dva tri godine u pustinju, studirati, kao žrtvovat će se za obitelj jer to je čast za obitelj, on je to dobio neku veću razinu tog rabinstva pa će kao studirati Bibliju još bolje učiti na pamet i tako, žrtva će sebiće sam, ona nek se brine za djecu, ajde dragi za tu čast i sve tako."
0:41:00,0:41:09,"I izdržio nekako tamo, jedva jedvica i došao ženi svoj kako je volio, vamo tamo, bio je tjedan dana i kaže draga, a ja bi opet, ja bi opet."
0:41:10,0:41:15,Jer doživjeti Božju riječ jest nešto neprocijenjivo.
0:41:15,0:41:19,"A ne mislim to sad na nekoj samo emotivnoj razini, ona može biti vrlo teška."
0:41:19,0:41:26,"Koji je svaka druga riječ kad ti kaže, hej počistit, a ja ne bi sad mi se ne da čistit, pa možda i sutra."
0:41:27,0:41:32,"Sad nema ta riječ, ta riječ koja stvara svijet."
0:41:32,0:41:44,"Ili naprimjer evo najčešća slika u Bibliji što se riječi tiče, evo znate kako se stupa u vezu, vi ovi koji ste slobodni, kako stupiš u vezu s crom ili s dečkom ako si žensko."
0:41:45,0:41:59,"Znači veza ne počinje time što je neko nekog podragao, poljubio, pomazio, platio kao sve to treba, nego kad kažeš, hej jel bi ti htjela biti moja djevojka, moraš reći riječ."
0:42:00,0:42:12,"Bez te riječi ništa, bez te riječi ono pa jesmo li mi zajedno, nismo mi zajedno, a šta to njemu znači, a ne znači, pa šta ti je rekao, pa nije mi ništa rekao, onda ništa, onda ništa."
0:42:13,0:42:22,"Brak isto, šta je to, došli tu dvoje, cijela fešta, vjenčanice, zlata, večera, janjetina, sve, zašto?"
0:42:23,0:42:26,"Zbog onih par riječi, zbog onih par riječi."
0:42:28,0:42:30,Ali te riječi nešto znače.
0:42:31,0:42:45,"Naravno da će onda onaj naš neprijatelj ići za tim da učini da mi riječ ne volimo, ne izgovaramo, ne razumijemo ili da ju profaniramo, da je iskorištavamo na bezvezne načine, na druge stvari."
0:42:46,0:43:00,"I vidimo to kod ovog bogataša, jadnika jer je on bio bogat, znači on je osjećao očito neku glad, neku čežnju, on je ne želi biti prazan, želi biti ispunjen i onda trpaj, trpaj, trpaj, trpaj, trpaj ali ne ide."
0:43:01,0:43:17,"Pazite mi smo kao što je ludac, šta god na trpaš, prije ili kasnije iziđe dalje i opet si gladan jel, mi smo protočan jedan organizam, jel, metabolizam takozvani, jel prolazi, prolazi kroz mene hrana, prolaze iskustva, prolaze i koliko god natrpaš opet će proći."
0:43:18,0:43:20,Ali ima li nešto što ostaje?
0:43:21,0:43:30,"To je bilo prvo pitanje koje su učenici pitali Isusa u Ivanovom Evanđelju, to je ono Evanđelje za malo naprednije vjernike koji su već prošli ove sinoptike."
0:43:30,0:43:38,"Prva stvar što oni pitaju sad nije ojoj koje ćeš čudo, eje, kako ćeš meni promijeniti ime, a tvoja majka kako je tebi začela?"
0:43:41,0:43:45,"Ne, prvo pitanje je bilo učitelju gdje?"
0:43:47,0:43:47,E nije.
0:43:52,0:43:55,"Nije, ali dobro, niste vi krivi, kriv je prijevod."
0:43:56,0:44:04,"Pitanje je gdje ostaješ i dođeš, vidješ i osta doše kod njega onaj dan."
0:44:05,0:44:06,Gdje Isus ostaje?
0:44:07,0:44:10,"Tu će sve bit, tu će sve proći, ali gdje ostaje?"
0:44:11,0:44:12,Gdje ostaje?
0:44:13,0:44:16,"Ostaje, draga braćo i sestre, u svojoj riječi."
0:44:17,0:44:33,"E sad, volio bi da kada se budemo molili večeras, da se molimo za jednu, ne znam, možemo to nazvati milost i raditi, sve je milost, da budemo slični, ovo je moje osobno mišljenje, najdražem liku Luki u Lukirovom Evanđelju."
0:44:33,0:44:45,"Znači Luka je onaj evanđelist, malo smo sad čitali, čitali smo ga i prošle godine nedjeljama, govorio je o rođenju Isusa, govorio je o pristodovama, o dobrom razbojniku, o Uskrsu, o putu Emaus."
0:44:45,0:45:12,"Međutim, ja imam neke, svoj neki onako stav, vjerujem nadahnut, da ima jedan lik koji je on najviše volio, kojem se najviše divi od svih likova, to je, nije, nije Isus, nije ni nije pao iako je o njemu pisalo djela apostolska, dobro, hajde dobar pokušaj, hajde nije, hajde dalje, nije blizu, ali nije Marija, nije ni Marta iako i to nije loša odabir, ha?"
0:45:16,0:45:28,"On je još pa jedva spomenuo, Abrahama isto nešto kratko, nije moj si, nije moj si, nije ni Ivan, ali blizu, evo pa toplo, toplo, toplo, toplo."
0:45:30,0:45:35,"Elizabeta, Elizabeta, zašto?"
0:45:36,0:45:52,"Vrlo jednostavno, znači Elizabeta je jedna stara žena neplodna koja nekad vidi Isusa, nego vidi Isusa upakiranog u nekog drugog, ona već tada puca od radosti."
0:45:54,0:46:02,"Ona već tada puca, ne ono je li to meni Isus došao, ne, nego vidim brata za kojeg znam, vjerujem da je u njemu Isus, ja sam već pucao od sreće."
0:46:04,0:46:05,Ja sam već pucao od sreće.
0:46:06,0:46:11,"Marija je simbol Biblije, Božje riječi u kojoj je Isus upakiran, ajmo to tako reći."
0:46:11,0:46:20,"A Elizabeta je ona koja ne sad, aha, kad ona meni kaže, aha, nije ona puca od sreće, aha, kad ona rodi tog Isusa, pa kad taj Isus sad učini čudo, pa ću ja biti vesel."
0:46:21,0:46:21,Ne.
0:46:22,0:46:37,"Pazi, ni Marija još vjerojatno nije znala, barem kako izgleda scena, jel'ko što je znala u sebi to zna Duh Sveti, ali po sceni izgleda, Marija još nije znala da je trudna, Elizabeta je već radosna, radosna."
0:46:38,0:47:00,"Statistički gledano, onako narativno, prvi koji je prepoznao Isusa je nerođeno dijete Ivan Krstitelj, utrobi Svete Elizabete.eta je zapravo totalno nepotreban lik, o njoj, evo što je bila ženski lik, evo što je bila starija, znači o njoj je nepotrebno pisati, nepotrebno, sve je mogu napisati da ju nije ni spomenuo."
0:47:01,0:47:21,"Međutim, ako me pamćenje dobro služi, slobodno me ispravite, možete provjeriti u Bibliji, kad je Andrzej Gabriel došao našoj blažnoj djeci Mariji i pokušao je malo nagovoriti, privoliti da kaže onaj, jel Fiat neka mi bude ili kamo sreće da mi bude, on je davao neke argumente, ali Marija nije baš odmah rekla može."
0:47:22,0:47:33,"Ma bit će velik, znači se sin svevišnjega, dug sveti će to odsjetiti, pa kako ću ja, ja muža ne umoriti."
0:47:35,0:47:39,"I onda vidiš, Angelo govori, govori neka proroštva, ovo, ono, ništa."
0:47:39,0:47:51,"I onda ima jedna pauza koju mi naravno prebrzo pročitamo, Mandželi je pa ne doživiš da je tamo jedna lijepa pauza, ono naš kad je Angelo bilo, kad je Gabrielu bilo vruće, pa steglo mu se ono, jel."
0:47:51,0:48:01,"I onda kaže, a tvoja rodica Elizabeta, njoj je ovo šesti mjesec, a mar je, onda može."
0:48:01,0:48:04,"Onda može, onda može, onda."
0:48:05,0:48:10,"A ti govoriš o Elizabeti, a to je nešto drugo."
0:48:10,0:48:16,Na Elizabetin znak Marija je reagirala i pokazuje nam koji treba biti znak meni i tebi.
0:48:17,0:48:22,"Elizabetin, to je onaj stav kakav trebamo imati, to je onaj zdravi stav."
0:48:24,0:48:29,Mi se ponašamo nekad kad igraš nogomet i sad dođe suparnik i on te predriblja.
0:48:29,0:48:32,"I umjesto da trčiš za njim ti, ojoj kako je on mene predribljao."
0:48:33,0:48:37,"I ostaneš tamo ono, ideš trener, on je mene predribljao, kako ću ja sad."
0:48:37,0:48:39,"dalje, šta da ja sad radim?"
0:48:39,0:49:06,"Pa trči za njim, pa čovjek će, pa šta čekaš ono, znači, da, pa dobro, nije dobro da te predrivi ovo, pa daj, pokreni se, znaš ono došlo predrivi i kako mi šokirani, ajmo, kako se dogodilo ono, njoj evo muž ostao njem, em što je neplodan, em što je star, em što ne bi još i on zanjemio, slav Bogu, ajmo, kako dobro, kako dobro, fenomenalno i zna sve, nitko ne zna kako ona sve te stvari zna."
0:49:07,0:49:19,"Puna Duha Svetoga još kaže, odakle meni da mi dolazi majka, gospodin mi je rekla, Gospodin vam nije rekao što je meni, eh hvala ti što je Marija zbog tebe, Isus je došao meni, pa evo, ne, ne, hvala ti što mi majka dolazi."
0:49:21,0:49:24,"I Marija je tu slika, rekli smo Božje riječi i Crkve."
0:49:25,0:49:32,"Hvala ti što zbog tebe je meni bliska ne samo, ne samo Isus nego je Isusova Crkva."
0:49:33,0:49:48,"Još jedna zanimljiva stvar koju govori riječ Božja, ako ste ikad čitali, a to isto možete vidjeti, obično to na mjenčanjima se značitati, ali nije baš da mi to doslovno shvaćamo pa onda nam to bude malo problem, a to je, znate vi da Isus nije umro za mene i za tebe."
0:49:50,0:49:55,"Nije Isus umro za patra Matu, ni za Kristinu, ni za Stjepana, ni za ovo, ni za ono, ni za sv."
0:49:55,0:49:58,"Pavla nije umro, nije, nigdje to ne piše u Bibliji."
0:49:59,0:50:22,"Umro je za svoju crkvu koja je ok, možda grozna, možda aljkava, možda grešna, crkveni oci su crkvu zvali sveta prostitutka, nije baš pobožan neki naziv, znamo kakva je, znamo šta je, znamo od čega je, ali Isus nije dao život na križu, krv do zadnje kapi za patra Matu, nego za svoju zaručnicu koja je crkva."
0:50:24,0:50:29,"E sad ti ajmo imati priliku biti dio te crkve, e to je naša stvar."
0:50:29,0:50:32,"Ali to ne mogu ja biti sam, e sad ću ja biti dio crkve, sad ću ja biti crkva."
0:50:33,0:50:37,"Nego da bi ja bio dio crkve moram imati brata, sestru kojeg možda ne volim."
0:50:38,0:50:47,"Ali zahvaljujući njemu, njoj mogu biti crkva, mogu biti dio tijela crkve, zahvaljujući Božjoj riječi."
0:50:48,0:50:51,"Sve stvari koje on govori, koje čini, čini za koga?"
0:50:51,0:50:52,Za svoju crkvu.
0:50:53,0:50:56,"Čini za svoju crkvu, za ljubav svoga života."
0:50:57,0:51:05,"Kako je nevjerojatno kad dođu ljudi i kažu, ma date patriot, da, meni se isto sviđa,, ali ta crkva nikako, što o čemu pričaš?"
0:51:06,0:51:08,"Jeste li ikad čuo tu riječ Božja, jeste li ikad čito?"
0:51:09,0:51:24,"I onda vidite braćo i sestre koliko često i u malim i velikim stvarima se dogodi da mi onako imamo neko iskustvo rekla, kazala, onako otprilike općenito, ali problem je nas što u odnosu s Bogom on mi je uvijek lošeg, iskrivljamo, vidimo."
0:51:24,0:51:32,I baš zato nam je potrebna i ova fizička riječ Božja da neprestano produbljujemo i pročišćavamo vlastitu sliku o Bogu.
0:51:32,0:51:41,"Jer kad bi bili svjesni, svjesni koliko je velik, koliko je snažan, koliko radikalno te ljubi, pa ne bi čekao."
0:51:42,0:51:58,"Kao onaj primjer s početka, kad ona im ova skuži da njegova Katarina je slobodna, zainteresirana, jedva čeka da ga vide, neću on čekat kod kuće, a da, možda još par godina pričekam, pa onda ću ja se javit, pitat ću je za kavu ono."
0:51:58,0:52:01,Ideš odmah jer ti je došla riječ.
0:52:03,0:52:04,Jer ti je došla riječ.
0:52:05,0:52:33,"I ponavljam, evo nije ovo, ova prispodova, Isus je govori, prispodova Bogatašu i Lazaru i Isus govori na usta Abrahamova o prispodrovi, ako ne prime Mojsijev prorok ili ti u tom vrijeme stari zavjet, a imamo danas i novi, ništa, ni Uskrs, pazi, Uskrs ti ništa ne znači, ni Duh Sveti ništa, ni sa kramena braka, ni sa kramena svećenika ništa, ni sveta ispuniti, ništa."
0:52:34,0:52:39,"Sve to pismo je duša duhovnosti, duša teologije."
0:52:39,0:52:46,"Teologija to je sve i ono znanje i razmatranje i razmišljanje i slavljenje, sve to ništa, nula bodova."
0:52:47,0:52:52,"I ponavljam, tako često pokušavamo evangelizirati bez Evanđelja."
0:52:53,0:53:01,"A Evanđelje, ma samo ga ostavi, samo će skoro, eto, eto, skoro pa samo, naravno ne želi samo jer želi tebe, ali gotovo, koda će samo ići."
0:53:02,0:53:16,"Znaš, kad kaže imam jednu prijateljicu, ne može nikako začeti, onda kaže, kad vidi sestru, kaže, ma nju mu samo pogledaj, ona začne, znaš, ono, ono, tako ti riječ Božja, ono, tako djeluje, znaš, samo joj pogledaš, već ti da neku inspiraciju, već nešto."
0:53:17,0:53:28,"Iako, oprez, to što ti kaže Božja riječ, pazi sad dobro, može biti da te pomazi, a možda ti zvehne šamarčinu, a može i to."
0:53:29,0:53:38,"Ali kao pravi vjernik, kao onaj Elizabetin brat, onda bilo da si dobio šamarčinu, bilo da ti je pomazilo, hvala ti Bože."
0:53:39,0:53:40,Hvala ti Bože.
0:53:41,0:53:42,To je Božja riječ.
0:53:43,0:53:44,Šta Božja riječ kaže?
0:53:44,0:53:52,"Di sam, ja jesam tamo sam, tamo sam, tamo u Hercegovini, gladan si jesam, gladan sam, kad baba kaže da si gladan, gladan si."
0:53:53,0:53:56,"Kad kaže riječ, to je to."
0:53:58,0:54:06,"I da li mi dopuštamo Božjoj riječi da ona bude naša logika, da ona bude naš logos."
0:54:08,0:54:14,"I apostoli su znali da bi to napravili, moraju reći Isus se, ok, to je nešto predivno, predobro, ali to i traje."
0:54:15,0:54:23,"I zato pitam Isusa, meni nije dovoljno jedno veće, meni nije dovoljno tri minute, nije mi dovoljna jedna molitvena zajednica, gdje ti ostaješ?"
0:54:25,0:54:26,Gdje ostaješ?
0:54:27,0:54:32,"Prvo pitanje u Bibliji, u Evanđelju Ivanovom, gdje ostaješ?"
0:54:32,0:54:33,Traži se mjesto.
0:54:34,0:54:35,Dođite i vidjet ćete.
0:54:37,0:54:40,I to je onaj poziv koji tebi i meni poziva nas.
0:54:41,0:54:56,"Božja riječ nije samo tih par informacija, evo da znamo da je to Isus umro, da je uskrsnuo, da je negdje nešto, po toj riječi ti i ja smo prisutni u onim događajima i oni događaju nama."
0:54:57,0:55:17,"Ono što je fascinantno, bilo smo to malo razmatrali za vrijeme mise, mi stvarno vjerujemo da kada se Evangelij naviješta za vrijeme mise ili u sklopu neke liturgijske molitve kao što je liturgija riječi ili sprovod ili neki sakramenat, mi vjerujemo da je taj dio Evanđelja koji se čitao se u tom trenutku ostvaruje."
0:55:18,0:55:21,"Znači ako danas slušamo o apostolima, negdje je Isus nekog pozvao."
0:55:22,0:55:24,"Nije to jedino, može ih on pozvati i po nekoj drugoj riječi."
0:55:24,0:55:29,"Naravno da je Božje milost, srđe i snaga, kreativnost neograničena."
0:55:29,0:55:31,Ali mi vjerujemo da se to ostvaruje.
0:55:32,0:55:38,"Ako čitamo i razmatramo o ne znam o istrivanju zloduha, znači pobjeđuje zloduha, ozdravlja."
