Start (HH:MM:SS),End (HH:MM:SS),Segment
0:55:39,0:55:48,"A mi onda, pa danas sam slušao Evanđelje o egzorcizmu, pa danas sam slušao Evanđelje da je Isus blagoslovio nekog zaručnika, pa je li ti to treba?"
0:55:49,0:55:51,Jel znaš nekoga kome će to trebati?
0:55:51,0:55:54,Jel to doživljavaš da si ti svjedok toga?
0:55:55,0:55:59,"Biti kršćanin znači biti svjedok, znači onaj tko je to doživio."
0:55:59,0:56:03,Ne moraš završiti školu da bi bio svjedok ali biti tamo i doživjeti.
0:56:04,0:56:11,"Mi nismo svjedoci jer je to netko nama nešto ispričao, onda si svjedok toga da sam ja pričao, ali nisi svjedok toga da si to doživio."
0:56:12,0:56:18,"A po Božjoj riječi se sve te stvari ostvaruju, ostvaruju."
0:56:19,0:56:21,"Postaješ mu žena, rekli smo po toj riječi."
0:56:22,0:56:32,"Po toj riječi ovaj hostija postaje tijelo Kristoistovo, po tom imenu Kristo, mi izazivamo to ime, po riječi si postao kršten."
0:56:33,0:56:38,"Znači, tebi je Duh Sveti istetovirao, ajmo reći, utetovirao u tvoje srce ime Isus."
0:56:38,0:56:51,"Kad jednog dana budeš stajao možda u čekalnici tamo čistilišta i sad čuješ da ono naše koje u onim starim domovima zdravlja ono naše govore ti ono prezime, kolak, a idiš tamo, ulaziš tamo, guraš se."
0:56:51,0:56:54,Ljudi svi gledaju kad ideš preko reda dok uđeš tamo na kontrolu.
0:56:55,0:57:02,"I sad ja tako zamišljam čistilište na čemu stojiš, ne smiješ sjesti, ne znaš tko je na redu, a oni prozivaju jednog na deset godina, to je čistilište."
0:57:04,0:57:37,"I kad budeš u tom čistilištu ili možda će drugačije izgledati i čuješ da netko viče, ljubljeni, omiljeni, najdraži, ne gledaj tko je, ti si, ti si, idite tamo, zove tebe i onda, poglavito je isto to uravno, ono, ljubljeni onako piše i to uravno u Isusovom krvlju, onako, ljubljen, pa nisam znao, pa nisam primijetio, pa nisam, eto, da, pa mogu se i privući, pa mogu se, onda mogu se, mogu se, Mogu si."
0:57:38,0:57:50,"Ja se obraćam i sestre, riječ je neopisivo snažna, duboka, ona je ogledalo, ona je ogledalo tvoje moje duše, ona daje to svjetlost, ona ti daje snagu."
0:57:51,0:58:09,"Igle, neke stvari su možda jednostavnije pa je dovoljno malo riječi, a neke treba malo više, negdje treba malo više dublje zakopati, malo više razmatrati, malo više to prolazit, malo više se tome prepustiti jer gospodin želi ozbiljnost, ozbiljnost."
0:58:10,0:58:23,"Njega ne možeš prevariti s time, nije da mi sad želimo pre prevariti, ali nije onda zad, a da dobro, eto malo ću kruniti iz mog, pa idem neku devetnicu, super, budi vjeran toj devetnici, ali prvo razlučiš šta gospodin želi."
0:58:24,0:58:25,To je vrlo praktično i super je zašto.
0:58:26,0:58:28,"Ti možeš doći i sad tražiti, ja dolazim iz Župe sv."
0:58:28,0:58:38,"Grantuna, Padovanskog, u selima, sesijskim i onda tamo ljudi dolaze, pante, testovi, pante, muž, pante, žena, pa, pa onda devetnica, trinaest utoraka sv."
0:58:38,0:58:41,"Manti, pa ljudi moji, na šta, treba to izdržati."
0:58:41,0:58:51,"I onda još ne dođe, pa dođe, pa ovako, pa onako, Bogu hvala, hajde ima pomaka, ali ono to je trud, to je teret jer ono pokušavaš nagovoriti Duha svetoga da ti nešto napravi."
0:58:51,0:58:53,"Ovaj neće, kuš ima neke svoje pa ajde."
0:58:54,0:58:56,"A kažete Isus, ma ostavi to."
0:58:58,0:59:00,"Nego kažem, ajde, napravi meni jednu uslugu."
0:59:01,0:59:06,"Sad meni se ta usluga Isusu ne sviđa, ali ajde, Isuse, kad je tebi usluga, ajde."
0:59:06,0:59:10,"I sad Isus ti kaže, gledaj, usluga ti je, daj ovom siromahu, daj nešto pojesti, ajde."
0:59:11,0:59:16,"I ti to njemu daš, pojesti, a Isus ti gleda, ma sine, hvala ti, jel mu ga za tebe jednu uslugu učinite?"
0:59:17,0:59:22,"Pa kad si već pitao, učini uslugu Isusu."
0:59:22,0:59:40,"Znači uopće nemoj ići radit ono šta bi ti htio, ne kažem da je to loše, ne, ali to ti gubljenje vremena, nego stani, ide na Joker, ide na ono, ide na sigurno, ide na ono, ide na milijun, ide i traži čekaj, gospodine, daj, evo ima li neka usluga koju ja za tebe danas mogu učiniti?"
0:59:40,0:59:44,"Mogu li ja nešto, evo da se tebi sviđa nešto što tebi treba, Isuse?"
0:59:44,0:59:57,"Je li treba nekog potapšati, ošamariti, nahraniti, povući, prevesti, ne znam, viknuti, šta god, evo, nekad je malo više, nekad je malo manje, napravi to i onda on tebi kaže masine, kako je da ti se odužim?"
0:59:58,0:59:59,"Ne znam, Isuse, ne."
1:00:01,1:00:10,"Ma niste danas, niste drugi put ćemo to ista, ne kažem, ne reci to sad, ne kažem, ne kažem, sine ti si mi učinio uslugu, ali tebi treba nešto."
1:00:12,1:00:37,"Bio sam jednom na Krapnju i sad, inače odem i ovako budem tjedan dana, ali jednom me je zvao velečasnik Andrija da uskokujem, neki svećenik nije mogao doći, ovo je ostalo sam i sad je trebalo onako iznenadno doći, pa ispovijedati, bježati i sad sam uspio naći neko vrijeme i došao, znači onako vanredno, ono, uletio, doletio, išao tamo iz Istre i sad dolazi on meni na kraju i kaže evo, pa evo da ti bar platim za taj put kad si ono došao tamo, amo, ovo, ono."
1:00:37,1:00:40,"Ja sam rekao velečasnik, znate šta nemojte me krivo shvatiti, ali malo ćete mi dati."
1:00:41,1:00:49,"Pa malo, malo za put koliko, pa ne, ne mislim ja da mi ne bi dali za gorivo i to da ćete vi oni više nego šta meni je za gorivo potrebno nego meni zapravo treba puno više para."
1:00:50,1:01:07,"A ako mi vi ništa ne date gospodin će mi platiti, tako da lijepo vi to nemojte samo krivo shvatiti ali ako može nema problema i stvarno, stvarno da bi riječ rekao, da bi riječ rekao, dobro velečasno Mandri, meni još bolje."
1:01:08,1:01:14,"Rek, samo mi ti nemoj davati, samo mi ti nemoj davati jer gospodin meni puno, puno bolju tarifu ima znaš konverzije."
1:01:14,1:01:21,"Tako da ovo ti dobro daš, kao dobro, ali gospodin mi tako, samo mi nemojte ti upropasti dar da mi još ti nešto daš."
1:01:21,1:01:27,"Meni će gospodin dati vjera, vjera u šta, u Božju riječ, da ti kaže."
1:01:28,1:01:55,"Evo samo za kraj, onda bih htio ostaviti priliku evo za vaša pitanja, ako imate bilo kakvih vezanih za Sveto pismo, evo, jedan momak iz Rima, imao je četrnaest godina, Federico se zvao, iz neke, pa dobro, polupobožne profane obitelji, onako dolaze na misu, ali jednomjesečno, sad je on uključio se u Župu, bio animator, igrao je nogomet i onako, potiho onako, nekako skromno, evo, skroman je onako bio,."
1:01:55,1:02:06,"Momaki se je on to odmah malo sve te neko promatrao i kaže on meni, on bi htio razmatrati Sveto pismo, kao šta da radi, kako da ovo, kako da ono, pa jesi ikad išta čitao, nisam nikad ništa."
1:02:06,1:02:13,"Pa dobro šta sad, ajde, pomolim se, ja sam rekao, ajde uzmi ovo, molim te Evanđelje, kad i su shoda po vodi."
1:02:14,1:02:15,"Dobro, šta moram napraviti?"
1:02:15,1:02:49,"Pa uzmeš Evanđelje, pa pomoli se Duhu Svetom, pročita, jednom, dva, tri, pedeset put i onda malo razmisli, probaj se zamisli da si ti dio tog teksta, probaj, ne znam, probaj zamisli da to govori tebi, onako neka malo maštovitost, pa lako, ono, probaj šta možeš, aj dobro, uzeo je on to, isto tako, potrudio se, znači, uzeo je on to, ali otišao je u neki parkit gdje je bio neki kružni tok, pa je bilo vruće, pa ovo, pono, pa ga je neki prijatelj došao, pa ga je nešto zvao, pa ga je smetalo i stalno je, trudio se četrdeset minuta, ali ništa."
1:02:50,1:02:56,"I nakon pet dana, kako introvertirani, ti, nek tek nakon pet dana dođe meni, e, pater, ja sam probio, ali nije bilo ništa."
1:02:56,1:03:06,"Kad to u ponedjeljak, ljudi moji, ponedjeljka već, mogao si, šta da sada, ništa ponovi, ništa nađe tiho mjesto, a gledaj, neka treba malo više za zapetljalo."
1:03:06,1:03:12,"A on nije mu se to svidjelo, znaš, opet isti tekst, opet isti sve, ovako već nije funkcioniralo,, al ajde."
1:03:13,1:03:20,"I za tjedan dana zoveo me, ej, Pater, evo bi mi mogli prokomentirati, ja sam nešto to ko probam, meni se čini da nešto bilo, nešto, ajde."
1:03:21,1:03:23,"Evo je rekao, ajde Federico Sine, ajde, reci, dođi."
1:03:23,1:03:30,"I dođe on i pazite, čovjek prvi put u životu razmatra i stvarno kaže, ništa posebno, mislim, ništa posebno."
1:03:31,1:03:59,"Ja sam pročitao taj tekst i gledam ono, sad čitam kako Isus hoda po vodi, pa ovi ne znaju, oni se boje jel to Isus nije i je i čujem riječ dođi., naći ćeš put, tu sam, čekam te, sve je to u tom dođi, ja sam tu, imaš kome doći."
1:04:00,1:04:15,"Nije bitno gdje si, nije bitno koliki teret imaš, nije bitno koliko si prljav čist, nije bitno s kim si u društvu, kakav si, šta su ti bili planovi, iz čije si kuća, šta si po zanimanju, šta si po rodu, šta si po vjeri ispitu, ne, dođi."
1:04:16,1:04:25,"Pazi, gospodin kaže dođi, ja se sjećam kad je on meni to priča, mene su trenuci prošli kad sam čuo kako je on to proživio tu riječ dođi, a ništa nije razumio ono."
1:04:25,1:04:31,"Ja pogledam šta je on još nekakav pandil, on me je zvao, kao da je meni to nešto rekao, kao pogled."
1:04:33,1:04:40,"Ali vidiš, riječ je zazvučala, riječ je nešto je zaigralo na strunama njegovog srca."
1:04:42,1:04:48,"I daj Bože, evo dragi brate, draga sestra, ti a budemo ti dobri svirači te Božje riječi."
1:04:49,1:04:55,"Jedan profesor je učio nas i rekao je ova knjiga, što mi zovemo kao knjiga Biblija, to su zapravo samo note."
1:04:56,1:05:08,"Ali evo sad ovi naši tu svirači, sad on meni dođe i umjesto da mi zapjeva da mi kaže evo ga, idemo sad večer slavljenja ije jer meni netko note pokazuje, znaš, onako i dobro."
1:05:09,1:05:40,"Sad ja si zamišljam, a ovo je ono, a ovo je, znači ja vjerujem da ovi svi skladatelji, ovi svi što su završili muzičke škole i tako, njima samo da pogledaš, njima daj, daj, daj, smanji, smanji, smanji, znaš ono, previsoki su mi toni, znači čim vidi to mi žviždi u glavi, ja nemam, evo ne čitam tako te note, ne ide mi to, ali kad mi malo to netko zasvira, a dobro, ne znam sad baš ja to svirati, ali melodija mi uđe, melodija mi uđe."
1:05:41,1:06:10,"Tako da i ovo su note, ali ako netko, a daj Bože ti ili ja, malo životom zasviramo po tim notama, pa dobro, možda ćeš i pogriješiti neku notu, možda ne sad iz prve, jel koliko puta bilo tko treba vježbati, sto puta, da bi se došlo do nekog savršenstva, ali kad to zasviraš, e to je Božja riječ, ovo su samo note, ovo su samo note, zasviraj tu Božju riječ svojim životom."
1:06:11,1:06:13,"Dobro, ima li kakvih pitanja?"
