Start (HH:MM:SS),End (HH:MM:SS),Segment
0:00:01,0:00:40,"Dobro drage braćo i sestre, evo nadam se da smo i molitvom uspjeli ohrabriti Duha Svetoga da može doći večeras u onoj svojoj širini itede Evo za početak jedna ovako zanimljiva misao, sad smo imali novu godinu i došle su nam u samostane neke obitelji da to bude kao nekakav duhovni doček nove godine, njih šest sedam tako parova s djecom i naravno šta se radi za novu godinu imali smo jednog finog odojka, vrti se odojak, vrti se janjetina i dolazi meni jedan od tih ljudi kaže pater ovo vam je jedino jelo koje kad ga posliješ bude još slađe, bude još slađe, još finije."
0:00:40,0:00:41,A zašto to govorim?
0:00:41,0:00:48,"Zato što je naš profesor svetog pisma u Rimu govorio da je Biblija ko svinjetina, sve valja."
0:00:50,0:00:53,"Sve valja, samo ne znaju svi sve iskoristiti jel tako?"
0:00:54,0:01:02,"Sve, kažem kod svinje se ništa ne baca, ništa se od svinje neće, sve se da, sve se probavi, ali ne sve na jednak način, nije sve isto."
0:01:03,0:01:04,Nije sve isto.
0:01:04,0:01:18,"E sad, ja imam jedan zadatak, barem ja osjećam da imam takav zadatak od Duha Svetoga za večeras, a to je da vam govorim o nečem dosadnom, da vam pokažem kakvi ima lijepih dosadnih stvari u životu."
0:01:19,0:01:21,Pa evo krenimo s tim.
0:01:21,0:01:40,"Prije svega ne želim govoriti večeras kao fratar, niko pobožan svećenik nego kao znanstvenik, jedna češka, svi obožavamo znanost jel tako, dođu ti rječnici, dođu ti knjige, ispiti, rokovi, sad će uskoro jel tako sve to vrijeme rokova, tako je."
0:01:41,0:01:42,Zašto?
0:01:42,0:01:54,"Pa prije svega zato što mi dosta tog znanja imamo, ali ga na duhovan način ne iskorištavamo, nego čak pun ponekad i preziramo što je suludo, a znanje je čak jedan od darova Duha svetoga."
0:01:54,0:01:59,"Ali ne, mi brojimo samo ono, jel proroštvo i to je to, ne znam, bez znanja šta ti je proroštvo."
0:02:01,0:02:26,"Kada govorimo o znanju, evo kada kažem da govorim, želim govoriti kao znanstvenik, meni nam, ne znam što tebi pada na pamet, možda neki Einstein, meni na pamet pada mala Terezija od djeteta Isusa, ona je znanstvenica, ona je učiteljica crkve, to je možda i sveti Augustin, to je sveti Tom Akvinski itede Znači znanje koje stječemo, koje učimo je nešto vrlo bitno."
0:02:26,0:02:42,"Istina s jedne strane vam djeluje pa dobro, ok, ja to znam, dva plus dva je četiri, idemo dalje, ali što će mi to sada doživjeti, ja želim neku snagu, ja sada želim neko nadahnuće, a sveti Pavao će reći da milost predpostavlja prirodu."
0:02:42,0:02:45,Ne možeš u glavu koja je glupa uvući veću milost.
0:02:46,0:02:53,"Moraš imati pametnu glavu, pametnu glavu da bi mogao tu milost još više primit, još više primit."
0:02:54,0:03:00,Prve riječi Ivanovog Evanđelja na grčkom glase enarhe enchologos.
0:03:00,0:03:05,"Logos, na početku bijaše logos, namjerno kažem na grčkom, zašto?"
0:03:05,0:03:08,Zato što riječ logos može prevesti sa trideset legitimnih prijevoda.
0:03:09,0:03:16,"Znanost, nauk, logika, riječ, misao, pretpostavka, pitanje, ne znam sve to nešto."
0:03:17,0:03:26,"Znači na početku je logika, nije odmah krenuo umro je na križu za nas nego na početku je logika, alo, e, daj glavu, otvori, daj, daj, taj razum otvori."
0:03:26,0:03:28,Nije rekao to je sad jedina stvar.
0:03:28,0:03:35,"Ali pazite za crkvene oce, jedan od najčešćih naziva za Isusa je logos, logika, znanje, misao."
0:03:36,0:03:42,"Nije to jedini, nije sad ah samo knjiga, samo logika, samo znanje nego ono uči."
0:03:43,0:03:46,Ali i ono što si naučio iskoristi.
0:03:47,0:04:05,"Evo meni osobno u mom duhovnom rastu jedna od najvažnijih stvari koje sam naučio i stekao ajmo tako reći kroz školovanje osnovne škole, srednje koje mi je najviše koristilo za duhovni rast jest gradivo hrvatskog jezika, čitanje lektira jer učiniš čitati knjige."
0:04:05,0:04:18,"A vidite čudo je Biblija jedna knjiga, pa ako si naučio ono našo, evo mjesto radnje, šta me briga, evo gdje?"
0:04:18,0:04:23,"Evo, on je ono, prepiso lektiru i tako, on, tko će to koga brigati, šta će mi to u životu?"
0:04:23,0:04:38,"Pa evo, sad ćemo vidjeti koje lektire radio kod kuće, tko je išao na lektire haer a tko je lijepo lektire radio, paš vidi koliko milosti dobiješ, paš vidi koliko milosti dobiješ, učio engleski, super, još bolje, zašto?"
0:04:39,0:04:47,"Zato što onda možeš, imaš pristup besplatnim engleskim rječnicima grčkog i hebrejskog, na hrvatskom ne postoje, barem ne online i nisu besplatni."
0:04:47,0:04:57,"I možeš naučiti još i drugi jezik, čak jezik koji je Isus govorio, mislio, osjećao, apostoli, a šta će meni, engleski, znam ja igrice, gameri i takve stvari, one druge stvari."
0:04:58,0:05:13,"Međutim, to znanje otvara jednu veliku, veliku, veliku stvarnost, ali ponavljam, toga znanja imamo mnogo i onog koje ne iskorištavamo i kojeg ne iskorištavamo jer nam djeluje preobično, pre bezveze, preglobo, pre."
0:05:14,0:05:17,"Dugo sveti je jednostavan čovjek, jednostavan čovjek."
0:05:18,0:05:21,"On može velike stvari, ali ide po jednostavnosti."
0:05:22,0:05:31,"I na kraju krajeva, mi svi volimo čudesa, ja prvi da ne bi netko rekao sad, evo ovaj fratar ne voli čudos, ne, obožavam, ja kamo sreće da vidim čudos u svojoj župi, bilo gdje."
0:05:32,0:05:34,"Ali znate, ima jedan koji ne voli čudesa previše."
0:05:35,0:05:36,Ne biste vjerovali to je Bog.
0:05:38,0:05:39,Ne voli toliko čudesa.
0:05:40,0:05:40,Zašto?
0:05:40,0:05:52,"Pa zato što nema ih baš toliko, mislim baš ono čudesa, čudesa, ono hodanje po vodi i tako, ne mislim sad ono čudosno što sam živ, e to je posebna kategorija, jel to je isto čudosno, ali ono baš ove neke nadnaravne neke."
0:05:53,0:05:53,Zašto?
0:05:54,0:06:02,"Zato što on smatra da je on pametan i smatra da je dobro napravio ovaj svijet, da je dobro tebe sagradio."
0:06:02,0:06:24,"Znači, Bog je jedan redatelj, tko je onda dogovorio sa glumcima, ti glumiš što, ti kažeš što, ovo je tvoj redak, ovo je taj, evo ti pališ svjetlo, ti muzika, ti tamo nemoj iza mene nešto talabročit, ovo, ono i sad Bog je sjedao u kazalište i gleda predstavu naše povijesti i u jednom trenutku spazi, evo je netko zaboravio redak ili ono svjetlo, tamo i ovaj nije upalio, a sad će trebati."
0:06:24,0:06:32,"I onda zove nekog anđela nešto, e daj tamo dok nitko nije vidio da uleti na pozornicu, da onaj mikrofon tamo radi, da upali YouTube, da ovo, ono."
0:06:33,0:06:43,"E to su čudesne, znači to su one nadnaravne stvari koje on mora sad, ali njemu je dobro to što si normalan, njemu je dobro to da imaš dvije ruke."
0:06:43,0:06:46,"Da ti je trebalo deset ruku stvorio bih ih, ali ne trebaju ti."
0:06:47,0:06:58,"Postoje, ponavljam, ti trenuci i dolaze i svima su nam dragi, ali nije sad stvar, aha, ja živim za onaj trenutak kad će ajde malo letiti, lebditi ili levitirati ili ne znam, imati dar bi lokacije."
0:06:58,0:07:37,"Super, kad ti dobiješ dar bi lokacije, reci hvala ti Bože, ali isto tako reci hvala što danas nemam ništa, što je tu zrak u kome, što su tu ljudi u kome, što sam u Hrvatskoj, što sam u Botincu, što sjedim na tvrdoj stolici, što mi je zima vani, što mi je auto proklizalo, autoproklizao ili nešto deset da iskoristimo sav taj potencijal koji Bog kaže pa dao sam ti ga, dobar ti je, veliki je, daj ga iskoristi, daj, daj uzmi to što imaš, daj tu svoju prirodu jer kad to iskoristiš to ti je posuda jer kaže sveti Pavao Apostol čije smo obraćenje jučer slavili, daj, to je posuda u kojoj možeš primiti onda i ove druge milosti."
0:07:37,0:07:43,"Nego mi ovo ne bi, a mi bi nešto drugo i onda nikako na zelenu granu, nikako na zelenu granu."
0:07:44,0:07:57,Tako da dragi moji nemojte se bojati otvoriti gospodinu riječi Božju jer drugi Vatikanski sabor kaže da je riječ Božja duša teologije.
0:07:58,0:08:01,"Sad malo treba samo pojasniti, mi znamo riječ duša, ali zapravo ne znamo šta je."
0:08:01,0:08:16,"Znači sad kaže Aristotel jedan tamo grčki mislioc, učitelj Aleksandra Velikog četiri stoljeća prije Krista i govorio je, kaže gledaš ruku, ona sama po sebi se ne miče, nego se miče zato što je spojena na tijelo koje ima dušu."
0:08:16,0:08:19,"Duša daje pokret, duša daje život, duša daje sve."
0:08:19,0:08:22,"Znači, tijelo bez duše kakvo je?"
0:08:23,0:08:35,"Ne možeš ga oponašati, mislim kad vidiš mrtvaca, točno vidiš da mu nešto fali, život, vidiš da mu nešto nedostaje, vidiš da mu nešto nedostaje, kad vidiš mrtvaca."
0:08:35,0:08:50,"I sad zamisli, zamisli naš Sveti Sabor, drugi Vatikanski, kaže da je tvoja moja teologija, razmišljanje o Bogu, molitva, evangelizacija bez Božje riječi mrtvo."
0:08:51,0:08:56,"Ne kaže da ga nema, mrtvac leži i popunjava prostor."
0:08:57,0:09:07,"Ali kad to usporediš s onim kako to izgleda s Božjom riječju, ovo, to je totalno druga kategorija, to je totalno druga kategorija."
0:09:08,0:09:20,"Sada naravno da postoje različiti načini i oblici i riječi i stilova i vremena i jezika i razumijevanja i percepcija i svega toga i ne moramo znati sve odjednom, ne."
0:09:21,0:09:29,"Ali zapamtite draga braćo i sestre, možda mi stvarno evo Božju riječ, ajde nešto malo znamo, nešto volimo, ali Bog ju voli."
0:09:31,0:09:34,"Bog više od mene i tebe voli svoju riječ, Isusa."
0:09:35,0:09:38,I mene i tebe voli ukoliko smo mu slični.
0:09:39,0:09:45,"Ako smo mi slični toj vječnoj riječi očevoj, tko bi rekao, zašto?"
0:09:46,0:09:54,Ili mogli bismo isto tako reći draga braćo i sestre da naša percepcija Božje riječi je često kada je to ne Božja riječ nego Božja informacija.
0:09:56,0:10:00,"A sada zamisli si sad evo nekog momka, ima li neki momak tko je slobodan?"
0:10:00,0:10:07,"Nek digne ruku, ajde, čisto, čisto onako, nemojte sad, ima, evo jedan je slobodan, samo jedan, dva, svi zauzeti."
0:10:08,0:10:12,"A evo sad, a ima, ima slobodan, dobro."
0:10:12,0:10:24,"dobro, pitanje broj dva za sve ove slobodne koji su tu i koji gledaju, od tih slobodnih koliko vas ima nekog na radaru ajmo tako reći, ono da onako već ciljaš negdje nešto."
0:10:27,0:10:28,To se ne smije dizati.
0:10:28,0:10:34,"Pa ne, ali ima li tko evo da ima neku, evo neku simpatiju ili tako, a rekao bi da ima, dobro."
0:10:34,0:10:39,"Ali evo sad zamislimo, ovi očito nemaju, svi su vjerojatno full slobodni, full slobodni, dobro."
0:10:39,0:10:46,"Ali evo sad zamislite evo momka koji je evo slobodan totalno, ali evo ima određena, ne znam, Katarina."
0:10:47,0:10:50,I sad ta određena Katarina ona tamo negdje je.
0:10:50,0:11:02,"I sad on čuje informaciju da je ta Katarina te večeri slobodna, da je pobožna, da se možda i o njoj sviđa i da bi joj bilo drago čut."
0:11:03,0:11:08,Da to je jednostavno jedna informacija koju će on negdje sebi zapisati i tako otići će spavati.
0:11:09,0:11:16,Ako je on čuo takvu jednu malu informaciju onda će ga upravo formirati i neće on čekat dugo.
0:11:16,0:11:20,"Znači ja imam zadaću, moram prvo suđe oprat pa ću onda ići van."
0:11:21,0:11:25,"Znate, moram prvo izribati podrum mami pomoć, onda ću."
0:11:25,0:11:29,"kao ići jer je Katarina slobodna, pa možda e tako bude još slobodna."
0:11:29,0:11:40,"Znači dobio si riječ, dobio si nešto što te se tiče i ti letiš, zaboravljaš sve, bolite briga jer to nije samo informacija, to je nešto što tebi život znači."
0:11:41,0:11:52,"A ponavljam, drugi Vatikanski, ako meni ne vjerujete, ponavljam samo riječi biskupa, svih onih pape, pape Ratzingera, pape, oni kažu da Franjo nije dobar, ali Ratzinger je bio, pa evo papa Ratzinger, evo ga, on je bio na II."
0:11:52,0:12:06,"Vatikanskom saboru, Ivan Pavao II je bio na Vatikanskom saboru, bilo je još drugih dobrih ljudi, pobožnih, znači bili su i kažu, gledaj, bez riječi Božje, tvoja molitva, tvoja žrtva, tvoj post, tvoj brak, je ništa, mrtav."
0:12:07,0:12:08,"U startu, mrtav."
0:12:09,0:12:12,"Nije da ga nema, nije da nije ništa, ali mrtav."
0:12:13,0:12:14,Nema života.
0:12:15,0:12:19,Pa evo jedan primjer kako to može funkcionirati.
0:12:20,0:12:23,"Evo, ne znam, vjerujem da je netko od vas ikad išao na ispovijed."
0:12:26,0:12:40,"Jeste li, evo, ima li netko da se nije ispovijedio deset godina ovdje, recimo, ne, nećemo, to su vam se preosobne pitanja, dobro, ispričavam se, ali evo, dobro, vjerujem da ste bili svi na ispovijedi, evo."
0:12:40,0:12:53,"I vjerujem da ima vas koji ste se ispovijedali i više puta i da nekad je potreba i više puta dnevno, ako je to bude, ja sam se na jednom tri puta dnevno ispovijedio, a trebalo je, a čovjek sagriješi i kad ne misli."
0:12:54,0:13:00,"I sad bih ja postavio jedno pitanje, koja je glavna točka ispovijedi, šta je najvažnija stvar u ispovijedi?"
0:13:01,0:13:19,"Ja ću vam reći, ja sam otkrio to kad sam bio četiri, pet godina bogoslovljen, već sam bio redovnik, znači već imam sam zavjete, privremene doduše, molio se, razmatrao, ne znam bio u karizmanskom pokretu već deset petnaest godina išao na molitve, molim u jezicima itede gledajući čudesa i sve."
0:13:19,0:13:33,"Vi ono na četiri godine bogatstvo i kaže profesor znate koja je glavna stvar u ispovijedi moj grijeh i božji milosrđe ne, šta drugo radiš na ispovijedi ono kaže na meni božja riječ."
0:13:34,0:13:38,"Pa ja rekao ispovijedan sam se svaki tjedan dana božju riječ na ispovijedi, a ako ništa na ispovijedi nikad čuo nisam."
0:13:40,0:13:42,"E, to mi je stvar kaže."
0:13:43,0:13:43,Zašto?
0:13:44,0:14:15,"Zato što kad čuješ božju riječ što ti ona govori, što ti ona dira u tebi onda dolazi da tvoja želja da ispovjediš, da kažeš Bože e da, ja tu riječ želim, ja tu ljubav, to milosrđe želim, ali ne mogu se ugurat tamo, premalim je broj, rukavica sam, predebeo sam, premršav sam, pre ne znam nešto, ne pašem, ne mogu, e onda kažeš e dobro, aj sad mi reci, kaže da usvijeti te stvari šta ne možeš, da te od toga oslobodim, da onda tu moju riječ možeš primiti."
0:14:16,0:14:26,"A ne, došao sam pa ja, jednom sam slušao ispovjed, starija osoba u ispovedonici dolazi i govori, skrušeno ispovijeda svojeedam sve grijehe, sve su oni čine od sv."
0:14:26,0:14:40,"Ante, pa ništa posebno, malo krv, malo vodu, malo zrak, malo, malo kruh, malo nebo, malo cestu, malo zrak, malo cestu, malo su, psovala, a psovala, dobro."
0:14:41,0:15:03,"Znači, dobro, rješenje, dobro, ok, u redu, čekaj, ali gdje tebi tu odnos, došao si šta, odradio si šta, koga si sreo, zašto si se ispovijedio, zbog čega, zbog čega, na koji način si pristupio ispitu savjesti, jer čisto kažem, uvijek isti i grijeh, ono, da, da, da, nisu isti, nego nego isti oblik grijeha ali to ćemo zanemariti."
0:15:03,0:15:25,"Ali ako ti uzmeš za ispit savjesti ne znam, evo jedan dio Biblije i gledaš evo šta ti ta riječ govori, gdje se vidiš da ne ličiš na tog milosrdnog Oca, gdje ne ličiš na tog Isusa, na tog svetog Ivana, na blažnu Djevicu Mariju itede gdje ti fali, gdje, onda vidiš da nikad se ne ponavljaju, uvijek su novi, uvijek su drugačiji."
0:15:26,0:15:34,"A riječ naravno s jedne strane zvuči bezveza, a ne šti, samo riječi, nemojte riječi, dajte djela kao djela, djela, djela."
0:15:35,0:15:47,"Da, super, treba doći do djela, ali kako ćeš doći do djela ako nema riječi, pravih riječi, kako su to djela bez riječi, to je onda luđak koji bez razmišljanja, bez logike, bez logosa ide dalje."
0:15:48,0:15:57,"Onda srljaš, bauljaš i ne znaš, kako je rekao onaj tamo na jednom videu i kaže, tko čoravo pašće, ne znaš koga će ubiti, onako samo ide."
0:15:58,0:16:08,"Međutim, riječ ti pokaže put, pokaže ti smisao, pokaže ti smjer i automatski daje i snagu i prisutnost, daje ti sve."
0:16:10,0:16:19,"Još jedan evo primjer, ima li ovdje, sad pitali smo je li imali slobodnih, ima li ovih zauzetih s prstenima možda, ima li koji da ima, digni, digni te ruke da vidimo da."
0:16:20,0:16:21,"Aha, dobro, dobro, dobro."
0:16:21,0:16:27,"To su ovi s prstenima, dobro, evo, iskoristit ćemo ovu braću i sestre s prstenima koji ih imaju."
0:16:28,0:16:35,"Ja suosjećam s onima koji nemaju, ja isto nemam prstenja, evo tako da ne bi rekli da samo govorim o ovim prstenonoscima, prstenonoscima."
0:16:36,0:16:41,"Evo, ja vjerujem da taj prsten koji nosiš na ruci ima neku vrijednost."
0:16:42,0:16:52,"Ne znam, možda nisam dobro informirana koliko danas vrijedi jedan zaručnički prsten, to deset tisuća eura petnaest koliko se to daje, koliko se Pa mislim da je bar deset koliko se štedi za njih."
0:16:53,0:17:01,"Kaže kao nomalan, volim ja curat, ali evo da uštedim za prsten, pa štedi već dvadeset godina čovječe uštedio bi za Ferrari, a ne za prsten, evo ljudi moji."
0:17:01,0:17:16,"Ali ono recimo sad taj prsten deset tisuća eura je jedan prosječan, to je vam prosječan zagrebački zaručnički prsten, evo curat zato se tako dugo čeka jer znaš što će biti baš dodiće propast kad krenu svi ovi evo sa tim prstenjem."
0:17:17,0:17:23,I sad recimo evo da neka sretno nesretna zaručnica ili žena taj svoj prsten izgubi.
0:17:24,0:17:38,"I sad netko taj prsten nađe i sad on digne i kaže, a da, da, da, ovo je zaračnički, to je deset tisuća eura, da, da, to je zagrebački zaračnički prsten, da, to je bar deset tisuća eura u startu, dobro, to se da lijepo novčiti i tako, ima neku vrijednost u sebi."
0:17:39,0:17:50,"Međutim, sad molim evo sve vas koji te prstenje to nosite, pogledajte taj prsten i reci koliko tebi on vrijedi, koliko on tebi vrijedi."
0:17:51,0:17:59,"Onda si ja pogledaj malo, pogledaj si taj prsten i recimo, sebi ne moraš naglas, ne moraš da te netko čuje, koliko tebi taj prsten vrijedi."
0:18:02,0:18:05,"sto eura, dvjesto eura, tristo nije bitno koliko vrijedi."
0:18:06,0:18:09,"I sad drugo pitanje, a zašto ti toliko vrijedi?"
0:18:10,0:18:13,Pa zato što taj prsten daj Bože nešto govori.
0:18:14,0:18:22,"Zato što nešto govori, odzvanja, riječi nečijim riječima možda onoga ili one koji ti je taj prsten stavio."
0:18:23,0:18:24,To je ono što daje snagu.
0:18:25,0:18:39,"Znači ako bez prstenja je deset tisuća eura, bez riječi je deset tisuća eura, sa riječima neopisivo, neopisivo mnogo više, neopisivo mnogo više."
0:18:40,0:18:41,To je ono što daje riječ.
0:18:42,0:18:49,"Naravno bez stvarnosti neće ništa, ali kad imaš ono umnaža tu vrijednost i potiče na stvaranje, čak i stvara."
0:18:50,0:19:03,"I nadam se draga braćo i sestre, pogotovo vi koji nosite to prstenje, nadam se da si ti glasniji u govoru tih istih riječi što govori tvoj prsten od tvoj prstenja."
0:19:04,0:19:11,Nadam se da taj tvoj prsten nije glasniji od tvoj srca i od tvojih dijela i od tvojih riječi.
0:19:12,0:19:14,Nadam se da to nije najglasniji dio.
0:19:14,0:19:20,"Nadam se da recimo ove ne znam lijepi kipovi, slike u ovoj crkvi se ne mole više nego što se mi molimo."
0:19:20,0:19:26,"Jer kad Bog gleda i kaže, pa da, mole se, a lijepše mu se moli ovaj kip, ovdje je ova slika nego što je vjernica onako."
0:19:28,0:19:40,"Bog je, on voli komunikaciju, on voli čut, reći, pitat, slušat, osluškuje, obožava, obožava te stvari."
0:19:42,0:20:10,"Pa evo da ne ostanemo samo na ovim nekim uvodnim mislima, pogledat ćemo ovo jedan dio teksta Evanđelja iz šesnaestog poglavlja Lukinog, jednu od najpoznatijih Isusovih prispodoba, dobro ona je top najpoznatija je bila poglavlje prije, ali ajde ovaj biti još zanimljivija u mnogo čemu, samo je to ipak ono milosrdni otac i ono teleta ugojeno, pa to malo, zbog teleta je ova prva ipak malo ima prevagu."
0:20:10,0:20:22,"Međutim, ova druga o takozvani bogatašu i Lazaru je poznata jer je to jedna jedina Isusova prispodoba u kojoj bilo tko od likova ima ime, Lazar."
0:20:23,0:20:27,"Jedini lik koji je u Isusovim prispodobama, koji ima ime."
0:20:27,0:20:38,"Svi drugi su neki čovjek, evo neki čovjek ima dva sina, stariji, mlađi itede ili ne znam, odlazi čovjek na put pa dade jednom pet alenata, deset, vrati se ovaj spet alen, nema imena, nema ništa."
0:20:38,0:20:49,"Jedna jedina Isusova prispodoba u kojoj se spominje ime, ime Lazar što je skraćeno od Eleazar što znači Bog je moja pomoć, ne baš se proslavio jel."
0:20:50,0:21:17,"I znamo kako ide ta priča, kaže ovako, čovjek neki bijaše, bogat i oblačio se u pušku u purpur i još neku bogat u odjeću i kaže euforiju, imao je euforiju doslovno kažem na grčkom, svakog dana i to ono bliskavo, znači bliskava euforija svakog dana je bio njegov život."
0:21:18,0:21:57,"A neki ono baš ono, ne samo siromah nego baš ono što je sirotinja, neki ono, sirotinja siromah imenom Lazar, Bog je moja pomoć, bio je bačen, znači ležao bačen doslovno, pasiv, pred njegova vrata, pun nekih čireva i čeznuo biti nahranjen od onoga što je padalo sa stola bogataša, ali i psi dolažu lizati njegove čireve."
0:21:59,0:22:12,Bit tako da se dogodilo da je umro siromah sirotinja i bi odnesen od strane anđela u krilo Abrahamovo.
0:22:13,0:22:20,"umre i bogataš i bi zatrpan, pokopan, tako otprilike riječ glasi."
0:22:21,0:22:40,"I u Hadu, sad ne znamo šta točno to je, pa zato namjerno takvu riječ ostavljam, podigavši oči svoje u trpeći razle boli, gleda Abrahama iz daleka i Lazara u krilu njegovu."
0:22:42,0:23:08,"I on glasom reče Oče Abrahame, smiluj mi se, I pošalji Lazara da umoči vrh prsta svoga u vodu i natopi jezik moj jer teško mukom se mučim u ovom nekakvom jadu."
0:23:09,0:23:21,"Reče Abraham, djetešce, sinčiću, sjeti se da si primio dobra svoja u životu svome."
0:23:22,0:23:25,I jednako tako Lazar zlači.
0:23:26,0:23:31,"Sada ovdje on biva utješen, a ti se mučiš."
0:23:32,0:23:56,"I u svemu tome između nas i vas velika razvaljena jama se raširila, tako da odavde ne može netko doći do vas, a reći, pitaj molim te onda oče Abrahame, pošalji njega u kuću oca moga."
0:23:57,0:24:11,"Imam naime petero braće da ne bi i oni došli u ovo mjesto ovih muka, kaže Abraham."
0:24:12,0:24:16,"Imaju Mojsija i proroke, neka njih poslušaju."
0:24:17,0:24:27,"A ovaj reče ne hoće Abrahame, nego ako bi netko od mrtvih došao k njima obratit će se."
0:24:28,0:24:41,"A reče mu, misli se Abraham, ako Mojsija i proroke ne poslušaju, čak ni da netko od mrtvih ustane neće povjerovati."
0:24:43,0:24:51,"Mojsijev i prorok je simbol metafora za Bibliju, misli se na peto knjižje i na drugi dio Biblije."
0:24:52,0:25:10,"Đaba, đaba svako čudo, đaba ti sve, đaba ti sva bogatstva, đaba ti i boli i jadikovke i želje i ovo i ono, kaže Abraham ako ne prihvatiš Božju riječ."
0:25:11,0:25:17,"Bez Božje riječi, Isus može uskrsnuti evo, evo sad, prije pet minuta tu pokraj tebe, možda već i je."
0:25:18,0:25:26,"Bez njegove riječi ništa, nula bodova, ne ide, ne vidiš, ne osjećaš, ne doživljavaš."
0:25:27,0:25:38,"I naravno kao kaže Sabor, rekli smo u drugoj vatri, mrtav si, jako živ, ali zapravo ne kužeš da je čovjek pored tebe živ, bez te riječi, bez toga svjetla, nema."
0:25:39,0:25:46,"Vidimo da je taj bogataš, bogat svojim riječima, ali nije bio bogat vjerom."
0:25:47,0:26:16,"I on evo želi zato sam stavio nasilje oporuka, evo ono kao nešto iako je već umro, ali evo kao nešto ono najvažnije, kao kad čovjek stavlja oporuku, pa onda ostavljaš ono evo nakon mene, nakon svega, evo to nešto ću ostaviti, to nešto, pa evo da im bar dođe, Abraham kaže, pa imaju oni oporuku, imaju oporuku, a pazite na latinskom se kaže oporuka testamentum, the Old Testament ili New Testament."
0:26:16,0:26:20,Znači možeš prevesti to kao novi zavjet ili nova ili stara oporuka.
0:26:21,0:26:25,"Imaš oporuku, imaš ono što te treba uputiti."
0:26:25,0:26:35,"Imaš ono što će ti dati snagu, imaš ono što će ti pokazati svjetlost, što će ti pokazati koje si boje, koje će ti pokazati smisao, koje će ti dati vrijednost."
0:26:36,0:26:56,"Jer nije stvar Božje riječi da ona samo povećava vrijednost našem zaračuničkom ili vjenčanom prstenju, nego tebi, tebi da ti doživiš koliko si vrijedan, koliko si dragocjen, koliko si njemu sve."
0:26:57,0:27:04,Jer on je riječ koja je tijelom postala i ali ne želi prestati biti riječ.
0:27:05,0:27:07,On je riječ koja je postala tijelo i ostala je riječ.
0:27:07,0:27:19,"On je riječ koja je tijelo postala, on je tijelo koje govori, on je tijelo koje ima smisao, on je tijelo koje pokazuje jednu putanju, koje pokazuje svrhovitost."
0:27:21,0:27:41,"Zamislimo se, evo, vraćam se sestri koliko svi vi više manje, svi mi jel volimo neku vrstu romantike u smislu, znaš da svaki taj pokret ima nešto, pa sad taj momak jel vodi svoju Katarinu negdje, pa onda zna, ona nešto očekuje, pa nešto, pa vidi da nešto govori, ne zna šta, ali nešto je, to je u našoj naravi, mi to volimo."
0:27:41,0:27:44,Mi želimo da naš korak ima značenje.
0:27:45,0:28:23,"Jedan prijatelj koji igra nogomet za reprezentaciju je rekao da se sam iznenadio kad smo mu dali podatak jer njih tamo izmjeravaju na sve strane da iako se on trudi jednako kad igra u klubu i za repku kaže kad igram repku trčim deset i petnaest posto više da mene pitaš ne bi ti rekao da trčim više ali evo statistika pokazuje tako zašto jer dobivaš neki smisao neki poticaj znaš kakvu svrhu znaš za koga kako čemu a bez te riječi Možeš imati sve i umiremo od dosade, ma šta će, ma komu, zašto, ma neka, kako ćemo mi to, čemu će to sve?"
0:28:24,0:28:27,"Nemamo riječi, nemamo riječi."
0:28:28,0:28:29,I što nam se onda događa?
0:28:29,0:28:32,Događa nam se to da mi sebi pucamo u koljeno.
