Start (HH:MM:SS),End (HH:MM:SS),Segment
0:00:00,0:00:03,Dobrodošli u Launched.
0:00:03,0:00:19,"Ja sam Charlie Chapman i danas sam jako uzbuđen što me je pridružio neovisni razvijač aplikacija iza Drag Thing, Peacock i Dice, kao i iskusni vukodlak podcastova koji gostuje na svim vrstama emisija s The Incomparable i Real AFM, a vjerojatno i na mnogo više nego što znam."
0:00:20,0:00:22,"Dobrodošao u emisiju, James Thompson."
0:00:35,0:00:36,Hvala što ste došli.
0:00:36,0:00:37,Hvala što ste me primili.
0:00:38,0:00:42,Lijepo je i otići negdje novo.
0:00:43,0:00:46,"Da, vjerojatno sam osoba čije ime zapravo ne znate."
0:00:47,0:00:51,"Pa, mislim da imam tamni šum na svom telefonu, pa stvarno?"
0:00:52,0:00:52,Da.
0:00:52,0:00:54,"O, čovječe, to je lijepo čuti."
0:00:54,0:00:55,"Ne, stvarno mi se sviđa."
0:00:55,0:01:00,Ponovo sam se malo poigrao s njim i to je stvarno lijepo.
0:01:01,0:01:01,Fantastično.
0:01:02,0:01:02,Pa hvala.
0:01:03,0:01:13,"Želim započeti s pitanjem za razbijanje leda, samo da održim razgovor, jer nitko ne zna tko sam, pa bih volio imati taj razgovor, znaš."
0:01:15,0:01:18,"Dakle, na kraju želim da ti se pitanja odnose na slušatelje."
0:01:19,0:01:22,"I zapravo ih imam nekoliko, ali za vas imam posebno pitanje koje sam želio postaviti."
0:01:23,0:01:28,"Često gostujete u emisiji Incomparable, pa ste svojevrsni medijski guru, barem s moje perspektive."
0:01:29,0:01:33,"Dakle, moje pitanje je, što vam se više sviđa u gledanju TV emisija?"
0:01:34,0:01:41,"Preferirate li tjedni izlazak koji dolazi s Apple TV-om i, mislim, još ne Disney plusom u Škotskoj?"
0:01:41,0:01:48,Ili preferirate Netflixov stil izlaza na jedan put?
0:01:48,0:01:52,Obično bih rekao da bih volio baciti sve odjednom.
0:01:53,0:02:01,"Ali, znate, bilo je dosta s Apple TV-om, ima nekoliko emisija poput For All Mankind i Sea i slično, koje stvarno uživam."
0:02:02,0:02:09,"I lijepo je da ne dobijem sve odjednom, znate, jer ljudi zapravo mogu pričati o epizodama."
0:02:10,0:02:14,"I, znate, postoje i druge emisije, znate, stvari poput Mandaloriana ili bilo čega."
0:02:14,0:02:25,"I čini se da ljudi mogu pričati o njima tjedno i postoji prostor za pričanje o tome što se upravo dogodilo, umjesto da, evo dvadeset epizoda nečega."
0:02:25,0:02:29,"Neki će ga izgraditi za nekoliko dana, a drugi će ih izgraditi za nekoliko tjedana."
0:02:29,0:02:38,"I nema istog, znate, rasprava o vodeni hladnjak, virtualni vodeni hladnjak."
0:02:38,0:02:43,"Dakle, mislim da je zapravo korisno da se emisije emitiraju jednom tjedno."
0:02:43,0:02:47,"Da, definitivno mislim da ovisi o emisiji, vjerojatno."
0:02:47,0:02:52,"Da, mislim da za stvari koje me zapravo ne zanimaju, ako se sve emitiraju odjednom, to je u redu."
0:02:53,0:03:04,"Mislim, nemojte me krivo shvatiti, volio bih odmah vidjeti sljedeće epizode ovih emisija, ali, znate, mislim da je to lijepo imati određenu količinu predviđanja."
0:03:04,0:03:08,"Da, zanimljivo je i to da svi izlaze u petak, čini se."
0:03:08,0:03:08,Da.
0:03:08,0:03:17,"Dakle, nekako se vratite s tjedna i imate sve te emisije da pronađete sve svoje prijatelje na poslu ili na svom virtualnom poslu, mislim, da vam se o tome mogu porazgovarati."
0:03:17,0:03:17,Da.
0:03:18,0:03:20,"I, znate, volio bih da malo razmaknu."
0:03:20,0:03:24,"Mislim, barem će Doctor Who biti u nedjelju, mislim, za sljedeću seriju."
0:03:25,0:03:28,"Dakle, to se ne događa u petak, subotu ili bilo gdje."
0:03:29,0:03:33,"Ali, da, trenutačno ima malo previše emisija."
0:03:33,0:03:36,"Ne bih trebao prigovarati zbog toga, ali postoji."
0:03:36,0:03:41,"Ali, znate, Watchmen je zaista vrijedan gledanja."
0:03:42,0:03:47,"I sve te stvari, bilo ih je previše ili ih nema dovoljno."
0:03:48,0:03:50,I jednostavno se raspastimo.
0:03:50,0:03:59,"Da, i svi se bore da pobijede u ovoj ratnoj igri za streaming istovremeno, što vjerojatno znači da ćemo sada dobiti najvišu količinu kvalitetnog sadržaja."
0:04:00,0:04:04,A onda će sve to jednostavno ispasti iznad nas kad netko pobijedi.
0:04:04,0:04:11,"Da, mislim da svi trošimo novac da bismo vidjeli ove trinaest mreža za streaming."
0:04:48,0:04:51,"Kariere, recimo prije drag stvari u ovom slučaju."
0:04:52,0:04:56,"Dakle, da, ja sam iz Glasgowa u Škotskoj."
0:04:57,0:05:10,"Moj naglasak zvuči malo između Škotske i Engleske jer je moja majka odrasla na jugu Engleske, pa mi se u Škotskoj sviđa zvati engleski, a u Engleskoj škotski."
0:05:10,0:05:12,"Da, to je zbunjujuće."
0:05:12,0:05:25,"Ali, u svakom slučaju, da, započeo sam, mislim, stvarno, da se vratim, dobio sam Commodore 64, mislim, oko 1983."
0:05:25,0:05:26,godine.
0:05:26,0:05:41,"I otprilike u isto vrijeme, u mojoj školi, a to je bilo u osnovnoj sedmoj razini, dobili smo računalo BBC Model B, što je posebno britanska stvar."
0:05:42,0:05:48,Ali na njemu je bio vrlo dobar osnovni programski jezik i mogli ste s njim raditi grafiku i razne druge stvari.
0:05:51,0:06:00,Kad sam dobio pristup tim strojevima i počeo sam jer sam.
0:06:00,0:06:03,"Jer, mislim, sada sam star deset godina."
0:06:03,0:06:07,Počeo sam igrati igre na njima jer to je ono što radite.
0:06:07,0:06:07,Naravno.
0:06:08,0:06:27,"I bilo je jedna serija igara, posebno od programera po imenu Jeff Mentor, koji je započeo početkom osamdesetih, a postojale su igre za Commodore 64 s naslovima kao što su osveta mutantnih kamela, koja je, naravno, bila nastavak napada mutantnih kamela."
0:06:28,0:06:35,"I on je radio sve te igre i sve su uključivale neku vrstu ovce, kamela, lame."
0:06:38,0:06:51,I naučio me je da može napraviti nešto samo jedna osoba jer je uvijek stavljao svoje ime na naslovnu stranicu i da se u softver može staviti određena količina svoje osobnosti.
0:06:52,0:06:54,Želio sam napraviti igre poput njega.
0:06:54,0:06:57,Upoznao sam ga jednom na računalnoj izložbi u Londonu.
0:06:59,0:07:03,"I tako sam se pitao, kako to radim?"
0:07:04,0:07:09,I počeo sam se igrati s Commodoreom 64 i BBC Basicom.
0:07:10,0:07:13,I znao sam da želim nastaviti.
0:07:15,0:07:19,s računalnim znanostima kao što je to bila moja karijera.
0:07:19,0:07:28,"Tako sam završio studij računalnih znanosti na Sveučilištu u Glasgowu, otprilike pet minuta hoda od mjesta gdje trenutno živim."
0:07:32,0:07:35,I tamo sam prvi put došao do Macintosha.
0:07:36,0:07:40,I u tom trenutku to je bilo nešto poput SE-a i te ere strojeva.
0:07:40,0:07:42,"Ovo je nešto poput, ovo je 1990."
0:07:42,0:07:43,U redu.
0:07:43,0:07:47,I bilo je kao da je Mac bio mnogo bolji od bilo čega drugog što sam koristio.
0:07:47,0:07:48,U tom trenutku imao sam Atari ST.
0:07:48,0:07:58,I shvatio sam da je korisničko sučelje Maca bilo nadahnuće za korisničko sučelje ST-a i da su ga loše iskoristili.
0:07:59,0:08:10,"Bilo je kao da sam to vidio i koliko je sve dobro promišljeno, koliko je dobro osmišljeno, bilo je kao da moram napraviti aplikacije za ovo."
0:08:11,0:08:12,"Tada su se zvali aplikacije, ali da."
0:08:15,0:08:25,"I tako je moja aplikacija koju sam napisao da bih naučio programirati Mac, prva stvar koju sam ikad napisao, počevši oko 1991., 1992., zapravo bila PC."
0:08:25,0:08:40,"I to je zaista bio PCalk jer sam želio aplikaciju, aplikaciju za znanstveni kalkulator i jednu koja bi radila na šestnaestoj, osamnaestoj i binarnoj vrijednosti jer sam je koristio u svom tečaju i nisam pronašao prikladnu za Mac i pomislio sam, ovo je dovoljno mali projekt da ga mogu napraviti."
0:08:40,0:09:00,"Drugi način na koji je to došlo bio je jedan od predavanja koje sam radio, dizajn korisničkog sučelja i jedan od projekata koji smo imali bio je dizajn centralnog grijalnog upravljačkog panela i to je u tom trenutku napravljeno u Hypercardu."
0:09:00,0:09:09,Upravo sam to učinio i kao dio toga stvorio sam ovaj lažni sedmisegmentni LCD zaslon i imao sam sve te gumbe.
0:09:09,0:09:15,"I pomislio sam, dobro, mogu ponovno upotrijebiti sve te resurse koje sam napravio za kalkulator."
0:09:16,0:09:22,I to je zapravo bila odluka o tome zašto sam napravio kalkulator jer sam već nacrtao ove grafike.
0:09:23,0:09:27,"Dakle, napisao sam PCalc i objavio ga kao freeware 1992."
0:09:28,0:09:28,godine.
0:09:29,0:09:34,I nastavio sam i napisao DragThing 1994.
0:09:34,0:09:34,i 1995.
0:09:35,0:09:36,godine.
0:09:36,0:09:45,"Sve ovo je bilo učenje novih stvari, kao što je DragThing naučio nove API-je za povlačenje i bacanje koji su se pojavili u System seven point five, mislim."
0:09:46,0:10:00,"I sve ovo je bilo učenje, ali u bilješkama za sve ovo u osnovi je bilo rečeno: Želim raditi za Apple, pa ako postoji netko u Appleu tko mi može pronaći posao, molim vas da to učinite."
0:10:00,0:10:03,"Koristili ste to kao neku vrstu uskrsnog jaja, ehm, životopisa?"
0:10:04,0:10:13,"Da, to je bilo objavljivanje u svijetu i u tom trenutku je bilo besplatno i bilo je kao da ćemo vidjeti može li biti popularno i može li mi to pronaći posao u Appleu."
0:10:13,0:10:16,Jedno pitanje koje sam imao bilo je kako ste to distribuirali?
0:10:16,0:10:17,Je li to bilo putem interneta?
0:10:18,0:10:23,"Da, mislim da je to bilo sigurno s PCalcom, to je bilo prije weba."
0:10:23,0:10:30,"Dakle, web mi je bio poznat otprilike 1994., 1995., pa je to bilo 1992."
0:10:31,0:10:49,godine i postojala je stvar koja se zvala InfoMac Archive i bila je to FTP arhiv softvera i mogli ste poslati svoj softver u to i bilo je grupa Usenet u koju ste mogli objavljivati stvari i automatski bi se slali i tako dalje.
0:11:24,0:11:30,"Gdje biste mogli odpisati i dobiti papirnati katalog, a zatim poslati stvari i vratiti ih na disk."
0:11:31,0:11:39,"Da, jer ste rekli da je to bilo besplatno, ali u tom trenutku, osim ako ste htjeli raditi s trgovcem ili nečim sličnim, je li zaista postojao način da se to proda?"
0:11:40,0:11:42,"Mislim, te stvari su počele u tom trenutku."
0:11:43,0:12:00,"Mislim, pokušavam se sjetiti, ne znam, ne mogu se sjetiti u kojoj godini je bilo nešto poput Doom-a, koji je, znate, bio distribuiran kao shareware, ali bilo je teško, ali postojale su tvrtke poput Caggyja, koje su bile ljudi koje sam na kraju upotrijebio za prodaju Pcalcona Drag Thing."
0:12:00,0:12:05,"Ipak, prvo sam se bavio dragom."
0:12:05,0:12:10,"Vjerojatno su počeli negdje oko 1995., 1996., u tom vremenskom razdoblju."
0:12:11,0:12:26,"Što je moj softver, mislim, osim što je bio svojevrsna vizitka i pokušavao sam dobiti posao jer sam bio na fakultetu i htio sam posao na kraju toga, imao sam neke od njih kao neku vrstu coolware ili razglednice ili nešto slično."
0:12:26,0:12:30,"Dakle, ljudi su mi šaljali samo slučajne razglednice i stvari iz cijelog svijeta."
0:12:31,0:12:35,"Mislim, to je bio dan kad sam stavio svoj dom u okvir o ovom softveru."
0:12:36,0:12:37,"Da, ne mogu zamisliti da to to radim sada."
0:12:38,0:12:40,"Ne, apsolutno ne bih to radila sada."
0:12:41,0:12:51,Iako ne mogu zamisliti da preuzimam slučajne aplikacije na računalo koje imaju potpuni pristup sustavu i samo ih pokrećem.
0:12:51,0:12:56,"Da, mislim da su to bili nevini dani na mnogo načina, ali do 1994."
0:12:57,0:13:16,"godine diplomirala sam i na kraju sam dobila posao na sveučilištu na kojem sam studirala i radila sam u timu za sustave koji su bili ljudi, znate, zapravo sam bila administrator sustava koji se brinuo za sus za iste laboratorije Maca koje sam koristio prije."
0:13:17,0:13:26,"U osnovi, to je bilo zato što sam se žalio jer sam bio studentski predstavnik i neprestano sam se žalio osoblju sustava na stanje svih sustava."
0:13:27,0:13:30,"Dakle, kazna mi je bila da sam bio zadužen za njih i da ih moram popraviti."
0:13:30,0:13:34,A onda su me studenti prigovarali na stanje stvari.
0:13:34,0:13:36,"Dakle, znate, to je bilo poput kruga života i sve to."
0:13:38,0:13:48,"I dok sam tamo radio, znate, pisao sam neku vlastitu softversku aplikaciju za odjel, učio sam sve više i više o pisanju aplikacija za Mac."
0:13:48,0:13:50,Bio je to dobar vrsta trenira.
0:13:51,0:14:02,"A onda sam u nekom trenutku, mislim da je bilo krajem 1996., dobio poruku e-pošte od nekoga iz Applea koji je rekao: Vidio sam tvoju knjigu Read Me u drag stvari."
0:14:03,0:14:04,Želiš posao?
0:14:05,0:14:10,A ja sam rekao: Da.
0:14:10,0:14:12,Tako sam otišao na razgovor.
0:14:12,0:14:13,"Mislim, to nije bilo samo ponuda za posao."
0:14:14,0:14:16,"Bila je to ponuda za razgovor, barem."
0:14:16,0:14:17,Da dođem u Kaliforniju.
0:14:18,0:14:19,"Pa, ovo je stvar."
0:14:19,0:14:20,Nije bilo Kalifornije.
0:14:20,0:14:21,Ovo je bilo Cork na Irskoj.
0:14:21,0:14:23,Zanimljivo.
0:14:26,0:14:32,"Bio je u blizini, znate, još nije bilo Škotske, ali znate, bio je samo kratak skok preko vode."
0:14:32,0:14:40,A u Corku imali su ono što je uglavnom bilo proizvodni pogon koji je proizvodio stvari iz vremena Applea II.
0:14:41,0:14:46,Mislim da su u jednom trenutku u tvornici proizvodili vlastiti silicij ili nešto slično.
0:14:46,0:14:49,"Bilo je kao da pijesak ulazi u jedan kraj, a računala izlaze iz drugog."
0:14:50,0:14:50,Wow.
0:14:50,0:14:58,"Ali u tom trenutku imali su i timove za softver koji su podržavali dio hardvera, a dio hardvera je tamo dizajniran."
0:14:58,0:15:00,Bio je to televizorski tuner.
0:15:00,0:15:07,"I to je bila kartica za tuner koja je bila na nekim od ranih Macintoshova, a softver za to je napisan u korku."
0:15:08,0:15:10,I mislim da je hardver razvijen i tamo.
0:15:10,0:15:24,"I u tom trenutku, kad sam došao, imali su prilično veliku ekipu jer mislim da je bilo oko 150 inženjera koji su radili na nekim stvarima."
0:15:25,0:15:34,"A ovo je bilo za macOS osam, originalni macOS osam koji se zvao Copeland, operacijski sustav koji je Apple pisao kako bi zamijenio klasični macOS."
0:15:35,0:15:37,"Dakle, memorija je bila zaštićena."
0:15:37,0:15:41,"Zaštitili su sve moderne stvari, ali to nije macOS X."
0:15:43,0:15:47,"Apple je već nekoliko godina govorio u WWDC-u da je to budućnost, znate."
0:15:48,0:15:50,"Da, ovo je ono što je uvijek dolazilo, zar ne?"
0:15:50,0:15:50,Da.
0:15:50,0:15:59,"I tako sam otišao, imao sam razgovor, ponudili su mi posao i preselio sam se, a moja supruga je preselila sa mnom."
0:16:00,0:16:04,"Zapravo, ne moja supruga tada, ali do toga ću doći kasnije."
0:16:05,0:16:08,I pridružio sam se i otkazali su projekt.
0:16:09,0:16:13,Dva tjedna.
0:16:15,0:16:17,I cijeli operacijski sustav je otkazan.
0:16:18,0:16:18,U kojoj godini je to bilo?
0:16:19,0:16:21,Mislim da je to bilo krajem 1996.
0:16:22,0:16:22,godine.
0:16:22,0:16:27,"Dakle, bilo je nekakvo nevjerovanje da je to bilo otkazano jer su ljudi na tome radili godinama."
0:16:28,0:16:30,"I dugo su o tome javno govorili, zar ne?"
0:16:31,0:16:43,"Da, mislim da su barem dva WWDC-a bila na kojima je to bilo na raspolaganju i da su se ranije alfa verzije operacijskog sustava poslale programerima i slično."
0:16:43,0:16:47,To je bilo kao ozbiljna investicija Applea.
0:16:47,0:16:49,Malo veća stvar od AirPower-a.
0:16:49,0:16:50,I zračna snaga nije dolazila.
0:16:50,0:16:51,"Da, da, da."
0:16:52,0:16:58,"To je bilo, bojim se razmišljati koliko je uloženo stotina milijuna dolara i ljudskog vremena u to."
0:16:58,0:17:07,"I ljudi su još uvijek radili na stvarima kad sam stigao, iako je to otkazano jer nitko zapravo nije vjerovao da će to zaista biti otkazano."
0:17:07,0:17:10,To je kao kad se rat završi prije nego što se telefon završi.
0:17:10,0:17:11,"Da, točno."
0:17:11,0:17:15,"Dakle, ti su programeri bili skriveni u prašumi, ne znajući da."
0:17:16,0:17:20,Kažu da i danas postoji jedan programer u kutu u Cork.
0:17:20,0:17:20,Da.
0:17:21,0:17:25,"I kad sam otišao, bilo je jasno."
0:17:26,0:17:32,"izvana, a očito nisam istraživao da je Apple u lošem stanju u tom trenutku."
0:17:32,0:17:45,"Znaš, bili su poput mog menadžera koji je podnio ostavku uskoro nakon što sam se pridružio i bilo je kao da je Apple bio, znaš, na četvrtini bankrota u tom trenutku."
0:17:45,0:17:49,Nije prošlo dugo za ovaj svijet.
0:17:49,0:18:01,"I doveli su Gil Emilia, koji je bio taj čovjek sjekire, koji je u osnovi doveo da otpusti puno poslova i puno ljudi."
0:18:01,0:18:07,"I znam da je bilo otpušteno mnogo ljudi i kad god bi ljudi otišli, nisu bili zamijenjeni."
0:18:07,0:18:15,"I znate, cijela inženjerska ekipa do kraja kad sam bio u Appleu, svi smo se smjestili oko jednog stola za vrijeme ručka."
0:18:16,0:18:17,"Bilo je to, čovječe."
0:18:17,0:18:31,"Prošlo je od puno ljudi i puno testiranih organizacija jer su oni, jedna od stvari Applea u to vrijeme bila da su htjeli testiranje u američkom vremenskom pojasu, u Japanu i Europi."
0:18:32,0:18:34,"Dakle, mogli su imati testove 24 sata."
0:18:35,0:18:36,"Dakle, izašla bi izgradnja."
0:18:36,0:18:42,"I do sljedećeg jutra kad su se inženjeri vratili, znate, prošli su cijeli ciklus testiranja."
0:18:42,0:18:42,To je bila teorija.
0:18:43,0:18:43,"Da, da."
0:18:44,0:18:47,"Dakle, to je bio jedan od razloga zašto su imali sve te stvari."
0:18:47,0:18:57,"Ali jer je Appleu došlo do kraja novca, smanjili su sve vanjske stvari i vratili ih u Kubernetes koliko god su mogli."
0:18:59,0:19:04,"Ali, znate, unatoč svemu tome, uspio sam raditi na zanimljivim stvarima."
0:19:05,0:19:11,"Mislim, prva stvar koju sam radio, ili prva dva projekta na kojima sam radio u Appleu, priču sam ispričao prije."
0:19:11,0:19:12,"Dakle, ako je netko čuo prije, žao mi je."
0:19:14,0:19:26,Ali radili smo za Disney jer je Apple trebao lansirati ove potrošačke strojeve i htjeli su da im se pruži neka potrošačka softverska oprema.
0:19:26,0:19:34,"A Disney je imao sve te studije za tisak u to vrijeme, što su stvari na kojima se mogu ispisivati čestitke, omotnice, naljepnice i slično."
0:19:34,0:19:36,"Oh, dobro, shvatio sam."
0:19:36,0:19:39,I imali su ih za PC i htjeli su verziju za Mac.
0:19:39,0:19:42,A prva je bila stotinu i jedan dalmatinac.
0:19:44,0:19:52,I tako je Apple otišao u Disney i rekao: Želimo da ovo prenesete na Mac.
0:19:52,0:19:55,"I znate, dali bismo vam milijun dolara ili bilo što drugo."
0:19:56,0:19:59,A Disney se okrenuo Appleu i Cork i rekao: Želimo da ovo prenesete.
0:19:59,0:20:03,I mi ćemo vam dati pet stotina tisuća dolara.
0:20:03,0:20:08,"I tako smo na kraju radili za Disneyja, radili za Apple, što je bila stvarno čudna situacija."
0:20:08,0:20:08,Da.
0:20:09,0:20:14,Imali smo ove dvije šefove i mi bismo poslali dizajne Disneyju.
0:20:15,0:20:17,"Ali znate, radili smo za Apple."
0:20:18,0:20:21,I tako sam to učinio i to je isporučeno.
0:20:21,0:20:24,I to je isporučeno s izvođačima u to vrijeme.
0:20:24,0:20:27,A onda smo napravili verziju temeljenu na filmu Herkul.
0:20:29,0:20:36,"Eh, i mislim da su to bile neka vrsta, znate, neka vrsta, ne bih rekao jednostavne jer ništa što uključuje ispis nije jednostavno."
0:20:37,0:20:37,Sigurno.
0:20:37,0:20:48,"Eh, ali, znate, bile su to prilično jednostavne aplikacije i morali smo prepisivati dizajn aplikacija za Windows i ponovno ga napisati iz nule ispod poklopca."
0:20:48,0:20:51,"Dakle, izgledale su isto i osjećale su isto, ali ispod njih je bio drugačiji kod."
0:20:52,0:20:58,"Da, bio sam, eh, razvijač telefona za Windows koji je u osnovi radio isto nekoliko godina."
0:20:58,0:21:01,Microsoft bi dao hrpu novca nekoj tvrtki.
0:21:01,0:21:06,Novac za prijenos aplikacije za Android ili iOS jer nitko nije želio.
0:21:06,0:21:08,A onda ta tvrtka uopće nije brinula.
0:21:08,0:21:13,Samo bi se okrenula i dala novac nama i rekla: Imate točno toliko novca da prijenesete ovu stvar.
0:21:14,0:21:16,"Dakle, vrlo sam upoznat s tom konceptu."
0:21:16,0:21:20,"Da, ali to je bilo zanimljivo."
0:21:20,0:21:29,"I naučio sam puno toga o tome, znate, opet, kao što smo to radili u C plus plusu i koristili okvir za mrežni rat Code Warrior za to."
0:21:30,0:21:37,"Ali htio sam raditi na tome, kao što je Mac OS X nekako pokrenuo."
0:21:37,0:21:40,"Upravo sam se tada pokrenuo interno i znate, bili smo svjesni toga."
0:21:41,0:21:46,A onda je Apple nije imao tajnu koju je imao kasnije.
0:21:47,0:21:52,"Dakle, znate, znali smo da je tu tajna i htio sam biti uključen u to."
0:21:52,0:21:58,"I bio sam poput, glavna stvar bila je da volim dizajn korisničkog sučelja."
0:21:59,0:22:07,"I tako su mi dali projekt na kojem radim na stvarima za autentifikaciju poslužitelja, koja uopće nije imala korisničko sučelje."
0:22:08,0:22:08,"Da, suprotno."
0:22:09,0:22:13,"Dakle, to je bio, znate, sve mrežni kod i, znate, višestruki."
0:22:13,0:22:16,"Multithreaded, mreža, autentifikacija, bilo što."
0:22:17,0:22:20,Bio sam najgori čovjek na tom projektu.
0:22:21,0:22:27,I radio sam na tome vjerojatno šest mjeseci do godinu dana ili nešto u tom stilu.
0:22:28,0:22:29,Možda ne tako dugo.
0:22:30,0:22:38,I pokazalo se da je zapravo bio za iMac jer je u tom trenutku iMac trebao biti bezdiskovna radna stanica koja se pokrenula.
0:22:38,0:22:39,"O, čovječe."
0:22:39,0:22:40,Tako se zvao iMac.
0:22:40,0:22:43,"To je bilo prije, recimo, Jobsa i Ivea."
0:22:44,0:22:46,"Pa, ne, ne, Jobs se vratio u tom trenutku."
0:22:46,0:22:46,U redu.
0:22:47,0:22:52,"Ali to je bilo 199897., 1998."
0:22:52,0:22:52,godine.
0:22:52,0:22:53,U redu.
0:22:53,0:22:55,Takav je vremenski okvir.
0:22:55,0:22:59,Ali mislim da se projekt još uvijek razvijao interno o tome što će biti.
0:22:59,0:23:06,I na kraju je sve to bez diska radne stanice i moj kod zajedno s njim izbačen.
0:23:06,0:23:09,"Dakle, postoji uzorak toga za moj posao u Appleu."
0:23:11,0:23:22,"Ali jedna od drugih stvari u to vrijeme bila je da sam se pridružio Appleu i rekao da imam i ove aplikacije koje radim u svom, znate, u svom slobodnom vremenu, Peacock i Drag."
0:23:23,0:23:25,I volio bih nastaviti raditi na njima navečer.
0:23:25,0:23:31,i vikendom i to je bilo uvjet mog zaposlenja.
0:23:31,0:23:35,"A Apple, barem Apple Cork, rekao je: Da, sigurno, nema problema."
0:23:36,0:23:38,I ne biste dobili takav ugovor s Appleom danas.
0:23:38,0:23:39,"Ne, nikako."
0:23:39,0:23:46,"Vidite sve te inženjere koji su dobili posao u Appleu, a onda se njihove aplikacije jednostavno izgube."
0:23:47,0:23:50,I uvijek je jako tužno kad se to dogodi.
0:23:50,0:23:59,"Sretni ste za nekoga tko ima posao i vjerojatno je to posao snova za Apple, ali njihov softver nikad više neće biti dodirnut."
0:23:59,0:23:59,Da.
0:24:00,0:24:04,Ali mogao sam raditi na tome u vlastitom vremenu.
0:24:04,0:24:09,I tako sam održavao PCALT i DragThing.
0:24:10,0:24:21,I ugrađivao sam u DragThing timeout u verzije jer sam bio umoran od ljudi koji bi došli k meni i rekli: Našao sam ovu grešku.
0:24:21,0:24:25,"A ja sam rekao: Da, popravio sam je u verziji 1.5."
0:24:26,0:24:29,"Dakle, svaka verzija trajala je samo godinu dana."
0:24:30,0:24:37,"A budući da sam radio u Appleu i nisam imao toliko vremena za rad na vlastitim stvarima, sve je bilo u redu."
0:24:37,0:24:39,Bilo je vrlo blizu te godine.
0:24:39,0:24:42,"A budući da je aplikacija bila besplatna, znate, nije bilo važno."
0:24:42,0:24:42,Da.
0:24:45,0:24:50,I mislim da je bilo otprilike u to vrijeme kad je drag stvar postala coolware.
0:24:50,0:24:51,"Znate, rekao sam, pošalji mi nešto cool."
0:24:51,0:24:59,"I dobio sam sve te čudne stvari, kao što su, znate, prodaje animacija i još uvijek imam veliku hrpu stvari, sve stvari koje mi ljudi šalju."
0:24:59,0:25:00,"Da, nikad nisam čuo taj pojam."
0:25:01,0:25:02,To je zanimljiv pojam.
0:25:03,0:25:04,Bilo je to poput častnog sustava.
0:25:05,0:25:05,Bio je besplatni softver.
0:25:06,0:25:13,"Znate, nije vam trebalo ništa slati, ali ideja je bila, znate, ako vam se to čini, ako vam se nešto koristi, pošalji mi nešto."
0:25:13,0:25:16,"Da, ali postoji nešto slatko."
0:25:17,0:25:26,"Ne znam, nešto u zajednici iOS-a, primijetila sam da postoji samo neka vrsta čudne razigranosti i to se osjeća tako."
0:25:26,0:25:33,"Ne kažem da je to nužno bilo nešto što je Apple radio tada, ali pokušavam razmišljati, kao da mi se glava trči, kao da bi danas mogao imati takav koncept?"
0:25:34,0:25:36,Ne znam kako bi to funkcioniralo.
0:25:36,0:25:38,"Mislim, da, danas je teško."
0:25:38,0:25:47,"Mislim da je bilo mnogo lakše prodavati softver ili ljudi su, ne želim koristiti riječ upravičeni, ali znate što mislim?"
0:25:47,0:25:52,"To je kao da pokušavate prodati aplikikaciju za dva dolara, ljudi će vam se žaliti."
0:25:52,0:25:52,Da.
0:25:52,0:26:05,"Ali u svakom slučaju, netko mi je tada poslao poruku e-pošte i radio je za vrlo veliku oglašivačku kuću i rekao: Naš računovodstveni odjel ne razumije pojam cool."
0:26:06,0:26:07,Možemo li vam poslati novac?
0:26:07,0:26:10,Ja sam rekao: Sigurno.
0:26:11,0:26:11,Što?
0:26:12,0:26:18,"To mi se nikad nije dogodilo, iz nekog razloga, da možete samo zatražiti novac od ljudi."
0:26:19,0:26:31,"I tako sam to uskladio s objavom ove nove verzije koja je u osnovi., nenamjerno su sve stare besplatne verzije nestale, a onda sam imao verziju za dijeljenje."
0:26:32,0:26:40,"Dakle, ako ste htjeli nastaviti koristiti softver koji je postojao u tom trenutku dvije godine i koji je koristio mnogo ljudi, morali ste platiti novac."
0:26:41,0:26:44,I tako je zapravo prošao iznimno dobro.
0:26:44,0:26:47,"Bio sam na putu da kažem, bilo je li povratnih informacija?"
0:26:47,0:26:48,Ne baš.
0:26:48,0:27:03,"Mislim da sam izgradio, mislim da je to jedna od stvari o, mislim, zajednici iOS-a i zajednici Apple-a općenito, ako imate dobru volju, to je kao da je to najbolvrjednija valuta kao razvijač."
