Start (HH:MM:SS),End (HH:MM:SS),Segment
0:27:03,0:27:12,I to je kao da sam stavio štednjak za napojnice u Pcalcu i ljudi u to stavljaju novac.
0:27:12,0:27:12,Ne moraju.
0:27:13,0:27:19,"Nema razloga da to učine, ali to rade jer im se sviđa ono što radim i žele me podržati."
0:27:19,0:27:23,"I, znate, ovo je malo dodatno."
0:27:23,0:27:37,"Mislim, povremeno se ljudi žale, ali, da, to je definitivno nešto što sam primijetio i ja, prebacivši se jer sam živio u Androidovom svijetu i ima puno stvari koje sam volio u tome, ali koncept štednjaka za napojnice nije bio."
0:27:37,0:27:39,Ne vidite to nigdje.
0:27:39,0:27:51,"I uz to, nemate puno aplikacija koje imaju ove male čudne dodirne značajke ili slično zaslonu o ljudima kao što je Peacock, gdje se gotovo osjeća kao da je to razvojnik koji vraća."
0:27:51,0:27:53,Kao da postoji ta stvar davanja i uzimanja.
0:27:53,0:28:01,"Možda je to kao Coolware, gdje nije nužno samo transakcija u kojoj vam dajem novac, a vi mi dajete proizvod."
0:28:01,0:28:03,Postoji takva vrsta odnosa.
0:28:03,0:28:05,"Da, i mislim da je to ono što volim misliti o tome."
0:28:06,0:28:13,"Mislim da je Peacock na ovom mjestu dvadeset i sedam godina, pa su ga ljudi koristili dugo vremena."
0:28:13,0:28:20,"I znate, postoje ljudi koji ga koriste i koji nisu rođeni kad je izašao, što je uznemirujuća stvar za razmišljanje."
0:28:20,0:28:33,"Ali, da, postoji neka vrsta, pokušavate, znate, neću vas prevariti i, znate, dajem vam lijep proizvod po poštenoj cijeni."
0:28:33,0:28:36,I ljudi vas onda nekako poštuju zbog toga.
0:28:36,0:28:44,"I, da, možete dobiti ovakvu vrstu, znate, neku vrstu simbiotičkog odnosa, mislim."
0:28:45,0:28:48,"Da, ne, definitivno to vidim."
0:28:49,0:28:53,"To je kao da, ako niste u svijetu, sve što govorite vjerojatno zvuči vrlo klišejski."
0:28:53,0:29:06,"Vjerojatno bi mi to zvučalo klišejski prije nekoliko godina, ali znam točno o čemu govorite i to je kao čudna stvar zajedničkih odnosa između tvoraca i korisnika."
0:29:06,0:29:19,"Da, i to je bilo tako i u ranim danima, znate, jer, kao i sa svim ovim stvarima, mogli ste samo poslati poruku e-pošte ljudima koji su pisali softver i mogli ste razgovarati s njima."
0:29:19,0:29:26,"I kao kad sam radio na drag stvari, što mislim da nisam rekao što je to bilo, ali znate, to je bilo neka vrsta prebacivanja aplikacija i pokr, pokretanje ili dokumentiranje."
0:29:27,0:29:35,Bilo je još tri ili četiri osobe koje su radile na prilično dobro cijenjenim sličnim proizvodima i razmjenjivali bismo kôd.
0:29:35,0:29:42,"Znate, ako je netko izmislio kako nešto učiniti, bilo je kao, oh, kako prikazati ovu određenu ikonu ili učiniti ovakvu stvar?"
0:29:42,0:29:44,"Znate, dijelili bismo tu informaciju."
0:29:45,0:29:49,Nije se to radilo na teritorijalan način.
0:29:49,0:29:55,"Dakle, znate, poznavao sam sve te ljude i neki su radili i za Apple, kako se pokazalo."
0:29:55,0:30:00,"Da, tako da je tada bilo ugodno osjećaj zajednice i mislim da još uvijek postoji ugodna zajednica."
0:30:00,0:30:03,Razlika je u opsegu toga.
0:30:03,0:30:26,"Danas je tako velik da vjerojatno ima stotine razvijača koji su, znate, vrlo vješti i koji izlažu stvarno dobre aplikacije o kojima jednostavno ne znam jer ih nisam susreo i, znate, mislim da je teško za ljude da se nekako probiju u to, ali razlika je u tome što se tamo događa toliko toga."
0:30:27,0:30:37,"Da, mogu reći kao netko tko nije bio dio toga na početku ove godine ili mislim prošle godine, ovisno o tome kada izađe ovaj epizoda, a sada imam osjećaj da sam bio."
0:30:37,0:30:39,se u potpunosti prihvatio u ovoj zajednici.
0:30:40,0:30:42,To je kao da je to noć i dan.
0:30:42,0:31:19,"A za mene je to bilo tijekom WWDC-a, kao potpuno ne-kalifornijski promatrač na Twitteru, ovo je bio prvi put da sam počeo tweetati i odgovoriti ljudima, a sve se brzo razvilo jer su svi bili uzbuđeni zbog istih stvari, a ja sam slučajno radio na nečemu i ljudi su jednostavno iznimno korisni s vremenom i rekli su: Možda, znate, kao što kažete, ljudi bi mi doslovno slali kôd, recimo, ovo je mali pomoćnik koji sam napisao da riješim ovaj problem ili nešto slično."
0:31:20,0:31:33,"I pokušavam učiniti isto sada, ali stvarno je divno kad se na neki način probijete u taj skupinu razvijača iOS-a na Twitteru jer postoji sve to zajedničko."
0:31:34,0:31:35,Da.
0:31:35,0:31:43,"I kad je prvi put izašao SDK za iPhone, bilo je slično, znate, osjećaj granice."
0:31:44,0:31:46,I puno ljudi dijeli savjete.
0:31:47,0:31:49,"I to je kao, i mislim, danas."
0:31:49,0:32:13,"Mislim, u današnje vrijeme apsolutna razlika je u tome što ljudi iz Applea na Twitteru dijele stvari, znate, i možete saznati, oh, ovo je osoba koja je bila na pozornici u WWDC-u i imam njihov adresu e-pošte ili znam tko je na Twitteru i mogu im postaviti pitanje i, znate, ponekad su poprilično zauzeti jer imaju puno stvari za raditi, ali ponekad ljudi će odgovoriti i reći, oh, ne, vjerojatno biste trebali to učiniti ili bilo što drugo."
0:32:14,0:32:20,"Da, imao sam Ari, voditelja ne radi, radnog tijeka, već skratnica."
0:32:20,0:32:20,Da.
0:32:20,0:32:27,"Jednom je odgovorio na tweet koji sam napisao i bio sam malo sarkastičan i osjećao sam se loše.še jer sam bila nešto poput: Oprostite, znam da radite na tome."
0:32:28,0:32:32,"I, da, očito je jako zauzet, ali uzimao je vremena da kaže: Ovo bi trebalo funkcionirati."
0:32:32,0:32:33,"O, možda to neće funkcionirati."
0:32:33,0:32:35,Vratit ću se timu.
0:32:35,0:32:36,I to je bila divna interakcija.
0:32:37,0:32:37,Da.
0:32:37,0:32:55,"I, i, uh, bilo je nešto poput toga da sam se započeo s podcastovima, znate, što se čini relativno nedavno za mene, znate, vjerojatno je bilo 2014., što je, mislim, sada pet godina."
0:32:55,0:32:56,Da.
0:32:56,0:33:02,"Ali, znate, mislim da je to bilo nešto poput toga da je stvarno pokrenuo iOSuo zajednicu."
0:33:02,0:33:16,"I znate, od kada sam se uključio u podcasting i postao više vidljiv lice, znate, moj, moj, ne želim upotrebljavati riječ zvijezda jer točno to mislim."
0:33:16,0:33:26,"To je strašna, strašna stvar jer je kao da nitko ne zna tko sam izvan iznimno male mjehuriće."
0:33:27,0:33:39,"Ali to je vrsta podcastinga i pokušaj da se malo više uključim u ljude u zajednici i znate, stvarno mi je pomoglo.lo u profilu."
0:33:41,0:33:48,"I sada sam u uvodnom dijelu, rekao si da nitko ne treba biti upoznat sa mnom."
0:33:49,0:33:53,"I slušao sam to i pomislio, Bože, to je zastrašujuće."
0:33:54,0:33:58,"I ja sam pomislio, A, nikad ne želim vjerovati vlastitom bučnom stresu."
0:33:58,0:34:03,"Jer u trenu kad pomisliš, oh, da, ja sam velika stvar, izgubio si je."
0:34:03,0:34:03,Da.
0:34:04,0:34:12,"Ali, da, to je bilo čudno putovanje posljednjih pet godina jer je Picasso učinio stvarno dobro."
0:34:12,0:34:33,"Mislim da je jedan od incidenata koji je potaknuo to bio kada je Peacock imao widget za obavijesti, a Apple ga je vrlo kratko zabranio, rekavši da je to bilo 2014."
0:34:33,0:34:35,"godine, kada su se prvi put pojavili widgetovi."
0:34:35,0:34:41,Kao da sam bio predstavljen u trgovini aplikacijama za ovaj widget kao sjajan primjer widgeta za obavijesti.
0:34:41,0:34:49,"Također su mi rekli da ga moram ukloniti jer je, znate, protivio različitim smjernicamaice."
0:34:50,0:34:54,Uzeo su je iz trgovine ili vam nisu dozvolili da podnesete nove verzije?
0:34:54,0:34:58,U to su vrijeme rekli da imam tri tjedna da uklonim tu značajku.
0:34:59,0:35:02,"Da, ili će srušiti verzije ili srušiti aplikaciju."
0:35:03,0:35:08,"I znate kako Apple kaže, znate, trčanje do tiska nikad ne funkcionira."
0:35:08,0:35:08,Da.
0:35:09,0:35:10,To nije istina.
0:35:10,0:35:10,Da.
0:35:11,0:35:18,"Mislim, to je nešto što se može učiniti samo, nikad ne biste trebali trčati do tiska kao prvo."
0:35:19,0:35:21,Trebali biste pokušati razgovarati s ljudima.
0:35:21,0:35:25,"Pa, to je kao što ste ranije rekli, dobra volja je kapital."
0:35:25,0:35:26,Kapital koji možete izgraditi i potrošiti.
0:35:27,0:35:27,Da.
0:35:27,0:35:29,I trčanje u tisak je potrošnja tog dobronamjernog kapitala.
0:35:30,0:35:30,Da.
0:35:30,0:35:34,"U ovom slučaju, posebno s Appleom, ali čini se da je to važan dobronamjerni kapital."
0:35:34,0:35:34,Da.
0:35:34,0:35:38,"Mislim, stvar je u tome da Apple nije kao jedna osoba."
0:35:38,0:35:38,Da.
0:35:39,0:35:45,"Znaš, pa postoje ljudi u inženjerskom timu koji, znaš, vide ono što ste izgradili i misle da je sjajno i stvarno su podržavajući."
0:35:45,0:35:49,A onda postoje ljudi u drugom timu koji možda ne žele da nešto funkcionira onako kako funkcionira.
0:35:50,0:35:56,"I znaš, pa postoji mnogo različitih skupina unutar Applea i svi imaju potpuno različite mišljenja o stvarima."
0:35:58,0:36:00,"Ali da, u to vrijeme, kao što sam rekao, ja."
0:36:00,0:36:05,"Znate, podigao sam neku vrstu žalbe i to je odbijeno."
0:36:06,0:36:11,I rekli su mi da se to pod nikakvim okolnostima neće promijeniti.
0:36:12,0:36:15,I tako nisam ni namjerno trčao u tisak.
0:36:16,0:36:25,"Nekako sam o tome objavio na Twitteru jer sam bio, znate, bio sam prilično ljut jer sam puno radio na pisanju ove stvari."
0:36:26,0:36:33,I bilo je vrlo teško jer mislim da je u tom trenutku bilo nekakva granica memorije od 64 megabajta ili nešto slično za widgete.
0:36:33,0:36:37,I tako sam radio na svemu ovom radu da ga pokrenem u maloj.
0:36:37,0:36:39,U malom prostoru koji sam imao.
0:36:40,0:36:46,I tako sam o tome tweetovao na mrzovit način i ti su tweeti zapravo postali viralni.
0:36:46,0:36:52,"I mislim, znam neke ljude u tisku i bili su dovoljno ljubazni da retweetaju stvari."
0:36:52,0:37:02,"Dakle, znate, dobio je pokrivenost, a onda je dobio još više pokrivenosti, a onda je dobio pokrivenost do te mjere da je, znate, spominjano u tiskanim novinama ili nešto slično."
0:37:02,0:37:02,Bože.
0:37:04,0:37:09,I dobio sam poziv otprilike četrdeset osam sati kasnije ili nešto u tom stilu.
0:37:09,0:37:10,Ne mogu se sjetiti točne vremenske crte.
0:37:10,0:37:14,"Bio je prilično kratak, ali su u osnovi re sam rekao: Sve je u redu."
0:37:16,0:37:27,"I to je bilo, mislim, vrlo smo se dobro snašli zbog sve publiciteta, znate, to je nekako učinilo Peacock vidljivijim."
0:37:27,0:37:29,Ali nije bilo vrijedno stresa.
0:37:30,0:37:38,"Znate, često razmišljate, znate, protiv sam se tvrtke koja je, znate, odgovorna za cijeli moj život."
0:37:38,0:37:39,U redu.
0:37:39,0:37:46,"Ne želim ih razljutiti, ali ne mislim da imam druge opcije."
0:37:46,0:37:48,"Pa, mislim da sam imao druge opcije."
0:37:48,0:37:55,"Mogao sam ih samo povući.kao, ali nisam mislio da je to točno jer je Apple napravio vlastiti widget za obavijesti kalkulatora na Macu."
0:37:55,0:38:03,"Dakle, mislio sam da je to dovoljno dobro za Mac, očito je dovoljno dobro za iOS da ima ove vrste interaktivnijih widgeta, što je bio problem s njima."
0:38:03,0:38:13,"Ali, da, taj incident me je pomaknuo u središte pozornosti."
0:38:14,0:38:16,Od tada je bilo nekoliko stvari.
0:38:17,0:38:25,Pokušao sam biti razuman član zajednice i pomoći ljudima.
0:38:25,0:38:33,"Uvijek mislite da možete učiniti više jer imam platformu, pa je to nešto poput toga da bih trebao učiniti nešto dobro s njom."
0:38:33,0:38:40,"A s widgetom, bilo je kao da sam ušao u vrata i otvorio ih za druge ljude."
0:38:40,0:38:52,"Pa, ovo mi se podsjeća na ljeto ili neposredno prije izlaska iOS-a 13, razvijač Allegoryja, aplikacije za bilježenje bilješki, imao je problema s aplikacijom Catalyst?"
0:38:53,0:38:54,Ne sjećam se pojedinosti.
0:38:54,0:38:58,Samo se sjećam da je odbijen iz nekog čudnog razloga.
0:38:59,0:39:00,I on je stvarno dobar razvijač.
0:39:01,0:39:09,"I, znate, ima prilično dobru publiku, ali mislim da ste vi bili taj koji ste ga podigli svaki put kad ste retweetali i rekli: Eh, ovo treba pogledati."
0:39:09,0:39:10,Ovo je prilično velika stvar.
0:39:11,0:39:13,I to je eksplodiralo na sličan način na koji govorite.
0:39:13,0:39:14,Da.
0:39:14,0:39:15,Mislim da to nije samo ja.
0:39:15,0:39:20,Mislim da postoji zajednica razvijača koja pokušava brinuti o sebi.
0:39:20,0:39:20,Mislim.
0:39:21,0:39:25,"I, znate, ljudi bi to učinili za mene i ja bih to učinio za druge ljude."
0:39:26,0:39:37,"I, a posebno kad je riječ o nekoj sumnjivoj odluci u trgovini aplikacijama ili nešto slično, znate da je to vjerojatno samo netko."
0:39:38,0:39:45,tko je vrlo strog prema pravilima i to nije zapravo namjera pravila ili nešto slično.
0:39:45,0:39:50,"I mislite, dobro, ako ovo postane malo vidljivije, proći će kroz lanac i sve ostalo."
0:39:50,0:39:55,"Ali, znate, druga stvar je da ne želite, to je nuklearna opcija."
0:39:55,0:39:57,"Da, da, točno."
0:39:57,0:40:04,I sam sam znatiželjan jer sam siguran da je ovaj podcast o tome kako je lansirati nešto.
0:40:05,0:40:13,"I tako mislim da je ovo primjer nečega gdje se kontroverza može dobro prodati, zar ne?"
0:40:13,0:40:18,"To može podići vaš profil, možda čak i povećati prodaju ili bilo što drugo, ali očito postoji neka vrsta troška za to, zar ne?"
0:40:18,0:40:32,"Ili se osjećate kao da, dok ste opravdani, što ste u ovom slučaju očito bili, nije bilo previše negativnih reakcija, osjećali ste li da ste morali popraviti neke odnose s određenim ljudima u Appleu ili je bilo sasvim u redu?"
0:40:32,0:40:40,"Ne, mislim, pa su jedini ljudi s kojima sam ikad razgovarao bili inženjeri koji su uvijek bili vrlo podržavajući ono što sam radio."
0:40:41,0:40:48,"Mislim da su te odluke donesene na nekoj vrsti više, znate, razine marketinga proizvoda."
0:40:49,0:40:51,Ne znam zna li Phil Schiller tko sam.
0:40:51,0:40:52,Pretpostavljam da je čuo moje ime.
0:40:53,0:40:55,Što mislite da je njegova pjesma na zaslonu o tome?
0:40:57,0:41:08,"Pa, mislim da sam večno zahvalan Philu na još jednom što sam dobio Peacock u pakiranju s originalnim iMacom Angle Poise."
0:41:09,0:41:09,Wow.
0:41:10,0:41:23,To se dogodilo jer je bilo međunarodno sastanak na WWDC-u i Phil je bio ondje i radio je u sobi razvijača.
0:41:23,0:41:34,"Razgovarao sam s njim iim i objasnila mu što sam radila, dala mu posjetnicu i rekla: Znate, ako želite besplatnu kopiju moje aplikacije, javite mi i ja ću vam je dati."
0:41:35,0:41:42,"A on mi se obratio i rekao mi je: Znate, može li Phil dobiti serijski broj?"
0:41:42,0:41:44,A ja sam rekla: Naravno.
0:41:44,0:41:58,Nakon nekog vremena dobila sam poruku e-pošte u kojoj se kaže da bismo to željeli spojiti s nadolazećim uređajem i za određenu naknadu.
0:41:58,0:42:01,"Naknada nije bila velika, ali je bilo mnogo primjeraka."
0:42:01,0:42:01,"Dakle, znate, mi smo to učinili."
0:42:01,0:42:04,Nisam znao da su ikad uopće u pakiranju stavili aplikacije trećih strana.
0:42:04,0:42:11,"Da, u ranim danima, pogotovo u ranim danima macOS-a, kada nije bilo toliko aplikacija."
0:42:14,0:42:20,"Sustavi kalkulator bio je vrlo, vrlo osnovni, nalik na onaj iz ranih klasičnih Mac dana."
0:42:22,0:42:26,"Dakle, zapravo su to radili i za svako područje."
0:42:27,0:42:30,"Znate, drugačiji kalkulator je u pakiranju stavljen u Francusku i slično."
0:42:30,0:42:34,"Mislim da je to zato što su imali francusku lokalizaciju, a mi nismo."
0:42:34,0:42:35,Ili nešto slično.
0:42:36,0:42:46,"Znate, postojala je takva vrsta ugovora i na kraju su se ugovori sklopili i Apple je napisao svoje stvari, ali i dalje je bilo lijepo imati, znate, godinu dana autorskih naknada za to."
0:42:46,0:42:49,I to nije bilo malo.
0:42:50,0:42:55,"Dakle, znate, ja, ja, ja, ja, ja, ja se jako volim prema Philu."
0:42:56,0:42:58,Ne znam što on osjeća prema meni.
0:43:00,0:43:08,"Ali mislim da sam imao stvari poput, bio je još jedan podcast na kojem sam bio, znate, debug Rennieja Richieja i Guya Englisha."
0:43:08,0:43:09,"U redu, znam ih."
0:43:09,0:43:10,Ali ne znam podcast.
0:43:10,0:43:20,"Pa, podcast je prestao prije nekoliko godina., ali bilo je slično intervjuiranju programera u razgovornom stilu, slično ovome."
0:43:24,0:43:28,"I ispričao sam razne priče o tome, a znate, neke koje možda ne bih trebao."
0:43:29,0:43:41,"A posebna priča je, pa druga pozadinska priča je da sam kasnije u Appleu nastavio raditi na macOS-u X Docu."
0:43:41,0:43:44,Proveo sam osamnaest mjeseci na tome.
0:43:45,0:43:47,Je li to zbog drag stvari?
0:43:47,0:43:55,"Jer, da, očito postoji ve da su povezivanja i prije Dock-a i macOS-a 10 nije postojao koncept takvog Dock-a, zar ne?"
0:43:56,0:43:58,"Da, mislim da je to bila kombinacija stvari."
0:43:59,0:44:19,"Bilo je kao da je Next imao Dock i većina inženjerskog upravljanja došla je iz Next-a u to vrijeme, pa su htjeli i Dock za Mac, ali DragThing je spomenut kao jedna od stvari u dokumentu za dizajn kao moguća inspiracija."
0:44:20,0:44:21,Znali su tko sam.
0:44:21,0:44:22,Da.
0:44:22,0:44:30,Tako sam na tome radio iz Cork-a i bio je to super tajni projekt.
0:44:31,0:44:39,Steve Jobs je saznao i bio je iznimno nezadovoljan što se na super tajnoj značajci radi izvan Kupertina.
0:44:39,0:44:58,"I tako je poznata njegova izreka koju koristim u gotovo svakom predavanju koje sam dao, da govori s mojim šefom, šefom šefa, s rečenicom: I žao mi je ako ćete morati to ignorirati."
0:44:59,0:45:04,Saznalo mi se da je inženjer koji radi na pristaništu u Irskoj.
0:45:05,0:45:29,"Tako je to bilo početak, uh, uh, uh, rekli su mi da se preselim u Cupertino ili nešto drugo, a ja sam rekao ne, uh, i to je trajalo neko vrijeme, a na kraju sam dobio drugi ultimatum da se preselim i rekao sam ne, a rekli su mi, dobro, ako se ne preselite, uh, odvesti ćemo vas s pristaništa i Finder-a i nikad više nećete dobiti zanimljivije poslove."
0:45:31,0:45:32,I podnio sam ostavku.
0:45:32,0:45:32,Ouch.
0:45:33,0:45:38,Jer mi se to činilo kao šikaniranjeantaža u to vrijeme.
0:45:38,0:45:39,I nisam htjela živjeti u SAD-u.
0:45:39,0:45:41,Bila je to razlog zbog kojeg sam bila u Europi.
0:45:42,0:45:45,Tako sam ispričala tu priču.
0:45:45,0:45:51,"O, posljednji dio priče je da su nekoliko tjedana nakon što sam podnijela ostavku otpustili sve ostale u Cork."
0:45:52,0:45:53,"Dakle, oh, čovječe."
0:45:53,0:45:58,U osnovi su planirali zatvoriti tim i htjeli su da se preselim u Cork.
0:45:59,0:46:01,U Kaliforniju.
0:46:01,0:46:03,Ali nisu mi rekli da planiraju zatvoriti tim.
0:46:04,0:46:10,"Dakle, samo su mi dali ultimatum misleći da će moja reakcija biti, recimo, da, molim te."
0:46:12,0:46:12,I nisam.
0:46:13,0:46:16,"Da sam ostala nekoliko tjedana više, dobila bih naknadu za otkazivanje."
0:46:17,0:46:17,Da.
0:46:17,0:46:33,"Tako sam ispričala ovu priču i na WWDC-u prije tri, četiri godine razgovarala sam s Craigom Federicem jer sam ga vidjela na nekoj sjednici ili bilo gdje i pomislila sam, dobro, pozvat ću ga."
0:46:35,0:46:45,"I u to vrijeme izmislila sam ove male značke s ikonom aplikacije Peacock i davala sam ih ljudima na konferenciji i pomislila sam, dobro, želim mu jednu dati."
0:46:46,0:46:49,I otišla sam do njega i predstavila sam se.
0:46:49,0:46:53,"i, znate, objasnio tko sam."
0:46:54,0:46:56,I počeo sam pričati neku priču.
0:46:56,0:47:00,"A on je rekao: Da, čuo sam da pričate tu priču na podcastu."
0:47:00,0:47:01,"O, čovječe."
0:47:01,0:47:07,"I bio sam poput te vrste straha, dobro, postoji samo jedan podcast koji može biti."
0:47:10,0:47:16,"I siguran sam da sam rekao stvari koje, znate, nisu bile u potpunosti povoljne Appleu."
0:47:16,0:47:18,"Ali, znate, bio je stvarno ljubazan."
0:47:19,0:47:25,"I to je samo takav trenutak, znate, trenutak sinkronizacije srca, kao da ovaj tip zna tko sam."
0:47:26,0:47:28,"To je sjajno, ali i zastrašujuće."
0:47:29,0:47:41,"Stvarno je smiješno kako mislimo da postoji ogromna Appleova zajednica, podcastovi i blogovi i sve to, a to se čini tako odvojeno od Appleove crne kutije."
0:47:41,0:47:48,"I to je kao da ne možemo vidjeti unutra, ali uvijek zaboravljam da oni mogu vidjeti van i vjerojatno konzumiraju sve isto što i mi."
0:47:48,0:47:53,"Da, i čuo sam ljude da to doslovno kažu, da slušaju sve iste podcaste kao i mi."
0:47:53,0:47:54,Znaju sve.
0:47:54,0:47:57,Samo ne mogu se uključiti i komentirati stvari.
0:47:58,0:48:00,"I znate, mislim da ste vidjeli stvari poput."
0:48:02,0:48:09,"Mislim da je Connected bio na jednom od glavnih izlagača, a mislim da je ATP bio napao zbog nečega drugog."
0:48:09,0:48:11,"Znate, to je nešto što znaju tko smo."
0:48:12,0:48:24,"Mislim, to je opet malo zabrinjavajuće, ali mislim da pričate s ljudima, znate, ponekad će ljudi doći do vas."
0:48:25,0:48:32,Ako sam stvarno frustriran i vi govorite loše o nekoj tehnologiji na Twitteru jer ste udarali glavom o neku API i ne radi.
0:48:32,0:48:37,"I znate, stvar koju stvarno ne biste trebali učiniti jest reći."
0:48:37,0:48:41,Rekli su da su ljudi koji su to napisali glupi ili nešto slično.
0:48:41,0:48:41,Da.
0:48:41,0:48:46,"Jer vas možda prate na Twitteru ili, znate, netko im možda ističe."
0:48:46,0:48:52,"I to je kao da sam u toj situaciji, ne bih htio da ljudi kažu, znate, stvari na kojima radim su loše."
0:48:52,0:49:04,"I to se dogodilo nekoliko puta i, znate, to vas uvjerava da ne biste trebali, znate, postoje stvarni ljudi koji pišu sve ovo i imaju iste osjećaje i stvari koje imamo mi."
0:49:05,0:49:08,To ih čini ljudskima kad god zapravo čujete od osobe.
0:49:08,0:49:08,Da.
0:49:09,0:49:13,"I, znate, ponekad ćete nekoga upoznati prije nego što ode na Apple."
0:49:13,0:49:17,"Idu u Apple, pa znate, možda imate neku vrstu veze s njima."
0:49:17,0:49:21,"I znate, ljudi u Appleu neće, ehm, curiti stvari."
0:49:21,0:49:23,"Mislim, dobro, općenito mi to ne curiti."
0:49:25,0:49:32,"Ali znate, ljudi će, ljudi će se možda obratiti i reći, ehm, vjerojatno biste trebali to učiniti umjesto toga."
0:49:32,0:49:39,"Ili, znate, ako kažem, imam ovo, naišao sam na ovo stvarno loše probleme, evo broja za pogrešku i objavit ću to na Twitteru."
0:49:39,0:49:46,"Ponekad vam ljudi pošalju DM i kažu, da, sada ćemo to razmotriti i obavijestit ćemo vas, nešto u tom stilu."
0:49:46,0:49:48,"Dakle, kao što kažete, to je taj kapital."
0:49:49,0:50:09,"i mislim da je to ono što je ključna stvar u našoj maloj zajednici, pokušati ga pametno potrošiti i dobiti, ne znam, to je čudna stvar, razmišljati o tome u nekom financijskom smislu."
0:50:10,0:50:14,Ali to je poput mjerača energije u nekoj RPG-u.
0:50:14,0:50:19,Morate izgraditi ovu energiju i koristiti je kada je to mudro učiniti.
0:50:20,0:50:24,A način na koji je možete izgraditi jest biti dobar član zajednice i pokušati.
0:50:24,0:50:27,I pokušavajući pomoći ljudima što je više moguće.
0:50:28,0:50:33,"I znate, ponekad imate ljude koji žele više pomoći nego što im možete dati."
0:50:33,0:50:46,"I znate, trebali biste pokušati na lijep način reći, znate, ova dokumentacija mi je zaista pomogla, znate, ovaj uzorak koda je dobra stvar za pogledati, takve stvari."
0:50:47,0:50:49,"Ali, da, to je lijepo mjesto."
0:50:51,0:51:01,"I znate, razvoj se ogromno promijenio od kada šaljem softver na disketama."
0:51:01,0:51:13,"i učitavanje na FTP poslužitelje, sada kada imate, znate, trgovine aplikacijama i sve se promijenilo u smislu trgovine."
0:51:13,0:51:20,Sada je stvarno teško prodavati aplikacije i činilo se relativno lako prije dvadeset pet godina.
0:51:20,0:51:25,"Sigurno ste se natjecali s manje, ali je i manji tržište, zar ne?"
0:51:25,0:51:29,"Da, mislim, da, ali to je vrsta velikog ribnjaka, mali ribnjak."
0:51:30,0:51:30,Da.
0:51:30,0:51:36,"Znate, možete biti aplikacija za dokumente ili aplikacija za kalkulator jer ih ima samo oko deset."
0:51:38,0:51:42,"Da, to nije slučaj sada, osim ako ne dođete do nečega zaista originalnog, ali to je."
0:51:43,0:51:44,I nema ništa zaista originalno.
0:51:44,0:51:44,Da.
0:51:45,0:51:58,"Mislim, sjećam se, ne mogu se sjetiti, to je bilo u vrlo ranim danima trgovine aplikacijama i netko je imao ukulele i ja sam pomislio, pitao sam se postoji li aplikacija za tuner za ukulele."
0:51:58,0:52:00,"I znate, ima ih oko deset."
0:52:00,0:52:11,"I tako je teško pronaći nišu, ali s druge strane, znate, možete napraviti nešto dobro i učiniti to dobro."
0:52:12,0:52:13,"Mislim, to nije tako."
0:52:13,0:52:23,"Mislim da to ne jamči uspjeh, ali mislim da je velik dio mog uspjeha posljedica sreće i toga da sam na pravom mjestu u pravo vrijeme i da sam dugo vremena bio u blizini."
0:52:23,0:52:27,"Znate, nema ništa što pomaže u uspjehu kao prethodni uspjeh."
0:52:27,0:52:38,"I mislim da postoji taj dobar kapital o kojem stalno pričamo, kao da ste član zajednice koja je mnogo doprinijela, ili barem mogu reći to iz svoje perspektive, jer doista nikad prije nisam razgovarao s vama."
0:52:39,0:52:47,Moj dojam o vama uvijek je bio da ste super dobar programer koji je bio stvarno aktivan u zajednici i koristan.
0:52:47,0:52:49,"I tako kad god nešto objavite, kao što je."
0:53:24,0:53:32,"Iz toga je došlo nekoliko stvari, jer mislim da Peacalk ima, mislim da mogu reći, pomalo složen zaslon o tome."
0:53:32,0:53:35,"Da, vjerojatno bismo to trebali objasniti vrlo brzo."
0:53:36,0:53:44,"Ponovno, vjerojatno gotovo svi već znaju ovo, ali aplikacija za kalkulator Peacalk, vrlo dobra aplikacija za kalkulator i izgleda lijepo, ali na kraju dana radi svoj posao."
0:53:44,0:53:57,"Izgleda kao aplikacija za kalkulator, ali usmjerili ste svu svoju kreativnost i sve složenije vještine fizičkog motora u zaslon o tome."
0:53:57,0:53:59,Je li to počelo na Macu ili je to počelo na iOS-u?
