Start (HH:MM:SS),End (HH:MM:SS),Segment
0:54:00,0:54:01,Pokušavam se prisjetiti.
0:54:02,0:54:06,Mislim da sam to radio istovremeno.
0:54:07,0:54:10,"Razvijao sam ga za izdanje tog godine, za Mac i iOS."
0:54:10,0:54:15,"Dakle, imao sam ga uglavnom na svim platformama dok sam ga razvijao."
0:54:15,0:54:22,"Mnogo je lakše razvijati ga na Mac strani, samo zato što simulator tada nije podržavao i 3D grafiku."
0:54:22,0:54:29,"Da, ali mislim da bih preporučio da ljudi pogledaju pozadinu toga."
0:54:30,0:54:36,Imala sam predavanje pod nazivom Ilustrirajuća povijest uskršnjih jaja.
0:54:37,0:54:37,Da.
0:54:37,0:54:43,"To je razlog zbog kojeg sam to htjela učiniti, ali to se odnosi na Apple i na igre i puno toga."
0:54:44,0:54:46,"Ali, stavit ću poveznicu na to u bilješke o emisiji."
0:54:47,0:54:57,To sam učinila na NS North u Montrealu i ponovno na konferenciji Hacking with Swift Live u Bathu.
0:54:58,0:54:59,Mislio sam da ću reći ove godine.
0:54:59,0:55:00,"Da, bilo je ove godine."
0:55:00,0:55:02,"Da, vrijeme je bilo čudno."
0:55:02,0:55:04,"Da, čini se da je to bilo davno."
0:55:04,0:55:19,"Ali, ta je rasprava u neku ruku ušla u pozadinu zašto sam to učinila, ali počela je kao da želim naučiti kako to raditi 3D grafiku, želim naučiti kako raditi AR i želim naučiti kako raditi sve fiziku."
0:55:19,0:55:25,"I to je bilo, znate, pokušati naučiti nove stvari jer je to stvarno korisna vještina."
0:55:26,0:55:30,"I to je jedna od stvari za koje koristim PCalc, znate, postoji nova tehnologija."
0:55:30,0:55:35,To je kao da postoji razuman način na koji mogu integrirati ovo u PCalc da naučim kako to funkcionira.
0:55:35,0:55:44,"I tako sam zapravo nastavio razvoj posljednjih, znate, bilo kakvih tridesetak godina da radim stvari, naučio sam stvarajući stvari."
0:55:44,0:55:48,"I tako, ovo o kutiji, dobro, mislim da samo trebate."
0:55:48,0:55:50,Mislim da je to nešto što morate vidjeti sami.
0:55:51,0:55:56,Niste se dovoljno duboko upoznali dok niste pronašli helikopter i dvorac.
0:55:57,0:55:58,"Da, nisam došao do toga."
0:55:59,0:56:12,"Ali mislim da je u tome nešto, u toj aplikaciji o zaslonu, što mogu reći barem anegdotalno, zbog čega sam kupio vašu aplikaciju jer je to nešto poput virusne stvari."
0:56:12,0:56:25,"Čak i prije nego što sam se uključio u razvoj iOS-a, znao sam da je Peacock popularna aplikacija za kalkulator i da ima ovu ludu stvar s velikih uskrsnih jaja u svojoj aplikaciji o zaslonu."
0:56:25,0:56:25,Da.
0:56:25,0:56:30,"Kada je izašla, dobio sam recenziju na Mac Storiesu koja je bila recenzija o tome."
0:56:30,0:56:34,Bilo je vrlo glupo.
0:56:34,0:56:37,"Ali, znate, mislim da je to bilo nekoliko stvari koje su se rodile."
0:56:38,0:56:42,"I bilo je kao da, znate, 2016."
0:56:42,0:56:47,"nije bila sjajna godina na više razina, znate, i ovdje i u SAD-u."
0:56:47,0:56:50,"Znate, bilo je puno političkih previranja."
0:56:50,0:56:54,"I znate, moje mentalno zdravlje nije bilo sjajno iz više razloga."
0:56:55,0:56:58,"I bilo je kao da, učinimo nešto zabavno."
0:56:58,0:57:00,Radim na aplikaciji.
0:57:01,0:57:09,"I znate, radim sve stvari s kalkulatorom, ali neka, znate, napravim nešto drugačije i nekako, znate, neka kreativna energija malo teče."
0:57:11,0:57:19,"I znate, uvijek sam pokušavao staviti malo svoje osobnosti u svoje aplikacije, ali ovo je bilo nekako, očito je malo previše."
0:57:19,0:57:23,Kao da sam angažirao skladatelja koji je snimao glazbu za Apache.
0:57:23,0:57:37,"U svakom slučaju, radio sam sve ove stvari s 3D-om i jedna od drugih stvari koje sam radio za zabavu, kao što je podcast Incomparable koji ste spomenuli, jedna od stvari koje smo radili ove godine je da sam igrao Dungeons."
0:57:37,0:57:57,"and Dragons putem interneta s puno ljudi, znate, kao što su Mike Hurley, Tiff Farmer, Jason Snell, znate, to su ljudi koji su poznati u Appleovoj zajednici, ali koji nisu tako dobri, rade i druge stvari za zabavu."
0:57:57,0:58:13,"I tako, znate, Jason ima ovu mrežu pod nazivom Incomparable i ima puno podcastova o pop kulturi, a Mike je želio igrati DD jer je mladi Whippersnapper i bio je živ kad je DD."
0:58:13,0:58:15,i D postao popularan prvi put.
0:58:16,0:58:25,"Tako smo postavili, postojao je podcast pod nazivom Total Party Kill, koji je samo uživo snimanje nas, ljudi koji igraju D i D."
0:58:26,0:58:32,Tako je skupina okupila se da to učini i počeli smo ga igrati.
0:58:32,0:58:45,Mislim da je to rekao Jason: Iznenađen sam što niste ništa napravili s poliedralnim kockama na zaslonu O nas ili napravili aplikaciju za to.
0:58:45,0:58:52,"Jer su u zaslonu O nas bile šesterostrane kocke i bilo je puno stvari., ali mislio sam, ah, to je zanimljivo."
0:58:53,0:59:07,"Dakle, malo sam prototipizirao kod u zaslonu o kojem možete baciti stotine kockica i to će ispravno izračunati ukupnu količinu kockica."
0:59:08,0:59:13,"Dakle, bacite pet stotina slučajnih kockica i pogledajte ukupnu količinu."
0:59:13,0:59:17,"I pomislio sam, dobro, vjerojatno bih mogao pretvoriti ovo u proizvod."
0:59:18,0:59:25,"Dakle, dao sam si tjedan dana da napravim aplikaciju jer sam zapravo napravio dvije aplikacije, a to je PcalControl."
0:59:25,0:59:25,Što je to PKL ugovora.
0:59:25,0:59:26,Ali to sam htjela pitati.
0:59:26,0:59:32,Bilo je li još nešto između toga ili je ovo vaš prvi put da pokrenete aplikaciju od devedesetih?
0:59:33,0:59:36,"Pa, novu aplikaciju koja nije bila prijenosna."
0:59:36,0:59:37,"U osnovi, da."
0:59:38,0:59:46,"Mislim, to je kao da sam radila nešto drugo i očito stvari za Apple, ali da, mislim da je to bilo devedesetih."
0:59:47,0:59:51,"Dakle, da, od tada je bilo kao da su to bile dvije stvari na kojima sam radila."
0:59:52,0:59:56,"I pomislila sam, dobro, znate, većina mojih aplikacija ima dvadeset pet godina."
0:59:57,0:59:58,Što mogu učiniti u tjednu?
0:59:59,1:00:00,"Dakle, sjela sam."
1:00:00,1:00:15,"Bio je to nevjerojatno optimističan vremenski okvir, ali sam dobio prototip koji je radio u tjednu i moj je rok bio da ćemo igrati DD u subotu i htio sam imati aplikaciju koju bih mogao dati ljudima koji su igrali."
1:00:16,1:00:22,A onda sam proveo još tjedan poliranja i isporučio je u trgovini.
1:00:22,1:00:27,"Dakle, prošlo je dva tjedna od izrade novog projekta u Xcodeu do isporuke."
1:00:27,1:00:37,"I da, dio koda došao je s zaslona o njemu, ali velik dio je bio samo, znate, mislim da Scene Kit ne radi puno posla umjesto vas."
1:00:38,1:00:39,"Dakle, to sam objavio."
1:00:39,1:00:41,sam to i onda je to bio uspjeh.
1:00:42,1:00:50,"I kao što kažeš, to je zato što su ljudi znali tko sam i, znaš, objavljujem tweet o tome i ljudi će ga gledati iz znatiželje."
1:00:50,1:01:00,"A onda sam učinio sljedeće: postoje ljudi, članovi koji sponzoriraju podcastove Incomparable."
1:01:01,1:01:05,Postoji kanal u privatnom Slacku na koji možete pristupiti ako postanete član.
1:01:06,1:01:09,Trebam reći da biste trebali postati član Incomparablea.
1:01:10,1:01:17,I zapravo sam taj kanal pretvorio u svoje beta testerce.
1:01:17,1:01:18,Da bismo nas testirali za aplikaciju.
1:01:18,1:01:21,I ljudi su mi govorili: Bilo bi sjajno da to može učiniti.
1:01:21,1:01:23,Ili: Bilo bi sjajno da to može učiniti.
1:01:23,1:01:28,Ili: Igrajem ovu vrstu RPG sustava i bilo bi dobro da to možete učiniti s kockicama.
1:01:28,1:01:41,"I zabavno je bilo više igrati se s 3D grafikom i raditi stvari poput: Želim napraviti, znaš, temu kockica koja izgleda kao pulsirana crvena lava ili nešto slično."
1:01:42,1:01:42,I to je zabavno.
1:01:42,1:01:46,"Vidio sam da je John Gruber tražio i posebnu temu, zar ne?"
1:01:46,1:01:47,"Pa, ne, prigovarao se."
1:01:48,1:01:50,Prigovarao se da sam upotrebljavao Ariel kao font.
1:01:51,1:01:52,"Oh, to je točno."
1:01:52,1:01:53,Naravno da je to bio font.
1:01:54,1:01:55,"Znaš, pokušavaš li me ubiti?iti?"
1:01:55,1:02:02,"Dakle, izmislio sam, zapravo sam implementirao komplet kockica Daring Fireball u pravim bojama."
1:02:03,1:02:04,I on se žalio na zabavu.
1:02:04,1:02:10,"Ali, znate, još nisam to isporučio, ali to je na mom popisu stvari koje moram učiniti kao glupo."
1:02:12,1:02:14,"I tako, znate, uložio sam u to vrijeme i to je bio uspjeh."
1:02:14,1:02:22,"Mislim, to je, to je, znate, to je kao da je PCalc moja dnevna aplikacija i to je moja aplikacija za večeri i vikendove."
1:02:23,1:02:27,"I to je bilo korisno, znate, jer sam je prenio na Catalyst."
1:02:27,1:02:33,I razlog zbog kojeg sam to učinio bio je taj što je to bila dovoljno mala aplikacija i htio sam vidjeti što Catalyst može učiniti.
1:02:33,1:02:39,"Bio sam sposoban i znate, PCalc je bio taj testni aplikacija kad sam bio, recimo, glavni je bio drag."
1:02:40,1:02:42,A sada je testna aplikacija Dice.
1:02:42,1:02:50,"Mislim da Dice nikad neće preuzeti i biti moj glavni izvor prihoda, ali znate, to je, to je, to je lijepa mala bonusna, uh, plaćanja."
1:02:50,1:02:57,"Uh, i znate, uložio sam više truda u to nego što sam trebao, stvarno, za, za, ali to je vrsta onoga što radim."
1:02:58,1:03:01,"I to je jedan od prednosti biti indie, zar ne?"
1:03:01,1:03:01,Da.
1:03:01,1:03:06,"Mislim, to je, to je kao da možete donositi odluke koje nisu uvijek samo temeljene na novcu."
1:03:07,1:03:11,"I da, to je vrsta, to bi vam moglo donijeti društvenu valutu."
1:03:11,1:03:16,"Umjesto stvarnog novca ovaj mjesec, umjesto društvene valute."
1:03:17,1:03:21,Ali možda ćete taj kapital potrošiti za šest mjeseci ili godinu dana.
1:03:23,1:03:27,"Da, to je zabavno, stvarati nešto novo."
1:03:27,1:03:33,"To također znači da kad pričam s nekim i kažu nešto poput: Dakle, izmislio si neke nove aplikacije?"
1:03:33,1:03:40,"I posljednjih dvadesetak godina kažem: Ne, još uvijek radim na kalkulatoru ili to radim."
1:03:42,1:03:44,"I mogu reći: Da, ove godine sam napravio nešto novo."
1:03:44,1:03:45,"Da, to je cool."
1:03:46,1:03:49,"A kad je došlo do stvarnog izlaska, bio si?"
1:03:49,1:03:59,"Mislim da niste bili baš vi, tretirali ste ga više kao stranski projekt nego kao novi proizvod, ali ste li radili neku vrstu marketinga ili pripreme za lansiranje ili nešto slično?"
1:04:00,1:04:03,"Ili je bilo nešto poput: Evo, ljudi, napravio sam nešto cool, znate?"
1:04:04,1:04:16,"Dakle, mislim da sam ga nazvao Dice by PCalk jer sam pokušavao doći do imena i već sam uzimao svaku moguću kombinaciju igre vezane uz kockice ili bilo što drugo."
1:04:16,1:04:19,U trgovini nema nedostatka aplikacija za bacanje kockica.
1:04:19,1:04:23,"I neke su zapravo vrlo dobre, ali, znate, htio sam napraviti svoju."
1:04:25,1:04:27,I nazvao sam ga Dice by PCalk jer.
1:04:27,1:04:31,od Peacock jer je to kao da mogu iskoristiti marku Peacock koju ljudi poznaju.
1:04:31,1:04:38,"Ako ljudi traže Peacock u trgovini, pojavit će se i slično."
1:04:40,1:04:47,"I mislim da sam se na Twitteru rugala o tome i znate, govorilo se o tome na snimkama Total Party Kill."
1:04:48,1:04:50,"Ali one nisu izašle do nakon aplikacije, zar ne?"
1:04:50,1:04:51,"Pa, da."
1:04:51,1:04:56,"Mislim, ako ste bili plaćeni član, mogli biste nas gledati uživo."
1:04:56,1:04:57,Gledali biste nas.
1:04:58,1:05:05,"Pa, vrijeme snimanja, imamo još jednu sesiju, ali mislim da će sve biti gotovo do iz."
1:05:06,1:05:06,Da.
1:05:06,1:05:09,"Ali opet, poveznica u bilješkama emisije."
1:05:09,1:05:13,Također možete vidjeti moje Lego umjetnine koje sam napravio za svaku epizodu.
1:05:13,1:05:14,"Da, da."
1:05:14,1:05:20,"Eh, što je još jedna, to je još jedna, evo kreativnog izlaza, eh, za nešto glupo."
1:05:20,1:05:28,"I mislim da je to važno, pogotovo ako ste nezavisni, eh, ili možda pogotovo ako radite, eh, za veliku tvrtku."
1:05:28,1:05:37,"Da, gotovo bih rekao da je to važnije ako, eh, radite, mučite se kroz, eh, normalne radne sate, radite na nečemu što nije vaša kreativna vizija."
1:05:38,1:05:38,Da.
1:05:38,1:05:47,"Mislim da je važno vježbati te kreativne mišiće, čak i ako je to nije nešto što vam nužno donosi mnogo novca."
1:05:47,1:05:53,"Mislim, znate, nemojte raditi samo gluposti jer morate zaraditi novac."
1:05:54,1:05:54,Dobar je točka.
1:05:55,1:06:02,"To je kao, znate, devedeset posto razumno, deset posto glupo ili neka vrsta, znate, mjerne jedinice poput te."
1:06:02,1:06:07,"Da, Peacock vjerojatno ne bi bio super uspješan da je samo zaslon o tome."
1:06:07,1:06:12,"Da, mislim, da bih to učinio kao igru, nitko ne bi bio brinuo jer je u zaslonu o tome kalkulatora."
1:06:12,1:06:13,To je glupo.
1:06:13,1:06:14,To je maštovito.
1:06:14,1:06:15,Zabavno je.
1:06:15,1:06:25,"Znate, ljudi su poput, da, ne mogu vjerovati da, da, dobro, recimo da je to pun veliki postotak veličine paketa aplikacija o zaslonu."
1:06:26,1:06:31,"I znate, jer je to glupo."
1:06:32,1:06:36,"I znate, igra u njoj neće brinuti Nintendo ni na koji način."
1:06:37,1:06:42,To je samo malo vožnje automobilom i skupljanje zlatnih banana u malom gradu.
1:06:42,1:06:45,Nisam pokvarila neke iznenađenja.
1:06:45,1:06:50,"Ali, u svakom slučaju, to nije, znate, to nije dobra igra."
1:06:51,1:06:57,"Ali, to je, to je, to je, to je, to je, to je, to je, to je, to je, to je, to je, to je, to je, to je, to je, to je, to nije dobro napravljeno."
1:06:58,1:06:59,Ali činjenica da to uopće čini.
1:07:00,1:07:01,Izvanredno.
1:07:01,1:07:02,"Mislim, to je dobar komentar."
1:07:02,1:07:10,Činjenica da se skriva u ovoj zaista vrlo dobroj i dobro poliranoj aplikaciji čini je smiješnom.
1:07:10,1:07:17,"Da, i zato sam je napravio jer je poznato da se usredotočujem na nešto."
1:07:18,1:07:23,Zato postoji četrdeset pet alternativnih ikona koje možete odabrati u PCalcu.
1:07:23,1:07:23,Da.
1:07:24,1:07:36,"Jer, znate, ljudi su me počeli ohrabrivati i bilo je kao, dobro, da, mislim, kao da vaša aplikacija ima više od svojeg udjela alternativnih ikona."
1:07:36,1:07:41,"Da, definitivno znam kakva je iskušenja da sve vrijeme provodim na ikonama, a ne na programiranju."
1:07:41,1:07:47,"Ali imaš tu maštu, reference na podcaste i slično."
1:07:48,1:08:04,"I to je nešto poput toga, ako znaš i gledaš, znaš, dobiješ referencu i to je kao da, znaš, ljudi koji znaju znaju, a ljudi koji ne znaju samo razmišljaju, zašto je ovaj tip napravio sve te ikone?"
1:08:05,1:08:12,"Pa, i nadam se da ako ti to nije stalo, ne znaš ni ne vidiš, to ne umanjuje iskustvo korištenja aplikacije."
1:08:12,1:08:12,Baš tako.
1:08:12,1:08:15,"Da, mislim da je to stvar s Peacockom."
1:08:15,1:08:22,"Morala bi biti solidna, pristojna aplikacija da mi omogući da se izvučem iz nekih glupih stvari koje radim u njoj."
1:08:22,1:08:24,"Ali, da, mislim da je Dice bio to."
1:08:25,1:08:44,"Bilo je kao da se ta glupost isprazni i na, znate, plaćenikov način monetizira napor koji je ulažen u tu 3D stvar i učeći o tome i stvarajući proizvod koji će zaraditi, znate, malo novca i malo proširiti moj portfelj."
1:08:45,1:08:51,"Pa, a vi ste doživjeli A, lansiranje novog proizvoda 2019."
1:08:51,1:08:51,godine.
1:08:51,1:08:51,Da.
1:08:52,1:08:53,I u istoj godini.
1:08:54,1:08:56,"vaš prvi proizvod umro, zar ne?"
1:08:56,1:08:57,Zbog Cataline.
1:08:58,1:09:00,"Dakle, zapravo imate još dva proizvoda, zar ne?"
1:09:00,1:09:03,"Da, to je kao da je jedan unutra, jedan van."
1:09:03,1:09:03,Da.
1:09:03,1:09:14,"Ali morate napraviti i Catalyst, što je definitivno nešto što je za vas važno, potencijalno s Peacockom, jer ne znam jesmo li to spomenuli, ali Peacock je na Macu i iOS-u."
1:09:14,1:09:27,"I tako, potencijalno, ako je Catalyst dovoljno dobar i dovoljno ste udobni u njemu, bilo bi vam od koristi da imate svoju aplikaciju za iOS i aplikaciju za Mac više na istoj bazi koda nego što već jesu."
1:09:28,1:09:28,Da.
1:09:28,1:09:29,I zato sam to učinio.
1:09:29,1:09:31,Zato sam napravio eksperiment.
1:09:31,1:09:38,"Proveli smo eksperimente kako bismo vidjeli gdje je to, koliko daleko možete povući aplikaciju da bude više slična Macu, takve stvari."
1:09:40,1:09:45,"I osjetio sam prednost, znate, gradim iz doslovno iste izvorne jedinice."
1:09:47,1:09:55,"I, dobro, mislim, točno ista izvorna jedinica, znate, kažem to, ali znate, postoje ako, ako, ako, povremeno i neke varijante."
1:09:56,1:10:08,"I koristim isti izvorni model za izradu verzije za sat, što je još jedna vrlo zanimljiva stvar jer je sloj korisničkog sučelja drugačiji, ali cijela 3D stvar je isti kod."
1:10:08,1:10:19,"Dakle, znate, ako dodam značajku na verziju za Mac ili iOS, ona se automatski pojavi u verziji za TV i verziji za sat."
1:10:19,1:10:33,"Dakle, imati ove četiri platforme iz jednog izvora stvarno je lijepo s gledišta razvoja jer, znate, samo ga kompilirajte četiri puta i imate četiri različite aplikacije koje morate učitati."
1:10:34,1:10:36,"Dakle, da, volio bih to učiniti s PCalcom."
1:10:36,1:10:45,"Mislim da postoje neke stvari koje još ne mislim da su sasvim tu, ali nadam se da će to biti moguće u budućnosti."
1:10:45,1:10:46,"Znate, ne mislim da će to biti ove godine, ali možda."
1:10:47,1:10:54,"možda sljedeće godine, jer, znate, ovisi o tome što ćemo dobiti za Catalyst 2.0 s sljedećim izdanjem operacijskog sustava."
1:10:54,1:11:09,"Ako je Apple u osnovi, ako je to točno isto i ne dotaknu ga, onda, da, možda su više usmjereni na brzu korisničku sučelje i ne žele da ljudi ulažu mnogo više novih aplikacija i stvari u to."
1:11:09,1:11:10,"Ali, da, vidjet ćemo."
1:11:11,1:11:13,"To je još uvijek jedna od velikih nepoznanica, mislim."
1:11:14,1:11:23,"Ali, uranjajući u taj svijet, imate neki kontekst koji olakšava skakanje ako se kreću u tom pravcu."
1:11:23,1:11:24,Da.
1:11:25,1:11:28,I napisao sam to i kao blog post.
1:11:28,1:11:35,A onda ljudi pričaju o blog postu i pozivaju vas na podcast da o tome pričate.
1:11:36,1:11:49,"I to je vrsta kruga jer je vrlo teško, mislim, da se stvari vide u trgovini aplikacijama jer, kao što smo rekli, sve već postoji stotinu puta."
1:11:50,1:11:55,I to morate znati sami iz aplikacija za generiranje bijelog šuma.
1:11:55,1:11:56,"Da, ima ih jednu ili dvije."
1:11:57,1:12:02,"Ima ih jednu ili dvije, ali vaša je vrlo profinjena i nekako."
1:12:02,1:12:08,"I možete vidjeti razvijatelja kroz korisničko sučelje, ako razumijete što mislim."
1:12:10,1:12:12,"Dakle, mislim da to pomaže."
1:12:12,1:12:22,"Mislim da pomaže i to što, kao i aplikacija za kalkulator, iako ih već ima milijun u trgovini, ima i iznimno veliku privlačnost."
1:12:22,1:12:22,Da.
1:12:23,1:12:56,"I tako, čak i ako možete dobiti samo mali postotak tržišnog udjela stvarajući nešto jedinstveno, bilo da se približavate s drugačijeg kuta ili više profinjenog ili bilo čega drugog, čak i ako dobijete samo mali postotak tržišta, taj je tržište toliko veliko da je to zapravo jedna od zanimljivih stvari u App Storeu i načinu na koji internet i podcastovi i slično donose zaradu jer ljudi trebaju plaćanje."
1:12:56,1:13:05,"Većina ljudi koji to slušaju zna to, ali ako ne možete zaraditi novac pisanjem nečega, radit ćete nešto drugo."
1:13:06,1:13:16,"Ako imate sreće, uzmete taj posao u Appleu i sve to ostavite jer ne biste mogli zaraditi novac kao samostalni programer."
1:13:18,1:13:22,I nadam se da će ljudi moći živjeti kao samostalni evaluator.
1:13:22,1:13:22,Da.
1:13:23,1:13:35,"Ali to je način na koji netko može, ne mogu se sjetiti, postoji neka izreka koja kaže da u osnovi trebate pet tisuća predanih obožavatelja ili nešto slično."
1:13:36,1:13:41,"Znate, ako radite nešto poput, recimo, da ste Oh, znam točno o čemu govorite."
1:13:41,1:13:43,"To je poput, izgradite, ne mogu se sjetiti što je to."
1:13:43,1:13:44,Ali znam o čemu govorite.
1:13:44,1:13:47,"To je poput, trebate pet tisuća ili određeno broj."
1:13:47,1:13:54,Izgradite svoju aplikaciju za to točno tu grupu i nemojte se brinuti o masovnoj grupi ili slično.
1:13:54,1:13:55,"To je poput bitne stvari, zar ne?"
1:13:55,1:13:56,Da.
1:13:56,1:13:58,I to je isto i za podcaste.
1:13:58,1:14:22,"Ako možete dobiti publiku i skupinu ljudi koji vas žele podržati u onome što radite, putem nekih vrsta Patreona ili članstva ili slično, ili ste YouTube streamer ili bilo što od toga, ne trebate imati milijune obožavatelja, samo trebate imati manji broj ljudi koji su predani, koji vole ono što radite."
1:14:22,1:14:31,"I možda nećete postati bogati zbog toga, ali možda ćete moći imati razumno životno stanje od toga."
1:14:31,1:14:35,Mislim da je to nešto što sam uvijek pokušavao učiniti.
1:14:36,1:14:46,"ne donositi odluke razmišljajući o milijardu ljudi koji imaju račun u trgovini aplikacijama, samo pokušajte pronaći malu skupinu."
1:14:46,1:14:56,"Mislim, kao što je Dice prodao pristojan broj, znate, imao sam brojku u glavi i pomislio sam, dobro, ako mogu prodati toliko, nazvat ću ovo uspjehom."
1:14:56,1:14:57,A onda je prodao više od toga.
1:14:58,1:15:03,"I pomislio sam, oh, sada imam neku vrstu problema jer je to značajan broj ljudi."
1:15:03,1:15:04,Ne mogu samo poslati više aplikacije.
1:15:04,1:15:07,Moram je zapravo podržati i dodati nove stvari.
1:15:08,1:15:09,I to nije loše.
1:15:09,1:15:14,"Dodali ste nešto gdje nakon prve godine Dicea, ako ga niste ažurirali, su ga, ali jednostavno ne radi."
1:15:15,1:15:17,"Ne, ali Apple to radi umjesto vas."
1:15:17,1:15:18,"Da, mislim da je to istina."
1:15:20,1:15:28,"Ali ne želim reći loše stvari o Appleu, ali znate, mislim da je to trošak stalnog napretka sustava operacijskog sustava, zar ne?"
1:15:29,1:15:32,"I, recimo, iOS se kreće mnogo brže od macOS-a."
1:15:33,1:15:40,"Mislim, da, imali smo ovaj događaj na razini izumiranja s aplikacijama s 32 bita ove godine, ali nismo imali jednu od njih dugo vremena."
1:15:40,1:15:51,"I to je uništilo DragThing, kako ste ranije spomenuli, jer je DragThing bila aplikacija s ugljikovim ugljenom i nije zaradila mnogo novca deset godina."
1:15:51,1:16:01,"Da bih ga pretvorio u aplikaciju s 64 bitova, morao bih je potpuno prepisati iz nule, što bi potrajalo dugo i nisam imao vremena za pisanje aplikacija koje su donosile zaradu."
1:16:02,1:16:14,"Dakle, s moje ograničene perspektive, nažalost, morate je pustiti i to je bilo nešto što je bilo velika stvar za mene jer je bilo kao da sam to započeo 1994."
1:16:14,1:16:15,ili nešto u tom stilu.
1:16:16,1:16:18,"To je ono što je sve pokrenulo, zar ne?"
1:16:18,1:16:29,"Pa, mislim, Peacock je bio prvi, ali onda je DragThing postao popularan, a zatim je DragThing nekako opao i kad je IOS počeo, Peacock je imao veliki oživljavanje i sada je moj glavni igrač."
1:16:29,1:16:32,To je svojevrsni glavni izvor prihoda.
1:16:32,1:16:33,Ali uvijek su to bili ti dva.
1:16:34,1:16:39,"Dakle, da jedan od njih nestane, mislim, to je kao da sam ga koristio na vlastitim računalima."
1:16:39,1:16:43,"Dakle, to je nešto poput, ah, dobro, više ga ne mogu koristiti."
1:16:44,1:16:44,Da.
1:16:46,1:16:51,"Ali, znate, dvadeset četiri, dvadeset pet godina je prilično dobar period za komad softvera."
1:16:51,1:16:52,"Da, nije loše."
1:16:53,1:16:58,Ponekad morate nekako pustiti da te stvari nestanu.
1:16:58,1:17:04,"Da, mislim da sam vjerojatno održavao DragThink i održavao ga dulje nego što bih trebao."
1:17:04,1:17:07,Ali ljudi su ga koristili i i dalje je radio.
1:17:07,1:17:19,"Da, to je bio neka vrsta tužnog trenutka, ali imao sam takav, jedan aplikacija se uključuje u zalazak sunca i pojavljuje se nova beba aplikacija."
1:17:19,1:17:22,"Da, može ih biti samo dvije."
1:17:23,1:17:24,"Da, to je Thompsonova pravila."
1:17:25,1:17:28,Mislim da je to Jedi i Sith ili nešto slično?
1:17:28,1:17:28,"Da, da."
1:17:29,1:17:31,"Majstor i učenik, nešto slično."
1:17:31,1:17:31,Da.
1:17:32,1:17:40,"Dakle, nisam sasvim siguran što me to čini u ovoj analogiji, ali da, nemojmo se tu upuštati."
1:17:42,1:17:43,"Dakle, ja ću se dugo zadržati."
1:17:44,1:18:01,"Zaista mi je žao, ali imam još jednu još jedno pitanje koje bih želio postaviti i koje namjeravam postaviti svima, a to je: koja je osoba ili aplikacija u ovoj zajednici, o kojoj smo puno govorili, koja vas je inspirirala i koju biste preporučili drugima da isprobaju, bilo da je to na Twitteru, samo aplikacija ili bilo što drugo?"
1:18:01,1:18:16,"Dakle, na to sam se malo izvukao jer sam razmišljao o Jeffu Mentoru, ovom razvijaču igara, koji je bio potpuni inspirator za mene kad sam počeo programirati."
1:18:17,1:18:21,"I čak i danas, živi na farmi."
1:18:22,1:18:23,"O, čovječe.."
1:18:23,1:18:34,"S četiri ovce, dvije lame, raznim bićima koje je volio cijeli život."
1:18:35,1:18:38,I još uvijek piše igre.
1:18:39,1:18:46,Sad ih piše sa svojom partnericom i napravio je brojne remakeove Tempesta.
1:18:46,1:18:49,Napravio je i vrlo dobru VR igru pod nazivom Polybius.
1:18:50,1:18:58,"I radi na puno stvari, ali to je vrlo, ne možete igrati jednu od njegovih igara i ne znati da je od njega."
1:18:58,1:18:58,"U redu, da."
1:18:59,1:19:01,To je kao da možete sjesti bilo koga.
1:19:01,1:19:10,"tko je igrao jednu od igara za Commodore 64 prije tridesetak godina ispred svoje najnovije VR igre i oni će reći: U redu, ovo je igra Geoffa Menta."
1:19:10,1:19:11,Čovječe.
1:19:11,1:19:21,"Moguće je da je u 3D-u, ali to je kao da čujete glazbu i znate tko ju je napisao, znate, to je kao da je to Nintendo."
1:19:22,1:19:24,"Da, mislim da je to taj stil."
1:19:24,1:19:32,"To je kao da možete čuti glazbenika, možete vidjeti umjetnika, znate stil onoga što rade."
1:19:33,1:19:38,I to je kao da je radio ovo već tri desetljeća.
1:19:38,1:19:42,"I, znate, radi stvari po svom nahođenju."
