Start (HH:MM:SS),End (HH:MM:SS),Segment
1:19:42,1:19:46,"I, znate, tvrtke su ga spalile i imao je sve te neuspjehe."
1:19:46,1:20:03,"I radio je na aplikacijama za iOS i trenutačno je jako protiv iOS-a i Applea jer je, znate, pokušavao prodavati igre u trenutku kada je zapravo dno tržišta za prodaju igara na iOS-u pala."
1:20:03,1:20:05,I tako je doživio ozbiljnu opeklinu.
1:20:07,1:20:11,I zapravo je samo preinačio sve svoje igre za iOS u VR igre.
1:20:14,1:20:15,I fascinantan je tip.
1:20:17,1:20:22,"I samo pratim ga na Twitteru, znate, nekoliko sam puta komunicirala s njim i rekla da sam ga jednom upoznala."
1:20:22,1:20:28,"On nema pojma tko sam, ali kao inspiracija za, da, mogu to raditi."
1:20:29,1:20:37,Mogu biti čudan i pokušati napraviti nešto što kaže da sam ja.
1:20:37,1:20:42,"I znate, ljudi se čini da na to reagiraju."
1:20:42,1:20:45,"I znate, ima iznimno predane obožavatelje."
1:20:45,1:20:51,"Znate, postoje forumi na kojima ljudi duboko raspravljaju o njegovom radu i slično."
1:20:53,1:20:54,I živi u Walesu.
1:20:57,1:21:01,Preporučujem da svaki dan uživo emitira hranjenje ovaca.
1:21:02,1:21:02,To je sjajno.
1:21:03,1:21:04,Je li na Twitteru?
1:21:04,1:21:05,"Da, na Twitteru je."
1:21:05,1:21:08,Mislim da je to Lamasoft Ox.
1:21:08,1:21:08,U redu.
1:21:08,1:21:12,Pobrinut ću se da ga pronađem i uključim u bilješke o emisiji.
1:21:12,1:21:14,Njegova tvrtka je Lamasoft.
1:21:15,1:21:20,"Znate, fiksacija na stavljanje životinja u igre postoji od samog početka."
1:21:22,1:21:39,"I da, mislim da to nije nužno relevantno za zajednicu iOS-a, ali relevantno za mene kao nekoga tko je to radio doslovno nadahnuo sve što sam učinio."
1:21:40,1:21:40,Ali to je savršeno.
1:21:41,1:21:54,"To je jedna stvar koju pokušavam učiniti i ovom emisijom, ne želim da se na njoj pojavljuju samo programeri aplikacija, iako je to vjerojatno glavna publika, jer mislim da se može naučiti mnogo toga i pronaći mnogo inspiracije izvan industrije u kojoj se nalazite."
1:21:54,1:21:57,"I tako, ovo zvuči baš kao takav scenarij."
1:21:57,1:22:07,"Kao da ne radi baš aplikacije za iOS, ali je vrsta osobnosti i način na koji se predstavlja i vodi svoj posao ono što je za vas inspiracija."
1:22:07,1:22:10,"I to se prenijelo u vaše djelo, iako to nisu iste stvari koje radite."
1:22:10,1:22:11,Da.
1:22:11,1:22:41,"Da, i mislim da je jedna od stvari koju sam primijetio, koja je zapravo smiješno plitka, ali sada nekako pratim ljude, recimo da postoji komičar koji mi se jako sviđa, znate, pratite ga na Twitteru i možda se povremeno s njim razgovarate i shvatite da su ljudi, znate, svi ljudi koji rade sve ovo, znate, svi su ljudi."
1:22:42,1:22:49,"I ovo je nekako čudna otkrića, znate, imati, ali znate, mogli biste razgovarati s nj njima."
1:22:50,1:23:00,"Znate, možda su previše zauzeti da vam se obratite, pogotovo s ljudima koji su, znate, vrhunski AAA, bilo kakvi, koji imaju stotine milijuna sljedbenika."
1:23:02,1:23:02,Da.
1:23:03,1:23:12,"Ali znate, ljudi rade sjajne stvari, znate, na srednjoj i, znate, na vrsti indie stripova, postoji ogromna scena indie stripova."
1:23:12,1:23:27,"A ako idete na bilo koji od, recimo, ComicCona u Glasgowu, bit će sve te ljude koji rade svoje stvari i, znate, sami ih objavljuju ili što god, koji su unajmili mali stol na ComicConu i pokušavaju širiti informacije."
1:24:04,1:24:08,Riječ je o pokušaju pronalaženja svih tih različitih kreativnih stvari.
1:24:08,1:24:27,"Mislim, da, do određene mjere usredotočeni ste na razvojnu stranu stvari, ali pokretanje nečega poput pokretanja novog stripa ili pokretanja glazbe ili bilo čega od ovih stvari ima određenu količinu sličnosti."
1:24:27,1:24:32,I siguran sam da je u svim tim industrijama koje su jednako važne teško primijetiti se.
1:24:34,1:24:38,Ali svaka industrija vjerojatno je došla do različitih stvari koje svi rade.
1:24:39,1:24:43,Kao što svi razvijatelji aplikacija vjerojatno će se obratiti istim nekoliko radova ili web-mjesta.
1:24:43,1:24:46,"ili, ehm, ehm, ehm, web-mjesta, blogovi i radit će određene stvari na Twitteru ili bilo gdje."
1:24:47,1:25:00,"Ali ako razgovarate s nekim poput web stripova ili nekim tko radi na YouTube kanalu ili kratkim filmovima, možda će imati potpuno drugačiji skup ideja, od kojih možete potpuno ukrasti neke za razvoj aplikacija koje drugi programeri aplikacija već ne rade."
1:25:00,1:25:06,"I tako, to je vrsta stvari koju se nadam da ću moći učiniti ako mogu uvjeriti neke ljude da dođu."
1:25:07,1:25:15,"Da, ne, mislim da bi to bilo stvarno zanimljivo i da to nekako dobijem."
1:25:15,1:25:21,"Mislim, posebno scena za razvijatelje neovisnih aplikacija gdje ljudi nose mnoge kape jer to nije samo pisanje."
1:25:21,1:25:22,aplikacije.
1:25:22,1:25:25,To je kao da vjerojatno radite manje od pedeset posto.
1:25:25,1:25:25,Da.
1:25:25,1:25:34,"Radi se o tome da pišete aplikaciju, ali pokušavate i promovirati aplikaciju i pružate tehničku podršku aplikaciji."
1:25:34,1:25:35,I vi ste dizajner.
1:25:36,1:25:43,"Znate, dizajner, možda sami crtate ikone, možda ne, ali možda legalno."
1:25:44,1:25:47,"I da, bio sam i ja u tome, vjerujte mi."
1:25:50,1:25:56,"To je puno toga, mislim, to je još jedna stvar u kojoj, da, neću se u to upuštati."
1:25:57,1:25:59,"Da, već sam prešao na vašem vremenu."
1:26:36,1:26:40,"Neka netko o tome govori, znate, i to je stvar."
1:26:41,1:26:47,"Ponekad ljudi dođu k meni i kažu, znate, što je tajna vašeg uspjeha?"
1:26:47,1:26:47,Ne znam.
1:26:48,1:26:57,"To je kao da, doslovno, osjećam, znate, postoji određena količina sindroma lažnog čovjeka."
1:26:58,1:27:05,"Napisao sam nekoliko članaka, mislim da su na mojem blogu o sindromu lažnog čovjeka."
1:27:05,1:27:17,"I postoji određena količina, ne znam kako mi još uvijek ide dobro i zamišljam da će me netko u bilo kojem trenutku otkr kao prijevarnik koji sam očito."
1:27:17,1:27:28,"I znate, ovo radim dovoljno dugo da bih trebao shvatiti da vjerojatno zapravo znam što radim i da vjerojatno sam prilično dobar u onome što radim."
1:27:30,1:27:36,Ali nemam dobra odgovora na pitanje kako postati uspješan?
1:27:37,1:27:42,"Jer možete pogledati, znate, mogu reći, dobro, učinio sam ovo, ovo i ovo i uspješan sam."
1:27:42,1:27:44,"Stoga, koraci moraju biti, učinite ovo, ovo i ovo."
1:27:45,1:27:53,"Ali znate, to nije, znate, možete pokušati nekako obrnuti kako ste postali uspješan."
1:27:53,1:27:58,"I vidite, dobro sam to učinio, pa je to očito ono što je bilo, ali možda nema veze s tim."
1:27:58,1:28:01,I puno toga je sreća.
1:28:01,1:28:15,"Da, prolazila sam kroz nešto slično jer sam došla od toga da nitko ne zna tko sam do objavljivanja prve aplikacije koja je bila prilično dobra, a ove godine sam počela učiti razvoj za IOS."
1:28:16,1:28:17,"Dakle, definitivno nisam stručnjak."
1:28:17,1:28:22,Većina ljudi koji mi postavljaju te pitanja zna mnogo više o svemu ovome od mene.
1:28:22,1:28:26,"I tako imam nešto slično gdje sam poput, ne znam točno što sam učinila."
1:28:28,1:28:31,"I pokušala sam, samo sam napisala blogove doslovno."
1:28:31,1:28:34,Bila sam u stvarnom opisu svega što sam učinila i sada mogu samo ukazati ljudima na to.
1:28:35,1:28:54,"Jedan od mojih odgovora je neugodan, na koji ste se na neki način dotaknuli, a to je da nisam bila zlonamjerna, ali dobila sam nekoliko ljudi da retweetaju moj tweet s tim ikonama aplikacije jer su se odnosili na neke od tih emisija podcastova."
1:28:54,1:28:58,"I dobivši Federica Viticciu, ne znam je li ga retweetao, ali mu se svidio ili nešto slično."
1:28:59,1:29:04,"A kad ste tako mali kao ja, netko poput njega, čak i ako mu se svidio, iznenada vam daje veliki poticaj za profil."
1:29:05,1:29:09,A onda su to napravili još nekoliko ljudi nakon toga ili bilo što drugo.
1:29:09,1:29:21,"Ne volim to govoriti jer je neugodno reći da nisam to učinio namjerno ili zlonamjerno, iako bih lagao da kažem da sam to dodao i da ne mislim, oh, bilo bi tako cool da to vide."
1:29:22,1:29:33,"Ali, recimo, da kažem da je to savjet nekome drugom, netko drugi koji radi isto možda uopće neće raditi jer ako svi počnu to raditi, nema, recimo, noviteta."
1:29:33,1:29:33,"Da, mislim."
1:29:34,1:29:35,Isto je i s vašim zaslonom o njemu.
1:29:35,1:29:40,"Da svi samo napravite zaslon o njemu, baš kao i vaš, onda je to kao, dobro, kakav je to smisao?"
1:29:40,1:29:42,Mislim da bi svijet bio bolji.
1:29:43,1:29:44,To je dobra točka.
1:29:44,1:29:47,"Ali, znate, ali ja točno razumijem što govorite."
1:29:47,1:30:03,"I to je vrsta, ne idite, mislim da s ovim svime ne idite s nekom vrstom izračunavanja, jer onda će ljudi reći da ćete se vrlo, vrlo brzo vidjeti."
1:30:03,1:30:10,"Mislim da možete biti izračunavajući, ali ne znam kako to reći, ali i iskreni, ako to ima smisla."
1:30:10,1:30:10,Da.
1:30:11,1:30:27,"Jer, recimo, ako radite stvari s namjerom da, recimo, ovo bi moglo postati virusno, možda to nije prava riječ, ali takav koncept, u redu, gdje je to poput, napravit ću nekoliko ovih stvari i nadam se da će jedna od njih nekako popasti i post privući pozornost od prave osobe."
1:30:27,1:30:28,I to bi mi moglo biti stvarno dobro.
1:30:28,1:30:34,"To ne znači da je to gnusno ili da pokušavate biti manipulativni ili nešto slično, mislim."
1:30:34,1:30:46,"Ali s druge strane, nemojte samo kopirati ono što netko drugi radi ili hraniti kontroverzu u tisku ili nešto slično ili pokušati kultivirati lažni odnos s tiskom, mislim."
1:30:47,1:30:47,Da.
1:30:48,1:30:53,I mislim da je to kao da morate biti iskreni u stvarima koje radite.
1:30:53,1:30:57,I mislim da ljudi na to reagiraju.
1:30:57,1:31:02,"I mislim da morate, pogotovo kad imate posla s tiskom, opet se vraćati na to da su ti ljudi ljudi."
1:31:03,1:31:03,Da.
1:31:04,1:31:07,I dalje ih zovemo novinarima kao da je to New York Times ili nešto slično.
1:31:07,1:31:10,"Ali obično je to, ovo je, znate, osoba."
1:31:11,1:31:11,To je Federico.
1:31:11,1:31:12,To je Mike.
1:31:12,1:31:12,To je Jason.
1:31:13,1:31:13,To je Marco.
1:31:14,1:31:14,To su ti ljudi.
1:31:15,1:31:20,"I, i, znate, mislim da ne boli reći, napisao sam ono što mislim da je cool stvar."
1:31:21,1:31:30,"Znate, pošaljet ću, znate, pošaljet ću poveznice na to, znate, ovim ljudima koje slušam na podcastovima koje stvarno poštujem ili što god."
1:31:30,1:31:32,"I, znate, puno ljudi to radi."
1:31:32,1:31:33,"Dakle, to je vrlo teško."
1:31:33,1:31:41,"Mislim da je i za ljude, znate, jer ja, znate, nisam u toj situaciji, ali zamišljam da dobiju stotine."
1:31:41,1:31:54,"e-poštama dnevno u kojima se kaže: Da, svi s kojima sam razgovarao kažu: Eh, trebao bi poslati neku vrstu tiskovne kutije, poveznicu s malom opisom e-pošte i to bi trebao poslati svima."
1:31:54,1:32:02,"I, znaš, možda ćeš poslati doslovno četrdeset e-poštama i ako dobiješ jednu natrag, učinio si stvarno dobro, kao da si imao sreće i dobro si radio."
1:32:02,1:32:03,Da.
1:32:03,1:32:05,"Ali ako ne dobiješ nikakvu natrag, nemoj se zbog toga osjećati loše."
1:32:05,1:32:06,"Da, točno."
1:32:06,1:32:13,Jer mislim da mnogi od tih ljudi ne mogu odgovoriti na sve.
1:32:14,1:32:19,"Često će se stvari pročitati i ako nešto privuče njihovu pozornost, onda znaš."
1:32:19,1:32:21,I onda će možda kontaktirati vas ili nešto slično.
1:32:24,1:32:27,"Ali Twitter je pakao, ali je i iznimno koristan."
1:32:27,1:32:27,Da.
1:32:28,1:32:41,"Mislim da možete imati nešto poput tehnologije poput skratnica ili katalizatora ili bilo čega, a ako to napišete i objavite na Twitteru i netko ga retweetne, možda će to dobiti i određenu popularnost."
1:32:41,1:32:57,"I ljudi će reći: Da, pokušavao sam nešto učiniti, naišao sam na neke greške u katalizatoru i tražite, a Steve Troughton Smith objavio je blog post o ovoj konkretnoj stvari u katalizatoru."
1:32:57,1:33:01,Ili je još jedna osoba koju bi ljudi očito trebali provjeriti i pratiti.
1:33:01,1:33:02,"Da, definitivno."
1:33:03,1:33:24,"I znate, postati poznatiji je postupak koji se ne može prisiliti, ali, znate, ponekad ako imate nesreću i nema odbijanja u Apple App Storeu, možda ćete postati malo poznatiji brže nego što očekujete."
1:33:25,1:33:26,To je ponekad dobra stvar.
1:33:26,1:33:27,Ponekad loša stvar.
1:33:28,1:33:31,"Ali, da, to je postupak."
1:33:31,1:33:35,"Ljudi kažu, znate, kako postati uspješan?"
1:33:35,1:33:39,"I ja kažem, dobro, nabavite stroj za putovanje kroz vrijeme, vratite se dvadeset i sedam godina unatrag, počnite tamo."
1:33:40,1:33:45,I to je najbolji odgovor koji imam jer ne znam kako bih to danas ponovio.
1:33:45,1:33:57,"Znate, da bih započeo iz nule, mislim, kao što ste vi ušli u ovu zajednicu, kao što je to bilo prošle godine, to je, uh, mora biti prilično zastrašujuće."
1:33:58,1:34:09,"Definitivno je drugačiji svijet, uh, ali ima i mnogo više resursa i, znate, više ljudi i različitih ideja koje su lako dostupne zbog interneta."
1:34:10,1:34:13,"Dakle, da, sigurno je to samo popis prednosti i nedostatakaostataka."
1:34:14,1:34:17,Ne znam je li to lakše ili teže ili je to neka čudna kombinacija dvaju.
1:34:18,1:34:32,"Pa, mislim da su stvari koje sam čuo od ljudi koji su napravili iOS i Android aplikacije da iOS aplikacije obično donose više novca samo zato što je to zajednica ili što god."
1:34:32,1:34:41,Ali znam ljude koji su napravili istu igru na obje platforme i prodali su razumnu količinu na IOS-u i ne baš mnogo na Androidu.
1:34:42,1:34:51,"Da, Android je definitivno besplatna igra, poput oglasa ili nekog oblika monetizacije koja nije plaćena unaprijed.."
1:34:51,1:34:51,Da.
1:34:51,1:34:53,To je zapravo neophodno.
1:34:54,1:35:01,"I plaćam unaprijed od samog početka, osim kad je moja stvar bila besplatna ili shareware ili bilo što drugo."
1:35:01,1:35:04,"Ali, znate, iz svijeta iOS-a i App Storea uvijek sam plaćao unaprijed."
1:35:04,1:35:08,"I to je, sada sam neka vrsta iznimke."
1:35:08,1:35:10,Prodajem aplikaciju po deset dolara.
1:35:11,1:35:11,Da.
1:35:12,1:35:20,"Kažem da je Peacock posebno bio neka vrsta inspiracije za mene da kažem, u redu je napraviti aplikaciju s unaprijed plaćenom vrijednošću."
1:35:20,1:35:23,Moja je aplikacija četiri dolara ili pet dolara.
1:35:23,1:35:25,"Trebala bih znati to, ali ne znam."
1:35:26,1:35:29,"Ali, to se činilo nekako."
1:35:29,1:35:38,"Bilo bi zastrašujuće ili bih se nekako izbacila iz grada, ali budući da je to bio moj prvi, nisam htjela proći kroz proces pretplate ili se baviti poslužiteljem ili bilo čim sličnim."
1:35:38,1:35:43,"I vidjela sam Peacock i pomislila sam, dobro, mislim da je to još uvijek nešto i ljudi to posebno vole."
1:35:44,1:35:55,"Ne znam da bih mogla lako izgraditi tvrtku na temelju plaćene aplikacije unaprijed, barem ne sada, ali čini se da je to još uvijek izvediva opcija."
1:35:55,1:35:55,Da.
1:35:55,1:35:58,I Peacock je bio dobar primjer toga.
1:35:59,1:36:01,"Pa, s jedne strane, sretna sam."
1:36:02,1:36:11,"S druge strane, mislim da se nadam da ne postavljam kao inspiracija za ljude., jer mislim da sam čuo ljude koji kažu: O, znaš, bio si mi velika inspiracija."
1:36:11,1:36:13,Ostavio sam stalni posao.
1:36:13,1:36:14,Bože.
1:36:14,1:36:15,"I ja kažem: O, ne."
1:36:16,1:36:24,"Znaš, to je kao da si, znaš, prvo radio na aplikaciji prije nego što si napustio dnevni posao."
1:36:24,1:36:26,"Da, to je zastrašujuće."
1:36:26,1:36:27,To je veliki skok.
1:36:28,1:36:35,"Ali to je bilo, znaš, kao da shvaćaš da imaš određenu odgovornost prema ljudima."
1:36:36,1:36:40,"I da, to je blago zastrašujuće."
1:36:40,1:36:43,"Da, to je stvarno dobar komentar na koji nisam nikad doista razmišljao."
1:36:44,1:36:45,I zato dajem kontekst.
1:36:45,1:36:47,"Zato je, mislim, važno dati kontekst."
1:36:47,1:36:47,Da.
1:36:48,1:36:48,Znaš?
1:36:49,1:36:56,"Da, mislim da ne bih mogao imati isti utjecaj kao što sam imao da bih započeo iz nule."
1:36:56,1:36:58,Ili barem ne na isti način.
1:36:59,1:37:04,"Da, i, znaš, nadam se da bih negdje pronašao posao, ali tko zna?"
1:37:05,1:37:12,I ja sam jako sretan što mogu raditi ono što radim i da mogu raditi puno toga po vlastitim uvjetima.
1:37:12,1:37:23,"Ali, znaš, bomba bi mogla pasti sutra, znaš, ako se Apple okrene i kaže: Odlučili smo da ćemo raditi, znaš, kao što je to."
1:37:23,1:37:30,"Apple Arcade, ali za aplikacije, što je moj veliki strah da će na neki način učiniti nešto slično."
1:37:30,1:37:33,I to je kao da ste u tome ili niste u tome.
1:37:33,1:37:39,"I znate, odlučili smo da ćemo u to staviti ovaj drugi kalkulator koji je malo popularniji ili nešto slično."
1:37:40,1:37:42,I onda će cijeli moj prihod nestati.
1:37:44,1:37:47,"Dakle, znate, takve stvari me drže budnim noću."
1:37:47,1:37:55,"Ali trenutačno, znate, stvari idu dobro i ja ću voziti ovaj vlak koliko god mogu."
1:37:57,1:38:00,"Pa, na tom mjestu, vjerojatno bih vas trebao pustiti."
1:38:00,1:38:00,Hvala.
1:38:00,1:38:01,Hvala vam puno što ste to učinili.
1:38:02,1:38:05,"O, ne, dobro, hvala vam puno što ste me pozvali."
1:38:05,1:38:14,"Mislim, to je nešto poput toga da ne vodimo takve vrste razgovora, znate, između programera i slično."
1:38:15,1:38:23,"Dakle, znate, ako je ovo korisno za nekoga, znate, ako ljudi žele kontaktirati mene, na Twitteru sam James Thompson, Nope i Thompson."
1:38:24,1:38:35,"I, da, želim vam veliki uspjeh s ovim, s ovim nizom stvari i nadam se da ćete moći dobiti bolje gostiće od mene u budućnosti."
1:38:36,1:38:38,To je kao da sam rekao da je to lažna poniznost.
1:38:40,1:38:41,"Da, znam."
1:38:41,1:38:42,"Da, da."
1:38:42,1:38:47,Uspjeh u svemu i hvala vam što ste me pozvali.
1:38:50,1:38:51,Hvala vam što ste slušali.
1:38:51,1:38:56,"Ako vam se emisija svidjela, odmah idite na Apple Podcasts i dajte nam ocjenu i recenziju."
1:38:57,1:39:05,"Ili ako koristite drugi reproduktor podcasta, pritisnite zvjezdicu u Overcastu ili dajte ocjenu u Breakeru ili Stitcheru ili iskreno, bilo čemu što koristite."
1:39:06,1:39:13,Posebno ovaj tjedan pokušavam napraviti što više buke kako bih pokrenuo emisiju i možda privukao malo pozornosti prema njoj.
1:39:13,1:39:17,"A ako želite raspravljati o epizodi, možete me pronaći na Twitteru na underscore.com."
1:39:17,1:39:18,Možete objaviti emisiju na podcrtanju Chuck E.
1:39:18,1:39:18,C.
1:39:18,1:39:20,ili je objaviti na Twitteru na launchedfm.
1:39:21,1:39:30,"Imamo i posebnu podredditu nazvanu launchedfm, na kojem možete raspravljati o emisiji sa mnom, drugim slušateljima, a ponekad će nam se pridružiti i naši gosti."
1:39:30,1:39:37,"Za bilješke o emisiji, kontaktni obrazac ili prijavu za sudjelovanje u emisiji ako imate veliki lansiranje u budućnosti, posjetite launchedfm.com."
