Start (HH:MM:SS),End (HH:MM:SS),Segment
0:30:38,0:30:41,Svi su mislili da je to neki demon jer smo mi njih ono.
0:30:46,0:30:57,"Čak sam jednom to sam jednom napravio, onda sam rekao, ne smij to više, sakrio sam se iza drve te ako skočio i ovaj ovakav je on napravio jer nije smio pričati zbog zavjeta."
0:31:03,0:31:18,"I tu sam ja njih naravno i utješao, neki kažu da im je uspio, neki su svjedočili da, znači naravno bilo lijepo i na kraju je bio taj zadnji dio puta koji su oni prešli, tamo ih je čekao Vigor, nije tu Vigor, Vigor."
0:31:21,0:31:25,I kasnije su išli do logorske vatre gdje smo svjedočili jedni drugima.
0:31:25,0:31:27,Ja sam vidio lica su bila potpuno drukčija.
0:31:27,0:31:38,"Neki su se ohrabrili odmah svjedočoče koliko strahova su se oslobodili, poslije smo se smijali što je bio i cilj jer strahovi su nerealni, možemo im se nasmijati kad ih pobijedi."
0:31:39,0:31:49,"Sve što su mislili da će im se dogoditi nije im se ništa dogodilo, neki su vidjeli jame u koje upadaju, neki su mislili idu u liticu sad, sad ćemo ih, neki su mislili sad će Habuš negdje izletit, isprepadat."
0:31:51,0:31:52,Ali uglavnom ništa se nije dogodilo.
0:31:52,0:32:06,"I onda je zadnji dio radionice bio razmatranje baš straha od smrti, pošto je pored te crkve odmah groblje, mi smo fakatko sekta tad bili, da nas je netko vidio, onda smo uveli ih baš u razmatranje vječnosti i smrti."
0:32:07,0:32:18,"I tamo sam vidio dječake koji su neostrašivi, rasporedili su se po groblju, neki su legli na grobove i bilo, čudno je za vidjeti, ali tada, ja sam znao šta se u njima događa."
0:32:18,0:32:24,"Neki su mi svjedočili baš da tada u tom trenutku da im je bilo svejedno, očumret će."
0:32:25,0:32:27,Znali da ih Isus čeka.
0:32:28,0:32:30,Tako da izađite iz komfort zone.
0:32:30,0:32:40,"Neke stvari će biti, znam da nekima naprimjer teško sjest za volan nakon mnogo godina, ali probajte, jer to su male stvari koje koče velike stvari."
0:32:42,0:32:46,Bog ima velike planove za nas.
0:32:46,0:32:48,Svaki plan Božji je velik za nas.
0:32:50,0:33:00,A vidimo da čak i u Bibliji kad je htio te planove izvršiti da je ono doslovno morao nekad nagovarati tu ekipu koju se mi divimo.
0:33:00,0:33:19,"Vidimo ne znam Jeremija kaže premlad sam, pa Šaul kaže pa ja sam iz Benjaminovog plemena, to je najmanje pleme, pa Ananija kaže pa znaš ti tko je pavao, znaš, morao ih je nagovarati, tako i mi često, nespreman sam, bože, ne malo sam porušan, kako ću ja sad, sad za Ambon."
0:33:22,0:33:25,"Znači to su male stvari, ali tko će velike stvari."
0:33:27,0:33:36,"Izaći iz komfort zone je isto nekima baš ovaj drugi korak, naći prijatelja kojem vjeruješ, nekima je jako teško podijeliti sve emocije."
0:33:36,0:33:38,Neka vam to bude za početak dobra vježba.
0:33:39,0:33:48,Vjerujte ima tu ljudi i zajednica je jako dobra i možemo iznijeti jedni druge.
0:33:48,0:33:49,Ja vjerujem.
0:33:49,0:33:54,"Dolazimo do četvrte točke i zadnje točke, to je moliti za hrabrost."
0:33:56,0:33:57,Sad ću vam objasniti zašto.
0:33:58,0:34:14,"Uglavnom postoje, čitao sam tu baš jednu knjigu koja još na engleskom nije prevedena, nadam se da će uskoro biti, o emocionalno zdravoj duhovnosti i jedan čovjek Bowen, ne znam kako se zove, zaboravio sam, je osmislio jedan pojam koji se zove diferencijacija."
0:34:15,0:34:22,Uglavnom taj pojam označava sposobnost da mi djelujemo po onome što jesmo.
0:34:23,0:34:26,Koliko možemo samostalno djelovati bez pritiska drugih.
0:34:27,0:34:31,I naš cilj je naravno da budemo što bliže Isusu na tom levelu.
0:34:32,0:34:42,"Isus je bio osoba koja je u potpunosti bio samostalan i u potpunosti je djelovao onako kako on želi, nije imao potrebu ni ogovarati druge da opravda sebe."
0:34:43,0:34:47,"Uglavnom on je bio, znao je koje i to mi želimo."
0:34:48,0:34:49,I šta se događa?
0:34:49,0:34:52,"Sad, to ćete vjerojatno svi možete svjedočiti taj dio."
0:34:53,0:35:23,"Kada osoba ili dođe bliže Isusu ili raste na tom stupnju, čak i malo kaže ovaj koji je to gledao samo sa znanstvene strane, da nailazi na otpor drugih, da se taj sistem u kojem on živi od ovih bližnjih ili prijatelja ili često roditelja, svatko može posvjedočiti jednu priču od roditelja, da ima taj ne možda direktno, ali efekt vrati se nazad, želimo te starog."
0:35:26,0:35:31,"I kaže da je taj, da postoje tri stupnja takvog otpora."
0:35:32,0:35:38,"Kaže prvi je naziv rečeniceicom, u krivu si što si se promijenio zato što i sad nabraja."
0:35:39,0:35:40,Često su roditelji takvi.
0:35:41,0:35:44,"Drugi je, promijeni se nazad i prihvatit ćemo te."
0:35:44,0:35:45,To su prijatelji.
0:35:45,0:35:51,"Možda ti ne moraju reći, ali mene su izbacili iz grupe na Facebooku kad sam krenula u zajednicu."
0:35:52,0:35:59,"Onda treći je, ako se ne promjeniš, nazad slijedi i sad ti nabrija, tak, tak, tak, tak."
0:36:01,0:36:03,Jel imate kakvo svjedočanstvo?
0:36:03,0:36:09,"Matija mi je rekao, sad tu mora biti nešto smiješno, ali sad sam, ne znam, sad mama mi je tu pa ne želim."
0:36:11,0:36:18,"Jednom mom prijatelju su rekli kad je krenuo na klanjanje, rekli su pa Sinja šta si ti toliko klanjaš, nisi ti musliman."
0:36:20,0:36:24,"Uglavnom imate komentara, nećete naći na otpor i zato treba molit za hrabrost."
0:36:25,0:36:30,Čak ne samo nećete naći na otpor kod ovih vani.
0:36:30,0:36:36,"Nažalost, često će se dogoditi da taj otpor bude i u crkvi, čak i u ovoj zajednici."
0:36:37,0:36:53,"I baš sam razmatrao jedan tekst, sad je bio nedavno čitanje, djela apostolskih petnaestjedan vidimo što se dogodilo."
0:36:54,0:37:00,"Pavao i Barnaba, Bog im je otvorio put da propovijedaju poganima, to smo realno sada i mi bi bili pogani."
0:37:01,0:37:04,I odmah nailaze na otpor.
0:37:05,0:37:14,"Čak dolaze neki ljudi iz Judeje, inače židovi koji su se obratili i kažu u to neki siđoš iz Judeje i počeš učiti braću."
0:37:15,0:37:19,Ako se ne obražete po običaju Mojsevu ne možete se spasiti.
0:37:21,0:37:23,I molio sam Boga zašto je tako.
0:37:23,0:37:31,"Vidio sam, znam da ti imaju malo i ostataka farizejskog duha i to jednostavno mi je došlo."
0:37:32,0:37:37,Oni su imali srce koje se nije moglo radovati i koje nije moglo prepoznat da je Bog ovdje bio na djelu.
0:37:38,0:37:40,Probudila se čak i zavist.
0:37:43,0:37:48,Kako on može dobiti tu milost a ja sam im morao puno teže dobiti.
0:37:50,0:37:52,Često će se to biti u zajednici jedni među drugom.
0:37:54,0:37:59,kad vidite da netko napreduje jako duhovno probudit će vam se taj osjećaj.
0:38:01,0:38:09,"Ali onda budite ponižni i recite Bože ne želim takvo srce, želim srce koje se tebi može radovati."
0:38:12,0:38:17,"Svim tvojim djelima, ako su djela moje braće super, ja njih ljubim isto kao što si ti ljubio."
0:38:27,0:38:30,Nemojte dopustiti da se to dogodi u našoj zajednici.
0:38:31,0:38:47,"Naravno, Bog je kasnije iskoristio ovu raspravu, kasnije su Pavao i Barnaba išli i utvrdili vjeru kod svih židova i govorili su šta je Bog radio kroz njih i kroz onu raspravu kasnije, Bog će naći način da se proslavi."
0:38:47,0:39:02,Ali previše je stvari koje je Bog htio napraviti bilo neuspješno zato što su se dva voditelja posvađala ili dvije osobe.
0:39:06,0:39:15,"suradnja je nestala, čak ne mora to biti ni u duhovnosti, u poslu, koliko je priča bilo."
0:39:17,0:39:26,"A mi želimo biti oni koji mogu unatoč tome, ako se ne slažeš s nekim, imati dalje bliski kontakt s njim."
0:39:28,0:39:28,To je cilj.
0:39:32,0:39:47,Još na kraju svog kratkog predavanja sam htio reći sad da Emocionalno sazrijevanje i ozdravljenje je na neki način odvojeno od duhovnog života iako jako utječe na njega.
0:39:48,0:39:48,Što to znači?
0:39:49,0:40:02,"Da ne trebate puno, skoro ništa mijenjati svoj dnevni život, svoje obaveze, fakultet, da sad padate u neki stres zbog toga, prva stvar je prihvatiti."
0:40:02,0:40:10,"I onda kasnije moje svjedočanstvo je, emocionalno sazrijevanje skoro nikad nije došlo dok sam ja bio u molitvi i neprestano postio, ne."
0:40:11,0:40:30,"Dogodili su se, išao sam naprijed, za Bogom, gdje sam trebao biti u službi, bio sam poslušan voditeljima i uvijek kroz neku priču ili s Matijom ili s nekim prijateljem ili sa djevojkom ili sa roditeljima, ja sam uviđao gdje imam probleme i polako je Bog to gradio."
0:40:30,0:40:33,"I samo se događa jedan klik ovdje, jedan klik ovdje, jedan klik ovdje."
0:40:34,0:40:42,"Samoća, tišina, malo molitve za hrabrost i otvorenost i prihvaćanje da takvi jeste."
0:40:43,0:40:43,To je to.
0:40:45,0:40:45,Hvala.
