Start (HH:MM:SS),End (HH:MM:SS),Segment
0:00:20,0:00:30,"Evo Nikola je baš lijepo uveo temu, zapravo gospodin me je progovorio baš lijepe i ohrabrujuće riječi za ovu temu današnju, ona je emocionalno zdrava duhovnost."
0:00:32,0:00:36,Zapravo je to vrlo važna tema i posebno je važna za nas.
0:00:38,0:01:04,"Često nam u karizmatskom pokretu i kritiziraju nas da smo previše duhovni, a da radimo svašta, vjerojatno i doma ste imali takva iskustva, ideš u crkvu puno, moliš ovo, ono, ali ja sam i dalje jako ponosa na sve vas i na sebe zbog toga što jesmo i na naš karizmatski pokret, zato što vidim da je to jedan od pokreta koji se usudio ući malo dublje."
0:01:05,0:01:23,"Ja ovu temu nisam radio zato da nam prestanu prigovarati, nego zato što postoji dio istine u svemu tome i zato što ako radimo na našoj emocionalnoj formaciji, Bog nas još više može iskoristiti."
0:01:25,0:01:26,I baš zato sam napravio temu.
0:01:27,0:01:43,"Malo gdje možemo čut o ovim temama, ne znam zašto je to možda zato što se čini malo škakljiva jer većina nas ima svijest i voditelja čak da smo svi nekako emotivno ranjeni i onda se ne osude puno pričati o tome jer i sami imaju problema s tim."
0:01:44,0:02:01,"Ali evo ja ću se usuditi o ovome pričati jer imam evo tripet godine, imam tripet godine iskustva emocionalno nezdrave duhovnosti pa nešto ipak znam."
0:02:04,0:02:07,"Želim da ovo bude ohrabrujuće za vas, znate zašto?"
0:02:07,0:02:13,"Zato što emocije mogu ozdraviti samo u okružu ljubavi, a hvala Bogu mi to ovdje imamo."
0:02:14,0:02:26,"Evo ja sad želim da u vaše srca sjedne ta istina da je Bog vama poslao ljude koji su spremni vršiti njegovu zapovijed, a to je ljubite jedni druge kao što sam ja vas ljubio."
0:02:27,0:02:32,I istina je da svako od vas ima te osobe koje vam mogu pomoći na tom putu.
0:02:32,0:02:46,Pa ćemo i danas malo slušati o tome i prvi korak da bi uopće došli do nekog emocionalno zdrave duhovnosti moramo shvatiti da smo emocionalno nezreli ili nezdravi ili ranjeni negdje i moramo to jednostavno prihvatiti.
0:02:47,0:02:53,"I zato sam ja podijelio prvi dio predavanja u dvije krajnosti, dvije krajnosti u kojima se često nalazimo."
0:02:54,0:02:58,Prva krajnost je zanemarivanje tojest potiskivanje emocija.
0:03:01,0:03:02,Kako prepoznat to kod sebe?
0:03:02,0:03:07,Pa obično takve osobe imaju strah od iskazivanja emocija.
0:03:08,0:03:11,Sam sam više sklon toj krajnosti pa znam dosta o tome.
0:03:12,0:03:30,"Inače još u djetinstvu znamo da smo ranjeni većinom od roditelja, kasnije od vršnjaka, kasnije si to teško priznajemo, nekad se opravdavamo da je to naša narav, ali zapravo ta krajnost ide zbog toga što smo se naučili braniti."
0:03:31,0:03:46,"Kao mala djeca zbog teških situacija, zbog povreda od roditelja odlučili smo se zatvoriti, skupiti u sebe da bi se obranili jel inače ne bi preživjeli."
0:03:47,0:03:51,"Naši roditelji su takvi kakvi jesu, evo moja mama je tu, možda jedan pljesak za mamu."
0:04:00,0:04:14,"Krasna majka inače, ali evo Nažalost, djeca su najbolji promatrači, ali najgori tumači nisu znali."
0:04:15,0:04:25,"Djeca ne znaju da roditelji neke stvari rade iz ljubavi, ali ostanu duboko povrijeđeni i onda još uvijek roditelj nema dovoljno znanja da prepozna to što se kod djeteta događa, nastaju rane."
0:04:26,0:04:30,"Često djeca znaju sama plakati, znaju biti razočarana i nitko im ne može pomoći."
0:04:31,0:04:40,"I na taj način sam ja nekako slično se zatvorio u sebe, prestao sam i plakati, u jednom trenutku sam čak donio i unutarnje zavjete da neću više plakati, da mi više neće nitko povrijediti."
0:04:41,0:04:50,"i na taj način sam ušao u ovu krajnost, a nijedna krajnost nije dobra, kažu i da je Bog uvijek negdje po sredini, da ga uvijek trebamo voditi za ruku i da nas uvijek nešto želi izbaciti iz te sredine."
0:04:52,0:05:01,"Takve osobe duhovnost i emocije gledaju na ovaj način, razmišljaju na ovaj način, možda to nisu rekla, razmišljaju."
0:05:01,0:05:11,Svaka emocija koja se probudi trebaju zanemariti jer ona može smjest da razmišljamo racionalno i prosuđivati duhovne stvari.
0:05:12,0:05:22,"I takva osoba će reći da je negativna emocija, čak i grijeh, a to je sasvim krivo i to uopće nije istina."
0:05:23,0:05:41,"Ali vidimo Isusa, njegov primjer je da je on, inače za sebe kažem da je najemotivnija osoba na cijelom svijetu, Isus u hramu uhvate ga bijes, ali svijet i bijes i reagira je po njemu, porazbacuje tamo sve u hramu."
0:05:42,0:05:57,"Kasnije vidimo da Isus plače, dopušta da ga emocija prožme, čak i djeluje po njoj, suosjeća i po tom suosjećanju ipak odlučuje primit pet tisuća ljudi koji su došli nakon što su oni apostoli bili vrlo umorni i htjeli doći na jedno samotno mjesto."
0:05:59,0:06:05,Znači vidimo pravi primjer i vidimo da je to znači ta krajnost loša.
0:06:09,0:06:14,Druga krajnost je podređivanje tojest prekomjerno prepuštanje emocijama.
0:06:14,0:06:16,Svi znamo i nekog takvog.
0:06:17,0:06:25,"Takva osoba je vrlo eksplozivna, takva je osoba će duhovnost podrediti emocijama i bit će onako kako se osjeća."
0:06:26,0:06:36,"Ako se osjeća dobro i ona će rasti u duhovnosti, raste i u darovima, ali ako se osjeća loše neće nigdje biti, pobjeće na način koja je ona to naučila već u mladosti."
0:06:37,0:06:47,"Takva osoba često donosi puno zavjeta da će krenuti u Bogu, krene jako, ali većinu ne ispuni."
0:06:47,0:06:52,"Često je nedisciplinarana i nepostojana u svim svojim odlukama u duhovnosti, nažalost."
0:06:53,0:06:58,I problem nastane kad ove dvije krajnosti postanu stanje.
0:06:58,0:07:01,Svatko od nas se može nekad naći u jednom od to dvoje.
0:07:01,0:07:04,Ali kad postaje stanje ovo su neki od simptoma.
0:07:04,0:07:07,"Zapravo su vrlo slični, ali negdje ih možemo razdvojiti."
0:07:08,0:07:27,"Nažalost, osobe koje su emotivno nezdrave često su mrzovoljne, često su nesretne i rijetko kad ih vidimo dobrog raspoloženja, često su nepristupačne, ove koje se, koje zanemaruju i potiskuju emocije često su, imam osjećaj kao da su hladni, kao da ne možemo doprijeti do njih."
0:07:28,0:07:34,Osobe koje sve podređuju emocijama često su eksplozivne.
0:07:35,0:07:44,"Znači bojimo im se priči, šta će ona reći, čekamo reakciju, većina ih se boji zapravo i ne želi imati posla s njima."
0:07:44,0:07:50,I zato obje krajnosti dovode do toga da ne možemo uspostavljati dobre kontakte s ljudima.
0:07:52,0:08:07,"Netko će reći da osobe koje su emocionalno zdrave imaju tešku narav, često su pod velikim stresom, one koje su potiskuju unutra, izgaraju sebi, one koje ne potiskuju, vidim se na njima da su pod stresom."
0:08:08,0:08:11,Često zbog toga ne uspijevaju izvršavati dužnosti koje koje trebaju.
0:08:12,0:08:19,"Onaj koji potiskuje često osuđuje drugoga, ali u sebi, u srcu ima negativne misli."
0:08:19,0:08:27,"Onaj koji je emotivno nezdrav na način da se prepušta emocijama, prekomjerno ogovara i govori zlo o drugima."
0:08:29,0:08:35,"Oboje su vredljivi, ali onaj koji zanemaruje ne dopušta da bude ranjiv."
0:08:36,0:08:44,"Jednostavno on misli nikom i ništa ne može i zapravo ulazi u samodopadnost, to je samodostatnost i oholost."
0:08:45,0:08:50,Također i ovaj drugi uvredljiv je i zbog toga se ljudi odmiču od njega.
0:08:53,0:09:03,Ja sam napravio i jedan animaciju gdje bi završile osobe iz jedne krajnosti i drugoj u kojoj bi sekti završile.
0:09:03,0:09:14,"Pa sada vidite, evo kad ne bi došli Kristo a bili bi, previše bi potiskivale emocije, završili bi u ehojnim svjedocima."
0:09:15,0:09:39,"Takve osobe često vide svijet samo crno-bijelo i nemaju nikakvu širinu duha i često su vrlo radikalni, vrlo aktivistički nastrojeni, svaki problem rješavaju nekom novom aktivnosti, dok recimo osobe koje prekomjerno prepuštaju se emocijama, oni bi ušli u New Age ili u Herbalife."
0:09:40,0:09:51,"To je baš ono što osjećaš, to je sve super ako osjećaš ovo, to tako da vodi se svojim osjećajima, zovimo ih nekad i zanje senjaci i oblačići."
0:09:54,0:09:55,Previše si dopuštaju.
0:09:57,0:10:07,"Na taj način se može vidjeti i čak i u nauku crkve gdje se izgubilo, gdje se u nauku otišlo u krajnosti."
0:10:07,0:10:13,U ovom dijelu gdje se previše prepušta uzeli smo samo Krista bez križa.
0:10:15,0:10:30,"Naša vjera je postala na to bazirana da je Krist ljubav, da će nam On sve oprostiti i ne zamišljamo Isusa kao osobu koja je nekad rekla ne ili ne smiješ ili prebila one prodavače."
0:10:32,0:10:41,"Zamišljamo samo kao neku ljubav u kojoj uvijek uz tebe možeš reći šta hoćeš, uvijek ti oprašta i na taj način uzimamo samo Krista."
0:10:43,0:10:47,Ovi druga krajnost tojest prva krajnost uzima samo križ.
0:10:49,0:10:52,Jednostavno je onemogućena zaosjetiti ljubav.
0:10:53,0:11:00,"Slušao sam jedno predavanje od Fultona Šina kako je razdvojio baš na te dvije stvari, križ bez Krista i križ bez križa."
0:11:01,0:11:04,Rekao je da je zapadna kultura ušla u križ bez križa.
0:11:08,0:11:22,"A istok tojest Rusija tojest komunizam uzro je križ bez Krista, aktivizam, sloga i ovo imaju užasne posljedice."
0:11:25,0:11:38,Rekao je čak da će se prije oni koji imaju križ da će im se vratiti Krist na taj križ nego ovi koji imaju Krista da će dobiti križ i to je istina.
0:11:38,0:11:51,"Vidimo ruska pravoslavna crkva se sad i obnnovila, jako napreduje, ali posljedice su bile velike, koliko smrti, logori, koliko gladnih ljudi."
0:11:53,0:12:06,"A danas prevelika opasnost za zapadnu kulturu je baš to, ulazimo u sve moguće duhovnosti, new age, otvoreni svim mogućim zlodosima, nema nikakve granice, nema ništa što ne smiješ."
0:12:11,0:12:15,"Ali evo sad kad sam vas podijelio u sekte, ima i dobra vijest."
0:12:16,0:12:21,"Prvo sam htio reći zašto neki reagiraju na ovaj način, zašto na onaj."
0:12:21,0:12:32,Često se zna dogodi da u obitelji istih roditelja majka tojest brat i sestra potpuno drukčije reagiraju na ponašanje roditelja ili brat i brat ili blizanci.
0:12:33,0:12:34,To je zbog naravi.
0:12:34,0:12:36,Jedino tu uključujemo narav.
0:12:37,0:12:39,Znači reakcija naša ovisi o naravi.
0:12:41,0:12:49,Ja sam recimo imao mirniju narav od svoje sestre i mi smo zapravo na različite načine reagirali na ono što nam se događalo.
0:12:50,0:12:59,"ja sam vjerojatno, ja sam ušao malo u ovu, prvu krajnost, ja mislim da je ona malo u drugu, da, ali isto je."
0:13:01,0:13:15,"Uglavnom, htio sam reći dobra vijest, postoji biblijski primjeri tojest oni junaci kojima se mi divimo danas nadam se u ovoj našoj zajednici koji su također prošli emotivno sazrijevanje."
0:13:15,0:13:20,"To su bili za ovu moju prvu krajnost, moj si je, kako to vidimo?"
0:13:20,0:13:24,To sam ja čitao malo između reda kad je došlo mi to otkrivenje da se pohvalim.
0:13:26,0:13:37,"Vidimo da je moj otac bio ranjen zbog kompleksa tojest zbog mane govora, to tek kada ga Bog šalje da oslobodi narod i da je imao krizu identiteta."
0:13:38,0:13:55,"Prvo je bio malo s majkom pa ga je ona pustila u rijeku, pa opet vratili su ga majci, pa su ga onda kad ga je ona odgojila opet vratili faraonoj kćeri i uglavnom živio između svog naroda, zvali su ga Egipćanin, on se znači nije se snašao."
0:13:56,0:13:59,I kako vidimo da je on bio osoba koja potiskuje?
0:13:59,0:14:12,"Njegova reakcija kad je vidio da netko tuče njegovog, tojest Egipćanin tuče jednog Izraelca koji je bio rob, on je njega ubio."
0:14:13,0:14:18,Vidimo radikalni potez odmah koji je zbog potiskivanja bio preradikalan.
0:14:19,0:14:23,"A druga stvar, prvo je pogledao li ima koga, pa ga je onda ubio."
0:14:24,0:14:28,"A onda poslije kada je skužio da se saznalo, bio je sav uplašen i bježi."
0:14:30,0:14:32,Čist primjer nezrelosti i nezdravosti.
0:14:33,0:14:47,"Drugi primjer je JOSIP najmlađi od jedanaest sinova tada, Jakov sin, on je živio u malo čudnoj obitelji i on spada po mom mišljenju u ovu drugu krajnost."
0:14:48,0:15:13,"Živio je u obitelji gdje je bilo dvije žene, dvije priležnice, sve nešto pomješano ispod jednog krova, teško može tu sazret, vidimo da je Bog zamislio da obitelj bude ovakva kakva je danas i to su bili teški uvjeti, još pogotovo s toga što je njegov otac njega najviše volio, vidno ga najviše volio, čak mu je stao stavljao kičenu, haljenu na nju, dok ostali su to gledali."
0:15:13,0:15:19,I vjerojatno se već u njima tad probudilo i vjerojatno on već shvatio da oni njega ne vole.
0:15:21,0:15:23,I vjerojatno on tad već bio povrijeđen.
0:15:25,0:15:26,I šta se događa?
0:15:26,0:15:39,"Vidimo kad je imao sedamnaest godina, oni su čuvali krave, stoke i poslali Josipu, Josip bi se vraćao i onda bi govorio, piše, Josip je ocu svom donosio zle glasove o njima."
0:15:40,0:15:42,"Znači, ogovarao ih je, govorio im je ružno o njima."
0:15:43,0:15:44,Vjerojatno zašto je bio povrijeđen.
0:15:44,0:15:48,Ali dalje koristio to što ga otac najviše voli.
0:15:48,0:16:00,"I vidimo da je bio nezrel zato što je, nije uopće razmišljao da bi njegovi snovi i njegovi osjećaj veselja i uzbuđenja mogli nekog povrijediti."
0:16:00,0:16:06,"Odmah kad je dobio da u snu da će mu se klanjati braća, odmah bi to podijelio s njima."
0:16:07,0:16:10,"Čak prvi put, odmah piše da su ga zamrzili, još više."
0:16:11,0:16:13,I on opet salje i opet ide u inac.
0:16:14,0:16:15,Znači uopće nije razmišljao.
0:16:16,0:16:24,"E, i onda kreće, Bog se je imao velike planove i to je dobra vijest za vas."
0:16:24,0:16:29,Bog je imao velike planove za obojicu i mi ih danas gledamo kao junake i divimo im se.
0:16:30,0:16:36,Zanimljivo je to što trebate zapamtiti obojice od obojice.
0:16:37,0:16:42,Nijedan od njih nije izgubio svoj osobni odnos s Bogom.
0:16:43,0:16:53,"I tu vidimo da emocije, tojest emocije uopće ne utječu na osobni odnos s gospodinom, čak ne utječu na to je li gospodin radi kroz njih."
0:16:57,0:17:04,"Odmah sad vam kažem da ako ste se već pomalo prepoznali, ne trebate pada tu neko razočarenje i sad da je smak svijeta."
0:17:05,0:17:10,"Ovo je lijepa tema danas, pogotovo kad ja predajem."
0:17:16,0:17:24,"Evo za Mojsija i za Josipa kažu da su bili oni koji su hodali s gospodinom, takvi mi želimo biti."
0:17:24,0:17:27,"Želimo proći tu, doći do emotivne zrelosti."
0:17:27,0:17:31,Ja vam sad nudim četiri koraka kako to možete započeti.
0:17:33,0:17:36,Prvi korak je samoća i tišina.
0:17:37,0:17:42,Vidimo čak i kod Josipa i kod Mojsija da je to bio prvi korak.
0:17:43,0:17:56,"Bog je na svoj način to učinio naravno, Josipa su prodali u roblje i išao je kasnije u tamnicu i morao je proći duži put samoće i tišine, a Mojsije je pobjegao iz svoje zemlje i dugo putovao još četrdeset godina da je bio udaljen od svega svoga."
0:17:58,0:18:05,"Znači evo da Bog ne učini to i nama, ja vam preporučam, odite svojvoljno, svaki dan pomalo u samoću i tišinu."
0:18:07,0:18:18,U duhovnosti je vrlo bitna samoća i tišina i molitva i osluškivanje i to ste vjerojatno sto puta čuli zato što se tu najbolje može čut Boga.
0:18:18,0:18:20,Ali ovaj put ne govorim samo zbog toga.
0:18:22,0:18:30,"Što je sad ako imate, ako hostite da vas Bog zove na novo sazrevanje u emocijama, što je bitno kod te samoće i tišine?"
0:18:31,0:18:37,Bitno je da tad u tim trenucima naučite dopustiti sebi osjećat.
0:18:39,0:18:56,"Zbog vremena u kojem živimo, puno emocija, puno svega što nam se događa, ubrzan način života, ništa se čak ne stigne s leć, naljutiš se, dolazi nešto novo, novi stres, nisi stigao ni procesuirati već je nešto novo došlo."
0:18:56,0:19:02,I naravno da su svi i nekako čudni i nabrušeni stalno kad ne znaš šta se događa s njima.
0:19:02,0:19:15,"I zato je bitno imati u danu vrijeme za koje ćeš ti dopustiti da osjećaš, da čuješ svoje osjećaje, da čuješ svoje snove, svoje želje, ono što ti se sviđa, ono što ti se ne sviđa, da upoznaš sebe."
0:19:15,0:19:19,Jer onaj koji upozna sebe tek onda može biti emotivno zdrav.
0:19:19,0:19:29,"Onaj koji upozna sebe zna i kad zna što mu se događa straha više nema, nema vlasti nad njim jer on zna tad."
0:19:29,0:19:31,Strah ima samo vlast kad nešto ne znamo.
0:19:32,0:19:37,I zato je potrebno to vrijeme u tišini da se naučimo izražavati.
0:19:41,0:19:52,"Svi veći heroji u Bibliji od Mojsija pa do Josipa, pa do Davida, do Isusa imali su to vrijeme samoće, onda vjerojatno moramo i mi."
0:19:52,0:19:53,Eto to je prvi korak.
0:19:54,0:20:13,"Drugi korak, znači samo još da kažem kratko, taj dio može biti u sklopu molitve, naklanjanju, odvoj se malo, danas ako ostiš malo skratim krunicu samo uđi u tišinu na taj način, nećemo vam oduzimati puno dodatnog vremena, razumijete."
0:20:16,0:20:20,Drugi korak je naći prijatelja kome vjeruješ.
0:20:21,0:20:27,Već sam na početku zahvalio dragom Bogu da imamo ovakvu divnu zajednicu i da sad vidite koliko je to jako bitno.
0:20:28,0:20:29,Zapamtite ovu rečenicu sad.
0:20:31,0:20:33,U duhovnosti solo igrači ne uspjevaju.
0:20:34,0:20:39,Nijedan svetac nije postao svetac bez svog duhovnika i to je jednostavno tako.
0:20:40,0:20:40,A zašto je to tako?
0:20:41,0:20:43,Evo možda će vam sada ova priča dočara to.
0:20:44,0:20:54,"Sveti Ivan Kasijan u pet stoljeću živio je, ispričao je jednu priču o jednom pustinjaku, zvao se Hiro."
0:20:55,0:21:14,"I taj Hiro, on je bio zapaljen za Boga i oni su se sastali jednom tjedno, slavili su svetu misu ili kad je bio neki blagdan i on ne bi htio sudjelovati osim ako ne bi ispričao svoje osjećaje, svoje doživljaje kak je on, šta je radio za Boga."
0:21:15,0:21:17,Već se tu vidjelo da nešto nije u redu.
0:21:18,0:21:27,"I jednom je on dobio spoznaju da ga Bog traži da skoči u jamu duboku, da iskuša njegovu vjeru."
0:21:28,0:21:53,"I on to naravno napravi i očekivajući da će ga anđeli uhvatiti pa da pada polumrtav, leži u toj jami i onda kad su ga ovi našli, izvukli su ga i tad dok je bio pred smrt pokušali su ga uvjeriti da to nije bio Božji govor, da su ga to nadmudrili demoni, on ostaje tvrdoglavo uz to."
0:21:55,0:21:57,Samoća je nekad vrlo opasna.
0:21:59,0:22:15,"Prvi je primjer vidjeli smo opasnost zbog pritiska društva, ono što nam se nameće danas, potrebna nam je tišina, a drugo je samoća koja može uzrokovati da nas Sotona nadmudri zbog naše oholosti ili samoobmane."
0:22:19,0:22:43,"Dietrich Bonhofer, to je bio jedan njemački protestant koji je bio za vrijeme borbe protiv nacizma bio jako duhovan, puno ljudi doveo Bogu, rekao je o ovoj temi ovako, osobu koja ne može biti sama čuvajte od zajednice, a osobu koja nije u zajednici čuvajte od samoće."
0:22:44,0:22:49,Trebamo biti zajedno sami tojest zajednica samotnjaka.
0:22:49,0:22:55,I upravo ova tu rečenica mi ove dva koraka prvo lijepo predočuje.
0:22:57,0:23:00,Kakav taj prijatelj kojeg morate naći mora biti?
0:23:01,0:23:15,"Pa zapravo treba biti, to može biti muži, može biti žena, to može biti duhovnik, duhovni pratitelj, ne znam šta sve imamo sad u zajednici, može biti tvojitelj slavljenja, može biti samo ona osoba u koju imate povjerenja."
0:23:16,0:23:22,I još jedan preduvijek da bude zreliji u vjeri od vas ili bar zreo u emotivnom dijelu.
0:23:24,0:23:26,"I kad, kako je to zamišljeno?"
0:23:26,0:23:37,"Nije to zamišljeno da ćete vi sad doći, njemu ćete ispričati svoje osjećaje, sad će on vas utješiti, vi ćete se tu super, vi ste super, vi ste to rekli, on je vas pomazao vam i glavu i uši."
0:23:38,0:23:38,Ne.
0:23:39,0:23:42,Znači tu morate biti sad spremni i čuti istinu.
0:23:42,0:23:49,Ta osoba vam mora reći kako to objektivno naprimjer neka vaša reakcija izgleda izvana.
0:23:50,0:23:55,"Možda ti osjećaš pa zato možete njemu objasniti zašto je napravio to, ali kako to izvana izgleda?"
0:23:55,0:24:05,On će vam pomoći da prepoznate te neke negativne stvari koje osjećate i stvari koje trebaju sazret i rane da prepoznate.
0:24:09,0:24:32,"Evo treća, moje svjedočanstvo da vjerujem da sam dosta emocionalno napredovao baš upravo zbog toga što sam imao ljude koji su bili u ljubavi oko mene, to je bio moj duhovni pratitelj, duhovnik i duhovni djed i otac, to su bili prijatelji i stvarno kažem vam usuditi se prepustiti drugom čovjeku."
0:24:33,0:24:36,Treći korak je izaći iz komfort zone.
0:24:38,0:24:39,Ovo je jedan zanimljiv korak.
0:24:40,0:24:46,"Ivan Merc je to često radio i on je to nazvao ići u neugodne situacije, imao je to baš u duhovnom svom programu."
0:24:49,0:24:58,Nekad će se možda činiti da je strašno umrijeti onom lažnom sebi i pustiti novom sebi da živi.
0:24:58,0:25:03,"Nekom jer naprimjer znam ljude kojima je ući u konflikt, konflikt isto kao i smrt."
0:25:03,0:25:07,Znam da postoje oni koji su alergični kad je netko ljut pored njih.
0:25:08,0:25:19,"Ima ljudi koji se boje pitati za pomoć jer ne znam, misle da su totalni promašak, pitaju i muče se s tim i kad gledaju ostale misle da je to mala stvar, ali njima je to velika stvar."
0:25:21,0:25:24,I to su te neke sitnice u koje možemo ulaziti u neugodne situacije.
0:25:24,0:25:29,Još jako zanimljiva stvar što ova vježba jako pomaže kod savladavanja strahova.
0:25:30,0:25:40,"Ivan Merci je imao vježbu da ide po noći na mračna mjesta u šumu, na nepoznata mjesta jer je znao da strah nije vani nego u njemu."
0:25:41,0:26:14,"Ja sam isto imao iskustvo, evo, Matija Ricom je zakuho kašu, prije ne znam, imao sam sedamnaest godina, bili smo na Visu i sad od njegove kuće koja je zadnja u tom selu do Mola postoji put od nekih, a šta znam, kilometar, kilometar i pol, dva vam kaže, dobro, kilometar i pol i kako se zove, mrklji mrak, znači nema ni jedne svjetiljke do dole do obale."
0:26:15,0:26:38,"I sad on meni već po putu mi nešto pričamo, ja sam bio radozna, mi smo puno pričali o duhovnostima, o svemu, o curama, o ovom, onom, sve što nas je zanimalo i on je već nešto suptilno počeo, imao kao jednu super vježbu, znaš što ćeš kad se budemo vraćali, kao Ivan Merci je to radio, a ja onako, onako dobro i onda prebaci brzo temu naš, ja se nisam ni snašao to, znaš i ništa."
0:26:39,0:26:58,"I on je mene to uspio nagovoriti, bio sam u nekim drugim borbama da nisam uspio registrirati što ću ja sad morat raditi i kako se zove sad, on meni kaže mi što sad je ta vježba, ja ono, mlad najvan poslušan, rekao dobro, uvijek za izazove."
0:26:59,0:27:03,"I sad kaže ti ideš sad ravno, ideš do kuće u Milni po mraku."
0:27:05,0:27:15,"A tad sam se i bojao mraka, često ne bih mogao ni zaspati bez da mi televizor gori i tako, namjestio bih ga na slip mode i dobro idem ja."
0:27:15,0:27:16,"I sad ja idem, vidim."
0:27:17,0:27:25,"Tako da tu asfalt, ako se dobro oči prilagođaju, treba vremena, znao je naletit auto, zabljesnite onda još manje vidiš."
0:27:26,0:27:29,I vidiš asfalt samo da nas kreneš u šikarje.
0:27:29,0:27:32,Oko tebe je bila šuma i čuješ stalno neke zvukove.
0:27:33,0:27:46,"I sad ja hodam u sebi srce lupa, pjevam salme, ja ne bojim se ni dolinom smrti proći, sve bi se pomiješalo, molim, salmaćmo."
0:27:55,0:28:00,"I znate šta, uspio sam i bilo je tako slatko."
0:28:01,0:28:03,Poslije mi je bilo i smiješno.
0:28:03,0:28:13,"Evo baš ovi su dečki koje smo vodili sad na Iž, kako smo mi ludi, imali su priliku proći kroz takvu jednu radionicu."
0:28:13,0:28:18,"Mogu vam ispričati ukratko i njihovo, bilo je puno svjedočanstva, ali ukratko da ispričam šta su radili."
0:28:19,0:28:29,"Imali smo jednu radionicu gdje bi ih stavili za ruke, ali prije toga povezali oči, još bi stavili čarapu da ne bi mogli dole vidjeti i onda ide poveza."
0:28:30,0:29:19,"Morali su dati zavjet da će šutiti dok ne završi vježba i stali smo joj za ruke i to je značilo sad idete gdje vaša braća idu, znači moraš hodati u vjeri i mi smo ih tak po otoku vodili, po mraku isto naravno i mnogi već tu imaju puno svjedočanstava kakvi su im se misli vrtili, koliko su se borili sa strahovima, ali da ne bude to to, mi smo napravili još jednu vježbu, ovo je bila vježba za zajedništvo i hod u vjeri u mraku, mi smo došli na mjesto koje smo izbjegavali dva dana da oni ne bi znali taj put, to je bio jedan put po stepenicama kamenim do crkve koja je dosta duga čak isto, možda petsto metara i pomrakuje."
0:29:19,0:29:24,"I onda bi ih odvojili naglo, bili smo inače hladni u njima da se suoče baš."
0:29:25,0:29:29,"Tad smo bili hladni prema njima, nismo bili bezobrazni ali smo bili hladni."
0:29:29,0:29:36,"Do sad smo bili puni ljubavi, sve je bilo jako lijepo na radionicama, sve i onda smo odjednom naglo postali hladni."
0:29:37,0:29:41,Već tada su oni neki pričali dečki da su osjetili da nešto važno se treba dogoditi.
0:29:41,0:29:58,"I sad mi dolazimo jednog od vama dovode ga do Matije koji je na početku tih stepenica i Matija im skida povez kao bravo uspio si naš prvi dio, ali sad u životu će biti stvari koje ćeš morati izboriti jedan na jedan s Bogom."
0:29:59,0:30:04,"Tako danas ćeš pobjediti strah, sjeti se lotove žene, kreni naprijed i ne okreće se."
0:30:06,0:30:19,"I sad oni idu i sad najsmješniji dio što moj dio nije baš uspio, ali dobro, ja sam bio na pola puta, oni su hodali po mraku, nisu znali gdje su i ja sam trebao biti taj na pola puta koji ih ohrabrili."
0:30:19,0:30:21,"Kaže, bravo sine na pola si puta."
0:30:22,0:30:28,"A Bog ti uvijek da utjehu kratku pošaljiti svog anđela da ne gledaš nazad, nego da ideš do kraja gdje to on želi."
0:30:28,0:30:38,Ali svi su svjedočili da su me se toliko uplašili kad su vidjeli u braku da je bio neki tip sa savu crnom koji je imao bijelu facu.
