Start (HH:MM:SS),End (HH:MM:SS),Segment
0:36:43,0:37:01,"Također jedno drugo sveučilište u Mađarskoj, to je sveučilište iz Segedina, iz Segeda, Gar Ferenc, tamo je jedan ekonomski fakultet gdje ima jedan izvrstan profesor koji također tu onda motivira svoje studente da se i prijavljuju i sudjeluju na ljetnoj školi."
0:37:02,0:37:16,"Zatim imamo jednu partnersku instituciju iz Poljske, iz grada Tarnova, također jedno humanistički fakultet pedagogije koji se zanimaju upravo za te teme na koji način ih onda implementirati u svoju struku."
0:37:17,0:37:20,"Te ove godine imamo još jedno novo sveučilište, a to je."
0:37:22,0:37:30,"Jedno sveučilište iz Bugarske, jedan ekonomski fakultet, također jako dobar se u kojem smo već imali na sveučilišnoj razini dobru suradnju, to je odličnu suradnju."
0:37:31,0:37:43,"Neofitrilski sveučilište, Southwest sveučilište, sa kojeg nam dolazi studenti ekonomije koji su izrazito zainteresirani za temu."
0:37:44,0:37:48,"Evo, to je ona uža skupina ovih međunarodnih i naravno sa Hrvatskog."
0:37:49,0:37:54,katoličkog sveučilišta imamo studente sa naših odjela ove godine.
0:37:54,0:38:07,"Kao što smo rekli, najveći interes i odazivi bi bili upravo sa odjela za komunikologiju, gdje nam od 11 studenta ukupno njih sedmero dolazi sa odjela za komunikologiju."
0:38:07,0:38:12,"Dolaze nam također studenti sociologije, psihologije i povijesti."
0:38:13,0:38:15,"Evo, super, imamo još par minuta."
0:38:17,0:38:19,Možda ako nam ti nešto želiš reći za kraj.
0:38:20,0:38:31,"Ljetna škola Bruno je rekao krajem osmog mjeseca, rekao je da će biti online i da ćete nakon toga tijan dana imati u Splitu."
0:38:32,0:38:35,"Evo, možete nam ti ponovit datume gdje se mogu prijaviti."
0:38:39,0:38:39,Od 18.
0:38:40,0:38:40,do 20.
0:38:41,0:38:51,kolovoza je online komponenta ljetne škole gdje ćemo imati predavače koji će online održavati predavanja i svi sudionici će pratiti predavanja online putem.
0:38:52,0:38:57,A uživo program u Splitu počinje u nedjelju 24.
0:38:58,0:38:59,kolovoza u 17.
0:38:59,0:38:59,sati.
0:39:00,0:39:02,a završit će 31.
0:39:03,0:39:09,"kolovoza također, to je iduća nedjelja, tako da imamo tu punih tjedan dana za rasprave."
0:39:09,0:39:26,"Da, da, da, za jednu vrlo konstruktivnu, možemo reći i dugo očekivanu i željenu zajedništvo je u tom smislu, da kažemo, vezano za upoznavanje ove teme, koje zaista može nam itekako pomoći u cijelovitu."
0:39:26,0:39:29,"Možemo reći da su studenti u biti jako zainteresirane, ne?"
0:39:30,0:39:31,"Ove godine, da."
0:39:32,0:39:37,"Ove godine i po motivacijskim pitanjima se vidi čak, pardon, po motivacijskim pismima se vidi."
0:39:38,0:39:39,Čak se i zahvaljuju.
0:39:40,0:39:52,"Studenti su se zahvaljivali što smo odabrali tu temu, jer primjerice taj pristup liderstvu, taj pristup vodstvu nemaju prilike čuti u sklopu redovnog studija."
0:39:52,0:39:55,A to je nešto što ih vidimo egzistencijalno zanima.
0:39:55,0:40:11,"Komunikologe zanima na koji način biti lider i ako žele se usmjeriti prema tom ekonomskom području, ekonomiste zanima na koji način biti lider i u tom smislu i etike i neki izričito spominju i socijalni nauk crkve."
0:40:12,0:40:20,"Oni koji su iz humanističkih znanosti žele bolje upoznati ovaj društveni aspekt, tako da se je stvorila jedna jako lijepa sinergija."
0:40:21,0:40:27,"Evo, za kraj, došli smo do kraja emisije, ako želiš reći neku završnu riječ."
0:40:29,0:40:35,"Evo, ovogodišnja ljetna škola je zaista, možemo reći, jedan odgovor brižnosti crkve."
0:40:35,0:40:44,"Evo, mi jesmo tu sa Hrvatskog katoličkog sveučilišta, ko integrirano sveučilište, ali kroz branjenu ekonomiju mi zaista sudjelujemo u jednom bitnom poslanju crkve u našem vremenu."
0:40:45,0:41:06,"A to je dati odgovor na pitanje vjernicima, laicima koji su aktivni u svim područjima života, tako i u ekonomiji, što to znači biti sol zemlja, što znači biti svjetlo svijeta, što znači ono kada Isus kaže neće u rajući samo oni koji mi govore gospodine gospodine, nego koji vrše volju Oca nebeškoga."
0:41:06,0:41:08,Kako to činiti u ekonomiji?
0:41:08,0:41:11,"Vršiti volju Oca nebeškoga, evo, to je stvarno ovaj."
0:41:12,0:41:14,I kako to konkretno stvariti u ekonomiji?
0:41:15,0:41:32,"Dakle, ne samo u nedjelju za vrijeme svete misle kad izvršavamo svoju dužnost da smo kao vjernici prisutni, nego kako živjeti i koji nam alate crkva tu nudi da bismo mogli autentično živjeti u tom izazovnom području i da možemo dati svoj doprinos."
0:41:32,0:41:36,Ono što i socijalni nauk crkve kaže za ostvarenje civilizacije i ljubavi.
0:41:37,0:41:41,"Evo, nova pitanja se otvaraju, šire se novi horizonti, to je dobro."
0:41:42,0:41:47,"Uvijek je dobro razvijati nove teme, kao što si sama rekla."
0:41:48,0:42:11,"Važno je ići na misu, važno je na nju i treće Božje zapovjedanje da dođemo na misu, da zahvalimo za cijeli taj tjedan, da mi dušu napajamo, ali evo, vršiti volju Boga Oca, to je u biti jako važno, pa nije dovoljno što smo rekli, trebalo bi biti znanje široko."
0:42:12,0:42:15,Trebalo bi to znanje vidjeti.
0:42:17,0:42:29,"Mi smo otvorili različite teme, jedva čekam ljetnu školu, dragi slušatelji, dragi gledatelji, ja vas isto srdečno pozivam, prijavite se do kad su prijave."
0:42:30,0:42:33,"Do 1.7., ali i do 31.7."
0:42:34,0:42:37,još moguće se javiti i ostvariti.
0:42:37,0:42:43,Oni koji ne sudjeluju preko Erasmusa moraju platiti određeni iznos koji pokriva minimalno.
0:42:43,0:42:45,"Dakle, zaista su minimalni troškovi."
0:42:45,0:42:47,"To je smještaj, pretpostavljam, i hranta."
0:42:48,0:42:54,"I svi popretni, dakle, sadržaj kao što imamo jedan izlet, dakle, sve je to onda uključeno u cijenu."
0:42:54,0:43:01,"A lokacija će biti kao i prošle dvije godine na fakultetu u sveučilištu u Spletu, je li tako?"
0:43:02,0:43:08,"Evo, draga Marijana, hvala ti što si bila još jednom naša gošća."
0:43:08,0:43:12,"Želimo puno uspjeha, Božjeg blagoslova."
0:43:13,0:43:28,"Neka gospodin vodi, neka on ovakve velike projekte vodi, neka duh svetina se blagoslovi za ovakve stvari, neka on vodi, a neka mi budemo instrument preko kojih onda on može raditi."
0:43:29,0:43:37,"Dragi slušatelji, dragi gledatelji, hvala vam još jedan put što ste pratili emisiju Franjena ekonomija."
0:43:38,0:43:47,"Moje ime je Katarina Bukša, ja sam urednica i voditeljica emisije, a tehnički urednik je danas bio Ivan Zaradić."
0:43:48,0:43:49,Hvaljeni su si Marija.
