Start (HH:MM:SS),End (HH:MM:SS),Segment
0:06:56,0:07:01,"Hvaljeni su se, Marija, dragi slušatelji i gledatelji radio Marije."
0:07:01,0:07:08,"Moje ime je Katarina Bukša, ja sam urednica i voditeljica emisije Franjina Ekonomija."
0:07:08,0:07:11,Tehnički urednik je Ivan Zaradić.
0:07:11,0:07:16,Danas ćemo pričati o ljetnoj školi Franjene ekonomije.
0:07:16,0:07:28,"Franjena ekonomija je pokret koji je počeo na poziv pokojnog pape Franje da se ekonomiji vrati integritet, moralni karakter i vrijednost ljudske osobe."
0:07:29,0:07:40,S nama su danas u studiju gosti profesorica Marijana Kompes i na telefonskoj liniji imamo Bruno Petrušića.
0:07:40,0:07:41,"Bruno, jel se čujemo?"
0:07:42,0:07:44,"Čujemo se, pozdrav Kate."
0:07:44,0:07:46,Evo ispričavam se što malo kasnim.
0:07:46,0:07:47,Nadam se da je sve u redu.
0:07:47,0:07:49,Pozdrav slušateljima i gledateljima.
0:07:50,0:07:55,"Pozdrav, evo, drago mi je da se čujemo kako je u Splitu, jer vruće i sparno kao u Zagrebu."
0:07:56,0:08:09,"Vruće i sparno je, ali evo, mi imamo more koje je jako dobro ohladi, ovako kad malo padne mrak, tijekom dana nije baš toliko, ali ovako navečer ruže se da rashladiti, da."
0:08:09,0:08:12,"Paše, paše, evo, baš smo blagoslovljeni s tim morem."
0:08:12,0:08:16,Ja uvijek isto kažem da je to drugi svijet dole.
0:08:17,0:08:25,"Bruno, evo, pričat ćemo o ljetnoj školi, ti si, evo, glavni, recimo to tako, glavni."
0:08:25,0:08:27,faktor unutar te ljetne škole.
0:08:28,0:08:40,"Ovo je već treća godina za redom, pa daj nam evo recite malo što je novo u odnosu na prošle dvije, koja je tema, o čemu ćete ovako pričat, koje su radionice, čisto ukratko da malo predstavimo."
0:08:41,0:08:42,"Da, da možemo."
0:08:42,0:09:15,"Ideja o ljetnoj školi kao što smo i rekli, a mislim i prošli put kad smo sudjelovali u emisiji je se rodila ustvari u Asizu na onom susretu sa papom Franjom i tada smo gledali kako možemo malo aktivirati sami sebe i ljude koji su okupljeni i onda smo došli na ideju ljetne škole i na neki način smo htjeli od samoga početka posvetiti pažnju svim ovim selima, hrane ekonomije odnosno tematskim skupinama tako da smo se svake godine odlučili za jednu temu iz nekog konkretnog sela."
0:09:16,0:10:08,"Prošle godine je tema bila distribucija bogatstva pravedna jel odnosno ovih dobara koje imamo, a ove godine smo se odlučili za pitanje liderstva i menadžmenta u nekakvoj boljoj ekonomiji kakvu je papa Franjo nas pozvao da zamislimo i realiziramo jer smo vidjeli da ne samo unutar ekonomske sfere nego u društvu općenito pa i na političkoj ovoj sceni da tako kažem vidimo da fali pravih istinskih lidera i što to znači biti lider u današnjem svijetu i na neki način smo htjeli vidjeti što hranjena ekonomija govori o tome, što socijalni nauk Crkve govori o tome, što pape kroz svoja autentična učenja govore o tome i evo što Biblija na kraju govori o tome i to ćemo ove godine razrađivati u Splitu krajem kolovoza."
0:10:08,0:10:14,"A novost naspram prošle dvije ljetne škole je staž, a imamo i ovu online komponentu."
0:10:15,0:10:42,"Možemo malo rasteretiti taj splitski dio jer smo vidjeli prošlih godina da je previše studentima, pa čak i nama koji smo u organizaciji profesorima, da po ovakvim vrućinama radimo intenzivno od 8,5 do 5,6 na večer, odnosno poslije poodne, tako da smo prebacili dio programa na online, tako da budemo malo fleksibilni kad je u pitanju ovaj splitski program."
0:10:43,0:10:49,"Dobro, znači to je online radionica, ona će se isto održavati paralelno u isto vrijeme ili će."
0:10:49,0:10:50,biti jedan drugi termin?
0:10:51,0:10:52,"Ne, ne, bit će tjedan prije."
0:10:53,0:11:56,"Znači, online komponenta ljetne škole počinje osamnaest kolovoza i otprilike ćemo imati nekih šest predavanja, što predavanja, što keystadija, što radionica preko Zuma ili Teamsa ili vidjet ćemo koja aplikacija i tu imamo stvarno jake snage, ovi ljudi koji podržavaju hranjenu ekonomiju, koji su dvije hranjene ekonomije, ali ne znam, su iz Amerike ili im je nezgodno doći u to vrijeme, tako da će oni biti sa nama, pa evo nakon tri godine što smo kontaktirali svake godine gospodina Lujčina Brunija koji je u Franjinoj ekonomiji od početka i jedan je od vodećih lidera, konačno zbog ove opcije online predavanja i sudjelovanja s njim ćemo otvoriti taj, ustvari cijelu dječju školu sa njegovim predavanjem, tako da smo jako, jako ponosni evo što i na taj način ljudi u Asizu koji vode Franjinoj ekonomiju vide što dobro to radimo i na ovaj način podržavaju."
0:11:56,0:12:13,"I kako se to radi isto unutar Hrvatske i koji su biti biti vaši onda isto programi tako da čim su u biti pristali na suradnju, znači da podržavaju i smatraju očito da je dosta dobro to napravljeno."
0:12:13,0:12:30,"Naravno, mi stvarno svaki put kad smo u korespondenciji sa njima, bilo mailom, bilo na ovim sastancima kao koordinatori Sela ili koordinatori HB-ova, stvarno ističu primjer Hrvatske kao jedan svijetl primjer na svjetskoj razini."
0:12:31,0:13:04,"Mi svi znamo da je strana ekonomija u zadnjih godinu i po dvije bila u nekakvoj prijelaznom fazi razdobljalju puno se radilo na unutarnjoj strukturi, dobili smo sad tu fondaciju, sada je stvar puno jasnija, rekao bih i unutar same sanjine ekonomije, zna se tko je odgovoran za što, tako da je komunikacija puno brža i efikasnija, naravno uvijek to može bolje, ali evo mi stvarno imamo snažnu podršku od ljudi iz Asisa, iz globalne zajednice i svi gledaju u Hrvatsku kao nekakav svjetli primjer."
0:13:05,0:13:05,Odlično.
0:13:06,0:13:15,Može nam Bruno možda reći osim profesora Luidžija tko će još bit odgodio na toj ljetnoj školi?
0:13:16,0:13:17,Pa može ovako.
0:13:17,0:13:41,"Znači što se tiče ovoga online segmenta, komponente, tu bih istaknuo profesoricu Alessandru Viskovi, ona je u mirovini, ali je cijelu akademsku karijeru provela na sveučilištu u Milanu, a dio je Menzura Bonom odnosno na koji način se može investirati temeljem vjerskog nekog opredjeljenja."
0:13:41,0:13:48,Ona nam je bila i prošle godine i jednostavno evo žena je poduševljena svim što radimo i želi biti dio.
0:13:48,0:14:14,"Također imamo i kako nam je jedan od partnera Angelikum, papinsko sveučilište svjedoka tome, Atlantskoga u Rimu, imamo i Pjera Januarda, ona dolazi znači s Angelikuma, sa teologije njihove i on će nam govoriti ovako kako je Sredi Tom Akvinski vidio ekonomsku aktivnost, poslovanje, menadžment i liderstvo."
0:14:14,0:14:34,"Onda ćemo imati isto tako profesoricu koja nam je prošle godine bila, koja je na svoj račun došla iz Amerike da sudjeluje u našoj ljetnoj školi, da Down Carpeter, ona je ove godine nažalost zbog poslovnih obaveza ne može biti tu prisutna sa nama, tako da će ona biti na ovoj online komponenti."
0:14:35,0:14:55,"Zatim tu imamo Lovrenca Čonga iz ekonomije zajedništva, imamo Paolo Santorija isto tako iz Hranjene ekonomije koji je više ovako usmjeren ovoj akademiji Hranjene ekonomije i razmišljanju na koji način kritički promatrati, promišljati suvremena ekonomska kretanja."
0:14:57,0:15:19,"I imat ćemo isto tako, ne znam ja ću isto održati u online dijelu i imat ćemo Johna Adela Kostu kojega je predložila i preporučila Helena Alford koja evo ove godine ne može biti ni uživo ni online, tako da je ona preporučila Johna pa evo to je što se tiče online komponente znači u tri dana."
0:15:20,0:15:53,"A što se tiče uživo programa moram istaknuti da sam posebno ponosan što će, ja se ispričavam van kad samo ovaj pale se prometuje, isprike slušateljima što će nam ove godine doći John Milbank, on je čuveni teolog, kulturnjak, nakon napisao je dosta knjiga, čovjek iznimno utjecajan, on će nam biti tu tri dana, održat će predavanje i sudjelovat će na panelu otvorenja same ljetne škole."
0:15:55,0:16:16,"Zatim imamo isto jake hrvatske snage, profesorica Ivana Marić sa ekonomskog fakulteta, Sveučilište u Splitu održat će predavanje, zatim profesorica Marijana Kompes, Petra Palić sa Hrvatskog katoličkog sveučilišta, isto tako, da vidimo, Domago i Hruška, doma, a goji Hruška sa ekonomskog fakulteta istog sveučilišta u Zagrebu."
0:16:18,0:16:22,I mislim da je to to što se tiče hrvatskih snaga.
0:16:23,0:17:01,"Imamo također profesore koji su oduševljeni iz zadnje tri godine pa evo su se na neki način nametnili sami da tako kažem, rekli su jednostavno moraju biti dio ove priče, tako da će nam tu biti Melani Reibek iz Amsterdama, kao i prošle godine Roland Silas iz Budimpešte, Korvinus University, isto će tako biti Sander Simon i mnogi drugi, ne znam, Martin Karbaho Nunez on je predaje u Americi, on je Franjevac, ali dio predaje je u Rimu, tako da će iskoristiti to vrijeme da malo bude sa nama pa će produžiti za Rim."
0:17:01,0:17:25,"Uglavnom, naše iskustvo je da ljudi i studenti i profesori koji dođu jednostavno žele ponoviti to iskustvo i mi smo već prošle godine imali pedeset posto programa što se tiče profesora jer su željeli ljudi sudjelovati a i studenata koji su rekli da će se prijaviti ove godine odlično evo pitat ćemo malo kasnije i marijanu kako studenti reagiraju a kako se čini isto?"
0:17:26,0:17:33,"Evo, ti si isto doktor znanosti iz teologije, pa što ti ovako imaš za reći prije nego što pređemo na Marijano?"
0:17:35,0:17:43,"Što se tebi čini, kako je ekonomija sad i što bi moglo gledano na tu temu liderstva i vođenja?"
0:17:45,0:17:46,Što ti misliš o tome?
0:17:47,0:17:55,"Da, pa ovako meni se čini da je blagodat projekata poput ovoga taj što dovede ljude za isti stol."
0:17:56,0:17:57,To je prva stvar.
0:17:57,0:18:00,Druga stvar dovede ih u prekrasnu Splitu i u prekrasnu Hrvatsku.
0:18:00,0:18:06,i onda ljudi nadam se neki kasnije i turistički dođu i sudjeluju u turističkim ponudama.
0:18:07,0:18:28,"Ali što se tiče same ekonomije i promišljanja jako je bitno to da su ljudi iz različitih perspektiva, različitog konteksta, različitih vjerskih opredjeljenja, ideoloških svjetonazora sjednu za isti stol, mirno razgovaraju, dijele argumente, ideje, kritike i onda u svemu tome ispane nešto prekrasno, prelijepo."
0:18:28,0:19:28,"Evo mogu posjedočiti prošle godine sa ovom profesoricom Melani Reiback koja nipočemu ovako kad se gleda njen profil izvana nipočem ne bi spadala u naš program ljetne škole zato što je žena sekularna, progresivna, ljevih uvjerenja, ali evo bila je tu, mi smo je pozvali, ona je pristava sudjelovati, doživjeli smo jednu prekrasnu razmjenu različitih perspektiva, pogleda na ekonomiju, na ljudsko dostojanstvo, na pitanje pravednosti, na pitanje slobode tržišta i drugih stvari i nakon toga se razvilo ne samo dobre ideje, nego i prijateljstvo među nama sudionicima koji se inače ne bi nigdje susreli jer živimo u različitim zemljama, ali i u kulturološkim balonima, teško da bismo se susreli."
0:19:28,0:19:58,"Ali evo naša ljetna škola je omogućila taj susret, jedno prekrasno prijateljstvo i evo žena stvarno želi doći tu ne samo ove godine već i do godine, dolazi u Hrvatsku, uključila se aktivno u hranjenu ekonomiju, doći će sad i u Rim kad bude ovaj globalni event, jednostavno vidiš da je nekakav duh tu koji okuplja, pokreće i gura sve to skupa naprijed."
0:19:58,0:20:10,"Tako da je meni tu kao teologu iznimno, iznimno zanimljivo biti, sudjelovati, promatrati sve to iz prve ruke, dobivati ideje, razrađivati ideje i evo jednostavno se veselim i ovoj godini kao i svakoj sljedećoj."
0:20:11,0:20:32,"Odlično, evo lijepo je to čuti, ovaj tako staviti sve na jedan stol i onda gledati, tražiti jednu dodanu vrijednost u ekonomiji da vidimo na koji način možemo vratiti ekonomiju na prave te staze, jedan taj integritet, dostojanstvo čovjeka, tako da super je."
0:20:32,0:20:56,"Bruno, oprosti samo, sad si me inspirirala jednu riječ samo da kažem, znači, skužili smo da ne možemo sami, znači, ne mogu katolici, ajmo tako reći sa desnog političkog spektra, sami ne mogu progresivni sekularni tipovi sa ljevog spektra političkog ili kulturološkog i baš smo prošle godine skužili da moramo zajedno djelovati."
0:20:56,0:21:07,"To je čar ljepote hranjene ekonomije šta će postaviti ljude svježije i zajedno da zajedno rješavaju društvene, ekonomske, kulturološke probleme, jer vidimo da sami ne možemo."
0:21:08,0:21:10,"Pa je, to i je kršćanstvo na kraju."
0:21:12,0:21:25,"Bruno, evo, zahvaljujem se, pozdravljam Split, sad ćemo napraviti jednu kratku stanku pa ćemo razgovarati sa našom Marijanom koja je isto jedan od predavača, jel tako, na ljetnoj školi."
0:21:26,0:21:33,"Pa ćemo, Bruno, evo, lijepo tebe pozdraviti, a mi se čujemo kroz minutu, dvije."
0:23:24,0:23:25,"Hvala vam, gospodine."
0:23:25,0:23:26,"Hvala vam, gospodine."
0:23:27,0:23:27,"Hvala vam, gospodine."
0:23:29,0:23:30,"Hvala vam, gospodine."
0:23:30,0:23:30,"Hvala vam, gospodine."
0:23:31,0:23:32,"Hvala vam, gospodine."
0:23:32,0:23:35,"Hvala vam, gospodine."
0:23:35,0:23:37,"Hvala vam, gospodine."
0:23:37,0:23:38,"Hvala vam, gospodine."
0:23:40,0:23:44,"Hvala vam, gospodine."
0:23:53,0:23:54,"Hvala vam, gospodine."
0:23:54,0:23:54,"Hvala vam, gospodine."
0:23:54,0:23:55,"Hvala vam, gospodine."
0:23:55,0:23:56,"Hvala vam, gospodine."
0:23:57,0:23:57,"Hvala vam, gospodine."
0:23:58,0:23:58,"Hvala vam, gospodine."
0:23:58,0:23:59,"Hvala vam, gospodine."
0:23:59,0:23:59,"Hvala vam, gospodine."
0:24:00,0:24:00,"Hvala vam, gospodine."
0:24:02,0:24:07,"Sad je s nama naša gošća već dosta poznata, profesorica Marijana Kompes."
0:24:08,0:24:09,"Marijana, dobro večer."
0:24:09,0:24:09,Kako si?
0:24:10,0:24:11,"Hvala, nisam si Marija."
0:24:11,0:24:14,"Evo, lijepi pozdrav Katarina tebi i svim slušateljima."
0:24:14,0:24:14,Hvala.
0:24:15,0:24:18,"Evo, da rećemo kratko da odmah pređemo."
0:24:18,0:24:28,"Ti si profesorica na HKS-u, a isto tako ćeš biti jedan od predavača na ljetnoj školi Franjene ekonomije, o čemu i pričamo."
0:24:28,0:24:40,"Pa možeš nam malo reći koja je tvoja tema, što ćeš ti predavati ili radionice koje ćeš imati i zašto da studenti, zašto da se neko prijavi na ljetnu školu Franjene ekonomije."
0:24:42,0:24:49,"Dakle, ova godišnja tema naše ljetne škole, možemo reći, zaista je pobudila veliki interes."
0:24:50,0:25:00,"Ako gledamo matematički i statistički u odnosu na prošlu godinu, znači sam broj prijavljenih studenata je naglo skočio, primjerice."
0:25:00,0:25:07,"Prošle godine smo imali na jednoj instituciji dvije prijave, ove godine imamo 12 sveukupno."
0:25:07,0:25:08,"Dakle, 33 studenata."
0:25:08,0:25:32,"Ono što se pokazalo kao vrlo indikativno je da uz ekonomiste, dakle uz društvene znanosti i humanističke znanosti, primjerice imamo i povjesničara, imamo pedagoga koji su se prijavili, imamo dakle i društvene znanosti kao što je ekonomija, studenata ekonomije, ali i ove godine jako velik broj studenata komunikologije."
0:25:33,0:25:44,"Što je jedna nova, možemo reći, tematska perspektiva koja se je tu otvorila, sada i za razvoj cijele ljetne škole, o čemu vjerujem da ste tematski već nešto i govorili."
0:25:45,0:25:48,"Evo, to je, možemo reći, jedna zanimljivost u odnosu na prošlu godinu."
0:25:50,0:25:56,"Teme predavanja, kao što je već bilo i rečeno, zapravo pokriva jednu veliku širinu."
0:25:56,0:25:59,Tako da se pokazuje da je jedna škola zaista jedno mjesto susreta.
0:26:00,0:26:21,"Jedno mjesto susreta u smislu ne samo susreta raznih disciplina, dakle u tom interdisciplinarnom smislu gdje se različite znanstvene discipline mogu tu razmijeniti svoje stavove o temi liderstva, vodstva, upravljanja, menadžmenta, ekonomije sa dušom, nego je to i mjesto susreta za mlade ljude."
0:26:22,0:26:26,"Dakle, tu se događaju susreti koji se inače ne bi bi dogodili."
0:26:26,0:26:35,"Poznanstva, možemo reći, umrežavanja koja, evo, da nema ljetne škole za te mlade ljude iz europskih zemalja se ne bi dogodila."
0:26:35,0:26:41,"Tako da smo mi ove godine tu pokušali, uzimajući u obzir tu temu liderstva, vodstva zaista."
0:26:42,0:26:56,"promišljati liderstvo u jednom aktualnom smislu, dakle, trenutku u kojem se nalazimo, dakle, da mi možemo imati ono što je nama zanimljivo, dakle, studente koji se intelektualno obrazuju, koji rastu u tom znanju."
0:26:57,0:27:12,"Dakle, lider nije samo netko tko je intelektualno jak, koji je veliki stručnjak u svom području, nego ono što je ljetna škola i u kontekstu i franjene ekonomije i socijalnog nauka crkve želi doprinjeti je da je lider i ona koja je morala."
0:27:12,0:27:17,"Dakle, lider mora imati uz tu stručnu dimenziju i tu moralnu dimenziju, etičku dimenziju."
0:27:18,0:27:34,"I kad malo promatramo i ta motivacijska pisma koja su nam pristizala, zanimljivo je da su ekonomisti najviše izražavali ne toliko želju da prodube svoje ekonomsko znanje, nego želju da upoznaju taj etički vid, etičku komponentu, neke možda i komunikacijske vještine."
0:27:35,0:27:37,"Da, kaže jedno motivacijsko."
0:27:37,0:27:47,pismo jednog studenta koji već ima prilike raditi u realnom sektoru da ono što ga je najviše na neki način zasmetalo je taj nedostatak ljudskosti.
0:27:48,0:27:56,"Možda se tako izrazio, nedostatak ljudskosti u ekonomskom djelovanju, da je njega zanima, da je njega zaintrigirao taj naslov što to znači ekonomija sa dušom."
0:27:58,0:28:10,"Tako da u tom smislu, kroz hranjenu ekonomiju i socijalne naukcije koje mi želimo dati doprinos, da mladi ljudi isteknu nova znanja, ali sad ne više toliko možda u ekonomskom ili nekom drugom."
0:28:12,0:28:19,"ali onda i šire u smislu što to znači, što kaže i socijalni nauk crkve, što kaže franjena ekonomija."
0:28:19,0:28:21,Kako se to konkretno može ostvariti?
0:28:21,0:28:25,Kako da profit ne bude jedino bitan?
0:28:26,0:28:36,"Tako je, ali kako da profit ne bude ono sredstvo koje nas reducira na to da čovjeka promatramo kao sredstvo, a ne kao cilj."
0:28:37,0:28:41,Jer profit sam po sebi nije nešto što trebamo odbaciti.
0:28:42,0:28:49,Ali pitanje je kako ga ostvarujemo i zato je tu i franjena ekonomija i socijalni nauk crkve upravo da vrati tu dušu.
0:28:49,0:29:05,"u ekonomiji kroz taj jedan naglasak da zaista ljude u cijelom tom procesu i poduzetništva i razvoja ekonomije promatramo kao cilj ekonomske djelatnosti, a ne kao jedno sredstvo koje onda nama pomaže da ostvarimo neke svoje ciljeve."
0:29:06,0:29:18,"Ono što sam se ja ovdje tematski fokusirala, što je meni osobito bilo gledajući ostale teme kao jedno područje koje bi bilo dobro obraditi, je pitanje žena i liderstva."
0:29:19,0:29:24,Žena i vodstva prema socijalnom navoku crkve i hranjenoj ekonomiji.
0:29:25,0:29:32,"Tako da ćemo i u tom predavanju, radionici, obraditi tu vrlo aktualnu temu."
0:29:33,0:29:44,"Polazeći od činjenice da nam i brojne statistike pokazuju kako žene zaista preuzimaju vodeće pozicije u ekonomskom sektoru, dakle u poduzetničkim vodama."
0:29:45,0:29:58,"I to ne samo u nekim branšama koje bismo smatrali da su svojstvene ženama, nego ako promatramo najuspješnije žene, to je područje i brodogradnje, dakle najbogatije žene, i u području brodogradnje, i u području građevinarstva."
0:29:58,0:30:01,"Dakle, žene tu se pokazuju kao izrazito uspješne."
0:30:02,0:30:21,"poduzetnice, izrazito uspješne u ekonomskom smislu, ali ono što ćemo mi u ovom predavanju iz tog jednog šireg aspekta i antropologije, ali onda i socijalnog nauka crkve i hranjene ekonomije malo dublje proučiti, je liderstvo kao jednu žensku karizmu."
0:30:21,0:30:24,Postavit ćemo pitanje da li uopće liderstvo jest ženska karizma.
0:30:26,0:30:30,"Smijemo naravno promišljati, imati stavove, ali ćemo promočiti."
0:30:30,0:30:32,Jako zanimljive radionice viden.
0:30:32,0:30:36,"Da, dakle, bit će tu pitanje jer znamo da su okružene postojale žene lideri."
0:30:37,0:30:44,"Ako promatrimo i sveto pismo i Bibliju, ako promatrimo i povijes Katoličke crkve, dakle govorimo zaista o velikim ličnostima."
0:30:44,0:30:52,I sada vezat ćemo onda tu temu liderstva kod žena uz važnu temu ženstvenosti kao jednu bitnu oznaku ženske esencijalnosti.
0:30:53,0:31:02,"Dakle, na koji način žene koje jesu lideri, i to je zaista izrađivo zahtjevan posao, ali mogu rasti u tom cjelovitom smislu, dakle integralnom smislu."
0:31:02,0:31:05,"To je ono što i socijalni nauk, onda i hranjena ekonomija ističe."
0:31:05,0:31:13,"Dakle, da žena tu u svom poslanju i pozivu svoju ženstvenost ne treba žrtvovati, nego da ona u njoj raste."
0:31:13,0:31:25,"Znamo da je to jedna tema koja je izrazito u našem vremenu vezana i uz razvoj feminizma i brojne društvene gibanja koje imamo, izrazito važna."
0:31:27,0:31:49,"Možemo onda reći svako u jednoj rečenici, znam da će se na radionicama stvarati ta diskusija i da će se donositi određene zaključke i da će biti jedan brainstorming i da će se biti jako dobre debate i da će se raspravljati, ali možemo reći u jednu ili dvije rečenice što je onda dobar voditelj."
0:31:50,0:31:51,Koje su to karakteristike koje?
0:31:52,0:32:18,"Da li je, rekli smo da nije dovoljno samo da ostvaruje profit, da je profit važan jer tvrtka mora ići raditi, moramo davati zaposlenicima novac, plaću, imamo obaveze prema državi, prema kupcima, prema dobavljačima, ali što je recimo još jedan, recimo faktor koji je važan za vođu, a da nije samo materialnom?"
0:32:19,0:32:24,"Da li je to možda, znači rekli smo od moralnog karaktera, ali da li je to možda."
0:32:24,0:32:29,Možda nešto što drži na okupu jednu zajednicu.
0:32:31,0:32:34,Što bi to bilo važno za jednog vođu?
0:32:35,0:32:37,Nevezano muškog ili ženskog?
0:32:38,0:32:39,Zanimljivo je.
0:32:39,0:32:43,Možemo tu na jednoj teorijskoj razini razlikovati muški i ženski stil vodstva.
0:32:44,0:32:49,"Jer žene imaju svoje jakosti, dakle muški vođe imaju svoje jakosti, naravno."
0:32:50,0:32:57,Ono što možemo možda jednim pojmom sumirati je jedna bitna oznaka vođe je stvaranje zajedništva.
0:32:58,0:33:01,"To je sad jedan jako velik pojam, ali kroz zajedništvo."
0:33:01,0:33:08,se stvara naravno onda i u određenom poduzeću ili kompaniji ta jedna viša razina efikasnosti.
0:33:08,0:33:19,"Dakle, ako se uspije stvoriti taj jedan duh zajedništva koji onda ostvaruje neke zajedničke ciljeve, onda su oni ili poslovno, znamo da profit stvara ne samo dobit, nego i zajedničke vrijednosti."
0:33:20,0:33:26,"Dakle, koje zajedničke vrijednosti mi tu onda zajedno zastupamo, za koje se borimo, za koje se zalažemo."
0:33:26,0:33:36,"Tako da vidimo i sam taj porast interesa za etiku u gospodarstvu u našem vremenu se može tumačiti i sa te strane, jer ono što promiče zajedništvo, promiče povjerenje."
0:33:37,0:33:39,"Ono što promiče povjerenje, promiče je veći dobitak."
0:33:39,0:33:40,Tako da je to sve povezano.
0:33:41,0:34:12,"Dakle, dobar lider će stvoriti jednu, dobar vođa stvara jednu klimu u kojoj se onda može ostvariti upravo taj duh zajedništva koji nije onda utemeljen na onome homohomini lupus, dakle da čovjek dijeluje protiv čovjeka i da u toj bici za profit, za veći neki dobitak, za neki bolji rezultat, nego onda lideri i vođe tu uspiju stvoriti tu jednu koheziju koja i dovodi do na kraju krajeva i veće efikasnosti i veće profitabilnosti."
0:34:13,0:34:20,"U biti ne mora zaposlenika se nagovarati na neki rad, nego on sam daje jedan svoj doprinosa."
0:34:21,0:34:21,"Da, da."
0:34:21,0:34:23,Jer lideri uvijek inspiraju.
0:34:23,0:34:30,"Dakle, oni uvijek daju, dakle, menadžment, ta dimenzija upravljanja, dakle, to je ta organizacijska dimenzija, ali lideri moraju imati određenu viziju."
0:34:30,0:34:39,"Oni moraju imati određenu sposobnost, dakle, inspiracije, dakle, poticanja na zalaganja za određenu stvar."
0:34:40,0:34:48,"Tako da, evo, iz našeg se programa isto vidi koliko primjera zapravo ima i to na visokoj ekonomskoj razini."
0:34:49,0:35:08,"i poduzeća i kompanija i pojedinaca koji su kao lideri uspjeli ostvariti zaista milijunske profite na jedan etički i na jedan društveno prihvatljivi način, ono što bismo nazvali gospodarenje društveno poduzetništvo."
0:35:09,0:35:14,"Dakle, to je nešto što je i tekako moguće i to je ona linija za koju se onda Franjina ekonomija zalaže."
0:35:15,0:35:21,"Evo ovaj projekt, odnosno ljetna škola je isto dobila podršku od Evropske unije."
0:35:21,0:35:25,Vi ste se prijavili na sredstva za Evropsku uniju.
0:35:25,0:35:31,"evropska sredstva i vi ste već drugu godinu za redom, jel tako, dobili evropska sredstva."
0:35:31,0:35:52,"Pa da li nam, može nam možda reći koji su zemlje partneri sa ljetnom školom i evo, sa Brunom smo čuli koji su profesori, ali i sama ta ideja da se prijavi, koji su to institucije, koji su drugi fakulteti koji će doći u Spliti i isto to slušati."
0:35:54,0:36:00,"Da, ljetna škola se financira uz pomoć jednog Erasmus, dakle međunarodnog."
0:36:00,0:36:13,"kombiniranog programa, kombiniranog intenzivnog programa, BIP programa koji omogućava takav jedan tip mobilnosti gdje su nužno potrebne minimalno dvije, to je tri partner institucije."
0:36:13,0:36:22,"Tako da smo mi prošle godine već uspostavili suradnju sa nekoliko njih i onda nastavljamo ove godine, a vidimo da nam se i svake godine i nove pridružuju."
0:36:22,0:36:25,Tako da je programski vjerujemo da ćemo se širiti iduće godine.
0:36:25,0:36:39,"Ove godine su nam partneri jedno sveučilište, poznato sveučilište iz Mađorske, Peter Pazman iz Budimpešte, jedan fakultet humanističkih znanosti sa kojih nadolaze izvrsni studenti."
0:36:39,0:36:42,Tamo nam dolaze i ove godine studenti komunikologije.
