Start (HH:MM:SS),End (HH:MM:SS),Segment
1:16:30,1:16:33,"Znači, metafora, ali kućiš u kojem smjeru pričam."
1:16:34,1:16:38,I zato svakako je bitno raščistiti stvari koliko god one teške bile i koliko god one negativne bile.
1:16:39,1:16:46,"Jer koliko mi se puta samo desilo da sam ja mislio da jedna osoba misli nešto, a zapravo uopće nije to mislila nego je totalno izokrenuta komunikacija bila."
1:16:46,1:16:52,"I najgore je ono rekla, kazala, kad netko stvori svoje mišljenje na temelju tuđeg mišljenja i to prihvati kao činjenicu."
1:16:53,1:16:58,"To naravno dešava se svima nama, to u prodaji je konstantno, to je vrlo često."
1:16:59,1:17:10,"Netko je nekome rekao da je nekome nešto prodao po toj i toj cijeni, a zapravo nikad nije to provjerio, nego jednostavno prihvatio to mišljenje te osobe da je to tako."
1:17:11,1:17:29,"I onda kad kreneš čačkati i kopati i kad skužiš da uopće to nije bilo tako nego se radilo o određenoj kompenzaciji da se zatvori nešto što je bio neki dug i ne znam, kužiš i ti sad iz ove priče stvoriš viziju o nekome da netko radi nešto što ne bi trebao a zapravo uopće nije to nego je totalno neka druga priča u pozadini."
1:17:30,1:17:31,"Ali ti to ne znači, nisi pitao."
1:17:31,1:17:38,I opet se vraćamo na uvjerenja koliko nas zapravo mogu zeznuti i onak ograničiti.
1:17:39,1:18:04,"Fascinantno je koliko zapravo predrasudaude koče ili šta si rekao, znači ja mogu imati predrasudu da ti imaš nekakvo mišljenje o meni i ta predrasuda mene drži u tom uvjerenju i čini naš odnos onakvim kakav je."
1:18:05,1:18:14,Kada bi mogao pitati onda bi možda imali šansu promijeniti to uvjerenje.
1:18:14,1:18:14,Pa upravo tako.
1:18:15,1:18:15,I popraviti odnos.
1:18:16,1:18:18,"Da, jako puno ljudi imaju tih predrasuda."
1:18:20,1:18:23,"Predrasuda i pretpostavke, evo se kaže da je pretpostavka majka svih zajednica."
1:18:23,1:18:23,"Predstavljajka, mlaka, svih zajedno."
1:18:24,1:18:25,"Je, apsolutno."
1:18:25,1:18:27,"Ti, ako si u pretpostavci, šta možeš?"
1:18:27,1:18:29,Možeš jednostavno pretpostavljati.
1:18:29,1:18:34,"Ja, recimo, kad kažem neku pretpostavku, ja uvijek ne glasim tri puta, ovo je samo pretpostavka."
1:18:34,1:18:37,"A koristim ovu pretpostavku da bi vam objasnio to, to, to i to."
1:18:38,1:18:40,Ali ne volim pretpostavljati.
1:18:40,1:18:46,"I tu mi znaju, evo, ako će Mirela ovo slušati, mogu sad reći, ona je iz ludi sa mnom."
1:18:47,1:18:50,"Nju znam onak, je to pretpostavljaš ili stvarno je to tako?"
1:18:50,1:18:51,Ona je poludila.
1:18:51,1:18:52,"Opet, sama me provociraš."
1:18:56,1:18:57,"Znači, nekad ne smiješ ni pitati."
1:18:57,1:19:06,"Pa, znači, možeš ako se interpretira kao provokacija koju ćeš, kad pitam jer me zanima, kad kad je provokacija, vidjet ćemo ih realno."
1:19:07,1:19:12,Koliko ti je danas lagano napraviti težak razgovor s nekim?
1:19:14,1:19:14,Lakše nego prije.
1:19:15,1:19:16,Da li je lagano?
1:19:16,1:19:17,"Nije, nikad nije lagano."
1:19:17,1:19:24,Nikad nije lagano jer ja uvijek kad idem u težak razgovor sa nekim uvijek gledam koja je moja uloga u tome i zašto je uopće do toga došlo.
1:19:25,1:19:32,"I tu vrlo često radim nekakvu self-reflection odnosno samu analizu gdje gledam, oka, šta sam ja sve krivo napravio da je došlo do ovoga?"
1:19:33,1:19:34,Zašto smo sada u ovoj situaciji?
1:19:34,1:19:36,Zašto uopće moramo voditi takav razgovor?
1:19:37,1:19:41,"Prije ne, prije bi došli iz DRO-a bi se popizdio i zelupio vratima."
1:19:41,1:19:44,"Otprilike prije 10 godina, 7 godina, 8 godina."
1:19:45,1:19:50,"A danas malo ipak pametnije pristupam, ajmo reći, takozvanim teškim razgovorima."
1:19:50,1:19:55,Iako na kraju to je i dalje samo razgovor o temama o kojima ljudi ne vole razgovarati.
1:19:56,1:19:59,I možda je opet puno pretpostavki i predrasuda.
1:19:59,1:20:00,Pa uvijek je.
1:20:00,1:20:03,"Možda taj razgovor uopće nije težak za drugu stranu, teško je samo za tebe."
1:20:04,1:20:05,Upravo to.
1:20:06,1:20:16,"I onda postavljam, ja uvijek, ono treba samo framing napraviti, ja uvijek kažem ljudima, gledaj, htio bih razgovarati s tobom, osjećam se loše zbog određenih stvari, a vjerujem da sam potpuno toga."
1:20:16,1:20:29,"puno toga sam sa sobom krivo izdefinirao, odnosno sam sa sobom krivo pretpostavio, pa bi čisto ono to htio otvoriti, evo pa da pričamo pa da vidimo jesam li ja to zabrijao ili stvarno to je tako ili ako je tako da vidimo što možemo s tim napraviti."
1:20:30,1:20:41,"Volim se takav framing napravit, nije da ih imam sve manje i manje u zadnje vrijeme imam jer nekako trudim se neću reći izbjegavati, ja nisam tip koji izbjegava nego valjda sam naučio ja komunicirati pa mi se manje to događa."
1:20:41,1:20:43,Prije mi se dosta događalo moram priznati.
1:20:44,1:20:48,Hajde da se vratimo na ono od početaka negdje.
1:20:50,1:21:08,"Ti si rekao ako sam ja dobro shvatio, ti ćeš me ispraviti da je tvoja misija učiniti prodaju zapravo rebrandirati prodaju da nema toliko loš prizvuk ili negativnu konotaciju."
1:21:09,1:21:18,"Pa sad pitanje zapravo kako bi ti učinio prodaju više seksi, više privlačnom ili možda misliš da već sada je."
1:21:19,1:21:23,"Meni se čini da nije, a imam osjećaj da bi mogla biti strašno seksi i privlačna."
1:21:25,1:21:29,Zapravo je samo mislim da se trebamo maknuti od nekih.
1:21:30,1:21:32,Jer u prodaju se barem uvijek najveće pare.
1:21:33,1:21:34,"To definitivno, to definitivno."
1:21:35,1:22:15,"Ali ti je sve više i više, znači šta se desilo s prodajom, to je, mislim da je to i Daniel Vičanić priča isto kod sebe, ali to je jako bitan zapravo moment u prodaji pa ću ga ponoviti, da su tamo negdje dvije tisuće su zapravo bile prekretnice za prodaju jer su informacije postale dostupne ti si imao prije ono prodavače koji su išli od vrata do vrata jer oni su bili prenositelji informacija i zato je vrlo često prodaja je dobila taj sinonim da je to jednako laganju jel'smo oni mogli reći bilo šta, šta god ti on kaže to je tako i kako su informacije postale dostupne došlo ti je do toga da ti vrlo često imaš prodani paradoks jer ti kao prodavač prodaješ određenoj osobi nešto, a osoba zna više o tom proizvodu od tebe."
1:22:16,1:22:21,"Pogotovo ako je tehnički potkovan, ako je tehnički proizvod, onda ti počinju postavljati pitanja na koje ti nimaš odgovori, diskreditirate."
1:22:22,1:22:46,"E sad, kako napraviti prodaju seksa, ja bi rekao, sad će opet ovo zvučak možda malo blesavo, ali ja bi rekao jednostavno prestat prodavat i ja bi rekao vratit prodaju ljudskosti, jer vrlo često me pogotovo u zadnje vrijeme pitaju šta će napraviti AI u prodaji odnosno umjetna inteligencija, hoće li biti promjena, hoće li prodavači ostati bez posla, pa bi rekao baš zato neće."
1:22:47,1:23:06,"Automatizirat će se dosta procesa, dosta repetitivnih stvari, ali neka prodajna mjesta koja zapravo uopće nisu prodajna, mislim ja recimo blagajne u dućanu ne smatram, ti možeš nekakav up selling napravit gore, ali realno danas su za automatizirane blagajne, ti si samo u principu uštedio."
1:23:07,1:23:15,Ali u bit to biu odnosno u nekakvoj kompleksnijoj prodaji mislim da će ljudi i dalje ostati i sve će više i više biti seksi porazgovarati sa nekim.
1:23:16,1:23:30,"Jer ti što više ideš u tehnologiju, to se više gubi ljudskost, samim time ljudi imaju sve veću potrebu za ljudskost i to je meni sociološki eksperiment po imenu korona virus ili ti COVID jako lijepo pokazao."
1:23:30,1:23:45,"Znači on u početku ne morate raditi, idemo od doma, e idemo od doma, ne morate raditi, prođe tjedan dana, ja bi van, e adim i ovaj frenet, ja bi se vidio s ovim, e i odjednom ljudi teže ljudima, odnosno žude za drugim ljudima, mislim pa ljudska smo bića."
1:23:45,1:24:05,"E sad što ti više stavljaš tehnologije, što više toga automatiziraš u prodaju, ja mislim da će prodaja postati sve ljudske i ljudske i ljudske i upravo ove stvari poput povjerenja, iskrenosti, razumijevanja, vjerodostojnosti, ne znam, šta god, koji god hoćeš riječ uzeti od tih će isplivat na površinu i da će prodaja sama po sebi postati sve više i više."
1:24:05,1:24:47,"više seks jer će to biti ako se sve izautomatizira prodaja će ostati jedini kontakt s ljudima zapravo prodaja zapravo već i sada je seks samo što ljudi to još ne shvaćaju svi ne shvaćaju svi daj mi reci da li si ikad čuo za ovu formulu a meni je ta formula ostala opet sam ja pokupio od Alana Žepec sa izrekoma ne znam od koga je on pokupio ili da li je njegovo originalno ako je čestitam znači oni se bave zapravo liderskim edukacijama On mi je fantastičan, profesionalac, fantastičan."
1:24:47,1:24:49,Evo mala reklama za njega.
1:24:50,1:24:51,Bog alane.
1:24:52,1:24:54,"Platit ću, platit ću ne brinem."
1:24:55,1:25:12,"On je rekao zapravo kao njegova firma se zove LQ, LQ bi trebalo znači kao leadership quotient, imamo različite vrste inteligencije, on to podrazumijeva pod LQ kao inteligenciju ili liderstva, lidersku inteligenciju."
1:25:13,1:25:24,"On je rekao da je zapravo formula jednaka IQ, kognitivna inteligencija koju mi običaj komuniciramo i poznajemo,emo, EQ, emotivna inteligencija plus SQ."
1:25:25,1:25:28,"Ja sam njemu rekao, šta ti znači SQ u toj formuli?"
1:25:28,1:25:32,"Ja sam mislio da se radi o social kvocientu, ne, ne, spiritual."
1:25:34,1:25:39,"Duhovna inteligencija, kakvo je tvoje mišljenje o toj formuli, pogotovo u tom aspektu duha?"
1:25:40,1:25:45,"Slušao sam, slušao sam to, ja ću ti se složiti, samo ću refraimati možda nešto što će ljudima biti prihvatljivije."
1:25:45,1:25:48,"Znači, kako ti se to definira u prodaji?"
1:25:48,1:25:59,"Ti imaš, prodaju ja volim podijeliti u dva segmenta, znači jedan je naučljivi dio prodaje, a drugi je upravo taj spiritualni odnosno na neki način vrlo često povezano s našim identitetom."
1:25:59,1:26:01,A identitet je opet ono što smo pričali.
1:26:01,1:26:04,"Znači naš karakter, naša osobnost i sve spojeno zajedno."
1:26:04,1:26:06,"Sve spojeno zajedno to bi bio naš identitet, ono što mi jesmo."
1:26:06,1:26:11,"E sad ono što je zanimljivo u ovoj cijeloj priči, možemo to nazvati spiritual intelligence bez problema."
1:26:11,1:26:26,"Znači ja to potpisujem odmah da bi naš identitet ono što mi sami jesmo, koliko jesmo, možemo to čak i reći produhovljeni ili ako ćeš gledati iz konteksta psihologa koliko sami dobro razumijemo sebe da bismo mogli razumjeti druge, da će nam to biti multiplikator."
1:26:26,1:26:27,Što to točno znači?
1:26:28,1:26:35,"To bi značilo da ovaj dio koji možeš naučiti da to su ti, znači job skills ili ti nekakve, to su ti vještine posla koji radiš."
1:26:36,1:26:42,"Znači ako radiš o autoind industriji moraš nešto na to o autima, moraš znati, koristiš određene programe, softvere i to koji su vezani uz to."
1:26:42,1:26:48,"es druge strane imaš sales skills, to je taj naučljivi dio prodaje koji sam ti rekao, dakle svatko može ih naučiti, nikakav nije problem."
1:26:49,1:26:53,"E sad, to staviš u zagradu, to zbrojit će, to je naučljivo, vrlo lako isponderirati."
1:26:54,1:26:55,"Koliko učiš, koliko ćeš znat."
1:26:57,1:27:14,"A onda ide zapravo puta taj identitet odnosno taj SQ i tu mogu se složiti u potpunosti, koji će te zapravo odrediti da li će to sve što znaš izaći van onako kako treba ili ne baš onako kako treba, ako me kužiš u kojem smjeru idem."
1:27:14,1:27:22,"Znači to će biti neki multiplikator i to ti je zapravo vrlo često timeš ljude koji jako, jako puno znaju, imaju abnormalno visoka znanja, a nisu uspješni."
1:27:23,1:27:23,Zakaj?
1:27:24,1:27:25,Zakaj im ne ide?
1:27:26,1:27:34,"Znači ja znam ljude koji imaju po dva, tri faksa završena, ne mogu ono kod mame živjeti dalje, ne mogu izaći uopće iz svojih ustavljenih obrazaca."
1:27:34,1:28:02,"Onda imaš jako puno ljudi takozvani fahidioti koji ne znači da su ljudi idioti, to ne znači ništa negativno nego fahidioti je osoba koja jako puno zna o određenoj temi, toliko je duboko zaglibila u tu temu da ne vidi šire odnosno van te teme i samim time teško dolazi u interakciju s drugim ljudima jer jednostavno može se držati u svom malom krugu ljudi, tamo se nadje sa tim ljudima, tko zna više, a realno ako takva osoba treba nešto prodat kako će?"
1:28:04,1:28:11,"Ne znam jesam ti približio, znači očito je da se nacrta, da se nacrta."
1:28:11,1:28:20,"Znači imaš job skills plus sales skills, to je naučljivo, puta identitet ili ti možeš taj eskiv nazvati."
1:28:20,1:28:21,Slažem se s tom definicijom.
1:28:21,1:28:32,"Evo ti je IQ i ovo ti je, koji je on rekao, IQ, gdje ti možeš naučiti taj dio, a ovo će ti zapravo definirati, u osnovi, veliki multiplikator svega."
1:28:32,1:28:38,"Da, ja volim uzeti za primjer, sad ne znam da li smijem govoriti ime ljudi, ali dobro, budem."
1:28:39,1:28:41,Recimo Zdravko Mamić.
1:28:42,1:28:48,"I sad neosporno je job skills, neosporno je da on fantastičan poznavati nogomet jel tako."
1:28:48,1:28:53,"Znači, fakat zna, fakat čovjek zna, kuži nogomet, kuži taj biznis, kuži menadžer, što kuži to."
1:28:54,1:28:59,"Neosporno je da je fantastičan prodavač, znači njegovi skilovi u prodaji su neosporni."
1:29:00,1:29:02,E sad hoćeš raditi sa njim ili nećeš raditi sa njim.
1:29:03,1:29:07,"Ne zavisi o to dvoje, zavisi o ovome kakav je on tebi ili nije."
1:29:09,1:29:09,Stoji.
1:29:09,1:29:10,Pa je.
1:29:10,1:29:10,Stoji.
1:29:11,1:29:12,I tako na kraju bude.
1:29:14,1:29:17,Ja osobno ne poznam čovjeka tako da mi je teško reći.
1:29:17,1:29:25,"Ja imam određenu sliku o čovjeku koju su nam mediji stvorili, ali ja dok nekoga ne poznam ne mogu reći je li radio s njim ili ne bi."
1:29:26,1:29:27,Htio si me uhvatiti za njim?
1:29:27,1:29:27,Volim.
1:29:28,1:29:28,"Ne, nisam."
1:29:31,1:29:37,"Pa mislim, čak i da si odgovorio da bi volio raditi s njim, ne bi smatrao to nečim lošim."
1:29:37,1:29:46,"Ne, ne, ne, pa nema tu loše ili dobro, to ti samo onako jer ja jednostavno ono što sam naučio kroz ovo vrijeme da medijska slika osobe ne znači da je ta osoba takva."
1:29:47,1:29:54,Ja sam neke ljude upoznao nakon što ih vidiš na malim ekranima ili na radiju ili negdje i totalno ne možeš uopće povezati jedni s drugima.
1:29:54,1:30:07,"Šta misliš kakva je percepcija ljudi koji tebe znaju samo kroz, koji imaju, to se zove super mi je taj termin parasocijalna veza ili odnos, to ti je odnos koji stvoriš ovako na digitalan način."
1:30:07,1:30:21,"Sada ljudi recimo neki misle da me možda poznaju zato što me gledaju satima da mu razgovaram, isto kao što ljudi vide tebe na društvenim mrežama ili čitaju tvoje članke itede Šta misliš, možda imaš nekakav feedback?"
1:30:21,1:30:22,Šta ljudi misle o tebi?
1:30:23,1:30:25,Imam feedback da me se boje.
1:30:25,1:30:26,Da te se boje.
1:30:26,1:30:26,Da.
1:30:27,1:30:27,ozbiljno.
1:30:28,1:30:28,Da.
1:30:28,1:30:33,To mi je onak toga kad sam čuo da se od malih smijete jer mi je to nepoimljivo uopće zašto bi se neko mene bojao.
1:30:33,1:30:43,"A onda kad se sjetim kad su nam cure bile male da su susjedi plašili svoju djecu sa mnom onda možda ima nekog smisla jer ne, ali fakta da je došlo do poziva šuti vedrena."
1:30:43,1:30:44,Zašto?
1:30:44,1:30:47,Zato što bi ja djeca divlje pokvarila da dođem samo i pogledamo oni se smire.
1:30:48,1:30:49,Zašto nemam pojma?
1:30:50,1:30:51,Da li je to neka dominacija?
1:30:51,1:30:53,Da li je to jednostavno tako izgledam?
1:30:54,1:30:54,Ne znam.
1:30:54,1:30:56,Da li je to čisto ono prvi dojam fizički izgled?
1:30:56,1:30:57,Ne znam što bi rekao.
1:30:58,1:31:00,Ali to je feedback koji sam dobio.
1:31:01,1:31:03,"I ja sam, rekli mi pa ljudi, ja sam."
1:31:03,1:31:05,sam mislio da ste vi jako ozbiljni.
1:31:06,1:31:09,"Ja sam puno toga, ali ozbiljan nije nešto što bi stavio."
1:31:10,1:31:13,"Jesam kad treba, znam ja biti ozbiljan i znam biti vrlo strukturirani."
1:31:14,1:31:18,"Ali ovako prije svega, ja se bar smatram, tako sebe vidim, možda sam totalno u zabludi."
1:31:19,1:31:21,"Da sam prije svega zebanta, onda sve ostalo."
1:31:22,1:31:23,To je broj jedan.
1:31:24,1:31:25,Puno prije ovog strahu.
1:31:25,1:31:27,"Pa da, ne, opće mi to onako bilo."
1:31:27,1:31:28,Kako je to moguće?
1:31:29,1:31:30,"Maja da, zanimljivo."
1:31:30,1:31:31,Pa Jelda?
1:31:31,1:31:32,"Je, je, je."
1:31:32,1:31:41,"Evo, sad sam se opet sjetio žepice, zato što mi je on rekao da je zanimljivo, nije riječ koju bi trebao često koristiti, zato što ne znači ništa."
1:31:41,1:31:43,"Da, sjećam se to, sjećam se to."
1:31:43,1:31:46,"Ili tebi reć da, sjećam se, pa to je bilo u podcastu."
1:31:46,1:31:48,"Je, bilo je u podcastu."
1:31:48,1:31:50,"Ne, nemoj koristiti, a više često i dalje, i dalje."
1:31:50,1:31:51,"Sjeti se, sjetiti se."
1:31:52,1:31:52,"Sjetiti se, sjetiti se."
1:31:52,1:31:53,I dalje koristiti.
1:31:53,1:31:55,"To je zanimljivo, nije riječ, ne znači ništa."
1:31:55,1:31:56,"Da, treba elaborirati nešto."
1:32:01,1:32:06,"Samo pouzdanje, koliko je bitno u životu općenito, a koliko u prodaji."
1:32:08,1:32:13,I da li je samo pouzdanje postalo isto ono što je iskrenost i autentičnost?
1:32:15,1:32:17,"Je, ali se pojavila jedna nova riječ."
1:32:18,1:32:23,"Jako puno treninga u prodaji se bazira na samopouzdanju, ja sam ih sam prošao nekoliko."
1:32:24,1:32:28,"I onda kaže, samopouzdanje se mora izgraditi, ono se zgraditi ovog godina, bla, bla, bla, bla."
1:32:29,1:32:30,A šta ti se desi?
1:32:31,1:32:36,I se čuze izraz overconfidence ili ti prekomjerno samopouzdanje.
1:32:37,1:32:39,I to ti je jako tanka linija.
1:32:40,1:32:47,"I to ti onda prerasta u one kokines ili ti na neki način, baš nemamo dobre riječi u Hrvatskom, baš mi fale riječi, prepotentnost."
1:32:48,1:32:49,Kurčevito.
1:32:49,1:32:52,"Da, kurčevito."
1:32:53,1:32:53,"E, ne."
1:32:55,1:32:55,Kurčevito.
1:32:56,1:32:56,Kurčevito.
1:32:57,1:32:58,Hrvatska riječ.
1:32:59,1:33:01,"Evo, to ćemo sada za uvodu u ovaj."
1:33:01,1:33:02,Potkastaviti.
1:33:02,1:33:02,Čevitost.
1:33:03,1:33:03,Čevitost.
1:33:05,1:33:06,"Slušaj, to je lijepo za izgovor."
1:33:06,1:33:07,Kurčevito.
1:33:07,1:33:09,"Da, ozbiljno."
1:33:09,1:33:10,Kurčevito.
1:33:10,1:33:10,"Da, dobro."
1:33:10,1:33:18,"U svakom slučaju, problem sa samopouzdanjem je što ako pređeš granicu samopouzdanja, onda ide u tom smjeru."
1:33:19,1:33:22,"I to se, jako sam puno ljudi vidio u prolječima, se upravo to desi."
1:33:23,1:33:30,"Izgrade se, fakat rade na sebi, razvijaju se i zaborave biti ono što se kaže, humble."
1:33:31,1:33:32,Opet mi fali riječ.
1:33:32,1:33:33,Ponizan.
1:33:33,1:33:33,Ponizan.
1:33:34,1:33:43,"Jer ti ako odeš, super je samo pouzdanje, ali što nije lijepo ostati na neki način ponizan i zahvalan da si nešto postigao."
1:33:43,1:33:48,Jer ljudi kad postanu jako samo pouzdani zaborave na ljude koji su im pomogli da dođu do toga.
1:33:49,1:33:50,I to mi se njihovo ne sviđa.
1:33:50,1:33:58,"Tako da samo pouzdanje definitivno da, rekao bi da da, to je sastavni dio prodaje, to je sastavni dio našeg identiteta koji bi trebao biti ugrađen."
1:33:58,1:34:10,"Samo pouzdan znači isto tako čvrsto stajati iza onoga što govoriš, znači to bi bilo isto vrlo blisko povezano sa autentičnošću, zato ti kažem dobro si rekao da ide u istu kategoriju riječi."
1:34:11,1:34:16,Da li jako puno ljudi ne razumije što znači biti samopouzdan?
1:34:16,1:34:57,"Definitivno, to sam sto posto siguran i samo se postavlja pitanje koliko jednoj osobi treba da izgradi samopouzdanje i da li svatko može izgraditi samopouzdanje jer ako si dobar u nečem nema razloga da ne budeš samopouzdan u tome ili ako si dobar u nečem zašto ne bi bio samopouzdan to bi trebalo biti prirodni slijed događaja ok kad si ruki kad ne kužiš još ništa pa kako se razvijaš, kako se gradiš, kako si sve bolji i bolji, kako imaš bolje rezultate, samo pouzdanje bi trebalo biti prirodni splet događaja."
1:34:57,1:35:09,"Ljudi će vrlo često nakon deset godina karijere koja je, skoro sam rekao riječ, jako dobra karijera, i dalje reći, ja nisam samo pouzdan."
1:35:10,1:35:16,"To možda ne znači da nisi samo pouzdan, nego si samo ponizan i zahvalan."
1:35:17,1:35:18,Jer kužiš.
1:35:19,1:35:22,Jako mi se sviđa ta priča.
1:35:22,1:35:28,"Teško je uopće reći da netko tko deset godina radi, koji je uspješan i kome super ide i sve super, da je ne samo pouzdan."
1:35:29,1:35:37,"Možda ima svoju percepciju da nije samopouzdan, ali ja bih samo rekao da je ta osoba i dalje ponizna i da crv stoji nogama na zemlji i da nije poletila previsoko."
1:35:38,1:35:41,A oni koji kažu da su samopouzdani obično uopće nisu samopouzdani.
1:35:42,1:35:49,Ovo sam spomenuo kad smo ognjeni ja snimali podcast i onda se nisam mogao sjetiti treće stvari.
1:35:50,1:35:52,Morat ću se nekog ginkgo bilo buku vod.
1:35:52,1:35:53,"E, ja sam počeo."
1:35:54,1:35:55,Prošle godine.
1:35:55,1:36:01,"Pa evo danas sam kliknuo tu jednu sedamnaest komara samo da mogu pametne stvari izbaciti, ne šalim se, jedan sam polubio."
1:36:02,1:36:02,Da.
1:36:04,1:36:19,"Vidiš, postoji jedan paradoks koji sam ja uočio da je stvarno u istini, barem u mom slučaju, ja imam jedno uvjerenje za sebe da ću ono, da sam predodređen za uspjeh, da ću razvaliti da će ovaj potpis biti najgledaniji potpis na svijetu."
1:36:19,1:36:20,Na dobrom se putu.
1:36:20,1:36:28,"A onda s druge strane, svaku večer kad legnem u krevet pomislimo ovo više nikad nitko neće gledati, ovo je katastrofa, ovo ništa ne valja."
1:36:28,1:36:37,"Znači, osobe koje imaju i sada opet postoji spektar, znači ja sad ne kažem da ću ja uspjeti radi toga, nego postoji spektar."
1:36:37,1:37:01,"Znači i u tom spektru što je to izraženije, te osobe imaju, taj paradoks je izraženiji, znači strašno veliki osjećaj predodređenosti za nekoga ja sam predodređen, mesija, whatever za to, ali opet s druge strane tako neki opet, opet mrzim što ne mogu sjetiti hrvatske riječi inferiority kompleks."
1:37:01,1:37:10,"Znači kao nikad neću biti dovoljno dobar, nisam dovoljno dobar i sad zaista spojite to jedno i drugo u jedno."
1:37:10,1:37:11,Ili se ti kad tako osjećaš?
1:37:12,1:37:15,"Da, ali ja sam skužio zašto je to tako."
1:37:16,1:37:18,Možda najbolje da to nacrtam ako smijem.
1:37:19,1:37:19,Ja volim to.
1:37:22,1:37:22,Imate još vrijeme?
1:38:02,1:38:06,"Fokusira se na proces, pusti cilj, cilj je rješenje, cilj je rezultat, cilj je nešto što se desi na kraju."
1:38:06,1:38:08,Znači to je normalni slijed događaja.
1:38:08,1:38:11,I opet ti kažem samo poznanje mora biti normalni slijed događaja.
1:38:12,1:38:20,"Jer ti kad dođeš do ovdje i ako misliš sada da ćeš biti samo pouzdan u trenutku kada si došao na svoj cilj, pa tada ćeš već imati neki cilj ovdje."
1:38:23,1:38:25,Samo u odnosu na točku u vremenu.
1:38:25,1:38:27,"Kako kaže Lino Červar, fokusira se na igru."
1:38:28,1:38:43,"Pa to je jedina stvar na koju se možeš fokusirati i ne možeš se fokusirati na to šta će suci napraviti, ne možeš se fokusirati, tojest ne možeš kontrolirati i ne bi se trebao onda fokusirati šta će suci napraviti, šta će protivnički igrači napraviti i kakav će rezultat biti, fokusira se na igru."
1:38:44,1:38:44,"Da, slažem se s tim."
1:38:44,1:38:51,"Ja ti isto kažem ono kad mi netko u prodaju kaže, ali konkurencija, kakve veze konkurencija je jednostavno?"
1:38:51,1:38:53,"Pusti ih da rade svoj posao, ti radi svoj posao."
1:38:54,1:39:04,"I sad, onda ja kad radimo recimo uvjerenja, onda ja njih pitam da li opravdavanje svojih neuspjeha zbog konkurencije ulazi u uvjerenja ili ne."
1:39:05,1:39:07,Nisu mi baš na čisto svi.
1:39:07,1:39:10,Znači oni će najlakše okriviti konkurenciju zašto ja nisam uspio.
1:39:13,1:39:15,Šta bi te mogao pitati za kraj?
1:39:15,1:39:17,Šta bi te mogao pitati za kraj?.
1:39:18,1:39:18,Volim.
1:39:22,1:39:25,"Evo, super je ovaj trenutak za tako nešto."
1:39:25,1:39:28,"Ovako je malo vjetmuran dan, oblačno je."
1:39:31,1:39:36,"I ja razmišljam, već ljudi koji gledaju znaju da razmišljamo o tome često i volim svoje goste pitati to."
1:39:39,1:39:42,"Kako ti gledaš na smrti, kako razmišljaš o smrti?"
1:39:43,1:39:45,Mhm.
1:39:46,1:39:47,Vi ste to iščupljali sad.
1:39:48,1:39:49,"Ali da, pitao si par ljudi."
1:39:52,1:39:54,"Pa sastavni dio života, uopće nemam."
1:39:55,1:39:56,ne razmišljam uopće o smrti.
1:39:58,1:39:59,Iskreno ne razmišljam.
1:39:59,1:40:00,"Ne, fakat uopće ne razmišljam."
1:40:01,1:40:07,"Jedinu stvar koju sam napravio je to na nagovor, uvijek da sam uplatao životno osiguranje u slučaju da se ne daj Bože meni nešto desi, da."
1:40:10,1:40:18,"Prodali su mi, ali vrlo na lijep način, nisu me zastrašivali jer ja ne volim, ja nisam jedan od onih koji ćeš mi prodati zastrašivanjem, meni je to odbojno."
1:40:19,1:40:29,"Ali više je bilo s obzirom da imaš kredite i te neke stvari, pa kao ima smisla da si uzmeš životno, ako se ne daj Bože šta desi tamo si na cesti pa da se to pokrije."
1:40:30,1:40:34,"Ali o smrti, pa mislim, to je nešto neminovno."
1:40:38,1:40:39,Ne mogu reći da razmišljam.
1:40:39,1:40:52,"Čak, možda bi trebao razmišljati sad kad me pita, možda bi trebao razmišljati malo čak i o svojim nekim postupcima i o nekim rizicima u koje se upuštam jer ja ti imam jednu krilaticu koju jako volim, no risk no fun."
1:40:54,1:41:00,"I možda bi to sad kad me pitaš iz konteksta smrti, možda bi malo to trebao refraimati."
