Start (HH:MM:SS),End (HH:MM:SS),Segment
0:24:44,0:24:50,I zapravo kad zakasniš taj sastanak ništa se ne desi jer je osoba s kojom se trebao sastati na tom sastanku i su zapale u istoj gužvi.
0:24:51,0:24:55,I onda sam sebi stvoriš neku sliku da će se nešto desiti a realno se ništa ne desi.
0:24:56,0:25:26,"Mislim da je Oscar Wilde jednom to napisao da imao sam sto problema od kojih se devedeset osam nikad nije desilo mislio sam da imam sto problema od kojih se devedeset osam nikad nije desilo rekao bi ja i jay z isto da i jay z imam devedeset devet problema ali žena nije ni jedna od tih ja bi Ja bih iskoristio ovu priliku sada da ako gledaš ovu epizodu a ne znaš tko smo i što smo, ja sam Vinko Mihaljević, ovo je Lud Podcast, mjesto na kojem istražujemo ideje razvoja čovjeka i društva."
0:25:28,0:25:49,"Pa puno bi mi značilo da zapratiš YouTube kanal Lud Podcast-a, a ti koji možda već imaš nekakav odnos i znaš što stvaram sa svojim gostima, puno bi mi značilo da daš financijsku podršku što možeš na dva načina ili mjesečno pretplatom na YouTube-u ili kroz jednokratnu donaciju putem PPP-a."
0:25:49,0:25:56,"putem PayPala, a sve to možeš vidjeti u opisu videa ispod videa na YouTubeu."
0:25:56,0:25:57,Ispod videa.
0:25:57,0:25:58,Vraćamo se nazad.
0:26:03,0:26:03,Nećemo.
0:26:07,0:26:08,Hvala ti još jednom.
0:26:11,0:26:16,Ovo mi je zapravo dosta zanimljiva.
0:26:16,0:26:52,"izjava koju je Steveve Jobs zaposlio kao CEO-a, kao CEO-a Apple-a koja ga je slavno koštala njegove pozicije u Apple-u gdje je on kao vlasnik, mislim da je bio u to vrijeme i dalje većinski vlasnik Apple-a zapravo izašao iz Apple-a i on je njega pitao prilikom zapošljavanja hoćeš li cijeli život prodavati zaslađenu vodu ili ćeš se pridružiti misiji spašavanja svijeta."
0:26:52,0:26:54,Sada to na engleskom zvuči još malo atraktivnije.
0:26:57,0:27:11,"Ti se danas baviš prodajem nekoliko stvari, ali ajde ja bi se fokusirao na ovaj dio zbog kojih ti ljudi znaju oko čega si ti izgradio svoj osobni brand, a to je zapravo prodaja, treninga, prodaje."
0:27:12,0:27:20,"To je ono, ti si u nekom meta svijetu, znači učiš o učenju ili prodaješ to kako dobro prodavati."
0:27:20,0:27:23,Šta ti želiš prodavati do kraja svog života?
0:27:24,0:27:25,Ali je to to?
0:27:28,0:27:44,"Ja imam svoju misiju koju sam negdje prije nekakvih desetak godina sam sebi zacrtao i sada će možda zvučati ovako malo američki, ali to je zaista ono što ja želim napraviti jer ja sam stvarno cijeli život sam u prodaji, od kad znam za sebe."
0:27:45,0:28:19,Negdje dvije tisuće petnaest sam počeo kući da je zapravo to što sam ja u prodaji što sam ja ponosan da sam u prodaji da to zapravo nije nužno precipirano kao nešto dobro odnosno da je prodaja precipirana kao nešto onak uvaljivanje muljanje laganje opet da se vrati i to me malo počelo smetati odnosno počelo me smetati na način da sam da sam se počeo loše osjećati zbog onoga što radim i onda sam počeo sam sebe preispitivati pa dobro da li ja uvaljam ljudima da li ja ljudima želim pomoći s tim proizvodima ili im uvaljam to samo da prodam i zadovoljem neki KPI.
0:28:19,0:28:24,Znači počeo sam promatrati prodaju ne kroz brojku nego kroz nekakvu emociju ili zadovoljštinu.
0:28:25,0:28:37,I onda sam sklužio da ja zapravo to sasvim ok radim da ne uvaljam nego da uspijem kroz iteraciju i komunikaciju pronaći zaista problem što je srž prodaje i samim time riješiti taj problem da li je to proizvodom ili uslugom ili nečim.
0:28:37,0:28:41,"I sklužio sam da mi to dobro ide, prirodno, znači imaš talent za nešto."
0:28:42,0:29:03,"I onda sam zapravo sklužio da moja misija na neki način mora biti i da to želim zaista dan danas i ako me pitaš kamo idem i čim ću se bavit ne znam, ali znam da će misija ostati, a to je da se sama percepcija prodaje pomakne u pozitivu, da prodaja počne biti percipirana kao nešto pozitivno."
0:29:03,0:29:08,"Znači promjena percepcije prodaje, ako ćemo reći šta ja želim postići."
0:29:08,0:29:23,"Sada, da li će to biti treninzima, edukacijama, govorima, u zadnje vrijeme jako puno me zovu na ove govore firme, motivacijske govore, iako zapravo motivacijske govore, krivi izraz, trebalo bi biti inspiracijski govor jer motivacija dolazi iznutra, inspiracija izvana."
0:29:23,0:29:27,"I to mi se zapravo jako sviđa, to mi je super."
0:29:27,0:29:47,"Samo opet ti se događa pogotovo u ovom biznisu edukacija, ono što je meni super, ja sam u B2B-u, tako da svaki puta kada radim sa nekim novim klijentom susrećem se sa nekim novim izazovima, s nekim novim problemima, odnosno manje-više sa istim stvarima, ali u nekom drugom okviru, u okviru nekog drugog biznisa, dosta je repetitivno."
0:29:48,0:30:09,"Što je na svu sreću da je tako, jer recimo da radim u B2C-u, da stalno imam nekih dvadeset ljudi koji mi dolaze na neko predavanje, dvadeset novih ljudi radi, dvadeset različitih firmi, sa dvadeset različitih očekivanja, sa dvadeset različitih bajasa odnosno nekakvih percepcija prodaje, a ja stalno pričam jedno te isto, vjerojatno bi vrlo brzo sam sebi dosadio, onda ne bi to mogao raditi."
0:30:09,0:30:20,A ovak barem imam tu nekakvu širinu da uvijek nešto novo nađem u prodaji što me zanima i što čemu se posvećujem i što na neki način čak kam istražujem dalje na svoj način.
0:30:21,0:30:34,"Sad netko će reći da čitam jako puno knjiga, ja sam više tip ovog digitalnog doba gdje ću otići na YouTube i poslušat sate i sate i sate materijala od tuđih mišljenja, ajmo reći da bih gradio svoje mišljenje, opet se vraćamo na ono."
0:30:35,0:30:40,"I tako to ide, tako da kad me pitateitate šta ću prodavati do kraja života, pa mogu reći sebe."
0:30:40,0:30:47,"To je jedino što ću prodavati, što sigurno ću prodavati jer šta god da radim, opet ću na neki način to biti ja."
0:30:48,0:30:55,"Možda u nekom drugom obliku, sa nekim drugim setom razmišljanja ili sa možda produhovljenija, možda nekako drugačiji, ali to opet bit ja."
0:30:59,0:31:09,"Ona popularna, ti i Saša ste zajedno s ognjenom bagatinom uspjeli dovesti Jordan Belforta u Zagreb i čestitam i tebi osobno na tome."
0:31:12,0:31:14,Treba nam još više takvih događaja u Hrvatskoj.
0:31:15,0:31:22,"I sad ona njegova slavna je bila kao iz filma, ali kao Selemitis Pen, prodaj mi ovu kemijsku."
0:31:23,0:31:30,"I sad si mi dao, si mi jednu novu dimenziju toga kad si rekao da želiš prodati sebe."
0:31:32,0:31:41,"Nekako kad kažeš prodaj mi ovu kemijsku, shvaćam princip prodaje, gdje slušaš drugu osobu, kakve probleme ta osoba ima itd."
0:31:42,0:31:46,"Više zapravo, više si ulozi u kakvoj sam ja, sada postavljaš pitanja i slušaš."
0:31:49,0:31:52,Ali kako koristiti iste principe kod prodaje sebe?
0:31:53,0:31:56,"Ajde mi baš opiš, kako bi prodao sebe?"
0:31:58,0:32:01,"Pa tako da se ne prodaje, prodaja bez prodaje."
0:32:02,0:32:03,Što znači?
0:32:03,0:32:21,"Vratimo se na ono što sam ti zapravo rekao u nekom trenutku prije, zapravo što se više, kad da kažem to sad, ajmo reći ovako, što se više trudiš nešto prodati to ćeš na neki način biti dalje od uspjeha da bi to prodao."
0:32:21,0:32:35,"Sada ovo zvuči to tamo čudno i abstraktno, ali Ali pogledajte se na sljedeći način, što ti je nešto nedostupnije, to veću žudnju imaš za tim i to više to želiš kupiti."
0:32:37,0:32:45,"Drugim riječima, ajmo reći ako ću željeti prodavati sebe, što ću više biti nedostupan ljudima, to će me više ljudi željeti kupiti."
0:32:46,0:32:46,Imate to smisla?
0:32:47,0:33:03,"E sad, ja sam možda ono, ljudi koji me poznaju i to znaju da sam uvijek svima dostupan na raspolaganju, uvijek ću govoriti na poruku, na mail, nisam ono jedan od njih, čak odgovara na spam poruke na LinkedIn-u, znači one, na one Salespeeševe, odgovorio im ono, evo, Hvala vam puno na vašoj pozornosti, nisam zainteresirana."
0:33:03,0:33:10,"Ako hoćete biti uspješniji u tome što radite, ja sam prodajni trend, slovo da mi se javite, ja odmah njima prodam, je li mi se javila jedna ženska."
0:33:11,0:34:13,"Ali nije mi poanta da ja nekome namećem sebe, nego kroz ono što radi, na što ti ono, ako si sami, si neka sluša, ja njega baš ono od dvije tisuće devet kad sam prvi put čuo taj golden circle i start with white nešto što je totalno logično jednostavno i zapravo si to negdje znamo u našoj podcesti ali je tako lijepo izdefinirano da ti je lako prihvatiti odnosno razumjeti te stvari i I kažem ti, ja sam počeo pisati i pisati i pisati tamo negdje dvije tisuće šesnaest i dvije tisuće sedamnaest baš ozbiljno pisati i ljudi su se jednostavno počeli kačiti na tu moju misiju na ono što ja želim postići i kad kažem prodavati sebe eto jednostavno na neki način skupiti dovoljno ljudi koji jednostavno razumiju ono što ja želim postići onda se više ne prodaješ nego jednostavno imaš na neki način ljude koji razumiju ono što želiš postići i više ne prodaješ ništa nego oni jednostavno kupuju ono što žele kupiti od tebe da li je to ispravan put ili nije da li ja imam sistem neki u pozadini pa nemam znači ajmo početi od toga kako je nastala moja knjiga?"
0:34:13,0:34:14,Jesam li to pričao?
0:34:14,0:34:23,"Pa bilo je korona i bio sam na Korčuli i bilo je jako toplo, a ja volim gemišt."
0:34:23,0:34:26,"I bilo je pošip, pa baš onako puno, po povoljnim cijenama."
0:34:26,0:34:28,Ja sam pio pošip i pisao.
0:34:29,0:34:31,I u četiri tjedna sam napisao.
0:34:33,0:34:37,Složio hrpu tih članaka koje sam povezao u jednu knjigu.
0:34:38,0:34:43,"Napisao sam ja puno toga, ali sam onda objavljivao malo po malo na LinkedIn-u i evo tako je nastala knjiga."
0:34:44,0:34:45,Viška vremena sam imao zapravo.
0:34:50,0:34:51,gdje sam sad otišao?
0:34:51,0:34:54,Samo sam sebi sam takvu digresiju napravio da više ne nešto sam pričao.
0:34:54,0:34:55,Pustio sam te da pričao.
0:34:57,0:34:58,Pustio sam te da se ukopaš.
0:34:58,0:34:59,"Da, baš sam se ukopao."
0:35:01,0:35:05,"Zapravo pitao sam te, ne znam da li sam dobio odgovor, vjerojatno nisi."
0:35:06,0:35:07,Kako prodaješ sebe?
0:35:07,0:35:10,Ti si rekao prodaješ sebe na način da se ne prodaješ.
0:35:12,0:35:22,"Da li je možda preciznije onda prodavati svoju misiju, a ne prodavati sebe, a ti si samo platforma kroz koju se prodaje ta misija."
0:35:23,0:35:27,"Sad, ajde idem onda na sljedeće pitanje, pa ću vam pokušati otpakirati kroz to."
0:35:28,0:35:30,Zapravo što je prodaja?
0:35:30,0:35:36,"Da li je to komunikacija, da li je to slušanje, da li je to gluma, da li je to odnos, da li je to utjecaj, da li je to uvjeravanje?"
0:35:37,0:35:37,Što je prodaja?
0:35:38,0:35:55,"To je definicija koja se u mojoj glavi promijenila valjda deset puta već do danas, ali prodaja je, sad mogu onu svoju flosku reći srce, duša i krvo tog svakog biznisa i bez prodaje zapravo teško da možeš u biznisu bilo što napraviti."
0:35:55,0:36:11,"Ali komunikacijski gledano, prodaja je sve, prodaja je za vođenje, prodaja je na bilo koji način da komuniciraš sa nekim i želiš nametnuti svoje mišljenje, evo to će ti Saša ja mislim potvrditi, komunikacijski obraci nisu možda isti ali su vrlo, vrlo, vrlo slični."
0:36:11,0:36:31,"Sad smo nedavno imali ovog bedboja baš u gostima, ok, malo je bio ovaj, sam panel je malo bio provokativan, štrfora, ja volim provokativne stvari, ali ti zapravo skužiš da u srži komunikacije, kad gledaš samo ogoliš komunikaciju, sada biraš riječi koje ćeš koristiti, udvaranje i prodaja ima totalno iste obrasce."
0:36:32,0:36:34,Jer ti želiš postići reakciju kod druge strane.
0:36:35,0:36:59,"E sad, da li ćemo biti onak površni pa ćemo reći, okej, prodaja je u suštini samo komunikacija sa svim svojim prednostima i manjama, verbalna i neverbalna, možemo, ali ja bih rekao da je prodaja i puno više od toga, jer prodaja je povezana ne samo sa biznisom, nego sa svakodnevnom komunikacijom, da li u obitelji, da li sa svojim djecom, da li samo se to ne zove prodaja."
0:37:00,0:37:03,Netko će to nazvati uvjeravanje ili možda čak i manipulacija.
0:37:03,0:37:18,"I zato ta riječ je toliko zbunjujuća na momente da kad nam kažem prodaja, imaš jednu vježbu super, tu možeš napraviti, kašbice i Kada ćeš biti sa ekipom, piše riječ prodaja i nek ti svako da po jednu, dvije asocijacije, da ćeš vidjeti šta još dobiti."
0:37:21,0:37:53,"Većina riječi će biti sedamdeset posto riječi obično bude negativna percepcija prodaje koje su provela asocijacija prema prema tvom iskustvu i prema mom iskustvu manipulacija manipulacija a onda ja pitam dobro da li je manipulacija nužno uvijek negativna stvar da li manipulacija može biti pozitivna pa je može šta misliš može ako želiš dobar ishod za nekoga onda je manipulacijaacija pozitivna, ako želiš loš ishod za nekoga onda je manipulacija negativna."
0:37:54,0:38:00,Na kraju krajeva svatko i to opet sad ću se usuditi generalizirati na dnevnoj razini manipulira.
0:38:00,0:38:02,A tko su najbolji manipulatori?
0:38:03,0:38:03,Pa djeca.
0:38:04,0:38:13,"Ali oni su neiskvareni manipulatori, znači oni nemaju set uvjerenja, oni jednostavno šute, oni ako vide, ako ti kažeš ne, ne, ne, ne."
0:38:13,0:38:20,"I onda ako je dijete dovoljno dosadno, ti ćeš onda reći da hajde nek ti bude, sad neka ga se riješiš jel?"
0:38:20,0:38:26,"I onda oni skuže u podsjetnici svoje, ha znači ako sam dovoljno dosadan onda ću ja dobiti odgovor koji ja želim."
0:38:27,0:38:27,Biće po mom.
0:38:28,0:38:31,"I to obično je kod mama, puno bolje pali nego kod tata."
0:38:33,0:38:34,"Ali, dobro, lažem, nije istina."
0:38:34,0:38:37,"Kćeri kod tata, sinovi kod mama, to je ono."
0:38:37,0:38:38,Usvojeno tako.
0:38:39,0:38:40,"Nemam statistiku, nemam statistiku."
0:38:40,0:38:42,"To je neko moje osobno iskustvo, moje mišljenje."
0:38:44,0:38:46,Tko bolje prodaje ti ili tvoje djece?
0:38:48,0:38:50,Kad prodaju tebi ili ženi?
0:38:52,0:38:55,"Nemam pojma, evo, dobro pitanje."
0:38:58,0:39:01,"Pa jako dobro prodaju njih dvije, dvije kćeri imam."
0:39:01,0:39:06,"djekčari imaju jako dobru prodaju, jako dobro prodaju priču i ideje, što je alarmantno napravili, da, jako dobro."
0:39:07,0:39:16,"Ali oni dugo nisu znali šta ja radim, onda sam i hodio sa sobom na jednu konferenciju, to sjedilo u publici i onda mi je bilo a ti to radiš."
0:39:16,0:39:24,"Ja rekom da, šta ste mislili, kažem mi nismo mi to tako zamišljali, oni su mislili da."
0:39:25,0:39:40,"Meni je najčešće kad kod kuće ja upalim televizor i uglavnom onda palim YouTube aplikaciju i onda kad upalim onda dođe par računa znaš, jedan račun je odlut potkest, a druge ne znamo žene, treći je on kick kao svaki put kćer."
0:39:40,0:39:43,"Kada vidi tata, to si ti, kaže gore na televizoru."
0:39:44,0:39:45,Šta radiš ti gore?
0:39:45,0:39:46,Pa da.
0:39:46,0:39:46,Da.
0:39:47,0:39:53,"Našta, ajde se vratimo na mišljenje drugih ljudi, ono što smo konzumirali."
0:39:53,0:40:02,"Jedna od najatraktivnijih knjiga na temu međuljudskih odnosa, pa možeš staviti isto i pod kapu, prodaje How to Win Friends and Influence People."
0:40:03,0:40:08,"Pa ne znam onda imaš onu drugu koja je meni isto draga, 48 Laws of Power."
0:40:08,0:40:11,"Robert Green, to je taj tip što sam ga se htio sjetiti, sad sam ga se sjetio."
0:40:11,0:40:12,"Čuo, ali čitao nisam."
0:40:13,0:40:21,"postoji strašno puno sadržaja, strašno puno svih vrsta sadržaja na tu tematiku i to je nevjerojatno."
0:40:21,0:40:36,"Znači mi smo ljudi socijalna bića i mi toliko puno energije i vremena investiramo u to da saznamo nešto o sebi, da saznamo nešto jedni o drugima da bi bili uspješniji u interakciji jedni s drugima."
0:40:37,0:40:38,To je ono fascinantno.
0:40:39,0:40:40,Fascinantno.
0:40:41,0:40:48,"A na kraju želiš saznati nešto o nekom drugom a na kraju shvatiš da ako se ti ne prilagodiš, ne promijeniš sebe da drugu osobu ne možeš promijeniti."
0:40:48,0:40:49,Je li tako?
0:40:50,0:41:04,"Mislim, ja sam to tako nekako sebi, znači kad podivljaš na nekoga i pokušavaš nekome nešto dokazati onda shvaćaš da zapravo tako dugo da ti promijeni svoj pristup kako to pokušavaš dokazati ili objasniti ili fraimat kako god hoćeš reći nećeš ništa postići."
0:41:04,0:41:06,Znači ćeš osobu otprost ve rasteret.
0:41:09,0:41:12,Što misliš o glumi i prodaji?
0:41:13,0:41:14,Gluma je prodaja.
0:41:16,0:41:20,Da li vidiš kod ljudi koji se bave prodajom elemente glume?
0:41:22,0:41:23,Pa vidim.
0:41:23,0:41:29,"Vidim što Što nije nužno loše, jer."
0:41:31,0:41:33,"Ajde ti, možda najbolje kroz primjer."
0:41:35,0:41:36,Ja sam do negdje 2004.
0:41:36,0:41:37,bio dosta zatvoren.
0:41:38,0:41:41,"Kad kažem zatvoren, ok, volio sam se veseliti."
0:41:41,0:41:45,"To, recimo, mikrofon mi je bio stran i jednako nezgodno mi je bilo iza."
0:41:45,0:41:46,Tu se da znaš lijepo.
0:41:46,0:41:48,"Dobro, čuo si."
0:41:48,0:41:50,"Ne, ostat će nekad na tome ostane."
0:41:53,0:41:54,Ali sam onda 2004.
0:41:55,0:41:59,otišao raditi u turističku animaciju i onda sam shvatio da ti je mikrofon prijatelj.
0:42:00,0:42:01,I onda sam shvatio.
0:42:01,0:42:05,"ako ti je mikrofon prijatelj, ako još znaš neke tehnike glume da zapravo ti je to super."
0:42:06,0:42:20,"E sad, učeći te nekakve tehnike koje sam tada naučio od plesnih koraka, od toga kako stajati na bini, od ne znam držanja mikrofona i tih nekih stvari, to ti počne ulaziti u tvoju podsvijest i to ti postane dio tebe."
0:42:21,0:42:33,"E sad, moje pitanje, evo da ja te pitam, ako to postane dio mene, to na neki način mene ajmo reći promijeni ili upgrade da li je to onda dalje gluma ili sam to ja?"
0:42:34,0:42:34,Više nije.
0:42:34,0:42:35,Pa nije više.
0:42:36,0:42:48,"I sad postavlja se pitanje, prodaja je gluma, da li je gluma u prodaji dobra ili nije, pa ja bi rekao je ako postane dio tebe, ako ti zaista to prihvatiš kao dio samog sebe da je to jednostavno tvoj upgrade."
0:42:49,0:42:52,Ako nikako to ne možeš prihvatiti na silu implementiraš onda nije dobro jer se vidi.
0:42:53,0:42:55,Ja mislim da sve što na silu radimo se vidi.
0:42:56,0:43:15,"Znaš šta, kažem, ja mislim, mislim da je dobro zapravo, spomenuo si bed boja maloprije i žene kad vide da muškarci uče o tome kako zavesu ženu, nešto im je tu jako of."
0:43:15,0:43:16,"Da, da."
0:43:17,0:43:25,I možda ima nekih poveznica tu između prodaje i učenja da budeš bolji u prodaji.
0:43:27,0:43:30,"Ne znam šta, ali nešto ima tu."
0:43:30,0:43:43,"Zašto jednostavno jer svatko tko krene prodavat, ja isto prodajem, repeticijom, znači ponavljanjem tih aktivnosti ti neminovno ćeš postati bolji."
0:43:44,0:43:59,"Naravno kad ti dođe prodajni trener ti on je osoba koja je napravila sintezu velikog broja tehnika, alata, principa, prodaje i to si objedinio, stavio na jedno mjesto."
0:43:59,0:44:07,"I ako imaš sposobnost to lijepo iskomunicirati i prenijeti to znanje, good for you i supreda za druge ljude."
0:44:08,0:44:23,"Ali jel osjećaj da postoji tu neki ofono kao da radiš nešto nemoralno, kao učiš o tome kako zavesti ženu ili učiš o tome kako nekome nešto prodati, ovaliti je ružnija riječ."
0:44:25,0:44:30,"super da si ovo pitao, naravno, ovako ću ti reći."
0:44:31,0:44:39,"Tehnike može naučiti svatko, doslovno, to čak ne treba ni trener, uzmeš YouTube, uzmeš knjigu, jednostavno kreneš učiti."
0:44:40,0:44:50,"E sad, da bi tehnika bila ispravna, ti zapravo treba postati dio tebe, a ti, evo na prodaju, ajde ovako."
0:44:50,0:45:09,"Ja volim reći ljudima, ja ne volim predavati tehnike jer vam ja za to ne trebam, ali ono što volim, volim se baviti vašim načinom razmišljanja jer da biste vi mogli implementirati neku tehniku, vi morate pripremiti vaš mozak odnosno vaš mindset ili vaš način razmišljanja da usvoji tu tehniku od početka do kraja i da ona postane dio vas."
0:45:10,0:45:24,"Drugim riječima od seta od deset tehnika, netko će odabrati tehniku jedan, netko tehniku dva, netko tehniku pet, netko možda tri, netko možda svih deset, ali one neće funkcionirati ako ih samo implementiraš na silu."
0:45:25,0:45:33,"Recimo ako ideš na silu govoriti ljudima, evo, tehnika je, ajmo uzeti jednu koju ćemo uzeti, ajde, iluzija je slobodno odabir."
0:45:34,0:45:36,Hoćeš li da se vidimo sutra u dva ili sutra u tri?
0:45:37,0:45:57,"Znači, tebi dajem da biraš od nečega što sam ti ja nametnuo, ti imaš osjećajno dojam da biraš i sad ti odaberješ od nešto od toga ili ćeš mi reći ne paši mi ništa od toga, ajmo u pet, meni ne paše u pet, ja ću ti reći ok ne idem u pet ali možemo u četiri ili u šest i opet ti dajem da biraš, znači opet je po mom ali zapravo ti biraš, ajmo reći to je tehnika."
0:45:58,0:46:18,Ako ja tu tehniku na silu implementiram i ako nisam ono da ne stojim sto posto iza toga to je sada ona floskulasta rečenica pa to se vidi znači ne možeš jednostavno tehniku na silu staviti pred sebe i ona mora postati dio tvojeg svakodnevnog komunikacijskog obrasca i onda to funkcionira.
0:46:20,0:46:23,"I zato kažem jedno je naučiti, a drugo je implementirati."
0:46:24,0:46:36,"Zato kažem ljudima, meni nije problem odraditi dvodnevnu radionicu, ja ću vam sve to pokazati, ali šta će onda biti, hoće li to netko koristiti ili neće, hoće li to netko implementirati ili neće, hoće li to netko koristiti na svakodnevnoj razini ili neće."
0:46:37,0:46:38,To se postavlja pitanje.
0:46:39,0:46:45,I onda netko pita kolika je uspješnost recimo edukacija takvih dvodnevnih ili trodnevnih ili čak četverodnevnih.
0:46:45,0:46:51,"Pa ja kažem, gledajte, uspješnost ponekad više zavisi o ljudima, malo ako ćemo u nekom prosjekujeku govoriti, to je između 25 i 30 posto."
0:46:51,0:46:58,"Drugim riječima, od 10 ljudi, troje će, ajmo reći, usvojiti to i možda jedna do dvije osobe će to početi koristiti."
0:47:00,0:47:00,Ako ćemo realno.
0:47:03,0:47:04,I sad to odvraćamo kao i bilo pitanje.
0:47:07,0:47:08,Nastojat ćemo dalje.
0:47:10,0:47:12,"Ne moramo se vraćati na to, tehnike su bile takve."
0:47:15,0:47:33,"Kako bi objasnili ljudima što je to mentalni sklop i što se zapravo podrazumijeva sve pod tim terminom mentalni sklopop, stručno ili, ajde da sad stručno objašnjavam, kako ti definiraš sebi to?"
0:47:33,0:47:37,Ili kako komuniciraš na predavanju?
0:47:37,0:47:42,"Da, kad komuniciramo, onda kažemo, ok, naš mentalni sklop zavisi o četiri osnovne stvari."
0:47:42,0:47:48,"Prva stvar je naš temperament ili ti osobnost, neko će reći možda čak i u malo širem kontekstu karakter."
0:47:49,0:47:52,"To je na prvom mjestu, to je ono što jesmo mi suštinski dubinski."
0:47:52,0:47:56,"Druga stvar na drugom mjestu je naše uvjerenja, odnosno uvjerenja i vrijednosti."
0:47:56,0:48:00,"Ja to čak neću izjednačavati, to su dvije različite stvari, ali ću staviti u istu kolonu."
0:48:00,0:48:04,onu jer to nas jako na neki način određuje tko smo što smo.
0:48:05,0:48:10,"I one dvije vanjske stvari, a to su ti dakle okolina koja te na neki način određuje i utječe na tebe."
0:48:10,0:48:15,"Imaš tu ono hrponi flosku, ako si najpametniji u sobi vrijeme je da promijeniš sobu i slične stvari, jel."
0:48:17,0:48:25,"Ili ako nemaš ništa za naučiti novo od tih ljudi onda promijeni okolinu, odnosno promijeni te ljude, ne u smislu da ih otkantaš nego ono ili dalje, nauči nešto novo, jel."
0:48:26,0:48:28,"I druga stvar, znanje i vještine."
0:48:28,0:48:38,"E sad, znanje i vještine i sami, sama okolina direktno mogu utjecat na promjenu naših stavova, odnosno na promjenu naših uvjerenja, odnos, odnosno na promjenu naših vrijednosti."
0:48:39,0:48:42,Mislim da nisi spomenuo stav kad si nabrzao.
0:48:43,0:48:45,Gdje bi svrstao stav zapravo?
0:48:49,0:48:54,"Stav je dio mentalnog sklopa, ali meni je to u istoj toj liniji gdje su ti uvjerenja i vrijednosti."
0:48:55,0:49:01,"Ja ću ti reći, ako ćemo gledati onak lajički, zapravo je samo bitno koju riječ odabereš."
0:49:02,0:49:12,"Možeš odabrati riječ stav, možeš odabrati riječ uvjerenja, svaka naravno ima svoju definiciju, nisu iste riječi, ali mislim da će ukupni rezultat na kraju biti podjednak."
0:49:13,0:49:19,"To je sad do pitanja, nešto ono kako se kaže frazeologija, frazeologija."
0:49:20,0:49:23,"Da, to je semantika, semantika, ja volim semantiku."
0:49:24,0:49:27,"Druge ljude, ženu moju pogotovo živcira što volim semantiku."
0:49:28,0:49:40,"Pa evo to ti je super bilo kad smo ti se upoznali, Saša Jajem, mi smo ti na ploču da bi se upoznali počeli smo jedan drugom predavati i počeli smo pisati svoje riječi objašnjavajući jednu te istu stvar, upravo ovo što sam ti sad pitao."
0:49:40,0:49:45,"Ja sam to objasnio na svoj način, objasnio na svoj način i na kraju smo shvatili da smo objasnili jednu te istu stvar, samo koristeći druge riječi."
0:49:48,0:49:50,Isto mislimo samo se drugačije izražavamo.
0:49:50,0:49:55,"Zapravo istu riječ možeš opisati na više načina, može značenje čak biti drugačije."
0:49:55,0:50:19,"Po meni recimo jedna od dražih definicija toga šta je stav, znači kaže kako bi se prevela habitual way of thinking or feeling, znači mišljenje i osjećaj koje po navici imaš o nekome ili o nečemu koje se jako vidljivo reflektira na tvojem ponašanju."
0:50:20,0:50:21,To je stav.
0:50:22,0:50:29,"Znači ja recimo sada sjedim s tom i da imam negativno mišljenje o tebi, to bi se nekako reflektiralo na mom govoru tijela jel tako."
0:50:30,0:50:33,I to je po meni najbolja definicija stava koju sam ja vidio.
0:50:33,0:50:38,"Da, ali u tom slučaju bi onda stav bio isključivo neverbalni po toj logici."
