Start (HH:MM:SS),End (HH:MM:SS),Segment
0:50:40,0:50:40,Ja mislim da nije.
0:50:42,0:50:43,Nije isključivo neverbalni.
0:50:43,0:50:45,"Nije isključivo neverbalni, da."
0:50:45,0:51:00,"Ali znam ljude pogotovo u korporativnom okruženju ili možemo reći u političkom svijetu gdje je jako bitno politizirati, gdje koriste i te tehnike glume i šta, ja znam svašta nešto."
0:51:02,0:51:04,Jako je teško to prikriti.
0:51:06,0:51:16,"Teško je prikriti, stvar je, ajmo reći u prodaji, kako bi, da moraš ono jednom riječju sad reći kako bi stav trebao biti u prodaji."
0:51:19,0:51:28,"Ja da kažem, ja bi rekao da bi stav trebao biti, ne znam, evo meni opet jednom riječju da."
0:51:29,0:51:31,"Reći ću ti kasnije jednu riječ, sad ću reći dvije."
0:51:32,0:51:35,Mislim da postoji razlika između optimizma i pozitive.
0:51:36,0:51:41,"Znači meni nije isto, ja bi prije rekao da treba biti nekakav optimističan stav recimo."
0:51:41,0:51:41,Da.
0:51:42,0:51:43,I to je jako bitno.
0:51:43,0:51:50,"Prodavači često zaborave biti optimistični, a ti bez optimizma nemaš šansa da proraš nekoga."
0:51:50,0:51:52,Pa tko će kupiti od pesimistične osobe?
0:51:53,0:52:07,"Kad je sve ružno, kad ti dođe ono pesimistični prodavač, ovo je ružno vrijeme, ovo je ne ide prodaja, ovo je grozno, ovo je zločesti šef, ovo je kolege mi zabijaju nož u leđa, ovo je, pa daj je ovdje van, neću kupovati od tebe, nemoj mi sad biti tu."
0:52:08,0:52:35,"Kad dođe netko optimističan, inače recimo meni ti je super vratiti svoje vremeno, ti ti je bio i tu na benzinskoj pumpi Inino i jednoj, bio je jedan fantastičan prodavač koji je, on je svako, ja ne znam kako je taj lik fenomenalan, znači on je ono uživao u prodavanju onih edon proizvoda kad dođeš, e čokoladicu, hoćete čokoladicu, hoćete ovaj, keksi, hoćete ovo, ali on je toliko uživao u tome da je on razvaljivao, on je prodavao toga suludo puno."
0:52:36,0:52:49,"Ali sam sad skužio, puno se vozim pa onda sam i puno po benzinskim pumpama, da je sve više ovih prodavača koji su, kad je to krenulo prodavanju onih edon proizvoda na benzinskim pumpama, u početku je bio strašan otpor."
0:52:50,0:52:54,Ili nisu nudili ili bi onako preko one stvari imati tu još na akcijama ako hoćete.
0:52:55,0:53:13,"Sada, evo ja ne znam, na zadnjih, evo deset pumpi što sam bio, baš sam ono primijetio, rekao, danas evo isto jutro sam točio i kaže, evo imam, vidim da ste uzeli samo gorivo ali odličan korasan, odličan korasan, evo na akcijama, čisto da znate, neću vam ga prodavati ali evo čisto da znate."
0:53:14,0:53:34,"Tako jednu simpan način, pokušat spomenut to i jer mislim da su ljudi skužili da moraju biti optimisti i da se moraju šali, da se moraju zapravo pogotovo kod tih nekakvih upsellinga, da jednostavno moraju doći u taj stadij mentalnog sklopa optimist da bi bili uspješni."
0:53:35,0:53:45,Čak je jedan kolega mi je svojevremeno rekao da postoji zapravo dvije riječi da nije samo optimist nego da mora biti lako vjerni optimist.
0:53:52,0:54:02,"Pa ja ću ti sad to elaborirati kako sam si ja to elaborirao jer kažu da su najbolji prodavači oni ljudi koji lako kupuju, koji koji lako kupuju, kojima je lako prodat."
0:54:04,0:54:16,"Ne znam od kuda to istraživanje, to sam negdje čuo i meni sam, razmišljao sam si poslije o tome, onda sam se razmišljao čekaj, meni dobro ide prodaja, fakat mi je dobro, a vratite meni je tako lako isto uvaljati nešto odnosno prodati, ja sam spreman bilo šta kupiti."
0:54:17,0:54:24,"Dijelomično iz nekakve empatije, dijelomično iz nekakve onog želje da pomognem ljudima, a dijelomično ono možda mi to i treba i će mi trebati jednog dana."
0:54:26,0:54:43,"Lakovjerni bi bilo to ti se opet vraćam na ono povjerenje, ako se sjećate, to su ti upravo ovi koji su ti u startu na sto posto i to bi onda lakovjerni optimizam bi bila takva osoba koja ti ti u startu vjeruje, ne očekuje da ćeš izzeznut, a s druge strane je optimistična."
0:54:45,0:54:49,Na šta zapravo pojedinac može utjecat u tom prodajnom procesu?
0:54:50,0:54:57,"Spominjao si bio osobnost, temperament, karakter, recimo to si stavio pod istu grupu."
0:54:58,0:55:09,"Nije isto, drugačije s definicijom, možda ista razina, isti je level nekakav, slažem se s tobom da postoji neka poveznica između ta tri termina da ih tako nazovemo."
0:55:10,0:55:15,Da li tu išta možemo utjecati na taj dan?
0:55:16,0:55:19,"Ne možemo promijeniti, ali možemo se prilagoditi."
0:55:20,0:55:36,"Što bi značilo ako smo ne znam, ajde da ne lupetam previše, da me psiholozi ne mrze, ali recimo ako smo se u prve svoje dvije, tri godine razvili kao nekakvi kolerici, onda ćemo mi teško moći prestati biti kolerici, gotovo nemoguće."
0:55:37,0:55:40,"Oprostite, ja ni ne znam čak što znači taj termin kolerici."
0:55:41,0:55:44,"Četiri osnovna temperamenta, znači sanguinik, kolerik, melankolik i sanguinik."
0:55:47,0:55:51,"Pa to je recimo, to je super u ovoj knjizi od Tomasa Eriksona o okruženim idiotima."
0:55:51,0:55:53,Zašto se zove knjiga o okruženim idiotima?
0:55:54,0:55:57,"Zato kad nekoga ne razumiješ njegovu srž nazoveš ga idioтом, ne ga ne kužiš."
0:55:58,0:56:17,"A kolerici kao ajmo reći naj, kako da to kažem, sad da kažem najtemperamentniji, što nema smisla jer je temperament sam naziv toga što zapravo oni jesu, ajmo reći najupućetljiviji možda, kolerici znaju biti."
0:56:17,0:56:22,"Kaže, kolerike karakterizira visoka razina energije i aktivnosti."
0:56:22,0:56:25,"Da, vrlo energični, evo super riječ, mogu reći, vrlo energični ljudi."
0:56:25,0:56:29,"Kolerični su vrlo ambiciozne, asertivne, često dominantne u socijalnim interakcijama."
0:56:29,0:56:34,"Da, puno ih imaš i direktora, vrlo često je naš predsjednik kolerik primjerice."
0:56:36,0:56:51,"Ali stvar je toga da recimo kod kolerika ćeš ti vrlo brzo skužiti da je on koleričan, zato što jednostavno brzo donosi odluke, brz je, natječe se na seaforu, svemu je natjecanje, neće se natjecati, tako vidi da ne može pobijediti."
0:56:51,0:56:56,"Znači to su ljudi koji vrlo racionalno donose odluke, oni nisu toliko ni emotivni ni ništa."
0:56:57,0:57:19,"Ali recimo on će teško promijeniti sebe, ali on ako je dobar i ako radi na sebi, to je sada opet ona floskula rad na sebi, ali ako sam sebe razumije onda će početi uviđat da njegovo ponašanje jednom recimo dijametralno suprotnom flegmatiku može ne odgovarat odnosno flegmatik bi se mogao onaj bojat kolerika."
0:57:20,0:57:28,I onda da bi uopće mogao biti uspješan u komunikaciji sa jednim flegmatikom mora se naučiti pripitomit.
0:57:28,0:57:31,Znači opet ona floskula zapravo know thyself.
0:57:33,0:57:43,"Ako već imaš uvjerenje da je nemoguće promijeniti svoju sposobnost, karakter itede što je vjerojatno nemoguće u nekom omjeru, barem upoznaje sebe."
0:57:44,0:57:47,Pa više se upoznaš i prilagodiš nego što se promijeniš.
0:57:47,0:57:58,"Znači, ti, ajmo se vratiti, sad ja pričam o stvarima koje zapravo su psihološke i ja ovo ne pričam iz kuta gledanja jednog psihologa nego pričam iz kuta gledanja jednog prodavača."
0:57:58,0:58:02,"Znači, kako se to manifestira meni u prodaji, što sam ja primijetio kroz neko svoje iskustvo."
0:58:03,0:58:24,"Znači, imaš recimo osobu koja nije u potpunosti u skladu sa sobom, recimo osoba koja radi posao koji ne bi trebala raditi, pogotovo recimo u prodaji, to je jako očito kad jedna osoba koja ne pripada u prodajaju radi prodaju, a onda ti se to manifestira ne znam, želudac, prvo, pa teži dišu, pa im se počne, pa sorijaza jako česta kod prodavača, to sam primijetio."
0:58:24,0:58:33,"Znači sad ti generaliziram totalno, znači ovo nije temeljeno na istraživanjima, ovo je temeljeno na onome što sam ja primijetio, vidio i pitao, jel to je sad zadnjih deset godina mog iskustva."
0:58:33,0:58:36,"Da li je to dokazano ili nije to ti ne znam, jel."
0:58:37,0:58:50,"Ali ono što sam primijetio, vidio je da jako puno ljudi ima problem sa želudcem i problemnim traktom tako dugo dok ono rade recimo posao koji ne bi trebali raditi."
0:58:52,0:58:59,"Znači, i sad, super si zapisao vještine i sad se vraćamo na to da li vještine mogu to promijeniti?"
0:59:01,0:59:03,Pa po mom mišljenju ne.
0:59:03,0:59:06,Pa i po mom iskustvu ne.
0:59:07,0:59:10,"Zapravo, ajde, idem ja malo sumirati."
0:59:12,0:59:15,Ja sam te pitao na koji dio mi možemo utjecati.
0:59:15,0:59:21,Krenuli smo prvo sa karakterom osobnosti i temperamentom.
0:59:22,0:59:36,"Tu si ti zaključio da naš napor treba ići u smjeru da bolje upoznamo sebe, ne da se previše grčevito trudimo mijenjati možda neke stvari koje su naš korijen."
0:59:38,0:59:52,"Osim toga, znači ostali dijelovi mentalnog sklopa smo rekli da podrazumijevaju stav uvjerenja vrijednosti, koliko možemo utjecati na taj, ja bi rekao sad da je to neka sljedeća razina možda."
0:59:53,1:00:00,"Da, da, to možemo, to možemo, neke stvari, ona duboko ukorijenjena uvjerenja ćemo teže mijenjati, a naravno ova koja su"
1:00:00,1:00:03,koja su nam ajmo reći na pričarini ćemo puno lakše mijenjati.
1:00:04,1:00:10,"Ali recimo uvjerenje, evo ti iz prodaje, jedno od češćih uvjerenja, nemaš šanse da tamo nešto prodamo."
1:00:13,1:00:16,"I sad ti naravno to je logično pitanje, ok zašto to misliš?"
1:00:16,1:00:24,"Ne, ne, tamo konkurencija, oni su svi dobri, ja sam vidio da oni igraju golf zajedno, oni su svi frendići i ja tamo nemam šta tražiti."
1:00:24,1:00:31,"E sad, takav set uvjerenja vodi ka tvojoj ajmo reći sudbini da tamo nećeš nikad ništa prodati, a zašto?"
1:00:32,1:00:33,Zato što nisi nikad ni pokušao.
1:00:34,1:00:44,"Jer si si stvorio set uvjerenja da tamo oni igraju golf i ti si temeljem toga donio zaključak da zbog toga ti tamo nema šta tražiti jer su se oni, oni su se frendići i tamo ne šta."
1:00:45,1:01:02,"Jer postoji možda neki drugi scenarij koji mogu, da je možda netko njih slučajno slikao pa se ti to vidio, da su se možda našli na nekom turniru slučajno zajedno, da možda su se poslađali u međuvremenu, da možda ovaj je toliko omađivan da uopće ne vidi da postoje druge opcije."
1:01:03,1:01:11,"Znači, timeš na temelju svog uvjerenja ti si donio zaključak da tamo nećeš prodat, a realno, budimo realni, nisi niti pokušao."
1:01:11,1:01:20,"Nisi digao telefon, nisi sjela u automobil, nisi pokucao na vrata, nisi pitao tu osobu da li ima smisla ili ne, na kraju krajeva nisi dobio odgovor ne."
1:01:21,1:01:28,"Ja kažem, tako u prodaji, to je jako bitno, tako dugo dok nisi dobio odgovor ne, ti ne znaš da li ćeš negdje prodati ili nećeš prodati."
1:01:29,1:01:44,"Jer čovjek kad je malo nasilno, kad mi netko ne odgovori na mail, ja onda uvijek pišem, ja pošaljem još jedan mail, kažem dajte mi onda sve u redu, meni je sasvim u redu da se ne dogovorimo, da mi kažete ne, samo mi recite ne, nemoj me držati sada tu da ja sam morao razmišljati što je pjesnik htio reći."
1:01:45,1:01:47,To što se ti meni ne javljaš meni to ništa ne znači.
1:01:48,1:01:49,"Ja hoću ne, daj mi ne."
1:01:50,1:01:51,Koji si?
1:01:51,1:01:52,Zašto hoćeš ne?
1:01:52,1:01:54,Hoću ne da onda znam di sam.
1:01:54,1:01:56,Koji si da znam koji je razlog ne ja.
1:01:57,1:02:05,"Jer Kujiš mene zanima, ok, ako je ne zbog toga što je cijena previsoka, to mi je sasvim ležito, ok, ima kolega koji ne znam rade za manje novaca i to je skroz ok."
1:02:05,1:02:08,"Ja ću reći, ok poštujem, vi imate takav budžet, radite s nekim drugim."
1:02:09,1:02:28,"Ako je ne zbog potencijalnog nesporazuma, što je vrlo često, ako smo se krivo razumjeli u komunikaciji, ako je nešto možda interpretirano na način na koji uopće tako netko nije mislio ili ne znam šta ti može biti ne, neti može biti da recimo, ja sam njemu ponudio jedne termine i oni me nisu odgovorili."
1:02:29,1:02:30,Šta to točno znači?
1:02:30,1:02:34,"Je li to ne ili možda samo treba naći druge termine, kožiš."
1:02:34,1:02:39,"Znači treba iščitati do kraja, doći do srži zašto radimo ili zašto ne radimo."
1:02:40,1:02:47,"I to je ono što jako često u prodaji zaboravi ekipa, stvore si uvjerenje da je nešto ovako ili onako i neće ni ići dalje."
1:02:48,1:02:56,"Odnosno čak se boje čut ne, imaju strah od toga da im netko potvrdi da je to ne, onda rađe ostave tamo negdje ovakvom u zraku neka bude pa."
1:02:57,1:03:01,"I onda kad ga pitaš šta je bilo, maj ovoj nisu se ni javili, to su takvi idioti."
1:03:03,1:03:10,"Jer moguće da je možda mail otišao u spam, jer moguće je to u jednoj literaturi."
1:03:10,1:03:12,"Da, ljude strašno plaši taj ne."
1:03:13,1:03:22,"Da, jer moguće da je netko slučajno kad je došao tvoj mail da je prešao sa mišljenjem preko maila odznačio ga kao nepročitano odnosno pročitano nepročitano ili sam zaboravio."
1:03:22,1:03:24,Jer moguće da je netko jednostavno zaboravio govoriti na mail.
1:03:25,1:03:25,Vrlo često.
1:03:26,1:03:41,"Tako da ono ako ti netko nije rekao eksplicitno ne ili napisao eksplicitno ne, obratite mi li šta je negoli što se može da osjetite, znači ti si ne sebi već u sadio u glavu, a postoji vjerojatnost da je zapravo da, ali se moglo dogoditi x i y razloga zašto ti nisi doživio odgovor."
1:03:41,1:03:44,Ovo je jedan jako lijep primjer negativnog uvjerenja.
1:03:44,1:03:45,"Da, da."
1:03:46,1:03:58,"E sad ako ćemo ono recimo duboko usvojene uvjerenja, evo jedan, jedan totalno glupo, ovo je toliko glup primjer i zato ga obožavam i to će ti moja mama."
1:03:58,1:04:32,"I ja kad sam bio klinec, to ste bile tamo krajem osamdesetih, tamo je počinjalo sranje tu kod nas u regiji, nije se baš imalo para, deda je još bio živi, ja sam, meni noga brzo narasla, ja sam ti redovito, ja sam već imao četrdeset jedan četrdeset dva deda je imao četrdeset tri malo su mi bile prevelike njegove cipele ali bih ih uredno nosio i neka bi došao doma ne bih im na čičak su bile neke one i ne bih mislio čičak nego bi samo ono stres osnoge kako su mi bile malo prevelike i to bi se tamo negdje razvjetlo i nastavio bi hodat bos, jel tako?"
1:04:33,1:04:39,"I u tom trenutku čim bi mene moja mama vidjela kaže vedre nemoj hodat bos prehladit će se da ovo su pločice, jel tako?"
1:04:40,1:04:50,"I tako prođe deset petnaest godina kasnije i ja čitam neko istraživanje kliničko i kaže da se zapravo ne možeš razboliti hodajući bos, ne možeš se razboliti."
1:04:51,1:05:09,"Isto tako ako ideš u savun, ne znam, ideš u savun ili ne, da ili u velness pa imaš onaj hladni bazen, topli bazen i kružiš znači poante zapravo potaknu krvotok neće ti se ništa destako hodati bos i jatuska i sam sa sebi počne smijati, kako mi je mama to govorila i on još dan danas ima to uvjerenje."
1:05:10,1:05:18,"I desi se meni da to znam i prođe još par godina, ja dobim kćer, dobim drugog kćer, oni dođu doma, skinu cipele i ja njima koji stopa."
1:05:19,1:05:22,"Obucite papuće, prehladit ćete se, nemojte hoditi po kočicama."
1:05:22,1:05:24,Eto ti duboko uvjerenje.
1:05:24,1:05:30,"Znači ja iako sam svjestan da je to totalni nonsens, bulusit ili kako hoćeš to nazvat, ja i dalje to izustim."
1:05:30,1:05:36,"Jer jezik odradi prije, povuče iz uvjerenja i onda sam sebi počne smijati i kaže, mada ja ju zaboravim, nisam ništa rekao."
1:05:39,1:05:45,Da ti ne pričam koliko često ponovim riječi svog starog ili starog ili stare kod svoje djece sad.
1:05:45,1:05:46,Eto ti uvjeren.
1:05:46,1:05:48,Na svakodnevnoj bazi.
1:05:48,1:05:54,"I što kažeš, ne možeš ni sam sebe uhvatiti već izleti lovan."
1:05:56,1:06:06,"Ja sad, ti kao prodavatelj sigurno, si jako perceptivan prema govoru tijela ljudi kojima prodaješ ili koji su oko tebe."
1:06:09,1:06:13,Što znači recimo ovaj tvoj trenutni stav mi je zanimljiv?
1:06:14,1:06:15,Nama baš ništa.
1:06:15,1:06:17,Nama baš ništa.
1:06:18,1:06:20,Ja sam čuo onu jednu da.
1:06:24,1:06:24,"Ne, ne, ne."
1:06:24,1:06:25,"Dobro, moglo se vas."
1:06:29,1:06:30,"Evo idemo, mislim."
1:06:31,1:06:46,Mislim da postoji jako puno ljudi koji možda pridaju i previše važnosti govoru tijela da ga seciraju do nekog gludila a uopće možda ne postoji potreba za tim.
1:06:46,1:06:50,"Koliko si ti, fale mi ti te hrvatske riječi."
1:06:50,1:06:53,Na engleski se kaže self-concious.
1:06:54,1:06:54,Svjesna samog sebe.
1:06:55,1:06:57,Ali pretjerano svjesna samog sebe.
1:06:58,1:07:07,"I onda ako si pretjerano svjestan samoga sebe, svog govora, tijela, svojih izgovorenih riječi, onda očito to radiš i analiziraš jako puno i drugu osobu."
1:07:07,1:07:10,Koliko te recimo to sputava u prodaji?
1:07:10,1:07:40,"Ako si previše fokusira na to i nisi u razgovoru, nisi stvorio rapo, ne slušaš osobu itede Pa ja ću reći da me, o tom sam puno čitao, bio sam na jako puno treninga o neverbalnoj komunikaciji, skužio sam da je jedan šezdeset posto tih treninga bilo poprilično krivo predstavljeno i prvi put vratit ću se na ovo koliko me to sputava, ali samo da ti dam malu, malu, malu digresiju."
1:07:40,1:07:47,"I prvi put kad sam zapravo potpunosti razumio neverbalnu komunikaciju, e sad ću opet ispod kao reklama, ali mi je opet suprotno Saša objasnio."
1:07:48,1:07:56,"Neće biti bitno kako sjediš ili šta radiš, nego je bitno kalibrirati na način da obraćaš stvari na promjene."
1:07:57,1:08:01,"Znači ako ja sad nešto kažem i ti se promijeniš i promijeniš svoju posturu, ok to nešto znači."
1:08:02,1:08:06,Sad je moj na meni da ja zapravo tebi postavljam prava pitanja da bi vidio šta točno znači.
1:08:06,1:08:11,"Da li sam ti stao na žulj, da li sam nešto krivo rekao, da li sam nešto rekao prerano ili sam možda rekao nešto prekasno."
1:08:12,1:08:12,Znači.
1:08:13,1:08:20,Najgora stvar je interpretirati svojim mišljenjem šta nešto znači kod čovjeka.
1:08:20,1:08:25,"Jer mislim imamo jezik, možemo pitati, barem mi koji govorimo i čujemo."
1:08:26,1:08:27,Ima ljudi koji ne mogu to.
1:08:27,1:08:34,"Ali mi koji govorimo i čujemo, mi bismo trebali koristiti to i provjeriti ono ako vidim da si sad nešto napravio ili si evo ovak."
1:08:35,1:08:36,Ja ti znam ljude pitati doslovno.
1:08:36,1:08:41,Kad mi neko ono sjedne ovak i počne gledati u pod.
1:08:42,1:08:49,"I onda stanem i znam pitati ljude, nemoj se ljutiti jesam nešto krivo rekao ili nešto."
1:08:50,1:08:52,I zanimljivo je da će ti ljudi reći.
1:08:52,1:09:01,"Ljudi će ti reći, znam, dobit odgovor, pa nešto, čudno si mi ovo sad rekao, da mi možeš li mi ono, ajmo korak nazad, mislim da sam te krivo razumio."
1:09:02,1:09:06,I zapravo ti s tim radiš određeni prekid i ideš razjasniti ono gdje je zapelo.
1:09:06,1:09:14,"Jer ljudi, prvo, ako smo pristojni nećemo prekidati drugu stranu, evo, bonton, to je isto uvjerenje, jel je, set uvjerenja."
1:09:16,1:09:56,"A druga stvar, jednostavno ljudi, ljudi će ti kad-kad i odšutiti neke stvari, ali ti ako vidiš neku promjenu, zašto ja tebe ne bih pitao, ono, čekaj, ja sam tebi nešto krivo rekao, napravio, jesam li krivo nešto rekao, jesam li nešto loše rekao možda, jesam li te uvrijedio možda, jer ti ne znaš koji je set uvjerenja, odnosno koje su vrijednosti te osobe i ti obično u komunikaciji ako pogaziš određenu vrijednost ili set uvjerenja osobe s kojom komuniciraš, pogotovo u prodaji, osoba te može diskreditirati, odnosno to može prekrižiti bez da ti uopće kaže i jedva čeka da završi sastanak ti odeš i više se nikada ne javi."
1:09:56,1:09:58,I onda ostaneš u vakumu i ne znam zašto.
1:10:00,1:10:01,Jes li se desilo to kad?
1:10:02,1:10:02,Često.
1:10:03,1:10:11,"Često, sad dok si ovo govorio, mislim po meni je ovo jedan od najboljih savjeta koje možeš nekome dati za kvalitetne međuljudske odnose."
1:10:12,1:10:23,"Ja sam sebe, evo imam jedan danas svjež primjer od jutra sa ženom prije nego što sam krenuo odvesti kćer do vrtića."
1:10:25,1:10:28,"Malo je energije između nas dvoje bilo onako, off, jel."
1:10:30,1:10:44,"I samo da na vrijeme iskomuniciramo ili ja i ona možda ne bi došli do povećanih tenzija svađa ili šta ja znam, što je danas tamo završilo recimo, mislim svađa, razmirica."
1:10:46,1:11:02,"I to je izuzetno, izuzetno bitno, a ne vidim da je puno ljudi dovoljno zrelo da bez obzira što i ja i ti to znamo, vjerojatno jedno i drugo napravimo grešku više puta pa ne pitamo ili ne uočimo, ne iskomuniciramo."
1:11:02,1:11:04,"Znači dosta se je potrebno samo reći, naglasiti."
1:11:04,1:11:10,"Potrebno je reći, a imaš, evo imaš jednu super, znači super primjer, durenje."
1:11:12,1:11:14,"Kad se naduriš, e sad baš neću."
1:11:18,1:11:21,"Evo me, došao sam skupa s mikrofonom."
1:11:22,1:11:37,"Kada dođeš u onu fazu naduriš se, vidiš da nešto ne štima, što je naravno ono jednomjesečno barem, ali nećeš, nek ona meni priđe, nek ona meni kaže, zašto uvijek ja moram?"
1:11:39,1:11:41,"I to je faza duranja, ja bih ga."
1:11:43,1:11:44,Jesi završio?
1:11:44,1:11:45,"Jesam valja, ne znam."
1:11:46,1:11:48,Jesi se završio duriti.
1:11:49,1:11:51,"Ne, te hoćim, sad počinješ."
1:11:53,1:11:54,Šta sam htio reći?
1:11:54,1:11:56,"Da, sad sam izgubio misao."
1:11:57,1:11:58,Ne možeš samo naduriti.
1:11:58,1:12:02,"Nećeš se naduriti, samo na sebe se možeš naduriti, ne možeš misliti."
1:12:03,1:12:10,"Koliko ti, koliko često je zapravo u međuljudskim odnosima, mislim da je to moja specijalnost pasivna agresija."
1:12:12,1:12:16,Ja sam pasiv agresiv par excellence.
1:12:17,1:12:21,"Da li primjećuješ često to, možda kod sebe ili kod drugih ljudi?"
1:12:21,1:12:24,"Da, ja stvarno znam biti pasivno agresivna."
1:12:24,1:12:26,Ali to je čak i povezano s tim durenjem malo.
1:12:27,1:12:35,"I je, je, je, čak i u pismenoj komunikaciji, u mailu, kad ono baš onako želiš subtilno nekom se osvrnuti."
1:12:36,1:12:41,"Ne derem se na tebe, neću pisati velikim slovima, kap slog, ali čisto da primiš poruku."
1:12:41,1:12:47,"I kad vidiš da ta osoba da je pala, znači spali su joj štitovi, pale znaš više ne ide, e sad sam ja zadovoljan."
1:12:47,1:12:58,"Sad sam ja sretan, sad možemo mirno spavati i onda shvatit da zapravo uopće nisam sretan, nemam reč mirno spavati, na kraju dođe do toga da se ispričavaš osobi, što je vrlo česta pojava isto."
1:12:58,1:13:10,"Ali ta pasivna agresija je, ja ne znam, mislim da je to ono žalosno što to moram konstatirati, ali u biznisu je to postalo onak jednostavno ono svaki dan vidim pasivnu agresiju."
1:13:10,1:13:17,"Neću reći da sam, ja se trudim koliko god mogu to barem kad primijetimo, iskontrolirati, ali kod ljudi oko sebe to vidim."
1:13:19,1:13:41,"Dakle, počevši od onog nepotrebnog dodavanja ljudi u cc, znači da osobi stvoriš dodatni pritisak do korištenja onak nepotrebnih konstatacija i riječi i rečenica koje nemaju mjesta uopće u komunikaciji, nema potrebe za tim, a opet radimo to, ti ti i ja ne znam."
1:13:42,1:13:58,"Meni ti se često čini da bio poslovni kontekst, bio kontekst obitelji, muža, žena, djeca, roditelji ili nekakav drugačiji kontekst."
1:13:59,1:14:14,"Nekad mi se čini kao da sve što možeš vidjeti i prepoznat u parku, u dječjem vrtiću, da sve to možeš prepoznat i u svijetu odraslih u bilo kojem kontekstu našeg života."
1:14:14,1:14:15,To je fascinantno.
1:14:16,1:14:21,"es tim da je to u vrtiću i u parku, to je još koliko toliko simpatično i nekontrolirano."
1:14:21,1:14:28,"Kod nas je vrlo često i smišljeno što je u našem svijetu, što je onak, to je ono što je žalosno."
1:14:29,1:14:37,"Ajde kod klinaca pa ajde pa vidiš sve i svašta i ta njihova komunikacija i šta si se sve znaju izgovoriti, majke, to je baš onako."
1:14:38,1:14:41,Ali to je još uvijek na jednoj totemnoj drugoj razini.
1:14:42,1:14:43,Nema tu zle namjere.
1:14:43,1:14:46,U ljudima zna se desiti da fakad bude zla namjera.
1:14:47,1:14:48,Neće tebi pokazati.
1:14:50,1:14:52,"To mi se ne sviđa, ne volim to."
1:14:53,1:14:59,"Da, opet ona strana, tamna strana na svake medalje i svake ličnosti."
1:15:00,1:15:03,"Svi imamo, nažalost, ili na sreću, vidjet ćemo."
1:15:04,1:15:12,"Nečega čega se ja često sjetim i trebao bi se češće toga sjećati, sad je oko neke matrix."
1:15:14,1:15:20,Jedna izjava na engleskom kaže remember to remember i to je zapravo sad ovo o čem pričamo.
1:15:20,1:15:30,"Znači ja i ti znamo da nekad je dovoljno samo iskomunicirati nešto i zato bi se trebalo češće prisjećati toga da se treba prisjećati nečega, nečega šta ti je bitno."
1:15:30,1:15:40,"Znači ako vidiš da ti to stvarno može podići kvalitetu tvojih odnosa sa ljudima koji su ti dragi, koji su oko tebe, sjeti se, sjeti se."
1:15:41,1:15:45,"Da, sjeti se, sjeti se i zašto je to dobrom?"
1:15:47,1:15:53,"Ajmo reći kad prekidaš neki odnos sa nekim jer si došao do zaključka da to jednostavno ne funkcionira, ajmo govoriti o poslovnom odnosu."
1:15:54,1:16:02,"Ljudi vrlo često zaborave, mislim vrlo često, ja bi rekao gotovo uvijek, zaborave napraviti onaj ajmo reći izlazni razgovor."
1:16:03,1:16:05,I šta ti se počne događat?
1:16:05,1:16:18,"To sam ja skužio stvarno kroz svoj život i to mi se prije događalo, danas zaista se trudim koliko god je to maksimalno i tu recimo Saša pizzi sa mnom jer ja mu uvijek kažem, ali ne znamo zašto, ajmo do kraja raščistiti tu situaciju, čisto da znamo gdje smo, šta smo."
1:16:19,1:16:29,"Ne bih ja samo nešto prekrižio, pa sad prekrižili smo, stavili smo to pod tepih jer što više toga guraš po taj metaforički tepih to je veća ta grba i kad najmanje očekuješ, sad ću se spotiknuti prekriti znači se potaknu preko te grbe."
