Start (HH:MM:SS),End (HH:MM:SS),Segment
0:00:00,0:00:08,"Vedrane, kako u svijetu gdje je povjerenje rijetko uvjeravaš druge u svoju iskrenost?"
0:00:08,0:00:11,"Čekaj pa gdje odmah sa najtežim, to je najskuplje pitanje?"
0:00:11,0:00:13,"Apsolutno da, moramo na najjač."
0:00:14,0:00:25,"Kako u svijetu gdje je povjerenje rijetkost, ja vjerujem da je, uvjeravaš druge u svoju iskrenost, pogotovo u svijetu u kojem ti jesi, a to je prodaja?"
0:00:27,0:00:28,"Da, pitanje je toliko."
0:00:29,0:00:34,"Dobro, a s druge strane, toliko kompleksno da uopće ne znamo iz kojeg kuta bi ga počeo odgovarati."
0:00:34,0:00:38,Ali hajmo krenuti pa ćemo vidjeti kamo će nas to odvesti jer to je jedno od onih pitanja za koje se čovjek ne može ni pripremiti.
0:00:41,0:00:42,Ajmo ovako.
0:00:42,0:00:52,"Dakle, prvo jedna riječ mi u tom pitanju malo me čak i boli jer uvjeravat nekoga u povjerenje mi je onak, nije mi to to."
0:00:52,0:00:57,"Ne bih ja nikoga uvjeravao, ja se čak bi se usudio reći da se ni ne trudim nekoga uvjeriti."
0:00:57,0:01:07,"Jednostavno si ono što jesi, pričaš na način na koji pričaš i jednostavno, super je pitanje oko povjerenja, kako stvoriš sa nekim povjerenjem."
0:01:07,0:01:14,I sad radeći taj posao cijeli život mogu reći da mi se ljudi vrlo brzo otvaraju.
0:01:14,0:01:26,"Zašto je to tako, stvarno nisam nikad istraživao, ali da znam puno tajni, to je istina, da jako puno tajni znam i da ih dosta dobro čuvam i držim, to je isto istina."
0:01:27,0:01:33,"Ali zašto je to tako, ne znam, možda baš zato što se uopće ne trudim, ne trudim se fekati ništa."
0:01:34,0:01:40,"Ja samo ono, u jednom trenutku u životu sam prihvatio da sam ja ono što jesam i da jednostavno ili ću ti sjesti ili ti neću sjesti."
0:01:40,0:01:43,Jesu tako u prodaju ili ću ti nešto prodati ili ti neću prodati.
0:01:44,0:01:50,"Nekad sam imao problem s tim kad mi netko kaže ne, pa sam si nabrbio glavu zašto ne, jer to do mene, jer do proizvoda., jer do usluge, jer do če."
0:01:50,0:01:53,"Na kraju shvatit ćete, jednostavno nije svatko tvoj kupac."
0:01:53,0:01:55,I ne da mi se uopće više razvijati glavu sa tim.
0:01:57,0:02:00,Nekad je ta puš prodaja bila svakom moraš prodati to što imaš.
0:02:01,0:02:07,"I sad ako je osnova prodaje povjerenje, to bi značilo da ti na neki način na silu sa svakim moraš uspostaviti povjerenje."
0:02:09,0:02:10,A kako to izvrstiti?
0:02:11,0:02:11,Kako je to moguće?
0:02:12,0:02:13,"Pa mislim, zar je zaista malo moguće?"
0:02:14,0:02:20,"Po mom mišljenju, povjerenje ne možeš steknuti prije nego što si stvorio odnos s nekom osobom."
0:02:20,0:02:23,"Znači, povjerenje se mora izgraditi, time ispraviti."
0:02:24,0:02:41,"Jer ja sam primijetio, ja sam recimo takva osoba koja će ti dati povjerenje, zapravo sad sebi ispravljam, daću ti povjerenje odmah na početku, na avans i onda je na tebi da zadržiš to povjerenje i tako nekako funkcioniram."
0:02:41,0:02:43,Kako to izgleda kod tebe u životu?
0:02:43,0:02:54,"Tako ja funkcioniram i to često ljude pitam na edukaciji i kažem prvo ono klasično pitanje od koga ljudi kupuju, od onih kojim vjeruju ili od onih kojim se sviđaju, jel to je ono klasično pitanje."
0:02:55,0:03:00,Na kraju se ljudi zakače pa jako puno ljudi često ode u ovaj da ti se nekomu zapravo mora sviđat.
0:03:01,0:03:06,"A kako ti se neko može sviđat ako mu ne vjeruješ, što je ono što je isto često pitanje."
0:03:06,0:03:15,"I sad to ti je ono na televiziji, gledaš neko, neko ti se sviđa, neko ti je kulo, sad pitanje je da ga upoznaš u osobnoj interakciji da li bi vjerovao toj osobi i na kraju krajeva da li bi nešto kupio od te osobe."
0:03:16,0:03:40,"Ali da se vratim na ovo, imaš ono, ja ti znam nacrtat liniju na ovome flip čartu i kažem tu vam je nula, tu vam je sto posto i kad ulazite s nekim prvi put u interakciju u razgovor ili sa nekim dal to kupac ili čisto u privatni razgovor da li ulazite sa nula posto povjerenja pa postepeno gradite ili uzimate sto posto povjerenja pa kada se neko zezne, parate na nulu i onda jako imate problem ići prema naprijed."
0:03:40,0:03:41,Što mi je najčešći odgovor?
0:03:45,0:03:49,Čini mi se da ulazi sa dosta povjerenja i onda brzo pada.
0:03:50,0:04:25,"Zapravo ti je odgovor da, to je mene zapravo iznenadilo jer ja idem tako da idem sa ono gotovo sto posto neću nikad reći sto posto ali imam devedeset pet posto povjerenja i onda kad me netko razočara jako teško vratim to povjerenje kod te osobe ali je većina ljudi odgovorila da je između sedamdeset i osamdeset posto jer kaže nisam spreman otv otvoriti sve karte, znači nisam spreman otvoriti sve karte na stol, ali ulazim u razgovor sa osobom ili sa kupcem sa nekakvom primisli ili nekakvim očekivanjem da me neće zaje."
0:04:27,0:05:05,"Da li ti se ikad desilo, a svi smo ljudi, pretpostavljam da je, da je osoba bila ona možda nekad tvoj partner, partnerica ili tvoj prijatelj, poslovni kolega, partner u kojeg si imao jako puno povjerenja za koju si mislio da ju znaš, dijelili ste nekako bilo integriteta s jedne i s druge strane i da se to sve čini se u jednom trenutku srušilo, ali vjerojatno se to rušilo postepeno."
0:05:06,0:05:17,I kako si se osjećao u tom trenutku i kako recimo nakon takvih situacija možeš opet ići u nekakav odnos onako sa tim povjerenjem?
0:05:17,0:05:26,"Ne jednom, desilo se više puta, nažalost, ali ti se uvijek postavlja pitanje do koga je, da da li je do mene ili do te osobe."
0:05:27,0:05:45,"I onda ti zapravo kad radiš nekakvu retrospektivu i samu analizu poslije, to se meni počelo događati kad sam analizirao sve te svoje situacije, skužiš da zapravo je uvijek bilo tako, samo si ti nekako sebi izgradi određenu sliku te osobe, te persone i jednostavno si ga prihvatio takvog."
0:05:46,0:05:58,"I onda s vremenom te neke stvari počnu, ajmo reći, nervirati jer ti vjerojatno dirne u neke vrijednosti ili određena uvjerenja gdje se to ne bi smjelo desiti, odnosno nešto što te zaista pokoleba u tom trenu."
0:05:59,0:06:06,"I onda ti jednom progledaj i onda se počneš vraćati u sve ono što se cijelo vrijeme događalo, što nisi viđao i onda počneš zamjerati toj osobi."
0:06:07,0:06:15,"Ali isto tako i obratno vrijedi, kad ti sebi i to mi se desilo i to sam svakako sam sam sebi kriv što sam ostao bez jednog posla."
0:06:15,0:06:21,"Znači to znam danas znam, u tom trenutku mi je naravno ta osoba bila smrtonij neprijatelj i najveći krivac."
0:06:22,0:06:31,"Ali ja sam sebi stvorio percepciju te osobe takvu da jednostavno nisam bio spreman uopće dati priliku toj osobi, dakle ne kužiš."
0:06:32,0:06:32,Zašto?
0:06:32,0:06:36,Zato što sam ja sebi umislio da sam ja zaslužio nešto što nisam a ta osoba je to dobila.
0:06:37,0:06:55,"Sada vrlo abstraktno pričam, neću, mislim, puno konkretnije pričati, to ti mogu ovaj u Ofu ispričati, ali zaista tako, meni je trebalo dobri dvije, tri godine poslije da ja uopće skontam da sam sam sebi fikciju stvorio u glavi da je ta osoba kriva za nešto što sam zapravo ja sam sebi kriv."
0:06:56,0:06:59,"Tako da vrijedi u oba smjera, jesam li se komplicirao?"
0:07:00,0:07:10,"Nisi se komplicirao, malo sam se ja sad pogubio u svojim mislima, ali pokušam se sjetiti imena jednog autora, mislim da je bitno za ovo pitanje, ali evo iskreno ne mogu se sjetiti."
0:07:11,0:07:11,Zašto pitati?
0:07:12,0:07:15,"Da, misliš da on ima bolju memoriju."
0:07:15,0:07:18,"On pamti sva ta imena, da je suludo."
0:07:19,0:07:42,"Taj gospodin kaže da jedna od prvih linija ili prvih točaka je zapravo naša introspekcija i činjenica da i mi u sebi imamo jako puno lošega ili zločestoga, znači svaka osoba ima i onu drugu stranu medalje, onoga, onu tamnu stranu medalje."
0:07:44,0:07:52,"Da li si ti to uvidio u svom životu i ako jesi kako se nosiš s tim, kad ideš u odnose."
0:07:53,0:07:56,"Kasnije ćemo mi doći malo na ovu prodaju, ali ja mislim da je ovo sve bitno."
0:07:56,0:08:01,"Ima sve bitno, odnos je odnos, bilo kakav između dvije osobe."
0:08:01,0:08:08,Ovo je super pitanje jer mi odmah pala na pamet pak meni jedna knjiga koja je mene zapravo natjerala da se ja isto zapitam neke stvari.
0:08:09,0:08:15,"Knjiga je zapravo vrlo bazična i jednostavna i sad ću se smijat kad ti kažem koja je od Thomasa Ericksona neokruženih idiotima, ali okruženih psihopatima."
0:08:16,0:08:16,Ovo je druga verzija.
0:08:17,0:08:28,"E kad sam čitao tu knjigu u jednom trenutku kad sam tih prvih osamdeset stranica gdje on zapravo objašnjava kako se testiraju psihopati, kako prepoznaju psihopatepata, ja sam u jednom trenutku stao i rekao, evo, ja sam ja psihopat, znaš."
0:08:29,0:08:31,Jer zapravo ti objašnjava kako psihopat razmišlja.
0:08:32,0:08:36,Ali psihopat ide još korak dalje i to je kšulis provede u djelo.
0:08:37,0:08:39,A mi svi imamo te neke teške misli.
0:08:39,0:08:46,"Ja kad sam to čitao, mislio kad je on opisao, rekao je, ja imam sve te misli, meni se to događa, nešto ono i ljubomora i zavijesti i nešto ono."
0:08:46,0:08:49,To su sve stvari koje će bilo tko teško priznat.
0:08:50,0:08:59,"Ali na van se to neće vidjeti, neće se to manifestirati, niti ću ići toliko daleko da ću zbog toga nekog kažnjavati, vrijeđati ili na bilo koji način to napraviti."
0:09:01,0:09:08,"Kad pitaš jesam li imao te primjedbe, da, siguran sam da ih svi imaju, čak ću ići u generalizaciju totalnu."
0:09:10,0:09:18,"I sad je pitanje da li treba razgovarati otvoreno o tome ili samo osvijestiti, ja bi rekao da je dovoljno da ljudi napravite taj prvi korak i budu svjesni toga da jednostavno je to tako."
0:09:18,0:09:22,"Da li treba razgovarati o tome, pa to nek svako odluči za sebe."
0:09:22,0:09:26,"Ja danas iz današnjeg kuta gledanja, iz današnjih Cipra nemam taj problem."
0:09:26,0:09:31,"Da sam ja to pitao prije pet, šest, sedam, osam godina, vjerojatno bih imao problem."
0:09:31,0:09:46,"Ali to je opet isto mislim povezano sa tim kad radiš za sebe pa onda zapravo nemaš lakat dlake na jeziku i možeš zapravo dozvoli da kažeš to neke stvari koje recimo da radim za nekog drugog ili u korporaciji, ne bih se usudio vjerojatno reći."
0:09:48,0:09:49,"Nema filtera više danas, toliko."
0:09:53,0:09:57,Da li vjeruješ svakoj svojoj misli i emociji?
0:10:01,0:10:02,Odlično pitanje.
0:10:02,0:10:04,"Evo, gdje si zvuko to sada?"
0:10:05,0:10:08,Da li vjerujem svakoj svojoj misli i emociji?
0:10:09,0:10:15,"Pa svakoj baš i ne, ali da ću je preokrenut dva, tri puta i vidjeti da li ima smisla ili nema smisla."
0:10:16,0:10:20,"Pa da, recimo najviše tih misli, evo zadnjih par dana sam baš nekako teško zaspao."
0:10:20,0:10:21,Zašto?
0:10:21,0:10:26,"Zato što nešto kad ti mozak radi ne možeš zaspati, ne možeš zaspati, stalno misliš, nešto ima super ideje."
0:10:26,0:10:35,"Jedno vrijeme sam si zapisivao pored, znači on odignem se i krenete i zapišem si u neki blokić jer je super ideja, jer se ujutro naravno ne sjećam više."
0:10:35,0:10:40,"I onda sam sad zaključio sam sa sobom, dao sam si zadatak, rekao ako je to tako dobra ideja sjećat ćeš se i ujutro."
0:10:41,0:10:41,Njih se ne sjećam.
0:10:44,0:10:46,"Ali toliko je dobra bila prije spavanja, nešto mi je super ideja bila."
0:10:46,0:10:48,Sad da li vjerujem svim svojim mislima?
0:10:48,0:10:48,Pa.
0:10:48,0:10:52,"Pa ne znam, vidjet ćemo, valjda, nemam pojma."
0:10:52,0:10:54,Da li vjerujem svim svojim emocijama?
0:10:55,0:10:56,"E da, vidiš, zanimljivo."
0:10:58,0:11:02,"To je zapravo jako bitno, pogotovo u odnosu sa drugim ljudima."
0:11:02,0:11:12,"Jer svi mi imamo nekakav intuiciju i puno je tu projeciranja, kako bi rekli psiholozi, mirroringa."
0:11:15,0:11:30,"Evo, baš sad koji dan, par dana, sjedim na kauču ujutro, pijem kauču i spušta se Mirela, moja žena, i kaže, nešto tako počnem pričati, jer ja reko mi, rekla, kad je to anksioznost, kad znaš da si anksiozan, znači šta je to točno?"
0:11:32,0:11:32,Što me pitaš?
0:11:33,0:11:38,Pa imam dojam da sam ja došao do stadija da osjećam određenu anksioznost.
0:11:38,0:11:42,"I tako malo smo pričali o tome, meni je da vrag mi je i krenem ja googlati o tome."
0:11:42,0:11:54,"On je napisao ovaj kratki članak na LinkedInu o tome, daleko od toga da ja znam puno anksioznosti, ja sam prepoznao da očito i jako i kao da se jako dobro nosim sa stvarima, imam određene probleme sa anksioznosti."
0:11:55,0:11:56,E sad šta je to?
0:11:56,0:12:04,"Kada ti cijelo vrijeme radi želudac, kada ti cijelo vrijeme radi glava, ne možeš prestati se vrlo se zabrinut oko nečega, a s druge strane ne poduzimaš ništa."
0:12:05,0:12:07,I onda sam počeo poduzimati.
0:12:08,0:12:10,Kako si sam sebe opisao anksioznost?
0:12:10,0:12:16,"To mi je zanimljivo zato što sam godinama čitao te članke kao anksioznost, stres."
0:12:16,0:12:26,"Ok, stres mi je nekako bila jasna i mogao sam osjetiti stres, ali uvijek sam se pitao što je ta anksioznost dok u jednog dana nisam osjetio."
0:12:26,0:12:28,Kako bi ti opisao taj osjećaj u onom tijelu?
0:12:31,0:12:34,To je kao neki teret u želucu.
0:12:36,0:12:38,"Kod mene, u mom slučaju to tako se kako manifestira."
0:12:38,0:12:52,"Kod nekih, nije kamen, nego ti onak, kod tebe, nešto ono imaš one leptiriće kad si zaljubljen, a ovo ti je kontra od toga, imaš nešto ti treperi u želucu, a nije ugodno, ne znam kako bi to objasnio."
0:12:52,0:13:06,"Ja bih recimo kod mene kao nekakav, znaš ono kao okolišni, bazni nemir, nemir neke super niske jakosti, da kažemo ovako, tu je."
0:13:08,0:13:15,"Koda udaram po zraku teniskim reketom, pokušavam pogoditi uho, a stalno je fulavam otprilike, tako nešto."
0:13:15,0:13:16,Dobra metafora.
0:13:17,0:13:46,"Ajde da se vratimo na ono na početku, iskrenost, nekako mi se čini kako radim ove podcast redovito i puno ljudi je bilo ispred mene, sad ću uskoro, sto ljudi i malo promatram te svoje goste i promatram onda zapravo taj moj osjećaj i onda osjećaj publike da li su oni bili iskreni."
0:13:47,0:13:54,"I onda sam primijetio da ljudi, danas je ta riječ autentičnost, iskrenost mi nekako isprostituizirana."
0:13:56,0:13:58,"Trebaš biti autentičan, trebaš biti iskren."
0:13:59,0:14:09,"Ja pošto imam filozofske sklonosti kad idem malo filozofirati o tim stvarima, ja mislim da nitko od nas nije autentičan i da to zapravo ne postoji."
0:14:11,0:14:14,"Čak i složit, to je dosta teško postići po meni."
0:14:16,0:14:25,"Ali osjećam osobe recimo koje dođu ispred mene, koje glume iskrenost i koje su zaista iskrene."
0:14:26,0:14:30,Ali ne znači to da moraš reći apsolutno sve o sebi da bi bio iskren.
0:14:32,0:14:38,"Mislim da kužim u kojem smjeru ideš, ali da se vratim na autentičnost i ovo što kažeš da je isfurano malo."
0:14:40,0:14:42,"Mislim, što znači uopće biti autentičan?"
0:14:43,0:14:50,Ja vrlo često spominjem tu riječ i vrlo često čak i na predavanjima ljudima kažem da je to jedan od najbitnijih stvari u prodaji bla bla bla.
0:14:51,0:14:54,A opet zapravo se postavlja pitanje šta znači biti autentičan.
0:14:54,0:14:58,"Jer ako imaš uzora u nekome, kako si onda autentičan?"
0:14:59,0:15:03,"Mislim, to mi je malo u koliziji, jel tako ili sam ja prvu prlupao, sad smo malo filozofiju otišli."
0:15:04,0:15:05,U koliziji je sigurno da.
0:15:06,0:15:40,"I sad, a opet ako si sto posto autentičan onda bi te ljudi mogli precipirati kao neshvaćenog jel da to su ono dvije krajnosti i sad znači trebaš biti dovoljno autentičan da budeš prihvaćen a da znači dovoljno na neki način ima nekoga uzora da imaš nekoga ili neku personu da li je to može to biti Bog može to biti ne znam može to biti neka osoba iz biznisa može to biti pisac može to biti momac ne bitno je ali s druge strane opet biti dovoljno autentičan da bi na neki način bio svoj."
0:15:40,0:15:44,Ja mislim da tu neki balans mora biti između toga dvoje.
0:15:44,0:15:47,To je neko moje mišljenje kako ja to vidim.
0:15:47,0:15:53,"E sad, gdje je tu, vjeruješ da si izgovorio riječ moje mišljenje, da si ja zapisao upravo tu riječ moje mišljenje?"
0:15:54,0:15:55,"Evo, eto vidiš."
0:15:55,0:15:56,Upravo u toj sekunde.
0:15:57,0:15:58,"Da, vidiš."
0:16:00,0:16:02,"Tako da, i sad gdje je tu istina?"
0:16:02,0:16:04,"E sad, ajmo onda se igrati sa istinom."
0:16:05,0:16:12,"Meni je super, evo sad malo ću reklamirati Sašu, ali nikada neću zaboraviti kad sam otišao kod njega na NLP."
0:16:13,0:16:22,"I onda je on napisao na onaj šta šara stalno po tom flip chartu, onda je napisao jednu rečenicu koja se meni baš usjekla, mentu super stvar, kaže sve je laž."
0:16:23,0:16:29,A s druge strane možeš napraviti i reframe toga i reći sve je istina u određenom okviru.
0:16:29,0:16:32,Tako da zapravo šta je istina i šta znači biti iskren.
0:16:32,0:16:42,"Jer ako ja tebi kažem mi smo na šesnaestom katu, a ti znaš da smo na četrnaestom, ako ja gledam od minus dva iz garaže, onda sam ja u pravu, to je isto u nekom okviru istina."
0:16:44,0:16:46,Šta znači biti iskren?
0:16:47,0:16:48,Šta ćemo sad reći?
0:16:48,0:16:52,"Ili šta znači lagati, ne znam, ja sam se malo već pogubio u tome."
0:16:52,0:16:55,"Ovo je dobro, sve je laž i sve je istina za vas."
0:16:55,0:16:57,"Ali, sad je to još sašnjeno, ali meni je super."
0:16:58,0:17:00,Bez ovog tog dodatka ne bi to bilo točno.
0:17:00,0:17:06,"Da, sve je laž, to smo čuli kod Ine Merlina, ali i sve je istina, to vidiš."
0:17:07,0:17:16,"Pa u fakatu u nekom okviru sve je istina, ti se možeš igrati, ti ako dovoljno dugo ponavljaš jednu te istu stvar, tebi to postane određena istina."
0:17:16,0:17:25,"Ne znam sad da uzmemo najbanaliju stvar i da ja sad kažem oka, super da me sjediš za ovim crvenim stolom, teba prva reakcija će biti da me ispraviš i kažete ovaj stol je bijeli."
0:17:25,0:17:39,"Ali ako ja dovoljno puta u rečenici kažem da sjedimo za crvenim stolom, crveni stol, stavio sam vodu na crveni stol i crveni stol, crveni stol, ti ćeš prihvatiti u nekom trenutku moju zezanciju i ta zezancija će ti postati u nekom trenutku možda tvoja istina i na kraju će taj stol biti crveni."
0:17:40,0:17:48,"Jer znači ono u crtićima kad bude ono, kaže, no you want, yes evill, no you want, yes evill, no you want, yes evill, no you want."
0:17:48,0:17:49,"Kad se obrnu, jel?"
0:17:52,0:17:56,Sad da nastavimo malo na ovu iskrenost i tu autentičnost.
0:17:59,0:18:18,"Ja sam dok si ti pričao ja sam zapisao moje mišljenje, ti si tamo izgovorio tu riječ moje mišljenje, kad sam u trenutku u kojem moram donijeti bitnu odluku gdje ću živjeti, šta ću raditi, takve neke velike životne odluke koje ti mijenjaju život."
0:18:21,0:18:28,U zadnje vrijeme sam se počeo truditi da shvatim šta je moje mišljenje.
0:18:29,0:18:49,"Jer većina nas, ono ne znam imaš partnera pa sad sa ženom pričaš, ženo da li da se preselimo tamo, da li da radimo ovo, da li da radim ono, pa pričaš sa poslovnim partnerima, pa pričaš sa prijateljima, pa svi smo nekako konzumirali tog sadržaja bilo kroz glazbu, kroz televiziju, filmove, knjige, što god."
0:18:51,0:18:52,I jako je teško znat koje je tvoje mišljenje.
0:18:54,0:18:57,Da li je to imputirano ili da.
0:18:58,0:19:00,I pogotovo je to vidljivo na ovim potkestima.
0:19:00,0:19:06,"Znači, ja se trudim biti originalni mislioc ali jako je to teško, to je gotovo nemoguće."
0:19:07,0:19:13,"I onda vidim sebe kad pregledam neke svoje epizode vidim aha, to si pokupio tamo, aha, to si pokupio tamo."
0:19:13,0:19:26,"Vidim druge ljude jer jako je naše pažnje recimo usmjereno na Ameriku, to sam više puta rekao kroz potkeste i zapravo mi recikliramo njihove ideje vrlo često."
0:19:28,0:19:30,Da li si ti svjestan prvo te činjenice?
0:19:31,0:19:34,Ja mislim da je činjenica i kako ti nađeš svoje mišljenje?
0:19:35,0:19:57,"Da, u potpunosti sam svjestan i al to vidiš kroz život, evo si super opisao kako pokupiš od svakoga ponešto i čak i od ljudi s kojima danas više ne čujem ni ne vidim niti ne, čak ono totalno se izgubio kontakt s nekim ljudima, ali znam točno koje sam stvari od njih pokupio i šta sam naučio od njih, to je ono cjeloživotno učenje i na kraju krajeva cijeli život skupljao stvari."
0:19:57,0:20:06,"Sada njihovo, znači moje mišljenje je zapravo skup tuđih mišljenja odnosno segmenti tuđih mišljenja koje sam ja ugradio u svoj set mišljenja ajmo to tako reći jel."
0:20:06,0:20:10,I onda ti nekakvim logičkim zaključcima dolaziš još do nekog svog dodatnog mišljenja.
0:20:12,0:20:26,"I evo nešto što nisam nigdje pročitao i što mogu reći da je u potpunosti moje mišljenje, ja sam to jednom izustio, meni se svidjelo to što sam izustio, ja uvijek to kažem ljudima, to je u kontekstu mog mišljenja, ali mi je toliko logično da se zapravo držim do toga da je to moje mišljenje."
0:20:27,0:20:28,"Recimo, daću ti primjer."
0:20:28,0:20:31,"Znači, svi znaš ekstroverti, introverti, jel?"
0:20:31,0:20:34,"Ja znam, vrlo često ljudi pitaju, okej, šta znači biti ekstrovertirana osoba?"
0:20:35,0:20:38,Da li je to ono točka na nekom pravcu ili nešto totalno drugo?
0:20:39,0:20:44,"Da se ljudi malo zbrojka, vrlo brzo zaključi da nije to točka na nekom pravcu, nego to je određeni interval unutar kojeg se krećeš."
0:20:44,0:20:50,"Znači, kad si malo više ekstrovertiran, kad si malo introvertiran, zapravo se krećeš više na strani ekstroverta."
0:20:51,0:21:00,"E onda postavim drugo pitanje i kažem, okej, daj mi recite kako neka osoba koja je ekstremno ekstrovertirana, kako vidi osobu koja je manje ekstrovertirana?"
0:21:01,0:21:03,"Pa logično odgovori kao introverta, evo."
0:21:05,0:21:16,"I zapravo sam da postavio pitanje kako možemo definirati ili odrediti da li je netko introvert ili ekstrovert, znači sve zavisi o tome iz kojeg kut gledate ili sam sad previše filozofirao."
0:21:16,0:21:18,"I to je, evo to je primjer mog mišljenja, to je moje."
0:21:19,0:21:22,"Zapravo postoji spektar, da, postoji spektar tih stvari, da."
0:21:22,0:21:25,Spektar unutar kojeg se krećeš i gdje jesi.
0:21:25,0:21:44,"I sad da li je to mjerljivo ili nije, ne znam, vjerojatno je, to će netko od psihologa sigurno bolje znati od kolega, ja nisam psiholog, ali kažem, ja sam nekako gledajući i promatrajući ljude i radeći s ljudima ljude i radeći s ljudima toliki niz godina, evo stekao to mišljenje čitajući puno knjiga, ali recimo ovo nisam nigdje pročitao nego je to neko moje mišljenje."
0:21:44,0:21:48,"Da li je to ispravno ili nije, evo bit će mi drago da me netko ispravi."
0:21:48,0:21:49,Kako donosiš te teške odluke?
0:21:50,0:21:50,Koje teške odluke?
0:21:51,0:21:53,"Pa nisu životne teške odluke, kako donosiš?"
0:21:53,0:21:54,Ja teške odluke.
0:21:55,0:21:55,Pa ne.
0:21:55,0:21:59,"Ono kad si suočen s nečim, onda moraš napraviti izbor A ili B."
0:22:01,0:22:10,"Ili dođe ti neka prilika koja je potencijalno atraktivna, traži promjenu veliku."
0:22:10,0:22:11,Huga se sjetim.
0:22:11,0:22:11,Huga.
0:22:12,0:22:14,"Da, odaber jedan broj i sigurno nećeš pogriješiti."
0:22:16,0:22:17,A ne nešto.
0:22:19,0:22:53,"Ja, evo zadnjih deset i petnaest godina kad sam bio puno mlađi imao sam problem sa donošenjem odluka, ali neko sam naučio da je vrlo često pogotovo u biznisu ako ćemo ići na biznis stranu da je bitno donijeti odluku pa makar ona bila i kriva jer ako zapneš u ne donošenju odluka ne reč dalje ja ti često razmišljam kad donosim odluku koja se čini kao veća da ako prođem kako opet sam ovo mišljenje ovu ideju negdje pokupio ako prođem kroz ta vrata, kad se vratim nazad šta ću dočekati istoga?"
0:22:54,0:23:27,"Jer neka odluka ono, napraviš i vratiš se na ono staro i nisi izgubio ništa, a neke su odluke, napraviš i pokušaš se vratiti na staro i osamdeset posto tog starog nema više ili nemoguće vratiti se ili nemoguće vratiti se ili nemoguće vratiti se ili znaš kaj imaš onu foru to mi je netko rekao isto svoje vremeno u životu kad kad kad kad kad je dobro da bi mogao ići naprijed moraš napraviti kad kad kad i korak nazad jer meni je to recimo u poslu se pokazalo dobio sam u životu, mislim, dva otkaza."
0:23:27,0:23:28,Dva otkaza sam dobio.
0:23:30,0:23:33,I zapravo su mi to bile dvije najbolje situacije.
0:23:33,0:23:40,"U tom trenutku, naravno, kad si ti u tom trenutku, kad to gledaš, to je ono grozno, sve se srušilo, bankrotirat ću, moram doći će mi banka, uzet će mi stan."
0:23:40,0:23:42,"Znaš ono, vrti ti se svi najgori filmovi."
0:23:43,0:23:47,"I onda prođe malo vremena, malo se ono sabereš, iskužiš zapravo."
0:23:48,0:23:51,"Čekaj, pa da se nije desilo ovo, ne bi se desilo ovo, ne bi se desilo ovo, ne bi se desilo ovo."
0:23:52,0:23:53,"To je taj korak nazad, jelo."
0:23:53,0:24:00,"I neko je to meni toliko poslalo prirodno da, recimo, to često zna Sašir reći kad on dođe sa vance."
0:24:00,0:24:09,vam se dogodilo se ovo ili ono pa je rekao ajde sad pričekaj mjesec dana pa da vidimo šta se ne bi desilo da se ovo loše nije desilo.
0:24:11,0:24:19,"Možda je to idealistički pristup ili neki utopijski, ne znam kako hoćeš to nazvati, ali meni je to zapravo super na taj način sebi refraimati."
0:24:20,0:24:41,"Kad se ono zapneš u guzi, kasniš na jako bitan sastanak i onda ti se zapravo desi da zato što kasniš dok sjediš u autu, nervozan si, trubiš, guraš se, hoćeš proći, a vidiš da nećeš stići, nemaš kameru, a ti zazvoni telefon, nazovete osoba koja ti ponudi neki super posao da se nisi javio u tom trenutku možda ne bi dobio te posao."
0:24:41,0:24:43,Mislim da se to primjer daje.
