Start (HH:MM:SS),End (HH:MM:SS),Segment
0:31:50,0:31:52,"Ne, ne, to znam, to znam."
0:31:54,0:31:57,"A smo izdvojeni iz Dalmacije, ne, ne, ne, ne."
0:31:57,0:32:07,"Dobro, dobro, dobro da ste rekli jer ja ga prodajem kao pod bodula tamo iz Dalmatina, ne, nešto sam krivo onda očito negdje povezao."
0:32:07,0:32:09,I veliki tragi u Karlovčkom tek onda ustavio.
0:32:12,0:32:17,"I dobro, ima dobar izgled, kondiciju, je li na hrvatskom šep kako bismo rekli."
0:32:17,0:32:21,"Par dana ima sedmi i osmi, ubite me ne znam, ali veliki, veliki tragi ustavio."
0:32:22,0:32:23,Što se tiče sportskog dijela.
0:32:24,0:32:29,"I čovjek je vrlo vješti, dakle kad iziče, to je vrlo, vrlo je vješti."
0:32:29,0:33:00,"E sada, on je rekao nešto što je meritum stvari, dakle u toj ustanovi za upravljanje sportskim objektima koje upravlja Hipodromom, Hipodrom je u jednom trenutku bio u nekim problemima koji su objektivni ili subjektivni, ja nisam to jako pratio, ali uglavnom radilo se o tome da je trebalo srediti situaciju oko plaćanja najma ovog, onog, evo desno, konji, čiji su konji, kakvi su konji, ovo, ono."
0:33:00,0:33:09,I i zaista su se tu pojavili neki problemi i vrlo vjerojatno je trebalo pojačati tu sigurnost.
0:33:10,0:33:22,Pogotovo je trebalo kod jednog od tih koji je imao i svoje zaštitare jer je angažirao da štite od ovih zaštitara te njegove konje i njegov prostor tamo i tako.
0:33:23,0:33:27,I onda se dogodila jedna stvar koja je strašno pretjerana.
0:33:28,0:34:25,"Dakle, Tomašević, kad kažem Tomašević, onda je on to dozvolio, pa je onda i Tomašević sasvim sigurno, gdje je dozvolio ravnatelju te ustanove da angažira dodatne čuvare i to je ok, ali on je angažirao trideset pet čuvara u tri smjene znači sto pet čuvara deset mjeseci ih je plaćao pa jel to rat nekakav jel to ono pa mislim a da apsurd bude veći taj je čovjek tužio grad zagreb dakle nije imao namjeru tamo dinamitom dignuti hipodrom u zrak, potući se, napraviti ciljne ekscese i da stvar bude bolja, Zagreb je i pobjedio u tom sporu, je li tako?"
0:34:26,0:34:42,"Čovjek se vjerojatno, nisam ja njega dalje pratio, vjerojatno je rekao, ok i namirio je gradu što možda materijalno, što kroz papirologiju, kroz ovo, ono i vjerojatno sad tamo ima uredno te svoje konje."
0:34:42,0:34:43,I o čemu se tu radilo?
0:34:44,0:35:30,"Dakle, djelatnici prema onom što su su pisali ti djelatnici, mislim ja sam vidio, čitao sam to pismo, osim toga pročitano je javno to pismo pa je dostupno, vidjeli su da to ne odgovara činjenici da naprosto nema tih trideset pet tamo da ponekad ima netko više od onih koji su inače tamo čuvari a tamo vam je ograda ovo ono to se relativno jednostavno čuva zaista nema potrebe za takvim i onda se ispostavilo da je velika sumnja u to kako je kolao novac di je išao novac kome je išao novac, na kakvom natječaju su se javili ti i koji su ti koji su bili čuvari."
0:35:31,0:35:49,"Da li su to prijatelji moji, prijatelji mog, prijatelja, prijatelji, prijatelja mog, prijatelja, pa mislim dva milijuna eura je veliki novac, tako lanac može napraviti veliki i navodno je li sumnja osnovana POS-u, ja ne mogu reći da je tako bilo, tako piše u tom papiru."
0:35:50,0:36:43,"U jednom trenutku kad su stvari počele kulminirati u samoj ustanovi, priča o ovoj i onom, priča o ovoj i onom, ne, ovi su se uznemirili i pogotovo kad su neke stvari počele onda se pišati po kafićima itede i po onome što novilo tvrdi, a on tvrdi ono za što su bovi dali dokaze valjane ili nevaljane, to će sud procijeniti, oni su išli na falsificiranje zapravo svih tih računa i svega toga tako da su recimo rasporedili tih trideset pet na mnoge ustanove ima inače tristo šezdeset čini mi dvjesto ili tristo šezdeset ustanova grad zagreb to je zaista veliki jedan za upravljanje, ali oni su to, oni su izmanipulirali, izlagali su to."
0:36:44,0:36:45,I što sad Tomašević?
0:36:46,0:37:05,"Tomašević sazove presicu odmah iza toga jer zna o čemu će biti riječi i zamislite, on ne kaže gospodin Nobilo, čudi me, tako iskusan odvjetnik, nekoga je navukao, to naprosto nije istina."
0:37:05,0:37:23,"Pogledajte ove papire, u tim papirima sve piše i meni treba tri, četiri tjedna da te papire sredim i ja vam dragi moji novinari obećem da ću sazvati presicu i sve ću vam podasrijet."
0:37:24,0:37:25,Nije on to rekao.
0:37:25,0:37:29,"On je rekao, ha, Nobilo, a što mu je to trebalo?"
0:37:29,0:37:36,"Pa mislim, pa tužbe se daju, to je normalno, ne, ali čemu u javnosti ići s tim?"
0:37:37,0:37:39,"Nobilo je rekao zašto u javnosti ići s tim, mislim."
0:37:41,0:37:46,"Onda kad je to rekao, zaboravio je da je on to isto Bandiću radio na žičari."
0:37:46,0:37:50,"Isto, postupno isto, jedanjedan, to je zaboravio naravno na te svoje stvari."
0:37:52,0:38:10,"Onda je rekao da, da, da, da, da, htio je vi duhovit gospodin Novilo sad više ne vodi proces kod Dodika, nestalo pinke, nije baš tako rekao, ali to je tako gestikulacija cijela išla i sad se dao na nov slučaj."
0:38:10,0:38:12,A znate zašto se dao na nov slučaj?
0:38:13,0:38:59,"I onda nam je Tomašić otkrio kako sa problema Hipodroma, problema vrlo vjerojatno protuzakonito upotrijebljenih dva milijuna eura što je veliki novac i svakog vraga se može s tim novcem namiriti za bilo šta na način da je rekao pa da gospodin Nobilov ima vrijedna zemljišta na Savi, na Laništu i sada sa novim GUP-om ćemo spriječiti preizgrađenost da se grade neboderi, nehetan ćemo spriječiti tamo i onda je gospodin Nobilov se osjetio ugrožen pa sada s Jutinom vrši nekakav atak."
0:39:00,0:39:06,"Dakle to je po meni zapravo velika slabost Tomaševića, velika slabost."
0:39:06,0:39:47,"On je morao reći, ja ću provjeriti je li to istina, što piše u tim papirima i što smo čuli, ako je istina, snosit će netko posljedice, pa makar i ja snosio posljedice na glasovima, je li birača sad za dva mjeseca, dva mjeseca, je li da malo, malo manje, dakle, ne, on nije, nego je išao na difamiranje, išao je protiv i mogu vam reći da je uspio jer ja kad razgovaram sa svojim prijateljima, kolegama u kafiću, pričamo, više se ne priča samo o dva milijuna eura koje."
0:39:49,0:39:50,nego o gradilištu na laništu.
0:39:50,0:39:57,"Pa da, pa ovo, a ja si odmah mislim, pa koji je interes ovome da se to pokrije."
0:39:58,0:40:16,"Da nema koji je interes tobelu da bi ga podbadao zbog toga što ovaj sa novim GUP-om, jer mu je, ne znam, nije mu dao deset nečega, nego će dobiti tri nečega, a i tri i deset jedan i nulapet je toliko ogromno da je zapravo sve to skupa smiješno."
0:40:16,0:40:18,Neko odvlačenje pažnje vodim rječnikom.
0:40:19,0:40:21,A majstor je za odvlačenje pažnje.
0:40:21,0:40:28,"Majstor, majstor, majstor treba i za promidžbu i za priče na društvenim mrežama."
0:40:29,0:40:31,"To je ekipa vodi dobro, može se učiti od njega."
0:40:32,0:40:36,"Oni to koriste što bi trebali svi, to je dokazano u Hrvatskoj i Jonjić gospodin."
0:40:38,0:40:40,"Jako ste mreža, a da."
0:40:46,0:40:48,Sad ću urežati gospodina Jonjića.
0:40:48,0:41:10,"Dakle izvori su za predsjednika države i ja naravno to je moja tema, kao što je moja tema sad izbori najviše zagrebački, ali ću ići i na druge, pa ću onda vas zamoliti da mi malo došapnete što se to događa u Karlovcu, u Karlovačkoj županiji itede pa da napravimo neku sinergiju, možemo razmjenjivati ovaj informacije."
0:41:20,0:41:24,"Pa imali ste lijeve, imali ste neki dan u ovom godini, pomognite mi ovom beroženicom raditi sve da."
0:41:24,0:41:28,"Pa da ne miše samo da ti pa recimo aktualna vlast protiv, ovi su protiv."
0:41:29,0:41:30,esdepe možemo se i to.
0:41:30,0:41:31,"Da, da, da."
0:41:31,0:41:35,Za sada je samo ovi hadezeovi kažu da to ćemo.
0:41:35,0:41:37,Ali da se vratimo na Jonjića.
0:41:37,0:41:42,I ja napravim ovaj jedan taj prilog o svim kandidatima.
0:41:42,0:41:46,"Jonjića nisam spomenuo, pobjeglo mi je, nisam vidio, nisam znao da je on kandidat."
0:41:47,0:41:58,"I piše meni jedan čovjek iz Rijeke, jako pristojno, kaže gospodine sve ste to lijepo rekli, sve je to divno, krasno, ali niste spomenuli gospodina Jonjića."
0:41:58,0:42:22,"Inače u to vrijeme još su mi bili ili baš u pom, ovo, ono, pa šta, te aha, ti je podcijenjuješ i oni ča pa desničare ono, jel vamo tamo odbacuješ itede Ja sam uredno čovjeku odgovorio u komentaru, oprostite stvarno nisam znao, ali onda sam primjenio jedan trik koji primjenjujem, ali obično mi ne upali."
0:42:23,0:42:35,"Ali sam vidio čovjek je lijepo, sročio je dobro, vidi se da nije ono baš vezan tip, nije nitko vezan tip, nego da zna artikulirati stvari."
0:42:35,0:42:54,"Ja mu napisao poštovani gospodin, ok, ako sam pogriješio to ću provjeriti pa ćemo to nadoknaditi, ali znate što, ja vas pozivam na Štokajču, dođite pa onda vi dajte tu vijest ili objavite svijetu da je i Jonjić da se."
0:42:56,0:43:02,"I rekao sam mu ajmo se sad dalje u komunikaciju preko Messingera, evo, skriveno, ne, javno."
0:43:02,0:43:11,"I ja bih samo za pet minuta i pošaljem mi broj da se čujemo, ja ga odmah nazovem i on prihvati, prihvati da gostuje."
0:43:11,0:43:14,"Ono tu, ono, ja to stvarno nisam očekivao."
0:43:15,0:43:45,"Zanadilo me da, on je invalid i teško uopće iz svog stana izlazi i tako i onda me pozvao da dođem kod njega da napravimo to, ja sam predložio da to ide online i bilo je online i mi smo razgovarali o njima, prije toga sam naravno ja vidio sve što je, kako je i mogu vam reći taj prilog, taj podcast, ta emisija, ta epizoda, ona je došla do nekih dvadeset tisuća gledanja."
0:43:46,0:45:02,"A kad imate prosjek, tada sam imao to je bilo jel prošlo ljeto pred izbore, kad imate prosjek dva tri tisuće pa dođete samo s jednim na dvadeset tisuća to je ono i nakon toga sam ja stvarno počeo pratiti Jonjića i ovo i ono, nisam ja za to da, ali htio bih ono, vi ste to i u svojoj misiji nekoliko imali tu tezu da je on na društvenim mrežama, ja ću vam ipak reći nešto drugo, dakle uglavnom njega sam počeo pratiti, otišao sam kad je predavao liste i kako sam imao dosta objava o njemu, on je napravio tamo jedan teatar, kao što svi rade, pa je svoje pobornike doveo pedesetak njih sa zastavama, s ovim, s onim, to je tako jedan folklorni element, ali i element koji je snagu pokazivao, pa tamo na Veles i MOST-u pjevali lijepu našu te pjesme, jel, doboljubne i tako i to je sve skupa lijepo izgledalo i strašno sam se začudio, prilazili su mi njegovi ljudi, pa jeste vi što kaj čekate, jeste vi ne nad predan njoj, pa bilo bi vas zvala ovo, pa ono."
0:45:03,0:45:06,"Dakle, on je imao taj potencijal kod desnice."
0:45:07,0:45:30,"Njegove društvene mreže na početku su bile katastrofalno loše, YouTube, ništa, imao je nekih dvjesto pratitelja, a nakon tog intervjua sad nije moja zasluga nego je njegova, ali to je jako, jako je skočilo, ovaj zaista je jako skočilo i vidim da se sad nešto popravio ali nedovoljno."
0:45:31,0:45:47,"Ja mislim da same društvene mreže nisu napravile jer ja sam njega pratio po svim društvenim mrežama, nego je to iznenađenje napravilo i ovo, taj jedan naboj koji će dovesti petsto tisuća ljudi kod tog suna."
0:45:47,0:46:11,"Dakle, ljudima je već dosta tog terora kako ljudi shvaćaju, netko shvaća kao teror je li ta ideološka ili nepomidljivost prema ravnopravnom razgovoru o ajmo to uvjetno nazvati lijevom i desnom i oni su se opredijelili za Jonića."
0:46:11,0:46:53,"Jonić nije čudo što je u Imotskom napravio izi izvrstan rezultat, on je iz ugledne obitelji, odvjetničke itede je li, a ovaj, stradalničke obitelji poslije drugog svjetskog rada su mu provarili u velikoj, da i to je ostavilo velikog traga na njemu i ovaj i on i mislim da je od ljudi očekivanje da zapravo jedan intelektualac, čovjek koji ima i glavu i rep, čovjek koji ima životopis, da zapravo on možda i koji ne, kako bih rekao, ne kalkulira, ne politizira i uvijek je čvrsti i otvoren, da je možda on ta osoba koja bi mogla desnicu povesti."
0:46:55,0:47:01,"Slično se događalo s Karamarkom, ali Karamarko je prokockao sve što je mogao prokocati i upropacio."
0:47:02,0:47:13,"Nešto slično, nešto slično je bilo sa Hasanbegovićem, ali on to nije uspio iz raznih razloga ipak kapitalizirati na pravi način."
0:47:13,0:48:02,"Sad nešto, je li pokušava, pa evo, ići će i za narodsku skupštinu, pa evo, tu se nešto sa Kolokovićem oko mjesta u Saboru itede pa sad taj Ustavni sud jer vidjeli tu su isto zanimljive priče kako Ustavni sud ne rješava problem, a mi nemamo sto pedeset jedan zastupnika nego sto pedeset a sto pedeset jedan je izabran i to toliko mjesta mora bit dakle to se mora riješiti na ovaj ili na onaj način nije bitno sad kako po zakonu Ustavni sud zna kako to riješiti eto vidite kako nam skaču misli pa tebe idu iz jednog područja u Zagrebu sad imamo esdepe možemo oka mislim da je oka imamo oka ali da nam je ne razumijem, ja sam balon."
0:48:04,0:48:05,"Nije, mene čak nije na silu."
0:48:08,0:48:12,"O tome bih volio da popričamo, samo ću vam reći zašto nije na silu."
0:48:12,0:48:37,"Dakle, možemo je zaista mislio i ima neke račune po cijeloj Hrvatskoj, ne samo u Zagrebu, je li sve to jedan zalog da možda sa glasovima esdepea jer esdepe ima veliki dio u Zagrebu, da, u Zagrebu je to puno dakle na njima da će Tomašić u prvom krugu ući u ove odluke."
0:48:37,0:49:26,"Ali esdepe nije shvatio što mene jako čudi, on je naprosto kastrirao Zagreb, najprije Gotovca bio izbacio, sjećate se, pa sada neće ići sa svojim kandidatom nego se tu i esdepeo Renato Petek njega su, joj ne smijem reći izigrali, ali dakle on je, dakle Renato Petek je ušao u esdepe ja li nešto kasnije, ali bio je njihovom i on ima jedan porim da zaista radi dobre stvari u Gradskoj skupštini, da upozorava ovo, on je bio veliki Bandićev kritičar, ali isto tako i kritičara je kritičar Tomaševićev i to zato jer ima puno više iskustva, argumentiranije vrlo često nego oporba."
0:49:26,0:49:40,"Oporba, a to je Bandićevac, a to je ono, a Petak je baš lijepo udario i izživcirao bi beskrajno, ali beskrajno je izživcirao ovaj Tomaševića, a onda i svoje."
0:49:41,0:49:57,"Ali on je rekao, ja sam moje, jel moje esdepeovce pita jel ja mogu tući pod njima kad nisu u pravu, po dobrim smo demokratska stranka, možeš kako ne bi mogao, pa ono, mislim, pa to je poželjno, jel, ako je ne, ako je za narod, ako je za ljude, ako je za zagrepčare, samo deri, ono."
0:49:58,0:50:19,"Međutim, to samo deri dovelo ga je do posljedice da sad kad su se, jel, sklopili koaliciju, kad zajedno idu na izbore, kad esdepe nije dobio ništa u smislu da možda će dobit predsjednika skupštine, jel, ako im se sve baš poklopi, ali to ja mislim da za skupštinu će isto biti nemoguće da bi im se tako poklopilo."
0:50:22,0:50:47,"Jednostavno, Renato Petek smeta Kako u kuluarima esdepeovskim pričaju što možda je istina, što možda nije istina, ali ja ću reći jer smo na podcastu a nismo na javnoj televiziji, te je Tomašić rekao da ga ne želi vidjeti ni nacrtanog niti na najnižoj razini na nekoj listi u mjestnom odboru, a kamoli za gradsku skupštinu."
0:50:48,0:50:55,Pa pazite čovjek se borio za gradonačelnika na unutar stranačkim izborima i imao je dobre glasove.
0:50:55,0:51:23,"I sad je on u velikoj dilemi što i kako napraviti, ovaj imaju dobru ideju da ide sam, da ide kao žališni, da svoju ekipu skupi, to je dosta je to, znate, dosta je to teško, jer je Bernardić tamo, dakle oni glasači koji nisu zadovoljni sa tim poticima esdepea imaju Bernardić, pa će on jedan dio otkinut, pa njemu koliko bi mu ostalo?"
0:51:24,0:51:56,"Jesu li ga, skupštine, skupština gradska, jesu li ga ipak ljudi toliko vidjeli i percipirali u javnosti da bi onda za njega glasali, a za razliku od vremena Bandića kad je društvene mreže i te što seve koristio jako, jel, pa ne znam, donio je jedanput neku sklopku na skupštini i rekao, vidite, ova sklopka košta dvadeset eura, Bandić je platio dvjesto eura, to je bio čisti fake, mislim da taj je gumb možda koštao dvadeset eura."
0:51:56,0:52:20,"Ali služio se tim što sevima, sad se nije služio s tim što sevima, ali je išao ovako, dakle nije se preko društvenih mreža uspio afirmirati dovoljno po mom mišljenju, da se, nestao je, bio je dosta jak na Twitteru, kužite, ali to novinari gledaju, to ne prate građani."
0:52:24,0:53:34,"Da, nešto je bilo na Facebooku, ali i to znate, to su podcasti su prava stvar, to ih se vrati, možemo pričati, već smo jedno o tome, pozivate ga ovako preko, preko, sada je u esdepeu možemo, Renato javi se, gospodin Kalinić koji je već rekao u jednom od podkasta tu susjednom jednom da bi on volio i htio da se stvarno svi okupe protiv aktualne vlasti."
0:53:35,0:53:47,"I dobro, kad je meni bio Jonjić Gost rekao je teško da može desni ili lijevi ali vidim da Pavle radi sa taj neki evo danas je, idemo u petak van ali danas je utorak, ne danas je ponedjeljak."
0:53:48,0:53:56,"Mislav Žagar mu je prišao, vi ste bili tamo, došli ste, došli ste, došli ste, došli ste."
0:53:56,0:53:58,"Ja sam došao, ja sam došao."
0:53:58,0:54:02,"Mislim da je to dobra stvar, ali ne nego da ih bude petnaest bilo kakvih."
0:54:02,0:54:30,"Ja mislim da je to puno bolja stvar i pošto imam neke insajderske informacije koje naravno ne smijem sada reći javno ovako, Auskavicu možda i mogu, dakle ne, bit će tu još, ne nikako, bit će tu još iznenađenja, ali ono samo što mogu reći je da Pavle Kalinić ima taj najveći koalicijski potencijal."
0:54:31,0:54:33,Zašto ima najveći koalicijski potencijal?
0:54:34,0:54:46,"Zato jer ga ima svugdje po Zagrebu, on je nešto kao Bandić u tom smislu, mada je Bandić neunadmašan, ali odmah poslije Bandića Kalinić je čovjek koji se dnevno rukuje s najviše ruku."
0:54:46,0:54:51,"I to ću ispasti kao da sam Kalinićevac, međutim ima iza sebe iskustvo Domovinskog rata."
0:54:52,0:54:52,Točno.
0:54:53,0:54:59,"I bio je dobar operativac, civilna zaštita i ovo, mogu se ljudi njemu rugat, ali vi u Zagrebu ste znali otprilike da."
0:55:00,0:55:02,"Da, mogu se rugat, ali ne na ono što je radio."
0:55:02,0:55:08,A mi u Karlovcu kad je bio potres ne znaš ono šta bi trebao znati.
0:55:08,0:55:11,"Da, mislim kod njega se točno znalo civilna zaštita."
0:55:11,0:55:16,"Ja sam ga nazvao onaj tankić i ovo, no međutim, ali znate što, zezanje je za tenkić."
0:55:16,0:55:21,"desetak godina kasnije kad se vide takvi potresi, ne daj Bože, rata više ikada."
0:55:21,0:55:33,"Pa vidite ovo sada u svijetu, sad je dole ovo, pa jedan takav tenkić bi jako dobro došao, ako je jedno zapovjedno središte komunikacijsko itede Ali da ne ulazimo, taj tenkić je zgodan za zezanje, jevda, zgodan je."
0:55:34,0:56:15,"On je jedan osobujen, tim zaista neposredan i ono, baš je otvoren i ono što je najvažnije u svemu, nema tu, kako bih rekao, ono što Bandića stalno prati kao slika, ta korumpiranost, ovo, ono, a vjerujte mi, ja sam s Bandićem radio dugo, mislim, toga nije bilo što se njegove krivnje tiče, apsolutno ništa više nego u sustavu, cijeli sustav se je izgrađivao i tek danas dolaze odmah isti čas, jel malo sagradiš bespravnu kuću i kako treba odmah te lijepo."
0:56:15,0:56:26,"Dakle, Pavle Kalinić nema ništa od toga, nema nikakav rep, ima svoj ponos, ništa ništa, ni zašta nije od toga bio, ima svoj ponos."
0:56:26,0:56:41,"I ono što mislim da je vrlo važno da ima i taj jedan znanstveni pedigree, on je napisao puno više knjiga nego što su pročitali neki koji će biti na listama kroz cijeli život."
0:56:42,0:57:16,"Tako da ne mislim na kandidate gradonačelničke, tako da je tu jedna zaista posebna stvar i jedna privlačnost za Pavla i mislim da gospodin Kalinić može i dobar dio ovog desnoga spektra motivirati da ulože u njega kao čovjeka koji bi možda imao najviše šanse za drugi krug i onda naravno u drugom krugu je sve moguće."
0:57:17,0:57:25,U drugom krugu mislim da Kalinić ima najveći potencijal baš zbog te svoje vrskavosti.
0:57:26,0:57:37,"Prije sam rekao primjere kad mu njevito Tomašević reagira sa svojom dosjetkom, ali to mu kod Pavla Kalinića ne bi palo.."
0:57:38,0:57:40,"Dakle, tu je taj jedan potencijal."
0:57:42,0:58:08,"Sad, Jonić mi je mala nepoznanica, naime, ja navijam ne zato što bih bio desničar, ja navijam za tu desnu stranu da se izdigne na jedan kvalitetan način i da zaista može dati kvalitete odgovore za Hrvatsku, ne navijačke, ne obojene ovom milijunom bojom, nego ono što donosi život, što je dobro za život."
0:58:09,0:58:13,"Dakle, Pavle Kalinić je išao u jednu krajnost, mislim da mu to nije dobro."
0:58:13,0:58:37,"On je rekao neću politiku u moju botigu, mene to srančarenje, ovo, ono, politika me ne interesira, ja sam gradonačelnik svih građana Grada Zagreba i meni su svi jednaki i postoji zakoni i treba poštovati te zakoni i u okviru tih zakona svi su mi jednaki, ne mislim raditi razlike kao što radi ova sadašnja aktualna vlast."
0:58:38,0:58:46,"A on je i više rekao nešto sasvim drugo, ne, ideologija je na prvom mjestu i na mjestu gradonačelnika."
0:58:46,0:58:49,Gradonačelnik nije glavni komunalni reda.
0:58:50,0:58:55,"Da, da i to mu je dosjetka fenomenalna."
0:58:55,0:59:25,"Ali znate ja imam nešto iskustva u lokalnoj politici Grada Zagreba i ja vam mogu reći da gradonačelnik vrlo često i mora biti komunalni reda, ne da bi radio posao komunalnog redara nego da bi smjerao, da bi dobivao izvješća, da bi tražio i da bi bio, meni je tu zapravo Bandić jedan uzor lokalnog političara kad ogolimo sve ovo drugo što se veže na njega."
0:59:25,0:59:32,"Dakle on je stalno bio s ljudima, on je bio u uredu, on je ovo, on je ono, on je znao i smiješne stvari napraviti."
0:59:32,0:59:46,"Ja sam jedanput bio s njim kad su baš na mom trnju, ja sam tamo bio gradski vijećnik i stavljali su zelenu površinu na nogometno igralište, na taj stadion naš na trnju."
0:59:46,0:59:49,"I naravno tamo su bili stručnjaci za to, sve ne."
0:59:50,0:59:56,"I on dođe, on njima tumači, neka zna što ti je ova podloga, ovo, ovo, to mi tako ćete vi to napraviti."
0:59:57,0:59:58,Ja se mogu stalno naštvarati.
0:59:58,1:00:00,"Mogli su raditi kakve treba, se"
1:00:00,1:00:01,Mogu malo na šoku.
1:00:02,1:00:07,Danas sam našao klip sa Vučićem kada je objašnjavao doktorima šta to treba napraviti.
1:00:07,1:00:09,"Da, pa vi ste morali s njima malo glasati."
1:00:09,1:00:16,"Ne, simpatično, naravno da su ovi napravili, možda su napravili kao što je Bandić rekao ako je to ispravno, ako su napravili ono što je ispravno."
1:00:16,1:00:19,"Idi se, ide se, izbori su glasali, ide se."
1:00:19,1:00:22,"Da, možeš biti operativac, da, moraš biti manikin, kad treba."
1:00:23,1:00:24,"E, mislim da je tako."
1:00:24,1:00:38,"E sad, i oni će, oni će, mi se još nije dovoljno otkrio ovaj, meni je žao, vi imate tako lijep prostor ovdje, ja da imam prostor ovakav, ja bih sve ovo njih zvao i oni bi sigurno došli."
1:00:38,1:00:47,"E, dva puta, ja gledam, gledam da, da, ova puta, evo, Renato će doći, a Pavle, samo da ga nagovorimo, da dođe."
1:00:47,1:00:50,Jer bio je i njegov član tima Vranja Vidmarović i preko njega ovaj.
1:00:51,1:00:54,"Samo vam je palo, pa sam vi nešto slično stavljat pitanja."
1:00:54,1:00:57,Pa ja sam htio reći da je Pavle najzahvalniji gost u Hrvatskoj.
1:00:59,1:01:02,"Dobar dan, dobro dan, da si novi, tu smo, gospodine Pavle, izvolite."
1:01:04,1:01:04,I pošteno.
1:01:05,1:01:06,Je li tako?
1:01:06,1:01:10,"Znači što, imao sam ja s njim ovaj intervju."
1:01:10,1:01:14,"Ja vam neko čujem Pavle, ja ti, podcast i jesu radi gostiju."
1:01:14,1:01:17,"Da, to je točno."
1:01:18,1:01:19,Ja vam neko čujem.
1:01:57,1:02:19,"I tako da ovaj, malevro, fenomenalan, fenomenalan je, on čemu god hoćemo, ekspresivan je, znate on priča, vidjeli ste gdje smo, znači to nam je drugi put da smo ovdje, dok se mi malo uštede, ali ako budeš gledao ovaj podcast, javi se gospodin Lalovac."
1:02:19,1:02:31,"Znači gospodin Pavlo, imat ćemo dvije ili tri kamere, sad se nešto zgodilo s drugom kamerom, zaboravili smo objektiv, posudili smo jednu drugu i lik nam vrati kameru bez objektiva, nismo gledali."
1:02:31,1:02:37,Pa idemo na jedan kadar da nas gleda ovaj na ovaj način.
1:02:37,1:02:40,"Dobro, dobro, dakle i oni će, ja čekam da se ono otvori."
1:02:40,1:02:48,"Naprosto ideologija sama ne može biti jer ideologija se onda svodi, ok, hod za život, ovaj je maknuo zastave, ja ću pustiti zastave."
1:02:48,1:02:50,"Neće mora ići, ovaj tramvaj mora voziti."
1:02:50,1:03:00,"Da, ne, ideologija mora biti, naravno, uvijek ideologija i kroz te udruge, je li to, to malo više koristi ono, skoro sam rekao besramno."
1:03:01,1:03:05,"Dakle, da, ali moraš još nešto imati."
1:03:06,1:03:10,"I ja da ima ovakav prostor, ja bih ga odmah zvao i samo o tome bismo razgovarali."
1:03:11,1:03:23,"Ja sam vam rekao koliko možemo, mi ćemo vam pomoći, jest da smo dislocirani, sad Sad bih ja rekao nešto što sam govorio, Karlovac je moj, ali jedan ovaj kandidat za gradonačelnika Karlovca je stavio to za svoj slogan, pa neću ovaj."
1:03:25,1:03:26,Karlovac je ipak glavni grad.
1:03:27,1:03:28,"Da, mene."
1:03:28,1:03:30,"Slobodan dođite, nismo daleko."
1:03:30,1:03:32,Karlovac je prekrasan grad.
