Start (HH:MM:SS),End (HH:MM:SS),Segment
0:00:15,0:00:17,Dobar dan ekipo i dobrodošli u Novi Čuštis.
0:00:18,0:00:26,Današnji gost je meni izuzetno dragi gost jer se poklopilo da smo neko u isto vrijeme krenuli sa tim YouTube objavljivanjem.
0:00:26,0:00:37,"To je gospodin Enad Predovan, umirovljeni brigadir Hrvatske vojske i odnedugo ima titulu najbržeg i najveće, najbržeg rastečeg malog youtubera u Hrvatskoj."
0:00:38,0:00:53,"Eto, čovjek u mirovini koji se nije odao kladionici, nije se odao nekakvim politikanstvima, već uzeo kameru, uzeo mikrofon i radi i užasno je gledan i kao što sam već rekao najbrži rastući mali youtuber u Hrvatskoj."
0:00:53,0:00:56,"Dragi moj njeno, hvala što ste došli u Karlovac i u naš podcast."
0:00:57,0:01:10,"Hvala vama, ja sam zapravo bio nestrpljiv da dođem i da budem vaš gost jer mi se već dugo ovako čujemo preko društvenih mreža, telefonom i tako i mogu vam reći da imate jako lijepi studio i tako."
0:01:10,0:01:11,"Evo, ne, ne."
0:01:11,0:01:13,Uvijek se ugodno osjećam.
0:01:13,0:01:14,svaka čast.
0:01:14,0:01:17,"Novo je malo studio, možda bude kakvih tehničkih problema, ali novo je to."
0:01:18,0:01:19,Ja u principu 60.
0:01:19,0:01:20,epizode krećem na novo.
0:01:20,0:01:23,"Nova ekipa, novi studio i tako."
0:01:23,0:01:24,Ali ne treba se predati.
0:01:25,0:01:26,To ste i sami naučili.
0:01:28,0:01:30,"U današnjoj doba, u 21."
0:01:30,0:01:37,"stoljeću, da i mi malo stari možemo vrlo lijepo se baviti sa društvenim mrežama, pa čak i nešto zaraditi."
0:01:38,0:01:39,O zaradi nećemo.
0:01:39,0:01:46,"Ali eto, gospodine, ja znam kako sam ja došao na ideju da počnem s tim podcastom, čisto iz dosada i zbog svog karaktera, a vi?"
0:01:48,0:01:53,"Vaš karakter je jako dobar., uspijete kod gostiju izvući sve ono najbolje od njih."
0:01:54,0:02:03,"Bilo da su mladi, a imate dosta mladih, bilo da su stari, bilo da su svako najstariji kao ja koji su u mirovini."
0:02:03,0:02:04,Niste još na starijem.
0:02:04,0:02:06,A nisam sve bio stariji neko od mene.
0:02:06,0:02:07,70 godina je bio najstariji.
0:02:08,0:02:10,Onda sam ja malo stariji koji mjesec.
0:02:12,0:02:19,"Dobro, dobro, sad sam odao tajnu u mojoj publici, ali ne treba se predati nikada nijukom."
0:02:21,0:02:21,Što kajče?
0:02:22,0:02:22,Što kajče je tako.
0:02:23,0:02:24,Podno ime da neko kažem.
0:02:25,0:02:29,"Pa uzeo sam ga zapravo tri zamjenice, što, kaj, ča."
0:02:29,0:02:36,"I odmah da vam kažem, zeznuo sam se bio na početku, zato jer sam uzeo najtežu moguću kombinaciju."
0:02:37,0:02:45,"Prije svega ima dva ova šuška, š i č, i to u tražilici je jako, jako teško naći."
0:02:46,0:02:56,"Ali sam nekako se probio, radio sam najprije putopise, moj je bio dosta dugo, travel, kategorija."
0:02:56,0:03:04,"I sa Krka sam radio jako lijepe reportaže, radio sam dobre reportaže i snimke i pričice iz Zagreba sa Trnja."
0:03:04,0:03:12,"Ja sam Trnjan, to je baš onako bilo gledano i onda sam se odlučio preći na ono što mogu raditi svaki dan."
0:03:13,0:04:09,"I svaki dan ja objavim jedan ili dva videa, evo dva videa sam danas objavio i ono da pokusnem na drvo, zaista sam zadovoljan sa gledano šutuje deset petnaest dvadeset trideset nekad i više pregleda dnevno pa čuje tisuća dvadeset ka ono, da, da, da, tako je, tako je i to je zaista, sam zadovoljan, jako puno je komentara, komentara je svakakvih, ali pustim ja sve osim baš ako neko nekog vrijeđa, pogotovo ako imam gost, ako imam intervju i neka uvreda ide prema njemu, to naravno brišem, još do sad blokirao nisam nikog jer eto, ali mogu vam reći u zadnje vrijeme da se ljudi pridržavaju, kao da prihvaćaju jedan ozbiljan razgovor na temu."
0:04:10,0:04:11,Pa mislim da je bilo i vrijeme.
0:04:11,0:04:13,Pa je.
0:04:13,0:04:23,"na korona, komentare po portalima, ono mislim čisto ono nekakvo stresanje, bijes, frustracija jer meni se vaš koncept, i sad ispada da ćemo jedan drugog tako navaliti, možda vas netko i kupi."
0:04:25,0:04:33,"Pa svi imate odličan koncept, osam do deset minuta dnevno političke događaje."
0:04:34,0:04:42,"Dakle, brži ste vi i vama slični od svih mainstream medija, a to danas način života i traži."
0:04:43,0:04:45,I zato ste vi tako naglo izrasli.
0:04:46,0:04:46,To je moje mišljenje.
0:04:47,0:04:53,"Pa gledajte, samo je jedna stvar, jedan medij je brži od mene, a to su portali."
0:04:54,0:05:29,"Jer portali on dođe, odmah napiše ono što bi se reklo, samo mora paziti da nema previše gramatičkih grešaka i da mu je rečenica nekako ok i pusti neki video, klipić itede Ja ono što radim, mislim prednost je što živim u Zagrebu, jel i onda zaista bio sam u Gradskoj skupštini, zastupnik, potpredsjednik Gradske skupštine, tako da sam vrlo vičan tom životu, znam običaje, navike i tako i onda mi nije problem sa presice doći doma i odmah recimo snimiti."
0:05:29,0:05:34,Evo recimo danas je Pavle Kalinić kandidat za gradonačelnika.
0:05:35,0:05:51,"Da, tako je, tako je, o tome možemo malo opširnije, ali hoću vam reći, jeli oni žagar su potpisali sporazum o predizbornoj koaliciji i taj vid je nakon sat vremena cijeli jedanjedan bio vani."
0:05:51,0:06:09,"Kad ne radim jedanjedan, e onda je to naravno malo drugačije, malo teže kad idem sa nekim sličicama itede Ono što ja nastojim da moj kanal ne bude vijest jer čovjek otvori radio, uključi, otvori televiziju, gleda vijesti i to je to."
0:06:09,0:06:16,"Želim uvijek dati jedan svoj komentar, komentar koji ide iz mojega iskustva."
0:06:17,0:06:29,"Nekom se sviđa, nekom se ne sviđa, ali hvala Bogu ima više onih kojima se to sviđa i eto rekli ste najbrži kanal rastući."
0:06:30,0:06:47,"Pa zaista u zadnjih osam devet mjeseci jesam najbrže rastući mali kanal, to ne mislim na ove koji imaju za sebe velike produkcije itede Pa ja mislim da ćemo se moći nositi, sigurno."
0:06:47,0:06:52,"Vi kao podkast, pa li to podcasti sad razvaljuju?"
0:06:53,0:06:58,"Da, sad ima puno, puno, puno, puno podcasta, ali neka baš zbog toga, zbog tih mainstream medija."
0:06:58,0:07:09,"Evo jedan od razloga je bio što sam počeo gledati i vas i druge podcaste, shvatio sam, okej, mediji uvijek moraju malo lagati, ali su počeli zadnje vrijeme previše lagati."
0:07:10,0:07:11,"Da, da, može se sa stava, da."
0:07:12,0:07:22,"Kliknete tamo na tom YouTube-u, slobodno ga reklamiramo, njihov smo partner i vi vidite neke druge stvari koje se pokažu za mjesec, dva, tri, istinite."
0:07:24,0:07:27,"Tako da iskreno ne, no ja vam više ni ne gledam vijesti."
0:07:27,0:07:43,"Oka, ako je neki gost poprati malo naslove i to, ali o ovoj policiji Hrvatskoj saznao sam po podcastima, od vas i od nekih podcasta, ukrajinsko-ruski sukob, ja sam većinu stvari saznao po tim podcastima, što hrvatskim, što sa ruskim i to je možda čak i žalosno."
0:07:44,0:07:48,"Da, Srbi imaju jako dobre podcaste za Ukrajinu i za općenito."
0:07:48,0:07:58,"Da, mi bi rekli na navijaju za Ruseno, međutim ne znam koliko oni navijaju i koliko Rusima stalo do toga da Srbi za njih navijaju, ali su 80% bili u pravu."
0:07:59,0:08:00,"Da, da, da."
0:08:01,0:08:06,"Ja sam bio malo onako, neću reći čudan, malo sam bio povrijeđen zbog tih naših medija, jel?"
0:08:07,0:08:12,"Gledajte, mediji su zapravo i klasični, jel, televizija."
0:08:14,0:08:19,"Radio mi se više sviđa od televizije, svi imaju svoj radio i to mi je bilo odlično, ali nije se isplatilo."
0:08:20,0:09:07,"Na kraju su velika ulaganja bila, rezultat nije bio adekvatan, oni su dosta konzervativni i dosta su oprezni jel oficijalne vijesti na hateveu ili erteu ili no ili njedan oni zaista moraju nekad malo prikoćit što bi se reklo i zapravo je vrlo veliki rizik da iziđu sa nečim jedan korak dva dalje zbog toga što im netko može prigovoriti ili da navijaju ili može prigovoriti da nešto prenaglašavaju a mi koji radimo na YouTube-u koji smo slobodni kao ptice, mi imamo svoju glavu, svoje razmišljanje, možemo raditi što hoćemo."
0:09:08,0:09:21,"Naime, ne možemo raditi baš što hoćemo, nego moramo imati svoju savjest da ono što ljudima pokazujemo da uobličimo zaista kroz ono što smo mi sami."
0:09:23,0:09:30,Šta mislite se mainstream mediji odnosno televizijske kuće pripremile na taj podcast dio?
0:09:31,0:09:38,"Mislim, dobar dio su podcast i takve emisije, pa zašto ste im uzeli malo i prostora i svega."
0:09:38,0:09:47,"Šta mislite, mislim ja sam pročitala jednu odličnu knjigu od Jana Šošića o njegovoj novini, kako su društvene mreže utjecale na razvoj televizije i svašta, preporučam vam."
0:09:48,0:09:53,Jajmo hoćete da nisu u početku oni to baš svačali ozbiljno.
0:09:53,0:09:56,Znate li imate respektabilne kanale danas na YouTubeu?
0:09:57,0:09:58,"Da, točno."
0:09:59,0:10:02,Vi se ajmo reći jedna možda državna televizija ne može nositi.
0:10:02,0:10:08,"Vi imate temu, možemo reći evo tema zagrebački izbori i vi ćete na YouTubeu, imate misao dva sata."
0:10:09,0:10:09,Točno.
0:10:10,0:10:19,"A na današnjoj, na televiziji, državnoj bili privatnino bit će nekakva misija od pola sata sa šest gostiju i to znate već iz iskustva, svaki gost će dobiti otprilike dvije minute."
0:10:19,0:10:19,Točno.
0:10:20,0:10:20,Lidski krik.
0:10:21,0:10:28,"Da, ovako možemo razgovarati, da u beskonačno što bi se reklo može biti piva na stolu, piva na pojedini, sve je to podržano."
0:10:29,0:10:37,"Mislim da je to veliki grad bio za mainstream medije, htjeli oni priznati ili ne, ali mi nismo nikog htjeli naštetiti, samo htjeli da svi više znamo."
0:10:38,0:10:39,"Točno, to je točno."
0:10:39,0:10:56,"Međutim, ja mislim da se mainstream mediji ili masovni mediji da se zapravo prilagođavaju situaciji jer vidite zapravo sve televizije imaju svoje kanale, YouTube kanale pa su to nekad vijesti, nekad podcast, nekad isjeći iz emisije."
0:10:57,0:11:08,"To nije puno posla jel jer novinari obave svoj posao u studiju i ono je kad kad na početak, na kraj pusti ga i kad su teme dobre to je dosta velika gledanost."
0:11:08,0:11:26,"Dakle u ovom politike i novosti, ja, politics news, to je ovi glavni, najveći mediji i televizije, one zapravo nose, one su najbolje, imaju najveći broj pretplatnika i najviše sati gledanja."
0:11:27,0:11:27,To je ipak tako.
0:11:28,0:11:34,"Vi faktički danas ako nemate YouTube kanal, vaše TV kuća ili radio može lagano staviti ključ u graf."
0:11:34,0:11:35,Pa to je točno.
0:11:35,0:11:37,Pogotovo u ovim lokalnim manjim sredinama.
0:11:37,0:11:43,"Pa to je točno zato jer YouTube omogućava da mi gledamo, pratimo nešto kad nam paše."
0:11:51,0:11:54,Pa teorije zavjere inače su jako zahvalna tema.
0:11:55,0:13:02,"Imate podcasta koji na teorijama zavjere stotine tisuća gleda gledatelja imaju, a ne desetak, petnaest tisuća kao recimo što imam ja na kanalu i teorija zavjere je vrlo, vrlo zavodljiva stvar, vrlo je primamljiva, međutim svi moraju od nečega živjeti, svatko mora imati neki interes, tako da mislim što se tiče zabrane toga odnosno da se to ukine na bilo koji način, mislim da do toga neće doći, da će prije doći, pa bi, prije će doći, da će znate kao što svaki medij ima svoje vrijeme, je li radio, pa televizija, pa evo sada društvene mreže, onda blogovi su bili vrlo popularni prije pet šest godina, ja sam vodio jedan blog, a to je točno."
0:13:04,0:13:06,"Da, da, to je točno."
0:13:07,0:13:17,"Blog je po meni zahtjevnija forma jer to je pisana je li stvar i ona zahtjeva čitanje, zahtjeva da je čovjek sam."
0:13:17,0:13:32,"Recimo vi ne možete dok čitate blog, ne možete raditi ništa drugo, neka žena ne može spremati sobu, mi ne možemo, netko ne može raditi neki svoj posao, kao uz YouTube to sve ide."
0:13:32,0:13:39,"Pa ono uključi i kad nešto čuje samo veću pažnju, vrati nazad i to."
0:13:39,0:13:53,"A ovo što je redovni program, teško se disciplinirati u današnje vrijeme i ono u sedam sati dnevnik pa ga gledati, svjesno bi bilo, pola osam dana su vremena."
0:13:53,0:14:10,"Da li vi, to su, tako, to su neke blitz vijesti, to više nema pravog istraživačkog novinarstva, nažalost to kad se nešto tako pojavi onda se vrlo brzo i vrlo lako pomete, nadjača se."
0:14:10,0:14:20,Ali evo zato smo mi tu sa našom slobodom da interpretiramo stvari onako kako hoćemo.
0:14:20,0:14:26,Dakle ja se s ovim zagrebačkim političarima vrlo često volim našaliti.
0:14:27,0:14:37,"To je tako zanimljiva zgoda, ta uopće Gradska skupština, tamo se događa politikar u Gradskoj skupštini, to je sukus politike, ali naravno ne samo u Gradskoj skupštini."
0:14:38,0:14:56,"Međutim, ja sam bio u nekoliko navrata u Gradskoj skupštini i mogu vam reći da razina zapravo i kvalitet pristupa jako pada, kao da i današnji političari pribjegavaju onom što je lakše."
0:14:56,0:15:14,"Dakle, TikTok, odmah ima deset i petnaest tisuća gledanja ili neka dođe i do sto tisuća čak napravi baš jako veliku glupost, jeli tako da ono nije ono doći problem, dakle kroz simbole i kroz metafore govore svoje stavove."
0:15:14,0:15:20,"Ono, grad je zagreb jako zagađen grad, čuć dođe s maskom zagađen grad."
0:15:22,0:15:35,"Tomašević udrugama daje svojim jako veliki novac i on nije zadnja, ima svaki dan jedna afera, on je jako zahvalan."
0:15:37,0:15:40,"Eto, to je klici, ajmo isti to kad došli su političari."
0:15:42,0:17:01,"Ali, gledaj, i sad ima jedna zastupnica, nećemo joj reći ime, ona je napravila smo tuljak, ono, ma jedno pedeset metara taj a četiri papir te račune je sve povezala jel, a samo zbog efekta kad dođe na zagornicu da ne kaže gospodin gradonačelnik je svojim udrugama dao toliko i toliko novaca što je zaista pretjerano kad usporedimo s prošlom godinom odnosno sa prošlim mandatom, tu se vidi jedan nesrazmjer, ja razumijem to je politika pa politika može kako hoće, jel, natječaj napravi kako hoće, ne, ne kaže tako, nego kaže kako je upravo katastrofa koliko je gradonačelnik besprizorno neosjetljiv za probleme u Gradu Zagrebu i sve daje svojim udrugama i onda uzme taj bunt koji je na koloturu nekom i onda to baci i to deset metara daleko ode jel i onda ima naravno nekoga koji je s time jer sve režirao je i recimo ono baci tamo, a od dan da je netko i taj kolut ide proba njemu i to jako dobro izgleda."
0:17:02,0:17:06,I taj vanklip dobije jako puno gledanja.
0:17:12,0:17:22,"Ali ja zapravo se svaki put pitam, meni fali malo zato jer sam malo stariji, meni zaista fali malo kvalitete u tom razgovoru."
0:17:23,0:17:26,Ali kad se spoji jedno i drugo onda je dobro.
0:17:27,0:17:40,"Recimo Herman, on je kandidat za gradonačelnika hadezea mladi čovjek, liječnik zagrebački dečko, kad bi tako rekao, ako me čuje možemo reći, bit ću drago, ali zaista je mlad čovjek, tako ovaj."
0:17:41,0:17:46,"I on pribjegava, on pokušava naći kombinaciju jednog i drugog."
0:17:47,0:17:57,"Znate, ne znam koliko ste pratili, bilo je prije mjesec dana vrlo aktualan Tomašićev grg, grg grada Zagreba."
0:17:57,0:18:11,"To zapravo nije bio grg nego znak koji je multivalentan pa se može na razne podloge staviti itede No, velika je povika bila oko toga jer zaista je to tako jedna vrlo jednostavna stvar."
0:18:11,0:18:13,Meni je osobno sad jednostavno.
0:18:13,0:18:15,Evo ja sam izjavio da je stvarno sad jednostavno.
0:18:15,0:18:16,"Da, da."
0:18:16,0:18:35,"E sad o tome možemo diskutirati jel jer je primjenjivo na sve i radio ga jedan vrhunski, vrhunski radio je jedan koji je pobjeđivao u mnogim natječajima itede I naravno na prvi dojam to je jednostavno, ali da ne pričamo o tome."
0:18:36,0:18:49,Htio se našaliti sa tim Herman i donio je jedan prijedlog koji da bude suvenir zagrebački i onda je rekao suvenir zagrebački da bude stupić.
0:18:50,0:18:54,"Onaj stupić na cesta, ovaj plastični kad ga malo klibamo, sve ovo."
0:18:54,0:18:54,A zašto?
0:18:55,0:19:17,"I to je stvarno duhovito jer Zagreb centar je pun tih stupića, a s tim stupićima su zagađena parkirališta, s tim stupićima se regulira sve i sva potrebno i nepotrebno i meni osobno to nije lijepo vidjeti koliko je korisno u prometu, nisam siguran valjda su imali neke izračune i onda je on napravio od toga show."
0:19:18,0:19:27,"I taj show, to je, znate to su sve prenijele televizije, sve novine, sve, sve, sve, sve."
0:19:27,0:19:33,"Čak sam i ja prenio pa je i nešto gledaniji ovaj, taj video jer je zaista dobar stos."
0:19:34,0:19:43,"Međutim, što, pitali ste me, rekli, razgovarali smo o razlici ovih glavnostrujaških medija i nas."
0:19:44,0:19:47,"E glavnostrujaški mediji odmah moraju dati ravnotežu, odmah."
0:19:48,0:20:26,"Dakle, imate s jedne strane taj po meni zaista dobar štos pogotovo što je bio popraćen i obrazloženjem što i kako se događa, s jedne strane i imate nešto u čemu je Tomašević vrlo vješt da vrlo brzo odgovori i da opanjka nekoga i on je rekao, okej, primit ću ja rado taj vaš stupić i stavit ću ga na parkiralište koje niste plaćali godinama, desetljećima itede I sad to ti mediji stavi u ravnotežu."
0:20:26,0:20:45,A zapravo je neusporedivo drugačije jer ovo je sa tim stupičem konkretno bila i priprema i cijela prezentacija itede a ovo je bilo ono što u čemu je Tomašić vrlo vješti da namah kaže neke stvari.
0:20:46,0:20:56,"Vrlo često u tome uspijeva, bude bogovit bar za svoje navijače ali vrlo često pređe granicu."
0:20:57,0:21:02,"Kad nemate, kad nema pravi odgovor onda je difamacija."
0:21:03,0:21:07,"A vi ste onaj što je to, a vi ste ili Bandićevac, ono."
0:21:08,0:21:11,"Bandićevac, Žikorski, Bandićevac gotovo je, to je ono."
0:21:12,0:21:15,"Danas jako lako lijepi svima, teško da skinu."
0:21:16,0:21:19,"Da, da, da, da, da, da možemo i o tome."
0:21:19,0:21:26,"Da, zašto treba se, evo i u Zagrebu, evo svaki dan i sve nekakve aferice ili pokušaj afera."
0:21:27,0:21:34,"Evo ovo zadnje, gospodin Obidol podnio tužbu protiv Tomaševića."
0:21:34,0:21:36,Tomaševića je još pet od drugih šestnaest.
0:21:36,0:21:38,"Ne znam ho li dokumentirati, ali."
0:21:38,0:21:40,Nije baš je zahvalno dokumentirati.
0:21:41,0:21:43,To je zahvalno kao i Tompsonov koncert.
0:21:44,0:21:45,Svi svoje znaju o tome.
0:21:45,0:21:46,Tompson je poruka.
0:21:46,0:21:47,Mislim da je Tompson poruka.
0:21:48,0:21:48,"Je, je, je."
0:21:49,0:21:50,Apsolutno je poruka.
0:21:51,0:22:11,"Evo, bar u degresiju da napravimo, tu se ne radi samo isključivo o glazbi, samo isključivo o tekstovima te glazbe, samo isključivo, ja bih rekao jednom hymničnosti zapravo od toga i onda se to lako pjeva i tako dalje, nego je to nešto drugo, a to je ono tema za sebe."
0:22:11,0:22:14,Pitali ste me za Nobila..
0:22:14,0:22:27,"Možda će dio ljudi otići na topsano koncert jer je možda granica koju je recimo prešla ta trenutna zagrebačka vlast baš taj zaštitna grada Zagreba, samo znak neki."
0:22:27,0:22:29,"Pa se izgubila ona kula, izgubila one boje."
0:22:30,0:22:31,Zumijete?
0:22:32,0:22:33,"Možda nekako, e baš sad vidim i ja."
0:22:33,0:22:44,"Ne, ne, ne, ne, ne, ne, mislim da je to puno, puno šira slika, ali da se nadodre, da ćemo se vratiti."
0:22:44,0:22:51,"Dakle, vi znate kako je bilo s tim koncertom, dakle Tom mi je dao nekoliko dva svoja termina."
0:22:52,0:23:11,Ta termina su bila u jako nezgodno vrijeme jer su ulazila u ono između prvog i drugog kruga jer Tomašević se nada da će proći u prvom krugu zato je uzeo esdepe međutim ja mislim da je to nemoguće da bi se to dogodilo jednostavno po prirodi brojaka.
0:23:11,0:23:24,"Ima puno kandidata oporbenih desetak, pa svako uzme nešto, pokvare sami sebi posao zato jer ih ima puno, ali pokvare i Tomaševiću u smislu da bi gaju ambicije da u prvom krugu sve napravi."
0:23:25,0:23:53,"I Tomašić je rekao, najprije je pustio, je li tu ekipu, stručni, stručni, taj tim PR-ovaca, Thompsonovih da se pacaju tjedan dana i rekao ne, moramo vidjeti, to su ti termini kad je hipodrom rasprodan, zauzet, a to nema veze s mozgom, mislim nikakve kožite, nije uopće zauzet, jednako je zauzet kao i taj dan kad je dozvolio."
0:23:53,0:23:55,I on je ponudio svoj termin.
0:23:56,0:24:27,"I sada mnogi su očekivali, a taj termin je bio ovaj sadašnji, ne sviđa mi se tako, pet i sedam taj je termin sadašnji i mnogi su očekivali da će u Thompsonu, Marku Perkoviću Thompsonu da će proraditi nad i da će reći ne ja hoću jedan od ta dva termina jer je vrlo lako dokazljivo da je jako nategnuto da nisu slobodni, jako nategnuto, to je ono mislim."
0:24:29,0:24:53,"I zapravo su i neki od oporbenih kandidata bili dosta ono snažno, ne, ne mi ćemo to samo nek se usudi ne dati itede I da je htio, Tomasović je tu mogao ispolitizirati, tako bih rekao u ovom trenutku stvar i potpuno zaoštriti stvar i Tomaševiću ne bi bilo lako."
0:24:54,0:25:07,"Ali, sručni tim i Tomasović su odlučili ipak prihvatiti taj termin i onda graditi cijelu priču na tom novom terminu."
0:25:07,0:26:01,"Tako da tu Tomašević ima stanovitu pobjedu, ali ima i imat će i veliki poraz svoje ideologije, a to je Vogue politika, to je ta transrodnost koju uzdiže na pjedestal koji je zapravo nezaslužen jer i ti ljudi su ljudi kao i svi mi, oni su među nama i tako ali ističe, to što ističe probleme je ok ali to što im daje jedan prostor koji u konačnici samo njima može više smetati preaglašavajući to da je netko gej, da je lezbika, da je ovo ono što ja znam ima deset tih kategorija, a to niti ne znam nabrojit što je što."
0:26:02,0:27:37,"Dakle, ja od Tomsona ovog koncerta očekujem da tih petsto petstotinjak tisuća ljudi, pola milijuna ljudi koji će doć od kojih su uglavnom mlađi od trideset godina osamdeset devedeset posto još bar milijun i pol u hrvatskoj još bar milijun u inozemstvu, da će stvoriti jednu podlogu da ono što je suverenistička politika Hrvatske da dobije jedan okvir da ne bude samo ruka na srcu kao ili kao neki modni dodatak ili da nije sve u tome hoće netko prošvercat uzvik onaj ili ovaj, da nije u tom jednom potpuno pojednostavljenom prkosu, ne htio reći."
0:27:37,0:27:45,"Ja se zaista nadam da se neće ta jedna silna energija koja će biti, ja se nadam da će sve dobro proći."
0:27:48,0:27:53,"Da, možemo i o tome razgovarati, o tome ne mislim uglavnom na nerede nego da sam na vrućinu, na masu ljudi da."
0:27:54,0:28:27,"Da, da, ljudi misle uglavnom na nerede kad misle dobro proći, da, ja sam uvjeren da će dobro proći, volio bih da to zaista da jednu snagu da ne razmišljamo površno o Hrvatskoj nego da razvijamo gospodarstvo, da razvijamo znanost, da vidimo mi mala zemlja, beznačajna u ovoj svjetskoj konstelaciji političkoj, pa zanemarene u EU, jel to smo sad vidjeli, s ovim onda su ih malo zbrojili pa su pozvali Plenkovića i ovako."
0:28:28,0:29:09,"Dakle, da ćemo mi naći onu nišu koja je naša, po čemu smo svoji i po čemu smo najbolji u svijetu i po čemu najbolje okupljamo najbolje ljude u svijetu, najbolje znanstvenike, najbolje ove, one i to moramo naći jer nas zapravo nema nigdje, nama uz ovo što je zapravo neminovno, ove migracijske politike, ova dominacija engleskog jezika nama zaista, ali vrlo objektivno prijeti da izubremo prvo kao jezik, onda kao narod jer nažalost je to tako."
0:29:10,0:29:32,"Zato je meni drag taj koncert, nešto bih bio posebni obožavatelj Tomcu na ovaj, ne mogu reći da sam njegov fan ali rado poslušam, nego iz tog potencijala koji taj koncert može imati, a što je dobro za Hrvatsku."
0:29:32,0:29:45,"I vjerojatno, jer smo primijetili i vi i ja i mnogi ljudi i u lockdownu i kod migracija, kad je neka frka, ja ću tako reći, sve zemlje zatvaraju granicu od Schengena ništa."
0:29:46,0:29:48,To bi mi Hrvati trebali naučiti.
0:29:48,0:29:58,"Ajde, stvorimo ovo što ste vi rekli svoju malu bazu koju mi imamo, jezdu, tako smo zapustili, a bit ćemo dobri sa svima, naravno, ne pa naprosto to moramo podići."
0:30:00,0:30:01,"Sjetiti se, napušteni smo smo bili."
0:30:02,0:30:04,Sada stvaramo granice.
0:30:06,0:30:08,Tako da se potpuno slažem tu sa vama.
0:30:08,0:30:09,"Da, to je točno."
0:30:09,0:30:11,I tu je ono sa teorijama zavjere.
0:30:12,0:30:18,Profitiraju jer u teorijama zavjere ima puno mogućega i istinitoga.
0:30:19,0:30:21,To je nešto ko sam im psycho kasnije.
0:30:21,0:30:24,A ono kaže se teorija zavjere do jednog trenutka da postane istina.
0:30:27,0:30:28,"Dakle, o tom se ne očekujem."
0:30:28,0:30:29,"E sad, Nobilo."
0:30:29,0:30:32,"Nobilo, to mi je vrlo interesantna tema."
0:30:33,0:30:35,"Ono, beskrajni interesantno."
0:30:35,0:30:37,To bi smo mogli tri potka se raditi.
0:30:37,0:30:40,"Prvo, zašto se uopće odlučio za to?"
0:30:40,0:30:42,Zdodik na Tomaševiću samo ide.
0:30:43,0:30:46,"Dobro, Dodik mu je, on je odvjetnik."
0:30:46,0:30:59,"Ono s Dodikom ja, ne znam, nisam razumio jer razumio sam da je on odvjetnik pa da je naravno uzeo klijenta Dodika, to nije loše vjerojatno, financijski je to isplativo."
0:30:59,0:31:21,"Međutim, ono što zapravo nisam mogao, baš, onako nije mi baš sjelo, da je, ako se sjećate na onom velikom u Manjeluci, na mitingu ima ih često, pa je on bio na pozornici, na B Bini, s Dodikom, ajde to još, još pa si u trećem redu nego on je imao povrih doći nešto objašnjavati tamo, a to je politika."
0:31:21,0:31:36,"Dakle, ja mislim, tu se mnogi ne slažu sa mnom, ja mislim da je nobilo u ovim godinama, je li kad čovjek osjeti pa ne smijem se dat, još me bora bit malo u javnosti."
0:31:38,0:31:39,A ne znam da ih kažu.
0:31:40,0:31:44,"Pa morate ga pozvati, on je javni, naš je javni."
0:31:44,0:31:45,"Da, da, jako je udobno."
0:31:45,0:31:48,"Pa je onda on tako krenuo u ono s Jelavićem, je li?"
0:31:48,0:31:50,"Kad je bila nam je I kad jedan dan nije bio crni pojas, samo da znate."
