Start (HH:MM:SS),End (HH:MM:SS),Segment
1:03:32,1:04:12,"Ja se Karlovaca sjećam iz mog djetinstva, dakle bila je osnovna škola, mislim da je bio pet ili šest razred, likovni i mi smo, ja za Karlovac šta bi, dijete od šest godina u Istra sam ja odrasla, bi čuo za Karlova za to, ne znam, ono, mislim jedno da je nekako povezan rodbinski ili nešto, onda po toj rodbinskoj je da, ali moj profesor L likovnog odgoja je bio iz Karlovca i on je s toliko ljubavi pričao o rijekama, o ovom, tom gradu, ovom, onom i tad sam prvi put čuo za Karlovac i često sam onda znao popit kavu baš sjećajući se toga."
1:04:13,1:04:14,U Karlovcu je uvijek mi bio lijepo.
1:04:15,1:04:17,A znate li kako je lijepo kad je plus četrdeset?
1:04:17,1:04:17,Da.
1:04:26,1:04:29,Za pet minuta se vi ne nabučnete i malo dođete k sebi.
1:04:29,1:04:30,"Pa da, pa da."
1:04:30,1:04:33,Pa u jednoj velikoj moćnoj Americi neki ne znam ni šta je ovo.
1:04:34,1:04:42,"Pa da, pa da, dobro, u Americi mnogi ne znaju puno toga da malo sa domaćih tema skrenemo nezaobilazno."
1:04:43,1:04:51,"Trump je došao kao šerif za neke, ja vam ovako kažem, njeno, vi me slobodno ispravite, pametni ste, mudri ste, iskusni ste."
1:04:51,1:04:52,"Ali pametni ste, nije tako."
1:04:53,1:04:58,"Sad će svi kao duti nešto na Trumpa u Europi, ali čovjek je to pričao cijelo vrijeme prije izbora."
1:04:59,1:05:02,"Pa jel to problem nas, Europljana, što mi njega nismo shvaćali?"
1:05:03,1:05:04,Ja ne znam.
1:05:04,1:05:21,"Pa očito je problem, problem je, problem je što Europa nema lidera, Europa nema svoju politiku i nažalost onda ta politika vrlo luda i ta je politika napravila mnoge i mnoge greške zbog kojih sada ispadamo."
1:05:22,1:05:26,"A mi smo, naravno, nemojmo mi tu nikakav problem."
1:05:27,1:05:33,"Za poker imamo Ameriku, Kinu, Rusiju i sada je Europa, mislite je četvrta, a zabranjuje Indiju."
1:05:33,1:05:36,"Pa da, da, točno, Indija je tako."
1:05:36,1:05:40,"Indija je velika, da, sila i gospodarska."
1:05:41,1:06:06,"Međutim, Trump, vi volite pričati o tome, prošli dan carine i sad je navodno, e, carine, tako burza je pukla tamo, pa naravno, kad postoje mešetari, pa naravno da je pukla kad netko želi da idu vrijednosti što niže, da onda kupi pa će se vratiti na neku sredinu."
1:06:06,1:07:25,"Dakle, ja mislim da mi prije svega nemamo, ja sigurno, pa onda se ne bih usudio o tome govoriti, mi nemamo dovoljno znanja što i kako će biti, a da Trump radi neke ishitrene poteze, to naprosto ne može biti točno jer on ima cijelu mašineriju iza sebe koja dobro promišlja stvari, da u njegovim riječima zaista ima ono da ujutro kaže jedno, popodne već kaže nešto drugo, međutim to su sasvim površne stvari, moramo pričekat, moramo vidjeti, ja naprosto teško mogu vjerovati da bi politika, savjetnici itede njegovi koji onda imaju ekipe stručne koji su povezane i uz kapital itede da bi dozvolio da ajmo reći mali čovjek u Americi onda teže živi zbog toga što su sad veće carine pa je teže život, teže kupovine itede Međutim, kao što mi moramo rješavati stvari u Hrvatskoj i željeti sve najbolje svojim snagama koliko možemo sami, tako Amerikanci moraju za Ameriku."
1:07:25,1:07:35,"Dakle, vi vidite tamo sada se najavljuju, već su počeli mnogi protesti, to će biti protesti puno, puno širi i puno veći nego sve što se po Europama događa."
1:07:36,1:08:22,"Znate, to prije, da Trump nije osvojio tako nadmoćno vlast, ljudi su govorili o mogućem građanskom ratu, ja sam gledala, da, Da, ja sam gledao dosta podkasta i tu mogu reći da Srbi imaju sjajne podkaste, puno bolje od nas, pogotovo ovo iz Australije, iz Amerike, imaju par ljudi koji to tako savršeno rade, ja to volim pogledat jer oni govore zapravo o situaciji na licu mjesta tamo, ali i o svojim strahovima kao oni koji su došli u taj obećanu zemlju, bolji svijet, što je to, što se može dogoditi u tom nekom srazu Amerikanaca."
1:08:23,1:08:39,"Dakle, ja mislim da je na Americi da riješi te svoje probleme, ovo je vrlo razumljivo da svaki državnik gleda da napravi u svojoj zemlji najbolje što može za svoju zemlju."
1:08:40,1:08:59,"Altruizam da, ali sve ima neke granice, sami ste rekli, veliki je europski altruizam za manjine, za ovo, ali kad je došla Ave, tako se prikazivala, korone, onda su svi vrlo jednostavno zatvorili granice."
1:09:00,1:09:10,"Onda naravno bilo je i ljudi koji su se opirali, tome je u Hrvatskoj dosta, ali svi su svi smo, velika većina je pala pod jednu takvu psihozu."
1:09:10,1:09:12,Da danas ljudi nose maske.
1:09:12,1:09:53,"Ja sam, ja sam, da, da, mislim, ja sam ovaj, naravno izlazio sam vani, ali vrlo ograničeno u Zagrebu i to, ovaj i preko interneta za ovu tehniku svoju što kupujem sve preko interneta, imam ovaj nikad, nisam se, da, i ovaj, baš je bilo ono, sam početak, vrka velika, ono, stožer televizije, to vam tamo, ne, i ja iziđem da ću to kupiti i žena mi kaže, čekaj, si masku zaboravio, a ja ajde, dobro ne da stavim masku, ali idem na zrak, šta ćeš staviti masku, ovo je došlo sa autom i za autom i da, do tada nisu rukavice ponio, ponesu rukavice."
1:09:53,1:10:39,"Dakle, zaista je vladala jedna velika, velika psihoza, iz ove sadašnje perspektive nam se čini pretjerano je da je to možda bio trening za nešto, jel opće bugovore, teorije, zavjere itede međutim, takva je psihoza bila i to vam samo hoću reći, da, ali mi moramo voditi računa o svojim ljudima sa tim zatvaranjem granica i svega i onda kad smo mi slobodni, suvereni, kad smo jaki, kad imamo dovoljno za život i dovoljno za užitak i dovoljno za zdravlje, e pa onda možemo biti i znamo tko smo i što smo."
1:10:39,1:10:48,"Jer ovo što nam se događa, to su ta sa tim migracijama, sa stranim radnicima, to se naprosto ne može zaustaviti."
1:10:48,1:11:11,"Mi moramo vidjeti kako ostati na svome i imati svoj jezik i svoju snagu i kako se smo prepoznati u svijetu po nečem, a da to nije nogomet ili rukomet ili water polo ili ne ili nešto što je ipak samo sport, tamo imati jednu emociju u jednom trenutku i ta emocija spasne vrlo brzo poslije toga."
1:11:11,1:11:59,"I zato mislim da se vrati na Thompsonov koncert da to što se lagano podgrijeva i tako da bi trebalo uroditi tom jednom samosvijeću da budemo jako dobri u svemu što radimo, da znamo vidjeti gdje i kakva Hrvatska mora biti i kako da tu budemo najbolji, najbolji pred nama samima i najbolji u svijetu, da budemo i dobri susjedi, razumijete da nas ne se kida ovo ili ono, a to što se u susjedstvu može događati u raznim raspetima situacije pogotovo Borca i Hercegovina, Kosovo, to je zaista nešto o čemu moramo razmišljati."
1:12:00,1:12:11,"Ja sam za kraj htio pitati, Trump i Putin rade na nekakvom miru, a stekao se dojam da je Europa se ponovno huška na rat."
1:12:14,1:12:18,Pa gledajte ako cijelo vrijeme govorimo da.
1:12:18,1:12:34,"Zadnje vijesti su po tim portalima, ruski će napast nakon Ukrajine, ruski će ovo, šta mislite, je li to opet atmosfera straha se radi ili ja osobno nakon ruskih lopata i čipova iz Vešmošine ništa ne vjerujem."
1:12:35,1:12:35,"Gledajte, ovako."
1:12:36,1:13:21,"Dakle, ja sam imao vojnu karijeru, ja sam završio civil filozofski fakultet, književnost i filozofiju sam završio, ali išao sam u Domovinski rat i onda su me zvali da ostanem i tako sam tu razvio karijeru do brigadira, bio sam četiri godine i u diplomaciji, bio sam vojni zaslanik u BiH, a a tamo biti vojni zaslanik nije baš znate kao u Londonu gdje šampanjac ovako trebate držati, fino se smiješati itede to je ipak malo jedna drugačija situacija i naprosto imam veliku odgovornost za sve to što je rat, što je vojska itede jer sam prošao te škole i kroz."
1:13:22,1:13:23,"Što ratne, što diplomatske."
1:13:24,1:13:30,"Što diplomatske, ali ja sam u Estoniji najvišu vojnu školu završio, ratnu školu po NATO standardu."
1:13:31,1:13:46,"Dakle, ja se tu ne bih usuđivao davati procjene, znate, pa netko kaže da, pa koliko je trebalo Rusima da jedan mali Gradić kao ne znam predgrađe Karlovca osvoji pa kuću onda osvaja drugo."
1:13:47,1:13:59,"Ali znate ja sam bio u Estoniji tamo na tom školu i mi smo išli po tim zemljama baltičkim, tamo postoji jedan realan i stvarni strah od toga, živi strah, kako bih rekao."
1:14:00,1:14:11,"Ono nama je Rusija relativno daleko, relativno daleko, pa ono što ne bi tjerao ono kao dobru politiku, dobru volju, ne, to kod njih ne postoji."
1:14:13,1:14:45,"Dakle ja mislim da je Rusija vrlo, vrlo istrošena u svojim resursima, ja mislim da je teško moguće da bi to bio nekakav veliki frontalan napad, je li on od ruskijskih napada, Rusija kreće sa svojim snagama itede oslobađat teritorij Europe, je li ovaj, ali da Rusija sasvim sigurno ima svoje geostrateške interese koji su zapisani u nekim knjigama, sasvim sigurno ima."
1:14:46,1:14:52,"Koliko oni daleko dosežu, netko će reći dosežu do Jadrana itede To je sad druga stvar."
1:14:53,1:15:31,"Ja mislim da je to glavna stvar da Rusija ima jedan veliki interes da se i dalje pokazuje kao svjetska sila što se kompromitirala na neki način pogotovo početkom rata pa mislim onako kako su to izveli stvarno je tako malo neobično je li ako su imali nekakve namjere napraviti to im se obilo zube kasnije, a opet Amerika ima isto tako veliki interes prema Kini."
1:15:31,1:15:53,"Kina dominira u svemu, Kina je u mnogo čemu sada jača od Amerike zahvaljujući Americi jer je znanje, izvoz znanja je išao prema Kini i prema drugima u svijetu, jedno što je Kina znala to iskoristiti na najbolji mogući način."
1:15:53,1:16:30,"Ima jedna slika baš evo iz te ratne škole, mi smo dosta govorili o toj geostrategiji, ima jedna mudrost prije toga da vam kažem samo ljudi na nekoj razini razgovaraju o budućnosti, kako otvoriti budućnost, kako ići naprijed, a to nitko ne zna, nitko nema ključ, samo velike, veliki ljudi ili stručne, dobre grupe ljudi, dobri stručni timovi mogu nešto prognozirati i odrediti kako ići."
1:16:30,1:16:51,"Ali za kinu samo da se vratim, rekli su to je kao veliki piton koji je na lusteru gore i ti dolje pričaš sve, radiš, živiš svoj život, ideš na godišnji, imaš svoje hobije, imaš svoje posao, ali taj piton gore stoji i nikad ne znaš kad će pasti."
1:16:52,1:16:54,To je ta slika nije.
1:16:56,1:16:56,"Da, da, da."
1:16:56,1:16:59,"Oni vremena imaju, oni to polako rade."
1:16:59,1:17:16,"Da, da, da, ali dobro, imaju i oni nekih svojih tamo stvari koje bi im trebalo biti prioritete, tako da tu mogu vas razočarati, malo ne bih se usudio ništa predviđati, ali dobro, dolazite lošu admirala, pozovite."
1:17:17,1:17:19,On je bio u glavnom stožeru kad sam ja.
1:17:21,1:17:21,Loša gađa.
1:17:22,1:17:24,"Loša je, loša je, dobar, dobar je, loša."
1:17:24,1:17:26,"Da, da, dobar je, dobar je, loša."
1:17:27,1:17:29,Meni je on zanimljiv kao sugovornik.
1:17:29,1:17:31,"U svakom slučaju, meni je on, hvala puno."
1:17:32,1:17:33,To je za ovu rundu to.
1:17:33,1:17:46,"Ekipa, zaprate čušpaj, to je jako dobar podcast i lajkajte ga i pretplatite se."
1:17:47,1:17:48,Pretplataj ključ.
1:17:48,1:17:49,A besplatna je.
1:17:49,1:17:50,A besplatna je.
1:17:50,1:17:51,Hvala vam lijepa.
