Start (HH:MM:SS),End (HH:MM:SS),Segment
0:00:00,0:00:01,"Hvala lijepa, nisi Marija."
0:00:03,0:00:16,"Lijepo vas je vidjeti ovdje i lijepo je biti s vama, velika radost danas što ću s vama moći podijeliti nešto, a i sigurno i nešto od vas i primiti tijekom susretanja."
0:00:17,0:00:22,Dakle čuli ste kako razlikovati svoj glas i glas Božji.
0:00:23,0:00:28,"Pa uvijek je dobro krenuti od onoga što nam je blizu, od onoga što je u našoj prirodi."
0:00:29,0:00:35,"Tako da ja ću malo interaktivan biti, ne morate odgovarati naglas, ali malo odgovarajte sami sebi."
0:00:36,0:00:38,Za početak da idemo od naše prirode.
0:00:40,0:01:01,"Recimo čije glasove poznajete, recimo zatvorite oči, u mraku ste i sad dolazi čiji biste glas prepoznali, mama, tata, brat, sestra, pa i neki pjevač, Petar Buljan, Thompsona, Biskuž je odmah i tako."
0:01:02,0:01:08,"Znači ima glasova, mi ih poznajemo, evo šta god bilo mi ih poznajemo i prepoznajemo."
0:01:08,0:01:20,Znamo da je iza tog glasa taj i ta osoba sa tim i tim životom i svakakvim stvarima koje i znamo i iskusili smo doživjeli o toj osobi.
0:01:20,0:01:25,"Evo svatko može reći da to može napraviti, je tako, je."
0:01:26,0:01:34,"Ali onda ako idemo malo dublje, neki od tih glasova su vam dragi i volite te glasove čuti."
0:01:35,0:01:50,"Recimo kad je momak, zaljubljenu djevojku, kad ta djevojka nešto kaže on i prepoznaje taj glas, ali taj glas ga iznutra ispunja toplina, ljubav, marastopio bi se."
0:01:50,0:01:52,A isto tako i suprotno.
0:01:53,0:01:56,I djevojka kad čuje mladića koga voli.
0:01:57,0:02:01,"Dakle, taj glas je drag i ono čak i jedva čekaš da ga čuješ."
0:02:02,0:02:13,"I ono kad te zove na telefon, gledaš u, da je bar sad to on ili ona i kad vidiš je i čuješ glas i ovoj razgovarali bi sat, dva, tri pa možda to i radite."
0:02:13,0:02:21,"I nikad vam dosta toga glasa jer taj glas donosi svašta lijepoga, draoga sa sobom i puni nam srce."
0:02:22,0:02:27,"Jel možete reći da imate to iskustvo, da imate glasove koje volite čuti."
0:02:28,0:02:50,"Ili neki stari prijatelji, niste se vidjeli dugo, moraju se seliti, moraju ići raditi u Njemačku, pa se vraća ili otišao na studij, pa evo jedva čekaš božićne blagdane da dođete, da se proveselite, čuješ glas, pa se oprašustite, pa se proveselite, pjevate i baš vam je taj glas vrhunski i daje vam život."
0:02:52,0:02:56,A onda vjerujem da ima glasova koji vas iritiraju.
0:02:58,0:03:03,"Možda nisu neke osobe loše, ali taj glas te iritira i strašno je nešto to je."
0:03:03,0:03:10,"No, ne možeš ga čuti, odmah mijenjaš radio stanicu, gasiš, zovete na telefon, neću se javiti."
0:03:11,0:03:37,"Ili zovete mama i taj glas ono kad zove s balkona ajmo doma itede Znači ima tih glasova koji možda nekad jednostavno su mrzljivi, a pogotovo ako je to osoba koja vas ismijava, koja vam se izrugava, koja je nepravedna prema vama onda taj glas nosi sa sobom nešto drugo što želite maknuti iz svoga života."
0:03:39,0:03:52,"Vidite to je nekako jako važno da vidite kako mi u prirodi imamo tu sposobnost HR-ovost prepoznati glasove, osobe i duh koji stoji iza toga glasa u toj osobi."
0:03:56,0:04:05,Vidite ti glasovi i do tog našeg iskustva šta koji glas nosi prošli smo sa nekim iskustvom i nekim putom.
0:04:06,0:04:15,"To je tralo neko vrijeme da mi imamo neki spoj, neki kontakt, neki odnos sa tim glasom s kojim se susrećemo."
0:04:16,0:04:25,"I moglo bi se reći da su tri stvari bitne, tri stvari bitne kako se to razvilo u nama, taj odnos sa glasom čovječjim."
0:04:27,0:04:32,Prva stvar je da smo u prisutnosti osobe koja nosi taj glas.
0:04:34,0:04:37,"Recimo, sama prisutnost nosi duh."
0:04:38,0:04:49,"To ste nekad osjetili, evo razmislite malo, neka draga osoba ili neka dobra osoba kad uđe u prostoriju donese mir, donese radost."
0:04:49,0:04:51,Odmah se promijeni atmosfera.
0:04:52,0:04:56,"Još kad progovori riječ, promijeni se atmosfera, dobro raspoloženje."
0:04:58,0:05:10,"Dođe neka osoba koja je u sebi sva ljuta, sva napeta, vi skužite, e nešto si danas napeta, nešto u tebi ljuta si, nešto se događa."
0:05:10,0:05:19,"I stvarno je tako cijela, ono u sobi muk i nitko ne bi htio pitat da ne bi sad to eksplodiralo i nastala svađa ili ne zna što."
0:05:21,0:05:26,dok se ne pita pa možda se onda raspusti dok dođe pogodna situacija.
0:05:27,0:05:55,"Znači prepoznali smo i naučimo se o glasovima osoba prepoznavati što se događa samom prisutnosti, onda po riječima koje su izgovorene, koje se prenose, riječi koje ispunjavaju ili riječi koje ruše, vrijeđaju, riječi koje ozdravljaju, pohvaljuju, podižu, ohrabruju, tješe ili ruše, šire mržnju, ranjavaju."
0:05:56,0:06:08,"Znači imamo to iskustvo prisutnosti, imamo iskustvo riječi i onda imamo iskustvo plodova, što ti glasovi donose, riječi toga glasa šta donose?"
0:06:09,0:06:41,"Pomirenje, smiraj, radost, motivaciju za rad, motivaciju da riješi, da se podignem, da riješim neku stvar, motivaciju da i ja budem neki tko će napraviti nešto dobro, donijeti dobre odluke ili može biti plod tog glasa da me tjera da se povučem, da uđemo u neko malodušnje, da budemo u razočaranju, u ljutnji i zapravo me odvlači od života."
0:06:42,0:06:54,"Evo to mi sve samim time po naravi, po prirodi svoje imamo iskustvo i prepoznajemo i možemo to reći, imamo tih raznih glasova u svome životu i to je osnova."
0:06:54,0:06:56,Znači mi smo stvoreni da to možemo.
0:06:56,0:07:06,"ćemo jer nas je Bog stvorio na svoju sliku i priliku pa i u tome da možemo komunicirati, prepoznavati, raspoznavati glasove."
0:07:08,0:07:18,Evo i to je priroda u kojoj živimo koja uključuje i riječi i osobe i duh koji osobe nose i koji imaju u sebi.
0:07:19,0:07:20,To je prva točka.
0:07:20,0:07:25,Druga je točka gdje je u svemu tome glas Božji?
0:07:27,0:07:31,Znači sad primijenimo koliko prepoznajemo glas Božji.
0:07:33,0:07:35,Šta nam je za glas Božji potrebno?
0:07:36,0:07:39,Samo primijenite ovo prirodno.
0:07:40,0:07:42,Kako ćete prepoznati glas Božji?
0:07:42,0:07:43,Idemo prirodno.
0:07:44,0:07:59,"Pa prisutnost ako ste u prisutnosti Božjoj, ako čuvate i slušate njegovu riječ i ako ubirete plodove Božjeg djelovanja u svom životu."
0:08:00,0:08:08,To je prirodni put kako razumijevate što je to i koji je među svim tim glasovima glas Božji.
0:08:10,0:08:15,Odnosno tu ga učimo prepoznavati kao prijatelj s prijateljem.
0:08:16,0:08:39,"Prijateljstvo je izvor poznavanja Božjega glasa, čitanje Božje riječi, prisutnost u adoraciji, uberanje plodova, recimo konkretno u Euharistiji, čuti Njegovu riječ, Njegovo ohrabrenje u ispovijedi, čuti utjehu od prijatelja koji ti donosi Gospodina."
0:08:41,0:08:47,Znači što više u tome jesmo to nam postaje jasno koji je glas Božji i što nam nosi.
0:08:48,0:08:53,Znači to je ono prirodno i to prirodno Isus potvrđuje.
0:08:54,0:09:01,"Sjetite se kada Isus poziva apostole, on ih poziva riječima Andrija, Ivane, Petre, Filipe, ajdete za mnom."
0:09:02,0:09:14,"Oni čuju glas, vide Moj vide moć Isusovu, vide šta radi, znači prisutnost riječi i djela Isusova i upoznaju ga i idu za njim."
0:09:17,0:09:21,To je Isus pretpostavio i ponudio za svakoga od nas pa tako i za nas.
0:09:23,0:09:29,"I jedna od lijepih rečenica je Ivanovo Evanđelje deset, Isus dobri pastir."
0:09:30,0:09:36,"Jednom si ga pročitajte cijeloga, a ja ću vam samo ovaj dio gdje on kaže ovo."
0:09:39,0:09:45,"Tko na vrata ulazi, pastir je ovaca, tome vrata rotvara i ovce slušaju njegov glas."
0:09:45,0:09:49,On ovce svoje zove imenom pa ih izvodi.
0:09:50,0:10:02,"A kad sve izvede, pred njim ide i ovce idu za njim jer poznaju njegov glas, a za tuđincem dakako ne idu, već bježe od njega."
0:10:04,0:10:16,"Vidite, već je tu, Isus je pretpostavio, biti s njime, biti s pastirom, on te poziva, on razgovara s tobom i ti onda učiš prepoznavati njegov glas."
0:10:18,0:10:19,To je priroda.
0:10:20,0:10:30,"Druga stvar je što svako od nas čuli ste zato, čuli ste da imate savjest, jeste čuli da svako od nas ima savjest."
0:10:30,0:10:36,Vidite to je toliko zapostavljena i zaboravljena stvarnost koju mi imamo u sebi.
0:10:37,0:10:53,"Odnosno možda znamo da imamo savjest, znamo jer nam ukazuje na dobro i zlo, malo kad se pripremamo za ispovijed, tu onda nekako nam savjest nas podsjeća što smo radili, gdje smo pogriješili, ali savjest je puno više."
0:10:55,0:11:11,"Savjest je glas Božji u nama, savjest je vikar Krista u nama, savjest nas poznaje puno bolje nego što mi sami sebe poznajemo i ukazuje nam na dobar put kako ići."
0:11:12,0:11:18,Tako da se taj glas Božji koji dolazi iznutra i glas Božji izvana podudaraju i vode nas.
0:11:20,0:11:27,"Glas savjesti nam daje svjetlo, razjašnjava put, razlučuje dileme, razjašnjava sumnje."
0:11:28,0:11:35,"Jedan primjer povijesni, možda najjači u crkvi vam je život John Herija Njumana."
0:11:35,0:11:39,"On je svetac, sada je proglašen prošle godine učitelj crkve."
0:11:40,0:11:51,On je bio odgojen u anglicanskoj protestantskoj obitelji i tri puta u životu je promijenio drastično život po savjesti.
0:11:52,0:11:56,Imao je taj dar baš da može slušati i dobro čuti svoju savjest.
0:11:57,0:12:16,"Prvi put je bilo kad je kod dječaka prestao ići u crkvu radi roditelja jer su ga roditelji vodili, znate jednostavno roditelji vode djecu, evo vi koji ste roditelji vodite djecu, vodite djecu i dok samo dijete jednog dana ne prepozna Božji glas i ode samo i to postane osobna vjera."
0:12:17,0:12:32,"John Henry Newman je prvi puta, kao ne znam u osnovnoj školi, točno koliko godina imao ne znam, a mislim oko desetak je sam odlučio ja danas ne idem jer moji roditelji, nego idem jer je tamo moj Isus."
0:12:33,0:12:34,To je prvi put u životu.
0:12:36,0:12:48,"Drugi put u životu je drastično promijenio život kada je odlučio se biti anglikanski svećenik, da služi Bogu, čuje taj glas i išao je za njim."
0:12:49,0:12:56,"i postao je profesor na Oxfordu, vodio je tamo pokret studenata koji su činili puno dobra."
0:12:58,0:13:07,"I onda je dogodio se jedan trenutak da je on vidio da još nešto nedostaje, glas savjetska gurala, proučava i nešto još tu nedostaje."
0:13:09,0:13:23,"Išla je proučavati crkvene oce, početak crkve i vidio je ovdje, ovdje, ovdje, ovdje bi mi mogli bolje i trebali bi usavršiti i svoju teologiju i svoju i svoj način pogleda na sakramente."
0:13:25,0:13:48,"Njegovi nisu tada prihvatili to i on je tada sam svojovoljno odstupio od svih funkcija, od katedre na Oksfordskom sveučilištu i povukao se u Osamu i tu je po savjesti sve ispitao i odlučio punina vjere je u Katoličkoj crkvi, ja idem tamo."
0:13:48,0:14:08,"I otišao je do prvog svećenika katoličkog i prešao na katoličku vjeru i vodila ga je savjest dalje, dalje i dalje da je opet i u Katoličkoj Crkvi postao i biskup i kardinal i evo sada i nakon smrti učitelj Crkve."
0:14:09,0:14:21,Vidite koliko je ta savjest u nama i duh po njoj radi i čime je hranimo tako ona postaje živi glas Božji u nama.
0:14:23,0:14:25,I ako vidite malo vidjeti u svetome pismu.
0:14:25,0:14:35,"U svetome pismu samo idete online Bibliju pa napišite tamo savjest i vidjet ćete ima dosta i stari zavjet, a pogotovo u novom zavjetu."
0:14:36,0:15:04,"Savjest može biti ranjena, savjest može biti otupljena, savjest može biti očišćena, savjest može biti okaljana, ali dobra savjest svjedoči vjeru, dobra savjest svjedoči Krista, dobra savjest u nama svjedoči zapravo puninu života i put koji nam je ići."
0:15:05,0:15:10,Tako da evo to je druga stvar koja potvrđuje glas Božji u nama.
0:15:14,0:15:15,To je druga stvar.
0:15:15,0:15:25,Treća stvar da bi mogli razumjeti glas Božji i svoj bolje razlikovati jest zadatak upoznaj samog sebe.
0:15:27,0:15:40,"To od početka, od kad su ljudi počeli razmišljati o životu i željeli naći sreću su si to spoznali od starih Grka da trebaš upoznati samoga sebe."
0:15:41,0:15:48,"Vrlo jednostavna pitanja gdje si jak, gdje su plodovi, gdje su dobre strane toga života."
0:15:50,0:16:01,"Pitaj se, baš pogledaj malo onako, koje su tvoje kreposti, koji su tvoji talenti da vidiš da usreću, da donose blagoslov, milost ljudima oko tebe."
0:16:03,0:16:18,"Drugo je pitanje gdje si slab, gdje su tvoje grijesi, gdje padaš u rupu, u nemilost, u odnose iskrivljene prema drugim ljudima, prema prijateljima."
0:16:20,0:16:34,"I treća je stvar gdje možeš napredovati, usavršiti se, gdje vidiš da te gura, da te gura nutrina, da tu trebaš, da tu ima prostora, da ćeš tu se ostvariti, da tu ima nešto dobro za tebe."
0:16:36,0:16:44,"To znači upoznati sebe i to i Sveto pismo upućuje, kaže u poslovni sv."
0:16:44,0:16:58,"Jakova, Đavao obilazi kao ričući lav da vidi gdje si najslabiji da te tu napada ili ako hoćete i neprijatelj gleda u tvrdu, širi, ide oko nje, ide oko nje, šeta da vidi gdje je najslabija točka i onda tamo napada."
0:16:59,0:17:02,"Znači to su naše slabosti, naši grijesi."
0:17:03,0:17:53,"Ako njih znamo onda će nam biti vrlo lako vidjeti što je glas Božji, što je glas džavla svijeta jer Božji glas ćete poticati, ne boj se, možeš, ja ću ti pomoći, bori se protiv toga grijeha, odi na ispovjed, oprosti ovom svom prijatelju, vidiš da je to zamka, a džava će ti reći, ma brini se za sebe, pustiti, vidiš kako su ove ljudi sebični, samo na sebe misle i ti moraš tako, makni se od njih i napravi po svome, uzmi svoje, uzmi ono što ti pripada, prikriži te ljude, vidi prave budalu od tebe, koliko puta više itede itede i tu vidiš točno šta te uništava, a šta te izgrađuje."
0:17:54,0:18:07,"A gospodin ti pokazuje da od toga mjesta gdje si najslabiji možeš biti najjači jer tu te gospodin izgrađuje, usavršuje, posvećuje."
0:18:08,0:18:37,"Kao što je Pao imao trn, kaže u tijelu, da ga stalno nešto podsjeća da je čovjek, da je slab, da treba Boga, tako i mi tamo gdje se ponavljaju grijesi, tamo gdje se najviše mučimo, borimo i gdje mislimo ma opet ću sutra napraviti to isto, tako sam slab, evo tu te Gospodin poziva svojim glasom i tako ćeš ga prepoznati da je on tu s tobom i da je to mjesto borbe, gdje je mjesto posvećenja."
0:18:42,0:18:52,"Zato ime u Evanđelju kaže, kad ideš graditi kuću ili kulu i tvrđavu, pa daj procijeni malo koliko imaš, pa da vidiš da možeš do kraja nešto napraviti."
0:18:53,0:18:59,"Ili ako ideš u neki rat, vidi jel imaš dovoljno snage, vojnika, sredstava da možeš dobiti taj rat."
0:19:01,0:19:04,Tu je ono gdje gospodin čini razliku.
0:19:05,0:19:14,On je onaj koji ti daje i svjetla i snage da se ima i da se isplati boriti za pravu stvar.
0:19:15,0:19:22,Tu onda mi susrećemo ono naše što dijelimo po ljudskoj naravi.
0:19:23,0:19:28,"Sveti Ivan kaže požuda tijela, požuda očiju i oholo života."
0:19:28,0:19:42,"Dakle sve ono što dolazi izvana ugodi tijelu, piće, hrana, seksualnost, odmor, komocija, materija da si sve priuštiš i to više samo te zatrpava."
0:19:42,0:19:56,"Evo to su stvarnost stvarnosti glasovi gdje nas gospodin uči ovo je tvoje po prirodi, ovo je duhovno, ovo je božje, ovo su napasti."
0:19:57,0:20:08,Dakle možemo reći da je dosta jednostavna stvar a kuša se vježbanjem kao svaka druga priča u životu.
0:20:08,0:20:37,"Ako hoćeš dobro svirati gitaru, ako hoćeš biti dobar mehaničar, ako hoćeš biti dobar kirurg, ako hoćeš znati dobro, lijepo moliti, ako ćeš biti dobar govornik, ako ćeš biti evo dobar stolar, ručni rad, slikar, znači bilo što, bilo što u svemu i najmanju stvar vježba i upornost čini majstora."
0:20:38,0:20:40,Tako vam je i u prepoznavanju glasa Božjeg.
0:20:41,0:20:45,"Ključ prebivanje, slušanje, razabiranje."
0:20:47,0:20:49,I polako idemo prema zaključku.
0:20:55,0:21:20,"Sveti Ignacije, to je evo utemeljitelj nas Isusovaca, on je imao tu jednostavno spoznaju i uvid koji mu je Gospodin dao da je upravo to ispitivanje savjesti ključna priča za naše živote da znamo tko nam glavu nosi, tko nas vodi i što se događa u nama."
0:21:21,0:21:44,"I zapravo taj ispit savjesti pomaže da upoznamo sebe, drugo da prepoznamo Božje poticaje, da prepoznajemo poticaje naših slabosti i da prepoznamo napastnika i da onda znamo za jedno se odlučiti, drugo odbaciti, a Bogu za dobro zahvaliti."
