Start (HH:MM:SS),End (HH:MM:SS),Segment
0:00:01,0:00:02,Hvala im je Susi Marija.
0:00:04,0:00:11,"Selem, je suha, je mesija, na zaračeni, boladra umirjem."
0:00:13,0:00:16,"Tako je to po arabskoj, kako se pozdravi sa Isusom."
0:00:17,0:00:25,"Selem, je suha, je mesija, na zaračeni i boladra umirjem, devetica Marija."
0:00:25,0:00:29,Tako je muslimani se pozdravili.
0:00:29,0:00:30,Se predstavim?
0:00:32,0:00:34,Jasam edi hišri.
0:00:34,0:00:55,"Hišri, imam šezdeset godina, rođen sam u Tunis, u sredine, trima Alžir, imam šezdeset godina, uženin, imam troje djece, imam troje unuke, imam dva divne, predivne zetove."
0:00:58,0:01:08,"Moje susret sa Isus, ja ću biti rezume kratak, zato ako hoću u detalje treba mi 4-5 sati."
0:01:09,0:01:17,"Ali ja ću, moja je najvažnija točka, moj susret i kako tu Isus meni spasio."
0:01:19,0:01:25,Moj otac vjeruje u učitelje islam.
0:01:26,0:01:28,I u škola i u džama.
0:01:29,0:01:30,Džamija da.
0:01:33,0:01:38,"Moj otac ima deset sinovi, jedna sestra, nas je jedanaest kuća."
0:01:39,0:01:43,"Od njih deset sinovi, zamislite, jedan čovjek u selu ima deset sinove."
0:01:44,0:01:45,Još u vjeru učitelja.
0:01:46,0:01:48,On bio sve u selu.
0:01:51,0:01:58,"Moje sreće, u nesreće, da moj tata htio da budem ja nasljednik."
0:01:59,0:01:59,Zašto?
0:02:00,0:02:04,"Zato sa sedam, osam godina znam Koran četvrtina."
0:02:04,0:02:06,Koran znam na pamet.
0:02:07,0:02:08,Tako islamska vjera.
0:02:08,0:02:12,"Naučiš na pamet, recitiraš Koran."
0:02:12,0:02:15,"Svaki dan, svaki dan, svaki dan, svaki dan, moraš naučiti."
0:02:16,0:02:20,"Sura, sve moraš naučiti na pamet."
0:02:22,0:02:38,"Ali, nažalost, kako moj tata planira da budem ja nasljednik vjeroučitelja, nažalost, nisam ja danas vjeroučitelj, ali moj čer postala vjeroučitelj katolik vjere."
0:02:40,0:02:44,"Zamislite, tako sam ja rođen u Tunisu."
0:02:45,0:02:57,"Sa moj otac, sa to deset sinovi, vjeru učitelj je, bio malo strog prema nama, islam je isto strog, to mora naučiti, to sve."
0:02:58,0:03:02,Sa 16 godina došao sam u Francuske.
0:03:04,0:03:15,"I tu bilo meni, ali ja sam uvijek isto, u Tunis, sa 12, sa 13 godina, uvijek sam je razlikovao, tu bile mi puno neke stvari, nije jasno."
0:03:17,0:03:18,Uvijek taj isusek.
0:03:18,0:03:23,"taj Isus je Krist, ta djevojica Marija, meni malo vukli na stranu."
0:03:24,0:03:29,"Stalno razmislju, stalno sam ja, kako to, zašto."
0:03:29,0:03:38,"Zato to u Kuranu se piše i Muhammad je rekao, recitirao u Kuranu, da vraća se kraj svijeta, vraća se Isus je Krist."
0:03:39,0:03:43,"Nije rekao vraćam si ja, vraća se Isus je Krist."
0:03:44,0:03:50,"Kod musulmani kada moli za uzdravljenje, on je moli djevojica Marija."
0:03:52,0:03:59,"I onda tu meni bilo nije jasno, imam dobra edukacija, islamsko edukacija, meni bilo nije jasno zašto."
0:04:00,0:04:27,"I onda kad sam ja došao u Francusku, bilo meni prvi susret, nikad ne zaboravim, imam šezdeset godina to, nikad ne zaboravim se zove madame Gilbert, koja je bila u Caritas, među svi mi smo bili mladi i tako to, ona je meni vukla na stranu i kaže ona meni, očeš ti i dođeš u crkve."
0:04:30,0:04:33,"Ja gledam u nju, ja u crkve."
0:04:34,0:04:35,Zašto?
0:04:35,0:04:37,On je u crkve za meni.
0:04:37,0:04:49,"Šta sam ja naučio u Koran, i sam naučio da vi, kršćani, vi za ovo kip, da vi klanetevi za kipovi koji ne može ništa pomoći."
0:04:49,0:04:51,"To je bilo ono što sam ja, razumijemo."
0:04:51,0:04:58,"U vremenu, da vi, kršćani, vi klanetevi za kipovi koji ne može ništa pomoći.ć."
0:05:00,0:05:04,"Ali to je krivo razumijevanje, da sam je krivo razumio, sve."
0:05:07,0:05:29,"Dobro, prihvatio sam, došao s njom, otišao s njom u crkve, bio je kraj klupa i prva je rečenica koja je tu meni kliknula u glave da je ta kršćanska vjera: opustite, opustite."
0:05:29,0:05:31,"U mojej vjeri, bivše vjere., ne."
0:05:33,0:05:34,To nije bilo to.
0:05:36,0:05:39,"Kada mi smo izašli i da li mi ona, meni, Biblija na arapski."
0:05:42,0:05:45,"Uzeo sam ostavio to u nekdje, zaboravio."
0:05:47,0:05:53,"Nakon par mjeseca vidim, ja ta Biblija tako prašena, to na arapski, samo da vidim."
0:05:54,0:05:56,"I ukrenem malo tako, čitam, meni je provuklo to."
0:05:59,0:06:07,"Isus, Stari zavjet, Novi zavjet, kako je to Isus, kako je to sve., a meni je Isus to bilo u moje bivše vjere."
0:06:07,0:06:13,"Isus je bio prorok, kao Muhamed, kao drugi, prorok."
0:06:15,0:06:28,"Onda okrenem ja malo razmisljem, okrenem malo razlikovati i vidim u Koran, vidim u Biblije, čitam tamo, čitam u vama, ali bili je meni uvijek ta sumljive."
0:06:29,0:06:45,"Nije lako vama, danas kažem vama mladi, nije lako, vi znate vi jedne vjere, ali kada čovjeka zna dva vjera, onda je jako teški, a napast još više, puno, puno teže."
0:06:45,0:06:51,"I onda bottevi uraditi u sebi, samo u svoju dušu."
0:06:54,0:07:09,"I krenem, ja sam s tim, dok ja sam došao na jedan od točke da vidim u ono vrijeme da sam ja vidio to tako i čuo od neke druge ljudi, i krenem čačkati i tražim ih."
0:07:09,0:07:19,"Da mi premašujemo, premašujemo divice, uspomenete u Koran 34 puta."
0:07:22,0:07:33,"Isus Kriste, Jesuja, Alma sugrađena, uspomenete 25 puta, a Muhamed 3 put."
0:07:36,0:08:04,"To je provuko mi u katoličke vjere, bok sam ja iz Francuske došao u Švicarsku, ali uvijek imam da ne kažem tu simpatije prema kršćanskoj vjeri, ali meni više interesirala ta vjera, bez obzira ima puno tu i sekte i vjere i tako to, ali kršćanske vjere i ta Isusa Krist meni prvu."
0:08:07,0:08:33,"Došao sam u Zurih, u Švicarsku, radim, među vremenom zaljubljen sam, poznamo ja, Poznamo je Slavonka, moja sadašnja supruga ko sam ja s njom 32 godine u crkvenu i su poznali, ja sam ju zaručio i ona meni kaže ovako."
0:08:35,0:08:46,"Ako budemo se vjenčali, ja želim se vjenčati u crkve, katolička crkva."
0:08:50,0:08:57,"Gledam kako to, ali još me ni povuku, još me ni da motivacija."
0:09:00,0:09:14,"Kaže on meni, ja sam od familije katolik, vjernici, rodovito crkve i ja želim, ti njemuraš, možeš ti samom odušu crkve, možeš ti na oltaru stojiti, ali ja želim odetu crkve."
0:09:16,0:09:18,"Ja sam Rakudop, nema problema."
0:09:19,0:09:20,Došli mi u Slavoniju.
0:09:22,0:09:36,"I među vremenom je to ukrenio meni taj žar, kada sam ja s njom, i svake nedelje meni vukle s njom, u srkve, otušao s njom, na misli, sjedio iza, samo gledao kako to klanje, kako to oduzvega."
0:09:36,0:09:40,"Ja sam samo gledao, nisam ništa procesirao ili razmišljao."
0:09:41,0:09:56,"Sam, puno, puno, puno lakše, kada čovjek rasporedi neke stvari i onda gledajem, a onda vagam sa sobom, sa koliko moje razumijevanje., razumijevanje, kako se kaže."
0:09:58,0:09:59,Razumijevanje je tako.
0:10:01,0:10:08,"Koliko sam ja razumio, katoličke vera, da je to puno, puno lakše od ona, bivša moja, koji je pet puta dnevno."
0:10:10,0:10:13,"I nije samo to, idiš ti klan, ti moraš oprat."
0:10:14,0:10:22,"I oproti tu od nogu, pa ruke, pa tamu, pa imamo pet puta dnevno, puno teže."
0:10:25,0:10:46,"Prihvatio je to i sam rekao, ok, s njom u crkvu, došli u Slavoniju, otišli u Crkvu da napravimo termin za svadba i sreće, nađem jedan svećenik, mogu reći da tu si iz Novogradiška, da, iz Novogradiška Slavonka."
0:10:48,0:10:50,Naš svećenik koji priča njemački.
0:10:53,0:10:54,Ja pričam isto njemački.
0:10:56,0:11:07,"Ja njega pitam da li mogu jadobni, kako papir, kako test, ne znam kako da mogu ja istu hoću istu želim s njom u crkve da se ženi istu u crkve."
0:11:10,0:11:13,"Kaže meni može, ali moraš na tečaj, jel tako?"
0:11:13,0:11:14,Možeš biti na tečaj.
0:11:15,0:11:31,"I bio na tečaj i uspio sam i znao dosta toga zato u Koran, skoro kopije, samo puno puno drugačije znači kada čitate vi na arapski, puno drugačije."
0:11:34,0:11:46,"Bilo mi je lijepo, prošao si sve, pitao si, meni je pao dosta pitanja, znal si, prošao si sve, dobio si krištenje, uzavem luke i srečen sam."
0:11:50,0:11:57,"I onda je na koncu krištenje je hoćeo primiti isto, to je Isus."
0:12:00,0:12:08,"I onda si mi je pitao da Bog je još svet je pričaš, muž je proživljen tečaj i da mi se svet je pričest."
0:12:09,0:12:12,"I ja sam bio kao ptica, sada je Klaudija moja za poslu."
0:12:13,0:12:21,"Uženio sam u crkvi, one je jedna, dva je pred oltar, Bogu hvala."
0:12:25,0:12:33,"Posla, se sedili mi smo u Puni, dobio sam Manuela, moj prvi ljubav."
0:12:34,0:12:38,"A njen je ime sam ja nazvao, kada sam ja se poznao za Klaudija."
0:12:38,0:12:52,"Prvi put, mislim, bili još tečke cure, ona otvorila Olivri, ona pjesma Manuela, Manuela, ja šalam, kažem nju, ako budem tebi ženiju, imat ću čer, nazvat ću nju Manuela."
0:12:54,0:12:56,"Imam tu Manuela, ona mi je prvi ljubav."
0:12:58,0:13:12,"I nakon Manuela dobio sam Mirjam, zato na arapski, vi kažete vi Marijem i kažem mu Mirjam la vra, Maram na hebrejski, na arapski Mirjam, Marija majka Boža."
0:13:13,0:13:16,"I to ime to jako, jako, jako volim te."
0:13:17,0:13:21,"Tako da uspiju, Bog meni htio da mladi, da Bog meni dao sve."
0:13:22,0:13:25,"Sve što sam ja poželio i htio, Bog meni dao."
0:13:26,0:13:27,A znate vi zašto?
0:13:28,0:13:34,"Zato Bog sam rekao, kucce otvorit ću, pitaj, odgovorit ću."
0:13:34,0:13:38,"Ja sam kucu i on meni otvorio, ja sam pitaj i on meni dao."
0:13:44,0:13:46,Uvijek je to jako zanimljivo.
0:13:50,0:13:50,Ne mogu.
0:13:51,0:13:57,"Naravno, imao je samo jedna pola sestra, nisam imao sestru od moja mama i dobio je dva čira."
0:14:00,0:14:04,Ali nakon osam godina ipak hoću nasljednike.
0:14:06,0:14:10,"Kažu mi, žena, treba mi si i moramo i prijeći i nastaviti u Hrvatsku."
0:14:13,0:14:21,"Molio sam, molila je ona i dobio sam sin, ko sam ja., jako volio, ima David, David Gabriel."
0:14:22,0:14:25,"I to bi mi je sin, David Gabriel."
0:14:25,0:14:27,A znate li zašto bi to bio sin?
0:14:27,0:14:31,"Zato što je Gud, i opet mi je dao."
0:14:41,0:14:42,Isus ne laže.
0:14:43,0:14:48,"Isus se obećuje sam, kaže: kucaj, otvori se, pitaй."
0:14:48,0:14:49,"Odgovori se, zaizdi isti."
0:14:50,0:15:26,"Ako kut ste vi otvori, Ako kucate vi u srce i pitate vi u srce da će vam sto posto ja sam dobio ja sam kucu i pitao on meni dao pa zašto ne bi dao vama mladi zašto i naravno idemo u redovitu crkvu moja i curica okrenula u spor u puli u sveti Franiju i tada okrenula prava muka Isusa."
0:15:28,0:15:31,U kreni jako teško napasti.
0:15:32,0:15:32,Kako?
0:15:33,0:15:34,Ma katoličke vjere.
0:15:36,0:15:37,"Isus Bog, kako to?"
0:15:38,0:15:40,"Isus sim Božji, kako to?"
0:15:41,0:15:42,U Korantu ne postoji.
0:15:44,0:15:46,I okrene meni muka sa sobom sam.
0:15:47,0:15:49,I okrene se zgubiti.
0:15:50,0:15:56,"Ali svjetlo koje mi je dao, Isus je Krista ovaj mali, nije tu slušanost, tu ja."
0:15:57,0:16:08,"U Tunisu, a ona je rožena u Novog Gradišku, a nas tvoje si sredi života u Švicarsku i za ljubim je u njih, a ona u meni."
0:16:10,0:16:11,Nije to slušajnost.
0:16:13,0:16:14,To je nešto od toga.
0:16:14,0:16:23,"Kada je človek posla, kada imate vi jednu problem, istruju, onda se pojite, a vi žice po žice, jedna po jedna, dok dođete vi gdje je."
0:16:25,0:16:26,"Uzrok, gdje je početak."
0:16:27,0:16:32,"Pernikla odjeo došla iz Novog Gradiškeška je Slavonija, odifša Jugoslavija."
0:16:34,0:16:35,Užiri.
0:16:36,0:16:37,Dobro.
0:16:40,0:16:43,Moja vjera u kršćansko bilo.
0:16:43,0:16:46,"Uki, ali imam somlje."
0:16:47,0:16:50,"Stalno, stalno me vrati ta somlja."
0:16:50,0:16:55,"Ne mogu, ne mogu nikako prehvatiti da je Isus Bog."
0:16:57,0:16:57,Kako?
0:16:59,0:17:02,"A kako god ja sam tu, pokriste."
0:17:02,0:17:04,Krista vratio suro u kora.
0:17:13,0:17:20,"Bog nema žene, nema djecu, nije rodio i ne može roditi i nema nikakvu ni sinove i nema nikoga."
0:17:22,0:17:27,"Kako god u krenju htio prihvatiti, nađemo suro koji mi je totalno kontra."
0:17:28,0:17:29,I tu krene meni muk.
0:17:31,0:17:34,"Ukrenio sam na YouTube, ukrenio je tamo, ukrenio je vama."
0:17:34,0:18:16,"Pitu par ljudi koji to znam, sudruži sa dosta svećenici koje zahvalim danas, među njima jedan koji meni jako, jako puno pomoglo, mogu reći njegovom fra Marku Blagović, bi meni jako dobar svećenik, jako puno pomoglo, ali svi koji sam ja s njime sudružio, da li mi odgovor, ali nije bio meni dovoljno za svoju dušu, da je to Da je tu prihvaćam i da zatvaram ta vrata za islam i da kažem, ovo je meni novi početak."
0:18:20,0:18:24,"Da, prihvatio sam, ali nisam sto posto."
0:18:27,0:18:33,"Ovaj trenutak, momentan kod vas, čekao sam 30 godina."
0:18:34,0:18:38,30 godina čekao taj trenutak da nas predvama.
0:18:40,0:18:49,"Prvi, svećen.ik koji sam ja prihvatio njegov poziv, Frastype, preko mojih čer Manuela."
0:18:57,0:18:59,Prvi put svjedočim.
0:19:00,0:19:01,Zašto svjedočim?
0:19:02,0:19:03,Većina mladi je to.
0:19:04,0:19:09,Zato smatram da je to moja obaveza svjedočiti Isusa Krista.
0:19:10,0:19:11,Žive istina.
0:19:15,0:19:20,"Okej, mi smo nastavili u polje živjeti, krenuli meni tamuke, velike."
0:19:23,0:19:27,"Imam tu Bibliju na arapski, čitam je, imam Kuran, imam tu sve."
0:19:28,0:19:35,"Jedan večer spavam, do dan danas ne mogu tu prihvatiti da li je to sam spavu, ali tu bile žive istine."
0:19:36,0:19:38,"U srednjoj noći došao mi čovjek, stavim i križ."
0:19:42,0:19:45,"Ja probudim i kažem žene s tim križom, ja kažem ne, spavam."
0:19:47,0:19:50,Ali meni čovjek ostavi križ na čelu.
0:19:53,0:19:53,Kako to?
0:19:56,0:19:56,Ne mogu.
0:19:58,0:20:20,"Nastavili dalje u crkve, otišli puno, duhovno obnova, bio kao da fraj pokojni zvijezdili nič od tabora, bio u Mađugori, bio u Fatima, bio tu u Lourdes, bio u Budu, opet uvijek bio aktivan, idem u seminare, idem u duhovno obnova, idem, idem, idem, idem, i da mi je pomogao, tu se."
0:20:20,0:20:30,"Pomogu to sve, ali problem od toga ja ne mogu nikako prihvatiti da Isus Bog ne postoji, ne mogu nikako prihvatiti."
0:20:34,0:20:40,"U jedan put došao otas James, ako ste vi čuli, u pol seminar."
0:20:41,0:20:43,"Bio jako sretan, ne znam zašto."
0:20:43,0:20:51,"Ja sam imao takvu osjećaj da taj otas James, taj svećenik, bit će on odgovorat na sve moje pitanje koje me muči."
0:20:55,0:21:34,"petnaestosamdvije tisuće dva za velike gospođe bio seminar na stadionu u puli stadion uljanik u puli u četiri sata poslovodne probudio sam ujutro mi smo imali restoran u puli u pješčano uvele kaže mja klaudija idem ja kod zubar nešto bavim i vraćam se pripremimo ručak i radnik to svega i onda u četiri idemo na seminar kaže dobro nema problema sjedio na vispa, otišao u grad, izašla je jedna baka od malo ulice i udarila mi kompletnu motor, ja slomljeni."
0:21:35,0:22:02,"Noga u gips, ruka u gips, završio sam u bolnica, negdje u dva pola tri izašao od bolnica, slomljen po tableta, bolovi, u četiri sata krene seminar, petnaest do četiri gledam ja i kažem nećeš ti meni Ispričeti da ja idem u semena."
0:22:03,0:22:09,"Mene je moj, malo budem slomljen, tu sve u komadu, zalijepite, tu sve ja idem."
0:22:10,0:22:12,Ja idem u semena.
0:22:13,0:22:17,"Naštaka, supruga je tu, naštaka po tabletama."
0:22:19,0:22:22,"Ja, naštaka, tata, tata, dođem na stadion, pun."
0:22:25,0:22:29,"Koristio prilike, isto naštaka, sam rekao: biće nešto."
0:22:31,0:22:39,"Ušli na stadion, vidi mi odmah naštaka, ostavlja mi u prvi red do otas James sa bolesnicom u liceima."
0:22:39,0:22:39,"O, super."
0:22:47,0:22:50,"Hvala vam, hvala vam."
0:22:50,0:22:55,"Ja sam rekao: Na moje sreće, nesreće."
0:22:57,0:23:00,"E tako kaže, na sreće, u nesreće."
0:23:02,0:23:27,"Bio sam sto posto siguran da je da ja vidim Otašu James na štakama, svi ostali u kolica bolesni, došla je pauza i taman bio fra Tomislav, svećenik koji njega poznajem, ja kažem njemu, slušajte ovo, stvarno da Isus ima prst u toga, sto posto Isus, vidite."
0:23:29,0:23:37,"Ja pitam fra Tomislav, mogu ja Otašu James jedne minute, minut, imam samo par pitanja."
0:23:38,0:23:50,"ja, kažu meni, okreni, ja okrenem, koliko ima ljudi, ja kažem četiripetpet tisuća ljudi svaka hoće jedna minuta pet tisuća minuta ne može."
0:23:55,0:23:59,Nak out blokirom i nisam više niti jedne riječi rekao.
0:24:01,0:24:13,On meni kaže u kreni ja vidim četiri pet tisuća ljudi svaki hoće jedna minuta šutiju vratio sam na svoje mjesto bio jako tužen baš baš bio tužen u mom srca.
0:24:15,0:24:16,Znate li što sam radio?
0:24:18,0:24:19,Znate li što sam radio?
0:24:20,0:24:27,"Opet sam kucu upitao, zašto ja ne mogu dobiti jedna minuta, zašto?"
0:24:27,0:24:29,Zašto ne mogu dobiti jedna minuta?
0:24:31,0:24:32,Ali nisam dobio.
0:24:34,0:24:55,"Završio sam vinar, vratili kuće u restoran, radim mu pun posla, ja na štake sjedem na stranu tužen, negdje osam Nigdje 8 sati zvoni telefon, uzme Klaudije, kaže meni, evo ti frađuru, sveti frajni u tebi treba i gdje spava Utas James sa 20 svećenik."
0:24:56,0:25:04,"Kaže on meni, Edi, naša koharica bolesna, da li možeš ti nama kuhać sutra ručak za 20 ljudi i donesi u crkve."
0:25:04,0:25:05,Hallelujah.
0:25:08,0:25:10,"Vidite kako, ko se i pa pitate."
0:25:12,0:25:23,"Dobro, sutra napravi mi jedan super ručak i do i doneseli tamo, ali sam rekao sa sebi sam, dobro, ja ću se ugurati barem jedno-dva pitanja."
0:25:23,0:25:26,"Ja ću samo pitati, jedno-dva pitanja, samo to."
0:25:28,0:25:46,"Vjerujete vi meni, ošli ostavljaju hrana, bili konobari, sam nam to sve, ostavili januštaka, ja okrenem glavu, a otas James oči, oči, kaže, ti bivši musliman, ruč si sjediš pokraj mene, tamo u stol ti sjediš pokraj mene."
0:25:46,0:25:48,I ruču s njim i bio dva sata.
0:25:49,0:25:49,Hallelujah!
0:25:51,0:25:51,Je li?
0:25:59,0:26:02,"Traži minut, rekao ne, ne, to je tvoja sata."
0:26:02,0:26:03,Ali moraš čekati.
0:26:07,0:26:08,Jer to nije blagoslov.
0:26:09,0:26:09,Je.
0:26:10,0:26:14,"Isus smo prati, Isus smo volili, spasio mi otama."
0:26:15,0:26:17,I zato danas ovdje htio njega.
0:26:18,0:26:25,"To mu je znak zahvalnosti, zahvalam ga, da je ja vama svet svjedočimo je to život."
0:26:28,0:26:37,"Sjedio bih kraj njega dva sata, bila bih privoditeljica, koja je znala, odgovorio mi na sva tri pitanja."
0:26:41,0:26:43,Liječio mi samo jedno pitanje.
0:26:45,0:26:45,Nije odgovorio.
0:26:46,0:26:50,"Odgovorio je, ali nije bilo u meni dovoljno za sebi, za meni."
0:26:51,0:26:52,Isus Bog.
0:26:54,0:26:57,"I nisam mogao nikako prehvatiti., tu postala ta sumnja."
0:27:00,0:27:05,"Jer prije korona, dvije godine, 2018."
0:27:05,0:27:13,"i 2019., u krenuli je pratiti jedna grupa katolik u Egipat preko Juturp."
0:27:16,0:27:29,"I bio je jedan svećenik, stari čovjek, ali jako, jako ima dosta znanja, ali bilo je na moj jezik, na arapski, meni je bilo puno, puno, puno, puno važnije da znam."
0:27:29,0:27:32,"Da znam, recimo, kao i vas, dostojanstvo."
0:27:33,0:27:35,Mi je jedna rečenica tako.
0:27:35,0:27:41,"Ali kada vi provodite na arabski karama, mi ginemo za karama, za dostojanstvo."
0:27:42,0:27:43,Dostojanje to znači karama.
0:27:44,0:27:47,"Ja nisam znao, to je težina te rečenice."
0:27:48,0:27:50,"Dostojanje je bilo, OK."
0:27:51,0:27:57,"Ali kad sam ja znao, dostojanstvo je tu, karama, kaže je teško riječ."
0:28:00,0:28:01,Možeš čak vagati.
0:28:04,0:28:08,"I ta vremena bila je baš u muke, teške."
0:28:09,0:28:29,"Imam još vremena, bio je baš u muke, teške mi je muke, baš sam mučio sa sobom sam, odustajem u kršćanstvu, tu svet, u ma kako je to, ne, ne, ne, ne, ne, ne, ne, ne, ne, ne, ne, ne, ne, ne, svjedočite tu, svjedočite tu, svjedočite tu, svjedočite tu, to, to, to."
0:28:30,0:28:46,"Jedan dan uzim mobitel navečer, tvorim mobitel i direktno nađem taj svećenik i bile piše gore i tema objašnjava kako je Isus Bog."
0:28:50,0:28:52,Znate kako među ovim dobim i sam jackpot.
0:28:53,0:28:56,"Ovo glavno ko sam ja mučio, mučio."
0:28:58,0:29:02,Kako on objasnio i liječi mi za vjeke vjekova?
0:29:03,0:29:03,Kako?
0:29:05,0:29:11,"Kaže on kako je Isus Bog, nama, pričan arapski, naravno."
0:29:13,0:29:21,"Imate vi jedan lijes, jedan sanduk od drva i vi obložite vi njega kompletno u zlato."
0:29:23,0:29:24,Od vani i od unutra.
0:29:26,0:29:27,Kompletno u zlato.
0:29:27,0:29:28,"Što vi kažete, taj sanduk?"
0:29:29,0:29:32,Da li zlato ili drvo?
0:29:32,0:29:34,Ili taj sanduk zlato i drvo.
0:29:36,0:29:38,I tu je Isus Krist.
0:29:38,0:29:40,"On u meni, ja u njemu."
0:29:41,0:29:42,Tu u Bogu.
0:29:44,0:29:44,I tu bili meni.
0:29:46,0:29:47,"Jednostavno, to je to."
0:29:49,0:29:50,"On u meni, ja u njemu."
0:29:51,0:29:56,"Taj sanduk, ne ne znaš da li u zlatu ili drvu."
0:29:58,0:30:07,"I tu objašnjem na svoj način, na arapski jezik, tu bili meni ta pitanja i tu to i prihvatio za vijeke vjekova."
0:30:10,0:30:12,Nemam više ta sumnja.
0:30:12,0:30:12,Ali.
0:30:14,0:30:21,"Čovjek, čovjek, vagat sebi sam."
0:30:24,0:30:41,"Znači, vraćam mu tamo od početka da Isus danas svjedoči pred vama, hoću vama kako meni njega hvalim i slavim i klanjem se."
0:30:42,0:30:42,Zašto?
0:30:43,0:30:44,Zato spasim i od tama.
0:30:46,0:30:47,Spasim i od tama.
0:30:47,0:30:48,Spasi mi od pakao život.
0:30:50,0:30:59,"Ono što danas kažem za sebi sam, kao ga šećer gorka, a život bez Isusa mračna i jadna."
0:31:01,0:31:02,Zahvaljujem.
0:31:02,0:31:04,Hvala Isus i Marija.
0:31:05,0:31:09,Neka Bog vas blagoslovi i pazi i čuva.
0:31:10,0:31:10,"Hvala vam, Knu."
0:31:11,0:31:11,Hvala.
