Start (HH:MM:SS),End (HH:MM:SS),Segment
0:27:03,0:27:06,"Ja sam uvijek rekao, obavljaj za dolje jastučić."
0:27:06,0:27:08,"Ili ono ono što keramičari imaju, znaš ono?"
0:27:08,0:27:11,"Da, pojmo, stari ljudi stave kumad kartona."
0:27:11,0:27:12,"Da, samo ne veće siro prvi."
0:27:13,0:27:13,"Da, to je."
0:27:15,0:27:18,To je fora neka iz prošlog podkast ste sa stigla poruka.
0:27:21,0:27:23,Ali evo baš me zanima tvoje mišljenje.
0:27:23,0:27:39,"Jedna stvar koja je na primjer na ovom podkastu, meni se čini da se to naravno opet zloupotrebljava od dviju strana, neću ja to nazvati lijevo ili desno, pozitivno, negativno, tamna, svjetla, ali da se i namjerno radikalizira."
0:27:40,0:27:47,"Nisu ti ljudi koji vjeruju toliko, šta bi rekao, avantgarda, a Bog mi ni ovi nisu toliko avantgardni, kad bi rekao."
0:27:48,0:27:52,"Ali imam, mislim, to je jedna, netko vrlo uspješno dirigira s tim."
0:27:53,0:28:04,"To je zapravo jedan klasičan put Reko bih čak neke, takve su se pobožnosti općenito katoličke širile."
0:28:06,0:28:07,To je nastalo u drugim zemljama.
0:28:08,0:28:12,"Mi ovdje tu nismo to izmislili, odnosno, klječenje."
0:28:14,0:28:18,To je nastalo puno prije u 21.
0:28:19,0:28:22,"stoljeću uglavnom, ali puno prije je nastalo i u Irskoj."
0:28:23,0:28:24,Zbilja?
0:28:24,0:28:34,"U Poljskoj je to naravno, mislim, Poljaci su katolici veliki, ali pa tamo ima toga jako puno, u Australiji, u Americi i tako dalje ima tih dosta poznatih."
0:28:34,0:29:14,"A oni su znali, oni su."
0:29:15,0:29:22,"Kažem, to je nešto što je već duže vrijeme prisutno, ali nije u mainstreamu, nije viđeno."
0:29:22,0:29:31,"Pa i do nedavno, ljudi koji su molili klečali na trgu, nisu baš bili nešto puno gurani od strane klera."
0:29:32,0:29:36,"Da, kako, recimo, možda znaš stalište crkve?"
0:29:36,0:29:39,Pa nema nekog ujednačenog stava crkve.
0:29:40,0:29:51,"Mislim, u crkvima puno svećenika, ima nekih koji imaju razmišljanje u jednom smjeru, neki koji imaju u drugom smjeru, ali generalno gledano uvijek je to u nekom okviru katekizma."
0:29:54,0:29:58,"A sad, ja isto nisam bio, ne idem."
0:29:58,0:30:02,Zanimljivo je da su muškarci to odlučili raditi.
0:30:02,0:30:19,"Dakle, muškarci da su rekli da oni kao u nekoj krizi muškosti danas, koja se isto spominje jako često, da su rekli da jednostavno moraju preuzeti tu neku inicijativu molitvenog karaktera i da su krenuli u to."
0:30:20,0:30:24,"Dakle, neće dizati revoluciju, nego će ići molit."
0:30:25,0:30:25,Tako da.
0:30:26,0:30:28,Po meni tu ne vidim nikakav problem.
0:30:28,0:30:32,"Meni ja kad vidim nešto na ulici šta mi se ne sviđa, okrenem glavu i protivim se."
0:30:32,0:30:40,"Našeg bi ja sad to kad si mi to rekao, znači nekadašnji alfa mužeci se bore sad sa prevlast nad alfa ženom."
0:30:40,0:30:42,"A da, čuj to, možda je i tako."
0:30:43,0:30:44,Ali niste sad tako ispala.
0:30:44,0:30:59,"A vidio, to je treći val feminizma, nije ni to, tu je ono, nismo više, jednostavno taj feminizam je jako ojačao, snažno i ovo ostalo sve što dolazi, dakle, ta cijela ljeva scena, walkie ideologija, kencel kulture."
0:30:59,0:31:08,"Neki ono jaču, gledaj, ja sam otac kćeri i naravno da, gledaj, ali baš sam tu bila isto neka gošća."
0:31:09,0:31:13,"Mislim dokle će ono jačča, dokle, kako bi ti rekao?"
0:31:13,0:31:22,"Imaš neku glupu tamo sporta, ako je to sportsko natjecanje, neke dvije mrci na 150 kg se nađu pa znaš šamar jedan drugoga, pa koji padne padne."
0:31:23,0:31:24,"I to sam vidio, nisam mogao vjerovati da je to sport."
0:31:26,0:31:29,"Da, to je, mislim, meni glupo i da mi muški to radimo."
0:31:30,0:31:33,"Odmah, odmah, i nađu se ove dvije žene koje to rade."
0:31:33,0:31:36,"Sad se ja pitam, nek mi zamjere, žene kad je to vama treba."
0:31:38,0:31:50,"Mislim, već kad se ova dva, već je ova dva o tome kad se muškarac natječe u ženskim natjecanjima, biološki muškarac kad se natječe u ženskim natjecanjima jer se smatra se ženom."
0:31:51,0:31:52,Dođemo i do te teme.
0:31:53,0:31:55,"A mislim, ja se isto smatram multimilionašem, pa."
0:31:56,0:31:59,"Da, ja se smatram vikingom, isto plavom rješavim."
0:32:00,0:32:00,I sad kako ti je?
0:32:00,0:32:02,Po Sanaderu bi.
0:32:03,0:32:04,Stalno nisam bio viking.
0:32:04,0:32:07,"Bio je plav, plav i vršav, uredan."
0:32:09,0:32:13,"Tako da velim, već kad si to tako, vuk pokret."
0:32:14,0:32:15,"Kako ti je, mišljenje, stav?"
0:32:16,0:32:29,"Ja sve to gledam kao jedan veliki paket svih tih, dakle transgender, LGBT, IQ50906."
0:32:30,0:32:31,već dalje ide.
0:32:33,0:32:37,"Taj treći, peti, osmi ne znam koji je val feminizma itd."
0:32:39,0:32:45,"To je sve ista, sve jedan isti smjer, ajmo reći političko-društveni koji dolazi sa zapada."
0:32:46,0:32:56,"I ono što vidim, to je jedan oblik po meni kulturne, društvene dekadencije koja se uvijek pojavljuje na kraju nekih imperija."
0:32:57,0:32:58,"Rimsko carstvo, na primjer."
0:32:58,0:33:00,Neže je uništila dekadencija.
0:33:00,0:33:08,"I u principu to je onaj zadnji stadij, zadnji element jednog imperija."
0:33:08,0:33:13,"Imperija kad propada, onda se vidi da tu dolazi do te tzv."
0:33:13,0:33:25,"pojave karnevalizacije, društva, sve se radi kao karneval, sve je ta dekadencija, sve je opušteno, raspušteno, raskalašeno."
0:33:27,0:33:31,A i vidimo da je kultura u krizi od svega.
0:33:32,0:33:40,"Meni uvijek pada na pamet, nisam nešto svetsko filmski kritičar, više sam književni, ali mislim kritičari."
0:33:40,0:33:59,"Ali vidim da u filmskoj industriji Hollywooda i općenito u zapadnoj filmskoj industriji, sve češće i češće imamo priliku gledati reciklaže, sve češće imamo priliku gledati remakeove ili 16."
0:33:59,0:34:02,nastavke nekih kultnih filmova.
0:34:03,0:34:07,"I naravno, tu su sad vrh biografski filmovi."
0:34:07,0:34:23,"Dakle, ne možemo izmisliti nekog svog novog oblika, nego moramo, ajmo raditi o Einsteinu, ajmo raditi o ne znam, mislim, evo sad ovo zadnje šta je bilo, Oppenheimer i Barbie, biografski film i reciklaža."
0:34:24,0:34:28,Nisam gledao ni Oppenheimera u našem vrlo medijskom.
0:34:29,0:34:31,I mogu reći da je film okej.
0:34:31,0:34:32,I Edison je okej.
0:34:33,0:34:34,"I Edison je okej, i film je okej."
0:34:36,0:34:37,Barbi ćeši išći pogledati.
0:34:37,0:34:38,Bambi.
0:34:40,0:34:41,Bambi.
0:34:41,0:34:42,"Bambi, nisam pogledao."
0:34:42,0:34:44,"Ali ne, Barbi neću."
0:34:44,0:34:44,Da.
0:34:45,0:34:48,Barbi neću nije moj nadmajka po ftimu.
0:34:48,0:34:50,"Šta ako ti plate za kritiku, pogledaš?"
0:34:51,0:34:52,"Ma ne plače, ni nikoli."
0:34:52,0:34:55,"Plače za kritiku, to je sve zabadava."
0:34:55,0:34:57,"Sve, da, sve je na dobroj volji."
0:34:59,0:35:03,"Ali kažem, to je nešto što se vidi da je to neki možda zadnji stadij, zadnji stvar."
0:35:04,0:35:15,"Da, puno to ljudi govore, a ovo politički, ekonomski možemo pričati ono da Kina dolazi i dolazi, da neke druge stvari možda dolaze isto koje su sad već velike."
0:35:15,0:35:19,"Ali, cijela Europa ima krizu identiteta i vodstva."
0:35:20,0:35:28,"Ja ne znam nisam dovoljno proučavao knjige, je li ikad tako bilo da ti u Europi više nemaš nekog lika, likicu, jakog vođu?"
0:35:29,0:35:49,"Pa nema uopće u koncepciji političkoj, dakle mislim kako da kažem politika je od drugog svjetskog rata ušla u fazu da se ne pozdravlja, nema, barem nema jer nema pitanja država, dakle nema uopće više pitanja hoćemo li imati države, države su već tu."
0:35:51,0:35:53,Ne smije se više postavljati velika pitanja.
0:35:53,0:36:10,"Smije se postavljati pitanja hoće li stopa izvoza Borovnica i Breskvi biti 0,5 ili 0,13, ali ne smije se postavljati pitanje vrijednosno hoćemo li kao društvo biti ovako ili onako, to su jako trik i pitanja."
0:36:11,0:36:18,"I naravno da onda nemamo ni državnika, nemamo više neke velike politike, pogotovo u Europi koja je istraumatizirana normalno."
0:36:19,0:36:20,Europa je razbucana.
0:36:20,0:36:22,Svaki petak novi rat je bio tako da.
0:36:24,0:36:25,Evropa je razbucana.
0:36:25,0:36:31,"Da, no, kad ti vidiš kad su nas učili, čitali znaš ono u majke demokracije kao Amerika."
0:36:32,0:36:40,"I sad ti tamo imaš dva, mislim da nikog ne uredim, dva starija čovjeka, jedan je tako živopisan."
0:36:40,0:36:41,"Da, ne bude da se uvrede."
0:36:42,0:36:43,Drugi će potkaz doći.
0:36:44,0:36:47,"Da, ovo neće moći doći jer ne zna gdje."
0:36:48,0:37:17,"Pa, pazi šta nije to ono, mislim dvadeset jedan stoljeće ti nemaš nekog mlađu osobu koja to igra mora biti ko je to kužiš opet indikativno da se radi o raspalim sustavima, da jednostavno više ne mogu ni iznjedrit možda toliku silinu mladih ljudi, mlade energije, kako kažu itd."
0:37:18,0:37:22,Ali po meni je pitanje Europe tu nama puno važnije.
0:37:22,0:37:31,"Jer Europa po meni sada ima priliku za, ajde da bude malo i patetičan, nekakvu renesansu, neku obnovu."
0:37:33,0:37:41,"Pogotovo zato što nije više na njoj tolika pažnja, možda nema ni tu tako značajnu i veliku ulogu."
0:37:41,0:37:45,"ulogu kako je nekad imala, tako da se možda može posvetiti napokon sebi."
0:37:45,0:37:47,"Da, mogla bi se, što se kaže, ono recuperat."
0:37:47,0:37:48,"Da, da, da."
0:37:49,0:37:56,Mislim da je Europa ušla u neku mašinu i da ju netko kanalizira tamo gdje ju ne bi trebao kanalizirati.
0:37:57,0:37:59,"Da, trudim se biti optimist."
0:38:00,0:38:04,"Vidim da ima jako puno, ima puno contre."
0:38:04,0:38:05,Da.
0:38:05,0:38:11,"Ima puno birokrata koji su onako sivi, bezlični i tako dalje, uvode sve to."
0:38:11,0:38:12,"Nedvosmisleni, nedorečeni."
0:38:13,0:38:23,"Ali ima puno contre i ima puno alternativnih smjerova i razmišljanja., i puno tih stvari, tako da se uvijek uzdam u to."
0:38:24,0:38:25,I vidim da nisu zanemarivi.
0:38:26,0:38:30,"Nisu to neki sad već više beznačajni pokreti, itd."
0:38:32,0:38:32,Pa onako.
0:38:33,0:38:35,Imam optimisticam po tom pitanju.
0:38:35,0:38:37,Samo treba vremena u svemu.
0:38:38,0:38:45,"Tako i kod nas isto kažu da jedna određena stranka, neću sad reći koja, ali kažu neće nikad se skinuti s vlasti."
0:38:45,0:38:55,"Kaže jedna starija žena, na primjer, meni je, nema šansi, ona će živjeti još 5-6 godina, ali ona meni tvrdi da će još 20 godina biti ista stvarna na vlasti."
0:38:57,0:38:58,"Ja ako će to biti, onda."
0:39:39,0:39:40,"Da, normalni neeri."
0:39:40,0:39:44,"Da on ovaj ne može još odrediti, je li on muškar žensku?"
0:39:44,0:39:45,U 20.
0:39:45,0:39:46,nekoj godini.
0:39:46,0:39:46,A daj mu vremena.
0:39:47,0:39:49,"Da, daj mu malo vremena."
0:39:50,0:39:52,Normalno je da je on postalno favoritički.
0:39:52,0:39:54,"Aha, pa da, to je sad ono isto košta nešto."
0:39:55,0:39:56,Nekom optimističan kod ti.
0:39:56,0:39:56,Ja ne znam.
0:39:56,0:39:57,Možda znači da sam star.
0:39:57,0:40:00,"Ima, evo, ja na primjer opet nalazim optimizmom."
0:40:00,0:40:01,"Tonac, jer ti znaš šta si ti?"
0:40:03,0:40:03,On je to onac.
0:40:05,0:40:05,On je to onac.
0:40:06,0:40:07,Ne bi me je uvjerio.
0:40:08,0:40:09,"Da, ja imam."
0:40:10,0:40:14,"On ne zna, on ne može još odrediti sam sa sobom šta je."
0:40:14,0:40:16,"Odredit će on, ima vremena, ali."
0:40:16,0:40:21,"Ali ja uvijek nađem optimizam, negdje ili se trudim naći optimizam."
0:40:22,0:40:26,"Na primjer, evo naš predstavnik, iskreno nisam čuo pjesmu."
0:40:26,0:40:27,"Ma ja plati to, ali."
0:40:28,0:40:29,"Čim bih digla, bi bi bi bio."
0:40:30,0:40:34,"Ali želim vam uspeh, naš je naš i ja sam čuo da je stvarno favorit."
0:40:34,0:40:36,Ja sam išao do toga na neke fake stranice.
0:40:36,0:40:37,"Ne, bio je do danas."
0:40:37,0:40:38,Ali stvarno je favorit.
0:40:39,0:40:39,Bio je do danas.
0:40:41,0:40:53,"Mislim, to je jedna pjesma koja po meni i koliko sam čuo, neke onako rubno sam čuo, možda ima neke dosta šanse da izgura visoko mjesto."
0:40:54,0:40:57,"Ali evo, na primjer, izjavljuje tu otvoreno da je katolik, da je vjernik."
0:40:58,0:41:00,"Da ne mislim, ne znam, ne znam, ne znam."
0:41:00,0:41:05,"Da, evo, opet je to neka mala kapljica neke, neke neke neke neke mlade postaje."
0:41:06,0:41:12,"Onda mu je tu svaka čas, da je on rekao da je pravoslavac, bilo što je bilo, ali da je on onda tu propao."
0:41:12,0:41:19,"Osamljene je, ne znam, ne znam, ne znam, ne znam, ne znam, ne znam, ne znam, ne znam, ne znam."
0:41:20,0:41:34,"Ali to je možda ta moja, odnosno ta opća društvena situacija da imamo uvijek, kad zamišljamo crkvu ili bilo koga u njoj, oni uvijek zamišljamo četiri i pol bakice, a meni je stipula."
0:41:34,0:41:35,"Znači, minosti puno dalje."
0:41:35,0:41:36,"Tako dalje, tako dalje."
0:41:37,0:41:39,"A evo, ima tu mladih ljudi, ima ludila."
0:41:40,0:41:42,"Ništa, završit ćemo optimistički."
0:41:42,0:41:43,Boris je optimističan.
0:41:43,0:41:44,"Mora, mora optimizam."
0:41:44,0:41:44,Samo.
0:41:45,0:41:48,Nastavite dalje punom parom pod nekog sljedećeg podkast.
0:41:48,0:41:51,"Da, i pozorni ste na kad bude predstavljanje knjige."
0:41:56,0:41:57,Ako neće biti tvrdi uvjeze.
0:41:57,0:41:58,Meki oblik.
0:41:58,0:41:59,Onda dva put meki.
0:41:59,0:42:00,"Ajde, dva put."
0:42:00,0:42:01,Meki i meki da.
0:42:01,0:42:02,"Ajde, ajde."
0:42:02,0:42:03,Ali samo jedan potpis.
0:42:05,0:42:07,Boris je na drugom srtiču.
0:42:07,0:42:07,Tako je.
0:42:08,0:42:08,"Može, eto."
0:42:09,0:42:10,"Ništa, Boris."
0:42:10,0:42:10,Hvala ti.
0:42:10,0:42:13,Baš je bilo lijepo ugodno da neko optimističko dođe ovamo.
0:42:14,0:42:15,Hvala što ste me pozvali.
0:42:16,0:42:16,Majki drugi put.
0:42:16,0:42:17,"Ekipa, ništa, ono."
0:42:18,0:42:19,"Hvala, like, subscribe."
0:42:20,0:42:21,Pratite i Borisa.
0:42:22,0:42:22,Vidimo se.
0:42:23,0:42:23,I
