Start (HH:MM:SS),End (HH:MM:SS),Segment
0:00:28,0:00:30,"Ekipa pozdrav, dobrodošli u čušpaj 13."
0:00:31,0:00:33,"Nismo sve uvjerni, idemo dalje."
0:00:34,0:00:46,"Današnji gost je naš uvođenin Boris etić koji sam kaže da nije uopće poznat širokoj javnosti, ali ja ga privatno poznam i znam da je ovako dosta aktivan u nekakvim sličicama, klubovima, udrugama, udruženjima."
0:00:47,0:00:56,"Pa evo, kad smo se dogovarali za ovaj početak, razgovor kako bi ga najavio, pa je Bori sam rekao, pa slobodno me najavi kao tajnik Književnog kruga Karloca."
0:00:56,0:01:01,Pa onda najbolje da i Bori sam kaže nešto više o tom Književnom klubu.
0:01:01,0:01:10,"Da nije baš neka titula onako visoka, ali ajde, jedina institucionalna onako forma kako se mogu predstaviti."
0:01:12,0:01:26,"Pa u principu tajnik sam već evo u tom Književnom krugu, to je udruga jedna od najstarijih u Karlovcu koja se bavi književnošću, fokusirana je i orijentirana baš na Karlovac i na karlovačke autore."
0:01:26,0:01:40,"Tu sam već u drugom mandatu i tako da uz predsjednika Damira Valenta, Dadu koji je i književnik i novinar i njega šira javnost zna naprimjer on je onako."
0:01:43,0:01:44,Pozdrav predsjedniče.
0:01:46,0:01:46,Ne moramo slušati.
0:01:46,0:01:47,Pa naravno.
0:01:49,0:01:58,"Tako da tu sam već dva mandata i eto tako, tu sam najaktivniji i nekako sam od svih stvari možda dosta posvećen."
0:01:59,0:01:59,tome.
0:02:00,0:02:01,Koliko imate članova?
0:02:01,0:02:03,"Ha, ne znam, imamo negdje."
0:02:04,0:02:08,"Sad, ja bi trebao taj popis ažurirati češće, ali."
0:02:10,0:02:15,"Pa, ne znam, mislim da aktivnih imamo negdje oko možda dvadesetak koji kruže."
0:02:15,0:02:17,Tu su i oni opet ležali.
0:02:17,0:02:18,A imamo te koji su stalno onako.
0:02:19,0:02:33,"Zeljko je in<|notimestamp|><|nodiarize|> Željko, Željko je inače osnivač, dakle, te daleke 97."
0:02:33,0:02:43,"godine, to je bio taj čovjek koji je te književnike ondašnji okupio za stol i uspio ih je okupiti da se ne posvađaju i napravili su udrugu."
0:02:43,0:02:45,Jel dolazi sa Vespama na sastanke ili?
0:02:46,0:02:58,"Ne, ne dolazi jer najčešće su sastanci otvorenog tipa u knjižnici i tako budući da čovjek tamo radi onda on samo spusti se s posla ovaj kad završi smjenu pa smo mi tamo."
0:02:59,0:03:06,Ali inače on je ovaj zaslužan za sve i da nema njegove onako upornosti toga to bi se već.
0:03:07,0:03:17,"Ma gledam, uvijek ti je jedan, dva do maksimalno tri u bilo kojoj udruzi koji povuku, ostali su tu za slikanje, a koji ima koji dominijenak to je tako."
0:03:17,0:03:24,"To znam ja jer u principu je jako mislim književni krug je udruga, dakle nekako pravno formalno to je udruga."
0:03:27,0:03:39,A tajnik udruzi s tim administrativom i sa svim tim stvarima onda tu baš treba zapest ako je neki posao onako konkretan.
0:03:40,0:03:42,Tajnik svake udruge ti je nešto kao tipa Joža Manolić.
0:03:43,0:03:43,Tako je da.
0:03:43,0:03:44,Znači toksično.
0:03:45,0:03:46,To je jako opasna fikcija.
0:03:48,0:03:56,"Osim što znamo ovako privatno svi vi nešto pišete članke, knjige, knjige, čim još onako vaša aktivnost se svodi u to da imamo i organiziranje nekih književnih večeri."
0:03:57,0:04:05,"Imamo, imali smo književne večeri, ima tu i natječaj koji je ovo baš jučer, odnosno prekjučer koji je šta je danas, drugi?"
0:04:05,0:04:06,Danas je drugi.
0:04:06,0:04:08,"Drugi, drugi april."
0:04:09,0:04:17,"Da, od prvog, znači već dvadeset godina isto ide taj natječaj Zlatko Tomić, to je natječaj za kratku priču."
0:04:17,0:04:34,"On već onako ima dugu, dugu istu tradiciju, dosta je poznat, tu bude onda od prijavljenih radova od 60 do 160 i ono prema 200 nekad bude, tako da i budu i kvalitetni, književnici se isto prijavljuju i tako."
0:04:34,0:04:37,To je naprimjer ona jedna najveća stvar koja je najduža tu.
0:04:38,0:05:12,"A onda kasnije ima i to čitanja, književnici čitaju u svom gradu, to je bilo u nekoliko navrata organizirano, sudjelovali su, ja konkretno nisam na tim čitanjima bio, nisam mogao, ali članovi inače sudjeluju i u zvjezdanom ljetu, isto postoje ta čitanja i na adventu u Karlovcu čitanja, tako da ima tu dosta tih aktivnosti, stalno su to neki projekti, stalno je to prijavljivanje na natječaj ministarstva, na natječaj grada, a to ja pričam iz svoje perspektive."
0:05:13,0:05:16,jer to je meni onako zadatak.
0:05:17,0:05:20,To je u kulturi inače malo.
0:05:20,0:05:21,Jako težak.
0:05:21,0:05:34,"Ja sam naprimjer bio zatečen kad sam trebao prvi put, nakon ne znam koliko godina, nam je obrt računovodstvenik koji je vodio knjige, žene otišlo u mirovinu."
0:05:35,0:05:40,"Mi smo se zatekli tu da nismo više stigli jer je trebalo predati financijski izveštaj, naravno."
0:05:40,0:05:52,"Tako da sam ja onda trebao tražiti hitno da se sredi taj financijski izveštaj za cijelu godinu prošlu i na kraju je spalo na mene, ja moram napraviti."
0:05:52,0:05:54,financijski izvještaj.
0:05:54,0:06:05,"I to kad ti padne u ruke, to nije ni malo ugodno ni lako, ali u dva dana dobiš sjede, ali napraviš."
0:06:05,0:06:09,"A i inače više kod nas nemaš, znaš, ni knjigovođa ni keramičar, ni čega više nemaš."
0:06:09,0:06:12,"Ne, nema na poštu, ali doći će na palac, na vikend."
0:06:12,0:06:14,"Da, nekom će zamjeriti."
0:06:15,0:06:17,"Ali, gledaj, ja vam kapu skidam."
0:06:17,0:06:19,"Gledaj, ovo je danas doba kad se sve manje i manje čita."
0:06:20,0:06:20,"Da, to je istina."
0:06:20,0:06:22,Vi ste kao neki onda vas je zvono.
0:06:22,0:06:24,"Pa neću namjerno reći posljednji samuraj, ali."
0:06:24,0:06:26,"Znači, književni samuraj."
0:06:27,0:06:27,Književni samuraj.
0:06:28,0:06:35,"Da, ali mene znaš, znaš da samuraj se vrtio tamo isto uz neku knjigu, knjižicu, da li je prolista, da li je čitao?"
0:06:36,0:06:38,To je dosta i danas je to.
0:06:39,0:06:43,"Da, borba je velika po tom pitanju, dosta."
0:06:44,0:06:54,"Ja bih rekao da su to druidi, možda smo onako druidi nositelji nekog starog znanja, knjiga, ne tablet, ne ekran, ne nešto drugo nego baš knjiga."
0:06:55,0:06:58,"Buduće ima, jel knjiga je sad poseban artefakt."
0:06:58,0:07:01,Ja bih danas priznao da čitaju i na tabletu samo čitaju.
0:07:01,0:07:19,"Da, čitanje, čitanje je stvarno važno i pada, postoji ta teorija da jednostavno ljudi sve manje i manje čitaju, meni je žao, ja imam na naprimjer jedno razmatranje da se danas pojavljuje jedna dosta tužna stvar, a to je da možda imamo faktičku nepismenost."
0:07:20,0:07:38,"Dakle, nije to što čovjek zna sebe potpisati, ima i prezime i da zna pročitati neki naslov ili nešto, ali kad bi mu dao da pročita stranicu teksta, neku ili ono, ne da je bože da mu daš nekakvu knjigu onda joj, ne, ne, ne, ja to neću."
0:07:38,0:07:41,"Što ste mi rekli, oni su otvorili, dobro, velika su slova."
0:07:41,0:07:43,"Da, velika su slova."
0:07:43,0:07:48,"Ne, ne smije biti, dakle uvijek se gleda na debljinu knjige, uvijek se gleda na."
0:07:49,0:07:50,"Na fond slova, to je isto."
0:07:51,0:07:52,A ne svi ljudi u pokoricama.
0:07:52,0:07:57,"Ali kažu, neki ljudi stvarno ne mogu, dakle oni nemaju tu volju."
0:07:57,0:07:59,Tako da su faktički nepišteni.
0:07:59,0:08:04,"Da, to je sad, mislim, Boris stvar, znaš i ove tehnologije, ovih aplikacija i ovoga."
0:08:04,0:08:12,"Ja sam ti čuo neki jedan dobar izraz, da je TikTok i YouTube za ljude sa ADHD poremećajem."
0:08:12,0:08:13,"Da, dobra aktualacija."
0:08:14,0:08:17,"Da, tako su ovaj, bojim se i knjige počele biti, znaš."
0:08:18,0:08:20,Svi su sad krenuli samo skrolanje.
0:08:21,0:08:25,"Da, opasnost da se smanjuje, maksimalno pet, da se smanji na tri."
0:08:25,0:08:28,"Pa ja se sjećam, mislim, ja sam 97.-og godište, ali."
0:08:30,0:08:30,"Bože, šta je mlađe."
0:08:31,0:08:32,"Bože, da."
0:08:33,0:08:36,"Znači, književni krug su osnovali kad si ti rođen."
0:08:36,0:08:36,"Tako je, da."
0:08:36,0:08:37,Imaš beneficije za to.
0:08:37,0:08:38,Točno tu negdje.
0:08:39,0:08:40,"Da, dva možda."
0:08:40,0:08:41,"Da, da, da."
0:08:43,0:08:45,Imam tu situaciju.
0:08:45,0:08:52,"Naprimjer, dosta kasno sam Facebook instalirao."
0:08:52,0:08:53,Počeo koristiti.
0:08:53,0:08:54,Počeo koristiti.
0:08:56,0:09:05,"Ali, na primjer, sad je Facebook, mislim, prastara aplikacija koju zapravo onako samo stariji koriste."
0:09:05,0:09:05,Mladi.
0:09:06,0:09:17,"Da, čak je i Instagram napravio ono što Facebook nije imao, statuse pismene, odnosno pisane statuse."
0:09:18,0:09:29,"Instagram se maknuo od toga prema slici, samo prema vizualu, a TikTok je čak i taj vizual uspio formulirati na tu jako opasnu razinu."
0:09:30,0:09:30,Reku bi.
0:09:31,0:09:32,"TikTok je zaznat, ja i drugi."
0:09:32,0:09:35,Pa čak i vi vi vi znate što je.
0:09:35,0:09:38,"Ja ne, ja nemam još i to mi je nekako."
0:09:38,0:09:40,"Ako duže budete, evo i političari su popustili."
0:09:40,0:09:50,"A vidim da, vidim da, svako svijetu pitaju za dopuštenje djecu svoju, jel smiju instalirati, a što je sad fora, ali ja mislim da još neko vrijeme."
0:09:50,0:09:51,"Da, djeca i blokiraju."
0:09:52,0:09:53,"Da, da, djeca blokiraju."
0:09:53,0:10:12,"Pa ne, to je jako se smanjuje nažalost, ali ima još ljudi koji čitaju i ono što je još bitnije, ima mladih ljudi koji čitaju i to čitaju jako ozbiljno, jako puno, jako intenzivno, jako duboko, jako dobre knjige, tako da nije sve tako crno."
0:10:13,0:10:17,Možda da se orijentiramo na kvalitetu prije nego na kvantitetu.
0:10:17,0:10:20,"Na uveda pijemo, malo pijemo dobro, uvijek je to vrijedilo."
0:10:21,0:10:24,"Dakle, posustat nećete, to je dobro."
0:10:24,0:10:26,"Ne odustaje od toga, nema kapitulacije."
0:10:26,0:10:33,"Osim što si tajnik, znam i za tebe privatno da ti i pišeš članke za neke časopise, neke portale."
0:10:33,0:10:35,Kako je moguće da su neki književni osvati?
0:10:35,0:10:37,Pa najčešće su književni osvati.
0:10:41,0:10:50,Zadnje je čak bio jedan osvrt na pjesništvo Viteza Željka Reinera.
0:10:51,0:10:58,"Ovo je ono specifično, jedna od njegovo stvarala, što je tako pjesništvo."
0:10:58,0:11:00,Pa sam se malo odlučio da pjesmom pišeš.
0:11:00,0:11:02,"Da, on je i akademik."
0:11:03,0:11:08,"Mislim, nije on tako banalan čovjek, dosta nespretno to što je postao vitez u 60."
0:11:09,0:11:10,nekoj godini.
0:11:11,0:11:17,"Ali, inače piše pjesme i mogu reći da to čak i nisu tako nekvalitetne pjesme."
0:11:18,0:11:21,Ne bi rekli da je Vitez Rajner takav pjesnik.
0:11:21,0:11:21,"Da, nisam."
0:11:22,0:11:24,"Ali ima, ima onda dobre pjesme."
0:11:24,0:11:29,Čak su u nekoj antologijama i dosta jedna pohvala.
0:11:29,0:11:33,"Možda da se više bavi pjesništvom, a manje politikom, to bi mu dobro došlo."
0:11:34,0:11:35,"Ne, ne mislim."
0:11:36,0:11:37,A vi ste 16.
0:11:37,0:11:39,"potpredsjednik sabora, mislim."
0:11:40,0:11:41,"Ne znam, ali."
0:11:41,0:11:43,"Pa, ide pišem pjesme."
0:11:43,0:11:45,"Ma dobro, čovjek akademik."
0:11:45,0:11:48,"Ali dobro, to je bila zadnja, bila je na heretici."
0:11:48,0:11:50,"Da, to je portal jedan koji vode mladi."
0:11:52,0:11:56,"Mladi koji možda nisu tako mainstream, ajmo to tako reći."
0:11:56,0:11:58,Imaju neke malo drugačije.
0:12:00,0:12:01,"Old school, možda."
0:12:01,0:12:02,"Da, možemo reći old school."
0:12:03,0:12:07,"Tradicionalno malo gledaju na drugačiji način, klasičnije na svijet."
0:12:08,0:12:08,"Tako, ovako."
0:12:08,0:12:16,"Ovo kad si spomenuo mainstream, mainstream mediji i sve neke stvari su baš i uzrok što se ovakvi podcasti razno razne počeli pojavljivati."
0:12:17,0:12:18,"Da, pa to je dobar stav."
0:12:19,0:12:21,"Ne računam to, naš podcast on je radio."
0:12:21,0:12:24,"Da je statistička pogreška, ali ima ozbiljnih podcasta."
0:12:25,0:12:31,"I mene kad je nešto zanimalo išlo gledati podcaste, bilo hrvatske, bilo srpske, bilo strane."
0:12:32,0:12:36,"Tu se kaže da će zapravo internet kao takav srušiti, na primjer, jednu televiziju."
0:12:38,0:12:43,"Konkretno da će YouTube, na primjer, imati kapacitete da već sruši na dobru televiziju."
0:12:43,0:12:51,"Jer mislim, znamo svi taj obrazac, dakle, podcast je, odnosno, videi na internetu su općenito podložni prematavanju i time."
0:12:51,0:12:55,"Tempiraš i vrijeme kad ga hoćeš gledati, kako ga možeš brzo slušati."
0:12:57,0:13:05,"Neće ti više Plenković govoriti sporo, nego možeš ga ubrzati na na dva, tri, četiri, šest mjeseci, nešto više od toga, ti si mlad, znaš, kao neko od određenih ljudi."
0:13:05,0:13:10,"Aha, znam za to, znam za to, ali ne znam za to, ubrzaš ga."
0:13:11,0:13:13,Tu je internet jednostavno prednost.
0:13:14,0:13:18,"I dobro da postoji, da se razvija ovaj isto podcast kao nekako alternativa."
0:13:19,0:13:20,"Ja, vjerujem mi je."
0:13:20,0:13:27,"Da, i ako ne bi izašao u Ostrov, ti bi napomenuo, uskoro i knjigu završavaš svoju, to je prva knjiga."
0:13:28,0:13:38,"To je prva knjiga, prvo nešto ukoričeno, prve moje misli da ih je neko stavio u korice i da je lijepo to sve uvezao."
0:13:39,0:14:18,"Da, ići će prva, ima tu ideja za valjda njih šesnaest i problem je to što pišem, skoro da pišem sve odjednom, pa je onda malo, pa onako više ih odjednom pišem onda se to uvijek oduži, uvijek kasni itede ali ovo je jedna specifična koja je morala izaći ove godine i jednostavno sam rekao da mora izaći u ovo vrijeme jer se radi o tome da je ova godina tako specifična izborna godina, a tema je ajmo reći da je to književnost koja se bavi takvim temama, dakle društvena, politička,."
0:14:19,0:14:21,Naslov već imaš ili nećeš imati radni.
0:14:21,0:14:24,"Imam, imam, zove se, zvat će se trbuh njegove ekscelencije."
0:14:26,0:14:28,Uvijek si bio onako fino otrovan koliko trebaš.
0:14:28,0:14:29,"Malo, da, malo."
0:14:30,0:14:31,Dozirao sam to.
0:14:31,0:14:32,"Da, da, da."
0:14:32,0:14:34,"Dozirao sam to, bit će jako zanimljivo."
0:14:34,0:14:37,Oni koji budu čitali u 2024.
0:14:37,0:14:38,će definitivno.
0:14:38,0:14:40,Vladi ćemo se ograba za knjigu Tonaca.
0:14:42,0:14:44,"Možda ovako, jednu, ali."
0:14:48,0:14:50,"Možda će biti i tvrdi uvjet, ajde ću vam."
0:14:51,0:14:52,Možda ću jednu.
0:14:52,0:14:54,"Makamo sata ovaj, u da li me je stalo od početka."
0:14:54,0:14:56,"Da, obavezno tu na vidljivo mjesto."
0:14:57,0:15:07,"Još nešto, kad smo kod knjiga, kad si spomenuo da ih ideš koliko 16 pisati, s time što sam to karikiram, ali više ih odjednom radim i stalno radim na tome."
0:15:07,0:15:14,"Jednom sam s time dao neku intervju i nešto, ali poslije sam sreo par ljudi u medijima, ovako privatno."
0:15:15,0:15:17,Čita po tri četiri knjige istovremeno.
0:15:19,0:15:37,"Ja se uvijek trudim, dakle, uvijek je taj minimum imati jednu beletristiku, znači jedna književnost, lijepa riječ, a jedna uvijek gledam da bude ili struka ili nekako publicistika, dakle o nekoj temi."
0:15:37,0:15:40,"To je neki minimum, ali onda se tu uvijek nađe i više stvari."
0:15:42,0:15:48,"Ja istovremeno, jednu po jednu, uzmem si tako šareno znaš, ali jednu uzmem, pročitam pa idem dalje."
0:15:48,0:15:53,"Da, meni je problem što sam ja imao i taj fakultet koji je sad već dolazi svom nekom."
0:15:53,0:15:55,"Pravni, pravni da ne spomenemo."
0:15:56,0:15:57,"Upravni, na pravnom."
0:15:58,0:16:16,"E da budem čisto da me neko ne hvata za riječi upravni, na pravom, ali sad je to dolazi do svom kraja i onda je to bilo dosta onako teško pa se čitalo tu i do kasno u noći i tako ono zbog toga, ali nikad nisam od toga odustao i uvijek sam čitajućiitao više knjiga odjednom."
0:16:16,0:16:39,"Problem kod čitanja, konkretno ono što jako puno ljudi neće čitati naprimjer beletristiku, to sam primijetio, odnosno književnost, nego smatraju da je korisnije čitati dakle tu publicistiku ili struku koja se bavi konkretno nekim informacijama i tako, da nešto saznaju konkretno ajmo to tako reći."
0:16:40,0:16:59,"Međutim, to je jako teško apsorbirati te informacije da ti ostanu u glavi, tako da sam ja onda uveo sebi neko osobno čitateljsko pravilo koje uspijeva i svima kojima sam preporučio, svi su mi rekli da je dobro pravilo."
0:17:00,0:17:04,"Dakle, da nekako se pokuša čovjek intenzivirati po tom pitanju šta čita."
0:17:05,0:17:13,"Dakle, ako čita knjigu o ne znam Bunoviću, o Drugom svjetskom ratu, nek se angažira po tom pitanju."
0:17:13,0:17:28,"Ja naprimjer osobno kad pišem članke, onda uzmem knjige i onda znam da ako pročitam knjigu po kojoj nešto radim, zapamti ću puno više iz te knjige."
0:17:28,0:17:32,"Dakle, ako uzmem knjigu koja mi se ovako svi vidi pa kao ajde idem pročitat, ono."
0:17:32,0:17:36,ono jednostavno manje informacija ostane u glavi jel.
0:17:36,0:17:44,"Znači ako netko baš čita aktivno sa nekim razlogom i da ide nešto baš istraživat, tu će onda ostati puno više informacija."
0:17:44,0:18:15,"Ja sam ti recimo imao profesora u srednjoj školi iz književnosti koji jako inzistira da ovi dječaci čitaju, to je bilo ok, još to je bila i ona država, jel on bivša, meni to nije bio problem, ali bilo je ljudi i ovoj dečki koji to tak idu, koji i danas, on je rekao, dečki, ajmo se dogovoriti, čitajte i kaubojdske romane, ali samo čitajte i donesite mi popis koji ste počitali, bilo šta čitite, e Čovjek je bio čovjek u pravu, bolje ista nego niste."
0:18:16,0:18:17,Pa mislim.
0:18:17,0:18:26,Neka najveća istina je da onaj tko može pročitati strip kao tineđer može pročitati bilo što.
0:18:26,0:18:31,"Dakle, samo je pitanje vremena i nekog rada."
0:18:32,0:18:36,"Danas je stvar zbog svog načina života moderna, to je stvar koncentracije."
0:18:37,0:18:50,"Danas mislim da se namjerno ovaj, dobro, mi smo malo stari i možda je za nas prošlo ovo što se kaže, ovako vi mlađa generacija i ajmo reći, točno se radi da nam se koncentracija ono ajmo reći oduzme, smanji."
0:18:51,0:18:55,"Ono, možeš 5 sekundi paziti na ovo, 10 na ovo, i to je to."
0:18:55,0:18:57,"Da, to je što smo pričali za TikTok."
0:18:58,0:19:00,TikTok je prosniji svijeta i.
0:19:00,0:19:04,"Ti na TikToku, ja znam po sebi, sati i pol ti odječe, samo ovo radiš."
0:19:04,0:19:08,"Da, sati i pol, a koncentracija ti je na 4,5 sekunde."
0:19:08,0:19:10,"I vidiš, pet se tiče informacija."
0:19:11,0:19:11,Mm.
0:19:11,0:19:16,"Neke si po pamti, neke nisi, ali su one kratke i zgrobite i udaraju ono u glavu."
0:19:17,0:19:23,"Mislim, opaka je da, aplikacija i sve to je dosta opasno."
0:19:25,0:19:29,Ali ja nekako imam nadu u smislu da tehnologija se jako brzo razvija.
0:19:30,0:19:35,"Mislim, ono od kad sam ja bio mali, bile su one VHS."
0:19:36,0:19:37,SVHS kazete.
0:19:38,0:19:40,Prije su bile beta verzije i tako dalje.
0:19:40,0:19:40,"Da, da, da."
0:19:41,0:19:45,"A mislim, sad smo već preskočili CD i tako dalje."
0:19:45,0:19:49,"Tako da ono mislim, jako brzo se to sve razvija."
0:19:49,0:19:53,"Tako da, tko zna šta će biti dalje."
0:19:54,0:19:55,A ne treba nužno biti loše.
0:19:56,0:19:57,"Ne mora da, ne."
0:19:59,0:20:00,Stalna je neka promjena.
0:20:00,0:20:04,"Ne možemo reći kao, e, sad je nešto nastupilo i do kraja našeg života će biti to."
0:20:04,0:20:05,Morat ćemo to gledati do kraja života.
0:20:06,0:20:06,Barem ne možemo to ništa.
0:20:07,0:20:09,"Uvijek je bilo u povijesti, dobro, loše samo gledati."
0:20:09,0:20:10,"Loše je samo, gleda da pamtimo samo loše stvari."
0:20:10,0:20:14,"I spaljivanje vještica, pamtimo kugu i koleru, pa pamtimo."
0:20:14,0:20:17,"Da, da, da, to je pamtimo ono, danas šta pamtimo, kužiš."
0:20:19,0:20:23,Ali neki potihamo što je da se namjerno ta količina loših vijesti pušta.
0:20:24,0:20:26,"Naravno, da ste nekada zvala plašilica."
0:20:27,0:20:27,Plašilica.
0:20:27,0:20:29,To si na poslu i rekao je kurirnik Boris.
0:20:30,0:20:32,Danas idemo sa plašilicom i onda si nešto.
0:20:33,0:20:33,"Da, da, da."
0:20:36,0:20:41,"To ćemo moći istraživati vjerojatno kad malo prođe vrijeme, vjerojatno i sa COVID-om itd."
0:20:42,0:20:43,Ovo je posljedna priča.
0:20:44,0:20:45,"Da, to će svega biti još ne znam."
0:20:46,0:21:30,"Evo, jedan naš gumac, baš sam gledal jedan podcast u odnosu na taj neki stari obrazac."
0:21:30,0:21:45,"Jer čak bi rekao da neki institut neovisnih novinara koji se predstavljaju uvijek neovisni portala, novina i medija svih koji su apsolutno neovisni, jednostavno mislim da to sve više i više pada."
0:21:45,0:21:48,Ti danas više nemaš istraživačkog novinara?
0:21:48,0:22:08,"Nema, da, nema i mislim kažem, novinarstvo se po meni nekako djelomično i razvijalo iz ljudi koji su imali neki stav, neki vrijednostni sustav, kasnije ideološki itede ali je onda, znači oni su pokretali te svoje prve medije, prve novine, itd."
0:22:10,0:22:12,Mislim da se to danas vraća.
0:22:13,0:22:26,"Danas nije toliko problem kad političke stranke imaju svoje glasila, kada se već u javnosti zna da je nečiji medij glasilo nekoga ili nešto."
0:22:27,0:22:30,Sportsko-klubno ili nešto drugo.
0:22:30,0:22:44,"Mislim da će to s vremenom postati prihvatljivo i da će se to jednostavno, po meni možda i razvijeti bolje novinarstvo jer nema tog uvjetno rečeno lažnog predstavljanja."
0:22:45,0:22:49,"opće objektivnosti, opće nepristranosti, itd."
0:22:49,0:22:55,"Jer kao čovjek, a najviše kao intelektualac, teško je biti pristran u puno tih stvari."
0:22:56,0:22:57,"Odnosno, nepristran u puno tih stvari."
0:22:58,0:22:58,Da.
0:22:58,0:22:58,To je.
0:22:59,0:23:01,"Pa, vidiš, nas, uzeli smo mobice i dva mikrofona."
0:23:02,0:23:06,"Pa, da, ovo je prije kri<|notimestamp|><|nodiarize|> Vi se još uvijek, vi se još uvijek pravite nepristrani."
0:23:07,0:23:07,"Pa, navodno."
0:23:08,0:23:08,Navodno.
0:23:09,0:23:10,Mi smo nepristrani.
0:23:10,0:23:12,"Imamo mi svoje stavove, principe."
0:23:13,0:23:15,"A evo, ovdje je rekao i naš konac, vidi ga."
0:23:15,0:23:18,"Ovo je gost ovih pet minuta, pričeš što hoćeš."
0:23:18,0:23:19,I tu je bio čovjek u pravu.
0:23:19,0:23:21,"Da, tu je bio čovjek u pravu."
0:23:21,0:23:23,"Je da, to je dobro."
0:23:23,0:23:53,"Dobro, osim što si knjižarnik, što ćeš biti upravni pravnik, kako si rekao šta ćeš biti, vidio sam malo na društvenim mrežama, ti si i aktivan u zajednici mladih katolika, to sam malo, nisam duboko u to išao, pa evo da pojasniš malo, pa ima jedna stvar, ovo je doba kad je moje osobno kršćanstvo malo u krizi, možda sad pretečku riječ, rekao ugroženo, ali u krizi, u Hrvatskoj još možda i ne toliko."
0:23:54,0:24:27,"Pa ne da mi smo malo šta kažu konzervativnije društvo navodno, ali stvar je u tome da Ja naprimjer do prije nekih hajmo reći malo više od deset godina nisam bio ni svjestan da u Karlovcu ima jedno ogromno nacionalno svetište, dakle veliko nacionalno svetište koje može primiti ne znam koliko ono, tisuće ljudi ovaj i tako da preko nekih prijateljstava sam u to hajmo reći upao."
0:24:28,0:24:35,"Ovaj jednostavno, tak negdje od kraja srednje škole sam aktivan u toj zajednici mladih katolika."
0:24:35,0:25:06,"U početku, ako neki tineđer misliš kao to su neki čudni ljudi, oni se mole prije obroka i na što su onako bile neke predrasude, onda saznaš da su to najnormalniji ljudi, oni su super zanimljivi, bave se, igraju nogomet, idu na Roštilje, sve radi normalno, tako da sam tu u principu upoznao tu zajednicu mladih i ubacio sam se u to, tu ima puno aktivnosti."
0:25:06,0:25:13,"Onda su me gurnuli u glumu, jer imao tamo dvoranu jednu cijelu koja je zanimljivija od Zorin doma naprimjer."
0:25:14,0:25:18,Igra ima veći kapacitet od Zorin doma što se publike tiče.
0:25:18,0:25:39,"Tu smo mi radili te svoje predstav predstave radili smo stvarno masu tih stvari, onda su tu otkrili da ja znam glumiti, da nemam takvu tremu i da nisam onako povučen i nikakav na pozornici, pa onda su me na sve moguće predstave zvali i za to, tako da smo onda s tim krenuli."
0:25:40,0:26:01,"I u principu da, tu su isto te more tih aktivnosti od čitateljskog kluba isto koji postoji tamo od volonterskih akcija svake godine, sedamdeset dva sata to je jedna velika nacionalna volonterska priča koju isto oni tu organiziraju već mislim da ne znam koju godinu, viš reda."
0:26:01,0:26:03,"Kad te neko bude slušao, valjda će."
0:26:04,0:26:05,"Da, valjda će neko."
0:26:05,0:26:07,"Reći će, gled, mali je klečovac."
0:26:08,0:26:11,"E, da, bit će možda i tako."
0:26:11,0:26:12,"Daj, daj, tebe pitaj."
0:26:12,0:26:13,Šta ti biće stvarno ono?
0:26:13,0:26:16,"Klečovac i oni ljudi, kako se oni kontra zovu."
0:26:17,0:26:18,Kontra klečovac.
0:26:19,0:26:21,"Da, ima revolucije."
0:26:21,0:26:24,"Kontra revolucije, onda imaju klečovac i kontra klečovac."
0:26:24,0:26:28,"Jer ja, ja sam vjernik, ali ne bih išao klečovac."
0:26:28,0:26:29,"Da, ne bih išao klečovac."
0:26:29,0:26:31,"Ja bih to na neki drugi način, možda."
0:26:31,0:26:35,"Ali, moga mi ne bi išli iz bubnjevima ako neko kleči tamo i staja znalaz."
0:26:35,0:26:37,"A, naravno, da, vi ste to je."
0:26:37,0:26:39,"Pazi, sad dođem ja iz bubbnjem ili klečim?"
0:26:39,0:26:40,"Da, ili ne."
0:26:41,0:26:43,"Evo, zanima me neko tvoje mišljenje."
0:26:43,0:26:48,"Da, ali to je fora, znaš, ne moraš ne znaš ne moraš ne znaš ne možeš ne znati svirati bubnjeve, a možeš doći prostor."
0:26:49,0:26:50,Tu ona cijani ne može mući klečat.
0:26:52,0:26:54,"Tu ona cijani ne može mući klečat, jer ćemo."
0:26:54,0:26:56,"Aha, teško se ustati."
0:26:56,0:26:59,"Tu baštom ne možeš nositi, znaš?"
0:27:00,0:27:00,Isto ovo.
0:27:01,0:27:02,"Ne, ne, strada u koljena."
0:27:02,0:27:03,Majda.
