Start (HH:MM:SS),End (HH:MM:SS),Segment
0:57:01,0:57:28,"Dakle, on sada milijuni odlaze kao i nekad na privatne tvrtke i privatna savjetovanja i nove projekte itede itede a baš je pripuz mu je bio uvijek u ustima jel da on ga sad šopa sa milijunima, znači onoliko koliko mu je dao Tomašević u pet godina, Bandić mu nije ni blizu u dvadeset u količini novca."
0:57:29,0:57:49,"Ja sam s pripuzom bio na sudu, imao sam tri procesa, baš na temu toga što sam objavio javno prvi podatke o cijenama koje je Bandić ugovorio s njim i o nekim stvarima i to sam komentirao kao političar i iznosio činjenice i papire, dokumente, uvijek, uvijek papir, dokument, dokaz."
0:57:51,0:58:08,I onda je priput tražio uvijek da sud zatraži od Grada Zagreba kako sad stvari stoje jer je znao da kad je došao taj izvještaj da ću se ja šokirati koliko je sad to novca koje odlazi opet toj istoj tvrtki.
0:58:09,0:58:17,Samo sada evo kao što bi neki rekli evo kad naši rade greške ili ne znam to onda kao to trebamo prešutjeti.
0:58:17,0:58:21,"Evo ne, ja nisam i neću jer je rekao da neće tako."
0:58:22,0:58:28,"Dakle on se okrenuo, on se promijenio strahovito taj čovjek u trenutku kad je postao gradonačelnik."
0:58:29,0:58:32,Tolike stvari koje je rekao da će raditi radi ih suprotnima.
0:58:33,0:58:42,"On naravno uvijek ima pomaka nekih, ima i dobrih određenih stvari, ali nevjerojatno da su te stvari koje sam ja sad rekao što bi radio."
0:58:44,0:59:06,"Definitivno ogroman problem Grada Zagreba je po pitanju prometa, naručio bi studiju, prometnu studiju koja obuhvaća i cijelu okolicu Zagreba i okolne županije jer to ne možeš razdvojiti jel i da se ide u tom smjeru i kažem neprihvatljivo mi je da u gradu Zagrebu ljudi nisu spojeni na gradski vodovod ili na gradsku kanalizaciju."
0:59:07,0:59:18,U četiri četvrtine gradske od Podsljemena do ovdje juga prema Lučkom ima nekoliko naselja bez kanalizacije i neki koji su na lokalnim vodovodima nisu na gradskoj vodi.
0:59:18,0:59:29,"Pa mislim to su osnovne, osnove civilizacije a da ne kažem dvadeset jedan stoljeća već smo sad ono dvadeset pet godina i da to još uvijek nije riješeno i da to nikome nije važno i da nije prioritet."
0:59:30,0:59:30,Da.
0:59:31,0:59:32,I gost bira rubriku.
0:59:32,0:59:33,"Renato, izvolite."
0:59:34,1:00:00,"Gost bira rubriku, evo ja sam i kao otac djeteta s teškoćama, to sam i govorio javno jer sam i angažiran kroz razne udruge nekako djelovao da mi to bude jedna od tema i pokušavao sam i kod Bandića i kod Tomaševića napraviti određene pomake sa prijedlozima jer naravno ti prijedlozi, evo teško se čitaju u novinama jer kad netko ima baš konkretan"
1:00:00,1:00:04,"neki prijedlog, on dobije pet lajkova što bi se reklo, ne."
1:00:04,1:00:08,"Ako se s nekim posvađaš, dobiješ petsto nažalost."
1:00:09,1:00:14,"Tako da brojni moji prijedlozi, dio njih se odnosio baš i na ovu temu, osobe s invaliditetom."
1:00:15,1:00:31,"U Gradu Zagrebu i u Hrvatskoj ima veliki broj osoba s invaliditetom koji su, nisu sad samo branitelji, nego su i oni koji su za vrijeme rada do, dobili invaliditet, ne, ili oni koji imaju rođenjem."
1:00:32,1:00:39,"Ta naša, naš sustav zdravstva, otkrivanje nekih i dijagnostika, je bolja nego prije."
1:00:40,1:01:00,"Tako da imamo jako puno osoba takozvani nevidljivog invaliditeta naprimjer, ne s autizmom i imamo jako puno odraslih koji se dijagnosticiraju, koji su imali, a da to ni prije nije bilo dijagnosticirano ili si kod dječaka naprimjer dio njih je dobio dijagnozu ADHD-a."
1:01:01,1:01:07,I to su recimo neke stvari koje mislim da država i gradovi sve trebaju posebno paziti i štititi.
1:01:07,1:01:10,"I vidim da u nekim gradovima je to bolje, u nekima je lošije."
1:01:10,1:01:26,"Na razini države rekli smo već uveden inkluzivni dodatak od strane Plenkovića i to je jedan dobar potez i tu je su povećana i financijska prava i on je baš priznao pošto nema dovoljno logopeda i svih koji trebaju, pogotovo za djecu."
1:01:26,1:01:29,"Evo vama više novca kad već idete kod privatnika, ne?"
1:01:30,1:01:45,"Recimo to je jedna dobra stvar koja je bila, oka, predizborno uvedena lani, ali super, mislim, oka, sad i postoji problem sa provedbom, postoji kritika da se ne rješavaju na vrijeme zahtjevi i to sve skupa, ali recimo to je sigurno jedan dobar pomak."
1:01:46,1:02:00,"I to sam, kažem to mi je ono izuzetno važna tema gdje sam koristio to što sam bio zastupnik, a i danas kroz udruge nastavljam da se zapravo pobrinemo za te ranjive skupine."
1:02:01,1:02:03,I mislim da trebamo biti posebno osjetljivi.
1:02:04,1:02:16,"Mi ne moramo svima subvencionirati vodu, odvoz smeća ili ne znam cijenu električne energije, ali moramo znati po kojim kriterijima ćemo pomoći onima kojima se to stvarno treba."
1:02:18,1:02:24,Jer ovako će nam se ne znam provući kroz u te kategorije neki koji možda to ne zaslužuju.
1:02:24,1:03:30,"Tako da sustav treba biti kvalitetan, ali mislim da ta humanost se treba jako njegovati, ne samo u politici nego u društvu i treba i trebamo paziti kažem i pogotovo na tu djecu i na te obitelji jer ih je takvih jako puno, deset do petnaest posto kako u kojem gradu stanovništva kad se uzme znači kad se uzmu sve vrste u tom paketu osoba sa invaliditetom kažem to mi je bilo uvijek pod znakom pažnje i uspio sam dobiti i Milana Bandića ili Tomislava Tomaševića da se pridruže nekakvim inicijativama i nekim akcijama netko je to napravio i poslije djelovao bolje ja sam očekivao iskreno vezano za Tomaševića i više jer smo zajedno radili neke teme dok smo bili u oporbi, on ih nije proveo do kraja u Gradu Zagrebu, a Grad Zagreb bi trebao prednjačiti ipak po bogatstvu da tako kažem financijskom, biti lider u Hrvatskoj i pokazati ono nekakve napretke."
1:03:31,1:03:36,Po tom pitanju to se danas zove službeni nadstandardi koji postoje.
1:03:36,1:03:47,"I sad tu imamo definitivno neke gradove koji prednjače, koji imaju, prate bolje trendove, kako da kažem."
1:03:48,1:05:15,"Ali općenito da malo proširim mrvicu na djecu i na obitelji i za opstanak ove države bi bilo bitno da postoji posebna briga i da sad proširimo ovaj segment i na demografiju mrvicu da se ono pozabavimo budućnošću i da stvarno gledamo i političari i svi drugi koji utječu medijski da gledamo kako potez će se reflektirati na pedeset petnaest godina i da gledamo gdje bi željeli biti za pedeset ili petnaest godina u nekom gradu u nekoj državi kako da to bolje funkcionira da iskoristimo taj smjer u kojem smo krenuli i ovo što smo pričali od samostalnosti prošlo trideset pet godina još neke stvari nisu dovoljno sazrele ali da to društvo bude sve bolje i bolje i da svatko pronađe nekakvo mjesto u njemu to ti je moje mi nemamo strategije u ničemu pa tako ni u tome ili čak imamo strategije ali onda se ne provode naprimjer jedna od mojih prijedloga je bio centar za inkluzivno obrazovanje i bandeć kaže može idemo i svi dignu ruke je li ikada on rekao da ne može pa rekao je da ali dobro uglavnom, pazi sad, to je trebalo pomoć djeci da se integraju u sustav obrazovanja vrtić, predškolsko, školsko i srednje škole itede Da bi bilo bolje."
1:05:16,1:05:51,"U strategiji piše da gradovi i županije to trebaju gurati i mi donesemo odluku i tražimo od ministra obrazovanja dozvolu da se osnuje taj centar i da se tamo zaposle stručnjaci, jedan mali tim koji bi obilazio vrtiće, škole, pomagao učiteljima, a pomagao i roditeljima, znači pomagao tim tim tim timovima i dobijemo negativan odgovor od ministarstva jer to je Jer to još uvijek, iako piše u strategiji, iako piše u Ujedinjenim narodima i mi se pozivamo na sve, ne piše u jednom zakonu u Hrvatskoj."
1:05:51,1:05:53,Još ni kroz sabor nije prošlo.
1:05:54,1:05:55,Iz toga kaže ne može.
1:05:57,1:06:01,"Evo, sudarište sa birokracijom i to ubije ono čovjeka."
1:06:02,1:06:04,"Renate, hvala ti puno."
1:06:04,1:06:06,Puno hvala na pozivu.
1:06:07,1:06:08,Zona Zagreba.
1:06:08,1:06:09,Zona Zagreba.
