Start (HH:MM:SS),End (HH:MM:SS),Segment
0:00:00,0:00:02,"Ekipa dobro večer, dobrodošli i novi Čučpajs."
0:00:03,0:00:13,"Današnji gost je bivši član esdepea, bivši zastupnik u Gradskom skupštini grada Zagreba, ne znam šta još bivši, reći ću ja sam, ali budući podkastar definitivno."
0:00:13,0:00:15,Gospodine Renato Petek.
0:00:19,0:00:22,"Renato, hvala ti što si došao i dobrodošao."
0:00:22,0:00:24,"Hvala tebi na pozivu, hvala i tebi na pozivu."
0:00:24,0:00:28,"Da, podkast će biti neka budućnost, novi put uskoro."
0:00:30,0:00:44,"A proveo sam osam godina u suradnji sa esdepeom i ponešto u nekakvim, u dijelu kad sam bio nezavisni, osam godina u Gradskoj skupštini Grada Zagreba, to je bilo prekrasno i važno iskustvo meni."
0:00:45,0:01:14,"No, probao sam uvijek nekako ostati svoj i ostati neovisan u smislu da nikad nisam prihvatio plaću ili nekakve naknade da sjedim po nadzornim odborima, upravnim vijećima i slično, baš zato što sam želio doprinijeti onoliko koliko mogu sa kvalitetnom pripremom i timom ljudi koje sam i neke stekao s vremenom, a neke od prije imao kao ljude s kojima sam se mogao savjetovati, stručnjake, savjetnike i tako."
0:01:14,0:01:25,Tako da mislim da je to bilo divno i probao sam ono dati sve od sebe kad sam već imao tu priliku zapravo biti u drugom Parlamentu Hrvatskoj.
0:01:25,0:01:39,"Bio si vrlo aktivan dok si djelovao, politički vrlo aktivan, ali evo puno puta je već rečeno, napisano napustio si esdepe u onom trenutku kad je esdepe sklopio koaliciju sa Mašom."
0:01:40,0:01:40,Pa zašto?
0:01:41,0:02:54,"Da, ja sam se prije sad tripet godine odlučio ući u esdepe jer sam bio nezavisni kad sam ušao u prošlome mandatu jer sam razmišljao da je vrlo teško u gradu Zagrebu koji ima sedamnaestčetiri i dvjesto osamnaest mjestih odbora graditi neku nezavisnu priču što sam ja izvorno i bio na listama da, Kregar je bio moj prvi nekako suradnik odnosno ja njegov dvije tisuće devet godine kad je on i išao naspram esdepea tada i milana bandića koji ga je predvodio mi smo ušli u drugi krug osvojili smo mjesta u gradskoj skupštini i to je bio moj angažman u organizacijskom smislu ok bio sam prisutan na listama ali sam se do sedamnaest godine podupirao kroz angažmane neke uglavnom nezavisne zastupnike i tražio te puteve i tako sam ušao u Skupštinu isto i onda neko vrijeme nezavisan i nešto u klubu esdepeom dok je išlo, kad nije išlo jer tu je bilo i raznih turbulencija, tražio sam uvijek mogućnost djelovanja, a na način da kad je nešto dobro je dobro, kad nije da mogu reći da nije bez obzira da li je gradonačelnik Bandić ili Tomašević."
0:02:54,0:03:05,"Dakle, meni je uvijek isti sustav vrijednosti i nekako zdrav razum i neke ono normalno nešto je što bi svaki čovjek rekao ovo je dobro ili ovo nije dobro."
0:03:06,0:03:14,"I da li imam ove argumente da mogu nešto braniti, ako nemam argumente, ako gradonačelnik ne želi dati podatke, ja za to onda nisam glasao."
0:03:14,0:03:28,"A Tomašić je sakrio čuda toga u prvom mandatu, sve kad što nije želio dati sa zastupnicima, ne samo meni nego zastupnicima, ja mu nisam podržao, nisam želio ići u nešto iza čega ne mogu stajati."
0:03:28,0:03:39,"I izborio sam se i u esdepeu za nekakvu slobodu da mogu djelovati prema onom što stvarno smatram da je tako, neovisno."
0:03:40,0:04:16,"I onda je to funkcioniralo neko vrijeme, ja sam istovremeno poštivao odluke stranke, do trenutka kad su oni rekli iako je bilo drugih obećanja, Hajdaša Dončića ići ćemo sami, imat ćemo svoje ljude, borit ćemo se ponovno za jaki esdepe kad je on odustao u masu gradova da ide samostalno već da ide i za možemo ili s možemo, kao i u Karlovcu, gdje je napravljena suradnja, tako i u Zagrebu, ali gdje je esdepe odustao od bilo čega, da surađuje na način da bude dodana vrijednost i korektiv."
0:04:17,0:04:33,"Kad sam vidio da to ne ide tako, čime je donesena ta odluka, ja sam rekao hvala lijepa, bez nekakvih loših da tako kažem riječi ili nešto, sam maknuo se i vratio sam mandat stranci koja mi ga je dala."
0:04:33,0:04:41,"To je bilo pod kraj mandata, sad to nije neka veličanstvena stvar da tako kažem, ali mislim da je to nekako čisto, da je to politika čistih ruku."
0:04:42,0:04:51,"I vratio sam taj mandat i rekao sam, evo vi sad vozite dalje skupa sa njima, jer da sam ja htio, ja bih otišao tamo da sam to htio a nisam."
0:04:52,0:05:36,"Neka sam očekivao da će esdepe probat se izgraditi u neku modernu ljevicu, nešto što će nadomjestiti potrebe brojnih ljudi u Hrvatskoj, kojih smo vidjeli da ih je prije bilo puno više, koji su u ljevici našli neko utočište kako da kažem, koja je ispunjavala njihove potrebe socijalne države itede Ali recimo Plenković je u ovoj covid krizi i poslije u financijskoj krizi također strahovito puno uzeo tih tema socijalne osjetljivosti, što je država intervenirala prema poduzetnicima, obrtnicima i što je uveo inkluzivni dodatak za osobe s invaliditetom naprimjer."
0:05:36,0:06:00,"I neke stvari koje esdepe nije napravio, on im je uzeo, time što je ušao u politički centar i izgradio dosta socijalnu i snažnu državu i kao da se izgubio identitet esdepea, rijetki će danas u kafiću ili negdje se sjetiti koja je to bila neka inicijativa koja je bila jako važna nacionalno za cijelu Hrvatsku ili za barem dio ljudi koji oni ciljaju."
0:06:01,0:06:17,"Da, pa šta se dogodilo sa esdepeom mislim, glupo pitanje objasnio si jel esdepe dopustio da se stalo za to, to je bilo jedan od najstarijih parlamentarnih stranaka u Hrvatskoj, druga po veličini, u nekoliko dvadesettak godina lagano klize, klize, klize."
0:06:18,0:06:21,"Da, klize pogotovo u zagrebu je to skroz prikazano i uz klimu."
0:06:22,0:06:27,"Oka, ali ne znam je li u Karlovcu imao vlast esdepe ovdje je bilo da je sutra hadeze od 2001."
0:06:27,0:06:28,do 2004.
0:06:28,0:06:38,a oka znači dvadeset godina oporbe pad i sad je čak možemo jači bio jači partner jači je to možda oni neće reći.
0:06:38,0:06:42,Kandidatkinja je bila izmožemo li tako za gradonačelnika.
0:06:44,0:06:50,"Što znači da su oni priznali primat možemo također u Harlovcu, a u Zagrebu je taj nesrazmjer ogroman."
0:06:54,0:06:58,"Nije se samo esdepe izgubio, izgubile su se socijaldemokratske stranke u Europi."
0:06:59,0:07:06,"Ta potraga traje već desetljećima, od onog borbe za radnička prava, sindikalizam i slično, ljudska prava."
0:07:07,0:07:08,Šta je to sada novo?
0:07:09,0:07:11,"Prekarni rad, pa to možda nije toliko zanimljivo."
0:07:11,0:07:17,"Pa migranti koji se zapošljavaju, isto dosta osjetljiva tema, nedovoljno razrađena."
0:07:18,0:07:23,"Dakle, nije pronašao identitet novi kako da kažem, prema modernom vremenu."
0:07:23,0:07:28,"I onda je najgore, po ljevicu ja mislim, ali to koriste svi koji su na vlasti."
0:07:28,0:07:32,"Kad je frka, kad nema novca, kad su afere, ajmo mi u rovove II."
0:07:33,0:07:41,"svjetskog rata i potpale se svi, ono, prosvjedi, marševi, sve, to je najlakše i odmah svi u rov."
0:07:41,0:07:56,"Dakle, ono što meni je nedostajalo najviše u politici, ali to sam prokušao nadomjestiti osobno, to što sam ja pozdravljao ljude normalno iz kojeg god da su stranaka koji su sjedili u skupštini."
0:07:56,0:08:12,"Ja s njima možda nisam družio, ja s njima neke vrijednosti ne dijelim, ali dobar dan, ne znam, porazgovarati ili neke stvari dok mnogi ljudi iz možemo ne pozdravljaju druge ljude."
0:08:12,0:08:20,"Ne da ne pozdravljaju sad desničara nekog, nego prestali su pozdravljati mene jer sam počeo postavljati određena pitanja."
0:08:21,0:08:22,"Dakle, to je nevjerojatno."
0:08:24,0:08:29,"Ja sam u Zagrebu, u kolegicama i kolegama, tražio je ljude također, ono ljude."
0:08:29,0:08:36,"Jer meni su mnogi pružili ruku na temi koju ćemo poslije dotaknuti, a to su osobe s invaliditetom."
0:08:37,0:08:42,"Mnogi su mi pružili ruke iz hadezea iz stranke Milana Bandića, nije bitno jel."
0:08:42,0:08:53,"Znači ako netko ima prijedlog kako da kažem na lokalnoj razini koji je univerzalno vrijedan, onda će, većina njih će reći pa nema veze tko ga je predložio, podržat ćemo ga."
0:08:53,0:09:23,"A da, ja sam to tražio, ja sam to tražio i na taj način sam komunicirao sa mnogim ljudima, stoga ja nemam sukobe na toj razini ljudskosti, nemam sukobe s nijednim desničarom, ja imam veliku podršku i među ljudima s desnice na društvenim mrežama jer govorim neke stvari, uglavnom se bavim lokalnom politikom koja je komunalna, a ono što se kaže, kanalizacija, voda, tramvaj ili most nije lijevi ili desni nego ono."
0:09:25,0:09:25,Kvaliteta života.
0:09:26,0:09:30,"Znači i direktna komunikacija s građanima, to mi je nekako bilo omiljeno."
0:09:31,0:09:45,"I to vrijeme koje sam kao volonter mogao izdvojiti uz svoj posao, onda sam izdvajao baš u tom smjeru i nisam želio trošiti previše energije na unutar stranačke nekakve nadmetanja i bitke."
0:09:45,0:09:49,Vidio sam da je to bitno i poštivao sam hijerarhiju dok sam bio u stranci.
0:09:49,0:10:03,"Mislio sam da će tu doći do modernizacije, da će doći mlađi ljudi koji će potaknuti neke promjene da idemo prema nekoj modernoj ljevici, da se pronađu nove teme, novi ljudi, da će se gurati to."
0:10:04,0:10:26,"Na nekim razinama to i postoji u svakoj stranci pa i u esdepeu ali u Zagrebu ne i sad vidimo da je to, da je praktički esdepe završio kao podružnica možemo, samo dižu ruke, malo dobiješ neka mjesta negdje na natječajima mora biti i onda tako funkcioniraš životariš."
0:10:27,0:10:34,Ja sam odustao od toga kad sam vidio da to ništa ne mogu niti promijeniti niti želim podržavati takve odluke.
0:10:35,0:10:37,Tako da evo to je bio nekakav moj put.
0:10:37,0:10:49,"U šta bi pokojniji Račan ovo rekao na današnji esdepe pa da mnogi kažu sad se ono neko, dakle, da li fali, pa fali, mislim da fali na političkoj sceni."
0:10:49,0:11:26,"Pa fali, mislim esdepe ima naprimjer nekoliko predsjednika od odlaska Milanovića, svi su bili na jedan dva posto po popularnosti u onom smislu kad se gledaju ankete ankete nisu zakon ono jel ali su apsolutna istina neka ali su nešto znakovito nešto što ipak pokazuje trend ako ništa drugo i evo sad Hajdaš Dončić ima najgoru reputaciju od svih predsjednika do sada zapravo kao da sve ide gore nikako da se stranka konsolidira a izgubila je ostala na četvrtini članova."
0:11:27,0:11:57,"Znači bazen kadrovski je oslabljen užasno i kad bi se jednom dogodilo da opet hadeze prepusti vlast jer uvijek esdepe dolazi kad hadeze se raspadne ili prepusti vlast a ne da ga esdepe osvoji sa partnerima ili bez, ja više ne znam koji su to točno ljudi koji bi imali kapacitete osim onih koji su bili Milanovićovi ministri, konkretno u zadnjoj njihove Vladi koji bi bili kadri upravljati ministarstvima kvalitetno."
0:11:57,0:12:43,"Znači, jako je malo takvih, a nekad je to bio ogromni bazen, to su bili sveučilišni profesori, to su bili stručnjaci koji su bili u savjetima stranke, to mislim praktički opustošilo se sve, možemo imati neke druge vrste bazena iz kojih oni crpe, od civilnog sektora i slično i na kraju hadeze je ne samo najjača stranka po rezultatu, već i možda najbolje organizirana u onom organizacijskom, sad govorim smislu isključivo jer ima jako dobru analizu, analitiku, slažu priču profesionalno, ne rade po osjećaju što bi se reklo, nije čudo da imaju rezultate kakvi imaju."
0:12:43,0:12:45,I nijedna afera je ne znam šta je.
0:12:46,0:12:48,"Da ono, trideset ministrica, afera, redna."
0:12:50,0:13:14,"Mislim, obično zna se reći da birači ili liberali i oni koji glasaju za ljeve stranke su jako osjetljivi na afere, na razočaranja, ne, dok hadeze ono nekako oni pregrme uvijek razne turbulencije, evo sad ovo ih ide najbolje do sad, jel da s trećim mandat za redom?"
0:13:14,0:13:14,Da.
0:13:15,0:13:20,Znači to se još nije dogodilo tako da je Plenković ispada najuspješniji mogući voditelj.
0:13:20,0:13:34,"Ja sam mislio da će se sad ono šalim ovo, sad ono kad će biti ovi parlamentarni izbori, Milanović više neće moći kandidirati za predsjednika, možda ode u hadeze malo da se, znaš, možda da Plenković postane predsjednik, ovaj postane premijer, ali u hadezeu da bude."
0:13:35,0:13:56,"Ja po nekim izjavama sada kada su se oni onda nadmetali verbalno, ono što smo pratili zadnjih par godina, u nekim situacijama i oko nekih izjava neki bi rekli da Plenković više pripada nekako esdepeu po stavovima, a Milanović da je dosta zastranio kao bio nešto hodajući po Bosni i ne znam šta, ne znam više šta čele."
0:13:57,0:14:00,"Uglavnom, tako da više pripada tom desnom spektru."
0:14:02,0:14:14,"Vidjelo se da je on to radio i da je dobio nevjerojatnu podršku na predsjedničkim izborima, sad za novu godinu i za nove godine nevjerojatnu podršku i to iz centra, iz ljevice i desnice."
0:14:15,0:14:19,Tako da on je izabrao neki svoj put što mu je bilo bitno.
0:14:20,0:14:27,Što će biti dvadeset osam pa bit će jako zanimljivo da li hadeze može se i dalje održati i da li ima itko tko može ozbiljno konkurirati.
0:14:28,0:14:36,"Sada se možemo i esdepe drže skupa, kao da će ići skupa, imali su na lokalnim izborima trg robu da vide da li mogu zajedno."
0:14:37,0:14:50,"Postoje ogromne razlike jer možemo nije ljeva stranka ni po čemu, nego je liberalno zelena stranka, a i to zeleno je isto malo čudno ponekad jer neke politike baš i nisu zelene koje provode."
0:14:51,0:15:13,"Čak na sudu je završio jedan slučaj bio kad su svi znaju Jarun, je li jezero oko Jaruna, išli su asfaltirati okolo, Butković im je dao novac, ba iddevej, rekao je li metar na šta potrošiti, pa budemo asfaltirali sedam km, da oko ovoga, to su bili novci od potresa su ostali i trebalo je negdje potrošiti."
0:15:14,0:15:20,"I kaže evo, našli smo pukotine da je popucala cesta od potresa, oka."
0:15:21,0:15:28,"I asfaltiraju oni, ali skuže da hoće proširiti biciklističku stazu, pa falim širine."
0:15:30,0:15:37,I porušiš oni drveće i uzeli su zelenog pojasa u dužini nekoliko stotina metara i sve su to asfaltirali.
0:15:40,0:15:40,I na sud.
0:15:42,0:15:47,Netko ih je tužio i došao je inspektor i rekao vi ste to nezakonito zelenu površinu.
0:15:47,0:16:02,"Znači zeleni su asfaltirali zelenu površinu i na sudu su se dokazivali, izgubili su sud i dokazano je da su oni protuzakonito proširivali cestu jer moraš izvaditi građevinsku dozvolu."
0:16:02,0:16:08,"Možeš mijenjati asfalt ali ne možeš proširivati i dodavati trake i ne znam šta, bez papira."
0:16:09,0:16:10,Evo to je jedan malac ratica.
0:16:11,0:16:13,Tako da pitanje je šta je to zeleno i šta se provodi.
0:16:14,0:16:19,"Pa ja znam reći ono onako na kavi za mene, ta zelena politika sve samo ne zelena."
0:16:19,0:16:21,Kad čujem takve stvari još neke.
0:16:21,0:16:30,"Pa mislim u smislu održivosti svatko želi živjeti u čistom gradu, u urednom gradu, bilo bi dobro da se svi pridržavaju kako se baca smeće, da ga bude manje."
0:16:34,0:16:36,Pa sve bolje je.
0:16:37,0:16:44,"Bandić je uveo razne kante i vrećice, onda je Tomašić dodao plave vrećice i malo je unaprijedio."
0:16:45,0:16:52,"Zanimljivo je, znači to su tone dodatne plastike na Jakušicu."
0:16:52,0:17:14,"Plava vrećica su tone plastike, zeleni su uveli, okej, ali su uveli to da, jer se za time plaća po količini, znači što manje vrećica baciš, toliko ćeš što manje platiti, a imaš fiksni dio cijene koji jako po, kod nas je to, mislim da je petpet eura fiksno i onda plus koliko potrošiš vrećica, to je jako povoljna cijena."
0:17:14,0:17:17,"Mi imamo neki devet stavki fiksnih, tako da me nemojte pitati o tome."
0:17:17,0:17:19,"Uglavnom, mi imamo dva, fiksna i ova."
0:17:20,0:17:32,"E sad, svaki put je sve bolje, mislim Bandić kad je uveo kante dok se ljudi naviknu šta ide gdje i tako treba godine jer je edukacija bila tako loša, a isto od možemo nije bila bolja."
0:17:32,0:17:47,"Tako da sve to skupa polako napreduje, ali mnogi se razočaraju kad vide da zapravo se sustav ne gradi jer po meni mi možemo od građana očekivati da oni sudjeluju u tome ako grad odradi svoj dio posla."
0:17:48,0:18:00,"I znači redovan odvoz da funkcionira sve, da možeš građanima reći koji je to svrha toga, kud to ide, šta se s time zbiva, s osmećem."
0:18:01,0:18:11,"I onda možeš reći, e sad, sve imate, sve je uređeno, sad ćemo kazniti one koji krivo, namjerno ili slučajno ili ne znam, ne žele se pridržavati zakona."
0:18:15,0:18:18,"E, tako i oko smeća, ali prvo grad mora odraditi svoj dio poslovanja."
0:18:19,0:18:26,"I naravno da ne kažem da je Tomašević rekao da će raskrstiti s Pripuzom i sa njegovom firmom, znači on ga šopa takvom logikom."
0:18:28,0:18:42,"Znači njihov populizam u dolasku na vlast, pa čak i za vrijeme vlasti i ta komunikacija koju oni imaju gdje je zapravo djelom manipuliraju."
0:18:42,0:18:48,"Moram priznati da je normalno dobro došao pokojniji Bandić dok je bio živ, temeljili su svoj taj neki kampanju."
0:18:48,0:18:49,Pa apsolutno.
0:18:49,0:18:55,"Da, mislim, anti-sistemska protivna stranka koja je pala vlast u ruke."
0:18:56,0:19:03,"I to je ono čudo, mislim onako njima bilo i mnogi koji smo ih znali dulje od prije smo znali da će to biti jako kaotično."
0:19:04,0:19:24,"Ja sam u startu rekao da ja ne želim sudjelovati ni na koji način osim što ću biti u skupštini, ne želim ići raditi nešto u grad ili bilo što, to sam im javno rekao i jasno, nakon što sam to rekao Tomaševiću, ja sam znao da oni sa svojim životnim i poslovnim iskustvom kojeg nisu imali, to ne može izaći na dobro."
0:19:25,0:19:37,"Mislim, ja radim u privatnom sektoru, znači nikad nisam radio ni za državu ni za grad na taj način i onda oni imaju određena iskustva, to nisu velika, ali su neka."
0:19:38,0:19:54,"Ali, znači većina tih ljudi njima je to ono potpuno nepoznanica i zato je sve bilo užasno sporo oko odlučivanja, jako kao tično, osim što su vrlo dobro kroz medije plasirali priče koje mediji čak nisu neke ni provjerili."
0:19:55,0:20:03,"I onda evo dogodilo se nešto drugo, ja sam čak očekivao da će to biti možda jedan mandat kao u Rimu."
0:20:03,0:20:30,"Kad je Tomašić došao ja sam onda rekao da pet zvijezdica je stranka koja je tada rasla prije desettak godina u Italiji, osvojili su Rim, imali su jednu pravnicu koja je došla za gradonačelnicu, oni imaju mandat od pet godina, ona je izgubila izbore, počeli su se kvariti autobusi, stopirala javnu nabavu jer je mislila da će s time spriječiti korupciju pa onda nije bilo rezervnih dijelova."
0:20:30,0:20:39,"Znači sve isto kao Tomašević kad je došao, on je stopirao svu javnu nabavu, znači ono, ja ne kuham, tebi trebaju rezervni dijelovi."
0:20:39,0:20:45,"I onda je rekao, sad ovi kažu, sad ćemo morati prorijediti autobusne linije jer nemamo više rezervnih dijelova."
0:20:45,0:20:56,"On kaže, pa kupite, pa kažu, to samo tako, pa ne možeš otići u dućan s karticom iz Grada Zagreba i sad otići u trgovinu dijelova za autobuse, ti moraš provesti javnu nabavu."
0:20:56,0:20:58,Pa taj čovjek se mora opremiti.
0:20:58,0:21:06,"On kaže, pa odite kod njega, pa on je prestao to raditiiti jer ste mu vi prekinuli posao, stekla je ugovor ili što već, nije bitno."
0:21:07,0:21:14,"Čovjek se prebacio na nešto drugo, ne može on sad, ne može on sad u garaži, u skladištu dijelove i čeka, ne ono."
0:21:17,0:21:24,"Dakle hoću reći takve nekakve smiješne stvari su se dešavale, puno takvih koji su potpuno paralizirali grad."
0:21:25,0:21:49,"A baš promet je jedan od glavnih tema, to sjetite i vi koji dolazite i mi koji smo tamo, oni su se odbili baviti prometom skoro cijeli prvi mandat, jasno su rekli HZMO-a jasno su rekli da neće proširenje kapaciteta iako su znali da raste broj automobila, skoro siluju ljude da idu na te bicikle, da je to alternativa."
0:21:49,0:21:55,"Alternativa je sustav javnog gradskog prijevoza, ne može biti alternativa autima bicikl."
0:21:56,0:22:06,"Znači starije ljudi, onima koji su pali na koljeno, oni koji su bolesni, oni koji voze djecu, njima nije, ne može im nikako biti bicikl."
0:22:06,0:22:11,"Jer mi nismo Danci i nećemo postati Danci, ili barem nećemo tako brza."
0:22:13,0:22:13,"Evo, ja možda ne želim."
0:22:14,0:22:15,"Pa, evo, iskreno."
0:22:15,0:22:17,Ja sam vozio bicikle puno prije.
0:22:17,0:22:24,"Mislim, puno, ali u zadnjih par, ne znam, 20 godina ne vozim ili vozim vrlo rijetko."
0:22:24,0:22:25,Jednostavno mi to više nije.
0:22:26,0:22:30,"Uglavnom, i vozim dijete svoje na ovo i na ono i želim ići s automom."
0:22:30,0:22:36,"I sad on kaže, ne, ja ću te praktički isfrustrirati da ti ono odustaješ od auta."
0:22:36,0:22:38,"Mislim, na silu to ne ide ništa."
0:22:39,0:22:46,"Ali oni imaju neke stvari koje guraju na taj način, iskoriste sam teško reći silovanje u tom smislu da te prisiljava, da, da."
0:22:46,0:22:48,Želite prisiliti na neke stvari.
0:22:49,0:23:01,"I ne uvažava drugo mišljenje, različito mišljenje, čak one koji propitkuju ili nešto, odmah su izgurani, odmah ih se miče i proglašavaju se neprijateljem."
0:23:02,0:23:15,"Čak i unutar stranke, oni su izgubili dio vijećnika koji su bili na nižim razinama, koji su rekli, gledaj ovo nije dobro, ovo bi trebalo drugačije, ti ljudi su odmah bili prekriženi, obrisani kogumicom, izgurani van."
0:23:17,0:23:25,Jednostavno ili ne propitkuješ ili možeš napredovati valjda ako si slijepi slijednik što se kaže.
0:23:25,0:23:29,Sad se ja ne mogu da ne zapitam kako bi to bilo da su onda preuzeli vlast u cijeloj Hrvatskoj.
0:23:30,0:23:35,Kad jedan Žarko Puhovski je davno rekao da je iz Zagreba prvi veliki korak za.
0:23:36,0:23:43,"Znamo, mislim, uče ljudi, dakle oni su i mladi, inteligentni, obrazovani, to ne, mislim, uče pa ćemo vidjeti, možda ne uče."
0:23:44,0:23:57,"Kako bi bilo, u ovoj situaciji bi bilo užasno jer oni za razliku od starih tradicionalnih stranaka koji imaju interne edukacije, oni nemaju to i nemaju takvog iskustva i bježe od stručnjaka."
0:23:57,0:24:01,"Brojni stručnjaci su se ponudili Tomaševiću, on ih je sve odbio,."
0:24:02,0:24:04,"Pa dobro, koji je onda njihov cilj recimo?"
0:24:05,0:24:17,"Pa mislim, nama je ostalo onda bolje glasati za hadeze barem će imati, ono hadeze može pokret, nemam pojma, direktore gradskih tvrtki pa da gradovi funkcioniraju i to, mislim, al nam je izbor neki, ali ono."
0:24:17,0:24:19,"Mislim, kako su onda oni zamislili da."
0:24:21,0:24:40,"Pa ljudi prona, ono, mislim oni su se pronašli, oni su iz udruga u kojima su radili protestne stvari i gurali određene nove trendove itede i od toga živjeli profesionalno, oni su se prebacili živjeti sad u politiku i sad tu dobivaju plaće."
0:24:40,0:24:51,"Dio ih je ostao u udrugama, jedan dio se prebacio na grad, kroz Sabor itede funkcioniraju i guraju, imaju svoje određene ciljeve."
0:24:51,0:24:56,"Dakle, svi profit, dosta njih profesionalno živi od toga i sad stječu oni iskustva."
0:24:57,0:25:07,"Dakle, općenito i danas u esdepeu nema toliko kadrova kao što ih je nekada bilo da dođeš u priliku obnašati vlast pa da možeš reći, ovi ljudi su stvarno dobri."
0:25:07,0:25:12,Mnogi će danas nabrojati samo one Milanovićeve ministre koji su stekli iskustvo.
0:25:12,0:25:25,"Mislim, nema škola da budeš ministar, da budeš premijer ili nešto, ali ti moraš barem pokazati neke kapacitete da si ti ne da se čudiš užasno kada dođeš u priliku raditi nešto i da ignoriraš struku."
0:25:25,0:25:59,"Dakle njima se dogodilo u prometu, u gospodarenju otpadom, u mnogo čemu, ljudi koji su u sustavu grada, rade deset i petnaest i dvadeset godina u uredima u odjelima koji znaju svoj posao oni njih nisu poštivali jer su oni bili valjda prljavi bandićevci koji su držali bandića na vlasti pa ti ljudi su tamo živjeli, radili dio njih je bio u optužnicama jel tako, dio je osuđen, dio su dobili otkaze zbog toga, nisu svi skvareni kriminalci samo zato što nisu u možemo, ne."
0:26:00,0:26:09,"I sada jedino možemo su pošteni, a vidimo evo po optužnicama, krenuli su, znači Milan Bandić u prvom mandatu nula optužnica."
0:26:10,0:26:17,"Ovaj Tomašić u prvom mandatu hopala ono ozbiljna istraga i njih, evo sad je prema natpisima iz medija."
0:26:22,0:26:23,Oko nekih istraga možda postoji.
0:26:24,0:26:26,U ovom slučaju hipodrom.
0:26:26,0:26:41,"Jer pardon, za očekivati, bili su agresivni u kampanjama napadali Bandića, pa ono naravno za očekivati, e sad ste vi došli na vlast, pa vam oni neki malo to ono vraćaju pecku, ali da imamo hipodrom, svega ima, maksimirski stadion, nešto oko bicikala."
0:26:42,0:26:53,"Ima nekoliko istraga, ima nekoliko, ima konkretna optužnica za jednog člana, to je ovaj Đulić koji je Tomaševićev ministar u Sijeni."
0:26:53,0:27:11,"Znači šta su oni, oni kad su došli, vratit ću se, oni kad su došli, oni su, imaš pročelnika, i to su bili pročelnici koji su imali ugovore itede I njihovi ljudi nisu imali uvjete da se jave na natječaj, kao pet ili deset godina moraš imati upravljačkog iskustva."
0:27:12,0:27:14,Njihovi ljudi to nisu imali.
0:27:14,0:27:32,"I onda su oni postavili ili su ostavili pročelnike čak i s hadezea od Bandića, evo još uvijek je jedna žena koja je bila Bandićova pročelnica kako da kažem tamo, ali su postavili njima kao flastere nekakve u sjeni pročelnike koji su odgovarali direktno Tomaševiću."
0:27:32,0:27:47,"Đulić je bio za sport, on je rješavao probleme u Ciboni, u Dinamu za vrijeme Barišića, on je komunicirao oko stadiona, oko statuta, dolazak zajedca, Bobana, to je radio Đujić."
