Start (HH:MM:SS),End (HH:MM:SS),Segment
0:27:47,0:27:52,"Ono što je on rekao, to je njima bilo rečeno kao da vam je rekao Tomašević ili obećao, ne?"
0:27:53,0:27:55,"Znači, on je, njegov čovjek od povjerenja."
0:27:56,0:28:17,"Čovjek je dobio optužnicu, što je radio, ovi neki kao njegovi, ispalo je, su uzeli, ispostavili fakture za usluge koje nisu uopće bile izvršene, prema HZMO-a, jel prema riječima USKOK-a iz optužnice i naplatili to masno."
0:28:17,0:28:48,"Ispalo je kao da je svaki dan tamo bilo po trideset čuvara u tri smjene, znači po noći trideset ljudi, nije bilo nikad, to nitko nije vidio, nitko i to su potvrdili brojni ljudi i svjedoci, a taj Đulić je te ljude koji su, on kaže otkucali su kriminal, on je njih išao degradirati i tu se radi o jednoj osobi koja je majka djeteta s teškoćama, koja je radila ili na pola radnog vremena ili je bila odsutna, on je njoj rekao da će spakirati otkaz."
0:28:48,0:29:04,"Čitam ono što piše u medijima, ono što je bilo u Hrvatskoj kad sve iscurilo iz tih papira, svjedočenja na USKOK-u iz optužnice itede I to je možemo čovjek iz stranke baš, u kruga."
0:29:04,0:29:12,"Tomašić ovih dana ga brani, čudi se kakav USKOK to, šta je to, šta se tu dešava."
0:29:13,0:29:14,On kaže da je on nevin.
0:29:15,0:29:34,"Znači kad sam se suočavao s hadezeom i s Bandićem, a imali su već potvrđene optužnice i hadeze osuđene ministre, premijera itede Oni nisu se nikad branili kao danas Tomašević jer to bi bilo skandalozno da kaže ne, ne, mi smo jako nevini i dalje, to se sve nešto podmeća i tako, ono, to sve."
0:29:35,0:29:47,"Znači, nedavno je uhićen Andrija Mikulić, glavni državni odvjetnik i inspektor, inspektor Bože, inspektor, da, da, da, da."
0:29:48,0:29:58,"I šta, ovaj mu daje, jel da nogu, Plenković i kaže ono, gledajte, ti se obrani, suspendira ga kao člana stranke i to sve skupa."
0:29:58,0:30:01,"Tomašević ovog brani životom, ono."
0:30:01,0:30:11,"o tom, znači vidi se da su oni kompa, da su oni i iz spisa i svega iz medija na kraju krajeva isto piše da je on obavijestio Tomaševića o svojim potezima."
0:30:12,0:30:15,Misliš da će to birači kazniti na neki način?
0:30:16,0:30:22,"esdepe Pa po meni, gledajte, da me nitko krivo ne shvati esdepe je dosta tu kriv, baš zbog svoje inertnosti."
0:30:22,0:30:25,"esdepe bi samo trebao reći, gledajte ovako ne ide."
0:30:26,0:30:33,"Meni je logički, ne želim glasati za hadeze esdepea nema, idemo možemo, ako možemo, možda neki drugi hoćemo će biti."
0:30:34,0:30:38,"Ali za mene, ne samo mene, dvadeset godina inertnosti."
0:30:39,0:31:00,"Pa moram, mislim i za to moraš snositi dio krivice, evo iskreno, da ne udaramo sad samo po, možemo i hadezeu ono, sigurno, mislim u Zagrebu ili bilo gdje, dakle, ne pokazuju kompetencije, znakove života, borbe za kvalitetu života, za građane."
0:31:02,0:31:07,"Ja sam imao plan, kažem ono da hodamo, da idemo od vrata do vrata malte, da idemo među ljude."
0:31:08,0:32:03,"Ljudi bi nas na početku pljuvali, rekli bi di ste bili, šta ste upropastili, tako da ono, kad bi mu došao treći, četvrti put i rekao, gledaj, saslušali smo vas, čuli smo vas, nešto smo poduzeli, i sljedeće godine se dokažeš da si nešto pokušao, možda bi to opet saslušali, možda bi to drugačije doživjeli i to bi bio po meni put oporavka ili ozdravljenja, ali na lokalnoj razini se baviti kvalitetom života, što fali, kako u Karlovcu taj centar grada, zašto on nije obnovljen u nekom razumnom roku i svi problemi koji su nastali što je postala nacionalna tema ili kažem u Zagrebu nekoliko posto ljudi nema kanalizaciju i vodu s tim, pardon da ću ja reći, trebala je postati nacionalna tema, ali isto kao Karlovčan ću reći je, zglazi za izgleda hadezea nešto, ali i oporba ta koju i osobno poznam, Mladi Karlovac, da."
0:32:04,0:32:06,"Brdo kritika, ali niti jedno rješenje."
0:32:06,0:32:09,To je ono što me najviše zabrinjava i ne samo u Karlovcu.
0:32:10,0:32:13,"Kritika, kritika, kritika, ali rješenje nitko ne nudi."
0:32:14,0:32:16,Evo mali primjer na to.
0:32:16,0:32:23,"Tu ova cesta vidjet ćete kad ćemo ići na kavu, trebala je biti otvorena petnaest deset nije, danas je dvanaest mjesec."
0:32:23,0:32:28,"Mi smo to prihvatili, kompletno društvo je u nekakvoj opati, znate što hoćemo reći?"
0:32:28,0:32:29,"Da, to je najveća opata."
0:32:29,0:32:36,"Pa nije, dobro, zatvorena je, Bug se i dalje snašao, pa onda onu zatvore, pa Bug se tamo sna, dokle ćemo se mi snalaziti?"
0:32:37,0:32:40,"Da, mi smo navikli danas na ono tuku, ne znam."
0:32:40,0:32:43,I trpimo neke stvari i ne reagiramo.
0:32:43,0:33:42,"Mislim, evo danas šta ljude na temu ustaša i partizana, dobiješ pet tisuća ljudi, deset tisuća ljudi ili petsto evo napravi ti ovdje prosvjed, zašto ta cesta nije na vrijeme ili da ja u zagrebu napravim prosvjed, zašto pet posto ljudi nema kanalizaciju u dvadeset jedan stoljeću u glavnom gradu eu i da kažem ajde neka skupština donese odluku da zabranjujemo da grad funkcionira a da ljudi nemaju kanalizaciju i da gradonačelnik ima pod prioritetu u roku toliko i toliko godina to riješiti i da napravim prosvjed koliko bi došlo ljudi da možda znači ono to bi bila margina teška e ali znači kad ljevica i desnica hoće prikriti afere nesposobnost ili nešto tko god je na vlasti samo baciti samo baciš ono temu u eter i Thompson je znači svima super tema."
0:33:42,0:33:46,"U Thompsonu je najbolje, Thompson ima toliko ljudi na kutu."
0:33:46,0:33:47,A Thompsonu sve radi reklame.
0:33:47,0:33:49,Thompson promovira u svakom slučaju.
0:33:49,0:33:50,"Da, da."
0:33:50,0:33:51,I još zaradi na koncertu.
0:33:54,0:33:57,Znači Tomašević nikome ništa nije zabranio.
0:33:57,0:34:01,"E, Tomašević je dozvolio prvi koncert i drugi koncert."
0:34:02,0:34:21,"On kaže da će on tek jer mu je Skupština dala preporuku, Skupština nema ovlast Sabora, ona mu je dala preporuku da on razradi iznajmljivanje stadiona, dvorana, Bundeka, Hipodroma, Arene i ostalu imovinu grada pod nekim uvjetima, dodatnim."
0:34:21,0:34:23,Znači to će biti ugovor uvjeti.
0:34:24,0:35:18,"E sad, bit će zanimljivo kada mu dođu Bed Blo Boysi na Maksimerski stadion, kada bude obljetnica pada Vukovara ili neka slična tema i kada mu počnu pjevati ovo što sad pjevaju svi navijači zadnjih nekoliko tjedana na svim stadionima svih Bed Blo Boysi u Gorici, neki dan Torcida u Rijeci, TORCID-a u Rijeci, ne znam, ne, ne, TORCID-a kada je bilo u Rijeci, ja mislim započela pa je armada nastavila u Gorici i u TORCID-u u Splitu i Bedlogubojsi u Gorici, ono nezavisna država, ne, ali ne u smislu, sad svi kažu to je ono prezivanje NDH, mislim ti mladi ljudi, koja je NDH, dakle ja ne vidim ustaše po Zagrebu, niti vidim partizane u šumi, mislim da su to kažem ono bacanje magle u oči."
0:35:18,0:35:27,Mi imamo problem naravno sa time što se tako vrlo se često stvarno vratiti i kao da to nije račišćena tema.
0:35:28,0:35:39,"Prema Ustavu i prema sudovima, znači više sudova, imamo sudske odluke, da gledamo hladno o toj temi, o temi II."
0:35:40,0:35:45,"Svjetskog rata, o temi Poklića ustaškog i o temi NDH i HOS-a."
0:35:46,0:35:50,"Imamo i ako se pridržavamo sudskih odluka, stvar je vrlo jednostavna."
0:35:50,0:35:53,Znači odluke Zavnoha u vrijeme II.
0:35:53,0:36:01,"Svjetskog rata, Zemaljskog antifašističkog vijeća, one su dio slijednica moderne Hrvatske."
0:36:01,0:36:07,"Naravno, rezultirala kroz rat je izborena, Domovinski rat, jel?"
0:36:09,0:36:25,"Ali imamo totalitarizme, fašizam, nacizam, komunizam i EU i kada smo prihvatili ući u EU i velika većina ljudi je glasala da uđemo u EU, mi smo prihvatili odluku EU o totalitarizmima, svim totalitarizmima."
0:36:27,0:36:29,I mi tu se pravimo ponekad grbavi.
0:36:31,0:36:41,Visoki trgovački sud o pjesmi Čavoglave Marka Perkovića Thompsona mu je dao za pravo da to nije prekršaj kad ju on pjeva kao autor u izvornom obliku.
0:36:41,0:36:55,"Bio je jedan drugi pjevač koji je, ne znam koliko to ljudi znaju, koji je isto pjevao, prepjevao, on je dobio kaznu jer on nije taj koji je, da, znači on je prepjevao, on je dobio kaznu."
0:36:56,0:37:06,"Što se tiče pokliča, danas je naš mali Rino, znam tko je kriv, mister J."
0:37:07,0:37:12,"Što se tiče uštaska, što ti pušta, uživaćeš kad budeš, uživaćeš."
0:37:13,0:37:25,"Što se tiče ovoga ustaškog poklića, stvar je isto jednostavna, znači, Upravni sud je rekao da je on protuustavan i da se može koristiti kada i šta."
0:37:25,0:37:43,"Mi imamo u Dubravi spomenik Crvenkapi, HOS-ovcu, kada se to obilježava, kada se obilježava obljetnica HOS-a ili nešto, on se koristi i isto po sudu je tada to ok jer su ti ljudi na kraju ugradili mislim svoje živote, ono najvrjednije što su imali HOS-ovi."
0:37:44,0:37:47,"Dakle, ako možemo gledati hladno da tako kažem."
0:37:48,0:37:52,es druge strane ono borba protiv fašizma u II.
0:37:53,0:38:05,"svjetskom ratu zajedno sa Churchillom, Rooseveltom i Stalinom jel ono i taj paket borbe protiv fašizma je zaustavio rat i fašizam i nacizam."
0:38:09,0:38:11,A da je bio antifašist.
0:38:11,0:38:13,"Pa dobro, tamo iz Rusije i potiče ta priča."
0:38:13,0:38:19,"Ali opet onda znači ono, ja odvajam taj dio od komunističke partije i od komunizma."
0:38:19,0:38:25,Dakle ono totalitarizmi ubijaju.
0:38:25,0:38:29,"Pa ja mislim da su ti klinci jedni i drugi jako, jako izmanipulirani."
0:38:30,0:38:35,"Ne, ali ja ne vidim u njima sada ono moderne nove ustaše ili nekakve stare ustaše ili ne znam ono."
0:38:36,0:39:03,"I opasnost, znači evo čini mi se da svi koji nemaju sadržaj u politici i ne bave se proračunom, državni proračun u padu, gradski svi proračuni u padu ove godine, ljudi od dvadeset šest bit će manje novca u dvadeset sedam još manje novca svuda nema fondova nemamo neke probleme ulazimo opet u financijsku krizu vlada EU, vlast je nabacila rovove II."
0:39:03,0:39:04,svjetskog rata i pucajte.
0:39:05,0:39:13,"Znači to je nevjerojatno da mi nismo dovoljno zreli kao društvo još uvijek demokratsko da se bavimo demokracijom, da ljudi imaju različite stavove."
0:39:13,0:39:16,"Mi ne trebamo biti unisoni, imati ista mišljenja i stavove."
0:39:17,0:39:22,"Trebamo imati prosvjede, protuprovjede, ali to treba biti u okvirima demokratičnosti."
0:39:22,0:39:47,"Mislim, neću reći mi se još uvijek učimo, ne nakon trideset pet godina ali okej znači navikavamo se na neke stvari ali recimo da sve stranke u saboru ja mislim da bi mogle ali one ne žele sjest skupa što je nezrelo politički sjest Sijest i praktički oko totalitarizma bi se morali moći dogovoriti jer kažem to su sad vrijednosti EU, ono mislim mir kao takav, ne."
0:39:48,0:40:05,"Ali mnogi će danas nabaciti ovu temu, udari po tom psu, u naslovnicu dobiješ, imaš klikove i stečeš poklonike i neprijatelje i onda se to podiže ti se vidljivost, podiže ti se ne znam napadi, ovo ono."
0:40:06,0:40:16,Ali definitivno potpirivanje strasti kod jednih i kod drugih kao da povremeno vidim da dolaze ono sa benzinom i zalijevom.
0:40:18,0:40:22,"Da li netko to sad da tereta, pa plus mediji i zapravo šta?"
0:40:23,0:40:35,"Ljudi mi ulazimo u financijsku krizu, imat ćemo probleme sa funkcioniranjem i ovakvom lošim što smo evo vidjeli primjer Karlovac-Zagreb nije bitno i to nije tema."
0:40:36,0:40:49,"Afere isto padnu u drugi plan, borba protiv korupcije koja nas izjeda i to očito u svim strankama postoji pa ju možemo, nego evo najlakše je ovo nabaciti."
0:40:49,0:40:54,"Pa, sad Glođin, ja sam dobio odgovor da si ti ga da naći nek vjerojatno bi Thompson imao koncert."
0:40:55,0:41:00,"Pa, dakle, ajmo zaraditi kroz tu arenu, ne."
0:41:03,0:41:09,"Ona priorička kako se zvala, nemam pojma ni tko je to, ni šta pjeva, ne znam koliko, pet koncerata je za redom ili nešto."
0:41:11,0:41:18,"U Varaždinu gdje je esdepe na vlasti, Thompson ima dva, tri koncerta, ja mislim ugovorena, na njihovoj areni manjoj."
0:41:20,0:41:34,"Tako da je ovo, ja mislim definitivno situacija u kojoj je Tomašević zbog razno raznih problema nabaci ovo iako je rekao da se on neće baviti ideologijom, ali nabaci ovo zato što je to najjednostavnije."
0:41:35,0:41:38,"Misliš da će ga držati, da će mu izabraniti drugi koncert?"
0:41:38,0:41:47,"Gledaj, on na drugi koncert navodno nije odgovorio da ne možeš zbog toga što pjevaš pjesmu Čavoglave, nego mu je rekao nešto oko termina."
0:41:48,0:41:54,"Da mu je to napisao, onda bi ovi imali pravo na tužbu i sudski to riješiti."
0:41:54,0:41:58,"Pula je zabranila ta tereta, pa se sudski rješavalo."
0:41:58,0:42:51,"Zagreb nije, Tomašević nije još poštivali sudove uz države koju poštujemo jel da i koja ima ustavno pravni poredak i Ustav države, onda su neke stvari činjenice i ja mislim da velika većina stranaka i njihovih članova bi se morala moći dogovoriti oko ključnih tema."
0:42:52,0:42:58,"E, ali kažem, kad nemaš sadržaja najlakše se pokefat, pa da, pa baš loje."
0:42:58,0:42:59,I mediji ćete popratiti.
0:42:59,0:43:03,"Ja bih tebe pitao, ti si ljevičar jel to nisi nikad skrivio."
0:43:03,0:43:18,"Ali baš da svi i da li Orešković stalno oko tih ustaša, plaćenika, taj, ajmo reći, ja ne znam da li taj antifašističkiki prostit koji je bio šta je bio više koji ne stigaš ni popraviti."
0:43:18,0:43:22,"Ovi dolaze s Čiruljicom, dolaze sa zastavom koji više ne postoji."
0:43:24,0:43:34,"Kuta onda je ljevica i to više onda više nije ni ljevica, mislim to je sad meni već koketiranje malo sad to je onog neutralnog može prebaciti na drugu stranu."
0:43:35,0:43:35,Kako bi ti rekao?
0:43:36,0:43:38,Nitko ne priča o poslu što si ti rekao.
0:43:38,0:43:41,"Da, pa mislim da je netko dao nekih."
0:43:41,0:43:42,"Sada kaže, mm, zašto?"
0:43:42,0:43:43,Kut to vodi više?
0:43:44,0:43:45,To se ne slažem.
0:43:45,0:43:50,"Nemoj dolaziti sa Čiruljicom kao što ne bi ja u Bjelograd išao s nekakvim, da, mislim, ne pada mi na pamet."
0:43:52,0:43:55,Možda su prešli granicu dobrog ukusa.
0:43:56,0:43:58,Svaka akcija je reakcija na nešto.
0:43:59,0:44:02,Oni će reći to je zbog Benkovca i zbog Thompsona.
0:44:02,0:44:06,"Ali tamo imamo branitelje koji su zabranili koncert, ja ne znam."
0:44:07,0:44:07,Predstavu.
0:44:07,0:44:08,"Predstavu, da."
0:44:09,0:44:12,"A ovdje je ovaj branitelj Thompson, pa svi branitelji, čovječe."
0:44:12,0:44:20,"Ne, sada je lokalna jedinica, svaka može reći, ne znam, ja mislim, neko je zabranio Severini koncert jer je imala nekakav govor o abortusu, čini mi se."
0:44:21,0:44:25,"Pa će ovi neće prihvaćati ovog ili zvati onog, ne."
0:44:25,0:44:33,"Kad je Skoro bio u politici onda tamo gdje je hadeze imao vlast tamo on nije mogao imati koncerte, ne, tada recimo."
0:44:34,0:44:37,"Samo naravno izbiskli su neki razlog zašto će ga, zašto mu neće dati."
0:44:38,0:44:52,"Hoću reći da, ja mislim da je ljevica da su rekli da je prosvjed, da je prosvjed za ljudska prava, protivna, ajde da ideš i protiv, protiv bilo kakvog verbalnog nasilja, ovog nasilja, onog nasilja."
0:44:53,0:45:06,"Velika većina ljudi će naprimjer osuditi što su neki ljudi došli pod prozor zastupnice Orešković, tamo živi ona njezina djeca i takve stvari to je nedopustivo, to će svatko osuditi."
0:45:07,0:45:33,"es druge strane ona je rekla nakon što su otkriveni ostaci ovog kuljera francuza, da je, šta da je plaćenik bio koji je došao u vlast, da je došao u vlast, da ne spominjem ime napisao, dl plaćenik i ona je to lajkala."
0:45:33,0:45:34,Ja sam baš na to.
0:45:34,0:45:36,"A to je krenulo s tim, da se sjećam sada."
0:45:38,0:45:40,"Mislim, ja sam istinski kad sam s tim."
0:45:40,0:45:41,"A ona to branila, ne?"
0:45:41,0:45:47,"A branila je, da, ali po meni bi bilo možda najbolje da političari uopće to ni lajkaju, ni dislajkaju."
0:45:47,0:45:51,"Da, ako je to Peropedić neki napisao, pa to je neki Peropedić."
0:45:53,0:46:01,"Ja sam tom Peripediću isto onako kao sport kad sam odgovorio ima neki shorts, svi smo mi bili plaćenici, čuj, ja sam bio dobro, primio sam plaću."
0:46:02,0:46:05,"Nisam bio nikakav Rambo, nikakav Ustaša, ništa nisam bio."
0:46:06,0:46:07,Šta hoću reći?
0:46:08,0:46:10,Poštujmo mrtve sa bilo koje strane.
0:46:10,0:46:11,A apsolutno.
0:46:11,0:46:25,"Nemojte ljudi, nemojte dirat mrtve Hrvate, Srbe, Bošnjake, Japance, Talijane jer rekao sam, izborili smo se za slobodu govora i ti branitelji i netko iz ove za branitelji, ajde opet podmetanja."
0:46:26,0:46:33,"I sad kad smo dočekali slobodu govora ne poštujemo više ljudske vrijednosti, ne poštujemo ništa."
0:46:34,0:46:46,"Da, pa mislim borili smo se za liberalnu demokraciju, htjeli smo Hrvatsku sa višestranačijem jel i to sad imamo i to su razlike u odnosu na Jugoslaviju, pa mislim ja to ne želim negirati."
0:46:46,0:47:34,"Šta to je stvar recimo, mislim pa to bi bilo suludo, pa SRH, Palestine, to je ovako, na prosvjed isto može doći netko i podmetnuti, jel da, ili imati osobni stav, ne."
0:47:34,0:47:38,"To ne znači da je nužno sada nužno stav organizatora, ali hajdemo vidjeti, ne."
0:47:39,0:47:46,"Definitivno, zazivanje nekakve nove konfederacije na Balkanu je praktički protuustavno također."
0:47:49,0:48:05,"Da, stara zastava, kad je Tuđman radio na Mimohod, na Jarunu, onda su bile sve zastave kao te slijednice jer po Ustavu ti nabraja Banska Hrvatska, pa ta u II."
0:48:06,0:48:42,"svjetskom ratu i te odluke Zavnoha, pa Ustav sr Hrvatske u smislu onog samoodređenja koje je zapravo bilo mogućnost da se mi u devedesettak da, znači tu su bili nabrojni ti koraci koji su išli u korist ovome danas modernoj Hrvatskoj i definitivno Domovinski rat dovoditi na razinu mita neko je tamo neka stranka od Kekin, su imali čak u nekim dokumentima da je mit Domovinskog rata."
0:48:43,0:48:49,I takve stvari su stvarno nedopustive i kontraproduktivne su za neku modernu ljevicu.
0:48:51,0:48:52,"Pa ne znam, očito ne."
0:48:52,0:49:02,"Najlakše je imati sljedbenike kojih ćeš lako zapaliti na temama, evo, vidim ustaše."
0:49:04,0:49:06,"Ja sam neki dan dva partizana vidio, išao sam nešto."
0:49:07,0:49:08,Išao sam u šumu.
0:49:10,0:49:16,"Ne znam, nositi sad tu zastavu iz Socijalističke Re republike Hrvatske ili nešto, pa tamo ne bi smio pisati, mislim."
0:49:16,0:49:20,Sada ja zazivam taj režim koji bi branio slobodu govora.
0:49:21,0:49:23,"Meni je to značajno malo, možda to s psihološke strane."
0:49:23,0:49:26,"Da, Klinci, vi znate kedelate uopće, mislim."
0:49:26,0:49:30,"Oka, ja sam isto rođen u jugu, ja sam gledao na taj prelaz na više strane."
0:49:31,0:49:36,"Pa kako bi mi njima objasnili evo ovo je božićna doba, ne da Bože da ti Murijak uhvati ispetata?"
0:49:36,0:49:39,"Mislim, a danas kad želiš ono da je."
0:49:39,0:49:44,"Mi smo uvijek išli u crkvu, nismo imali problema, recimo nije danas nitko sad zbog toga hapsi."
0:49:44,0:49:47,Ali danas bi bio recimo katolik i to mi se isto ne sviđa.
0:49:47,0:49:49,Ja sam vjernik ali ne idem u crkvu.
0:49:49,0:49:52,"Dakle ovak, podignuta je razina netrpeljivosti."
0:49:53,0:50:02,"Društvene mreže gore, ljudi se vrijeđaju gore nego ikad, ono, od prije koncerta pa do danas, to traje povremeno uz male pauze."
0:50:04,0:50:15,"Ne do Boga da stvarno završi na bilo kakvom nasilju fizičkom, da netko negdje nekoga nešto dočeka ili što god jer to će biti onda nova razina samo ona."
0:50:17,0:50:20,"A svi kažem, svi potpaljuju, dosta su neodgovorni."
0:50:21,0:50:26,"I kažem, ja sam kroz, gledam ono kad smo učili demokraciju."
0:50:28,0:50:34,Poštuješ ono drugo mišljenje i razgovaraš i pokušavaš razumjeti različite stavove.
0:50:34,0:50:52,"Znači ne govorim nezakonite stvari nego zakonite, imamo različite stavove i odnose itede Tako da čini mi se da bez dijaloga među ljudima svako se zatvori onda u svoj krug, dakle možemo inače to tako funkcionira u svim aspektima."
0:50:53,0:50:59,"A sada će se ljudi podijeliti ljevica i desnica i puškaranje iz rovova, verbalno za sada."
0:51:00,0:51:01,modelac se zaboravio.
0:51:02,0:51:05,"Da, Bandić će znati pomiriti sve, ne?"
0:51:06,0:51:10,"On je rekao ono, ja da sam žensko, ja bi bio najbolje žensko jer ja svima dam pomalo, ne?"
0:51:11,0:51:13,"To mu je bila jedna od izjava, ne?"
0:51:15,0:51:27,"On je dao znači i antifašistima i financirao je Praljkovu knjigu, sjećam se i dao je za crkvu negdje u Bosni ili u Hercegovini, ne?"
0:51:28,0:51:31,"I podupirao je Gay Pride, ne znam u Zagrebu."
0:51:31,0:51:33,"On je bio mudar, bio je politički mudar."
0:51:33,0:51:36,"Da, on je, ono plivo je kroz taj populizam i to sve skupa."
0:51:36,0:51:40,"Kažem, čovjek bez stava to je isto koma, na užas."
0:51:40,0:52:01,"Ali ja bi volio stvarno živjeti u nekakvom društvu u kojem možeš reći svoj stav i zbog toga te nitko neće osuditi ili nešto, ok možda netko će imati drugačije mišljenje jer ne možete trpiti zbog toga ili što već, ali ako smo ljudi, ako smo ono ok, pošteni i ako poštujemo druge istinski onda bi trebali stvarno graditi takvo društvo."
0:52:02,0:52:03,Da Hrvatska ide u tom smjeru.
0:52:03,0:52:16,"Mislim, ovi ljudi su spomenuli sam mrtve, oni su stvarno doslovno dali živote za ovakvu zemlju koja se razvija u tom smjeru i da iskoristeistimo sva blagodati i navikli smo se na bolji život."
0:52:16,0:52:42,"Kažem ono, to je mene stvarno malo zasmetalo to diranje u mrtve, to prozivanje, pa ove izložbe baš u neprimjereno vrijeme mislim, ja se pitam da li ti ljudi znaju kako je bilo, ja ću reći iz svog primjera, tinejdžeri ljeto završavaju i odjedanput tvoj grad nije isti, netko počne pucati po tvom gradu, rušiti, čista i mira i tamo sam naučio da se ti moraš opredijeliti."
0:52:43,0:52:46,"Jer ako si u ratu ne opredijeljen, to ti nije dobro, ovo je kužiš."
0:52:47,0:52:49,"Ali Renato, čemu je sve to trebalo?"
0:52:50,0:52:59,"Je li to stvarno djelo tih tajnih službi treće strane, izložba u Vukovaru, gospodin Medaković, u Zagrebu?"
0:52:59,0:53:06,"Zašto se recimo sada aktualna vlast slika koketira, zna da mu radi toga može izgubiti izbore?"
0:53:06,0:53:09,"Jesu li njima maske palili, kako bi se to nazvalo?"
0:53:10,0:53:16,"Znači, izmožemo su se kao distancirali od te izložbe nakon što se dogodio prosvjed."
0:53:17,0:53:19,Ali oni su krenuli na izložbu.
0:53:20,0:53:23,"Dakle, njihovo opravdanje je šuplje ukratko."
0:53:23,0:53:27,"Oni su znali tipa kad dobiješ pozivnicu sedam dana prije, jel?"
0:53:27,0:53:33,"I šta sad, piše ti na pozivnici kud ideš, ti ne gledaš ni kud ideš ni šta, samo zato što te je Pupovac pozvao."
0:53:33,0:53:52,"I onda su kao došli tamo i otišli prije nego što je počelo službeno ovo, ali su bili prisutni i tamo ušli i davali izjave ispred, ispred objekta, davali izjave za televiziju, vidi se objekt iza, ali kao nisu ostali na službenom otvorenju ceremonije, izložbene."
0:53:53,0:54:00,"Ali da li je, mislim, ne znam reći je li slušta namjerno ili slučajno, ali je neprimjereno."
0:54:01,0:54:20,"I na kraju evo možemo koji je ono, evo, mnogi su jugo nostalgični prema onom svemu što govore ili dio njih, na kraju su se svi oni distancirali i rekli su da nisu htjeli ići na takvu izložbu i ne misle da je to dobro, pogotovo u ovo vrijeme."
0:54:21,0:54:33,"I sad mislim manjine imaju zaštićena svoja prava po Ustavu, ja ne vidim da nekome nešto fali osim incidenata kad se pojavljuju, ali incidenti su navijački, ovakvi i onakvi, razni."
0:54:34,0:54:58,"Tako da to što su oni pokrenuli u srpskim centrima po Hrvatskoj sve te programe, neprimjereno vrijeme po zakonu, su dva tri dana vezana za Vukovar, ali je atmosfera takva da jednostavno ili to radiš da bi provocirao ili nisi pametan, ne znam kako bi rekao."
0:54:59,0:55:06,"I najviše štetiš Srbima u Hrvatskoj i Hrvatima u Vojvodini, to je neki ovako moj zaključak, čak komalo čovjeka."
0:55:06,0:55:09,"Pa da, zato što svaka reakcija izaziva kontrarakciju."
0:55:10,0:55:14,"Renato, da sutra postaneš glavni načelnik Zagreba."
0:55:14,0:55:16,"Prva stvar, tko bi to napravio?"
0:55:16,0:55:18,"Ajde dobro, evo ti tri stvari, vidim ja da ti znam."
0:55:19,0:55:23,"tri, pa vidjet ćemo da li ću se opće vratiti u politiku, ajde to."
0:55:24,0:55:31,Evo vratit ću se ako se nađem u krugu ljudi koji nekako normalno zrelo razmišljaju.
0:55:31,0:55:52,"Evo ovako kako sam ja do sada predstavljao stvari, jer jedna osoba ne može ništa, ne, mora biti tim ljudi koji će imati kapacitete izgurati ključne stvari i imati dovoljno vremena sada i ponašati novca zbog medija da to predstavimo javnosti."
0:55:53,0:56:00,I ako to uspijemo složiti ja ću se onda i vratiti u politiku jer me politika zanima i dalje.
0:56:01,0:56:04,"Za sada ne, ako se ne ostvariti preduvjeti."
0:56:05,0:56:28,To bi značilo konkretno da li su to parlamentarni izbori dvadeset osam ili lokalni u zagrebu dvadeset devet to ćemo vidjeti o tome sve ovisi ali definitivno nekoliko ono ključnih stvari koje treba mislim napraviti kad se uđe u novu administraciju jedan clean start za financije govorim to tomašić nije napravio iako je obećao da će mu to biti prvi potez.
0:56:28,0:56:50,"Drugo što je obećao da će vratiti Magnoliju, to je bila simbolika, da će vratiti Magnoliju na džamiju tamo, jel pa toga nije stvarno puno koštalo, nikad to, čak ni to nije napravio iako su tamo bili dvadeset prosvjeda je bilo radi tog drveta, dvadeset prosvjeda je bilo tamo i kad su došli nisu vratili to drvo da zapiknu."
0:56:51,0:57:01,"I treće je rekao da će sa privatnicima, da će napraviti dubinsku analizu ugovora sa privatnim tvrtkama radi odljeva novca."
