Start (HH:MM:SS),End (HH:MM:SS),Segment
0:00:07,0:00:13,"Sadašnja tema je trenutna tema, to je Krist Kralj."
0:00:14,0:00:21,"To dolazim iz toga zato što sam pripremao niz tema Krist kao svećenik, Kralj i Krist kao prorok."
0:00:22,0:01:05,"Kroz to naša uloga kao kralja svećenika i proroka u ovom svetu, a prvenstvena tema je nastala na tome zato što imamo mušku grupu gdje neki koji dolaze su ovdje gdje smo odlučili gledati biblijske likove, gledati kr kroz Bibliju pravu ulogu muškarca i njegovog identiteta i kakav je on i kao jedna od važnijih stvari, a to je da je svaki muškarac kao svećenik i prorok u svojoj obitelji, koja je njegova uloga, na koji način bi trebao biti to u svojoj obitelji, tako da imamo tu grupu za neoženjene koji se tek pripremaju, tako da budu donekle spremni za taj brak i za svoju ulogu kao muškarci."
0:01:06,0:01:13,Ovo je vrijeme koje nikad nije bilo potrebno više pravog liderstva i pravog vodstva.
0:01:13,0:01:41,"Dakle, ovo je vrijeme koje zahtijeva pravu promjenu i to da kršćani napokon ustanu jer zlo nikad nije bilo toliko dostupno koliko je sad dostupno, dakle doslovno nam je sve što nije dobro pod nosom, ali isto tako ni Božja riječ nikad nije bila dostupnija, tako da nam i ona može biti cijelo vrijeme uz nas, uz ove napravice koje stalno nosimo na svojim rukama."
0:01:42,0:02:06,"Dakle i one dobre stvari su nam isto tako dostupnije nego ikada prije, tako da nemamo izgovora zašto to nismo čitali itede Dakle imamo, zove se, grupa se zove Tobija, zbog knjige Tobine i koju pouku to daje svom sinotobiju zbog pet stvari koje bi trebao on znati i kojih bi se trebao držati pa smo tako nastala muška grupa."
0:02:06,0:02:21,Ali sada ću govoriti za sve nas i općenito i za muške i za žene koja je uloga Krista kao kralja i kroz tu njegovu ulogu kada prepoznamo koju je on ulogu imao kao kralj kroz to možemo vidjeti i svoju ulogu u ovom svijetu.
0:02:25,0:02:27,"Dakle, Isus Krist, što znači Krist?"
0:02:30,0:02:30,Što znači Krist?
0:02:32,0:02:33,Je li to njegovo prezime?
0:02:36,0:02:39,"To je Isusovo prezime., nije isusovo prezime."
0:02:40,0:02:43,Krist znači pomazanik.
0:02:44,0:02:46,"Dakle, tko su bili pomazanici u Starom zavjetu?"
0:02:52,0:02:55,Tko su bili pomazanici u Starom zavjetu?
0:02:56,0:03:06,"U Starom zavjetu su pomazanici bili kraljevi, svećenici i proroci, to su bili pomazanici u Starom zavjetu."
0:03:06,0:03:12,"Dakle, Krist kao konačni, kao najveći, kraj svećenik i prorok ima taj naziv."
0:03:12,0:03:16,"Dakle, svi oni koji su u Starom zavjetu bili pomazanici su zapravo Zapravo kristići."
0:03:17,0:03:29,"Svatko od nas je isto tako kao pomazanik, zapravo kao krštenje, postajemo kršćani, zapravo postajemo kristići, kristići, postajemo pomazanici."
0:03:29,0:03:38,"Dakle, to svi imamo ulogu tu, u krštenju smo postali kraljice svećenici, proroci, to se potvrdilo na krizmi ili na svetoj potvrdi."
0:03:38,0:03:45,"O, dakle, to nije njegovo prezime niti neki nadimak, nego označava ulogu koju Bog ima preko njega."
0:03:45,0:04:21,"Isto tako, Isus, znači Bog spašava, dakle, to isto njegovo ime isto znači ono što će Bog učiniti preko njega jer Isus nije bilo tako neobičajeno ime u to vrijeme, dakle to je bilo često ime, ali preko njega, točno preko te osobe, preko tog Isusa je Bog htio spasiti narod, dakle označava njegovu ulogu kao što je ranije kasnije objašnjavao što znači Jakov, Lukovac, manipulator itede tako i Isus, znači Bog spašava."
0:04:21,0:04:36,"Oke, sad da bi nam bilo jasno koju ulogu Kris kao kralj ima, moramo vidjeti, zanimalo me, mene je zanimalo gdje se prvi put kralj spominje u Starom zavjetu, gdje se prvi put pojavljuje uloga kralja kod Izraelaca?"
0:04:40,0:04:41,Tko je bio prvi izraelski kralj?
0:04:45,0:04:47,"Ajde, ljudi, pa bili ste na vjeronauku."
0:04:48,0:04:52,"Neki ovdje teologiju studiraju, isto bratri i bratar."
0:04:53,0:04:56,A ti znaš sigurno.
0:04:57,0:04:59,Tko je bio prvi izraelski kralj?
0:05:01,0:05:02,"Mislim, šao."
0:05:03,0:05:04,"O, točno si rekao."
0:05:05,0:05:07,"Dakle, šao je bio prvi izraelski kralj."
0:05:07,0:05:23,"Glavno prije toga su imali, bili su i proroci, bili su suci, oni su upravljali Izraelcima i svećenici nakon Mojsija, Samoel u vrijeme Šavla i Izraelci su tražili svoga kralja."
0:05:23,0:05:24,Zašto su tražili kralja?
0:05:24,0:05:26,Pa zato što su svi drugi imali.
0:05:26,0:05:27,Nije bilo drugi razlog.
0:05:28,0:05:41,"Svi oko nas imaju, dakle kad čitate u Bibliji imena naroda oko njih, to nisu bile neke lokalne bande koje su maltretirale Izraelce, to su bila kraljevstva koja su imala svoje kraljeve i oni su gledali ostala kraljevstva imaju svoje kraljeve i zašto mi ne bi imali?"
0:05:41,0:05:43,"Zašto oni mogu imati kralja, a mi nemamo?"
0:05:43,0:05:45,I traže kralja.
0:05:45,0:05:56,"Na to Jahve kaže dobro, ali ovo će biti pogodnosti, tojest ovdje u Bibliji je naslov nezgodne strane kraljevske vlasti, ali zapravo su pogodnosti koje je kralj imao."
0:05:56,0:06:01,I onda me zanimalo šta je kralj sve posjedovao.
0:06:01,0:06:07,"Jer ako kažemo da je Krist, dakle da je Isus naš kralj, šta to znači za njegovu vlast u našem životu?"
0:06:08,0:06:11,I odgovor je u ovome što ću vam sada pročitati.
0:06:12,0:06:17,Što je rekao gospodin Samuel da kaže Izraelcima koje povlastice će imati šala ako će biti njihov kralj?
0:06:17,0:06:20,Kaže ovo će biti pravo kralja koji će kraljevati nad vama.
0:06:20,0:06:27,Uzimati će vaše sinove da mu služe kod bojnih kola i kod konja i oni će trčati pred njegovim bojnim kolima.
0:06:27,0:06:29,Postavljat će ih za tisućnike i pedesetnike.
0:06:29,0:06:36,"Orat će oni njegovu zemlju, žeti njegovu žetvu, izrađivati mu bojno oružje i opremu za njegova bojna kola."
0:06:36,0:06:41,"Uzimat će kralj vašeg čeri da mu priređuju mirisne pomasti, da mu kuhaju i peku."
0:06:43,0:06:50,"Uzimat će najbolja vaša polja, vaše vinograde i vaše maslenike i poklanjat će ih svojim dvoranima."
0:06:51,0:06:56,Uzimat će desetinu od vaših usjeva i vaših vinograda i davat će svojim dvoranima i svojim službenicima.
0:06:57,0:07:03,"Uzimat će vaše sluge i vaše sluškinje, vaše najljepše volove i magarce i upotrebljivati će ih za svoj posao."
0:07:03,0:07:08,"Uzimat će desetinu od vaše sitne stoke, a vi sami postaćete mu robovi."
0:07:10,0:07:13,"Šta ovo znači, na šta je imao kralj pravo?"
0:07:14,0:07:15,Na sve.
0:07:17,0:07:20,Kralj je imao pravo na što god je tražio.
0:07:22,0:07:28,"Pitanje, ako kažem da je Krist moj kralj, na šta on ima pravo u mom životu?"
0:07:28,0:07:32,"Na sve, na sve."
0:07:33,0:07:39,"Dakle, kaže najbolje, uzimat će najbolje od vašega, od vašega."
0:07:39,0:07:46,"Ovo je zanimljivo, svoje službenike je plaćao tako da je od onih ostatka naroda uzimao desetinu."
0:07:46,0:07:48,"Dakle, službenici njegovi šta su radili?"
0:07:49,0:07:55,"Radili su za svoga kralja i živjeli su od ostalog naroda, od ostalog naroda."
0:07:55,0:08:03,Tako mi danas imamo svećenike i sve ostale službenike u Božjem kraljevstvu koji bi trebali živjeti od onih kojima služe uz kralja.
0:08:04,0:08:09,"Ali ono što mi je zanimljivo, dakle ima pravo na sve, ima na sve."
0:08:09,0:08:16,I sad ima li Krist u mom životu pravo na sve ili ipak nema?
0:08:19,0:08:31,"Moj novčanik, kad se priča o novcu, uvijek se priča starijima o novcu, o crkvi, govori se o starijima kako bi oni trebali ovo, kako bi trebali ovo, kako bi trebali paziti na novac."
0:08:31,0:08:45,Ja sam mislio da treba pričati mladima o novcu jer stariji su već napravili hrpu grešaka i svaka druga treća osoba na molitvu mi dođe i traži molitvu za blagoslov financijski jer su u problemima.
0:08:45,0:08:47,I nitko nas u crkvi o tome ne uči.
0:08:48,0:08:52,"Tako rijetko nam pričaju kako se odnositi prema materijalnim sredstvima, kako se odnositi prema novcu."
0:08:53,0:09:04,"I onda kasnije gdje ćemo, pogotovo muškarci koji će odlučivati o financijama u svojoj obitelji ne znaju kako odlučivati i onda dovedu u svoju obitelj pod prokletstvo financijsko, zato što nisu znali."
0:09:05,0:09:13,"Već sada se učimo obratati našim novcem, već sada odlučujemo i pokazujemo koliko ćemo Bogu vjerovati čak i s tom stvarom."
0:09:14,0:09:24,"Možemo reći pa dobro, ja još ne zarađujem, nisam se zaposlio nigdje, dobro, ali s onime što imaš, pokazuješ mu koliko ćeš mu vjerovati, šta ćeš raditi s njim."
0:09:25,0:09:33,"Zato je to jedna od stvari koje to bi, rekao to bi, kako da se odnosi prema novcu i to je jedna od stvari koje radimo na muškoj grupi."
0:09:33,0:09:41,"Jednog dana će ovisiti o financijama, jednog dana će voditi financije i morat će odlučivati o tome i mislim da je jako bitno da nas o tome uči."
0:09:42,0:09:52,"Jedna od stvari koje se češće uči kada se priča mladihima o crkvi i čistoći, a to je uglavnom stvar o kojoj pričamo mladima i u redu treba, ali nije to jedina stvar koja mene zanima."
0:09:53,0:10:00,"Mene zanima i kako biti muž, mene zanima kako će trebati biti i otac, mene zanima kako će trebati voditi financije i sve ostale stvari."
0:10:00,0:10:10,"Jednog dana ću voditi neki posao, bit ću odgovoran za ljude ispod sebe, treba me naučiti kako se odnosi prema svojim radnicima i to su pet stvari koje to bit poučava svoga sinatobiju."
0:10:10,0:10:11,Zato od toga dolazim.
0:10:11,0:10:13,Ali ajmo vratiti se na kralja.
0:10:14,0:10:19,"Dakle, šaul nakon što je postao kralj nije baš bio neki idealni kralj."
0:10:21,0:10:29,"Na kraju krajeva šaula su skinuli, šaul Šaol je poginuo i na vlast je došao tko?"
0:10:31,0:10:31,David.
0:10:32,0:10:33,Nakon Šaola dolazi David.
0:10:34,0:10:40,David je slika i David je ideal kralja za Izraelce.
0:10:41,0:10:42,Što je David napravio za Izrael?
0:10:46,0:10:56,"Ujedinio je sva plemena, uspostavio jednu državu, postavio Jeruzalem kao glavni grad, pobijedio je neprijatelje, otjerao ih i htio izgraditi hram."
0:10:57,0:11:03,"Dakle, to je ideal, ideal za Izraelce kakav treba biti kralj."
0:11:03,0:11:06,"Dakle, David nije izgradio hram nego je izgradio hram tko?"
0:11:14,0:11:17,"Samo, ne samo, Salomon."
0:11:17,0:11:18,Salomon je izgradio hram.
0:11:18,0:11:25,"Dakle, David je pripremio pare, Salomon je išao graditi hram jer gospodin je rekao nećeš mi ti graditi hram nego tvoj sin."
0:11:25,0:11:31,"Dakle, pitanje koje se postavlja, od kada Izraelci očekuju mesiju?"
0:11:32,0:11:36,"Kada oni počinju čitati mesijanske tekstove u Bibliji, u svome pismu?"
0:11:47,0:11:49,"Šta mislite, od kada čekaju?"
0:11:52,0:11:57,"Ima jedan tekst koji ću vam pročitati, druga knjiga o Samuelu, kažem."
0:12:00,0:12:09,"I kad se ispune tvoji dani i ti počneš kod svojih otaca, podići ću tvoje potomka nakon tebe koji će se roditi od tvoje tijela i utvrdit ću njegovo kraljevstvo."
0:12:10,0:12:14,"On će sagraditi dom imenom mojem, a ja ću utvrditi njegovo prijestolje zauvijek."
0:12:14,0:12:16,"Ja ću njemu biti otac, a on će meni biti sin."
0:12:17,0:12:30,"Ako učiniš to zlo, kazni ću ga ljudskom šibom i udarcima kako ih zada recimo kako izdaju sinovi ljudski, ali svoje naklonosti neću odvratiti od njega kao što sam i odvratio od šaula koga sam uklonio ispred tebe."
0:12:31,0:12:37,"Tvoja će kuća i tvoje kraljevstvo trajati do vijeka, predamnom tvoje će prijestolje čvrsto stajati za svoga."
0:12:38,0:12:41,Natan prenese Davidu sve te riječi i cijelo viđenje.
0:12:43,0:12:44,O kome priča Natan?
0:12:49,0:12:51,O Salomonu.
0:12:52,0:12:53,Priča o Salomonu.
0:12:53,0:12:55,Ali ovo je mesijanski tekst.
0:12:56,0:13:00,I u kojem trenutku Izraelci počinju ovo promatrati kao mesijanski tekst.
0:13:02,0:13:41,"Nakon progonstva u Babilon, nakon progonstva u Babilon, kada su izgubili svoju državu od četiristo godine prije Krista do jedna tisuća devetsto četrdeset osam godine izraelci nemaju svoju državu nisu imali svoju državu dakle od progonstva u babilon četiri stoljeće prije krista izraelci općenito počinju kao narod vjerovati u skrsnuće i počinju čekati mesiju i čitati ovaj tekst kao mesijanski ovo je mesijanski tekst i kad se čita ovo oni misle na novog davida na novog davida njegovog sina i misli se na Krista."
0:13:43,0:13:49,Jer šta će im mesija kada imaju svoju državu?
0:13:49,0:13:51,Šta će im mesija koji imaju svoju vlast?
0:13:53,0:13:54,Nije im bio potreban.
0:13:54,0:13:57,Šta će meni Krista koji ima svoju vlast nad svojim životom?
0:13:58,0:13:58,Nije mi potreban.
0:13:59,0:14:07,Tek kad se počnemo gubiti i tek kad imamo neke probleme onda odlučimo tražiti Krista i onda odlučimo tražiti njegovo spasenje i da uđu u naš život.
0:14:08,0:14:12,"Ali dok ja vladam svima u svome životu i dok je meni dobro, pa šta će meni Bog?"
0:14:21,0:14:26,Šta će mi netko kome treba spasiti iz svega toga?
0:14:26,0:14:27,Šta će me spasiti?
0:14:27,0:14:28,On će mi dati hrpu zapovijedi.
0:14:28,0:14:30,Zašto Bože zapovijedi?
0:14:30,0:14:31,Zašto je dao zapovijedi?
0:14:34,0:14:35,Zato da bi nas mučio?
0:14:38,0:14:39,Zašto su Bože zapovijedi?
0:14:39,0:14:40,To mene je bilo mučilo.
0:14:41,0:14:42,Ali znate šta ja mislim?
0:14:42,0:14:52,"Ja mislim da su Bože zapovijedi čisto da mu mogu pokazati ljubav, da ograničenja kako bi mu mogao pokazati ljubav, kako bi mu mogao pokazati koliko ga volim."
0:14:52,0:14:55,Jer tko mene ljubi čuva moje zapovijedi.
0:14:57,0:15:11,"Zamislite, cure, da imate dečka koji nema ograničenja, pa ne veze šta je s vama, pa smije biti s bilo kojom drugom curom kojoj mu se sviđa može biti drugo, jel tako i kasnije ođete u brak s mužem koji isto tako uzme ženu kojeg god hoće, bo ga briga."
0:15:13,0:15:14,Jel može to?
0:15:15,0:15:18,A koja bi htjela takvu dečku?
0:15:20,0:15:25,"Dečke dižu ruke, vi bi htjeli takvu ženu koja to pušta."
0:15:27,0:15:44,"Dakle ne bi, ali za nismo onda grubi, za nismo onda dosadni, pa e sad mi od njega tražimo da samo bude nama vjeran, samo da nas ljubi, samo da nas najviše voli, samo da nas sluša, samo da nama priča, da smo mi na prvom mjestu, zar nismo grubi?"
0:15:45,0:15:51,Zar nismo grubi ako ga u brak stavimo u nekakve okvire i zatvoreni prostor i on mora ostati u tom braku čitavu vječnost?
0:15:54,0:15:55,Jesmo.
0:15:56,0:16:01,"Ali ta ograničenja, na tim ograničenjima on pokazuje svoj ljubav."
0:16:03,0:16:06,Na taj način mi pokazujemo jednim drugima ljubav.
0:16:07,0:16:11,"Slobodno mi je sve činiti i gospodin kaže, slobodno ti je sve činiti, ali ti sve ne koristi."
0:16:12,0:16:15,"Slobodno mi je sve činiti, ali ne želim jer tebe volim, tebe ljubim, tebe želim."
0:16:17,0:16:28,"To ćemo reći svojim supružnicima, svojem dečku, svojoj curi, to ćemo joj reći, želim tebe i bit ću ti vjeran."
0:16:30,0:16:35,"Na taj način mu pokazujem ljubav za ne, na taj način mu iskazujem poštovanje."
0:16:36,0:16:43,"Onda ako kažem da Boga ljubim, ali ne želim se držati njegove zapovijedi, nego želim šarat okolo, jel pokazujem ljubav ili šta?"
0:16:44,0:16:49,"Ne pokazujem, pokazujem ljubav tako da čuvam te zapovijedi, tako da se trudim."
0:16:52,0:17:01,Ali oni znaju za naše slabosti i za naše trenutke kada padnemo i on ostaje vjeran iako smo mi nevjerni i on ne prekida svoju vjernost.
0:17:04,0:17:07,"Zato zapovijedi, zato zapovijedi."
0:17:11,0:17:31,"I onda kada znam da ako ih čuvam je moj iskaz ljubavi prema njemu, nije mi teško jer ga ljubim, jer ljubim tog kralja, onda želim to raditi jednako kao što se odnosimo jedni prema drugima i prema svojim partnerima."
0:17:32,0:17:40,"Nemi muka zato što ne smije nikog drugog pogledat, možda nekome je, ali želim, odluka je."
0:17:41,0:17:58,"Dakle, David kao kralj je napravio to da je okupio Izraelce, istirao neprijatelje, ustanovio glavni grad, htio je izgraditi hram i zapravo napravio šator gdje je bilo slavljenje dan i noć i to je napravio."
0:18:00,0:18:02,Što se očekuje od Novog mesija da će napraviti?
0:18:02,0:18:04,Šta su Izraelci čekali do ovoga Isusa?
0:18:04,0:18:12,"Čekali su kralja koji će istirati Rimljane, koji će okupiti Izraelce, koji će ustanoviti državu i koji će obnoviti hram."
0:18:14,0:18:17,"Dakle, čemu čekati takvoga mesiju prije Davida?"
0:18:18,0:18:25,"Dakle, očekuju mesiju nakon progonstva, nakon progonstva u Babilon."
0:18:26,0:18:31,Nakon tog progonstva očekuju mesiju i očekuju novog Davida koji će to sve učiniti.
0:18:31,0:18:42,"Dakle, kroz tu sliku, čekali su i oni patnika i takvog mesiju, ali više im se sviđala ova slika, zato ih je Isus zbunjivao, očekivali su da će Isus vladati na ovom svijetu."
0:18:43,0:18:47,"Dakle, s Isusom dolazi novo kraljevstvo i staro kraljevstvo, odlazi."
0:18:49,0:18:54,"I sada ono što je zanimljivo, kada se Isus rodio, i kada su mudraci dolazili, tko je zadrhtao?"
0:19:00,0:19:03,Jeruzalem i Herod.
0:19:05,0:19:11,Zašto je Herod drhtao?
0:19:12,0:19:25,"Prvo, mene je zanimalo, piše da Herod pita mudrace gdje se je imao roditi taj Krist, taj izraelski novi kralj, Židova, da dođem i ja mu se poklonim."
0:19:25,0:19:30,I mislim si koji Židov ispovijeda Krista kao Mesiju i zna što treba napraviti.
0:19:30,0:19:35,mesija i zna da je dobra stvar i onda ga hoće ubiti.
0:19:37,0:19:38,Koji je razlog gdje ste to primijetili?
0:19:39,0:19:47,"Dakle ispovijeda ga kao mesiju, ispovijeda ga kao spasitelja, kao pomazanika i onda traži da sazna gdje se ima roditi tako da bi ga mogao otići ubiti."
0:19:49,0:19:57,"I prvo sam se mislio zato što je Herod Đak, nema druge, na kraju popije tamo onu djecu, dakle lud čovjek nema šta drugo biti."
0:19:58,0:20:09,"I onda saznam, čitam zapravo povijest Herodovu i Herod uopće nije bio original židov, on je oko sto pedeset dio naroda koji je oko sto pedeset godine prije krista požidovljen."
0:20:10,0:20:15,"Dakle, uopće nije bio originalni židov i došao je na vlast pomoću Rimljana."
0:20:17,0:20:20,Zato mu se nije sviđalo jer su svi znali šta treba Novi Mesi napraviti.
0:20:20,0:20:22,Novi Mesi treba izbaciti Rimljane i vladat.
0:20:23,0:20:26,"To su oni očekivali u Kristu, to mu se nije svidjelo."
0:20:26,0:20:28,Izbacit će one preko kojih sam ja došao na vlast.
0:20:29,0:20:32,I onda će on vladati i moj život je gotov.
0:20:32,0:20:35,"Moj ugodni život, moja vlast i moć koju ja imam gotovo."
0:20:36,0:20:40,Herod je bio toliko lud da je ubio svoju ženu i svoja dva sina zato što se bojao za svoju vlast.
0:20:42,0:20:48,"Dakle, za njega sve što mu je bila prepreka da dođe na vlast, on je to rješavao i tako, tako što ih je ubio."
0:20:48,0:20:56,"Dakle, nije bio neka mitica, niti je bio original Židova tako da ga možete bolje razumjeti šta je on napravio u tom trenutku."
0:20:56,0:21:04,"Ali, Herod se boji jel dolazi Isus koji će na taj način vladati onakav kakav su svi Židovi očekivali."
0:21:04,0:21:07,"Ali da ga je poznavao, ne bi ga se bojao."
0:21:08,0:21:16,"Da je znao tko je Isus zapravo i kakav je on Mesije, na koji način će on vladati, bolilo bi ga briga, ne bi ga htio ubiti."
0:21:16,0:21:17,Ista stvar je s nama.
0:21:18,0:21:23,"Da ga poznajemo, ne bi se bojali toga da nam on bude kralj."
0:21:24,0:21:26,"Ali, budući da ga ne poznajem, bojim se prepustiti djelu svoga života."
0:21:27,0:21:27,života.
0:21:28,0:21:30,"Jer šta, ako mu upustim šta će mi dati?"
0:21:32,0:21:37,Bojim se predati svoj život Kristu zato što se bojim da mi ne uvali nešto što ja ne želim.
0:21:40,0:21:44,"Ali on neće dati nešto što mi ne možemo podnijeti s ljubavlju, što mi ne možemo iznijeti."
0:21:44,0:21:47,"On zna koliko mi možemo, neće nam dati preko toga."
0:21:48,0:21:49,I nije taj koji uvaljuje.
0:21:51,0:21:53,Nije takav.
0:21:53,0:21:55,"Dakle, to je kriva slika koju Herod ima."
