Start (HH:MM:SS),End (HH:MM:SS),Segment
0:00:00,0:00:02,pokušavamo otvoriti vrata za sve.
0:00:03,0:00:10,"Tako da svi oni koji su zainteresirani, koji žele želimo da se osjeća ovdje dobrodošlo na kraju krajeva."
0:00:17,0:00:19,"Poštovani gledatelji, dobar vam dan."
0:00:19,0:00:21,Dobrodošli u podcast Mreža riječi.
0:00:21,0:00:26,S nama je danas voditeljica Riznice iz Splitske katedrale Ana Vukas Belas.
0:00:26,0:00:27,Ana dobro nam došla.
0:00:27,0:00:29,"Hvala, bolje vas našla."
0:00:29,0:00:36,"Evo, kako je zapravo i kada uopće otvorena Riznica iz Splitske katedrale i kako je do toga došlo?"
0:00:36,0:00:44,Pa Riznica iz Splitske katedrale u ovom formatu kakav danas imamo i kako znamo otvorena je prije nekih tri godine na blagdan sv.
0:00:44,0:00:53,Jeronima koji je inače i zaštitnik Dalmacije u palači Skoči Lučić Lokaris na jugozapadnom dijelu plokate sv.
0:00:53,0:00:56,Dujma tojest na Peristilu pored kapelica.
0:00:57,0:01:02,"Naravno, riznica Splitske katedrale stoljećima je djelovala uz samu katedralu sv."
0:01:02,0:01:39,"Dujma uz kuću koja je bila prislonjena na sami kor katedrale, tako da ta tradicija posjećivanja i čuvanja blaga unutar riznica naših katedrala, ne samo Splitske nego i ostalih katedrala u Hrvatskoj je jedna već stoljetna i tradicija koja je evo sad samo dobila jedan novi format, jedan bolji prostor da se ta zapravo jedna priča i naše kulturno i vjersko nasljeđe bolje prezentira javnosti, vjernicima i svim posjetiteljima koji dolaze u svakodnevnu Riznicu."
0:01:40,0:01:44,Možeš li našim gledateljima pisati malo unutrašnje uređenje Riznice?
0:01:45,0:01:45,Naravno.
0:01:46,0:02:03,"Uglavnom, koncept Riznice Splitske katedrale osmislila je gospođa Vanja Kovačić koja je bila dugogodišnja djelatnica konzervatorskog odjela u Splitu u suradnji naravno sa Splitsko-makarsko nadbiskupijom i županom uznesenja Blažne Djevice Marije pod kojom je katedrala sv."
0:02:03,0:02:03,Dujma.
0:02:04,0:02:16,"U palači Skočebučić-Lukaris, zapravo u ovom zapadnom dijelu Njene, cijeloj palači, formiran je postav Riznice katedrale kroz prizemlje i dva kata."
0:02:17,0:03:16,"U prizemlju Riznice katedrale osmišljeno je da bude zastupljena kamena plastika tojest razdoblje od antike četiri stoljeća, istraživanja koja su provedena unutar katedrale tijekom zadnjih godina i prošlog desetljeća su tu prezentirana zajedno sa kamenom plastikom tojest nadgrobnim pločama, spomenicima te nekim eksponatima koji su nam zapravo sačuvani i doneseni iz različitih dijelova crkvica sa naprimjer recimo Smarjana i okolnih crkava ovdje unutar same jezgre grada Splita tojest palače Dioklicijanove, a kroz prvi i drugi kad su nas zasukano po ajmo reći nekim povijesno umjetničkim nepouhama tako da se proteže od ranog srednjeg vijeka pa sve do prve polovice osamnaest stoljeća i taj neki razdoblje baroka."
0:03:17,0:03:36,"Naravno veliki dio Riznice Split i katedrale, to je druga polovica osamnaest stoljeća, devetnaest i dvadeset stoljeća još nije izloženo zbog naravno nedostatka prostora i da se nešto adekvatno i na zapravo pravi način prezentira javnosti i svim našim zapravo posjetiteljima."
0:03:36,0:04:00,"Tako da kada smo otvarali Riznicu katedrale, kada su se radile zapravo prve pripreme uopće što uključiti u postav i odabrati ono što je zapravo najbitnije bilo je izuzetno teško jer puno toga što je očuvano u Riznici nakon evo toliko vremena i stoljeća se i restauriralo i mnogo toga je zapravo ima svaku priču iza sebe."
0:04:01,0:04:55,"Tako da sada trenutno da imamo skoro pa sve eksponate koji su i predmeti bili u svakodnevnoj upotrebi unutar crkve, unutar katedrale i drugih crkava koje su bile ovdje na recimo naprimjer crkva mrtve dušice koja je bila na srebrenim vratima koja danas više ne postoji su, taj inventar je prebačen u katedralu i dio tog inventara se također nalazi ovdje u postavu Riznice Splitske katedrale pa uvijek se nekako pokušava Hrvatska prezentirati na najbolji mogući način ono što nam je ostalo kroz sve te vijekove jer ti stari zapravo zapisi iz vizitacija i biskupa i iz Rima također imamo popise od čak srednjeg vijeka što je bilo unutar iznice."
0:04:55,0:04:56,Mnogo toga danas nema.
0:04:57,0:05:28,"Naravno tu trebamo uzeti u kontekst i vrijeme u kojem smo živjeli i učestale turbulencije, promjene vlasti od ljetačke republike, od onog turbulentnog perioda kada je Osmansko carstvo ovdje bilo na vratima, kada su bile mnoge i borbe i kada je Crkva izrazito sudjelovala aktivno i u obrani grada i investirala zapravo u obranu, tako da su tko zna koliko je toga blaga koje je bilo eto netko čuo u samoj riznici iskorišteno upravo da se financira obrana."
0:05:28,0:05:39,"Tako da ima, tu je jedan veliki i široki spektar zapravo i povijesnog i umjetničkog, vjerskog i kulturnog značenja unutar riznice trenutno sačuvan."
0:05:39,0:05:47,"U svakom tom predmetu kada bi se išlo dublje istraživati, nađete jednu zanimljivu zapravo pripovijest o jednom minulom vremenu."
0:05:48,0:05:58,"Pa evo, možeš nam neke konkretne predmete predstaviti koji je možda tebi najdraži općenito, šta misliš, šta je ljudima onako najzanimljivije kada uđu u Riznicu?"
0:05:58,0:06:34,"Pa evo, mi ovo radimo, a je uče, stalo sa kolegama Kustosima i Ture, tu dolazi nama i puno stranaca, puno osoba iz kulturnog života i ne samo Hrvatske nego i izvana kad dolaze u bilo kakve službeni posjeti, tako da ih onda učestalo provedemo ne samo kroz Riznicu nego i kroz katedralu, Kripto Krstijonicu jer to isto je sve pod Riznicom Splitske katedrale, cijeli taj katedral, ne možemo reći kompleks nekadašnji zapravo taj trg koji je bio zapravo posve unutar cijelog ovog našeg sada dijela gdje se nalazimo i na peristilu."
0:06:36,0:06:53,"Tako da većina ljudi ono što ih obično zanima, oni vole onaj neki spoj između te vjerske povijesti naše i one prošlosti koja je vezana često i za političke okolnosti ovdje života i one normalne socijalne okolnosti."
0:06:53,0:07:15,Pa uglavnom jedan od najznačajnijih predmeta u kojoj većini se ljudi sviđa je zapravo pokaznica Katarine Dražujević koja je bila supruga kneza Dražujevića koji je bio istaknuti vojsko vođa ovdje na području Splita i okolice i koji je zapravo slavno poginuo ajmo reći u borbi protiv Osmanlija.
0:07:16,0:07:19,I on je bio pokopan upravo u katedrali sv.
0:07:19,0:07:30,"Dujma, to se i dan danas nalazi njegov grob uz glavni oltar, a njegova nadgrobna ploča je upravo u prizemlju Riznice Eskucije katedrale."
0:07:30,0:07:40,"Dugo godina ona je bila unutar same katedrale pa se premještala i kod Krstijonice, tako da je nekako uvijek bila tu po samom sklopu tom katedralom."
0:07:40,0:08:05,"Ali sama ta monstranca koju je napravio Viktor de Angelis je izrazito zanimljiva zato što je ona zapravo jedan predmet koji je zapravo jedan prvi primjer renesanse u hrvatskoj umjetnosti, čak i prije renesanse nego što je počela u Italiji u onom svom obujmu, s onim valom koji je donio i Leonardo da Vinci i ostali umjetnici tog vremena."
0:08:06,0:08:22,"I interesantna je upravo u tom smislu tog umjetničkog obrta, ali i kao zavjetni dar jedne udovice i njezine vjere i požrtvovnosti koja je odlučila to darovati, tu pokaznicu katedrali nakon smrti svoga muža."
0:08:23,0:08:25,"Je li splitski evanđelistar, je li on izložen?"
0:08:26,0:08:47,"Splitski evanđelistar još uvijek nije nije izložen u Briznici iz Splitske katedrale, jednog dana se nadam da će biti jer to je zapravo jedna od naših najznačajnijih knjiga koja zaslužuje samo ona za sebe jedan cijeli prostor s obzirom koliko se istraživanja radilo o samom Evangelistaru i koliko je bitan za cijelu našu povijest, ne samo za Split nego za Hrvatsku i šire."
0:08:48,0:08:55,Tako da se nadamo da će u bliskoj budućnosti biti ovdje izloženo u onoj pravoj mjeri i sa osiguranjem kako zaslužuje.
0:08:55,0:09:05,"Pa evo može samo ukratko našim gledateljima reći zašto je on zapravo toliko bitan, po čemu je on tako poseban, zašto je to jedna od najznačajnijih knjiga u hrvatskoj povijesti."
0:09:06,0:09:35,Pa jedna od naših najznačajnijih zapravo je knjiga Inkunabula koja je pisana ne samo sa latinskim pismom nego na nekoliko vrsta pisama i goticom i zanimljiva je upravo i zbog toga što su na njezinim koricama potpisane i zaklete sufragana splitskomakarske metropolije ili ondašnje salonitanske kao nasljednice splitskomakarske kao nasljednica salonitanske metropolije.
0:09:35,0:10:06,"Tako da je zapravo evangelista Rusebi je zapravo jedan isto i povijesni dokument koji je od izrazite nam važnosti zato što je u i pomoću njega pratimo kao neki tijek unutar same Crkve u Splitu, ali i zbog toga što je kao okuplja i Evanđelja unutar i u tom obliku i kako je pisan je neprocjenjivo zapravo blago za cijelu našu zajednicu oko ne samo Splita nego i šire."
0:10:08,0:10:19,Evo kada se slušaju i gledaju različiti mediji stječe se dojam da turiste u Splitu i u okolici Splita više manje zanima samo zabava.
0:10:19,0:10:20,Pa je li to baš tako?
0:10:20,0:10:23,Kakva je posjećenost u našoj Bliznici?
0:10:23,0:10:35,"Pa mi se stvarno ne možemo požaliti na posjećenost jer manje-više svi turisti koji dođu ovdje i grupe organizirane dođu posjetiti i Rijeznicu, Katedralu sv."
0:10:35,0:10:36,Tobula obavezno i Zvonik.
0:10:37,0:10:40,Manje-više je skoro sve što se nudi ovdje na peristilu.
0:10:41,0:11:04,Ne samo zato moguće da nam ide u veliki prilog i sama lokacija jer smo u centru Dioklecijanove palače pa i svi koji dolaze dolaze manje-više tu na peristilu i ovdje su koncentrirani ne samo mi nego i mnogi muzeji oko nas su tu smješteni tako da je ovdje zapravo dolaze na vrelo kulture i povijesti u Splitu i neminovno je da neće zaobići.
0:11:04,0:11:39,"Tako da ovo što mi posjetitelja vidimo i kad imamo i prilike s njima doći u izravan kontakt osobito putem vodstava ili nekih organiziranih tura, većina njih je zadivljena, osobito oni koji nisu toliko upoznati sa našom kulturom ili poviješću i općenito sa Hrvatskom, budu iznenađeni koliko zapravo otkad, otkud smo mi tu i otkada je ova zapravo i katedrala tu i otkad je zapravo vjera ovdje i Katolička Crkva."
0:11:39,0:11:57,Tako da njima je interesantno vidjeti predmete koji su od četiri stoljeća pa recimo do druge polovice osamnaest stoljeća jer nekim mladim državama to je skoro pa nestvarno da se nešto nakon toliko dugo vremena očuvalo.
0:11:59,0:12:12,"Dolaze li mladi, imali mladih turista ili je to su uglavnom ljudi u sedamdesetim godinama jer onako isto stječe se dojam da mladi nisu baš općenito zainteresirani za umjetnost pa jesu šta ti misliš?"
0:12:14,0:12:18,"Pa moram reći ovako, nama dolazi stvarno široka lepeza ljudi."
0:12:19,0:12:45,"Dolaze ljudi koji su pa rekao bih pretežno da na mlade ljudi dolaze najviše, ali imamo i dosta i starijih ljudi, možda oni malo više osjetljiviji na kulturu nego današnje generacije koje opet su neki drugi aspekt gledaju, ali ima i dosta koji su stvarno zainteresirani, koji ih i zanima i pitaju i vole i više saznati od onoga što je ponuđeno."
0:12:45,0:13:27,"Tako da ne mogu reći da nema interesa iako je danas jako teško i procijeniti, mnogi oni su tu samo u prolazu, onda je teško procijeniti koliko toga nekome zbilja ostane nakon posjeta, neki su samo tu na kratko jer opet kad gledate grad Split, puno posjetitelja koji dolaze, dolaze i s kruzerima i oni su ograničeni općenito u vremenu da se nešto mogu posvetiti, ali imamo naprimjer povratne informacije gdje se ljudi vraćaju, koji su bili prije recimo par godina i sada su se ponovno vratili i znenade se kad vide da je riznica ovdje sada i onda se sjete i kažu ajme pa to nismo uopće primijetili kad smo zadnji put bili tu pola toga."
0:13:27,0:13:35,Tako da moram priznati da ima puno više pozitivnih reakcija i od mlađih i od starijih posjetitelja.
0:13:36,0:13:46,"Ali u većini slučajeva ono što primijetimo, većinom su mlađi posjetitelji, a starije nekako dolaze u onoj podsezoni ili predsezoni nekako više organizirano kada su manje vrućine."
0:13:48,0:13:49,Koji su vaši budući projekti?
0:13:50,0:14:38,"Pa mi imamo dosta projekata koji su povezani sa restauracijom i održavanjem samokatedralnog sklopa, tako da dosta surađujemo sa restauratorima, sa konzervatorima, sa Ministarstvom kulture, pa evo i sa županijom, tako da non-stop pokušavamo unaprijediti, poboljšati ne samo uvjete kako se nešto i izlaže i da idemo u korak i sa vremenom da nije sve, da bude interdisciplinarno, da se može mlađima približiti i pomoću tehnologije umjetnost koja je stara više stoljeća i da se maknemo možda od onih sasvim tradicionalnih načina prezentiranja naših zaštićenih kulturnih dobara."
0:14:38,0:14:53,"Naravno, ovdje imamo veliki izazov zato što je puno toga što se tiče naprimjer same katedrale ili arhitektonskih ovih naših spomenika poput i krstijonice i kripte ograničeno je i zakonima i konzervatorske struke."
0:14:53,0:14:58,Tako da tu uvijek morate biti na neki način domišljati na koji način možete nešto prezentirati.
0:14:59,0:15:49,"Uvijek je bilo najlakše kroz priču, kroz direktnu komunikaciju, ali danas evo postoje mnoge i aplikacije gdje ne morate sad biti nužno vezani za materijal, ono čvrsti opipljiv, nego možete putem aplikacija i različitih drugih načina pomoći da nešto više saznaju naprimjer o samoj katedrali, tako da nam je jedan od idućih projekata zapravo da pokušamo pomoću aplikacije cijeli taj neki sustav povezati kao virtualne ture gdje mogu još poznati i dalje određenim eksponatima, povezati recimo sa ostalim crpama unutar Splitsko-makarske nadiskupije jer katedrala je sama isto povezana i sa Salonom i sa naprimjer Gospodinom od Poišana i sa Marijanom i s ovim crkvicama sve koji su unutar same Diocletianove palače."
0:15:49,0:16:19,"Tako da ono što je za budućnost cilj je napraviti neku i odredni bazu podataka i središte odakle bi se moglo na kraju krajeva poslati one koji su zainteresirani da mogu otići i vidjeti i druge i župe i zajednice i crkve koje su isto predivne i primjeri ne samo predivni iz povijesti i umjetnosti već i nešto da se još više saznamo o našoj samoj kulturi, baštini i vjeri koja je tu."
0:16:20,0:16:36,"Tako da pokušavamo te projekte nekako progurati, a ujedno i ove koji nam obuhvaćaju uvijek održavanje koje je najteže jer katedrala samo kao katedrala zbog svoje lokacije gdje je nije lako obnavljati."
0:16:36,0:16:50,Evo mi već zadnje dva tri godine radimo na peripteru katedrale i obnavljamo samu tu konstrukciju da bude u ovom obliku koji jest i za sljedeće naraštaje.
0:16:50,0:17:07,"I to su veliki projekti koji zahtijevaju puno i pripreme, višegodišodišnje i iz godine u godinu se malo po malo radi, tako da imamo uvijek nešto što se mora planirati unaprijed, tako da je to ono vječno održavanje."
0:17:08,0:17:11,Pa krenuli ste u neke projekte radionice za djecu?
0:17:11,0:17:37,"Da, tako je unutar same riznice katedrale radimo također radionice za djecu jer smatramo uvijek nekako da je najbitnije krenuti od najmlađih naraštaja, tako da njih odgajamo da oni kasnije eto mogu skupiti i iskustva i da mogu neka lijepa sjećanja ovdje stvoriti pa za pa kasnije kad dođu i kad postanu stariji da se mogu opet i vratiti na neki način."
0:17:37,0:18:10,"Tako da uglavnom radionice vežemo isto i uz vjerski karakter, uz ako imamo neke prigodne blagdane, uz isto povijesnu umjetničku struku gdje često suzrađujemo i sa konzervatorsko-restauratorskim firmama koje isto pomažu kao doktori za umjetnine djeci objasniti kako se nešto zapravo može popraviti, kako ništa nije zapravo ono što je staro zapravo može biti jako vrijedno i kako to održati i dalje vrijednim."
0:18:11,0:18:15,Pa tu imamo različite radionice uvijek u Sudan i u Sred blagdan sv.
0:18:15,0:18:40,"Dujma, ljetne radionice su nam uvijek najaktivnije i najlakše je organizirati kada su djeca fleksibilnija i nama je tada lakše jer nismo ograničeni samo vikendom jer i roditeljima mislim nije ni njima lako u sredu školskog tjedna djecu sad voditi i na radionice, tako da smo ono kad je školska godina, smo vikendom radimo radionice, a ovako ljeti smo ono i u sred tjedna i stvarno smo sretni sa odazivom."
0:18:41,0:19:14,"Evo sad smo imali radionice vezane i za veliku GOSP-u gdje smo radili, sad je kupaž tehnikom je kolegica Kusodica Monika Stjepanovaović vodila radionicu izrade kao kutijica koje su zapravo trebale prezentirati kao zavjetne kutijice koje su se neko čisto bile jako značajne u tom crkvenoj umjetnosti, pa je odnosno sa tehnikom dekupaža prilagodila djeci što je zapravo njima najlakše na neki način."
0:19:14,0:19:19,Pa bude povezano i sa Svetom Lucom koja je ovdje uz samu katedralu.
0:19:19,0:19:40,"Često prošle godine smo naprimjer organizirali radionice gdje smo izrađivali adventske vijence i pomagali za udrugama kao Svetog Vinka Paulskoga i za sinomašne i nemoćne, tako da volim ono da budem i nekog dobrotvornog karaktera, a ujedno i da sudionici nešto nauče i da nešto sa sobom na kraju krajeva ponesu kući."
0:19:41,0:19:45,"I ne samo lijepo vrijeme da provedu ovdje u druženju, nego da imaju i neku uspomenu."
0:19:46,0:19:49,Dakle i karitativna jedna djelatnost.
0:19:49,0:19:57,"Pa jest, mislim da je to ipak ono cilj jer opet bitno je i dati na kraju krajeva nešto i zajednici."
0:19:59,0:20:03,Pa je li Riznica Splitske katedrale može evangelizirati danas?
0:20:04,0:20:05,"Pa ako može, na koji način može?"
0:20:06,0:20:10,Pa mislim da svi mi možemo na neki određeni način doprinijeti evangelizaciji.
0:20:11,0:20:27,"Mi možda evo putem ovih radionica najviše i sa djecom kada radimo i s roditeljima toliko dođe i ljudi koji se iznenade da radimo tako jer naprimjer da ne naplaćujemo radionice, da sve što napravimo, da darujemo i budu iznenađeni jer nisu navikli na to."
0:20:28,0:20:33,A stvar je i da nekako pokušavamo otvoriti vrata za sve.
0:20:34,0:20:59,"Tako da svi oni koji su zainteresirani, koji žele želimo da se osjeća ovdje dobrodošlo na kraju krajeva i kroz same recimo organizirane i sa školama, i ture i sa vjeroučiteljima, učiteljima pokušavamo da se nekako privučemo i mlađe naraštaje, ne samo djecu vrtićke i ove školske dobi nego i srednjoškolce i sa fakulteta."
0:20:59,0:21:24,"Isto tako da imamo i suradnju već i sa fakultetima koji dolaze, tako da pokušavamo i kroz ovaj način prezentiranja naše vjere i povijesti i crkvene umjetnosti približiti neki to osjete i pobudi se možda u nekome i nešto, ali eto nadamo se da ćemo i naći još neke druge načine da otvorimo, da se još više nekako prema ljudima budemo otvoreni i da osjete sve pozvani da dođu."
0:21:25,0:21:40,"Pa evo za kraj možeš li pozvatiati baš ljude da dođu, a posebno naše sugrađane koji tu žive tijekom cijele godine nekako stječe se dojam da nam puno više dolaze turisti iz stranih država i pa evo možeš pozvati naše domaće ljude."
0:21:41,0:21:53,"Pa ja bih jako voljela da naši domaćini ovdje ni Splićani, ali i šire okolice, cijele županije i Hrvatske da dođu, da vide, da se upoznaju sa i sa iznosom katedrale."
0:21:53,0:22:00,"Nažalost, puno Splićana koji dođu kažu nisu nikada popeli na zvonik svetog duha, nisu ušli u katedralu, a žive u neposrednoj blizini."
0:22:00,0:22:07,A mi za stvarno za naše posjetitelje obavezno kažemo da obaveznono je da djecu dovedu i da vide.
0:22:08,0:22:11,Tako da vrata su uvijek otvorena.
0:22:11,0:22:13,Za sve upite uvijek se mogu javiti.
0:22:13,0:22:14,Imamo mailove.
0:22:15,0:22:17,I danas putem društvenih mreža smo uvijek dostupni.
0:22:18,0:22:22,"Tako da, draga srca, pozivamo sve koji su voljni doći neka dođu."
0:22:23,0:22:26,Hvala ti što si bila s nama i što si izvojila svoje vrijeme za nas.
0:22:27,0:22:27,Hvala vama.
0:22:28,0:22:29,Bilo mi je zadovoljstvo.
