Start (HH:MM:SS),End (HH:MM:SS),Segment
0:00:01,0:00:01,Hvala lijepa.
0:00:02,0:00:06,"Marija, malo je ruže ovdje, ali snaćemo se."
0:00:10,0:00:16,"Uglavnom, evo večeras imam tu čast govoriti ovdje pred vama, ali neću biti jedini."
0:00:16,0:00:20,Iza mene je Kiki pa bi volio odmah početi sa onim o čemu ćemo pričat.
0:00:22,0:00:56,"Zadnji put je ovdje bio Miše, on je govorio o buđenju i obraćenju i govorio je o tome kako Ralf Martin u svojoj knjizi ispunjenje svake želje, donosi razmišljanja svetaca o tome kako naše obraćenje izgleda, donosi njihova svjedočanstva, a danas ćemo u stvari malo ući u njihov način razmišljanja, stvari kako sveci razmišljaju, što je temelj njihovog razmišljanja, njihovih misli i zašto su zbog toga došli tu gdje jesu, zašto su napravili tolika čudesa i tolike velike stvari za gospodina."
0:00:57,0:01:01,I temelj njihovog razmišljanja je ova knjiga ovdje.
0:01:03,0:01:06,Oni svijet gledaju na potpuno drugačiji način od većine nas.
0:01:07,0:01:19,"Mi ga gledamo kroz našu svjetovnu prizmu, kroz naših želja, naših nekakvih pretpostavki, ali oni su svoj život odlučili potpuno urediti po Božjoj riječi, po Božjoj objavi."
0:01:20,0:01:32,"I gledaju ga kroz tu prizmu, gledaju ga kroz prizmu duhovnog, onoga što je u vječnosti, ne onog materijalnog i propadljivog, nego onoga što će ih dovesti do vječnog života."
0:01:35,0:02:05,"I ustvari Autor nam kaže ipak gotovo je nemoguće razumjeti smisao pojedinog učenja odnosno svetaca ako se ne razumije širi okvir koji nije ništa manje nego temeljna struktura stvarnosti, prošlosti, sadašnjosti i budućnosti koja nam biva razvidna po biblijskoj objavi."
0:02:06,0:02:07,Temeljna struktura stvarnosti.
0:02:08,0:02:17,Ovaj svijet ako vjerujemo u Boga i njegovu riječ je stvoren tako što je Bog rekao nešto i to se stvorilo.
0:02:18,0:02:23,"Bog kaže neka bude svjetlost i nasta svjetlost, neka bude noć i nasta noć."
0:02:24,0:02:31,I ako je ovaj svijet saznan po njegovoj riječi onda ga u stvari jedino možemo razumjeti ako ga gledamo kroz prizmu te riječi.
0:02:32,0:02:37,"I to je ono što su sveci činili i zato su postigli tolika čudesa, zato su postali sveti."
0:02:40,0:02:46,"I ta riječ nam u ustvari daje ključ kako živjeti ovdje, kako biti u Božjoj milosti."
0:02:48,0:02:50,"Autor govori o prošlosti, sadašnjosti i budućnosti."
0:02:51,0:03:04,"I ako želimo razumjeti ono što je bilo prije nas, ako želimo živjeti u pouzdanju da ono što je pred nama je u Božjoj providnosti onda mora to biti temeljeno na Božjoj riječi."
0:03:05,0:03:13,"I onda nikakve poteškoće koje su nam pred putom, niti ono što nam se dogodilo u prošlosti ne predstavlja problem ili prepreku za naš život."
0:03:14,0:03:22,"Onda smo kao što je mudri Salomon rekao, što je bilo, opet će biti, što se činilo, opet će se činiti i nema ništa novo pod suncem."
0:03:22,0:03:30,A mi smo cijelo vrijeme u strahu od nečeg novog ili razmišljamo da ono što se dogodilo se moglo samo nama dogoditi da je toliko loše.
0:03:30,0:03:39,"Nije, sve se to događalo, događat će se i Bog nam je to dao u svojoj riječi, samo moramo ući u nju i početi razmišljati na način na koji sveci razmišljaju."
0:03:41,0:03:56,"I cijelo ovo poglavlje koje ću danas razmatrati i pokušati vam približiti, ustvari imao za cilj donijeti temeljne poruke koje Biblija šalje, one temelje koje su sveci ugradili u svoj život da onda možemo na tome graditi svoje duhovno putovanje."
0:03:56,0:04:18,"Prošli put smo započeli s buđenjem i obraćenjem s tim dodirom kad Gospodin uđe u naš život, kad ga prvi put iskusimo u svome životu da je on blizak, sada dolazimo na gradnju temelja, kad moramo izgraditi temelje za svoju duhovnost i ako tu pogriješimo često zaglibimo na nekim krivim putevima i treba nam povratak nazad."
0:04:19,0:04:24,Zato autor odmah sada daje te temelje da bi mogli poslije graditi kuću na stjeni.
0:04:26,0:04:36,I prva stvar koju autor donosi kao jako bitnu je stvarnost raja i pakla.
0:04:38,0:04:46,"Raj postoji, pakao postoji, đavao postoji, a Isus Krist je tu da nas spasi od vječne propasti."
0:04:47,0:04:48,To je temeljna poruka tog djela.
0:04:49,0:04:57,"I često čujemo danas rasprave u nekakvim krugovima crkvenih i tako, pa onda se govori kao je li đava osoba ili nije."
0:04:57,0:05:10,"Isus ga često puta spominje, ne moramo prolaziti puno po svetom pismu da bi našli, često izgoni iz loduhe, znači to je nešto što je stvarno, što je prije bilo i što je sada."
0:05:11,0:05:15,Mnogi njeću postojanje pakla i da li je netko u paklu.
0:05:15,0:05:22,"Isus je rekao, pakao postoji, govorio je vječno o ognju, o mjestu gdje plačiš krgu zubi i to je pakao."
0:05:23,0:05:35,"I ako želimo vaš biblijski dokaz, Evanđelje po Mateju nam donosi izvještaj odnosno prispodobu po kojoj Krist to donosi."
0:05:43,0:05:44,Samo malo.
0:05:46,0:06:03,"To je prispodoba o posljednjem sudu gdje gospodin govori kako će Sin čovjek i doći u slavu i raziljivat će one koji su bili u njegovoj milosti, koji su posluživali siromahe, koji su išli bolesnim, koji su, one koji su tamničani posjećivali."
0:06:04,0:06:07,Za njih kaže tada će doći kralj reći onima sebi s desna.
0:06:08,0:06:15,"Dođite blagoslovljeni oca mojega, primite u baštinu kraljevstvo, pripremljeno za vas od postanka svijeta."
0:06:16,0:06:20,"A za ove s lijeve strane kaza, zatim će reći onima s lijeva."
0:06:21,0:06:27,"Odlazite od mene, prokleti, u oganj vječni, pripremljen đavlu i anđelima njegovim."
0:06:28,0:06:32,"Znači Krist nam potvrđuje raj postoji, pakao postoji i đavao postoji."
0:06:34,0:06:42,"Ali mislim da se u našim krugovima ne trebamo previše zadržavati na toj temi da li postoji raj, pakao, čistilište, đavao."
0:06:43,0:06:48,Ono što je puno bitnije je zabluda u kojoj mi često živimo.
0:06:49,0:06:52,Često mislimo da ćemo na neki jeftin način doći do raja.
0:06:53,0:07:38,"Obratili smo se, došli smo do gospodina, možda smo i Možda smo izvršili neku pobožnost devet jedan petak ili tako nešto i mislimo sad smo mi u raju sto posto to je isusovo obećanje ali isto tako on kaže onaj tko ustraje do kraja bit će spašen znači moramo biti oprezni sa svojim životom i cijelo vrijeme bdjeti nad svojim srcem isto tako kaže o kako su uska vrata je tjesan put koji vodi u život i malo ih je koji ga nalaze kad pričamo i kad čitamo nekakve članke i razmišljanja, često bi mogli zaključiti da je Isus rekao o kako su široka vrata i širok put koji vodi u život i puno ih je koji ga nalaze."
0:07:41,0:07:47,Najčešće taj put je prazan i malo tko njime hoda.
0:07:50,0:08:02,I ono što se s nama događa u ovom trenutku i cijelim svojim životom je borba između naše pale naravi i oca koji nas želi spasiti.
0:08:04,0:08:16,"Ta naša pala narav je dio nas i poslala je dio nas kada je Eva uzela od zmije onu jabuku i zagrizla ju, Jadam ju je učinio isto kao i ona."
0:08:17,0:08:21,"I od tada počinje borba za naš život, za naše spasenje."
0:08:24,0:08:42,"A gospodin Bog otac koji nas želi spasiti i koji na ovom svijetuetu nije uspio naći nešto po čemu bi nas spasio, šalje svog sina da bi bio spasen, da bi bio most između neba i zemlje."
0:08:43,0:08:53,"Šalje ga ovdje da živi svetim životom, da ispuni zakon i da bi po njemu, po njegovoj žrtvi mogli ući u raj."
0:08:57,0:09:19,I daje jednu sliku svet o Kristu koji je most između neba i zemlje.
0:09:20,0:09:28,"Ispod mosta teče jedna rijeka koja vodi ljude u propast, a most je jedini put kako doći do neba."
0:09:30,0:09:31,I kaže ovako Bog otac.
0:09:33,0:09:39,Ali onaj koji se ne drži ovoga pu se ispod mosta na rijeci.
0:09:41,0:09:44,"Nitko ne može hoditi, a da se ne potopi."
0:09:45,0:09:55,"Oni slijede laž, drže se puta laži i sinovi su djavala koji otac laži, pa pošto prođu kroz rata laži primaju vječnu osudu."
0:09:56,0:10:07,"Ovako bjedno svršavaju oni koji hodaju putem ispod mosta, Rijekom, ne okričući se natrag da bi priznali svoje grijehe i molili za milosrđe."
0:10:08,0:10:13,Tako dolaze na vrata laži jer su slijedili nauk džavla koji otac laži.
0:10:13,0:10:18,Sam džavao predstavlja njihova vrata i kroz njih stižu k vječnoj osudi.
0:10:22,0:10:29,"I ovdje vidimo koliko je lako ići ispod rijeke, zaobići taj most."
0:10:30,0:10:34,"I kad uđemo u tu rijeku vrlo se teško izvući, nama je nemoguće."
0:10:35,0:10:39,Ali ono što bi nas trebalo utješiti je ova poruka.
0:10:40,0:10:44,Ne uključujući se na ne okrećući se natrag da bi priznali svoje grijehe i molili za milostrče.
0:10:46,0:10:56,"Gospodin je svjestan da mi kad se nađemo u toj rijeci, u tom nekakvom vrtlogu grijeha kad zaboravimo gdje smo, otac je svjestan da se mi sami ne možemo iščupat van."
0:10:58,0:11:04,"Ali zato kaže ne okreću se natrag, da se bar samo okrenu i zamole za milostrče."
0:11:04,0:11:08,I to je sve što on od nas traži u tom trenutku da bi nas vratio nazad na put.
0:11:09,0:11:11,On je tu da nas iščupa natrag.
0:11:12,0:11:25,"I možda nekome teško shvatiti tu prispodobu i tu njegovu ljubav, ali pogledajte kad roditelji naprave nekakav dogovor s djecom, to ćete svi razumjeti, roditelji i djeca."
0:11:26,0:11:34,"Koliko je često puta se dogodilo da su se posložili uvjeti, ne znam, dobit ćeš novi mobitel ako imaš pet na kraju godine."
0:11:35,0:11:49,"I sad, to je veliki izazov za dijete, roditelji su postavili dobru ljestvicu, sve će biti u redu ako se to izvrši i ide godina, dijete se trudi, al nažalost izvan njegovih kapaciteta je."
0:11:50,0:11:52,Što se dogodi na kraju godine?
0:11:52,0:11:56,"On je tu negdje blizu, vidjelo se da se trudi, ali nije uspio."
0:11:56,0:11:58,Što se najčešće dogodi?
0:12:01,0:12:03,"Eto, Dragica zna."
0:12:05,0:12:07,Znači roditelji pa kupi taj mobitel.
0:12:08,0:12:12,"Isto tako Isus je rekao ništa čisto, ništa nečisto neće ući u raj."
0:12:13,0:12:21,"Ali je zato gospodin dao sredstvo, dao je način kako da se očistimo jer je znao da smo nesavršeni, da mi to ne možemo sami."
0:12:23,0:12:28,"Spasiti ljudima je nemoguće se, ali je zato Bogu sve moguće."
0:12:29,0:12:32,I to je poruka koju nam šalje otac preko svete Katarinije Sijenske.
0:12:36,0:12:46,Ali isto tako sveti Bernard napominje koliko ustvari ljudi često odbiju to milosrđe.
0:12:48,0:13:00,"Iako je besplatno, iako nam ništa ne priječi okretanje nazad, zbog nas samih ne prihvatimo ga."
0:13:04,0:13:06,I gdje se onda nađemo?
0:13:07,0:13:10,Nađemo se u jednom trenutku na raskrižju.
0:13:13,0:13:15,Možemo krenuti dvama putovima.
0:13:16,0:13:25,"Možemo se okrenuti natrag prema Gospodinu, prema njegovom milosrđu ili možemo nastaviti dalje ne osvrćući se nazad ići prema vratima koja vode vječnoj osudi."
0:13:27,0:13:36,I ono što cijelo ovo poglavlje naglašava je da je ovaj svijet samo priprava za ono što će doći.
0:13:38,0:13:42,Sve ono što ovdje osjećamo je samo priprava za ono što će doći.
0:13:43,0:13:46,Sve što ovdje imamo bit će obilatije na onom svijetu.
0:13:47,0:13:54,"Ako smo ovdje bili obilati u dijeljenju milosrđa, na onom svijetu ćemo obilato primiti."
0:13:54,0:13:59,"Ako smo ovdje bili sebični, prema nama će biti još sebičniji kad dođemo na onaj svijet."
0:14:02,0:14:33,"I u svjetlu toga, današnje Evanđelje mi je jako ostalo na srcu, gdje Gospodin upozorava one gradove i one ljude koji su mnogo toga doživjeli, mnogo toga vidjeli, mnoga čudesa su se dogodila u tim gradovima, Isus je prolazio, navještao riječ, mnogi su ozdravljali, zlodosi su bili izgonjeni, ali se ljudi nisu obratili."
0:14:35,0:14:48,"I onda kaže, ja od tebi, Korozajne, ja od tebi, Becajdo, da su se u Tiru i Sidonu izbila čudesa koja su se dogodila u vama, odavno bi već sjedajući u kostreti i pepelu činili pokoru."
0:14:49,0:14:52,Ali Tiru i Sidonu bit će na sudu lakše nego li vama.
0:14:53,0:14:56,"I ti, kafarnaume, zar ćeš se do neba uzvisiti?"
0:14:57,0:14:59,da u podzemlje ćeš se strovaliti.
0:15:00,0:15:07,"Tko vas sluša, mene sluša, tko vas prezire, mene sprezire, a tko mene prezire, prezire onoga koji mene posla."
0:15:10,0:15:22,"Želio bih samo da svi sagledamo svoje srce, sagledamo sve što smo doživjeli, sve što smo prošli i na koji način smo to prihvatili."
0:15:24,0:15:38,"Da li smo i dalje ostali u nekim svojim borbama s nekim grijesima, U stvari uživajući u tom grijehu, ne želeći se promijeniti ili smo odlučili skroz krenuti za gospodinom."
0:15:38,0:15:42,"Što se dogodilo Becajdi, Kafarnaumu i svim tim gradovima?"
0:15:42,0:15:46,"Doživjeli su mnogo toga, ali nekih stvari se jednostavno nisu htjeli odreći."
0:15:48,0:15:53,Gospodin im kaže Sodomi će onaj dan biti lakše nego li tom gradu.
0:15:55,0:16:01,"Sodoma koja je bila homoseksualna, koja je uništena skroz, Sodomi će biti lakše nego li tome gradu."
0:16:01,0:16:04,"HS-a nego i tome gradu, zato što s odom i nije bilo navješteno ono što je nama navješteno."
0:16:06,0:16:13,"Koliki su propovijedali s ovog gambona, John Pridmor je bio tu, majka Teresija je bila tu, malo tko od nas je mogao čuti, ali dobro."
0:16:17,0:16:27,"Čuli smo mnoga svjedočanstva potresna iz naše zajednice, Habuš, ne znam je li tu, ako nije, možete ga naći poslije, pitajte ga svjedočanstvo koji nisu čuli."
0:16:28,0:16:30,Kristijan će poslije dati isto jedno svjedočanstvo.
0:16:32,0:16:47,"I koliko često ustvari mi ostanemo u nekakvim svojim prizevnim mislima, u nekakvim svojim malim grijehima kojih se ne želimo odreći, u nekakvoj ljubavi prema svijetu, a toliko puta smo čuli da taj svijet samo uzima, ništa ne daje."
0:16:50,0:16:53,Onda se moramo zapitati nad ovom porukom koju nam Misus šalje.
0:16:53,0:17:00,"Ja o tebi, ja o meni ako se ne obratim, ako se ne budem borio i protiv tih malih grijeha."
0:17:00,0:17:05,"Jer ono što svi sveci u ovoj knjizi napominju, na tom duhovnom putu kad krenemo."
0:17:06,0:17:09,Na početku obraćanja moramo se odreći teških grijeha.
0:17:11,0:17:22,"Ali Svetoj Terezi Javilskoj je rekao ne, nećeš otići niti već pripremljeno mjesto u paklu zbog tih velikih smrtnih grijeha nego zbog gomile malih grijeha koje si rekla pa ok i su."
0:17:24,0:17:32,I mi isto tako moramo biti svjesni da je grijeh i grijeh i da za svaki taj grijeh moramo tražiti Božje milosrđe.
0:17:33,0:17:42,"Ali moramo ga tražiti a ne reći a dobro sad, svi griješe, pomalo griješe, ali Bog nas zove na obraćenje da dođemo njemu."
0:17:43,0:17:47,"Griješili su i sodomci, ali kome će biti teže na sudu?"
0:17:48,0:17:50,Sodomcima ili kafarnaumu.
0:17:52,0:17:59,Nama je navješteno i moramo biti svjesni toga da smo puno primili i puno će se od nas tražiti.
0:18:02,0:18:10,"I zato onaj Isusov poziv na obraćenje, obratite se i vjerujte Evanđelju, obratite se svim srcem, a ne polovično."
0:18:11,0:18:17,Nemojmo ostavljati prostora tim malim grijehima da nam uzmu onu vječnost koju nam je gospodin pripravio.
0:18:22,0:18:33,I nakon toga želim na neki način uvesti ustvari u te dvije krajnosti koje nam gospodin nudi.
0:18:34,0:18:44,"Prva krajnost je da nastavimo dalje tom rijekom koja ide ispod mosta, koja se ne osvrće natrag i koja vodi u vječnu propast."
0:18:45,0:18:56,I Bog otac svetoj Katarini Sijenskoj daje objavu u kojoj objašnjava kako je to u paklu i kako je to onima koji su se odlučili ne obratiti.
0:18:58,0:19:00,I navodi četiri vrste paklenih muka.
0:19:02,0:19:06,I prva muka među njima je ustvari najgora.
0:19:07,0:19:36,"I za nju Bog otac kaže Katarini Sijenskoj da se samo ona makne, ove tri ostanu, oni bi mogli to izdržati, ali im je ta toliko teška, toliko ih boli ta muka to što ne vide Boga Oca, što mogu vidjeti kako oni koji su u raju gledaju Oca, kako blaženstvo zbog toga imaju, a oni ne vide Boga Oca."
0:19:37,0:19:48,"I dok sam razmišljao o tom tekstu, gospodin me odveo na priču o Lazaru siromahu i bogatašu."
0:19:50,0:19:54,"I kad umrije siromah, Lazar, odnesoš ga anđeli u krilo Abrahamovo."
0:19:55,0:19:58,Umrije i bogataš da bude pokopan.
0:19:58,0:20:05,"Tada u teškim mukama u paklu, diže svoje oči, te iz daleka ugleda Abrahama i u krilom Lazara."
0:20:06,0:20:16,"Pa zavapi, oče Abrahame, smiluj mi se i pošalji Lazara da umoći vršak svoga prsta u vodu i rasladi mi jezik jer se strašno mučim ovome plamenu."
0:20:18,0:20:27,"I ta kapljica vode predstavlja ustvari izvor žive vode koju lazar može gledati sa kojeg se može napajat, a to ovaj bogataš ne može."
0:20:28,0:20:31,"I samo da ima tu kapljicu vode, pa kao bi bio podnošljiv."
0:20:32,0:20:40,"Ali zbog toga što ne vidi Boga Oca, što ne vidi taj izvor žive vode, žive ljubavi, njegova muka je nepodnošljiva."
0:20:41,0:20:48,"I sve ostale muke proizlaze iz toga što ne vidimo Boga Oca, što ne vidimo onoga koji daje tu ljubav."
0:20:52,0:20:56,I čak nekakva predokus toga možemo vidjeti na ovome svijetu.
0:20:58,0:21:06,"Vjerujem da smo se svi susreli sa ljudima koji nažalost ili nemaju svog biološkog oca ili ih je on ostavio, odrasli su bez njega."
0:21:10,0:21:22,"I koliku prazninu možemo vidjeti u tim ljudima, koliku ustvari neostvarenu potrebu, a to je tek predokus onoga što osjećaju ljudi koji su u paklu."
0:21:23,0:21:31,I u psihologiji i psihijatriji kažu da je danas jedna od najčešćih bolesti u stvari telemahov kompleks.
0:21:32,0:21:39,"Sad ne znam jel znate tko je telemah, ali u Odiseju, u epskom pjevu, telemah je sin Odiseja."
0:21:39,0:22:26,"I Odisej je bio jedan veliki junak, on je bio super, borio se na grčkoj strani, pobijedio je u troj i onda na njegovom povratku nazad iz Troje, on putuje ja mislim dvadeset pet godina a njegova žena Penelopa odbija mnoge prostce, ona je lijepa, mnogi ju žele za ženu, svi govore da je odisaj i mrtav ali ona cijelo vrijeme govori ne, ne, on će se vratiti i ona ga iščekuje i svakog dana čeka da se on vrati, tako dvadeset pet godina a sa strane je njen sin telema koji cijelo vrijeme sluša majku koja govori doći otac doći otac i on cijeli život provodi u iščekivanju tog oca kojeg nikad nema i koliki mladi ustvari danas odrastaju u iščekivanju oca koji nikad ne dolazi."
0:22:28,0:22:32,"Čak ga možda i vide, on dođe, ali njegova prisutnost nije tu."
0:22:33,0:22:36,I onda vidimo da tu prisutnost traže tamo gdje ne treba.
0:22:37,0:22:43,"Traže pažnju, samo da bi ih on pogledao, povlaze u poroke, u ovisnosti, samo zato što ne vide oca."
0:22:45,0:22:51,"Isto tako, još gore će biti onima koji dođu u pakao, a ne vide Boga oca."
0:22:51,0:22:56,A vidjet će one koji ga gledaju i koji uživaju u njegovoj slavi.
0:22:59,0:23:03,Druga muka je ustvari izravna posljedica prve muke.
0:23:04,0:23:10,"Prva muka je da ne vide Boga Oca, a druga je cr savjesti koji ih podsjeća da su ga mogli gledati."
0:23:11,0:23:25,"Da su mogli gledati Oca, da su mogli pričati s anđelima i surađivati s njima, ali zbog njihove odluke da na ovome svijetu ne surađuju s anđelima nego sa demonima, sa đavlom, oni sad moraju gledati đavla i slušati zloduhe."
0:23:27,0:23:34,"I savjest ih cijelo vrijeme opominje, ti si mogao biti gore, a ne dole, ti si mogao biti je bio lazar, a ne ovdje."
0:23:35,0:23:38,"I ta savjest konstantno radi, cijelu vječnost."
0:23:41,0:23:49,"Treća muka je ustvari to što vide samo zlo, vide izvor samog zla i vide džavla."
0:23:51,0:24:08,"I najčešće mi kad razmišljamo o džavlu, kad se razmišlja o satoni, čak od malih nogu svi zamišljamo nekakva zla bića, nekakve rugobe i ne znam šta sve ne, čak i u literaturi kad se prikazuje."
0:24:10,0:24:13,Ali ga ne vidimo baš tako kad ulazimo u neke grijehe.
0:24:14,0:24:35,"naprimjer svima nam je super ono, žene, auti, bogatstvo, sve to lijepo izgleda, izlazci, alkohol, malo kocka ovo, ono, sve je to super, skupe stvari, skupe rari, sve je to oblaženo nekakvim, kao zlatom."
0:24:36,0:24:43,A onda nam autor kaže da je problem veo koji imamo na očima na ovome svijetu.
0:24:43,0:24:46,Veo koji nam ne da da vidimo duhovnu stvarnost.
0:24:47,0:24:50,"Ali kad dođemo gore, taj veo se skida."
0:24:50,0:24:53,I onda vidimo stvari u stvari onakve kakve jesu.
0:24:54,0:24:57,I onda bi lepa Brena rekla s naše sudbine pada pozlata.
0:24:59,0:25:02,Onda ta pozlata pokaže onu svu trulež koja je ispod.
0:25:08,0:25:12,I kad taj veos padne mi smo onda svjesni što smo radili.
0:25:13,0:25:20,"Nilo Zanon je to rekao na svoj način malo drugačije od lepe Brenne, pa da oni koji ne slušaju lepu Brenu shvate."
0:25:24,0:25:28,Istina je da zloduh nije ni malo ružniji od grijeha što ga skriva iza sebe.
0:25:28,0:25:44,"Grijeh koji smo prihvatili, način razmišljanja kojim vrijeđamo onoga koji nas je stvorio, očaj što ga nosimo u sebi i na koji smo se navikli, požuda koju potajice hranimo, ne praštanje i gorčina što ih gajimo, sve su to izrazi utjecaja zlih duhova."
0:25:45,0:25:46,Tako oni izgledaju.
0:25:47,0:26:01,"Prije toga je govorio kako mi zloduhe u stvari zamišljamo kao ružne, a onda kaže, ali se nama ne čine tako strašnima jer to su naši zlodosi, to su pozvani gosti, naši suputnici."
0:26:01,0:26:20,"Svaki mali grijeh, ono što sam pričao, koji činimo svakodnevno, od kojeg se ne želimo riješiti, eto, kao možemo griješiti, otići ćemo na ispovijed odmah nakon toga, ustvari jedan ružni zloduh koji se nakačio na nas i kojeg smo mi prihvatili, još smo ga stavili ruku na njega kao jarani i hodamo."
0:26:22,0:26:32,"I onda od njega zamišljamo kao da je on lijep, nije on toliko strašan, šta otićemo na večer, napićemo se, bit će koja više, ono, škicnut ćemo koju malo, pa šta bude, bude, ajde ispovijedit ćemo se."
0:26:35,0:26:42,A onda shvatimo da iza toga dolazi četvrta muka.
0:26:43,0:26:50,I da je ta četvrta muka ustvari biljeg koji taj zloduh koji je naš pajdaš ostavi na nama.
0:26:52,0:27:02,"Don Bosko je u sveti Don Bosko usnuo jedan san gdje mu je gospodin pokazao raj, čistilište i pakao i u paklu je pripomijenio jednu zanimljivu stvar."
0:27:04,0:27:08,Svaki čovjek je na sebi imao napisan grijeh koji ga je doveo do tu.
0:27:09,0:27:11,Ime zloduha koji ga je doveo u pakao.
0:27:12,0:27:16,I tako svaka ona osoba koja je u paklu ima na sebi obilježje.
0:27:18,0:27:24,"Na nekom piše bludnost, na nekom srebroljublje, nekom droga, alkohol, kocka."
0:27:25,0:27:27,Svatko ima svog zloduha koji ga je doveo tu.
0:27:28,0:27:30,"To je nagrada tom zloduhu, a nama muka."
0:27:32,0:27:40,"Samo zato što sad svačamo da ona zlato, ona pozlata nas je dovela do vječne propasti."
0:27:50,0:28:02,I to nam ustvari na neki način Bog Otac želi pokazati kakva je stvarna slika onih sitnih stvari kojih se ne želimo odreći.
0:28:03,0:28:37,"A onda svetoj Katarini Sijenskoj pokazuje objavu kako će živjeti oni koji su se odlučili odreći tih stvari, koji su se odlučili za radikalnu svetost, koliko Koliko god teška bila, koliko god padala bilo, oni koji su se odlučili za tu svetost su oni koji su odlučili progledat na ovom svijetu, koji su na ovom svijetu odlučili vidjeti iza one pozlate, koji su odlučili ne taknuti tu trulež, tu kaljužu."
0:28:38,0:28:40,"Pa čak i kad bi taknuli, odmah bi se oprali."
0:28:42,0:28:52,"Onda sveti Bernar zadnjih kaže, oni koji su u tami na ovome svijetu, ući će u gušu tamo, a oni koji su odlučili vidjeti, vidjeti će još jasnije."
0:28:54,0:28:57,To znači sve ono lijepo što smo doživjeli zato što smo odlučili biti Božji.
0:28:59,0:29:05,Svaki put kad nam je On izlio blagoslov za neku malu našu žrtvu je samo predokus onoga što ćemo imati.
0:29:06,0:29:17,"Svaka ljubav koju smo osjetili od Boga, od ljudi, iz odnosa je ovdje samo mali predokus kao ono kad dobijete u nekim restoranima ono da malo kušate vino."
0:29:18,0:29:19,To je kap dva.
0:29:20,0:29:23,Ovo je cijela boca ili pokal kako hoćete.
0:29:25,0:29:28,Ovdje dobivamo puninu onoga što nam je dano na ovome svijetu.
0:29:29,0:29:36,"Sve ono lijepo će biti još ljepše, samo zato što je u srcu donešena odluka."
0:29:37,0:29:46,"Sveti Pavao nam za to kaže što tko nije vidjelo, njuho nije čulo, niti u srce čovječe nije ušlo, to je pripravio Bog onima koji ga ljube."
0:29:47,0:30:00,"I čak ćemo često ući u blagoslov za ono što uopće nismo zaslužni, za nešto što je netko drugi izborio, samo zato što smo bili s njim, zato što smo mu dali ljubav, zato što smo odlučili živjeti u ljubavi s bližnjima."
0:30:01,0:30:03,Koliko često se to dogodi na ovome svijetu?
0:30:05,0:30:08,Koliko je ljudi ušlo u pomazanje koje je izboreno u ovoj zajednici?
0:30:09,0:30:14,Koliko je ljudi ušlo u blagoslov zato što je netko odlučio živjeti sveto?
0:30:15,0:30:19,Jedan čovjek koji živi sveto u obitelji može cijeloj obitelji donijeti blagoslov.
0:30:20,0:30:22,Koliko će to biti obilnije kad dođemo gore?
0:30:23,0:30:25,Isto tako i po nama.
0:30:26,0:30:34,"Blagoslovi koje mi izborimo ovdje svojim žrtvama, svojim trudom donose blagoslovi nama i svima oko nas i ovdje i na onome svijetu."
0:30:35,0:30:42,"I Krsna zato kaže onome tko ima bit će dano, a onome tko nema čak i ono što ima bit će oduzeto."
0:30:46,0:30:52,"S malim stvarima možemo zadobiti puno toga, a s malim stvarima možemo izgubiti puno toga."
0:30:53,0:30:54,I sve je na odluci.
0:30:59,0:31:04,da li ćemo mi odlučiti se za gospodina ili ne.
0:31:05,0:31:11,Autor nam kaže u poglavlju idućem mi odabiremo vlastitu sudbinu.
0:31:12,0:31:14,Nitko drugi ju ne može izabrati za nas.
0:31:16,0:31:27,"Naša startna pozicija je Bogu znana i on zna koliko se svatko od nas mora boriti za čistoću, za slobodu, ali je bitna ta odluka."
0:31:28,0:31:30,"Bitno je gdje idemoemo, gdje smo se odlučili ići."
