Start (HH:MM:SS),End (HH:MM:SS),Segment
0:31:30,0:31:42,"I kaže ovako, zanimljivo je primijetiti kako otac pokazuje Katarini da se neka osoba kad umre zapravo žuri onamo gdje želi biti."
0:31:43,0:31:53,Na vrlo stvara način svaka osoba izabire vlastitu sudbinu tijekom svoga života na zemlji i u trenutku smrti prigrli ono što je uistinu postalo njezin izbor.
0:31:56,0:32:01,"Mi u trenutku smrti možemo prigrliti tri stvari, to nam donose sveci."
0:32:02,0:32:16,"Prvo je možemo prigrliti mržnju i ta mržnja je ona koja nas osuđuje, ta mržnja je ona koju smo izabrali za vrijeme ovog života, ona nas dovodi do vječne osude i pakla."
0:32:17,0:32:27,"Drugo što možemo prigrliti je oca gledajući ga preko krvi Jagančeve, to nam donosi sveti Bernard."
0:32:28,0:32:47,"Kaže oni koji su umrli u čistoći, u savršenoj ljubavi, U trenutku smrti iščekuju vidjeti Boga Oca jer su sigurni da je on tu, osjećaju ga već iskustveno i kada napuštaju svoje tijelo oni slave jer znaju gdje idu."
0:32:48,0:32:52,I treće što možemo prigrliti je Kristovo milosrđe.
0:32:54,0:33:12,"To oni koji nisu bili savršeni u ljubavi, koji se nisu savršeno očistili, ali su odlučili želim biti Božji, nisu došli do tog savršenstva u ljubavi do kraja duhovnog putovanja, Sjedinjenja, oni će prigrliti Kristovo milosrđe koje će ih odvesti u čistilište."
0:33:13,0:33:19,I u tom čistilištu će se očistiti od svega onoga što još nije čisto da bi mogli ući u raj.
0:33:21,0:33:29,I ustvari shvatio sam da se samo dvije vrste ljudi žure.
0:33:31,0:33:36,Žure se oni koji idu u pakao i žure se oni koji idu u raj.
0:33:38,0:33:44,"Jer oni koji idu u pako već znaju da su odabrali pako i žure se tamo, žure onamo gdje žele biti."
0:33:46,0:33:52,"Oni koji idu u raj žure tamo zato što već osjećaju iskustvo na Boga Oca, osjećaju tu ljubav i žure prema njoj."
0:33:54,0:34:05,"Treća vrsta, oni koji idu u čistilište ne žure toliko, znaju da idu prema Kristu, ali znaju da ih ipak čeka period čišćenja pa onda malo drugačije."
0:34:05,0:34:08,Ali to je isto sve posljedica onoga što smo na zemlji činili.
0:34:11,0:34:17,I ustvari ta žurnost je nešto što krasi one koji su donijeli odluku.
0:34:21,0:34:29,"Najbolji primjer nam je zato ta žurnost u nešto je kad se borimo s nekim grijehom, s napašću."
0:34:30,0:34:48,"I često ta borba može trajati dugo i mi se ne možemo odlučiti i u trenutku kad odlučimo posustati, kad mislimo e sad se ne mogu izboriti, borba je gotova, a predamo se, tako brzo padnemo u taj grijeh i samo se onda uđemo u vrtlo grijeha."
0:34:49,0:35:02,"Razmislite koliko puta ste u srcu pogotovo dječki kad ste se borili protiv bluznosti i samozadovoljavanja, borili možda i satima bitku, neću, neću, neću."
0:35:02,0:35:09,"I onda bi u jednom trenutku samo odustali, grijeh bi došao tako brzo i odmah za njim drugi."
0:35:10,0:35:16,"Najčešće lijenost ili samo sažaljevanje, samo bi išlo jedno za drugim."
0:35:18,0:35:30,"Ili kad bi se možda borili s tim da odete u kockarnicu ili tako negdje, satima se borite s napašću, onda kad odete tamo još poslije toga odete napijete se i napravite još tisuću jednu glupost."
0:35:34,0:35:48,"To je džavao koji radi, kad mu se prepustimo u borbi, dopustimo da uzme i onda nas on s takvom žurbom dovede tamo gdje se već teško vratiti i treba nam neka pomoć."
0:35:48,0:35:53,"Dok smo još u borbi, možemo se vratiti nazad, dok još nismo pristali uz grijeh."
0:35:54,0:36:00,"Ali čim padnemo, samo idemo u vrtlog i džava nas tako brzo dovede tamo gdje ne želimo."
0:36:02,0:36:07,"I najbolji biblijski primjer za to, za takav brzi pad je Juda."
0:36:09,0:36:18,U Waltorti i spisima Katarine Emerih možemo vidjeti što je Isus prolazio u toj borbi za Judu.
0:36:19,0:36:28,"Možemo vidjeti da se njemu toliko posvećivao, pričao s njim, grlio ga, pokazivao mu ljubav jer je u srcu osjetio borbu za njegovu dušu."
0:36:29,0:36:31,On je znao tko će ga izdat.
0:36:33,0:36:41,"On je znao da Juda i krade i da potkrade, ali je znao da se još uvijek isplati boriti za njega."
0:36:42,0:36:48,"I on se borio, čak je u spisima piše da je zamolio Gospoda da priča s njim, da ga grli kad je vidio da se bitka gubi."
0:36:51,0:37:00,Ali bitka je bila izgubljena u onom trenutku kad je Juda odlučio u svome srcu da će počinit grijeh.
0:37:02,0:37:07,"I možda se netko dok se mi borimo s tim grijehom ustvari moli za nas, netko od naših predaka."
0:37:09,0:37:22,I sveti Bernard u poglavlju jako lijepo opisuje to kako je uređen raj i kako oni koji su u raju ustvari su i dalje povezani s onima s kojima su bili povezani na zemlji i da mole i zagovaraju za njih.
0:37:24,0:37:32,Ali onda Bog otac kaže mogu im pomoć sve dok njihova glupost ne odustane od moje pomoći.
0:37:33,0:37:37,"Sve dok mi ne odustanemo od pomoći koju nam Bog daje, mi se borimo."
0:37:37,0:37:41,"Kad odustanemo od te pomoći padamo, to se dogodilo i ljudima."
0:37:41,0:37:47,"I onda u trenutku kad Juda odlučuje, Isus mu kaže što činiš, čini brzo."
0:37:49,0:37:58,"Vidi da je đavao pobjedio, vidi da je žurnost na djelu, čini to brzo i nakon toga pada u još hrpu grijeha koji završavaju samoubojstvom."
0:38:00,0:38:04,"Đavao ga je doveo na teren gdje se više ne može vratiti, tako i s nama."
0:38:05,0:38:07,Đavao nas dovede tamo gdje se više ne možemo vratiti.
0:38:12,0:38:24,"I kad znamo zašto je Đavao toliko do žurbe, zašto je žurnost toliko bitna, onda možemo vidjeti zašto su sveci ustvari toliko gorili."
0:38:25,0:39:46,"Kad čitam životopis svete Katarine Sijenske koji je ovdje skraćen, živjela je do trideset tri godine šta je stalo u te trideset tri godine to ni sam ne mogu shvatiti nikako od toga da je preživjela razdoblje kuge da je bila tamo glavna koja se skrbila za sve sa šest godina je već odlučila da će postati časna da će sa sedam je položila zavjete za djevičanstvo sa petnaest se ošišala da ju roditelji ne udaju, s trideset ne, s dvadeset sedam godina je već bila savjetnica papi prije toga je jednog papu vratila i zavinju na urijim i to je samo ono nekakav okvir koji stane u stranicu i pola vjerojatno je to ono cijela knjigžurina životopisa trideset tri godine koliko nas se može pohvaliti s jednim dijelom toga to je samo zato što se bogu isto žuri doći do tih duša koje džava otima koje džavao već oteo i onda ljudima koji mu se odluče predati potpuno, kao što su se ovi odlučili predati đavlu, tako i gospodin, onima koji mu se potpuno predaju, daje taj žar, daje tu snagu, sveti Padre pio je, spavao par sati mjesečno, tjedno, ovisi o izvještaju, godišnje, nebitno."
0:39:47,0:39:49,"Otkud mu snaga, samo mu Bog to može dati."
0:39:50,0:40:02,"I Bog, one koji mu se potpuno predaju, koji shvate, moj život kratak, kao što je sveta Katarina shvatila, kao što je sveta Tereza Avilska shvatila, moj život kratak."
0:40:03,0:40:12,"Ako ga želim iskoristiti, jer ne znam kad će završiti, možda završiti sad nakon susreta pet minuta, možda za pedeset godina, možda za sto godina, ja ne znam."
0:40:13,0:40:18,"Ali ako će završiti za jedan dan, pa želim taj dan iskoristiti do kraja."
0:40:19,0:40:25,"Jedini način da ga iskoristimo je da služimo Bogu, da mu se potpuno predamo."
0:40:25,0:40:27,To mogu iz svog iskustva reći.
0:40:28,0:40:33,Dok god sam služio sam sebi i svojim željama bio sam potpuno neispunjen.
0:40:34,0:40:48,"Ne znam šta sve nisam probodio i sve nisam otišao, ali nakon par dana ispraznost opet, gdje god sam došao dok nisam odlučio pristatus gospodina."
0:40:48,0:40:57,"I onda i one neke stvari koje su mi se tada činile dosadne mogu raditi sa žarom, s ljubavlju, samo zato što je Bog tu i Bog daje snagu i Bog daje ispunjenje."
0:40:58,0:41:00,Ispunjenje nećemo naći u stvarima nego u Bogu.
0:41:02,0:41:09,"I zato Bog one koji mu se predaju šalje tamo gdje je najpotrebnije, šalje tamo gdje nitko ne ide."
0:41:11,0:41:22,I često se našu zajednicu znalo kritizirati što uz sve evangelizacije i sve što radimo se uključila u hrpu drugih stvari koje se na prvu ne čine kao evangelizacija.
0:41:24,0:41:29,"Tu je politika, tu je sport i nogomet, tu je posao, biznis."
0:41:31,0:41:39,"Ali ako nam je glavni cilj ono što je Bogu, a to je spasenje svake duše."
0:41:39,0:41:53,"I svatko tko bi pročitao neki privatnu objavu Isusa nekoj osobi bi shvatio da je glavna čežnja njegovog srca svaka duša, svaka duša."
0:41:54,0:41:58,I Crkvi se nameće da bi trebala ići i evangelizirati na rubove društva.
0:41:59,0:42:03,"To su siromaši, možda migranti i to je istina."
0:42:04,0:42:08,Trebamo ići na rubove društva i njih evangelizirati.
0:42:09,0:42:12,ali šta je s onim rubovima duhovnog društva?
0:42:14,0:42:20,"Što je s onima koji su bogati materijalno, ali u duši prazni, koji isto tako traže?"
0:42:21,0:42:23,I njima isto netko treba ići.
0:42:23,0:42:29,"Sveti Franjo kojeg danas slavimo je išao Sulimana, sultana evangelizirati."
0:42:31,0:42:33,Šta bi tek njemu onda rekli?
0:42:34,0:42:46,"Ako gospodin čezne za svakom dušom, onda to nije bitno je li to običan čovjek koji je na ulici, kojeg isto treba evangelizirati, kojeg isto evangeliziramo ili je to nogometaš na nogometnom terenu."
0:42:48,0:42:58,Njemu je možda i potrebnije jer ovaj siromah nažalost za nečim vapi pa će onda iz tog razloga vapit gospodinu pa će ga vjerujem i pronaći.
0:42:59,0:43:04,"Ali ovaj na nogometnom terenu ima sve oko sebe, a opet je u duši prazan."
0:43:05,0:43:06,Treba i takvima ići.
0:43:09,0:43:12,Na koji način je Bog našao ljubav na ovome svijetu?
0:43:12,0:43:13,Bog otac.
0:43:14,0:43:18,"Prije Isusa na ovom svijetu nije mogao naći ljubav, a želio ju je pronaći."
0:43:19,0:43:33,"I onda šalje svog sina utjelovljenu ljubav na ovaj svijet da se da za nas, za svakog od nas i da svaki od nas koji ga prihvati u sebi može pronaći tu ljubav."
0:43:35,0:43:38,I onda i Bog otac može pronaći ljubav na ovome svijetu.
0:43:40,0:43:42,I šta treba biti naš cilj?
0:43:42,0:43:46,Gdje god nema ljubavi mi moramo donijeti tu ljubav koju nam je Bog dao.
0:43:47,0:43:50,Govorimo o tome da je politika katastrofa u Hrvatskoj.
0:43:51,0:43:56,"Govorimo da je biznis, da je poslovni svijet katastrofa, da se izrabljuju radnici."
0:43:56,0:43:57,Sve je to istina.
0:43:59,0:44:01,Koja je poruka koju nam Bog otac šalje?
0:44:02,0:44:08,"Ako sam ja dao svoju ljubav tamo gdje je nije bilo da se žrtvuje, to moramo i mi napraviti."
0:44:08,0:44:10,Gdje god nema ljubavi moramo doći tom ljubavi.
0:44:12,0:44:16,"Pa makar bili kritizirani, makar nam govorili da radimo gluposti."
0:44:17,0:44:23,"Ako negdje ne možemo naći ljubav, dužno svako kršćanina je tu donijeti ljubav da ju poslije tu možemo i naći."
0:44:27,0:44:49,I ono što mi je još ostalo jako na srcu dok sam čitao ovo poglavlje je ono što je Sveta Tereza Javilska govorila velika slika i to je upravo ono o čemu sad govorim.
0:44:50,0:44:58,Često mi svoj duhovni život svodimo na to samo da moram doći iz molit krunicu dvije na klanje sat vremena i misu i to je moj duhovni život i to je to.
0:45:00,0:45:02,Šta je svet Ivan od križa kaže na to?
0:45:04,0:45:15,Usredotočiti se na poboljšanje vremena posvećena molitvi naprimjer znači usredotočiti se preusko ukoliko razmišljamo o duhovnom putovanju kao cjelini.
0:45:15,0:45:31,"Ako želimo rasti i donijeti ljubav gdje god želimo, gdje god je nema, mi moramo svojom duhovnošću učiniti svaki aspekt našeg života, bilo to posao, bilo to financije, bilo to obitelj, odnosi, sve je to duhovnost."
0:45:32,0:45:36,"Ako mi tamo donosimo Kristovo svjetlo, to je duhovnost."
0:45:37,0:45:44,"I tek kad na taj način počnemo gledati, kad počnemo gledati tu širu sliku koju nam Gospodin daje, tek onda možemo raditi velike stvari."
0:45:44,0:45:53,"I svaki svetac je to imao, tu široku sliku da ono što radi u svakodnevnici je u stvari temelj njegovog djelovanja."
0:45:59,0:46:04,"I treći put, prošli smo one koji idu u osudu, koji idu u rat je srednji put."
0:46:05,0:46:10,"To su oni koji se baš i ne žure, o kojima sam već pričao, to su oni koji su na putu u čistilište."
0:46:10,0:46:27,"Nekako su mi najbliže tomu, oni od kojih se često može čut, a to vam se ne da, jer nije razborito, to je ok, to je put kojim većina ljudi ide, ali nas Bog zove na svetost."
0:46:28,0:46:47,I ako se sjećate prije tri ili četiri tjedna je Matija čitao izvještaj Jose Marije Eskrive o tome kako je on u vrijeme građanskog rata četrdesetih u Španjolskoj kad nije imao kruh za jesti radio velike planove o tome kako će ženski ogranak opuzdeja u Brazilu raditi školu.
0:46:48,0:46:50,Oni nemaju za kruh jesti kako će graditi školu.
0:46:52,0:47:12,"I sad, Jose Marija Eskriva je sveta s Katoličke crkve, a ja sam siguran da je bilo ljudi koji koji su mu govorili to baš i nije razborito, sad gledat u tom smjeru, nadam se da su u raju, ali za njih ne znamo i oni nisu osnovali opuzdeji koji se danas u svim dijelovima svijeta bori protiv masonerije."
0:47:14,0:47:22,"Razborito moramo gledat samo ako imamo Krista u srcu, samo tad možemo biti razboriti ako tražimo njegovu mudrost."
0:47:23,0:47:25,A otkud nam dolazi ta mudrost?
0:47:26,0:47:30,Sveto pismo kaže strah gospodinji Strah Gospodnji početak je mudrosti.
0:47:32,0:47:35,A o strahu Gospodnjem cijelo vrijeme pokušava na neki način pričati.
0:47:38,0:47:40,O strahu da ćemo uvrijediti Gospodina.
0:47:41,0:47:43,O strahu poštovanja prema Gospodinu.
0:47:44,0:47:49,O svijesti da svaki grijeh koji počinimo je grijeh protiv Boga.
0:47:51,0:47:53,David kaže samo tebi ja sam zgriješio.
0:47:56,0:48:02,"I toliko ga boli i ta odvojenost od njega da odmah čim je shvatio za svoj grijeh pada u pokajanje, u kostrijet."
0:48:04,0:48:08,"Koliko često mi kad griješimo shvatimo, a dobro kao ispovjedit ću se, nije to toliki problem."
0:48:10,0:48:15,"On pada u grijeh i čim to shvati, pada na koljena, u kostrijet i plače."
0:48:16,0:48:19,"I piše, najljepši pokajnički psalam."
0:48:21,0:48:26,"To je svetac, to je onaj koji je svjestan da je grijeh taj koji ga odvaja od Boga."
0:48:27,0:48:28,To nam Izajia kaže.
0:48:29,0:48:32,Opačine naše napravi se jaz između nas i Boga našega.
0:48:33,0:48:41,"Samo naši grijehe su ti koji nas odvajaju od Boga i od vječnog gledanja, od one prve muke, oni nastavljaju tu prvu muku, svaki naš grijeh."
0:48:44,0:48:50,"I ako se ne pokajemo, ako ne budimo sa sobom, ako nemamo taj strah od Gospodnji, vječno ćemo živjeti u paklu."
0:48:52,0:48:57,A sveci su shvatili da je jedino to što ne žele biti vječno odvojeni od Boga.
0:48:57,0:49:02,"Sve im je ostalo bilo manje bitno, ali ta odvojenost od Boga im nikako nije mogla sjesti."
0:49:03,0:49:08,"I često su oni počeli služiti, krenuli putem svetosti samo zato što su se bojali pakla."
0:49:10,0:49:11,I to je super put.
0:49:13,0:49:20,"Često pričamo o Božjoj ljubavi, Bog je ljubav, ali do te ljubavi treba doći."
0:49:21,0:49:25,"Bog je ljubav, pričamo o duhovnom osjedinjenju, mi smo na početku puta."
0:49:28,0:49:36,"I ako je strah u Gospodnji početak mudrosti, autor nam kaže ispunjenje te mudrosti je ljubav."
0:49:37,0:49:43,Nitko ne može doći do ljubavi bez duhom nadahnutog straha koji je biblijsko iskustvo.
0:49:44,0:49:50,Znači nitko ne može doći do ljubavi do Boga Oca bez da prvo osjeti strah.
0:49:52,0:49:52,Tako i djeca.
0:49:54,0:50:02,"Često ne mogu osjetiti ljubav od roditelja, ali iz nekog straha ne naprave neku glupost i onda shvate koliko je bilo bolje."
0:50:04,0:50:06,Jer kad naprave onda dobiju malo iza uši ili tako nešto.
0:50:07,0:50:07,Ali.
0:50:09,0:50:13,"Svate kolika je ljubav roditelja, tek nakon toga."
0:50:14,0:50:24,"Tako i mi ako nas Duh Sveti ne nadahne da prvo uđemo u strah, da spoznamo mudrost, zašto je uopće nešto grijeh, to dolazi s mudrošću, mi to sami ne možemo shvatiti."
0:50:26,0:50:31,"Onda ćemo početi ljubit gospodina koji je sve to tako lijepo uredio, koji je postavio zapovijedi."
0:50:33,0:50:38,"I tek onda možemo reći Bog je ljubav, možemo i sada, ali to nije iskustveno."
0:50:39,0:50:46,"Tek kad prođemo taj strah, kad prođemo tu kušnju, kad dođemo do mudrosti, onda nas ispunjava ljubav."
0:50:48,0:50:58,"I autor kaže da je to, da ne možemo od toga doći bez duhom nadahnutog straha koji je biblijsko iskustvo."
0:50:59,0:51:00,Znači biblijsko.
0:51:02,0:51:09,"Proroci su ga prošli, sveci su ga prošli, ali uz Bibliju, uz Božju riječ."
0:51:11,0:51:27,"I mi možemo biti oni koji grade kuću na pijesku, a pijesak bi tu usporedio sa nekakvim emocijama, dame se, ne dame se, pa doću na susret, neću doći na susret, pa doću na misu, neću doći na misu."
0:51:28,0:51:35,"Dok god gradimo svoje temelje na osjećajima, kako se mi osjećamo, da li nam se da ili da li nam se ne da, naša kuća je na pijesku."
0:51:36,0:51:37,"Čim udare bujice, ona će pasti."
0:51:39,0:51:48,"Onaj tko gradi svoju kuću na stjeni, gradi ju na ustrajnosti., na konstantnom prijanjanju uz Božju riječ."
0:51:49,0:51:51,Tko ustraje do kraja bit će spašen.
0:51:53,0:51:55,I onda gradi na čvrstom temelju.
0:51:56,0:52:01,"Isus kaže nebo i zemlja uminuće, ali moja riječ ne, neće uminuti."
0:52:01,0:52:09,"Jedino vječno za što se sad možemo primijetiti na ovome svijetu je ovdje, na ovih jedna tisuća i nešto stranica."
0:52:10,0:52:26,"I ako želimo svoj život izgraditi na čvrstom temelju, pa kad navale bujice, kad navale kušnje, problemi, napasti u životu, onda ćemo imati ovo čvrsto sidro, ovaj čvrst temelj i naša kuća će ostati."
0:52:28,0:52:39,"Sada možemo birati, hoćemo sagraditi kuću na stjeni ili ćemo biti kao kafarnaum, hoćemo biti kao becaida ruševina."
0:52:40,0:52:50,"Ići ćemo sad svi većinom u Izrael, bar velika većina nas i doći ćemo na mjesto gdje je kafarnaum i nećemo naći kamen na kamenu."
0:52:52,0:52:58,Naš život može biti prekrasan hram ili razvaljena ruševina.
0:52:59,0:53:01,Svako od nas bira za sebe.
0:53:04,0:53:11,Svako od nas može izabrati biti ruševina ili biti svjetionik koji svijetli drugima.
0:53:12,0:53:15,Biti onaj grad na gori o kojem gospodin govori.
0:53:18,0:53:18,Amen.
