Start (HH:MM:SS),End (HH:MM:SS),Segment
0:00:00,0:00:10,"Naša večerašnja tema je gospođa Lupska, odnosno pogodnost koja je nastala u svijetu upoznanja u Meksiku."
0:00:12,0:00:15,Njezin blagdan smo proslavili sada 12.
0:00:15,0:00:22,"prosinca u utorak, pa smo joj odlučili o predavanju zapravo u Totslavi."
0:00:24,0:00:34,"Gospođa Lupska je zaštitnica Meksika, ona je zaštitnica i Latinske Amerike, peruanskih studenta, a 2000."
0:00:34,0:00:36,godine papirom.
0:00:36,0:00:40,APIM kao drugi podražava i sa reicom objema mehka.
0:00:42,0:01:04,"Riječ u Adalupet zapravo na trećom asteškom jeziku na Hvaku znači ona koja sadrije glavu u zimi, a meditaciju od milja nazivaju i rijetnim momenom, što znači tamo gopadeljica, posljedici o kojoj ćemo kasnije više govoriti."
0:01:06,0:01:11,Sama pobožnost podjeći kao što sam već rekla ovdje u stupinu ukazanja.
0:01:12,0:01:22,"Dobrovolodcu Indiju Suhonu Diegu, čije ime znači ova o kojoj govori i kojega je sveti papa Ivan Pao II."
0:01:22,0:01:23,2001.
0:01:23,0:01:31,"godine proglasio svetim, čime je on postao prvi kanalizirani Indijanac u povijesti Katoličke crkve."
0:01:33,0:01:37,Njemu se dakle djeca Marija ukazuje od 9.
0:01:37,0:01:38,do 12.
0:01:38,0:01:40,prosinca 1531.
0:01:41,0:01:45,"godine na pravu TPAC, sjeverno od Meksiko-Silija."
0:01:46,0:01:59,"Onamo se ukazuje kod svih četiri dana svega četiri puta i taj događaj je zapravo započeo milijunska opraćenja koja dan danas traje na području Meksika, Srednje i Južne Amerike."
0:02:01,0:02:17,"Ukazanje je prvo priznato od Katoličke crkve naravno, a na slici ćete sada vidjeti središte koje je jedno od najvećih i najposjećenijih katoličkih središta u svijetu."
0:02:17,0:02:23,"Evo i ova slika, to je izvorna bazilika sagrađena u 17."
0:02:23,0:02:29,"stoljeću, a u ova slika je Nova crkva izgrađena u 70."
0:02:29,0:02:34,godina prošlog stoljeća i u njoj se čuva slika dječjina.
0:02:36,0:02:50,"Prije nego što ću vam govoriti više o samom ukazanju i o slici, voljela bih vas uvesti u povijesnu podlogu, odnosno povijesna zbivanja na području Meksika u vremenu ukazanja."
0:02:51,0:03:34,"Znači, područje Meksika su prije ovog krugu triča Amerike jedna tisuća četiristo devedeset dva godine među kojom je stanjivala visoko organizirana kultura steha sa politeističkim radijskim sustavom više božanstava na vrhu sa božanstvom keca platla to je bilo jedno praiskonsko biće za koje su vlasnici vjerovali da je stvorilo sunce i njihovo vjerovanje je išlo u smjeru da kako bi se sunce kretalo i kako bi život na zemlji opstajao bilo je potrebno prenositi tom božanstvu ljudske žrtve."
0:03:35,0:03:44,I sad vlasnici su to žrtvovanje ljudi smatrali svojom svećenu dužnošću i u tim svojim obradnim centrima koje su se.
0:03:50,0:03:55,"Vidimo ovo slika dole, to je primjer tog njihovog obradnog centra odnosno piramide."
0:03:57,0:04:08,"Gore vidimo tu sliku žrtvovanja, dakle mislim da ste svi gledali film El Gibson Apocalypto u kojem su vjerno prikazana takva žrtvovanja."
0:04:09,0:04:30,"Uglavnom oni su žrtvovali otprilike 80 ljudi svaki dan u tom božanstvu i to su najčešće žrtvovali robove, a u vremenima mira prigazivali su takozvane cvjetne ratove gdje su se ljudi prinosili božanstvima kao svijeće, samo su prenosili svoje živote."
0:04:32,0:04:40,"Također, taj njihov vrhovni bog je bio i bog dvožnosti, znači on je bio istovremeno i dobar i zao."
0:04:41,0:04:48,I to je jedan od razloga zašto vlasnici vrlo teško prihvaćaju hrvaštvo sa dovoljenom planetarnom.
0:04:50,0:05:15,"Također, oni su vjerovali da uvjerovali su u periodično obnavljanje svijeta i čovječanstva i prema njihovim izračunima to njihovo božanstvo, koje inače su oni smatrali tu, znači zapravo to je bilo jedno jedinstvo ptice, vode i zemlje u lipu mizele zmije."
0:05:15,0:05:35,i oni su zapravo vjerovali da je to čovjek koji je postao Bogom i sukladno tom njihovom vjerovanju u periodično obnavljanje oni su prema svojim izračunima iščekivali njegov ponovni dolazak i po njihovom izračunu taj dolazak se trebao dogoditi 1519.
0:05:36,0:06:05,"godine što se točno poklapa sa dolazkom španjolskog kolonizatora na čelu sa generalom Kortezom i sukladno to njihovom vjerovanju i iščekivanju on je Korteza znači dočekuju zbog ošljicom, što on iskoristava te ih na vrlo krvav i razoran način uvažava, uništava njihovu kulturu te im nameče europsku kulturu i kršćansku religiju."
0:06:07,0:06:18,"Naravno, s obzirom na način na koji se to sve odvijalo, s obzirom da je to bilo njima nametnuto, prvi misionari, krenjaci na tom području postižu kao mala usluga."
0:06:18,0:06:25,"Zapravo, kroz deset godina situacija je dosta nepovjerljiva i znači vrlo je malo kršćenih."
0:06:25,0:06:41,"malo pokrštenih, ali međutim malim brojem pokrštenih tu je i Juan Diego Vidjers, njegova žena Marija Lucija i ujak Juan Bernardino."
0:06:43,0:06:46,I sad ću vam nešto više pričati o samom ukazanju.
0:06:48,0:06:52,"Znači, priča počinje 9."
0:06:52,0:06:54,prosinca 1531.
0:06:54,0:06:56,godine u Ranu Zulu.
0:06:57,0:07:00,Juan Diego odlazi u Vidjero Nistelista.
0:07:02,0:07:06,"To je plan lijevo, to je njegova slika, ovo je na porušenju svetim."
0:07:09,0:07:18,"On odlazi u crkvu u zemlji Santjagate, na putu do crkve na produt depjak mu se ukazuje u osma prvi put."
0:07:19,0:07:24,"On mu se obraća na njihovom, na plakavom jeziku i dolazi u liku indijanke."
0:07:25,0:07:34,"I obraća mu se sa riječima, znaju najmanji moj sin da sam ja plasta ljevica."
0:07:35,0:07:47,"Preseta Marija, majka najistinitije i jedinoga voda, po kojemu sve opstoj, koji stvorite života i ljudi, gospodar njega i zemlje."
0:07:49,0:08:01,"Žarko želim da se na ovom mjestu sagradi moj mali sveti dom, crkva u kojoj ću kuku iz ljubavi na vidljiv način iskazati milosrđe, pomoć i zaštitu."
0:08:03,0:08:10,"Jer ja sam zbilja vaša milostivama, ti, tvoja, svih onih koji zajedno nastanjavaju."
0:08:10,0:08:17,"na stanje u ovom zemlju i svih onih koji me ljube, zazivaju, obraćaju i potpuno su u mene pouzdani."
0:08:19,0:08:22,Ovdje ću slušati vaš plač i alikopri.
0:08:23,0:08:30,"Bićete mi u srcu i brinuću se da vam pomognem u svim vašim brojnim brigama, patnjama i bolestima."
0:08:34,0:08:44,Isto ga dana Juan Diego po trećenim zbivanjima odlazi biskupu koji je on bio i prvi meksički biskup.
0:08:45,0:09:14,"optuženac Juan Dreza Marada te mu iznosi svoje svjedočanstvo, međutim vijeću postaje nepovjerljiv te šalje razočaranima van Diega doma, međutim na povratku kući na istom mjestu istog dana, a van Diegu se ponovno pokazuje mjesta i zapovijedano da sutra dan ponovno posjeti iskupa tajnu ponovno iznesene izvan MOB-u."
0:09:16,0:09:31,"Idućeg dana, deset prosinca, u Zeleni, Diego ponovno odlazi biskupu i ovaj put ga je biskup znači saslušao i zatražio od njega vidljiv znak da je ukazanje vjerodostojno."
0:09:33,0:09:43,I na povratku kući tog istog dana ponovno se ukazuje Gospodin na istom mjestu u isto vrijeme te mu obećaje dati znak koji je biskup od njega zatražio.
0:09:45,0:09:52,"Međutim, idućeg dana, ponedjeljak jedanaest prosinca zbog stričare bolesti Juan Diego ostaje doma."
0:09:54,0:10:02,"Naime, njegova stričica nalazi u slatkim ukama i planirao je ostati s njim, te idućeg jutra, utorak 12."
0:10:03,0:10:06,"prosinca, samo da napomenem da je i sad utorak 12."
0:10:06,0:10:30,"prosinca, on žurno odlazi potražiti ispovjednika za svoje rastrice, međutim preselila ga je opet u osta i on mu obećaje da njegovo stričito prilikom neće umrijeti i šalje ga na mjesto gdje mu se odkazala prvi put, gdje mu obećaje dati."
0:10:30,0:10:32,znači dati taj bitni znak za iskupa.
0:10:34,0:10:45,Hladek je tu poslušao gospu i otišao na brod TPAK gdje nalazi grm predivnih crvenih kasteljanskih roža.
0:10:47,0:11:04,"Zanimljivo je da u tom dijelu Meksika zije prevladavao polupustince suha klima sa malo do nikakvom vegetacijom, te su takve rože potpuno netipične uče za taj kraj, a potom ne za prosinac, to je za zimu."
0:11:05,0:11:11,"Nije dobro prepoznato kao znak za biskupa, berete ruže i stavljate u svoju tilnu."
0:11:12,0:11:24,"Tilna to je bio jedan asteški okretač od robotka, od agavljenih niti koji je njima služio i za spremanje stvari i za vrtanje i ležali su na tome."
0:11:25,0:11:31,Uglavnom on sprema u tilnu i žurno odlazi biskupu.
0:11:34,0:11:47,U biskupovom dvoru su osim biskupa u tom trenutku prisustovali i prevoditelji i još jedan Franjanac kako saznajemo iz povijesnog izvornika Nikana Mokoa koji se smatra povijesnim dokumentom.
0:11:49,0:12:03,"On dolazi pred biskupa, otvara svoju temu, ulaže palicu pred biskupa, a na njegovoj filmu se ukazuje usmjena slika u potpunom istom obliku i izgleda kakva je danas u Basilici."
0:12:08,0:12:20,I tim događajem biskup vrlo ubrzo zaista da i sagraditi svetište gospodinu svetište na dobrodete i tu očekujemo opraćenje cijelog egzita.
0:12:22,0:12:43,"Na povratku kući Juan Diego doma zatječe svoga srca potpuno zdravog, te mu potvrđuje da ga je gospodo zdravila, te da mu je dala naziv kojim će biti čašćena na srici, prema njezinim riječima uvijek djevojica sveta Marija Bodavska."
0:12:45,0:12:50,"Ok, sad ćemo se malo više baviti slikom."
0:12:50,0:13:08,"Pošto je slika prepun simbola i istraživana kroz stoljeća, ja sam odlučila podijeliti svoje predavanje na one očite simbole koje vidimo i njihovo značenje, a kasnije ćemo se više baviti znanstvenim istraživanjima i dokazima."
0:13:09,0:13:22,"Znači ono što vidimo na slici, tojest ono što je jedan aspekt mogao prvo uočiti, jest da je djevojka se ukazala prema puti, stasu i držanju kao indijanka, tojest kao njihova žena."
0:13:23,0:13:34,"Također ona je u sklopljenoj ruku, u pobožnom stavu molitve i nagnute glavićima, ona poručuje da ona nije božanstvo već da se ona klanja u pravu Bogu."
0:13:36,0:13:47,"Također, prema tome što je ona tamo, tojest kako je kaznena žurena, to daje zapravo prvu poruku Astecima, a to je da je ona i njihova majka."
0:13:47,0:13:55,"Tojest ona im poručuje da ona nije samo majka bijelim kolonizatorima i španjolcima, već je i njihova majka i majka cijelog čovečanstva."
0:13:58,0:14:19,"Ono što dalje možemo primijetiti, tojest što dalje, što su oni mogli primijetiti, je djevičina raspuštena posla koja je kod Asteka bila znak djevičanstva i tamo je ljubičasta vrpca oko struka koju su nosile asteške žene u vrijeme trudnoće."
0:14:19,0:14:25,Znači druga vrlo važna poruka koja djevojica šalje je da je ona ujedno i djevojica i majka.
0:14:27,0:14:28,"Nadalje, uvažena je za svima."
0:14:30,0:14:40,"Dalje, vrlo važan simbol za Asteke je svijet točno ispod vrha cijelog njezinog struka, točno na mjestu gdje se nalazi djete."
0:14:41,0:14:47,"Taj svijet koji astezi nazivaju Quincona, za njih je tekako se i volio."
0:14:48,0:15:10,"Naime, astezi su vjerovali da je svijet stvaran kroz četiri etape i oni su nazivali te etape dobima ili suncima i sve četiri te etape, odnosno doba, su završavali kataklizmom i astezi su zapravo željeli iščekivati to peto sunce, to Quincona."
0:15:10,0:15:14,tog verkonom u kojoj je bila nova prilika za svijet i za čovječanstvo.
0:15:15,0:15:17,Možete već uočiti vrlo jasnu simboliku.
0:15:18,0:15:33,"Marija na njima vrlo razumljiv način poručuje da ona dolazi i dokida kod suca, Boga kojem oni štuju, prvu žrtvu, stotine tisuće ljudskih žrtava i djece."
0:15:34,0:15:45,"I ona im donosi mladosunce s visine, kako ga nazivam, zahvaljujem svom panospjevu, koji dokida svako žrtvovanje i koji se sam žrtvuje za cijelo čovječančanstvu."
0:15:47,0:15:54,Znači tu vidimo koliko Marija zapravo ih poznaje i na njima razumljiv način poručuje vrlo jasnu poruku.
0:15:56,0:16:16,"I zapravo kad sam razmišljao o tom petom suncu, o tom kutu sunca, nekako sam tražila neku poveznicu između današnjice, vremena ukazanja i o gospodinu Nilozu u svemu tome."
0:16:17,0:16:20,"I baš što sam se sjetila prije prilike godine, danas sam."
0:16:33,0:16:41,"Uglavnom, u jednom dijelu knjige, otec Pelanovski, razmata dio iz knjige Pavla H."
0:16:41,0:16:50,"Ezekela, u kojemu Jakar kroz san opisuje i ukazuje Ezekel na grijehe Izraela."
0:16:51,0:16:52,I sad počit ću ovaj.
0:16:55,0:17:03,"taj isjećak iz knjige Plovoka Jzenja i samo u jednoj rečenici, odnosno tumačenju ovakvog postupka."
0:17:05,0:17:14,"Iz knjige Plovoka Jzenja, on mi reče, vidiš li sine čovječe, vidiš li još veći gladosti od ovih."
0:17:16,0:17:19,Nakon toga odvede unutarnji pregled gospodine Kuće.
0:17:20,0:17:33,"Ondje je na ulazu u gospodin Hram između trema i žrtvenika za žrtve Baljanice bilo oko 25 ljudi čija su leđa bila okrenuta prema hramu, a lice prema sunčanoj istupu."
0:17:34,0:17:36,Planjeni su se suncu prema istupu.
0:17:37,0:17:40,"On mi reče, vidiš li si ne čovječi?"
0:17:41,0:17:52,"Zar je premalo ljudi na ovoj kući što čine zločine, što ih ovdje čine, nego još napuniće i zemlju nasiljem i mene sve nekako izazivaju na bijeg."
0:17:53,0:17:55,"Eto, držaj glavu na svojem nosu."
0:17:56,0:17:59,Zato ću i ja u bijegu postupati protiv njih.
0:18:00,0:18:03,Moje oko neće im gledati nosivo.
0:18:04,0:18:05,Neću imati milosrđa.
0:18:06,0:18:09,"Kad izavit ću uzav glas, neću ih slušati."
0:18:10,0:18:13,Sada imamo tumačenje: pocaj vam ostor.
0:18:14,0:18:21,"Napokon, zadnji gre je duše, najdublji gre, najdublji i najskriveniji kult, kult sunca."
0:18:23,0:18:28,"Bara se onaj tko misli da se radi samo o nekoj magiji, kult zvijesta ili samog sunca."
0:18:30,0:18:35,"Sunce simbolizira sjaj i slavu, skretanje pozornosti na sebe."
0:18:36,0:18:39,Isu se samo jednom ukazao u slavu kada mu je lice postalo.
0:18:48,0:18:55,I tu mi je bilo jasno zašto sam se zadržala i zašto sam se sjetila tog odluka iz te knjige.
0:18:55,0:19:06,"Zapravo ustalo je da je dosad jasno, pastici, što je put sunca i njemu žrtvuju stotine tisuća ljudi između ostalog i majmuna lice."
0:19:07,0:19:13,"Dan danas se što je ovaj put sunca, o kojem govori patrijska vlasnica."
0:19:14,0:19:25,"Znači ta sebičnost i ta samolopadnost je taj kult kojim se žrtvuje, znači stotine tisuće djece kroz grijeh abortusa."
0:19:27,0:19:31,"I opet ovdje je gospina uloga vrlo jasna, molba slučaja."
0:19:32,0:19:42,"Slučajno stekalna se ukazuje i donosi, donosi Isusa i time dokida i razdara taj njihov kult Sunca."
0:19:43,0:19:44,Što se danas događa?
0:19:44,0:19:52,"Opet ukazuje nam se gospa, ukazuje na grijeh protiv nerađenih, ukazuje na hitnost obraćenja i ukazuje na zadovoljstvo."
0:19:54,0:19:56,Koja je ovdje Marija poruka?
0:19:56,0:20:01,"Ovdje nam se Marija ukazuje i kao zaštita života, kao zaštitnica života."
0:20:04,0:20:04,O.
0:20:05,0:20:05,K.
0:20:07,0:20:07,Dalje.
0:20:09,0:20:22,Ono što već iz ovih prvih nekih simbola i ovih vidljivih detalja na slici možemo zapravo iščitati kakva je Marija kao je ovdje bila za otjecanje.
0:20:23,0:20:40,"Naime, Napomenut ću samo i da su se asteci koristili ovom piktogramskim pismom, to jest oni nisu imali nikakvo pismo ni slovo, već su se sporazumijevali kroz niz slikica i simbola i vidimo u kojoj mjeri je Marija to ispoštovala."
0:20:41,0:20:49,"Znači na slici slika nema nikakva slova, nikakve riječi, ali zato predstavlja simboliku."
0:20:50,0:20:56,I zato kroz to Marija daje vrlo jasnu poruku astecima.
0:20:56,0:20:59,Znači ona ne samo da vrlo dobro poznaje njihovu.
0:21:00,0:21:02,"kulturu, običajne već ih ona i poštuje."
0:21:03,0:21:11,I to je temeljna razlika od španjolskih kolonizatora koji su došli namećući svoju kulturu i svoju religiju.
0:21:11,0:21:16,"Marija za razliku od toga dolazi na njima posve na zufi način, čak dolazi kao jedna od njihovih žena."
0:21:18,0:21:26,"I tu zapravo još jednu poruku važnu Marijani na Rosiji, a to je da ih ona pozne."
0:21:27,0:21:38,"I to je, barem po mom mišljenju ona temeljna i najvažnija poruka koju nama Bog, kojim Bog nas usvaja, naše srca i srca svojih naroda."
0:21:39,0:22:02,"Znači ja pravo, krećući se sebe, da se kada razmišljam o svojem obraćenju, zapravo o razlišenom trenutku u kojem je Bog došao do svojih prolaka koje nisam poznala od tad, progovara o onim najvećim strahovima, o kojima možda nikad nikome nisam pričala i da se javlja ta strašno važna spoznaja u mom srcu, Bog me i poznaje."
0:22:03,0:22:17,"I ne samo to, ona i poučuje i da ona i poštuje i oblikuje našu različitost."
0:22:19,0:22:37,"To zapravo također možemo vidjeti i u raznim se značajnim oprećenjima i ovdje među nama i ljudi koji svjedoče da zapravo na koliko različitih načina Bog dotiče ljude, to je u kojoj mjeri on nas poznaje."
0:22:38,0:22:44,"Bjelovica u mene je dotaknuo na tako miježen intiman način, to recimo u prijateljici Jelanu."
0:22:45,0:22:59,"koja se od uvijek voljela baviti politikom, Bog dotiče na izazovne političke progode naših župnika, zbog toga ostaje ovdje i kasnije dolazi u zajednicu."
0:22:59,0:23:06,I hoću reći tisuću je takvih primjera zapravo Božjeg oblikovanja u našim različitostima.
0:23:08,0:23:19,"I u toj zapravo, u tom marinom načinu organizacije, prepoznajemo duh Božji koji potiče razvijanje i očuvanje identiteta kolina sa naroda."
0:23:20,0:23:30,i oprečno tome možemo primijetiti kako se u svijetu javljaju tri duha svijeta koji su posve oprečni tome.
0:23:32,0:23:49,"Prvi bi smo mogli reći da je okupatorski duh, znači to su veće moćne države koje na nasilan način zapravo provodimo među manje narode sa ciljem da unište njihov identitet, njihov nacionalni osjećaj i kulturu."
0:23:50,0:24:08,"Zove strane imamo globalizaciju, to je najzvjerljiviji način, mirni način u kojem narodi imaju i dalje svoju privilegiju slobodu, međutim opet im se na taj suptilan i sofisticiran način oduzima identitet, kultura i nacionalni osjećaj."
0:24:09,0:24:17,Zapravo oba ta duha možemo primijetiti u našem najbližem okruženju.
0:24:18,0:24:21,"Također, taj je duh globalizacije."
0:24:22,0:24:33,"Ne znam baš, sjećam se kad mi je brat svjedočio o svom putovanju u Lisabon, pa je došao u Lisabon želja zapravo upoznati njihovu kulturu i njihove običaje."
0:24:34,0:24:39,"I kaže nije nigdje povijest neko portugalsko jevo, nije nigdje čut farao."
0:24:40,0:24:47,I to je nažalost ono što se događa pogotovo oko nas u Europi jer se mi potpuno odrećemo našeg hršćanskog identiteta.
0:24:48,0:25:00,Zapravo primjećujemo da se nameće taj jedan ideal u koji svi moraju ući jer sve je oko toga je veći nacionalizam itd.
0:25:02,0:25:37,"Treći dug svijeta kojeg sam prepoznala kao oprečni duh u duhu Božjem, je duh sinhretizma, tojest vjerovanje da su narodi i jezici, općenito različitosti među ljudima, zapravo plod ljudskog djelovanja, a da je Bog nas isključio sve jednakima, Bog sa malim dnom, sve jednakima i zapravo svaka različitost se smatra većim ljudskim i čak krivim i takvom vjerovanjem nam se preklanjaju riječi slične prakse."
0:25:38,0:26:00,da je to su dakle vjerovanja koja nacionalni osjećaj smatram primitivnima i zadatnima i zapravo meni je tu isto podrazumijevanje toga puno pomoglo kad sam gledala na kraju predavanja ću opustiti jedan kratki isječak sa kanalizacije svetog plana djeteta u kojem papa Ivo Pava II.
0:26:01,0:26:04,također u potpunosti poštuje njegovu kulturu.
0:26:04,0:26:22,"Znači imamo sliku pape svećenstva a oko njih doslovno polvo Indijanci sa vojnim licima, s šarom i perjem na glavi, znači u potpunosti izvorno asteški, plešu okolo, svijeru u svojim instrumentima, dim i tako dalje."
0:26:22,0:26:37,"I zapravo tu sam shvatila koliko je zapravo, koliko se daju ubožena slika od onoga što nam se nameće, čak i ne samo na razini naroda, već i na razini pojedinaca i individualaca."
0:26:46,0:26:49,Ono što prepočujem da je na djevičjoj slici.
0:26:49,0:26:52,"Riječima Svici je mala kraljevica Križica, ovako razloga."
0:26:53,0:27:10,"Time ona u svojoj, znači u sve ove aseriške obličeje, tu ona ukazuje i na tu službu u Bisku, koji je tada bio frakcionar, kao što sam već napomenula, a ujedno govori i o pripadnosti sebi kao Katoličkoj crkvi."
0:27:11,0:27:12,To je bilo pitanje.
0:27:13,0:27:13,OK.
0:27:14,0:27:18,Nadalje imamo Angela u djevičinu podložu.
0:27:19,0:27:30,"E sad, kako sam istraživala, većina teologa se slaže da taj anđel predstavlja plan Diega, ali vjerujem da možemo primijeniti i šire slike toga anđela."
0:27:31,0:27:40,"Naime, on se ljom rukom drži za djevičinu habinu koja predstavlja zemlju, a desnom rukom za djevičinu plaštu koju predstavlja degom."
0:27:41,0:28:01,"I na taj način on zapravo plan Diegu tu ima ulogu povezivanja, to jest posredovanja između ovoga steka, a mi možemo čitati i kako je gospa zapravo naša direktna posrednica između svijeta i njega."
0:28:09,0:28:22,"Ono što još zamišljamo i što ste mogli vidjeti po našem citatu na tekstopiletu koji ja nemam, je citat iz Otkrivanja svetog riva na postu."
0:28:22,0:28:30,Možemo vidjeti da slika djevice Cleizboldske i Gvozdalupske u potpunosti odgovara opisu iz Otkrivanja.
0:28:30,0:28:33,"Znači, ona je."
0:28:33,0:28:50,"Ona je sunce podijeljena, mjeseci pod njezinim nogama, ona je trudna, a kasnije kad budemo malo razjašnjavali izvješća po njezinom liku, vidjet ćemo da li ste imali to na glavi."
0:28:51,0:29:01,"I sad razmišljala sam što gospođa Timko učuje, ona na taj način vjerojatno donosi i sveto pismo astričkom narodu."
0:29:02,0:29:10,"a i nagrađuje pobjedu nad najprijateljima, te zbog toga i dobiva naziv u odboru, odnosno na satire koja uzmemo."
0:29:15,0:29:35,"Sada ćemo, vidjet ćete, nisam vola, tu ću se sad malo zaustaviti i voljela bi vas uvesti u ovaj znanstveni dio koji meni osobno jako poporim i voljela bi da pozorno pratite i u srčnom javnosti to što bolje dočarite."
0:29:36,0:29:49,"Znači, što se tiče znanstvenih istraživanja, ja bih počela od samog platna na kojemu je slika naslikana."
0:29:50,0:30:01,"Znači platna je kao što sam već rekla filma, odnosno bio odjeće specifične za siromašne i bio seasteke koje se koristilo kao touch."
0:30:01,0:30:05,I 1946.
0:30:05,0:30:39,"godine tek tada je filma detaljno proučena na Institutu za biologiju sveučilišta u Meksiku i u tom istraživanju potanju se iznosi saznanje da takav materijal u prirodnim uvjetima može ostati maksimalno 30-40 godina, a ova tima na kojoj je dječja slika je 120 godina bila bez ikakve zaštite."
0:30:40,0:30:52,"Znači nije bila niti pod staklom, bila je izložena u bazilici, svakodnevno je izložena dimu svijeća, ovalci prašeni i ostalim lošim uvjetima, ostaje potpuno ista."
0:30:55,0:31:03,"U vidu daljnjeg istraživanja platna kao takvog, meksički umjetnik Bartolačić 1789."
0:31:04,0:31:19,godine izrađuje kopiju slike na potpuno istom platnu i izlaže u neposrednoj blizini originala.
0:31:20,0:31:22,"Međutim, slika vrlo brzo propa."
0:31:24,0:31:28,"Nadalje, 1791."
0:31:28,0:31:29,prijeko G.
0:31:29,0:32:02,"prije odčišćena okvira stakla u kojemu se nalazi gospoda slika, jednom od djelatnika s učenom greškom pada kapljica na otok dušične kiseline na Botnu, sad je to i koji ste možda primijetili na kemijskim fakultetima, farmaceutskim itede Znate sigurno da je dušična kiselina iznimno jaka, klonogradska kiselina koja zapravo djeluje iznimno korozivno na bilo kakve prirodne materijale."
0:32:02,0:32:18,Ja se osobno sjećam iz West Hampshire škole da smo radili taj pokus gdje smo kapili pisaninu na neko zlato koje je u oko nekoliko minuta je nastala rupa i došlo do potpuno ništenja u vremenu od nekoliko minuta.
0:32:19,0:32:21,Što se događa sa slikom?
0:32:23,0:32:30,Bučina pisanina je kapala na gornji lijevi rub i ostavila tek malo žučkasu umrlju koja s godinama gleda.
0:32:32,0:32:34,Nadam se da ste već jako zainteresirani.
0:32:35,0:32:36,To nije još ništa što će nas slijediti.
0:32:40,0:32:42,"Nadalje, 14."
0:32:42,0:32:45,studenog 1921.
0:32:45,0:33:09,"godine u Ketu Sreća u Srećnom Taru ispod lijevičine slike je pokrenuta lučna kravata i eksplozija te kravate je znači uništila metalne skenice, stavila je masivni metalni križ i poazbijala svoje staklo u blizini."
0:33:10,0:33:14,Gospjena slika i staklo potpuno metalno.
0:33:16,0:33:22,Znači ovo su znanstveni dokazi i podaci povijesti kojima su svjedočili brojni svjedoci.
0:33:30,0:34:01,"Daljnja istraživanja bilježe jedna tisuća devetsto šezdeset tri godinu kada poznati umjetnik francisko kandis reguliera iz barcelone kroz dvije godine općava sliku te donosi izvještaj u pojmu tvrdi da ploha nije pripremljena ni na koji način za slikanje, to jest da tako platno uopće nije predviđeno da se koristi za slikanje."
0:34:02,0:34:07,"I što je vrlo važno, omogućava da nema nikakvih znakova poteza kistana."
0:34:08,0:34:15,"Što znači zapravo da je nemoguće odrediti na koji način je slika nastala, to jest koji je postupak stvaranja."
0:34:17,0:34:20,Mislim da je vam već jasno da je Boga otvorio ove slike.
0:34:22,0:34:23,Vidjet ćemo dalje.
0:34:24,0:35:05,Zatim jedna tisuća devetsto trideset šest godine njemački novelovac rikard kun zaključuje da na slici gospe nema tragova boja ni biljnog ni životinjskog ni biljnog podrijetla samo vam kažem jer to ne može biti znači da boja nije zemaljskog podrijetla i da je nemoguće utvrditi koji je sastav ono što dalje zamišljamjećujemo je istraživanje doktora Ijeska koji uočuje savršene zlatne rezbe.
0:35:10,0:35:20,"Zlatni rez, to je pojam koji nastaje u Antici i koristi se za umjetnička dijela."
