Start (HH:MM:SS),End (HH:MM:SS),Segment
0:35:20,0:35:30,To je zapravo kompozicijski matematički zakon u kojem se manji dio prema većem odnosi kao veći dio prema uputnom.
0:35:32,0:35:35,"Manje dio je ovdje gornji dio., donji je veći."
0:35:36,0:35:54,I u praksi to se vrši tako da se umjetničko djelo podijeli na 13 jednakih dijelova koji se kasnije dijele u konceptualnim mjerama 8 na 5 ili se dijele na 21 jednakih dijelova i dijele 13 na 8.
0:35:54,0:36:05,"Uglavnom što se više dijelova, jednakih dijelova slike dijeli, to se više približava tom savršenom zlatnom rezu koji zapravo predstavlja jedno biometrijsko savršenstvo."
0:36:06,0:36:20,Općenito taj zlatni rez koji su u Antici nazivali božanskim je iznimno teško postići zato što ta metoda zapravo i nije čisto matematička metoda već je ona aproksimacija.
0:36:21,0:36:43,"Međutim, na Oswicije je postignut taj završen zlatni rez i zapravo primjećujemo da se takva zakonitost također primjećuje kod Kristovog ili kod Anatolicom platnu i tu vidimo koliko su zapravo i naši zakoni i naša otkrića u službu vođe proslava."
0:36:45,0:36:55,Na ovoj slici u sredini također je jedan matematički dokaz.
0:36:56,0:37:12,"Znači, u suncu unutar kojeg se dostopa nalazi se može savršeno opisati elipsa i unutar te elipse slike se može podijeliti na dva dijela kružnica jednakih radiusa i time se slika dijeli."
0:37:13,0:37:17,I na ovoj slici vidimo tu koju upravljuju raspored pravog udnika.
0:37:22,0:37:34,"Nadalje, također vrlo je zanimljivo i to su zanimljive simbolične zvijezde po gospodinu plažu i po njenom objektu."
0:37:34,0:37:35,"Da, to možeš."
0:37:36,0:37:48,"To ćemo pustiti, time se bavili spomenuti doktor i veskas i voljela bi vam pustiti jedan takav isjećak iz ovog odbora za kojem su opisana ta zviježđa."
0:37:54,0:37:54,Ileskas.
0:37:55,0:38:08,"U suradnji s padre Sanchezom, znanstvenikom i stručnjakom za stečku kulturu i Meksičkim astronomskim observatorijem Laplace, otkrio je da zvijezde na plaštu odgovaraju zvijezdima na nebeskom svodu na nebu grada Meksika."
0:38:09,0:38:13,Zvijezde su grupirane kao u stvarnosti u nešto komprimiranom obliku.
0:38:15,0:38:28,"Ovdje možemo vidjeti zvijezde sjeverne krune, ofiuksa, škorpiona, vage, vuka, hidre, centaura, južnoga križa i malog psa."
0:38:31,0:38:36,Na drugoj strani djevičana plašta nalaze se zviježđa sjeverne polutke neba.
0:38:37,0:38:56,"Na ovom dijelu plašta možemo zapaziti zviježđe Potesa, zviježđe Vereničine Kose, lovačke pse, malog medvjeda, zviježđe Kočijaša, zviježđe Bika i u središtu, polazeći od plašta, slijede zviježđa središta i točno se podudaraju."
0:38:57,0:39:05,"Sjeverna kruna u visini čela djevice, zviježđe djevice u visini ruku djevice i u središtu zvijezđa Lava."
0:39:06,0:39:08,Opet vidimo vrlo jasnu simboliku.
0:39:09,0:39:14,U samom središtu na mjestu djeteta nalazi se zvijezđa Lava.
0:39:14,0:39:20,Opet sva naša okrenića čak i nazivni nazivi u službi proslave Božje.
0:39:21,0:39:34,Znači svi znamo da našeg gospodina Isusa Krista svetog bisma naziva Lavom iz plemena ljudi i Marija i time potvrđuje da se u njenim utopi nalazi spasitelj.
0:39:36,0:39:47,"Ono što je dalje vrlo značajno i, mislim, najinteresantnije u cijeloj priči je daljna priča o tom zviježđu."
0:39:49,0:40:08,"Naime, zvijezde na slici, tojest pretvijeste kako je stručnik na videu dijelio slike na lijevoj desnu i ovo zapravo nije naša realna slika našeg promatranja sa Zemlje."
0:40:09,0:40:12,Tojest rasporez zviježđa ovakav prvi.
0:40:13,0:40:18,"Nije iz naše perspektive promatranje sa zemlje, naime on je zrcalan."
0:40:19,0:40:27,"Što znači da ono što je na našem karti neba s lijeve strane, na slici gospoda i desne strane je obrnuto."
0:40:29,0:40:30,Što nam to ukazuje?
0:40:30,0:40:42,"Ukazuje nam da autor slike M svakako nije promatrač sa zemlje, već da se takva perspektiva može pozvati samo promatranjem iz svemira."
0:40:45,0:40:47,On nije služio autorima u 66.
0:40:52,0:41:01,"Također, osim toga da je auto bog, također vrlo jasno vidimo da nije samo auto u nebo, već je i gospa u nebo."
0:41:01,0:41:10,"I tu vidimo i to zviježđe krone na njezinu glavu, to je ono što sam govorila, znači da se poplapa sa otkrivanjima."
0:41:12,0:41:26,"Što je još vrlo važno i ukazuje na njezino zvesenje, je to da ovakav rastući zvijezda u jednom trenutku iznad nijednog mjesta nije moguće vidjeti sa odrednosti manje od 350 km."
0:41:28,0:41:32,Opet ukazuje na autorat i na djevičinu uznesenje.
0:41:41,0:42:05,"Ono što je meni isto tako zanimljivo, rado bih dopustila i ta isjeća, ali nažalost nemamo vremena, uglavnom današnje razvoj astronomije, znači današnje digitalna karta neba, možemo s obzirom na zanimljivo kretanje, promatrati kretanje zviježđa u biti u povijesti gdje su se nalazili kod mjesta."
0:42:06,0:42:10,I kroz to istraživanje je otkriveno da 12.
0:42:10,0:42:12,prosinca 1531.
0:42:13,0:42:17,"godine se Lav nalazi točno u Zelinu, to je iznad Meksiko Cityja."
0:42:18,0:42:26,Znači još jedna poruka da je zapravo središte i centar ove slike iskustvo naravno u tobi.
0:42:27,0:42:33,"O, još jedna zanimljiva sveza za zviježđe je to da polože zvijezda."
0:42:33,0:42:45,"na nebu odgovara zimskom sofisticijom, koji je ujedno bio i najvažniji dan u religijskom kalendaru od steka, tojest to je bio dan povijesti sofistica."
0:42:46,0:42:57,"Opet Marija, znači opet Marija na njima razumljiv način im poručuje da zapravo ono što ona donosi, da je to pravo istinsko povijesno sofisticije, pravo Boga."
0:42:58,0:43:11,"I vjerojatno vi same prevećujete da zimski sofisticij ne pada na dvanaest prosinac, nego na dvadeset jedan prosinac ali to nije nikakva zabluda je njihova zabuna jer točno te godine, 1531."
0:43:12,0:43:13,pao je u vrh 13.
0:43:14,0:43:22,ispraveo stari egorianski avatar te donosi egorianski avatar nazvan u polijemu prišući 10 dana.
0:43:24,0:43:27,Znači zimski susticij je te godine pao na 12.
0:43:28,0:43:28,prosinac.
0:43:33,0:43:35,E sad pustit ću vam još jedan video.
0:43:37,0:43:47,Razvoj virtualizacije i zapravo mogućnost da se slika oveća i do nekoliko tisuća puta uočene su razne slike u gospećim očima.
0:43:48,0:43:52,"Sad ja neću početi s tome prilično stručno, ali pogledajte taj video."
0:43:54,0:44:19,Stručnjak za digitalnu fotografiju Jose Aste Tonsman iz Lime koji se bavi proučavanjem slika iz svemira procesom digitalizacije uspio je dobiti povećanja slike do dvije tisuće petsto puta od originalne slike u veljači jedna tisuća devetsto sedamdeset devet takva povećanja primjenjuje dr tonsman na proučavanju očiju gospe guadalupske i došao je do iznenađujućih rezultata.
0:44:25,0:44:37,Peruanac Aste Tonsman dobio je dozvolu da u svoje slobodno vrijeme digitalizira sliku i otkrio je u gospinim očima ne samo jednu nego trinaest slika.
0:44:37,0:44:40,Na izgled to je jedna vrsta fotografije.
0:44:45,0:44:49,"Od gospe nevidljive, ali koja je fotografirala svojim očima."
0:44:52,0:44:53,Zanimljiva stvar.
0:44:55,0:45:05,"Kao da je gospa poput nevidivog fotografa bila prisutna pri otvaranju Diegove tilme s ružama u biskupovom dvoru, snimila prizore i spremila ih u svojim očima."
0:45:06,0:45:08,Nije ih izbrisala nego ih je sačuvala za nas.
0:45:10,0:45:54,"Doktor Lavoigne istražuje sliku od jedna tisuća devetsto pedeset šest do jedna tisuća devetsto pedeset osam uz oftalmoskop kao svjetlosni izvor i leću za povećanje i otkriva u rožnicama i zjenicama gospijinih očiju obrise ljudskih likova i fenomen purkinje samson Sanson koji nam objašnjava pojavu refleksnih sličica u ljudskom oku od objekta koji se reflektira na prednjoj površini leće i čini prednju sličicu, drugu sličicu čini prednja površina leće, te dvije sličice su virtualne i uspravne."
0:45:55,0:46:02,"Treća sličica se formira na stražnjoj površini leće, ona je obrnuta i realna sličica."
0:46:03,0:46:14,Sada prikazujemo projekciju prve pufinje sansonove skličice na rožnici živoga oka grupe ljudi koja nam je služila kao živi objekt.
0:46:37,0:46:51,Znanstveno ostaje nedorečeno kako je moguće da ova trosuka Purkinja Sansonova sličica ostane projecirana u oku koje nije živo oko na slici gospe Guadalupske.
0:46:51,0:47:04,"Nemoguće je naslikati sve te likove u krugovima od oko osam mm promjera, kolike su šarenice gospe Guadalupske i to uz apsolutno poštivanje optičkih zakona koji u šesnaest stoljeću nisu bili niti poznati."
0:47:05,0:47:27,Koliko to nismo uspjeli ni na grubim tkaninama suhna i jutro nismo uspjeli ni na nešto ili znatno finirati kanjeni lanenog platna gdje sam također pokušao u nekoliko poteza pod povećalom ostvariti iluziju jedne grupe ljudi.
0:47:29,0:47:44,"Ona je, kažem, opet ostala kao sugestivna impresionistička mrlja, a nikako se iz toga ne može pročitati egzaktan obris osobe ili dube osobe."
0:47:48,0:48:11,"Poruka koju zapravo možemo čitati iz ovih njezinih slika u očima, osim toga da je ona živa, pošto je kao što ste primijetili, ova populistica primijetila da je ovakav predmet teško uočudovitijem fotografijom, kao ova slikama u tom vremenu, također i simbolična poruka svima nama je vrlo jasna."
0:48:11,0:48:22,"Znači, gospođa zadržava sljedbe u svojim očima, najprije iz izu svojeg života, a ako gledamo šire iz naših života, ona ih pregrađuje u svom srcu i na temelju njih."
0:48:23,0:48:25,stvaramo molitve i prenosimo ih u odsu.
0:48:25,0:48:30,"Oka je jasna, utječite se gospi, ona je naša najnevjerojatnija zagovornica."
0:48:32,0:48:40,"To da je živa, osim ovog fenomena u njezinim očima, potvrđuje još jedna prilično fascinantna činjenica."
0:48:40,0:48:53,"Znači, kroz više godina ili više vremenica uvjeta mjerena je temperatura divne i sva mjerenja temperatura izvršena pokazuje temperaturu 37 stupnjeva."
0:48:54,0:48:57,Svi znamo da je to standardna temperatura života.
0:48:58,0:48:59,ljudskog tijela.
0:49:00,0:49:07,"Izgledala sam se prema tom tempu, pitala sam se mogu li ja uopće shvatiti to, ali tako je."
0:49:07,0:49:11,Način manje poruka je da živi i da je snaga.
0:49:14,0:49:20,Svi ovi znanstveni dokazi i simboli potvrđuju to da je ova slika ahimopita.
0:49:21,0:49:28,"To je grčka riječ koja znači neogotvoreno, odnosno stvoren i nastao bez ljudskog sudjelovanja."
0:49:29,0:49:33,To je izraz koji se prvi put koristi za već spomenuto.
0:49:33,0:49:42,"je to orijentalno platno za koje, za pristup ili na to orijentalno platno, za koje vjernici od prvih je rekao da je nastao potpuno bez ljudskog sudjelovanja."
0:49:45,0:50:10,"Također ono što ide u prilog tome da je ova slika aherobita, je također i istraživanje pod laserskim zrakom koji pokazuje da nije bilo nikakve boje na prednjem ili stražnjem dijelu tkanine i da čestice boje lede na udaljenosti od 0,25 mm od Tilune."
0:50:12,0:50:17,"Znači, opet govorimo, su znanstveni dokazi potvrđeni i ispitani."
0:50:17,0:50:23,"Kako to ja smatram, nego da je u sliku stvoren sam Bog."
0:50:26,0:50:42,"Još u prilog tome da je u slikama Hiropita je i istraživanje umjetnika Nivoela Cabrera, koji je kroz dvije godine istražio sliku i uputio da su na slici uklonjene četiri slikarske tehnike u divnom cjelinu."
0:50:43,0:50:55,"što se ne može postići u običnoj slikarskoj tehnici, a imamo na umu da u to doba se kasama kao tako tek razvio u Europi, dok u Meksiku nije bilo uopće govora o primjeru."
0:50:58,0:51:05,"Dobro, ja bih sad lagano svoj dio oprijela kraju, samo sa jednim svojim razmišljanjem."
0:51:06,0:51:17,"Znači mi ne znamo koliko će se još naša znanost i tehnologija razvijati i što će se još otkriti na ovoj slici, ali ono što nam stoji je da će slika ostati potpuno."
0:51:18,0:51:25,ista i tu možemo vidjeti zapravo na koji način gospa dolazi u temelju naše sveprivosti i poveznosti.
0:51:26,0:51:35,"Ona dolazi znači na tim iz siromašnog indijanca, a kroz stoljeća fascinira i intrigira cijelo čovečanstvo."
0:51:37,0:51:39,Poslušam vam za kraj jedan video.
0:51:40,0:52:14,"U tom videu su, mislim, dokumentarac stvarno odličan, ali danas sam izvolio taj dio u kojem ćemo vidjeti razmatranja jednog hrvatskog misionara vašu uvoznu središtu u Meksiku, zatim jednog stranjca, doktora, doktora tojest znači stručnjak za herbite i jednog francuskog mistika."
0:52:17,0:52:27,"Ona je Meksiku dala cijelom svijetu sliku, ovu sliku, tojest da sruši boganstvo i da navijesti evanđelje slikom kako?"
0:52:28,0:53:12,"Oni su se klanili suncu, a hvala vam divno kaže jer vidite, bisku kaže, sunce je njoj ukras, evo ga naokolo, ona odjevena sunce, klanili su se mjesecu, mjesec je pod nogama njezinim, dakle nije to božanstvo, klanili su se zvijezdama, zvijezde su ukras, ne blistaju puno, vidiš kada slikaju sada kopije, prave kopije, to blistaju, da, zvijezde su ukras na plaštu, ona nije bog jer ona je prigrlila glavu, slopila ruke, dakle ona se klanja više biću nego onaj ambasador Božji, službenica Božja, glasnica Božja, majka Božja i majka tu veselo je ono što mu je jasno, to je majčica."
0:53:12,0:53:15,Gospodina slika postaje kodeks za steike.
0:53:16,0:53:38,Amerikanka Helen Berens među prvima je otkrila godine jedna tisuća devetsto četrdeset pet da su milijuni indijosa prepoznali u isti čas godine jedna tisuća petsto trideset jedan da je slika otisnuta po cvijeću na tilbih onadijega slikovita poruka pravi i istinski roj simbola kao i druge slike u njihovim kodeksima.
0:53:39,0:53:46,"Ometiotr, tojest Bog, postavši slika, tojest Lakuilo, znao je stvoriti magistralno djelo."
0:53:47,0:53:55,"Vidjeli smo kako je Padre Maro spovori o astečkim kodeksima, kako su oni temeljni za razumijevanje poruka i mentaliteta asteika."
0:53:56,0:54:01,"Gospina slika je dakle kodeks za asteike, ona je kodeks evangelija."
0:54:02,0:54:07,"Oni u gospinoj slici čitaju poruku Božju, poruku spasenja."
0:54:36,0:54:38,"S pravom, papa Ivan Pavao II."
0:54:39,0:54:47,"u svjetlu gospe Guadalupske počinje navještati i pozivati na novu evangelizaciju, novu u izražaju, u žaru."
0:54:47,0:54:48,u znazi.
0:54:57,0:54:59,I konačno ona se očituje kao majka života.
0:55:00,0:55:03,Marija ne nosi dijete na rukama nego u svojoj utrobi.
0:55:04,0:55:11,"Stoga ju je papa Ivan Pavao II proglasio majkom života, majkom svih koji se posvećuju obrani života."
0:55:12,0:55:24,"I to je prvotna hitnost današnje crkve da brani život, tamo gdje je on najviše napadnuo u svojoj zori, u svojem fetusu."
0:55:36,0:55:41,"Treba braniti lomnost života i u drugoj skrajnosti, lomnosti starijih osoba."
0:55:42,0:55:53,Crkva treba štititi život i štiteći život štititi Boga jer džavao Biblija protiv svakog malog ljudskog fetusa jer ga podsjeća na dijete u krilu Marinu.
0:55:59,0:56:10,On također napada i osobe koje nisu ekonomski korisne da ih eutanazira jer svaka osoba koja trpi njega podsjeća na raspetoga na križu.
0:56:12,0:56:23,"Dakle, Marija u Guadalupe za nas je doista kao živa ikona života koji treba štititi, majčinstva, to je najbožanski otajstvo čitavog stvorenja."
0:56:29,0:56:39,Papa Pio XII je rekao da je žena zajedno s muškarcem remeh djelo i vrhunac svega stvorenja i na dasve žena koja nosi dijete.
0:56:40,0:56:41,Tu je misterij života.
0:56:42,0:56:46,Svaka noseća žena nas podsjeća na Mariju Majku Božju.
0:56:46,0:56:47,Evo Guadalupe.
0:57:07,0:57:34,"taj trenutak, ta svećenost njegove organizacije koja mene jako, jako dirnula je zapravo jedino ono čemu se priča on je duboko koji poštuje i njegove naše različitosti se jasno očituje u toj svećenosti gdje je papa Ivan Pavlov, znači cijeli, cijeli zapravo obred je ukrasio, ja ne mogu reći na neki način, po tonu, pa s tim što završit ću."
0:57:35,0:57:35,Hvala.
