Start (HH:MM:SS),End (HH:MM:SS),Segment
0:00:01,0:00:34,Čitanje svetog evangelja po luki U ono vrijeme vratiše se 72 radosni govoreći Gospodine iz Lodus i nam se pokoravaju na tvoje ime.
0:00:35,0:00:41,"A on im reče, promatrah Sotonu kako poput munje s neba pade."
0:00:41,0:00:52,Evo dao sam vam vlas da gazite po zmijama i štipavcima i po svojoj sili neprijateljevoj i ništa vam neće naškoditi.
0:00:53,0:01:04,"Ali ne radujte se što vam se duhovi pokoravaju, nego radujte se što su vam imena zapisana na nebesima."
0:01:05,0:01:19,"U taj isti čas uskliknu Isus u Duhu Svetom, slavim te od oče gospodaru neba i zemlje što si ovo sakrio od mudrih i umnih, a objavio malenima."
0:01:20,0:01:23,Da oče tako se tebi svidjelo.
0:01:24,0:01:36,"Sve mi predaje otac moj i nitko ne zna tko je sin doli otac, nitko je otac doli sin i onaj kome sin hoće objaviti."
0:01:37,0:01:59,"Tada se okrene prema učenicima pa im nasamoreče blago očima koji gledaju što vi gledate, kažem vam, mnogi su proroci i kraljevi htjeli vidjeti što vi gledate, ali ne vidješe i čuti što vi slušate, ali nisu čuli."
0:02:00,0:02:09,"Riječ Gospodnja, po riječima svetog Evanđelja izbrisali se naši grijesi."
0:02:11,0:02:21,"Čaga, naše i sestre u Kristu, slavimo danas spomendan svete Male Terezije, eto poznataj poti."
0:02:21,0:02:24,Znata je pod tim imenom ili sveta Terezija od Djete Isa.
0:02:26,0:02:31,"Mala Terezija, ali veliki svetac, velika svetica."
0:02:33,0:02:47,Ona je velika jer je znala biti malena i evo upravo je ona poruka svima nama kako je moguće ne učiniti ništa veliko na vani.
0:02:48,0:02:50,a postati veliki svetac.
0:02:52,0:02:56,"Dakle, ona je živjela u prošlom stoljeću, proživjela."
0:02:56,0:03:23,"je teško djetinjstvo, kad joj majka umrla, ona je bila mala djevojčica, ušla je vrlo rano u samostan, čak je od pape morala tražiti dozvolu da u takvoj ranoj dobi uđe u samostan i tu je bila u tim zidinama samostana, dakle bez nekog vanjskog velikog djelovanja."
0:03:24,0:03:27,A postigla je veliku svetost.
0:03:28,0:03:28,Zašto?
0:03:29,0:03:35,Jer je znala obične male stvari raditi velikom ljubavlju.
0:03:36,0:03:51,Jednom je razmišljala kako bi ona nešto veliko napravila i onda je čitala Sveto pismo i naišla je na poslanicu Korinčanima gdje je tamo pročitala onaj tekst Sv.
0:03:52,0:03:59,Pavla Glasoviti o ljubavi i onda joj je postalo jasno pa evo ja mogu tako ljubiti.
0:04:01,0:04:41,"U srcu crkve biti ljubav, biti srce koje ljubi i to je onda i živjela iako joj nije bilo lako i bolovala je, umrla je u svojoj mladosti u dvadeset četiri godine života umire ali umire radosno nakon kušnji i nevolja ipak na kraju govori ja ne umirem ja ulazim u nebo ja se vraćam ocu svome idem u svoju pravu domovinu koja je na nebesima evo obraćam se sestre to je njezina poruka nama."
0:04:43,0:04:48,Ne morate činiti nešto spektakularno veliko da svijet vidi.
0:04:49,0:04:58,"Obične stvari u svojoj kući, na svome poslu, u obitelji, možeš postati svetac i svetica."
0:04:59,0:05:06,"Ako to učiniš s čistim srcem, velikom ljubavlju, spreman služiti iz ljubavi."
0:05:07,0:05:24,"Imati ljubav koju govori Pavao, poslanici Korinčanima, da sve vjeruje, sve podnosi, svemu se nada, da ne zavidi, ne hvali se, ne opoli se, nego služi drugima i s ljubavi."
0:05:25,0:05:36,"Eto to svi možemo uz milost Božju naravno, tako ljubiti može onaj koga Duh Sveti osposobi."
0:05:37,0:05:41,A Duh Sveti razlijeva ljubav Božju u naša srca.
0:05:42,0:05:50,"Po Duhu Svetome je ljubav Božja razlijevena u našim srcima, kaže Pavao u poslanici Rimljanima."
0:05:50,0:05:54,Eto zato treba imati čisto srce i jaku vjeru.
0:05:55,0:06:02,Onda Duh Sveti nas ispunja ljubavlju koju mi onda možemo služiti drugima.
0:06:07,0:06:18,Današnje evanđelje u prvom dijelu učenici su se hvalili pred Isusom kako im se iz ludosti pokoravaju.
0:06:21,0:06:23,Isus im je dao tu moć.
0:06:24,0:06:44,"Ali Isus im govori da ima jedan drugi veći razlog da se radujete, a ne tome samo da vam se zlodosi pokoravaju, a to je razlog da se možemo istinski radovati jer da su nam imena zapisana na nebesima."
0:06:46,0:06:49,"Vratit ću i sestre, evo i nama Isus to poručuje."
0:06:51,0:06:54,To treba biti izvor naše radosti.
0:06:55,0:07:11,"Mi ovdje živimo u suznoj dolini i ovdje je normalno imati nevolja, munka, tjeskova, strahova, ali ono najljepše zašto nas je Bog stvorio, to je Bog ostavio da nas čeka."
0:07:13,0:07:21,"Za one koji ne vjeruju za te iste, ono najljepše prođe u prvom dijelu života, to je mlado zdravlje i ljepota."
0:07:22,0:07:27,"A onda dolazi bole i starost, smrt, tjeskove i nevolje."
0:07:29,0:07:51,"Za nas vjernike je obratno, ono najljepše nas čeka nas na nebesima, ljepota o kojoj ovdje ne možemo ni sanjati, kaže Pavao, oko nije vidjelo, uho nije čulo ni srce, poželjelo onu ljepotu koju je Bog pripremio onima koji ga ljube."
0:07:53,0:08:12,"Eto, to nam Misus poručuje, radujte se tome i kad dođu nevolje, tjeskobe, muhe, neuspjeh, razočaranja na ovome svijetu, prihvatimo to kao jedan sastavni dio života ovdje u ovoj suznoj dolini."
0:08:13,0:08:18,Ali mi znamo da nas čeka neutisiva radost i veselje.
0:08:20,0:08:32,"Eto to je ljepota naše vjere, da u nevoljama ovog života Bog daje snagu da izdržimo, a da sačuvamo svoju vjeru, nadu i ljubav."
0:08:33,0:08:45,"Po tome se čovjek ostvaruje kao osoba, ne po tome da završi velike škole, skupi puno moći, utjecaja, vlasti u životu."
0:08:45,0:08:52,užitaka ili materijalnih dobara jer sve to ostaje na ovome svijetu.
0:08:53,0:09:09,"Kad te Bog pozove sebi, ništa ne možeš nositi na drugi svijet, nosiš samo sebe, svoju dušu i što si postigao ovdje radeći, gradeći u vjeri, nadi i ljubavi."
0:09:10,0:09:13,Jes li sačuvao vjeru i po njoj živio?
0:09:14,0:09:16,Jes li imao pouzdanja u Boga?
0:09:16,0:09:19,Jes li imao ljubavi koja služi?
0:09:19,0:09:20,To je bitno.
0:09:21,0:09:24,O tome ovisi i naša vječnost.
0:09:25,0:09:34,Kako nas djavao i duh ovog svijeta lako mogu zavesti da se zalijepimo za ovu zemlju.
0:09:36,0:09:38,A zemlja nema sve što nam treba.
0:09:39,0:09:44,Mi smo stvoreni za vječnost ljudsko je srce već i od čitavog svemira.
0:09:45,0:09:49,Samo nas Bog može ispuniti jer nas je On za sebe stvorio.
0:09:51,0:10:08,"Evo, kraćoj sestre, mi smo ovdje i povodom jer je Homski jerihonskog klanjanja koje će biti non-stop ovaj tjedan dana, to je silna moć duhovna se oslobađa kad se klanjamo živom Isusu."
0:10:09,0:10:15,Sam Isus rekao ja sam s vama u sve dane do srušetka svijeta.
0:10:16,0:10:25,"Najsigurniji način da je Isus s nama je u Euharistiji, odnosno u presvetom altarskom sakramentu."
0:10:27,0:10:30,Nema bolje pobožnosti i jače za izjavu.
0:10:30,0:10:35,i djelotvornije za naš duhovni život od Euharistije.
0:10:36,0:10:41,Sveta misa je Bogu najdraža i nama najkorisnija molitva.
0:10:42,0:10:44,I odmah u svetu misu tu je klanjanje.
0:10:45,0:10:53,Isti ovaj Isus koji nam dolazi u svetoj misi i onaj koji ostaje u posvećenoj hostiji.
0:10:56,0:10:57,Mi smo ni svjesni.
0:10:57,0:11:00,koju imamo sa sobom moć.
0:11:00,0:11:04,"Bog sam, nebo je ovdje na oltar."
0:11:04,0:11:18,"Živi Isus Krist, onaj koji je pobjedio djavla, pobjedio smrt, pomirio nas Bogom, pripravio nam mjesto u Božjem kraljevstvu i sada boravi ovdje s nama."
0:11:20,0:11:28,"Zato se mi poklanjamo, pokleknemo kad uđemo u careku, samo se Bogu uklanjamo."
0:11:31,0:11:39,"Evo, mi ćemo dakle kroz ovo vrijeme, evo pozivam i vas da koliko god možete vremena provesti u klanjanju."
0:11:41,0:11:44,Tada se duša ispunjava milošću Božjom.
0:11:46,0:11:50,To je druženje sa Isusom Kristom našim prijateljem.
0:11:52,0:11:54,Evo ja imam jedan primjer.
0:11:55,0:12:00,Prije nekoliko godina jedna obitelj mlada me pozvala na nedjedni ručak.
0:12:02,0:12:04,Željeli su me tu počastiti.
0:12:04,0:12:09,"Imali su sina malog Dominika, gdje je šest godina u to vrijeme."
0:12:10,0:12:15,I on je vidio u subotu mama uređuje kuću više nego obično i pitao.
0:12:15,0:12:23,"Obično je pitala zašto to radi, onda je ona rekla, sutra nam dolazi ugostitelj patar Mio Nikić."
0:12:23,0:12:27,"Sada on zna Mio Nikić to ime i prezime, ali šta je patar?"
0:12:27,0:12:28,"Mama, šta je to patar?"
0:12:29,0:12:38,"Nije ni ona znala da to znači latinska riječ, otac ili velečasnik, kako nas Isus ucele zovu patar."
0:12:39,0:12:48,"Nego je ona rekla, što joj je palo na pamet, ali jako dobro je rekla, rekla mu je, patar to znači Isus od prijatelja."
0:12:49,0:12:52,I mali nije dalje pitao ali je zapamtio.
0:12:52,0:13:02,"I drugi dan u popodne kad sam se ja s njim pozdravljao, on mene pogleda u oči i upita jesi li ti Isusov prijatelj."
0:13:04,0:13:07,Evo moram reći da me protreslo to pitanje.
0:13:07,0:13:14,"Bilo mi drago da me jedno nevino dijete tako oslovljava, ali je to i bilo pitanje ozbiljno."
0:13:15,0:13:17,Jesam li ja Isusov prijatelj?
0:13:18,0:13:31,"U Evanđelju na jednom mjestu čitamo Isusove riječi, govori svojim apostolima, vas sam nazvao prijateljima jer vam prioči sve što sam čuo od Oca svoga."
0:13:31,0:13:40,"Dakle, Isus je izabrao svoj učenika i sve nas on doživljava kao svoje prijatelje za koje je život dao."
0:13:41,0:13:48,"Pa evo kao što je mene pogodilo pitanje, ja bih želio da i vas pogodi to pitanje."
0:13:48,0:13:50,Jeste li ti Isusov prijatelj?
0:13:52,0:13:56,Jeste li spremani uzvratiti Isusu na njegovu ljubav?
0:13:56,0:13:59,On je iskrvario na križu za nas.
0:14:00,0:14:02,da ja budem vječno sretan.
0:14:03,0:14:15,"On me izbavio iz vlasti djavla, sačuvao od vječnih paklenih muka i osigurao mi život u Božjem kraljevstvu."
0:14:17,0:14:26,"Vraćajući se sve, to je sve zasluga Isusa Krista, njegovom spremnošću da ide na križ, da iskrvari na križu za nas."
0:14:27,0:14:37,To je cijena našeg spasenja i to je snaga njegovog prijateljstva da je spreman umrijeti za svoje prijatelje.
0:14:38,0:14:44,"Zapravo mi smo bili njegovi neprijatelji po grijehu, a on je još tada umro za nas."
0:14:45,0:14:58,"A evo mi odgovorimo na tu ljubav ovdje ovim klanjanjem ili kad uđemo u crkvu, sjetimo se ovdje živi Isus Krist, moj spasitelj."
0:14:59,0:15:10,A kako će to lijepo biti poslije smrti kad padnu mnene koje nam sad skrivaju pravu stvarnost i ugledamo Isusa licem u licu.
0:15:11,0:15:13,To će biti nebo.
0:15:15,0:15:19,"A evo, i što se to događa ovdje, samo u vjeri."
0:15:19,0:15:25,"Mi ne vidimo, mi vidimo hostiju, ali u njoj je skriven i živi Isus Krist."
0:15:26,0:15:40,"Evo, neka nas Duh Sveti obdari Božjom ljubavlju i spremnošću da mi Isusa doživljavamo kao svog prijatelja za kojeg ćemo biti spremni i život svoj dati."
0:15:40,0:15:41,Amen.
