Start (HH:MM:SS),End (HH:MM:SS),Segment
0:31:18,0:31:20,Se sjećate ovo maloprije?
0:31:21,0:31:28,"Stvari se čine besplatno, ništa ne dobivam za to od drugih ljudi, zato je potrebno to izbjeći."
0:31:28,0:31:41,"Kaže Isus, zato kažem vam, ti naprotiv, kad postižeš, pomaži glavu i umi lince da ne zapaze ljudi kako postižeš, nego otac tvoj koji je u skromitosti."
0:31:42,0:31:48,"Nemojte sad preokrenuti priču pa gledat tko dođe u crkvu najljepše uređen i najbolje naš mijing, ga reče jedan ga je posti."
0:31:51,0:31:52,To isto treba izvjeći.
0:31:54,0:32:04,Ali je jako važno uočiti da Isus hoće da sačuvamo stvari koje su nam važne između nas i Boga u skromitosti.
0:32:05,0:32:05,Zašto?
0:32:09,0:32:14,Otac tvoj koji vidi u skromitosti uzvratit će ti.
0:32:15,0:32:18,"Dakle, Bog vidi što se događa u ljudskom srcu."
0:32:19,0:32:21,I I on će uzvratiti na takav post.
0:32:23,0:32:26,Najpoznatiji post naravno nama kršćanima je Isus O.
0:32:26,0:32:27,Post.
0:32:27,0:32:46,"To je post kušnja u pustinji četrdeset dana gdje je on četrdeset dana bio u judejskoj pustinji koje simboliziraju četrdeset dana prolaska izabranog naroda kroz sinajsku pustinju, ulaska u obećanu zemlju prije nego li je on počeo javno djelovati."
0:32:46,0:32:48,Ali to je za nas uputa.
0:32:48,0:32:53,Prije velikih životnih koraka dobro je odvojiti vrijeme za post.
0:32:54,0:32:57,"Dakle, Isus je u najvećih životnih koraka životni korak."
0:32:57,0:33:01,Najveća promjena je bila između skromitog života i javnog života.
0:33:04,0:33:12,"Redovnicima je primjerice vrijeme prije svečanih zavjeta vrlo važno vrijeme, to je vrijeme za post."
0:33:12,0:33:17,"Svećenicima prije svećeničkog ređenja, to je vrijeme dobro za post."
0:33:17,0:33:24,"Ili u životnim trenucima kada moramo donijeti neku važnu životnu odluku, udvojiti vrijeme za post."
0:33:26,0:33:28,Što se događa s nama kad postimo?
0:33:29,0:33:40,"Ako vas zanima fizička strana, dakle tjelesna strana možete naći vrlo dobre informacije sa, o postu na internetu koliko god hoćete, imate puno dobrih informacija."
0:33:40,0:33:51,"Ali kad mi pogledamo što se s nama u duši događa u odnosu s Bogom, mi ćemo primijetiti da post najprije treba imati dobro vrijeme."
0:33:52,0:34:15,"Post nije jedino jedan dan, to je naš uigrani, može biti tjedni post od jednog dana ili od dva dana, ali ako hoćemo napraviti neku važniju, neki važniji korak u životu, onda taj post može trajati sedam dana, petnaest dana, tri tjedna i za njega se treba spremiti."
0:34:16,0:34:28,"Treba se spremiti u smislu da ja imam vrijeme kad mogu postići, da to nije užurbano vrijeme rada, ja mogu uvijek raditi sve, ali to mora biti vrijeme kad se, ako ja mogu posvetiti Bogu."
0:34:28,0:34:30,Što se dogodi kad mi postimo?
0:34:32,0:34:41,"Mislim da taj prvi strah kod ljudi koji ne znaju što je postići je strah da ću stalno osjećati glad i kako ću podnijeti, jer kad se glada ne može spavati."
0:34:42,0:34:45,Ali osjećaj gladi nestane relativno brzo.
0:34:46,0:34:53,"U dan, dva osjećaj gladi nestane jer tijelo je savršeno satkano, tijelo je genijalno napravljeno."
0:34:53,0:35:13,"Kad tijelo razumije da više ne dobiva hranu, ne pojavljuje se osjećaj gladi, nema nikakvog krčanja, nema ničega, to je ti si miran i s vremenom kroz nekoliko dana dobiješ jednu lakoću u tijelu, osjećaš se olakšan, funkcije tijela se stabiliziraju."
0:35:14,0:35:19,"Dakle, to je na tjelesnoj razini prvi važni korak da smo počeli postati."
0:35:22,0:35:25,Druga stvar koja se dogodi je u odnosu na vrijeme.
0:35:27,0:35:40,"Vi znate da nam treba za doručak neko vrijeme, za ručak neko vrijeme, za večeru neko vrijeme, ako još imate kao prijepodne, kao posljepodne, zbrojite koliko je to vremena, a vi ćete vidjeti koliko to vremena ima."
0:35:41,0:35:43,Sve to vrijeme dobijete u postu.
0:35:45,0:35:54,"To znači, od kada ustaneš, dok legneš, nema više sjedenja za ručkom, nema ništa, to je vrijeme tvoje, znaš puno vremena."
0:35:55,0:36:18,"Drugo što dobiješ je da tijelo odnosno um, glava nije opterećena hranom i kad mi jedemo, nakon toga nam treba, ako moraš trenit, moraš malo zaspati, moraš se odmoriti jer je jer krv odlazi u stomak, a nije ima više u glavi, ja ne mogu dobro funkcionirati, ali kad postiš toga nema, znači ti postaješ bistri i to traje jako dugo, cijeli dan."
0:36:19,0:36:29,"Treća stvar koja se dogodi u tijelu, to je da spavaš manje i spavaš, probudi se vrlo lagano ujutro, probudi se ranije nego inače, ne trebate spavanja."
0:36:30,0:36:35,"Dakle, nama te promjene u tijelu donose promjene koje se tiču odnosa prema vremenu."
0:36:36,0:36:41,"Drugčije shvaćanje vremena, to je jedno veliko, važno iskustvo u postu."
0:36:44,0:36:45,Što se dalje dogodi?
0:36:46,0:37:07,"Dogodi se da POS počne pokazivati gdje su moje kritične točke, počnu izlaziti vani moje napasti, počne izlaziti to što me muči, koje su moje strasti, gdje su moji strahovi, tko mi smeta u životu, s kim se ne mogu vidjeti, tko mi diže živce."
0:37:08,0:37:15,"Drugim riječima, postajemo jako osjetljivi i to što nam je stalno prisutno u životu odjednom postane vidljivo."
0:37:15,0:37:22,"Dakle, kada se vratite na Isusa u Postu, u pustinji, onda ćete vidjeti na koncu, što postaje vidljivo?"
0:37:22,0:37:26,"Napast, jer on se mora izboriti sa napastnikom, sa njegovim kušnjama."
0:37:27,0:37:37,"Drugim riječima, post je susretanje sa onim što nas najviše muči, što je u nama, a što mi nismo u stanju u svakodnevnom životu tako lako vidjeti."
0:37:40,0:37:44,Što se dalje dogodi s čovjekom koji posti?
0:37:46,0:37:52,To je jedan efekt kojega ne možemo razumjeti nego samo u poslu.
0:37:52,0:38:00,"Poslom inače kao i svaka druga praksa, vi ne možete naučiti plivati u svojoj kući u botincu."
0:38:00,0:38:17,"HZMO-u, nemojte zato što nema mora, nema bazena, ne možeš u kaden ući plivati, možeš naučiti plivati samo ako uđeš u more, ako uđeš u jezero, ako uđeš u vodu, ne možeš drukčije, ne možeš znati što je post ako ne postižeš."
0:38:21,0:38:41,"Kad prođe neko vrijeme posta i ti se vratiš hrani, to je čudo jedno kakav okus ima hrana, to je čudo jedno koliko ti malo hrane treba, to je čudo jedno kako ne moraš brzo jesti."
0:38:43,0:39:02,"Nikada nećete imati tako intenzivan okus bilo koje hrane kao nakon posta jer tada je tijelo neopterećeno hranom, izbistrela se, osjetila i odjednom imaš osjećaj da je to čudesno, tako dobro."
0:39:02,0:39:14,"To vam je kao kad recimo dijete svaki dan uzima neku čokoladu i jede slatkiš, vi mu date jabuku, jabuka njemu nije slatka."
0:39:15,0:39:24,"A ako vi mjesec dana ne uzimate nikakav šećer, nikakvu slatku stvar i nakon toga zagrizete jabuku."
0:39:25,0:39:27,To je kozmos od šećera.
0:39:28,0:39:34,"Dakle, to što mi osjećamo ovisi kako se odnosimo inače prema hrani."
0:39:35,0:39:43,I stoga mi razumijemo zašto se u židovstvu i u kršćanstvu post smjestio prije velikih svečanosti.
0:39:45,0:39:53,"Prije nego imate proslavu, ne znam neke velike svečanosti, u nas je to velika gospa, Božić, Uskrs."
0:39:54,0:39:55,Zašto mi tada postimo?
0:39:56,0:40:09,"Jedan od važnijih razloga je da kad prestane post da pokušamo kako je dobar okus hrane, da pokušamo kako je dobro to što je Bog stvorio."
0:40:10,0:40:23,"Stoga ako hoćete imati duboki užitak u hrani, u piću ili ako hoćete u bilo kojem drugom tjelesnom užitku morate postati."
0:40:24,0:40:31,Post je priprema za duboko iskustvo dobrote onoga što nam je Bog stvorio.
0:40:32,0:40:36,To je jedna od važnijih elemenata jer Bog hoće da imamo puninu života.
0:40:37,0:40:41,"Drugo, ako mi nikad nismo posili, mi nikad nećemo moći to tako pokušati."
0:40:41,0:41:00,"Ja sam to prvi put iskusio prije nego sam baš postio, ali ono kad bih išao iz Makarske, sam se penjao na vrh brda na Biokova pa ne bi ponio nikakvu hranu sa sobom nego samo vodu i jednu naranču i tu naranču na vrhu, evo gore kao nagradu koja je to čudo od okusa bilo."
0:41:02,0:41:04,"To je, naranča nije takva."
0:41:04,0:41:11,"Drugim riječima, ta pretpostavka da nas post pripremi za hranu je važan moment."
0:41:17,0:41:26,Mi naravno znamo da POS ima jaku simboličku snagu i da se mi s njim možemo služiti na vrlo različite načine.
0:41:27,0:41:50,"Vi ćete naći u Starom zavjetu posebno kod Izaije proroka, ako vas to zanima uzmite pedeset osam glavu izaije proroka vi imate jaku kritiku posta koji se pretvorio u religioznu praksu iza koje ne stoji trud za bolji svijet gdje onda preko proroka izaije bog kaže ma šta će mi takav vaš post?"
0:41:51,0:42:03,"Vi postite od hrane, a ne vidite nepravdu oko sebe, ne vidite da su vam susjedi zarobljeni, vi tlačite ljude, ne dajete plaću radnicima."
0:42:03,0:42:04,Šta će meni takav post?
0:42:06,0:42:06,Bacite taj post.
0:42:07,0:42:26,"Drugim riječima, taj zajednički tekst kaže ako post ima neku svrhu, on ima svrhu da svijet učinimo boljim, da postanemo osjetljiviji za ono što je važno u odnosu prema drugima, prema svijetu, prema zajednici."
0:42:26,0:42:35,I tu nam pada na pamet ta velika razlika između vjernickog posta i suvremenog sekularnog posta.
0:42:36,0:43:19,"Kad vi pogledate čemu služi sekularni post, on je uvijek da ja budem zgodniji, da ja budem kako se kaže sportski, da meni bude dobro, da ja budem zdraviji, dakle mi skrbimo sami za sebe što nije loše, ali sam za sebe staviti samog sebe u središte to nije kršćanski, to nije vjernički, mi smo svi ovdje susreli da je vjernički staviti Krista u centar i onda post je trud oko odnosa s Bogom, oko odnosa s drugim ljudima i oko odnosa sa samim sobom."
0:43:20,0:43:33,Zato post ima vrlo različite naglaske u vjerničkom postu od onih koji ćete naći u jednom postu koji se tiče ne znam sekularnog svijeta.
0:43:36,0:43:46,Ja sam ovih dana nešto razgovarao s ljudima koji postoje i imaju poteškoća sa okruženjem u kojem žive.
0:43:47,0:44:05,"Ja moram priznati da je to vrlo česti slučaj u kršćanstvu, kod nas Hrvata uglavnom je to slučaj, čak i u redovničkim i svećeničkim zajednicama osim možda u Međugorju i tamo u zajednicama koje su blizu Međugorja."
0:44:05,0:44:13,"Jeste li vi odlučili posjetiti, oko vas će doći mnoge upute, ne, ne, ne, ne, pazi na zdravlje, pazi na ovo, pazi na ono."
0:44:14,0:44:18,"A onda ima ljudi koji nemaju iskustva, postaju i dijele savjete."
0:44:19,0:44:32,"Ne, nedavno pitala jedna žena koja se trudi posjetiti, kaže ja ti postim srijedom i petkom o kruhu i vodi i pijem kavu, ne mogu, moram popiti kavu, ja ne mogu funkcionirati."
0:44:32,0:44:42,I kaže ja sam išla tražiti odgovor kod neću reći koga i pitala sam ga jel ja mogu posjetiti o kruhu i vodi a da popijem kavu ujutro i poslijepodne.
0:44:43,0:44:47,"Odgovor je bio ovakav, ako ti piješ kavu, poslijepodne ništa ne vrijedi."
0:44:48,0:44:49,To sve zaboravi.
0:44:50,0:44:56,"Jedna žena pogođena, ono, poslije pije kavu i sad je izluđena, sad je poslije vrijedi."
0:44:57,0:45:04,Pa bi ja volio da nekako stavimo sebi možda neku praktičnu jasnoću u glavu.
0:45:06,0:45:11,Post u principu je ono što ja uredim.
0:45:12,0:45:19,"Mi znamo da se može postiti, nemrskad ne jedemo masno, znamo da se može postiti o kruhu i vodi."
0:45:19,0:45:24,"To je jedan uigrani, stari, vrlo arhaični način posta."
0:45:24,0:45:28,"Jedem kruh i pijem vodu, od toga mogu proživjeti, drugo ne uzimam."
0:45:29,0:45:33,"Ali vi možete postiti samo o vodi, vjerojatno još ništa."
0:45:33,0:45:44,Ali vi možete postitiati tako da jedete jedan put u danu bilo koju normalnu hranu.
0:45:45,0:45:48,Dakle mi određujemo na koji ćemo način postati.
0:45:48,0:45:59,"To ovisi o tom kojim sam ja dobi, koliko godina imam, kakvo je moje zdravlje, što se događa s mojim tijelom, kad postim, jako postim."
0:45:59,0:46:11,"Ljudi su vrlo različiti, ima ljudi koji jednostavno zbog fizičkog stanja ne mogu postati i to Crkva je vrlo jasno kazala kada netko dođe u neke godine nije za njega post kao što nije post za dijete."
0:46:12,0:46:24,"Dakle mi moramo procijeniti sami kakvo je naše fizičko stanje, koje su naše navike sa hranom i sa pićem i u tom pronaći način da postimo."
0:46:25,0:46:28,I naravno da možete gledati vrlo različite prakse.
0:46:28,0:46:39,Ako hoćete post učiniti jednim redovitim načinom odnosa prema Bogu i vremena za molitvu možete postiti jedanput tjedno petkom.
0:46:39,0:46:50,To može biti tako da nešto jedete ili da jedete jedanput ili ako vam to dopušta zdravlje da ne jedete ništa ili samo jedete kruh i vi ćete primijetiti na sebi što vam se događa.
0:46:50,0:46:54,"To može biti dva puta tjedno, to može biti u srijeda i petak."
0:46:55,0:46:58,Ali vi možete postati samo u korist mi.
0:46:59,0:47:13,Možete u korist mi reći ja u korist mi se odričem alkohola i ne pijem alkohol kroz cijelu korist mi ili se odričeš cigareta ili se odričeš ne znam slatkoga ili se odričeš mesa.
0:47:14,0:47:19,To je vrlo osobna priča koja ovisi o tom kako izgleda moj život.
0:47:19,0:47:30,"I volio bi da razumijete da POS nema neki kodirani, kodiranu normu koju ja moram izvršavati ili mi POS ne vrijedi."
0:47:31,0:47:37,"Post je vrlo osobni odnos, kaže Isus kad postojiš, postoji u skromitosti."
0:47:37,0:47:42,U skromitosti u odnosu sa svojim Bogom možeš donijeti odluku kako će to izgledati.
0:47:44,0:48:03,"Što ulazi u post, u što ćeš potrošiti vrijeme koje si dobio, na što želiš potrošiti snagu koja ti dolazi postom, za što želiš moliti, s kojim ljudima se želiš družiti, koju literaturu želiš čitati, što ćeš napraviti od vremena kad ustaješ ranije."
0:48:03,0:48:08,Dakle imamo puno stvari koje treba dovesti u red i posložiti ako hoćemo postiti.
0:48:09,0:48:26,"Tako da je trud oko posta prilično važan i zahtjevan, mi ne možemo tek tako samo postiti jer to od nas traži da detaljnije uredimo odnose s ljudima s kojima živimo i da posložimo stvari koje su nam važne."
0:48:28,0:48:42,Još jedna sugestija ako hoćete postiti je da pokušate pronaći koliko tekstova ima na hrvatskom jeziku o tom kako su ljudi postili i što je to za njih značilo.
0:48:42,0:48:52,"Da eventualno malo poslušate i druge ljude što im se događalo, što možete očekivati, na koji način organizirati molitvu."
0:48:53,0:49:01,"Ja znam da postoji i manjih grupa u Hrvatskoj, to je moguće i ovdje među vama koji postaju u zajednici, u grupi."
0:49:02,0:49:05,Znači mi se dogovorimo da ćemo kao zajednica postati.
0:49:05,0:49:06,To može biti isto različito.
0:49:07,0:49:11,Ili postimo svi srijedom i petkom ili će svatko postiti jedan dan.
0:49:11,0:49:19,"Imate ljude, sedam ljudi, sedam muškaraca kažu, nas sedmoročno ćemo postiti za to da budemo bolji muževi svojim ženama."
0:49:20,0:49:35,"Ja postim ponedjeljkom, ti ćeš utorkom, ti ćeš srijedom, a onda se nedjeljom nađemo pa zajedno kažemo što nam je bilo, koje su nam bile napasti, eventualno se pomolimo i na da sve pazimo jesu naša žena sretnije kad mi postimo ili nismo ili nisu."
0:49:36,0:49:40,"Dakle, hoću reći jedan mali primjer kako se to može organizirati."
0:49:40,0:49:43,"Dakle, mi možemo se povezati s ljudima da ne budemo sami."
0:49:44,0:49:53,"To je važan moment jer mi u Crkvi znamo da imamo zajedničke poslove, ali oni mogu biti ne samo zajednički nego mogu biti i vrlo osobni."
0:49:54,0:50:10,Pa bi evo tih nekoliko možda praktičnih napomena možda moglo ukloniti poteškoće koje se pojavljuju sa našim onako dosta škrtnim iskustvom sa POS-om.
0:50:12,0:50:58,"Meni se čini da mogu vam spomenuti i neke knjige, imate primjerice iskustva POS-a u Pravoslavnoj crkvi, Solovjev je pisao nešto o tome, imate to na hrvatski prevedeno, imate praksu koja se razvijala u Međugorju, pokojni Fraslavko Barbarić je napisao i knjigu Postiti srcem, on je zapravo uveo praksu POS-a u Međugorju koja i danas postoji, to je recimo sedam dana postao kruhu i vodi gdje imate seminare u kojima voditelj sa onima koji se uključe u to im pomaže da nauče kako mogu živjeti samo u kruhu i vodi otkrivajući da više žive o Božjoj riječi."
0:50:58,0:51:12,Dakle to se događa u Međugurju pa onda sudjeluju u redovitom svakodnevnom programu ali onda preko dana postaje i to postaje u zajednici pa onda mogu izmjenjivati na kooncu tog seminara koji je uglavnom u šutnji i svoja iskustva.
0:51:13,0:51:22,"Dakle postoji jedna vrlo važna religiozna, tjelesna, duhovna psihička avantura."
0:51:23,0:51:25,"Bilo bi šteta proći kroz život, me to ne iskusiti."
0:51:26,0:51:27,To je jedno važno iskustvo.
0:51:28,0:51:30,"Probajte, nemojte im vjerovati."
0:51:30,0:51:45,"Uzmite za početak tri dana, pa ako vam ide dobro nastavite za pet dana, pa ako ide dobro napravite sedam dana da probate što se događa s vama jer mi nikad ne znamo što sve leži u nama ukoliko se ne upustimo u jednu takvu praksu."
0:51:46,0:52:03,"A možda otkrijete najvažnije stvari u svom životu, možda otkrijete kako dišete pred Bogom, koje su vaše napasti, koje su emocije koje vas muče, ali možda otkrijete i mirnoću i blagoslov i blizinu Božju zato što ste se upustili."
0:52:04,0:52:10,"Pokušajte POS povezati prvenstveno sa Božjom riječi, zato što je to Isusova uputa."
0:52:11,0:52:16,"POS njegova prva uputa, prvo odbijanje napasti je ne živi čovjek samo u kruhu."
0:52:17,0:52:21,"Dakle, kad ja odričem se kruha, nego živim od svake Božje riječi."
0:52:22,0:52:37,"Pa onda bi jedna konkretna uputa bila, ako se odvažim na POS od sedam dana, bilo da onda tih sedam dana nađem način kako ću doći svaki dan u svetu misu, koje ću čitanje uzeti, kako ću čitati Božju riječ."
0:52:37,0:53:21,"I još jedna uputa koja može biti od velike koristi je da napravite sebi dnevnik posla, da unosite u to, upišete u svoj dnevnik što se događa kad postajete, zato što mi redovito puno stvari zaboravimo, ali će vam se pojaviti misli, pojavit će vam se ideje, pojavit će vam se što možete napraviti, ako imate nekoga koga ste uvrijedili, niste se još ispričali, kad budete postali doći će vam u glavu, ja bi morao Ivana zamoliti za oprost, zapišite to sebi, pa ćete naći da vam se u svijest vraćaju blagodati ili milosti koje ste dobili i za koje niste zahvalili, pa ćete onda reći ja bi morao za to zahvaliti."
0:53:21,0:53:35,"Dakle, POS je jedna neobična praksa koja nam približava Boga u naš život, ali nam približava i nas same jer mi tada dajemo prigodu sebi da vidimo kako stvari stoje iznutra."
0:53:37,0:53:46,"Eto, to bi bilo otprilike tih nekoliko važnijih momenata koji se tiču POS-a koji mi se čine važnim."
