Start (HH:MM:SS),End (HH:MM:SS),Segment
0:00:01,0:00:16,"Hvaljeni su svi Marija, pozdravljam vas, pozdravljam sve one koji su s nama preko društvenih mreža, njima je malo toplije nego nama u crkvi ovdje, a vani pada kiša."
0:00:17,0:00:30,"Počet ćemo ovaj poslijepodnevni susret jednom kratkom molitvom sa svježću što činimo, stavit ćemo na sebe znak križa u ime Oca i Sina i Duha svetoga."
0:00:30,0:00:30,Amen.
0:00:32,0:00:48,"Sve moguće, dobri Bože, mi te molimo da nam tražiš svoj blagoslov da možemo otvoreno u otvorenog uma i otvorenog srca čuti tvoju riječ, primiti je u srce i pustiti je da nas oblikuje izvnitra."
0:00:50,0:00:53,Slava Ocu i Sinu i Duhu Svetomu.
0:01:00,0:01:02,"U ime Oca i Sinaja i Duha Svetoga, amen."
0:01:03,0:01:04,Izvolite sjest.
0:01:06,0:01:30,"Kad je veličastni Matej zvao da organizira ovu duhovnu obnovu tražili smo vrijeme u korizmi, nismo ga mogli naći pa smo se približili korizmi koliko smo se mogli približiti, ali on je svejedno htio da onda dotaknemo jednu našu korizmenu temu i da se nekako zaustavimo na njoj i mislim da je to dosta ovako zanimljivo, riječ je o Postu."
0:01:33,0:01:41,"Post je jedna vjerojatno najstarija religiozna praksa koju mi poznajemo, otkad znamo za sebe."
0:01:43,0:01:55,"Ja bi volio nešto progovoriti o tom zato što je Post nama i poznati i nepoznati, zato što je Post se premještao i premješta se još uvijek iz jedne sfere u drugu."
0:01:56,0:02:02,Sve više vjernika koji nemaju osobnog iskustva s Postom.
0:02:03,0:02:10,"Čuli su govoriti, čuju u čitanjima što bi bio Post, ali osobnog iskustva s Postom nemaju."
0:02:10,0:02:21,"Sve više vjernika koji kad čuju da će netko u njihovoj blizini postiti odmah imaju dobre savjete da treba paziti na zdravlje, da se ne smije pretjerati, da to mora biti jako oprezan."
0:02:23,0:02:33,Ja čim čujem te savjete već prilično jasno znam da je riječ o govoru koji ne dolazi iz iskustva nego dolazi iz jednog nepoznavanja posta.
0:02:35,0:02:45,"Vjerojatno je do većine od nas došlo da postoji post u suvremenom sekularnom svijetu i to vrlo različite, različiti oblici posta."
0:02:46,0:02:54,"Pa ja volim na početku napraviti razliku između tri prakse koje na oko izgledaju isto, a iznutra su različite."
0:02:55,0:03:02,"To je post koji uvijek ima vjerski karakter, to je štrajk glađu i to je dijeta."
0:03:03,0:03:05,Na van je to sve isto.
0:03:05,0:03:13,Netko ne uzima hranu koju bi mogao uzimati ili ne uzima onoliko koliko bi mu srce htjelo onoliko koliko mu apetit traži.
0:03:14,0:03:16,Iznutra je sasvim drukčije.
0:03:16,0:03:33,"Mi moramo kazati da zbrka između ova tri različita svijeta se može uvući među vjernike, tako da vjernici mogu reći a sad dolaze korozma lijepo, fino, postiću, a misli tamo dobro da malo smršam, da se pripremim za ljeto, da mogu ići na plažu."
0:03:33,0:03:38,"Dakle, da pobrkamo dijetu i post."
0:03:39,0:03:47,O čemu se radi kad netko ima posebni odnos prema hrani zbog neke djete?
0:03:48,0:04:06,"Može biti zbog toga što ima zdravstvenih poteškoća, može biti da hoće smanjiti težinu jer mu smeta u kretanju, u izgledu, estetski razloga ima, jer mu smeta u nekakvom sportskom načinu života."
0:04:07,0:04:18,"Dijeta je opravdana i dobrodošla i vi ste primijetili da imate mnoštvo ponuda za vrlo različite načine kako se dijeta vrši, ali to nije post."
0:04:19,0:04:26,"Trebalo bi vam kazati ako je moja prvenstvena nakana zdravstvena ili estetska, to nije post."
0:04:27,0:04:29,Navani to može izgledati isto ali to nije post.
0:04:30,0:04:32,Isto tako štrajk glađu.
0:04:32,0:05:02,"Navani netko ne uzima hranu, a ponekad netko i ne pije, ne uzima piće zato što se bori za nešto što smatra pravednim, smatra da je nepravedno diskriminiran, da ga je netko oštetio, otprilike zna tko je krivac za to i dođe i pod prozorom ili pred vratima onoga koga smatra odgovornim za svoje stanje koje podnosi, a to stanje je za njega nepravedno počinje štrajk glađu."
0:05:02,0:05:10,Štrajk glađu je jedan moralni pritisak na nekog drugog za kojeg ja smatram odgovornim za moje stanje i tko može to riješiti.
0:05:10,0:05:24,"Štrajk glađu je prilično, da to kažem, jaki politički način borbe za neko pravo, za nešto što je čovjek smatra da mu pripada, a nije dobio."
0:05:25,0:05:30,Mi ćemo znati da u političkim borbama ima ljudi koji se uvijek bore štrajkom glađu.
0:05:31,0:05:38,"Bilo je u povijesti ljudi koji su uvijek iznova se vraćali upravo na takvu borbu, jedan od najpoznatijih je vjerojatno Gandhi."
0:05:38,0:05:48,Mahatma Gandhi kad god nije mogao izboriti se za ono što je smatrao važnim za svoj narod u Indiji počinjao bi štrajk glađu.
0:05:49,0:05:50,"To naliči na Post, ali on ne bi jeo."
0:05:51,0:06:01,I to je bilo u cijeloj Indiji vrlo živo političko razdoblje i napetost je bila vrlo živa zato što jedan čovjek je odbijao jesti.
0:06:01,0:06:20,"To znači prijeti svim drugima da će njegova brza smrt jer netko može postati samo neko vrijeme odnosno štrajkati glađu, nakon toga slijedi kolaps tijela i prijeti smrt, ali ta prijetnja smrću nije samoubojstvo nego je za njegovu smrt odgovoran netko drugi."
0:06:21,0:06:25,To je jedan od načina kako se netko može boriti.
0:06:25,0:06:27,Post nije ništa od toga.
0:06:29,0:06:39,Post je u svojoj srži povezan sa mojim odnosom s Bogom i taj odnos s Bogom je ključ za razumijevanje posta.
0:06:39,0:06:53,"On ima vrlo različite momente, vrlo je složen fenomen i mi ćemo pokušati dotaknuti neke od njih da vidimo čemu sve i zbog čega ljudi postoje i kako to izgleda."
0:06:53,0:07:00,Mi zapravo polazimo odatle da je nama u kršćanstvu zadan post u neko vrijeme.
0:07:01,0:07:17,"Dakle imamo vrijeme posta, mi znamo da postoji post i nemrs, to su dva dana u godini, to je čista srijeda i veliki petak, početak i kraj korizme, post i nemrs se tu spajaju, ali to nisu iste stvari."
0:07:18,0:07:30,"Nemrs je dakle uzimanje hrane koja nije masna i nije mesna, uzmem drugu hranu, a post je reduciranje hrane, da to tako jednostavnije kažemo."
0:07:30,0:07:37,"Imamo ta dva dana posta i nemrs, ali imamo post koji može biti vrlo različit."
0:07:37,0:08:08,"Netko postoji jednom tjedno primjerice petkom, netko postoji dva puta tjedno srijedom i petkom, to je vrlo starhajični katolički običaj koji je u zadnje vrijeme zbog Međugorja živnulo, ima ljudi koji postaju srijedom i petkom, ali ima ljudi koji postaju utorkom svetomanti, ima ljudi koji su odredili post zbog nekog zavjeta, neki postaju cijeli život određeni dan u tjednu, neki samo neko vrijeme, dakle vrlo raznoliko imamo."
0:08:09,0:08:17,"Mi imamo jedan post koji je pa neću reći posve zaboravljen ali posve otišao u zaborav, to je Euharistijski post."
0:08:19,0:08:28,"Ja nisam siguran jel vi znate što je Euharistijski post uopće, koliko traje, to ste učinili u vjeronauku, sat vremena."
0:08:28,0:08:33,"Što znači sat vremena, kad to počinje i do kad se mjeri, od kad do kad se mjeri sat vremena?"
0:08:36,0:08:41,Jel se on mjeri do trenutka kad se ja pričašćujem ili kad počinje misa?
0:08:41,0:08:42,Razna tumačenja.
0:08:43,0:08:53,"Da, hoću reći, ta razna tumačenja će nam pokazati da mi zapravo smo izgubili elementarnu ideju Euharistijskog post."
0:08:54,0:08:55,Čemu je Euharistijski post?
0:08:56,0:08:59,Sve što uopće treba postojati prije Euharistije.
0:09:04,0:09:17,"Ja mislim da se to tiče zapravo Euharistije jer u trenutku kad mi zaboravljamo da taj post ima svoje smisao i svoje značenje, mi zaboravljamo čemu služi Euharistija."
0:09:18,0:09:31,"Dakle, kad je taj post nastao u antici, dakle u davno vrijeme u početku kršćanstva, onda je u zdravstvenom sustavu postojala ideja da se lijekove uzimaju natašte."
0:09:32,0:09:36,"Svaki lijek se uzima natašte, a Euharistija je lijek."
0:09:37,0:09:51,"Prema tome, ako ja hoću da Euharistija djeluje kao lijek, kao lijek za moje zdravlje, za bolesti moje duše, bolesti mojih odnosa, bolesti moga tijela, onda je moram uzeti natašte."
0:09:52,0:09:55,"Sve do drugog vatikanskoga, to je bilo prilično strogo."
0:09:56,0:10:05,"Ja znam da moja braća Franjević, koji su tada imali misu, nisu smjeli uzimati ni hrane ni vode dok ne bi slavili svetu misu."
0:10:05,0:10:16,"A nekad su kao župnici slavili nekoliko misa, pa ako je misa, pa ako je misa bila u podne, on je od sinoć, od ponoći, dok neslavni nisu, završilo je, bio je Euharistijski post."
0:10:17,0:10:33,"Drugi Vatikanski je učinio da je Euharistijski post traje sat vremena, znači prije nego počne misa, sat vremena postim, možete reći da to uopće nije post jer sat vremena i onako nam prođe da ne jedemo, ali to pokazuje u kakvom mi svijetu živimo."
0:10:33,0:10:53,"Mi živimo u svijetu u kojem, da to malo drastično kažem, u kojem je na mjesto velikog broja umiranja od gladi nastupilo stanje u kojem puno više ljudi umire od pretilosti nego li od gladi."
0:10:53,0:11:00,Na zapadu puno više ljudi ima problema sa previše hrane nego li sa premalo hrane.
0:11:00,0:11:14,"Dakle, Post je nama, da to kažem, otišao i u životnoj praksi iz svijesti daleko i to je jedna od stvari s kojom se treba suočiti kad govorimo o Postu u suvremenom svijetu."
0:11:14,0:11:22,"Jer u suvremeni svijet je otkrio Post izvan religioznog konteksta, izvan religioznih praksa, izvan vjere."
0:11:22,0:11:27,U sekularnom svijetu vi imate vrlo vrlo raširenu praksu posta.
0:11:29,0:11:40,"Jedna od najdrastičnijih je primjerice da imate klinike u njemačkom govornom području što će reći Njemačka, Švicarska, Austrija za post."
0:11:41,0:11:59,"Dakle, vi ako hoćete postati zbog nekog zdravstvenog razloga, zbog izgleda, možete ići tamo tri tjedna, možete i manje četiri tjedna, možete i četrdeset dana i pod pratnjom liječnika platite naravno boravak u klinici i pijete vodu četrdeset dana."
0:12:01,0:12:02,Pijete vodu.
0:12:03,0:12:14,"Liječnik će pratiti stanje vašeg tijela, ići ćete u šetnju, on će vam kazati što se događa sa vama i vi ćete biti sretni jer ćete četrdeset dana piti samo vodu, običnu vodu, nema ništa drugo."
0:12:16,0:12:20,"Hoću reći, ta praksa je vrlo poželjna."
0:12:21,0:12:35,"Ja znam da ljudi iz engleskog područja koji nemaju takve klinike dolaze u Njemačku, plaćaju kliniku da mogu tamo biti na tom postu koji traje duže vremena."
0:12:35,0:12:45,"Naravno da je razumljivo da ljudi neće se sami upustiti bez pratnje liječnika u takvo nešto, ali iza toga stoji jedna važna ideja što POST čini."
0:12:47,0:13:25,"Ja sad nemam točno u glavi, ali možete potražiti na YouTubeu jedan dokumentarac iz bivše države Sovjetskog saveza o tome kako su one otkrili u Sibiru POST i otkrili blagodati POST-a i bilo je kasnije liječnika koji su imali vrlo otvoreni pozitivan način o gladovanju koje je uspijevalo izliječiti mnoge bolesti i uspjelo prekinuti neke kronične bolesti."
0:13:26,0:13:36,"Dakle, riječ je o jednoj bolnici u Sibiru u kojoj je jedan Rus došao na liječenje i odbijao hranu."
0:13:36,0:13:47,"Liječnici su bili bijesni, ne možeš odbijati hranu i oni su ga htjeli nasilno hraniti i on je uspio svojom voljom prisiliti da ga pusti da postoji."
0:13:48,0:13:53,I pokazalo se da je njegovo izliječenje došlo brže i bolje od drugih.
0:13:53,0:14:00,I tad je njima probradio kliker u glavi ali što se to događa sa ljudskim tijelom kad ne jedemo.
0:14:01,0:14:05,I tad se otvorila cijela priča i tu je počela vrlo zanimljiva priča.
0:14:05,0:14:23,"Ja sam jednom imao jedan seminar na fakultetu o različitim religioznim praksama među kojima je bila i POST, pa su neki studenti pisali svoje radove o POST-u pa su tražili i ove filmove, dokumentarce o vrlo različitim praksama."
0:14:23,0:14:40,"To je bilo zanimljivo zato što to spada u jednu istočnu praksu, dakle više je vezano uz pravoslavne crkve nego uz katoličku, pa smo otkrivali razlike u praksi POST-a koji su se pojav pojavili kad se pravoslavna i katolička crkva, kad su krenuli različitim putovima."
0:14:42,0:15:01,"Iz toga se danas pojavilo da imate ne samo klinike za POS, nego imate jednu vrlo raširenu, modernu praksu takozvani periodičnog posta ili intermitentnog posta koji se razvio najprije u Kaliforniji, a sad se razvio po cijelom zapadu."
0:15:01,0:15:05,Imate puno aplikacija kojima možete pratiti svoj POS.
0:15:05,0:15:41,"On se sastoji od jednostavne ideje koja je znanstveno utemeljena, a to je da ljudsko tijelo nakon određenog vremena što ne uzima hranu, da to kažem aktivira neku funkciju u tijelu koja tijelu pomaže, ona se zove autofagija što otprilike jednostavnim lajčkim jezikom znači nakon šesnaest sati što ne uzimam hranu nego uzimam samo vodu, stanice u tijelu, višak koje stanice proizvode počinje sama stanica da kažem uništavati ili jesti, to je autofagija, jedem sam sebe."
0:15:42,0:15:54,"Dakle ono što bi se pretvorilo u mast i u salo i u suvišno, sad stanica sama pojede jer je tijelo kazalo nema više hrane, brini se kako znaš, jedi šta imaš i tijelo to uzima."
0:15:54,0:16:06,"Dakle i na taj način ljudi, jedan dobar dio ljudi posti recimo sedamnaest ili osamnaest sati svakog dana, a onda ostalih šest sati jedem normalno."
0:16:06,0:16:22,"To znači otprilike ako ste vi večeras večerali u šest sati, vi možete sutra do podne ne jesti, pijete samo vodu ili napitke koji nemaju u sebi šećera, koji nemaju u sebi energije nego napitke koji su energetski na nuli."
0:16:22,0:16:28,"Dakle čaj bez šećera, voda, kava bez šećera, to je u principu moguće."
0:16:28,0:16:42,I to po sebi nije nikakav neki veliki problem jer uostalom proslavate nekih šest sedam osam sati odnosno koliko spavate i nakon toga od podne do šest idete što hoćete i nemate nikakav osjećaj za glad.
0:16:43,0:17:00,"Dakle to je jedan moderni način kako ljudi koji se bave sportom, koji hoće zadržati liniju, koji hoće uspostaviti dobar odnos sa hranom, koji hoće kontrolirati neku svoju ne znam manu vezanu uz hranu i piće drže kontrolu i to je vrlo rašireno."
0:17:00,0:17:18,"Dakle ono što se meni čini s ovim je da ako netko hoće naučiti što se događa u tijelu, kad postimo moraš ići u sekularni svijet, u religioznom svijetu, u vjerskom svijetu, sve smo zaboravili, sve manje znamo."
0:17:19,0:17:33,"Vi možete reći da je sekularni svijet ukrao ideju, postao od vjernika i od njega napravio biznis i to je moguće reći i to je način kako je vjera oblikovala svijet i kako ga i dalje oblikuje."
0:17:34,0:17:57,"Ali nama je možda puno važnije da otkrijemo što je to što je nama post unutar vjere,erskih momenata izvan estetskih, izvan sportskih, izvan ovih fitnisa, imali nešto što je nama važno kao vjernicima."
0:17:59,0:18:12,Ja bih vam na početku pročitao jedan kratki odlomak iz Markovova Evanđelja u kojem nam postaje bliže što zapravo Post znači.
0:18:12,0:18:27,Riječ je o jednom trenutku na početku Markovova Evanđelja u kojem se i dogodila svađa oko posta između Ivanovih učenika odnosno Farizeja i Isusovih učenika.
0:18:27,0:18:38,"Kažem Marko ovako, Ivanovi su učenici i Farizeji postili, dakle to je praksa koja je postojala i to su svi koji su htjeli imati intenzivniji odnos s Bogom činili."
0:18:39,0:18:48,"I dođu neki i kažu mu zašto učenici Ivanovi i učenici Farizejski postoje, a tvoji učenici ne postoje."
0:18:50,0:18:52,Isusovi učenici nisu postili.
0:18:53,0:18:54,Na to im i su sreće.
0:18:55,0:19:08,"Vidite što on sada radi, on će sad uzeti u zaštitu svoje učenike, to je jedan elementarni moment da Isus svoje štiti i kaže mogu li svatovi postiti dok je zaručnik s njima?"
0:19:09,0:19:19,"Dakle on je s njima, to je svečanost, to je proslava, on je zaručnik, oni za vrijeme proslave ne mogu postiti."
0:19:20,0:19:24,I onda kaže dokle god imaju zaručnika sa sobom ne mogu postiti.
0:19:25,0:19:31,Doći će već dani kad će im se ugrabiti zaručnik i tada će postiti u onaj dan.
0:19:32,0:19:35,Dakle ovdje imate prvu naznaku čemu služi post.
0:19:36,0:19:56,"Post je način da se ja približim Bogu kad je u meni stanje takvo da mi se čini da je Bog daleko, da mi se čini da mi nije blizu, da mi se čini da život nije proslava, da mi je život postao težak."
0:19:56,0:20:20,"Drugim riječima ako imate trenutak u životu kada vam se čini da ne možete ništa, da vas Bog ne čuje, da niste u stanju razgovarati kako biste htjeli, da vam je muž skroz postao tvrdoglav, da njegova vaša riječ ne dolazi do njega ili da je žena postala tvrdoglava, da ne uspjevate ništa doći do nje i kad kažete ja više ništa ne mogu, kažem vam ovaj tekst, možeš posti."
0:20:22,0:20:29,To je način kako se izlazi iz stanja da je zaručnik daleko.
0:20:30,0:20:35,To je prva napomena da je post ono što mi činimo kad ne možemo ništa činiti.
0:20:35,0:20:37,Imate drugi tekst koji to potvrđuje.
0:20:38,0:21:03,"Ako se sjećate, nakon što je Isus doživio preobraženje na brdu, pa se sa svojom trojicom učenika spuštao na dno brda, onda nam evangelisti opisuju da je dole naišao na jednog oca koji je doveo svoga sina koji je bio opsjednut nečistim duhom, njegovim učenicima i molio da ga oslobode i oni su pokušali osloboditi ga i nisu uspjeli."
0:21:03,0:21:19,"I došao je Isus i onda ga je otac molio i nakon te razgovore jako zanimljive, Isus je dječaka oslobodio i otac je bio sretan, dječak je bio slobodan i ostao je Isus sa svojim učenicima sami i oni kažu, a kako mi to nismo mogli?"
0:21:20,0:21:26,A vi ste nam dao vlast nad nečistim dusima i da mi to činimo u tvoje ime i mi smo probali i nije išlo.
0:21:27,0:21:28,Zašto nismo mogli?
0:21:29,0:21:39,I da nam on kaže ova vrsta se ne može istjerati osim molitvom i postom.
0:21:41,0:21:46,To su dva načina kako se možemo boriti protiv nečistih duhova.
0:21:47,0:21:48,Molitva i post.
0:21:48,0:21:50,Što je zajedničko u molitvi i postu?
0:21:53,0:22:13,"Imamo više stvari koje su zajedničke, ali ako vi pogledate kako nas je Isus učio moliti, onda u srcu Oče Naša imate jednu rečenicu gdje on kaže da je srce molitve da se u mom životu ostvari Božja volja."
0:22:13,0:22:15,Ne moja nego Božja volja.
0:22:16,0:22:22,"To je bilo srce Isusove molitve u Getsemanskom vrtu, ne moja volja nego tvoja."
0:22:22,0:22:28,"To znači ja se povlačim, ima manje mene, a više Boga."
0:22:29,0:22:39,"Tamo gdje sam ja sa svojom silom, svojim mišljenjem, svojim egom, svojom snagom, ja to mjesto praznim od sebe i puštam da tu Bog djeluje."
0:22:39,0:22:40,To je srce molitve.
0:22:41,0:22:42,To je srce posta.
0:22:44,0:22:47,Jer mi postom slabimo svoje tijelo.
0:22:47,0:23:08,"Do čim mi prestanemo jesti, mi naravno puno vremena još puno dana možemo imati vrlo dobar osjećaj fizičke snage, ali mi u srcu znamo da post nama oduzima hranu, oduzima moć, oduzima snagu i kada bi se post produžio u nedogled mi bismo kolabirali, ne bismo imali više snage."
0:23:08,0:23:21,"Znači s postom ja gubim snagu, ali s postom snagu duha ojačava Bog na mjesto gdje je bila moja fizička snaga ili snaga moje psihe dolazi Božja snaga."
0:23:21,0:23:30,Dakle ta dva momenta molitve i postu u kojem je manje mene a više Boga pokazuju kako se borimo protiv napasti.
0:23:31,0:23:39,Protiv napasti se ne borim ja nego se ja povlačim da na mom mjestu Bog se bori umjesto mene.
0:23:40,0:23:50,Zato nije netko jači od napasti nego je on u svom egu oslabio i na to mjesto je Bog umjesto njega pobjedio napast.
0:23:50,0:23:54,Dakle to mi se čini dosta onakvom važnim momentom koji je vezan uz POS.
0:23:55,0:24:19,"Ali kad mi pogledamo kako je Isus svoje učio što je POS, mi ćemo naći u Markovom korist biti tekstovi gdje Isus svoje poučava kako trebaju činiti tri religiozne prakse koje su vezane za život vjernika."
0:24:20,0:24:32,"Dakle, sinoć smo slušali Jakova koji vrlo oštro govori ne riječi nego djela, djela su jako važna i za nas je jako važno da vjerovati ne znači u glavi imati neku ideju o Bogu."
0:24:33,0:24:34,Što znači vjerovati?
0:24:34,0:24:38,"Vjera znači imati način života, imati oblik života."
0:24:39,0:24:47,"Vjera se odnosi na to kako spavam, kako jedem, kako razgovaram, s kim se družim, u što ide moje vrijeme, tu je vjera."
0:24:47,0:24:53,"Nije vjera u tome jesam li ja razumio što znači presveto trojstvo, to je iznimno važno."
0:24:54,0:25:02,Ali vjera je naša praksa i Isus svoje uči tri religiozne prakse koje su jako važne i taj redoslijed isto tako važan.
0:25:02,0:25:06,"To je milostinja, to je molitva i to je post."
0:25:07,0:25:20,"Se sjećate Isusova teksta da za svaku od ovih praksi upotrebljava jednu važnu stvar, to je kako se dobro dijeli milostinja u skromitosti."
0:25:21,0:25:22,Što je milostinja?
0:25:23,0:25:25,Milostinja je da ja od svoga dam drugome.
0:25:26,0:25:26,Kako?
0:25:28,0:25:33,Isus kaže u skromitosti tako da tvoja desnica ne zna što radi ljevica.
0:25:35,0:25:51,"To nije zato da staviš na velika zvona, da napraviš da ti tvoj ego raste, da te snime eventualno kamere, da dođeš na YouTube, to je zato da se ti oblikuješ i da se to ne zna."
0:25:52,0:25:55,Milostinja se najbolje dijeli anonimno.
0:25:57,0:26:02,Da onaj tko prima ne zna komu je to dao.
0:26:02,0:26:03,Zašto je to važno?
0:26:04,0:26:21,"Zato da se ne stvori dug, da se ne stvori osjećaj moram njemu ili njoj uzvratiti nego da budem slobodan, da budem slobodan ja koji dajem i da budem slobodan onaj koji prima."
0:26:22,0:26:35,Mi možemo to prevesti tako da bi milostinju trebalo dijeliti tako da onaj koji prima ne osjeća se poniženim nego da osjeća da je to pravednost koja se dogodila.
0:26:37,0:26:49,"Najbolja milostinja u skromitosti je da ako ja dobijem milostinju od drugoga, kad se moje stanje promijeni da nađem nekog kome ću ja dati učiniti dobro, a da to on opet ne zna."
0:26:50,0:26:52,Ta anonimnost je jako važna.
0:26:52,0:26:55,To se sačuvalo u Katoličkoj crkvi kako?
0:26:56,0:26:58,Na skupljanju milostine preko mise.
0:27:00,0:27:12,"Dođe do vas netko sa košaricom i vi stavite unutra deset kuna i nemate pojma kome to ide, nemate pojma zašto su stavili, nemate pojma gdje će to župnik potrošiti."
0:27:13,0:27:17,Vi ne znate tko će od toga sutra kupiti kruh i da li će uopće itko.
0:27:17,0:27:30,Ali to je baš oslobođenje da sam ja potpuno slobodan i da sam ja dio svoga dao za nešto što nije meni donijelo ništa za uzorat.
0:27:31,0:27:32,Što se tu događa?
0:27:32,0:27:38,"Tu se događa jedan lom koji lomi sve, cijeli naš sustav."
0:27:40,0:27:42,Mi novac dajemo uvijek za nešto.
0:27:43,0:27:52,"Vi nećete doći u trgovački centar i reći trgovcu evo ti dvjesto kuna jer mi se sviđaš, to se ne događa osim ako netko malo skrene."
0:27:52,0:27:59,"Ti daš dvjesto kunaa za neke čarape, za neku majicu, za neke naočale, za nešto što dobiješ zauzvrat."
0:27:59,0:28:04,"Dakle mi dajemo i da dobijemo, to je uzajamno, mi nešto dajemo i nešto dobijemo."
0:28:05,0:28:12,"U crkvi ne, mi dajemo, a nismo zauzvrat za te novce dobili ništa, anonimno."
0:28:12,0:28:14,Dakle čuvamo anonimnost.
0:28:15,0:28:24,"I to je jedna stvar koja je povezana sa drugim, a to je da te stvari radimo ni za što."
0:28:25,0:28:36,"Ne samo zato što ja ne znam gdje će taj novac otići, nego zato što u sebi čuvamo besplatnost i to je jedna od najčudesnijih stvari."
0:28:37,0:28:44,"Kada vam netko umre i znate gdje je njegov grob, vi ćete donijeti cvijeće tamo i nećete dobiti ništa za to cvijeće."
0:28:45,0:28:46,To je besplatno.
0:28:47,0:28:49,Mi ćemo u crkvi davati besplatne stvari.
0:28:50,0:28:56,"Netko od vas zna raditi nešto i reći će župniku, ja ću dva sata to što znam raditi pokloniti nekome."
0:28:56,0:28:59,"Ni za što, neću dobiti plaću za to, dajem besplatno."
0:29:00,0:29:03,Ta skromitost i besplatnost su obilježe milostinje.
0:29:04,0:29:08,"Onda je Isus govorio kako treba moliti, molim se u skromitosti."
0:29:08,0:29:21,"To nije jedini način molitve, nije on samo u skromitosti molio, ali je to elementarni, sržni način molitve da moj odnos s ovcem nebeskim nije nešto što se pokazuje prema drugima."
0:29:22,0:29:24,To je način koji je između mene i Boga.
0:29:25,0:29:47,"Ja znam zato što sam svećenik, vam ljudi kažu da ljudi mole na vrlo različite načine, neki kažu čuj, ja se zatvorim u svoju sobu, nitko ne može doći, ja legnem na glavom, licem prema zemlji i tako molim, da bi ja to vani radio, da bi ja to pred drugima, a to je njegov način molitve s Bogom."
0:29:48,0:29:50,"Dakle, to je način uskrovitosti."
0:29:50,0:29:53,I onda Isus kaže da tako treba i postiti.
0:29:54,0:30:02,"I kaže, i kad postite, ne budite smrtnuti kao licemjeri, to je prvo obilježje."
0:30:03,0:30:05,Zašto je čovjek smrtnut kad postoji?
0:30:06,0:30:18,"Zato što je gladan, prvi dan je gladan, zato što je nervozan, zato što kad počneš postiti iz tebe izlaze najgore stvari, najružnije stvari, neće ti izići najljepše stvari."
0:30:19,0:30:29,"Kad postojiš, ti si vrlo osjetljiv, gledaš druge ljude, gledaš kako te gledaju, onda sad misliš kako ti vrijeme drukčije ide."
0:30:30,0:30:32,Puno stvari se promijeni kad postižeš.
0:30:32,0:30:56,"I onda naravno možeš napraviti lice koje je ozbiljno isprkrknuto da ljudi, na kraju ti radiš ozbiljne stvari jer ti postižeš, Isus kaže ne te to radit, to je gluma za vani, to nije post, post nije jednostavan nego kaže za licemjere, za farize i kaže izobličuju lica da pokažu ljudima kako poste."
0:30:59,0:31:00,Zašto je njima post važan?
0:31:01,0:31:06,"Da drugi kažu, gledajte, on ti pos postoji, on ti je dobar vjernik, on ti postoji."
0:31:07,0:31:14,"Kaže Isus, to je posti, ali primili su svoju plaću."
0:31:16,0:31:18,Mi postimo da bismo primili plaću.
