Start (HH:MM:SS),End (HH:MM:SS),Segment
0:00:00,0:00:18,"Što se tiče ove knjige, evo uspio sam pročitati dio, nisam stigao sve, ali ono što je bit, to su u biti osobna svjedočanstva ljudi koje je Bog okupio da sudjeluju u njegovom planu spasenja."
0:00:18,0:00:33,Ja to tako gledam jer plan spasenja po onome kako ja vidim je da Bog uvijek uključuje čovjeka i njegovo djelovanje u svom planu spasenja i sve čini tako da mi brinemo jedni za druge.
0:00:33,0:00:43,"Znači od samog početka stvaranja usmjerava nas jedne na druge, da jednim drugima pomažemo, a ne da osuđujemo jedni druge."
0:00:44,0:01:04,"I to je ustvari način na koji kad krenemo predstavljati na misama, ustvari uvijek kažemo da je Bog milosrdan i milosrdan i gospodin i sporna srđbu i dobroostiv i da oprašta svako zlog raskajednom srcu koje je čovjek učinio, znači zlo osuđuje, a čovjeku oprašta i čovjeka ljubi."
0:01:06,0:01:23,"Kako sam ja došao u ovu priču, to je isto interesantno, tu ima, znači stvarno smo različiti, ovo kada sam čitao za puno tih ljudi poznam, ali nisam isto znao na koji način su ti ljudi uopće pozvani od Boga da sudjeluju."
0:01:23,0:01:27,A ja ću vama sad ispričat kako je to meni došlo.
0:01:28,0:01:42,"Prije svega odrastao sam u katoličkoj obitelji, zaista vjerničkoj, redovito smo morali ići kao djeca na misu, poslije smo to prihvatili kao normalno da se ide na misu, da se vjeruje u Boga, imali smo osnovne smjernice."
0:01:43,0:02:07,"Isto svijet čini neka svoja djela u našem životu, pokušavam uvijek se dopust svima kako se to kaže, ali u jednom trenutku moja prijateljica mene zove i kaže, žurim se, kasnim, jel me možeš prebaciti, idemo u Župu svetog Josipa na Tresnjici, ali jako kasnim jel mi možeš pomoći."
0:02:08,0:02:32,"Ja kažem nema problema, uvijek smo jedni drugom pomagali kod takvih stvari, zajedno smo bili članovi jedne i još uvijek smo ekološke udruge, sad kakve to veze ima s ovim, to je o tom, potom neću sad u taj dio ulaziti, ali ekologija ima veze jako puno, pogotovo ovaj sveti Franjo o tome puno, puno rekao i u Bibliji puno toga piše."
0:02:33,0:03:01,"I tako krenemo mi tamo i u auto, već meni moja prijateljica Maja govori, gledaj, mi ti se idemo okupljati, to ti je jedna molitva, ja sam rekao Maja, znaš ti što ja mislim o molitvenim zajednicama, o molitvama itede Tko hoće može doći molit, prije mise kod nas u Župi, u Stenjevcu je crkva otvorena skoro cijeli dan, nije baš cijeli dan, skoro cijeli dan može doći, prije mise, za misom, normalno, poslije mise molit, pa tko voli nek izvoli."
0:03:02,0:03:36,"I tako, ništa, ja ono, idem odradit svoju uslugu i dođemo mi u crkvu, u prostorije Svetog Josipa na Tresnjevci i tamo bude nekakvo manje društvo i krenu oni pričat, prepoznam Antu Čajkošića jer on je isto bio iz naše župe i krenu oni pričat što će oni radit, da će oni molit pred bolnicama, da će im se ljudi pridružiti i tako ja se okrenem i kažem Majo, ti si tu normalna, jedina, gledaj, ajmo mi odavde, tu nitko nije normalan."
0:03:36,0:03:47,"Mislim, razumijem čak i ove u molitvenim zajednicama pa dođe na Misu Molice, ali šta šti ti sad moli tamo po trgovima da vas ljudi vide, šta je, kakve su to, ali nema veze."
0:03:47,0:04:03,"Ništa, oni dalje oduševljenii s time i onda još kad su rekli da će oni nositi nekakve transparente, a meni kroz glavu prođu sve one slike s tim transparentima kad ljudi ono idu viču po ulicama i potpuno ono i onda krene brojanje."
0:04:04,0:04:10,"Oka ima nas sedam, ti ćeš bit pet sati, ti ćeš bit pet sati, ono ako znate računati, ne računajte na mene."
0:04:12,0:04:25,"Ono matematika im u startu ne valja, oni kažu još će nam se ljudi pridružiti, pa ono ljudi slušajte, ja vam se prvi neću pridružiti, tu sam s vama sjedim, slušam vas i ne vjerujem šta pričate, nitko od vas nije normalan i dobro."
0:04:26,0:04:41,"Tek ako sam shvatio da ne mogu utjecat na njih, da ih ne mogu odgovorit, to mi je bila prva i osnovna namjera za njihovo dobro, naravno, prošlo je to malo, malo maja nazove, kaže, opet imamo sastanak, što niste već odustali."
0:04:41,0:04:44,"Ne, ne, ne, nemam vremena, maja, hvala doviđenju."
0:04:45,0:04:49,"I tako to traje, ti primirili su oni neko vrijeme i mislio sam da je to gotovo."
0:04:50,0:04:56,"I zove maja, kaže, ej Tomica, krećemo sutra, rekao, di krećete."
0:04:56,0:04:59,"Kaže, pa idemo, krećemo, idemo na bjenjenje."
0:05:00,0:05:06,"Ono, hoćeš bit sutra kapetan dana, rekao, kapetan čega, što, pa ne, nemam ja vremena."
0:05:07,0:05:10,"Ma ništa se ti ne brini, traje to četrdeset dana."
0:05:13,0:05:22,"I sad, kako da kažem, uvijek sam se trudio koliko toliko biti iskren pogotovo prema prijateljima i sad, a i prema sebi."
0:05:22,0:05:30,"Ne mogu nekome reći, ono, četrdeset dana stvarno ne mogu naći, da ne mogu odvojit vremena za nešto ako mislim da je to bitno."
0:05:31,0:05:33,"Ja kažem u redu, Majo, javit ću ti se."
0:05:34,0:05:40,"Naravno, cijelo moje razmišljanje je išlo u smjeru što odgovorit, a da ja ne moram ići pred bolnicu."
0:05:42,0:05:47,"I odlično se sjetim, naravno, to sam već spomenuo, sjetim se odlično, a Pavjera mi ne dozvoljava."
0:05:48,0:05:51,Nemojte po ugluvima i trgovima da vas ljudi vide.
0:05:52,0:05:57,"Mislim, imam argument protiv koga nitko ne može zapregovoriti ništa."
0:05:58,0:06:30,"Krenem, stisnem ono na mobitel tipku da već zvoni, ja onda mislim, ali ipak malo više znam o tome kako to stvari stoje, zašto je ona, ne počinje Biblija sa jednom rečenicom i ne završava sa jednom jedinom rečenicom ili mislio, znači, ideja je u toj priči bila malo drugačija od one koju sam ja preželjkivao, a to je da se ne dignete ugled u društvu i onda meni prođe kroz glavu, aha, pred kim ću ja dići ugled u društvu ako stanem pred bolnicu i molim."
0:06:30,0:06:47,"I onda bi prođu svi oni ljudi s kojima već sam pjevao godinama u Crkvenom zboru, koji su moji prijatelji, mislim, pa pred njima neću dići ono prvima koji sa mnom pjevaju redovite slave Boga na misi, već ću za njih biti nekakav ovaj, kako kažu Dalmatinci, redikul."
0:06:48,0:06:56,"I onda mislim, pa dobro, pa dobro, neću dići ugled u društvu, jel onda mene sram u stvari, jel mene strah stat."
0:06:56,0:07:01,"Inače sam za sebe mislio, bože samo reci šta treba, idem ja, pa poginut, poginut."
0:07:01,0:07:21,"Naravno, kad dođe takav trenutak, dođe obično na način na koji nismo očekivali i to je baš meni bilo onako iznenađujuće i osjetio sam u srcu da je meni možda zbilja sram stat i onda mi je prošlo kroz glavu, ako se posramite mene pred ljudima i ja ću se vas pred očem svojim."
0:07:23,0:07:24,"E, sad smo počeli ozbiljno."
0:07:26,0:07:34,"Dakle, stvar je jednostavna, znam, čuo sam da se spašavaju životi, znači tu nemam opravdanja, pa neću stati jer nema smisla."
0:07:35,0:07:38,"Ima smisla, ako je spašeno jedno dijete već to ima smisla."
0:07:38,0:07:49,Znači oni su tada tvrdili ne znam koliko deset tisuća spašenih života u svijetu na takav način ono uz Božju pomoć naravno bez Boga ništa nije.
0:07:51,0:07:55,"Dakle nije to opravdanje, pitanje je jednostavno."
0:07:56,0:08:05,"Znači ako se ne sramim Isusa, ako mu vjerujem na riječ, dakle jel ja vjerujem u Boga ili ne vjerujem, jel spašeni život vrijedi."
0:08:06,0:08:20,"I jednostavno sam se osjećao prozvanim i tad sam prvi put postavio ono, mislim stalno mi postavljamo sebi pitanje ja vjerujem u Boga i onda nađemo nekakve razlike logičke misli, one zašto mi vjerujemo u Boga."
0:08:20,0:08:34,"Ali ovdje sam postavio tako pitanje i sam sebi ne mogu objasniti, ali kao da sam prodro sebi u notrinju i shvatio, ali onako polupanično vjerujem, jednostavno sam shvatio da vjerujem."
0:08:35,0:08:50,"I dalje više nije bilo razgovora, Maja se javila u tom trenutku na telefon i ja sam naravno, to je možda trajalo puno kraće od ovoga što pričam jer su to ono u srcu događaj i rekao Maja reci kad i gdje."
0:08:50,0:08:54,"Ona kaže pa evo, tad i tad ono, hoćeš bit kapetan dana?"
0:08:54,0:08:57,"Rekao Majo može, ali kapetan dana neću biti."
0:08:59,0:09:02,Tu je moja odluka donesena da ću ići na bdenje.
0:09:03,0:09:23,"I došao je moj trenutak da dođem na bdenje, parkiram auto preko puta bolnice u Vinogradskoj, izlazim iz auta i normalno izlazim iz auta, hoću zakoračiti, a meni su noge odrezane, ja neću napravit korak."
0:09:23,0:09:28,Opet još jedan događaj u kojem ja nisam vjerovao za sebe da mi se to može dogoditi.
0:09:28,0:09:30,"Nigdje, neće ni pomak."
0:09:30,0:09:41,"Onda sam išda sam išao onako hrabro uz zgradu do kraja jer tamo su ljudi stajali, imao sam osjećaj kao da stoje na vjetrometini, kao da su poredani da je zastreljanje."
0:09:41,0:09:48,"Evo tako su izgledali i takva teška situacija u srcu mi je bila, kao da je oko njih sve na njih navaljuje."
0:09:49,0:09:51,Ovi ljudi koji su već tamo molili i dijeli.
0:09:53,0:10:04,"Onda sam došao uz zgradu bolnice, polako, polako, skroz u samu zgradu se pridržavao i onda trebao još tri koraka hrabro napraviti, priključiti se njima, stati molit i to sam uspio."
0:10:05,0:10:13,"I stao sam i onda prvi stanem, ali ja sam tu došao molit jer je odjedanput nastupio mir."
0:10:13,0:10:19,"Znači odluka je bila čvrsta, nije bila jednostavna i to je bilo to."
0:10:19,0:10:25,"Naravno da mi je bilo poslije toga misao evo Bože, namirio sam, pokazao sam da se ne sramim, ja se više neću pojaviti."
0:10:27,0:11:41,"Kao što vi, evo prošlo je deset godina, gotovo redovito uzimam smjene i to su nekakvi događaji, znači kako sam se priključio, a koja su iskustva na samom mjestu gdje je, toga ima jako puno, kaže ona, ja sam htjela, imala je blizance, kaže ja sam htjela tu djecu pobaciti, predomislila sam se i kaže, a sad kaže je li ovo kao, je li ovo Božja kazna, nekakva je odgovor na to."
0:11:42,0:12:08,"Naravno da nije i to je isto razlog zašto trebamo znači, zašto trebamo isto biti tamo, znači one majke koje su samo pomislile na pobačaj nose velike traume, a one koje su napravile pobačaj to su ogromne, ogromne patnje i eto svjedoci smo i takvih situacija."
0:12:09,0:12:24,"To je jedan dio što se tiče dijeljenja, ali kasnije recimo imamo te majice kao što je ovo, kao tim majicama ili ovo kad dijelimo ove kemijske i takve stvari, to je isto prilika da svjedočimo."
0:12:25,0:13:06,"Evo sad ću vam reći još jednu situaciju, moja nečak nije bila bolesna, trebao sam i hitno voziti u bolnicu i na sebi sam imao jednu majicu četrdeset dva dana za život onu s kapuljačom došli smo u bolnicu i kako je trebala čekati u redu, ja se tamo šetam u toj majci i jedna gospođa me pogleda i kaže ne znam točno kako je počela razgovor, kao ja, a ja znam vas i pokazuje na četrdeset dana za život i krenemo u razgovor, došli smo do toga da žena nosi tešku ranu pobačaja, znači ona je svoju kćer nagovarala na pobačaj."
0:13:08,0:14:10,"I naravno mi imamo i ovaj program oprostom oslobođenim i onda sam uputio gospođu, gospođa se odmah javila, Dijani i tako, znači to su na sve načine možemo svjedočiti, samo trebamo biti hrabri, znači tim ljudima treba pomoć i medicinskom osoblju treba pomoć i to su, to su ovi, to su ustvari sve darovi Božji na koji način On nas usmjerava da pomognemo drugima, a ustvari sam svakim tim susretom ja osobno jačao i uvjerio i jednostavno je sve postalo jasno što je važno, što nije važno, za što se vrijedi boriti, ne nema zabune, lako se odlučuje stvari kada pitaju što ako je ne znam ovo ili ono, vraćamo se uvijek na temeljni princip, a to je je li to život, je li to dijete, je li to čovjek."
0:14:10,0:14:16,"Ako je čovjek, onda nemamo pravo odlučivati o njegovom životu, ima li pravo živjeti ili nema."
0:14:16,0:14:19,Tako da je to meni recimo dosta pomoglo.
0:14:20,0:14:37,"Evo, mislim, ne bih ja dalje duljio, ima tu drugih ljudi koji će nešto reći više možda o knjizi i o svemu, ali evo, osnovna misao je meni bila da kod hrpe ljudi koji su ovdje se uključili."
0:14:37,0:14:38,"Ne, nisam ja za to."
0:14:40,0:14:41,Za stanje predbol.
0:14:41,0:14:43,"Ne, ne, nisam ja za to."
0:14:43,0:14:56,"Ali u stvari, Bog zna tko je za što, a svi smo poznani na ovaj ili na onaj način štititi život jer je to temelj mira u svijetu, temelj svega i evo, toliko."
0:14:57,0:14:57,Hvala.
