Start (HH:MM:SS),End (HH:MM:SS),Segment
0:52:43,0:53:19,"A po drugoj strani isto surov znaš, surov je ti iz tebe MB finale ili ne znam tebe finale Olimpijskih igara te gleda ne znam trideset i pedeset milijuna ljudi i svi vide tvoju grešku znaš neki advokat policajac doktor on kad napravi grešku nitko ne vidi a možda je ta njegova greška za nekoga naš fatalna a ova tvoja nije ali opet znaš tako da sve ima svoj plus i minus znaš ali kad jednom uđeš u to i kad nađeš neki onaj pravi pravo mjesto pod suncem, tim sportskim, to je najbolje što postoji."
0:53:19,0:53:30,"Ja sam rekao, prije si rekao da ti je bilo teško, bilo mi je ne znam prve, dvije, tri, četiri, tri godine, ali zato mi je onih ostalih osam, sedam, osam godina bilo fenomenalno."
0:53:30,0:53:39,"Znaš, kad si ti džomba jedno, što kažu, znaš, a kad nisi više ruki onda, pa to postaje skroz drugo."
0:53:39,0:53:40,Ali moraš da prođeš taj.
0:53:41,0:53:44,"Sve to ide, dobro je da se prođe i da se nauči."
0:53:44,0:53:45,"Život, život."
0:53:46,0:53:54,"Moram te još pitati za još jedan fenomen s naših prostora, Jokića, evo spomenuo si ga da se malo i njega dodirnemo."
0:53:56,0:53:59,"Možda i najčudniji, šta je njegova tajna?"
0:54:02,0:54:11,"Sve je čudno kod njega, a dvostruki MVP i evo govoriš da je jedan od najboljih stranaca ikad koji je bio u MBA-u."
0:54:12,0:54:13,Kakva je priča s njim?
0:54:14,0:54:16,"Ja mislim da je on rođen, rodi se tako."
0:54:17,0:54:28,"Sad nas uvijek košta kako, da li bi se oni snašli da su ušli u MBA prije dvadeset godina, ovako pitanje, drugi je bio stil, čije se igralo, ali kod koga to briga, oni su sad tu i oni su najbolji."
0:54:29,0:54:36,"Ja mislim da je to, ja sam gledao i Okića prvi put kad smo bili, ne znam, prije sam digla pa sam išao gledat Olimpija mega."
0:54:36,0:54:46,"Znači, gledaš ti, čovjek je bio onako malo bučka, znaš kakav je bio, ali tamo ni to on skače ni ništa, svaka lopta je kod njega u ruci, znaš, skok."
0:54:47,0:54:58,"Ako sprati neke, pogledaj neke starije utakmice, znači, kako ti rek njemu lopta znaš u ruci, ti odmah vidiš, on se odvijao, još gledaj, takvih igrača sam pokojniji, deki Milujević, ako se sjećaš i Tomašević."
0:54:59,0:55:17,"Znači, isto tako, nisu bili neki atleti, ali oni su uzimali po petnaestdvajest skokova, znači, tako da ti kažeš šta je ovo, znaš od kuda ovo, znaš čovjek skroz kad ga gledaš ono, opšte ne liči, ali to onda mekana ruka, zna ali to ja kažem, to se rodilo tako, to je naše rođenje za to."
0:55:19,0:55:23,"I u pravom trenutku, na pravom mjestu, prava ekipa."
0:55:23,0:55:24,Na dobrom klubu.
0:55:24,0:55:28,"Očistili su ekipu za njega, vjerovali su mu, dali su mu sve u ruke."
0:55:28,0:55:31,Greg Popović je dobro rekao kad je on tek počeo ono.
0:55:32,0:55:39,"Ja samo se nadam da ga neće znati sad, da proboju da ga naprave kao Amerikanca sa svog mišićima, nego da ga puste da bude to što jeste."
0:55:40,0:55:45,Neuspjeh je sastavni dio uspjeha i ova emisija se zove Neuspjeh prvaka.
0:55:47,0:55:51,Svi smo imali usporna i padova kako se izdići svega toga.
0:55:51,0:55:58,toga šta je to neuspjeh i kako se boriti protiv toga da bi na kraju završilo sve sa uspjehom.
0:55:58,0:56:01,"Koja je, ajmo reći nekako tvoja formula?"
0:56:01,0:56:20,"Pa znaš kako je to, to dobro su jedan trener ovdje u Sloveniji rekao, kaže znaš šta ovi dole kao Srbija, Bosna imaju jednu dobru riječ što mi nemamo, kaže inata znaš i to je istina, znaš kad se jednom zainatiš i mislim da i samo ne, šta god se desi mislim neuspe si ustvari stvaraju velike šampione ja mislim."
0:56:20,0:56:31,"Naš jedan neuspjeh te stvara samo još jačima i kad se vratiš si samo još jači, samo još bolji, naučio si šta je neuspjeh i boji se toga i samo radiš još jače da bi bio što uspješniji."
0:56:32,0:56:36,"Ja još nisam sreo nikoga koji je bio samo uspješan, a još uvijek imaš neuspjeha."
0:56:36,0:56:41,Ali svakog sreo sam dosta njih koji su bili iz neuspjeha su izašli još jači i bolji.
0:56:41,0:56:44,Naša poruka mladima je samo da nikad ne odustaju.
0:56:44,0:56:50,Razumijem da sve što se dešava je to neki sastavni dio i svi smo to prošli.
0:56:51,0:56:56,Ja znam naš kad cyklinac šesnaest sedamnaest bori se pa misliš što se samo tebi dešava.
0:56:56,0:56:58,"Ne, to se svima dešava i svi su prošli kroz to."
0:56:58,0:57:05,"Sad je samo do tebe da ti se pogledaš u ogledalo i da kaže meni se ovo neće desiti, neću prestati kroz što sam ti rekao."
0:57:05,0:57:10,"Ovo nije kraj, ovo je samo početak neke bolje priče i da nastaviš sa samo još jače naprijed."
0:57:11,0:57:13,Tako da to bi bilo.
0:57:14,0:57:16,"Hvala ti, bilo je stvarno zadovoljstvo."
0:57:16,0:57:20,Nadam se da se vidimo na Krku ovo ljeto.
0:57:21,0:57:24,Hvala na vremenu i bilo je stvarno fenomenalno.
