Start (HH:MM:SS),End (HH:MM:SS),Segment
0:26:25,0:26:38,"Sigurno šta, težak, veliki, onih što kažu, competitor znaš, stalno ih je htio da pobijedi i mislim da je tad bio još dosta mlad, nije svato."
0:26:38,0:26:47,"nije shvatio, mislim da u tom trenutku nije mogao da shvati da ne mogu svi tko on, razumiješ nego je naš pokušavao da sve digne na svoje nivo, a nije to tako."
0:26:47,0:26:58,"Mada poslije, pre kraju karijere kad sam pričao s ljudima kažu da je bio skroz drugačiji, ali definitivno jedan od najboljih ovaj najvećih talenata i najisposobnijih igrača što sam ja vidio."
0:26:58,0:27:03,"I ja pokušavam svima da objasnim šta sam ja od toga, šta mi je ostalo."
0:27:03,0:27:16,"Oni su svi MVP, svi su velike šuteri zvijezde All Star, ja znam da je on strašno želio da bude defensiv kao obrambeni igrač sezone."
0:27:16,0:28:01,"I to su svi oni ako pratiš, on, Kobe Bryant, Michael Jordan, Duncan, svi, oni će svi da daju dvadeset pet poena to je najmanji problem ali i to se meni onda strašno svidjelo znači oni su bili u onoj obrani su grizli da dokažu da su i tu najbolji ja pokušavam to decid da objasnim znači pusti ima dvije strane razumiješ terena nije samo jedna strana jel ti pre ne znam koliko godina vjerojatno će se setit možda recimo je sa skoro desetak godina kad je bio margasol odbrojbeni igrač godinu dana mislim da je Lebron izašao i rekao svakom u čast ali to je moja nagrada ne, nešto u tom, ja sam bio, znači koliko to, znači da se u tom druži cijela."
0:28:01,0:28:18,"Samo je jedna stvar koja mi je strašno ostala da su sve te velike zvijezde ti najbolji što su stvarno bili najbolji su ginuli u odbrani, znači ta odbrana im je bila ona prestiž i to mi se strašno svidjelo u poređenju, ne znam, imaš nekog koji daje trideset poena a u odbrani onako znaš švercuje se."
0:28:18,0:28:24,"Zato i mislim da je to najveća razlika između tih najvećih, stvarno onih najvećih da su svi bili odlični obrambeni igrači."
0:28:25,0:28:38,"Kad ih sad pogledaš i Kobe i Michael Jordan i Lebron i Duncan Garnet pa kreneš na niže dole, naši Boston Celtics, oni su isto u odbrani U odboru Gazili, pa Lakers i pa Detroit Pisnost."
0:28:38,0:28:39,Svi su kroz tu odboru.
0:28:40,0:28:42,Do titule se ne može bez obrane.
0:28:47,0:28:57,"Četiri godine si proveo tako u Minne Soti, treća je bila po nekakvim statistikama sa najboljim rezultatima, treća ili četvrta."
0:28:57,0:29:12,"I to ti je donijelo tvoj sljedeći ugovor, znači tvoj odabir je bio da ideš malo južnije u toplije krajeve, poslije će se pokazati da je to bio najbolji odabir koji si mogao izabrati."
0:29:13,0:29:27,"Kako je došlo do toga, tu se spominju nekakvi veliki novci, da si odbio, daj nam malo to razjasni i da li je to kruna tvoje karijere odlazak u San Antonio Sports?"
0:29:27,0:29:32,"Pa sigurno, pored Kindera, recimo i partizana, sigurno je to jedan od najvećih onih."
0:29:33,0:29:58,"Pa kako se desilo, ja sam bio free agent, slobodni agent i onda, sjećam se, jedan gula je, imaju neka pravila, jedan gula može da se počne razgovor sa free agentima i onda je jedan gula, sedim ovdje i zovem Paspalj kao doće Greg, Greg je U Gregi u Belgradu pa će on doći u Ljubljano da se vidite, kao da gledam šta je sad ovo, znaš?"
0:29:58,0:29:59,Greg.
0:29:59,0:30:00,"Da, grek po povič."
0:30:00,0:30:13,"I onda je došao tu, išli smo tu u neke restore na čeva, jer to je da proba, i to je kao po tim pravilima može, znači tu smo imali taj neki prvi kontakt i onda imao sam Minnesotu i New York se nešto zanimalo, znaš, što je."
0:30:14,0:30:22,"Ali sam odlučio za ovo, znaš, ovo, mislim, ja nikad nisam gledao na pare, jer ti, znaš, možda voši jedan auto da spaš u jednom krevetu, znaš, šta sad ja imam."
0:30:23,0:30:38,"To što mogu s ovim, mogu bi i s ovim, mislim da nisu pare, ne mislim, sigurno sam, što nisu u preduslu za sreću, nego su to kao neka sigurnost da si ti siguran da ti je lakše, da je sve, ali to ne znači da će ti da budeš sretan, razumiješ."
0:30:39,0:30:43,"I onda oni su bili prvaci te godine, 2003."
0:30:44,0:30:45,sa Davidom Robinsonom.
0:30:45,0:30:47,"David Robinson je odlazio, admiral."
0:30:47,0:30:56,"Da, oni se penzionirali i oni su kao rekli, bilo je tu još par igrača i ne znam i onda smo se našli, smo se brzo i nisam žalio nikada."
0:30:56,0:31:04,"Prije svega, super mi je bilo, imam super prijatelje tamo, mislim kad se vidimo nam je super i osvojili smo tu titulu."
0:31:04,0:31:13,"Mada ja mislim mogli smo i one dvije koje su otišle u zadnjim sekundama, manje u sekundama nego u stotinkama, ali okej."
0:31:14,0:31:20,"Definitivno za mene je jedan od boljih poteza što za ono trenutnu situaciju, što za budućnost."
0:31:20,0:31:27,"Jer tamo sam isto kao što sam ti rekao pre, učiš pa gledaš i naučiš od najboljih, a Popović je jedan od najboljih."
0:31:28,0:31:43,"Znači i naučiš kako on to postavlja stvari na svoje mjesto, kako znaš, uvijek to je uvijek govorio, uvijek postoji bolji, uvijek znaš, nikad on uvijek kaže trebaš biti i u pobjedi i u porazu uvijek otprilike na istom nivou."
0:31:43,0:31:44,I ako gledaš Danka na to je to.
0:31:45,0:31:51,"Da li je Greg Popović najbolji ili jedan od najboljih, najutjecajnijih trenera u tvojem životu?"
0:31:51,0:31:53,"Pa jeste, znaš što, ja sam imao sreće."
0:31:53,0:31:55,Ja sam i Messinu spominjao.
0:31:55,0:32:02,"Sreću sam imao, znači bio sam kod Messine dvije godine, kod Grega tri, bio sam godinu dana kod Dude i kod Dude i kod Kona."
0:32:02,0:32:03,"Pa di bolje, da."
0:32:03,0:32:04,Teško je.
0:32:04,0:32:19,"Jedino što nisam nikad kod Željka, znaš nikako se nije, ali više, znaš da ja vidim taj način rada, način razmišljanja, neku filozofiju košarkašku jer ja mislim da ti to posla u životu, ne samo košarci ti mnogo, ti više pomogne, razumiješ."
0:32:19,0:32:43,"I zahvalan sam, mislim, kao što sam ti rekao, igrao sam ne znam sa dva, njih dvojica su bili i Duncan i Granet MVP, naš MBA, ne znam igrati sa Krisom Bosom koji je isto vrhunski igrač sa Danilovićem Savicem, to su neke stvari koje ti se poklope i dese u životu, sam znaš ili ti se desi ili ti se ne desi i to krene ili u jednom ili u drugom pravcu."
0:32:44,0:33:04,"Da se vratimo još malo San Antonio, znači odličan klub, odlična organizacija, odličan trener, znači te godine je stvarno unutra sve bilo namješteno kako treba, kako je bilo iznutra osjećaj, atmosfera, suigrači, kako je to bilo posloženo, kako je to greb."
0:33:05,0:33:09,"I ti si na početku, pardon, imao čak i ozbiljniju."
0:33:09,0:33:12,Na kraju dana ili pred kraj.
0:33:12,0:33:21,"Znaš kako to je, grege postavi se, hijerarhija se postavi i zna se tko je prvi, zna se da je broj jedan Duncan, svi ispod njega onda idu u piramida i to se ne krije, to se zna."
0:33:22,0:33:28,"Znaš što se zna, kažu ovdje jedini koji ne može da se trade je Duncan i ovo ostalo je sve, pored Gino Bili, Ahorija, Parkera, znaš."
0:33:29,0:33:44,"Ali to ljudi prihvate i onda, mislim da ako sam ja prihvatio, vjerojatno bi imao neke statističke podatke, mislim statistike bolje u nekom drugom klubu, ali pitanje je koliko bi, da bi se uspjelo, da bi se pobjedilo, ja mislim da je to jedini način da se točno postavi."
0:33:45,0:33:54,"Znači ovo je naša špica piramide, kao što je bio Dankan, a iza njega idu svi i rade ono za zajednički uspjeh."
0:33:54,0:33:58,"Što ne znači opet naš, sad sve lopte na njega, uopće to ne znači."
0:33:58,0:34:00,Ali se zna tko je gazda u timu.
0:34:01,0:34:09,"Znači imali smo recimo situaciju, slabo smo trenirali neki trening, desi se znaš i poslano nas je Grek u kući znaš."
0:34:10,0:34:20,"I sad mi smo ušli u slikovnicu i Robert Hori, znaš Robert Hori, on ima recimo sedam prstenova, pa dva s Houstonom, pa tri s Lakersima, pa dva sa San Antonijem, više od Michaela Jordana."
0:34:20,0:35:12,"I on je ušao i nitko nije, samo je on ustao, a nikad nije pričao, on je super, jedan od najboljih sa igrača koji hoćeš da ima, znači da ti pomogne i savjet i sve najbolji kad, samo je ustali i on je rekao par riječi, znači vidi, ovo nismo mi ako hoćemo da budemo prvaci i ništa, svi smo ustali, izašli na polje, odradili dvadeset minuta, manje možda dvadeset pet minuta gotov trening sve super i opet znači ali kad imaš jednog takvog s iskustvom koji te u takvim teškim trenucima te vrati nazad na šine točno gdje treba da ideš znaš mnogo je lakše tako i onda je došao taj prsten kako je bilo bilo jako teško sedam utakmica jer tako nešto sam čitao da je prije toga jedno dugi niz godina nije bilo finale sa sedam utakmica da ste baš bili u nekakvom egalu."
0:35:12,0:35:24,"Kako je bilo sedam utakmica, di ste igrali, jel bilo proslave, kako se to oko njih slavi, daleko u Europi čekanje na trgovima, autobusi, navijanje, jel imaju nekakve druće rituale."
0:35:25,0:35:45,"Tamo imaš onaj river wok, ona rečica koja ide kroz centar i onda se tu tamo organiziraju ti brodice, manje, stavi se po dva, tri igrača, familija ljudi iz kluba i onda se to kruži tamo, na kraju se završi sve u sali, ne znam svako ne kaže po par reči i znaš dosta su svi već umorni od toga."
0:35:45,0:35:48,"Naš, kad je Jožičov svoj, kad je rekao: moram ići da idem kući prošle godine."
0:35:49,0:35:50,"Znaš, čekaj na konji."
0:35:50,0:35:54,"Tako da, ali ne, onako sve nekako normalnije, umirenije."
0:35:54,0:35:57,"Znaš, nije kod nas to bi bile baklje, navijanje, bubnjevi."
0:35:57,0:35:59,Tamo je već umirenije.
0:35:59,0:36:04,"Tamo dođu djeca, naš navijači, bacaš neke majice, malo se družiš s njima, slika se."
0:36:04,0:36:08,"Ali, sigurno ti ostane za cijelo život jedna usmjena koja je neizbrisiva."
0:36:09,0:36:14,"A da li se sjećas noći prije samo učina utakmice, zagrijavanja?"
0:36:14,0:36:17,Je li ostalo u sjećanju ili je to već izbljedilo?
0:36:17,0:36:18,Pod normalno?
0:36:18,0:36:23,"Ne, znaš, sjećam se da su, mislim, utakmice išle kako išle."
0:36:23,0:36:40,"U teglini se išla kako je išla, pa smo mi nešto gubili, znaš, treća četvrtina je onda su Gino bili dankani, ovi preuzeli pa su to vratili i na kraju, mnogo se brzo stvari dešavaju, znaš, i to ti prođe, ti samo da je ovo, da je ono i onda pobijediš i onda te onaj adrenalin kad popustiš, malo si umoran i strpljen, znaš."
0:36:41,0:37:01,"Ali za tu paradu koja se zove parada, znači, ja nisam imao nikog, meni je tata gledao, ne znam, polu finale, mislim da je gledao da li se sjetlo, ili možda čak i finale Fenixa i onda je on morao ići kući, znaš, mora ići u Bosnu do Šišća, Vočke, znači, to nemam vremena, ne interesuje ga."
0:37:01,0:37:03,"Na interesu ga, gledalče kući on to gleda."
0:37:04,0:37:05,I onda sam ja onako ostao sam.
0:37:05,0:37:08,"Po se mi došli ti neki drugari, iz ljubljane."
0:37:09,0:37:11,I onda sam s njima i to je njima isto.
0:37:11,0:37:14,I dan danas imamo i neke slike i to je uvijek kad se setimo.
0:37:15,0:37:25,"Znaš, ostaviti taj neki trenutak ti ostane, ali to su ti lepi trenuci koji onda nadmaše sve one loše koje si, iako si ih imao, sve ti se izbriše, znaš, pretogel."
0:37:25,0:37:29,"To je, što kažu Amerikanci, once in a lifetime, znaš."
0:37:30,0:37:34,"Ja sam jednoman, neki su imali i više puta, hvala vam puno."
0:37:39,0:37:41,Igro si u četiri različite.
0:37:41,0:37:46,"različita kluba, sjever, jug Amerike, više od desetljeća u MBA-u."
0:37:46,0:37:56,"Da li postoji nešto što je ostalo u tebi da je nedosanjeno, nešto što smatraš da si trebao ispuniti u Americi a nisi?"
0:37:56,0:38:29,"Pa možda šta jedna druga titula, recimo kad bi bila, znači mi smo izgubili prve godine pet utakmice, da protiv Lakersa bila je dva dva, da je nam je Derek Fisher koš ne znam nulačetiri sekunde prekren, a onda ideš tri do dva, ideš u tamo i tamo se desi šta se desi to, a pa smo poslije bili prv prvaci, a 2-6 smo isto igrali, gubili smo 3-1 s Dallasom, pa smo došli na 3-3 i vodili smo 3-1, sad kaže čuti, 20 sekunde do kraja."
0:38:29,0:38:33,"I onda je, ne znam, rekli smo: nema trojke i nema faula."
0:38:33,0:38:42,"Ovo je išlo na neki prodrom, na zakucavanje, ne znam, koga je želio da mu lupi rampu, faul plus jedan, produžetak i izgubiš u produžetku."
0:38:42,0:38:50,"A igrali bi sa Majamom, Phoenix, s kojim smo imali 3-1, mislim da te godine finale bi bili sa Majamom 2-0."
0:38:50,0:38:57,"Sad to ne znači da bi mi išli, ali bi opet po tim kako se sezona odvijala, mislim realno je bilo da bi mi otišli do finala."
0:38:57,0:39:04,"Tako su i te neke zvu, znaš, u sekundi, a jednom kad osvojiš i vidiš kako je to, onda si."
0:39:05,0:39:08,"Prvo, da li onda si tek gladan, za yosna, zato što vidiš kako je to."
0:39:14,0:39:22,"A kad bi te pitao koji ti je najteži trenutak u karijeri, šta bi ti prvo palo na pamet?"
0:39:23,0:39:28,"Ne mora to biti u prste, možda nešto iz juniorskih dana ili nešto takvo."
0:39:28,0:40:15,"Pa bilo je, ali mislim da je ono što se sjećam poslije, mislim da mi je utakmica na Evropskom prvenstvu protiv Grčke kad smo trebali dođemo u polu finale i onda smo izgubili kako smo izgubili isto nešto bez veze, znači vodili smo dvanaest razlike, ne znam dvapet minuta do kraja i onda su oni neke trojke, neki igrači koji nikad nisu davali trojke, da je to ti se desi znaš i to mi je ostalo onako taj preskok, prije svega zato što je te godine dosta njih je otkazalo povrede, nikakve i onda smo naš, bili smo onako, mislim da je pola tima od tih najboljih falilo da su išli neki igrači koji su bili dosta mladi, neiskusni, razumiješ, povrijedi nam se Dragić, pred prvenstvo slomi nos, pa igra sa onom kacigom, tako da, ali mislim da je to jedan od težih poraza, mislim to od dva sedme."
0:40:16,0:40:25,"Znači reprezentacija, svaka čast i prstenima i Americi, ali Slovenija je sve Slovenija, doma i kuća i kuća i to najviše."
0:40:26,0:40:54,"Prezentacija je ipak naš, to ti je nešto, mi imamo urođeno to još od rođenja, znači u Americi se to gleda drugačije, u Kanadi, kod nas ti je to, znači ja sam rastao, ja sam gledao samo za mene, sam bio odigram za Jugoslaviju recimo bivšu, znači oni su igrali Europsko prvenstvo u Zagrebu, pa da je u Rimu, prvaci sveta u Argentini, znaš što je za nas bilo, znaš da ti igraš tamo, da budeš prvak sveta, to je kakav MBA, nisam ni znao da naš, ni kako se igra, ni kako naš, ni da postoji."
0:40:55,0:40:56,stoji drugačija vremena.
0:40:57,0:41:11,"Znači to ti onda kroz, znači tako ja se nadam da će to što smo mi ovdje uradili s reprezentacijom da će to sad toj djeci isto da da neki naš elani pocvek za dalji napredak mislim u karijeri i u igranju."
0:41:12,0:41:31,"Znači nakon dvanaest jedanaest godina preko Atlantika vraćaš se u Europu, vraćaš se u Olimpijakos, međutim tad je bilo dosta po novinama da će to biti transfer u Partizan, da je to bila neostvarena želja, međutim to se nije dogodilo."
0:41:31,0:41:35,"Da li je bilo uopće poziva, da li je bilo ili je to samo bilo novinarsko, ovaj?"
0:41:36,0:41:36,"Ne, to smo."
0:41:36,0:41:37,Hajip nekakav.
0:41:38,0:41:45,"Tad je bio Danilović predsjednik pa smo imali nekad jednom razgovor, ali tek poslije te prve godine u Olimpijaku su, ali poslije te prve ja više nisam mogao."
0:41:46,0:42:17,"Mislim, imao sam trideset pet godina istrošeno povredu ramena se imao koja bi mi uzela sigurno jedno tri četiri mesa da se vratim dobili smo treće djete vratili se i tad sam riješio vidi došao ga ne mogu nisam više mogao fizički nisam mogao mislim sam znaš kad dođeš u trenutak u karijeri kad ti se smuči i bandažiranje i trening najmanji problem je bila utakmica to je bilo najveće zadovoljstvo znaš doći utakmica sve ovo ostalo je postalo problem toliko ti se skupi i nakupiti se stvari, da kažeš: ne mogu."
0:42:17,0:42:20,"Mislim, ja kad vidim onu bandažu, ja se bandažirujem zbog zlobova."
0:42:21,0:42:30,"Meni je te tive su me bolele, jedva sam hodao, pa da razmišljam, čeka im, ima i neki život, posle, košarke, treba i posle da se živi."
0:42:31,0:42:44,"Tako da kad sam povrijedio to rame i kad su mi rekli koliko će vremenski, da do októbra, novembra, ja sam to povrijedio ne znam, neko April ili Maja, tada sam već otprilike znao da je to to."
0:42:45,0:42:49,"Umeđu vremenu se već postao obiteljski čovjek, da tako i već imamo djece."
0:42:50,0:42:53,"To je bilo usklađeno, sve međuobiteljski., ili tako bilo."
0:42:54,0:42:56,"Ne, više pri kraju nije bila samo tu, već i u tome."
0:42:57,0:43:05,"Mislim da mi je mnogo bitnije tada bilo da ja više vremena provodim s djecom nego što ću ja još jednu, možda možda dvije sezone, da odigram negdje."
0:43:05,0:43:11,"Jer uvijek znaš iza toga, možda je to neki znak da telo polako popušta, razumешь."
0:43:11,0:43:14,"Pa bolje da je to sad, da ne bude nešto još gore."
0:43:15,0:43:15,Razumiješ?
0:43:23,0:43:31,"Mislim da je strašno bitno da si ti tu, da ima neki oslonac u tebi, da je neka disciplina u redu."
0:43:32,0:43:33,Nikad se nisam pokajao.
0:43:34,0:43:36,Mislim da sam pravilno postupio.
0:43:36,0:43:45,"Proveo sam dosta vremena s njima, dok sam igrao, što je bilo, što je bilo, što je bilo, što ne je bilo, nešto znaš, nešto ne znaš."
0:43:45,0:43:51,"A kad si tu svaki dan, onda znaš, tačno razmeziš situaciju i možda izkontroliraš kad negdje zagusti."
0:43:52,0:44:00,"Vidio sam negdje da ideš na utakmice Partizana, gdje si pozirao sa šalom, jer lodeš često, opračeš ljudi."
0:44:01,0:44:05,"Partizan je u regiji, možda osim Olimpije, u srcu."
0:44:06,0:44:10,"Pa, na šta ja sam, kad sam otišao u te dvije."
0:44:10,0:44:20,"92., znaš tamo, tada sam i zavolio i mislim, ja nešto nisam ni znao, samo je bila reprezentacija, više se pratila."
0:44:21,0:44:27,"Volili smo gledati sve što je bilo, od Cibone, Bosne, Jugoplastike, sve smo gledali, razumiš."
0:44:27,0:44:44,"Evo, onda sam pa nekako, znaš, kad sam otišao tamo, kad sam vidio, počeo sam gledati ove druge Miča, Berič i Stepanović i ekipa."
0:44:44,0:44:56,"I onda vidiš šta je ovo, to u Ljubljani nikad nije bilo, s 7000 ljudi, ili koliko već stavi u onaj pionir, zvanično, ne zvanično, ko zna koliko ih uđe, razumeš?"
0:45:03,0:45:15,"Predsto si igrao u karijeru, odmah si, ili tako, ušao u Savež kao glavni operativac ili bilo malo, ili to su bili u tijeku pregovori, jer si odmah znao da ćeš ući u Uniju."
0:45:15,0:45:28,"Ne, nije, to se dešavalo tako i mene nikad, realno to nije, ja sam više te u klub, znaš da je svaki dan da se radi s mladima, da se nešto stvara, da je našel savjest i ono periodično, imaš prvenstvo, pa onda."
0:45:28,0:45:29,tri mjeseca nemaš ništa.
0:45:29,0:45:41,"Sad su neki uveli te Windows-e pa imaš svaka tri mjeseca, a prije je bilo završi se Europsko prvenstvo od dvadeset septempera do sljedećeg jedan septempera nema nigdje nikoga ili petnaest augusta kako god."
0:45:41,0:46:06,"Znači pa sam tu, tu sam bio to slučajno, pa slučajno devet godina naš slučaj da se zadržiš i tako, bilo lepo isto super, ali mislim da je došao trenutak da se ide, mislim dosta je bilo za neki naš da se ima neke druge stvari u životu, tako da sad godinu dana je to što je, vidjet ćemo."
0:46:06,0:46:09,"Opsta nisam naš Nisam znao da silim, daj, daj."
0:46:09,0:46:16,"Kad sam vidio, recimo, Zahoviće, isto sam pričao, isto kaže: Polako, ne znam."
0:46:19,0:46:25,"Jedna stvar je taj profesionalni, a druga je ovaj familijarni koji ide po brzini."
0:46:25,0:46:28,"I da su ti teški dani, to su teški."
0:46:28,0:46:30,"To su ovi porazi prema pubertetu, su nula."
0:46:32,0:46:37,Da li je najveći uspjeh države Slovenije 2017.
0:46:38,0:46:54,na Evropskom prvenstvu nekakva satisfakcija možda ili nekakav balans da si doprinio nešto što je možda falilo što si malo prije rekao na toj reprezentativnoj razini kad si bio igrač.
0:46:54,0:47:58,"Da li si sad, da li je laknulo, da li je pao tona kamena sa leđa nakon dvije tisuće sedamnaest Pa ne bilo je super znači poklopile su nam se neke stvari koje su prije toga dvadeset godina nam se nisu poklopile znači mi smo bili kompletni drugi su imali povrede obično smo mi bili ti koji su bili nekompletni znači vratio se neki kult reprezentacije kroz igora kokoškova koji je tu donio skroz neki drugi mentalitet zato ti kažem ta raznolikost je mnogo bitna, znači drugi pogled na balkansko, MBA pogled, mislim MBA i balkanski pogled na košarku, znači došao je s Balkana u MBA već toliko i toliko godina i točno je mogao da poveže, razumiješ kockice, kako šta i uradio je to što je Popović uradio, napravio neku hijerarhiju gdje se zna tko je glavni, ali to ne znači da će samo taj glavni da igra, nego zna se tko je gazda, ali i će svi da igraju i hvala Bogu nam se poklopilo, znači tako da definitivno jedan od, ako ne najveći, jedan od najvećih, znači, sportskih uspjeha u Sloveniji."
0:47:59,0:48:07,"Mislim da je za kolektivni sport sigurno najveći, znači prije svega košarka je kako god se okrene, je još uvijek drugi najpopularniji sport na svijetu."
0:48:08,0:48:19,"Znači, gledanje, sam naši, pričali ste klikovi, followeri, ovo, ono to je, idu nogbaleri, pa košarkaši, mada sad i tu je pitanje: Da, lehko posljednik."
0:48:20,0:48:27,"Da, znaš, sve super, rukometod, bojka, water polo, sve super, ali ovo su neka dva sporta koja prednjače u Evropi, govorim znaš."
0:48:27,0:48:43,"Amerika opet ima neki svoj, razumiješ, sistem i svoje vrednovanje sportova kako idu, ali za Evropu ti pričam, znači sigurno taj naš, ja sam uvijek, sam želio to naš."
0:48:43,0:48:46,"Da to nije samo jednom, nego da i još naš da ne ispadne."
0:48:47,0:48:49,"Imali smo sreće, nego nije bilo sreće, nego naš."
0:48:51,0:48:54,"Idemo dalje, idemo dalje, idemo gradimo."
0:48:54,0:49:00,"Košto ste vi osvojili, košto sada osvajaju Danci, recimo, naši, Francuzi ne znamo u nogometu što su bili."
0:49:00,0:49:07,"Znaš, to su te neke generacije koje, znaš, recimo San Antonio Lekersi koji nije bilo jednom, nego je bilo više puta."
0:49:07,0:49:09,"Znaš, dokazali su da su tu."
0:49:09,0:49:16,"Sad, jedne godine ovako, onako, ali u nekom periodu 10-12 godina bili su više puta na vrhu."
0:49:18,0:49:29,"Kum si Luka Dončić, to je stvarno jedan fenomen na svjetskoj razini, daj nam malo razjasniti njegovu situaciju."
0:49:30,0:49:43,"Negdje sam pročitao prije tvoj intervju dok je još igrao u Europi, imao si stvarno visoko mišljenje o njemu, ali nisi spominjuo ove razine na kojim je sad."
0:49:43,0:49:48,Je li to za tebe očekivano ili je nadmašio čak i tvoje očekivanja?
0:49:48,0:50:19,"Pa mislim, dokle je došao nije neočekivano nego mislim gdje je sad, nego je brzina kojom znaš, ja sam mislio da će imati problema, ali nije više zna što sam, mislim da je, da to se rađa jednom u ne znam koliko godina, ne znam što je on godinama, znaš, to je ono van serijski talent, ti samo potvrđuješ iz godine u godinu, razumiješ da ide u pravom pravcu, znači ja sam mislio da će mu trebati možda dva, tri godine dok on dođe na taj nivo, znaš dok se privikne, on je već prve godine bio Maltene vodeći igrač, ne Maltene nego sigurno je bio vodeći igrač Dallasa, razumiješ."
0:50:19,0:50:40,"Tako da je, mislim da je to samo neka nadogradnja, jer kad pogledaš zadnjih koliko ih je bilo, ne znam, tri, četiri ili pet MVP-ova, nitko nije bio iz Amerike, svi su bili stranci, znači dva put Janis, dva put Jokić, sad je bio Mbit koji isto nije Amerikanac, znači sada ako opet uzme Jokić ili Janisis opet naš."
0:50:41,0:50:45,"To dokazuje da se košarka igra u drugim dijelovima svijeta, ne samo tamo."
0:50:45,0:50:54,"I definitivno da je on jedan od ta dva, tri glavna koji predvode taj talas, ne američki u MBA-u i sigurno Luka."
0:50:55,0:50:56,"Što miš, Jim je kraj?"
0:50:57,0:50:58,"Pa ne znam, to se treba vidjeti."
0:50:58,0:51:09,"Znači, imaš mnogo dobrih igrača u mnogo jakim ekipama koji na kraju, znači, definitivno će ga svi ocjenjivati prema tome što bude u svojoj u MBA-u."
0:51:10,0:51:18,"Znači, imaš Charlesa Barkleyja, imaš Karamela, imaš ne znam, Patrick Ewing koji su bili igrači, zato je sport strašan."
0:51:18,0:51:24,strašno zato ljudi ne znaju ti kada osvojiš NBA prvenstvo tamo ima 500 igrača a vas 15 je osvojilo.
0:51:24,0:51:32,"U cijelom svijetu ima ne znam koliko, Lupić, sad 20-30 milijuna profesionalnih igrača a njih 15 je samo osvojilo to."
0:51:32,0:51:33,"Znači, strašno je teško."
0:51:34,0:51:53,"Jednom ti se jedan povrijedi, drugi put drugi, treći put ti nisi na toj na nivou na kojoj moraš da budeš, četvrti put ti dođe neka druga ekipa, desiti se ne znam, tamo sastojiš ekipu pa se ti desi ne znam da se sklope ovi kao što su se sklopili kad je garneto otiš, ne garneto, Durant u Golden State."
0:51:53,0:52:03,"Znači, sklope se njih trojicu šta da radiš, možda imaš ekipu ili ti se desi Miami hit sa Lebron Jamesom i ovima, na što ne mogu."
0:52:04,0:52:08,"Ti stvaraš, stvaraš i onda ti se to desi pa te poremeti, strašno teško."
0:52:10,0:52:15,"Pričali smo o Manchester Cityju, sve je super, ali uvijek je tu neki real, neka barica, neko."
0:52:17,0:52:18,"Sve kao nisu, uvijek su tu."
0:52:19,0:52:19,I uvijek su tu.
0:52:20,0:52:21,Tako da je mnogo teško.
0:52:21,0:52:25,Sport je po jednoj strani najljepša stvar na svijetu.
0:52:26,0:52:32,"Ja sam se i na putu, proputovao sam svijet i upoznao sam predivnih ljudi i video sam predivne krajeve."
0:52:32,0:52:43,"I puno veseljati da i uspesi i suze, neuspesi, ali mislim da ti neuspesi onda te još više povežu između sebe, prijateljstva koje ti onda ostanu za cijeli život, znaš."
