Start (HH:MM:SS),End (HH:MM:SS),Segment
0:00:02,0:00:11,"Zaboravite, ne znam što je u redu, ne znam što je u redu, ne znam što je u redu."
0:00:37,0:00:50,"Poštovanje, Racho, dobr dan, dobrodošao u emisiju, zahvaljujem ti puno na izdvojenom vremenu i hvala ti što ćeš s nama danas podijeliti svoj životni put, privatni, a i sportski."
0:00:50,0:00:54,Hvala vam da ste me ugostili u ovako lijepom ambijentu.
0:00:54,0:01:23,"Tvoje je porijeklo iz beiha jel tako, međutim ti si rođen u Ljubljani, tata je došao sedamdesettih šezdesettih sedamdesettih osamdesettih kad su bile te velike migracije jel tako u bivšoj jugoslaviji međutim tvoj kvart fužine je poznat recimo u Ljubljani pa da odmah razjasnimo kako je tamo bilo odrastati jel to bio nekakav geto ili je bio sasvim normalan kvart za odrastanje?"
0:01:24,0:01:31,"Ne, znaš kako, mislim ono iz početka tata je došao, a mama isto došla iz novog sada, znaš tako da su se ovdje su se upoznali u Ljubljani, znači."
0:01:32,0:01:36,"U Ljubljani, da, tu je bila tačka, ono meeting point."
0:01:37,0:01:58,"Fužine, ko Fužine mislim da su malo izvikane, to je bilo neko novo naselje koje se osamdesettih izgradilo i koji i dan danas tamo stoji i ti stariji ljudi, ne samo stariji nego tko god je tamo jednom se preselio, nitko ne bi da se seli odand jer je stvarno idealna pozicija, blizu su i autoputa, blizu su i centra, blizu ti je ne znam Golovec."
0:01:58,0:01:59,"za šetnju, sve ima tamo."
0:02:00,0:02:13,"Samo što su to bili blokovi, ne znam, vjerojatno je par puta netko nešto napravio u gradu što je i dospio do novina da je pisalo da je iz Fužine i tako su to došle na loš glas."
0:02:13,0:02:20,"Ali ja, lično, a i moje društvo nismo imali nekih loših iskustava iz tog perioda odrastanja na Fužinovu."
0:02:21,0:02:42,"Ti si već sa šesnaest godina se uputio u partizan koji je tada bio aktualni prvak Europe i ti dolaziš sa nekakvih šesnaest godina, molim te nam opišite te početke, kako je doći u tu slačionicu s tim igračima."
0:02:43,0:02:49,Da li si uopće tad bio svjestan da ćeš ti jednog dana napraviti takvu karijeru?
0:02:49,0:02:50,Kako je bilo u tim trenucima?
0:02:51,0:02:52,Da li se možeš vratiti tako rano?
0:02:52,0:02:56,"Po mom mišljenju, to su bile jedna od najljepših godina."
0:02:56,0:03:27,"Mislim, poslije CPS-a, kad sam gledao cijelu karijeru, ne znam, partizan mi je bio jedna od najljepših godina, jeste da je ta bila situacija takva kakva je bila devedeset dva devedeset tri raspad države mnogo loših stvari se dešavalo svugdje ali i meni je bilo recimo ja sam došao iz slovana koji je mali klub, mi smo igrali neki turnir u Malmi u Švedskoj i onda su me tamo vidjeli neki kontakt i onda do negdje do jula, augusta, očito neću kako i onda sam odlučio da idem."
0:03:27,0:03:49,"Ali u Partizanu je tad bilo iz Hrvatske, iz Bosne, iz svih dijelova države bivše su došli igrači, ne znam, ja sam bio u selekciji sa Glintićem, sa Drobnjakom, sa Mičem Radovanovićem koji su svi poslije više ili manje uspješno igrali ili Euroligu, neki MBA i neki domaću ligu."
0:03:49,0:03:55,Ali definitivno kad sam došao nisam imao nikakvu predstavu ustvari šta je to pravi klub..
0:03:56,0:04:03,"E, onda sam tamo, po sam ja došao za Juniore, pod Nenat Trajkovic, bili trenirajući Per Rodić."
0:04:03,0:04:16,"Onda sam prvi put shvatio, u stvari, posljedno mjesec dana, da šta je ozbiljan trening i da bi možda ja čak i negdje u budućnosti mogao da se bavim tom košarkom, malo ozbiljnije nego dok sam bio ovdje."
0:04:16,0:04:17,"To je sve bilo, okej, idemo."
0:04:18,0:04:19,"Kako je prvi put, znači, došao na 16?"
0:04:20,0:04:23,"S nekog sa 16, jer sam izrastao na 27, 28."
0:04:23,0:04:42,"Prvi put sam mogao da vidim, da mogu da pariram i boljima, jer ovdje je bilo sve nekako, manje je država, nije bilo tamo i igrali smo sa zvijezdom, sa suboticom, vidio sam da mogu, znaš, da sam tu da može nekako i da bi jednog dana u budućnosti možda čak nešto mogli da bude."
0:04:42,0:04:54,"Mada u ono vrijeme, ne znam, sjeća se to kakav NBA, mi nismo ni znali za NBA, tad je bilo partizane, eventualno neki evropski klub, reprezentacija, to je bio Max neki domec."
0:04:54,0:05:01,"Znaš, danas djeca prvo što vide vide NBA i onda roditelji vide sve što ide uz NBA, razumiješ?"
0:05:01,0:05:12,"I tu mislim da je veliki problem, mi nismo ni znali to, NBA smo imali negdje, znali smo da postoji, da je tu Michael Jordan i neki Michael Cherry Birdie i tu se priča završavala."
0:05:17,0:05:19,"Dolazi do rata, nestabilnosti."
0:05:21,0:05:24,"Puno karijere je otišlo drugim puta nego što je trebalo, tako i tvoja."
0:05:25,0:05:36,"I nakon samo godinu dana, jel tako odlaziš iz partizana, odlaziš u inostranstvo, prvi put u Pauk, jel tako isto crno-bijeli."
0:05:39,0:05:56,"Kako je došlo do te realizacije, ti mlad igrač, odlazak u Grčku, tu je i promjena bila pasoša, jel tako tu si zbog nekakve birokracije, grčki paso, šta su bili nekakvi uvjeti jel tako, samo dva stranca?"
0:05:57,0:06:35,"Da, imali su dva stranca, pa to je bilo, tada su iz Srbije, recimo pošto su vozili ih u Grčku, mislim da su prvi su, među prvima su bili, ako se dobro sjećam, Marko Jelić i ne znam tko još, pa su onda, ja sam otišao recimo u Tarlac je bio i Milan Tomić, oni su prvi, pa su onda išli Marko Jelić i još jedan ili dva igrača, onda smo otišli, Peđa Stojaković, ja smo otišli u Pauk, tamo je bio trener Duda Ivković i Srđan Jovanović je bio i on je nas doveo na strojicu, ali nažalost nikako nisu mogli te papire jer, moji svi papiri su bili još uvijek vezani za Sloveniju."
0:06:36,0:06:52,"Znači, nikako nisu mogli to košarkarski prelaz pa danas, sutra, danas, sutra i na kraju sam odlučio ništa da se vratim nazad za Sloveniju jer ovaj nije moglo taj prelaz da se uradi letter of clearance da sad ne ulazim u te detalje."
0:06:52,0:07:50,"Godinu i pol dana sam bio u slovanu i onda sam devedeset pet prešao olimpiju i tad kreću ajmo reći nekakvi malo ozbiljniji ovaj uspjesi počelo je sa mvpm jel tako do dvadeset godina tad je europa čula za tebe to je bila devedeset šest jel tako da u turskoj smo bili tada se sve počelo malo šušat o tom prezimenu i nakon toga je ste složili u olimpi jednu vrhunsku ekipu koja je došla do final four jel tako a taj nip nisam ja to nikad nije ni bilo ništa to su ne znam to su pisali novinari ali olimpija je bila bila bila je super a bilo je i mnogo loših stvari prvo je bio jedan trener pa drugi pa treći promijenili ste se te prve godine i zmago sagadin je e druge godine je došao zmago sagadin ja nisam htio da produžim ugovor jer nisam znao kako će biti mislim dosta puta se dežalo produžiti ugovor na tri godine pa ne igraš i onda sam rekao ako bude neke su tu bile stvari koje su se desile nisu bile lepe ružne stvari, ali u svakom životu imaš."
0:07:51,0:07:53,"Mislim, u životu, pogotovo u sportu."
0:07:54,0:07:56,"Ima brdo lepih stvari, ali ima i par ružnih."
0:07:57,0:08:03,"Ma da, sad kad pogledamo unazad, ne znam da li bi se sjetio tri ružne stvari, ali mogu se sjetiti hlinja do lepih momenta i trenutaka."
0:08:03,0:08:05,"Ali to je bilo tad, je bilo tako, kako je bilo."
0:08:05,0:08:06,Dobra je ekipa.
0:08:06,0:08:09,"Ja nisam bio u ekipi, izolovan cijele godine."
0:08:10,0:08:13,"Odigrao sam dva ili tri utakmice, recimo te 96."
0:08:13,0:08:14,i 97.
0:08:14,0:08:19,"sezone kad je Olimpija otišla na Final Four, recimo realno jedna od najboljih ekipa."
0:08:19,0:08:20,97.
0:08:20,0:08:23,"je Olimpija igrala Final Four, mislim, bio sam i ja sam tamo bio."
0:08:27,0:08:36,"Mislim da smo č čak, mislim ako nismo bili, da bi mi trdali da je malo drukčiji raspored bio da nismo naletjeli na Olimpije, jako su u polufinalu da bi Olimpije ušle u finale."
0:08:36,0:08:38,"I pobjedili ste Francuze, jel tako?"
0:08:38,0:08:39,Francuze za treće mjesto.
0:08:40,0:08:44,I bio je Sale Đorđević sa Barcelonom.
0:08:44,0:08:55,"Znači, poslije toga onda je, onda je već ono, ide Kinder i to je već, kao što sam rekao, idu loši trenuci i onda ti se u godinu dana ti se skroz promijeni život."
0:08:55,0:09:02,"Ali evo, prije samo još te situacije, da se vratim na onaj početak ratnog doba i odlazak iz Partizana."
0:09:02,0:09:10,Da li misliš da je to ta cjelokupna situacija to dosta usporila u karijeri ili je to jednostavno tako moralo biti?
0:09:10,0:09:15,"Pa vidim, sad kad gledam neku analizu, mislim da me je ta Grčka poslije spasila."
0:09:16,0:09:20,Taj Pasoš me je spasio kad sam prelazio u Kinder.
0:09:20,0:09:26,"Jer tad Slovenija još nije bila Bosman pravilo, nije bila dio EU, a Grčka je bila."
0:09:26,0:09:30,"I onda sam, to su tad bile neke sive zone, ni crno ni bilo."
0:09:31,0:09:36,"Ja kad sam prešao, prešao sam pod grčkim tim imenom Makris, sam prešao u Kinder."
0:09:36,0:09:38,Isto su bila dva stranca.
0:09:40,0:09:41,Danielović i Savić.
0:09:41,0:09:42,"I Savić, a prve godine."
0:09:43,0:10:00,"Bili su ovi Bosmanovci, znači Bosman je bio bio rigado, Hugo Konokin je već imao pasoš, mislim da je italijanski, je dobio, bio sam ja, bio je grk, papa Nikolaou koji poslije na kraju nije mogao da pređe zbog nekih nesuglasica sa Olimpijakosom."
0:10:00,0:10:02,A da nisam imao taj pasoš morao bi biti stranac.
0:10:03,0:10:08,"Što je bilo, recimo, kao mlad igrač iz Olimpije, gorim dana nisam igrao."
0:10:08,0:10:10,Jako teško za potpisati.
0:10:11,0:10:12,"Malte ne, nemoguće da bi."
0:10:13,0:10:16,"Tako da zato kažem, uvijek se nekako situacije na kraju poklope."
0:10:17,0:10:21,"Naš ide, u valovima ide, sam znaš, ide dobro, pa ide loše."
0:10:22,0:10:23,"Znači, kad smo."
0:10:24,0:10:50,"došli do Final Foura, Olimpija doma, vjerojatno si mislio da je to kruna tvoje karijere, da je to što si postigao, međutim, sljedeće godine još bolje prelazak i osvojio si Ligu prvaka sa Kinderom, to je bilo stvarno jedno nezaboravno iskustvo, sljedeće godine ste isto igrali u finalu, pa ajmo sad malo usporediti to prvo i drugo."
0:10:51,0:11:01,"Znaš kako to u prvom finalu igrali smo za ulazak na Final Four, tad su bila dva najjača tima u Europi, Virtuus i Fortitudo iz Bolonje, Tim System i Kinder."
0:11:02,0:11:22,"I mi smo već igrali ne znam za ulazak u Final Four s njima, smo igrali pa je bila ona neka čuvena tuča, pa je, tada si imao ne znam na našoj strani si imao Danilović, Savic, Rigados, Konokini, Abio, a kod njih su ti bili David Rivers, Dominik Wilkins, Majers, Fučka, na što su bili dva tima neviđena."
0:11:23,0:11:31,"I onda već tamo smo mi pobijedili i došli na Final Four, osvojili, sad osvojili smo Final Four, mi smo se odmah vratili kući tako da nismo ni proslavili."
0:11:32,0:11:46,"A onda smo krajem maja, e onda smo igrali finale na pet utakmica i tad je Danilović dao ono čuveno trojku plus jedan u petoj utakmici za produžetak i evo, tad smo nadognadili to slavlje i za Euroligu i za ovo."
0:11:46,0:12:17,"Tako da, tko što sam ti rekao, znači još sam strašno neki, recimo godinu dana pretoga sam bio u Olimpi, nisam igrao ništa, izolovano od svega, a ne znam, učestvuješ poslije godinu dana u nekoj utakmici koja je i dan danas u Bolonji vjerojatno proglašena za jednu od najboljih utakmica u istori Bolonije, jer mi smo gubili, finale je samo počelo na tri dobijene, mi smo bili domaćin, mi izgubimo prvu pa dobijemo drugu, pa izgubimo drugu, pa dobijemo, mislim treću, pa dobijemo kod njih, sve su i u gostima dobio."
0:12:17,0:12:21,"I tu zadnju smo isto gubili, ne znam, dvanaest poena i onda se okrenulo, kako se okrenulo."
0:12:22,0:12:36,"Znači došli su Sale, dao trojku plus penal, pola ljudi je već izašlo po Sloveniji, htjelo da gleda kako će oni da slaje, pa su se poslije vraćali, pa je to, mislim to se doživiš jednom ako doživiš u životu i to ti ostane za cijeli život."
0:12:37,0:12:55,"Evo to da usporedimo sad divne trenutke i godinu dana, dvije prije u Olimpiji, kako si se održao psihički stabilan kad nisi igrao, kad si bio u problemima sa klubom, tad su vjerojatno se rojile crne misli da li ćeš uopće imati nekakvu karijeru i ovako ti se sve otvori."
0:12:55,0:13:00,Ali kad pogledamo u povijest kako je bilo izdržati to sve?
0:13:00,0:13:10,"Pa, znaš, mislim da prije svega imao sam podršku u familiji i to mi je bila najveća podrška, kao i okolje oko mene, tih par prijatelja."
0:13:10,0:13:15,"A druga stvar, pa ništa, kad nisam igrao, onda mislim, tad sam prvi put i počeo ono sam."
0:13:17,0:13:22,"Igra se utakmica, ja se ne igram, nego sam u publici i kad se završi utakmica, oni idu kući."
0:13:23,0:13:36,"Ja idem da trčim ili idem u salu ili u teretanu nešto, morao sam sam sebe da držim i tad sam prvi put i počeo nekako sam sebe da motivišem i da guram, da tražim neki motiv, razumeš da ne dozvolim."
0:13:36,0:13:44,"Jer na kraju svake najlakše je reći krivi je on, krivi je trener, krivi je na kraju za sve si kriv sam kad pogledaš."
0:13:44,0:13:54,"Sam si kriv, možeš šta god se desi, na kraju ti sam odlučuješ da li ćeš njima da dozvoliš ili nećeš da dozvoliš da ti stanu na put to što ti želiš."
0:13:54,0:14:00,"Znači, tad sam prvi put vidio, okej nisam znao, nisam ni u osnovima zamišljao da će to tako da ide."
0:14:00,0:14:07,"A sam rekao neće, ovo nije kraj karijere, razumiješ, nema šanse da ovo i sam sam, sam sam stalno trenirao."
0:14:08,0:14:24,"Ili smo trenirao po dvojica trojica koji su bili viša u ekipi, znači od dvanaest ih je putovalo, bilo je petnaest igrača i onda smo mi kroz te treninge, što uvijek kažem, da se to nije desilo, pitanje kako bi se ja u budućnosti onda razvio."
0:14:25,0:14:27,"I nosio sa svojim problemima, da, da."
0:14:29,0:14:33,"Odrastao sam nekako i sportski, čovjek kroz tih gorim dana."
0:14:33,0:14:44,"Neka treba malo, znaš da ti se nešto desi, da te prodrma iz te idile, iz tog ušuškanog, gdje svi misle na tebe pazite, sve se prilagođava tebi."
0:14:44,0:14:56,"Neka treba malo da te prodrma, da shvatiš da sve tipak i da život nije to baš sve naše cvijeće i latice od oružja, nego je borba iz dana u dan."
0:14:56,0:14:57,I tad se vjerojatno.
0:14:57,0:15:11,INA probudio i sljedeće godine si postao prvak Europe i jesi mogao pomisliti uopće na to da će ti se u tako kratkom roku promijeniti život?
0:15:11,0:15:52,"Pa ne znaš kako ja sam došao tamo, ja sam gledao Danilovića i Savića u reprezentaciji i znaš oni su bili za mene, kakav Michael Jordan recimo da bi došao prema njima kad sam ih vidio ne bi ni pola toliko znaš bilo oduševljenje, ja sam i njima sam zahvalan do kraja života i ne znam Mesići ko treneru znaš jel ja sam došao, bio sam tamo ne znam jedanaest i dvanaest igrač ali prije svega iz DZV oni su mi držali leđa, razumijem, Danilović sam po sebi je bio zdrav, totalan, nema zakulisnih igara, bio i dan danas je naš najpoznatiji ako ne u cijeloj Italiji, mislim u Bologni sigurno."
0:15:52,0:16:03,"Znači, a Savić je bio po drugoj strani veliki radnik i tu sam, od njega sam opet naučio one dobre stvari kako se radi, kako se, šta je kad si pravi profesionalac."
0:16:03,0:16:13,"Znači, ja sam uvijek kažem super da ti imaš nekog dobrog trenera, ali mlad igrač treba da ima i dobrog sa igrača jer od njega naučiš dosta više."
0:16:13,0:16:15,"Trener te usmjerava, od igrača učiš."
0:16:16,0:16:28,"Znači, ja sam kroz karijeru, svima hvala Bogu, mnogo dobrih sa igrača i kažem, to je neko znanje, neki kapital za cijelo život i ostane da si ti video."
0:16:28,0:16:35,"Naš igro si sa MVP, MBA i igro si sa najboljim igračem u Evropi, sa najboljim centrom ono vreme, savjećem u Evropi."
0:16:35,0:16:44,"Znači, to ako si pametan i ako povučeš malo pogledaš šta, kako ide, mnogo ti više ostane od toga za budućnost nego ono."
0:16:44,0:16:49,"Trenutak je, mi smo pobjedili, super, ali to što naučiš sa njima ti ostaje poslije kroz cijelo život."
0:16:54,0:16:57,Da se vratimo još na Žalgiris.
0:16:57,0:17:03,"Prve godine ostvarjate, i slijedeće godine finale sa Žalgirisom."
0:17:03,0:17:04,Ajmo nekakve usporedbe.
0:17:05,0:17:12,"15 milijuna, vaš proračun, Žalgiris 5 milijuna, koliko sam razumio, bili ste totalni favoriti, ili tako u tom?"
0:17:13,0:17:17,"Da, smo mi već te godine spogrešili sa strancem."
0:17:18,0:17:24,Prvi pik na draftu je bio Olaf Kandi.
0:17:24,0:17:33,"Znači, on je došao, tim sistem je doveo Del Negro koji je već tamo, Vini Del Negro, već igro je onda su oni."
0:17:33,0:17:36,parirali njemu sa prvim pikom.
0:17:36,0:17:38,"On je sleteo, odigrali smo utakmicu."
0:17:38,0:17:43,"Poslije ne znam, 48 sati su javili da se završava NBA lock-out."
0:17:43,0:17:47,"Znači, on je već s mojom mozgom proveo s nama ne znam mjesec dana."
0:17:48,0:17:52,"Danilović je bio već onako načet, razumije sa zglobovima, nije bio najbolji."
0:17:52,0:17:54,Imali smo još par manjih povreda.
0:17:54,0:17:58,I onda mi smo već onako roviti ušli u borbu za Final Four.
0:17:58,0:18:02,"I onda kad smo došli na Final Four, znači, dobili smo u polufinalu taj team system."
0:18:02,0:18:12,"A vama mislim da nam je falio tačno taj jedan igrač da malo da energija, da malo, znaš kad stane onako i onda dođe jedan svjež na energiju."
0:18:12,0:18:14,"Svežna energija, uzme dva skoka skoku u napadu."
0:18:15,0:18:18,"Ali opet, imali smo i u toj utakmici neku šansu."
0:18:18,0:18:24,"Vratili smo se u igru i onda je da onaj Bulbi, kako se zove, Bulbi je dao trojku i tu su se odlepili opet."
0:18:24,0:18:30,"Ali to je sport, dešava se i mislim zato i jesti sva lepota sporta u tome."
0:18:31,0:18:32,"Jednom je bolje, jednom je lošije."
0:18:38,0:18:42,"Dobro, Amerika, vjerojatno tvoj san, kod tebe je to išlo dosta brzo."
0:18:43,0:18:43,17.
0:18:43,0:18:48,pik na Drapu i izbor kluba je Minnesota.
0:18:50,0:18:51,Hladnim i napornim.
0:18:51,0:19:03,"hladni Minneapolis, kakav je bio taj početak, prvi prelazak preko Atlantika, prvi dodir sa Amerikom, jel to bio šok, dolaziš kao prvak Europe, ali opet MBA u to vrijeme?"
0:19:04,0:19:14,"Znaš kako to je bilo prije svega za mene, ne na košarkaškom, nego dobro, košarka je imala svoj ali kulturološki šok, znaš, to je skroz druga kultura, drugo shvatanje života, drugi način života."
0:19:14,0:19:21,"Ja sam strašno imao, ne znam, prve dvije godine probleme više s tim nego da se naviknem na, na, na, na, u kojem smislu?"
0:19:22,0:19:30,"U Italiji je u ono vrijeme živela, to se živelo, restorani, naši izlasci, društvo, tu je mnogo, mnogo zatvoreno, konzervativno, bilo u ono vrijeme."
0:19:30,0:19:50,"Znači to rade od devet do pet kuća, nema ljudi, nema nigdje, mrak pada preko cijele zime, naš rano se smrka, nisam čak ni neko društvo dosta dugo moglo da se uklopi, dok u Italiji sam u roku od dva mjeseca s Italijanima koji nisu znali engleski, iako nisam znao italijanski, smo već pričali, znaš kako to, snalazili se."
0:19:51,0:19:59,"I onda mi je trebalo to neko vrijeme da se naviknem na stil života, šta oni vole, šta ne vole, kako gledaju na nas, kako ne gledaju."
0:19:59,0:20:04,"Tada oni nisu imali pojma, sad, poslije svih ovih evropskih igrača, oni znaju prate, znaš šta to nije bilo."
0:20:04,0:20:05,A u to vrijeme?
0:20:05,0:20:08,"Divac, Sabonis, Peđa je otišao, razumiješ, nije."
0:20:08,0:20:15,"nije Kukoč je bio, nije tu bilo nešto, Dino se već vratio nazad, razumiješ, nije bilo tu da ti kaž trideset igrača."
0:20:16,0:20:24,"Znači to je tek krenulo, ja znam kako je meni bilo, a poslije tek zamišljam kako je bilo ne znam Divcu i pokojnom Draženu bio žiri i obijeli led."
0:20:25,0:20:26,I Saborni s njih trojicama.
0:20:27,0:20:39,"Šta su oni tek prošli, znaš da su uspjeli u tome, znaš pogotovo Dražen je koji je bio neviđen igrač i naš nikako nije mogao da probije dok nije otišao u NEC-e."
0:20:40,0:21:12,"Znači onda sam tek onda kad sam došao tamo sam počeo to da cijenim, znaš te prve igrače koji su išli ne znam i Marčuljonis recimo, tako da kad kažeš divac prve godine igra finale, znaš što tebi sad odavde čini, ali kad odeš gore pa vidiš tko je sve to protiv koga igro, kako igro, to su neki, znaš nije osvojio nažalost ali je postavio, znaš neke visoke granice koje danas nije tako lako pogotovo u ono vrijeme kad se više igralo i na snagu i na brzinu i na fiziku."
0:21:13,0:21:19,"E to, daj mi malo taj usporedba prije MBA i kad ste vi dolazili i sad."
0:21:20,0:21:39,"Direktno igra, igrači, negdje sam pročitao da i naše razmišljanje bilo dosta krivo, da je puno bilo predrasuda, da oni gutaju steroide, da su napumpani i da ništa ne treniraju, a to je ustvari bilo čisto suprotno od onog što se ti razmišljaš."
0:21:39,0:21:45,"Treniraju oni na što su stvarno su, ali igrala se mnogo fizička košarka."
0:21:45,0:21:49,"Znači to je bilo, pa tvrđe obrane, puno manje koševa."
0:21:50,0:23:31,"Ja sam ja došao u neko vrijeme kad je to polako počelo da popušta, a prema meni recimo petšestdeset godina to je bio kaos, to su se sam znaš tukli su se, to je bio kaos, ali ovaj, e onda su oni polako, pa kod nas ti je bilo recimo ti dođeš, igraš ne znam sad u Dallasu ili u Atlantiku, ako domaća ekipa da sto poena ne znam svi navijači svaki navijač dobije džebe pivo, džebe Coca-Colu, džebe pizzu a danas ti imaš poluvremeni rezultat osamdeset tri i sedamdeset pet na što je nepojmljivo mi kad smo bili prvaci sjećam se da smo imali neki limit na četvrtinu dvadeset dva dvadeset tri poena limit znači to ti se negdje svodi na devedeset dva poena na utakmicu sad se to da zna što se za poluvremen malte nešto na devedeset poena tako da i sad ti kad gledaš neki michael jordan ima prosjek trideset tri ili koliko ima trideset dva poena na ne znam devedeset osam ubačenih poena ovaj chicago sad ti stavi ne znam trideset dodatnih to je trideset posto više i automatski ćeš dodati na četrdeset pet poena potakmici mislim samo matematički gledano na što ne znači da bi to tako i bilo ali mislim da su čak za moj je nekakav ukus previše su dozvolili previše se ide na to da je napad favorizovan u odnosu na odbranu ne smiješ ti samo šao da znači bacaju se te trojke u nedogled znaš tako da kad si zadnji put vidio ne znam nekog da je dole na postu recimo kao što su bili kevin mkh ili dan Kevin McKilli ili Duncan, znaš da mu daš loptu, pa da vidiš da uživa, znaš u pokretima, nema, sve se svodi na taj vanski šuti, znaš na neku, što si rekao, show, više kao izhibiciju, znaš, do play-offa se sve to nekako."
0:23:31,0:23:33,"Dok hoće to, to će do 200 poena doći."
0:23:33,0:24:20,"Ne, ne, ne, ne, ne, ne, ne, ne, ne, ne, ne, ne, ne, ne, ne, ne, ne, ne, ne, ne, ne, ne, ne, ne, ne, ne, ne, ne, ne, ne, ne, ne, ne, ne, ne, ne, ne, ne, ne, ne, ne, ne, ne, ne, ne, ne, ne, ne, ne, ne, ne, ne, ne, ne, ne, ne, ne, ne, ne, ne, ne, ne, ne, ne, ne, ne, ne, ne, ne, ne, ne, ne, ne, ne, ne, ne, ne, ne, ne, ne, ne, ne, ne, ne, ne, ne, ne, ne, ne, ne, ne, ne, ne, ne, ne, ne, ne, ne, ne, ne, ne, ne, ne, ne, ne, ne, ne, ne, ne, ne, ne, ne, ne, ne, ne, ne, ne, ne, ne, ne, ne, ne, ne, ne, ne, ne, ne, ne, ne, ne, ne, ne, ne, ne, ne, ne, ne, ne, ne, ne, ne, ne, ne, ne, ne, ne, ne, ne, ne, ne, ne, ne, ne, ne, ne, ne, ne, ne, ne, ne, ne, ne, ne, ne, ne, ne, ne, ne, ne, ne, ne, ne, ne, ne, ne, ne, ne, ne, ne, ne, ne, ne, ne, ne, ne, da postane interesantnije jer MBA se ti je digo kad su počeli Boston i Lakers i znaš da je digo, a ti gledaš finale, to danas bi poluvremeno mislim da bi njih sedam bilo na klupi s pet fala, pet fala, trojica bi bili isključeni odmah, razumiješ u prvom kontaktu jel je to tako bilo?"
0:24:21,0:24:22,Boston u ono vrijeme da.
0:24:25,0:24:36,"Najbolje i najgore stvari u, u, u, u, u, u, u, u, šta ti se sviđalo u Americi, a šta si doslovno, ajmo, ne možemo reći mrzio, na šta se nikad nisi mogao privući?"
0:24:36,0:25:18,"Ne, ne znam, sad to da se mrzio nisam ništa, ne mogu uopće naštet, to sam ti prije pričao, lijepih trenutaka mogu da sjetimo se, ali loših je bilo, znaš, bilo je ne znam, sjeti se neki poraz nešto, znaš kako ide ekipa slabija pa je nervoza, tenzija, ali na kraju to kad podvučiš crtu, znaš, bilo je super, upoznao sam super ljude, vidio sam neki, znaš, mi smo imali predrasude Amerikanci, ovo nije, Amerikanci su naš, oni žive svoj život, to su velike zemlje što su za nas male, nekad ne razumemo, znači njima je dosta, cijela Amerika ne treba im ništa više, kao što su ne znam i druge velike zemlje, znači čitao sam neki podatak, ne znam koji procjenat, sedamdeset ili osamdeset posto Amerikanaca nema pasuš."
0:25:19,0:25:25,"Znaš, ali ti u Americi ti ima sve pa ti ideš na Floridu, ti je more, ideš na skijanje, ideš sve što god dođe."
0:25:25,0:26:05,"Znači tako da mislim ja sam ono što sam radio u sportu radio, ali sam upoznat i dan danas imam super prijatelje iz tog GMB-a, znači i vidjam se i čujem se s njima i vidimo se kad je u mogućnosti, mislim da je to najljepša strana tog sporta, znači da nisi, vidiš, upoznaš druge ljude, upoznaš druge kulture, druge navike, znači oni isto nisu mene prvo upoznavali pa kad te upoznaju osjeti znaš da se to skroz mijenja, da to nije onaj odboj i neki zid nego polako te puštaju, prihvaćaju, razumiješ ulaziš u taj njihov krug nekih da ti vjeruju, da si dio te ekipe."
0:26:06,0:26:24,"U to vrijeme kad si ti bio je u klubu igrao i Kevin Garnet, on je došao dvije, tri godine prije tebe, ikona, jedan od najvećih igrača u NBA-u, pa daj nam ga malo približi kakav je bio, kako je bio privatan, kako je bilo trenirati s njim, da li te poboljšao?"
